job_name,job_url,job_location,job_salary,job_company,job_experience,job_class,job_given,job_detail,company_type,company_person,search_key,city
海外新媒体运营,https://www.lagou.com/jobs/7151131.html,城阳区,6k-10k,青岛拓澳国际贸易有限公司,1-3年,本科,发展前景和薪资收入,岗位职责：1. 负责公司海外社交平台的账号运营和红人营销；2. 公司社交平台账户的日常运营、活动策划以及用户关系维护（平台包含Facebook、Instagram、Pinterest、Youtube、Twitter等）；3. 负责公司日常品牌内容发布、行业动态分享、产品功能介绍及用户活动的组织及管理；4. 探索社交媒体用户增长，策划和执行社交媒体营销活动，提升有效粉丝数，粉丝活跃度；5. 社群运营和维护；6. 负责挖掘优质海外社交媒体的红人资源，收集、整理、分析网红的数据并进行分类处理；7. 与网红谈判具体推广合作事项，并邀请社交媒体红人进行产品推广/ 测评。任职要求：1.本科及以上学历，市场营销、传媒广告、新闻或语言文学类等专业毕业；2. 敏锐感知国内外实事热点，快速响应国际、社会、行业热点话题，选取有意思的话题与产品结合制定主题传播方案，并植入公司的活动，扩大品牌知名度与提升产品的口碑，将人气转化成为实际流量；3.具有较强的跨界思维和一定的数据分析能力，文笔优秀，英语能力较强（英语过六级）；4.具备营销方案策划能力，了解欧美文化，能够提升用户对产品的熟悉度与信任度；5.有一年以上的海外社交媒体内容运营经验，了解国外用户社交平台的阅读习惯，熟悉海外社媒平台；6.有海外生活工作或留学经验者优先。福利待遇：薪满益足，让你心满意足薪——想要高薪，只要你愿意满——满载的不仅是你的钱包，还有你的理想益——收益金钱、学识和技能足——足够的发展空间您享有的薪酬：基本工资、项目提成、绩效工资，绩效考核优者会有特别奖励（现金）及表彰；您的工作时间：五天半工作制（8H/天，公司固定休息1.5天）具体工作时间上午：8:30～12:00，下午：13:00～17:30关心您的成长与发展：培训（优秀者公司可提供外部专业知识的培训）、学习、内部培养与提升，内部讲师也有力的促进企业内部文化和知识的传承为您创造的职业晋升是：公司实行公开、公正的选人、用人机制、系统、具体的职业发展方向和指引，为员工的职业发展提供平台及通道真诚邀请各位有识之士加盟，共创辉煌！我们公司不大，但是我们觉得能诱惑你的八条理由：1.付出和收获永远成正比，有能者居上！干的出色发你6个月工资的年终奖，**让你爽！2.阿里巴巴合作伙伴C拍档，公司推崇阿里文化，在立加你能零距离感受阿里文化3.公司提供学习运营内部培训，分享干货！为每一位员工提供成长帮助4.家庭式的装修设计风格，让你感受温馨自由5.不忙的时候织下微博，听听歌，吃点零嘴，逛逛豆瓣，没人能来管你！6.公司离公交站1分钟路程，附近商业设施配套齐全，影院、健身、娱乐、餐饮俱全7.我们的办公室斜对面篮球场，每天下午6点，球场上见！8.我们团队中都喊花名，我们自由，但不散漫，我们的文化由我们自己创造。,"电商,消费生活",15-50人,数据分析,青岛
网络推广专员seo,https://www.lagou.com/jobs/7210358.html,市南区,4k-6k,青岛泉源顺食品有限公司,应届毕业生,大专,五险一金、带薪年假、生日福利、旅游、体检,岗位职责：1）负责公司官网的SEO、营销推广工作，实现网站和公众号导流；2）负责互联网各种新媒体平台内容发布、维护。利用网络平台：微博、BBS、论坛、贴吧、问答平台等推广方式，针对性提高具体关键词推广；3）通过数据分析、跟踪做出有效的推广策略和方式，及时调整并提供切实可行的推广方案；4）官网日常更新、后台维护，并对推广结果跟踪反馈；5）关注市场动态和竞争对手，提出网络推广合理建议及应对措施。任职要求：1）专科以上学历，1年以上网络推广经验；2）熟悉HTML/CSS代码，对网站开发有一定了解，对优化内链和提高外链有相关经验。,"消费生活,广告营销",15-50人,数据分析,青岛
效率运营专家,https://www.lagou.com/jobs/7129271.html,崂山区,20k-40k,北京嘀嘀无限科技发展有限公司,3-5年,本科,扁平管理、管理规范、平台好,岗位职责：1、负责区域乘客运营策略分析和项目流程规划。决定团队需要重点关注的项目，设定紧凑推进的时间线达成目标；2、负责核心业务数据的整理和分析。通过分析用户各类指标判断城市运营健康状况，并协助制定相应策略落地取得结果；3、负责乘客运营体系的迭代、优化和完善。用户拉新促活留存和生命周期管理；4、业务拓展规划。评估业务拓展的经济及战略成本、收益，与管理层紧密合作执行相关战略。5、极强的商业灵敏度和洞察力，具有强烈的好奇心和创造力，善于思考是什么让我们与其他企业不同。6、透彻理解网约车商业模式并坚持不懈地使这一模式全面渗透在你所在的辖区城市中。任职资格：1. 统计学/数学/财经类相关专业本科以上学历，3年以上互联网、咨询或相关行业的用户/策略运营、行业研究或市场营销经验；2. 有较强的逻辑思维能力和数据敏感度，有丰富的数据分析、挖掘、建模的经验，熟练使用SQL和相关分析工具；3. 对用户价值有深入理解和洞察，善于建立经济模型，思考和测算商业逻辑的合理性；4. 强大的责任心与沟通协调能力，可承担跨地区，多部门的项目协调工作；精力旺盛、抗压力强。,汽车丨出行,2000人以上,数据分析,青岛
大数据实习,https://www.lagou.com/jobs/6973017.html,市北区,6k-12k,青岛莱信实业有限公司,不限,大专,快速成长，平台广阔，后期带队，开拓市场,MySQL，Oracle，Linux，数据处理，数据挖掘，数据分析1、年龄20-30周岁。2、对大数据了解感兴趣（专业不限）3、参与数据整理和分析。4、负责数据仓库的日常维护工作。,"移动互联网,数据服务",50-150人,数据分析,青岛
竞价专员,https://www.lagou.com/jobs/7075225.html,市南区,5k-10k,青岛成功易信息技术有限公司,不限,不限,五险，带薪年假，国家法定节假日,"[岗位职责]1、负责了解客户产品，并为客户网站的推广账户搭建合理账户结构。2、负责客户网站优化信息，对账户展现，点击，消费，咨询情况进行优化提升。3、负责账户日常问题及时处理，并能够分享优质案例。4、负责推广数据统计，如：消费，咨询量。5、协助客户得到更好推广效果，以至于提升预算。[任职要求]大专及以上1、熟练掌握网站各项推广技巧,具有百度、谷歌搜索引擎推广、360推广、搜狗推广经验，有成功SEM案例优先考虑；2、熟悉 SEM 搜索引擎（百度/360/搜狗/谷歌/头条等）、关键字、竟价排名等；熟练使用office办公软件； 3、有较强的数据分析能力，能够为提高推广效果给出一定建设性意见，对互联网营销具有较深的理解；【薪资待遇】无责底薪+绩效+团队奖金+全勤奖+运营工资（整体薪资可拿5-9K)【其他】早8点20-晚5点30   单双轮休   节假日按照国家规定正常休假","移动互联网,电商",50-150人,数据分析,青岛
金融产品经理,https://www.lagou.com/jobs/7177843.html,市南区,5k-7k,惠众商务顾问（北京）有限公司山东分公司,3-5年,大专,集团实力雄厚，上升渠道广,岗位责任1. 与金交所，金融机构，合作机构对接资产端；2.与团队协作将资产端提供的资产进行流程梳理，转化为合规合法风险可控的金融产品，并进行相关数据分析及费用核算；3.金融产品相关资料的准备；4.相关金融产品合同的起草以及修订；5.涉及金交所业务的材料准备及推送；6.其他金融产品及风控相关内容岗位要求1、专科以上学历，金融、经济、法律相关专业优先；2、两年以上相关岗位工作经验，有信贷、房地产、担保相关工作经验者优先考虑；3、有较强的风险管理意识，准确识别、分析、评估风险；4、熟悉投资、担保、财务、金融及企业管理相关的法律法规政策；5、有基金从业资格证优先；6、有银行，政府，交易所资源的优先；7、工作认真负责，有责任心，有吃苦耐劳的精神，具备较强的抗压能力。,"移动互联网,金融",500-2000人,数据分析,青岛
大数据实习,https://www.lagou.com/jobs/7182199.html,市南区,4k-7k,青岛航凯大数据科技服务有限公司,3-5年,大专,双休 住宿 五险一金,进行数据分析数据挖掘 抽取 转换 加载  接受无经验大专生,移动互联网,15-50人,数据分析,青岛
市场推广经理,https://www.lagou.com/jobs/7202144.html,黄岛区,5k-10k,青岛百百道信息科技有限公司,1-3年,本科,五险一金，定期团建，过节福利,职位要求：1、对行业动态关注，了解行业政策及发展趋势，能及时捕捉市场机会，调整市场策略，2、有较强的亲和力，沟通及表达能力和一定的文学功底3、较好的营销策划能力和市场开发能力4、对数据敏感，有较好的数据分析和判断能力5、收集和分析简单销售数据，检测推广效果，保证推广质量，及时提出各推广渠道存在的问题，并能建设性的提出改进建议6、有较强的责任心、团队意识和执行力7、在本行业或相关行业从事市场管理开发优先 （接收退伍军人、实习生及应届毕业生）8、有驾照、能开车上路,"企业服务,软件开发",15-50人,数据分析,青岛
服装销售总监/大客户销售经理,https://www.lagou.com/jobs/7189599.html,即墨市,10k-20k,飞榴（上海）信息科技有限公司,3-5年,大专,员工活动、专业团队、带薪年假,1、根据公司发展战略，拟定销售长短期目标，并分解达成目标。2、负责销售渠道维护，提高品牌知名度，开拓新市场。3、负责客户档案信息建立，并形成数据分析报告。4、负责销售部人员管理和人才梯队搭建。5、负责部门日常事务管理。任职要求：1、大专以上学历，5年以上销售管理经验，2年以上销售总监工作经验；2、对市场有灵敏的嗅觉和对信息和项目进度的判定能力；3、具有良好的商务谈判能力和高度执行力；4、有服装行业经验者优先。,"移动互联网,数据服务",50-150人,数据分析,青岛
风险策略分析,https://www.lagou.com/jobs/6843916.html,,20k-25k,海尔集团,3-5年,本科,10002,,"物联网,电商",2000人以上,数据分析,青岛
海洋项目智能超算与大数据平台软件架构师,https://www.lagou.com/jobs/6939073.html,即墨市,20k-25k,青岛海洋科学与技术国家实验室有限公司,3-5年,本科,前景发展好，福利好,岗位职责：1.负责智能超算与大数据平台项目开发；2.参与公司定制大数据处理分析平台和产品的设计与研发；3.参与大数据运维系统开发，对大数据平台持续优化；资格条件：1. 本科及以上学历，有大型复杂项目或产品研发经验及行业应用项目经验者优先；2. 熟悉常用设计模式和开发框架，熟悉并发、分布式编程者优先；3. 熟悉shell、python、go等编程语言者优先；4. 熟悉操作系统、算法、数据库原理和并行处理技术，对大数据处理技术有深入的了解；5. 具有良好的团队协作能力，具有较强的分析和解决问题能力；6. 有数据模型或数据分析经验者优先；7. 有科研类、工程类以及产业应用类等项目申报经验者优先。,"企业服务,其他",15-50人,数据分析,青岛
平台运营总监,https://www.lagou.com/jobs/7068076.html,市北区,12k-20k,青岛益兴贝链电子商务有限公司,5-10年,本科,公司重点项目 绩效奖金 股权激励,"【贝链项目简介】贝链嗨购以采用区块链内核打造的OAO跨境贸易全产业链生态项目，是在山东省委省政府、青岛市委市政府的大力支持下，由益兴集团发起打造的全球跨境贸易专业服务平台。线上为国内外商家和消费者搭建交易平台，在""引进来""的同时推动国内的优质产品“走出去”，并通过区块链技术对货品安全实现全程溯源，以智能合约确保交易标准化；线下汇聚全球优质供应链和物流体系，并为平台交易双方提供信用与金融的支持与保障；贝链嗨购项目2018年由政府指引，益兴集团发起，在进行B2C和O2O试点之后，确定了以跨境B2B业务作为突破点，从源头解决痛点的方向，在2019年中斥资打造了国内**跨境大宗贸易模式的B2B2B商城-“贝链嗨购商城”，积极承接国家""一带一路“重大发展战略，依托青岛保税港区的地利优势，为传统的跨境贸易加速。让国际贸易标准化，简单化是平台一期要解决的痛点。目前“贝链嗨购商城”的一期已完成上线，目前主要以CIF交易模式为主，并会在上半年针对业务流程需要进行交易模块升级；系统目前支持现货和期货(系统内称预售)两个方式为主；区块链溯源系统将于2020年下半年正式上线并对接商城系统；在实际经营业务上，“贝链嗨购”的**阶段是以跨境生鲜为落脚点。近年来消费升级从服装家电到百姓的餐桌。价格的高涨，在食品的安全上并未得到正比的体现，甚至随着食品消费的增长，以次充好导致实际消费价格质劣的情况比比皆是。基于此，贝链嗨购商城的一阶段是以生鲜商家的跨境贸易为主，同时贝链嗨购旗下子公司：贝链贸易，也已取得挪威渔场5000吨的进口配额，来协助平台和商家一起打好这场食品安全的硬仗。岗位职责：（1）了解公司平台项目发展沿革，根据个人和类似平台操盘经验查找问题，提出整改意见建议。（2）筹划平台完善、推广、运营的战略性问题，提高科学性、针对性、可行性。根据公司产品特性，制定推广方案和营销策略，进行科学分解并落地。（3）根据实际情况，提出技术性需求、目标、措施和时间节点，并监督执行。总体把控各模块的研发验收确保质量进度；定期分析后台数据参数，提出改进方案和实施。（4）思考组织架构，提出用人需求，参与招聘遴选。（5）管理团队，提升工作效率。组建团队，建立激励考核机制；明确职责，进行科学的岗位分工；绩效管理，充分调动员工的积极性；合理统筹，对运营和研发费用负责。（6）制定并达成运营目标。组织调研，根据后台数据等信息满足客户需求、提升平台竞争力、抓好产品服务、加快促销推广。（7）与其他部门合作，代表公司组织和参与商务洽谈，构建与政府、商会、银行和投资机构、各类经济实体以及相关非政府组织的良好合作关系。（8）根据本职工作，完善岗位职责并忠实履行。（9）完成总裁交办的其他事务。任职要求：（1）年龄28-45，条件优秀可以适当放宽。（2）具备良好的互联网思维模式，了解互联网企业发展规律，熟知代表性企业的核心运营模式和盈利模式。（3）具备宏观视野和灵活、开放、跨界的思维习惯，具备良好的沟通协调能力、团队合作意识和进取心。（4）具有线上线下产品推广、实操经验和成功案例，或参与过相似项目并处于中层以上岗位。（5）本科以上学历，具备20人以上团队领导能力和经验。（6）具备数据分析推理能力，能根据数据归纳整理有用信息，并以此推动工作。（7）熟知商务礼仪，个人形象良好、谈吐大方，思维和语言逻辑性强。","电商,消费生活",15-50人,数据分析,青岛
商品（食品类）陈列专员,https://www.lagou.com/jobs/7159303.html,崂山区,10k-15k,上海盒马网络科技有限公司青岛第一分公司,3-5年,本科,五险一金、十三薪、年终奖金、团队建设,工作职责：1、负责线下零售门店平面图，货架商品陈列图，新开门店提供陈列培训及现场指导支持；2、负责陈列全品项数字化实施；3、分析门店销售数据，结合市场趋势进行品类分析及管理，基于数据洞察来新建/调整商品陈列图；4、与关联部门如采购/库控/运营等保持有效的沟通，保障商品空间管理工作顺利开展；任职要求：1、教育背景：本科或以上学历，零售、物流、数据分析等相关专业优先考虑；2、工作经验：有一年相关采购、品类管理、陈列工作经验优先考虑；3、熟练使用办公软件（excel/ppt/cad），有较强的数据分析处理能力；4、有相关软件（Space Planning或Spaceman）使用经验优先考虑，若没有则必须有良好的学习能力与领悟力；5、 吃苦耐劳，有一定的承压能力，能与各部门保持有效的沟通；6、该岗位由上海上嘉物流有限公司代理招聘和管理。,O2O 不限,500-2000人,数据分析,青岛
电商营销策划,https://www.lagou.com/jobs/7168288.html,市北区,8k-12k,北京值得买科技股份有限公司,3-5年,大专,周末双休 弹性工作 加班补助 交通补助,岗位职责：1、拥有成熟的电商和品牌营销方案生产能力；2、对外可独立完成针对特定项目的营销策划方案输出；3、对内可独立完成快消类商品的线上活动策划并落地执行；4、深谙新媒体传播模式，有自己独特的理解和观点，能够精准提炼出提案的亮点；5、具有敏锐捕捉社会热点与趋势的能力，可产出高品质的品牌、平台传播活动与事件；6、了解用户行为及需求，收集用户反馈并提出运营改善方案任职要求。任职要求：1、2年以上品牌营销策划、品牌管理咨询、广告等行业工作经验；2、熟悉电商平台的运营模式，了解抖音、快手、小红书等新媒体策略和玩法；3、有很好的策划和创意能力，有自己对新媒体策划的见解及方法，有成功的项目案例；4、具有严谨的思维、良好的文案写作、项目方案撰写能力；5、对数据敏感，可通过数据分析产出有效结论；6、良好的团队合作及沟通能力，能很好配合团队完成相关工作；,电子商务,500-2000人,数据分析,青岛
cto首席技术官,https://www.lagou.com/jobs/7132408.html,崂山区,60k-90k,青岛硕智博睿管理顾问有限公司,5-10年,本科,大平台 薪酬高 发展前景好,岗位职责：1.根据组织发展战略，全面负责公司系统的技术方向研究、难点攻破和总体规划，参与重大技术决策和方案的制定；2.负责技术团队的建设，监督及指导，制定技术团队的培训计划及绩效评估标准，有效提升技术团队水平；3.主导技术项目的评估、规划、决策，审核总体技术方案，管理项目进度、预算及项目风险，对技术团队产出的质量和效率负责；4.全面支持平台日常安全运营、系统维护、升级，确保系统在高并发场景下的性能优势，解决系统潜在的技术风险；5.负责制定技术开发规范、运维规范，安全规范，故障处理等技术团队工作规范和工作流程，并监督、跟踪开发过程中规范落地情况；6.负责协调技术团队与公司其他部门的工作，为业务发展提供全面的技术支持，助力公司战略目标的实现。 任职要求：1.本科及以上学历，计算机科学与技术类相关专业；2.8年以上技术总监任职经验，100人以上团队管理经验，具有大型政府、智慧城市类项目或者大型企业项目设计实施经验者优先；3.5年以上分布式、高并发、高可用大型系统架构设计与开发经历，在软件开发、平台建设、项目管理等方面有丰富经验；4.精通java、设计模式、面向对象思想、微服务架构，精通Spring Boot、Spring Cloud，深刻理解其原理和实现机制；5.精通主流数据库（包括但不限于Oracle/MySQL/PostgreSQL/Greenplum/MongoDB），有丰富的SQL开发调优经验，有大数据处理经验；6.精通大数据领域解决方案，具备该领域全面的技术积累，包括但不限于Hadoop、Spark、Flink等，精通数据仓库建模和设计、海量数据处理与分析，有数据中台项目经验者优先；7.精通数据挖掘技术，精通TensorFlow深度学习开源框架，有大型政府或者企业数据挖掘、数据分析相关项目经验者优先；8.具备主导、培训整体技术研发团队的能力和经验，能够独立完成目标分解和难点攻关，可带领团队高效达成项目目标，并助力团队成长；9.具备极强的内驱力与责任心，对技术市场具有一定的敏锐度，能及时掌握市场最新技术发展动态，对公司技术发展能提供决策性的建议；10.具备极佳的分析、解决问题能力与沟通协调能力，擅长资源管理与资源调度，高效完成项目目标,企业服务,少于15人,数据分析,青岛
电商运营专员,https://www.lagou.com/jobs/7104500.html,即墨市,3k-5k,青岛润达生物科技有限公司,应届毕业生,大专,双通道晋升、福利丰厚、包吃包住,岗位职责：一、用户获取：1，负责通过渠道、活动、内容、产品等运营方式，对用户日活、留存量数据负责；2，负责设计新颖有效的拉新活动，制定方案并执行；3，对产品生命周期进行分析，规划产品迭代方案，负责产品内容运营，丰富产品宣传内容；                                 二、用户维护1，负责平台侧运营工作，对活动、策略、类目、产品、会员体系等，针对相应活动出具转化或者销售数据分析。2，负责对用户侧运营，通过qq群，微信群，微博，社群，公众号的形式，搭建用户社区运营体系；4，负责对商品选品、优化，上架，报名活动进行全流程指导；岗位要求：1、电子商务等相关专业2、接受优秀应届生，实习经验少没关系，可以培养，让你快速成长3、性格开朗，活泼大方、有创新的想法,其他,150-500人,数据分析,青岛
电商运营专员,https://www.lagou.com/jobs/7099007.html,即墨市,3k-5k,青岛润达生物科技有限公司,不限,大专,福利丰厚、年终奖、员工聚餐、双通道晋升,岗位职责：一、用户获取：1，负责通过渠道、活动、内容、产品等运营方式，对用户日活、留存量数据负责；2，负责设计新颖有效的拉新活动，制定方案并执行，对新注册用户数据负责；                                     3，对产品生命周期进行分析，规划产品迭代方案，负责产品内容运营，丰富产品宣传内容；                                 二、用户维护1，负责平台侧运营工作，对活动、策略、类目、产品、会员体系等，针对相应活动出具转化或者销售数据分析。2，根据行业特点，输出有效用户画像。3，负责对用户侧运营，通过qq群，微信群，微博，社群，公众号的形式，搭建用户社区运营体系；三、运营文档知识库建立1，针对相关产品选型策略方案，运营工具使用，人员培训提升，商城平台帮助手册等知识库内容整理存档；,其他,150-500人,数据分析,青岛
产品助理,https://www.lagou.com/jobs/5960725.html,市南区,8k-10k,海程邦达国际物流有限公司,1-3年,本科,周末双休 领导开明 扁平管理 遍地大神,岗位职责：1.参与项目需求调研与分析工作，辅助产品经理进行功能分解、页面原型设计等工作；2.协调技术开发人员，跟踪产品开发进度，完成产品的开发、测试、版本管理，评审发布，产品上线等相关工作；3.协助产品经理完成产品实施工作；4.跟踪上线产品的使用效果、用户反馈，收集和主动挖掘改进需求；任职要求：1.本科以上学历，物流工程、计算机软件等理工科专业优先；2.有较强的沟通能力，逻辑思维能力和文档编写能力；3.有良好的数据分析能力；4.思维活跃，逻辑条理清晰，能明确的表达自己的想法和见解，善于与其他部门同事沟通，善于倾听他人的意见建议但不盲从。,企业服务,2000人以上,数据分析,青岛
