job_name,job_url,job_location,job_salary,job_company,job_experience,job_class,job_given,job_detail,company_type,company_person,search_key,city
大数据开发工程师,https://www.lagou.com/jobs/6158591.html,雨花台区,15k-18k,江苏飞搏软件股份有限公司,3-5年,本科,清晰的职业发展通道,职责描述：1、负责大数据平台管理和开发工作；2、负责大数据开发和查询子平台建设，包括数据采集，传输，存储，计算流程调度，元数据管理等工作；3、负责大数据平台相关场景模型迭代设计。任职要求:1、计算机相关专业毕业3年以上工作经验，本科以上学历；2、良好的java编程能力，熟悉java开发工具和调试工具；3、熟悉linux系统，熟练使用shell/python脚本处理工具；4、熟Hadoop /Hive / Hbase/ Spark / Storm/Elastic Search等开源大数据系统的原理和使用；5、熟悉政府，公安，工商，检察院等大数据应用优先。,"信息安全,其他",150-500人,大数据,南京
大数据开发工程师,https://www.lagou.com/jobs/5670752.html,江宁区,17k-30k,孩子王儿童用品股份有限公司,3-5年,本科,母婴行业独角兽、互联网氛围、晋升灵活,"工作职责：1. 负责数据仓库应用产品设计和开发  2. 负责数据仓库建模、数据预处理子系统的设计和开发。3、负责数据仓库ETL流程的优化及解决ETL相关技术问题 职位要求：1、计算机相关专业本科及以上学历；2、在用户行为日志采集、海量数据处理、数据建模、业务理解方面有丰富经验； 3、精通Hadoop/MapReduce/hive ,有一定的hql/sql性能调优经验；4、熟悉java/Python/php/mysql，有相关开发经验； 5、熟悉Linux/Unix环境以及常用命令；6、至少熟练使用shell、python、perl等脚本语言之一； 7、有较好的沟通交流能力,善于主动思考和行动,乐于解决具有挑战性的问题； 8、有较好的逻辑思维能力，较强的抽象、概括、总结能力；9、对数据敏感、对新技术敏感、对数据产品设计有想法者优先。",消费生活,2000人以上,大数据,南京
大数据开发工程师,https://www.lagou.com/jobs/6879090.html,江宁区,15k-25k,上海源犀信息科技有限公司,不限,本科,双休，假期多，领导nice,"关于团队团队已完成了数据平台的搭建和数据仓库的建立，正在不断优化OLAP业务；我们有较完善的CI系统，使用gerrit提交代码并进行 review，jenkins执行测试；我们的服务已经完成了容器化，并搭建了k8s；我们基于Spark生态搭建了数据平台，并结合kylin做数据预处理我们使用Elesticsearch处理大部分在线业务查询。岗位职责：1. 参与规划和实施公司数据平台的搭建以满足未来1-2年的数据分析要求；2. 参与公司CDP平台的整体数据架构设计，完成从业务模型到数据模型的设计工作 ；3. 负责基于Spark的数据平台研发工作（包扩离线计算，数据仓库存储和处理等）；4. 对业务开发团队提供技术支持，协助方案规划；5. 维持线上服务高效稳定，支撑业务和数据量的快速扩张。岗位要求：1. 有 java 开发基础，熟悉 Spark 相关技术，至少有 3 年以上的大数据开发经验（有过带教经验优先考虑，本岗往Leader方向培养）；2. 熟悉流式计算平台的搭建，例如使用Flink / Spark Streaming和kafka结合的实时数据处理系统，实现数据实时大屏；3. 理解离线和实时数据仓库的治理方法和分层逻辑；4. 熟悉 Scala 语言，对 Scala 原理、底层技术有深入研究者优先；5. 深入理解 MapReduce 工作原理，HDFS 分布式文件系统架构；熟练掌握 Hadoop/Hive/HBASE 的运维和调优方法；6. 熟悉 mysql, ElasticSearch, Redis 等关系型或 NoSQL 数据库，了解应用场景和使用限制。有实际调优经验者更佳；7. 熟悉 Linux/Unix 操作系统, 会写Shell，会使用 Git了解大数据组件的使用限制和应用场景，包括但不仅限于: hdfs, yarn, hbase, hive, flume, kafka, zookeeper, kylin, kudu, ElasticSearch, Storm, MongoDB 等；8. 了解掌握 TensorFlow 者优先；9. 熟练的英文技术文档阅读能力；10. 有深入研究过 Hadoop，Spark 源码者优先；具备强烈的意愿去文档化所有的东西，这样你就不用再学一遍之前学过的东西。福利：双休，自研，偶尔加班，不出差，六险一金（公积金基数比例高），入职即有年假（一年12天），弹性工作，交补话补，每周团建，定期outing等","企业服务,广告营销",15-50人,大数据,南京
高级大数据开发工程师,https://www.lagou.com/jobs/7004515.html,雨花台区,20k-28k,众能联合数字技术有限公司,5-10年,本科,期权激励,岗位职责：1、负责大数据相关的开发工作； 2、负责需求评审、模型设计、代码开发工作3、负责线上系统质量保证、系统性能优化工作； 4、负责规范文档的编写工作； 5、负责技术难点的攻关等技术工作。 任职要求：统招本科计算机相关专业以上学历，5年及以上的开发经验1、精通java/scala开发，有较好的性能调优能力及经验；2、精通流式处理框架，能够独立进行开发；3、精通建模理论，具备独立设计数据模型的能力；4、精通数据仓库原理；5、精通BI开发；6、精通大数据生态组件（HDFS/MapR/Hive/Hbase/Spark/Spark-stream/Flink/Kafka/Kudu/Impala/kylin等）架构原理；7、富有责任心，有良好的团队合作精神，具备良好的沟通能力；8、有互联网，零售，供应链等行业应用经验者优先,"移动互联网,企业服务",500-2000人,大数据,南京
开发工程师(大数据、人工智能、物联网),https://www.lagou.com/jobs/7028736.html,江宁区,9k-15k,上海海万信息科技股份有限公司,3-5年,本科,五险一金 带薪年假 周末双休,工作地点：南京学历要求：本科以上岗位要求：（1）熟悉SDK组件开发流程，独立开发过SDK组件；（2）熟悉HTTP、TCP/IP、MQTT协议；（3）熟悉C/C++/Java等语言中的一种；（4）熟悉物联网技术，有相关开发经验者优先；（5）熟悉分布式、多线程及高性能的设计与编码及性能调优者优先；综合能力：（1）负责物联网平台整体架构设计、体系及其标准制定和功能模块设计；（2）负责物联网数据采集层、数据传输层、云服务层、业务应用层的数据传输协议，以及接口规范定义及云平台架构搭建，并制定产品解决方案；（3）编写相应的设计报告、技术标准和技术文档；（4）负责软件框架代码的开发和调试工作；（5）参与物联网感知数据的数据分析和数据可视化工作；（6）解决工程项目当中遇到的问题，进行系统性能优化和安全加固，保证平台安全、稳定、快速运行；,"移动互联网,金融",500-2000人,大数据,南京
大数据开发工程师 (MJ000038),https://www.lagou.com/jobs/7086722.html,雨花台区,15k-30k,星环信息科技（上海）有限公司,3-5年,本科,弹性工作制 发展前景好 周末双休,工作职责：1、基于大数据平台，研发行业相关应用系统；2、根据行业的应用解决方案，设计及开发原型系统；3、根据系统设计方案，进行设计文档编写，编码，测试等工作；4、按项目进度要求完成分配的开发任务，开发过程和成果符合质量控制要求；职位要求：1、计算机相关专业，本科及以上学历； 2年以上互联网/企业级应用开发经验；2、熟悉Java语言及常用类库和J2EE技术框架，熟练掌握常用开发工具；3、熟悉SQL语言，了解Oracle或MySQL的开发和维护；4、了解软件需求分析和系统设计相关的知识；5、了解项目管理基本流程和软件开发规范；6、有金融行业应用开发背景或大数据应用开发经验者优先。,数据服务,500-2000人,大数据,南京
大数据应用开发工程师-高级 (MJ000037),https://www.lagou.com/jobs/6909360.html,雨花台区,15k-25k,星环信息科技（上海）有限公司,1-3年,本科,弹性工作制 六险一金 成长空间大,工作职责：1、基于大数据平台，研发具有创新性行业相关的应用系统；2、设计行业的应用解决方案，能快速开发原型系统，并验证方案的可行性；3、根据业务需求，进行系统设计，包括架构设计，高层设计、模块分解等；4、负责应用系统的模块开发，包括设计、编码、整合、测试和优化；5、指导和培养团队成员，包括评审设计文档和代码；职位要求：1、计算机相关专业，本科及以上学历； 5年以上互联网/企业级应用开发经验，1年以上系统设计经验；2、精通Java语言及常用类库和J2EE技术框架，熟练使用常用开发工具；3、精通一种数据库产品Oracle/MySQL的SQL开发和SQL调优；4、掌握软件需求分析、系统设计的基本方法和理论，并能合理的使用；5、熟悉研发项目管理流程、软件开发规范和质量保障体系；6、具有团队管理经验者优先；7、具有金融行业应用开发背景或大数据、机器学习应用开发经验者优先。,数据服务,500-2000人,大数据,南京
大数据开发工程师,https://www.lagou.com/jobs/7213718.html,建邺区,10k-15k,南京华恩信息技术有限公司,1-3年,本科,从事主流行业，可深入了解银行业务,1.熟悉Linux系统，熟悉常用操作命令以及shell编程2.主导或参与过大数据项目，熟悉hadoop，kafka，spark，hbase等大数据组件的基本原理3.具有数据仓库项目经验，数据模型设计经验，熟悉oracle，hive，sparksql等常用语法4.能够对应用程序进行性能优化，包括java端代码优化，SQL优化，组件配置优化等5.具有良好的沟通能力和团队精神，较强的学习能力，能承担一定的工作压力6.有银行经验优先,"金融,软件开发",50-150人,大数据,南京
大数据开发实习生,https://www.lagou.com/jobs/6606451.html,建邺区,8k-10k,北京字节跳动科技有限公司,不限,本科,休闲下午茶,,文娱丨内容,2000人以上,大数据,南京
前端开发高级工程师-大数据,https://www.lagou.com/jobs/5569611.html,建邺区,20k-40k,北京字节跳动科技有限公司,3-5年,本科,弹性工作，免费三餐，租房补贴，带薪休假,,文娱丨内容,2000人以上,大数据,南京
大数据架构师,https://www.lagou.com/jobs/6999385.html,江宁区,18k-36k,合肥优尔电子科技有限公司,5-10年,本科,"双休、旅游,五险一金,健康体检,年终奖","职位信息：1. 负责系统架构规划和设计，制定开发规范等；2. 负责带领开发团队持续改进产品的整体设计，跟踪需求迭代，提高用户体验；3. 负责主导重要或高风险模块的详细设计，且亲自实现部分核心模块，控制产出质量；4. 负责项目研发过程中的技术输出与评审工作（包含撰写文档，开展code review等）；5. 负责指导、培养项目组其他开发人员；6. 负责前沿技术研究与落地。任职要求：1. 计算机相关专业本科及以上学历；2. 8年以上开发经验，其中至少3年以上的架构设计经验； 能主持大规模系统的总体设计，具备较强的分析、判断和概括能力，逻辑思维能力，可带领小团队具体开发实现；能够深度挖掘业务需求，为软件开发提供相应的架构设计；具有良好的设计通用框架及模块的能力；3. 熟悉主流开发框架和组件如SpringMVC，SpringBoot, Mybatis, Redis等； 精通MYSQL、Oracle、Greenplum等主流关系型数据库；熟悉sql调优；能够对数据库整体调优为佳； 熟悉并发处理、分布式系统架构；熟悉大数据相关技术为佳（如Hadoop,HBase,Hive,Flink，Spark，Kafka，Flume等相关开发使用经验）； 熟悉Nginx，负载均衡等技术；熟悉前端框架如Vue或React优先；4. 有熟悉阿里、华为数据中台技术组件、架构及数据服务相关开发经验者优先；5. 熟悉git，linux系统的相关命令及基础shell编程；6. 有电力、电信运营商等行业数据采集或大数据相关开发经验者优先；有系统架构师证书优先。","企业服务,信息安全",50-150人,大数据,南京
大数据架构师,https://www.lagou.com/jobs/7071550.html,鼓楼区,16k-25k,南京联创信息科技有限公司,1-3年,本科,云计算,岗位职责    1、具有管理团队开发经验，具备良好的组织能力、协调能力、项目管理能力及抗压能力，工作积极主动，自我驱动能力强，主动思考，心态开放，思路清晰。2、带领团队攻克高并发、高稳定性，复杂业务模型等带来的各种挑战及技术难关；3、参与项目的系统设计和核心代码开发，指导和培训其他工程师；4、整理和提交技术文档，负责核心功能模块的代码编写和测试工作；5、具有将大数据产品、技术解决方案的案例跨行业应用的能力。能力要求    1、计算机、统计学、数学等相关专业本科及以上学历，2年以上软件架构经验或3年以上大数据开发经验；2、对数据仓库、数据平台、数据分析、数据挖掘、深度学习、NLP等领域有深刻的理解，丰富的数据架构经验，精通数据建模及ETL设计开发。3、熟悉企业数据架构和数据模型，完整的企业数据产品的架构设计和落地经验，能结合具体的业务场景，提供有竞争力的的数据产品解决方案设计。4、对教育行业业务有整体的理解，对数据业务场景非常敏感，能够有效结合业务和技术创新，全局地规划或完善数据服务体系以解决业务/产品的问题。5、掌握IT咨询规划方法，熟悉软件架构方法及云计算架构，具有大型分布式应用系统分析、架构设计、开发经验；6、具有非常扎实的Java基础，对数据结构和AI相关算法设计有较为深刻的理解；7、在可扩展、高性能，高并发，高稳定性系统设计、开发和调优方面有实际经验；8、精通MapReduce设计方法、对NoSQL，Hadoop、Hbase、Hive等主流云计算，大数据相关软件有充分的了解，并且有实践经验，能解决应用中的复杂问题； 9、具有很强的技术研发和创新能力，能有效把握技术发展方向；10、具有海量数据处理、数据挖掘、数据分析相关项目的工作经验者优先：11、具备极强的技术把握能力与前瞻性，优秀的分析和解决问题的能力，对挑战性问题充满激情；12、对商业和业务逻辑敏感，具备良好的逻辑分析能力。,"移动互联网,教育",150-500人,大数据,南京
大数据研发经理,https://www.lagou.com/jobs/6278743.html,雨花台区,25k-35k,众能联合数字技术有限公司,5-10年,本科,独角兽企业、发展平台、竞争力薪酬,岗位职责：1、负责基于大数据平台的离线，实时数据仓库搭建，数据仓库的基础架构、ETL设计、流程优化，元数据系统设计；建立数据生命周期框架，整体管理数据的生产、建模、应用及质量体系建设；2、负责离线或者实时销售指标系统、风控系统底层指标系统开发维护；3、对海量数据整合分析，挖掘用户，产品及潜在数据信息，为销售、风控，运营决策支撑体系提供完善的数据平台支持；4、负责大数据数据仓库（离线，实时）方向技术团队管理，业务技能和技术能力培养；任职要求：1、精通数据仓库理论、具备大型数据仓库架构设计、模型设计优化等能力；2、对数据敏感，有较强的逻辑分析能力，对数据处理和分析有多年从事经验，有复杂业务和算法的数据平台建设经验；3、全日制本科以上学历，计算机相关专业； 3-5年以上完整实施DW/BI项目实施和开发经验、有一定的团队管理经验；4、熟悉Hadoop2、Spark/Streaming、Kafka、Flume、Presto、kylin等；5、熟练掌握Java/Python语言、有丰富的后台服务开发经验，对系统架构设计与性能调优有经验；6、熟悉主流数据挖掘算法开发实施经验者优先；7、要求较强项目管理经验和研发管理经验，有金融行业经验者优先；,"移动互联网,企业服务",500-2000人,大数据,南京
高级产品经理-大数据方向,https://www.lagou.com/jobs/5478912.html,江宁区,20k-40k,孩子王儿童用品股份有限公司,5-10年,本科,母婴行业独角兽、互联网氛围、晋升灵活,职位描述：1、负责公司内数据产品规划，以产品的视角组织数据，给运营人员提供基于数据的业务指导；2、 撰写高品质的产品需求文档，利用各种工具，完成产品设计，并与开发部门等相关单位沟通，形成最终产品设计；3、 通过大量的数据分析，完成相关调研分析工作 岗位要求：1、 数学、统计、计算机软件、管理信息系统、运筹学相关专业本科及以上学历，五年以上大数据产品经理工作经验；2、 熟悉产品设计流程，熟练应用Axure等产品原型设计工具；3、 熟悉SAS、SPSS等统计分析软件，熟悉SQL，熟悉数据挖掘者优先；4、 具有良好的商业敏感度和数据分析技能；5、 具有较强的沟通表达、项目管理及组织协调能力，有团队工作管理经验；6、 优秀的团队合作精神。,消费生活,2000人以上,大数据,南京
大数据项目经理,https://www.lagou.com/jobs/5171465.html,秦淮区,15k-25k,北京芯盾时代科技有限公司,3-5年,本科,"五险一金,健康体检,晋升空间,内推重奖",岗位职责：1、参与及负责大数据项目的实施落地。2、负责大数据产品相关文档编写及培训等工作。3、深入理解公司大数据平台架构，发现并解决性能瓶颈，支撑业务和数据量的快速增长。4、协助客户参与各种环境业务系统的投产及技术支持。5、协调项目资源，对于项目实施进度的规划、控制、监督和管理。6、负责与公司内相关部门沟通协调，制定整体方案，推进项目执行。7、负责定期汇报项目状态，跟进项目问题风险。 任职要求：1、熟悉Linux操作系统常用命令。2、熟悉Tomcat、Weblogic基本操作及调优。3、熟悉MySQL、Oracle安装及相关配置，熟悉SQL基本操作。4、熟悉Hadoop、Redis、ElasticSearch、HBase、Spark、Storm、Kafka等大数据组件，对离线计算、内存计算和流式计算均有较为深刻理解。5、有一定的Java开发能力者优先。6、熟练掌握Power point、Excel、Project、Visio等工具。7、熟悉软件项目管理过程，具有较强的项目管理能力和沟通协调能力。8、具有较强的大局观，能够统筹跨团队项目，具有丰富的项目组织及人员管理经验，能够有效管理项目团队。9、具备较强的语言表达能力，能与客户顺畅沟通或产品介绍。10、具备较强的学习与动手能力，能够适应出差。,"移动互联网,信息安全",150-500人,大数据,南京
大数据高级开发工程师,https://www.lagou.com/jobs/7199638.html,秦淮区,20k-30k,江苏普旭软件信息技术有限公司,3-5年,本科,双休 五险一金 团建福利齐全 带薪年假,岗位职责1. 负责参与DAAS系统项目，数据仓库和数据集市的架构与模型设计、ETL开发与优化；2. 负责数仓设计与开发，优化数据计算和访问性能，保证服务高质量运行；3. 负责大数据挖掘分析平台算子开发，系统化、自助化地提高业务支持和分析效率；4. 技术预研和技术难点攻关、保障系统可用性、稳定性和可扩展性。 职位要求1. 本科及以上学历，计算机相关专业，3年以上数据治理经验；2. 熟悉Linux命令，有Linux环境大数据集群部署维护经验；3. 熟练掌握java编程语言，并有大型数仓或者数据分析项目建设经验，有python、scala开发经验优先；4. 熟练掌握数仓理论，对数仓架构、模型、元数据和数据治理等有深入的理解；5. 熟练掌握大数据技术栈，包括Hadoop，Hive，Spark，HBase，Flink等；6. 熟悉数据分析技术栈，包括基本统计和机器学习等，有spark ml开发经验优先；7. 思维逻辑清晰，良好的自驱力，沟通能力和解决问题的能力。,"移动互联网,信息安全",50-150人,大数据,南京
大数据实习生,https://www.lagou.com/jobs/6144398.html,雨花台区,3k-4k,亚信科技（中国）有限公司,应届毕业生,本科,前沿技术，5G研发,【工作职责】1、负责数据处理解决方案的设计与实施，以满足特定行业的生产需求；2、负责大数据相关组件进行二次开发；3、负责大数据的应用开发；4、负责研发族群文档编写 。【职位要求】1、2021届应届毕业生，本科及以上学历，985/211毕业院校优先考虑，计算机软件、通讯相关专业；2、较强的编程(JAVA/Scala)以及脚本编写基础；3、大数据以及分布式计算领域相关基础知识；4、熟悉至少一种如下大数据相关组件，如：Hadoop/Spark/Kafka/Hbase/Hive/Storm/HAWQ/ /AMBARI/Solr；5、性格开朗，学习及语言表达能力强，善于与人沟通、交流 。,"企业服务,移动互联网",2000人以上,大数据,南京
大数据架构师,https://www.lagou.com/jobs/7116104.html,建邺区,25k-35k,广州佰聆投资咨询有限公司,5-10年,本科,周末双休、餐补、通讯补贴、年终奖,"岗位职责：1. 负责系统架构规划和设计，制定开发规范等；2. 负责带领开发团队持续改进产品的整体设计，跟踪需求迭代，提高用户体验；3. 负责主导重要或高风险模块的详细设计，且亲自实现部分核心模块，控制产出质量；4. 负责项目研发过程中的技术输出与评审工作（包含撰写文档，开展code review等）；5. 负责指导、培养项目组其他开发人员；6. 负责前沿技术研究与落地。任职要求：1. 计算机相关专业本科及以上学历；2. 8年以上开发经验，其中至少3年以上的架构设计经验； 能主持大规模系统的总体设计，具备较强的分析、判断和概括能力，逻辑思维能力，可带领小团队具体开发实现；能够深度挖掘业务需求，为软件开发提供相应的架构设计；具有良好的设计通用框架及模块的能力；3. 熟悉主流开发框架和组件如SpringMVC，SpringBoot, Mybatis, Redis等； 精通MYSQL、Oracle、Greenplum等主流关系型数据库；熟悉sql调优；能够对数据库整体调优； 熟悉并发处理、分布式系统架构；熟悉大数据相关技术（如Hadoop,HBase,Hive,Flink，Spark，Kafka，Flume等相关开发使用经验）； 熟悉Nginx，负载均衡等技术；熟悉前端框架如Vue或React优先；4. 有熟悉阿里、华为数据中台技术组件、架构及数据服务相关开发经验者优先；5. 熟悉git，linux系统的相关命令及基础shell编程；6. 有电力、电信运营商等行业数据采集或大数据相关开发经验者优先；有系统架构师证书优先。","数据服务,软件开发",150-500人,大数据,南京
大数据开发工程师,https://www.lagou.com/jobs/7200275.html,玄武区,12k-24k,苏宁易购集团股份有限公司,3-5年,本科,五险一金、职业发展、餐补、通讯补贴,招聘详情1、完成电商场景下海量数据的在线及离线数据清洗、数据分析任务开发工作；2、两年以上大数据相关工作经验，熟悉掌握hadoop、spark、flink、kakfa、storm、hbase、hive、es中的多项技能；3、熟悉掌握Java、scala、python至少一种编程语言；4、有kylin、Phoenix、Druid、图数据库相关开发经验优先；具备网络安全行业相关知识背景，熟悉WAF、HIDS等安全产品优先。,"电商,信息安全",2000人以上,大数据,南京
