job_name,job_url,job_location,job_salary,job_company,job_experience,job_class,job_given,job_detail,company_type,company_person,search_key,city
软件架构师,https://www.lagou.com/jobs/7094012.html,工业园区,16k-25k,苏州声通信息科技有限公司,5-10年,本科,薪资待遇，发展前景,工作职责：1. 负责基础架构技术选型、参与技术评审、核心组件研发2. 负责技术攻关，解决项目中遇到的技术问题，对线上运行的系统进行及时响应处理3. 负责产品线所涉及的中间件开发4. 优化项目框架，负责核心业务的代码开发5. 指导研发人员进行项目开发，解决开发中遇到的技术难点6. 对开源社区前沿的解决方案进行技术跟踪，为项目开发做技术储备岗位要求：1. 本科及以上学历（985/211优先考虑），计算机相关专业，8年以上软件开发经验2. 精通PHP/JAVA语言开发一种以上3. 参与过高并发、高性能、高可用系统设计，有大型互联网公司经验优先4. 熟悉微服务架构5. 熟悉主流开源消息中间件的使用，Kafka/RocketMQ/ActiveMQ/RabbitMQ中的一种6. 熟悉MySQL等关系型数据库，以及相应数据库调优、SQL优化7. 熟悉NoSQL数据库，并能熟练使用Redis/MongoDB中的一种8. 有线上运维经验优先9. 熟悉云原生相关技术优先10. 沟通流畅、思路清晰、善于解决复杂问题11. 具备良好的抗压能力、自我驱动、高效的执行力，以及良好的团队协作能力,数据服务,15-50人,php,苏州
高级后端开发工程师&nbsp;,https://www.lagou.com/jobs/6751411.html,工业园区,12k-20k,江苏匡集工业科技有限公司,3-5年,本科,五险 带薪年假 双休 年终奖,"岗位要求1. 本科及以上学历，3-5年以上开发经验（特别优秀也可以考虑）2. 至少精通一门后端语言，java，php，python等，深入理解面向对象编程，设计模式3. 至少精通一种数据库设计和运用，并能够对sql进行优化，熟练数据库安全设计4. 具有独立完成后端开发的能力5. 熟悉 TCP/IP 网络协议，熟悉 HTTP 协议6. 熟悉多线程, 线程安全和线程可见性，能编写高效的多线程代码，解决模块开发过程中的高性能，高并发和高可靠性问题工作职责：1. 独立架构、完成后端程序的开发2. 后端性能，内存优化，疑难问题分析3. 搭建服务器，后端代码框架设计，后端代码逻辑开发4. 产品功能开发例如： 注册登录，订单，支付（微信支付宝），聊天（图文，语音，视频），分类，排序等功能，个人设置等","电商,其他",50-150人,php,苏州
高级后端开发工程师,https://www.lagou.com/jobs/6745145.html,工业园区,12k-20k,江苏匡集工业科技有限公司,3-5年,本科,五险 带薪年假 双休 年终奖,"岗位要求1. 本科及以上学历，3-5年以上开发经验（特别优秀也可以考虑）2. 至少精通一门后端语言，java，php，python等，深入理解面向对象编程，设计模式3. 至少精通一种数据库设计和运用，并能够对sql进行优化，熟练数据库安全设计4. 具有独立完成后端开发的能力5. 熟悉 TCP/IP 网络协议，熟悉 HTTP 协议6. 熟悉多线程, 线程安全和线程可见性，能编写高效的多线程代码，解决模块开发过程中的高性能，高并发和高可靠性问题工作职责：1. 独立架构、完成后端程序的开发2. 后端性能，内存优化，疑难问题分析3. 搭建服务器，后端代码框架设计，后端代码逻辑开发4. 产品功能开发例如： 注册登录，订单，支付（微信支付宝），聊天（图文，语音，视频），分类，排序等功能，个人设置等","电商,其他",50-150人,php,苏州
后端开发工程师,https://www.lagou.com/jobs/6866782.html,相城区,10k-15k,苏州荣域管理咨询合伙企业（有限合伙）,3-5年,本科,公司发展平台好,"岗位职责：1. 负责公司后端模块研发及需求满足；2. 负责后端架构设计、数据库设计及技术攻关；3. 搭建系统开发环境，完成系统框架和核心代码的实现，负责解决开发过程中的技术问题；4. 协助完成系统测试工作、研究跟踪用户增长相关前沿技术； 任职资格：1. 三年以上python/php/java/go语言开发经验，熟练使用springboot，hibernate，Mybatis，springMVC框架，有数据处理系统开发经验优先；2. 熟悉Nginx, 熟练使用mysql, Redis, 有分布式系统设计经验优先；3. 熟练掌握Linux操作系统及常用命令；4. 扎实的计算机基础，掌握熟悉常用数据结构、算法、设计模式；5. 良好的代码编写习惯，结构清晰，良好的研发文档开发习惯；6. 具有良好的团队合作意识，善于沟通，较强的学习能力，有责任心；7. 经历过完整产品周期，具备上线产品经验。","人工智能,软件开发",150-500人,php,苏州
Web前端开发工程师（苏州）,https://www.lagou.com/jobs/6905180.html,姑苏区,8k-16k,天津市基理科技股份有限公司,1-3年,不限,"业内大伽,学习氛围浓,技术驱动,苹果开发","岗位职责：互联网前端开发（官网：www.geneegroup.com)技术能力要求：1. 热爱编程，掌握前沿编程技术 2. 熟悉Javascript, HTML5, CSS3, 熟悉前端调试工具的使用 3. 除Javascript外, 至少熟悉另外一门Web开发相关语言 (PHP/Java/Ruby/Python) 4. 对表现与数据分离, 模块化, 组件化有所理解 5. 向开源社区贡献过代码，GitHub等相关网站技术分享活跃者优先 6. Node.js经验者优先 7. 有React/AngularJS/VueJS等相关经验者优先 技术素养要求：1.了解坚持和固执的区别2.有和非开发人员进行沟通协作的良好能力，遇到问题避免情绪化，理性沟通，结果导向 3.理性对待任何技术决定，能够通过量化和客观的数据对不合理问题进行反驳并提出改进方案 4.享受coding，对技术有热情，关注技术发展方向企业诱惑：哈佛博士后领导班子（CEO和CTO）、大牛团队、扁平化管理、弹性工作制、极少加班、地铁周边、Mac办公","电商,企业服务",150-500人,php,苏州
高级java开发工程师（苏州）,https://www.lagou.com/jobs/7208806.html,吴中区,10k-20k,苏州工业园区凌志软件股份有限公司,5-10年,不限,上市公司，待遇优渥,职责描述：1. 参与新项目框架的搭建、负责公司后台产品开发、编写软件产品中的相关模块和算法的程序；2. 参与功能设计与数据库设计、负责系统架构设计、性能优化和产品研发工作3. 负责软件项目的设计、开发以及单元测试工作；4. 按项目管理规范要求编写相关文档，准确描述和解释业务需求、解决方案；5. 参与相关质量活动，确保软件设计及实现按时保质完成；6. 负责难题解决和技术攻关；岗位要求：1. 精通Java语言和面向对象设计方法，熟练掌握JSP、Servlet、JDBC等技术；2. 熟悉PHP、C#、.NET语言常用框架及方法3. 有完整参与大型项目经验者优先；4. 为人正直，待人真诚，良好的团队合作意识；5. 能吃苦耐劳，有良好的学习能力和合作意识；,金融,2000人以上,php,苏州
工业互联网软件开发工程师,https://www.lagou.com/jobs/7173694.html,工业园区,8k-16k,江苏确安工业技术服务有限公司,不限,本科,开创一体化工业互联网服务,"1.   公司简介：定制工业服务解决方案确安工业服务于2011年成立于南京，主要业务是向工业企业提供直接、间接物料，专业管理咨询和其它工业服务，目前主要客户在南京、上海和苏州，大部分客户为外资企业。为了实现公司的快速发展和业务转型，公司确定开发和利用互联网工业服务应用平台，更好更快地为制造企业，特别是中小型制造企业服务：Ø  提供全流程的物料管理解决方案Ø  提供有关生产成本、节能降耗、产能提升和设备可靠性方面的专业咨询2.   职位说明：每个成员都是核心团队，只是分工不同，主要职位包括互联网项目/产品经理、Andriod和iOS系统工程师，架构师，UI设计工程师，后台和前端技术开发工程师，主要职责包括：Ø  负责和团队成员一起研发、开发和实施整个平台和相关的应用Ø  负责协调项目进度，控制预算Ø  负责平台用户、客户和供应商的系统对接3.   期望特质：正直诚实，具有创业勇气，刻苦钻研，积极主动，结果导向，团队合作4.   教育和工作背景：Ø  大学本科以上，计算机软件、信息工程、物联网相关专业Ø  熟悉Android，或iOS开发, 或JAVA, 或PHP, 和数据库SQLØ  有APP开发，ERP、CRM、MES、任务和OKR系统开发或实施经验优先5.   薪资参考：底薪+股票期权+项目奖金 核心价值观Ø  信任和承诺：我们是一个创业性组织，信任是一个组织为了实现共同目标的开始，承诺积极有效的沟通，提供公正平等的机会，和每个人分享利益Ø  成就和责任：团队的成就来自于每个人的成功和失败的分享，时刻保持奋发进取之心，互相帮助，团队协作，并积极履行社会责任Ø  安全和合规：确保每个人的健康和安全，保护我们的环境；遵循商业道德，并始终恪守正直诚实的经营之道Ø  创新和客户：敏锐洞察客户的需求和环境的变化，不断创新，为客户和合作伙伴的满意和成功持续不断地改进，才是可持续发展之道","企业服务,软件开发",少于15人,php,苏州
