job_name,job_url,job_location,job_salary,job_company,job_experience,job_class,job_given,job_detail,company_type,company_person,search_key,city
后端架构师（go语言方向）,https://www.lagou.com/jobs/7160218.html,南山区,20k-25k,深圳市泰创网络科技有限公司,3-5年,大专,公司重点项目，年终分红,职位描述：1、软件系统架构设计经验；2、对数据模型有感知能力，有一定的运维能力，对业务有一定的理解能力；3、采用Go语言(Golang)开发稳健可扩展的后端程序；另具备一门其他语言编码能力，如Java，JS，Python，OC，Dart等；4、理解多种编程模型与范式，理解代码执行环境底层原理；5、小到局部编码，大到系统设计，都有一套可提炼的实战经验与方法论；6、热爱开源框架与新技术，热衷研究分析源码，熟练使用主流web开发框架；有Github开源作品/个人Blog优先考虑；7、数据结构，算法与操作系统知识基本功扎实；8、学习能力与沟通能力强，富有极客精神，善于技术分享，乐于培养新人；9、熟悉Redis、MySQL开源库；熟悉Linux操作，具备一定Shell脚本开发能力10、熟悉TCP、HTTP等常用协议，熟悉MySQL操作及其性能优化。,软件开发,少于15人,go,深圳
高级Go开发工程师,https://www.lagou.com/jobs/7145149.html,南山区,20k-25k,青牛智胜（深圳）科技有限公司,3-5年,本科,年终奖金 餐饮补贴 周末双休 五险一金,岗位职责 1、负责系统核心代码编写，对技术的关键指标进行优化和提升；2、负责提升系统性能和交付质量；3、能主动发现问题并解决问题。 岗位要求：1、本科或以上学历，计算机软件或相关专业，3年以上相关经验；2、熟悉Linux开发环境，精通Go，精通Linux网络编程、多线程编程，有高性能、大并发后台服务开发经验者优先；3、熟悉MYSQL或其他大型数据库，熟悉NoSQL数据库应用经验； 4、熟悉互联网技术解决方案，熟悉微服务/分布式系统设计和开发，有中大型互联网系统开发经验优先； 5、有较好的沟通和业务理解能力，乐于解决具有挑战性的问题，善于跟进新技术的发展。,人工智能,50-150人,go,深圳
Go开发工程师,https://www.lagou.com/jobs/6755992.html,南山区,20k-30k,深圳达实智能股份有限公司,1-3年,本科,福利好、上市公司,岗位职责1、负责公司物联网网关的应用软件开发；2、负责系统核心代码编写；3、维护现有网关软件。任职资格1、本科及以上学历，计算机相关专业；2、2年以上开发经验，一年以上Golang/C++开发经验，熟悉Go的语言特性；3、 熟练掌握数据结构、多线程编程以及常用的设计模式；4、 熟练掌握常见NoSQL存储，如：Redis、mongodb等；5、掌握Modbus、Bacnet、MQTT等常见工业/物联网协议；6、 熟悉容器技术原理；7、 熟悉Linux操作系统；8、 强烈的责任心，对技术充满热情，高效率，良好的沟通能力，有工业物联网网关项目经验者优先。,其他,500-2000人,go,深圳
高级Go语言开发工程师,https://www.lagou.com/jobs/7191338.html,龙岗区,15k-25k,深圳理想动力信息技术有限公司,3-5年,大专,十三薪 弹性工作 年终奖金 节日福利,技能要求：GO，Python，Web前端，Golang，Linux职位概要：1.负责公司日常数据报表开发；2.根据公司市场发展情况进行未来规划（如BI数据分析、数据埋点等）；3.根据运营需求进行一定级别的定制化需求开发，提升运营工作效率；工作内容：1.带领组员完成日常数据报表脚本的开发及数据的统计等工作；2.能从多维度进行业务指标运营分析，指导和支持业务发展，高效解决实际业务问题；3.能够快速响应对接第三方平台，开发脚本同步数据；4.协助运营人员对接各平台活动数据，针对现有平台数据进行二次开发，不断满足运营需求；5.具备一定的管理能力及技术前瞻，能够获得团队内外一致认可；技能要求：1.1.大专以上学历，熟悉`go`语言，基础扎实，1年以上`go`开发工作经验，有完整的项目经验 ；2.同时熟练掌握php/python任意一门语言者优先；3.熟悉Golang协程，精通channel和锁，对高并发、高可用架构系统有正确、深刻的理解，有分布式服务设计或开发经验者优先；4.有Web开发经验，对RESTful概念有清晰的理解，并至少有一次web开发项目中运用到；5.熟悉xml/json/protobuf等至少任意一种网络通信技术和数据交换格式；6.熟悉MySQL、Redis、ES、Linux、Mq；7.对技术有激情，喜欢钻研，能快速接受和掌握新技术，学习能力和工作责任心强，良好的沟通表达能力和团队协作能力；,电商,150-500人,go,深圳
后端开发工程师（go）,https://www.lagou.com/jobs/5804920.html,南山区,15k-30k,广州国音智能科技有限公司,不限,本科,"大牛多,人工智能,IDG领投,技术创新",职位描述：1、负责后端程序的架构设计和优化；2、负责后端新需求的系统设计和实现。任职资格：1、本科及以上学历，有1-7年的互联网后端开发经验；2、精通Golang、Python中至少一门语言，能够熟练使用业务语言快速实现需求；3、良好的文档编写能力和故障排查能力，工作细心，较强的责任感和抗压能力；4、有过复杂系统开发经验优先，如ERP/CRM/电商订单管理类业务等；5、熟悉人工智能领域者优先。,移动互联网,150-500人,go,深圳
C++/Go/Java开发工程师,https://www.lagou.com/jobs/7172969.html,南山区,15k-30k,广东其龙环境科技产业有限公司,3-5年,本科,大牛带队 带薪年假 优质福利 六险一金,视频GO/C++/Java开发工程师工作职责负责视频APP后台架构设计和功能开发；负责视频极速版后台架构设计和版本迭代。工作要求本科及以上学历，计算机、通信及相关专业背景；2年以上开发项目经验，至少2年的Java/GO/C/C++开发经验；深入了解TCP/UDP协议，进程间通讯编程，熟悉各类服务器架构并能合理的应用；对系统的瓶颈、业务扩展性，有比较强的把控能力；有海量服务器开发经验优先,"移动互联网,其他",2000人以上,go,深圳
go语言工程师,https://www.lagou.com/jobs/6580277.html,南山区,15k-30k,深圳梨享计算有限公司,3-5年,本科,腾讯系团队，联想投资，港科大重点项目,岗位职责:1. 雾计算及P2P-CDN调度系统研发与维护2. 关键雾计算后端平台与服务的开发及对应的基础业务运营3. 容器技术在雾计算/边缘计算领域的最佳实践任职要求1. 熟练掌握Go/Golang2. 熟悉微服务，具有高并发系统经验3. 熟悉Linux环境与Shell脚本编写4. 熟悉容器技术及K8s，具备Docker及Kubernetes的二次开发或扩展能力5. 加分项：参与过开源分布式数据处理系统（如 MapReduce、Spark、Ray）开发6. 加分项：具有大规模容器平台开发经验者优先7. 加分项：熟悉通用的算法与数据结构，有参加ACM/ICPC、数学建模、电子设计等竞赛经验者优先8. 强学习力、自驱力与责任心、主人翁意识，有使命感者更佳,软件开发,15-50人,go,深圳
go开发工程师,https://www.lagou.com/jobs/6752770.html,南山区,20k-28k,纳才（深圳）信息科技有限公司,3-5年,本科,五险一金 年终奖 下午茶 发展晋升,"职位诱惑：五险一金 +下午茶 +不限零食供应+晋升发展+团建+绩效奖金+年终奖职位描述：岗位职责:1、即时消息业务服务器的设计和开发维护;2、区块链支付业务的一些模块的设计开发和维护 ;3、和区块链的业务的服务器接⼝对接和开发。岗位要求:1、本科以上学历，计算机相关专业；2、3年以上后台开发相关的经验，熟悉golang或者c/c++语言，深刻理解后台开发的协程的 编程模式；3、熟悉mysql,redis,mongdb等常用的后台开发组件；4、熟悉TCP/IP协议等相关的知识，熟悉网络编程；5.有过单独开发项⽬的经验者优先。","移动互联网,区块链",15-50人,go,深圳
腾讯云运营开发工程师（PHP/GO）,https://www.lagou.com/jobs/5377044.html,南山区,25k-50k,腾讯科技（深圳）有限公司,5-10年,本科,核心服务、海量访问、前景广阔,"岗位职责:1、负责腾讯云CDN、网络加速等产品功能的需求分析及后台开发工作；2、负责腾讯云运营平台的开发工作；岗位要求：1、计算机相关专业，5年及以上互联网行业工作经验,有扎实的计算机理论基础；2、精通LNMP技术栈，或精通Go语言，自行设计过相关框架者优先；3、熟悉WEB架构，具备高性能、高可用和分布式系统的实践经验；4、具有较强的业务需求分析能力、问题定位能力，能够高效沟通；6、有出色的学习能力与饱满的工作热情，善于钻研新技术；5、具备Python/C++相关项目经验者优先；7、具备云服务后台开发经验者优先；",社交,2000人以上,go,深圳
腾讯_高级Java/Go技术平台开发工程师,https://www.lagou.com/jobs/6352869.html,南山区,20k-35k,腾讯科技（深圳）有限公司,5-10年,本科,技术大牛；互联网大厂；高薪福利多,工作职责：1、负责技术中台的建设、运营、及部分运维工作，为开发团队提供高效、可靠的公共基础框架、服务、组件、中间件平台等； 2、负责基础中间件平台（mq\cache\db\gateway\微服务\devops\容器平台等）的选型、设计、开发、高可用部署； 3、负责公共基础微服务（搜索、通知、流程、权限、事件、队列、调度、语音等）的选型、设计、开发、高可用部署； 4、负责基础开发框架、功能组件、Java/Go SDK等的设计、开发及封装交付； 5、负责所建技术中台的使用指引、辅导、培训，深入对接开发团队的技术需求，迭代交付中台能力。岗位要求：1、计算机相关专业本科及以上，5年以上相关经历； 2、熟练掌握Java或Golang中的至少一种； 熟悉SOA、微服务体系（SpringCloud或Istio优先），熟悉SpringBoot、NIO、高并发、分布式锁等知识优先； 3、熟悉Redis、MQ、ELK、Nginx等中间件的使用、特性、及高可用方案；熟悉MySQL数据库，具有一定的数据库设计及调优经验，熟悉VUE、有前端经验者优先； 4、熟悉Docker容器、Kubernate平台的基本使用，对应用镜像构建、发布、运行、更新的全生命周期有清晰的理解； 熟悉Linux操作系统，熟练掌握常见安全、调优配置，及追查分析问题的操作命令； 5、有一定的架构设计思维，有良好的软件工程规范； 有公共平台型产品的建设经验者优先； 6、有清晰的逻辑思路，善于分析问题、解决问题，能掌握前后端完整链路的各环节者优先； 善于沟通、善于学习，为人踏实、不浮躁者优先。,社交,2000人以上,go,深圳
ServiceByShopee资深Go开发工程师,https://www.lagou.com/jobs/7137761.html,南山区,30k-50k,深圳虾皮信息科技有限公司,3-5年,本科,大牛多，氛围好，外企，福利好,"业务描述：SBS（Service By Shopee）服务于”Shopee自营“和”Shopee代商家运营“两种业务模式，由PMS（采购管理系统，服务于内部运营人员）和SRM（供应商门户，服务于供应商）承载。自2018年起已覆盖供应链供应商管理，商品管理，采购管理，出入库管理等流程，并于2020年搭建结算管理流程以形成一体化综合服务平台，使得供应链得以更好为商家和Shopee电商赋能。SBS产品不仅需要具备供应链的综合性业务知识，更需要对Shopee复合型电商模式的有全面的理解，如何将这两者整合成一个易用的产品，是对这个团队最大的挑战。技术责任描述 ：
 负责SBS项目的开发建设和规划，保证项目质量和进度；
 负责根据项目计划制订开发计划，分配开发资源，负责与产品，测试，开发就项目需求、进度和问题进行沟通，推动问题解决；
 负责对技术方案的把控，以及跟进研究业界动态，推进新技术的落地实施；
 负责核心模块的设计和开发；
 负责优化和改进研发流程，提高开发人员的效率；
 负责团队培训、相关人员的管理。
任职要求：
 计算机及相关专业，本科以上学历，五年及以上全职开发工作经验；
 扎实的编程基础，良好的代码风格，精通常用的软件工程方法，设计模式，数据结构和算法；
 精通Go语言，有一年以上Golang项目开发经验，熟悉Python优先；熟练掌握IO、多线程、gRPC等基础框架；
 对MySQL，Redis等存储系统有深入理解，熟悉Rabbitmq，Kafka等消息系统，能够熟练使用消息系统进行系统解耦；
 有组建和管理小型开发团队、技术选型、构架定制等经验；
 对企业应用的架构和系统架构有独到的认识，了解不同架构方法的适应性和优缺点；对系统的高可用和高复用有一定的经验和理解；
 以结果为导向；善于思考，能独立分析和解决问题；责任心强，具备良好的团队合作精神和抗压能力；要有创业的激情和坚定的信念；
 有物流业务业务开发背景优先;
 具有一定的产品敏感度，能够把握产品的需求价值，结合产品研发给出详细的技术方案。",电商,500-2000人,go,深圳
GO语言高级开发工程师,https://www.lagou.com/jobs/7103902.html,宝安区,20k-40k,深圳市星际大陆科技有限公司,3-5年,本科,国际化、前景好、高成长、领导棒、年轻化,岗位职责：1、完成基于go/redis/mysql等技术的服务器端API开发2、负责项目的设计、编码、调优、测试及Bug处理3、负责产品服务端开发，不断进行产品演进，提高产品质量和用户体验4、据产品需求，写出良好的解决方案职位要求：1.至少三年(含)及以上golang开发经验；2.熟悉goroutine、channel、mutex、syncmap、cgo等， 有高并发、了解go底层源码优先 ；3.熟练使用包管理工具go module；熟悉mysql、postgresql、redis、prometheus等； 4.了解分布式链路追踪，有良好的算法基础、一定的架构设计能力；5.有大规模分布式系统开发经验优先，了解分布式常用算法；6.有框架开发 / 基础工具、高性能组件、分布式/微服务架构设计开发者 / 开源项目代码贡献经验优先。有个人github开源项目尤佳(如有，请提供github地址)；7.能抗压、踏实稳重，责任心强，有担当，执行力强。,"移动互联网,硬件",50-150人,go,深圳
Go语言开发工程师,https://www.lagou.com/jobs/7103876.html,宝安区,15k-20k,深圳市星际大陆科技有限公司,1-3年,本科,国际化、前景好、高成长、领导棒、年轻化,职责描述：1、完成基于go/redis/mysql等技术的服务器端API开发2、负责项目的设计、编码、调优、测试及Bug处理3、负责产品服务端开发，不断进行产品演进，提高产品质量和用户体验4、据产品需求，写出良好的解决方案任职要求：1、大学本科以上学历，熟悉`go`语言，基础扎实，1年以上`go`开发工作经验，有完整的项目经验 2、有Web开发经验，对RESTful概念有清晰的理解，并至少有一次web开发项目中运用到3、熟悉Golang协程，精通channel和锁，对高并发、高可用架构系统有正确、深刻的理解4、熟悉mysql、redis等中间件，熟悉数据结构设计和SQL调优5、有灵敏的技术嗅觉，能够独立解决问题，具备清晰的思维和良好的沟通能力6、有钻研精神，对技术充满热情；有团队合作精神7、有高性能、大并发后台服务架构设计和开发经验者优先,"移动互联网,硬件",50-150人,go,深圳
Go研发高级工程师 — 基础架构,https://www.lagou.com/jobs/6720339.html,南山区,20k-40k,北京字节跳动科技有限公司,3-5年,本科,六险一金,,文娱丨内容,2000人以上,go,深圳
Go/c/c++/后端工程师,https://www.lagou.com/jobs/7177336.html,福田区,20k-35k,广东思哲网络科技有限公司,3-5年,不限,周未双休，法定节假日，薪资待遇从优,岗位职责1. 参与公司项目需求分析及方案设计；2. 参与公司项目及产品的核心代码编写，并完成高质量的代码交付；3. 负责公司现有项目的维护及优化；4. 负责公司项目架构设计及实施； 岗位要求1. c/c++/go/一种或多种语言，熟悉设计模式，数据结构，了解多门语言者尤佳；2. 精通Socket、网络通讯、Redis缓存等技术；3. 精通Linux操作；了解以下内容者或具备相关能力者优先：1. Github活跃用户或技术博主；2. 消息队列、容器docker技术、缓存、负载均衡、API网关、微服务、分布式事务、网络安全等技术的原理、应用或优化；福利待遇：1、周未双休，法定节假日；2、午餐补贴；3、购买社保；4、丰富的员工活动；5、快速晋升的机会上班地址：深圳市福田区沙头街道京基滨河时代大厦a座1502,"硬件,软件开发",15-50人,go,深圳
后端开发（c++/go）,https://www.lagou.com/jobs/6883322.html,南山区,15k-30k,拉勾猎头,1-3年,本科,鹅厂,﻿1、负责腾讯音乐相关产品后台工作； 2、负责中大型项目的后台server软件架构和整体框架设计； 3、负责提出海量服务的解决方案，寻找高并发高负载服务应对策略； 4、负责Linux下面的C/C++系统以及数据库应用的设计和开发，要求开发的系统具有高性能和高可靠； 5、参与相关产品需求讨论与产品系统架构的设计和优化工作。 1、本科及以上学历，至少2年以上相关开发经验； 2、掌握C/C++/Go等编程语言中的一种或几种，并有实际的项目开发经验，熟悉Linux下的网络编程及常用的系统编程知识，熟悉互联网应用协议； 3、了解并使用过KV存储，如Redis，了解MySQL及其相关开发； 4、具有良好的分析解决问题能力，能独立承担开发任务，有一定的项目进度把控能力；5、责任心强，良好的沟通和团队协作能力，主动，好学； 6、拥有扎实和体系完备的计算机专业知识，有互联网高并发、高性能、分布式系统设计和开发经验者优先； 7、有直播或者支付后台开发经验者优先 ﻿,"移动互联网,企业服务",500-2000人,go,深圳
GO开发实习生 (MJ000297),https://www.lagou.com/jobs/6223602.html,南山区,4k-6k,深圳追一科技有限公司,应届毕业生,本科,高速发展机遇，个人成长,"岗位职责：1. 负责算法平台的功能设计与实现2. 负责算法平台部署方案开发与实现岗位要求：1. 本科及以上学历，计算机或相关专业2. 熟悉linux操作系统, 熟悉go语言,熟悉beego开发框架,有python/java开发经验优先3. 熟悉Mysql,Redis,MongoDB等数据库或缓存技术4. 有Elastic Search，Hadoop, Spark 等大数据工具使用经验优先6. 有Docker技术及Kubernetes容器调度系统，有容器化经验优先7. 技术视野开阔，有强烈的上进心和求知欲，善于学习和运用新知识8. 善于沟通和逻辑表达，良好的团队合作精神和积极主动的沟通意识","移动互联网,企业服务",150-500人,go,深圳
微服务架构师（GO/.Net/JS）,https://www.lagou.com/jobs/5943825.html,福田区,30k-50k,穆迪信息咨询（深圳）有限公司,5-10年,本科,外企管理双休不加班假期丰富花式员工活动,"The Role / Responsibilities:A Software Architect fulfils the following responsibilities with little to moderate guidance of more senior team members.·         Take ownership of stories and interpret business requirements for these stories with the assistance of Business Analysts.·         Provide feedback on requirements from a technical perspective, and provide estimates for user stories and tasks.·         Provide input into technical design, at the story and/or module level.·         Comply with coding standards.·         Collaborate with quality assurance engineers to fix defects.·         Collaborate with build and release engineers to prepare packages and solve environment issues.·         Investigate and find the root cause for software problems reported by clients.·         Maintain technical documents.·         Review code of Associate Software Engineers.Mentor Associate Software Engineers.Qualifications:·         Minimum Bachelor’s degree in Computer Science or related major from top institutions, Master degree is a plus. The graduated universities of candidate must be in top 50 in China mainland or Overseas colleges and universities.·         Deep understanding of Object Oriented design and development·         5+  years of professional software development experience on multi-tiered enterprise applications.·         Able to work well within the constructs of an agile development process, including SCRUM, Unit Testing, Continuous Build and Integration, etc.·         Willing to learn new technologies; capable of self-directed learning.·         Very good verbal and written communication skills·         Ability to handle multiple assignments concurrently and independently manage time·         Works well in a fast-paced team environment; able to work under pressure to meet tight deadlines·         Has superb analytical skills and persistence in problem solving.·         Experienced in Programming Languages: C#, Go/Golang, Javascript·         Experienced in Development tools: Visual Studio, Visual Studio Code etc.·         Experienced in Development Platforms: Microsoft Windows, Linux.·         Experienced in Application Servers: IIS.·         Experienced in Application Frameworks & Engines: .NET Core, ASP.NET MVC, ASP.NET WEB API, Entity Framework/Entity Framework Core.·         Experienced in Databases: SQL Server, MongoDB, Redis etc.·         Experienced in Others: Git .·         Experienced in Restful API design and development.·         Familiar with micro-service development process is a plus.·         Familiar with the container and container management platform is a plus, such as Docker/K8s.","企业服务,金融",2000人以上,go,深圳
GO语言开发工程师,https://www.lagou.com/jobs/6972973.html,南山区,15k-30k,深圳皇同管理咨询有限公司,3-5年,大专,发展前景 薪资待遇,1、熟悉golang开发，2年以上实际项目经验；2、精通linux/unix网络编程、多线程编程；3、逻辑思维能力强，有较强的分析定位问题的能力；4、掌握mysql、redis或其他数据库，能够独立设计数据库表格并优化数据库语句；5、统招大专及以上学历，具有2年以上互联网服务端开发工作经验。,软件开发,15-50人,go,深圳
腾讯视频GO/C++后台工程师（深圳,https://www.lagou.com/jobs/6912829.html,南山区,20k-40k,腾讯科技(北京)有限公司,3-5年,本科,大厂 海量数据 完善的福利体系 培训体系,岗位职责：负责腾讯视频app移动后台的设计与开发； 负责腾讯视频弹幕、直播服务等系统的设计与开发； 负责腾讯视频看单、push等系统的设计与开发。岗位要求：本科及以上学历，计算机、通信及相关专业；2年以上开发项目经验，至少2年的GO或C/C++开发经验；深入了解TCP/UDP协议，进程间通讯编程，熟悉各类服务器架构并能合理的应用；对系统的瓶颈、业务扩展性，有比较强的把控能力；有海量服务器开发经验优先。,移动互联网,2000人以上,go,深圳
go开发工程师,https://www.lagou.com/jobs/6844608.html,南山区,20k-40k,腾讯科技（深圳）有限公司,3-5年,本科,大平台 福利待遇优厚,岗位职责：负责公司级研发及运营平台的开发，致力于提升公司在具体领域内的研发及运营效率，服务于公司所有研发&运维人员，涉及的内容包括软件源、配置中心等；负责研发效能相关平台的研发，致力于提升基础的研发效率，涉及的内容包括CI、发布、监控、日志数据平台等；负责运营体系、运营平台的建设，致力于提升部门业务的运营效率、运营质量。岗位要求：精通Unix/Linux操作系统、Bash、C/C++，良好的编码规范； 具备2年以上开发经验，至少熟悉1种开发语言：PHP、Java、Rubby、Python、Perl； 具有良好的学习能力、沟通能力、服务理念和合作精神； 强烈的责任心与主动性，对所负责工作有owner意识，并能自我驱动成长； 有数据仓库建设经验，熟悉python和web前端开发优先； 有运维自动化、监控系统、发布系统、运营支撑系统等开发经验者优先； 有大型分布式系统设计与开发经验者优先；,社交,2000人以上,go,深圳
