job_name,job_url,job_location,job_salary,job_company,job_experience,job_class,job_given,job_detail,company_type,company_person,search_key,city
算法工程师,https://www.lagou.com/jobs/6459198.html,福田区,15k-30k,深圳交控科技有限公司,不限,本科,"轨道交通,六险一金，周末双休，行业发展好",工作职责：1、负责推荐系统架构服务开发及架构升级； 2、优化推荐系统性能.稳定性.架构可扩展性，保障算法策略模块快速迭代； 3、分析海量用户行为数据.内容资讯数据，增加有效的用户特征和内容资讯特征，改进模型和召回.排序策略，提升推荐效果；或者提出人工智能解决方案和模型岗位要求：1、本科及以上学历，数学或计算机相关专业，3年以上服务器开发经验。做过推荐系统或搜索引擎，有自然语言处理、机器学习、数据挖掘等相关经验优先； 2、精通Go、 Python、 C、 Java、熟悉基础数据结构和算法，熟悉常用软件设计模式，代码整洁； 3、熟悉推荐系统，并对常见的推荐算法有自己的理解； 4、熟悉常用数据结构，及分析算法，并有自已独到的理解及应用。5、精通高并发，低延迟服务设计，熟练掌握常用开源框架，至少熟悉两种NOSQL数据库 6、熟悉并行计算或者分布式计算，熟悉Spark.Storm等计算平台，有相关性能优化经验，并熟悉其上下游环境，包括Flume.Kafka.Hive.HBase等； 7、对数据敏感，分析数据，抽象问题，对于把大数据和人工智能分析的结果能够应用到实际业务场景产生商业价值具有强烈的热情。,其他,150-500人,人工智能,深圳
边缘芯片解决方案架构师,https://www.lagou.com/jobs/6916948.html,南山区,20k-40k,中科寒武纪科技股份有限公司,5-10年,不限,带薪年假 六险一金 节日福利,岗位描述：1.  基于寒武纪边缘智能芯片的商业能力进行行业解决方案设计、规划、实施并参与项目落地。 包括深入理解客户的业务场景、参与关键业务设计与优化，提供最优的解决方案，满足客户业务核心功能和性能的要求； 2.  确保重点项目的拆解和落地，推进项目实施以及解决方案可复制，推动跨部门合作，推动架构和产品优化；3.  根据行业特性，沉淀行业解决方案，以点带面占领市场；4.  结合项目，优化技术架构，根据客户核心诉求提出产品需求，推动研发团队提升产品体验；5.  了解行业技术发展变革方向，能够在行业解决方案上有前瞻性布局。 岗位要求：1. 本科或以上学历，微电子/电子/集成电路/通讯/自动化等相关专业优先考虑；2. 具备5年以上技术市场或解决方案架构/售前工作经验3. 熟悉有边缘计算落地场景的市场与客户， 有SoC芯片或者Sensor的解决方案架构师或者应用工程师岗位相关经验者优先考虑；4. 具备半导体芯片公司IC设计背景或者AE岗位工作经验的候选人优先考虑；5. 熟悉芯片应用的软硬件系统的候选人优先考虑；            6. 熟悉IC的设计验证制造流程，熟悉模拟电路和各种高速接口电路者优先考虑；7. 对人工智能/深度学习及其应用有深入了解和独到见解；8. 对人工智能芯片的上下游，包括供应链（代工厂，IP Vendor）以及客户（智能视频分析、云计算、教育）等有较深理解或认识;9.具有优秀的沟通技巧和团队协作精神、新技术学习能力，能够独立和客户进行沟通与 交流，并准确把握客户需求 ；,"硬件,数据服务",500-2000人,人工智能,深圳
电梯工程师,https://www.lagou.com/jobs/6899858.html,福田区,8k-15k,深圳天安智慧园区运营有限公司,5-10年,大专,国有控股企业、平台稳定、业务转型前景极好,岗位职责：1.收集、识别和传递国家有关特种设备安全管理方面的法律法规、技术规范和标准，并贯彻落实；2.负责特种设备安全使用和维护管理制度、流程和标准的持续改进和完善；3.审核各项目特种设备维护管理方案和计划，并监督实施；4.审核各项目特种设备维护、技改工程合同与报价、施工方案，参与相关工程质量监理和验收工作；5.制定特种设备职能检查计划，开展特种设备检查及安全评价，跟进、验证不符合项的整改落实；6.提供特种设备技术和管理咨询服务，解决相关技术问题，建立特种设备安全管理案例库；7.撰写特种设备技术和管理培训课件，提供有关技术和管理培训服务，建立培训课件库。任职资格：1.大专以上学历，机电、电气工程等相关专业；2.两年以上电梯工程安装和调试工作经验，五年以上电梯维护管理工作经验；3.具有助理工程师以上技术职称或高级电梯维修工及以上职业技术等级资格，并持有有效的特种设备作业人员证；4.熟悉国家相关政策法规和有关电梯工程的设计、施工及验收规范和标准；5.熟悉电梯检验流程、标准和内容，与政府相关部门及行业保持有良好的人际关系；6.能够熟练操作Office办公软件、AutoCAD绘图软件，文字处理功底扎实；7.掌握富士达等品牌电梯的疑难故障维修技术者优先。----------------------------------------------------------------林先生 Owen招聘主管天安数码城集团邮箱：***************电话：*************地址 : 深圳市福田区天安数码城（天安运营中心 5楼）（车公庙地铁站F出口）--------------------------------------------------------------------------------------------　　公司简介　　天安运营集团 　　深圳天安智慧园区运营有限公司（简称“天安运营”）成立于1994年，由天安中国投资有限公司（HK0028）与深业泰然（集团）股份有限公司合资组建，是一家以现代科技产业园区综合运营服务为核心业务的规模化、品牌化轻资产运营企业集团。公司肩负“运营智慧园区，成就客户卓越”的企业使命，倡导“简单、阳光、专业、创新”的企业文化，致力于成为“中国智慧园区运营服务领先者”。　　公司总部位于深圳，管理服务足迹覆盖到深圳、广州、东莞、佛山、上海、天津、重庆、常州、江阴、青岛、苏州、昆山等区域性中心城市和经济发展热点地区，设有20多家分子公司、员工超过2000人，管理面积超过1200万平方米，已陆续为超过10000家创新成长型企业提供一流的园区运营服务。2015年，公司在中国园区运营企业综合评比中排名第1。　　近年来，公司围绕园区服务平台搭建实施战略转型，践行人才高地战略、大力引进高端跨界人才，潜心打造“智慧园区管理应用系统”和“智慧园区运营服务体系”两大核心专长，聚焦客户需求，整合政商资源，引入新技术，跨界新业态，创新商业模式，提升服务层次，探索园区智能管理，实现从粗放型传统服务业向集约型现代服务业的转变，通过独特的智慧园区运营服务模式创建引领行业变革。　　天安运营潜心打造“智慧园区管理应用系统”和“智慧园区运营服务体系”两大核心专长，打造线上线下无缝衔接的高效产业园区O2O运营服务体系，搭建服务园区客户的金融服务平台、商务服务平台、人力资源服务平台、产品路演服务平台、政务服务平台、园区配套服务平台、物业服务平台。线下通过“园区运营服务中心”提供优质运营服务，带给园区客户优质服务体验，线上以智慧园区运营服务网（PC、Web、APP）为信息交互平台。线上线下并行，以园区的基础物业服务为基础，以互联网、物联网、大数据、人工智能等高新技术为工具，深度挖掘园区企业需求，为企业客户提供优质服务。　　伴随着新兴产业的崛起，天安正尝试于“物流园区”、“养老社区”等新兴服务运营领域进行探索与实践，进一步打开企业成长新空间，以创新探索、独树一帜的专业风范持续领跑业界。 　　　　　下面是我们的官方网站及关联企业的相关链接：　　【天安中国】 http://www.tiananchina.com/　　【天安数码城集团】 http://www.tianan-cyber.com/　　【天安运营】 http://www.tianan.net/　　【天安运营】 http://www.tianans.com/,"消费生活,其他",2000人以上,人工智能,深圳
开发组长,https://www.lagou.com/jobs/6956896.html,福田区,15k-30k,深圳天安智慧园区运营有限公司,5-10年,本科,国有控股企业、平台稳定、业务转型前景极好,"岗位职责：1、参与公司运营网、CRM系统、微信停车缴费系统开发工作；2、参与微信、BI门户、金蝶OA系统、门禁、视频监控、智能家居等第三方系统接口对接和定制开发。3、负责业务部门的需求沟通、对接、设计、前后端接口定义、编码研发；4、承担核心开发工程师职责，同时肩负开发团队Leader职责，具备独立开发和测试能力，并对上线后的项目承担监控及运维职责；任职要求：1、本科以上学历，计算机、软件工程等相关专业，4年以上独立研发经验；2、精通JAVA语言，并且有PHP开发经验，熟练掌握JSP，精通Maven使用，Git/SVN；3、掌握JVM性能调优、了解常见JVM垃圾收集算法、Java并发框架与库、了解Java内存模型；；4、熟悉J2EE模式，熟练掌握SSH或SSM开发框架，熟悉WebLogic/JBoss/Tomcat之一服务容器配置和优化；熟悉Linux操作系统，熟悉nginx、docker；5、熟练使用Oracle,Mysql，Sqlsever,Hbase等至少一种数据库；6、了解Html/Xml/CSS/Javascript/jquery/ajax/json 等前端开发技术，了解dubbo、微信开放平台API；7、具备强定位问题和解决问题的能力，一定的文档编写能力，能编写项目计划书/功能需求分析/设计文档/用户使用手册8、有电商、物联网、数据平台、物业管理等相关项目开发经验者优先；有独立的项目团队负责人负责人经验者优先；有敏捷开发时间、持续集成经验者优先；----------------------------------------------------------------林先生 Owen招聘主管天安运营集团地址 : 深圳市福田区天安数码城（天安运营中心 5楼）（车公庙地铁站F出口）------------------------------------------------------------------　　公司简介      天安运营集团　　深圳天安智慧园区运营有限公司（简称“天安运营”）成立于1994年，由天安中国投资有限公司（HK0028）与深业泰然（集团）股份有限公司合资组建，是一家以现代科技产业园区综合运营服务为核心业务的规模化、品牌化轻资产运营企业集团。公司肩负“运营智慧园区，成就客户卓越”的企业使命，倡导“简单、阳光、专业、创新”的企业文化，致力于成为“中国智慧园区运营服务领先者”。 　　公司总部位于深圳，管理服务足迹覆盖到深圳、广州、东莞、佛山、上海、天津、重庆、常州、江阴、青岛、苏州、昆山等区域性中心城市和经济发展热点地区，设有20多家分子公司、员工超过2000人，管理面积超过1200万平方米，已陆续为超过10000家创新成长型企业提供一流的园区运营服务。2015年，公司在中国园区运营企业综合评比中排名第1。  　　近年来，公司围绕园区服务平台搭建实施战略转型，践行人才高地战略、大力引进高端跨界人才，潜心打造“智慧园区管理应用系统”和“智慧园区运营服务体系”两大核心专长，聚焦客户需求，整合政商资源，引入新技术，跨界新业态，创新商业模式，提升服务层次，探索园区智能管理，实现从粗放型传统服务业向集约型现代服务业的转变，通过独特的智慧园区运营服务模式创建引领行业变革。　　天安运营潜心打造“智慧园区管理应用系统”和“智慧园区运营服务体系”两大核心专长，打造线上线下无缝衔接的高效产业园区O2O运营服务体系，搭建服务园区客户的金融服务平台、商务服务平台、人力资源服务平台、产品路演服务平台、政务服务平台、园区配套服务平台、物业服务平台。线下通过“园区运营服务中心”提供优质运营服务，带给园区客户优质服务体验，线上以智慧园区运营服务网（PC、Web、APP）为信息交互平台。线上线下并行，以园区的基础物业服务为基础，以互联网、物联网、大数据、人工智能等高新技术为工具，深度挖掘园区企业需求，为企业客户提供优质服务。　　伴随着新兴产业的崛起，天安正尝试于“物流园区”、“养老社区”等新兴服务运营领域进行探索与实践，进一步打开企业成长新空间，以创新探索、独树一帜的专业风范持续领跑业界。","消费生活,其他",2000人以上,人工智能,深圳
数据工程师,https://www.lagou.com/jobs/6623141.html,南山区,15k-25k,深圳格隆汇信息科技有限公司,3-5年,本科,金融 数据产品,岗位职责：1、负责公司大数据团队的各项管理工作，包过团队建设、技术指导、工作规划、管理等工作。2、负责公司产品的技术选型、架构设计，对公司整体技术平台负责；3、规划和设计大数据整体平台，包括：数据爬取，数据归集、数据仓库、数据分析、数据挖掘、数据服务、数据产品；4、与其他部门合作，提供数据分析、挖掘、建模等相关支持，共同完成公司产品的研发；5、保持与国际、国内同业及数据科学圈子的联系及交流，密切跟踪机器学习、人工智能、大数据、等领域的最新进展及实践情况；6、带领团队对技术难点进行公关；7、参与重大技术项目的决策，指导、审核项目总体技术方案。任职要求：1、3年以上数据相关工作，3年以上的团队管理经验，对数据敏感、对新技术敏感；2、对数据爬取，数据存储、数据仓库、数据分析、数据挖掘等整个大数据系统的架构有清晰的思路和落地执行的方案，对数据服务、数据产品的模式有清晰的理解，并能带领团队实施；3、熟悉编程语言，如：java、python、R、shell、SQL等；熟悉当前主流的开源数据平台和工具以及数据云服务，如：hadoop、hbase、Spark等；并具有hand-on能力；4、有激情，有强烈的事业心，合伙人心态。,"社交,金融",50-150人,人工智能,深圳
nlp算法工程师,https://www.lagou.com/jobs/7205240.html,南山区,30k-50k,苏州精正信息科技有限公司,不限,本科,技术大牛~技术氛围浓厚~风口行业~,岗位职责：  1、 参与/负责分词、命名实体识别、文本纠错等 NLP 基础组件的研发；2、 参与/负责智能质检、语音识别等项目的研发，包括但不限于意图识别、情感分析、语 义理解、倾向性分析等； 3、 针对语音自动转写文本，进行海量文本数据处理、清洗、转换等处理工作； 4、 配合后端开发人工智能数据服务，提供稳定、高可用性的智能服务； 5、 随时把握 NLP 前沿问题的研究，结合实际应用场景，提供技术解决方案；  岗位要求： 1、熟悉知识图谱、了解搜索的原理，熟练使用 ES，做过聊天问答机器人或者知识库搜索的 项目最佳。 2、有一年以上的工作经验，曾经独立上线过 nlp 相关的产品。,"企业服务,金融",少于15人,人工智能,深圳
nlp算法工程师,https://www.lagou.com/jobs/7205240.html,南山区,30k-50k,苏州精正信息科技有限公司,不限,本科,技术大牛~技术氛围浓厚~风口行业~,岗位职责：  1、 参与/负责分词、命名实体识别、文本纠错等 NLP 基础组件的研发；2、 参与/负责智能质检、语音识别等项目的研发，包括但不限于意图识别、情感分析、语 义理解、倾向性分析等； 3、 针对语音自动转写文本，进行海量文本数据处理、清洗、转换等处理工作； 4、 配合后端开发人工智能数据服务，提供稳定、高可用性的智能服务； 5、 随时把握 NLP 前沿问题的研究，结合实际应用场景，提供技术解决方案；  岗位要求： 1、熟悉知识图谱、了解搜索的原理，熟练使用 ES，做过聊天问答机器人或者知识库搜索的 项目最佳。 2、有一年以上的工作经验，曾经独立上线过 nlp 相关的产品。,"企业服务,金融",少于15人,人工智能,深圳
Java资深开发工程师,https://www.lagou.com/jobs/5104295.html,南山区,20k-40k,竹间智能科技（上海）有限公司,5-10年,本科,"扁平化管理,弹性上班,技术牛人","岗位职责：1.负责人工智能产品平台的后台开发工作，包括需求分析, 系统设计，编程和测试等；2.负责代码的开发于实现，解决开发中遇到的问题难点；3.持续改进系统架构，优化性能，提高服务质量，保障系统稳定、高效运行。  任职资格：1. 211/985本科及以上学历，计算机相关专业；2. 5年以上Java开发工作经验，具有扎实的编程功底，理解集合、多线程、IO等基础框架；3. 熟悉Oracle、SQL Server、MySQL至少一种或多种数据库技术；4. 熟悉分布式服务架构包括且不限于Spring Boot, SSM, Dubbo, Spring Cloud等等；5. 熟悉业界内常用的开源工具，并在不同项目中有实际使用；6.具有比较强的问题分析和处理能力，有比较优秀的动手能力，拥有良好的规范意识，追求编写优雅的代码，能适应AI快节奏高强度高压的工作特点。 AI的大趋势才刚开始。竹间现在快速成长中，寻求对AI有兴趣和热情的人才，一起加入在万亿产值的巨大AI机会中创造价值！ 你不安于现状，想要闯一闯，挑战新技术新应用吗？在AI的浪潮中发挥你聚集多年的潜力吗？你有具备解决问题的长才，想要在AI领域试试身手吗？你想要挑战将人工智能应用到各行业的场景中吗？产业创造价值的精英欢迎一起加入！ 竹间秉持以人才定岗位。寻找资深个人贡献者以及 能带团队的 leader。","移动互联网,其他",150-500人,人工智能,深圳
售前顾问,https://www.lagou.com/jobs/5885968.html,南山区,20k-40k,竹间智能科技（上海）有限公司,5-10年,本科,"高效团队,发展前景大,带薪年假,期权激励",职位描述：岗位职责：1.    将前沿的人工智能技术，结合到真实的业务场景中，实现人工智能+服务的模式。2.    根据市场、客户对于人工智能的理解，针对行业客户设计出场景化的解决方案，实现人工智能在行业的价值体现。3.    完成公司人工智能技术的产品包装，将方案和产品推广到市场，在客户方实现AI产品的价值。4.    将人机交互、智能对话系统、图像识别、语音识别、自然语言理解、情绪识别等人工智能的技术应用到客户业务场景中，解决客户业务流程中的问题。5.    负责公司人工智能方案和产品的宣讲。任职要求：1.    计算机或相关专业，本科及以上学历，3年以上的软件或解决方案售前咨询经验。2.    具有人工智能相关知识，学习能力强。3.    较强的沟通能力、协调能力和团队协作能力。4.    较强的文档撰写能力，演讲能力和演示能力。5.    具有售前咨询和相关工作经验者优先。,"移动互联网,其他",150-500人,人工智能,深圳
行业销售总监,https://www.lagou.com/jobs/6925319.html,南山区,20k-25k,广东星舆科技有限公司,5-10年,本科,人工智能 股权激励,30w-40w/年，期权职位描述：1、调研高精度定位、高精度地图应用/解决方案在各行业中的市场机会，开发客户；2、行业核心客户关系的建立、维系和提升，做好中高层客户关系，推进销售落地；3、行业应用销售团队建设及发展。任职要求：1、理工科背景本科及以上学历，熟悉高精度定位、高精度地图产品；2、8年以上汽车/消费电子软硬件系统集成、人工智能、物联网、智慧城市、测绘、地理信息、通信等行业销售工作经验，有一定行业资源；3、热爱销售工作，对高精度定位、高精度地图应用领域有热情及推广意愿，能有效发掘行业客户应用机会，建立合作关系；4、人格成熟，职业素养佳，工作积极主动，具备较强的沟通协调能力、人际影响力、客户关系管理能力，能承受较强的工作压力，接受出差。,"移动互联网,数据服务",50-150人,人工智能,深圳
软件测试工程师,https://www.lagou.com/jobs/6800492.html,南山区,15k-30k,珠海凡泰极客科技有限责任公司,3-5年,本科,"金融科技,前沿,有挑战","职位描述：金融科技团队，寻找富有质疑精神、推理能力、工程师文化的测试，负责产品的自动化测试和验收，能从细节中发现魔鬼，促进产品质量的提高。 岗位职责参与研发一个有高度金融行业针对性的科技平台，结合通讯协同技术与人工智能，解决交易、交流、内容、服务与产品、合规监管多要素的一体化，并构建行业生态圈，连接投资者、金融机构与开发者社区，促进多元化的业务创新，让下一代金融服务的智能化、自动化成为可能。本岗位有以下职责：- 质量保证，与开发、运维团队紧密配合，发现bug及时与开发沟通，保障线上服务的可靠性、可用性- 案例设计，根据设计文档编写并执行测试案例，给出具有上线参考意义的测试报告- 自动化测试，利用自动化测试技术，完成单元级别、API级别、端到端(E2E)级别的自动化测试- 测试流程设计，设计和实现适合开源社区的自动化测试流程，并推动开发团队遵守- 性能评估，与研发团队紧密配合，正确评估系统性能，并定位出系统的性能薄弱点- 稳定性保证，为系统引入Chaos monkey，评估系统的高可用性和薄弱点职位要求本职位对候选人在测试技巧和工程能力两方面都有巨大挑战，我们期望应聘者：1. 扎实的测试能力，对业务理解有独到之处，能够洞悉业务细节，根据产品设计文档写出较全面的case2. 具体基础知识。您深刻掌握了某种技术的原理，例如常用系统的操作工具：linux命令/shell脚本/sql语句；或者一些测试工具，例如jmeter/loadrunner；又或者一到两项编程语言，例如Python/Java/Golang/C/C++；并对开源测试框架的发展动态了如指掌。其他如面向对象设计、函数语言的基本原理等等基础技术“功底”，我们认为也非常重要。3. 有较学习能力, 对于新技术和生态具有强烈好奇心和持续关注的热情4. 交流沟通能力强，能积极参与项目讨论。我们鼓励团队成员大量阅读（不一定只是技术书籍，谁说历史哲学不能触类旁通），鼓励写作发表技术文章以及在各大峰会演讲。最起码您得逻辑地归纳总结和描述一个问题，并逻辑的描述它的解决方案；5. 其他加分项。例如熟悉docker、k8s等虚拟化技术、设计过Chaos monkey、参与过开源项目、写过一些关于自动化测试的技术博客文章… 具体不限，我们愿闻其详6. 知识面。如果您尝试过Electron及Nwjs等跨平台客户端框架，我们非常迫切希望跟您交流 注：****，支持**远程办公","金融,社交",50-150人,人工智能,深圳
平台数据方向产品专员,https://www.lagou.com/jobs/7097589.html,南山区,10k-15k,深圳羚羊极速科技有限公司,1-3年,本科,平台好 福利好 五险一金 双休,岗位职责：1. 负责设计视频图像识别分析系统的数据指标体系，并跟进开发、测试、验收的全流程；2. 关注重点客户的运营数据，定期输出和分享分析报告，提升团队的数据感知力；3. 收集和理解客户的算法个性化调优需求，结合线上数据，为研发提供调优建议，并为最终结果负责；4. 参与其他平台数据运营类功能需求的设计，如物联网运营平台、实时大屏、BI工具等。岗位要求：1. 全日制本科及以上学历，1年以上平台类/数据类产品设计经验，具备人脸识别、数据分析领域知识者优先；2. 熟练掌握数据分析工具（Excel、Python等）和方法，产品原型设计及文档能力过关；3. 了解数据开发、客户端开发、后端开发的基本逻辑和技术原理，能与研发高效沟通；4. 对物联网、云服务、人工智能等新兴领域的产品及技术有较强的兴趣及理解力。,移动互联网,150-500人,人工智能,深圳
