job_name,job_url,job_location,job_salary,job_company,job_experience,job_class,job_given,job_detail,company_type,company_person,search_key,city
浙大诚聘 web开发项目经理,https://www.lagou.com/jobs/6435965.html,西湖区,16k-25k,浙江大学,5-10年,本科,五险一金、绩效奖金、带薪年假、周末双休,岗位职责：1、负责系统及相关产品需求分析及架构设计；2、对产品的整体系统架构负责，对产品的系统安全性设计负责，开发及相关设计文档编写；3、负责相关请求的技术分析，负责制订相关的技术解决方案；4、参与制定设计及实现规范，指导设计、实现及部署工作；5、负责对软件开发团队的日常管理和技术指导。任职要求：1、软件工程、软件开发相关专业本科及以上学历，5年以上开发经验；2、具有独立承担超过2年以上的软件项目系统分析和架构设计经验，有成功案例、大型系统软件架构设计经验优先；3、掌握软件工程理论，了解或精通CMMI标准体系、DO178B/C标准体系；4、熟悉JAVA体系架构，精通主流的开源框架如（Spring+SpringMVC+Mybatis、SpringBoot、SpringCloud等） 和开发工具如（Myeclipse、ideal等）；5、精通Mysql等数据库的应用，具有相关应用开发经验及数据库规划能力；6、熟悉Axture等软件原型设计工具，能够独立进行软件产品原型设计和开发；7、逻辑分析能力、学习能力和创新能力强，具有团队合作精神，良好的语言表达及沟通能力。应聘基本条件:1、遵纪守法，具有高度的责任心、较强的团队合作精神以及良好的协调与沟通能力，道德品质良好；2、专业基础知识扎实，外语读写能力较强；3、具有较强的创新意识和分析问题、解决问题的能力；4、提供详细的个人简历（含教育经历、项目经历、工作经历等）；5、身心健康。岗位待遇:1、提供有竞争力的薪酬待遇，完善的社会保险、住房公积金等；2、提供完善的福利保障，员工食堂（午餐补贴）、带薪年假、各类福利津贴等；3、完善的员工职业发展体系和培训体系；4、丰富多彩的员工集体活动，如各类文体活动、集体疗养、年终联欢等。,教育,15-50人,web,杭州
浙大诚聘 web开发后端工程师,https://www.lagou.com/jobs/6290568.html,西湖区,12k-16k,浙江大学,3-5年,本科,五险一金、绩效奖金、带薪年假、周末双休,岗位职责：1、负责软件功能模块的设计和开发实现；2、负责相关开发文档的编写工作；3、负责解决开发过程中的技术问题。任职要求：1、计算机相关专业，统招本科以上学历，三年以上JAVA语言后端研发经验；2、有良好的沟通协调能力和团队合作精神，具备快速学习新产品和技术知识的能力；工作积极主动、能承受较大的工作压力；3、熟悉JAVA常用设计模式（单例模式、工厂模式、工厂方法模式、职责链模式、外观模式等）并有JAVA相关常用设计模式的实践经验；熟悉常用数据结构；4、熟悉常见的JAVA技术框架（spring、springmvc、mybatis、spring boot），了解springcloud架构体系，有spring cloud或dubbo开发经验者更佳；5、熟悉maven并具备丰富的使用maven工具进行研发的经验；6、了解activiti工作流引擎技术知识，具备设计和实现流程的相关经验；7、有丰富MySql数据库开发和优化经验，对数据库工作原理有较深刻的了解；熟练使用nosql数据库（redis）；8、熟悉Tomcat等一种以上服务器的部署和配置和调优，了解Nginx负载均衡配置；9、了解Rest API接口设计方法和使用经验；10、具备独立负责某个模块的设计和编码实现的能力；11、具备高并发和大型分布式系统开发经验者优先。应聘基本条件:1、遵纪守法，具有高度的责任心、较强的团队合作精神以及良好的协调与沟通能力，道德品质良好；2、专业基础知识扎实，外语读写能力较强；3、具有较强的创新意识和分析问题、解决问题的能力；4、提供详细的个人简历（含教育经历、项目经历、工作经历等）；5、身心健康。岗位待遇:1、提供有竞争力的薪酬待遇，完善的社会保险、住房公积金等；2、提供完善的福利保障，员工食堂（午餐补贴）、带薪年假、各类福利津贴等；3、完善的员工职业发展体系和培训体系；4、丰富多彩的员工集体活动，如各类文体活动、集体疗养、年终联欢等。,教育,15-50人,web,杭州
web前端开发工程师,https://www.lagou.com/jobs/7032924.html,西湖区,10k-20k,浙江网新恩普软件有限公司,1-3年,大专,省级部及大项目,岗位职责：1、负责公司各类产品的前端开发工作，确保优质的前端产品体验；2、建设前端开发框架和组建，开发高兼容性、高性能的前端代码；3、负责可视化技术的探索、创新及应用；4、负责编写前端技术文档。任职资格：1、大专以上学历，2年以上工作经验，其中Web前端工作1年以上；2、精通JavaScript、HTML5，CSS，理解其原理，并能灵活应用，能独立开展前端开发工作；3、能独立使用JavaScript实现Web前端表现和交付者优先；4、熟悉react、vue、JQuery、AntDesign等常用前端框架；,"移动互联网,金融",500-2000人,web,杭州
web前端开发工程师,https://www.lagou.com/jobs/6997780.html,江干区,8k-11k,杭州今元标矩科技有限公司,1年以下,不限,"周末双休,五险一金,成长空间大,发展前景",岗位职责：1. 负责公司产品的客户端开发工作；2. 持续优化前端体验、页面性能和项目代码。任职要求：1. 相关计算机专业毕业，本科以上学历；2. 熟悉html5，css3；3. 熟悉原生es5，es6/es6+编程；4. 有react全家桶使用经验，或小程序开发经验，或熟悉前端工程化的更佳。,"移动互联网,企业服务",500-2000人,web,杭州
web前端,https://www.lagou.com/jobs/6754741.html,西湖区,10k-16k,杭州大名软件有限公司,1-3年,本科,多次调薪,1、参与产品需求、研发设计的相关讨论，从前端设计角度提升产品使用性和美观度的要求；2、负责网站的前端开发工作，实现产品所需的交互效果；3、与后台技术开发保持良好的沟通，完成具体的开发工作。任职要求：1、计算机相关专业，本科及以上（实习生也可）2、具有1-2年及以上前端开发工作经验，自我要求高，执行力强；3、熟练掌握使用JavaScript、html / html5 、css / css3、Ajax等前端开发技术，熟悉W3C标准；4、熟悉一至多个常用前端库（anios、lodash、jquery、bootstrap、Zepto.echart.js等）；5、了解各种浏览器兼容性，缓存、安全等机制；6、具有良好的前端设计感；7、会使用至少一套Web开发框架(react、vue或angular)者优先；8. 熟练使用Node.js或python书写脚本，创建网络服务器工作地址,"电商,企业服务",50-150人,web,杭州
web前端开发（react1年以上工作经验）,https://www.lagou.com/jobs/7120093.html,余杭区,15k-20k,武汉佰钧成技术有限责任公司,3-5年,大专,入职六险一金，双休，节假日福利,"3年以上前端开发经验
 精通各种前端基础技术，包括 HTML/CSS/JavaScript 等，熟悉函数式、性能优化、Hybrid 技术者优先
 熟悉至少一个主流框架（如 Vue/React/Angular 等），能够高效完成视觉稿拆解及编码实现
 对前端工程化与模块化开发有一定了解，并有一定实践经验（如 Gulp/Webpack/Rollup/CommonJS 等）
 对前端技术有持续热情，具备良好的团队协作精神，个性乐观开朗，善于与各种不同背景角色合作
react不熟练的不用投递，不用投递，不用投递！！！",移动互联网,2000人以上,web,杭州
web前端资深工程师,https://www.lagou.com/jobs/312682.html,余杭区,20k-30k,杭州脸脸会网络技术有限公司,5-10年,本科,发展平台 领导牛 产品牛 期权激励,岗位要求：1、负责前端技术选型、技术规划、前端框架和组件库建设，并能制定相关的前端开发流程和规范标准； 2、跟踪并研究前端新技术发展方向，确保技术路线的合理性、安全性、稳定性； 3、充分理解业务及产品需求，进行项目成员的组织协调、计划排期和开发实现，并能跟踪项目进度、评估项目风险，对产品需求进行持续迭代优化； 4、持续推动前端工程化体系建设，提高开发效率及质量；5、负责前端团队组建和管理，提升团队整体能力。技能要求： 1、全日制本科及以上学历，5年以上前端开发经验，其中2年以上项目及团队管理经验； 2、精通HTML5、CSS3、JavaScript，熟练掌握React、Vue等主流前端框架，在前端技术上有专长； 3、对交互设计、用户体验有深刻理解，关注前端发展趋势、新技术，对技术有很大热情；4、具备优秀的组织管理、跨部门沟通协调能力和问题解决能力，注重团队合作、对工作有强烈的责任感；5、有数据分析产品、BI工具、地图产品前端系统搭建经验者优先。,"移动互联网,消费生活",150-500人,web,杭州
web测试工程师,https://www.lagou.com/jobs/7170376.html,西湖区,12k-13k,杭州博彦信息技术有限公司,1-3年,大专,年终奖,阿里云智能事业群-云安全团队是阿里云飞天平台（阿里云自主研发大规模云计算操作系统）的核心，在全球超过19个地域及52个可用区，构建高等级的安全基础设施，同时提供业内最丰富的安全产品及解决方案，为云上企业资产保驾护航。云安全-智能密码团队立志于建设世界一流的服务平台，为阿里云用户和云产品提供安全、合规、高可靠、高可用、高性能的密码能力，通过丰富的产品形态赋能全方位、多层次的密码应用场景，成为云上系统数据和业务数据安全保护的技术基石；还可以作为企业PKI体系、身份认证、数据分级、DRM、区块链等各种业务系统的基础模块。对Python开发，自动化测试很熟练对Shell脚本、linux系统熟悉对存储、文件系统熟悉有设计开发能力，不光是测试不要移动端、Web端领域的,"移动互联网,电商",2000人以上,web,杭州
web前端,https://www.lagou.com/jobs/2558266.html,,10k-20k,浙江远图互联科技股份有限公司,1-3年,本科,软件和硬件，产业和互联网，挑战应有尽有～,"岗位职责： 1、负责公司WEB应用产品和无线产品的前端开发，配合后端开发人员完成数据交互及动态功能实现； 2、参与讨论制定前端页面框架，负责应用功能的开发，编写标准化的代码； 3、全力实现优秀用户体验，促进产品易用性改进和界面技术优化； 4、与后端开发人员保持良好沟通，快速理解、消化各方开发需求，并予以实现。 任职要求： 1、大专及以上学历，2年以上WEB前端开发经验； 2、精通DIV+CSS、HTML/HTML5、JS,  Javascript框架的一种，能实现良好的用户体验与新颖的交互方式； 3、熟悉WEB应用开发流程和开发工具，能够针对反馈的问题高效快速做出解决方案； 4、深刻理解WEB开发标准，对用户体验、交互操作流程及用户需求有深入理解；5、了解Hybrid方式开发APP，熟悉目前主流的Hybrid开发框架优先；6、良好的沟通协调能力和团队合作能力，工作主动，认真细致，有较强的学习能力和责任心，抗压能力好；7、有创业激情，认同创业团队的管理与工作模式，有与创业团队共同长期发展的愿景。加分项：1、有个人博客，定期沉淀技术文章2、参与过开源项目，关注前端技术发展3、独立负责过前端项目","移动互联网,医疗丨健康",150-500人,web,杭州
web前端,https://www.lagou.com/jobs/7107591.html,萧山区,3k-4k,杭州知衣科技有限公司,应届毕业生,本科,大牛团队,要求最少实习6个月，仅面向21年毕业的同学，优秀者提供转正留任机会哦聪明，学的快React、React-router、reduxVue、Node js以上至少熟悉两项在校期间有过相关获奖经历or获得过两次以上奖学金or 211/985院校,"移动互联网,电商",50-150人,web,杭州
web前端开发工程师,https://www.lagou.com/jobs/7205971.html,江干区,5k-10k,杭州昊晟投资管理有限公司,1年以下,本科,年终奖,"关注新事物、新技术，有较强的学习能力，喜欢挑战执行力强，具有优秀的团队合作精神、敬业精神有作品者优先 (如有，请在简历中注明)技术要求:熟练掌握HTML/CSS/Javascript熟悉常见的前端框架有React、Vue经验,。熟练掌握CSS3、HTML5、ES6、Webpack等规范和技术优先欢迎优秀应届生",金融,15-50人,web,杭州
web前端开发工程师,https://www.lagou.com/jobs/7049405.html,余杭区,15k-23k,杭州博彦信息技术有限公司,1-3年,大专,周末双休，五险一金,"只要一年以上前端经验，react框架半年以上任职资格：1、计算机等相关专业本科及以上学历，至少2年前端工作经验；2、熟练使用React全家桶进行前端开发，并有相关项目经验及作品；3. 熟悉 React 的基本原理，熟悉 React优化；4. 熟练使用 redux 5、熟悉ant design及nodejs相关的前端构建工具npm, bower, gulp,webpack等； 6、拥有良好的代码书写和编程习惯，了解代码管理与版本控制； 7、可承受压力，有责任感，学习能力强，自我驱动力强","移动互联网,电商",2000人以上,web,杭州
web前端开发工程师,https://www.lagou.com/jobs/7089224.html,拱墅区,15k-30k,宁波中茂网络科技有限公司杭州分公司,3-5年,不限,b2b 晋升 定期培训 项目奖金,1、精通HTML5、CSS、JavaScript等前端技术，熟悉模块化、前端编译和构建工具，熟练运用主流的移动端JS库和开发框架，并深入理解其设计原理；2、关注业界前端新技术，熟练使用Vue等多种框架；3、熟练使用Gulp/Webpack等类似的前端构建工具；4、熟悉Java后端开发。,"数据服务,软件开发",150-500人,web,杭州
web前端实习,https://www.lagou.com/jobs/5391758.html,江干区,4k-6k,杭州纳舍科技有限公司,应届毕业生,本科,弹性工作不用打卡，定期团建吃喝玩乐,"作为前端实习生，会有一对一mentor。有机会参与公司产品的开发，基于HTML5和React和Vue都ok。如果你比较怀旧jQuery我们也欢迎。我们为我们的产品选择最合适的技术实现， 我们喜欢开源，也喜欢新技术。岗位职责
 HTML5开发
 CSS3开发
 良好的Javascript编程能力
 自动化开发和测试的能力
 良好的设计能力和设计眼界，能迅速找到合适的交互方案并且实施
 开发文档的编写和维护
岗位任职要求
 有HTML5开发经验
 有JavaScript开发经验
 有CSS开发经验
 有设计作品者优先
 有Twitter Bootstrap经验者优先
 有jQuery经验者优先","企业服务,数据服务",15-50人,web,杭州
高级Web前端工程师（Electron）,https://www.lagou.com/jobs/6497232.html,余杭区,10k-15k,杭州快忆科技有限公司,1-3年,本科,五险一金、周末双休、带薪年假、年终奖,岗位职责：1、参与公司核心产品软件的开发和维护2、负责公共组件库的开发和维护3、承担技术难点的攻坚岗位要求：1、计算机相关专业本科以上学历，1年以上相关工作经验2、良好的设计和编码品味，热爱写代码，能产出高质量的设计和代码3、精通Web前端开发技术：JavaScript（含ES6）、HTML、CSS、DOM、协议、安全等4、精通NodeJS，熟悉JS的异步机制，熟练掌握Promise/async/await的使用5、有Electron开发经验者优先，熟悉PHP、Threejs框架或Webgl者优先公司简介：快忆科技（KuaiYi Tech）是专注于大数据和人工智能服务的高科技互联网公司，旨在为全球的企业和开发者提供最前沿的大数据和人工智能应用开发和服务生态。 基于来自Google的技术团队自主研发的分布式大数据操作系统，提供从大数据采集获取、可视化存储管理、数据清洗、BI商务智能到AI机器学习算法的数据训练、建模、模型管理、 模型服务(Serve)等一站式产品和服务。公司由来自西安交通大学的多名硕士创始人联合创立，研发团队由原就职于Google、IBM、MicroStrategy、**网的资深工程师组成 。以第1名的领先优势入驻杭州梦想小镇互联网村。我们认为，从大数据开始，人工智能即将引领下一次技术革命，希望我们能够推动这一革命的早日到来！,"移动互联网,数据服务",15-50人,web,杭州
web前端开发工程师,https://www.lagou.com/jobs/7035260.html,西湖区,10k-13k,杭州边锋网络技术有限公司,3-5年,本科,"人性化,免打卡,氛围好,待遇佳",岗位职责：1. 参与需求分析和交互设计，商定移动端及PC端的页面设计2. 参与接口协议的制定，与后台工程师共同完成应用的开发3. 对产品前端进行迭代和重构，改善用户体验任职要求：1.熟悉Web前端开发技术，包括javascript、Ajax、CSS、Vue等web开发领域相关技术2.熟悉掌握常用开发调试工具3.熟悉性能的优化，熟悉浏览器兼容问题处理，了解搜索引擎优化和web语义话4.熟悉并掌握移动端性能优化方法，熟悉移动端的兼容问题处理，熟练使用常用设计模式5.会UI设计优先考虑6.具有较强的学习能力和逻辑思维能力，具有良好的沟通能力、团队合作精神、能承担工作压力,"移动互联网,游戏",2000人以上,web,杭州
web前端开发实习生,https://www.lagou.com/jobs/7152442.html,余杭区,3k-5k,抖数科技（杭州）有限公司,应届毕业生,不限,实习生150/天,岗位描述：1.与后台人员配合，负责前端项目的静态页面及接口对接，调试和维护；2.负责浏览器插件的开发工作；岗位要求：1.专科及以上学历，计算机相关专业，有激情，有责任感，肯于钻研技术难题，具备良好的沟通技巧和团队合作精神；2.熟悉W3C规范及常见WEB前端技术，能写高质量Javascript/HTML/CSS代码；3.熟练掌握angularjs、vue+element等开发技术；4.对WEB前端技术HTML/HTML5/JavaScript/CSS/跨浏览器兼容等有一定的理解；5.具有良好的表达、沟通、学习及问题分析能力；具有良好的过程改善思维及能力；具有良好的代码注释及编程格式习惯；6.具有较强的团队合作精神、进取心和求知欲，热爱学习，勇于挑战。,数据服务,15-50人,web,杭州
web前端开发工程师,https://www.lagou.com/jobs/7216861.html,余杭区,12k-17k,浙江斑智科技有限公司,3-5年,本科,五险一金 周末双休 老板nice,"岗位描述：1、拥有丰富的项目经验，能作为前端项目负责人承担负责项目开发过程中出现的各种前端技术问题。2、对项目流程有一定了解，在项目流程出现问题时能协助项目经理解决。3、业务系统功能的开发和优化4、配合后台工程师一起研讨前端技术实现方案，提高界面交互体验。任职要求：1、熟悉Vue技术，能够使用Vue以及antDesign组件库开发PC/Mobile端应用,对antDesign Pro有一定的了解。2、熟练掌握前端技术JavaScript、ECMAScript  6的语法及应用、熟悉状态管理3、熟悉前端路由4、熟悉前端权限、前端国际化等业务需求5、熟练使用git等项目管理工具6、有良好的代码书写、注释和单元测试习惯7、熟悉常用浏览器兼容方案，有实战经验者优先8、熟悉nginx以及常用前端代码部署相关知识能适应一定程度出差，需要在客户现场驻场开发，具有良好的抗压能力",软件开发、数据服务,50-150人,web,杭州
Web全栈工程师,https://www.lagou.com/jobs/6237221.html,滨江区,18k-30k,杭州希格斯投资管理有限公司,应届毕业生,本科,发展空间大、绩效奖金、年底双薪、氛围好,工作职责1、负责公司内部交易风控、客户关系管理、工作效率提升工具等等相关产品网页前端和后端的研究设计、开发和优化；2、负责相关产品的日常运维，参与产品规划，持续优化产品体验及性能；3、参与制定标准规范，流程改进及工具建设，为技术选型及技术改进提供解决方案。技能要求1、扎实的计算机基础知识（如操作系统、计算机网络、数据结构、算法），熟悉 HTML 、 Javascript 和 Web 开发框架，具备全栈开发能力；2、对 MVC/MVVM 等模式有一定的理解，熟悉常见前端技术框架（如React、vue、angularJS）；3、对前端工程化有一定理解，熟练掌握 Webpack/Grunt/Gulp 等构建工具的使用和配置；4、熟悉一门后端编程语言及常见 Web 框架，如 Java Spring，Python Tornado 等；5、熟悉常见数据库技术；6、熟悉常用的项目管理工具git，熟悉Linux系统及常见命令，具备较好的项目管理经验；7、具有良好的学习能力，对用户体验和产品研发有经验者优先。,"金融,数据服务",15-50人,web,杭州
web前端工程师,https://www.lagou.com/jobs/4344976.html,余杭区,7k-14k,杭州昵图信息技术有限公司,1-3年,本科,"成熟企业,氛围轻松,自盈利,老板好",岗位职责：1、负责公司网站前端新需求开发；2、对现有业务功能模块进行维护；3、代码优化规范化；4、快速响应和解决用户反馈的问题.任职要求：1、计算机相关专业，本科及以上学历，1年及以上相关工作经验；2、熟悉HTML、CSS、JavaScript、等Web前端技术，熟悉HTML5、CSS3与W3C 网页标准，并能兼容主流浏览器 ；熟练使用常见JS开发框架如jQuery，VUE，React等；3、精通DIV+CSS布局的HTML代码编写，熟练手写标准CSS样式表，高效精确还原设计稿，并兼容各个浏览器；4、至少熟悉一门后端语言，如c#，java，node等；5、对用户可用性，用户体验，用户研究等相关知识有深入的了解和实践经验；6、具备良好的代码编写习惯及一定的文档编写能力；7、具有良好的团队合作精神，沟通和理解能力。,电商,50-150人,web,杭州
Web开发工程师,https://www.lagou.com/jobs/6940080.html,西湖区,10k-15k,浙江协同数据系统有限公司,3-5年,本科,学习提升,"岗位职责：                                                                              1、参与公司产品Web前端功能设计、开发和实现；2、使用Web前端技术，创建用户友好、符合标准、跨平台及跨浏览器的Web应用，注重产品易用性和界面优化；3、与后端开发人员配合，高质量完成网站前端开发工作。职位要求：1、统招本科以上学历，3年以上Web开发经验；                      2、精通javascript、HTML、CSS，能快速定位解决浏览器兼容性问题；3、熟练掌握HTML5,CSS3，能够制作精准稳定的Web页面，有良好的交互效果；4、掌握模块化工具requirejs等技术，阅读过一种框架的源码；5、具备良好的代码风格和编程习惯，能够合理利用设计模式和模块化组织方式对代码进行优化；6、熟悉常用的前端构建工具，如Gulp,Grunt,FIS等；7、有过Vue, Angularjs, React等任一开发经验的优先，最好是Vue前后端分离相关开发经验。",移动互联网,50-150人,web,杭州
web前端实习生,https://www.lagou.com/jobs/6882464.html,余杭区,2k-4k,杭州介子网络有限公司,应届毕业生,本科,扁平化管理、支持转正、成长空间大,岗位职责： 1.参与公司官网 及 微信小程序开发； 2.负责与产品设计师沟通协调，完整还原设计方案； 3.能积极主动学习相关技术，并按时完成分内的工作； 4.持续优化，改善用户体验； 5.对新技术有较强的学习接受能力；岗位要求：  1. 能够熟练使用html、css、JavaScript制作网页前端；  2. 有独立开发网页前端的经验，能够制作简单的素材；  3. 熟悉vue.js开发；  4. 熟悉前端基本开发语言；  5. 熟悉前端常用开发框架；  6.有相关项目实操经验（课题或实习均可）；  7.热爱前端工作，阳光积极，进取心强；  8.每周实习最少4个工作日。    该岗位支持转正！,"移动互联网,社交",15-50人,web,杭州
web前端,https://www.lagou.com/jobs/7189313.html,余杭区,10k-18k,义乌爱拼网络科技有限公司,3-5年,本科,有电商经验,工作内容：根据产品需求进行H5、Web等页面开发及交互效果实现、易用性改进及页面性能优化。职位要求：1、本科及以上学历，2年或以上工作经验；2、熟练使用HTML5 CSS3，熟悉SCSS；3、熟练使用原生Javascript、ES6开发；4、熟练掌握Vue、AngularJS、React等框架中的一种或几种，熟悉MVC、MVVM等前端开发模型；5、熟悉使用Gulp、Webpack、Git、SVN等工具；6、有Java后端开发经验者优先考虑。,"电商,社交",少于15人,web,杭州
