job_name,job_url,job_location,job_salary,job_company,job_experience,job_class,job_given,job_detail,company_type,company_person,search_key,city
Web前端工程师,https://www.lagou.com/jobs/4790655.html,五华区,10k-13k,成都恒道智融信息技术有限公司,3-5年,本科,"六险一金,绩效奖金,创业公司,带薪年假",岗位职责： 1、前端开发工作，小程序的编写 2、负责项目页面编码、程序嵌套、静态交互效果展示、浏览器兼容等相关工作； 3、对完成的页面进行维护和对网站前端性能做相应的优化； 4、熟悉当前互联网的各种流行应用，在交互开发、用户体验等方面有自己的见解，能主动根据业务需要，提出合理的交互方案。 5、有较强的团队合作精神，责任心强，学习能力强，代码规范（重要）；任职要求： 1、本科4年以上 熟练使用html5、css3进行页面布局及开发; 2、熟悉Ajax异步编程；熟悉数据交互的前端。 3、熟练使用JavaScript 4、熟悉Vue全家桶Vue + Vue-router + Vuex + Axios，NPM 、WebPack等Vue的应用生态链，并使用它们开发过实际项目； 5、有基于SVG、d3.js、three.js等可视化效果开发经验者优先；,"金融,数据服务",15-50人,深度学习,昆明
送餐员,https://www.lagou.com/jobs/6731186.html,盘龙区,7k-12k,昆明德利楼餐饮服务有限公司,不限,不限,福利待遇好工资准时发放工作氛围好。,招聘要求1、男女不限，年龄在18-45岁 。2、有无经验均可，工作流程简单，前期有人带，可以快速上手。3、会熟练使用智能手机导航，会骑电动车，具备快速学习的能力。4、责任心，时间观念强、能吃苦耐劳，服从公司管理制度。5、身体健康，无传染疾病及不良嗜好。工作时间：早9:30-21:30正常上班时间，可自由加班工资待遇：1.月单量提成：单量稳定，多劳多得，平均4000-8000/月。2.全职骑手享受车补+话补+勤奖+单量奖。3.上班服装、餐箱不收取押金。不拖欠工资。4. 可以供住宿，解决吃饭，尽可能帮助骑手上岗。公司直招面试不收取任何费用面试通过直接上岗！面向全昆明招聘长期有效！,其他、物流丨运输,50-150人,深度学习,昆明
VUE前端开发工程师,https://www.lagou.com/jobs/6949249.html,呈贡区,8k-15k,云南龙腾软件开发有限公司,3-5年,本科,前景较好，资金充足,【云南龙腾软件开发有限公司】要求：1、能够独立使用Vue框架开发完整的App，熟练使用Vue2.0框架以及对vue全家桶(Vue+Vue-router+Vuex+axios)，熟悉uni-app。2、熟悉前端开发技术Vue.js，熟悉ElementUI等相关Vue.js的框架；至少用Vue.js开发过2个以上的项目。2、精通JavaScript，熟悉使用过最新ES规范开发(ES6/7)。4、具备多浏览器、多设备兼容经验，熟悉移动端web app开发及多设备兼容性调试和后端交互；5、有良好的团队协作精神、工作责任心和较强的学习能力；6、有android、IOS端基于vue的APP开发经验者优先。7、熟悉android或ios原生开发的优先。8、熟悉其他前端技术栈的优先。工作内容：1、负责基础页面的开发与接口对接调试等。2、负责APP端的适配等。3、基础前端算法处理、缓存及其他前端非页面功能实现等。,软件开发,15-50人,深度学习,昆明
开发工程师,https://www.lagou.com/jobs/6938118.html,盘龙区,5k-8k,云南锃亮科技有限公司,不限,大专,五险一金、年底双薪、孝心基金,工作时间：上午9：00-12：00，下午13：30-18：00，单双休，国家法定节假日正常放假。岗位要求：1、 计算机、软件工程相关专业大专及以上学历，热爱软件开发及代码编写工作。2、具有一年以上软件开发工作经验。3、熟练C#语言，了解VB，具备独立代码编写能力。4、熟悉SQLServer数据库。5、熟悉财务软件，有金蝶KIS、K/3 Cloud（金蝶云）等二次开发经验者优先。6、具有严谨的逻辑思维能力，优秀的学习能力、语言表达能力。工作内容：1、当客户有开发需求时，为售前顾问提供售前支持，参与功能需求讨论，提供开发解决方案，并评估开发周期。2、按时按量完成开发工作，并进行相关测试。3、配合ERP实施工程师完成开发功能的实施工作，并在整个实施过程中进行功能完善、BUG修复等工作。4、对于开发部单独承接的开发或二次开发，开发完成后，需要自行实施交付。5、负责客户化需求的开发、测试、部署，以及各过程文档的编写及交付。福利待遇：1、待遇：基本工资（5K+） + 奖金 + 全员营销提成2、工资范围：5K~8K。3、福利：五险一金、年底双薪、孝心基金、无息购房贷款、季度团建活动、年度旅游。4、三级合伙人：命运合伙人、事业合伙人、项目合伙人（转正即有）。,数据服务,15-50人,深度学习,昆明
前端工程师,https://www.lagou.com/jobs/6686052.html,五华区,6k-10k,云南趣探科技有限公司,1-3年,不限,双休，天使轮融资，工作氛围好，产品牛逼,工作职责：1. 独立负责移动端项目开发和维护，以微信小程序为主；2. 与后端工程师协作，高效完成产品的数据交互、动态信息展现；3. 持续的优化前端体验和页面响应速度，提升 Web界面的友好和易用； 任职资格：1. 本科及以上学历；2. 熟练HTML/CSS/JS等Web前端技术，对符合WEB标准的网站开发有相关经验；3. 对Nodejs、Angularjs、React、Vuejs、D3.js、echarts、jQuary至少一项有过了解或使用经验；4. 熟悉微信小程序开发。5. 有较强的逻辑思维能力，善于分析、归纳、解决问题； 我们希望你：1. 充满好奇心，有专研精神，对新鲜事物有浓厚的兴趣；2. 很强的学习能力，新的东西可以很快地学会；3. 这是我们希望你与我们一起完成的产品：https://www.goexplore.io,软件开发,15-50人,深度学习,昆明
人事专员,https://www.lagou.com/jobs/7004053.html,官渡区,3k-6k,云南端泽生物科技有限公司,1年以下,不限,工作时间自由，,工作内容：负责公司招聘，配备合适人选，预约求职者安排面试工作要求：积极上进，学习能力强，善于沟通工作时间：9:30-6:00周末单休,其他,15-50人,深度学习,昆明
java高级软件工程师,https://www.lagou.com/jobs/3864799.html,盘龙区,8k-12k,昆明房融科技有限公司,1-3年,不限,"高薪,双休,氛围好,妹纸多",职位描述：岗位职责:1、负责所属模块的开发建设，包含功能的规划、需求分析设计与技术实现；2、根据需求、设计文档完成指定的设计、开发工作；3、完成其他交办的各类技术开发任务。 岗位要求：1、计算机相关专业本科及以上学历，2年以上实际工作经验，了解软件开发上线过程；  2、精通掌握Java、JSP/Servlet、JDBC等J2EE相关技术；  3、熟悉HTTP、HTML、JavaScript，了解JQuery等ajax技术；  4、熟悉Hibernate、Spring、Struts2等主流框架；  5、熟练掌握SQL，熟练掌握主流的关系型数据库，如Oracle、MySql等；  6、熟悉Linux，有Linux系统开发及部署经验者更佳；  7、熟悉SVN、GIT、MAVEN等项目管理软件使用者优先；  8、有良好的交流沟通、团队合作与协调能力，学习能力强；  9、大流量高并发Web开发经验者优先；同时，您还能接受：1、每天上班时间上午9:00-12:00、下午13:30-18:00；2、每周工作5天半；3、每月可以和伙伴们（妹纸多）出去嗨皮嗨皮；4、公司外带公费让您到各地顺便游山玩水。如果以上条件您能基本接受并且部分符合您的胃口，请不要犹豫！我们所有伙伴都等着你,"移动互联网,企业服务",15-50人,深度学习,昆明
销售经理,https://www.lagou.com/jobs/6665239.html,官渡区,7k-12k,云南手信信息技术有限公司,3-5年,本科,有多大的能力就有多大的舞台,"负责组建销售队伍,培训销售人员，评估销售业绩,建设销售团队，公司会不定期组织学习，岗位多多，具体面谈为准。APP及刷脸支付设备，智能充电宝等",金融、软件开发,15-50人,深度学习,昆明
产品经理,https://www.lagou.com/jobs/6665225.html,官渡区,3k-6k,云南手信信息技术有限公司,应届毕业生,大专,有多大的能力就有多大的舞台,"负责组建销售队伍,培训销售人员，即使你没有经验也没有关系，公司会不定期组织学习，岗位多多，具体面谈为准。APP及刷脸支付设备，充电宝等",金融、软件开发,15-50人,深度学习,昆明
区块链市场经理,https://www.lagou.com/jobs/6958444.html,五华区,10k-15k,昆明埃舍尔科技有限公司,1-3年,本科,丰厚薪酬，优秀团队，前景好，专业,岗位职责1、负责区块链领域的资源拓展及互换，建立及维护资源生态圈，不断完善合作模式，扩大公司影响力。2、负责拓展“区块链+医疗”领域的市场业务，快速制定项目策划方案，推进项目落地实施。3、关注区块链前沿技术的发展趋势、主流的区块链项目，探索区块链技术在医疗领域的新落地场景，为公司业务发展提供持续支撑。 任职资格1、统招本科及以上学历，计算机、数学等理工科专业优先考虑。2、1年以上区块链行业工作经验，有数字货币投资买卖经验优先考虑。3、熟悉IPFS，BTC，ETH，EOS等主流区块链项目运作模式。4、具备较强的策划能力，敏锐的市场触觉，出色的逻辑分析能力，优秀的资源整合能力和业务推进能力。5、良好的团队合作精神，学习能力强，抗压能力强，责任心强。6、热爱市场营销工作，对区块链等新兴产业有浓厚兴趣。,移动互联网,50-150人,深度学习,昆明
销售经理,https://www.lagou.com/jobs/6968175.html,呈贡区,5k-10k,中国人寿保险股份有限公司呈贡县支公司,不限,不限,周末双休 气氛活跃 平台稳固 提升快,（一）提升销售技能，管理并服务好辖区内的老客户，在此基础上进行业务拓展。（二）接受公司相应的免费培训和学习的机会。（三）根据客户的家庭资产规模及生活状况分析并制作合理有效的理财计划。（四）负责制定销售计划和销售方案，同时撰写市场分析报告等工作。（五）公司将提供丰富的网点客户资源，续期客户资源，学生平安险客户资源的。（六）为客户提供保险规划，提供车险，非车险，财险，寿险团险的一站式服务。需要外出积极开发并拜访新老客户，需要较强的吃苦耐劳和抗压能力,金融,2000人以上,深度学习,昆明
销售专员,https://www.lagou.com/jobs/6914329.html,盘龙区,5k-10k,云南民银科技有限公司,不限,不限,福利好，出差费用公司报销，有餐补，包住宿,岗位职责：学习公司产品的知识培训，负责产品的销售，推广，安装以及使用指导，开拓新市场，维护新老客。岗位要求：不***，无经验、应届生也可以，有良好的人际沟通能力，亲和力强，服从管理。,"电商,金融",15-50人,深度学习,昆明
人事专员专员,https://www.lagou.com/jobs/6958979.html,官渡区,3k-5k,官渡区暖利小吃店,3-5年,本科,主要负责招聘内部员工，学习人事管理，,1，应聘人事要求，主要负责招聘内部员工，学习人事管理,招聘 不限,50-150人,深度学习,昆明
web前端开发工程师,https://www.lagou.com/jobs/6761865.html,五华区,5k-9k,广州市科传计算机科技股份有限公司,3-5年,大专,六险一金、带薪年假、绩效奖金、年终双薪,"岗位职责：1)负责web前端、微信小程序、APP产品的开发、测试及维护；2)负责前端产品性能优化，兼容性优化及故障排查；3)跟踪移动应用开发的新技术发展，持续学习为团队技术发展做出贡献。任职要求：1)本科以上学历，毕业后2年以上的web前端开发工作经验，主要需有混合架构开发经验者；2)具备WEB独立开发能力，熟悉常用的 Web 框架及h5标准，熟悉 HTML CSS JavaScript 以及相关框架和工具；3)精通至少一种主流JS框架（vue.js，angular.js,node.js等 ）；4)能兼具手机原生APP及组件开发经验更佳。现诚聘各类精英：科传股份公司拥有独立研发的专利技术和20多项软件著作权。为员工提供舒适轻松的写字楼办公环境，完善的晋升体系，为在职员工提供公平的竞争平台和广阔的晋升空间，给员工带来更多自我提升和自己增值的机会。科传股份公司服务客户对象是一线国内外知名品牌的零售企业。现诚聘愿意从事软件销售、软件实施的各类精英，共创辉煌！公司福利：1.法定双休、法定假期、带薪年假2.社保五险、公积金3.试用期转正后，享受商业保险福利（包含定额门诊、住院、意外险种及体检费）；4.年终双薪5.绩效奖金6.每周一次水果日福利7.康体活动（因应季节提供羽毛球、篮球、游泳、健身等项目）8.生日聚餐","消费生活,数据服务",150-500人,深度学习,昆明
外贸专员,https://www.lagou.com/jobs/6807041.html,西山区,4k-8k,北京水杉云图投资管理有限公司,1-3年,本科,待遇丰厚，带薪年假，可以在家轻松工作,职位诱惑：工资高，工作时间自由岗位职责：1、通过skype，打电话等方式联系国外的dsp广告供应商2、供应商维护，并做相关客户资料整理；3，跟供应商见面商谈合作细节任职要求：1、热爱工作，坚定从业方向，良好的学习能力、较强的执行力，思维灵活；2、有一年dsp，ssp相关从业经验者优先，优秀应届毕业生亦可；3、具备较强英语口语能力。4、细心、沟通能力强、外向，具较强团队协作能力；5、具备良好的计划、协调、沟通能力；6、能熟练使用办公自动化软件。公司产品网址http://www.fbkits.com,"移动互联网,电商",50-150人,深度学习,昆明
产品经理,https://www.lagou.com/jobs/6883872.html,官渡区,15k-20k,昆明家韵房地产经纪有限公司,不限,不限,上班时间短，无加班，高提成，定期聚餐团建,"不限要招人数|经验不限|学历中专以上工作内容:新房的销售,二手房的销售与租赁。招聘人群类型:社会人士1、从事中高端二手房的销售及租赁,同时兼一手房的代理销售;2、陪同客户现场看房,协助买卖双方磋商价格并签订合同;3、陪同办理后期货款、权属过户等手续,为客户提供一站式服务。4、任职要求:中专(高中)以上学历,专业不限,能力突出者可放宽条件;5、有销售经验者优先;为人亲和,反映敏捷、表达能力强,具有较强的沟通能力及交际技巧;6、具有一定的市场分析及判断能力,良好的客户服务意识;7、责任心强,能承受较大工作压力,勇于挑战。待遇:底薪3000,+35%-75%带薪年假+带薪培训学习=月均10000-13000元薪资发放时间薪酬及时发放。我们每月15号底薪提成一起发放,绝不拖欠!员工福利:定期组织员工内训、外训,帮助你快速掌握行业知识一对一的师父带教,帮助你熟悉整个业务流程,顺利岀师员工国內外精英游畅通的职业晋升通道,只要你足够优秀,最短6个月的时间可以晋升管理层工作时间:上午9.00-下午18.00每月休息4天","企业服务,消费生活",500-2000人,深度学习,昆明
前端开发工程师,https://www.lagou.com/jobs/5795532.html,官渡区,4k-8k,昆明三桥科技有限责任公司,1-3年,大专,老板好，不定期员工活动,"0. 一年以上开发经验1. 大专以上学历，条件优秀者可放宽学历2. 理工科，计算机专业，设计，物理，数学专业优先3. 有一定的审美能力，具备良好的学习，沟通能力5. 熟练掌握HTML5、CSS3、JavaScript等6. 熟悉W3C标准与ES规范，熟悉Web语义化7. 熟练掌握盒模型、常用布局以及浏览器和移动设备兼容性8. 熟练使用vue框架，掌握其原理，能独立开发常用组件9. 有reactNative框架使用经验者优先10.了解typeScript,熟悉ES69. 能独立分析、解决和归纳问题10.熟悉前端自动化和工程化11.熟悉NodeJS开发，熟练使用Git上班时间：上午9:00-12:00，下午14:00-18:00（单双周轮休，法定节假日正常休息）","移动互联网,游戏",15-50人,深度学习,昆明
电话销售专员,https://www.lagou.com/jobs/6861332.html,盘龙区,4k-8k,云南翰沣教育信息咨询有限公司,1年以下,大专,公司团队氛围好，公司环境佳，有国内外旅游,"职位描述 岗位职责： 勤奋好学，有梦想，有追求。任职要求：也许你没有高学历，也许你没有高收入，也许你刚走出校门，也许你还在为找工作而奔波，来这里！！！公司提供平台，只要你愿意学习，肯付出，你就一定会从平凡走向优秀。有闯劲的85后，新锐的90后，期待你的加入，选择比努力更重要职业规划：1、达标即可晋升，升官即可发财（晋升销售主管岗位底薪3000至8000元以上+个人提成+维护提成+高额团队提成），从业务员到总经理晋升通畅、标准公开透明，你能清晰康到自己的位置和方向。2、各块业务之间灵活选择拓展发展机会，帮你释放自己的天才，只要你足够优秀，可以通过培养成为主持人、讲师、咨询师、职业经理人。3、全员持股计划、年终分红、成为公司的合伙人。         培训机会：免费参与公司课程学习，如公众演说、舞台主持、企业管理等。工作时间：我们没有事业单位一样的双休，在这里工作的伙伴也没有强大的家庭背景作为支撑，我们只是一群积极乐观爱开玩笑的逗比。周一至周六8:30--18:00每个月可以休息4天，如果你需要去相亲见对象，一定要提前告诉排班的同事，大家会主动帮助你的，我们的目标只有一个-----你一定要幸福!","企业服务,教育",50-150人,深度学习,昆明
人事招聘专员,https://www.lagou.com/jobs/6911031.html,西山区,3k-6k,云南星生文化传媒有限公司,不限,不限,包住 上班时间短升职空间大,岗位职责：1.根据现有编制及业务发展需求，协调、统计各部门的招聘需求，编制年度人员招聘计划；2.建立和完善公司的招聘流程和招聘体系；3.利用各种招聘渠道发布招聘广告，寻求招聘机构；4.执行招聘、甄选、面试、选择、安置工作；5.进行聘前测试和简历甄别工作；6.充分利用各种招聘渠道满足公司的人才需求；7.建立后备人才选拔方案和人才储备机制。8.协助建立岗位任职匹配模型。任职要求：1.人力资源、劳动与社会保障、劳动关系等相关专业本科以上学历2.具有3年以上招聘相关工作经验3.具备招聘方面的专业知识，熟知招聘工作流程以及招聘渠道，熟悉国家关于劳动合同、人力资源管理方面的法律法规4.具备良好的沟通交流能力5.具有亲和力，能妥善安排应聘面试工作6.工作认真、负责，善于学习。条件优秀可应聘人力行政主管）高级招聘专员的职业发展招聘主管、招聘经理、人力行政经理、总监,文娱丨内容,50-150人,深度学习,昆明
销售,https://www.lagou.com/jobs/6864636.html,官渡区,9k-10k,昆明尊园房地产经纪有限公司第三分公司,不限,不限,晋升快，工资高，工作自由轻松，提供住宿,工作内容:1，从公司内网房星网，和安居客，****等外部网，发布房源信息，获取客户来电，并根据客户的需求，合理推荐合适客户的一手楼盘或二手房源，并服务好客户，约看，带看相关房源，直至签约成交。2，筛选公司电销机器人打出来的意向客户。要求:熟悉掌握电脑操作流程，打字熟练，有上进心，学习能力强，做事认真踏实，(无责任底薪3000元，租房提成百分之60，售房提成百分之45，每月休息4天，每月公费聚会2-3次，让你在工作的同时，还能有一个愉快的生活氛围。业绩优秀者，每年一次公费国外游，一次国内游，)月薪轻松过万，有挑战高薪者，欢迎加入我们这个大家庭！3:提供住宿，公司购买保险。,房产家居,2000人以上,深度学习,昆明
产品经理,https://www.lagou.com/jobs/6868648.html,盘龙区,9k-18k,云南众炎科技有限公司,不限,不限,1，收入日结 2，时间自由 3，成长空间,1，学习成长空间大2，收入空间大3，晋升空间大4，办公空间大,"电商,金融",150-500人,深度学习,昆明
理财规划师,https://www.lagou.com/jobs/6569687.html,盘龙区,6k-10k,平安普惠投资咨询有限公司昆明青年路分公司,不限,大专,大平台，晋升制度高度透明，欢迎有梦想的你,岗位职责：1.依据客户的资产规模、理财、保险需求，提供综合性咨询服务，并利用金融工具制定适合方案。2.为客户提供寿险、车险、银行、信托、贷款、投资、买房、买车等一站式金融服务。3.为客户提供保障需求缺口、家庭财务状况分析，并制定保险、理财解决方案。职位要求：1.25岁以上，大专及以上学历，具有金融、营销、财经类专业者优先考虑。2.人品端正，谦虚好学，做事认真。3.具有工作责任心和较强的学习能力。4.有企图心，目标明确，愿意为自己打拼一番事业。培训机制1.上岗前接受公司安排的人身保险新型产品基础知识及实务。（包括人身保险概述、意外伤害险、健康保险、普通保险、分红险、**险和保险从业人员职业道德）。2.上岗后接受本公司产品形态、结构培训，并根据客户需求设计合适的方案。3.定期培训综合金融知识，包括贷款、信托、车险、房车等。4.每年多次的储备干部的管理能力培养。,"金融,消费生活",2000人以上,深度学习,昆明
食品包装,https://www.lagou.com/jobs/6891875.html,盘龙区,4k-7k,云南智翔项目管理有限公司,不限,不限,求职者想了解工作可以加我微信私聊我,"一、岗位职责：1、按照主管要求，按时按量完成生产任务，完成当日当月生产任务；2、按工艺要求进行生产操作；3、服从领导安排，完成本岗的技术学习任务；4、完成领导交办的工作。二、任职资格：1、16岁以上，45岁以下，学历不限2、吃苦耐劳，有责任心3、持有效身份证件三、工作内容手机等电子产品的生产包装，管理生产材料和生产成品四、工作待遇底薪+加班费+技能奖金+生产奖金,?月综合工资4200一6800元/月五、工作时间5天8小时，做六休一，也可以不休（不休有加班费），每天正常上班8小时，超出算加班，加班工资?周一到周五1.5倍加班，双休2倍加班，法定节假日3倍加班。六、住宿：提供公寓宿舍（住宿免费）4-6人/间，24小时热水，独立卫生间，有空调和洗衣房，电视。七、福利待遇1.保险：公司为员工缴纳保险。2.休假：员工依法享受国家法定节假日、婚假、产假、丧假、带薪年假等。3.公司会举办丰富多彩的业余活动，篮球赛，足球赛，各类晚会，文艺表演等。4.园区有各项便利设施：室内篮球场、网吧，银行ATM机、邮局，超市，各类美食餐厅等。今天的生活我们不去评论，但明天的生活掌握在我们自己手中。你需要工作，而我们刚好有职位满足你的需求，合作共赢，我们秉承诚信**，服务至上的信念注*此次招聘为本公司直招，全程无任何费用，请求职者辨明资质，以免上当受骗！",其他,50-150人,深度学习,昆明
