job_name,job_url,job_location,job_salary,job_company,job_experience,job_class,job_given,job_detail,company_type,company_person,search_key,city
大数据主管（偏数据仓库经验）,https://www.lagou.com/jobs/7114600.html,南山区,18k-30k,深圳深蓝保信息技术有限公司,5-10年,本科,行业引领者，大牛团队，互联网氛围,工作内容：1、建设公司级数据仓库，并根据业务变化持续迭代和优化；2、对业务数据进行梳理和抽象，建设数据仓库的数据模型；3、对业务数据进行采集、清洗、转换和存储；4、支撑BI、用户数据、用户运营、用户画像、推荐系统等核心数据平台产品；5、研究大数据前沿技术，不断持续优化大数据平台，为业务提供价值。岗位要求：1、本科及以上计算机、统计学、数据库、机器学习等相关专业，5年以上数据相关工作；2、对业务数据有敏锐的理解能力，并能快速梳理和分析业务数据；3、熟练掌握SQL语言、熟悉MySQL，对Shell、Java（主要开发语言）、Python编程非常熟悉；4、熟悉常用的ETL技术和原则；精通数据仓库数据库设计规范和实操；5、熟悉Hadoop、Hive、HBase、Spark、Storm等开源平台者优先；6、具有较强的分析和解决问题的能力，良好的学习能力和团队合作精神，追求价值实现，认同目标管理和敏捷。7、有大数据处理、数据平台、数据仓库经验者或数据挖掘算法优先；8、具有大数据团队管理和技术管理经验优先。,"金融,移动互联网",150-500人,python,广东
自动化测试,https://www.lagou.com/jobs/7171419.html,龙岗区,9k-15k,深圳市天瑞地安网络科技有限公司,不限,本科,五险一金、双休,岗位职责：1、负责特性自动化脚本开发、音频检测算法开发、工具开发等工作。2、按时完成开发工作，同时参与测试用例的设计与优化。任职要求：1. 计算机、软件工程、自动化、数学等相关专业本科及以上学历；2. 2年以上软件开发及测试经验，有蓝牙耳机、蓝牙音箱等产品或者APP自动化开发经验者优先；3. 具备C/C++/python任意一个主流语言的开发基础；4. 具备较强责任心和团队精神，承压能力强，工作积极主动,"移动互联网,电商",50-150人,python,广东
数据挖掘,https://www.lagou.com/jobs/7049823.html,南山区,13k-25k,广州市梦享网络技术有限公司,3-5年,本科,福利待遇，弹性工作，下午茶，五险一金,岗位职责 ：1、 负责产品海量数据的提取及分析挖掘，为相关部门提供数据支持。2、 深入理解业务，协助实现数据驱动的运营及决策指导。3、 挖掘数据特征及数据价值，探索数据商业化，提出产品优化方案，协助提升数据产品用户体验。4、 设计和开发底层数据分析模型，并不断优化，结合业务需求研究用户画像，构建用户标签体系。5、 监测日常数据，优化数据埋点，对数据异常波动进行分析，并协助解决数据问题。岗 位要求：1、 本科以上学历，数学、统计学、计算机等相关专业优先考虑。2、 2年以上数据分析经验，有移动互联网、电商等相关行业经验优先考虑。3、 具有数据思维，熟悉数据分析与挖掘的流程及方法，擅于从数据中发现问题，并提出解决方案。4、 熟悉 SQL 数据查询及分析，有 MySQL 等关系型数据库使用经验。5、 熟悉 Elasticsearch 原理及使用技术，有海量数据提取及分析处理经验优先。6、 熟悉 python 编程，熟练使用 numpy、pandas、matplotlib、sklearn 等进行数据处理、可视化及建模。7、 掌握常用机器学习算法（分类、聚类、回归、关联等）原理、应用场景及代码实现。8、 了解 Hadoop 生态相关技术及 Linux 常用命令，有 hivesql、spark、Hbase 等使用经验者优先。,"移动互联网,消费生活",150-500人,python,广东
安全技术-后台开发高级工程师,https://www.lagou.com/jobs/6114870.html,南山区,20k-40k,腾讯科技（深圳）有限公司,不限,大专,免费班车；员工食堂；健身房；鹅厂福利,"负责业务安全后台开发，负责高并发服务开发、监控系统开发、海量数据处理集群建设1、具备3年以上开发经验，本科以上学历；2、精通C/C++开发；3、熟悉TCP/IP协议，熟悉Linux开发环境及系统及常见应用层协议；4、有运维自动化、监控系统、发布系统、运营支撑系统等开发经验者优先；5、有海量数据处理相关开发经验者优先，如 Hadoop、Storm、Spark等；6、具有良好的学习能力、沟通能力、团队合作意识；7、强烈的责任心与主动性，对所负责工作有owner意识，并能自我驱动成长。安全技术-运营开发高级工程师岗位职责：负责内容业务安全运营平台及管理平台等项目的前端开发岗位要求：1、3年及以上Web前端开发经验, 熟悉 html5, css, js, node 等开发和维护技术； 2、熟悉常见的前端开发框架, 至少熟悉Vue、React、angular 中的一种框架; 3、有一定的 linux 系统使用经验; 能独立完成web应用的部署, 维护工作; 4、有较强的主动学习能力, 沟通主动，强烈的责任心与主动性。  5、具备大数据平台开发方面相关工作经验、熟悉常用大数据平台和工具，如hadoop/spark/Hbase/Flink/ES等优先考虑。安全技术-计算机视觉方向岗位职责：负责图像审核、模型设计，研发适合在内容安全中使用的安全模型、算法和工具 岗位要求：1.图像处理、计算机视觉、模式识别、机器学习等相关专业。 2.3年以上图像识别/计算机视觉领域相关工作经验，熟悉图像识别/计算机视觉领域的主流模型和算法，关注领域内的最新进展。 3. 较强的算法实现能力，熟练掌握C/C++，Python，Java等至少一门语言；熟悉OpenCV等常用库，熟练使用一种或几种深度学习框架（caffe，tensorflow， MXNet）。 4. 有图目检测、特征提取，图像分类、图像识别等实际应用经验者优先。 5. 有较强的研究能力者优先，如在领域**会议如CVPR，ICCV，ECCV，NIPS等发表过高质量论文。自然语言工程师：岗位职责：负责文本审核、舆情分析的文本识别模型设计，研发适合在内容安全中使用的安全模型、算法和工具 岗位要求：1、自然语言处理、模式识别、机器学习等相关专业硕士及以上。，3年以上相关工作经验；2、有较强的算法基础和编码能力，熟练掌握C/C++，Python，Java等至少一门语言。熟悉Linux环境开发；熟练使用一种或几种深度学习框架（caffe，tensorflow， Pytorch）；3、熟悉常用的自然语言算法，如word2vec、LDA、HMM、CRF等；熟悉深度学习在自然语言处理中的应用；4、有文本内容审核、文本分析、舆情分析等实际应用经验者优先；5、有较强的研究能力者优先，如在领域**会议如ACL、EMNLP、NAACL等发表过高质量论文；6、有良好的团队合作和沟通能力。",社交,2000人以上,python,广东
腾讯音乐中央信息库数据开发工程师,https://www.lagou.com/jobs/6970072.html,南山区,20k-40k,腾讯科技（深圳）有限公司,3-5年,本科,平台大,岗位职责 负责海量数据处理的基础架构开发与维护岗位要求 1. 本科及以上学历。熟悉Hadoop/Spark/Flink等分布式计算平台。2. 扎实可靠的编程能力，精通Python/C/C++/Go/Java至少一门编程语言；3. 具备良好的数据结构、算法、操作系统、数据库与计算机网络基础。4. 具备良好的分析解决问题能力，能独立承担任务，有系统进度把控能力； 5. 责任心强，良好的对外沟通和团队协作能力，主动好学。,社交,2000人以上,python,广东
Golang开发（云平台） (MJ001796),https://www.lagou.com/jobs/6913343.html,番禺区,20k-35k,广州希音供应链管理有限公司,5-10年,本科,技术大咖 扁平管理 氛围年轻 弹性上班,岗位职责：负责paas平台开发，维护，管理。职位要求：1. 3年以上k8s devops经验（能力强者忽略），参与过整个k8s的落地实践，并有丰富的部署规划经验。2. 熟练操作k8s docker istio的经验，熟悉源码，有源码修改者加分。3. 至少熟练一种开发语言，如Go，C/C++，Java，Python等。4. 熟悉k8s架构域实现者优先。5. 熟悉envoy，istio架构与实现者优先。,"电商,移动互联网",2000人以上,python,广东
安全运维工程师,https://www.lagou.com/jobs/6939694.html,宝安区,15k-30k,深圳哈稀网络技术有限公司,3-5年,不限,奖金多多，福利多多,职位描述：1、负责公司云上安全设备的部署、维护、配置，以及安全防范措施的方案规划，推动业务团队落地；2、负责本地和云上的服务器与网络基础设备的安全加固的方案规划，推动业务团队落地；3、负责公司的数据安全保护，安全策略配置，容灾优化，性能优化等的方案规划，推动业务团队落地；4、负责建立公司例行化的安全运维巡检、安全审计机制，并持续优化；5、负责Web漏洞和系统漏洞修复工作推进，跟踪解决情况，问题收集；6、能对公司的安全事件排查与分析，建立工具和平台，使安全态势量化和可视化。职位要求：1、熟悉主流的Web安全技术，包括SQL注入、XSS、CSRF等OWASP TOP 10安全风险； 2、熟悉Linux/Windows下系统和软件的安全配置与加固；3、熟悉常见的云端安全产品及原理，熟练掌握他们的配置方法；4、掌握常见系统、应用的日志分析方法，熟悉网络安全技术：包括端口、服务漏洞扫描、程序漏洞分析检测、权限管理、入侵和攻击分析追踪、网络渗透、木马防范等；5、熟练掌握C/PHP/Perl/Python/Shell/Lua等1或多种语言，最好精通Lua/Python； 6、有用Haoop大数据分析用户日志行为经验者优先；7、具有安全事件挖掘、调查取证经验，有XSRC经验者优先；8、能够编写安全运维类工具，提高运维审计效率、检查安全基线是否符合要求；9、要有本地机房、IDC、阿里云的安全运维经验；10、较好的文档撰写能力、语言表达和与沟通能力；11、诚实守信、责任心强，具有良好的团队协作精神；,"移动互联网,金融",50-150人,python,广东
测试,https://www.lagou.com/jobs/6965086.html,龙岗区,13k-25k,常州泉晋光电有限公司,3-5年,本科,公司可以给你一分体现价值发挥实力的平台,业务技能要求：1、熟悉测试基础理论和测试流程、测试设计方法、业界测试工具； 2、熟练掌握测试用例、缺陷报告、测试报告等文档的编写 3、具备良好的表达和沟通能力及团队协作能力；4、掌握Python编程语言者优先；具备API或者UI自动化测试经验者优先；自动化测试工程师 1、熟悉自动化框架设计和开发，熟悉自动化测试在CI和DevOps中的应用，熟悉使用Linux、数据库； 2、具备良好的表达和沟通能力及团队协作能力； 3、熟练掌握Python、JAVA、GO编程语言者优先； 4、具备性能测试、自动化测试（后端服务接口自动化或者APP自动化）经验者优先； 专业知识要求： 1、熟悉测试基础理论、测试设计方法、业界测试工具； 2、熟悉业界主流的CI、自动化验证工具链和框架； 3、熟练掌握一种编程语言（Java/Python/GO语言等）； 4、熟悉TCP、UDP等网络通讯协议，熟悉RTMP/FLV/HLS/RTP等常用流媒体协议。,"移动互联网,数据服务",2000人以上,python,广东
数据分析,https://www.lagou.com/jobs/7062376.html,南山区,9k-12k,深圳鱼羊美厨网络科技有限公司,1-3年,本科,有竞争力 薪资扁平化管理 工作氛围好,品牌名：【wonderlab】岗位职责：1、负责商业化业务的数据管理、业务分析工作，对各类分析任务中发现的问题，进行跟踪、定位、分析工作；2、从需求出发，推动上报，中间表，系统数据能力落地；3、对部门现有业务数据进行梳理汇总和跟踪监控，建立日常跟踪监控体系，及时敏锐的发现业务数据变化趋势；4、建设增长数据系统，提供系统化的数据分析能力，满足业务需求；5、定期输出数据分析报告，提出产品/推荐/增长/内容等方向的优化点。岗位要求：1. 本科及以上学历； 2. 有2年以上互联网行业数据工作经验；3.扎实的数据开发和编码技能 ；4.有过数据治理、数据平台、数据分析经验； 5. 很好的业务和产品理解能力；6. 熟练使用SQL/HIVE/SAS/SPSS/R/Python;- 具有竞争力的薪酬待遇- 入职即缴纳五险一金（社保一档）- 带薪年假- 国家法定假期- 生日福利- 节日福利- 年度调薪- 良好的办公环境，甲级写字楼,消费生活,150-500人,python,广东
运维工程师,https://www.lagou.com/jobs/6720402.html,宝安区,15k-30k,深圳哈稀网络技术有限公司,3-5年,本科,福利好、发展前景好、奖金多,"【岗位职责】1.负责应用系统运行软件的安装、配置、优化与维护2.负责应用系统模块部署、配置、维护、备份与检测3.负责应用系统的日志信息备份、管理、维护与分析4.负责应用系统的日常监测于维护、故障处理、性能分析与优化5.负责应用系统的相关文档的编写、运维信息统计等。【岗位要求】1.有阿里云的线上web应用运维经验优先，有区块链相关经验的优先2.熟悉Linux操作系统的基础知识，熟练使用Linux常用操作命令3.熟练配置Nginx等应用相关软件的部署、配置与优化维护4.熟悉shell/python中的一种或多种进行运维程序的开发5.熟悉Open-falcon,grafana,Prometheus等监控软件部署、配置与维护6.熟悉Jenkins或者别的自动化发布、git使用7.熟悉大型互联网公司架构， 熟悉nginx／redis／java等配置8.熟悉MySQL数据库管理、监控和备份9.服务器、存储系统、负载均衡等网络设备的搭建、配置、监控维护，具有网络维护、排障和系统化解决问题能力","移动互联网,金融",50-150人,python,广东
PHP后端开发工程师,https://www.lagou.com/jobs/6878111.html,香洲区,15k-20k,珠海新海通电子商务有限公司,3-5年,大专,提供良好的发展平台，提供具有竞争力的薪酬,"该岗位工作地址在珠海湾仔（2人）或深圳南山科技园（4人）岗位职责：1. 程序实现2. 编写单元测试3. 程序性能优化4. 程序调试和测试5. 程序缺陷修复6. 程序文档编制任职要求1. 3 年以上 Linux 环境编程经验2. 精通一种主流开发架构和语言，如 C/C++, Java, Golang, Erlang/Elixir 等，或 Python, PHP, node.js, Ruby 等，并熟练掌握相应的开源框架、库和工具3. 熟练掌握常用的数据结构和算法，掌握异步、并行开发、IO 和网络编程等4. 熟练掌握常用关系型及非关系型数据库的应用和优化5. 经验丰富的全栈工程师优先",电商,15-50人,python,广东
产品经理（数据分析方向）,https://www.lagou.com/jobs/7079515.html,南山区,10k-16k,深圳市超盟金服技术信息服务有限公司,3-5年,本科,领导nice 年轻化团队 集团企业,职位描述：1、深入理解公司业务，完善数据监测、业务运营指标；2、服务公司各部门和项目，推动并配合数据分析类产品在各解决方案的落地和应用，为产品完善提供数据支持；3、负责产品的需求分析、指标定义、产品设计和产品迭代，输出高质量的PRD文档。任职资格：1、统计、数学、计算机等相关专业本科及以上学历；2、二年以上数据分析或数据产品相关经验，参与过完整的数据分析项目；3、熟悉支付、餐饮、零售、金融等业务知识，有行业数据分析相关经验者优先；4、具有敏锐的数据价值理解和感知能力，具有优秀的产品设计能力，能快速落地抽象需求，并转化成产品形态。5、熟练使用相关数据分析工具（如Python/R、SQL、统计分析SPSS/SAS、BI工具Tableau/PowerBI）等，了解大数据平台架构；6、熟悉平台类产品规划方法，熟练使用AXURE、PPT、WORD、VISIO等产品策划工具。,移动互联网,500-2000人,python,广东
NLP自然语言处理工程师,https://www.lagou.com/jobs/4988022.html,南山区,40k-80k,深圳苹果树数据科技有限公司,5-10年,本科,"腾讯研发,技术提升,弹性上班,制度规范","工作职责：1.负责语义理解、分类/聚类等系统构建；2.负责对话文本特征提取、语义理解、详情提取、对话结果生成算法研究及实现；3.负责大规模文本数据处理和数据挖掘；职位要求：1.计算机或相关专业本科及以上学历,2年以上NLP相关工作经验2.有扎实的编程基础，熟悉Java及 Python 语言，对算法和数据结构有深入研究； 3.熟练机器学习方面的基础理论知识，对深度学习等当前热点和前沿技术有完整和系统的认识；4.熟悉TensorFlow框架和TF-Serving5.熟悉NLP相关算法（分词、词性标注、命名实体识别、文本分类、聚类等），熟悉NLP和文本挖掘的关键技术，并有一定的研究成果或项目经验，有语义理解开发经验者优先；6.责任心强，有较强的分析和解决问题能力，有良好的沟通协调能力和团队合作意识。","金融,数据服务",150-500人,python,广东
php开发工程师,https://www.lagou.com/jobs/6036947.html,龙华新区,15k-25k,深圳市智学帮科技有限公司,3-5年,大专,在线教育，员工期权，五险一金，带薪年假,【岗位职责】1、负责公司产品的服务端设计和开发；2、负责系统的稳定运行和性能优化；3、负责新项目需求分析、系统设计、数据库设计。【任职要求】1、3 年以上开发经验；2、熟练使用 Laravel，并且有扎实的 PHP 基础，掌握面向对象开发思想；3、熟悉LNMP体系的开发，熟悉Linux操作系统，熟悉Nginx系统配置4、掌握 HTML / CSS / JavaScript 等前端开发技术；5、熟悉MySQL数据库，有MongoDB等NoSQL数据库开发经验者优先6、熟悉memcache/redis、MVC/REST架构、模板引擎、中间件的原理与应用；7、熟练掌握 git，掌握 git workflow;8、有JAVA\GO\Python开发经验优先考虑;9、热爱编程，工作积极主动，学习能力强，友善容易相处。,教育,15-50人,python,广东
中高级web前端,https://www.lagou.com/jobs/6961396.html,番禺区,18k-35k,广州探迹科技有限公司,5-10年,本科,"大数据AI,五险一金,期权激励,扁平管理","岗位职责：1、与产品经理、后台工程师、测试工程师等紧密合作，共同交付功能完善、稳定可靠的SaaS产品；2、参与Web前端的代码设计与开发,使用敏捷产品开发流程来确保功能按时交付；3、编写、审查和维护技术文档；4、研究和评估新技术和框架,持续改善和提高产品的性能、灵活性及稳定性。任职资格：1、统招本科及以上学历，计算机相关专业，4年以上web前端开发经验； 2、精通 HTML\CSS\JS等前端技术，熟悉Web前端的性能优化，并对Web安全有丰富的认识和经验； 3、熟练掌握ReactJS或者VueJS、AngularJS至少一种前端框架；4、熟悉DNS，HTTP及其他相关网络层数据传输协议；5、有UI组件的实际开发经验，能够解决多平台多终端的兼容、适配问题；6、了解Python，PHP，Node.js，Java等后台开发语言及技术的一种或多种，对前后端的开发对接技术原理有全面认识；7、了解主流前端构建工具的工作原理，并能根据项目实际情况定制化构建工具； 8、具有良好的编码能力、学习能力、沟通能力、服务理理念和合作精神，能接受挑战并承担工作压力； 9、热爱前端技术、关注国内外各大技术论坛，有技术博客者优先。","数据服务,企业服务",150-500人,python,广东
web前端工程师,https://www.lagou.com/jobs/5627837.html,番禺区,20k-30k,广州探迹科技有限公司,3-5年,本科,"大数据AI,五险一金,期权激励,扁平管理","岗位职责：1、与产品经理、后台工程师、测试工程师等紧密合作，共同交付功能完善、稳定可靠的SaaS产品；2、参与Web前端的代码设计与开发,使用敏捷产品开发流程来确保功能按时交付；3、编写、审查和维护技术文档；4、研究和评估新技术和框架,持续改善和提高产品的性能、灵活性及稳定性。任职资格：1、本科及以上学历，计算机相关专业，专业基础知识扎实，有两年以上web前端开发工作经验者优先； 2、精通 HTML\CSS\JS等前端技术，熟悉Web前端的性能优化，并对Web安全有丰富的认识和经验； 3、熟练掌握ReactJS或者VueJS、AngularJS至少一种前端框架；4、熟悉DNS，HTTP及其他相关网络层数据传输协议；5、有UI组件的实际开发经验，能够解决多平台多终端的兼容、适配问题；6、了解Python，PHP，Node.js，Java等后台开发语言及技术的一种或多种，对前后端的开发对接技术原理有全面认识；7、了解主流前端构建工具的工作原理，并能根据项目实际情况定制化构建工具； 8、具有良好的编码能力、学习能力、沟通能力、服务理理念和合作精神，能接受挑战并承担工作压力； 9、热爱前端技术、关注国内外各大技术论坛，有技术博客者优先。","数据服务,企业服务",150-500人,python,广东
量化交易员,https://www.lagou.com/jobs/7156237.html,番禺区,6k-12k,广州经传多赢投资咨询有限公司,1-3年,本科,"五险一金,绩效奖金,年底多薪,专业团队",【岗位职责】1、良好的短线盘感，对各种技术分析、量化交易有研究；2、负责量化对冲类产品（主要是股票对冲产品）的管理以及实际投资运作；3、实时监盘对产品和交易进行风险跟踪；4、负责日终头寸核对、损益计算、行权处理、清算交割等工作；5、产品的其他相关事宜。【职位要求】1、理工科或者金融类专业，本科或以上学历；2、有良好的数据分析能力，逻辑思维严谨；3、对金融产品交易有浓厚兴趣，有大资金实盘交易经验；4、 对证券市场有较深刻的理解力，至少掌握一种分析工具，有较好的研究分析能力；5、为人正直诚信，有高度的责任心和主动性，有良好的职业操守，有敏锐的判断力、独立的逻辑分析能力，具有良好的团队合作精神，具有较强的信息搜集能力、逻辑思维能力； 6、熟悉Python、R、Matlab一种编程语言优先。,金融,2000人以上,python,广东
软件开发工程师,https://www.lagou.com/jobs/6802020.html,龙岗区,15k-30k,华为技术有限公司,不限,本科,薪酬优越 年终丰厚 大佬云集,此岗位隶属于华为-2012实验室，这里集成了华为技术的核心。大牛云集，氛围良好，欢迎各位私戳。我们希望您：1、计算机、软件、通信等相关专业本科及以上学历；英语通过CET-4或相当水平。2、热爱编程，基础扎实，熟悉掌握但不限于JAVA/Python/JS/HTML/CSS等编程语言中的一种或数种，有良好的编程习惯。3、具备独立工作能力和解决问题的能力、善于沟通，乐于合作，热衷新技术，善于总结分享，喜欢动手实践；4、熟悉java主流框架、容器及数据库，能够解决疑难问题。如spring，tomcat，mysql，MongoDB等。5、熟悉微服务框架（如Dubbo、SpringCloud等）以及应用，有SOA或分布式高并发系统的设计和开发经验。6、了解消息队列，分布式缓存，NoSQL，分词搜索等技术，能够快速掌握相关开源产品使用。我们提供：1、专业的技术团队，全球**的产品业务知识，充分开拓你的视野；2、融洽的团队氛围，解决你的后顾之忧；3、有竞争力的薪酬和完善的调薪机制，华为为你的能力付薪；4、超一流的行政服务团队，美食、免费宵夜、加班免费打车统统给你。,通讯电子,2000人以上,python,广东
