job_name,job_url,job_location,job_salary,job_company,job_experience,job_class,job_given,job_detail,company_type,company_person,search_key,city
web前端开发工程师,https://www.lagou.com/jobs/7080214.html,海曙区,4k-8k,宁波云数信息科技有限公司,1-3年,大专,"工作环境好,晋升空间大",职位描述：岗位职责: 1. 根据UI设计，熟练运用 HTML CSS JavaScript 产出兼容于目前主流浏览器的前端页面；  2. 实现Web前端用户界面编码，能够和UI设计师、后端工程师紧密沟通协作，负责将UI提供的设计图转化成静态页面。 任职要求： 1. 大专及以上学历，至少2年Web前端开发经验；  2. 精通HTML、CSS、JavaScript、Ajax等Web前端开发技术，能轻松写出符合W3C标准、兼容多种浏览器的前端页面代码，对于页面效果实现有足够的经验；  3. 能熟练使用Vue.js开发；(这条很重要哦) 4. 对用户体验，交互设计等有深入的理解，对前端页面代码结构及前端交互性能有深入的理解； 有UI设计能力者优先，薪资可再面议； 6. 具备良好的敬业精神、团队协作能力、沟通能力和学习能力。,"移动互联网,教育",15-50人,web,宁波
web前端开发工程师,https://www.lagou.com/jobs/6240605.html,鄞州区,15k-25k,宁波逸享电子商务有限公司,5-10年,大专,发展前景优,职位描述1、负责移动端HTML5页面产品的研发； 2、根据产品需求完成相关产品功能开发； 3、持续优化系统在各平台下的兼容性，提高执行效率； 4、配合后台工程师一起研讨技术实现方案，进行应用及系统整合。任职资格 1、拥有3年以上Web前端开发经验； 2、精通ES6/7/8 HTML5 CSS3 等，深刻理解web标准，对主流浏览器兼容性问题有一定研究； 3、熟练掌握至少一种主流前端开发框架（Vue/React/Angular），我们用的的是vue； 4、熟悉移动端前端开发，以及混合模式开发，熟悉移动端的调试； 5、熟悉移动端开发、熟悉java、nodejs等开发语言优先。,"电商,社交",15-50人,web,宁波
高级WEB前端开发工程师,https://www.lagou.com/jobs/6513788.html,北仑区,13k-20k,上海旺链信息科技有限公司,5-10年,本科,绩效：13-16薪,工作内容：1. 负责区块链业务前端开发，应用前沿技术，迎接大受众规模、复杂场景、高质量要求的挑战;2. 沉淀组件、抽象框架、建造工具，持续发展技术体系，享受幸福的工程师生活;3. 探索技术极限，拓展能力边界，给世界带来微小而美好的改变;岗位要求:1. 本科及以上学历，计算机相关专业，熟练掌握 HTML/CSS/JavaScript;2. 5年及以上前端相关工作经验，参与过比较复杂的前端交互场景;3. 对流行的 MV*框架有深入了解，熟悉 Vue 或 React 优先;4. 具备优秀程序员的基本素养，对代码有洁癖，善于使用搜索引擎，遇到问题可以一查到底，善于使用工具提高效率;5. 快速学习能力，不断突破技术瓶颈，乐于探索未知领域，随时准备好去面对新挑战;,"企业服务,数据服务",15-50人,web,宁波
web前端开发工程师,https://www.lagou.com/jobs/6901269.html,鄞州区,6k-12k,宁波菊风系统软件有限公司,1-3年,本科,"奖金丰厚,福利多,弹性上班,团队轻松",岗位职责：负责菊风视频BU的前端开发。岗位要求：本科以上学历，1年以上工作经验；能够接受出差1. 精通HTML5/CSS3/JS/ES6等前端技能，理解web标准和兼容性，了解Webpack；2. 熟练使用主流的JavaScript框架（React/Vue/RN等），并精通其中的一种以上；3. 熟练掌握Git4. 熟悉一门后端语言优先，熟悉linux系统优先；5. 了解WebRTC等音视频技术的优先6. 熟悉小程序，并至少有一个参与的小程序项目7. 思路清晰，具备良好的沟通能力和团队协作精神，能够独立思考和解决问题，有上进心，对新技术有浓厚的兴趣。,移动互联网,50-150人,web,宁波
web前端开发工程师,https://www.lagou.com/jobs/6423653.html,海曙区,15k-30k,浙江蓝卓工业互联网信息技术有限公司,5-10年,本科,"扁平化管理,氛围活跃",岗位职责：1. 与UI设计师、后端开发人员等配合，负责前端架构设计、开发、测试和持续性能优化；2. 参与开发各种前端页面组件或页面模版；3. 参与制定JS、CSS、Html开发规范并推进执行；4. 负责Web前沿技术研究和新技术调研。任职要求：1. 大学本科计算机或相关专业，3年以上工作经验；2. 精通html5、javascript、canvas、css，熟悉ES2015/ES6，了解相关的前端框架，如angularjs、reactjs、vue等；3. 对前端开发基础架构、技术应用、团队高效协作有自己的见解；4. 热爱前端和开源项目，喜欢用平台化和工程化的手段解决问题；5. 尝试各种前沿可视化技术与思想，推动团队技术继续前进；6. 工作富有激情，有良好的团队协作精神，富有责任心，能承受一定强度的工作压力。,"移动互联网,信息安全",150-500人,web,宁波
web前端开发工程师,https://www.lagou.com/jobs/6533374.html,镇海区,10k-15k,宁波西北梦电子商务有限公司,1-3年,大专,团队融洽，发展空间大，环境好,"岗位职责：1、依据公司需求完成web和app高质量的前端开发和维护；2、优化前端应用，改善用户体验；3、参与前端开发规范的制定及开发流程的优化；4、参与、配合并完成公司管理中的各项任务及临时工作；5、参与小程序开发，后台服务器开发，PHP开发；6、负责完成上级领导交办的其他任务。任职要求：1、计算机相关专业大专以上学历，1年以上Web前端工作经验；2、熟悉Mobile Web的开发，熟悉其它类似框架，并且能实现各种交互效果；3、熟悉HTML5+CSS3+JS编程，熟悉各种前端调试工具； 熟悉JS性能优化；4、熟悉jQuery等主流的JS库，了解其运行机制；5、熟悉新的HTML5表现形式的制作及开发, 有响应式页面开发经验优先。",电商,15-50人,web,宁波
web全栈,https://www.lagou.com/jobs/6790694.html,北仑区,10k-15k,宁波欣珵贸易有限公司,3-5年,本科,愉快的桌游环境，良好的发展前景,"Web开发人员在我们的桌游业务实现过程中将扮演重要角色，需要将我们的一些设计和概念转化为可行的网站页面。出于这一点考虑，我们在寻找一位具有创造力和优秀沟通能力的人，能够帮助我们面向所有客户提供最好的解决方案。你的挑战和目标:了解我们的需求，并提供相关的资料。具备独立完成web开发项目的能力。具备较好的英文水平，可以与我们的海外团队进行交流沟通。可以有效管理项目，合理安排开发周期。日常工作:与国内外的团队保持良好的沟通，提供所需的web相关服务，主要是后台服务支持。和团队组其他成员一起，为不同的项目开发不同的web页面。编写和维护跨浏览器、跨平台和高质量的代码。你的能力:前端:JavaScript/JQuery/Vue、HTML/HTML5、CSS/CSS3等编程技能，跨浏览器兼容性、Web用户界面设计(UI)后端:熟练掌握Python 、Web服务(REST/SOAP)、Django CMS设计，网站安全，能熟练运用常用的异步IO,负载均衡,异步队列celery/rabbitmq,进程通信,乐观/悲观锁,以及其他常用的高并发技术．加分项:熟悉国内电子商务框架与Gamification、多媒体内容开发Photoshop、Indesign、Illustrator等，具备优秀的沟通和团队协作能力。较好的英文水平，可以有效地和国外团队交流。工作积极主动，有团队精神。至少具有2年的web开发相关工作经验，具有大型网站开发经验者从优。 关于我们我们欣珵贸易有限公司（今年会成立一家新的合资公司-原石创造进出口有限公司）是在国内致力于桌面游戏销售的公司，我们的目标是建立中国最大的桌游用户群。目前我们和很多国外桌游出版社均有业务合作：高质量模型的主题类桌游卡牌、版图等策略性桌游Kickstarter桌游web开发人员需要按照我们的需求来开发我们所需的web。我们提供一个轻松、充满活力和创造性的工作环境，每个人都可以充分利用自己的技能和喜好，通过协作和团队合作来提高自己的能力。我们提供：一个充满活力、有趣、快节奏的环境位于浙江宁波的办公室有机会在我们意大利的办公室进行海外培训有竞争力的薪资和晋升空间",不限,少于15人,web,宁波
web前端开发工程师,https://www.lagou.com/jobs/6826087.html,鄞州区,12k-16k,宁波博登智能科技有限责任公司,1-3年,本科,技术氛围浓厚；上升空间大；团队气氛融洽,1、精通JavaScript，熟悉ES6，HTML5，CSS3。2、熟悉Vue.js，Vuex，VueRouter，熟悉ElementUI，有模块化开发和编写单元测试能力;3、对主流浏览器做兼容调试与修改;4、协同后端和UI设计师完成兼容性良好的前端页面制作;5、对Web前端开发有浓厚的兴趣，喜欢钻研技术，善于思考;5、较强的领悟能力和沟通能力，有很好的团队合作精。有以下经验者佳：1、熟练掌握three.js/webgl技术，有前端开发经验，会使用WebGL及其框架three.js等前端技术开发3D页面;2、了解三维图形图像的理论基础，如三维成像原理、着色器等；,"数据服务,人工智能",15-50人,web,宁波
web前端开发工程师,https://www.lagou.com/jobs/6788084.html,江东区,11k-20k,宁波康铭泰克信息科技股份有限公司,3-5年,不限,绩效奖金，员工旅游，周末双休,"岗位职责 :1.按给定的UI和需求构建实现功能,并符合团队的编码规范,解决Bug,优化;2.分析并给出一个项目的前端设计,实现相应的功能模块,抽象出可复用的组件;3.根据需要选择框架和工具搭建开发环境;4.优化开发流程,实现开发中需要的实用工具;5.对界面和交互设计给出自己的意见,参与讨论改善岗位要求1.三年以上工作经验，掌握HTML、JS、CSS语言知识;2.深入理解W3C标准,掌握盒模型、常用布局以及浏览器兼容性,熟练运用ES6新特性;3.具备Angular/React /Vue三者之一的实战经验,熟练使用jQuery,能自行编写jQuery插件;4.对工程化和模块化开发有了解,了解webpack或gulp等工具,能够选择相应技术进行开发 并能够自行根据要求定制开发环境;5.能开发webpack/gulp插件,能开发提升开发效率的小工具6.具有良好的沟通能力和团队合作精神","移动互联网,消费生活",50-150人,web,宁波
web前端开发工程师,https://www.lagou.com/jobs/6558383.html,鄞州区,5k-10k,浙江博曼科技有限公司,1-3年,本科,政策风口、员工持股、发展快、机会多,岗位职责：1. 使用Element+VUE+Echarts，进行系统前端页面的开发；任职要求：1精通JavaScript、Html5、CSS、Ajax等技术。2. 精通常用的JS开发框架（VUE、Echarts、ElementUI 等）。3. 有独立完成项目的能力。,物联网,15-50人,web,宁波
资深web前端,https://www.lagou.com/jobs/6775687.html,鄞州区,10k-18k,浙江康铭泰克信息科技股份有限公司,3-5年,本科,团队技术大牛多,"1.三年以上工作经验，掌握HTML、JS、CSS基础知识，了解常见的设计模式和编程思想，能根据需求给出简洁可扩展的实现；2.深入理解W3C标准,掌握盒模型、常用布局以及浏览器兼容性,熟练运用ES9新特性;3.具备Angular/React /Vue三者之一的实战经验,熟练使用jQuery,能自行编写jQuery插件;4. 了解常见的前端框架如Bootstrap/Semantic-UI/amazeUI；5.能开发webpack/gulp插件,能开发提升开发效率的小工具6. 有Less开发经验，了解React/Angular/Vue，有Vue实战经验；7.具有良好的沟通能力和团队合作精神8. 熟练使用Linux开发环境，熟练使用Git；9.了解Vue源码 ，自己封装过npm库的优先",移动互联网,50-150人,web,宁波
web前端开发,https://www.lagou.com/jobs/6022080.html,江北区,7k-14k,宁波微世信息科技有限公司,1-3年,本科,良好的团队氛围，发展前景。,工作内容：1.webapp开发。2.熟练angular codova reactive ionic中的一种。,"电商,移动互联网",15-50人,web,宁波
会VUEJS前端开发,https://www.lagou.com/jobs/7219145.html,奉化市,9k-12k,宁波奉化瑞晨信息科技有限公司,3-5年,本科,国内**家垂直自动化设备商城交易服务平台,1计算机或相关专业本科及以上学历，2年以上Web前端开发工作经验；2熟悉前端Vue体系架构，熟悉api接口传输协议有Vuejs项目实战经验。3熟练掌握HTML5、CSS、Ajax，熟悉DIVCSSCSS3布局、jQuery和bootstrap等主流框架和html5，精通JS模块化、Vue、ES6、NPM以及Webpack打包工具；4学习能力强、责任心强，有良好的代码编写习惯，具有团队合作精神和良好的沟通能力，和独立完成自己岗位。,电商,少于15人,web,宁波
前端开发工程师,https://www.lagou.com/jobs/7190876.html,鄞州区,7k-10k,四川倍施特科技股份有限公司,1-3年,大专,七险一金、交通补贴、双休、年终奖,技能要求1、精通HTML5、CSS3、Javascript等web前端开发技术，精通web2.0标准，Ajax、DOM、XML等相关技术。2、了解HTML5最新规范，能够熟练运用HTML5特性构建移动端的WebAPP。3、负责web、H5等产品视觉设计。4、精通Photoshop、Illustrator等设计软件，能独立完成产品UI设计5、熟悉使用主流js框架：jquery、vue等。至少有一款UI框架基础如：layui，Bootstrap等。6，需有小程序开发经验。任职要求：1、大专及以上学历，沟通表达能力良好；2、1- 2年以上相关工作经验， 3、具有良好独立工作能力和解决问题的能力；思维活跃，思路开阔，具有较强的沟通理解能力，能准确理解产品需求4、工作地点：宁波月薪：7000-10000元,移动互联网,50-150人,web,宁波
Java 研发,https://www.lagou.com/jobs/4928760.html,鄞州区,6k-12k,浙江乐檬信息技术有限公司,1-3年,本科,做事靠谱，年假、五险一金、体检、旅游等,岗位职责：1、Java中间层开发岗位负责使用Java语言编写应用程序中间层接口服务。2、Java前端开发岗位负责使用GWT（GXT）框架编写应用程序Web交互。 任职要求：1、精通Java编程语言；精通Spring Frawework；精通Hibernate或MyBatis其中一种Java ORM框架；精通MSSQL、MySQL、Oracle、PostgreSQL其中一种关系数据库，精通掌握Redis、MangoGo等其中一种NoSQL；2、数学、物理理或计算机相关专业，本科（含）以上学历；通过大学英语CET-4，不借助工具能够直接阅读英文技术文档；3、如期完成计划开发任务。4、211、985等重点大学本科学历 ，通过大学英语CET-6级的优秀应届生亦可。 工作时间：9：00---18：00 单双休，单休周周六上午团队周例会和学习分享，下午团建活动。,"企业服务,消费生活",50-150人,web,宁波
JAVA项目经理,https://www.lagou.com/jobs/6973468.html,鄞州区,15k-20k,中信网络科技股份有限公司,5-10年,本科,"午餐补贴,五险一金,年终奖，双休，年休假",职责描述：1.项目实施实行项目经理负责制，项目经理负责项目整个实施过程；2.项目的范围、进度、成本控制；3.项目的风险控制；4.撰写项目相关文档；5.与客户的有效沟通；6.负责项目实施过程中的实施记录和备案。任职要求：1． 5年以上 Java 开发经验；精通 java 编程语言。2． 熟悉web service、SOA、ESB、JBI等相关技术与规范理念。3． 熟练掌握SpringBoot，Spring Data JPA，Hibernate。4． 熟悉Unix/Linux系统常用操作命令和 SHELL 脚本编程。5． 熟悉oracle、DB2、Informix等大型数据库开发，熟悉 SQL。6． 熟悉Jboss、Weblogic、WAS等常用中间件。,金融,500-2000人,web,宁波
H5前端开发工程师,https://www.lagou.com/jobs/6978543.html,鄞州区,6k-12k,中信网络科技股份有限公司,3-5年,本科,"午餐补贴,五险一金,年终奖，双休，年休假","岗位职责1.负责手机和web项目前端核心代码实现；2.配合后段开发人员进行界面和接口集成;3.持续优化前端界面和脚本，保证兼容性和高性能；4.富有挑战的前端新技术研究;5.与团队保持良好的沟通，提供合理的技术方案建议。任职条件1. 2年以上H5前端开发经验，本科及以上学历；2. 能独立完成div+css设计排版、制作成符合web规范的静态html代码；3. 精通Javascript,HTML5,css3,AJAX等前端技术；4. 熟悉Web前端主流技术框架，如vue/jquery/jquerymobile/bootstrap/angularjs等；5. 熟悉WEB标准，熟悉一种服务器端脚本语言优先(PHP、Java)；6. 了解PC不同浏览器的差异重点IE10 IE8 Google Mozilla Firefox Safari 等；7. 有良好的沟通协调能力，有责任心，思维逻辑性强；",金融,500-2000人,web,宁波
前端开发工程师,https://www.lagou.com/jobs/7165817.html,鄞州区,6k-12k,上海驻云信息科技有限公司,1-3年,本科,五险一金，带薪年休假，节日福利，双休,"工作职责:1、完成UI设计师的设计要求，将UI设计稿转换多浏览器适配的WEB页面；2、配合后台工程师一起研讨技术实现方案，进行应用及系统整合；利用HTML5/ Node.js/CSS3等技术实现网站和客户端的前端页面；3、编写可复用的用户界面组件；4、持续的优化前端体验和页面相应速度，实现异步加载，保证兼容性和执行效率，确保产品具有优质的用户使用体验。任职资格:1、全日制本科及以上学历，计算机相关专业， 1年以上前端开发工作经验；2、具有较强的学习和独立分析能力、工作责任心、良好的沟通能力和团体合作精神；3、精通JavaScript、HTML、CSS等前端技术，熟悉Bootstrap，Jquery等前端的框架和技术，熟练运用MVC架构和设计模式；深刻理解Web标准，会响应式页面开发；熟悉java""script""与后台的交互方式；了解移动HTML5应用。","移动互联网,企业服务",150-500人,web,宁波
Java开发工程师（远程在家办公）,https://www.lagou.com/jobs/7113134.html,江东区,13k-17k,上海盘古餐饮管理有限公司,3-5年,本科,"五险一金,团队氛围好,技术点多","岗位职责：1、负责与组员共同完成公司网络点单产品云pos的开发2、与组员共同完成公司产品关键技术突破3、平台类产品、应用类产品开发4、技术栈：ReactJs、SpringBoot、Mybatis、Redis、WebSocket、MongoDB、Spark、Hadoop生态岗位要求：1、3年以上的 J2EE 应用开发经验,对主流开发框架,如 Spring、SpringMVC、Mybatis、SpringBoot等有全面的了解和掌握2、熟悉前端流行框架，如JavaScript、Freemarker、VUE、jquery、HTML+CSS、AJAX等3、精通MySQL、Oracle等常用关系数据库开发，能针对项目特性设计性能较优的数据库结构4、具有RESTful、Netty、Mina、RPC、node.js、微服务等的使用及开发经验5、 熟悉前后端分离开发模式,能独立完成功能模块的研发和编码,具有良好的代码风格、安全意识、代码洁癖6、熟悉常用的分布式缓存及消息队列技术，如Memcached、Redis、分布式任务调度平台XXL-JOB等，并运用于实际环境的优先考虑7、熟悉相关负载代理软件，如Nginx、HAproxy、F5等，了解集群高可用HA等技术优先考虑8、熟悉大型电商企业Web优化方案、调优、问题跟踪定位、监控等优先考虑9、有电商系统开发经验、有CRM会员系统、商品系统、订单系统开发经验优先10、熟练使用maven\git\svn\ jenkins，优先考虑11、熟练使用Dubbo以及阿里云等优先考虑可安排远程电话或视频面试集团总部在上海，工作形式为远程在家办公",消费生活,2000人以上,web,宁波
java开发工程师,https://www.lagou.com/jobs/4014620.html,慈溪市,5k-10k,慈溪市顺通网络技术有限公司,不限,大专,"开发,软件,JAVA,计算机系",职位要求：（asp.net大牛也招）1、有1年Java、WEB及Server项目开发经验，Java基础扎实，规范的编码，精通设计模式。2、熟悉常用的前端框架vue、react、angluar（其一）相关技术。3、熟练使用mysql、oracle 以及相关优化，对memcached、redis、hadoop等开源框架有使用经验更佳。4、了解Linux下常规操作，熟悉shell、awk等优先。5、有良好的沟通能力，具有跨部门协作的经验，推进能力强，责任心强。6、积极主动，较强的学习能力，能够思考和优化解决方案，能够独立完成项目的设计和交付。1提供宿舍，水电，网络，热水器，洗衣机等。工作地点1：慈溪桥头镇东工业区(日旺北路)29-1号.工作地点2：慈溪市文化商务区凯玛大厦（暂时对技术人员开放）自己开车来：使用百度地图搜索 “慈溪市顺通网络”即可找到。乘车路线： 1、慈溪来公司：从慈溪客运中心站坐201/263路（白天）或者801（晚上）公交车到枫林道口站下车，然后往日旺北路往北方向直走10分钟（约800米）可见顺通网络。 2、宁波北站来公司：北站坐8路到红梅新村换378路公交车到龙山公交中心站，坐201路公交车在枫林道口站下车，，然后往日旺北路往北方向直走10分钟（约800米）可见顺通网络。3、宁波南站来公司：南站坐501路到公交庆丰桥站换378路公交车到龙山公交中心站，坐201路公交车在枫林道口站下车，，然后往日旺北路往北方向直走10分钟（约800米）可见顺通网络。4、杭州来公司：杭州至慈溪客运中心站坐201/263路（白天）或者801（晚上）公交车到枫林道口站下车，然后往日旺北路往北方向直走10分钟（约800米）可见顺通网络。 5、上海来公司：上海至慈溪客运中心站坐201/263路（白天）或者801（晚上）公交车到枫林道口站下车，然后往日旺北路往北方向直走10分钟（约800米）可见顺通网络。 5、余姚北站来公司：余姚北站坐293至桥头镇枫林道口站下车，然后往日旺北路往北方向直走10分钟（约800米）可见顺通网络。,"移动互联网,教育",15-50人,web,宁波
软件开发/测试,https://www.lagou.com/jobs/7064897.html,镇海区,5k-7k,上海深擎信息科技有限公司,应届毕业生,本科,五险一金 人工智能,开发/测试工程师类                                                               参与各类金融AI产品研发测试等技术实现                             工作方向：Java开发、web前端开发、软件测试                   对应院系：信息科学与工程学院,人工智能,50-150人,web,宁波
前端开发工程师,https://www.lagou.com/jobs/7190711.html,鄞州区,6k-10k,宁波恩通物流科技有限公司,1-3年,不限,项目型管理，任务导向，不需要打卡,岗位职责：1、负责移动端HTML5页面产品的研发； 2、根据产品需求完成相关产品功能开发； 3、持续优化系统在各平台下的兼容性，提高执行效率； 4、配合后台工程师一起研讨技术实现方案，进行应用及系统整合。 任职要求：1、1年以上web前端开发经验；2、科班毕业；3、积极主动，责任性强。,"物流丨运输,软件开发",15-50人,web,宁波
测试工程师,https://www.lagou.com/jobs/6210740.html,鄞州区,10k-20k,宁波逸享电子商务有限公司,不限,本科,发展前景优,"职位描述1.负责线上线下零售体系、供应链集团信息化相关平台的测试工作，制定项目测试方案，计划并实施，保证项目质量和进度；  2.根据产品和项目特点，提出合理的技术解决方案，并负责设计和实现相应工具、平台，提高效率与质量 ； 3.设计与执行测试用例，跟踪定位产品软件中的缺陷或问题 ； 4.参与产品需求、系统设计和程序代码的评审工作，并提出改进意见 ； 5.评估项目质量风险，与产品经理和开发人员就项目进度和问题进行沟通。 任职资格 1.计算机及相关专业本科及以上学历； 2.具备3年以上无线端开发/测试 或者 web产品开发/测试 ； 3.自动化测试常用工具（如monkeyrunner，appium,selenium等）； 4.掌握PHP/JAVA/C/C++或几种脚本语言如python/shell 等，能熟练阅读代码或熟练编写代码； 5.精通软件测试理论和方法，熟悉互联网行业测试环境及相关技术 ； 6.熟悉Linux/Unix操作系统，或LAMP架构 ； 7.善于学习和运用新知识，具有良好的分析和解决问题能； 8. 具备严谨的逻辑思维和测试发散思维，敏锐发现项目风险； 9.熟悉电商后台、零售业务、供应链管理业务流程/技术架构优先。","电商,社交",15-50人,web,宁波
