job_name,job_url,job_location,job_salary,job_company,job_experience,job_class,job_given,job_detail,company_type,company_person,search_key,city
网络销售,https://www.lagou.com/jobs/7055695.html,盘龙区,4k-8k,钿京（云南）网络科技有限责任公司,1-3年,大专,六险二金、带薪年假、团建，带薪休假,"一，【岗位名称】：网络销售﻿二，【工作职责】：1.负责帐号管理，产品上架上传，维护优化，站内推广，产品销售；2.确保帐户安全，保证店铺良好好评，制定产品销售策略；3.处理客户邮件及查询,提高Review的质量和数量；4.及时跟踪订单信息，处理客户投诉，对客户的退换货进行妥善处理；5.根据部门销售目标和计划，达成销售业绩。﻿三、【任职资格】：1.良好的计算机操作能力；2.有较强的学习能力和数据分析能力；3.对网络销售有浓厚的兴趣和激情；4.具备良好的沟通表达能力，团队合作精神；5.能独立解决平台上各种客户问题，包括咨询、售后、处理投诉等；﻿四、【工作时间】： 星期一  至  星期五上午： 8：30-12：30下午：13：30-17：30﻿五、【薪资待遇】：基本薪资+绩效考核4k-12k﻿六、【福利待遇】：六险二金、带薪年假、团建、带薪旅游、带薪休假（儿童节假期、婚假、产假、丧假）、水果餐、下午茶、体检、生日福利、话费补贴、内购、加班补贴、节日大礼包、降温取暖费。","数据服务,软件开发",15-50人,深度学习,昆明
销售专员,https://www.lagou.com/jobs/7143824.html,盘龙区,10k-15k,昆明顶呱呱经济信息咨询有限公司,不限,不限,团队强大，薪资待遇高，事情少,有活力、自信、专业的年轻团队，本着喜欢学习研究，乐于分享、共同成长、共同发展、的态度，我们有舒适的办公环境，轻松的工作氛围，我们所从事的行业有着巨大的发展空间，加入我们，努力就会获得回报！职位要求：1、 喜欢销售，对金融行业感兴趣2、 敢于跟客户沟通性格开朗自信3、 由自己的梦想，有强烈的金钱欲望4、 有团队意识、主动性强、服从管理薪资待遇：《5000-30000》40%以上业绩高额提成➕奖金公司提供免费专业的业务技能销售技巧培训，能迅速的帮助你提供销售技巧;无需担心工作一头雾水。,金融,150-500人,深度学习,昆明
Android攻城狮,https://www.lagou.com/jobs/1669023.html,五华区,6k-10k,云南芮米科技有限公司,1-3年,不限,大牛领导，弹性工作时间，五险一金，项目奖,"岗位职责
 负责Android新应用开发以及现有项目维护。
 文档编写。
 负责为Flutter编写插件。
我们对你的期望：
 计算机相关背景专业；
 有完整Android应用开发经验；
 熟练使用Android各种调试工具；
 良好的编码能力及习惯，良好的算法分析和实现能力；
 具备良好的团队精神和沟通意识，责任心强，工作认真细致；
加分项：
 有上线作品，技术博客或github有开源项目；
 有部分前端知识，具备良好的学习能力，适应新的开发方向；
你将获得：
 不打卡，不打卡，不打卡，弹性办公时间。
 五险一金。
 电脑购买补助。
 良好的团队氛围，扁平管理。","移动互联网,数据服务",15-50人,深度学习,昆明
java开发工程师,https://www.lagou.com/jobs/6832910.html,盘龙区,10k-15k,信息技术力量（成都）有限公司,3-5年,本科,福利待遇、发展前景,岗位职责：1. 参与软件技术框架设计以及搭建，以及技术难点攻克；2. 参与软件设计、完成软件部分功能设计；3. 开发关键代码，并指导中初级开发人员遵从设计、规范进行系统开发；4. 按照公司软件开发管理规范要求，编写软件开发说明文档；5、负责项目团队的技术指导以及系统技术方案制定；6、带领团队进行项目实施。任职要求：1、4年以上软件项目开发经验，做过team leader或者项目管理者，则更佳；2、熟练掌握SpringCloud，以及技术难点的攻克；3丶熟练掌握JAVA开发语言，对spring、VUE等开源框架有深入的了解，自己能够搭建SpringCloud等相关框架，自己写过核心功能；4、熟悉MySQL、oracle、Nginx的使用；5、能优化系统性能，解决项目中遇到的疑难杂症；6、熟悉Linux 环境下应用的的安装部署和日常维护；7、熟悉JAVA软件项目相关的开发、测试、实施流程和标准，具有良好的学习能力，组织、协调和沟通能力，有较强的责任心和事业心；8、具备良好的编写代码、逻辑思维能力、需求分析能力，良好的冲突处理能力、组织能力。,"移动互联网,数据服务",50-150人,深度学习,昆明
销售经理,https://www.lagou.com/jobs/7079557.html,盘龙区,8k-16k,汉海信息技术（上海）有限公司,3-5年,本科,门票度假商务部大客户经理,工作职责：1.负责收集各类渠道和商家的最新信息，达成与区域内的景区合作签约、产品运营、信息维护等2.通过运用景区门票营销工具，整合站内外资源，确保在线产品的竞争优势，包括但不限于预订条款、价格、库存、货架展示等3.负责与景区沟通线上及线下活动方案，跨部门沟通协调，跟进提报、审批以及项目落地等4.围绕着公司的战略方向，帮助景区提高运营效率，高效执行并达成目标岗位要求：1.本科及以上学历，3-5年以上旅游行业或大客户销售工作经验者优先2.具备独立思考及较强的学习的能力，良好的人际沟通及协调能力3.条理清晰、思维敏捷、有责任心及超强的执行力、抗压能力4.具备较强的数据分析能力，熟练操作各类办公软件（包括不限Word、Excel、 PowerPoint等）,移动互联网,2000人以上,深度学习,昆明
销售专员销售代表,https://www.lagou.com/jobs/6866424.html,五华区,8k-10k,云南溢本商贸有限公司,不限,大专,节假日福利，定期体检，大假旅游,岗位职责：1、协助已有贷款意向的客户，负责确认具体的需求和疑问的解答2、协助已有贷款意向的客户，负责过程的跟进和资料的提交3、负责初步核实客户资料的合规性、完整性岗位要求:1、学历为大专及以上，特别优秀者可放宽学历要求2、沟通能力强，为人踏实诚恳，学习能力强3、普通话标准、情感充沛、语言富有感染力者优先,金融,15-50人,深度学习,昆明
催收员,https://www.lagou.com/jobs/6870260.html,五华区,3k-5k,昆明乙良商务咨询有限公司,不限,不限,五险一金，定期团建，节日福利，晋升空间大,岗位职责：1，以专业，规范的程序协助处理逾期账款的回收，维护客户信用，对重点受访对象定期进行管理。2，与相关受访客户沟通，督促客户及时还款。任职资格：1.学习能力强，沟通能力强，服从上级安排2.学历不限，18岁以上3.无不良征信记录、无犯罪记录,金融,15-50人,深度学习,昆明
设计师,https://www.lagou.com/jobs/7154220.html,西山区,3k-6k,云南汉鼎商贸有限公司,不限,大专,五险一金,工作内容：1、根据客户预约负责上门量尺，进行客户沟通和量尺详实记录工作，深度挖掘客户需求；2、根据客户需求结合公司产品标准，按时完成配套方案效果图设计；3、负责客户需求方案解说、沟通，修改及配套服务，促进销售达成。职位要求：1、全日制大专以上学历，设计类相关专业，有设计经验者优先，欢迎应届生应聘；2、熟悉 CAD、3DMAX、 PS等基础设计软件操作，懂圆方软件者优先考虑；3、具备良好的沟通表达能力、销售能力、审美能力、色彩搭配能力。,"消费生活,房产家居",150-500人,深度学习,昆明
普工操作工,https://www.lagou.com/jobs/7145888.html,五华区,5k-7k,昆明观湖商贸有限公司,3-5年,不限,包吃住福利待遇好工资稳定不拖欠,岗位职责：1、长白班为主，坐班，轻松不累；2、按工艺要求进行生产操作；3、服从领导安排，完成本岗以外的技术学习任务；4、按照车间主管要求，按时按量完成生产任务，完成当日当月生产任务。任职资格：1、年龄16-45周岁，男女不限，学历不限，经验不限，可接收应届毕业生。2、面试时必须要有二代身份证原件；3、合适当天可安排，可预支工资。薪资待遇：（1）月综合工资5500-7000；（2）上六休一，上班休息时间充足；（3）薪资发放：每月10号发工资。福利待遇： 为了保证您能安心工作，我们为您解决吃住等问题：1、免费提供住宿，标准4-6人间，独立的阳台、阳台、空调、冰箱、彩电、饮水机、洗衣机、无线网；2、公司依法按照国家规定的缴纳养老、医疗、工伤、失业、生育保险；3、公司依法为员工办理社会保障，并额外为员工办理医疗自保基金，提供双份保障；4、员工享有国家法定假、工伤假、婚假、产假、带薪年休假等假期。,其他,15-50人,深度学习,昆明
房地产销售,https://www.lagou.com/jobs/7053212.html,西山区,3k-6k,昆明贝壳房地产经纪有限公司,不限,大专,岗前培训/师傅带教/晋升透明/高新提成,"工作职责1.收集社区楼盘及商圈生活配套信息， 并根据客户需求，帮助客户完成房屋交易、租赁、资产管理等业务；2.通过Online to Offline(O2O)模式，运用链家网、贝壳网、Link等互联网平台及工具完成房客源的开发与维护，为客户提供全流程房产交易服务；3.参与商务谈判，负责业务跟进、客户信息登记及客户关系维护，与客户建立长期良好的业务合作关系；4.深度挖掘客户需求，为其定制相应的资产管理方案与基础房产法律咨询服务。薪资待遇3200-3400底薪 业绩提佣（15%-75%）←按级别通提或阶梯提成 晋升空间：经纪人—店长—商圈经理——总监—分公司总经理 （1） 经纪人的发展可以选择职业经纪人的专业路线或管理路线进行发展 （2）管理路线为： a、房产经纪人及营销管培生发展路线： 1）置业顾问——店经理——商圈经理——总监——城市分公司总经理；2）房产经纪人/置业顾问——分公司/事业部管理层任职要求： 
 2020届统招专科及以上学历，无专业限制；
   阳光自信，具备较好的沟通表达能力和学习能力； 
 务实正直，高度的工作热情，强烈自驱，渴望成功；
  对房地产经纪行业有一定的认可度，意向从事营销相关工作。",企业服务,50-150人,深度学习,昆明
信用卡销售,https://www.lagou.com/jobs/7114181.html,盘龙区,6k-12k,深圳分期乐信息技术服务有限公司云南分公司,不限,大专,底薪+五险一金+提成+各种福利,"招人，招人，招人A 岗位要求：1，大专以上学历或者芝麻分660以上2，具备一定的销售工作经验，且原销售表现中等以上3，学习能力，抗压能力，适应能力强4，具备一定金融知识5，有一定的销售工作经验者可放宽学历要求6，需要超强执行力和抗压能力，能够服从管理工作内容1,推广公司分期乐app2，帮助客户授信额度并销售使用3,地推扫街工作模式福利待遇:1，入职五险一金2，完善的新人入职培训及精英销售手把手教3，定期团建活动及旅游，生日会等4，每年涨薪及年终奖5，活跃开放的快乐工作的团队氛围补充说明:1，公司是美国纳斯达克上市公司，目前正在扩大团队规模，如果你是有梦想的人，如果你是不安于现状的人，如果你是对高收入有追求的人，欢迎你加入2，公司可以保证在这里付出和回报一定成正比，团队平均工资在2万以上，最低没有低于1万，入职有专业业务培训和老带新手把手辅导，小白也可以轻松上手成为销售精英3，本团队属于精英团队，在这里不仅可以得到高收入的回报，还可以得到能力大幅的锻炼和提升，真正的让你掌握销售这门技能，不需要你现在很优秀，我们需要想变得优秀的你4，不用每天到公司打卡",金融、消费生活,2000人以上,深度学习,昆明
橱柜/衣柜/木门/全屋定制设计师,https://www.lagou.com/jobs/7099181.html,西山区,15k-30k,云南海衡商贸有限公司,1-3年,大专,底薪加提成 绩效奖励 工龄奖励 五险,1、具备1-3年或以上建筑建材装修装饰以及橱衣柜、木门、家居或全屋定制相关主案工地测量、设计、施工等相关工作经验；2、能够掌握且100%的熟练运用CAD、三维（3Dmax、三维家、酷家乐等）、PS等设计软件完成实际设计工作；3、具备吃苦耐劳、乐于付出、敢于挑战自我、服务意识及态度良好、善于思考富有创意创新思维的优秀者、奋斗者；4、公司目前有17人精英设计团队，目前扩招5人，打造“37”精英战队；有意愿从事设计工作者但经验不足、品质态度优良，愿意学习且转化优良者公司愿意给予时间学习和培养，将给予专业和精英设计师团队进行培训和辅导。5、欢迎和期待热爱设计工作者加进行加持！,其他,50-150人,深度学习,昆明
投资顾问,https://www.lagou.com/jobs/7198027.html,盘龙区,5k-10k,云南裕基经济信息咨询有限公司,不限,不限,前途无量,"公司是你坚实的后盾，公司一直秉持，快乐工作，轻松赚钱！职位简述：    1.通过线上搜集新客户的资料并进行沟通,开发新客户；    2.积极开拓市场，做好客户资料的收集与整理；    3.通过拜访及电话拜访客户，建立与维护客户关系；    4.维护老客户的业务,挖掘客户的最大潜力；任职要求：    1、大专及以上学历，有无工作经验皆可，但要有强烈的学习欲望；    2、具备良好的沟通能力和团队协作能力；    3、有较强的执行能力，能够高度认可公司的企业文化和战略决策；    4、能够自觉遵守公司的各项规章管理制度；    5、工作认真细致，思路清晰，有计划性、条理性的去完成工作。薪资待遇：    1、无责底薪+高提成+各种补助；    2、周末双休+国家法定节日+超长带薪年假+灵活的业务培训，快速提升个人能力；    3、定期的员工娱乐活动，聚餐、旅游、下午茶等；    4、完备并不设限的晋升体系，有专业&管理两条路线可选。成功的路上需要您，希望与您一起走的更高更远！",金融,50-150人,深度学习,昆明
销售,https://www.lagou.com/jobs/7175475.html,五华区,5k-10k,中企动力科技股份有限公司昆明分公司,不限,大专,带薪年假、公费旅游、定期团建、五险一金,一、公司介绍：中企动力科技股份有限公司成立于1999年，是香港联合交易所上市公司中国数码信息有限公司旗下的一家大型股份制高新技术企业。中国数码信息有限公司位于北京，旗下主要企业包括中企动力、新网等。中企动力科技股份有限公司自成立以来始终致力于为中国的企业提供信息化服务，在国内开创了以运营模式实现企业信息化的先河。国际权威机构IDC报告显示，中企动力科技股份有限公司已连续六年获得中国IT外包服务市场本土企业**名，与国际IT服务巨头IBM、HP共居中国IT外包服务市场前三位，并于2007年位列IT外包服务市场榜首，谱写了中国本土品牌奋斗、超越的精彩篇章，欢迎想超越自己、想成就事业的伙伴加入我们的团队！ 二、招聘职位：（一）商务代表（3500-8000元）岗位职责：一对一顾问服务，为中小型企业开展信息化建设电子商务营销需求，提供专业的企业网络营销整体解决方案。岗位条件:1、积极主动的心态，愿意接受挑战，发现新的自己；2、工作勤奋踏实，有责任心，能够承受较强的工作压力；3、有较强的学习能力、语言表达能力和沟通能力；4、有较强的团队合作意识，有挑战高薪的信心和决心。（二）储备干部（销售类）（4000-12000元）岗位职责：1、经过公司系统的培训，能够熟悉企业业务流程，识别目标客户潜在需求；  3、专业的发展路径：管理线（储备学习→经理→分公司总监→区域总监）。 岗位条件：1、专科及以上学历，市场营销、通信、信息、互联网等相关专业应届毕业生；2、积极主动的心态，愿意接受挑战，能承受较大的工作压力；3、性格外向，反应灵敏，沟通能力强。三、公司为您提供：1、薪资结构：销售方面：底薪+绩效+提成（20%，业内最高）+奖金+津贴+餐补（不同的职级岗位，相应的通讯补助、岗位津贴、房补等福利）；2、入职后即签订劳动合同，给您职业安全感有力保障；3、完备的社会统筹保险，五险：(养老、失业、工伤、医疗、生育）；一金（公积金）；4、优秀员工将代表分公司参加集团公司组织的年度ceo大会；公司每年还会组织优秀员工参与海外游（如：马尔代夫、韩国、日本、欧洲游等）；5、公司提供完善的行业、专业、销售技能培训和职业发展规划；6、全体员工除享受以上福利待遇外还将享受带薪年假、病假、婚假、丧假、产假等国家法定节假日。 四、公司地址及联系方式:中企动力科技股份有限公司昆明分公司昆明市五华区祥云路59号银佳大厦南侧11楼（公司近南屏街，地铁东风广场/五一路站步行5分钟）官方网址：www.300.cn,"移动互联网,电商",50-150人,深度学习,昆明
php后端,https://www.lagou.com/jobs/7054938.html,盘龙区,3k-5k,云南盟派科技有限公司,1-3年,大专,福利待遇好，公司发展前景良好,1、1到3年PHP开发经验；2、熟练掌握PHP语言，熟悉或了解Laravel、Yii、ThinkPHP等框架；3、熟悉 MySQL数据库设计和优化，熟悉在代码层面优化查询的基本方法；4、了解非关系型缓存数据库，如Redis、memcache，有开发经验；5、熟悉或了解前端主流技术和框架，如vue等，能自如应用；6、熟悉各种消息中间件，如RabbitMQ等；7、熟悉Linux/Unix系统环境搭建和基本操作；8、具备良好的沟通合作技巧，较强的学习能力、责任心及团队合作精神；9、学习能力强，适应快，能快速入手二次开发；10、大专及以上学历，计算机相关专业毕业优先。,电商,50-150人,深度学习,昆明
销售顾问,https://www.lagou.com/jobs/6876441.html,盘龙区,5k-10k,云南翰沣教育信息咨询有限公司,不限,不限,可参与公司课程学习，公众演说企业管理等。,职位描述 岗位职责： 勤奋好学，有梦想，有追求。任职要求：也许你没有高学历，也许你没有高收入，也许你刚走出校门，也许你还在为找工作而奔波，来这里！！！公司提供平台，只要你愿意学习，肯付出，你就一定会从平凡走向优秀。有闯劲的85后，新锐的90后，期待你的加入，选择比努力更重要职业规划：1、达标即可晋升，升官即可发财（晋升销售主管岗位底薪3000至8000元以上+个人提成+维护提成+高额团队提成），从业务员到总经理晋升通畅、标准公开透明，你能清晰康到自己的位置和方向。2、各块业务之间灵活选择拓展发展机会，帮你释放自己的天才，只要你足够优秀，可以通过培养成为主持人、讲师、咨询师、职业经理人。3、全员持股计划、年终分红、成为公司的合伙人。         培训机会：免费参与公司课程学习，如公众演说、舞台主持、企业管理等。工作时间：我们没有事业单位一样的双休，在这里工作的伙伴也没有强大的家庭背景作为支撑，我们只是一群积极乐观爱开玩笑的逗比。周一至周六8:30--18:00每个月可以休息4天，如果你需要去相亲见对象，一定要提前告诉排班的同事，大家会主动帮助你的，我们的目标只有一个-----你一定要幸福!,"企业服务,教育",50-150人,深度学习,昆明
电话销售,https://www.lagou.com/jobs/6868606.html,盘龙区,3k-6k,云南翰沣教育信息咨询有限公司,不限,大专,可参与公司课程学习，公众演说企业管理等。,职位描述 岗位职责： 勤奋好学，有梦想，有追求。任职要求：也许你没有高学历，也许你没有高收入，也许你刚走出校门，也许你还在为找工作而奔波，来这里！！！公司提供平台，只要你愿意学习，肯付出，你就一定会从平凡走向优秀。有闯劲的85后，新锐的90后，期待你的加入，选择比努力更重要职业规划：1、达标即可晋升，升官即可发财（晋升销售主管岗位底薪3000至8000元以上+个人提成+维护提成+高额团队提成），从业务员到总经理晋升通畅、标准公开透明，你能清晰康到自己的位置和方向。2、各块业务之间灵活选择拓展发展机会，帮你释放自己的天才，只要你足够优秀，可以通过培养成为主持人、讲师、咨询师、职业经理人。3、全员持股计划、年终分红、成为公司的合伙人。         培训机会：免费参与公司课程学习，如公众演说、舞台主持、企业管理等。工作时间：我们没有事业单位一样的双休，在这里工作的伙伴也没有强大的家庭背景作为支撑，我们只是一群积极乐观爱开玩笑的逗比。周一至周六8:30--18:00每个月可以休息4天，如果你需要去相亲见对象，一定要提前告诉排班的同事，大家会主动帮助你的，我们的目标只有一个-----你一定要幸福!,"企业服务,教育",50-150人,深度学习,昆明
主播艺人,https://www.lagou.com/jobs/7163963.html,盘龙区,5k-10k,昆明星宿文化传媒有限公司,不限,不限,周末双休，工资5000保底上不封顶！,1.年龄18--35周岁，五官端正，无不良嗜好2.具备相关行业经验，无经验可培训，具备良好的学习能力3.普通话熟练，具备一定才艺，如:唱歌，跳舞，说话风趣幽默，表演等4.热情活泼，思维活跃，具备良好的个人修养薪资待遇:根据月播时长而定，月薪5000-10000+礼物收益(根据个人条件及相关经验可做调整)，上不封顶。每周定期音乐及舞蹈培训。多平台可供选择 抖音，陌陌，腾讯，快手等。,社交,50-150人,深度学习,昆明
