job_name,job_url,job_location,job_salary,job_company,job_experience,job_class,job_given,job_detail,company_type,company_person,search_key,city
数据分析工程师,https://www.lagou.com/jobs/7019581.html,雨花区,10k-20k,长沙牛感科技集团有限公司,应届毕业生,硕士,"五险一金,双休+法定",岗位职责：1、负责企业大数据平台数据模型设计已经数据仓库的建立，根据数据仓库及BI项目的需求，制定ETL相关的设计方案和开发计划，并进行后续的设计、实施、维护；2、负责整个数据仓库数据模型的管理工作（建模，设计，实施）；3、负责沟通需求，将需求转化为模型及mapping；4、负责数据源调研、入库、开发的全流程工作，并保证数据质量；5、负责数据仓库的模型的标准制定，实施，监督工作；6、承担数据抽取、清洗、转化等数据处理程序开发。7、日常数据异常排查及分析。 任职要求：1、三年以上BI工作经验，至少一年以上数据建模工作， 能够熟练运用erwin、PowerDesigner等至少一种建模工具； 2、精通java、Python语言，两年以上开发经验；3、精通Hadoop，hive，spark，sqoop等；4、精通Oracle、SQL Server、MySQL等主流数据库的应用设计、性能调优及存储过程的开发具有2年以上ETL相关开发经验；5、对ETL有较深刻的认识，对于数据的定义有独到理解，熟悉至少一种ETL工具；6、有较强的沟通能力，能够将需求转化为模型，能够独立编写mapping设计；7、拥有良好的代码习惯，要求结构清晰，注释清晰，命名规范，逻辑性强，代码冗余率低，尤其是习惯写开发文档。,"物联网,区块链",15-50人,python,长沙
网络安全开发工程师,https://www.lagou.com/jobs/7015800.html,长沙县,12k-20k,湖南天河国云科技有限公司,3-5年,大专,期权分红、合伙人股权激励、公司品牌背书,一、岗位职责1、负责区块链平台、智能合约。钱包、Web网站、APP应用、系统渗透以及日常监测等渗透测试和源代码审计工作；2、负责安全测试技术的研究工作；3、负责安全相关的工具和系统的开发工作。二、任职要求1、计算机相关专业，本科及以上学历，硕士及以上学历优先；2、有三年以上安全行业工作经验，掌握典型网络安全攻防技术原理，有渗透测试、Web或APP漏洞挖掘实战经验，精通各类渗透测试工具和软件的灵活使用；3、具备WEB系统源代码审计经验。熟练使用Java/Python/C++中至少一种语言，能够快速编写常用工具；4、有很强的逻辑分析能力，善于总结和抽象提炼，以及良好的文字表达能力；5、具备CISSP、CISP、CISA、CWASP等认证优先考虑。,"移动互联网,金融",50-150人,python,长沙
数据分析师,https://www.lagou.com/jobs/7171839.html,岳麓区,10k-15k,湖南联信科技有限公司,3-5年,本科,五险一金 定期体检 周末双休 年底奖金,1、职位信息1. 负责信贷风控等方向模型需求分析和拓展，模型构建与验证；2. 独立或带领算法工程师负责模型项目化或产品化落地，实现业务与算法融合；职位需求：1. 数学/统计/计算机/金融工程等相关专业； 2. 熟悉贷前、贷后风控模型，对用户标签体系、用户行为分析有丰富经验，3年以上相关项目经验；3. 能根据业务场景合理设计模型算法，快速将模型落地、部署和监控；算法分析和实现能力强； 4. 熟练使用R/Python/Java编程语言；具有大数据系统Spark/hadoop/Hive等使用经验；5. 良好的团队合作精神，较强的沟通能力、抗压能力。,"移动互联网,金融",150-500人,python,长沙
Python实习,https://www.lagou.com/jobs/6723948.html,雨花区,3k-5k,湖南智圭谷信息技术咨询服务有限公司,不限,大专,福利待遇优越，发展空间大,岗位职责：1. 参与产品需求分析和评审；2. 编码实现功能需求，修复Bug缺陷和代码评审；3. 编写自动化测试用例。职位要求：1. 具有良好沟通能力、学习能力和团队协作能力，责任心强，积极主动，工作细致认真，有耐心。2. 实习生岗位开放，欢迎计算机或相关专业的应届生加入；工作时间：9:00-12:00 ；13:30-18：00，大小休，法定节假日照常放假,教育 软件开发,15-50人,python,长沙
运维研发工程师,https://www.lagou.com/jobs/6943785.html,开福区,12k-18k,湖南快乐阳光互动娱乐传媒有限公司,3-5年,本科,上市公司 福利待遇好 工作氛围好,岗位职责：1. 负责线上业务的日常运维、优化、容量管理等工作，7x24小时保障线上业务的稳定运行；2. 负责维护公司运维基础设施的正常运行；3. 负责公司运维基础设施开发，包括监控系统，运维平台，自动化部署系统，虚拟化平台；4. 研究运维新技术和方向，持续提高生产力。岗位要求：1. 有较大规模在线业务运维、优化等工作经验；2. 熟悉自动化运维工具Ansible，具有playbook相关编排经验3. 熟悉Linux操作系统，计算机网络等，基础知识扎实；4. Linux系统下熟练使用golang或Python、Shell等脚本语言开发；5. 有良好的时间观念，能很好的沟通交流，乐于分享；6 学习能力强，肯钻研，认真踏实,文娱丨内容,500-2000人,python,长沙
后端开发工程师,https://www.lagou.com/jobs/6817162.html,开福区,15k-25k,湖南快乐阳光互动娱乐传媒有限公司,3-5年,本科,国企上市公司，发展空间大,"职位描述：会员通用服务、营销、增值产品的技术设计、开发和维护岗位要求：1.最少精通Python/Go/Java一种语言，熟悉Python, 掌握常见场景设计如缓存、高并发、高可用、高负载等；2.熟悉http协议，熟悉常见的Python web框架，包括但不限于Django、Tornado、aiohttp等；3.熟悉MySQL、RabbitMQ、Redis、Nginx，有一定的SQL调优经验；4.责任心强，工作主动，善于思考总结，深入业务，抽象业务；5.良好的代码习惯，结构清晰，命名规范，逻辑性强，有交易、活动系统相关经验者佳；6.有一定的前端开发经验者佳，如掌握nodejs，vue等。",文娱丨内容,500-2000人,python,长沙
初级技术服务工程师,https://www.lagou.com/jobs/6853275.html,岳麓区,3k-4k,北京易观智库网络科技有限公司,1-3年,本科,"五险一金,双休,下午茶,会玩儿",岗位职责：1、支持和处理客户在易观方舟交付前、中、后期方面遇到的各类技术问题；帮助客户排查、定位问题、解决问题；负责易观方舟大数据产品私有部署环境的安装及运维支持工作（大数据平台运维支持方向）；2、负责支持客户完成易观方舟各类SDK的接入工作（SDK技术支持方向）；3、负责开发和完善数据ETL工具及文档；不断提升客户技术支持的满意度（ETL开发支持方向）；4、负责开发和完善技术服务软件系统，提升内部项目管理与服务效率（应用开发支持方向)。岗位要求：1、有强烈意愿从事大数据行业，愿意利用科技改变世界，热爱大数据和数据分析行业。2、具有优秀的数学基础、逻辑思维强，愿意接受挑战3、性格开朗，有责任心，团队意识强。4、本科及以上学历，信息与计算机相关专业；985、211高校毕业生优先。 岗位技能要求：1、熟悉网络与通信，了解操作系统原理，熟悉数据结构与常用算法。2、对linux系统有认知和简单操作经验。3、对hadoop生态中的组件，有一定认知和简单操作经验。4、有一定的 java/python/scala 语言基础。5、有一定SQL基础。,"移动互联网,数据服务",150-500人,python,长沙
运维工程师,https://www.lagou.com/jobs/6147122.html,岳麓区,5k-10k,北京易观智库网络科技有限公司,不限,本科,会玩的大数据公司,"岗位职责：1、负责大数据产品的安装、升级以及日常运维排障工作。2、负责大数据产品运维体系、项目流程的改进。3、支持客户解决日常遇到的运维问题，反馈客户运维问题，优化产品运维工具。4、为售前提供运维相关方案，优化大数据产品的运维方案。5、协助客户完成基本的客户端埋点工作，与售前、项目经理共同完成POC、项目交付等工作。6、参与开发相关运维工具。（shell/python）6、能接受短期出差。（主要国内大城市）任职要求：1、统招本科学历，985，211高校优先，专业不限；2、愿意在长沙长期发展；3、对互联网、大数据行业有兴趣,可以确定较长期的职业规划；3、职位方面：愿意从事Linux系统运维工程师+大数据生态组件运维职位；以及部分shell/python开发、docker运维工程师工作；4、具有良好的沟通表达能力、团队合作意识以及较强的心理承压能力。","移动互联网,数据服务",150-500人,python,长沙
AI架构师,https://www.lagou.com/jobs/7184199.html,岳麓区,25k-50k,北京宝兰德软件股份有限公司,5-10年,硕士,五险一金，双休，年终奖，生日福利,"岗位职责    1、致力于智能运维（AIOps）场景下的机器学习应用落地，负责应用性能监控软件中时序数据的运维分析，包括       趋势预测，异常分析，跟因分析等。    2、参与核心数据模型设计，自动化并抽取分析模型落地为实际产品。    3、分析公司业务需求，设计AI软件系统架构，主导技术难题攻关。    4、参与关键组件和代码的CodeReview，评审AI开发人员的系统设计和代码质量，编写技术文档和制定开发规范。    5、推动技术和业务的融合，推动AI团队的架构设计能力提升。    任职要求：    1、本科及以上学历,计算机、数学、统计学专业毕业，硕士以及博士研究生优先。    2、具备5年以上的机器学习、深度学习经验和产品成功落地案例。    3、熟练Python开发语言，掌握SKLearn、Tensorflow、XGBoost等机器学习和深度学习框架。    4、有丰富的数据建模经验，掌握常用的数据建模方法和机器学习算法，如异常分析、回归、分类、聚类，相关性分析等,       对于时序数据分析有经验者优先。    5、有利用机器学习、深度学习框架落地实际项目经验，例如智能运维，NLP，图像处理等领域的项目经验；    6、有智能运维（AIOps）场景下的机器学习应用落地经验者优先。       7、有较强的团队沟通、协调能力, 强自驱力。    8、有AI团队的管理经验优先。",企业服务,150-500人,python,长沙
图像处理工程师,https://www.lagou.com/jobs/7173247.html,开福区,10k-20k,深圳航天工业技术研究院有限公司,3-5年,硕士,福利待遇，发展，平台,岗位职责：1、负责视觉产品中图像处理核心算法的设计与实现；2、编写相关技术文档、过程文档；3、指导初级算法工程师进行算法研发；4、参与/负责自然场景下目标的检测、识别、跟踪、测距和精准定位；5、对接后台工程师，合作编写接口文档并完成接口调试；6、配合硬件设计进行选型、调试，促进整个系统上线运行7、完成公司其他视觉相关需求岗位要求：1、计算机、模式识别、图像处理等相关专业，本科及以上学历，硕博士优先；2、熟练掌握Python、C++至少一种编程语言，有较强的图像算法分析与编码实现能力；3、熟悉常用的图像处理算法，熟练掌握OpenCV、TensorFlow、pytorch等处理库；4、熟练掌握一种目标检测算法框架如RCNN、Yolo、SSD等；5、2年以上图像处理算法设计与开发经验；6、有工业视觉项目经验，掌握视觉检测流程、目标测距、三维场景重建者优先。7、掌握深度学习计算机视觉研发相关技术，领域包括但不限于图像分类、目标检测、目标识别、关键点检测、语义分割等。,其他,50-150人,python,长沙
设备控制开发工程师,https://www.lagou.com/jobs/7173378.html,开福区,10k-20k,深圳航天工业技术研究院有限公司,3-5年,硕士,福利待遇，发展，平台,1、 熟悉C、python语言，ARM内核单片机开发2、 熟悉智能硬件、单片机编程、驱动编写，负责无人机、无人车控制接口3、参于相关研发项目的方案讨论与制定；4、操作系统移植，协助实验平台搭建；5、深度学习算法移植及参数调优；6、负责获取机器人底层各类传感器数据并进行发布；包括：里程计、毫米波、红外、GPS、惯导、碰撞等；岗位要求：1、本科以上学历，自动控制、电子、电气工程及自动化相关专业；2、精通C、python语言编程，熟悉STM32，ARM等各类单片机或嵌入式设备；3、熟悉Linux系统架构，Linux操作系统移植，有丰富的Linux操作系统驱动开发经验；4、熟悉I2C、SPI、串口等各类单片机接口；熟悉TCP/IP，UDP等协议的网络编程；5、熟悉无线通讯，高精定位；6、熟练使用大疆无人机者优先；,其他,50-150人,python,长沙
爬虫工程师,https://www.lagou.com/jobs/7157221.html,岳麓区,7k-12k,湖南中项永达科技有限公司,5-10年,大专,"年终分红,五险一金,股权期权,朝九晚六",岗位职责： 1. 负责分布式、可扩展的互联网爬虫系统的设计与开发。 2. 针对各种数据抓取需求进行爬虫系统的定制化开发。 3. 解决各种复杂条件下的网页抓取问题。 4. 根据系统要求灵活设计数据抽取策略和算法，提升数据抽取效率和准确性。 5. 持续优化系统流程和实现、监控系统运行、提高系统性能及稳定性。  * 任职要求： 1. 计算机及相关专业本科或以上学历，2年以上后端开发经验。  2. 掌握Mysql Redis 熟悉SQL查询的优化，有Mysql 多库多表开发经验。 3. 熟悉python编程技术，编程能力强。 4. 有爬虫系统开发经验，熟悉爬虫架构原理和数据爬取的各种策略和方法。 5. 熟悉网络通信原理和Web协议栈，有一定的HTML、CSS、JS基础。 6. 有强烈的责任心与主动性，有良好的团队意识，能独立解决开发过程中遇到的各种问题。,"企业服务,数据服务",150-500人,python,长沙
Linux容器技术开发工程师,https://www.lagou.com/jobs/6837712.html,开福区,15k-20k,天津麒麟信息技术有限公司,3-5年,本科,"五险一金,餐费补贴,通讯补贴",岗位职责：国产化平台上的容器云产品的适配和开发，主要是基于Kuberetnes容器云产品深度开发及Docker的开发和优化工作。任职要求：1、全日制本科及以上学历，计算机软件相关专业，英语四级及以上；2、1-3年相关工作经验，熟悉容器技术原理，生态系统，熟悉Kubernetes、Mesos、Swarm等容器管理系统； 3、具有Docker Kubernetes落地实践经验，熟悉Docker Kubernetes相关生态，有集成Docker落地经验者优先；4、精通Python或Go语言开发；5、熟悉Linux系统管理、熟练使用Linux下各种常用命令、能够熟练编写Shell脚本。,"移动互联网,信息安全",150-500人,python,长沙
服务器操作系统研发工程师,https://www.lagou.com/jobs/6314344.html,开福区,10k-15k,天津麒麟信息技术有限公司,1-3年,本科,五险一金,岗位职责：1、负责服务器操作系统产品的研发；2、负责服务器操作系统产品的技术支撑工作。任职要求：1、全日制本科及以上学历，计算机软件相关专业，英语四级及以上； 2、熟悉Linux操作系统；3、熟悉C/C++、Python语言，熟悉QT、GTK编程，具有良好的编程能力及规范；4、熟练掌握Shell脚本编程；5、具备较强的学习能力和团队协作能力；6、有开源软件开发经验者优先。,"移动互联网,信息安全",150-500人,python,长沙
etl工程师,https://www.lagou.com/jobs/7196894.html,天心区,10k-13k,深圳市华盛天成科技有限公司,1-3年,不限,福利待遇较好,工作职责：1、负责数据仓库ETL详细设计，ETL作业开发工作；2、根据业务需求开发ETL作业，对数据进行加工、转换、汇总，实现复杂的业务逻辑；3、负责Informatica相关产品组件的配置开发与系统运维等；4、分析SQL执行效率，提升SQL执行速度；5、参与数据仓库/数据集市的模型设计；任职要求：1. 计算机相关专业，3年以上数据仓库ETL相关工作经验，电力行业优先；2. 掌握数据仓库ETL开发方法论，了解数据仓库维度建模；3. 熟悉Informatica相关产品组件（包括PowerCenter(PWC)、Big Data Management（BDM）、EDC、DIH、AXON、MDM等优先；4. 至少熟悉一种主流ETL开发工具，如：Kettle、DataStage等，Informatica优先；5. 至少熟悉两种常见数据库，Hive/Oracle/SQLServer/PostgreSQL/DB2/Hbase等；6. 熟悉SQL，具备SQL性能优化能力，熟悉Hive SQL，有大数据处理能力者优先；7. 熟悉Linux/Unix环境及脚本开发（shell或python等）。,"软件开发,物联网",150-500人,python,长沙
全栈工程师,https://www.lagou.com/jobs/6987697.html,岳麓区,15k-25k,同程网络科技股份有限公司,5-10年,本科,上市公司,"工作描述：我们正在寻找一个有经验的高级全栈开发人员来优化公司的业务系统和技术创新。工作职责：优化线上业务系统，改进和创新。按照团队标准按时完成任务和项目工作，确保质量达到可接受的水平晚上和周末的时间可能需要处理线上紧急业务问题从技术设计、开发、测试、部署、维护和文档化方面掌握您的工作与产品团队和项目团队的其他成员合作，以简单、可持续的方式解决业务和技术上的挑战开发技能：前端:css,js,anguler,react,typescript,less,saas,gulp...后端:golang,python,nodejs,php,django,express js,desigin,cache,middleware...数据库:mysql,mongo db,redis,sqlite,sqlserver,oracle,SQL Clusters joins Sharding...DevOps:SCM,CI,CD,nginx,Ansible,graylog,SQS...移动开发:Hybrid Apps iOS/Android,React native,Ionic...以上技能至少每类掌握一项及以上所需知识，能力和经验：3年以上全栈开发人员经验精通网络语言：前端，后端，数据库，开发方法，移动开发需要具有""爬虫""和""微信小程序""的经验。响应式框架（例：Foundation或Bootstrap）的UI/HTML布局经验者加分很好掌握 golang 和 js，可以为前端或后端应用程序提供支持。熟悉http/https，protobuf，tcp等常用协议有大型并发系统开发经验。有Mac,xcode和调试iPhone应用方面的经验。有调试Android应用方面的经验。使用单页应用程序的经验加分具有火车票技术的经验将是优先考虑的。能够定义任务时间表，主持产品会议并提供开发解决方案的技术指导。",旅游,2000人以上,python,长沙
系统架构师,https://www.lagou.com/jobs/7074797.html,雨花区,13k-18k,中国电建集团中南勘测设计研究院有限公司,不限,本科,福利待遇好,一、工作内容主要从事系统的模块设计，模块之间的数据交流以及数据储存相关事宜二、基本要求1、专业：计算机科学与技术2、学历：本科及以上3、从业年限：3年以上工作经验（若无就业经验，则要求为应届毕业硕士生）三、能力要求能够设计系统每个模块的具体结构，会C#、python、C等语言，熟悉云-端架构编程，能解决开发过程中的难点,其他,2000人以上,python,长沙
算法开发工程师,https://www.lagou.com/jobs/7074828.html,雨花区,12k-16k,中国电建集团中南勘测设计研究院有限公司,不限,本科,福利待遇好,一、工作内容AI算法在工程领域的深度应用，算法结构的更新，数据处理等二、基本要求1、专业：计算机科学与技术、人工智能2、最低学历：本科3、从业年限：3年以上工作经验（若无就业经验，则要求为应届毕业硕士研究生）三、能力要求擅长深度学习、机器学习等算法，具有一定的编程能力，能熟练使用Python、C等语言,其他,2000人以上,python,长沙
测试运维工程师,https://www.lagou.com/jobs/5650387.html,长沙县,10k-20k,三一汽车制造有限公司,3-5年,本科,福利待遇、发展前景,"岗位职责： 1、 深度参与产品研发项目，熟悉测试流程，根据需求设计并执行测试用例，具备独立承担项目能力，保证产品质量和项目进度。  2、负责编写测试流程中各环节相关文档，如制定测试计划、设计测试用例，测试执行，记录缺陷，并跟踪整个缺陷的生命周期，编写测试报告； 3、熟悉掌握常用的测试工具，能够对所负责的项目进行接口测试，功能测试，性能测试；  4、搭建测试环境，执行升级sql，进行相关业务部署，分析错误日志；  5、配合解决测试过程中的问题，协助研发工程师重现、分析、定位、修复bug，帮助开发人员解决问题并验证； 6、总结测试过程中的问题，进行发布评估，并总结版本历史及遗留问题为以后测试提供关键依据； 7、开发自动化测试脚本，开发性能测试脚本,利用脚本和自动化工具提高日常任务的执行力和准确率； 8、积极思考如何通过技术手段提高测试效率，对项目流程的规范建设提出自己的见解；  岗位要求 1、统招本科及以上学历，计算机类相关专业； 2、3年以上软件测试工作经验，熟练搭建测试平台，精通软件测试理论和方法和软件测试流程； 3、熟练操作Linux系统命令,对计算机网络相关知识有一定了解； 4、熟悉主流的自动化测试工具，如Selenium、QTP;性能测试工具，如loadrunner、Jmeter;测试管理工具,如禅道、jira； 5、熟悉Mysql和Oracle等主流数据库，能编写较为复杂的SQL语句进行数据校验； 6、熟悉java，会Python或shell语言，编写过测试脚本的优先考虑； 7、熟悉SVN或GIT等工具，jenkins自动化运维工具； 8、具备跨团队沟通能力、协调能力和协作精神，具有高度责任心和积极主动的工作态度，工作认真仔细，较强的学习能力和技术钻研能力以及良好的沟通能力",汽车丨出行,2000人以上,python,长沙
高级产品经理,https://www.lagou.com/jobs/7203672.html,岳麓区,12k-18k,湖南流量互娱科技有限公司,5-10年,大专,发展前景,岗位职责：1、理解公司的战略规划和行动策略，调研并掌握业务部门的运营需求，在此基础上对负责的业务板块进行产品规划和设计；2、协调公司各层面、各部门，使其对产品的理解和认知保持一致；3、对产品的投入产出负责；4、掌控产品在各个运营阶段功能上线节奏，制定产品的迭代路线；5、输出业务需求文档（BRD），并与业务部门沟通达成一致；6、输出产品需求文档（PRD），确保公司战略在产品中落地，并与研发人员达成一致；7、输出产品原型，并指导UI设计人员工作；8、在产品研发过程中，配合项目经理做好项目范围控制和需求变更控制，解答研发团队在需求方面的问题；9、产品的发版验收；10、产品宣传材料编写、培训和宣讲；任职资格：1、5年以上产品策划管理经验，具备大中型企业产品规划和设计能力；2、擅长从用户角度考虑问题，对用户需求有较好识别判断能力；3、逻辑清晰，喜欢抽丝剥茧，乐于分析事物本质，擅长系统地解决问题；4、具有良好的审美和逻辑思考能力，富有想象力和创造力，具有敏锐的用户体验观察力；5、拥有良好的团队合作精神、较高的工作效率，乐于分享和交流，有良好的领悟力和沟通能力6、拥有很强的抗压能力，能打硬仗，愿意加入创业型团队，有主人翁精神；7、对电商、直播、供应链、支付、培训等业务领域中的两个以上有深入的研究和产品经验；8、有SaaS产品设计经验者佳；9、人机界面设计、设计心理学相关专业者优先，具备交互，视觉设计能力者更佳10、具有优秀的产品文档能力，能够产出标准的需求文档和设计文档。有BRD、MRD、PRD文档经验11、熟悉掌握Axure、Sketch等产品原型设计工具；12、了解SQL，熟悉至少一款大数据可视化工具，如 Tableau、FineBI、PowerBI；13、了解大数据、人工智能技术（如Spark/Hive/Flink、Python/Scala/SPSS等），有开发经验者优先；,"电商,软件开发",150-500人,python,长沙
