job_name,job_url,job_location,job_salary,job_company,job_experience,job_class,job_given,job_detail,company_type,company_person,search_key,city
数据库平台高级工程师（腾讯云全资子公司)（西安）,https://www.lagou.com/jobs/6987290.html,高新技术产业开发区,15k-25k,腾讯科技（深圳）有限公司,3-5年,本科,腾讯-西安子公司,"岗位职责 1、负责腾讯云数据库产品的云上业务、运维和监控工具等研发工作；2、负责专有云和公有云的产品提供部署支持和售后技术问题支持；3、负责对现有线上系统的稳定性优化，性能调优等工作；4、对客户现网问题进行技术分析和整理相关技术文档。岗位要求1、2年以上工作经验，熟练掌握Shell/Python/Golang等语言的一种，具备良好的编程风格；2、熟悉Linux运行机制、常用命令和工具、性能分析方法, 了解linux网络/IO/调度等基本原理；3、熟悉Mysql/SQLServer/Oracle/PostgreSQL中的一种及以上的数据库架构和运行原理机制，掌握常见关系型数据库性能调优和问题定位分析办法；4、有数据库和电商/金融业务开发或者运维经验优先；5、具备较强的抗压能力、求知欲、细致认真，具有主动服务，沟通，自驱等能力；6、良好的团队协作能力，喜欢有挑战的工作；7、良好的沟通表达能力，具备优秀的文档能力，能够熟练编写各类技术文档；通过腾讯云技术认证或同等资格认证的优先；此岗位为腾讯集团旗下全资子公司编制岗位。",社交,2000人以上,数据仓库,西安
22989-数据库高级工程师（腾讯云全资子公司）,https://www.lagou.com/jobs/6987217.html,高新技术产业开发区,15k-25k,腾讯科技（深圳）有限公司,3-5年,本科,腾讯-西安子公司,"岗位职责 1、负责腾讯云数据库产品的云上业务、运维和监控工具等研发工作；2、负责专有云和公有云的产品提供部署支持和售后技术问题支持；3、负责对现有线上系统的稳定性优化，性能调优等工作；4、对客户现网问题进行技术分析和整理相关技术文档。岗位要求 1、2年以上工作经验，熟练掌握Golang/C++等语言的一种，具备良好的编程风格；2、熟悉MongoDB/Redis中的一种优先；3、熟悉Linux运行机制、常用命令和工具、性能分析方法, 了解linux网络/IO/调度等基本原理； 4、大型分布式平台开发经验优先；5、强烈的学习欲望，良好的服务，沟通，自驱意识；6、良好的沟通表达能力，具备优秀的文档能力，能够熟练编写各类技术文档；通过腾讯云技术认证或同等资格认证的优先录取；此岗位为腾讯集团旗下全资子公司编制岗位。",社交,2000人以上,数据仓库,西安
数据库开发工程师,https://www.lagou.com/jobs/6875303.html,莲湖区,8k-12k,上海诺悦智能科技有限公司,1-3年,大专,五险一金 奖金 餐补 通讯补助等,任职要求:1、精通数据库产品，熟悉Mysql、GBase、Oracle、PostgreSQL其中一种。2、熟悉SQL语法，熟悉ptyhon、shell、sql存储过程其中一种。3、有数据流转、清洗、转换、分析相关工作经验；4、有Java、Scala、Python等编程中一种或多种语言经验者优先。5、熟悉hadoop，了解mapreduce、spark者优先。6、有2至3年数据相关工作经验.,数据服务,50-150人,数据仓库,西安
数据库DBA【西安】,https://www.lagou.com/jobs/6958169.html,高新技术产业开发区,12k-20k,中华联合财产保险股份有限公司,5-10年,本科,六险二金、完善的福利体制,岗位职责:1.维护数据库稳定运行，负责数据库的性能优化；2.负责数据库的监控系统设计及虚拟化平台建设；3.对数据库进行容量规划、架构设计，提高业务高可用性和容灾能力；4.负责数据库相关工作的整体规划，提供决策建议。任职要求：1．全日制大学本科及以上学历，计算机相关专业；2.具有5年以上相应岗位工作经验；3.熟练数据库架构设计、分库分表、读写分离设计、数据路由设计、分布式缓存设计等，解决多种业务模式下的可扩展、高可用、负载均衡等关键技术。,金融 软件开发,2000人以上,数据仓库,西安
数据仓库工程师,https://www.lagou.com/jobs/6816366.html,未央区,25k-30k,联通系统集成有限公司,5-10年,本科,公司平台大 福利待遇优 发展前景好,"1. 211或985学校毕业，计算机相关专业，全日制本科及以上学历。2. 五年以上经验。3. 精通数据仓库模型设计，精通维度建模。4. 负责运营商数据仓库概念、逻辑和物理模型设计、完成仓库体系建设。5. 熟悉数据资产管理、数据治理领域知识，包括但不限于数据架构管理、数据标准管理、数据安全管理、数据生命周期、元数据管理、主数据管理等;6. 熟悉Hadoop、Hive，具备海量数据处理和性能调优经验，对Hadoop、Hive,具备海量数据处理和性能调优经验加分项从事大数据生态相关工作经验者优先，如Hdfs、Hive、Flink、Spark、Redis、ElasticSearch;7. 优秀的逻辑思维能力和业务需求分析能力，较好的沟通交流能力，能够迅速融入团队8. 具备运营商、互联网数据仓库建设经验。",通讯电子,2000人以上,数据仓库,西安
数据库程序员（DBDP）,https://www.lagou.com/jobs/6994532.html,经济技术开发区,5k-10k,美达科林（南京）医药科技有限公司,1-3年,本科,医药生物领域,♥(ˆ◡ˆԅ) 小可爱们先阅读这段话，再考虑是否投递哦：* 此岗位非纯数据、研发岗，这部分工作只占20%~     80%主要围绕EDC( 临床试验远程电子数据采集系统)系统、临床试验方向的数据支持研究工作；小可爱的职业发展是考虑偏医药临床领域的研究上；一部分医学知识的摄入与学习，若不喜欢医学行业及医学知识的掌握与理解请慎重投递哦（我们当然有系统的医学带教）~* 医药临床相关专业提示：此岗位为CDM建库前端的操作，除了有医学知识外，还需掌握一些计算机相关语言哦（有兴趣学习，自认为逻辑性很强的小可爱我们会进行带教）~好啦，下面就是我们的工作内容介绍啦：工作职责1、临床试验数据库设计、搭建、测试、验证及维护； 2、数据核查程序的开发和验证； 3、数据库的日常管理工作，如账号设置、账号管理和数据锁定等； 4、帮助数据管理团队生成相关的数据管理报告以提供数据管理工作的效率。任职要求1、本科及以上学历，计算机、IT、信息管理等相关专业；或者医药临床相关专业； 2、在至少一个编程环境中的体验（例如，CDMS、EDC、SQL、VB、Java、C#），C#掌握熟练者优先； 3、良好的英语听、说、读、写能力；4、有医药临床试验数据领域经验优先考虑。可选择工作地点：上海、西安、沈阳、南京高淳,医疗丨健康,500-2000人,数据仓库,西安
数据库开发工程师,https://www.lagou.com/jobs/4102192.html,高新技术产业开发区,7k-11k,西安悦泰科技有限责任公司,3-5年,本科,"五险一金,带薪年休假、节日福利、员工体检",任职要求： 1.全日制本科及以上学历，计算机相关专业2.从事数据库开发3年以上工作经验。3.熟练掌握oracle/mysql存储过程，触发器开发，能够使用游标，临时表等执行过程对象。能通过表分区、索引、sql代码优化等方面对数据库性能进行优化。4.能够根据业务需求和业务流程设计数据库表结构、表之间的关系及以及表字段定义，业务抽象化能力较强5.熟练掌握oracle/mysql数据库的安装与管理，性能监控及优化，故障诊断和排除。6.具备较强的沟通协调及团队合作能力，能承担工作压力。 职位职责：1.负责业务系统数据库的建模及存储过程开发；3.负责现有数据库性能及架构的优化；4.负责解决日常出现的存储过程错误及数据错误，并给出解决方案；5.负责数据库运维工作（同步、建库）；6.负责数据库技术架构；,"移动互联网,电商",50-150人,数据仓库,西安
数据库开发,https://www.lagou.com/jobs/7128444.html,高新技术产业开发区,10k-16k,上海易宝软件有限公司南京分公司,3-5年,不限,五险一金 双休法定,朱明 5-11 15:46:30岗位职责：1、项目团队中承担核心开发人员角色，负责系统技术框架的搭建（或运用）和核心模块的开发；2、参与项目的需求调研、系统设计及联调上线工作，参与项目中文档的编写及审核；3、与项目经理及客户之间的日常沟通交流工作；任职资格：1、本科及以上学历，相关经验4年以上 2、熟练常见的关系型数据库Oracle、MySQL、SQLServer、DB2等3、熟练掌握SQL语言，能够写存储过程4、能够简单操作linux系统，掌握常见命令，会写简单的shell脚本5、掌握数据迁移，熟练使用数据库结构设计，数据搬迁以及数据维护等工作,移动互联网,150-500人,数据仓库,西安
数据库开发工程师1,https://www.lagou.com/jobs/6910739.html,高新技术产业开发区,8k-12k,西安九派数据科技有限公司,3-5年,本科,"核心,五险一金,绩效奖金,双休,员工旅游","岗位职责：
 充分理解项目需求，负责数据库的设计与规划；
 负责数据库存储过程相关开发工作；
 负责数据库的使用优化工作，解决系统开发、运行中出现的各种问题；
 负责数据库开发质量测试并编写相关的项目文档；
负责的数据库的日常维护、备份、优化及恢复等。任职要求：
 计算机相关专业本科及以上学历，3年以上相关工作经验；
 精通Oracle、MySQL，SQL Server等一种或多种数据库，具备数据库架构设计、SQL调优能力；
 精通数据库、表空间、数据文件、表、字段、存储过程、视图、索引等数据库对象的运用；
 有复杂SQL编写经验，能根据设计说明书进行数据库存储过程的开发。
 有Oracle OCP/OCM或其他类似数据库认证优先；
 有强烈的上进心和求知欲，善于学习新事物，对技术充满激情；
 具有较强的团队合作能力，勇于面对和解决挑战性问题。","移动互联网,数据服务",15-50人,数据仓库,西安
数据库高级工程师,https://www.lagou.com/jobs/6852725.html,高新技术产业开发区,15k-25k,苏州米牛电子商务有限公司,1-3年,本科,知名企业，五险一金，年终奖,具备扎实的高可用、可扩展系统架构能力，能够完成复杂业务场景下高并发的系统的设计并保证系统稳定运行；熟悉MySQL或其他大型数据库系统，具有优秀的业务抽象能力，能够快速根据需求完成高性能数据库设计，熟悉面向对象的开发，有网络系统的开发经验； 熟悉Linux，熟练掌握Golang/Java/Python/C++等语言中的一种，可以通过编写程序解决工作中遇到的问题，具备良好的编程风格；具有2年以上项目需求分析、方案架构设计工作经验，具有大型行业业务架构经历以及较强的客户需求调研和需求分析能力者优先；具备较强的抗压能力，有良好的服务意识；良好的团队协作能力，喜欢有挑战的工作；良好的沟通表达能力，具备优秀的文档能力，能够熟练编写各类技术文档,电商,15-50人,数据仓库,西安
dba数据库管理员,https://www.lagou.com/jobs/6933913.html,高新技术产业开发区,6k-10k,西安翔石电子科技有限公司,3-5年,大专,双休、弹性工作时间、社保、发展空间大,"岗位职责1、 负责oracle数据库系统技术支持工作。2、 负责oracle产品部署及技术培训，参与用户测试方案编写，测试环境搭建及测试数据分析。3、 负责数据库运行中出现的问题，保证数据安全、可用。4、 项目的日常运维实施。5、 负责对项目及运维服务知识库归纳、整理及更新。任职资格：1、  通信、电子工程、自动化、计算机其相关专业本科以上学历。2、  具备数据库系统安装、配置及数据库管理与维护的基本技能3、  精通Oracle数据库各项操作,做过数据迁移项目优先。4、  具备良好职业素养，有团队协作精神，能适应适当出差。3、有ocp及以上证书者优先。上班时间：9：00-17：30    双休薪酬福利：6k-10k (优秀者可面议)、社保、零食、咖啡、下午茶翔石电子期待优秀的你加入！","数据服务,信息安全",15-50人,数据仓库,西安
大数据开发工程师,https://www.lagou.com/jobs/7176942.html,高新技术产业开发区,15k-25k,北京中合利成电子商务有限公司,5-10年,本科,央企 五险一金,"岗位职责:1. 负责公司大数据平台及大数据应用产品设计、研发2. 负责大数据项目的架构设计、技术管理任职要求:1. 计算机或数学相关专业、本科及以上学历;2. 熟练掌握Java/Python/Scala等任意一种或多种编程语言,至少5年以上软件开发经验及2年以上技术管理经验,熟悉C++者优先;3. 熟悉Hadoop生态系统,熟练掌握Hadoop、Spark、Flink框架。4. 具有数据仓库、数据治理工作经验者优先",电商,150-500人,数据仓库,西安
大数据开发工程师,https://www.lagou.com/jobs/4164946.html,雁塔区,15k-25k,深圳市易流科技股份有限公司,1-3年,本科,"友好团队,前沿技术,发展平台",岗位职责：1、数据仓库和大数据处理模块的设计、开发和优化；2、数据预处理、数据分析及挖掘工作；3、大数据前沿技术的研究及应用。任职要求：1、本科及以上学历，1年以上大数据工作经验。心态端正，认真负责，学习能力优秀；2、熟悉mysql、SQLserver等主流数据库系统，精通SQL及调优；3、熟练使用Hadoop、Hive、HBase、Spark等基本大数据组件，必须有可靠的实际编程能力和项目经验；4、精通java、熟悉scala、python语言；5、有物流行业或时空数据处理工作经验优先考虑。,移动互联网,500-2000人,数据仓库,西安
BI数据分析师,https://www.lagou.com/jobs/7166700.html,高新技术产业开发区,8k-15k,西安华讯科技有限责任公司,3-5年,本科,带薪年假 五险一金 节日福利 公司旅游,工作职责：•实施数据访问方法，并与数据访问和可视化工具集成，在数据治理模型中实现自助数据访问。•定义和构建数据提取、集成和报告解决方案，以支持CIM项目的制造厂软件系统需求。•与最终用户协作，收集需求，设计和构建从概念到实施的技术解决方案。•在软件项目中创建、记录和实施架构设计。 教育和经验：•计算机相关专业两年以上工作经验。•有半导体/FPD/LED相关行业经验优先。 要求：•基本原则、理论和概念的有限使用和/或应用。•统计和数据分析技术的基本知识。•熟悉ASP.NET或AngularJS软件编码优先。•熟悉HTML5、CSS3和JavaScript软件语言。•熟悉SQL Server和Oracle数据库。•熟悉Web服务和RESTful API开发。•在数据建模、ETL开发和数据仓库方面的经验。•有使用Tableau和/或Power BI和/或FineReport（FineBI）构建工具的经验。,"电商,移动互联网",150-500人,数据仓库,西安
数据开发工程师,https://www.lagou.com/jobs/7015926.html,高新技术产业开发区,10k-20k,蝉鸣科技（西安）有限公司,3-5年,本科,带薪年假 弹性工作 绩效奖金 股票期权,职责描述：1. 深刻理解公司业务和业务数据，构建稳定可靠的数据仓库和灵活易用的BI分析系统和报表系统，保障对业务部门提供数据的正确性、完整性、一致性、及时性。2. 负责大数据平台技术架构设计和落地实施，把握技术方向，构建离线计算和实时计算体系，业务运营提供解决方案式的决策支持。3. 对业务数据进行深度挖掘，指导公司运营策略。4. 进行大数据团队建设，提供团队技术水平和工作效率。任职资格：1. 对公司业务和业务数据有强烈的兴趣和敏感性、对大数据技术有强烈的好奇心和追求，致力于通过数据和系统为业务部门提供解决方案。2. 在大数据领域有系统化的研究和成功的项目经验。对主流技术如Hadoop 、Spark 、Hive、Flink 、Kafka 等有深入的理解和丰富的使用经验。3. 具有扎实的计算机基础、数据结构和算法基础，本科以上学历，计算机、数学相关专业，3年以上大数据相关工作经验，熟练掌握java/python编程语言，熟悉分布式系统、存储系统、计算系统等理论和实现。4. 较好的沟通和团队配合能力，以及对工作的强烈责任心。,"教育,移动互联网",150-500人,数据仓库,西安
资深大数据ELT工程师 / 资深大数据DBA工程师,https://www.lagou.com/jobs/7120165.html,雁塔区,20k-30k,北京国双科技有限公司,5-10年,本科,六险一金,工作内容： - 负责基于国双分布式数据仓库平台的数据ETL工作；- 深入研究基于大数据技术的分布式SQL引擎，并负责关键性能问题的技术攻关； 任职要求： - 本科及以上学历，统计、计算机或其他理工科专业背景优先；- 具有5年以上海量数据ETL和性能调优经验，有大数据经验者优先；- 精通Oracle、Sql Server、PostgreSQL、MySQL等至少一种主流数据库的SQL方言和技术原理；- 具有成功的大数据迁移项目经验；- 具备较强的数据思维和快速理解复杂业务的能力；- 可以接受驻场出差；- 擅于沟通和解决问题，并乐于总结分享；- 责任心较强，具有良好的自驱力和团队协作意识；工作地址可选择北京，西安，成都,"数据服务,企业服务",500-2000人,数据仓库,西安
Java工程师-西安盼盼(J10874),https://www.lagou.com/jobs/7028078.html,高新技术产业开发区,10k-20k,北京仁科互动网络技术有限公司,3-5年,本科,技术大牛,,"移动互联网,数据服务",500-2000人,数据仓库,西安
算法工程师,https://www.lagou.com/jobs/6985739.html,高新技术产业开发区,20k-30k,陕西同纳信息技术有限公司,5-10年,本科,产品前景、团队氛围、工作节奏,职责描述：1.对大量结构或非结构话互联网数据进行清洗、整理、分析与挖掘；2.进行数据体系规划和数据治理，及数据仓库的架构设计、建模3.利用不同维度的数据，通过机器学习、神经网络、聚类分析、决策树、逻辑回归、文本分析等方法，对行业数据进行多维度的画像;4.建立各种计量模型，如评分卡、LBS、社交网络模型、反欺诈模型、关联模型等，帮助优化信贷资产管理;5.针对特定业务场景，制定相应数据分析方案，包括文本数据、图像数据;6.建设数据仓库及其服务（包括元数据管理、数据接入标准设计、数据服务流程制定、数据分析平台形态等）。任职要求：1.全日制数学、统计、金融数学、软件工程或计算机等相关专业本科以上学历；2.能熟练使用python，能熟练使用至少一种数据分析软件，如SAS、R、Matlab、SPSS等；3.对机器学习、分布式计算、神经网络等算法研究有兴趣；4.精通数据结构，能熟练运用数据挖掘和机器学习算法等常用算法，并对机器学习算法和理论有深入研究（如对熟悉决策树、聚类、逻辑回归，序列标注，关联分析、SVM，贝叶斯等数据挖掘算法有较深理解和实践经验）；5.精通数据建模方法论、熟悉运用数据分析、数据挖掘应用；6.五年以上数据分析与数据挖掘相关工作经验者优先。,移动互联网,15-50人,数据仓库,西安
数据挖掘工程师,https://www.lagou.com/jobs/6679969.html,高新技术产业开发区,10k-16k,陕西欢迎网络技术有限公司,3-5年,本科,14薪资，六险一金，双休，技术好,1、海量大数据分析、数据挖掘，负责分析和评估数据质量，提升数据治理的水平并指导数据采集 2、负责数据分析、加工、清理、预处理等数据质量分析工作 3、能够熟练使用Python编程掌握numpy、pandas、matplotlib等常用分析工具包 4、能针对特定的业务场景，从数据中建模，解决问题 5、善于撰写文档，善于积累和输出者优先 岗位要求： 1、本科及以上学历，计算机、数理统计、机器学习、人工智能相关专业毕业优先，基础功底扎实，硕士优先； 2、对oracle、MongoDb、hadoop，MySql、Redis熟悉优先； 3、熟悉hadoop生态系统内常见项目的使用（hdfs、hive、hbase、spark、storm、zookeeper、kafka、yarn等） 4、熟悉数据仓库领域知识和技能者优先，包括但不局限于：元数据管理、数据开发测试工具与方法、数据质量、主数据管理，可以灵活运用SQL实现海量数据ETL加工处理 5、具有团队合作精神，良好的沟通协作能力，善于分析问题本质并解决问题，善于学习，乐于分享 岗位要求： 1、本科及以上学历，计算机、数理统计、机器学习、人工智能相关专业毕业优先，基础功底扎实，硕士优先； 2、对oracle、MongoDb、hadoop，MySql、Redis熟悉优先； 3、熟悉hadoop生态系统内常见项目的使用（hdfs、hive、hbase、spark、storm、zookeeper、kafka、yarn等） 4、熟悉数据仓库领域知识和技能者优先，包括但不局限于：元数据管理、数据开发测试工具与方法、数据质量、主数据管理，可以灵活运用SQL实现海量数据ETL加工处理 5、具有团队合作精神，良好的沟通协作能力，善于分析问题本质并解决问题，善于学习，乐于分享,"移动互联网,人工智能",500-2000人,数据仓库,西安
大数据架构师,https://www.lagou.com/jobs/7204025.html,长安区,15k-30k,西安烽火软件科技有限公司,5-10年,硕士,国企央企、大牛团队、大数据、网络安全,工作职责：1、负责大数据平台离线数仓的产品预研和设计，构建核心竞争力；2、负责实时计算产品的预研和设计，构建核心竞争力；3、深入研究大数据相关技术和产品，跟进业界先进技术，指引大数据平台产品发展方向；4、开展大数据技术相关培训和指导工作。岗位要求：1、统招一本院校的硕士及以上学历，计算机等相关专业；2、至少5年以上软件和分布式系统开发经验，2年以上大数据系统架构经验精通Hadoop/HBase/Hive/Spark/Redis/Flink等技术及其生态；3、具备Java/C++/Scala等开发经验，具有良好的系统分析能力和故障诊断能力；4、对大数据、数据仓库等领域有较为全面的理解，对技术发展创新有独到见解；5、有强烈的上进心和责任感，具有良好的逻辑思维、语言表达沟通能力及团队协作精神。,人工智能,150-500人,数据仓库,西安
数据开发工程师,https://www.lagou.com/jobs/6876339.html,高新技术产业开发区,8k-15k,广州谷沃信息科技有限公司,3-5年,本科,带薪年假，周末双休，五险一金，团建零食,岗位职责：1、参与数据仓库数据模型优化工作；2、负责数据湖、数据中台数据模型设计工作；3、参与需求分析、概要设计及详细设计工作；4、参与部分核心数据模型的ETL实现、ETL流程的优化及相关问题的处理；5、与项目经理、业务分析、开发、测试等人员密切合作，以完成项目方案交付；6、参与数据模型评审、模型优化及整体解决方案架构设计，并参与编写相关材料或文档；岗位要求：1、5年以上金融行业需求分析、模型设计、数据仓库实施经验；2、熟悉数据仓库模型设计、SQL及ETL开发经验 ，掌握Kimball的维度建模设计方法，具备海量数据加工处理（ETL）相关经验；3、有从事分布式数据存储与计算平台应用开发经验，熟悉Hadoop生态相关技术并有相关实践经验着优先，包括Hdfs、Mapreduce、Hive、Hbase ；4、熟悉数据仓库及BI领域知识和技能，包括但不局限于：数据模型设计、数据开发、数据管理等；5、熟悉主流数据库技术（如oracle、TD、GP中的一种或多种）；6、对数据有敏锐的洞察，快速的业务理解及学习能力，具有良好的服务精神，团队协作和业务协调能力；7、具备良好的沟通能力，能够根据客户需求提出模型设计或优化改进建议；,"金融,数据服务",15-50人,数据仓库,西安
