job_name,job_url,job_location,job_salary,job_company,job_experience,job_class,job_given,job_detail,company_type,company_person,search_key,city
高级网络渗透测试工程师（25-50K）,https://www.lagou.com/jobs/6949591.html,岳麓区,25k-50k,湖南格凡安信科技有限公司,不限,不限,弹性工作 节日福利 法定假期 团建活动,岗位职责： 1、承担安全服务项目中的渗透测试和应急响应工作； 2、主导公司线上应用、业务安全相关风险评估；并进行渗透测试与漏洞挖掘，提出解决方案、跟进修复； 3、负责建立安全流程，包括常规性处理流程以及应急处理流程； 4、对基础安全服务工程师进行赋能，提供渗透测试、安全攻防、重保支撑等方面的技术培训和经验分享； 5、部门的其他工作。任职要求： 1、本科及以上学历，5年及以上渗透测试经验，具备渗透大型目标的经验； 2、熟悉常见的安全漏洞原理，熟悉OWASP ****0和OWASP Mobile ****0漏洞原因与修复方案； 3、熟练使用安全测试工具，可独立完成网站、信息系统、APP安全渗透测试； 4、熟练使用Linux操作系统，掌握一种或多种编程（java、python、php等）和shell脚本语言； 5、拥有大型企业内外网完整渗透测试经验，对APT有深入研究或有实践经验； 6、拥有安全防护经验。,数据服务,15-50人,python,长沙
数据分析,https://www.lagou.com/jobs/6905837.html,芙蓉区,8k-12k,北京天意飞扬科技有限公司,1-3年,不限,周末双休；五险一金,1、能熟练使用SQL分析数据，熟练使用数理统计、数据分析、数据挖掘工具软件（SAS、R、Python、tableau等的一种或多种）3、熟悉数据统计和数据挖掘专业知识4、学习能力强，擅长沟通、责任心强，有团队合作精神。善于表述，抗压能力强。,"电商,移动互联网",少于15人,python,长沙
急聘WEB前端工程师,https://www.lagou.com/jobs/7058782.html,雨花区,10k-16k,湖南象盒网络科技有限公司,3-5年,大专,双休，五险一金，下午茶，拓展活动，兑休,"web前端开发要求：岗位职责：1、参与基于HTML5/JavaScript/CSS3等的项目开发2、参与项目需求、设计，包括技术研究，可行性分析3、负责代码编写和测试，提供高质量、兼容性良好的代码4、负责前端项目维护和更新任职要求：1、掌握良好的前端技能，包括XHTML/XML/CSS/Javascript2、精通javascript，熟悉各种流行的开发框架、库3、精通javascript交互设计和模块化设计4、熟悉HTML5以及响应时布局开发；5、了解WEB标准化、性能优化方法，了解可用性、可访问性、安全性和跨浏览器；6、自我管理能力强良好，崇尚团队合作，快速的学习能力，乐于分享与沟通；7、注重团队合作，有良好的语言表达能力及沟通能力，工作认真负责,能承受一定的工作压力。8、有Web后端脚本的语言（如JavadeJS/PHP/C#/C++/Python）开发经验者优先；","消费生活,移动互联网",2000人以上,python,长沙
编程老师,https://www.lagou.com/jobs/7151737.html,岳麓区,4k-7k,长沙思明逻辑科技有限公司,应届毕业生,不限,一周40小时工作制，上班时间相对自由。,主要教授学生简单arduino、Python课程，一周40小时工作制，双休，时间相对自由，校区新装修，周围环境优美，工作环境舒适！,教育,15-50人,python,长沙
软件研发工程师（golang）,https://www.lagou.com/jobs/7027293.html,天心区,6k-10k,湖南心镜科技有限公司,1-3年,本科,周末双休六险一金，免费下午茶同事nice,福利待遇：①时间：9:30-12:00 14:00-18:30，周末双休。带薪年假+婚、丧、产、陪产假；②收入：上不封顶的；③培训：干货培训是免费的；④旅游：奖励多，方案多，免费周游世界；⑤晋升：空间大，是不靠关系的；⑥奖励：六险一金，福利多多；⑦心情：是自由的，还有每周免费下午茶，让你开心不下线。期待闪光的你，加入心镜科技！工作职责：1、软件研发工程师，负责产品服务端的设计、必须掌握Golang开发和单元测试工作；2、参与软件架构的设计和优化，并对软件性能进行优化;3、业务系统正常维护；4、完成其他相关工作。任职要求：1.涉猎面广，并且掌握Golang开发，主持，组织过项目的完成（或项目重要成员的）2.优秀的学习能力和问题解决能力，自我驱动，执行力强，主动承接任务3.对基本数据结构、网络协议、算法有深刻理解；对前后端分离有深刻理解，可设计restful接口；4.熟练掌握Golang开发，熟悉python/perl/shell等至少一门脚本语言，或熟悉Android或IOS开发基础知识5.熟悉linux服务器维护，可操作postgresql/mysql/mongo等数据库；6.有良好的工作及编码习惯；7.良好的沟通与表达能力、思路清晰，有较强的主动性和责任心，有较好的团队协作能力，技术视野广泛。8.能接受加班（非全日制本科以上与无诚意者勿扰）       公司拥有一支高水平的技术团队，技术骨干均为软件开发、系统管理、信息安全领域的大全栈极客；、如：AI人工智能(产品已上线)、大数据、云计算、创新的多种开源项目，还有多个合作项目。我们也是新大众创的创始合伙人，拥有2000平方的的创业孵化器。,"广告营销,移动互联网",15-50人,python,长沙
算法工程师,https://www.lagou.com/jobs/7110060.html,岳麓区,15k-20k,长沙智纽科技有限公司,3-5年,硕士,五险一金，周末双休,激光雷达算法工程师职责描述：雷达算法工程师-激光雷达目标识别算法设计-毫米波雷达目标识别算法设计-目标融合算法设计-算法编程实现图像算法工程师岗位职责：-车辆/行人目标识别算法设计-交通元素目标识别算法设计-多传感器融合识别算法设计-算法编程实现任职要求：-硕士及以上学历-计算机、自动化、软件、车辆专业-3年以上相关工作/研究经验-C++、Python、Linux OS、ROS、网络通信、CAN通信、Eigen、PCL、OpenCV、CNN、MATLAB,软件开发,15-50人,python,长沙
大数据开发工程师,https://www.lagou.com/jobs/6865640.html,天心区,7k-12k,湖南红网新闻网络传播有限责任公司,3-5年,本科,国企，工作稳定，福利齐全，周末双休,"岗位职责：1、负责负责用户画像、运营平台、推荐等相关红网大数据平台数据应用产品设计、研发；2、保障系统高性能、高质量、完全运行；3、参与设计并构建主题化数据模型，构建集团数据仓库；4、参与数据治理规范的建立, 构建覆盖全集团的数据治理工具；5、负责或参与项目开发过程中的技术攻关和性能调优。任职要求：1、全日制本科及以上学历；2、3-5年数据开发工作经验，3年及以上数据平台构建，Java, Scala 或 Python 开发工作经验；3、熟悉 Git/GitHub，通信协议 TCP/HTTP 及 RESTful 标准；4、深入了解大数据计算平台架构和产品组件原理和应用场景，如 Spark, Hadoop, Hive, HBase, AWS Redshift, AWS Kinesis, GCP BigQuery, GCP Cloud Dataflow 等。","移动互联网,电商",500-2000人,python,长沙
区块链开发工程师,https://www.lagou.com/jobs/7011722.html,天心区,10k-15k,湖南融聚区块链科技有限公司,1-3年,本科,"我们是年轻、激情的团队, 看能力重贡献！",,其他,50-150人,python,长沙
高级devops技术专家/运维专家,https://www.lagou.com/jobs/7013440.html,岳麓区,30k-40k,健康力（北京）医疗科技有限公司,5-10年,不限,待遇优厚、独角兽公司,"岗位描述：1、负责部署系统的研发及自动化运维系统建设。2、制定工程规范并负责实施落地3、开发软件工程各环节需要使用的工具和服务岗位要求：1、5年以上软件开发经验，3年以上工程效率相关经验，熟悉软件工程相关理论和技术2、熟悉Go、Java、Python或C/C++编程语言至少两种，理解该语言以及相关的基础框架。3、熟悉分布式、缓存、RPC、消息中间件、MySQL存储至少一种。4、熟悉容器服务、K8S，熟悉云原生持续交付的体系架构，有大规模持续交付的经验背景。5、熟悉DevOps相关工具和技术，例如Git, Jenkins, Docker, K8S, Ansible, Chef, ELK, Artifactory, Maven 等6、有较强学习和沟通能力；有很强的动手能力和解决问题能力。7、熟悉云平台，有云计算背景优先。8、熟悉平台运维和应用运维，能够建设运维规范和运维平台。此岗位base地在湖南和深圳都可",医疗丨健康,150-500人,python,长沙
图像算法工程师,https://www.lagou.com/jobs/6999671.html,雨花区,12k-18k,深圳昱拓智能有限公司,5-10年,本科,五险一金、双休、带薪休假、年底双薪,工作职责：1.参与整个算法实现过程，从需求分析、输入输出确定、方案设计、测试、算法库交付等；2. 图像目标检测、定位、检索、配准等算法设计、实现及优化；3. 基于可见光/热成像相机的全景拼接算法及可视化软件的开发；4. 机器人自主完成现场目标采集、识别的自动化工具的设计、开发与优化；5. 研究深度学习及传统机器学习中核心算法，针对目标问题收集样本，训练模型及优化。任职要求：1.本科及以上学历，计算机、应用数学、统计学、模式识别、人工智能、信号处理等相关专业；2. 有图像处理、模式识别、视觉分析、机器学习等算法经验3. 具有良好的C/C++语言功底，熟悉Python语言和opencv4.思路清晰，逻辑分析能力强，有解决复杂问题的能力。,人工智能,50-150人,python,长沙
数据分析,https://www.lagou.com/jobs/6923383.html,芙蓉区,5k-7k,南京汇龙科技有限公司,1-3年,本科,五险一金年终奖励周末双休员工食堂,数据岗位要求：（工作地点：长沙 ）工作要求1、电信移动用户维系相关数据统计及分析。2、完成移动用户的各类预警模型搭配。3、根据各维度的数据分析，提供用户维系营销建议。技能要求1、全日制大学本科及以上学历，有2年以上电信业务数据分析和业务分析工作经验优先。2、能熟练使用SQL分析数据，熟练使用数理统计、数据分析、数据挖掘工具软件（SAS、R、Python、tableau等的一种或多种）3、了解数据仓库理论，熟悉数据统计和数据挖掘专业知识4、参与过数据挖掘项目，使用过逻辑回归、神经网络、决策树、聚类等的一种或多种建模方法，对数据埋点、处理、建模和应用有一定了解者优先5、学习能力强，擅长沟通、责任心强，有团队合作精神。善于表述，抗压能力强。,移动互联网,150-500人,python,长沙
软件开发工程师,https://www.lagou.com/jobs/7062774.html,天心区,8k-12k,长沙麦粒软件开发有限公司,不限,本科,提供五险一金，股权激励，不加班,岗位职责：1.从事仿真软件研究开发工作，涉及精细化建模仿真、复杂材料的力学本构等产品创新研究；2.负责仿真优化算法能力构建及相关实验能力的构建，推进公司产品的迭代升级。岗位要求：1. 本科及以上学历；2. 掌握至少一种主流软件开发工具，如JavaScript、Python和C++等。,企业服务,少于15人,python,长沙
数据运营工程师,https://www.lagou.com/jobs/7035204.html,开福区,8k-12k,湖南快乐阳光互动娱乐传媒有限公司,1-3年,本科,年轻、大平台、福利待遇好,岗位职责：负责CDN运营数据的收集、清洗、计算、分析和呈现；负责运营数据报表的统计计算；负责对接和实现相关部门的数据需求。任职要求：1、了解Python、shell、SQL，熟悉其中至少一种。2、了解至少一种Python web框架，可以是Django、Tornado、flask等；3、了解Linux常用命令的用法，了解常用服务，如nginx、ftp等，有一定troubleshotting能力；4、熟练使用常用数据库，如mysql、redis等，有clickhouse、es、kafka等使用经验优先；5、工作积极主动、认真负责；6、工作经验1年以上优先。,文娱丨内容,500-2000人,python,长沙
测试工程师,https://www.lagou.com/jobs/6917868.html,岳麓区,12k-18k,中兴通讯股份有限公司,5-10年,本科,待遇好，前沿技术，一流团队,"1、全日制本科及以上学历，计算机相关专业；2、有本科至少4年以上，硕士2年以上测试经验，熟悉测试设计理论，熟练掌握测试工具，有功能测试经验；3、熟悉Oracle，mysql等常用数据库系统，能独立完成数据库的安装、备份和维护操作；4、熟悉Unix/Linux常用操作，熟悉常规的脚本命令，懂shell脚本,能开发小工具提升效率；5、至少具备性能测试、安全测试、自动化测试某一方面的工作经验；6、具备良好的沟通能力和团队合作精神，责任心强，学习能力强，有质量意识，工作有原则，能独立完成安排的工作任务。7、熟悉Java或者Python编程语言，能编写测试小工具提升测试效率者优先；8、具有功能测试、性能测试、安全测试、自动化测试、接口测试经验者优先。","数据服务,信息安全",2000人以上,python,长沙
运维工程师,https://www.lagou.com/jobs/7029879.html,岳麓区,10k-20k,中兴通讯股份有限公司,3-5年,本科,五险一金，定期体检，年终奖，免费班车,岗位职责：1、负责公司项目和工具的环境搭建、上线、部署等工作2、负责公司项目和工具上线后的监控、用户运维等工作3、负责项目和工具的架构改进，提升自动化运维水平，保证系统稳定性4、负责系统的故障排查以及应急处理工作岗位要求：1、全日制本科以上学历，学习能力强，有3年以上运维工作经验2、熟悉Windows、Linux操作系统，了解操作系统原理和网络原理3、会使用shell或Python编写脚本，熟悉DevOps和CI/CD相关理念及工具，熟练Zabbix等监控工具4、熟悉Mysql、SQL Server数据库5、有丰富的系统故障排查和系统调优经验，突出的分析和解决问题的能力6、有高度的责任感，对工作积极严谨，有良好的沟通协调能力、学习能力、团队精神7、有Docker经验、微服务经验、DevOps经验、安全工具经验者优先,"数据服务,信息安全",2000人以上,python,长沙
测试工程师,https://www.lagou.com/jobs/6961028.html,雨花区,10k-20k,湖南中拓电子商务有限公司,5-10年,本科,年终绩效 业绩提成 五险一金 定期旅游,岗位职责：1、根据软件设计需求制定测试计划，设计测试数据和测试用例；2、有效地执行测试用例，提交测试报告；3、定位并跟踪问题，推动问题及时合理地解决；4、完成对产品的集成测试与系统测试；完成产品的软件功能、性能及其它方面的测试。任职资格：1、计算机或者相关专业，统招全日制本科及以上学历；2、对测试工作抱有热情，对复杂系统中出现的问题能追踪到根源，对产品对工作从各个角度追求完美；3、两年以上后台服务开发或测试经验，熟悉软件测试流程和测试用例设计方法，能够独立编写测试计划，测试用例，执行测试，完成测试报告；4、有良好的编程能力（熟悉Java编程，并熟悉Python/Shell等脚本编程中至少一种）；5、熟悉HTTP协议、Web架构、RESTful API及互联网应用的工作原理；6、熟悉互联网应用开发测试流程、代码分支管理、CI环境和流程等基本技能；7、能独立思考，并使用开源工具或脚本提高测试工作效率；8、熟练使用Linux及Git代码管理工具；9、有移动端测试经验者优先。,"电商,移动互联网",50-150人,python,长沙
数据清洗工程师,https://www.lagou.com/jobs/6685429.html,岳麓区,5k-10k,长沙紫檀数据科技有限公司,不限,本科,周末双休，薪酬待遇优，带薪年假,周末双休，薪酬待遇优，带薪年假，专人带领和培养，年底奖金分红，股权激励。  一、岗位职责： 1.参与数据采集平台的开发和自动化运维。 2.参与大数据采集、数据可视化呈现的工作。 3.编写数据分析和清洗脚本。 4.参与其他IT方面的建设工作。    二、任职资格： 1.熟练掌握Python语言，编程基础扎实，熟悉常见数据结构。 2.熟悉关系型数据库，能编写复杂SQL，了解MongoDB，Redis优先。 3.熟悉Pandas，Nump，Arima等数据分析库优先。 4.熟悉Flask或Django等Web框架，有分布式系统设计及开发经验优先。 5.思路清晰，学习能力强，踏实肯干，具有较好的团队合作精神。 6.计算机或相关专业本科及以上学历（一本以下请勿投递），亦欢迎优秀应届毕业生投递简历。三、我们能提供的： 1.以结果为导向的薪酬福利体系；具有竞争力的基本工资，丰厚的绩效奖金（绩效奖金上不封顶，优秀员工可以拿到6个月以上的绩效奖金） 2.优秀人才有机会参与员工持股计划分享公司分红 3.5-12天带薪年假，远超国家规定和一般企业5天的标准 4.在高速发展的朝阳行业里，提供施展个人能力的广阔空间和快速成为公司核心成员的晋升通道 5.全球化、高素质的团队氛围和英文的工作环境：团队成员分别来自中国大陆、美国、韩国、香港4个国家和地区，毕业于清华大学，香港大学，英国沃里克大学等。,数据服务,15-50人,python,长沙
web前端开发工程师,https://www.lagou.com/jobs/6856894.html,天心区,7k-10k,长沙至盛电子科技有限公司,1-3年,大专,五险一金，每年四次加薪机会，通讯补助,1、负责公司Web产品和客户端内嵌WEB网页应用架构设计； 2、负责Web前端架构设计、核心代码的编写及与后台服务的联调；3、负责WEB APP，微信小程序开发；4、良好的代码编写习惯，对自己代码进行复查，并进行简单的测试，及时消除代码中的缺陷；5、深入理解业务需求，提供具体问题的解决方案及相关模块的开发和改进，保证系统性能及其稳定性；岗位要求：1、良好的编码习惯，较高的技术钻研能力、技术难点攻关能力、分析问题解决问题的能力；2、熟练掌握HTML5、CSS3、JavaScript（ES6），能熟练运用HTML、CSS进行合理的网页制作，能够解决各种浏览器兼容性问题；；3、能熟练掌握至少一种主流前端框架Vue、React等，并了解其原理；4、熟练使用前端构建工具，如Webpack、Gulp等；5、掌握NodeJS/Python/Ruby等动态语言者优先；6、掌握JS数据可视化技术（如D3、Echart）者优先；7、计算机及相关专业专科以上学历，2年以上项目经验；8、能够根据产品原型设计UI效果跟视觉设计优先；薪资福利：1、福利：五险一金、年底双薪、每年四次晋升机会、绩效奖金、过节费 2、假期：法定假期、春节带薪探亲假、年假、婚假、丧假、产假、陪产假等 3、工作环境：人文化管理、开放式办公室、年轻化团队 4、专业培训：“导师制”入职培训体系、在职培训体系,"电商,其他",2000人以上,python,长沙
数据分析,https://www.lagou.com/jobs/6853952.html,芙蓉区,6k-10k,北京天意飞扬科技有限公司,1-3年,本科,五险一金。双休。电脑补贴,一、岗位要求1、能熟练使用SQL分析数据，熟练使用数理统计、数据分析、数据挖掘工具软件（SAS、R、Python、tableau等的一种或多种）2、熟悉数据统计和数据挖掘专业知识3、学习能力强，擅长沟通、责任心强，有团队合作精神。善于表述，抗压能力强二、工作内容1、电信移动用户维系相关数据统计及分析。2、完成移动用户的各类预警模型搭配。3、根据各维度的数据分析，提供用户维系三福利1、薪资6000-100002、周末双休（8:30-18:00，中午休息2个半小时）3、转正之后购买五险一金4、自带电脑补贴150/月,"电商,移动互联网",少于15人,python,长沙
JAVA研发工程师,https://www.lagou.com/jobs/5995868.html,岳麓区,5k-9k,湖南慧明达信息技术有限公司,1-3年,不限,年终分红年底双薪五险一金节日福利员工旅游,"1、负责公司云平台及移动端开发2、熟练web产品开发流程3、熟悉java ,Python,c++等4、基本的英语读写能力5、工资待遇6K~15K6、年终分红、年底双薪、五险一金、节日福利、员工旅游、带薪年假、绩效奖金。","移动互联网,数据服务",15-50人,python,长沙
运维工程师,https://www.lagou.com/jobs/6134240.html,岳麓区,6k-10k,湖南南软信息科技有限公司,3-5年,大专,年底双薪、五险一金、双休、年度体检等,"岗位职责：1、负责服务器的维护，平台和集群的安装部署、维护、优化及升级，确保安全稳定运行；2、完善并落实运维工作制度、方法、预案、服务流程和标准；3、负责网络、数据库、服务器的规划和管理，确保安全、稳定、可靠的运行；4、系统故障和风险的预警与规避，故障与风险迅速定位、快速响应解决；5、撰写运维方案、巡检记录、安全报告等文案；6、针对公司项目能优化解决方案，编写脚本并持续改进日常运维支撑工具，逐步实现安装部署、运维自动化；7、解决IT类日常出现的问题及故障，分析并提出解决方案；8、各类IT设施操作、信息监控设定、设备维护、事件监控；任职要求：1、三年以上运维经验，计算机及相关专业本科以上学历2、深入理解Windows、Linux系统，有系统调优经验；3、熟练掌握大型网站应用架构组成、并熟悉各个环节的部署和维护方法；4、精通Nginx/Jekins/Appllo/Zookeeper/Redis/MongoDB/MQ/Cat/Prometheus/IIS/Dubbo/Shell/Python/Teleport等；5、精通容器技术(Docker、K8S)、虚拟化相关技术(KVM、VMWare)；6、有强烈的责任心，工作踏实认真，积极主动，善于思考，学习能力强；7、具备较强的沟通、合作能力，能适应7X24H故障响应工作，有一定抗压能力、学习能力；8、掌握网络和系统安全技术，如入侵检测、**防护、防火墙、VPN等福利待遇： 1、工作时间：5天7.5小时 2、基本工资：提供极具竞争力的薪酬；根据公司业务发展状况和个人工作表现进行年度绩效评估和薪酬调整，除年中固定加薪外另有不定期加薪； 3、五险一金：社会保障五险及住房公积金； 4、其它福利：免费体检；国家规定的各种法定假期，并可享受婚假、产假、带薪年假、法定节假日；生日礼包、节日礼金； 5、员工活动：不定期组织员工参与各种文体活动、室内室外拓展活动，每年组织员工旅游活动。湖南南软信息科技有限公司成立于2013年11月，主要从事国内先进物流软件研发，致力于为国内物流行业同行提供专业的物流信息化解决方案。“创新推动物流进步”是南软一直推崇的经营理念，公司拥有自己的核心竞争力：南软云开放平台(OpenNDT)、物流源平台等, 通过几年的研发和项目实施的技术积累，已经逐步成为物流行业内**的信息化合作伙伴。公司网址：http://www.techns.com.cn 如果有意向，请先投递简历，人事部经过筛选之后，如果符合要求，会在1-2天时间内电话通知面试时间和地址！","移动互联网,数据服务",15-50人,python,长沙
前端开发工程师,https://www.lagou.com/jobs/6713807.html,雨花区,10k-20k,天创智汇科技（北京）有限公司,5-10年,大专,发展前景广阔，给予充分足够的提成空间,"职位职责：1、负责公司WEB、H5相关产品的分析设计、开发实现和持续改善；2、参与产品分析和规划，完善和优化开发过程；3、研究和实践相关技术及实现原理。4.通过各种前端技术手段，提高用户体验并满足性能要求；5.能充分理解项目需求和设计需求，具有一定研发精神，能解决各种未知问题。职位要求：1.2年以上前端开发经验(硬性)；2.精通HTML、CSS、JavaScript、Ajax、jQuery等，熟悉HTML5，CSS3，及常见Mobile WEB方案或框架,对BootStrap,D3等有深入了解（加分项）；3.熟练混合APP开发；4.掌握面向对象编程思想，熟练使用JavaScript前端框架（jquery、AngularJs、react、reactNative、vue等）开发技术，能够对JS进行模块化开发；5.对有Vue、React Native、nodejs开发经验者优先。6.熟悉主流浏览器的兼容性调试，熟悉W3C标准，对表现与动态数据分离有较好的认识；7.熟悉Java,Python等语言或有Web后端开发经验者优先；",文娱丨内容 企业服务,50-150人,python,长沙
