job_name,job_url,job_location,job_salary,job_company,job_experience,job_class,job_given,job_detail,company_type,company_person,search_key,city
UX设计师（偏UE）,https://www.lagou.com/jobs/6898016.html,吴中区,25k-35k,苏州蜜巢计算机系统有限公司,3-5年,大专,平台好/发展好,岗位职责：1、高度理解用户画像及用户故事，对用户需求有自己的思考;2、基于用户故事及交互逻辑完成用户在app内的体验路径设计；3、提供调研素材完成交互场景的验证、内测过程，对产品的用户体验负责，包括场景及文案;4、完善已有的交互规范，优化交互组件，能够清楚地传达设计思路和展示设计方案;5、对关键节点数据进行分析，溯源并明确优先级；岗位要求：1.设计、计算机专业优先，本科及以上学历;2. 4年以上互联网从业经验，2年以上交互设计师岗位工作经验，有乙方公司经验的加分；3.熟悉产品整体业务开发及推进流程，熟悉UED方法和工作流程，独立完成整个设计；4.优秀的交互设计能力，熟悉iOS与Android设计规范，熟练使用常用设计软件，会使用Sketch、Protopie的加分；5.用户思维考虑产品，良好的沟通能力与团队协作能力；,"移动互联网,消费生活",50-150人,ios,苏州
高级移动开发工程师,https://www.lagou.com/jobs/7129238.html,虎丘区,10k-20k,上海安硕信息技术股份有限公司,5-10年,本科,"领先优势,福利优厚,发展空间大","岗位要求：1、本科及以上学历，有基础框架设计、公共组件开发、App重构和优化等实践经验；2、精通IOS平台开发，熟练掌握Objective-CJava,熟悉面向对象设计方法和常用设计模式，熟悉常见网络通讯协议HTTP、HTTPS、Socket、xmpp、WebSocket；3、对审核流程熟悉，善于处理发包流程；4、具有良好的工作主动性：主动发现问题，主动解决问题，主动协助解决问题，主动预测风险。岗位职责：1、有良好的 IOS 开发的规范和流程2、新技术，新框架的预研及导入，能独立完成核心功能的实现工作；3、对项目组开发人员的设计评审，CodeReview，以保证代码的可读性、可扩展性、易维护性； 4、负责IOS app发布、安全设计及整改、生产环境问题定位及解决等相关工作。",金融,2000人以上,ios,苏州
Unity3d开发工程师,https://www.lagou.com/jobs/7060157.html,工业园区,8k-15k,江苏第二空间软件科技有限公司,1-3年,本科,五险一金等等,任职要求1. 熟悉C#语言2. 熟悉.NET4及以上版本、熟悉Unity3D3. 熟悉UGUI或NGUI基本机制以及DoTween，EasyTouch等插件4. 了解多线程和并行编程、网络套接字编程更佳5. 了解SVN、GIT等版本控制工具更佳6. 了解设计模式更佳7. 能够流利阅读计算机专业技术英文文档8. 3年以上游戏行业从业经验工作内容基于VS2017和.NET框架以及第三方库，使用U3D：1. 编写VR表现逻辑以及UI效果2. 编写前后端的通信协议3. 各种SDK的接入4. VR打包发布到IOS、安卓并进行测试5. 编写VR产品编辑器6. 针对美术提出的需求，编写人物编辑器等工具,VR丨AR 教育,15-50人,ios,苏州
java开发工程师,https://www.lagou.com/jobs/7215386.html,昆山市,8k-14k,江苏网进科技股份有限公司,3-5年,本科,双休,岗位职责：1、参与系统平台核心后台系统的设计和研发；2、负责网站的研发和维护；3、负责基础平台、功能设计开发，关键技术问题的攻关工作；任职要求1. 熟悉HTML，CSS，JavaScript。有web前端开发经验，对jquery、ajax前台开发深入理解；2. 熟悉主流的J2EE框架，如springMVC、spring、mybatis等；3. 熟练使用webservice开发接口（cxf的soap、restful协议）；4. 精通SQL，熟悉Mysql关系数据库，了解nosql，熟悉redis缓存服务；5. 熟练使用和配置tomcat应用服务器，了解基本的Linux命令；6. 参与过与客户端（android、ios）的接口开发项目。,数据服务,500-2000人,ios,苏州
高级ui设计师,https://www.lagou.com/jobs/7125967.html,虎丘区,5k-10k,苏州南慧科技创新研究院有限公司,3-5年,本科,薪酬福利、沟通顺畅,"岗位职责：1、负责公司所有产品的UI相关设计工作，能独立且高品质地完成产品设计任务；2、可以独立高品质的绘制相关产品插画，以及原画设定；3、实时把握web和APP设计的流行趋势，提出崭新的创意策略 ,以及对界面设计和用户体验提供新的想法和观点；4、分析网站和app架构、频道策划，站在用户角度思考，优化设计；5、与产品经理、工程师密切合作，完成日常的需求与项目工作，提供优秀合理的设计方案；任职要求：1、 本科及以上学历（毕业于游戏美术设计，以及相关美术专业），五年以上UI设计经验， 熟练使用设计软件，熟悉iOS和Android设计规范2、 对视觉设计、色彩有敏锐的观察力及分析能力，了解产品交互设计，能在产品易用性与设计美观性上寻求平衡；3、 深入了解交互设计、界面设计的发展趋势，对用户体验、用户需求和用户心理有自己的理解；4、对设计风格和品质有强烈的自我追求，在设计理念上以用户使用感受为最终目标；5、优秀的沟通能力和团队协作精神，乐于学习，工作有激情，富有创造力和责任感。*投递简历请附带作品或作品链接，无作品不面试，谢谢理解。","金融,软件开发",50-150人,ios,苏州
移动端高级测试开发工程师(J10739),https://www.lagou.com/jobs/7120280.html,工业园区,10k-20k,智慧芽信息科技（苏州）有限公司,3-5年,本科,团队管理 大客户销售 晋升空间大,,移动互联网,150-500人,ios,苏州
web前端开发工程师,https://www.lagou.com/jobs/5981873.html,工业园区,12k-24k,苏州极光无限信息技术有限公司,3-5年,本科,薪资丰厚、扁平管理、环境舒适、氛围轻松,"岗位职责：1. 配合UI设计师及后端工程师实现前端应用构建；2. 实现海量用户产品一流的移动端界面，优化代码并保持良好兼容性；3. 设计并实现海量用户产品的交互，提高网页性能和用户体验；4. 配合现有项目进行前端页面功能对接。 任职要求：1. 计算机相关专业本科及以上学历，3年以上工作经验；2. 理解并掌握前端开发技术DOM、BOM、Ajax、JSON等，对前端框架应用（如jQuery/bootstrap等）有一定的经验；3.熟悉ES6/js/html5/css，熟练使用常见图表库如echarts/highcharts；4.熟悉Vue（或React），阅读过vue代码，有实际Vue项目经验，熟练使用webpack，熟练使用常见vue开源库；5.对桌面端/移动端页面兼容性有了解（Windows/macOS/iOS/Android、chrome/firefox/webview/ie/edge...... ）；6.熟悉前后端分离开发模式,参与设计过restful接口，熟悉前后端开发联调；7. 具备良好的服务意识、责任心、较强的学习能力、优秀的团队沟通与协作能力。",信息安全,15-50人,ios,苏州
Unity3D高级开发工程师,https://www.lagou.com/jobs/6618752.html,工业园区,12k-17k,苏州阿基米德网络科技有限公司,3-5年,本科,弹性工作不打卡 福利待遇优越,1、使用Unity3D引擎，独立设计开发APP中相应的模块及AR场景实现；2、APP内相关工具的开发以及性能的优化；3、负责游戏核心架构的搭建以及技术攻关；4、负责AR相关技术的调研、评估工作；任职要求：1、5年以上Unity3D引擎开发经验，有构建框架的能力；2、精通Unity3D引擎，熟悉3D动画方面的知识，精通C#语言，熟悉常用关系型数据库；；3、熟悉Unity3D在IOS、Android平台上的部署、适配、UI布局优化等；4、熟练掌握NGUI和UGUI，熟悉3D图形学，精通Shader编程；5、熟悉AR或2D游戏在移动平台上的开发流程；6、良好的编程习惯及代码编码规范；7、生活工作态度积极，有良好的的沟通能力和团队合作精神，责任心强；8、理解创业精神，敢于创新，思维严谨，勇于挑战自己；,移动互联网,15-50人,ios,苏州
IOSAndroid开发工程师,https://www.lagou.com/jobs/7204378.html,工业园区,8k-15k,苏州欣皓信息技术有限公司,1-3年,本科,带薪年假、年终奖、员工住宿、五险一金,"岗位职责:1.搭建ios /Android应用构架，提交ios /Android系统技术方案，2.独立负责完成ios /Android移动互联网客户端软件的开发维护;3.配合项目经理进行项目分析，技术研讨，实行技术方案的整合;4.研究新技术，满足产品要求;5.进行ios /Android技术文档编写;6. 完成领导分配的其他工作。任职要求:1.计算机相关专业大专以上学历，一年以上ios /Android开发相关工作经验;2.对ios /Android体系构架有深入的了解，能独立完成ios /Android客户端的开发工作及后期维护bug修复工作;3.精通ios开发中的各种组件、 网络通讯、数据存储、UI 布局、动画与控件的使用;4.熟精通ios中的交互设计、 内存管理技术、多线程、自定义高级ui、性能优化等;5.了解hybird app研发，熟悉html5、 javascript和css6. 熟练使用ios /Android开发相关工具，以及相关的sdk,完成相关的测试;7.熟悉 json/xml、http、 tcp/ip 相关协议8. 有实际ios /Android  app上架经验。",移动互联网 数据服务,50-150人,ios,苏州
技术合伙人,https://www.lagou.com/jobs/7178303.html,工业园区,8k-15k,江苏确安工业技术服务有限公司,不限,本科,开创一体化工业互联网服务,"1.   公司简介：定制工业服务解决方案确安工业服务于2011年成立于南京，主要业务是向工业企业提供直接、间接物料，专业管理咨询和其它工业服务，目前主要客户在南京、上海和苏州，大部分客户为外资企业。为了实现公司的快速发展和业务转型，公司确定开发和利用互联网工业服务应用平台，更好更快地为制造企业，特别是中小型制造企业服务：Ø  提供全流程的物料管理解决方案Ø  提供有关生产成本、节能降耗、产能提升和设备可靠性方面的专业咨询2.   职位说明：每个成员都是核心团队，只是分工不同，主要职位包括互联网项目/产品经理、Andriod和iOS系统工程师，架构师，UI设计工程师，后台和前端技术开发工程师，主要职责包括：Ø  负责和团队成员一起研发、开发和实施整个平台和相关的应用Ø  负责协调项目进度，控制预算Ø  负责平台用户、客户和供应商的系统对接3.   期望特质：正直诚实，具有创业勇气，刻苦钻研，积极主动，结果导向，团队合作4.   教育和工作背景：Ø  大学本科以上，计算机软件、信息工程、物联网相关专业Ø  熟悉Android，或iOS开发, 或JAVA, 或PHP, 和数据库SQLØ  有APP开发，ERP、CRM、MES、任务和OKR系统开发或实施经验优先5.   薪资参考：底薪+股票期权+项目奖金 核心价值观Ø  信任和承诺：我们是一个创业性组织，信任是一个组织为了实现共同目标的开始，承诺积极有效的沟通，提供公正平等的机会，和每个人分享利益Ø  成就和责任：团队的成就来自于每个人的成功和失败的分享，时刻保持奋发进取之心，互相帮助，团队协作，并积极履行社会责任Ø  安全和合规：确保每个人的健康和安全，保护我们的环境；遵循商业道德，并始终恪守正直诚实的经营之道Ø  创新和客户：敏锐洞察客户的需求和环境的变化，不断创新，为客户和合作伙伴的满意和成功持续不断地改进，才是可持续发展之道","企业服务,软件开发",少于15人,ios,苏州
cocos2d-x,https://www.lagou.com/jobs/6662517.html,工业园区,12k-18k,苏州超娱互动网络科技有限公司,3-5年,大专,薪资优厚、周末双休,"职位描述：1、配合项目开展项目，并负责公司Android/IOS手游产品客户端的开发；2、负责游戏后期的升级、维护、BUG处理等日常维护工作；岗位要求：1.1年以上基于cocos2d-x引擎的Android/IOS手游开发经验；2.熟悉C++,熟悉Lua脚本；3.熟悉网络通讯协议；4.具有良好的沟通能力和团队合作精神；5.为人诚恳踏实；6.有ARPG游戏开发经验者优先考虑。",游戏,15-50人,ios,苏州
cocos2d-x游戏,https://www.lagou.com/jobs/6474534.html,工业园区,8k-15k,苏州超娱互动网络科技有限公司,1-3年,大专,高薪，周末不加班，有前景,"1、配合项目开展项目，并负责公司Android/IOS手游产品客户端的开发；2、负责游戏后期的升级、维护、BUG处理等日常维护工作；岗位要求：1.1年以上基于cocos2d-x引擎的Android/IOS手游开发经验；2.熟悉C++,熟悉Lua脚本；3.熟悉网络通讯协议；4.具有良好的沟通能力和团队合作精神；5.为人诚恳踏实；6.有ARPG游戏开发经验者优先考虑。",游戏,15-50人,ios,苏州
软件工程师,https://www.lagou.com/jobs/7178559.html,工业园区,6k-12k,江苏确安工业技术服务有限公司,应届毕业生,不限,开创一体化工业互联网服务,"1.   公司简介：定制工业服务解决方案确安工业服务于2011年成立于南京，主要业务是向工业企业提供直接、间接物料，专业管理咨询和其它工业服务，目前主要客户在南京、上海和苏州，大部分客户为外资企业。为了实现公司的快速发展和业务转型，公司确定开发和利用互联网工业服务应用平台，更好更快地为制造企业，特别是中小型制造企业服务：Ø  提供全流程的物料管理解决方案Ø  提供有关生产成本、节能降耗、产能提升和设备可靠性方面的专业咨询2.   职位说明：每个成员都是核心团队，只是分工不同，主要职位包括互联网项目/产品经理、Andriod和iOS系统工程师，架构师，UI设计工程师，后台和前端技术开发工程师，主要职责包括：Ø  负责和团队成员一起研发、开发和实施整个平台和相关的应用Ø  负责协调项目进度，控制预算Ø  负责平台用户、客户和供应商的系统对接3.   期望特质：正直诚实，具有创业勇气，刻苦钻研，积极主动，结果导向，团队合作4.   教育和工作背景：Ø  大学本科以上，计算机软件、信息工程、物联网相关专业Ø  熟悉Android，或iOS开发, 或JAVA, 或PHP, 和数据库SQLØ  有APP开发，ERP、CRM、MES、任务和OKR系统开发或实施经验优先5.   薪资参考：底薪+股票期权+项目奖金 核心价值观Ø  信任和承诺：我们是一个创业性组织，信任是一个组织为了实现共同目标的开始，承诺积极有效的沟通，提供公正平等的机会，和每个人分享利益Ø  成就和责任：团队的成就来自于每个人的成功和失败的分享，时刻保持奋发进取之心，互相帮助，团队协作，并积极履行社会责任Ø  安全和合规：确保每个人的健康和安全，保护我们的环境；遵循商业道德，并始终恪守正直诚实的经营之道Ø  创新和客户：敏锐洞察客户的需求和环境的变化，不断创新，为客户和合作伙伴的满意和成功持续不断地改进，才是可持续发展之道","企业服务,软件开发",少于15人,ios,苏州
前端主管,https://www.lagou.com/jobs/7209283.html,工业园区,12k-20k,浙江三铁信息技术有限公司,3-5年,大专,扁平化管理；弹性工作；餐费补贴；通讯补贴,"职责：1.设计核心产品的前端架构，并带领前端团队实现并持续优化。2.负责前端公共库/组件定义、设计和实现，并持续优化。3.为前后端技术改进、网站性能优化、技术选型提供解决方案。4.负责产品（web/h5/小程序）前端核心模块的设计、交互实现，并持续改善性能和用户体验。5..优化前端开发方式及协作流程，创建技术标准及规范，并推动前端开发团队执行。6为前端团队的技术成长制定目标、计划并定期开展技术培训，提升整体前端技术水平。要求：1.熟悉W3C规范，熟悉HTML4/HTML5、CSS2/CSS3、ES5/ES6等前端开发技术。  2.熟悉Vue/React/Angular等类似MV*框架实践经验，具备独立项目开发能力；熟悉Node.js  技术及生态，熟练使用npm/webpack/gulp等工具链。  3.熟悉前端预编译语言sass、less、Stylus中至少一种。  4.熟悉前端模块化、编译和构建工具，如grunt，gulp,webpack等。  5.能够独立进行前端页面代码开发及性能调优，能够充分理解设计需求并落地。  6.能够独立完成网站脚手架搭建，具备较强自学能力，了解B/S架构工作原理。  7.对移动端开发安卓、IOS、混合开发有深厚相关开发经验。  8.具有良好的沟通能力，重视代码规范，熟练编写API文档。",电商,150-500人,ios,苏州
UIUX设计师,https://www.lagou.com/jobs/7130900.html,工业园区,6k-12k,上海星昕教育科技有限公司,应届毕业生,大专,潜力巨大的新创公司、开阔职场视野,职位描述★ 负责BlaBla移动端和Web端相关产品的设计工作，能独立且高品质地完成产品设计任务；★ 负责公司产品的总体视觉设计，参与相关设计流程、设计标准以及视觉元素规范的制定；★ 与产品经理、前端工程师密切合作，完成日常的需求与项目工作，根据产品需求，提供优秀合理的设计方案；★ 跟踪把握设计与创意的流行趋势，对设计和用户体验提供新的想法和观点。职位要求：★ 本科及以上学历，1-3年左右工作经历；★ 熟练使用Sketch、Photoshop等设计软件，熟悉iOS和Android设计规范；★ 对视觉设计、色彩有敏锐的观察力及分析能力，了解产品交互设计，能在产品易用性与设计美观性上寻求平衡；★ 深入了解交互设计、界面设计等发展趋势，对用户体验、用户需求和用户心理有自己的理解；★ 如同艺术家般对设计的风格和品质感有强烈的自我追求，认同以用户使用感受为最终目的的设计理念；★ 优秀的沟通能力和团队协作精神，乐于学习，工作有激情，富有创造力和责任感；★ 有代表个人风格和水平的完整移动端产品设计经验者优先，简历请带上个人作品。,"教育,人工智能",少于15人,ios,苏州
前端开发工程师,https://www.lagou.com/jobs/6861135.html,工业园区,10k-12k,苏州恒力智能科技有限公司,3-5年,本科,"发展空间大,世500强,五险一金",岗位职责：1、负责产品设计的前端开发工作，能够快速学习并使用主流JS框架、组件和前端规范； 2、负责PC端，移动客户端，小程序等平台的前端开发；3、负责与Web UI设计师、系统开发工程师协作完成web前端的开发工作，根据设计稿实现界面与动效，并从用户角度提出交互使用意见；4、不断优化改进开发框架和产品。任职要求：1、 具有PC、移动端项目，前端开发经验优化；2、 熟悉html/html5、css/css3相关基础知识及应用；3、 熟悉Web标准，对表现与数据分离、html语义化等有一定的理解；4、 熟练掌握代码版本管理工具Git、前端构建工具wepack等。5、 对原生javascript知识有一定的掌握，并有原生代码编写实战经验；6、 热爱前端，精通html5、css3、javascript(ES6/ES7)、nodejs、flutter、vue等前端开发技术，熟悉常用前端框架；。7、 使用Flutter进行移动应用研发；能够独立完成iOS、Android应用的开发工作；8、 能够独立分析解决问题，具有良好的学习能力和团队协作能力，执行力强，富有责任心。,"移动互联网,电商",50-150人,ios,苏州
美工设计,https://www.lagou.com/jobs/7206307.html,工业园区,5k-8k,苏州华碧微科检测技术有限公司,1-3年,大专,五险一金、免费午餐,"岗位职责：1. 负责公司产品界面的设计、编辑、更新、改版2. 负责公司宣传产品的美工设计3. 负责公司纸媒广告和专题设计4. 负责与开发人员配合完成网站、应用、前端页面设计与编辑5. 负责其他美术设计相关工作任职要求：1. 20-28岁，美术、平面设计相关专业2. 两年及两年以上网页设计、平面设计、应用界面设计经验3. 有扎实的美术功底、良好的创意思维和理解能力4. 熟练各种设计工具,包括Ps，Ai，Adobe  xd等相关设计软件，用Sketch 做UI设计5. 熟悉IOS和Android设计规范, 熟练使用：蓝湖等工具6. 可以画产品原型图者优先，擅长手绘者优先7. 善于与人沟通，具有良好的团队合作精神和高度责任感，能承受压力，有创新精神。8. 应聘时务必提供个人作品",企业服务,150-500人,ios,苏州
海外游戏运营,https://www.lagou.com/jobs/6800990.html,工业园区,10k-18k,同程网络科技股份有限公司,3-5年,本科,创新项目，发展空间大,职责描述：1.负责产品在海外地区发行及运营工作以及研发的对接；2.负责产品版本更新与活动计划维护游戏生态，与开发团队沟通协调版本开发、运营细节，保证项目按时上线；3.协调配合各部门支持海外正常运营，及时处理运营突发事件，完成项目执行4.跟踪日常运营数据，对产品数据进行分析，并提出合理化建议；5.定期提交同类产品市场活动综合分析报告，保质保量完成运营相关工作任务；6.收集整理客服汇报用户建议及产品缺陷，推动产品质量持续改善。任职要求：1.3年以上手游海外运营经验，参与过项目从海外版本制作到上线全部过程，了解各项运营基本工作，能保证各项运营工作的按时按质执行，有外语能力者优先；2.清楚了解IOS及谷歌市场规则，账户/打包/上传/更新等详细环节流程；3.熟悉游戏运营各种环节，游戏分析，数据分析能力较强；4.学习能力强，有责任心，思维敏捷，具备较强的团队管理能力和沟通表达能力；5.逻辑思维能力强，喜欢并热爱游戏行业。,旅游,2000人以上,ios,苏州
Unity3D游戏开发工程师,https://www.lagou.com/jobs/6866075.html,高新区,6k-10k,苏州天魂网络科技股份有限公司,应届毕业生,本科,年终奖、周末双休,因公司发展需求，现面向全国广纳贤才，欢迎大家投递哦~【工作地址】江苏-苏州-高新区-中国苏州创业园不忘游戏初心，苏州天魂网络招兵买马啦~ 【成就奖励】年中加薪：用你无穷的潜力，为自己加价年 终 奖：过年回老家，让你成为“别人家的孩子”项目分红：想赚钱？做项目！游戏做的好，分红少不了！还有期权、老员工奖励等你来拿~~~ 【任务系统】1、负责U3D手游客户端UI相关功能开发；2、负责U3D手游客户端功能模块的设计及编码实现；3、负责对接SDK接入及发包。 【技能系统】1.有半年及以上U3D游戏开发经验；2.精通C#，熟练掌握常用插件，熟悉OOP及常用设计模式；3.有良好数据结构及算法功底；4.有编辑器工具开发及扩展经验者优先；5.有Android/IOS、SDK开发及接入经验者优先；6.有良好的沟通表达能力；7.挚爱游戏，有多年游戏经验者优先；8.Dota、Dota2资深玩家优先； 【帮派介绍】我们是完美世界苏州合资公司，拥有射雕三部曲、楚乔传、央视大头儿子等知名IP正版授权，我们是有偶像包袱的实力派。 【养成系统】高段队友-体验大神的666操作拜师学艺-领略答疑解惑的前辈风骚团队配合-有神一样的队友，就有猪一样的对手 【休闲系统】街机掌机等你来挑战，台球桌球欢迎较量下午茶吃点心喝奶茶，让我把你捧在手心组团开黑练英雄升段，体验当王者的荣耀 还在等什么，游戏马上就要开始了，加入我们，一起来一波漂亮的团战！,游戏,15-50人,ios,苏州
