job_name,job_url,job_location,job_salary,job_company,job_experience,job_class,job_given,job_detail,company_type,company_person,search_key,city
文案编辑,https://www.lagou.com/jobs/6949452.html,东莞市市辖区,4k-8k,东莞市兆妍商贸有限公司,3-5年,大专,带薪年假 节日福利 餐饮补贴 七险一金,"岗位职责：1、与美工协作,对公司产品宝贝作出恰当的描述;写各种促销及营销文案与实施方案2、根据产品的特点,进行针对性、直观、感性且赋有吸引力的描述、产品,主题,印象、美文3、配合设计人员,进行品牌宣传等软文撰写4、各类宣传品中的化妆品卖点和活动内容进行文案描述,顾客消费引导5、加强品牌软文推广能力，熟悉多种广告形式的文字表达；6、自媒体运营（微信微淘等）任职资格：1、有淘宝等电商平台的文案相关经验优先，擅长网络编辑或销售型文案写作，有较强的文字编辑能力和策划能力，创意能力；2、创意思维活跃，对网购群体敏感。具备良好的洞察能力，擅于从全类目中提炼素材；3、熟悉淘宝规则，并对淘宝活动、视觉营销等网店相关运作内容方面有经验者优先；4、工作责任心强，抗压能力好，具有良好的理解能力、沟通能力，有团队合作精神，了解网络购物市场及网购群体消费习惯。福利待遇：1、有竞争力的薪酬福利和良好的晋升空间2、法定节假日、有薪年假3、五险一金4、良好的工作氛围及发展空间5、各类国内外培训，个人提升发展的培训及国外出差机会6、公司不定期组织聚餐及户外活动7、正式员工享有节日福利品8、员工集体生日欢乐会9、下午茶、水果及进口零食10、公司代理产品之福利品发放11、员工内部价、免费产品试用12、不断提升的福利待遇等你来建议......","移动互联网,电商",50-150人,美工,东莞
前端开发工程师,https://www.lagou.com/jobs/7079738.html,东莞市市辖区,7k-8k,东莞房保保网络科技有限公司,1-3年,大专,有挑战能成长,1、负责小程序的开发框架的日常维护、新特性开发；2、负责根据产品需求文档，与美工、后端人员一起协作，完成小程序的整体开发和架构部署；3、负责小程序上线后的代码优化和迭代开发；任职要求1.计算机专业或软件工程相关专业大专以上学历，熟悉小程序开发；3.精通vue 、JavaScript、HTML5、CSS、jQuery等前端开发5.能够独立完成详细设计及编码、进行代码审查，编程风格良好。,消费生活,15-50人,美工,东莞
web前端开发工程师,https://www.lagou.com/jobs/6711516.html,东莞市市辖区,8k-10k,广东盘古信息科技股份有限公司,1-3年,大专,五险一金；绩效奖金；年终奖；购房购车补贴,岗位职责:1.参与项目方案中前端相关的讨论、设计以及文档编写；2.负责前端HTML/js/CSS代码的编写，实现界面效果、交互和功能；3.按产品设计需求完成项目开发迭代，主动实现优化和提升用户体验；4.深入分析和解决前端遇到的各种技术、性能、跨终端、浏览器兼容问题，保证页面响应性能和执行效率；5.完成前端核心业务代码及JS组件的封装；6.能不断完善和优化前端技术开发规范和流程；任职资格:1.二年以上前端开发经验；2.精通Javascript、HTML/XML、CSS3、html5、Ajax等前端开发技术，熟悉W3C标准；3.熟悉bootstrap，font awesome等CSS框架；4.熟悉JQuery、zepto、bootstrap等Javascript框架；5.掌握WEB所需图片设计及编辑等基本美工能力；6.有nodeJS开发经验者优先；7.熟悉全栈开发，有创新能力，有JAVA WEB经验优先；8.对业界最新的前端技术和实现有浓厚的兴趣及深入的见解；9.具备良好的团队合作精神、较强的沟通能力、高度的责任感、有一定的抗压能力。,其他,150-500人,美工,东莞
網路運營,https://www.lagou.com/jobs/6752975.html,东莞市市辖区,5k-8k,深圳巴斯洛时尚有限公司,1-3年,不限,五險一金 帶薪年假,职责描述：电商平台运营，京东，小红书，有赞微商城平台运营和对接工作。1、负责店铺的运营管理、改版策划、上架、订单、推广、销售、售后服务等；2、负责组织完成公司各类促销活动及营销方案，指定活动方案、计划与预算；3、定期监控、分析、评估各项经营数据，根据数据做出分析报告并提出改进方案；4、跟踪客户销售数据、优化平台，提升用户体验，协调各部有效完成各项需求；5、分析访客流向数据，协调策划与美工人员对商城页面进行调整或改版；6、与平台外部联系人保持密切联系及良好关系，沟通解决各类问题，为店铺争取各类有益资源；7、负责收集市场和行业信息，提供有效应对方案，完成销售目标； 8、完善客户服务规范、流程和制度；提供并优化完善客户常见问题反馈及解决流程；全方位优化客户服务质量； 9、管理客户档案，建立客户关系维护相关办法；利用微信群、帮派、论坛等工具增加客户粘度。10、使用聊天工具与客户在线交流，介绍产品，解答客户咨询；顾客购买后续服务，跟踪发货进度，及时与用户沟通，处理客户的订单查询。11、准确把握客户需求并进行针对性销售，完成部门销售任务，并配合其他部门处理客户订单和售后问题；12、完成公司安排的其他工作；任职要求：为人正直诚信，踏实用心工作、思维宽广、有上进心！1、良好的策划推广能力和项目执行能力2、熟悉各购物平台运营环境活动规则、推广，京東 小紅書站内广告资源； 3、有線上推广相关经验； 4、思维清晰，具有较强的数据分析能力，能分析各种统计软件的数据。,"电商,消费生活",15-50人,美工,东莞
网络销售+内贸业务员,https://www.lagou.com/jobs/7027412.html,东莞市市辖区,4k-8k,东莞市易麦工艺礼品有限公司,不限,不限,带薪培训+90后95后年轻团队+包食宿,"你有梦想，我有平台；趁年轻,我们一起拼！【任职易麦，你将收获？】9年业务经验，“老司机”带你飞带薪免费专业培训学习，收获满满拥有参展机会，带薪年假PK奖、团队奖、销售奖，奖金多多团建活动、聚餐、爬山、烧烤、K歌公司旅游；一群年轻活力同事朋友公司氛围好，带健身器材，空调办公室【工作内容：】1.与客户交流；了解公司产品信息，促成交易2.引导客户进行下单，询问买家的需求和用途进行沟通跟踪3.态度积极热情服务，为顾客解决售后服务问题4.进行客户回访，跟进客户，更好的稳住和维护老客户5.新客户进行开发，二次开发，持续跟进，接单。要求：1.工作责任心强，性格活泼开朗！2.较强的谈判沟通能力，熟悉办公软件，电脑打字快3.喜欢销售，热爱销售工作，学习态度好4. 比较细心，有耐心，责任心强。【我们的优势：】1.有专业产品开发能力，独立设计；年高达500款以上常规新品及10+款专利新品！2.每年2-3场展会，9年alibaba优质平台。3.客户资源不用愁，阿里国内后台客户+询盘客户+展会客户+现成客户资源，来即可跟进客户4.销售链路配套齐全，运营，美工，跟单，生产，开发，一应俱全，让专业的人做专业的事！5.享受带薪专业培训，技能、产品等培训,让你赢在起跑线上",电商,50-150人,美工,东莞
直招电商应届生,https://www.lagou.com/jobs/7042210.html,东莞市市辖区,4k-6k,深圳市联合智造商务有限公司,应届毕业生,不限,公司经常有团建活动，水果分发等,招聘学校应届生，淘宝美工/运营等。。。。做事踏实，服从管理。公司环境干净，整洁、安静，公司提供冰箱、微波炉给员工使用，宿舍配有空调、热水器、洗衣机。公司离虎门高铁站、高速路口，车程10分钟左右，宿舍在公司隔壁，附近200米左右就有公交站，交通便利。上班时间：08.00-12.00 13.30-18.30,"移动互联网,电商",15-50人,美工,东莞
新媒体运营,https://www.lagou.com/jobs/7097588.html,东莞市市辖区,8k-14k,东莞市道滘海强五金家具厂,3-5年,本科,包吃住，双休，有勤工奖，效绩奖金，保险。,天猫/淘宝运营店长8000-14000元/月职位详情岗位职责1、负责淘宝店铺的上架、营销、管理等一切事物；2、能够独立分析数据，做好店铺规划，配合美工做好店铺装修；3、负责淘宝店铺推广，提高店铺点击率和浏览量，完成店铺销售目标；4、负责淘宝店铺营销活动的策划及实施，并协同客服、平面、商品及相关部门完成任务；5、负责对店铺数据进行分析整理，提出改良建议并执行。任职资格1、大专及以上学历；2、熟悉淘宝规则，有三年以上网店运营经验者优先；3、优秀的策划能力，能完成店铺日常活动策划并跟进执行；4、良好的团队协作能力及执行力；5、良好的沟通能力，有淘宝相关资源优先。,其他,50-150人,美工,东莞
