job_name,job_url,job_location,job_salary,job_company,job_experience,job_class,job_given,job_detail,company_type,company_person,search_key,city
java高级开发工程师,https://www.lagou.com/jobs/7219327.html,浦东新区,25k-35k,上海众旦信息科技有限公司,5-10年,本科,运营支撑，大数据量挑战,1.参与公司运营支撑系统需求分析和系统设计2.负责与产品沟通相关需求和技术方案输出3.需求任务拆解和工作分配管理4.领域核心功能代码设计和实现任职要求：1.7年及以上工作经验，java基础扎实，具备领域相关设计和研发经验2.负责域内开发计划排期以及任务拆解，指导组内低级别小伙伴的代码开发，组织小伙伴进行codeReview3.熟悉JVM原理及调优，熟练掌握spring-cloud、redis、rocketMQ等技术栈，4.对数据库的基本理论和内部实现机制有深刻的理解，能够熟练应用MySQL，有实际大数据量的数据库设计（数据库架构设计，水平分库分表）经验以及NOSQL设计经验5.有小团队（3人以上）管理经验优先考虑，能给团队做技术、经验分享，帮助组员成长与提高,电商,500-2000人,java,上海
Java开发工程师,https://www.lagou.com/jobs/7219328.html,徐汇区,14k-25k,武汉讯锡云科技有限公司,3-5年,大专,互联网 产品业务 医疗行业,技术栈：1、SpringBoot、Spring Cloud 或 Dubbo、MyBatis 或 Spring JPA2、MySQL、MongoDB、Redis、ES3、RocketMQ、RabbitMQ4、Jenkins、Maven、Git岗位职责：1、负责新一代互联网产品后端系统的设计与开发，保证系统可靠性，性能，可维护性；2、负责开发后端功能模块，编写设计文档，并与产品经理及前端开发配合；3、参与技术预研和技术重构，参与团队交流，为新功能提供前期准备；4、协助运营和其他技术人员解决线上问题；5、和小伙伴互相进行Code Review。岗位要求：1、 5年以上Java开发经验（至少年以上互联网或移动互联网开发经验）；医疗类、电商类项目经验优先。2、 熟悉Spring及常用的Web框架，如SpringMVC，Struts2；3、 熟悉MySQL数据库及MyBatis；4、 熟悉常用的NoSQL产品，如MongoDB，Redis，Memcache；5、 优秀的团队合作和沟通技能；6、 愿意接受挑战性的工作，能够主动高效及时完成工作，能够承受交大工作压力,"移动互联网,消费生活",150-500人,java,上海
java高级开发工程师,https://www.lagou.com/jobs/7219146.html,浦东新区,14k-20k,上海煜旺电子商务有限公司,3-5年,本科,下午茶，节日福利，旅游，打车报销,"0、请仔细阅读，**印象答不上来的不用投简历，实际工作经验，培训经验自动过滤1、java基础好，反射，集合，线程，日志，map,链表，异常，jvm，面向对象，常用的设计模式,java相关特性等2、spring框架，微服务相关，扩展，基础，aop，ioc，事务等3、mybatis试用，缓存，写法等4、熟悉oracle，sql优化，索引，表设计的理由5、做过多线程高并发项目，金融经验6、自己做的项目要很清楚流程，价值和自己做的模块有哪些突出的技术体现7、【毕业4年以上，本科学信网可查，双证齐全,工作地点在6号线北洋泾站，非诚勿扰】",电商、房产家居,150-500人,java,上海
Java开发工程师,https://www.lagou.com/jobs/7186504.html,杨浦区,30k-50k,青岛盛世创想信息科技有限公司,3-5年,本科,明星电商平台,福利待遇：高于市场的补贴和福利阿里/头条/腾讯的同事职责描述：1.负责移动应用的后台系统设计的迭代、开发、重构;2.编写代码实现产品功能，完成项目开发，撰写相关文档，参与需求分析;3.负责核心技术问题的攻关，架构设计、系统优化，协助解决项目开发过程中的技术难题;4.了解互联网的技术发展、评估外部技术与解决方案。职位要求：1. 3年以上Java及Java Web开发经验， 具有扎实的程序设计基本功，有志于从事技术工作，能够独立担当功能模块的设计开发；2. 理解Java常用设计模式，并且能够合理运用，基本技术特性，如Java数据结构，多线程编程，Java IO等3. 熟练使用Java常用框架和工具，如 Spring boot 、Spring Cloud、SpringMVC、Struts、Hibernate、Mybatis等4. 熟悉缓存Redis、Memcache/Couchbase，缓存设计和模式及其应用；5、熟悉数据库原理并熟练掌握相关优化方案，熟悉ORACLE、MySql数据库开发技术及相关工具，熟悉数据库设计，熟练掌握SQL语句；6、能在类Unix环境下熟练开发，掌握Java开发，Tomcat 配置、MySQL配置；有shell/python脚本开发能力更佳；7、好的沟通能力及团队合作精神，具备良好的理解能力和表达能力，能够承受一定工作压力；8、有移动互联网行业开发经验者优先。 PS：1.之前公司必须有一个是中大型企业，不接受一直在技术人员少于100人的公司。2.处理电商平台高并发，日活百万是最低要求3.负责后台功能的设计、开发及维护4.期望跳槽不要太频繁，5年最多接受2次跳槽，年龄26-33，有大厂经历可放宽要求,"移动互联网,电商",50-150人,java,上海
java开发工程师,https://www.lagou.com/jobs/6220537.html,浦东新区,14k-24k,奥解思信息科技（上海）有限公司,1-3年,本科,福利好，弹性工作制，培训机会多,1、2年以上Java开发经验，良好的基于Java系统设计和开发相关经验。2、本科及本科以上计算机相关专业3、熟悉JAVA(核心JAVA、多线程、Spring、Restful服务)4、熟悉Maven、GIT、Hudson、JUnit等类似技术。5、数据库- Oracle或具有SQL、PL/SQL编程经验。6、unix /Linux脚本编写技巧(Korn shell)7、具有Mongo DB经验，会Spark优先考虑8、有消息服务(JMS、Tibco EMS)和Websphere application server方面经验优先。9、英语优秀优先考虑。,金融,500-2000人,java,上海
高级java开发工程师,https://www.lagou.com/jobs/6097218.html,浦东新区,15k-30k,上海商涌网络科技有限公司,5-10年,本科,"学习成长快,团队氛围好,发展空间大",岗位职责：1、负责系统的架构设计、数据建模和核心代码的编写；2、能够指导初、中级研发工程师的工作，完成技术难点的功关，解决项目中遇到的技术难题；3、在负责处理本域事务的基础上，也能协调相关上下游域的事务；4、对外技术合作的沟通、接口的设计和主要代码的实现；5、线上系统的运维支持、排查和解决系统疑难问题；6、完成领导安排的其他开发与设计工作。任职资格:1、计算机软件或相关专业本科及以上学历，5年左右Java开发经验，具有扎实的Java编程功底和良好的编码规范及规范的文档编写习惯；*2、熟悉MySQL，有丰富的主从架构、读写离、分库分表设计和实际应用经验，能够根据业务设计出合理的方案，熟悉NoSQL、Redis、ZooKeeper使用优先；*3、熟悉Java语言开发，JAVA基础扎实，精通io、多线程、集合等基础框架，精通分布式、缓存、消息等机制；4、熟悉kafka、activemq等消息组件，以及消息中间件的使用场景，能够根据业务需求设计合理的使用方案；5、熟悉Dubbo、SpringCloud等微服务技术框架，了解微服务架构设计和技术实现；  6、具有高度的抽象设计能力，思路清晰，善于思考，能独立分析和解决问题；7、具有良好的沟通合作技巧、较强的责任心，能承受较大的工作压力；8、熟悉大流量、高并发、高性能的分布式系统的设计及应用，熟悉安全机制及性能调优。,"数据服务,人工智能",50-150人,java,上海
java工程师,https://www.lagou.com/jobs/5947381.html,浦东新区,10k-20k,上海商涌网络科技有限公司,3-5年,本科,"发展前景好,学习空间大,团队氛围好","工作职责:1、负责业务线及技术改造类项目的系统分析、设计、编码，与相关团队的协作、沟通2、负责线上稳定，线上问题独立定位、解决2、系统性能优化，持续提升系统在大规模分布式系统环境下高并发、海量请求数下的高处理性能3、解决各类潜在系统技术风险，保证系统的安全、稳定、快速运行任职资格:1、本科及以上学历，计算机相关专业优先2、有3年以上JAVA开发工作经验；有并发编程经验，扎实的Java编程基础；3、熟悉常用Java开源类库，熟悉设计模式，熟悉JVM，缓存，分布式架构等核心技术及原理；4、对各种开源的框架如Spring、ibatis、mq、redis等有深入的了解，对框架本身有过开发或重构者可优先考虑；5、熟练使用关系型数据库（MySQL/Oracle），有SQL优化和数据库调优经验者优先；6、熟悉常用的项目工具（如maven,git)，熟悉Linux    系统及常见命令，具备很好的问题分析和排查能力；7、积极主动，责任心强，能承受高度工作压力，具有良好的信息收集能力、归纳思维能力、团队协作意识强；有良好的软件工程知识和质量意识；","数据服务,人工智能",50-150人,java,上海
java开发工程师,https://www.lagou.com/jobs/6093903.html,徐汇区,10k-18k,上海唯都市场营销策划股份有限公司,3-5年,本科,500强企业项目，500强企业园区,"工作内容：1.负责知名品牌的网站，微信公众号、小程序及CRM系统的开发和运维2.理解业务需求，设计系统功能并实施3.负责公司内部开发框架的编写和完善工作任职要求：1.计算机及相关专业本科以上，3年以上Java开发经验2.JAVA基础扎实，精通io、多线程、集合等基础框架，熟悉常用的设计模式3.熟悉流行的开发框架：Spring MVC/struts2、Hibernate/Ibatis（myBatis）、Spring等4.对大型的分布式系统架构有很深入的理解，在SOA架构和应用架构上丰富经验，能够解决各种系统架构问题5.熟悉分布式系统的设计和应用，熟悉分布式、缓存、消息、负载均衡等机制和实现；擅长性能调优者优先6.熟悉RabbitMQ, Redis, ElasticSearch等流行技术框架工具者优先",广告营销,150-500人,java,上海
java技术专家,https://www.lagou.com/jobs/7219318.html,浦东新区,20k-30k,上海众旦信息科技有限公司,5-10年,不限,核心交易链路，高并发挑战,职责：1.支付相关应用系统模块设计和开发，按照项目计划独立完成编码功能实现2.相关系统维护，确保服务稳定运行3.开发过程中各相关文档的编写任职要求：1.5年及以上相关领域工作经验2.掌握基本设计模式，对系统架构有一定了解3.熟悉JVM原理及调优，熟练掌握spring-cloud、redis、rocketMQ等技术栈4.能够熟练应用MySQL，精通MySQL性能分析方法，并能进行合理优化5.良好沟通能力，善于学习，有强烈的学习欲望和学习能力，对技术有追求,电商,500-2000人,java,上海
Java工程师,https://www.lagou.com/jobs/6168541.html,闵行区,16k-25k,锋泾（中国）建材集团有限公司,5-10年,本科,五险一金，中秋春节福利，年终奖,"任职资格：1、至少五年以上Java开发经验，扎实的Java基础；2、熟悉敏捷开发，了解微服务架构并有实际开发经验，熟悉springboot、springcloud；3、熟悉redis、mongodb等，熟练掌握Oracle、MySQL等数据库，精通MyEclipse,IDEA等开发工具；4、对于Java开发的底层架构逻辑有比较深入的了解；5、对业务需求有深入的了解，能耐心研究复杂的业务逻辑。","电商,房产家居",500-2000人,java,上海
java开发工程师,https://www.lagou.com/jobs/6168883.html,闵行区,14k-20k,锋泾（中国）建材集团有限公司,3-5年,本科,节日福利，餐补，带薪年假,"任职资格：1、至少三年以上Java开发经验，扎实的Java基础；2、熟悉敏捷开发，了解微服务架构并有实际开发经验，熟悉springboot、springcloud；3、熟悉redis、mongodb等，熟练掌握Oracle、MySQL等数据库，精通MyEclipse,IDEA等开发工具；4、对于Java开发的底层架构逻辑有比较深入的了解；5、对业务需求有深入的了解，能耐心研究复杂的业务逻辑。","电商,房产家居",500-2000人,java,上海
Java开发工程师,https://www.lagou.com/jobs/5045495.html,静安区,15k-20k,上海海万信息科技股份有限公司,5-10年,本科,"五险一金,旅游体检,年终奖,过节礼金",岗位职责：1、负责零售消费金融后台产品、核心模块关键组件的架构设计和编码相关工作；2、研究业界最新技术以及应用，解决研发过程中的关键问题和技术难点；3、根据任务按时完成编码工作和单元测试工作，保证产品的质量；4、按照开发流程编写相应的模块设计文档；5、与产品经理、测试工程师和其他团队沟通协作，保证产品研发的进度和质量；任职要求：1、5年Java开发经验，熟练使用Java相关技术和框架（包括Java语言基础/多线程/Spring/Springmvc/myBatis等）；2、精通Oracle/Mysql数据库编程，对数据库的规划、设计、优化有丰富的经验；3、熟悉面向对象的分析和设计能力，熟悉webservice、Soa等远程调用框架，掌握常用的设计模式；4、熟悉tomcat、intelidea、Git、Maven、Eclipse等；互联网金融从业背景，银行信贷核心系统业务开发经验者优先5、具有较强的学习能力：能够独立分析问题，调试问题，解决问题的能力；6、具有良好的团队合作精神和与人沟通的能力；7、能够承担较大的工作压力,"移动互联网,金融",500-2000人,java,上海
高级java开发工程师,https://www.lagou.com/jobs/6661116.html,静安区,15k-20k,上海海万信息科技股份有限公司,5-10年,本科,"五险一金,旅游体检,年终奖,过节礼金",岗位职责：1、负责零售消费金融后台产品、核心模块关键组件的架构设计和编码相关工作；2、研究业界最新技术以及应用，解决研发过程中的关键问题和技术难点；3、根据任务按时完成编码工作和单元测试工作，保证产品的质量；4、按照开发流程编写相应的模块设计文档；5、与产品经理、测试工程师和其他团队沟通协作，保证产品研发的进度和质量；任职要求：1、5年Java开发经验，熟练使用Java相关技术和框架（包括Java语言基础/多线程/Spring/Springmvc/myBatis等）；2、精通Oracle/Mysql数据库编程，对数据库的规划、设计、优化有丰富的经验；3、熟悉面向对象的分析和设计能力，熟悉webservice、Soa等远程调用框架，掌握常用的设计模式；4、熟悉tomcat、intelidea、Git、Maven、Eclipse等；互联网金融从业背景，银行信贷核心系统业务开发经验者优先5、具有较强的学习能力：能够独立分析问题，调试问题，解决问题的能力；6、具有良好的团队合作精神和与人沟通的能力；7、能够承担较大的工作压力,"移动互联网,金融",500-2000人,java,上海
java工程师,https://www.lagou.com/jobs/6505676.html,闵行区,15k-30k,广州云徙科技有限公司,5-10年,本科,一年二轮融资 快速发展 餐补房补,工作职责：1. 从事公司相应的java项目的开发工作。任职资格1、5年以上开发经验，有扎实的java基础，熟悉io、多线程、集合等基础框架，有WEB开发经验；2、精通Java程序设计语言，对各种开源的框架如Struts、Hibernate、Spring、SpringMVC、Mybatis、JUnit等有一定的了解；3、熟悉主流数据库，如：MySQL、PostgreSQL、Oracle中的一种等；4、学习能力强，对前沿技术有理解和应用能力；5、工作有激情，能承受压力。责任心强，工作效率高，有良好的团队合作精神。工作地点：上海市 闵行区 虹桥天地,"数据服务,移动互联网",500-2000人,java,上海
高级java开发工程师,https://www.lagou.com/jobs/6105734.html,浦东新区,20k-30k,宏信金服（天津）信息科技有限公司,3-5年,本科,扁平化管理 领导nice 福利好,职责描述：与产品经理沟通，了解业务需求和产品市场定位；根据产品需求完成架构和模块设计、编码、测试工作；能按照项目计划，按时提交高质量的代码，完成开发任务；改善软件的易用性，提升用户使用体验；规范和文档的编写、维护。任职要求：本科及以上学历，计算机相关专业；熟悉Java开发语言，精通JVM平台的并发、网络安全等知识精通SpringCloud等开源框架；熟悉各种常用设计模式；熟悉数据库开发及各种开发工具；熟悉微服务、Docker容器化设计；互联网金融行业优先。,金融,50-150人,java,上海
Java高级开发工程师,https://www.lagou.com/jobs/6338882.html,长宁区,15k-30k,上海机场国际旅行社有限公司,3-5年,本科,机场及携程背景，从0-1开发,1、根据产品和业务抽象，完成后台API接口模块的研发，支持各类前端，以及第三方系统的调用2、根据产品需求和系统设计完成指定模块的开发    3、根据开发进度和任务分配，完成相关的设计、开发任务   4、参与相关产品需求分析及软件架构设计    5、基于公司的微服务框架，独立完成组件的设计及开发    6、尝试新技术，提出架构建议    7、辅导新人养成良好的软件工程知识和编码规范意识    8、解决开发过程中的技术问题    9、优化架构设计，提升系统性能    10、计算机、软件工程及相关专业本科毕业；    11、5 年以上 java 实际项目开发经验（电商平台）    12、精通Java 8，熟悉Java多线程，高并发，IO/NIO，网络通信等；；    13、丰富的后端服务开发和架构设计经验（Web Service、Restful API等）；    14、熟悉常用的设计模式，有大型分布式，高并发，高负载，高可用性系统的设计和开发经验    15、掌握各种常用服务端技术，能优化服务响应和数据查询，保证各种服务质量，解决高并发和高可用性的问题；    16、熟悉MySql或MSSQL，熟练掌握数据库设计能力和性能调优技巧；    17、掌握 Gradle / Maven 等构建工具， 熟悉 Docker集群的使用    18、深刻理解面向对象设计和开发思想，具备较好的文档能力及良好的编码风格；    19、工作积极主动，具良好的对外沟通和团队协作能力；    20、诚信、敬业、好学、吃苦耐劳,旅游,500-2000人,java,上海
java开发工程师,https://www.lagou.com/jobs/6103269.html,浦东新区,10k-20k,宏信金服（天津）信息科技有限公司,1-3年,本科,扁平化管理 领导nice 福利好,职责描述：与产品经理沟通，了解业务需求和产品市场定位；根据产品需求完成架构和模块设计、编码、测试工作；能按照项目计划，按时提交高质量的代码，完成开发任务；改善软件的易用性，提升用户使用体验；规范和文档的编写、维护。任职要求：全日制本科及以上学历，计算机相关专业优先熟悉Java开发语言，精通JVM平台的并发、网络安全等知识精通SpringCloud等开源框架；熟悉各种常用设计模式；熟悉数据库开发及各种开发工具；熟悉微服务、Docker容器化设计,金融,50-150人,java,上海
Java开发工程师,https://www.lagou.com/jobs/6885688.html,杨浦区,15k-20k,上海道客网络科技有限公司,3-5年,不限,五险一金、补充医疗险、年终奖金,"在DaoCloud你将会负责：1、分析业务需求，将需求拆分为独立的业务功能；2、分配研发任务，监督设计与实现过程，保证产物按时按量完成；3、独立负责系统设计、研发与优化工作，协助解决项目研发过程中的技术难题。DaoCloud对你的期望：1、计算机相关专业本科及以上学历，至少3年以上开发经验；2、扎实的Java基础，熟悉JVM，理解io、多线程，常用数据结构、算法、设计模式；3、熟悉主流开源框架，技术：Spring Boot、Spring Cloud、MyBatis、Maven、Git；4、有微服务开发经验，使用过Spring Cloud或者Dubbo的微服务体系，了解微服务监控；5、熟练使用MySQL数据库的设计，开发和性能调优；6、熟悉分布式缓存、消息中间件、负载均衡、安全防御等技术，掌握各类中间件使用，包括MongoDB、Redis、RabbitMQ、RocketMQ、Kafka,、Elasticsearch等；7、具有较强的文档编写能力，能够按照要求编写开发设计和架构设计文档8、熟悉Linux操作系统，掌握常用的Linux命令；9、较强的表达和沟通能力，高度敬业精神，团队意识强，对技术有着特别的渴求，在关注的领域有着深入的研究，并不断创新。符合以下条件者优先1、有大型网站开发经验、熟悉Docker、K8S等优先；2、有支付和订单的高并发编程经验优先；3、有IoT运营平台开发项目经验优先;4、熟悉其他开发语言可加分（例如Go，Python，PHP，Node）。","企业服务,数据服务",150-500人,java,上海
Java开发工程师,https://www.lagou.com/jobs/6748882.html,徐汇区,20k-40k,北京市商汤科技开发有限公司,3-5年,本科,AI独角兽；弹性工作；餐补；扁平管理；,工作内容1.负责智慧交通业务及数据平台的设计与开发2.参与需求分析，撰写相关文档3.提升产品整体的运行效率与稳定性职位要求1.熟练使用java语言，具有扎实的java基础、良好的编程习惯及其代码规范。2.熟悉linux系统，了解网络、计算、存储等基本原理，能解决常见的操作系统相关问题，熟练使用shell命令。3.熟悉主流开源应用框架，如SpringBoot、SpringClood、SpringMVC、myBatis、XML、JSON、Maven等开发技术，使用过Spring Cloud优先。4.熟悉Mysql数据库，熟练掌握SQL语句，并知悉SQL执行效率。了解数据库优化、SQL优化、查询性能等优化；精通数据库架构Sharding、高可用性、主从复制等技术。5.熟练使用git，Maven等开发及管理工具。6.互联网开发及其分布式项目经验，有大并发处理经验为佳。熟悉Kafka，ZooKeeper，Redis，ElasticSearch，Flink等技术优先。,人工智能,2000人以上,java,上海
java架构师技术专家,https://www.lagou.com/jobs/7186605.html,杨浦区,40k-60k,青岛盛世创想信息科技有限公司,5-10年,本科,明星电商平台,"工作职责
 负责基础架构建设，包括方案设计、技术选型、组件研发2.基础组件线上维护和问题响应处理，oncall3.响应跨团队需求和咨询，技术方案支持和协助4.包括且不限于以下技术方向，微服务、海量数据存储、应用监控、中间件研发、基础框架研发、容器化、电商交易业务架构要求1.五年以上工作经验，高潜型放宽年限要求2.2年以上基础架构经验或者业务架构经验，高潜型放宽经验要求3.java精通，有golang、rust经验更好，高潜型放宽语言要求4.熟悉spring cloud微服务体系，有servicemesh经验更好。熟悉分库分表方案和相关中间件有实际经验。熟悉常用缓存架构和相关中间件。熟悉互联网高并发高可用架构方案。有devops文化精神。5.注重团队合作，有一定沟通协调能力和抗压能力，软素质过关，工作踏实6.编码能力强，不要ppt架构师，热爱技术，思路清晰，基础牢固。从未远离一线加分项1.acm奖项2.参与开源项目3.熟悉电商交易业务PS：1、只接受中大型企业背景人选，公司平台需要处理日活千万级别以上的高并发。
       2、5年最多接受2次跳槽，如果有大厂经历可放宽。       3、年龄28-35岁","移动互联网,电商",50-150人,java,上海
高级JAVA开发工程师,https://www.lagou.com/jobs/5679388.html,青浦区,28k-40k,上海中通吉网络技术有限公司,5-10年,本科,每年两次晋升机会，平台成熟,"岗位职责：1、负责公司基础平台组件、服务化中间件的选型、设计、开发、推广；2.、完成重要业务模块，搭建核心框架的，实现核心编码， 落地部门架构师的设计原型；3、负责对系统代码Review提出改进建议；4、引导团队用架构的思路设计和规划系统，引导提升团队的架构设计能力；5、帮助团队解决日常疑难问题。岗位要求:1、统招本科及以上学历，7年以上Java编码经验，2年以上的团队管理经验；2、精通JAVA语言：熟练掌握数据结构，算法、多线程编程，高并发设计，掌握常用的设计模式；熟悉JVM，包括内存模型、类加载机制以及性能优化；3、熟悉分布式（SOA、微服务）开发模式；4、深入分布式领域中间件原理优先考虑。包括但不限于：Dubbo,SpringBoot, SpringCloud, 分布式调用连，自动化发布流程，ZK，ELK，分库分表，消息中间件（kafka），分布式缓存，监控，分布式调度；5、有物流/快递行业、金融、O2O、电商、互联网等行业背景者优先考虑。",电商,2000人以上,java,上海
