job_name,job_url,job_location,job_salary,job_company,job_experience,job_class,job_given,job_detail,company_type,company_person,search_key,city
测试工程师,https://www.lagou.com/jobs/6573020.html,天河区,13k-24k,亚创（上海）工程技术有限公司,5-10年,本科,13薪，六险一金 外企环境，扁平式管理,岗位要求（仅供参考，以实际面试为准）：1.计算机相关专业，本科及以上学历，有集成测试或者开发经验者优先； 2.熟练掌握性能测试理论及实践，具有3年以上的相关测试经验； 3.熟悉主流自动化测试工具； 4.具备Java、C++等编程经验，并具备Python等脚本开发经验； 5.熟练掌握操作系统（Linux、Windows）和主流数据库（Oracle、MySQL、SQL Server）。,"企业服务,硬件",2000人以上,测试,广东
测试工程师,https://www.lagou.com/jobs/6173957.html,南山区,7k-10k,中兴软件技术（南昌）有限公司,1-3年,本科,大平台 发展前景好,技能要求： 网络测试，机顶盒测试，路由器测试 岗位职责：  1、熟悉软件工程，软件测试设计方法，软件测试理论，能对产品需求进行测试分析，对测试故障进行初步定位。  2、熟悉以太网基本原理和结构；  3、熟悉C；熟悉TCL、Python脚本类语言  4、掌握数字信号处理、通讯基本原理；  5、有多媒体产品、手机等个人终端产品的软件和系统测试工作经验  6、具有良好的沟通和团队合作精神，高度的责任心和积极的工作态度  任职要求：  1、有至少1年以上相应的网络、路由器、机顶盒测试经验的优先；  2、有计算机、网络工程师等级证书者优先考虑；  3、能吃苦耐劳，能承受一定的压力，较好的沟通能力。,"移动互联网,企业服务",500-2000人,测试,广东
测试工程师,https://www.lagou.com/jobs/6339045.html,海珠区,10k-20k,广州花生家网络科技有限公司,3-5年,本科,"千万级用户,高并发系统,团队大牛多","岗位职责:1.负责部门web系统和APP产品测试工作；2.根据产品需求和原型能够设计和编写测试用例，制定测试流程、规范，及执行相关测试工作和完成测试报告的编制工作；3.构建测试环境和执行测试用例，进行缺陷跟踪分析，定位和反馈，完成改善验证；4.熟悉产品流程，为相关部门提供技术支持，协助解决问题；5.负责相应的产品发布及上线验证；6.协助处理突发情况及上级交代的临时任务等；7.负责测试环境的维护与管理。任职资格:1.本科及以上学历，计算机相关专业，具有3年以上相关测试经验；2.掌握主流测试工具lordrunnerQRTP,对于自动化测试有一定的认识，能够独立进行自动化测试框架设计；3.熟悉操作windows、linux、sqlserver、oracle等软件,有开发经验者优先；4.有较强的逻辑分析能力和总结能力；5.有测试组长经验优先；【加入我们，您将能享受】*优秀平台：充满激情的工作氛围，与优秀牛人共事的机会，快速发展成长的平台，广阔的发展空间与实现梦想的舞台；*全面保障：购买“五险”（养老、医疗、失业、工伤、生育保险）、“一金”（住房公积金）；*各种福利：员工活动（生日会、体育活动、部门团建、年度体检）； 公司正在快速发展，期待你的加入哦，简历砸过来吧~","电商,消费生活",150-500人,测试,广东
测试工程师,https://www.lagou.com/jobs/6722472.html,天河区,7k-8k,广州市因地利信息科技有限公司,1-3年,大专,年终奖,岗位职责1、负责公司内APP和微信等产品的测试工作，做好测试用例编写和管理；2、负责产品的功能性、稳定性、性能方面测试；3、负责与产品进行需求收集，负责与技术进行bug跟踪。任职要求1、大专或以上学历，1年以上工作经验；2、熟悉手机端(IOS、Android、Web)的各种边界测试、性能测试以及功能与稳定性测试；3、具备很强的逻辑思维能力，能够独立完成测试用例编写，做好发布前和发布后的覆盖测试和回归测试；4、有很强的沟通能力，能够与产品、设计和开发进行顺畅高效的沟通；5、对工作认真负责，克服困难保证工作按质按时完成，做好产品的质量保证工作。,"移动互联网,广告营销",50-150人,测试,广东
测试工程师,https://www.lagou.com/jobs/6991371.html,南山区,8k-15k,深圳视界信息技术有限公司,1-3年,本科,AI+大数据；氛围活跃；新技术,岗位职责：1.负责八爪鱼官网的测试；2.负责八爪鱼采集器桌面客户端的测试，确保产品质量；3.负责分布式云服务系统测试，服务接口测试和性能测试，确保服务稳定；4.跟进产品迭代的整个流程，负责验收产品需求，设计和编写测试用例，测试驱动开发，负责产品验收；5.利用自动化测试等工具方法，提高测试效率；岗位要求：1.计算机或相关专业，本科及以上学历，优秀应届生可考虑；2.掌握并可灵活运用测试理念、测试方法、以及测试相关流程；3.掌握常见的抓包工具，如Fiddler、Postman等；4.掌握常见的接口性能测试工具，如JMeter、LoadRunner等；5.掌握Java/Python/SQL相关知识，了解至少一种脚本语言；6.用过常见的C/S端测试工具，如TestComplete/Ranorex等，对C/S端有自动化测试经验的优先；7.有Jenkins等持续集成工具应用经验的优先；8.有较好的学习能力和沟通能力，鼓励对先进测试方法的应用。,数据服务,50-150人,测试,广东
测试工程师,https://www.lagou.com/jobs/6861260.html,南山区,10k-20k,深圳点猫科技有限公司,3-5年,本科,全额五险一金、年终奖、团队建设、下午茶,工作职责:1、参与需求和设计评审，并根据需求和设计文档编写测试用例和测试数据，并有效执行测试用例，提交测试报告；2、通过参与实例化需求工作，提升需求质量，减少项目执行过程中需求变更的数量；3、面对实际系统，根据业务测试经验，不断进行探索实验，持续完善测试用例；4、及时发现测试中的问题，准确地定位并跟踪问题，推动问题及时合理地解决，对线上问题及时跟进处理；5、完成公司软件项目和产品的各种测试工作，包括功能测试、接口测试等，确保上线项目以及发布产品的质量；6、与项目相关人员就项目进度和问题进行沟通，检查产品的完整性和正确性；7、整理项目资料及技术文档，完成领导交办的其它工作。任职资格:能力要求1、本科以上学历，计算机相关专业优先，具有1年以上软件测试经验；2、熟悉软件测试理论和方法，熟悉软件测试流程，熟悉黑盒测试用例的设计方法，能够合理编制项目的测试计划及进度；3、有良好的业务理解能力和结构化思维能力，对敏捷项目管理流程有深入理解；4、具备良好的团队协作精神、敬业精神，责任心强、工作积极主动；5、具有较好的逻辑思维能力、沟通能力、问题判断与解决能力、文档撰写、阅读能力。加分项：1、有web端测试经验、熟悉后台系统测试，mysql数据库，有互联网行业ERP系统测试经验者优先；2、能熟练使用postman/jmeter，有接口测试相关工作经验，有自动化和性能测试相关经验为加分项；,"移动互联网,教育",2000人以上,测试,广东
测试工程师,https://www.lagou.com/jobs/6722021.html,南山区,12k-18k,岩心科技（深圳）有限公司,3-5年,本科,发展前景好、扁平管理、带薪年假,工作职责:1.参与产品需求评审，分析并制定测试计划和策略，设计测试用例并组织、参与用例评审。2.执行测试用例，缺陷深入定位跟踪及解决，并协助开发分析解决问题。3.跟进项目迭代，能预估风险，推进项目进度，保证项目质量。4.熟悉掌握产品的技术架构，精准把握业务需求，持续改进测试方法，提高测试效率、质量和覆盖。5.及时汇报测试进度和测试结果任职资格:1.全日制本科以上学历，计算机相关专业，工作经验不限。2.能够熟练的使用抓包工具Charles fiddler等工具进行抓包测试，能够使用常见的自动化测试工具。3.熟练使用SQL和linux命令。4.掌握常见的软件测试技术、方法和工具，如功能测试、兼容性测试等。5.良好的沟通能力、团队协作能力、学习能力，较强的责任心和自我驱动能力。6.有过互联网金融移动端测试经验的优先。,"移动互联网,金融",500-2000人,测试,广东
测试工程师,https://www.lagou.com/jobs/6477403.html,南山区,8k-16k,深圳市新类型科技有限公司,3-5年,大专,"周未双休,五险一金,年终奖,年度调薪","工作职责1.项目启动测试前，与客户、研发人员进行沟通，根据客户测试标准、公司测试标准、产品特性制定测试计划和用例2.严格按照软件测试相关规范文档展开测试工作，全面、准确反馈测试中发现的问题3.负责跟研发人员进行故障沟通，快速推动研发解决问题并验收4.有automation测试经验,能运用相关的automation tools进行自动化测试  岗位需求1.本科以上学历，计算机相关专业，3年以上相关工作经历2.有良好的英语写作能力，沟通能力并熟练进行测试用例设计、编写者优先3.精通系统测试知识体系了解软件生命周期、测试流程、设计方法和基本规范4.掌握各种软件测试技术和方法，如功能测试、性能测试、安全性、可靠性、界面等5.能用如下automation tools: Robot framework, Selenium, Python,JMeter,LoadRunner等进行自动化测试者更佳6.英语听说读写能力较强。","移动互联网,金融",50-150人,测试,广东
测试工程师,https://www.lagou.com/jobs/7146694.html,南山区,8k-15k,深圳市新类型科技有限公司,3-5年,大专,周末双休 年终奖 五险一金 年度调薪,1、分析产品需求，编写测试场景和测试用例。2、发现产品缺陷，协助改进产品功能，协助开发工程师快速定位并解决问题。3、负责测试执行，进行测试过程记录，缺陷上报与跟踪。4、负责产品日常的功能测试、系统流程测试和数据检查。 任职要求：1、3年以上的测试工作经验，计算机相关专业优先。2、熟悉测试流程，能够独立的完成测试需求分析，测试场景、测试报告等测试技术文档。3、熟悉测试方法和常用的测试工具。4、善于沟通，学习能力和责任心强。5、有大数据、金融行业和大型全球性后台系统项目运维的测试经验者优先考虑。6、有自动化测试经验者优先。7、广东籍贯会粤语和英语沟通者优先。,"移动互联网,金融",50-150人,测试,广东
测试工程师,https://www.lagou.com/jobs/7154093.html,天河区,6k-10k,广州久邦世纪科技有限公司,3-5年,本科,下午茶水果 办公环境好 发展空间大,岗位职责1、详细了解需求，编写测试用例，提交测试报告；2、独立完成安卓和IOS应用APP功能、兼容、性能测试，保障产品质量；3、主动发现问题，深入了解用户反馈，能主动提出产品优化方案；4、积极配合开发、重视测试中出现的bug，推动问题的解决，协助开发人员进行产品的改进和优化。任职要求1、本科及以上学历，2年以上iOS及Android测试经验，熟悉APP测试流程；2、有较强的测试分析能力和逻辑分析能力；3、熟悉Xcode和adb工具的使用，了解自动化测试、性能测试方法；4、熟悉脚本语言及常用测试工具优先；5、思维敏捷、热爱测试工作，具备良好的学习、沟通能力，有良好的团队协作意识。,"移动互联网,游戏",500-2000人,测试,广东
测试工程师,https://www.lagou.com/jobs/7069330.html,天河区,6k-10k,广州久邦世纪科技有限公司,1-3年,本科,下午茶水果 办公环境好 发展空间大,岗位职责1、详细了解需求，编写测试用例，提交测试报告；2、独立完成安卓和IOS应用APP功能、兼容、性能测试，确保产品最终质量；3、主动发现问题，深入了解用户反馈，能主动提出产品优化方案；4、提交bug并跟踪bug的整个生命周期，协助开发人员进行产品的改进和优化。任职要求1、本科及以上学历，2年以上IOS及Android测试经验，熟悉APP测试流程；2、有较强的测试分析能力和逻辑分析能力；3、熟悉Xcode和adb工具的使用4、了解自动化测试、性能测试方法；5、熟悉数据库、脚本语言及常用测试工具优先。,"移动互联网,游戏",500-2000人,测试,广东
测试工程师,https://www.lagou.com/jobs/5001120.html,福田区,10k-15k,深圳交控科技有限公司,3-5年,本科,"6险一金,周末双休，行业前景好",工作职责:1、负责公司的产品测试工作，测试产品包括WEB端、APP端；2、设计用例、将手工用例转化为自动化测试用例，持续完善维护自动化测试脚本；3、负责构建自动化测试环境并维护、能熟练Coding；4、引入新的测试框架和测试技术、丰富测试手段、不断优化产品研发测试流程，提高测试效率和质量；5、利用自动化测试方法对发现的问题进行详细分析和准备定位，与开发人员讨论缺陷解决方案，对测试结果进行总结与统计分析，并提出反馈意见；6、针对特定的测试或开发问题，开发相应的工具供使用。岗位要求：1、通信、信号、电子工程、计算机及其相关专业，本科及以上学历；2、三年以上同岗位经验，有轨道交通信号系统项目（1个以上）工作经历者优先；3、熟悉测试理论、测试流程、熟悉WEB网站和APP测试方法，探索Java和Web测试解决方案；4、熟悉Java（Spring-MVC、Spring-Boot、Spring-MyBatis）或Python(PyQt5、wxPython)、熟悉SQL语句，会使用Eclipse、Mysql等工具5、熟悉SVN、Git、Linux系统和禅道等工具的使用；6、有编写Shell脚本，负责前后端业务自动化测试功能的优先；7、熟练掌握数据库，包括mysql、sql server等。,其他,150-500人,测试,广东
测试工程师,https://www.lagou.com/jobs/6037770.html,福田区,5k-10k,深圳华策辉弘科技有限公司,1年以下,本科,"五险一金,年终奖,通讯补贴,绩效奖金","岗位职责：1、根据产品规格设计测试方案和测试用例,并进行定期维护,保证用例能够追溯到需求,保证用例的完备性;2、实施软件测试,跟踪分析和报告软件问题,提交测试报告;3、完成产品集成测试、系统测试、验证测试,对产品功能的测试质量负责;4、参与需求文档的评审,提出对软件的进一步改进的要求并评估改进方案;5、参与软件方面的技术支持、培训以及在线产品的软件故障重现;6、参与说明书的编制工作;7、对软件交付物进行质量评价,及时向项目组反馈软件质量,提交软件质量相关统计数据;8、协助产品软件安装包的制作和维护。任职资格：1. 对软件测试和项目管理流程有一定的认识；2. 具备编写自动化脚本的能力(jmeter优先）； 3. 会基础的Linux系统命令和mysql, mongo的增删改查；熟悉Java，Python等基本主流编程语言，能结合日志对测试过程中遇到的问题进行定位和分析； 4. 工作态度积极，对工作负责； 5. 有较强的沟通和协调能力。招聘2020年毕业的应届生",移动互联网,50-150人,测试,广东
测试工程师,https://www.lagou.com/jobs/7109975.html,南山区,10k-20k,深圳市金证科技股份有限公司,1-3年,本科,金融证券,岗位要求：1.参与项目需求分析；2.项目设计编写测试用例或自动化测试用例；3.参与测试计划评审，测试用例评审；4.执行测试用例，跟踪定位产品中的缺陷或问题；5.与开发等相关部门沟通，协助开发部门修正缺陷、完善软件功能。任职要求：1.全日制本科，计算机相关专业；2.2年以上测试经验，熟练掌握设计测试用例的方法和技巧；3.熟悉软件工程，精通软件测试流程，参与测试过程和测试方法的持续改进；4.具有较强的沟通和解决问题的能力，具有良好的团队意识和敬业精神；5.熟悉SVN的使用，熟悉QC等测试管理工具的使用；6.熟悉 sqlserver 、Oracle数据库语言;7.熟悉Python自动化测试工具；,金融,2000人以上,测试,广东
测试工程师,https://www.lagou.com/jobs/6945869.html,海珠区,10k-20k,广州滴普科技有限公司,不限,本科,发展前景,任职需求：1、熟练设计测试用例、测试报告、测试计划；2、熟悉软件测试流程、测试方法，精通常用网络抓包工具，fiddler等；3、熟悉数据库基本操作，熟悉linux常用指令；4、掌握一至两种编程语言更佳，如 java，python。有自动化测试、性能测试实战经验优先；5、懂得规划任务优先级，合理分配任务；6、沟通表达能力佳，可以准确的描述出自己的问题；7、积极乐观，做事情主动，不要让事情堆积；8、本科学历（学信网可查）及以上，持续学习。岗位职责：1、负责项目测试工作，参与需求分析、制定测试计划、评估项目风险、保证项目质量等；2、独立执行项目测试，包括测试的设计、执行、bug跟踪管理，推动bug修复；3、有良好的沟通能力，在测试过程中及时和项目经理、开发进行积极的沟通；4、精通测试理论和方法，熟悉敏捷开发、敏捷测试模式。,"企业服务,数据服务",500-2000人,测试,广东
测试工程师,https://www.lagou.com/jobs/6909480.html,罗湖区,10k-15k,深圳市林祺信息技术有限公司,3-5年,本科,13薪,工作职责协助测试负责人，完成项目测试工作，保障版本质量。包括但不限于需求跟踪、风险识别、案例编写、测试执行、缺陷跟进、进度总结。配合团队完成自动化、安全测试邓相关工作的落地。包括但不限于脚本开发、案例编写、执行与结果分析等；产品材料、测试经验方法等经验文档资产的编写；领导交代的其他工作 任职资格：本科以上学历，计算机相关专业，两年以上测试工作经验，有7或者8经验者可以适当放宽学历和专业要求；熟练掌握测试理论、流程和方法，具有较强的风险意识；至少熟练掌握一种接口测试工具，如postman、jmeter等；熟练掌握常见数据库的基本操作，包括增、删、改、查、拼，以及数比对等；熟悉常见的自动化工具和框架和脚本语言，至少能够熟练的利用框架进行自动化案例编写工作；具有高效沟通合作能力，快速理解学习能力，具有一定的抗压性；熟练利用python或者java语言进行测试工具、自动化框架、或者底层脚本开发者优先；有银行或者金融资管公司系统测试经验者优先，尤其是金融市场、托管、风险、基金理财等后台系统。,移动互联网,15-50人,测试,广东
测试工程师,https://www.lagou.com/jobs/6590284.html,龙华新区,9k-15k,富泰华工业（深圳）有限公司,3-5年,本科,发展前景好,岗位职责：1、负责对手机App和Web网站的测试，根据需求设计等文档编写测试计划和设计测试用例；2、执行测试活动，包括：功能、性能、兼容性、安全性等测试；3、编写测试脚本，进行自动化和性能测试；4、提交Bug，并进行Bug跟踪和回归，直到Bug解决；5、根据产品测试情况编写测试报告及整理项目测试资料和技术文档。任职要求：1、2年以上软件测试工作经验，有APP项目测试经验；2、熟悉Web和APP测试流程和测试方法；3、能独立编写测试计划、测试报告和设计测试用例；4、熟练使用常用的测试工具，如QTP、禅道、LoadRunner等；5、了解、Mysql、Linux系统，会一些常用命令操作；6、有独自完成项目测试或熟悉性能测试的优先考虑。,"电商,数据服务",2000人以上,测试,广东
测试工程师,https://www.lagou.com/jobs/7206584.html,海珠区,8k-15k,广州斗游信息科技有限公司,1-3年,本科,海外工作机会、年终奖、带薪年假、年度旅游,岗位描述：1、对产品需求进行分析、评审，设计测试点、测试用例； 2、对 web 页面、移动端 app进行功能测试、接口测试等日常质量保障； 3、积极发现和推动解决项目中的问题，并能对项目提出合理化建议；4、遇到问题和发现风险及时上级反馈5、探索新技术，提高测试效率和质量岗位要求： 1、计算机相关专业本科以上学历，熟悉测试的基本理论和方法，能独立编写测试用例、发送测试报告2、熟悉计算机网络基础知识，了解Linux、数据库基本操作，有一定代码能力优先3、熟悉常用测试工具，postman/fiddler/jmeter/adb4、有强烈的主动性、责任心和执行力，具备产品整体的质量把控意识和风险意识； 5、有清晰的逻辑分析和沟通协作能力，心理素质良好，可以承受一定的压力,移动互联网,150-500人,测试,广东
测试工程师,https://www.lagou.com/jobs/6537580.html,龙华新区,9k-11k,武汉佰钧成技术有限责任公司,1-3年,本科,入职即购买六险一金，周末双休，定期团建,1. 统招本科学历（学信网可查）2. 熟悉性能测试理论和测试方法，工作经验在2-3年左右3. 熟练使用测试工具Loadrunner和Jmeter做测试执行。4. 熟练掌握性能测试缺陷跟踪处理流程。5. 熟悉数据库基本增删查改语句。6. 能独立编写测试计划和测试报告。,移动互联网,2000人以上,测试,广东
测试工程师,https://www.lagou.com/jobs/7110127.html,南山区,10k-15k,深圳市金证科技股份有限公司,1-3年,不限,上市公司福利 股权激励,任职资格:,金融,2000人以上,测试,广东
测试工程师,https://www.lagou.com/jobs/7216218.html,越秀区,8k-13k,深圳市前海欢雀科技有限公司,1-3年,本科,朝九晚六周末双休五险一金 国企背景,职责描述：1、负责Web系统、Android、ios产品的功能测试、性能测试、弱网测试等；2、理解产品需求，根据测试计划和策略来设计测试用例，编写测试报告，并按照测试计划和流程完成测试任务；3、对问题进行报告、跟踪、汇总，并协助开发人员定位问题，推动问题及时合理解决。任职要求：1、本科及以上学历、计算机软件或者相关专业1-2年测试工作经验；2、了解Linux系统，MySql数据库，以及TCP/IP，HTTP等网络协议；3、了解软件测试理论知识、Web系统、app测试方法、测试流程等；4、具备良好的归纳总结能力、需求理解能力，逻辑思维能力；5、具备强烈的责任感及进取精神，较好的沟通技巧及团队合作精神，能快速融入团队。,"企业服务,移动互联网",50-150人,测试,广东
测试工程师,https://www.lagou.com/jobs/5779832.html,南山区,10k-15k,辉芒微电子（深圳）有限公司,3-5年,本科,"主管很好,技能培养,福利多多,重研发","岗位要求：1、熟悉模拟电路和数字电路基础理论，了解半导体工艺流程，具有一定的C/C++编程基础；2、具有EEPROM(I2C、SPI)测试开发经验，熟悉MCU,RF者优先考虑；3、熟练掌握ATE测试平台，如V77，V50，Chroma3360等机台；4、有较强的问题分析能力，有现场解决测试难题的能力，能接受短期出差，能承受较大压力。5、熟悉RF/MCU测试者优先考虑岗位职责：1、负责开发存储类芯片（如EEPROM、MCU、RF)的测试验证，测试程序，测试流程，测试板卡；2、负责量产导入，并持续跟进量产良率情况；3、协助设计部门做新产品的验证和debug.",硬件,50-150人,测试,广东
测试工程师,https://www.lagou.com/jobs/5161463.html,福田区,10k-18k,上海海万信息科技股份有限公司,3-5年,本科,"带薪年假,五险一金,周末双休,年终奖",岗位要求：1、3年以上测试工作经验 ； 2、在某一测试领域上（如功能、接口、性能、自动化等）有较深的知识和经验积累，熟悉以下至少一款工具JMeter，Postman，熟悉Oracle、MySQL、PostgreSQL数据库其中一种；  3、工作认真负责，有耐心，能胜任重复工作，承受一定的工作压力； 4、有较强的逻辑分析能力和学习能力；5、具有良好的团队精神、沟通、协调和解决问题能力。,"移动互联网,金融",500-2000人,测试,广东
