job_name,job_url,job_location,job_salary,job_company,job_experience,job_class,job_given,job_detail,company_type,company_person,search_key,city
数据分析师（BI方向）,https://www.lagou.com/jobs/7089082.html,市南区,6k-12k,北京字节跳动科技有限公司,3-5年,本科,"六险一金,团队氛围好,薪资优厚",,文娱丨内容,2000人以上,数据分析,青岛
ETL大数据分析（实习）,https://www.lagou.com/jobs/7210711.html,市北区,6k-12k,青岛莱信实业有限公司,不限,大专,节日福利、带薪年假、双休、五险一金、包住,岗位职责:1、参与项目需求分析和设计;2、完成软件系统代码的实现，编写代码注释和开发文档;3、辅助进行系统的功能定义程序设计;4、根据设计文档或需求说明完成代码编写，调试，测试和维护;5、分析并解决软件开发过程中的问题;6、协助测试工程师制定测试计划，定位发现的问题;7、配合项目经理完成相关任务目标;8、具有很强的学习和独立分析能力、工作责任心、良好的沟通能力和团体合作精神。任职资格：1、专科及以上毕业生;2、相关专业优先考虑;3、有责任感，良好的团队协助精神;4、有无经验均可，一经录用，待遇优厚;5、可接收应届毕业生。,"移动互联网,数据服务",50-150人,数据分析,青岛
数据分析师,https://www.lagou.com/jobs/6841855.html,崂山区,10k-20k,海尔集团,3-5年,本科,大平台、稳定性高，薪酬福利完善,"岗位描述：1. 从0到1搭建数据分析体系：搭建数据监控分析体系，贴和业务需要定期分析查看业务发展情况，业务发展结果可量化，可衡量，使业务侧得到准实时的效果反馈，根据业务效果指导业务决策，做到心中有数；根据对数据、业务理解及与业务部门沟通，提出可能的潜在影响因素的业务假设；对于明显影响效果的因素，提出优化建议。2. 提出数据分析工具化，产品化建议：以“让数据易用”为准则，提出现有BI或数据产品相关的优化建议，提升数据使用效率，发挥更大价值。3.支撑战略，运营等决策部门提供专题分析及业务方向探索，实现战略落地： 根据决策层需要定期产出专项分析报告，不限于PPT或如tableau敏捷数据可视化开发工具。4.数据规范制定及数据质量提出建设性优化建议：梳理分析指标及数据源头，保证数据准确性及有效性，能针对数据缺口提出合理性需求。岗位要求：1.熟悉MySQL、Oracle等关系型数据库，有数据库基本应用能力；基本了解常用的应用服务器tomcat，Jboss等;2.精通编写sql语句，对复杂查询、分组等有深入了解，有一定的复杂报表经验，能独立梳理复杂业务逻辑；3.熟练运用类似Tableau，powerBI，QlikSense其中至少一种敏截数据可视化产品进行数据逻辑处理和业务逻辑转化，测试数据的准确性，快速形成相关的报表；4.熟练使用各种办公软件，如PPT、EXCEL等，能独立撰写数据分析报告；5. 了解SAAS服务基础原理及应用场景，需要时能投入相关数据分析工作；7.精通至少一种数据分析/挖掘/统计软件/语言，如Python，SAS，SPSS等；8. 对数据与业务方面有足够敏感性，有较强的逻辑分析能力，有较强的独立思考能力；9.良好的数据搜集、预测能力以及文档编写能力；10.5年以上数据分析经验，至少1年以上制造业相关工作经验，对工业互联网行业有一定的了解为加分项,有产品经理经验为加分项；11.具有良好团队合作精神，工作积极主动，有较好的学习能力，能够承受工作压力；","物联网,电商",2000人以上,数据分析,青岛
高级数据分析,https://www.lagou.com/jobs/6868084.html,李沧区,7k-12k,上海超数信息科技有限公司,3-5年,不限,五险一金,岗位职责：1、与用户沟通，理解用户需求，提炼数据可视化思路；2、参与数据分析方案的设计，用数据帮助用户发现、分析和解决问题，编写数据分析报告；3、参与搭建企业数据分析平台，包括数据可视化平台设计、数据对接、分析页面制作。任职资格：1、对数据高度敏感，至少熟练运用一种，FineBI 、FineReport、永洪BI工具；2、有3年以上相关工作经验，热爱互联网，具备数据分析思想，熟悉常用数据分析方法（聚类分析、时间序列分析、交叉列联分析等）；3、责任感强，工作积极主动，具备学习意识，有良好的团队协作意识；4、熟练掌握sql者优先，熟练掌握任一种编程语言者优先。,"电商,数据服务",50-150人,数据分析,青岛
大数据开发工程师,https://www.lagou.com/jobs/7049921.html,市北区,6k-10k,青岛好驻大数据科技有限公司,不限,大专,早九晚六 周末双休 五险一金,1、计算机及其相关专业，大专及以上学历。2、具备实时处理框架的设计和开发能力4、熟悉Linux等开发环境，能进行shell脚本的编写;5、具有较强的逻辑分析能力，高度的责任心及团队合作精神;6、具有实际大数据项目的成功经验者优先考虑,数据服务、软件开发,150-500人,数据分析,青岛
人力资源总监,https://www.lagou.com/jobs/7197195.html,市南区,15k-20k,山东春晓图书有限公司,3-5年,硕士,平台好,岗位职责：1.在公司人力资源战略、政策和指引的框架下，建立并实施人力资源方针和行动计划，以支持公司达到预期经营目标。2.负责组织起草、修改和完善人力资源相关管理制度和工作流程。3.负责招聘、培训、薪酬、考核、员工关系等人力资源日常管理事宜。4.负责组织编写各部门职位说明书。5.定期进行人力资源数据分析，提交公司人力资源分析报告。6.根据行业和公司发展状况，协助制定公司薪酬体系、激励体系并负责实施。7.协助监督控制各部门绩效评价过程并不断完善绩效管理体系。8.协助推动公司理念及企业文化的形成。9.协助制定公司人力资源整体战略规划。10.负责部门的日常事务管理工作，协助完成本部门员工工作考核、激励及部门资金的预算和控制等工作，公司安排的其他工作。任职要求:1.人力资源管理、工商管理、企业管理、行政管理等相关专业硕士学历，有海外MHRM、MBA、EMBA学习经历者优先录用。 2.3年以上大中型企业、集团公司、瞪羚企业、独角兽企业、新三板企业人力资源经理及以上岗位工作经验。3.具有良好的职业素养和道德操守，无不良行业从业记录，对现代企业人力资源管理模式有系统的了解和丰富的实践经验。4.对现代企业人力资源管理模式有系统的了解和丰富的实践经验，对人力资源管理各个职能模块均有深入的认识，能够指导各个职能模块的工作。5.熟悉国家、地区及企业关于合同管理、薪金制度、用人机制、保险福利待遇、培训等方面的法律法规及政策。6.具有较强的战略决策能力、统筹规划、组织管理能力和团队协调、领导能力，具有战略、策略化思维，有能力建立、整合不同的工作团队。 7.具备良好的判断力、前瞻性和应变能力以及较强的计划性和实施执行的能力。8.具备良好的团队合作精神，能服从公司工作安排，工作积极高效，乐于沟通，有一定的承压能力。薪资待遇：基本工资+管理津贴+奖金，年薪17-24万，具体可议。,文化娱乐,50-150人,数据分析,青岛
大客户销售（CKA）,https://www.lagou.com/jobs/6997439.html,市北区,10k-15k,达疆网络科技（上海）有限公司,3-5年,大专,带薪年假 五险一金,KA，大客户，餐饮，商超，新零售工作职责：1、负责达达集团城市大客户品牌和渠道的合作拓展和落地；2、能够深度了解配送行业产品，并根据品牌数据分析和履约效果，制定配送合作方案，实现大客户配送需求解决；3、能够与客户进行有效的沟通和谈判，促进业务达成；4、协同总部KA和运营团队，持续优化服务质量和用户体验。任职要求：1、3年以上互联网销售经验，1年以上大客户销售经验；2、目标导向，有良好的沟通表达和团队协作能力，逻辑思维清晰；3、大专以上学历,消费生活,2000人以上,数据分析,青岛
电商运营,https://www.lagou.com/jobs/7197461.html,市南区,10k-15k,山东春晓图书有限公司,1-3年,本科,平台好,"岗位职责：1.负责公司图书（垂直）电商业务的渠道战略布局、运营策略和规划、业务发展规划和指标，并推动、指导、监督、管控部门各项任务指标的完成进度，责成相关人员修正工作目标、管理措施和政策方案。2.负责月度、季度、年度销售规划和指标，推动、指导、监督、管控任务指标完成，并对相关运营数据进行监控、分析。3.制定电商营销策略，建立产品的网络营销管理体系和推广模式，编制年度、季度网络营销方案和预算，落实并监控各项计划和方案的实施。4.负责电商运营的技术研究，结合产品及市场现状，为平台增量业务的电商运营设计可执行方案和产品优化方案。5.负责线上商品营销及物流管理，包括各平台店铺商品上下架及商品日常权重优化（包括上线、上下架、库存调配工作）。6.协同团队挖掘产品亮点与卖点，提出图片创意，了解行业数据，积极做出推广策略调整。7.负责对店铺中单品的流量数据、交易数据、推广数量、产品及客户管理等全方面多维度进行销售分析，不断的调整策略，保证爆款的推广营销指标的达成。8.负责规划网络广告的投放，并做好爆款推广营销费用的预算和数据统计分析。9.负责挖掘客户需求，对客户体验进行优化，包括自有店面装修、布局、编辑、单品爆款推广营销提出优化方案和改进建议。10.监测同行业运营情况及市场最新动态，并进行分析，需要时可及时调整营销策略。11.根据业绩、市场反馈数据等有效信息，对运营情况进行监督、控制和评估，及时调整市场策略，保证经营和利润目标的达成。任职要求:1.电子商务、市场营销、产品运营、新闻传播等相关专业统招本科及以上学历。2.2年以上电商运营工作经验，熟悉京东、拼多多等平台运作。3.能根据电子商务运营特点和受众分析，进行业务拓展及营销，熟练运用各种推广策略，有效的开辟电子商务市场终端。4.熟悉电子商务运营管理结构和流程，对数据敏感，具备较强的数据分析能力及高效的执行力，具有后台数据统计分析经验, 有较强的分析判断能力，能根据推广效果反馈调整策略。5.具有较强的沟通、协调、团队领导能力，具备良好的判断力、前瞻性和应变能力以及较强的计划性和实施执行的能力。6.具有良好的职业素养和道德操守，善于沟通，工作认真、严谨、细致、耐心，具有解决复杂问题的能力。7.具备良好的团队合作精神，能服从公司工作安排，工作积极高效，乐于沟通，有一定的承压能力。 薪资待遇:基本工资（年薪17-24万）+绩效工资，具体可议。",文化娱乐,50-150人,数据分析,青岛
品质运营,https://www.lagou.com/jobs/7218590.html,市南区,8k-12k,北京字节跳动科技有限公司,1-3年,本科,"健身瑜伽,六险一金,团队氛围好,餐补",,文娱丨内容,2000人以上,数据分析,青岛
业务BI分析专家,https://www.lagou.com/jobs/6936490.html,市北区,15k-25k,拉扎斯网络科技（上海）有限公司,5-10年,不限,前景广阔 阿里系公司,【工作职责】:1、对交易履约业务部门进行数据需求支持，深入进行业务专题主题分析，基于数据分析成果，为业务部门提供商业策略分析和业务优化建议，持续改进运营效果，含用户留存分析，商户运营及品类分析，物流分析，经营规划等；2、优化和完善所属方向的数据分析体系，包括 KPI 指标体系、报表体系、搭建分析框架，并进行核心指标监控，撰写数据分析报告；3、通过专题数据分析来发现问题，实现数据驱动，提升交易运营效率，扩大市场份额，提升交易、物流的协同联动；4、提升团队的整体数据分析、财务分析、数据运营等能力。【任职要求】：1、数学、统计学、计算机等专业本科及以上学历，985院校或国外名校毕业者优先，数学+计算机+财务专业者更佳；2、 5年以上互联网相关领域/咨询相关行业数据分析的工作经验、；3、熟练掌握SQL，熟练掌握excel，了解Python、 R中至少1-2种工具方法，熟悉thinkcell者优先；4、优秀的商业分析思维，善于思辨，敢于决断；能够针对某项业务，搭建整个数据分析体系；5、优秀的沟通能力和项目管理能力，强大的自驱力和抗压力，具备分享精神，能带动小伙伴们一起提高。,消费生活,2000人以上,数据分析,青岛
用户运营专家,https://www.lagou.com/jobs/6936474.html,市北区,15k-25k,拉扎斯网络科技（上海）有限公司,5-10年,本科,前景广阔 一年两次晋升,岗位职责：1、根据公司战略制定大区的用户运营策略；2、进行大区问题诊断，确定大区重点提升指标；3、跟进大区活动执行节奏和效果，保证资源和流量的转化率；4、负责总部运营方案的大区落地；5、监控分析大区流量、渠道质量及转化情况，为区域目标设置提供数据支持输出流量运营专项报表，制定方向及推进策略案的落地。 任职资格：1.本科及以上学历；2.5年以上用户运营、流量运营工作经验，有商户管理或线上质量管理经验；3.数据敏感度强，抽象、归纳能力强，有独立的数据分析和运营方案设计能力；4.具备良好的沟通协调能力和项目管理能力，能推动业务落地；5.执行力和责任心强，具有良好的团队协作和创新精神。,消费生活,2000人以上,数据分析,青岛
策划总监,https://www.lagou.com/jobs/6757680.html,崂山区,15k-22k,深圳钛铂新媒体营销股份有限公司,5-10年,本科,策划,"岗位职责：1、针对客户品牌/营销需求，制订具有创新性的传播解决方案，包括建立线上/线下品牌宣传渠道，策划与执行线上/线下各类营销活动，协助客户完成营销目标 ；2、研究及掌握不同行业营销和传播需求，洞悉媒体、品牌未来发展趋势;3、独立组织和撰写完整的营销策划方案，项目策略方案;4、创新性资源应用策划方案、事件营销方案、活动策划方案;任职要求：1、大学本科以上学历，广告、市场营销、新闻、中文、管理等专业毕业；2、5年以上策略策划相关工作经验，有知名企业品牌营销（网络公关、网络活动、论坛营销、新闻营销、事件营销等）策划经验优先；3、良好的营销规划能力，行业信息、数据分析能力、PPT能力强；4、熟悉互联网、新媒体发展趋势，关注新兴事物;5、对品牌策划、广告传播有深厚的理解，熟悉整个品牌策划的运作流程；6、优秀的方案策划能力，思维敏锐活泼，资源创意及整合能力，能独立撰写项目营销推广方案；7,、熟悉各大新媒体平台玩法，对新媒体营销案例有独到的见解；8、有服务海尔工作经验优先",广告营销,150-500人,数据分析,青岛
策划,https://www.lagou.com/jobs/6757694.html,崂山区,8k-12k,深圳钛铂新媒体营销股份有限公司,3-5年,本科,策划,岗位职责：1、营销推广方案制定、撰写及提案；2、辅助部门总监进行线上线下活动策划及执行把控3、线上线下营销资源掌控与整合，媒体资源的深度挖掘及整合运用；4、熟悉网民特性，精确捕捉适合客户线上营销的目标受众群体；5、能挖掘新创意，达到线上营销目的，并有较强的数据分析能力，对广告效果进行客观的评估。任职要求：1、4年以上广告或公关活动策划工作经验（具有4A广告或大型网络互动、公关公司经历者优先）2、有服务“海尔”项目经验者优先；3、精通线上线下营销方式，对信息有专业的敏感度，擅长结合社会热点，进行适时适度的炒作；4、擅长撰写及执行策划活动方案，有较强的文字功底及提案能力，善沟通，具亲和力；5、抗压能力强，能承受高强度加班及客户反复修改要求；6、有责任心和团队合作精神。,广告营销,150-500人,数据分析,青岛
用户体验（UX/UE),https://www.lagou.com/jobs/3395333.html,市北区,12k-24k,山东海博科技信息系统股份有限公司,不限,本科,"系统培训,员工旅游,五险一金,带薪年假","岗位职责：1.主导用户体验设计，全面负责公司产品整体架构设计和风格的把握；2.负责对通过竞品服务、数据分析、用户调查等方式，不断更新产品，提升产品与市场的匹配度，提高APP用户活跃度和黏性；3.研究用户行为和使用场景，优化现有产品的设计缺陷并提出优化解决方案；4.参与产品的规划、项目的原型设计、产品流程设计及优化、UI界面等；5.跟进UI设计的整个流程，对每个流程进行可用性设计和测试，提供专业意见。任职要求：
 本科以上学历，心理学、计算机或美术设计等相关专业优先；
 精通交互设计、视觉设计、需求分析、可用性工程的相关知识与技能；5.对互连网设计趋势与流行有很强的敏锐度；
  同理心，真诚的去思考并帮助用户解决他们的实际问题，使我们的设计决策能更好的聚焦于用户目标；
 洞察力敏锐，对人性心理需求与用户行为有深度关注；
 具备管理、激发团队成员的能力，营造良好的团队氛围，能带领团队有效达成目标，有五年以上互联网公司UED工作经验最佳，其中2年以上的团队管理经验。","移动互联网,信息安全",50-150人,数据分析,青岛
机器学习专家,https://www.lagou.com/jobs/6578537.html,市北区,8k-16k,青岛永嘎科技有限公司,3-5年,本科,"一同创业，共同成长。
成为联合创始人。",1.用好python.熟悉机器学习，深度学习，迁移学习，强化学习。熟悉基本的算法，机器学习常用算法，有自己擅长的领域。tensorflow.pytorch，caffe.solodity.至少要会使用一种。2主要实践方向，对二手房数据的机器学习推荐系统，广告系统，二手房区块链公链的实现，其他研究方向，人工智能下:脑机接口，癌症的诊断和基因治疗，量化交易。.3. 利用数据挖掘、建模分析的理论和方法解决具体业务需求问题，提升业务运转能力； 4、对互联网大数据挖掘、数据分析有一定的研究，并且拥有非常强的自我学习能力、自我激励能力。,"移动互联网,消费生活",少于15人,数据分析,青岛
大数据架构师,https://www.lagou.com/jobs/7209777.html,黄岛区,15k-30k,青岛国信城市信息科技有限公司,5-10年,本科,五险二金，免费三餐,"岗位职责：1.负责平台的整体数据架构设计，完成从业务模型到数据模型的设计工作 形成快速解决方案；2.负责根据业务功能、业务模型，进行数据库建模设计 ，解决高并发的调度系统中的关键问题；3.负责平台数据提取、数据挖掘及数据分析，具有良好的商业敏感度和优秀的数据分析技能，能够解决复杂的商业问题；4.负责数据开发质量的评审，指导相关构建测试并完成性能、代码优化；5.负责组织开发人员进行技术研究和技术攻关工作，负责研发人员技术培训和技能提升，提升工作效率，降低研发成本；6.完成上级交办的其他工作。任职资格：学历：本科学历及以上专业：计算机、软件工程、数据等相关专业；年龄：不限；工作技能：1.有5年以上的大型项目工作经验,至少3年架构师或技术经理等工作经验。2.丰富的数据架构规划、数据建模、数据库设计以及程序设计、开发经验；3.丰富的数据解决方案或数据架构（数据仓库、数据集成、数据管理）构建经验；4.深入掌握业务抽象、SQL查询路径以及优化路径在内的方法和技能；5.精通至少一种数据库技术,至少一种开源ETL工具、数据建模工具；6.不少于三年hadoop生态圈相关经验，基于Hadoop、MPI或Cassandra、MongoDB分布式平台, HBase及类似的NoSQL存储, MySQL，和BI系统等大型商业系统实践经验。","人工智能,区块链",2000人以上,数据分析,青岛
支付产品运营,https://www.lagou.com/jobs/6848468.html,黄岛区,13k-17k,青岛国信城市信息科技有限公司,不限,本科,市直企业、政府授权、智慧城市建设及运营,一、需求量：1二、工作职责1.负责独立站自有钱包项目的运营管理，包括自有钱包运营规划，活动策划，市场推广及日常运营维护；2.通过数据分析，拆解运营增长问题，制定所负责模块运营策略及规划，跟进运营增长需求的落地执行；3.研究竞争对手及优秀平台自有钱包运营等支付手段，提出针对性的策略和方案，挖掘平台及产品特色，提升自有钱包使用率；4.以结果为导向，负责对所负责产品的运营效果进行跟踪、评估、分析及总结，达成运营增长目标。三、任职资格学历：本科及以上专业：计算机相关专业年龄：40岁以下工作技能：1.2年以上互联网产品相关运营经验，热爱互联网行业；2.有支付金融类运营、产品运营、线上支付活动策划者优先；3.具备良好的策划能力，对数据敏感，能够从数据变化中发现问题并给出改进建议；4.善于沟通协调，良好的跨部门协调能力，具备较强的逻辑思维能力、独立创新能力强；5.具备较强的抗压能力，有乐观的态度，具有较强的执行力，项目驱动能力强，较强的团队协作能力。,"人工智能,区块链",2000人以上,数据分析,青岛
区域市场营销高级经理(J200109028),https://www.lagou.com/jobs/7031937.html,崂山区,20k-40k,北京嘀嘀无限科技发展有限公司,5-10年,本科,广阔平台 急速成长 诱人福利,,汽车丨出行,2000人以上,数据分析,青岛
大数据实习,https://www.lagou.com/jobs/7111861.html,市北区,6k-8k,青岛楷皓大数据有限公司,不限,大专,五险一金节假日朝九晚五晋升机制健全薪资高,岗位职责:数据分析、数据挖掘、数据开发任职要求:大专及以上学历、21-35岁之间、逻辑思维良好、专业(会计、统计、数学及应用数学、计算机)相关专业优先,数据服务、人工智能,50-150人,数据分析,青岛
大数据ETL实习生,https://www.lagou.com/jobs/6784006.html,市北区,5k-8k,青岛隆顺数据服务有限公司,不限,大专,薪资高、弹性工作、晋升快、底薪4000起,薪资高，有发展，晋升机制健全，福利待遇优，机会多，工作体面。工作时间：周末双休，朝九晚五，转正投五险一金，提供住宿，节假日正常放假（元宵节，情人节，端午节，七夕节等）岗位职责：数据分析、数据挖掘、数据开发任职要求：大专及以上学历、21-30岁之间、思维逻辑大数据属于新兴行业，人才匮乏，薪资普遍很高。,"数据服务,人工智能",50-150人,数据分析,青岛
成本经理,https://www.lagou.com/jobs/7148831.html,市南区,25k-35k,青岛超级稻农业开发有限公司,5-10年,本科,双休，五险一金，不用驻场,1、 组织编制项目目标成本； 2、 合约规划全过程工作、含供应商考察、招投标文件编制，招标洽谈，合同编制签订等； 3、 负责设计变更、现场签证的审核以及项目施工过程中的分包工程及零星工程价格审核工作； 4、 负责进行动态成本管理及信息数据分析和项目预结算工作的审核； 5、 项目造价管理后评价以及公司造价管理数据库的建立及维护等工作。,企业服务,50-150人,数据分析,青岛
