job_name,job_url,job_location,job_salary,job_company,job_experience,job_class,job_given,job_detail,company_type,company_person,search_key,city
PHP开发工程师（高级）,https://www.lagou.com/jobs/5208293.html,吴中区,10k-20k,苏州绯闻网络科技有限公司,5-10年,大专,"五险一金,每月奖金,晋升空间大","岗位职责:1、负责平台内部管理系统的PHP后台开发;2、优化运营工具需求,与运营团队一起迭代数据后台及相关管理工具;3、直接参与业务讨论,作为用户来体验公司产品,并站在业务需求视角来考虑技术实现;4、记录工作情况,并进行技术总结与交流;5、协助完成项目的测试、系统交付工作。任职要求：1、大专及以上学历，计算机或相关专业；2、3年以上PHP开发经验，有语音类项目经验优先，具有良好的php基础，熟悉yii，thinkphp，CI或其他开源框架；3、精通PHP+MYSQL编程，熟练使用html、Javascrīpt、Ajax以及CSS编写；4、熟悉linux环境，熟悉LAMP结构；5、熟悉MYSQL数据库开发、配置、维护、性能优化；6、具有MySQL索引优化、查询优化和存储优化经验方面的经验，要求随时随地贯彻最优化开发的思想；7、必须拥有良好的代码习惯，要求结构清晰，命名规范，逻辑性强，代码冗余率低；8、有撰写设计文档的习惯，有团队开发经验；9、热爱开发工作，团队合作意识良好。",社交,15-50人,php,苏州
前端工程师,https://www.lagou.com/jobs/7056563.html,昆山市,10k-15k,昆山微远信息技术有限公司,1-3年,大专,年终奖 旅游 2次加薪,岗位职责：1、负责公司PC端网页、APP端H5、小程序等的开发和维护；2、与后台开发工程师协同开发，完成接口规范制定及接口对接，制定系统整合方案，优化兼容性、系统响应性能等；3、开发公司前端基础物料4、优化、提高web应用的易用性、美观性、高效性；5、根据需求，针对用户体验、视觉效果等进行**的优化和完善任职资格：1、全日制本科及以上学历，计算机、软件工程、数理等相关专业；2、熟练使用JavaScript，熟悉DOM、Ajax、JSON等，熟练掌握Vue.js/React.js(至少一项)，熟悉es6标准，掌握webpack等构建工具；3、2年及以上H5、小程序等的开发经验；4、熟悉设计模式，能独立设计及实现具有良好可维护性的工程；(加分项)5、具备较好的canvas、svg相关开发经验；(加分项)6、能够熟练的使用原生Javascript进行基础库等的开发；(加分项)7、具备一定的后端开发经验，如node.js、php、java等；(加分项),"游戏,其他",150-500人,php,苏州
程序工程师,https://www.lagou.com/jobs/7196033.html,工业园区,5k-8k,营米科技（苏州）有限责任公司,1-3年,大专,五险一金，团队氛围好，小伙伴nice,岗位职责：1、根据项目具体要求，承担开发任务，按计划完成任务目标；2、负责小程序设计、开发和维护；3、负责app平台所需要的接口和数据管理，技术支撑工作；4、与UI设计师协作实现页面及交互;5、不断优化代码，学习新技术，提高代码性能;6、关注用户体验，不断改善和完善系统性能和体验。任职要求：1、有扎实的PHP基础，拥有较好的前后端程序整合调试能力，有检测前后端开发经验者优先；2、具有良好的编码习惯和安全意识；3、熟悉主流系统（如：phpcms、ecshop、Javascript、JQuery、Ajax、CSS、HTML及相关知识等），能熟练应用及二次开发，熟悉微网站的开发，有大型网站开发经验者优先；4、具备网络应用系统分析与设计经验；熟练掌握linux环境；5、工作积极主动，细致认真，责任心强，有良好的沟通能力和团队协助精神，有强烈的学习欲望，能适应强度较高的工作；从事计算机相关专业，精通php，div+css布局，MYSQL等数据库，对PHP有较深的理解与应用；熟悉html、css、php 等网站制作语言，熟练使用photoshop、dreamweaver等网站制作相关软件；,文娱丨内容,15-50人,php,苏州
安全服务工程师（苏州）,https://www.lagou.com/jobs/7090927.html,姑苏区,10k-20k,杭州安恒信息技术股份有限公司,3-5年,本科,五险一金 带薪年假 国内外旅游,岗位职责：1.负责对客户系统进行渗透测试，包括各类应用系统、移动APP等，全面发现被测系统存在的安全问题并提供修复建议；2.客户系统出现安全事件时进行应急处置，协助客户修复安全漏洞；3.负责对客户的系统进行代码审计，通过对源代码检测和分析，找出代码层面存在的漏洞，并提供修复建议；4.跟踪国内外信息安全动态，进行安全攻防技术研究。5.负责日常网络安全产品运维、漏洞扫描、网络安全基线配置核查等；6.负责日常网络安全日志和事件监测、分析、预警、处置、总结；7.负责敏感时期、重大节假日期间的网络安全保障；8.协助用户处理日常安全工作，提供安全建议和咨询。任职要求：1.对网络安全攻防感兴趣，熟练掌握渗透测试技巧、熟练运用各类安全软件、安全测试工具；2.熟悉渗透测试步骤、方法、流程，熟练使用渗透测试工具； 3.熟悉常见web安全漏洞的原理、测试方法、加固方法；4.具有较好的工作习惯及较强的文档、报告、方案编写能力；5.具备优秀的沟通协调能力、学习能力、抗压能力；6.开发过相关安全工具、平台、项目，或可独立支撑应急响应者优先；7.在t00ls、freebuf、Seebug等平台发布过技术文章者优先；8.有web开发经验或熟悉PHP/C#/Java/Python任意一种语言者优先；9.有CTF、攻防比赛获得奖项者优先；10.有知名SRC、漏洞平台、CVE、CNVD、CNNVD漏洞提交证明者优先。,"信息安全,数据服务",500-2000人,php,苏州
资深前端开发工程师,https://www.lagou.com/jobs/6777904.html,工业园区,16k-30k,同程网络科技股份有限公司,5-10年,大专,团队有活力，发展潜力大,"岗位职责：1. 负责产品设计的前端开发工作，能够熟练手写HTML/CSS/JavaScript；2. 基于JavaScript框架的应用和项目开发；3. 负责与Web UI设计师、软件开发工程师协作完成web前端的开发工作；4. 能够快速学习并使用部门内部开发的JS框架和前端规范5. 对前端技术的发展趋势保持关注，能不断学习业界最新技术资格要求：1.    5年以上前端开发经验, 具有良好的交流沟通能力和团队协作能力；2.    精通html/xhtml、css，对web前沿产品和技术感兴趣并愿意做研究3.    熟悉Web2.0，了解浏览器端原理，掌握网站性能优化基本知识；4.    熟悉js的运行机制，熟悉jQuery/YUI/MooTools/Dojo中至少一种框架；了解框架设计原理、适用场景，若能灵活一些思想进实际工作更好；5.    有asp 、asp.net、php 或 jsp 相关经验的优先",旅游,2000人以上,php,苏州
WEB前端工程师,https://www.lagou.com/jobs/6887958.html,工业园区,5k-7k,苏州博纳讯动软件有限公司,应届毕业生,本科,六险一金，年度旅游体检，补助，带薪培训,岗位要求：1、有扎实的html、css、js语言基础，对JS的各种特性以及浏览器兼容性有丰富实战经验。2、了解常用数据结构与算法；了解常见的前端框架和响应式页面设计，熟练掌握Angular JS，理解web产品工作方式，熟悉MVC、Restfu。3、对Javascript面向对象编程具有深入的了解；熟练运用JQuery。4、掌握至少一门非前端开发语言（如PHP/Java/Python等），并有一定的实战经验。5、具备良好的学习能力和分析解决问题能力；责任心强，良好的对外沟通和团队协作能力，乐于交流和分享。6、善于学习新事物，善于沟通和表达，有良好的团队合作意识。 7、全日制本科及以上学历，具有良好的沟通能力和团队合作精神、优秀的分析问题和解决问题的能力,"移动互联网,企业服务",150-500人,php,苏州
架构师,https://www.lagou.com/jobs/7025775.html,工业园区,35k-45k,智慧芽信息科技（苏州）有限公司,5-10年,本科,发展空间大；国际化团队,"工作职责： 1.负责技术研究、难点攻关、架构设计、技术团队开发； 2.从需求进行抽象分解设计；主要功能、核心模块的架构与代码编写； 3.对团队开发人员进行代码质量审核、技术指导和监督；4.系统性能优化，安全加固，保证系统安全、稳定、快速运行 任职资格： 1.计算机或相关专业本科以上学历； 2.八年以上互联网软件领域的设计开发经验，三年以上大型网站技术架构的主导经验；3.精通JAVA, 了解JS, 熟悉PHP/SOA/SaaS/微服务架构者优先；4.精通Linux操作系统，NoSQL (MongoDB, Redis), MySQL等主流数据库;熟悉常见的MQ系统5.精通系统分析与设计、常用的设计模式，擅长性能调优； 6.有责任心, 学习能力强, 工作积极主动, 思路清晰，擅长沟通、有团队合作精神；7.精通RESTful API设计，熟悉DDD及分层架构8.熟悉Docker及K8S等容器技术，熟悉CI/CD流程9.熟悉SPA架构，了解常用的前端SPA框架，如React, Vue, Angular10.有Enterprise相关领域开发经验优先",移动互联网,150-500人,php,苏州
WEB前端工程师,https://www.lagou.com/jobs/6444628.html,工业园区,5k-7k,苏州博纳讯动软件有限公司,应届毕业生,本科,六险一金，年度旅游体检，补助，带薪培训,职位描述：1、负责PC端应用架构设计。2、利用JS、CSS和HTML5等技术，完成页面开发制作及维护工作。3、设计及实现前后端的数据交互，对代码质量及进度负责。  4、配合产品经理和UI设计师，研究并改善用户体验。  职位要求： 1、有扎实的html、css、js语言基础，对JS的各种特性以及浏览器兼容性有丰富实战经验。  2、了解常用数据结构与算法；了解常见的前端框架和响应式页面设计，熟练掌握Angular JS，理解web产品工作方式，熟悉MVC、Restfu。3、对Javascript面向对象编程具有深入的了解；熟练运用JQuery。4、掌握至少一门非前端开发语言（如PHP/Java/Python等），并有一定的实战经验。5、具备良好的学习能力和分析解决问题能力；责任心强，良好的对外沟通和团队协作能力，乐于交流和分享。6、善于学习新事物，善于沟通和表达，有良好的团队合作意识。 7、全日制本科及以上学历，具有良好的沟通能力和团队合作精神、优秀的分析问题和解决问题的能力,"移动互联网,企业服务",150-500人,php,苏州
技术合伙人,https://www.lagou.com/jobs/7178303.html,工业园区,8k-15k,江苏确安工业技术服务有限公司,不限,本科,开创一体化工业互联网服务,"1.   公司简介：定制工业服务解决方案确安工业服务于2011年成立于南京，主要业务是向工业企业提供直接、间接物料，专业管理咨询和其它工业服务，目前主要客户在南京、上海和苏州，大部分客户为外资企业。为了实现公司的快速发展和业务转型，公司确定开发和利用互联网工业服务应用平台，更好更快地为制造企业，特别是中小型制造企业服务：Ø  提供全流程的物料管理解决方案Ø  提供有关生产成本、节能降耗、产能提升和设备可靠性方面的专业咨询2.   职位说明：每个成员都是核心团队，只是分工不同，主要职位包括互联网项目/产品经理、Andriod和iOS系统工程师，架构师，UI设计工程师，后台和前端技术开发工程师，主要职责包括：Ø  负责和团队成员一起研发、开发和实施整个平台和相关的应用Ø  负责协调项目进度，控制预算Ø  负责平台用户、客户和供应商的系统对接3.   期望特质：正直诚实，具有创业勇气，刻苦钻研，积极主动，结果导向，团队合作4.   教育和工作背景：Ø  大学本科以上，计算机软件、信息工程、物联网相关专业Ø  熟悉Android，或iOS开发, 或JAVA, 或PHP, 和数据库SQLØ  有APP开发，ERP、CRM、MES、任务和OKR系统开发或实施经验优先5.   薪资参考：底薪+股票期权+项目奖金 核心价值观Ø  信任和承诺：我们是一个创业性组织，信任是一个组织为了实现共同目标的开始，承诺积极有效的沟通，提供公正平等的机会，和每个人分享利益Ø  成就和责任：团队的成就来自于每个人的成功和失败的分享，时刻保持奋发进取之心，互相帮助，团队协作，并积极履行社会责任Ø  安全和合规：确保每个人的健康和安全，保护我们的环境；遵循商业道德，并始终恪守正直诚实的经营之道Ø  创新和客户：敏锐洞察客户的需求和环境的变化，不断创新，为客户和合作伙伴的满意和成功持续不断地改进，才是可持续发展之道","企业服务,软件开发",少于15人,php,苏州
系统集成工程师 （部署实施）(J10424),https://www.lagou.com/jobs/6895003.html,高新区,20k-30k,中移（苏州）软件技术有限公司,3-5年,本科,五险一金、交通补贴、餐饮补贴、通讯补贴,,移动互联网,500-2000人,php,苏州
软件工程师,https://www.lagou.com/jobs/7178559.html,工业园区,6k-12k,江苏确安工业技术服务有限公司,应届毕业生,不限,开创一体化工业互联网服务,"1.   公司简介：定制工业服务解决方案确安工业服务于2011年成立于南京，主要业务是向工业企业提供直接、间接物料，专业管理咨询和其它工业服务，目前主要客户在南京、上海和苏州，大部分客户为外资企业。为了实现公司的快速发展和业务转型，公司确定开发和利用互联网工业服务应用平台，更好更快地为制造企业，特别是中小型制造企业服务：Ø  提供全流程的物料管理解决方案Ø  提供有关生产成本、节能降耗、产能提升和设备可靠性方面的专业咨询2.   职位说明：每个成员都是核心团队，只是分工不同，主要职位包括互联网项目/产品经理、Andriod和iOS系统工程师，架构师，UI设计工程师，后台和前端技术开发工程师，主要职责包括：Ø  负责和团队成员一起研发、开发和实施整个平台和相关的应用Ø  负责协调项目进度，控制预算Ø  负责平台用户、客户和供应商的系统对接3.   期望特质：正直诚实，具有创业勇气，刻苦钻研，积极主动，结果导向，团队合作4.   教育和工作背景：Ø  大学本科以上，计算机软件、信息工程、物联网相关专业Ø  熟悉Android，或iOS开发, 或JAVA, 或PHP, 和数据库SQLØ  有APP开发，ERP、CRM、MES、任务和OKR系统开发或实施经验优先5.   薪资参考：底薪+股票期权+项目奖金 核心价值观Ø  信任和承诺：我们是一个创业性组织，信任是一个组织为了实现共同目标的开始，承诺积极有效的沟通，提供公正平等的机会，和每个人分享利益Ø  成就和责任：团队的成就来自于每个人的成功和失败的分享，时刻保持奋发进取之心，互相帮助，团队协作，并积极履行社会责任Ø  安全和合规：确保每个人的健康和安全，保护我们的环境；遵循商业道德，并始终恪守正直诚实的经营之道Ø  创新和客户：敏锐洞察客户的需求和环境的变化，不断创新，为客户和合作伙伴的满意和成功持续不断地改进，才是可持续发展之道","企业服务,软件开发",少于15人,php,苏州
前端工程师,https://www.lagou.com/jobs/7080375.html,工业园区,10k-15k,苏州革新百集传媒科技股份有限公司,1-3年,大专,福利待遇好，发展前景好,一、岗位职责：1、对用户体验有专业而深刻的理解和实践；2、优化完善公司的web端代码框架；3、持续的优化前端体验和页面响应速度，并保证主流浏览器兼容性和执行效率；4、前端页面性能稳定及代码优化5、完善前端的技术栈  二、岗位要求：1、至少3年以上前端开发经验；2、熟练使用H5、CSS3、ECMAScript6等前端技术；3、熟悉vue开发；4、熟悉微信小程序开发；5、熟悉各种网络协议原理及相关知识，对web性能优化、常见漏洞有深入的理解，并能够在工作中取得有成效的问题定位和解决过程实践；6、有Hybrid的HTML5移动开发经验优先；7、有php/python后端开发经验优先；8、良好的代码习惯，熟悉各类项目文档编写；9、有良好的团队合作能力，善于沟通，自我驱动。,"广告营销,文娱丨内容",50-150人,php,苏州
软件开发工程师,https://www.lagou.com/jobs/7132874.html,吴中区,5k-10k,苏州日升软件有限公司,1-3年,大专,年终奖季度奖项目奖,"1.一年以上软件开发相关工作经验；2.掌握Java、.NET、C/C++、PHP等任一种开发语言；3.良好的团队精神和协作能力；4.能服从公司安排，有较好稳定性；","移动互联网,企业服务",50-150人,php,苏州
高级前端开发工程师,https://www.lagou.com/jobs/7051617.html,吴中区,14k-24k,苏州开心盒子软件有限公司,3-5年,本科,发展前景好，福利待遇佳,岗位要求1. 3 年以上前端开发经验，良好的编码品味2. 精通前端相关技术和常用工具，有 React 或 Vue 相关实践经验优先3. 熟悉 W3C 标准，对数据表现分离、语义化、可用性、可访问性、可维护性等有深刻理解4. 熟悉 Web 前端开发流程，熟练使用相关工具（NPM/Gulp/Webpack等），对前端开发规范、工程化、组件化、测试有相关实践5. 工作认真负责，个性乐观开朗，逻辑性强，有较强的沟通能力，合作能力6. 热爱学习新技术，了解前端最新趋势，具有分享精神7. 熟悉一门非前端的语言（如 NodeJS/Java/PHP/C/C++/Python/Ruby 等)，并有实践经验者优先；8. 有技术博客者、个人开源项目者优先， 熟悉TypeScript者优先岗位描述1. 与 PD、UED、后端、测试密切合作，深入参与产品需求讨论、功能定义等2. 负责高质量的设计和编码；承担重点、难点的技术攻坚3. 提升产品的用户体验，提升团队前端开发效率4. 为前端技术改进、性能优化、技术选型提供解决方案，并推动落地5. Web 相关前沿技术研究和新技术调研及应用，优化完善前端团队的技术体系，提升前端团队的整体技术能力,移动互联网,150-500人,php,苏州
资深java架构师,https://www.lagou.com/jobs/7194208.html,吴中区,30k-50k,宜春市巨无霸信息服务有限公司,10年以上,本科,双休，互联网企业,"工作职责:1.负责技术研究、难点攻关、架构设计、技术团队开发； 2.从需求进行抽象分解设计；主要功能、核心模块的架构与代码编写； 3.对团队开发人员进行代码质量审核、技术指导和监督；4.系统性能优化，安全加固，保证系统安全、稳定、快速运行 任职资格:任职资格： 1.计算机或相关专业本科以上学历； 2.八年以上互联网软件领域的设计开发经验，三年以上大型网站技术架构的主导经验； 3.精通JAVA, 了解JS, 熟悉PHP/SOA/SaaS/微服务架构者优先； 4.精通Linux操作系统，NoSQL (MongoDB, Redis), MySQL等主流数据库;熟悉常见的MQ系统 5.精通系统分析与设计、常用的设计模式，擅长性能调优； 6.有责任心, 学习能力强, 工作积极主动, 思路清晰，擅长沟通、有团队合作精神； 7.精通RESTful API设计，熟悉DDD及分层架构8.熟悉Docker及K8S等容器技术，熟悉CI/CD流程9.熟悉SPA架构，了解常用的前端SPA框架，如React, Vue, Angular10.有Enterprise相关领域开发经验优先","移动互联网,企业服务",15-50人,php,苏州
软件测试工程师,https://www.lagou.com/jobs/4184014.html,高新区,8k-16k,苏州万店掌网络科技有限公司,3-5年,本科,"带教,进步,团队,福利",职位描述: 1.负责web/app客户端和服务端日常测试工作，对产品的功能、性能及其他方面的测试负责；2.负责web/app的自动化测试，参与web/app测试框架、平台、工具的设计及实现；3.研究web/app的测试解决方案、测试方法的创新，4.参与关键故障的技术分析和讨论，制定相应的技术防范措施和解决方案，并牵头进行技术实现；5.参与重大项目和产品的设计评审，对关键技术领域进行风险分析和测试设计，提供测试技术解决方案。岗位要求： 1.计算机或其他相关专业本科以上学历；2. 至少3年以上软件开发、测试工作经验，2年以上移动互联网测试经验；3. 熟悉C/C++/Java等编程语言，有Shell/Ruby/PHP/Perl/Python等使用经验者优先；4. 熟悉移动web/app软件开发和测试流程；5. 有性能、安全等专项测试经验者优先。,移动互联网,50-150人,php,苏州
资深python开发工程师,https://www.lagou.com/jobs/6498099.html,工业园区,15k-30k,上海众言网络科技有限公司,5-10年,本科,中大型客户群体 大客户代表 晋升空间大,岗位职责：1、负责公司各平台服务端设计和代码实现 ；2、优化现有产品的功能和体验细节 ；3、对现有平台进行性能优化 ；4、积极调研新技术，随时准备用于产品 ；岗位要求： 1、全日制统招本科及以上学历，计算机、软件工程、信息管理等相关专业，年龄35岁以内 ；2、5年及以上Web服务器端开发经验，有Python经验佳，Java、php亦可；3、有丰富的数据库建模经验，有丰富的性能优化经验 ；4、有扎实的技术功底，做到知其然并知其所以然，能读懂python主流框架源码 ；5、熟悉分布式系统的设计和应用，熟悉分布式、缓存、消息等机制；能对分布式常用技术进行合理应用，解决问题；6、具有较深的技术架构思维，确保设计的技术方案、开发的代码有较高性能、质量保障、扩展性，前瞻性 。,移动互联网,150-500人,php,苏州
Python工程师,https://www.lagou.com/jobs/3917655.html,工业园区,10k-20k,苏州东湾信息科技有限公司,1-3年,本科,五险一金,"软件工程师(1-3年工作经验)职位要求： 1.计算机相关专业，本科及以上学历;2.熟练掌握基本算法与数据结构;3.具有优良的编码风格和习惯；4.熟悉HTTP、TCP/IP协议，RESTful规范；5.熟悉Linux开发环境, zsh/vim/git者优先；6.良好的 Ruby或者Python/PHP语言基础及开发/重构能力优先；7.具有良好的英语书面表达能力, 过6级者优先；8.熟练使用 Ruby On Rails或Flask，Django, Laravel等主流开发框架者优先;9.了解Postgresql、Mysql、Redis、Memcached等数据库及缓存的使用和基本原理者优先；","移动互联网,企业服务",50-150人,php,苏州
web开发工程师,https://www.lagou.com/jobs/6155060.html,工业园区,9k-18k,苏州东湾信息科技有限公司,1-3年,本科,五险一金,"职位要求： 1.计算机相关专业，本科及以上学历;2.熟练掌握基本算法与数据结构;3.具有优良的编码风格和习惯；4.熟悉HTTP、TCP/IP协议，RESTful规范；5.熟悉Linux开发环境, zsh/vim/git者优先；6.良好的Javascript或者Python/PHP语言基础及开发/重构能力优先；7.具有良好的英语书面表达能力, 过6级者优先；8.熟练使用Express或Flask，Django, Laravel等主流开发框架者优先;9.了解Postgresql、Mysql、Redis、Memcached等数据库及缓存的使用和基本原理者优先；10.了解React框架者优先","移动互联网,企业服务",50-150人,php,苏州
前端工程师,https://www.lagou.com/jobs/7119211.html,工业园区,10k-15k,瑞熙（苏州）智能科技有限公司,3-5年,大专,五险一金 周末双休,岗位职责：1、根据产品需求，对产品的整体风格、交互设计、界面结构、操作流程等做出设计；2、负责公司应用前端页面设计及开发工作；3、各业务模块前端代码开发，前端前沿技研究和新技术调研；4、输出软件产品设计规范制度、流程；能积极与开发沟通，推进界面及交互设计的最终实现。任职要求：1、2年以上前端开发工作经验，有参与过复杂的项目开发；2、精通各种前端技术，包括html/css/scss/less/javascript/node.js；至少熟悉一门后端语言（如java、php、C#）；3、对前端工程化和模块化开发有一定的了解，熟练使用webpack、gulp、npm、yarn等工具；4、工作使用过任意MVVM框架(如：AngularJS/Vue/React等)，长期深入使用1年以上，有VUE项目开发经验者优先考虑(elementui\mintui等)；5、熟练使用gitlab进行项目代码管理以及版本控制，并遵循一定的流行规范；6.具备良好的团队协作精神，能利用自身技术能力提升团队整体开发效率，提高团队影响力；对前端技术有持续热情，逻辑性强，善于和各种背景的人合作；,"企业服务,人工智能",50-150人,php,苏州
