job_name,job_url,job_location,job_salary,job_company,job_experience,job_class,job_given,job_detail,company_type,company_person,search_key,city
对日项目开发,https://www.lagou.com/jobs/5994191.html,吴中区,9k-18k,苏州工业园区凌志软件股份有限公司,不限,不限,发展空间大，平台好,职位一： 项目经理1.大专或以上学历，计算机相关专业毕业。2.JAVA、Cobol开发相关经验5年以上，其中项目组长或功能模块担当经验2年以上。3.日语一级，口语书面无障碍沟通。需求地点：苏州/无锡/如皋/上海 职位二：高级软件工程师1.大专或以上学历，计算机相关专业毕业。2. JAVA、Cobol、C#/C、web、asp，html5、Gen等开发语言，相关经验5年以上，其中设计经验2年以上。3.日语二级，可熟练进行书面交流，可进行日常基本对话。需求地点：苏州/无锡/如皋/上海/北京 职位三：中级软件工程师1.大专或以上学历，计算机相关专业毕业。2. JAVA、Cobol、C#/C、web、asp，html5、Gen等开发语言，相关经验3年以上。3.日语三级及以上水平，工作相关书面读写无障碍。需求地点：苏州/无锡/如皋/上海/北京 职位四：出差日本岗位1.大专或以上学历，计算机相关专业毕业。2. JAVA或IOS或Android或Sharepoint或salesforce开发相关经验3年以上。3.可以赴日出差（3个月以上）为前提4.技术优先，可日语交流（最低日文读写）需求地点：苏州/如皋/上海  苏州地址：江苏省苏州工业园区启泰路96号凌志大厦 无锡地址：江苏省无锡市菱湖大道111号国家软件园飞鱼A座9F如皋地址：如皋市万寿南路999号如皋软件园2号楼3楼上海地址：上海市普陀区大渡河路388弄华宏商务中心5号楼5楼北京地址：北京市海淀区首体南路12号科技楼6层,金融,2000人以上,ios,苏州
游戏技术测试工程师,https://www.lagou.com/jobs/6496913.html,吴中区,4k-8k,苏州玩友时代科技股份有限公司,1-3年,大专,技术大牛,工作内容：1、制定与优化游戏专项质量策略和验收标准；2、制定与优化自动化测试策略，实施自动化测试，提升测试效能；3、负责缺陷跟踪处理，分析缺陷数据，构建质量模型，推动产品质量改进；4、优化测试流程，改进测试效率；5、负责推动测试相关工具与平台的设计与研发。任职要求：1、计算机及相关专业；2、一年以上测试经验，至少两年以上移动端测试经验；3、有一定的开发背景，熟悉Python、JS等语言，熟悉常见测试相关的工具与技术；4、具有自动化测试项目经验，掌握自动化工具的原理及使用；5、具有Android/iOS移动端测试经验，具备安全、性能、兼容性等专项测试经验；6、具备良好的沟通能力、团队协作和领导能力；7、有手游测试经验者优先。,"移动互联网,游戏",500-2000人,ios,苏州
java工程师,https://www.lagou.com/jobs/6692858.html,昆山市,8k-12k,广东盘古信息科技股份有限公司,3-5年,本科,绩效奖金；加班补助；带薪年假；股票期权,岗位职责：1、根据开发进度和任务分配，完成相应软件模块的设计、开发任务； 2、进行程序单元、功能的测试，定位软件存在的缺陷并修复； 3、进行项目文档的编写和完善；4、完成上级主管分配的其他项目工作；任职要求：1、计算机或相关专业专科以上学历，3年以上工作经验；2、精通Java、Html(5)、JSP、JavaScript；熟悉JQuery、Spring、SpringMvc、Mybatis等开发技术；3、有Activiti5、Drools的经验者优先；4、有Redis、Memcache、Mongodb经验者优先；5、掌握Qracle、SQL Server、MySQL等一种及以上数据库开发技术；6、熟悉CSS、Ajax、XML、JSON等技术；7、熟悉主流应用服务器如Weblogic、Tomcat、Jetty、JBoss、WebSphere；8、熟悉Linux系统；9、有Android或IOS 的APP研发经验者优先；10、有良好的代码书写、注释和单元测试习惯，较好的文档编写技能，可以独立编写项目开发涉及到的各种技术文档；,其他,150-500人,ios,苏州
ui设计师,https://www.lagou.com/jobs/7117254.html,工业园区,8k-11k,苏州研途教育科技有限公司,3-5年,大专,双休8小时活动多氛围好社保公积金全额缴,工作职责1、负责公司Web端产品的UI设计； 2、负责公司ios及安卓端APP产品的UI设计； 3、完成界面、图标等图形界面设计与制作； 4、负责相关产品线视觉规范的制定； 5、对产品界面进行持续的设计优化，提升用户体验 6、协助公司推广活动做banner图和促销专题页等7、配合产品运营的需求，负责相关H5的视觉呈现及简单效果呈现； 8、负责公司品牌宣传等创意设计； 9、负责跟进前端开发人员，确保前端展示对视觉设计稿的还原度； 10、分享设计经验，推动提高团队的设计能力。 岗位要求1、大专及以上学历，美术、艺术设计相关专业 2、2年以上设计工作经验 3、精通PS、AI、PR等设计软件，能独立完成设计；有出众的审美能力和创造力，对行业变化和设计发展趋势有自己的理解和设计思想； 4、善于沟通，有良好的团队合作精神，有责任感，能承受压力；优势：五险一金+周末双休+社保公积金入职全额缴纳,"教育,移动互联网",150-500人,ios,苏州
Unity3D游戏客户端资深开发工程师,https://www.lagou.com/jobs/6371687.html,工业园区,15k-30k,江苏益趣联欢信息科技有限公司,3-5年,大专,六险一金、项目奖金、午休空间、学习分享,岗位职责：1、使用Unity3D引擎进行iOS/Android平台手机游戏的客户端功能开发；2、根据策划需求进行设计并编码完成目标功能；3、根据实际开发或运营需求对现有代码进行维护和调整；任职要求：1、计算机相关专业，本科及以上学历；2、2年以上Unity3D客户端开发经验，至少完整参与完成一款已上线的Unity手游项目； 3、熟练使用C#、Lua，有良好的面向对象设计、分析和编码能力；4、熟悉U3D引擎，能熟练使用Unity制作场景、UI及脚本； 5、掌握Android及iOS基础知识，能快速接入Android及iOS SDK；6、有以下经验者优先考虑：AssetBundle，Lua及热更，性能优化，shader；7、热爱游戏，良好的沟通能力，高度的工作责任心和敬业精神，能承受一定的工作压力。8.有休闲类或者ARPG类型游戏优先。,"游戏,社交",50-150人,ios,苏州
Unity3D游戏客户端开发工程师,https://www.lagou.com/jobs/6503820.html,工业园区,13k-20k,江苏益趣联欢信息科技有限公司,1-3年,大专,六险一金、项目奖金、午休空间、学习分享,岗位职责：1、使用Unity3D引擎进行iOS/Android平台手机游戏的客户端功能开发；2、根据策划需求进行设计并编码完成目标功能；3、根据实际开发或运营需求对现有代码进行维护和调整；任职要求：1、计算机相关专业，本科及以上学历；2、2年以上Unity3D客户端开发经验，至少完整参与完成一款已上线的Unity手游项目； 3、熟练使用C#、XLua，有良好的面向对象设计、分析和编码能力；4、熟悉U3D引擎，能熟练使用Unity制作场景、UI及脚本； 5、掌握Android及iOS基础知识，能快速接入Android及iOS SDK；6、有Unity扩展工具开发经验及DoTween使用经验，同时有以下经验者优先考虑：AssetBundle，Lua及热更，性能优化，shader；7、热爱游戏，良好的沟通能力，高度的工作责任心和敬业精神，能承受一定的工作压力。8.有休闲类或者ARPG类型游戏优先。,"游戏,社交",50-150人,ios,苏州
Unity开发工程师,https://www.lagou.com/jobs/6873981.html,工业园区,10k-15k,苏州奖多多科技有限公司,3-5年,大专,平台大 弹性工作制 福利待遇佳,"岗位职责:    1.运用Unity3D工具引擎开发游戏；    2.提供日常的代码Review以及文档撰写,分析代码效率并进行多层次的优化;    3.根据策划要求，与美术一起协作，完成相关的应用功能开发；    4.负责客户端在Android、IOS平台下的功能开发。任职资格:    1.大专及以上计算机专业或其他相关专业,至少1年以上unity游戏开发经验;    2.熟练使用Unity3D编辑器，熟练使用Unity 3D制作场景、UI及脚本，熟悉Unity3D游戏制作流程;    3.熟悉面向对象编程、设计模式、具有严谨的逻辑思维能力;    4.参加过一款或以上商业化项目者优先;    5.有技术团队带队经验者优先;    6.具有良好的团队精神，沟通能力、自学能力;    7.责任感强，工作认真负责，富于团队精神和敬业精神以及独立解决问题的能力。","移动互联网,消费生活",150-500人,ios,苏州
开发,https://www.lagou.com/jobs/6959115.html,工业园区,13k-20k,华为数字技术有限公司,不限,本科,福利待遇好，成长空间大,工作职责:1 参与软件的设计、开发、维护等工作2 参与友商产品竞争分析、制定产品优化策略方案等3 承担多个模块或子系统的软件需求分析、模块的构造设计、代码编写、单元测试、静态检查、问题定位等工作4 熟悉企业协作组网和业务，负责音视频产品开发和交付，主导技术方案设计和关键模块开发任职要求:业务技能要求:1 熟悉c/c++/java/ios/python/js一种或多种语言2 熟悉基于linux系统进行开发维护专业知识要求:1 有1年及以上软件开发工作经验2 需要实际参与1～2个项目需求分析与系统设计的具体工作3 有性能优化、关键问题攻关经验优先4 有音视频开发经验优先,"数据服务,企业服务",2000人以上,ios,苏州
前段架构专家,https://www.lagou.com/jobs/6754872.html,吴中区,20k-35k,苏州缪斯谈谈科技有限公司,3-5年,不限,大牛多，发展空间大,工作职责设计整个客户端产品的架构，带领整个客户端和前端技术团队 负责面向AI音乐陪练市场的Android，iOS移动客户端产品的开发 设计和管理从开发到运维监测的全链路开发流程 岗位要求3年以上Android/iOS相关的开发经验，计算机或者相关专业本科以上学历。 有过从0到1的Android/iOS产品的开发经验。 扎实的计算机科学基本功，如算法和数据架构、网络等相关知识。 优秀的逻辑思维能力，分析和拆解问题的能力。 良好的技术英文的阅读能力,"文娱丨内容,软件开发",少于15人,ios,苏州
java开发高级工程师,https://www.lagou.com/jobs/6900992.html,吴中区,10k-15k,苏州跬步信息技术有限公司,3-5年,大专,双休、项目奖金、年终奖、员工旅游,"岗位职责：1、参与公司移动云平台的详细设计、研发工作；2、把握复杂系统的设计，编写核心部分代码、指导和培训工程师、不断进行系统优化；3、负责相关技术文档的拟订；4、能够独立完成上级交付的研发任务。任职要求：1、3年以上工作经验，计算机软件相关专业，本科及以上学历；2、精通Java开发,具有良好的代码风格及习惯，以及一定的抗压能力；3、熟练运用Spring MVC、Mybatis、shiro框架；4、熟悉MySQL，NoSQL (MongoDB, Redis等)5、熟练运用HTML,CSS,JavaScript,Ajax等Web端技术,熟练运用jQuery框架。6、熟练运用Java多线程，了解事务控制及相关技术，熟练运用Git进行项目版本管理。熟练使用Maven/Ant、Jenkins者优先；7、熟悉Tomcat，接触过JBoss,WebLogic，WebSphere等容器中的至少一种Web容器。了解Linux常用命令；8、具备Android/Ios项目开发经验者优先。9、有大型高可用、高弹性、分部式等系统相关经验优先；","移动互联网,企业服务",少于15人,ios,苏州
APP测试工程师,https://www.lagou.com/jobs/7170552.html,张家港市,5k-10k,张家港万众一芯生物科技有限公司,1-3年,大专,双休、法定假日、节日福利、生日会、奖金等,岗位职责1、负责iOS、Android和Web端平台App的软件功能和性能测试；2、根据项目需求，独立编写测试计划、规划测试方案、编写测试用例；3、跟踪分析测试情况，解决测试过程遇到的问题；4、建立、维护测试工作的相关文档；5、协助用户解决产品使用中遇到的问题。岗位要求:1、计算机相关专业大专及以上学历，3年以上APP测试经验；2、有良好的沟通和学习能力、有较强的团队协作能力以及快速解决问题的能力；3、熟悉Mysql等至少一种数据库管理系统，能够熟练编写SQL语句；4、较强的语言表达能力和文档撰写能力，良好的英文阅读能力；5、熟悉测试理论，流程与方法，熟练应用各种测试工具和管理系统；6、熟悉Andriod/iOS以及对应开发架构；7、熟悉 Android 、iOS手机端测试方法及Scrum开发模式者，优先考虑。,其他,15-50人,ios,苏州
前端组长,https://www.lagou.com/jobs/6989677.html,工业园区,20k-30k,浙江三铁信息技术有限公司,5-10年,大专,薪资弹性可谈,1、熟悉W3C规范，熟悉HTML4/HTML5、CSS2/CSS3、ES5\ES6等前端开发技术；2、熟悉Vue/React/Angular等框架实践经验，具备独立项目开发能力；熟悉Node.js技术及生态，熟练使用npm/webpack/gulp等工具链；3、熟悉前端预编译语言sass、less、Stylus中至少一种；4、熟悉前端模块化、编译和构建工具，如grunt、gulp、webpack等；5、能够独立进行前端页面代码开发及性能调优，能够充分理解设计需求并落地；6、能够独立完成网站脚手架搭建，具备较强自学能力，了解B/S架构工作原理；7、对移动端开发安卓、IOS、混合开发有深厚相关开发经验；8、具有良好的沟通能力，重视代码规范，熟练编写API文档。,电商,150-500人,ios,苏州
java开发工程师,https://www.lagou.com/jobs/6470922.html,工业园区,5k-10k,苏州米德威尔信息科技有限公司,1-3年,本科,扁平化管理，结果导向，系统培训支持,职责描述：1、负责公司WEB/手机端(APP)产品后台系统架构设计，编码和技术维护；2、参与项目分析和技术实现研讨，完成安排的工作任务；3.支持产品部门的需求，提出相应的解决方案并实现；4.根据部门主管的分工完成各项程序的开发工作。任职要求：1、 2-3年工作经验，计算机软件相关专业，本科及以上学历； 2、 具有良好的学习，良好的代码风格及习惯，以及一定的抗压能力；3、 熟练运用HTML、CSS、JAVASCRIPT、AJAX等web端技术熟练运用jquery框架。 4、 熟练运用JAVA多线程，定时任务，了解事务控制及相关技术，熟练运用git进行项目版本管理。熟练使用mavenant、Jenkins者优先； 5、 熟练运用Spring MVC框架。掌握RestFul实现、Java异步消息技术者优先； 6、 熟悉TOMCAT，接触过JBOSSWEBLOGIC，WEBSPHERE等容器中的至少一种web容器。了解linux常用命令； 7、 具备android/ios项目开发经验者优先。,"企业服务,移动互联网",15-50人,ios,苏州
Cocos2d-x开发工程师,https://www.lagou.com/jobs/4776062.html,工业园区,8k-15k,苏州大熊网络科技有限公司,1年以下,本科,自由发挥,职位描述：    1.根据策划方案完成手游客户端界面、场景、游戏逻辑等功能；    2.根据美术提供素材完成游戏呈现效果；    3.解决游戏发布在移动设备上的兼容问题   任职要求：    - 具备1年以上游戏开发工作经验；    - 有cocos2d-js或unity3d游戏客户端实际开发经验，有过完整上线游戏项目开发经验者优先；    - 熟悉javascript语言，有使用Cocos2d-js开发游戏经验；    - 熟悉网络编程，有长连接、实时网络交互经验者优先；    - 熟悉android或ios平台的开发，熟悉常见手游sdk的接入；    - 良好的沟通能力，做事认真负责，具有团队合作意识；    - 热爱游戏，热爱软件开发，勇于接受挑战；,"移动互联网,游戏",少于15人,ios,苏州
工业互联网软件开发工程师,https://www.lagou.com/jobs/7173694.html,工业园区,8k-16k,江苏确安工业技术服务有限公司,不限,本科,开创一体化工业互联网服务,"1.   公司简介：定制工业服务解决方案确安工业服务于2011年成立于南京，主要业务是向工业企业提供直接、间接物料，专业管理咨询和其它工业服务，目前主要客户在南京、上海和苏州，大部分客户为外资企业。为了实现公司的快速发展和业务转型，公司确定开发和利用互联网工业服务应用平台，更好更快地为制造企业，特别是中小型制造企业服务：Ø  提供全流程的物料管理解决方案Ø  提供有关生产成本、节能降耗、产能提升和设备可靠性方面的专业咨询2.   职位说明：每个成员都是核心团队，只是分工不同，主要职位包括互联网项目/产品经理、Andriod和iOS系统工程师，架构师，UI设计工程师，后台和前端技术开发工程师，主要职责包括：Ø  负责和团队成员一起研发、开发和实施整个平台和相关的应用Ø  负责协调项目进度，控制预算Ø  负责平台用户、客户和供应商的系统对接3.   期望特质：正直诚实，具有创业勇气，刻苦钻研，积极主动，结果导向，团队合作4.   教育和工作背景：Ø  大学本科以上，计算机软件、信息工程、物联网相关专业Ø  熟悉Android，或iOS开发, 或JAVA, 或PHP, 和数据库SQLØ  有APP开发，ERP、CRM、MES、任务和OKR系统开发或实施经验优先5.   薪资参考：底薪+股票期权+项目奖金 核心价值观Ø  信任和承诺：我们是一个创业性组织，信任是一个组织为了实现共同目标的开始，承诺积极有效的沟通，提供公正平等的机会，和每个人分享利益Ø  成就和责任：团队的成就来自于每个人的成功和失败的分享，时刻保持奋发进取之心，互相帮助，团队协作，并积极履行社会责任Ø  安全和合规：确保每个人的健康和安全，保护我们的环境；遵循商业道德，并始终恪守正直诚实的经营之道Ø  创新和客户：敏锐洞察客户的需求和环境的变化，不断创新，为客户和合作伙伴的满意和成功持续不断地改进，才是可持续发展之道","企业服务,软件开发",少于15人,ios,苏州
Unity3D游戏客户端开发主程序,https://www.lagou.com/jobs/6371911.html,工业园区,30k-50k,江苏益趣联欢信息科技有限公司,3-5年,大专,六险一金、项目奖金、午休空间、学习分享,岗位职责：1、使用Unity3D引擎开发手机游戏，包括但不局限于核心框架搭建、前后端对接、多平台发布等；2、根据项目需求对各类所需工具（可视化编辑器等）进行再开发及调整优化；3、负责项目技术团队建设、产品技术评估及研发、事故问题处理、技术问题解决；4、负责协调美术需求，并能根据美术需求，提供技术支持，完成项目需求渲染效果，能提供高质量Shader；5、负责机型适配同时使用相关工具对项目整体进行分析优化。任职要求：1、计算机相关专业，本科及以上学历；2、5年以上Unity客户端开发经验，1年以上主程经验，至少持续完整参与完成一款已上线的大型Unity项目，具备优秀的团队管理经验； 3、精通数据结构等基础知识，具有良好的编码习惯，严谨的编码风格；4、精通U3D引擎开发，熟练使用C#、Lua等语言，熟悉3D图形学和实时渲染，精通Shader编程。熟悉客户端代码和资源热更新方案的更佳；5、熟悉U3D资源管理和内存分配；6、精通U3D在IOS及Android平台的发布及调试，熟悉各平台打包和上架流程；7、对新技术持有敏感性以及愿意致力于新技术的探索和研究；8、热爱游戏，良好的沟通能力，高度的工作责任心和敬业精神，能承受一定的工作压力。工作地点在苏州！！！,"游戏,社交",50-150人,ios,苏州
