job_name,job_url,job_location,job_salary,job_company,job_experience,job_class,job_given,job_detail,company_type,company_person,search_key,city
java/go开发工程师,https://www.lagou.com/jobs/7207755.html,南山区,20k-35k,北京奇艺世纪科技有限公司,5-10年,本科,带薪休假,工作内容：1.  负责产品线上、线下性能工具的开发和自动化框架的开发、维护2.  结合业务找到提高项目测试效率的技术解决方案，并解决测试过程中的复杂技术问题； 4.  能结合行业发展趋势，制定合适的质量技术发展规划，促进团队质量保障效率和团队技能的提升，指引团队测试技术的发展方向5.  不断的引入新技术，优化工具的执行效率和测试质量，对CI/CD有深刻的理解及实际实施经验任职资格：1.  本科或以上学历，计算机软件、通讯相关专业2.  5年以上后台开发的经验3. 熟悉Java或者Golang语言4. 掌握至少一种脚本语言，如Python/shell，熟悉Linux操作系统5. 具备广泛的技术视野和很强的技术前瞻性，洞悉测试技术的发展6. 很强的学习能力、分析能力和解决问题的能力温馨提醒：如果 7 天内您没有收到爱奇艺的面试邀请，那么目前我们不会安排您参加后续的面试环节，感谢您的理解和对爱奇艺的关注与认可。,文娱丨内容,2000人以上,go,深圳
GO语言开发工程师,https://www.lagou.com/jobs/7217797.html,南山区,15k-28k,金蝶软件（中国）有限公司,3-5年,本科,大平台、导师制、工作环境佳、发展潜力大,"职位职责负责金蝶云平台以及运营管理平台的研发工作，主要包括：1.负责金蝶云平台控制台帐号权限、基础安全、帮助中心等相关产品的后台开发；2.负责对现有系统稳定性优化、性能调优等工作；3.负责金蝶云平台运营管理平台的后台开发、建设；任职要求1.计算机相关专业本科以上学历，3年以上工作经验；2.熟练掌握Golang语言，熟悉至少一个Golang web框架；3.了解linux运行机制和原理；深刻理解mysql，InflexDB,redis,kafka等工作原理4.熟悉负责系统解耦，具有较好的系统分析设计能力；5.熟悉大中型网站后台架构，有大型系统的重构经验，有高可用系统实践经验者优先，有帐号系统开发经验者优先。",企业服务,2000人以上,go,深圳
服务端开发工程师（go语言）,https://www.lagou.com/jobs/3985274.html,南山区,12k-24k,乐至（上海）科技有限公司,1-3年,大专,薪酬和能力成正比,岗位职责：1、负责公司产品服务器端开发及维护；2、负责实现产品功能系统设计和开发；3、负责服务器配置、部署和维护；4、负责服务器相关工具的开发；5、与团队成员密切协作完成功能开发。录用条件：1、熟悉Go语言，Go协程，Channel，对高并发、高可用架构系统有正确、深刻的理解，要求有分布式服务器开发经验；2、熟悉json/protobuf等至少任意一种网络通信技术和数据交换格式 良好的算法基础和清晰的编程思路；3、熟悉tcp，ip，http等网络协议；4、熟悉 Linux、Redis、关系型数据库、Docker等；5、良好的职业道德素养及工作态度。,移动互联网,50-150人,go,深圳
GO语言开发工程师（金蝶云苍穹）,https://www.lagou.com/jobs/6334930.html,南山区,13k-26k,金蝶软件（中国）有限公司,3-5年,本科,公司核心业务，大平台，薪酬福利好,"职位职责：1、负责云苍穹PaaS基础平台（混合云管理、k8s容器服务、云监控、云日志等）的研发与维护；2、负责云苍穹开放平台（网站，API网关）研发与维护。任职要求：1、计算机及相关专业本科及以上学历， 三年以上LINUX环境（GO、python、perl）编程经验；2、熟悉k8s、docker、ELK、Openstack、Prometheus, 有DEVOPS产品开发经验者优先；3、熟悉TCP/IP及HTTP, SNMP等常用网络协议；4、熟悉Linux系统，了解其工作原理，具备优化和排障能力；5、具备良好的沟通、协调、学习和创新能力。",企业服务,2000人以上,go,深圳
GO/PHP开发工程师,https://www.lagou.com/jobs/6668693.html,南山区,10k-15k,深圳市华阅文化传媒有限公司,1-3年,本科,"奇虎360,五险一金,大咖多,弹性工作制",工作职责:1、参与后端服务重构工作，负责公司阅读等相关业务后台服务开发和版本迭代；2、负责并参与系统架构设计、优化和及核心功能开发；3、根据系统发展，对技术架构不断调整持续优化；任职资格: 1. 本科以上学历，计算机相关专业学历，1-3年工作经验；  2. 精通PHP或GO语言，愿意转GO开发语言，掌握常用开发框架及设计模式；  3. 熟悉Linux下开发工作，熟悉TCP/IP、HTTP协议，掌握多进程多线程模型；  4 掌握MySQL及Mongo/Redis等NoSQL的应用场景及相关优化方案；  5. 较强的分析和解决问题的能力，积极主动的个性，关心产品和业务；,移动互联网,150-500人,go,深圳
GO开发工程师（PAS）(002391),https://www.lagou.com/jobs/7066305.html,南山区,15k-30k,深圳云安宝科技有限公司,3-5年,本科,"精英团队,千万级用户,高并发系统",1、参与数据安全产品核心业务模块的软件设计、开发和验证工作；2、参与数据安全产品的系统架构设计、验证和性能优化；1、精通GO语言，有良好的安全编码规范意识，有一定架构设计经验；2、熟悉TCP/IP协议，熟悉网络通信基本原理；3、熟悉linux操作系统原理；4、具有分布式系统、集群管理、SOA架构等相关技术研发经验优先；5、有海量数据库设计、开发经验，熟悉常用开源分布式数据库经验优先；6、3年以上工作经验，统招本科以上学历，计算机相关专业。,"信息安全,数据服务",50-150人,go,深圳
GO开发工程师,https://www.lagou.com/jobs/7072288.html,南山区,14k-28k,深信服科技股份有限公司,不限,本科,"平台大,福利好,薪资高",1.负责服务器后台需求分析，架构设计，核心编码2.精通golang程序设计开发3.对C有开发经验的优先4.喜欢挑战不可能5.对于经验更丰富、能力更强、有相关领域研发经验者，将会以更高级别招聘入职,"信息安全,企业服务",2000人以上,go,深圳
Go语言主管开发工程师、高级开发工程师,https://www.lagou.com/jobs/6966796.html,南山区,20k-30k,深圳市金证科技股份有限公司,3-5年,本科,金融IT,"工作职责:1、从事金证云原生开放平台的研发2、从事软件新技术的研究和开发base深圳，工作地深圳/成都可选。任职资格:1、计算机技术或者软件工程专业，本科或以上学历，硕士学历优先；2、3年及以上的Go语言开发经历；3、精通常用的数据结构和算法，熟悉常用的设计模式，熟练掌握网络和并发编程、分布式计算4、熟悉premethues、openshift、docker，rancher、kubernates,ELK的使用，具有优化及二次开发经验，有DevOps产品开发经验；5、了解云原生、DevOps相关的生态及文化；6、身心康健，具备良好的团队合作精神，对技术有热情和追求，具备钻研和坚韧、勤奋精神，有良好的分析和解决问题的能力。",金融,2000人以上,go,深圳
后端开发工程师——go,https://www.lagou.com/jobs/6969137.html,南山区,14k-28k,苏州博纳讯动软件有限公司,不限,不限,前沿行业 团建旅游,1. 负责核心产品的后端开发工作，支撑千万日活 2. 设计和构建相关基础设施，优化开发、部署等流程，提高生产力 3. 持续改进服务端架构和技术栈，扩大系统容量，提高系统可用性 任职要求： 1. 专科及以上学历，计算机相关专业 2. 至少3 年以上 Go开发经验，熟悉常见软件架构模式和技术栈 3. 计算机基础知识扎实，熟练运用常见数据结构和算法 4. 熟练掌握 MySQL、Redis 等数据库，对性能优化有较深的理解和应用 5. 熟练掌握 Linux 平台，熟悉常见软件或服务，有一定的性能监控、调优相关经验 6. 拥有一定的持续测试、集成、部署实践经验 7. 有Java或Python、k8s等使用经验优先,"移动互联网,企业服务",150-500人,go,深圳
Go/Golang资深工程师,https://www.lagou.com/jobs/7022412.html,南山区,35k-60k,深圳一匹狼科技有限公司,3-5年,本科,博士团队 氛围轻松 提升快 能学到新技术,"您要做的是：
 负责公司容器服务平台开发
 负责/参与技术架构设计、重构、优化
需要您：1.良好的问题发现和分析能力，追求在彻底地解决问题的过程中修炼技术，而不是脱离实际空谈技术；2. 熟悉Golang语言，有3年及以上Go实际项目经验；熟悉至少一个Golang web框架（例如Gin、beego等）；3. 熟悉GNU/Linux操作系统，熟悉开源的LNMP架构、redis、mq、常见的nosql等技术，特别欢迎对开源组件有源码级了解或曾贡献过代码的同学4. 对云原生技术感兴趣者优先，有docker、kubernetes、helm、k8s-operator使用、开发经验者优先；5. 工作认真负责，有良好的团队意识和沟通能力。","企业服务,数据服务",15-50人,go,深圳
go/golang开发工程师,https://www.lagou.com/jobs/6941330.html,南山区,13k-25k,上海游密信息科技有限公司,1-3年,本科,晋升空间大；技术氛围浓；弹性工作时间,【岗位职责】1. 负责核心业务系统开发2. 参与产品需求沟通、方案设计、程序开发、运营优化3. 保障系统在高并发下的稳定性4. 负责编写项目自身的单元测试或API自动测试程序、压测程序【任职要求】1. 1 年及以上 Go 实际项目经验，能在规定的架构内独立完成项目开发2. 熟练掌握 Restful API 接口设计标准及规范3. 熟练掌握 MySQL、Redis、RabbitMQ等开源中间件4. 熟悉 Linux 开发环境，掌握HTTP、TCP/IP等网络相关技术5. 除 Go 外 至少还熟悉 C++/Python/PHP/JAVA 中的一门编程语言，有实际编写经验6. 热爱编程，工作积极主动，有较强的学习、交流能力、抗压能力以及良好的团队合作精神,"移动互联网,社交",50-150人,go,深圳
GO后端开发工程师,https://www.lagou.com/jobs/7175727.html,南山区,9k-11k,上海微创软件股份有限公司,1-3年,大专,发展好，有前景,（岗位是外派到腾讯上班）岗位要求：计算机相关专业，本科及以上学历。熟练使用Go或者Java，C/C++任意一种语言，熟悉Linux/Unix平台开发，至少熟悉一种脚本语言；熟悉TCP/IP与HTTP等网络协议相关知识，以及多线程开发；熟悉Mysql数据库开发，熟悉NoSQL，如memcache/redis/mongodb；具有Go语言web后台项目经验，微服务应用设计和开发经验者优先；具有较强的问题定位和分析能力；具备较强的抗压能力和良好的沟通、学习能力。岗位职责：腾讯智慧交通旅客全流程服务系统相关的后台开发工作,"企业服务,移动互联网",2000人以上,go,深圳
后台开发工程师（C++/Java/Go）,https://www.lagou.com/jobs/6955022.html,南山区,4k-7k,微民保险代理有限公司,应届毕业生,本科,腾讯子公司,,金融,500-2000人,go,深圳
go语言开发,https://www.lagou.com/jobs/7025577.html,南山区,14k-20k,深圳市拓保软件有限公司,1-3年,大专,五险一金,1. 大专以上学历，2年以上工作经验； 2. 熟练掌握Linux环境下的C/C++或Golang开发； 3. 熟悉Redis、Leveldb/Rocksdb等原理及源码； 4.有参与研发大型分布式系统、缓存、KV存储的经验；5.具备良好逻辑分析能力，沟通能力以及团队合作精神。,数据服务,2000人以上,go,深圳
Go工程师,https://www.lagou.com/jobs/6457869.html,南山区,10k-20k,深圳市华宇讯科技有限公司,1-3年,本科,腾讯系；自研平台；技术大牛多；技术氛围好,"岗位职责：1、负责产品研发中心平台部基础平台系统的研发工作；2、参与制定前后端业务流程、接口协议、文档输出等3、参与项目研发、部署及日常运维工作；任职要求：1、扎实的后端基础知识，精通golang;2、熟悉Linux，对服务器性能优化有深刻了解，有高并发项目经验优先;3、熟悉网络编程，了解TCP/IP，HTTP等工作原理;4、精通MySQL，能写出高性能SQL及分析性能瓶颈，熟悉数据库表的设计;5 、熟悉业界内常用的开源工具（kubernetes,kafka、hadoop、grafana、ElasticSearch, Logstash, Kibana等），并在不同项目中有实际使用经验者优先6、具有主导或参与开发大型电商平台经验者优先；7、具有良好的沟通能力、学习能力、分析解决问题能力,具有高度的责任心和团队合作精神。","移动互联网,电商",500-2000人,go,深圳
go开发工程师,https://www.lagou.com/jobs/7194156.html,南山区,10k-16k,深圳贝尔创意科教有限公司,1-3年,不限,空间大 氛围好,1. 本科及以上学历，计算机或相关专业，热爱互联网和互联网相关技术；3年以上后台开发工作经验；2. 掌握Golang/Java，并深入理解微服务架构，有过实际框架开发经验者优先；3. 精通Unix/Linux操作系统原理、常用操作和工具；4. 熟悉常用算法和数据结构，网络及多线程编程技术；5. 熟悉Mysql及NOSQL数据库（redis/mongodb/memcache）原理，并能进行基于此的开发和优化；6. 对新技术敏感，求知欲强，能快速学习并具备较强的技术领悟能力；7. 良好的学习、沟通、团队协作、分析解决问题的能力，有责任心，和主动性。,其他,2000人以上,go,深圳
Go后端架构师,https://www.lagou.com/jobs/7180112.html,南山区,20k-35k,深圳市柒零壹科技有限公司,5-10年,本科,技术机遇，发展前景,【岗位职责】1、 负责公司产品后台服务的架构搭建和编码实现；2、 负责公司后台开发规范，性能优化，安全优化；3、 带领后台团队完成工作，并负责技术攻关，技术分享。【任职要求】1、 精通Golang开发，两年以上Go开发实际经验，有实际项目上线运行经验2、 熟练掌握Go微服务架构设计，分布式微服务治理、高性能、大并发后台服务开发经验3、 熟悉Redis、RabbitMQ、NSQ、Kafka等消息中间件，掌握MYSQL及数据库设计与优化。4、 具备良好的设计规范，优秀的团队协作精神，良好的沟通表达能力；5、 统招本科及以上学历，计算机相关专业6、 能够接受短期不定期出差,软件开发,15-50人,go,深圳
Go/Golang,https://www.lagou.com/jobs/7090087.html,福田区,20k-40k,深圳诺德士资产管理有限公司,3-5年,本科,福利待遇好、发展前景大,"我们的任务是不断挑战**的系统性能，打造纳秒级低延时的高频交易框架，为高频交易提供快人一步的交易装备。我们开发的交易系统已连续多年稳定创造收益，在这里，你的任何代码改动都可以直接得到市场的反馈，并有可能极大的提升收益。 我们提供的服务包括：高频交易框架、高频交易策略孵化平台、高质量市场数据平台。 岗位职责：1、负责内部高性能、高可靠性的交易框架的开发和维护2、负责公司高频交易策略孵化平台、数据平台的开发和维护3、参与产品架构的设计优化与基础设施演进4、使用网络，系统工程以及各种新技术持续优化系统性能任职要求：1、本科及以上学历，计算机相关专业；2、3年以上Unix/Linux下C/C++, Golang开发经验；3、熟悉Unix/Linux操作系统原理、常用工具；4、全面并且扎实的软件知识结构（操作系统、软件工程、设计模式、数据结构、数据库系统、网络安全）；5、具备良好的分析解决问题能力，能独立承担任务和有系统进度把控能力；6、好学、责任心强、思维缜密敏捷、良好的对外沟通和团队协作能力；7、有低延时系统开发经验优先考虑。",金融,15-50人,go,深圳
C++/GO语言后台云服务软件工程师,https://www.lagou.com/jobs/6723245.html,龙岗区,15k-30k,华为技术有限公司,不限,本科,5GC相关业务,"【岗位职责】专注5G云服务业务，包括1、参与5G应用软件高级开发工程师，负责相关模块设计和开发；2、参与产品云化架构演进，构建稳定，竞争力强的云架构并落地3、负责看护产品核心技术，承担关键问题攻关，提升产品优势。【业务技能】1、计算机、通信、电子、自动化等相关专业全日制本科及以上学历；2、具备丰富开发能力和经验，熟悉C/C++、java、python ,go等开发语言的种或多种，能够熟练运用完成开发工作；3、熟悉常见的数据结构和算法，熟悉设计模式，具有一定的架构设计能力和重构经验；4、具有强烈的主观能动性，良好的沟通与合作能力。思维开放，善于自我激励和驱动；5、熟悉tcp/ip/sctp/或者http，soap，diameter等协议，具备高性能服务器软件设计开发经验者优先",通讯电子,2000人以上,go,深圳
Java/GO/C++后台开发工程师,https://www.lagou.com/jobs/7128349.html,南山区,18k-35k,武汉市中知商标事务代理有限公司,不限,本科,高福利、高待遇、互联网平台,"工作要求本科及以上学历，计算机相关专业； 具备Unix/Linux下C/C++/Java/Go其中至少一门语言 1年以上开发经验， 熟悉常用的数据结构、算法设计； 精通TCP/IP协议，进程间通讯编程，熟悉Unix/Linux下常用架构设计方法； 熟悉Unix/Linux操作系统原理、常用工具， 熟悉Mysql/Oracle等数据库管理、开发,SQL调优； 全面的软件知识结构(操作系统、软件工程、设计模式、数据结构、数据库系统、网络安全)； 具备良好的分析解决问题能力，能独立承担任务和有系统进度把控能力； 责任心强,良好的对外沟通和团队协作能力； 有大容量通信系统和大型互联网后台开发经验者优先。",企业服务,15-50人,go,深圳
go开发工程师,https://www.lagou.com/jobs/7114634.html,南山区,15k-30k,深圳市即构科技有限公司,3-5年,本科,15薪,职位描述：－负责IM类业务需求的后台架构设计、开发、运营－负责在线教育产品SAAS服务的后台架构设计、开发、运营职位要求：－本科及以上学历，2年及以上后台开发经验－良好的数据结构和算法能力－熟悉Unix/Linux开发环境，熟悉网络开发，理解并发编程－熟练掌握GO语言，有大型项目开发经验优先－在GO语言的基础上，有C/C++系统开发经验优先－良好的沟通能力和责任感，能够承担工作压力，独立分析和解决问题,"移动互联网,企业服务",150-500人,go,深圳
后台开发（C/C++/Java/Go均可）,https://www.lagou.com/jobs/7143675.html,南山区,15k-30k,广州拓信计算机科技有限公司,1-3年,本科,独角兽企业 年底奖金丰厚,"工作职责：负责直播中台的开发和维护；负责直播业务的后台开发及维护；负责互动直播类相关海量后台的架构设计、实现和维护。工作要求本科及以上学历，计算机相关专业；具备Unix/Linux下C/C++/Java/Go其中至少一门语言 1年以上开发经验， 熟悉常用的数据结构、算法设计；精通TCP/IP协议，进程间通讯编程，熟悉Unix/Linux下常用架构设计方法；熟悉Unix/Linux操作系统原理、常用工具， 熟悉Mysql/Oracle等数据库管理、开发,SQL调优；全面的软件知识结构(操作系统、软件工程、设计模式、数据结构、数据库系统、网络安全)；具备良好的分析解决问题能力，能独立承担任务和有系统进度把控能力；责任心强,良好的对外沟通和团队协作能力；有大容量通信系统和大型互联网后台开发经验者优先。",软件开发,50-150人,go,深圳
高级研发工程师(C++/Go),https://www.lagou.com/jobs/5976286.html,福田区,20k-30k,深圳市中联创新自控系统有限公司,3-5年,本科,"五险一金,绩效奖金,弹性工作，节日福利",我们是谁:中联创新旗下有速力思、迈斯、康耐德三个子品牌，在数据中心、社区与通用物联网领域拥有行业领先的技术积累与持续盈利的产品线。我们的研发毕业于CMU、清华、香港大学等国内外高校，来自谷歌、华为、百度等企业。主力研发方向为：1、面向创业公司的通用物联网硬件产品与平台；2、面向专业场景的工业领域AI+控制系统。岗位职责：1、参与开发大型物联网项目的核心服务器开发与设计工作；迭代改进高性能、高稳定性服务器与边缘网关架构，使其不断进化；2、参与工业物联网新产品线的研发工作，负责B端产品的核心模块技术设计并独立完成coding工作，输出技术文档；主要实现语言为C++/GO；3、完成自己开发模块的单元测试与测试用例评审，输出技术文档；4、定期了解行业内新技术方向，组内定期对自己擅长的领域做技术交流。岗位要求：1、大学本科及以上学历，计算机、电子、通讯等理工科专业，2年以上工作经验；2、熟悉Linux环境下开发（x86架构server与arm板)；3、技术栈可以是:C++/Go，C++出身两者兼具最佳，熟练使用例如grpc，mongo，redis，influxdb，elk套件等开源组件；熟悉TCP、UDP等常见通讯协议，精通网络编程；4、在算法/大型架构上，有一定经验，至少阅读过3个以上大型开源项目源代码。加分项:1、有物联网产品和实现经验优先；2、积极乐观，责任心强，工作认真细致，具有良好的团队沟通与协作能力；3、对产品有好奇心，关注业内产品，喜欢使用产品，关注产品体验；4、热爱编程，有良好的自驱力，有较强的学习能力，有强烈的求知欲、好奇心和进取心，能及时关注和学习业界最新技术；5、对arm linux有一定了解，做过嵌入式开发优先。欢迎对热爱技术、对自己技术成长有追求的小伙伴加入！,移动互联网,150-500人,go,深圳
go开发工程师（高级）,https://www.lagou.com/jobs/7034994.html,南山区,25k-35k,深圳无内科技有限公司,5-10年,本科,技术大牛、boss好,"职业要求:1.能够独立设计和实现系统架构、软件产品，并能撰写技术文档。在开发之前，要知道所做出来的东西是否有用、易用，是否便于维护，是否性能稳定，等等。2.对初级、中级工程师进行指导与培养。3.能肩负起系统架构的一般设计、优化与实践。4.有做架构师意向的可在面试的时候详谈。       技术要求:1.精通Go开发语言，熟练掌握Go的数据类型、内置函数、接口类型等;2.熟悉Go的标准库、优秀的第三方库(不限于Web/ORM/RPC),了解Go的并发模型/运行时等；3.熟悉Linux操作系统，有一定的MySql优化经验，必须能够手写SQL语句；4.熟知面向对象基本概念和原则，设计模式和算法有所涉猎,有DDD项目实践者优先；5.对云原生技术的运维/安全感兴趣者优先，有docker/k8s/helm二次开发经验更优；6.必须扎扎实实撸了两年以上Golang代码，第二语言为C\C++、Python者优先；",信息安全,15-50人,go,深圳
C/C++/Go高级开发工程师,https://www.lagou.com/jobs/7134373.html,南山区,15k-25k,深圳网聚云联科技有限公司,1-3年,本科,年终分红 期权鼓励 周末双休 五险一金,"职责描述:1、负责客户使用公司产品的日常技术支持工作；2、负责客户化需求的专项服务产品的开发与交付，包括新产品的设计与研发。任职要求：1、本科及以上学历,3年以上Linux服务端开发经验；2、精通C、C++、Go中某一种编程语言；3、精通网络编程、多线程、内存管理、大规模分布式系统等;4、熟悉Nginx、Squid、TrafficServer、Varnish等任何一种软件者优先;5、精通Shell、Python、Lua等一种脚本语言；6、有TCP/UDP传输协议优化经验者优先；7、有事件驱动编程、协程使用经验者优先；8、具有较强的逻辑思维能力，具有良好的沟通以及协调能力，团队意识强;9、主动学习，有想法，有激情，有责任心，积极接受挑战，勇于行业、场景拓新。","数据服务,软件开发",50-150人,go,深圳
