job_name,job_url,job_location,job_salary,job_company,job_experience,job_class,job_given,job_detail,company_type,company_person,search_key,city
Spark高级开发,https://www.lagou.com/jobs/6868931.html,高新区,20k-30k,多点新鲜（北京）电子商务有限公司,3-5年,本科,新兴行业 大牛云集 年轻有活力 福利多多,岗位描述1、负责多点大数据平台的Spark技术研发、问题诊断和性能优化等；2、基于Spark构建数据中台；3、乐于挑战没有明显答案的问题，快速理解业务场景，从具体问题中抽象出通用的解决方案；4、研究业界最新的大数据技术并能快速提出基于公司现状的针对性解决方案；岗位要求1、计算机或相关专业本科以上，3年以上大数据工作经验；2、熟悉Spark、Spark SQL和Spark Streaming内核原理，有社区贡献者优先；3、做事严谨踏实，责任心强，具有良好的沟通能力和团队意识；,移动互联网,500-2000人,spark,成都
核心Java开发工程师,https://www.lagou.com/jobs/6851178.html,高新区,12k-20k,四川众鹏科技有限公司,5-10年,本科,"六险一金,年底双薪,节日福利,年度体检",岗位职责：1.     负责/参与产品或者项目的架构设计、重构、优化及产品间的接口设计。2.     负责项目关键模块的详细设计，并开发实现。3.     负责/参与项目原型设计。4.     完成软件产品在测试、运行过程中出现问题的分析、修正。5.     组织小组成员完成开发工作。 任职要求：1.     本科及以上，计算机相关专业，3年以上java开发经验。2.     熟悉主流开源框架spring boot、spring cloud；storm/spark/ELK；且至少在一个项目中深入应用。3.     具备良好的数据结构基础，有扎实的Java程序设计与编码功底，对面向对象思想有深入理解。4.     熟悉JVM原理及运行机制，能根据实际情况对JVM进行定制优化。5.     深入掌握JAVA软件开发技术，具备中小型项目的分解能力，并能指导初级工程师完成技术工作。6.     能熟练使用vue前端框架7.     熟悉软件设计与开发流程，熟悉Axure、PowerDesigner等设计管理工具。8.     熟悉Memcached、Redis、MongoDB等常用NoSQL解决方案、了解各自的优缺点以及使用场景者优先；,"移动互联网,消费生活",15-50人,spark,成都
技术总监,https://www.lagou.com/jobs/7046657.html,高新区,20k-25k,成都律军风险管理股份有限公司,5-10年,本科,律师互联网行业领跑者、六险一金、扁平管理,岗位名称：技术总监一、岗位职责1、根据公司业务需求和规划，全面负责制定和实现公司的技术框架，负责产品技术方案的规划开发、相应应用架构/技术架构的设计、持续优化和管理；2、负责主导技术管理、技术开发等相关制度规范体系的建立和实施，并不断持续优化，完成技术方案的撰写与审核；3、带领并参与团队开发，为项目制定可靠的执行计划，完成公司既定目标；负责整个项目的系统规划、项目细分，并制定项目任务和项目进度表； 4、能独立完成整个项目核心框架的设计，及核心代码的编写；5、负责公司B端平台、C端产品的技术架构方案的规划，以及对同行业技术产品进行调研以提高产品技术竞争力；6、对公司技术团队的梯队建设及管理，包括专业培训、职业化培养、业绩评估及激励，全面提升团队的技术水平。二、任职要求1、统招本科学历，8年以上Java研发和软件设计经验，具有3年以上管理经验，管理过10人以上研发团队经验优先，有金融行业背景者优先；2、具有丰富的项目管理、架构设计、产品研发、运维管理及项目开发团队管理经验；3、精通springcloud、devops、hadoop，spark/Flink、jvm性能调优，熟练掌握分布式缓存redis，ELK，能熟练使用sql语言，并能进行性能优化；能对分布式常用技术进行合理应用并解决问题；4、擅长大型分布式微服务架构与分布式事务的解决方案、IM 架构、Java 技术栈、golang技术栈等；5、有强烈的创业精神、有较强的团队协作能力以及快速解决问题的能力；6、有较强的沟通交流能力，能领会公司战略意图，并快速准确转化为IT实施落实；7、了解信息安全，并落实公司信息安全管理措施落地。工作地点：成都市高新区天府软件园Ｅ2-1-12层,"金融,其他",50-150人,spark,成都
【WMPS】广告算法工程师-成都,https://www.lagou.com/jobs/6904741.html,高新区,20k-40k,北京三快在线科技有限公司,3-5年,本科,五险一金、免费班车,,消费生活,2000人以上,spark,成都
【WMPS】数据开发工程师,https://www.lagou.com/jobs/6806062.html,高新区,18k-35k,北京三快在线科技有限公司,3-5年,本科,五险一金、免费班车,,消费生活,2000人以上,spark,成都
智慧零售高级后台研发工程师（成都）,https://www.lagou.com/jobs/6427314.html,高新区,20k-40k,腾讯科技（深圳）有限公司,5-10年,不限,业务高增大、大牛多、发挥空间大、福利津贴,工作要求：1、计算机相关专业本科以上学历；3年以上研发类工作经验； 2、熟悉Linux网络编程，精通Java或者Go语言，精通Mysql数据库优化；3、深刻理解面向对象开发，具有较好的系统分析设计能力、文档撰写能力； 4、具备大型分布式系统后台研发或有电商交易平台开发经验者优先；5、具备Hadoop&Spark进行海量数据分析经验者优先；6、积极进取、诚实正直、责任心强，有较好的沟通能力。工作职责：1、负责腾讯云面向智慧零售行业的产品与服务的系统研发工作； 2、负责腾讯云面向智慧零售行业的技术解决方案的研发落地工作； 3、负责腾讯云面向智慧零售行业的系统稳定性保障以及性能调优等工作。,社交,2000人以上,spark,成都
政务大数据交付架构师（成都）,https://www.lagou.com/jobs/6957817.html,高新区,25k-50k,腾讯科技（深圳）有限公司,5-10年,本科,大牛团队,职责：政务大数据处理平台的架构设计和技术选型； 大数据处理平台实施方案的设计和规划； 技术难点攻坚； 项目整体进度的把控和风险控制； 培训及知识转移。岗位要求：计算机、数学等专业本科或以上学历，5年及以上大数据相关工作经验； 对hadoop生态、实时计算框架非常熟悉，具备集群搭建、维护、监控能力； 熟悉Flume、Kafka、Storm、Spark、impala、Hive、Elasticsearch、Hbase等大数据技术至少精通其中三项以上； 具备大数据平台性能分析、debug、排障能力； 有大数据平台的数据流处理、监控经验优先； 至少实践过1个大数据平台建设项目，平台数据量不小于20T； 具有百台以上大数据集群架构经验者优先，具有集群与集群之间数据交换经验者优先，具有政务行业大数据项目经验者优先。,社交,2000人以上,spark,成都
新媒体内容运营专员,https://www.lagou.com/jobs/6806564.html,高新区,4k-7k,BNEING INTERACTIVE PTY LTD,1年以下,大专,海龟、国际范、扁平、发展空间、双休！,"Chinese Content Specialist   A passionate, high-energy social media producer to write, design and create branded content. You will be helping to build exciting content for Australian brands and their audiences on their social media (namely Weibo and WeChat). The successful candidate will have a core skill-set in writing and developing story ideas, with additional capabilities in content planning and strategies (how to make awesome content plans).OUTLINE OF THE ROLE 1、Working together with project owner and AM to develop monthly content plans.2、Develop creative ideas relevant for both brands and social media audiences.3、Content ideas will be a mix of text (stories), images (photos & infographics) and videos .4、You will also play a lead role in writing, editing and producing the content (stories).5、Successfully launch content (stories/images) on social media such as Weibo & WeChat.YOUR SKILLS1、Great Chinese writing skills.2、The ability to both write great original stories and edit, refine and sometimes translate.3、Have strong feel for what stories, topics and themes spark interest with audiences on social media.4、Multi-media design & creative skills (eg. graphic design etc).5、Understanding for how social contents/creatives work and are consumed.6、Strong eye for creative/design (especially in how the creative relates to a specific brand).7、A good understanding for the Chinese social media landscape.新媒体内容运营专员精通写作、视觉排版，擅长生产品牌内容的新媒体制作人。帮助澳洲品牌客户在微信和微博上制作高质量的新媒体内容。期望你的核心技能包括优秀的写作和故事叙述技巧，优秀的内容策划能力。岗位职责1、与策略和AM一起制定月度内容计划。2、能生产创意点子，满足品牌和受众的需要。3、内容构思可以结合文字（故事），图片（照片和信息图）与视频。4、主导内容的写作、编辑和制作。5、内容的按时分发。要求技能1、优秀的写作技能。2、能撰写原创故事，也能编辑润色。一定的英中翻译能力。3、对什么样的故事、话题能引爆读者的兴趣有强烈的认知。4、优秀的视觉和排版技能。5、了解新媒体内容和创意的分发、运营和消费机制。6、具备良好的审美，能识别品牌的调性。7、了解中文新媒体的发展趋势。","社交,广告营销",15-50人,spark,成都
1121WN-应用架构专家,https://www.lagou.com/jobs/6683679.html,锦江区,15k-30k,平安科技（深圳）有限公司,5-10年,本科,"五险一金,节日福利,带薪年假",,金融,2000人以上,spark,成都
大数据测试工程师,https://www.lagou.com/jobs/6679673.html,高新区,8k-15k,杭州初灵信息技术股份有限公司,3-5年,本科,"周末双休,年终奖金,五险一金,弹性工作",岗位职责：1，设计和编写测试用例，组织测试用例评审；2，基于Linux的测试环境，执行测试用例，并定位bug和对修复结果负责；3，负责大数据hadoop，spark，hive，flink等相关大数据产品的测试工作； 3，负责大数据项目及产品上线测试，挖掘并跟进实施性能测试，稳定性等专项测试，保障和提升产品质量；4，根据测试需要，开发测试脚本，进行自动化测试；5，完成测试项目归纳及总结文档。岗位要求：1，本科以上学历，计算机等相关专业；2，2年以上测试相关经验；3，熟悉大数据相关组件，包括spark hive hbase等，有spark，hive等调优经验者优先；3，熟悉软件测试理论和流程；4，熟悉Linux系统安装操作，能独立进行相关大数据组件部署；5，有python，java编写及自动化测试工具开发经验者优先； 6，有通信领域测试经验者优先；7，具备良好的团队合作精神，善于协调沟通。,"移动互联网,数据服务",500-2000人,spark,成都
大数据开发工程师,https://www.lagou.com/jobs/6679720.html,高新区,10k-20k,杭州初灵信息技术股份有限公司,1-3年,本科,"周末双休,年终奖金,五险一金,弹性工作",岗位职责：1、负责大数据相关技术研究，解决海量数据不断增长面临的挑战；2、负责海量数据的处理、分析、挖掘和存储；3、大数据挖掘计算平台集群管理、部署、优化、排错；4、大数据分析项目的软件开发、维护、架构设计，文档编写等工作；任职要求：1、计算机相关专业本科及以上学历；2、有扎实的Java语言基础，熟悉JVM运行机制和内存管理，熟悉Scala语言者为佳；3、熟悉HHadoop 2.0以上版本体系结构、各个模块的功能，对Hadoop生态圈有较全面了解，同时具有源码级开发经验；4、对Hive、HBase、Map/Reduce、Spark有深入了解，能熟练编写Map/Reduce程序和Spark程序；5、熟悉Hadoop运行监控及调优技术；6、具备机器学习算法理论基础，如分类、聚类、推荐、关联规则，具备相关项目经验为佳；7、有互联网公司或海量数据处理工作经验，数据分析和挖掘经验者优先;,"移动互联网,数据服务",500-2000人,spark,成都
资深Java开发工程师（成都）,https://www.lagou.com/jobs/6979606.html,武侯区,15k-30k,神策网络科技（北京）有限公司,3-5年,本科,"技术大牛,行业前景好",工作职责:1、负责神策大数据产品 Web 后端的架构设计和开发工作；2、维护和升级现有技术框架，保证系统的稳定性和性能；3、理解大数据分析产品业务需求，负责新功能的技术开发；4、团队合作，参与大数据导入、存储与查询方向的技术调研和技术攻关。 岗位要求:1、计算机或相关专业毕业，本科及以上学历，1 年以上 Web 开发经验；2、精通 Java 语言，具有扎实的计算机技术基础和良好的编程习惯；3、熟悉 Spring/MyBatis/Netty/Nginx 等 Web 开源技术和框架；4、精通数据库设计（MySQL优先），优秀的SQL编写及调优能力，熟悉常见NoSQL存储，如Hbase/Kudu/Redis/Mongodb等；5、了解 Hadoop/Hive/Spark/Impala 等开源大数据技术优先；6、善于学习新知识，主动性强；7、良好的团队合作精神，较强的沟通能力。,数据服务,150-500人,spark,成都
Java后端工程师（非游戏）,https://www.lagou.com/jobs/7115647.html,高新区,10k-15k,成都止观互娱科技有限公司,3-5年,本科,"多次调薪,团体健身卡,六险一金,婚育礼金","岗位职责：1、参与架构设计、方案讨论和技术调研；2、负责公司投放平台和数据平台框架和核心代码开发；3、参与日常开发和测试工作，解决开发中的技术问题。任职要求：1、计算机相关专业本科及以上学历，3年及以上java开发经验；2、熟练掌握Spring,Spring-mvc，Spring boot ,Spring cloud，Mybatis等开源框架,熟悉源码加分项；3、熟练掌握关系数据库Mysql,熟练编写Sql,熟悉常见的Sql优化技巧,熟练使用Redis,熟悉Kafka,Zookeeper；4、熟悉JVM,了解GC算法,熟悉JAVA内存模型；5、对多线程、事务有丰富的实战经验,对任务调度方案有自己的见解；6、熟悉Linux.能进行基本的服务部署以及线上问题处理；7、有大数据经验如:Hadoop生态,Spark 等优先；8、对技术有激情，能独立完成单个项目的设计以及实现,能快速接受和掌握新技术，有较强的独立、主动的学习能力，良好的沟通表达和团队协作能力。","移动互联网,游戏",50-150人,spark,成都
JAVA开发工程师,https://www.lagou.com/jobs/4210469.html,高新区,10k-17k,上海海万信息科技股份有限公司,3-5年,本科,"节日礼金,年底奖金,体检旅游,带薪年假",1. 参与数据相关的软件开发工作，开发数据可视化工具，负责核心模块的设计和编码相关工作；2. 了解业界最新技术以及应用，解决研发过程中的关键问题和技术难点；3. 根据任务按时完成编码工作和单元测试工作，保证产品的质量；4. 按照开发流程编写相应的模块设计文档；5. 与产品经理、测试工程师和其他团队沟通协作，保证产品研发的进度和质量。 任职资格：1. 全日制本科及以上学历，3年以上Java开发经验；2.熟练使用Java相关技术和框架（包括Java语言基础/多线程/SpringBoot/SpringCloud/myBatis等）；3. 熟悉MySQL数据库编程，对数据库的规划、设计、优化有一定的经验；4. 掌握常用的设计模式；5. 遵守开发编码规范，有良好的编程风格。6.最好有大数据开发经验，有Hadoop、Hbase、Hive、Spark、Flink等大数据技术的相关开发经验，最好是有ETL（包含Sqoop、flume等实际使用）和数据仓库相关的经验~,"移动互联网,金融",500-2000人,spark,成都
推荐算法工程师 (MJ000111),https://www.lagou.com/jobs/6961268.html,武侯区,15k-25k,深圳市慧择时代科技有限公司,3-5年,本科,上市公司，六险一金，周末双休，业务前景,工作内容：1.参与保险相关业务场景的推荐、精准营销相关的算法研发和优化工作，包括但不限于算法理解、实现、优化等。2.参与用户画像建设、特征工程建设工作。3.业务上线后需持续跟踪运营效果并进行算法指标的持续优化达到预期标准。任职要求：1.计算机相关专业本科及以上，2年及以上算法相关实际工作经验；2.熟悉逻辑回归、决策树、神经网络等，并且有实际的上线项目经验；3.至少熟悉一类深度神经网络模型，如DNN、CNN、RNN等；4.熟练使用至少一种深度学习开源框架，如tensorflow，pythorch，keras等；5.熟练使用Python、java、C++等编程语言；6.熟悉推荐系统架构，上下游调用逻辑；7.具备大数据编程和处理能力，如hive、spark等；8.具备持续的专利输出能力；9、目标导向，数据驱动，善于结合具体业务场景，分析与解决有挑战性的问题；有以下经验者优先：1.在精准营销领域有丰富算法工作经验者优先；2.有用户画像、特征工程等经验优先。3.有保险行业推荐算法从业经验优先。,"移动互联网,电商",500-2000人,spark,成都
运维工程师（大数据方向）,https://www.lagou.com/jobs/4965683.html,高新区,15k-30k,成都路行通信息技术有限公司,3-5年,本科,扁平化管理 员工餐厅 大平台,岗位职责：1.负责大数据集群的搭建、维护、监控、异常处理等工作，保障集群稳定运行；2.负责大数据集群的用户管理、权限管理、资源管理、性能优化、自动化运维等；4.深入理解大数据平台架构，发现并解决重大故障及性能瓶颈；5.跟进大数据前沿技术，不断优化大数据集群；  岗位要求：1.本科以上学历，至少2.5年大数据运维经验；2.有良好的计算机和网络基础，熟悉linux文件系统、内核、性能调优，TCP/IP、HTTP等协议；3.具备中级运维架构能力，熟悉不同场景下的CAP理论的应用，可对业务从热点/单点、缓存、高可用、熔断策略、服务降级、发布策略、监控、安全、备份等进行基础的架构分析或进行运维架构设计，能胜任大数据10+节点的运维工作；4.熟悉大数据生态中的常用组件，掌握HDFS、Hbase、yarn、Spark、Kafka的底层结构、数据流向并有2.5年以上的生产环境操作经验，能够结合以上知识、既往经验做到对平台问题的发掘、分析及解决；5.独立的性能优化能力，涉及hbase、hdfs、kafka的经验；6.熟练使用python、java或go等语言开发相关运维管理工具；7.良好的英文阅读能力和文档撰写习惯；,"移动互联网,消费生活",500-2000人,spark,成都
大数据运维,https://www.lagou.com/jobs/7077277.html,高新区,20k-40k,成都路行通信息技术有限公司,5-10年,本科,车联网 新零售 高速发展平台,岗位职责：1.负责大数据集群的搭建、维护、监控、异常处理等工作，保障集群稳定运行；2.负责大数据集群的用户管理、权限管理、资源管理、性能优化、自动化运维等；4.深入理解大数据平台架构，发现并解决重大故障及性能瓶颈；5.跟进大数据前沿技术，不断优化大数据集群；  岗位要求：1.本科以上学历，至少2.5年大数据运维经验；2.有良好的计算机和网络基础，熟悉linux文件系统、内核、性能调优，TCP/IP、HTTP等协议；3.具备中级运维架构能力，熟悉不同场景下的CAP理论的应用，可对业务从热点/单点、缓存、高可用、熔断策略、服务降级、发布策略、监控、安全、备份等进行基础的架构分析或进行运维架构设计，能胜任大数据25+节点的运维工作；4.熟悉大数据生态中的常用组件，掌握HDFS、Hbase、yarn、Spark、Kafka的底层结构、数据流向并有2.5年以上的生产环境操作经验，能够结合以上知识、既往经验做到对平台问题的发掘、分析及解决；5.独立的性能优化能力，涉及hbase、hdfs、kafka的经验；6.熟练使用python、java或go等语言开发相关运维管理工具；7.良好的英文阅读能力和文档撰写习惯；硬性要求：大数据平台运维经验、大数据技术知识,"移动互联网,消费生活",500-2000人,spark,成都
算法工程师,https://www.lagou.com/jobs/6378081.html,武侯区,15k-25k,成都顶呱呱投资集团有限公司,5-10年,大专,"大平台,双休,包吃,非外包","岗位职责:1.公司资源项目的数据整理与分析,通过数据分析、调研等手段解决业务问题;2、负责公司相关项目中模型搭建,提高模型准确率与效率3、通过对用户行为数据的挖掘，对用户进行建模，精准刻画用户各种属性；4、运用推荐算法分析客户对不同产品的响应倾向，提高营销的效率，实现精准营销任职资格:1、具有3年及以上的python数据分析/数据挖掘模型开发或运营经验，数据、统计、计算机等相关专业优先;2、具有扎实的统计学基础,并有较强的机器学习建模能力,有基于企业大数据建模经验,并有成功项目案例者优先;3、精通python语言,熟悉基本的数据挖掘模型,如回归,决策树,聚类,GBDT等算法模型; 熟练Java，Scala语言4、熟练使用Pandas、Numpy、Matplotlib等数据分析工具；熟悉tensorflow，keras等级深度学习框架;5、熟悉Hive、Hadoop、Spark等大数据工具；6、强烈的责任心，工作细致，有条理，善于学习，具有良好的团队合作精神，能够承担一定的工作压力；积极向上的工作态度，对数据敏感，热爱数据分析工作;7、有用户画像、推荐系统、分配、派单、深度学习成功项目经验；",金融,2000人以上,spark,成都
大数据架构师,https://www.lagou.com/jobs/7064016.html,高新区,15k-25k,成都中科大旗软件股份有限公司,3-5年,本科,福利待遇丰富，发展前景广阔,"岗位职责1、负责公司大数据平台的设计和开发，hadoop、flink、spark、图数据库、时序数据库等云计算平台的开发和优化，制定数据架构规范，指导团队落地；2、负责数据基础架构和数据处理体系的升级和优化，不断提升系统的稳定性和效率，为公司的业务提供大数据底层平台的支持和保证；3、系统核心部分代码编写、指导和培训工程师、不断进行系统优化；4、负责技术选型，对数据应用提供数据存储、查询引擎、实时计算、元数据管理的架构设计；5、研究未来大数据的发展方向、数据模型和计算框架的创新与落地，包括但不限于以下领域：大规模数据实时化、模型算子算法,参与制定并实践团队的技术发展路线；任职资格1、精通Hadoop、spark、flink生态相关技术及架构原理，有5年以上使用经验；2、精通图数据库、时序数据库中的至少一种；3、有作为技术负责人海量数据平台研发的成功案例；4、熟悉目前正在发展的大数据分布式平台前沿技术的应用；包括但不仅仅限于：hadoop、storm、spark、flink等；5、良好的沟通能力，作为技术负责人能指导研发落地；6、具有一定的项目规划和决策能力，善于捕捉业务需求、架构设计存在的问题，并给出有效的解决措施和方法；7、精通java、scala、python任意两门编程语言，对大数据基础架构和平台底层原理有深度理解和丰富开发经验, 对复杂系统的性能优化和稳定性提升有一线实战经验，具备相关产品（Hadoop、Hive、HBase、Kafka、MapReduce、Spark、Flink等）项目应用研发经验；8、对开源社区有贡献者优先。","旅游,软件开发",150-500人,spark,成都
大数据运维工程师,https://www.lagou.com/jobs/7063913.html,高新区,12k-15k,成都中科大旗软件股份有限公司,3-5年,本科,福利待遇丰富，发展前景广阔,"岗位职责：1.负责公司大数据基础平台的运维,保障平台的稳定可用；2.负责大数据云平台、混合云部署及运维；3.负责大数据应用产品部署、上线及维护；4.负责大数据平台资源管理、性能优化和故障处理；5.深入研究大数据业务相关运维技术，持续优化集群服务架构;6.参与设计大数据自动化运维、监控、故障处理工具。任职要求1.至少3年以上大数据平台的运维经验；2.掌握Hadoop/YARN、Hive、Spark、Kafka、ES、flink、Clickhouse、kudu、impala、flume、kylin、hbase的原理/部署/维护/调优，至少非常熟悉其中3-4种组件3.熟悉CDH发行版或hadoop社区版，有实际部署、维护及优化经验；4.掌握Linux系统环境的配置和优化，熟练部署各种应用服务，独立处理系统故障；5.至少掌握Shell/Python/Java/scala语言的一种；6.强烈的责任心，执行力强，富有团队合作精神；7.对大数据和自动化运维开发有浓厚兴趣，有大规模hadoop集群、ES集群或流平台运维经验者优先；8.精通Hadoop、spark、HIve等相关组件配置优化者优先；9.熟悉虚拟机与虚容器技术，能熟练搭建和使用docker和kubernetes者优先。","旅游,软件开发",150-500人,spark,成都
