job_name,job_url,job_location,job_salary,job_company,job_experience,job_class,job_given,job_detail,company_type,company_person,search_key,city
高级ios工程师,https://www.lagou.com/jobs/7211731.html,工业园区,20k-30k,苏州奖多多科技有限公司,5-10年,大专,双休 五险一金全额缴纳 年假15天,"岗位职责：1.根据业务和技术需求，进行ios平台应用程序开发, 并有能力承担部分管理工作2.负责移动端技术分析和设计工作，解决技术难题和技术攻关突破3.针对复杂业务进行架构和重构编码，设计有效的技术方案并推动提高业务交付效率4.通过输出解决方案和流程规则持续改进应用性能和工程质量和交付效率5.完成领导交代的其他任务。任职资格： 1.三年及以上ios实际开发经验2.熟练掌握ios应用开发和架构，熟悉平台API、网络/交互/存储/多线程/性能优化等开发内容3.有多个完整的ios项目经验，至少参加过一个完整的商业级手机应用开发项目4.良好的沟通能力，对业务类和技术类的需求委托有清晰的理解并通过技术促进业务发展5.有管理经验优先","移动互联网,消费生活",150-500人,ios,苏州
ios开发工程师,https://www.lagou.com/jobs/7132042.html,工业园区,5k-8k,苏州奖多多科技有限公司,应届毕业生,不限,双休 五险一金全额缴纳 年假15天,工作内容：1.完成开发组长安排的需求开发内容； 2.对代码进行文档管理； 3.负责单元测试的编写和小号上包； 任职要求：1.本科级以上，计算机、通信专业等相关专业； 2.了解objective-c语言和swift语言，了解xcode的使用； 3.有扎实的计算机专业基础，有实习经验的优先考虑。,"移动互联网,消费生活",150-500人,ios,苏州
ios开发工程师,https://www.lagou.com/jobs/7209970.html,工业园区,15k-25k,智慧芽信息科技（苏州）有限公司,3-5年,本科,管理偏平、老板NICE、上班不打卡,工作职责：1、 负责智慧芽视频APP产品的功能特性开发工作；2、探索各项跨平台技术，在App开发中落地方案，进行相关架构和规范建设；3、持续改进跨平台技术的效率、性能、安全性、稳定性和可扩展性；4、设计和建设相关脚手架、打包发布等配套工具平台。任职要求：1、本科及以上学历，3年及以上移动原生APP开发经验；2、深刻理解React Native/Flutter/Hybrid至少一种方案，对相应方案的性能/稳定性/交互体验/原生扩展/脚手架工具，具备优化和建设能力；3、精通JavaScript/Dart/CSS/HTML至少一种语言，有相应跨平台产品或Demo者优先；4、计算机相关知识基础扎实，有良好的工程代码规范，具备一定业务/架构设计能力；5、热爱移动大前端，思维敏捷，较强的自学能力，对新兴技术敏感，有实战项目经验。6、带过移动开发团队优先,移动互联网,150-500人,ios,苏州
Android/IOS开发工程师,https://www.lagou.com/jobs/6685561.html,工业园区,20k-40k,微软（中国）有限公司,不限,本科,职级开放，****,The Outlook Mobile team 1． mobile developer （IOS/Android），要求做mobile的简易的project test，考基础的算法和coding. 但是英语只要求读写，口语不做要求，当然口语好的话肯定更加积分。2．接受Web/Frontend Dev，Backend dev背景的的人选来做mobile的工作。不会去考project test，但是需要英语有较好的口语沟通能力。,"移动互联网,数据服务",2000人以上,ios,苏州
ios开发工程师,https://www.lagou.com/jobs/6618216.html,工业园区,10k-15k,苏州阿基米德网络科技有限公司,3-5年,本科,弹性工作不打卡 福利待遇优越,岗位职责：1、负责建立iOS智能平台客户端软件的开发框架；2、根据产品需求和开发规范，负责iOS客户端软件设计、编码和测试；3、负责在开发过程中相关的技术规范文档的编写工作；4、负责iOS App通用组件的开发和封装；5、负责相关前沿技术研究和产品预研，参与移动平台软件框架的研究，关键技术验证和选型等工作。任职要求：1、两年以上iOS开发经验，有APP实际作品；2、具备扎实的 Objective C、Swift基础，使用过Swift进行实际的开发工作；3、熟悉iOS开发中常用的第三方库4、熟悉SVN或Git等相关的代码管理工具；5、工作认真负责，有良好的组织纪律和团队合作精神，乐于分享，沟通能力好。6、加分项：熟悉Flutter或者React Native的使用,移动互联网,15-50人,ios,苏州
ios开发工程师,https://www.lagou.com/jobs/7181375.html,相城区,10k-15k,苏州博智电子科技有限公司,3-5年,本科,年终奖、项目奖金、不打卡、领导nice,"职位描述：1、负责公司APP的性能优化以及架构设计；2、负责公司APP在苹果设备上的适配、调试和功能开发；3、根据产品需求完成软件实现，并配合测试、运营等其他部门，提供产品相关技术支持；4、参与与服务器交互的设计，参与产品的讨论。岗位要求：1、本科学历以上，计算机科学或相关专业，3年以上APP开发经验；2、可以独立承担架构设计，独立负责iOS产品开发（有上架应用者优先）；3、熟悉Objectivec及Swift开发语言，iOS SDK ,Objective-C开发语言，熟练掌握Xcode等相关开发工具,熟悉c/c++，熟悉常见的设计模式和数据结构，熟练掌握多线程；4、对IOS的基础架构、组件、性能优化、内存优化有深刻了解；5、熟悉IOS平台网络开发，HTTP及Socket网络通讯、JSON解析等技术，熟悉数据加密方法；6、熟练掌握UI设计、布局和实现，具有屏幕适配和iOS系统兼容的经验，熟练掌握UI设计、自定义控件、storyboard和xib等；7、熟悉iOS的发布流程，熟悉使用svn、git等相关的代码管理工具；8、熟悉MVC，MVVM设计思想；9、熟悉各个版本IOS系统的特性能及时适配系统。10、熟悉iOS前端与后台通信机制、内存管理、JSON数据传输和http协议；11、对iOS下的多线程编程、网络编程、内存管理、GUI开发、消息通讯机制有深刻认识;12、精通IOS平台下的多线程开发，了解音视频相关开发;13、熟练掌握常用的第三方库，如SDWebImage、Masonry、MJRefresh、AFNetWorking等;14、有良好的数据结构及算法基础功底、熟悉多线程编程和网络编程；15、对新技术保持热情，具有良好的分析、解决问题的能力；基本信息：1、可在家办公，每周到公司2-3天，其余时间均可在家办公2、试用期：3个月，入职缴纳社保公积金3、年终奖","移动互联网,电商",15-50人,ios,苏州
高级iOS开发工程师,https://www.lagou.com/jobs/5705786.html,工业园区,15k-20k,苏州排忧网络技术有限责任公司,3-5年,不限,弹性工时，扁平化管理，自由舒适，五险一金,"[工作职责] 
 负责公司iOS移动端产品的研发，编写高质量的代码；
 配合苹果审核团队，具有良好的英文沟通技巧；
 和产品经理配合，深度参与产品需求讨论，功能定义等；
 根据开发过程中的体验对产品提出改进建议；
[职责要求] 
 两年以上 iOS 开发经验，有主导iOS应用开发及发布经验； 
 有强烈的求知欲和进取心，对新技术有持续的热情；
 有良好的交流沟通能力 。
 具有扎实的编程工底，良好的设计能力和编程习惯； 
 熟练掌握 Swift, 熟悉 iOS ； 
 能独立开发 iOS App ； 
 学习能力强，具有良好的团队合作精神。",移动互联网,15-50人,ios,苏州
iOS工程师,https://www.lagou.com/jobs/3402794.html,工业园区,8k-13k,苏州伊品众网络科技有限公司,1-3年,大专,五险一金，周末双休，带薪年假，年终奖,"岗位职责：1、主要负责 iOS应用程序的设计、开发工作2、基于公司的产品设计，根据需求，进行 iOS 版本应用的实现3、独立完成 iOS软件开发、验证和修正测试中发现的问题4、对iOS平台开发技术进行研究，根据开发过程中的体验对产品提出改进建议 任职资格：1、熟悉 iOS 开发，能够独立完成 iOS 项目开发 2、熟练掌握 Objective-C 编程,具有扎实的 C/C++编程基础 3、熟练掌握 MRC&ARC 内存管理机制以及应用性能优化 4、熟练掌握网络处理,熟练使用 NSURLConnection&NSURLSession,熟练使用 AFN 等第三 方网络框架 5、熟练掌握 JSON&XML 数据解析和 GET/POST 数据请求等操作 6、熟练使用 SQLite 嵌入式数据库,进行常见的 CRUD 操作，熟练使用 CoreData 进行数 据存储，以及数据库表结构设计 7、熟练使用 GCD、NSOperation、NSThread 多线程编程 8、熟练掌握屏幕适配, 熟练使用 AutoLayout 页面布局 9、精通 KVC,KVO,通知等核心机制以及 MVC、代理、单例、观察者等设计模式 10、熟练使用 Instruments 工具对应用进行性能优化，熟悉 UITableView 的性能提升  11、熟练使用 cocoapods 管理第三方资源库，熟悉应用开发规范 12、熟悉应用上架流程，熟悉 App Store 应用审核规则 13、对数据结构、基本算法熟练掌握,并具备基本的算法设计能力 14、具有丰富的 BUG 调试经验和性能调优经验,熟练使用各种性能分析工具",移动互联网,15-50人,ios,苏州
iOS Software Engineer,https://www.lagou.com/jobs/7035732.html,工业园区,15k-25k,诺仕科技（苏州）有限公司,3-5年,本科,年底双薪 带薪年假 午餐补助 五险一金,"Minimum Qualifications-Bachelor’s degree in Computer Science, Information Systems or related field preferred, or equivalent experience with prior related work experience.-3 years’ of software development, programming and analytical experience-Ability to analyze requirements, provide feedback, create detailed design specifications, and perform required design work-Ability to analyze and recommend solutions to programming issues, defects and bugs as assigned or encountered-Ability to manage multiple priorities and meet deadlines in a fast paced environment with limited supervision-Experience integrating to hardware APIs / SDKs-Experience with git (GitLab especially)-Effective communications and interpersonal skills-Excellent organizational skills-Ability to maintain confidentiality-Ability to work independently, but with a team focus-Must be able to effectively communicate in English with remote team across time zonesRequired -iOS development experience using SWIFT-Experience building UI’s in Xcode and Interface Builder-Knowledge and demonstrable apps built on the current iOS platform-Strong understanding of multi-tier architecture, design patterns (MVC) and good engineering practices Functions-Work as a member of a globally distributed software development team-Write and maintain developer test suite of unit and integration tests-Work with QA and BA to ensure finished product meets all requirements-Deliver across the entire app life cycle –concept, design, build, deploy, test, release to app stores and support-Keep up to date on iOS industry trends and mobile technologies-Be able to communicate well with technical and non-technical members of the team-Participate in team code reviews to ensure quality is maintained","电商,金融",500-2000人,ios,苏州
Web/安卓/iOS苹果APP测试开发工程师,https://www.lagou.com/jobs/6760878.html,工业园区,10k-15k,龙测科技（北京）有限公司,1-3年,本科,福利待遇优、有丰厚奖金,描述：1. 负责写安卓/苹果APP的功能测试用例代码2. 执行与维护测试代码，并形成测试报告要求:1. 计算机或相关专业本科及以上学历2. 有写安卓/苹果APP测试代码半年到1年经验3. 熟悉至少一个测试框架如uiautomator，Robotium，Appium等4. 熟练掌握Java/Python开发语言工作认真负责能独立完成上级交付的任务,移动互联网,少于15人,ios,苏州
ios开发工程师,https://www.lagou.com/jobs/7002442.html,吴中区,10k-15k,苏州共创方程式企业管理有限公司,3-5年,本科,双休、五险一金、大平台、福利好、假期长,"职位名称：IOS开发工程师岗位职责： 1. 负责核心产品ios研发工作。2. 能独立负责APP项目开发。熟悉常用的数据传输格式，加密，解析3. 规范文档的编写、维护，以及其他与项目相关工作；3. 配合后台同事制定APP与服务器后台数据接口4. 优化代码实现，提高产品性能岗位要求： 1. 三年以上IOS平台的开发经验；2. 精通Objective-C及各种IOS开发技能，具备熟练的系统设计经验，具备一定的大局观，能够从整体上考虑设计问题；3. 熟悉设计模式，有良好的面向对象编程思维，思路清晰、善于思考；4. 熟练掌握视频直播涉及到的技术，流媒体服务器 nginx+rtmp、音视频采集 AVFoundation、滤镜美颜处理 GPUImage、编码解码 VideoToolbox、AudioToolbox,推流 LFLiveKit/ffmpeg、拉流播放 ijkplayer5. 熟练使用 Realm、SQLite、CoreData 等数据存储技术6. 熟练打包.a 静态库和.framework 动/静态库、pod 库自动化7. 熟练代理、单例、KVO、MVC、KVC 和工厂等常用设计模式!8. 熟练掌握NSThread、NSOperation、GCD等多线程技术9. 工作严谨认真，能承受工作压力；10. 富有激情，学习能力强，有较强的沟通能力和强烈的责任心；★薪酬福利★①大平台，有机会成为核心骨干（公司人数1000+）②福利好，五险一金，季度奖/年终奖，国外游，节日福利，超长带薪年假等③培训及机会多（公司有在线学习平台，免费开放学习权限）④团队氛围好，解决单身问题几率高(公司90后为主，待婚嫁资源佳）⑤工作环境优越(超大办公面积，活动设施一应俱全，多种业余活动俱乐部等）",教育,500-2000人,ios,苏州
ios开发工程师,https://www.lagou.com/jobs/6579654.html,工业园区,10k-20k,苏州东湾信息科技有限公司,1-3年,本科,外企待遇,iOS高级工程师（拒绝996，外企工作方式）1-3年职位职责：1、负责iOS端项目的技术调研，架构设计以及相应的开发工作2、负责项目重构，代码review，性能优化，质量把控等3、有效分析并解决项目开发中的问题， 严格执行和推行开发规范任职要求：1、全日制统招本科及以上学历，计算机相关专业2、1-3年iOS开发经验，熟悉Swift，Objective C语言开发3、具有优秀的代码设计书写能力，对软件开发有较深的理解4、重视项目相关文档的作用，以及能够用英文进行良好表达的能力5、对工作具有认真负责的态度，具备持续优化的能力6、能够从用户角度出发，具备一定的产品思维7、具有良好的沟通以及表达能力和团队合作精神，抗压能力强 9、英语4级以上，6级通过者优先,"移动互联网,企业服务",50-150人,ios,苏州
高级ios开发工程师,https://www.lagou.com/jobs/6745152.html,工业园区,10k-15k,江苏匡集工业科技有限公司,3-5年,本科,五险 带薪年假 双休 年终奖,岗位要求：1. 本科及以上学历，3-5年以上ios开发经验（特别优秀也可以考虑）2. 对面向对象程序设计思想有深刻的理解； 3. 精通Objective-C程序设计，精通iOS SDK及相关开发工具； 4. 精通iOS框架及各种特性，熟练使用iOS的各种UI组件并了解其内部原理，了解基本的交互知识； 5. 精通常用软件架构模式，熟悉各种算法与数据结构，多线程，网络编程（Socket、http/web service）等； 6. 具备其它开发经验的优先考虑，如 Mobile Web 开发经验、前端开发经验、后端开发经验； 7. 个性乐观开朗，好奇心强，逻辑思维强，善于团队合作，有强烈的责任心。工作职责：1. 独立架构、完成iOS客户端程序的开发； 2. iOS性能，内存优化，疑难问题分析； 参与移动平台软件框架的研究，设计和实现、关键技术验证和选型等工作；,"电商,其他",50-150人,ios,苏州
ios开发工程师,https://www.lagou.com/jobs/6811315.html,工业园区,10k-15k,苏州易百特信息科技有限公司,1-3年,本科,丰厚的项目奖金，优质的项目,岗位职责：1、根据需求在IOS移动端进行APP的设计与开发；2、参与移动端的架构设计，能够优化现有系统架构，提高系统性能及安全性；3、独立完成开发工作，保证代码的质量，保证产品的正常运行以及维护升级。岗位要求：1、全日制本科及以上学历，有2年以上IOS实际相关开发经验；2、熟练运用XCode等开发工具；3、对代码具有较深的理解，可以编写结构良好的代码，具有规范性；4、有完整成功开发手机应用产品案例者优先；5、有混合开发经验者优先；6、拥有较强的自我驱动力和学习能力，逻辑思维能力和自我管理能力优秀，时间意识良好。,"移动互联网,信息安全",50-150人,ios,苏州
iOS 开发工程师,https://www.lagou.com/jobs/3995545.html,昆山市,5K-10K,昆山迈尔斯信息科技有限公司,不限,大专,"氛围轻松,弹性工作,定期聚餐",职位责任： • 负责公司项目及产品的开发和设计工作； • 参与产品需求的沟通、讨论和协调； • 参与 iOS 端技术架构设计和优化； • 验证和修正测试中发现的问题； • 负责产品后续迭代版本开发，不断优化相关产品的质量、性能、用户体验。职位要求： • 大专以上学历，计算机、软件、通讯等相关专业； • 具有 iOS 一年以上开发经验者优先，能独立完成项目开发； • 熟悉 C / C++、精通 Objective-C，有良好的编程习惯，代码规范利于团队合作； • 熟悉 Xcode / iPhone SDK 开发环境； • 熟悉 iOS UI 控件及 iOS 事件机制等； • 熟练使用第三方开发模块或插件； • 熟悉无线网络应用开发，精通 Socket 和 http / https 网络接口编程，熟悉 iPhone App 客户端及服务端通讯方案； • 对数据结构、基本算法熟练掌握，并具备基本的算法设计能力； • 认真踏实，有责任心、富有主动性和团队精神，能够承受工作压力； • 需要有成功案例或自己独立完成并可运行展示的 Demo。,"移动互联网,企业服务",少于15人,ios,苏州
ios开发工程师-本科2年,https://www.lagou.com/jobs/6869037.html,张家港市,8k-15k,北京融易通信息技术有限公司上海分公司,1-3年,本科,五险一金 交通补助 餐补 年假,岗位职责：1. 参与项目开发，了解公司产品框架和业务流程，从事项目编码和调试工作；2. 根据开发组长安排，进行组内需求分析、任务开发等工作的执行。 任职资格： 1. 软件工程、信息工程、计算机科学等相关专业本科以上学历； 2. 精通Objective-C或者C、C++、JAVA语言中的任意一种or多种；3. 熟悉XML、XHTML规范；4. 2-3年项目工作经验，精通内存管理，具备快速学习新技术的能力；5. 工作责任心强，积极主动，思路清晰有条理，有良好的团队精神。,"金融,数据服务",150-500人,ios,苏州
视频开发工程师,https://www.lagou.com/jobs/7196672.html,工业园区,15k-30k,君师禾信息技术（上海）有限公司,不限,本科,福利待遇好,岗位职责：1、负责智能协作终端产品中视频子系统的前后处理，编解码，网络适应性等关键技术的创新研究和突破，为最终用户打造**的视频体验，构筑高质量的产品竞争力；2、负责android/windows/IOS/MAC等不同操作系统视频引擎开发及产品化，负责不同芯片平台的硬件编解码能力、AI算法分析验证与产品集成；3、承担视频子系统的软件设计、代码编写、单元测试、静态检查、问题定位等工作;任职要求：1、具有良好的C/C++语言编程能力，熟悉常用的算法和数据结构，熟悉软件开发流程；2、具备较好的分析问题和创造性解决问题的能力，能快速接受和掌握新技术，有良好的沟通能力与团队合作精神；3、熟悉H264/H265/H266等主流编解码协议，有ffmpeg，webRTC，openMAX IL相关开发经验者优先；4、有机器学习和深度学习方面理论及工程能力，熟悉TensorFlow，caffe等主流框架者优先；,信息安全,15-50人,ios,苏州
ui设计师,https://www.lagou.com/jobs/7054349.html,昆山市,12k-18k,昆山微远信息技术有限公司,5-10年,大专,项目奖金 年终奖 旅游 节日礼品,岗位职责：1、负责IOS、Android等移动设备操作系统的视觉设计，有扫描类与数据恢复类软件的设计经验优先考虑2、主导设定整体视觉风格设计，包括插图、动效，能够输出json文件输出到软件3、负责参与设计体验、流程的制定和规范；4、负责分享设计经验、推动提高团队的设计能力；5、与整个研发团队紧密配合，协助达成最终产品目标；6、完成部门安排的其他工作； 任职要求：1、三年以上互联网产品视觉工作经验，熟悉视觉设计流程，能够独立熟悉业务的整个设计过程，并有成功案例；2、优秀的审美能力和视觉表现力，精通色彩、图形、信息和 GUI 设计原则及方法；3、较强的逻辑思维能力，熟练掌握产品需求分析技巧，能对原型快速有效的解读并能完整准确的还原信息层级和关系，能运用设计手法平衡商业和用户需求；4、对各种互联网产品和流行趋势有敏锐的设计触觉，富有设计创造力和激情，有探索研究精神；5、具备视觉动效表现力，熟悉视频剪辑、后期特效合成、3D、AE动画擅长者优先；6、有过带团队经验者优先考虑；7、此职位的申请必须提交作品集（相关作品附件或者链接）。,"游戏,其他",150-500人,ios,苏州
游戏主策划,https://www.lagou.com/jobs/7085842.html,昆山市,15k-25k,昆山微远信息技术有限公司,3-5年,不限,年终奖 旅游 2次加薪 项目奖金,岗位职责：1.参与公司小游戏项目（微信端、安卓、IOS等多端）的立项；2.负责游戏产品的整体策划、市场定位、设计研发工作；3.研究行业发展趋势和走向，分析竞品及行业情况，实时调整产品策略；4.全面参与游戏的玩法、数值、功能框架搭建，技术定向、美术风格定位等；5.负责推进游戏项目的进展；任职要求： 1. 三年以上游戏设计经验，曾参与过至少一款产品的完整研发经历，有小游戏策划经历的优选；2.游戏经验丰富，熟悉多类型度游戏，善于分析、归纳游戏核心原理及内容，能够准确把握设计重点；深入理解游戏的体验、交互，能够基于数据来驱动产品开发和优化；3. 执行力强，有实战经验，了解游戏开发工作的各个细节； 4. 有良好的团队合作精神，较强的沟通能力，抗压能力强，有一定的美术鉴赏能力。5. 了解游戏策划关于系统、数值、关卡等开发过程；,"游戏,其他",150-500人,ios,苏州
音视频SDK技术专家,https://www.lagou.com/jobs/7217026.html,工业园区,25k-50k,科天智慧云（广州）信息科技有限公司,5-10年,本科,绩效奖金；带薪年假；弹性工作；500强,"职位描述1、负责跨平台实时音视频SDK的设计与开发工作，包括音视频引擎，信令和媒体协议等；2、负责实时音视频SDK核心指标优化，包括延迟、卡顿、清晰度、能耗等；3、负责实时音视频SDK在多业务场景技术落地，包括通话，会议，直播等；职位要求1、精通C/C++，三年以上C/C++项目开发经验，具有良好的软件设计能力；2、熟悉流媒体传输协议（RTP/RTCP/RTMP), 精通UDP/TCP传输原理，熟练掌握socket，多线程编程；3、熟悉Android/iOS/Windows/Mac等至少一个平台的音视频特性，具有端上音视频相关开发经验者优先；4、熟悉多媒体开源架构(WebRTC、FFmpeg、linphone等)，有基于某开源框架进行开发者优先，熟悉实时音视频通话的核心技术，例如JITTER BUFFER，NETEQ，FEC，带宽预测和码率自适应，有实时音视频通信相关经验者优先；5、丰富的多媒体行业经验，对实时音视频行业具有前瞻性的思考和自己的见解；","移动互联网,数据服务",150-500人,ios,苏州
