job_name,job_url,job_location,job_salary,job_company,job_experience,job_class,job_given,job_detail,company_type,company_person,search_key,city
iOS 客户端开发工程师（游戏平台方向）,https://www.lagou.com/jobs/7214601.html,海淀区,20k-40k,成都西山居互动娱乐科技有限公司珠海分公司,5-10年,本科,发展好,岗位职责- 负责游戏平台 iOS 端的开发工作- 从用户需求、发行业务需求出发，打造具有渠道、用户、支付、运营、数据等体系的高品质游戏平台聚合 SDK ，为游戏用户、游戏研发团队、发行业务团队提供丰富且多样化的 SDK 功能- 通过丰富的广告源接入，及时且自动化的广告数据抓取、分析，精准的用户画像，提升游戏产品的广告收益率能力要求- 五年以上前端开发经验，三年以上 iOS 开发经验- 熟练使用 Objective-C 或 Swift 进行日常开发- 熟悉 iOS SDK 及 iOS 系统特性- 对 iOS 的构建、签名、发布流程有深刻理解- 熟练使用 Xcode 和 macOS加分项- 对 Apple 开发技术栈的前沿发展有长期持续的追踪- 有游戏渠道 SDK 的对接经验- 熟悉或了解 Unity3D/UE4/Cocos 等游戏引擎- 熟悉 Jenkins，对 CI/CD 有所了解,游戏,2000人以上,ios,北京
iOS开发工程师（SDK）,https://www.lagou.com/jobs/6526512.html,海淀区,20k-35k,北京搜狐新媒体信息技术有限公司,3-5年,本科,"工作氛围好,精英团队,广告业务,弹性工作",1.负责搜狐视频广告相关iOS端SDK的研发工作；2.负责搜狐视频广告iOS端相关营销工具的设计和研发工作；3.负责搜狐视频广告iOS端相关创新营销产品的设计和研发工作。1.有iOS端开发经验，熟悉iOS体系结构；2.精通多线程和网络编程，对高性能程序设计、架构有较多的工程经验；3.有完整的iOS项目经验；深刻理解手机客户端开发特点；4.具有较强的分析问题和解决问题的能力；5.具备良好的团队协作能力、沟通能力和学习能力，有责任感；6.统招本科及以上学历，计算机或相关专业。,"移动互联网,广告营销",2000人以上,ios,北京
iOS SDK开发,https://www.lagou.com/jobs/6095084.html,海淀区,20k-30k,北京搜狐新媒体信息技术有限公司,3-5年,本科,"弹性工作,大数据平台,精英团队,极客氛围",工作职责：1.负责移动端商业产品的技术架构及商业产品机会探索相关研发2.负责移动端iOS广告模块研发及其与内部App及第三方应用的标准化对接3.以数据化驱动的方式挖掘研究客户需求及用户行为特征，推动商业产品创新 岗位要求：1.数据结构算法基础扎实，具备扎实的ObjectiveC编程基础2.有良好的架构设计能力，熟练运用设计模式3.有商业和产品感觉，能够理解及平衡商业化与用户体验之间的相互作用4.对移动端技术有深入理解，能对商业需求对移动端产品进行持续优化5.有行业视野，能与行业同行协作推动移动广告展示、服务、监测等技术接口标准化6.具有良好的沟通能力、推动能力、协调能力、理解能力，并拥有强烈的责任心和团队合作精神，能承受一定强度的工作压力,"移动互联网,广告营销",2000人以上,ios,北京
iOS开发工程师（猫耳北京）,https://www.lagou.com/jobs/6790101.html,朝阳区,10k-20k,上海喵斯拉网络科技有限公司,1-3年,本科,"二次元,零食饮料,有猫,定期团建",工作职责：- 负责猫耳FM客户端及相关 SDK 的开发- 根据项目具体要求，承担开发任务，按计划完成任务目标- 参与产品需求的沟通、讨论和协调 职位要求：- 至少 2 年客户端开发经验，熟练掌握 iOS 应用开发技术，能独立开发应用- 熟悉设计模式，掌握面向对象核心思想，具备扎实的抽象编程 / 设计能力- 能够熟练使用 Git- 有较强的问题分析和解决的能力- 具备良好的沟通能力和优秀的团队协作能力- 有音视频、游戏相关开发经验的优先- 参与开源项目或有自己开源项目，有 GitHub 或个人博客者优先,"文娱丨内容,游戏",150-500人,ios,北京
iOS开发工程师（项目负责人）,https://www.lagou.com/jobs/7055297.html,东城区,40k-50k,北京新片场传媒股份有限公司,5-10年,本科,免费早晚餐 下午茶 扁平管理,有过应用在音视频剪辑类产品的经验，或是具备有音视频剪辑功能的产品经验,"移动互联网,文娱丨内容",150-500人,ios,北京
【5Miles】iOS高级开发工程师,https://www.lagou.com/jobs/4143632.html,朝阳区,18k-36k,北京第三石科技发展有限公司,3-5年,本科,良好的发展前期，丰厚的福利待遇,"岗位描述： 
 负责部门移动产品（iOS)的研发工作； 
 负责iOS平台应用程序框架设计、开发，参与移动项目整体技术方案的设计和制定；
 根据开发进度和任务分配，完成相应模块软件的设计、开发、编程任务； 
 参与产品的各阶段评审，根据产品要求，按照需求进行工作； 
 编写相应的开发文档.
任职资格： 
 计算机相关专业毕业，大学本科及以上学历； 
 3年以上iOS开发经验，有2以上的后端开发经验优先； 
 熟练掌握TCP、HTTP等网络传输协议，熟悉数据库，多线程，网络基础以及常用的设计模式； 
 有扎实的C/C++、Objective-C基础，对Cocoa、UIKit框架及iOS SDK有深入理解，能够对移动应用进行性能分析和优化；
 熟悉App与HTML5集成开发相关技术；  
 有独立开发能力，在AppStore有上线的应用； 
 有移动电商或者即时通讯开发经验的优先；
 具备良好的敬业精神和团队合作精神,有良好的理解表达沟通能力，能适应较大的工作压力.
 有团队管理经验的优先","移动互联网,电商",50-150人,ios,北京
（短视频方向）ios开发工程师,https://www.lagou.com/jobs/7164298.html,朝阳区,20k-30k,北京第三石科技发展有限公司,3-5年,本科,扁平化管理，提供足够的平台发展空间,岗位描述： 1、负责互娱类移动产品（iOS)的研发工作； 2、负责移动平台软件框架的研究，设计和实现、关键技术验证和选型等工作；3、带领并参与代码开发/单元测试等工作；4、参与移动规范制订、技术文档编写。任职资格： 计算机相关专业毕业，大学本科及以上学历； 3年以上iOS开发经验，有2以上的后端开发经验优先； 熟练掌握TCP、HTTP等网络传输协议，熟悉数据库，多线程，网络基础以及常用的设计模式； 有扎实的C/C++、Objective-C基础，对Cocoa、UIKit框架及iOS SDK有深入理解，能够对移动应用进行性能分析和优化；有成熟的弱网环境下的数据加载优化经验；熟悉App与HTML5集成开发相关技术；  有独立开发能力，有抽象平台化技术组件的经验；有IM，社交产品，音视频产品开发经验者优先；具备良好的敬业精神和团队合作精神，有良好的理解表达沟通能力，能适应较大的工作压力；有团队管理经验的优先,"移动互联网,电商",50-150人,ios,北京
iOS开发工程师（社交方向）,https://www.lagou.com/jobs/4131409.html,朝阳区,15k-30k,北京陌陌科技有限公司,1-3年,本科,优秀团队,岗位职责：1、负责公司新产品（社交方向）的技术研究；2、负责公司新产品（社交方向）的版本迭代开发。  岗位要求： 1、本科以及以上学历，计算机或者数学相关专业； 2、熟练掌握Swift语言或者有Objective-C两年及以上经验； 3、熟练掌握iOS开发； 4、喜欢钻研新技术，有良好的编程习惯，有较强的快速学习能力；5、有github开源项目，或者独立发布应用到AppStore；6、做过社交相关产品的优先。,社交,500-2000人,ios,北京
联盟广告iOS开发工程师,https://www.lagou.com/jobs/6689334.html,海淀区,15k-25k,厦门美图之家科技有限公司,3-5年,本科,有竞争力薪资，餐补交通补等等,工作内容：1、联盟广告SDK的架构设计、开发、持续演进和重构；2、广告客户端技术的前沿追踪、技术攻坚和落地，推动客户端技术团队成长；3、广告平台投放优化（穿山甲、广点通、Google等）效果数据跟踪、分析；任职资格：1、精通OC语言，熟练掌握常用开发技巧，以及底层Runtime、RunLoop、GCD等运行机制；2、精通常用UI组件开发，善于整体架构体系设计；3、熟悉HTTP、HTTPS、TCP/IP、Protobuf通讯协议，精通多线程编程；4、精通客户端程序设计方法、性能优化、安全的应用层协议设计和安全攻防；5、了解业内主流广告平台SDK特性（穿山甲、广点通等），深入研究其内部运行机制；,硬件,2000人以上,ios,北京
IOS开发工程师（商业）,https://www.lagou.com/jobs/7160153.html,朝阳区,20k-35k,北京陌陌科技有限公司,3-5年,本科,餐费补助 打车补助,岗位职责：1. 根据产品设计，进行iOS端产品研发和高质量的交付；2. 持续进行版本迭代、性能优化、架构优化；3. 持续跟进行业新技术新趋势并加以利用；4. 参与团队梯队建设，团队分享，新人指导等，提升团队技术能力。岗位要求：1. 统招本科及以上学历，具有3年以上iOS平台相关研发经验；2. 具有丰富的 Objective-C 及 C/C++ 开发经验，优秀的架构设计能力和编程习惯，具备较好的技术攻关能力；3. 熟悉iOS平台下音视频技术、高性能编程及性能调优；对网络通信、内存管理等有深刻的了解；有IM或者长连接业务开发经验的优先；4. 具备完整的iOS项目经验，至少参加过一个完整的社交类App技术框架搭建、关键技术选型工作；有手机游戏开发经验或海外业务经历的优先；5. 工作踏实认真，有责任感，求知欲望强，抗压能力强，有独立解决问题的能力和团队协作意识。,社交,500-2000人,ios,北京
高级 iOS 开发工程师,https://www.lagou.com/jobs/7026084.html,东城区,20k-35k,北京高因科技有限公司,不限,本科,平台大，氛围佳，领导好，福利好。,工作职责：1、负责高质量的设计和编码，独立承担架构设计，主导项目；2、深度参与 App 产品需求讨论，功能定义等；3、承担重点、难点的技术攻坚，App 性能优化、稳定性提升。 职位要求：1、良好的设计和编码品味，热爱写代码能产出高质量的设计和代码；2、对稳定性和性能有超乎寻常的关注；3、熟练掌握 iOS 界面绘制、数据存储、网络通信、线程管理、内存优化等原理；4、对于各种工具的使用或制造很有心得；5、习惯查阅英文资料，如 Apple 官方文档、StackOverflow 等；6、有良好的产品意识；7、有知名开源作品或者博客者优先；8、积极乐观，认真负责，乐于协作和分享；9、有知名互联网公司或者业务背景，并有相关团队管理经验。,移动互联网,2000人以上,ios,北京
资深ios工程师,https://www.lagou.com/jobs/7182711.html,海淀区,25k-40k,北京奇艺世纪科技有限公司,5-10年,本科,核心团队 精英文化 优秀的团队氛围,"岗位职责：1、负责iOS端移动产品的功能研发和性能优化, 完成高质量编码工作；2、与产品经理配合, 深度参与手机产品需求讨论, 功能定义等；3、设计良好的代码结构, 不断迭代重构； 任职要求:1、本科及以上学历, 计算机相关专业, 三年以上开发工作经验, 两年以上iOS开发经验, 参与过至少一款商业app项目的开发工作；2、具有扎实的编程功底, 良好的设计能力和编程习惯, 熟练掌握Objective-C、iOS SDK；3、熟悉iOS底层原理, 有一定的性能调优经验, 熟悉常用性能调试工具；4、积极乐观, 责任心强, 工作认真细致, 具有良好的团队沟通与协作能力。温馨提醒：如果7天内您没有收到爱奇艺的面试邀请，那么目前我们不会安排您参加后续的面试环节，感谢您的理解和对爱奇艺的关注与认可。",文娱丨内容,2000人以上,ios,北京
iOS研发工程师-电商,https://www.lagou.com/jobs/5015618.html,海淀区,20k-35k,北京小米科技有限责任公司,3-5年,本科,"核心部门,六险一金,弹性工作,下午茶",岗位职责1、配合产品人员、UED人员完成需求分析工作2、IOS平台应用程序开发、调试及性能优化3、根据开发过程中的体验对产品提出改进建议.对已有APP进行持续性改造和优化任职要求1、两年及两年以上iOS开发经验2、仍对iOS开发充满热爱3、有电商背景优先4、有react native开发经验优先5、大型互联网公司工作背景者优先6、有名校本科或者硕士毕业背景的优先7、有清晰职业规划者优先8、易沟通，有团队合作精神者优先9、有广泛爱好，热爱运动者和读书者优先,硬件,2000人以上,ios,北京
视频iOS开发工程师-核心业务,https://www.lagou.com/jobs/6447162.html,海淀区,25k-45k,微梦创科网络科技（中国）有限公司,3-5年,本科,大平台、成长空间、福利完善,"岗位职责： 1、负责新浪微博客户端中视频相关产品的开发，包括视频生产（拍摄，编辑，上传），视频消费（播放器，视频推荐，自动播放，预加载），新产品开发；2、负责维护微博客户端内视频相关产品，分析和解决用户碰到的各种疑难杂症 ；3、负责客户端的性能优化以及各种实用工具的开发。      任职要求： 1、二年以上iOS开发经验，热爱编程(在校项目也算)； 2、熟悉常用网络协议包括Tcp,Http等； 3、具备一定的产品意识，对社交网络产品有一定的理解； 4、具备扎实的理论基础，熟悉常用的数据结构，算法以及数据库技术； 5、具备一定的沟通能力，能够清晰地表达自己的想法。     加分项：1、视频相关技术的理解和应用经验；2、相机，播放器，视频编辑等相关产品的应用经验；3、Github，技术blog。",文娱丨内容,2000人以上,ios,北京
ios工程师(J10515),https://www.lagou.com/jobs/6944462.html,朝阳区,15k-30k,互动峰科技（北京）有限公司,3-5年,本科,五险一金、个性化发展道路,技术必备：1. 3年以上iOS研发经验。2. 语言基础扎实，精通iOS框架及各种特性，熟练使用iOS的各种UI组件并了解其内部原理；3. 具有移动端应用程序性能、内存、稳定性分析优化项目经验。4. 熟练使用OC和swift 两种语言开发项目。5. 了解或有组件化开发经验。6. 了解html5、js、css等相关技术，有Hybrid开发模式经验，熟悉react-native、weex等技术者优先；7.  有客户端自动化测试或单元测试相关经验者优先。加分项：1. 有小程序、web开发、android端、服务端开发经验者优先。2. 有完整的线上问题收集分析修复等技术经验者优先。,医疗丨健康,500-2000人,ios,北京
商业化IOS开发,https://www.lagou.com/jobs/5451196.html,朝阳区,25k-50k,行吟信息科技（上海）有限公司,3-5年,本科,良好的发展前景,工作内容：1. 主要负责小红书iOS App的商业化模块设计和开发、推进商业化平台技术研究与应用；2. 不断提升广告的用户体验，持续得从技术的角度提升商业化产品的体验3. 负责项目重点、难点的技术攻坚。 任职资格： 1. 大学本科或以上学历，计算机相关专业，3年以上iOS相关经验；2. 态度积极向上，有责任心，有极强的自学能力，能够以数据为基础自我驱动；3. 精通Objective-C／Swift，编程能力优秀，良好的面向对象化编程思想；4. 熟悉敏捷开发与设计模式，有大型项目的基础架构研发实践经验，并能设计出高效、合理、易读、易于扩展的程序结构；5. 具体较强的分析问题和解决问题的能力；6.有基础组件封装，架构设计，性能优化等经验者优先。,消费生活,500-2000人,ios,北京
iOS开发工程师(J10163),https://www.lagou.com/jobs/6785375.html,海淀区,30k-50k,北京读我科技有限公司,3-5年,大专,业务发展清晰、车补房补、地铁周边、年终奖,,移动互联网,500-2000人,ios,北京
IOS原生播放器工程师,https://www.lagou.com/jobs/6604889.html,朝阳区,15k-22k,欢欢喜喜（天津）文化投资有限公司,3-5年,本科,"外企托管,补充医疗,影视互联网",岗位职责: 1、基于现有视频平台，负责视频播放平台的功能开发和优化； 2、熟悉掌握视频平台相关技术，例如投屏的DNLA，Airplay等，独立的进行SDK，framework开发； 3、图像处理的研究与实现； 4、随时跟进项目和技术更新。任职资格: 1、精通  OC  编程语言，熟悉swift，至少三年以上开发经验；  2、有iOS视频播放器（基于AVPlayer）的实际开发经验，掌握各种播放器相关的处理和业务逻辑；3、对视频平台有自己的独到理解和认知。 4、对于自己的工作，认真负责，深入思考； 5、有良好的分析问题和解决问题能力，良好的沟通能力与团队协作能力； 6、能独立进行相关模块开发。,"移动互联网,文娱丨内容",50-150人,ios,北京
ios实习生,https://www.lagou.com/jobs/7026155.html,海淀区,5k-8k,北京迦游网络科技有限公司,应届毕业生,本科,发展 转正,技能要求：Objective-C，java岗位职责：1.协助技术人员完成iOS应用开发；2.协助技术人员完成游戏测试；3.协助技术人员配置开发环境，调试应用；4.协助技术人员解决遇到的问题；5.协助技术人员完成需要对接运营的相关任务。任职要求：1.对苹果相关领域感兴趣或了解相关知识；2.计算机相关专业毕业，有良好的计算机基础；3.有java或Objective-C相关计算机语言基础优先；4.有一定的抗压能力和自我学习能力；5.接受重复性工作内容，能主动提高效率。,"移动互联网,游戏",150-500人,ios,北京
iOS 开发工程师 (MJ000295),https://www.lagou.com/jobs/6974551.html,海淀区,25k-40k,北京智者天下科技有限公司,1-3年,本科,带薪年假 补充医疗 弹性办公,1、负责移动客户端 （iOS） 产品的整体框架、GUI 交互的设计与开发2、负责移动客户端 （iOS） 产品的基础组件、通用模块的设计与开发3、负责公司 iOS App 产品的技术方案规划、架构设计和系统设计4、研究并实践移动客户端领域的新技术1、具有扎实的编程功底，良好的设计能力和编程习惯2、深入掌握 Objective-C 语言、Cocoa Frameworks 和 MVC 设计模式3、熟练使用 Git、CocoaPods、Instruments 等 iOS 开发常用工具4、对界面美观度和用户体验有较强的敏感度5、良好的团队协作能力和沟通能力，有责任感，对移动端产品有浓厚的兴趣6、有强烈的求知欲和进取心，对新技术有持续的热情加分项有 MVVM、响应式编程、函数式编程、ComponentKit 开发经验者优先有大型成熟项目的架构设计经验者优先对视图渲染、多媒体技术、OCRuntime 有深入了解者优先对知名的 iOS 开源项目有过代码贡献优先简历请附上 GitHub 和技术博客地址,社交,500-2000人,ios,北京
IOS移动端开发工程师,https://www.lagou.com/jobs/7127494.html,石景山区,15k-30k,中设数字技术股份有限公司,5-10年,本科,国企背景 行业前景好,1. 全日制本科以上学历，计算机或相关专业毕业，有3年以上开发经验；2.精通H5开发，精通swift开发，有基于HTML5技术的移动端APP相关项目的开发经验；3.熟练使用git、svn等版本管理工具；4.熟悉IOS平台开发环境及开发架构、可以实现Native+H5混合开发；5.有良好编码风格，追求代码执行效率，精通数据结构、算法设计；6.有独立负责APP开发、发布、优化的经验。7.个性乐观开朗，逻辑性强，具有良好的沟通能力和团队合作精神、优秀的分析问题和解决问题的能力；,"企业服务,数据服务",150-500人,ios,北京
iOS 高级研发工程师,https://www.lagou.com/jobs/7088095.html,海淀区,20k-35k,北京翼鸥教育科技有限公司,5-10年,本科,五险一金、14薪起、股票期权、包吃、旅游,岗位职责：1、负责iOS平台相关应用的开发和维护；2、参与iOS平台新技术调研、技术文档编写； 任职要求：1、统招本科及以上学历，5年以上iOS平台软件开发经验；2、熟悉面向对象软件设计原则；3、熟悉ObjectiveC编程语言特性；4、需要有较好的代码编写习惯并对代码质量有所追求；5、需要有较强的沟通理解能力；6、需要有较强的学习能力以及独立解决问题的能力； 能够良好运用多线程、同步异步等特性者优先；在多人开发团队中负责过软件架构设计者优先；参与开发过服务端软件者优先；使用Socket与c++服务端做过对接者优先；做过pdf、ppt、音视频等文件播放器者优先;参与实现过电子白板或笔记、绘画板功能者优先；实现过直播类App中的音视频数据处理者优先；有图片识别工作经验者优先；对编码工作有一定热爱者优先；,"移动互联网,教育",150-500人,ios,北京
iOS工程师(J10399),https://www.lagou.com/jobs/6787376.html,朝阳区,20k-35k,互动峰科技（北京）有限公司,3-5年,本科,五险一金,"工作职责:岗位职责：1、负责公司iOS端产品的开发与维护,能根据需求独立完成模块设计、编码、维护工作；2、根据产品需求对负责的业务进行迭代开发；3、跟进新技术的探索研究，应用到实际产品开发中，不断迭代优化；4、能够熟练完成技术等相关文档的编写；任职资格:任职要求：1、本科学历以上，计算机相关专业；2、3年以上iOS研发经验，语言基础扎实，精通iOS框架及各种特性，熟练使用iOS的各种UI组件并了解其内部原理；3、具有移动端应用程序性能、内存、稳定性分析优化经验；4、熟练掌握iOS SDK，熟悉常用的iOS三方库并了解内部实现原理；5、了解html5、js、css等相关技术，有Hybrid开发模式经验或熟悉react-native、weex等技术者优先；6、熟悉多线程，网络编程, 有一定的开源框架、开源组件源码阅读和钻研能力；7、熟悉面向对象方法和常用设计模式，拥有较好程序设计思想和质量意识；8、有较好的团队协作精神和责任心，思维敏捷，学习能力强，承压力强。",医疗丨健康,500-2000人,ios,北京
高级iOS移动应用研发工程师,https://www.lagou.com/jobs/5660148.html,海淀区,15k-25k,标贝（北京）科技有限公司,3-5年,本科,年底双薪 弹性工作 七险一金 绩效奖金,岗位职责 根据产品需求，产品设计完成iOS平台移动应用开发任务。。负责项目开发过程中的问题分析和总结，提供建议和帮助改善研发流程。和产品/测试/运营进行密切沟通，能够根据需求提出合理技术方案；要求：对数据结构和算法，软件架构设计有较为深刻的理解和经验精通Objective C/Swift/C++等编程语言及开发平台，精通iOS应用开发对网络编程、数据库、多线程、设计模式、程序架构等有深入的理解有语音识别、语音合成相关应用开发经验者优先优秀的逻辑思维能力和分析问题、解决问题的能力，对解决具有挑战性问题充满激情有较强的分析和解决问题的能力，强烈责任感、 缜密的逻辑思维能力。具备良好的项目管理及执行能力,"移动互联网,数据服务",50-150人,ios,北京
中高级iOS开发工程师,https://www.lagou.com/jobs/6296527.html,海淀区,25k-35k,北京华瑞宏泰信息技术有限公司,3-5年,本科,六险一金弹性工作制发展空间大节日福利,职位描述：负责数字货币交易系统iOS客户端的研发、维护岗位职责： 1.基于公司的产品设计，根据需求，进行iOS版本应用的实现； 2.负责提高客户端的质量、开发效率以及安全； 3.负责解决业务上遇到的技术问题。 岗位要求： 1.统招本科及以上学历，计算机等相关专业，具备3年及以上iOS相关项目开发经验； 2、熟悉 iOS 移动终端开发技术，熟悉面向对象化编程思想和设计模式；3、精通Swift，熟悉Storyboard/MVVM，熟练使用Auto Layout，深入理解Objective-C Runtime运行机制和内存管理机制；5、有完整的商业级 iOS 项目经验；6.名校、大厂、熟悉区块链行业者优先。,区块链,50-150人,ios,北京
