job_name,job_url,job_location,job_salary,job_company,job_experience,job_class,job_given,job_detail,company_type,company_person,search_key,city
应急响应工程师,https://www.lagou.com/jobs/7016316.html,芙蓉区,8k-15k,中通服创发科技有限责任公司,3-5年,本科,一切皆有可能,岗位职责：1、负责公司及客户突发安全事件的应急响应处理；2、负责各类安全问题和安全事件的跟踪、分析、处理和解决；3、负责与客户进行安全事件的沟通接洽。任职要求：1、本科以上学历，计算机相关专业（能力突出者学历和专业不限）；2、有Linux、Windows系统经验，能熟练使用Linux、Windows系统平台下各种命令查看系统日志、安全策略等信息；3、掌握或熟悉典型攻击与防护技术，熟练使用网络数据包分析软件，如Wireshark等；4、熟悉汇编语言，熟悉软件逆向分析的基本方法，使用过IDA等调试工具；5、具备较强的动手能力，熟悉至少一门编程语言(python /c#/c/java等) ；6、敬业、正直、诚实，喜欢学习新知识、乐于接受新事物。优先考虑的条件：1、具有一定的开发能力，可以自己编写攻击和检测程序；2、对**的原理和实际案例有深入研究和积累，能快速还原恶意程序的代码细节，对加壳程序能够熟练脱壳；3、有应急响应经验者优先。,"移动互联网,电商",150-500人,python,长沙
LinuxC研发工程师,https://www.lagou.com/jobs/6987618.html,岳麓区,18k-25k,北京启明星辰信息安全技术有限公司,3-5年,本科,七险一金 上市公司 网络安全领航者,岗位职责:1、产品功能模块重构；2、重难点问题攻关；3、性能调优。能力要求:1、计算机、软件、网络工程、通信等专业；2、精通C语言及常用数据结构，掌握shell/python优先考虑；3、熟悉TCP/IP协议，熟悉进程间通信；4、熟悉linux操作系统及常用工具，有内核相关研究经验优先考虑；5、良好的沟通能力，较强的自驱力。,信息安全,500-2000人,python,长沙
算法工程师,https://www.lagou.com/jobs/7211962.html,岳麓区,16k-30k,北京宝兰德软件股份有限公司,3-5年,硕士,发展空间大 上市公司 六险一金,"岗位职责：    1.负责OCR图像处理、机器学习、深度学习的实现与改进；    2.负责完成图像算法的实现，结合业务需求进行人脸识别加持证件识别、对比人脸、证件、后台信息记录三者的一致性；    3.收集研究行业内新的技术、算法，不断提高系统对图图像识别的效率与准确率；    4.负责相关方向技术难点攻关、前瞻研究以及应用拓展。    岗位要求：    1、学历要求：硕士及以上，数学或计算机相关专业；    2、在OCR领域有深入的了解，熟悉文本检测、文本识别等核心算法,在图像处理领域有丰富的研发和技术经验；    3、熟悉深度学习常用的算法和优化策略，熟悉常用机器学习算法，有相关研发经验；    4、精通Python、C++等至少一种编程语言，熟悉TensorFlow、PyTorch、MXNet、Caffe等至少一种深度学习框架，熟悉Linux工作环境，对数据结构和算法设计有深刻理解；  5、了解图像处理/深度学习领域的最新研究成果、公开数据集和相关的开源系统；    6、对图像处理、深度学习、机器学习等技术创新与应用充满激情；技术狂热者，乐于和善于完成具有挑战性的技术工作，很强的动手实践能力。",企业服务,150-500人,python,长沙
nlp算法研究员,https://www.lagou.com/jobs/6423714.html,岳麓区,15k-25k,湖南星汉数智科技有限公司,不限,硕士,"扁平化管理,周末双休,五险一金,股票期权",岗位职责：1、 研究分词、实体识别、句法分析、信息抽取、分类等自然语言处理相关关键技术，进行技术创新；2、 负责R&D转化工作，将相关关键技术进行工程化代码实现，参与关键技术的系统集成；3、 参与技术需求研讨；4、 撰写相关专利，发表论文，参加各类公开评测；5、 组织各类数据集的收集、标注和整理；岗位要求：1、985院校计算机或相关专业硕士以上学历； 2、熟练掌握Java编程语言，算法基础扎实，具备较强的分析和解决问题能力，；3、在CCF C类以上国际会议、SCI期刊或EI期刊发表过NLP相关学术论文；4、了解spring cloud、hadoop、spark、storm、hive 、ElatisticSearch等大数据开源框架，有一定的大数据开发经验；5、具有较强的科研创新能力，能够解决NLP、知识抽取、分类、推理等领域的关键技术问题；6、具有较好的工程实践能力，能够将NLP相关前沿技术进行工程实现；7、熟悉python、TensorFlow和面向文本的深度学习模型，深度掌握机器学习及深度学习的内部机理；8、具有自我驱动品质，学习能力强，适应能力好，有强烈的责任心，具备耐心/细心的品质；9、抗压能力强，吃苦耐劳，愿意出差，能够加班待遇：1、作为公司骨干储备力量，优先配股；2、年薪20万-30万；,"移动互联网,数据服务",50-150人,python,长沙
Java算法工程师,https://www.lagou.com/jobs/6036058.html,岳麓区,8k-15k,湖南星汉数智科技有限公司,不限,本科,双休五险一金 年终奖金 团队氛围活跃,岗位要求：1.  本科及以上学历，计算机及相关专业毕业； 2.  熟练掌握Java编程语言，算法基础扎实，具备较强的分析和解决问题能力，了解设计模式；3．掌握基本的文本处理算法，并能对算法进行优化设计；4．熟悉大数据系统架构和开发框架；5．熟悉一种常用的NoSQL数据库； 6．熟悉python、TensorFlow和面向文本的深度学习模型者优先；7．有知识图谱领域实际项目经验者优先；岗位职责：1． 用NLP技术实现及优化相关模型；2． 多维度分析线上线下数据，合理优化模型；3．提供规范的系统设计和代码文档；,"移动互联网,数据服务",50-150人,python,长沙
高级DevOps开发工程师,https://www.lagou.com/jobs/5849347.html,开福区,12k-20k,深圳市赢时胜信息技术股份有限公司,不限,本科,"绩效奖金,年终奖金,股权激励",工作职责： 1、负责DevOps运维管理平台开发及迭代； 2、负责参与运维标准化环境制定及执行；  3、负责参与自动化测试工具编写及集成； 4、负责参与服务器、虚拟化、容器化集群体运维及资源调度。 岗位要求：1、有5年以上DevOps相关开发&运维工作经验，本科及以上学历；2、熟悉Java、Python或C/C++编程语言至少两种，理解该语言以及相关的基础框架3、熟悉Liunx原理，精通Shell、Python编程；4、熟悉Docker容器及K8S调度系统；5、熟练掌握devops相关工具链：SVN，Git，Gitlab、Jenkins pipeline、Maven、Ansible、ELK6、深入理解监控含义，有prometheus、zabbix等监控工具架设运维经验7、熟悉微服务，了解微服务架构，有微服务部署运维工作经验；8、了解AIOPS，有AIOPS研发经验者优先9、踏实肯干，热爱技术，勤于专研、善于学习。,金融,500-2000人,python,长沙
数据分析师,https://www.lagou.com/jobs/7073214.html,雨花区,10k-20k,昆仑智汇数据科技（北京）有限公司,不限,本科,福利多多,"1.针对制造行业的智能制造与工业互联网的需求，深入了解业务需求（如产品研发、生产工艺、质量控制、设备诊断、供应链管理等），运用数据分析/数据挖掘技术解决客户的实际问题。2.基于数据平台产品，建立数据标准、进行数据清洗、建立数据分析、预测或优化模型、并负责与团队一起负责数据分析应用的开发和落地实施。3.对具有共性的数据分析模型和行业应用进行抽象与研究，支撑数据分析产品的开发和在数据平台的应用。任职要求：1.独立定义和解决工业行业相关的数据分析/数据挖掘问题的能力，具有清晰的系统思维逻辑和共性抽象能力2.精通数据清洗、统计分析和常用数据挖掘/机器学习算法，有丰富的工业数据分析相关的实际项目经验3.至少精通一种数据分析语言（如Python, R, MATLAB等），及其相应的算法包。4.有良好的客户沟通、业务咨询、团队合作与项目管理能力5.有一定程序开发经验（如Python, Web, Java等），熟悉面向对象的设计6.熟悉常用数据库、大数据、并行化计算等相关技术和工具，如Spark, Hadoop等7.熟悉信号处理、优化算法、时序数据分析、深度学习等算法8.统招本科及以上，3年以上工作经验优先条件：1.工业专业教育背景或者工作经历（如自动化、机械、电气、能动、电子等）2.熟悉工业流程、工业通信协议，SCADA/MES/PLM等工业软件3.了解精益生产、六西格玛等概念及相应数据分析工具。4.熟系烟草行业的研、产、供、销相关环节的业务",数据服务,150-500人,python,长沙
软件工程师,https://www.lagou.com/jobs/7158447.html,长沙县,8k-15k,湖南潇湘大数据研究院,1-3年,本科,五险一金，周末双休，不定期大咖交流会,岗位职责： 1、负责公司产品、项目的功能模块开发，包括需求分析，系统设计和编码实现； 2、负责公司产品、项目的部署、运维等研发相关的工作； 3、重构现有产品或项目，不断完善系统健壮性，代码质量和用户体验； 4、解决项目中存在的性能瓶颈及隐患漏洞。任职资格： 1、本科及以上学历，计算机、应用数学、密码学等相关专业；2、熟练掌握 Java\Python\Golang\Nodejs\C++\PHP 的任意一种语言，Mysql 数据库 3、对计算机网络系统有深刻理解，有分布式，点对点网络协议或应用开发经验 4、理解各类主流的共识算法，包括但不限于 POW、POS、DPOS、PBFT 等； 5、有以下经验的优先 - 掌握 FISCO BCOS，Hyperledger Fabric 等区块链相关机制和原理并有开发经验； - 有信息安全相关工作经验； - 熟悉数据库设计，有 MongoDB、Redis、消息队列等经验；年龄要求：无 性别：无 专业：计算机、机械、电子信息、信息管理、自动化及应用数学等相关专业 学历要求：本科及以上 试用期：3 个月,"数据服务,人工智能",15-50人,python,长沙
软件工程师c++,https://www.lagou.com/jobs/7180736.html,长沙县,8k-15k,湖南潇湘大数据研究院,1-3年,本科,五险一金，周末双休，不定期大咖交流会,岗位职责： 1、负责公司产品、项目的功能模块开发，包括需求分析，系统设计和编码实现； 2、负责公司产品、项目的部署、运维等研发相关的工作； 3、重构现有产品或项目，不断完善系统健壮性，代码质量和用户体验； 4、解决项目中存在的性能瓶颈及隐患漏洞。任职资格： 1、本科及以上学历，计算机、应用数学、密码学等相关专业；2、熟练掌握 Java\Python\Golang\Nodejs\C++\PHP 的任意一种语言，Mysql 数据库 3、对计算机网络系统有深刻理解，有分布式，点对点网络协议或应用开发经验 4、理解各类主流的共识算法，包括但不限于 POW、POS、DPOS、PBFT 等； 5、有以下经验的优先 - 掌握 FISCO BCOS，Hyperledger Fabric 等区块链相关机制和原理并有开发经验； - 有信息安全相关工作经验； - 熟悉数据库设计，有 MongoDB、Redis、消息队列等经验；年龄要求：无 性别：无 专业：计算机、机械、电子信息、信息管理、自动化及应用数学等相关专业 学历要求：本科及以上 试用期：3 个月,"数据服务,人工智能",15-50人,python,长沙
资深测试工程师,https://www.lagou.com/jobs/7177559.html,岳麓区,14k-25k,湖南兴盛优选电子商务有限公司,5-10年,不限,绩效奖金,工作职责：1. 参与业务的产品、技术方案评审，负责测试方案设计与相关业务的测试工作2. 协同开发者确保项目保质保量上线3. 负责提升项目组或协同部门提升工作效率；开展相关自动化测试工具或平台的工作，产出正向收益4. 协同上级，指导测试工程师的工作开展与能力建设岗位要求：1. 至少5年实际的中大型项目的测试经验，且在电商/支付/物流/供应链等有相关的项目经验2. 掌握各种测试流程和测试方法。对测试或软件质量领域的技术与发展，有一定的前瞻性和理解深度3. 了解数据库如 Oracle、MySQL、Redis 等，对常见技术特点熟悉4. 熟悉 TCP/IP 协议簇，如 HTTP、TCP 等协议，对接口测试有项目经验5.了解*nix系统常用的核心指令6. 熟悉面向对象编程设计思想，具备对开发设计方案评审的能力。了解Java 或 Python语言，并可开展一定的测试开发工作7. 对常用技术的中间件有了解，如 Redis、MQ、ES 等8. 有中大型项目经验，对分布式集群项目有一定的理解与实际的测试经验9. 态度端正，有主人翁精神。有强执行力、自驱力和较强学习能力团队介绍：测试部成员现近 50 名，核心成员来自一线企业，如腾讯、阿里、华为、唯品会等。组织结构现分为业务功能组、性能组。 部门有较完备的流程、管理与技术能力，有较好的组织结构，测试领域所涉及技术与理念均在业界前沿，日常有开展各类学习分享、培训与指导。,电商,2000人以上,python,长沙
高级软件测试工程师,https://www.lagou.com/jobs/5532947.html,岳麓区,10k-15k,安克创新科技股份有限公司,3-5年,不限,"氛围好,测试技术牛,发展空间大,成长快","1、3年以上软件测试经验，熟悉Web, APP端常用测试方法，曾独立负责过一个产品项目测试的优先考虑；2、熟练掌握web,app功能测试、兼容性测试、稳定性测试等，有较好的测试设计能力，能独立设计测试用例和测试方案。3、了解移动端常用测试工具，例如:ADB常用命令、logcat、ddms。能写测试脚本或UI自动化则更佳。4、熟悉python ,selenium, jmeter等测试技能可优先考虑。5、良好的学习能力和技术钻研能力，良好的沟通能力及团队合作意识，有乐观和坚韧的心态。",移动互联网,500-2000人,python,长沙
算法工程师,https://www.lagou.com/jobs/7159721.html,长沙县,10k-20k,湖南长城信息金融设备有限责任公司,不限,硕士,"朝阳行业,央企,五百强",任职要求：1.在统计机器学习/计算机/自动化/运筹优化/应用数学相关领域的专业。至少在分析、预测、优化，NLP，OCR等某一个方向有深入的研究，对数据敏感，善于从数据中发现规律。2. 精通机器学习中的常见模型，如logistic regression、 神经网络、SVM及决策树等。可独立研究学术与工程资料，对实际业务问题建模的能力，有参加过数学建模大赛及其相关算法大赛的候选者加分。3.至少掌握一门编程语言，如Python，java等，有在大数据平台上处理大规模实时数据及应用机器学习模型经验者加分。4. 至少熟悉一种常用的数据库，如Mysql，以及SQL相关操作。5. 在数据分析挖掘、算法设计与开发、机器学习和深度学习等方面有着浓厚的兴趣。6. 有着清晰的逻辑分析和表达能力，热爱技术，乐于分享，对行业和技术的发展有自己的见解。,移动互联网,500-2000人,python,长沙
嵌入式软件开发工程师(J10698),https://www.lagou.com/jobs/7136151.html,长沙县,10k-15k,树根互联技术有限公司,3-5年,本科,年终奖 领导nice 平台稳定,,"移动互联网,企业服务",150-500人,python,长沙
网络工程师,https://www.lagou.com/jobs/6943811.html,开福区,10k-15k,湖南快乐阳光互动娱乐传媒有限公司,1-3年,本科,上市公司 福利待遇好 工作氛围好,岗位职责：1、负责省内外运营商合作项目网络架构的方案设计，实施、调测和后期运维工作，制定网络规范，确保网络质量满足公司战略和业务的发展需要。2、参与网络新业务的开发和设计，网络新技术研究和测试3、面向内部服务器运维以及研发人员提供网络解决方案咨询和技术支持4、协助解决网络业务和运营中发现的问题，提出优化改进建议。岗位要求：1、需具备扎实的网络项目施工经验，精通TCP/IP协议，交换，路由，组播、网络安全和VPN技术2了解NFV、SDN、VXLAN等网络新技术。3、掌握一定的用户接入网技术，了解IPTV网络架构 相关标准规范。3、精通Cisco，Huawei，H3C、硬负载等多种网络设备的配置，实际动手能力强。熟悉Linux系统工作原理和常见操作，熟悉或掌握常见脚本语言如linux shell、python、go等；4、良好的沟通和协调能力，具有团队合作精神；工作态度严谨、诚实，有高度的责任心；具有较强的学习能力，敢于迎接变化和挑战。,文娱丨内容,500-2000人,python,长沙
php开发工程师,https://www.lagou.com/jobs/6132421.html,天心区,15k-25k,长沙天创文化传播有限公司,1-3年,本科,五险一金 年底双薪 带薪休假 出国旅游,"职位描述：岗位描述：1、负责产品的研发、架构设计、产品数据库设计、前后台功能模块开发；2、开发数据API，为移动端和前端提供接口支持；3、负责公司已有程序的维护和优化。岗位要求：1. 3年以上PHP、MySQL为主的开发经验，熟悉LNMP技术体系2. 熟悉互联网各类组件,包括不限于Mysql,Redis,Beanstalk,ElasticSearch等3. 掌握Linux操作系统，熟悉相关常用命令及管理方法。4. 有Python相关编程经验优先5. 有大型项目开发经验者优先。","移动互联网,社交",50-150人,python,长沙
PHP高级工程师,https://www.lagou.com/jobs/2583320.html,天心区,15k-25k,长沙天创文化传播有限公司,3-5年,本科,如能胜任技术总监一职，月薪可达25K,"职位描述：岗位描述：1、负责产品的研发、架构设计、产品数据库设计、前后台功能模块开发；2、开发数据API，为移动端和前端提供接口支持；3、负责公司已有程序的维护和优化。岗位要求：1. 3年以上PHP、MySQL为主的开发经验，熟悉LNMP技术体系2. 熟悉互联网各类组件,包括不限于Mysql,Redis,Beanstalk,ElasticSearch等3. 掌握Linux操作系统，熟悉相关常用命令及管理方法。4. 有Python相关编程经验优先5. 有大型项目开发经验者优先。","移动互联网,社交",50-150人,python,长沙
测试工程师,https://www.lagou.com/jobs/6640766.html,岳麓区,8k-14k,拓维信息系统股份有限公司,不限,本科,13薪,【岗位职责】1. 根据产品规格和测试需求，编写测试方案、测试用例、测试脚本；2. 组织、执行产品的测试工作，帮助研发人员进行软件定位，协助解决问题；3. 对测试过程进行监控，完成集成测试、系统测试、回归测试等；4. 建立、跟踪、维护测试工作的相关文档。【任职要求】1. 全日制本科及以上学历，从事软件开发或测试，工作两年以上；2. 可熟练根据软件设计需求制定测试计划，设计测试数据和测试用例；3. 熟悉主流测试工具，包括缺陷管理，测试管理，自动化测试工具等；4. 熟悉MySQL、linux系统，掌握Python、Java编程更佳；5. 掌握良好的测试理念、测试方法，具有良好的业务理解能力、交流、沟通能力，能够清晰准确的描述BUG；6. 有较好的协调能力，以及具有良好的团队意识和合作精神。,"移动互联网,教育",2000人以上,python,长沙
etl工程师,https://www.lagou.com/jobs/7197743.html,天心区,10k-15k,深圳市华盛天成科技有限公司,3-5年,不限,薪资高，福利好,工作职责：1、负责数据仓库ETL详细设计，ETL作业开发工作；2、根据业务需求开发ETL作业，对数据进行加工、转换、汇总，实现复杂的业务逻辑；3、负责Informatica相关产品组件的配置开发与系统运维等；4、分析SQL执行效率，提升SQL执行速度；5、参与数据仓库/数据集市的模型设计；岗位需求：1. 计算机相关专业，3年以上数据仓库ETL相关工作经验，电力行业优先；2. 掌握数据仓库ETL开发方法论，了解数据仓库维度建模；3. 熟悉Informatica相关产品组件（包括PowerCenter(PWC)、Big Data Management（BDM）、EDC、DIH、AXON、MDM等优先；4. 至少熟悉一种主流ETL开发工具，如：Kettle、DataStage等，Informatica优先；5. 至少熟悉两种常见数据库，Hive/Oracle/SQLServer/PostgreSQL/DB2/Hbase等；6. 熟悉SQL，具备SQL性能优化能力，熟悉Hive SQL，有大数据处理能力者优先；7. 熟悉Linux/Unix环境及脚本开发（shell或python等）。,"软件开发,物联网",150-500人,python,长沙
深度学习算法工程师,https://www.lagou.com/jobs/6469225.html,开福区,15k-30k,开易（北京）科技有限公司,3-5年,硕士,弹性工作、技术大牛、**团队、零食茶饮,工作内容：1. 深度学习计算机视觉技术研发，领域包括但不限于图像分类、目标检测、目标识别、关键点检测、语义分割等。2. 深度学习下，针对特定硬件特点的网络结构模型设计与搜索。岗位要求：1. 计算机视觉或相关方向硕士及以上；2. 具有良好的能动性、沟通能力、团队合作精神；3. 熟练掌握C/C++、Python，有相关项目经历；4. 能够跟踪最新技术，熟练阅读领域论文，并拥有较强算法实现能力，有ACM/ICPC 等编程竞赛经验者优先；5. 熟悉并熟练使用Caffe、MxNet、Tensorflow、PyTorch等任一种深度学习开源框架者优先；6. 熟悉神经网络模型的设计、调参、优化方法，熟悉小模型、移动端模型调参者优先；7. 对样本敏感，有过基于大规模样本的机器学习（深度学习）项目者优先。,"数据服务,其他",150-500人,python,长沙
算法分析师（实习）,https://www.lagou.com/jobs/6886334.html,岳麓区,5k-10k,湖南刺猬安全技术咨询有限公司,应届毕业生,本科,职位晋升；年终奖；条件优秀者待遇可面谈。,岗位职责：1.运用统计方法和机器学习方法，构建国际公共安全形势分析、突发事件影响分析、等业务所需的计量模型；2.配合研发部门将模型产品化，并推进相关算法的迭代完善；3.通过数据分析方法持续验证和优化模型及算法的可靠性；4.研究最新的建模理念和算法技术，为公司产品决策提供合理化建议。5.对业务数据进行整合、分析挖掘，挖掘用户行为特征，为产品、运营决策提供业务分析及数据支持任职资格：1.大学本科及以上学历，计算机/数学/信息类专业优先，985院校优先。2.熟悉常见分析方法及模型，如案例研究法、定量分析法、形式模型法和诠释法等，有过国际关系研究的相关建模经验者优先；3.精通至少一种数据分析/挖掘语言，如R/Python/SAS/Mahout等，熟悉至少一种数据库操作，如Hive/Mysql/Hadoop/Oracle等；4.对机器学习算法有了解的优先；5.具备业务快速学习和理解能力，有强大的自驱力；,"移动互联网,信息安全",15-50人,python,长沙
Java开发工程师（定制化项目）,https://www.lagou.com/jobs/7163920.html,岳麓区,9k-13k,上海海典软件股份有限公司,3-5年,本科,公司行业领先，互联网医药，大牛团队,"岗位职责：1、独立负责公司核心的开发任务，解决技术难题；2、编写完成任务的开发文档、产品设计思路；3、能够根据客户需求制定相关技术与产品的解决方案；4、带领部门初级开发人员的成长。任职要求：1、计算机或相关专业本科或以上学历，具有3年或以上软件开发相关工作经验；2、熟悉Oracle/MySql/SQLServer等数据库基础知识，熟悉存储过程、触发器，有数据库调优能力者优先;3、精通Java，熟练使用SpringMVC、Mybatis、Spring Boot等常用框架和技术，熟悉常用的消息中间件RocketMQ、RabbitMQ或Kafaka中的一种或多种,熟悉html、js、jquery等前端技术;4、了解其它C++、JS、C#、Python等开发语言中的一种；5、良好的沟通能力及团队合作精神，责任心强；6、有医药行业或流通软件行业从业经验优先。",医疗丨健康,150-500人,python,长沙
