job_name,job_url,job_location,job_salary,job_company,job_experience,job_class,job_given,job_detail,company_type,company_person,search_key,city
高级开发工程师（大数据方向）-西安,https://www.lagou.com/jobs/6816558.html,未央区,20k-25k,联通系统集成有限公司,5-10年,本科,公司平台大 福利待遇优 发展前景好,工作职责 1. 参与进行客户业务需求、数据分析需求的调研、收集与分析；2. 负责大数据存储、计算平台搭建和开发；负责根据具体应用场景进行技术选型；3. 负责数据仓库建设，数据抽取、清洗、转化等数据处理程序开发。4. 负责新技术调研、测试和落地应用；岗位要求 1. 211或985学校毕业，计算机相关专业，全日制本科及以上学历，年龄在35周岁以下； 2. 5年以上Java或者Scala实际使用经验，能熟练的进行线程，高并发编程；3. 熟悉JVM运行机制，对于JVM调优有实际经验；了解JMM内存模型；3. 有HiveSQL、SparkSQL编写优化有丰富经验，能够进行相关平台参数进行优化；4. 对于Hadoop生态圈以及各种框架的使用有丰富的经验；5. 对于Spark、Flink、Flume、ES、Clickhouse中的一种或者几种有实际使用经验更佳；阅读过源码优先6. 参与过大型分布式系统开发，优秀的解决问题能力，对olap batch和stream程序有深刻的认知。7. 具备良好的文档撰写能力和技术团队管理能力；具备良好的团队合作精神，较强的沟通能力，喜欢挑战，执行力强。,通讯电子,2000人以上,数据仓库,西安
JAVA高级开发工程师-Hadoop方向,https://www.lagou.com/jobs/7016623.html,碑林区,6k-12k,西安合智宇信息科技有限公司,3-5年,本科,行业前景好,1. 全日制本科及以上学历，4年以上JAVA或Hadoop开发经验2. 熟练掌握设计模式，多线程，JVM，socket3. 熟练掌握JAVA开源生态，如：Spring全家桶，Mybatis等，并了解其实现原理，熟练掌握主流中间件，MySQL，RabbitMQ，EMQX，Redis，Zookeeper等4. 有分布式项目开发经验，不限于Dubbo，Spring Cloud5、熟练使用linux（centos 7）系统，会编写较复杂Shell6. 精通Hadoop、Hive、HBase原理及优化，熟悉大数据生态技术圈，如Storm、Spark、Flume、Sqoop、Kafka、Zookeeper、ES等，有大规模集群架构设计、开发及管理经验；7. 熟练使用SQL语言，掌握Oracle、DB2、GP、MySQL等至少两种数据库系统的使用，有较好的SQL性能调优经验；8. 熟悉数据治理及应用，元数据管理的设计与应用；9. 熟悉数据仓库模型的设计，分层设计原理，并结合大数据技术组建解决模型应用的问题；10. 优秀的分析和解决问题的能力，对挑战性问题充满激情；11. 具备良好的文档撰写能力和技术团队管理能力；12. 具备良好的团队合作精神，较强的沟通能力，具备良好的技术领导能力；13. 有Hive数据仓库或者Apache Kylin的开发经验者优先考虑；14.有工业自动化行业大数据项目经历者优先,"信息安全,软件开发",15-50人,数据仓库,西安
后台开发工程师,https://www.lagou.com/jobs/6777352.html,高新技术产业开发区,13k-25k,中国联合网络通信有限公司西安软件研究院,3-5年,本科,周末双休 五险一金 绩效奖金 餐补,职位描述：1.参与业务需求评审、软件功能需求分析与设计工作；2.参与代码的编写工作，完成单元测试；3.配合测试人员完成系统测试及改进工作；4.负责关键技术的预研和攻关，提高系统的扩展性、稳定性和安全性；5.完成领导交办的其它工作。任职要求：一、专业知识：计算机、通信、信息系统等相关专业；二、工作经验：本科及以上学历，3年及以上相关经验三、专业技能1.有2年以上 java 开发经验，扎实的 java 编程基础， 熟悉 Spring、Spring Boot、Spring Cloud 等框架；2.熟悉微服务架构，有 REST API 接口经验；熟悉 HTTP、Restful API、具有大规模软件系统的设计能力；3.熟悉linux操作系统及相关操作指令；4. 熟悉mysql、mongodb等主流数据库，熟悉kafka、rabbitMQ等主流消息中间件；5.熟悉容器技术，包括 Docker，mesos，k8s 等 。6. 熟悉jdk8新特性，有快速接受并掌握新技术的能力；7.熟悉Redis、mq等分布式系统常见的中间件，并有实际使用经验者优先；8.熟悉Hadoop/Hive/Spark/Flink，有MapReduce/Spark RDD/Flink开发经验者优先；9.独立或者合作完成过大型项目，网络相关项目更佳优先；10.擅长网络相关功能开发，具有网络、数通相关项目开发经验优先；11.熟悉数据仓库以及维度建模原理，有数据仓库建设经验者优先；12.熟悉运营商B域业务者优先。四、综合素质：1. 具有较好的沟通能力；2. 具有良好的文档设计与编写能力；3. 诚实、踏实、认真负责，能承受一定强度的工作压力；4. 具备较强的组织、学习、创新、协调和沟通能力。五、年龄：原则上不超过30周岁，特别优秀的可以放宽到35周岁。招聘人数:15人,"信息安全,数据服务",150-500人,数据仓库,西安
数据开发工程师,https://www.lagou.com/jobs/5856399.html,莲湖区,8k-12k,江苏盈达信息技术有限公司,3-5年,本科,五险一金 绩效奖金 餐补 定期体检,职位描述：1、参与项目需求分析工作；2、参与DB2数据模型设计，数据处理过程设计以及相关的存储过程开发工作；3、负债日常运维工作；4、熟练掌握SQL的基本语法； 任职要求：1、计算机或电子相关专业本科以上学历，从事银行金融数据库领域3年以上工作经验，具备数据库模型设计、数据仓库与ETL开发经验；2、良好的沟通能力，有快速学习上手的能力；3、有一定SQL性能调优经验；4、对数据敏感，有数据分析能力；5、有金融数据处理经验者优先；,移动互联网,150-500人,数据仓库,西安
算法工程师,https://www.lagou.com/jobs/5101454.html,雁塔区,20k-35k,深圳了然视觉科技有限公司,不限,硕士,"前沿技术,团队实力雄厚附带待遇优",1、深入了解产品和业务，对产品和业务问题进行深入分析，为公司运营决策、产品和业务方向、销售策略提供数据支持；2、搭建业务指标体系，通过数据分析及时发现业务问题并协助解决；3、基于产品和业务目标，构建相应的数据模型并验证，指导模型落地；4、机器学习算法以及大规模并行计算的研究；5、数据模型，数据仓库构建与维护；6、具备良好的团队协作精神、吃苦耐劳、忠诚正直、沟通及学习能力强。7.学习成绩优秀，211/985高校毕业优先。,"企业服务,硬件",15-50人,数据仓库,西安
