job_name,job_url,job_location,job_salary,job_company,job_experience,job_class,job_given,job_detail,company_type,company_person,search_key,city
中级测试工程师,https://www.lagou.com/jobs/5836206.html,天河区,8k-14k,广州向日葵信息科技有限公司,3-5年,本科,"5险1金,弹性上班,餐费补贴",岗位职责：1、负责产品线测试的全流程，包括参与需求分析、设计评审，制定测试计划、组织用例评审、保证项目的质量和进度；2、根据产品架构和业务要求，制定和推进测试策略，测试计划和测试方法；主导执行项目测试；3、执行测试发现缺陷，确认缺陷和协调修复缺陷4、保障服务质量和进度，有流程优化，技术创新意识，不断优化产品迭代方式，并主动通过技术手段提升测试效率（如引进自动化测试方案等）；5、对产品、流程剔除持续性改进意见岗位要求：1、计算机相关专业，正规统招本科及以上学历；2、3年或以上测试经验，负责过大型互联网产品、电商等领域相关测试者优先；3、熟悉Linux或Unix操作系统，熟悉Java/Python/PHP等至少一种编程语言；4、了解自动化测试框架以及自动化框架部署，熟悉自动化的编写和推广，有用技术手段解决复杂问题、通过建设工具或系统来保障质量的能力；5、对软件测试有浓厚的兴趣和丰富的经验，善于发现、分析和总结问题，6、学习能力强，能承受一定工作压力，富有团队精神，有责任心，良好的沟通能力；,"消费生活,金融",150-500人,测试,广东
中高级测试工程师：,https://www.lagou.com/jobs/6994322.html,龙岗区,12k-15k,深圳开思时代科技有限公司,5-10年,不限,节日福利，绩效奖金，带团队,中高级测试工程师：岗位要求：1.计算机或相关专业，本科学历，从事测试工作5~10年，熟悉软件测试流程、规范和实施；2.深入理解业务需求，制定测试方案，测试需求分解以及测试用例编写；3.执行项目测试，包括构建测试环境，执行接口测试，Web端/app端专项测试，性能测试等；4.通过测试的相关流程，策略，方法和工具等创新，努力提升测试的质量和效率；5.进行缺陷跟踪和后期质量评估分析；6.解决测试过程中遇到的各种问题；7.适应敏捷流程，能准确定位问题，协助解决问题并从测试的角度提供优化意见；8.熟练MySQL数据库的各类基本操作；9.熟练Linux系统操作，主动性强愿意提高自身技术水平；10.熟练JAVA或其他编程语言，熟练使用1种以上自动化测试工具者优先；11.有性能测试，接口测试工作经验者优先,"移动互联网,电商",500-2000人,测试,广东
中高级测试工程师,https://www.lagou.com/jobs/7080562.html,海珠区,8k-16k,广东省广告集团股份有限公司,3-5年,本科,广告营销大平台，福利全，氛围好，大牛带队,岗位职责：1、负责产品的测试方案制定、策略分析、用例设计、测试执行、风险评估等工作；2、独立负责产品的质量保障工作，包含功能、性能、安全、兼容、自动化等方面；3、负责项目整体的质量把控，制定测试方案、计划、跟进项目进度风险，监控项目外网质量并实施改进；4、负责收集和分析业务测试需求，探索更多的测试手段和维度，帮助提升测试质量、效率和深度；技术要求：1、全日制本科计算机相关专业毕业，3年以上软件测试经验；2、熟悉软件工程、软件测试流程和规范，掌握多种软件测试手段；3、具备良好的团队协助和沟通能力，表达能力强，有责任感；4、熟悉功能测试、性能测试、以及压力测试等，精通WEB测试；5、熟悉linux操作系统常用命令、Mysql、Redis数据库等，能够编写SQL语句；6、熟悉敏捷测试流程，有互联网广告产品测试经验及大数据平台测试经验者优先；7、有较强的主动性、责任心、抗压能力，热爱新技术的学习&实践。,广告营销,2000人以上,测试,广东
渗透测试工程师,https://www.lagou.com/jobs/7111603.html,福田区,15k-30k,深圳平安综合金融服务有限公司,3-5年,本科,平台大，福利好，年终奖,岗位职责:1、以攻促防，以专业APT黑客视角模拟攻击，挖掘银行内部更多的攻击面和风险盲点;2、负责安全漏洞和木马**的分析和应急响应；3、负责研究跟进业界新安全技术动态；岗位要求:1、渗透测试思维敏捷，独特，熟练掌握各种攻击方法并且对其原理有深入了解；2、拥有大型企业内外网完整渗透测试经验，对APT有深入研究或有实践经验；3、熟悉python，JAVA等一种脚本语言，有安全工具/平台的开发经验，具备源码审计漏洞挖掘的能力;加分项：有国内外大型CTF参赛经验并取得突出成绩,金融,2000人以上,测试,广东
高级测试工程师,https://www.lagou.com/jobs/6128736.html,南山区,20k-30k,深圳市移卡科技有限公司,5-10年,本科,"发展空间,氛围好,地铁附近",岗位职责：1. 评审研发的需求输入和设计输出；2. 主导APP、WEB、业务系统的测试；3. 规范测试流程和制度；4. 搭建优化自动化性能测试环境；5. 管理测试团队及成员；6. 对版本的测试进度和质量负责；岗位要求：1、具备自动化性能测试的技能；2、熟悉APP、WEB的兼容性测试；3、测试工作2-3年以上管理经验，5-10年软件测试经验4、有互联网或金融收单行业经验优先。5、本科以上学历,移动互联网,500-2000人,测试,广东
测试工程师（2020校园招聘）,https://www.lagou.com/jobs/6334274.html,天河区,6k-10k,广州百田信息科技有限公司,应届毕业生,本科,"福利好,有大咖带,上升空间大",职位描述：1. 理解产品功能说明书并评估具体质量保证实现资源需求。2. 管理和执行版本构造活动。3. 系统功能测试。4. 与产品，开发和运维等人员协同工作。 职位要求：1. 本科以上学历。2. 熟悉计算机系统，具有测试基础。3. 热爱测试工作。,"移动互联网,游戏",500-2000人,测试,广东
测试实习生,https://www.lagou.com/jobs/6974032.html,南山区,2k-4k,睿魔智能科技（深圳）有限公司,应届毕业生,本科,前沿科技 弹性工作 留用机会,岗位职责：1、负责公司产品的业务功能测试，确保产品质量；2、按测试计划执行分配的测试任务，及时提交和跟踪缺陷，协助开发人员定位重现缺陷，推动缺陷的及时合理的解决。3、根据产品测试的实际情况，编写相应的测试分析报告和相关文档，定期向上级汇报项目进展情况。任职资格：1、本科及以上的在校学生，软件工程、计算机技术等相关专业；2、熟悉开发流程以及测试理论，有智能硬件产品测试经验优先考虑；3、需掌握Linux常用命令，至少掌握一门编程语言，如Python/JAVA；4、具有良好的逻辑思维及学习能力；5、工作积极主动，认真负责，执行力强。良好的沟通表达能力，优秀的文档撰写能力；6、该岗位要求每周至少实习四天，实习时间不少于3个月。加分项：摄影摄像、无人机、机器人爱好者,"硬件,其他",50-150人,测试,广东
中高级测试工程师,https://www.lagou.com/jobs/2350305.html,海珠区,10k-20k,广州市巴图鲁信息科技有限公司,不限,本科,弹性上班、周末双休、扁平管理、股票期权,岗位描述1、负责业务线产品需求分析，利用相关方法和工具进行软件测试分析，制定测试策略，设计测试方案；2、负责项目过程数据收集分析，提出业务线持续改进意见；3、利用平台工具实施快速测试，实现敏捷测试，快速解决项目问题，提高产品质量；4、负责制定自动化测试策略，实现自动化测试用例，提高测试效率；5、参与产品线产品规划、产品设计，对产品提出建设性意见，提升产品用户体验。职位要求：1、计算机相关专业本科以上学历；2、2年以上相关工作经验，3、熟悉软件测试理论、方法、工具，了解敏捷测试方法；4、熟悉互联网应用技术，了解互联网产品特点，了解互联网用户行为和习惯；5、掌握相关软件技术，熟悉JavaWeb应用，熟悉Junit测试框架；6、具有较强的沟通能力、主动学习能力、自我驱动力。,汽车丨出行,500-2000人,测试,广东
测试工程师（实习生/应届生）,https://www.lagou.com/jobs/7111031.html,海珠区,3k-4k,广州市巴图鲁信息科技有限公司,应届毕业生,不限,"弹性上班制,技术杠杠,扁平管理",岗位职责：1、负责移动平台APP、M站、PC端等产品的功能测试及专项测试；2、负责根据需求完成测试计划及测试用例的编写；3、负责根据测试用例进行测试执行工作，实施接口和功能测试，记录缺陷并跟进处理情况，协助开发人员定位问题；4、参与产品需求讨论、设计评审，在各环节与开发、产品等成员积极有效沟通，推动问题解决，保证产品质量。任职要求：1、统招本科及以上学历，计算机或相关专业；2、了解测试基本理论、技术与流程；3、最好掌握java、shell、python等语言中的一种，对linux、mysql有一定了解，有SQL能力；4、良好的沟通与表达能力、思路清晰，较强的动手能力与逻辑分析能力；5、有强烈的责任心，自驱力和自学能力，对技术有热情；6、良好的团队协作者，具备优秀的跨团队协作、补位能力。,汽车丨出行,500-2000人,测试,广东
急招测试工程师,https://www.lagou.com/jobs/7061697.html,罗湖区,10k-15k,北京联龙博通电子商务技术有限公司,3-5年,本科,五险一金周末双休加班补助餐补年底双薪,1、全日制统招本科以上学历，计算机相关专业，具备必须的软件测试理论和测试技能。2、熟悉测试理论和方法，掌握杭甬测试工具和Linux基本操作3、熟悉自动化测试和接口测试4、熟悉JAVA，能够编写简单的测试代码5、有后台测试经验6、熟悉系统架构以及系统间接口的通讯7、熟悉银行业务，3年以上测试经验以及1年以上银行工作经验,"移动互联网,电商",2000人以上,测试,广东
测试主管,https://www.lagou.com/jobs/6673220.html,天河区,10k-15k,广州卖家宝信息技术咨询有限公司,5-10年,不限,带薪年假 五险一金 年终奖 季度活动,岗位职责：1. 理解产品需求，设计测试用例、编写测试报告，并按测试计划和流程完成测试任务；2. 有效地执行，运用黑盒测试人工执行软件质量测试，完成相关的功能测试、接口测试、性能测试等测试工作；3. 记录测试过程，对问题进行报告、跟踪、汇总，并协助开发人员；4. 根据需求和交付要求编写测试脚本，搭建及维护测试环境，执行测试及Bug跟踪；5. 根据项目测试计划制定测试用例并实施，编写测试报告等相关文档，保证系统质量和进度；6. 有2年以上的团队管理经验，具备对测试人员进行培训和指导的能力。任职要求：1. 计算机、软件工程或其他相关专业，本科及以上学历；2. 5年以上的软件测试经验有开发工作经验者优先；3. 责任心强，细致耐心，善于沟通和协调，积极主动，能够独立承担产品测试工作；4. 熟悉软件测试流程和方法，熟悉软件工程知识；5. 热爱软件测试工作，有较强的逻辑分析能力，总结能力，工作细致认真，有耐心；6. 熟悉C#语言，能独立的搭建各种测试环境；7. 熟练掌握测试计划及测试报告的编写；8. 熟练掌握SQL Server数据库系统的使用；9. 良好的沟通能力与团队协作能力，高度的工作责任心和敬业精神。,电商,150-500人,测试,广东
整机测试工程师,https://www.lagou.com/jobs/7062249.html,南山区,8k-15k,深圳市同为数码科技股份有限公司,1-3年,不限,上市公司,岗位职责：1、负责摄像机项目测试进度跟踪，单板硬件信号/整机接口/性能/可靠性测试工作；2、负责摄像机项目测试方案制定，包括单板硬件测试、系统测试、温升测试、功耗测试、可靠性测试、WiFi和蓝牙测试等；3、负责摄像机项目测试阶段点质量控制和质量评审工作；4、负责摄像机项目的认证测试支持工作；5、负责测试过程中问题的反馈、跟进、关闭；任职资格：1、本科及以上学历，通讯、计算机、电子、自动化类专业；2、2年以上相关经验，有安防监控摄像机测试经验优先；3、对测试工作具有较浓厚的兴起，做事认真踏实细致，有较好的团队协作精神和较强的产品质量意识；,信息安全,500-2000人,测试,广东
高级测试工程师,https://www.lagou.com/jobs/6930124.html,越秀区,15k-20k,广东中视信息科技有限公司,5-10年,大专,高薪招聘，成长快速。风口平台，行业前沿。,工作内容：1、核心测试项专项测试；2、培养初中级测试工程师成长；3、线上问题闭关。任职要求：1、计算机相关专业，本科及以上学历；2、有自动化或者性能方面的工作沉淀；3、至少掌握一门脚本类语言（python优先）；4、具备一定的产品思维，5、高度责任感。,"数据服务,软件开发",50-150人,测试,广东
高级测试工程师,https://www.lagou.com/jobs/7032676.html,天河区,11k-14k,广州中康资讯股份有限公司,3-5年,本科,智慧医疗、人工智能、医疗信息化,工作职责：1.与产品，开发沟通配合，理解产品需求，挖掘产品内部逻辑， 并结合用户使用场景进行测试方案和测试用例的设计、讨论、完善和维护；2. 负责测试执行，bug定位跟踪及解决，并协助开发分析解决问题；3. 跟进项目迭代，能预估风险，推进项目进度，保证项目质量；4. 学习掌握产品的技术架构，持续改进测试方法，提高测试效率、质量和覆盖；5. 熟练使用脚本和自动化工具提高日常任务的执行效率和准确程度；任职资格：1. 计算机或相关专业，本科及以上学历，5年以上WEB端/移动端/服务端测试经验；2. 熟悉软件测试流程，具备一定的质量改进推动能力；有管理经验、商城测试经验者优先；3. 掌握各种常见软件测试技术、方法和工具，如功能测试、性能测试、兼容性测试等；4. 熟练掌握SQL、Linux基本命令；熟悉基础网络知识，熟悉http/https协议，有接口测试经验，熟练使用fiddler等抓包工具；5. 熟悉Java/Python等至少一种编程语言;,"移动互联网,医疗丨健康",150-500人,测试,广东
大数据测试,https://www.lagou.com/jobs/7182030.html,福田区,11k-19k,上海海万信息科技股份有限公司,3-5年,大专,"五险一金,带薪年假,办公环境好,周末双休","岗位要求：1、3年以上软件测试、开发相关经验, 精通测试理论； 2、有丰富的数据分析、数据仓库、大数据测试经验，对数据有较高敏感性； 3、精通sql，熟悉存储过程； 4、具备shell、python脚本编程能力、有自动化测试经验优先； 5、熟悉Hadoop、spark、hive等，具有大型分布式数据库测试经验优先； 6、良好的沟通协作能力，抗压能力强。","移动互联网,金融",500-2000人,测试,广东
Java测试,https://www.lagou.com/jobs/6989359.html,福田区,10k-20k,上海海万信息科技股份有限公司,3-5年,本科,大平台、五险一金、交通便利、新技术,"岗位职责: 任职要求：1、本科以上学历，计算机相关专业，三年以上测试工作经验。2、善于沟通，认真负责，积极主动，抗压能力强。3、技能方面:1）有较强的接口测试能力，熟悉jmeter,postman等测试工具。2）有web测试、性能测试经验和熟悉sql语法命令。3）熟悉RobotFramework、Selenium、python等自动化测试工具。4）有JAVA编程或者金融、保险测试工作经验优先考虑。","移动互联网,金融",500-2000人,测试,广东
业务测试Leader,https://www.lagou.com/jobs/6687894.html,南山区,30k-50k,深圳虾皮信息科技有限公司,5-10年,本科,外企氛围，蓝海市场，大牛多多，15天年假,"岗位职责：1、参与产品可行性研究，提出可测性需求，参与产品需求分析，制定测试策略、方案及计划，统筹资源和任务分配，保证项目的测试进度和质量；2、分析产品性能测试需求，设计性能测试方案，执行性能测试和分析，预测系统性能瓶颈、风险和安全隐患，负责线上缺陷跟踪及分析；为网站容量规划提供数据及建议；3、制定测试计划,根据需求设计测试用例,根据测试用例进行测试执行工作，并对缺陷进行跟踪，推动问题及时解决；4、根据项目特点(WEB、手机APP、后台API)，开发或使用合适的测试工具实现自动化测试；5、负责项目内测试团队的成员工作分配、技术指导和项目进度跟进，确保交付时间和质量；6、建设人才团队，优化测试工具，提高测试效率。岗位要求：1、统招本科及以上学历，计算机相关专业，5年及以上全职测试或开发工作经验，1年及以上团队（5人及以上）管理经验；有电商类相关测试经验优先，负责过中大型的项目测试工作优先；2、有独立负责项目经验及出色的测试构架能力，熟悉测试流程和规范，熟练掌握软件测试方法，熟悉灰盒测试、安全测试、自动化测试、性能测试等；3、熟练使用任意一种常用的自动化或性能测试工具（QTP、LoadRunner、Selenium、Appium、Jmeter、Locust等），缺陷管理跟踪软件（禅道、Jira、QC等），持续集成工具Jenkins；4、有搭建自动化测试平台的实战经验者优先；5、具备良好的开发基础，至少熟悉Python/Java/Go等一种开发语言；6、熟练使用版本控制工具，熟悉Linux操作系统，熟悉TCP/HTTPS等网络协议，熟悉MySQL/Oracle等数据库；7、较强的表达沟通能力、团队合作精神，工作细致、责任心强，较强的逻辑分析总结能力和学习能力；8、需要有一定的英文听说读写能力，英文优秀者优先。",电商,500-2000人,测试,广东
系统测试工程师,https://www.lagou.com/jobs/6703202.html,南山区,15k-30k,深圳虾皮信息科技有限公司,1-3年,本科,外企氛围，蓝海市场，大牛多多，15天年假,岗位职责：1、参与产品需求分析，制定测试策略、方案及计划，设计测试用例，进行测试执行工作，并对缺陷进行跟踪，推动问题及时解决，保证项目的测试进度和质量；2、参与设计评审、代码评审；进行API接口测试，并实现自动化；使用灰盒和白盒测试方法进行系统测试；3、设计性能测试方案，执行性能测试和分析，预测系统性能瓶颈、风险和安全隐患，负责线上缺陷跟踪及分析；4、使用或开发安全测试工具，进行安全测试；5、参与开发或引进测试工具和测试方法，提升团队的测试质量和效率； 任职要求：1、统招本科及以上学历，计算机相关专业，1年及以上全职测试或开发工作经验；有电商类相关测试经验优先，参与过中大型的项目测试工作优先；2、熟悉测试流程和规范，熟练掌握软件测试方法，熟悉灰盒测试、安全测试、自动化测试、性能测试等；3、熟练使用任意一种常用的自动化或性能测试工具（QTP、LoadRunner、Selenium、Appium、Jmeter、Locust等），缺陷管理跟踪软件（禅道、Jira、QC等），持续集成工具Jenkins；4、具备良好的开发基础，至少熟悉Python/Java/Go等一种开发语言；5、熟练使用版本控制工具，熟悉Linux操作系统，熟悉TCP/HTTPS等网络协议，熟悉MySQL/Oracle等数据库；6、较强的表达沟通能力、团队合作精神，工作细致、责任心强，较强的逻辑分析总结能力和学习能力；7、需要有一定的英文读写能力，英文优秀者优先。,电商,500-2000人,测试,广东
高级测试工程师,https://www.lagou.com/jobs/6391085.html,天河区,15k-30k,广州合摩计算机科技有限公司,5-10年,不限,"多牛人,架构扁平,上升空间大",职位描述：1. 参与产品需求和架构设计评审，对需求和设计进行有效性分析，识别相关风险及保障产品的可测试性；2. 参与产品的全流程测试，通过测试相关流程、方法和工具等创新，提升测试的质量；3. 根据项目需要开发测试工具，提高测试团队工作效率及测试深度。任职要求：1. 熟悉Java/Python/Shell等至少一种编程语言，至少2年以上软件开发或自动化测试工作经验；2. 熟悉性能测试、自动化测试、安全测试及白盒测试领域之一；3. 能够主动发现和解决测试关键问题；4. 有独立设计测试框架经验者优先。,移动互联网,150-500人,测试,广东
测试高级工程师,https://www.lagou.com/jobs/7209747.html,龙华新区,10k-17k,深圳市绿联科技有限公司,5-10年,本科,团队管理，技术精进，晋升通道完善,技能要求：android测试，APP、web端测试，软件测试为主，接触过相关产品测试。工作职责：1、参与需求分析，编写测试计划和测试用例，负责App测试工作；2、熟练编写用例，组织用例评审，有效执行测试，准确定位bug且跟进解决；3、对产品进行功能、兼容、接口、安全及其他方面的测试；4、用户反馈问题的及时跟进和记录，并协助问题的解决。任职要求：1、电子、计算机、自动化等相关专业， 5年及以上软件测试相关工作经验，2年以上团队管理经验；2、熟悉客户端软件测试流程，做过手机app方面的应用测试；3、熟练linux操作系统及常用的操作命令，能编写自动化脚本；4、有TV、机顶盒等产品相关测试和Android系统测试经验或者做过云存储及智能家居项目者更佳；5、工作积极主动，认真负责，较强沟通能力和具有团队协作精神。,电商,500-2000人,测试,广东
AIoT服务端测试高级工程师/测试专家,https://www.lagou.com/jobs/7208951.html,龙华新区,25k-50k,北京三快在线科技有限公司,3-5年,本科,大平台新业务，技术氛围好，业务负责度高,小象事业部在美团“Food＋Platform”战略聚焦下，承载着“深耕生鲜零售，提升消费体验”的任务，先后推出小象生鲜和美团买菜两个自营生鲜零售业务。其中，小象生鲜是集生鲜食品、餐饮、电商和即时配送于一体的线上线下一体化生鲜超市，目前在北京拥有两家门店；美团买菜则定位为社区居民的“手机菜篮子“，采用“手机APP+便民服务站”模式，聚焦三餐食材，为社区居民提供生鲜零售及配送服务，目前已在北京、上海、武汉三地开出多家服务站。岗位职责：1. 负责AIoT中心服务端及web产品的功能测试、接口测试、性能测试； 2. 参与需求及技术评审，制定测试计划，设计测试用例，组织及执行整个测试流程（模块、集成和回归测试），跟踪分析、推动解决测试过程中问题及线上问题； 3. 优化产品研发测试上线流程，维护测试环境及测试数据，制定测试策略提高产品质量和测试效率； 4. 引进和完善测试方法，开发测试工具，构建测试框架，开发维护case；5. 构建服务端CI环境，将功能测试、接口测试和压力测试集成到CI环境中。6. 指导初级、中级工程师，攻克技术难题，和团队共同成长。任职要求：1. 计算机或相关专业本科及以上学历，服务端测试方向3年及以上经验；2. 有良好的编程能力（熟悉Java编程，并熟悉Ruby/Python/JavaScript/Shell等脚本编程中至少一种）；3. 熟悉常用软件测试流程和测试用例设计方法，了解常见问题的处理方案；4. 熟练使用常用测试工具，熟练操作数据库，了解互联网相关协议，熟悉常见互联网架构，熟练使用一种开发语言；5. 有良好的逻辑分析能力和沟通能力，快速学习能力，有责任感主动性强，良好的团队合作精神，能适应一定压力的工作。加分项：1. 熟悉压力测试，熟练使用压测工具Jmeter / Load Runner / http_load等；可以通过压测快速发现系统的瓶颈并提供解决办法；2. JVM原理的深入了解，如内存管理、类加载机制等。岗位亮点：1. 有机会全身心地参与新零售业态，体验并掌握各个环节的核心技术要素，和团队一起对供应链、采销、仓配等行业技能进行全新的升级、再造；2. 利用物联网和AI技术为新零售行业赋能;3. 能和电商、O2O、物流、零售、人工智能等多元化背景的团队技术大牛一起，综合学习，共同进步。,消费生活,2000人以上,测试,广东
