job_name,job_url,job_location,job_salary,job_company,job_experience,job_class,job_given,job_detail,company_type,company_person,search_key,city
IOS开发工程师,https://www.lagou.com/jobs/7119356.html,宝安区,13k-18k,中山师兄在线网络科技有限公司,3-5年,本科,成为平台学员企业投资人,"主要职责1.根据需求进行iOS平台客户端软件的设计、开发和维护,分析和发现系统的优化点；2.与项目相关人员配合共同完成应用软件的架构设计，具体业务开发设计工作；3.按照项工作目计划在保证质量的前提下、按时完成开发任务；4.学习和研究新技术以满足产品的新需求。5.对人工智能有理解能加分6.对大型互联网后台架构设计有了解能加分任职要求1.BAT等大型互联网企业工作经历着优先考虑，但工作年限不限制，只要满足要求应届生也可；2.3年以上开发工作经验；3.熟练掌握OBJC，Swift语言、iOS framework、xCode开发环境，熟练掌握iOS界面和交互开发，Linux下环境配置/搭建/运维操作；4.有良好编码风格，有较强的代码阅读能力和学习能力，追求代码执行效率；5.对APP网络相关调试，性能优化，内存优化和本地存储优化有一定了解，熟练掌握iOS，MAC平台下的代码调试和调优技术；熟悉Linux环境下软件发布，配置，运维的常规手段，熟悉各类商业云运用有加分；6.具备较强的业务逻辑理解、需求分析能力；7.良好的沟通技能，以及团队合作能力，能承受较大工作压力；8.数学优秀有加分；","移动互联网,企业服务",15-50人,人工智能,深圳
风控安全算法工程师,https://www.lagou.com/jobs/6642737.html,南山区,30k-60k,腾讯科技（深圳）有限公司,5-10年,本科,微信支付业务、发展空间大,"工作职责：1.     针对微信支付各类风控系统/模型，应用包括但不限于文本对抗、图对抗等前沿技术手段，探测决策边界，并生成对抗样本，优化风控模型；2.     负责对微信支付各类金融业务的风控模型进行模型评估与验证，能对各类攻击进行监控与溯源，并给出改进方案；3.     研究各类（有/无目标，黑/白盒等）安全攻防对抗技术，能从攻击者视角看问题，不断提升业务风险管理、防御、及预警能力，并指导技术团队进行安全攻防系统的研发与搭建。 工作要求：1.    本科及以上学历，计算机、应用数学、模式识别、人工智能、统计学等专业5年以上工作经验，熟悉Hadoop/spark等大数据计算平台；2.     有扎实的统计分析、机器学习理论基础和实战能力，具备优秀的逻辑思维能力及数据分析能力；精通一种或多种前言算法模型如NLP前言技术、深度学习、迁移学习、生成对抗等；熟悉sklearn／TensorFlow／Torch／Keras等机器学习及深度学习框架的使用；3.    对新技术充满好奇心，爱挑战高难度，善于发散思维并能快速动手验证加分项：1.    在NLP, Machine Learning, Data Mining相关领域**会议/期刊有发表过论文的优先2.    有利用新技术研究互联网黑产对抗行为者优先；有对抗样本及对抗训练经验者优先；具备算法部署及工程化能力者优先。",社交,2000人以上,人工智能,深圳
前端开发/体验开发工程师,https://www.lagou.com/jobs/6508515.html,南山区,18k-30k,腾讯科技（深圳）有限公司,3-5年,本科,牛人多、探索前沿科技、发展空间大,"岗位职责
 负责腾讯FCC业务相关产品界面的表现层开发，运用技术还原设计理念；
 参与效率提升工具、智能化与创新项目的研发工作；
 从产品业务的视角分析，围绕产品体验和用户增长目标，制定并实施综合性解决方案；
技能要求
 计算机相关专业背景，至少两年Web前端工作经验，有大型站点前端开发及优化实践经验； 
 熟练掌握 HTML5、CSS3 语言，理解W3C标准，理解语义化，遵循主流编码规范； 
 熟练掌握 JavaScript / ES6+，精通一种VueJS, ReactJS 等 MVC/MVVM框架； 
 具备移动端Web / Hybird App 开发经验，掌握多端设备适配技巧，掌握移动站点性能优化方法； 
 具备 SEO 或 ASO 相关优化实践经验，具备一定的数据分析能力； 
 良好的团队协作精神、良好的沟通表达能力、良好的文档写作能力，具备技术方案评估和决策能力。 
加分项
 掌握移动端3D动效及H5游戏开发能力，有ThreeJS / CreateJS 的实际项目开发经验； 
 掌握一门App开发语言（iOS / Android平台），有 原生App / 小程序 的开发和上架经验； 
 掌握 ReactNative / Weex / Rax 开发语言之一，并有实际项目开发经验；
 掌握一门后端开发语言（如 NodeJS、PHP 等），并有实际项目开发经验； 
 掌握 Webpack 等自动化构建工具，有实际业务流程优化经验； 
 了解人工智能领域，对机器学习算法和训练方法有实践经验者优先。",社交,2000人以上,人工智能,深圳
海外架构师（北京/上海/深圳）,https://www.lagou.com/jobs/6882676.html,南山区,30k-50k,北京市商汤科技开发有限公司,5-10年,本科,发展空间大、弹性工作、午餐补助、扁平管理,岗位职责： 1. 负责公共安全和智慧城市等领域海外重点项目和创新项目的整体架构设计，配合一线团队和交付团队完成客户需求分析、方案设计以及最终的交付落地；2. 负责梳理海外市场现状及友商分析，与产品团队配合，沉淀海外标准解决方案、推广策略以及竟合策略等材料，支撑海外市场拓展；3. 负责面向海外客户的高端宣讲活动以及客户交流，提升商汤品牌和方案竞争力。任职要求：1. 具备软件研发经历，熟悉分布式系统原理和设计，有软件架构设计经验者优先；2. 具有5年以上大型项目操盘经验，能够准确把握客户需求，进行合理的系统架构设计；3. 具备公共安全、智慧城市相关行业经验，对人工智能中的机器视觉有一定的了解；4. 具备优秀的文档撰写能力和演讲能力，能够进行高端宣讲和方案交流，有大型活动演讲经验者优先；5. 具备良好的沟通、协调能力，对外能与合作伙伴协同，对内能推动公司资源投入，确保项目落地；6. 具备良好的英语沟通能力，有海外工作经验者优先。,人工智能,2000人以上,人工智能,深圳
高级开发工程师,https://www.lagou.com/jobs/5877643.html,南山区,20k-40k,北京市商汤科技开发有限公司,5-10年,本科,优秀团队，学习机会多,,人工智能,2000人以上,人工智能,深圳
市场总监,https://www.lagou.com/jobs/7163021.html,南山区,15k-25k,深圳爱莫科技有限公司,3-5年,不限,高提成；期权奖励；产品有竞争力,"岗位职责：
 以公司合伙人心态负责市场团队的建设管理，包括目标及预算的制定与控制、激励及考核制度、团队成员培训及指导等；
 负责视觉识别的AI产品线的有效线索获取，通过对“线索获取-项目落地”各环节的转化率进行评估与监控，持续优化推广策略和商务合作模式；
 制定渠道拓展的策略和方法，搭建及维护渠道客户关系；
 能够根据渠道商需求，配合撰写集成解决方案，根据各类渠道商特点，制订技术交流和商务谈判策略。
 完成公司的市场拓展任务和销售任务。
任职资格：1、具有人工智能或安防行业1年以上工作经验；2、对人工智能产品及技术有较深刻的理解，至少熟悉公安/社区/园区/校园/交通等行业解决方案中的一种；3、对B端和G端渠道客户群体有全面认识，具有拓展行业渠道的工作经验，掌握一定的行业渠道资源（方案商、集成商、代理商、渠道商等）；4、具有一定的方案编写、宣讲、技术交流能力；5. 具备敏感的市场意识，分析问题及解决问题能力强，具备优秀的资源整合能力和业务推进能力；6. 具备良好的沟通协调能力及团队合作意识，具备市场团队建设经验者优先。特别优秀的候选人package可面谈。","移动互联网,数据服务",15-50人,人工智能,深圳
高级产品经理,https://www.lagou.com/jobs/6851288.html,南山区,25k-50k,卓望信息技术（北京）有限公司,5-10年,本科,福利好，有晋升空间,"岗位主要工作职责:1.负责收集市场信息和客户需求，阶段性对产品进行规划并制定相关版本计划;2.负责项目核心产品的需求设计、需求编写、设计；3.负责产品研发过程中的资源协调工作，包括主要包括数据、UI、研发、设备等资源;4.负责配合运营团队，关注产品业务数据，进行产品的运营工作，不断优化产品质量;5.根据公司需要，完成领导交办的相关工作。        岗位知识技能及阅历要求:1、本科或以上学历，5年以上互联网产品经理经验，沟通能力强，实操过千万级以上软件/项目整体规划，有政府类项目产品经验优先；2、根据公司战略，负责大数据、人工智能产品的规划和设计；3、市场及行业分析，客户需求分析，竞争对手分析； 4、有一定的市场敏锐度，并能进行产品规划工作； 5、可独立编写市场需求和产品需求文档，可独立进行较大规模产品整体规划；6、熟练运用制作产品原型及产品流程图的工具（Axure , Viso等）； 7、有较强的沟通技巧，有较高的思维归纳和演绎能力； 8、具备产品团队领导能力，能够为团队制定阶段性目标，通过合理分工，完成团队任务。",移动互联网,2000人以上,人工智能,深圳
业务拓展专员（电话销售）,https://www.lagou.com/jobs/7019547.html,南山区,5k-7k,深圳视见医疗科技有限公司,1-3年,大专,周末双休，节日礼物，弹性工作时间,"配合公司客户经理，负责公司面向客户、渠道和产业合作伙伴（以下统称“客户”）的销售工作。通过电话或在线方式进行公司的市场拓展工作，向客户推荐、销售公司人工智能辅助诊断软件、病理切片扫描仪硬件等全系列产品和解决方案，达成公司下达的销售目标，和客户经理共同提升客户的满意度。【岗位职责】1、通过电话与客户进行有效沟通，了解客户需求,发掘销售机会并配合公司客户经理共同完成销售业绩；2、熟练掌握公司系列产品信息，为客户提供专业、全面的解决方案；3、系统收集、整理客户及行业招投标等信息，持续开发新客户，拓展与老客户的业务，建立和维护客户档案，维护客户关系；4、与客户经理紧密配合，协调各地的渠道合作伙伴体系，共同达成销售业绩；5、支持客户经理工作，提供商务流程支持（如商务报价、合同、合作协议起草和管理等）；6、据项目需求搜索关联产品信息、寻找关联产品供应商并进行商务合作对接；7、部门管理者指派的其他销售相关工作。【岗位要求】1、大专或以上学历，专业不限，医学类或计算机类相关专业优先考虑2、一年或以上电话销售经验，有医药或者医疗器械销售等相关经验优先考虑3、具备计算机、软件工程、信息管理、医疗器械等相关知识储备优先考虑4、普通话标准，优秀的沟通能力和团队协作能力，能适应高节奏的工作压力，有强烈的赢单（销售）欲望，勤奋踏实，愿意学习新事物。薪资结构：无责任底薪+提成","医疗丨健康,数据服务",15-50人,人工智能,深圳
软件工程师,https://www.lagou.com/jobs/6184225.html,南山区,13k-26k,深圳深镜数据有限公司,1-3年,不限,"前景广阔, 股权激励，注重员工满意度",职位描述1      参与深镜软件产品的需求分析，根据需求进行敏捷的前后端开发。包括建立分布式，可扩展的金融量化云计算引擎和大数据平台，开发数据可视化分析平台和客户端应用。2      创立测试环境，和数据分析师共同制定全面的测试计划和流程，彻底解决测试中发现的问题，确保成功上线。3      负责上述业务产品的深入优化。研究新技术、新架构，并能应用和推广到产品开发上，推动产品迭代。任职要求1      有扎实的Java/C#/C++编程功底。有Scala/Python/SQL/NoSQL/R 其中一种或以上的的开发经验者优先。有金融数据库和软件开发经验的优先。2      熟悉MySql，SQL Server、Oracle其中一种及以上的关系数据库管理系统。3      掌握JavaScript、HTML5、CSS3，熟悉移动端h5开发。4      良好的学习能力、热衷于新技术的研究和创新。具有很强的问题解决能力、良好的编程习惯，较强的沟通能力、学习能力以及团队合作精神。5      有多个或多年前后端设计，开发和落地的成功经验。有证券市场软件开发，数据仓库和大数据平台创立经验者优先。6      计算机本科及以上学历。有金融机构或BAT大数据相关领域三年以上工作经验优先考虑。公司简介 深圳深镜数据有限公司（简称“深镜”）以业界最前沿的理论研究和实践经验为基础，利用人工智能及大数据技术为资产管理提供深度全面的基金分析以及管理服务。面对不确定的未来，深镜致力于帮助投资者制定最优的决策。公司的创始团队具备丰富的跨行业背景及深度的专业性，知识沉淀和共享，与时俱进，工匠精神，对追求客户满意度的极大热情。团队在所在行业收获显著成果，并在中国及海外市场拥有良好的业界声誉及基于信赖关系的客户群体。 深镜的核心价值观是“革故鼎新，求实求是，任人唯贤，客户至上，坚持原则”。我们希望深镜的每位成员都能开诚布公、合作共赢，在此核心价值观的指导下共同建立可以塑造我们优秀人格的企业文化。深镜团队始终保持开放和不断革新的态度与精神，在准确地理解事实的基础之上，精益求精的设计和完善产品，最终为客户实现利益的最大化。我们期待，也会提供一切可能的资源，来协助每位成员在深镜的职业生涯中能最大实现自我价值。,"金融,数据服务",少于15人,人工智能,深圳
计算机视觉算法工程师（深圳）-校招,https://www.lagou.com/jobs/6172890.html,南山区,25k-35k,深圳市锐明技术股份有限公司,应届毕业生,硕士,团队氛围好 节日福利 五险一金,岗位职责：1、基于深度学习的计算机视觉技术系统与产品研发；2、前沿计算机视觉算法调研及实现；3、ADAS（Advanced Driver Assistance System）和DSM（Driver Status Monitor）等相关算法研发，包括车辆检测、行人检测、车道线检测、人脸检测、人脸关键点检测、人脸识别等；4、神经网络优化，包括压缩剪枝、量化等；5、前沿目标跟踪算法研究与优化，包括KCF、ECO、GOTURN等。 任职要求：1、硕士/博士学历，有计算机视觉或机器学习研究背景；2、精通C/C++/Python；3、精通caffe、pytorch、tensorflow、keras等其中一种开源深度学习框架；4、熟悉MATLAB/Python优先；5、有深度学习相关科研经历优先；6、有计算机视觉算法的实际产品化经验优先；7、在视觉计算、机器学习、人工智能、数值优化等领域有优秀论文发表记录优先。,"数据服务,硬件",500-2000人,人工智能,深圳
数据分析师,https://www.lagou.com/jobs/5902196.html,南山区,13k-25k,深圳深镜数据有限公司,3-5年,本科,发展前景广阔，大数据，人工智能，股权激励,"职位描述1 分析需求并转化为数据模型，通过ELT把数据整合到数据仓库。2 基于海量证券市场，宏观及独有数据，结合大数据分析的方法和技术，建立数据模型，深挖有价值的业务信息。建立算法模型，有效利用人工智能的技术，多维度的分析基金产品和基金经理人。结合现代资产组合优化理论，为投资人提供最优资产组合的解决方案。3 与团队一同推动产品迭代。 任职要求1 精通至少一种ETL工具，如MS SQL Server 2005 SSIS、Informatica、Datastage、Kettle等2 熟悉Hadoop生态体系、掌握Oracle/Mysql/Hive/Hadoop/Map-Reduce/SPARK/STROM分布式计算框架中的一种，有多个或多年大数据项目的成功实施经验。有海量证券市场数据处理和实时数据计算经验者优先。3 良好的学习能力、热衷于新技术，新方法的研究和创新。具备团队精神并且擅长沟通。具有高度的敬业精神和客户至上的理念，能够承受较大工作压力。4 统计，数学，计算机，金融工程等专业本科及以上学历。具有数据挖掘、机器学习、NLP等相关工作经验优先考虑。有三年以上金融机构风险管理或大数据工作经验者优先考虑。5 能够从员工的成长，客户的满意度，公司的发展角度提出对公司的具体要求和期望。 公司简介 深圳深镜数据有限公司（简称“深镜”）以业界最前沿的理论研究和实践经验为基础，利用人工智能及大数据技术为资产管理提供深度全面的基金分析以及管理服务。面对不确定的未来，深镜致力于帮助投资者制定最优的决策。公司的创始团队具备丰富的跨行业背景及深度的专业性，知识沉淀和共享，与时俱进，工匠精神，对追求客户满意度的极大热情。团队在所在行业收获显著成果，并在中国及海外市场拥有良好的业界声誉及基于信赖关系的客户群体。 深镜的核心价值观是“革故鼎新，求实求是，任人唯贤，客户至上，坚持原则”。我们希望深镜的每位成员都能开诚布公、合作共赢，在此核心价值观的指导下共同建立可以塑造我们优秀人格的企业文化。深镜团队始终保持开放和不断革新的态度与精神，在准确地理解事实的基础之上，精益求精的设计和完善产品，最终为客户实现利益的最大化。我们期待，也会提供一切可能的资源，来协助每位成员在深镜的职业生涯中能最大实现自我价值。“I am an ordinary man but I want and believe I can enable you to create something great, to make yourself extraordinary. So let's put a ding in the universe”","金融,数据服务",少于15人,人工智能,深圳
投资行业研究实习生（深圳）,https://www.lagou.com/jobs/3784693.html,南山区,2k-4k,深圳同创鼎诚投资管理有限公司,不限,硕士,"创业团队,专业培养,平等氛围,共享成果",一、人工智能研究方向；二、生物技术研究方向；三、教育产业研究方向；四、其他行业研究方向；任职要求：1.国内外重点院校计算机技术、生物技术、会计、金融财经、法律等相关专业硕士及以上学历；2.了解行业发展基本原理，有相关的研究经历者优先；3.欢迎应届毕业生；4.欢迎海外留学回国的学生；5.欢迎其它行业转行从事投资的优秀人才；6.有意愿在投资行业发展；7.具有前瞻性思维，信息综合分析判断能力强；8.英语水平能够满足日常商务交流。工作地点可选：深圳 广州,金融,15-50人,人工智能,深圳
投资经理（深圳）,https://www.lagou.com/jobs/3784677.html,南山区,10k-20k,深圳同创鼎诚投资管理有限公司,3-5年,硕士,创业团队，扁平架构，平等氛围，共享成果,岗位职责：1. 针对公司拟定的投资方向（人工智能、生物技术/医药、教育、区块链），主导完成投资项目的执行工作，包括前期洽谈、筛选和评估、工作计划的制定与实施、候选项目的行业研究及市场调研等；2.主导项目投资的尽职调查、投资分析、交易结构设计；拟定投资方案及退出方案，完成投资建议书等相关文档；3.主导投资交易实施，包括重要文件的起草、项目投资谈判、投资实施与退出等；4.投资后管理与增值服务；对投资项目全过程进行风险监控。任职资格：1.国内外重点院校计算机技术、生物技术、金融财经、法律等相关专业硕士科及以上学历；2.具备“行业研究+金融投资”复合型背景；3.对行业发展与趋势有深刻的认识与体会；4.具有投资机构工作经验3年以上，有VC/PE公司相关工作经验尤佳;5.有成功投资案例者优先；6.英语水平能够满足日常商务交流；7.有志投身于投资行业，有加入创业公司的热情；8.具备较高的道德修养和职业操守，勤勉尽责，务实进取，廉洁自律，认同公司的价值观。工作地点可选：深圳 广州,金融,15-50人,人工智能,深圳
图像识别算法工程师,https://www.lagou.com/jobs/6906854.html,南山区,20k-30k,深圳泰克教育科技有限公司,不限,本科,发展空间大,"岗位职责：1、 负责机器视觉（包括图像/视频处理、图像分 割、智能识物、手势识别等）领域的深度学习基 本算法的开发与性能提升，涉及的问题包括但不 限于：检测、跟踪、分类、图像优化、图像聚类 、视频语义等，井推动在实际应用领域的性能优 化和落地；2、 负责公司产品中涉及的人工智能软件产品化 开发；3、 针对不同的硬件平台，对各类软件/算法实现 进行移植和优化。任职要求：1、 本科以上学历，计算机、软件工程、电子工 程、自动化、人工智能、模式识别等相关专业；2、 熟悉以下至少一种语义分割网络的数据集制 仁训练，超参数调节，模型部署，模型性能优 化FCN、SegNet、U-Net、Link-Net. RefineN et、PSPNet、Mask-RCNN, Fully Convolutio nal DenseNet, G-FRNet等；3、 对Anchor, Regularization, Dropout, Seal e, Data Augmentation, Decay有深刻的理解；4、 熟练掌握以下至少一种编程语言Python、C/ C++ ；5、 必须精通openev, numpy；6、 熟练使用以下至少一种深度学习库，tensorflow, pytorch0",软件开发,15-50人,人工智能,深圳
腾讯云销售,https://www.lagou.com/jobs/6348721.html,宝安区,10k-15k,深圳市美奔科技有限公司,不限,大专,大品牌，高收入，晋升快，福利高！,"【我们是谁】美奔科技是中国市场专业的云托管服务商（Cloud MSP），在数据中心和云计算领域有近五年的专业交付和管理经验，目前正服务于5000多家企业级客户。美奔科技与腾讯建立了战略合作关系，在云计算驱动产业变革的今天，以客户需求为驱动，积极投资于核心技术研发和团队组织的云原生技能，致力于成为IT新生态和产业互联网的新一代连接器，面向政务、金融、零售、教育、医疗等行业的中大型客户提供“云+大数据+AI”的咨询、集成和管理服务，以及数字化解决方案，帮助客户利用新技术进行业务创新，实现数字化变革。【我们是一家怎样的公司】我们是一家年经的互联网公司,你加入的将是最好互联网平台,最好市场的最强团队.我们欣赏过程,但我们只认可结果.无视你的过去，在这里你将你是新的开始，开启新的篇章。天下大势浩浩荡荡，云计算、大数据、人工智能是未来，欢迎和我们有共同信仰、有才、有特点的兄弟姐妹加入！【希望你是这样的人】 1．大专及以上学历最好，有经验学历不够也可以大胆来聊聊；2．最好做过这个行业,优秀应届毕业生培训达标可上岗。3．正气，有工作热情，工作态度端正优先考虑；4．能辩，能想，能做，能坚持为梦想而奋斗。5．敢想敢干，有某领域非常得意的成绩。6. 颜值过硬的小伙伴，请无视以上条件。【我们可以给你】1、工作时间：上午：9：00- 12：00 下午： 13:30-18:00; 周末双休 ,法定节假日；2、员工享受有薪年假、婚假、产假、护理假、病假、丧假等有薪假日； 3、享有月度考核奖金及每月定额交通补贴、电话补贴； 4、完善的教育培训体系，提供各类专业培训； 5、公司具有良好的激励机制，畅通的晋升渠道和充分的发展空间； 6、福利：端午、中秋福利，春节现金福利，公司年会，每周组织篮球、羽毛球、聚餐等集体活动； 7、办理深圳户口调入（符合政府相关政策人员） 8、购买法定社保。 9、公司培训：腾讯云从业者基础培训、云运维工程师培训、专业销售技能提升课程培训。10、优秀销售可享星级津贴、出国旅游、购车支持等福利。十几年了，我都还没有找到你，那么，现在我就站在这个显眼的位置等待你。等待你的到来。","企业服务,人工智能",15-50人,人工智能,深圳
