job_name,job_url,job_location,job_salary,job_company,job_experience,job_class,job_given,job_detail,company_type,company_person,search_key,city
产品经理,https://www.lagou.com/jobs/6710779.html,番禺区,15k-30k,广州探迹科技有限公司,5-10年,本科,"五险一金,大数据AI,期权激励,扁平管理",岗位职责：1、负责公司智能销售云平台内AI产品及应用场景规划、业务流程设计、功能设计、产品优化等工作；2、负责AI产品及解决方案，结合公司已有的企业数据和客户具体应用场景，输出可落地的NLP、AI项目解决方案；3、分析行业竞品、深刻了解用户的需求，针对用户需求输出高质量的产品原型和文档，不断地改良、调整产品的表现形式；4、与设计、研发、运营等部门保持良好的沟通，协同工作，保证产品设计的理念被良好的贯彻执行，推动产品需求落地。任职要求：1、有5年以上的实际互联网产品设计经验，精通各类产品设计的工具和流程；2、热爱互联网，洞察力强，关注大数据、智能营销、智能客服类产品，熟悉互联网AI相关产品的产品形态和产品功能；3、对数据敏感，数据分析能力强，思路敏捷，逻辑思维，具有较好的解决问题能力；4、优秀的项目管理能力、抗压能力以及跨职能、跨部门的组织协调能力和沟通能力，为结果负责；5、熟悉NLP、知识图谱、文本挖掘算法学术和工程的研究进展，熟悉各类机器学习模型及其评估方法，有扎实的人工智能知识基础的优先。,"数据服务,企业服务",150-500人,人工智能,广东
推荐算法工程师,https://www.lagou.com/jobs/7191158.html,天河区,25k-40k,网易（杭州）网络有限公司,3-5年,本科,福利好 大平台,职位描述1. 负责游戏用户精细化运营和相应推荐系统的开发和优化工作；2. 负责召回和排序算法开发工作，包括但不限于 Wide&Deep/DeepFM/GBDT 等；3. 参与构建特征工程，标签体系，优化技术方案，改进产品功能等。职位要求1. 计算机、机器学习和数学等相关专业，硕士及以上学历；2. 熟悉经典的算法并有实践经验，比如 FM/LR/W&D/FTRL 等；3. 精通至少一门语言，Java/C++/Python/R 等，具有扎实的代码功底和实战能力；4. 3年以上推荐/搜索/广告算法工程师等相关工作经验；5. 较强的沟通能力和团队协作能力；6. 善于学习新知识、乐于接触新场景、关注前沿新技术。7. 熟悉主流大数据处理技术（Hadoop/Spark/Hive/HBase/Flink 等）优先；8. 具备数据可视化和模型可解释度相关工作经验者优先；9. 有 Kaggle 或人工智能大赛经历并已取得较好名次优先。,电商,2000人以上,人工智能,广东
产品研发工程师/机械设计工程师（2020届）,https://www.lagou.com/jobs/6944434.html,南山区,10k-20k,北京石头世纪科技股份有限公司,应届毕业生,本科,下午茶，免费零食，大牛带,工作内容：1、负责新产品的设计开发工作;2、负责对现有产品进行合理化降本改善 ;3、产品出现品质问题时，能进行原因分析并能制定对策;4、负责各推进项目的日程管理，并及时向上级汇报。职位要求：1、机械结构设计、电子电路、材料学相关专业统招本科及以上学历，211/985院校优先；2、2020/2021年毕业，可全职实习；3、有较强的沟通表达能力、创新能力，能承受一定的压力，对人工智能感兴趣。,硬件,500-2000人,人工智能,广东
机械设计工程师,https://www.lagou.com/jobs/7024211.html,南山区,8k-15k,北京石头世纪科技股份有限公司,不限,本科,公司发展前景好，个人成长机会,工作内容：1.负责新产品的设计开发工作;2.负责对现有产品进行合理化降本改善 ;3.产品出现品质问题时，能进行原因分析并能制定对策;4.负责各推进项目的日程管理，并及时向上级汇报。职位要求：1.机械结构设计、电子电路、材料学相关专业本科及以上学历；2.2019/2020/2021年毕业，在校生可全职实习3-6个月；3.有较强的沟通表达能力、创新能力，能承受一定的压力，对人工智能感兴趣。,硬件,500-2000人,人工智能,广东
公共安全产品经理,https://www.lagou.com/jobs/4876962.html,东莞市市辖区,10k-20k,深圳云天励飞技术有限公司,1-3年,本科,"独角兽,人工智能,团队融洽,高成长",岗位职责：1、工作领域为人工智能、公共安全方向；2、负责产品交互设计，输出高质量的PRD；3、协调各部门完成需求评审、技术评估，并推动产品开发全流程。4、能够对交付型项目的需求进行分析，提取共性，分析趋势，从具体需求中抽象出平台级通用化功能5、收集用户反馈，跟踪产品迭代，对产品持续优化和改进6、关注竞情产品，把握行业趋势，深度思考业务发展问题，不断改进和提升产品体验； 任职要求：1、严密的逻辑性及产品思维，能够深刻理解市场和客户需求，理解业务与数据逻辑关系；2、3年以上相关产品工作经验，本科及以上学历；3、具备系统化思考和设计能力，有产品设计和分析经验，具有产品模块从0到1的规划设计工作；4、自我驱动性强，有责任心和工作热情、良好的人际沟通协同能力、团队合作精神。,人工智能,500-2000人,人工智能,广东
Java(中/高)级开发工程师（基础业务方向）,https://www.lagou.com/jobs/4955817.html,南山区,20k-28k,深圳云天励飞技术有限公司,5-10年,本科,"独角兽,人工智能,团队融洽,高成长",岗位职责：1、负责人工智能行业应用基础业务开发；2、负责运维管理系统运维基础业务开发；3、负责监控告警系统开发（对接不同的开源监控、告警、日志系统接口进行定制开发）。任职要求：1、计算机、信息管理或相关专业毕业，大学本科及以上学历；2、3年以上java开发工作经验；3、熟练使用eclipse/IDEA、maven、springboot、spring cloud、mybatis完成服务端系统开发工作，熟练spring cloud生态并了解各个组件原理；4、熟练使用mysql、mongodb数据库，对表结构设计、sql语句有一定调优能力；5、熟练常用中间件使用，如redis、kafka、fastdfs；6、熟练分布式系统原理及设计优先考虑；7、对监控系统、日志系统，如prometheus、open-falcon、elk等相关生态组件，熟练及了解其原理优先考虑；8、有GO开发经验优先考虑；9、有基础业务开发、运维业务开发经验优先考虑；10、熟悉docker、kubernetes等容器生态相关组件使用优先考虑；11、具备良好的逻辑思维，思路清晰，善于思考，能独立分析和解决问题、良好的沟通技能和团队合作能力。,人工智能,500-2000人,人工智能,广东
高级算法工程师,https://www.lagou.com/jobs/4694997.html,南山区,25k-50k,深圳市百果互动科技有限公司,3-5年,硕士,"弹性工作,工作氛围好","职位诱惑：待遇好,平台佳,发展空间广职位描述：岗位职责：1.  主要负责深度学习相关应用的研发工作，包括智能供应链、智能导购、精准营销等应用2.  运用机器学习、深度学习、自然语言处理等方面的先进模型和算法，利用C++/Python等相关语言进行人工智能的算法拓展及产品研发。 任职要求：1. 全日制计算机、数学、统计、金融等相关专业硕士以上学历，2. 具备扎实的数学基础和机器学习算法功底，熟悉决策树、随机森林、协同过滤、SVM、回归等相关机器学习算法3. 熟悉神经网络模型，至少能够使用Caffe、TensorFlow、Keras、PyTorch其中任一框架进行建模和训练。4. 熟悉C/C++/Python/Shell/Java/R等任一门编程语言5. 具备良好的系统分析能力，良好的抽象思维和逻辑思维能力，独立分析问题解决问题的能力； 工作地址深圳 - 南山区 - 深圳湾 - 留学生创业大厦二期25楼","移动互联网,电商",150-500人,人工智能,广东
推荐算法工程师,https://www.lagou.com/jobs/4867406.html,天河区,15k-25k,广州坚和网络科技有限公司,3-5年,本科,福利待遇高，发展前景好,岗位职责：1、负责设计个性化推荐等算法，提高产品用户体验和推荐效果；2、负责各算法和模型的分布式实现（离线，在线），丰富并行算法库；3、负责提供系统设计和代码文档；4、参与数据清洗和过滤、特征抽取、参数选择、算法实验、效果分析。 岗位要求：1、本科以上学历，计算机、应用数学、模式识别、人工智能、自控、统计、运筹学等专业；2、2年以上推荐引擎、搜索引擎相关工作经验优先； 3、有大规模分布式计算平台的使用和并行算法的开发经验；4、具有数据指标逻辑及数据驱动概念；熟悉常见统计和机器学习算法，比如逻辑回归，决策树等，有聚类算法，协同过滤算法经验，同时备数据可视化能力更好。,移动互联网,150-500人,人工智能,广东
推荐算法工程师,https://www.lagou.com/jobs/6247131.html,南山区,20k-30k,深圳市尚游网络科技有限公司,3-5年,本科,"年底双薪,季度奖,氛围好,稳定平台",1、 人工智能、机器学习等领域开展前沿技术研究，并应用于业务领域研发；2、 参与和推动技术落地到项目应用上；3、 跟踪人工智能技术进展，研究人工智能算法，探索人工智能在业务方向上的价值点；任职要求：1、 本科及以上学历，计算机、软件工程、网络工程、自动化、数学等相关专业优先；2、 有大数据、机器学习、图像识别、广告推荐中至少一种相关背景和经验，有机器学习应用于广告推荐的经验优先；3、 至少熟练使用一款开源机器学习工具；4、 算法与编程能力强、熟悉机器学习常用算法：决策树，随机森林，协同过滤，SVM，回归算法等；5、 思维严密，态度积极，有良好的团队意识和协作精神。机会吸引点：1、因为股东背景，背靠OPPO和vivo两大渠道资源，目前团队产品累计下载量超4.6个亿，用户规模巨大；2、做事空间大，有机会利用海量用户资源做出最佳的游戏AI实践；3、公司平台靠谱，11年老厂，研发、发行、资金实力都很棒。,游戏,150-500人,人工智能,广东
AI算法专家,https://www.lagou.com/jobs/6304987.html,南山区,30k-60k,深圳市尚游网络科技有限公司,5-10年,硕士,平台稳定，年终奖丰厚，团队优秀，氛围活跃,1、 人工智能、机器学习等领域开展前沿技术研究，并应用于业务领域研发；2、 参与和推动技术落地到项目应用上；3、 跟踪人工智能技术进展，研究人工智能算法，探索人工智能在业务方向上的价值点； 任职要求：1、 硕士及以上学历，计算机、软件工程、网络工程、自动化、数学等相关专业优先，4年以上工作经验；2、 有大数据、机器学习、图像识别、广告推荐中至少一种相关背景和经验，有机器学习应用于广告推荐的经验优先；3、 至少熟练使用一款开源机器学习工具；4、 算法与编程能力强、熟悉机器学习常用算法：决策树，随机森林，协同过滤，SVM，回归算法等；5、 思维严密，态度积极，有良好的团队意识和协作精神。机会吸引点：1、因为股东背景，背靠OPPO和vivo两大渠道资源，目前团队产品累计下载量超4.6个亿，用户规模巨大；2、做事空间大，有机会利用海量用户资源做出最佳的游戏AI实践；3、公司平台靠谱，11年老厂，研发、发行、资金实力都很棒。,游戏,150-500人,人工智能,广东
店小蜜智能训练师,https://www.lagou.com/jobs/6625874.html,黄埔区,5k-8k,蓝月亮（中国）有限公司,不限,本科,平台大 双休 饭堂 宿舍 班车,岗位职责：1.需快速熟悉掌握公司产品，正确的描述公司所有产品的特点2 .完善官方知识库、自定义知识库，优化问答话术，提升问题解决率和交易转化率3.每日查看聊天记录，并对其进行质检和分析，提取、总结用户询问的问题；4.对接活动、运营，保证店小蜜知识库及时更新（商品上新、活动内容话术上新及优化）5.汇总店小蜜好评和差评明细并分析优化6.每日、月输出日报、月报，需要对数据进行解读和分析并作出优化方案任职要求：1.善于沟通，有很好的团队合作精神，统筹协调合作能力2.逻辑思维能力及分析能力，及时发现和提炼问题特征，并能挖掘优化方案和建议，帮助人工智能产品提升性能3.有一定的钻研精神，乐于研究4.注重细节，有非常好的服务意识，注重顾客体验和满意度5.本科及以上学历，熟悉淘宝，天猫平台规则，有店小蜜训练经验者优先考虑；,消费生活,2000人以上,人工智能,广东
产品创新合作岗,https://www.lagou.com/jobs/5217174.html,海珠区,13k-25k,联通（广东）产业互联网有限公司,1-3年,本科,"五险一金,周末双休,包吃,年底分红",岗位职责：1。 负责围绕通信开放平台语音能力挖掘大数据、物联网、人工智能等新技术的产品结合。2. 负责根据创新的产品结合寻找优秀的合伙伙伴，并承担市场营销组织和开拓。任职资格：1.本科及以上学历，计算机等专业。2.具有两者之一：1）具有三年以上产品经理经验，了解大数据、物联网、人工智能等至少一种新技术。2）具有一年以上大数据、人工智能相关研发经验。3.具备较强的场景能力和创新能力。4.责任心强，有激情，愿意与团队共同高速发展。,"移动互联网,医疗丨健康",500-2000人,人工智能,广东
产品创新合作岗,https://www.lagou.com/jobs/5217174.html,海珠区,13k-25k,联通（广东）产业互联网有限公司,1-3年,本科,"五险一金,周末双休,包吃,年底分红",岗位职责：1。 负责围绕通信开放平台语音能力挖掘大数据、物联网、人工智能等新技术的产品结合。2. 负责根据创新的产品结合寻找优秀的合伙伙伴，并承担市场营销组织和开拓。任职资格：1.本科及以上学历，计算机等专业。2.具有两者之一：1）具有三年以上产品经理经验，了解大数据、物联网、人工智能等至少一种新技术。2）具有一年以上大数据、人工智能相关研发经验。3.具备较强的场景能力和创新能力。4.责任心强，有激情，愿意与团队共同高速发展。,"移动互联网,医疗丨健康",500-2000人,人工智能,广东
咨询研究中心负责人,https://www.lagou.com/jobs/5296908.html,海珠区,35k-50k,联通（广东）产业互联网有限公司,5-10年,硕士,包三餐、周末双休、节日福利、七险二金,岗位职责：1. 研判产业互联网领域未来重大商业机会，提出需要重点开展研究的行业领域建议；2. 研究政府、城市、产业三个领域数字化转型方案顶层设计的方法论，提升队伍咨询能力和整体水平；3. 制定团队年度工作计划，并领导团队完成。任职要求：1.硕士及以上学历；2.具有较强的信息力、逻辑力和判断力；3.了解移动互联网、云计算、物联网、大数据、人工智能等新一代信息技术；4.具有丰富的咨询行业经验，尤其是产业互联网领域相关的顶层设计咨询经验；5.热爱咨询，充满激情。,"移动互联网,医疗丨健康",500-2000人,人工智能,广东
AI产品经理,https://www.lagou.com/jobs/6480474.html,南山区,18k-30k,深圳市智灵时代科技有限公司,3-5年,本科,AI+金融、大牛多多、实力雄厚,工作职责：1、负责智能语音对话/CRM产品平台系统的统筹规划、需求分析和产品设计，持续完善现有产品；2、收集整理来自业务方需求，系统化进行整理与评估，完善需求文档与系统原型图；3、负责将智能前沿AI能力，转化为业务产品能力，进行产品创新和场景应用，把握用户关键路径，实现用户需求4、推动与跟进产品的开发、测试和上线；5、 行业研究和竞品分析，结合业务实际，制定契合行业发展和公司需求的产品规划；任职要求：1、本科及以上学历，计算机、通讯、数学、统计、语言学、智能化方向优先2、 有平台化、系统化产品落地实施经验优先，对于人工智能中的NLP、ASR、TTS技术熟悉，并了解其局限性优先；3、 对人工智能有热情和好奇心，熟悉相关产品的实现机制，对解决方案有较深的理解；4、 对智能语音/智能客服等产品有深入理解，对产品实施与优化有深刻见解；5、 突出的沟通协调能力、清晰的逻辑分析和表达能力、较强的执行力，能承受较大的工作压力；,人工智能,150-500人,人工智能,广东
ai产品经理,https://www.lagou.com/jobs/6893258.html,天河区,18k-30k,深圳市智灵时代科技有限公司,3-5年,本科,AI+金融、大牛多多、实力雄厚,工作职责：1、负责智能语音对话/CRM产品平台系统的统筹规划、需求分析和产品设计，持续完善现有产品；2、收集整理来自业务方需求，系统化进行整理与评估，完善需求文档与系统原型图；3、负责将智能前沿AI能力，转化为业务产品能力，进行产品创新和场景应用，把握用户关键路径，实现用户需求4、推动与跟进产品的开发、测试和上线；5、 行业研究和竞品分析，结合业务实际，制定契合行业发展和公司需求的产品规划；任职要求：1、本科及以上学历，计算机、通讯、数学、统计、语言学、智能化方向优先2、 有平台化、系统化产品落地实施经验优先，对于人工智能中的NLP、ASR、TTS技术熟悉，并了解其局限性优先；3、 对人工智能有热情和好奇心，熟悉相关产品的实现机制，对解决方案有较深的理解；4、 对智能语音/智能客服等产品有深入理解，对产品实施与优化有深刻见解；5、 突出的沟通协调能力、清晰的逻辑分析和表达能力、较强的执行力，能承受较大的工作压力；,人工智能,150-500人,人工智能,广东
副CTO,https://www.lagou.com/jobs/6473267.html,福田区,35k-55k,深圳光汇石油集团股份有限公司,10年以上,本科,全球化电商平台，独角兽,"1. 协助集团CTO管理深圳团队的产品、研发和商务智能团队，确保各项产品交付任务得以落地执行2. 根据公司产品发展战略，领导深圳团队完成产品方案、产品交付完整生命周期3. 为新加坡团队提供研发资源管理2岗位任职要求：1. 计算机及数学相关工科专业本科或以上学历2. 至少15年以上互联网项目经验，6年以上技术总监经验，有从0-1的创业科技团队管理经验优先。3. 精通基于Java技术体系的各类MVC及微服务体系架构技术，熟悉Python, NodeJs, Go等多种语言和相关技术框架特性。对大数据、人工智能及区块链等相关新兴技术领域有一定的研究或项目经验者优先。4. 优秀的互联网产品及技术方案的选型、评估和架构设计能力，有高数据容量和并发量的大型互联网系统的架构设计成功案例5. 优秀的跨部门沟通协调能力，有国际化研发团队工作或管理经验，具备较好的英文听说能力。6. 优秀的技术疑难问题解决能力，能为团队快速解决各种技术问题提供思路或解决方案，必要时能自己解决技术问题。7. 对新技术有敏锐的嗅觉，并能不断保持新技术的学习和应用能力，确保公司科技上的先进性。8. 优秀的执行力和团队管理能力，引领团队不断创新，对技术和用户体验有**的追求。9. 具备大局意识，能快速推进工作落地执行。",其他,500-2000人,人工智能,广东
项目经理,https://www.lagou.com/jobs/7111368.html,越秀区,13k-22k,北京中电广通技术服务有限公司,3-5年,本科,五险一金，项目奖金，双休，弹性工时,工作描述：1、项目管理：负责大型IT系统集成、开发、运维项目的规划、设计、预算、实施、验收等全过程的项目管理工作，控制项目范围、进度、质量、沟通、风险和成本等2、需求分析：充分沟通了解项目需求并梳理分析，精确达给产品经理，协助产品经理产品原型落地，把控产品质量3、多项目管理：管理跨地域多个项目并统一协调相关资源实现项目目标4、客户满意度：深刻理解客户需求，与客户保持充分的沟通，提升客户满意度5、市场机会：在项目实施或运维过程中，发掘后续项目机会，促进市场巩固和配合市场拓展任职要求：1、IT相关专业大学本科或以上学历2、3年以上项目管理工作经验，能够独立管理IT系统集成、开发、运维等项目3、具有较强的沟通能力，承压能力，团队管理能力和协调能力，认真仔细，责任心强4、具有较强的客户关系的把控能力和市场开拓能力5、持有PMP认证，信息系统集成项目经理认证者优先6、具有云计算、大数据、人工智能相关工作经验者优先7、熟悉Linux系统具备一定shell脚本编写能力、了解云环境者优先,移动互联网,50-150人,人工智能,广东
大数据开发测试岗,https://www.lagou.com/jobs/7159516.html,福田区,10k-18k,中信网络科技股份有限公司,1-3年,本科,五险一金补充医疗保险定期体检节日福利,大数据开发测试岗 一、岗位要求1、全日制本科及以上学历，学信网可查，计算机相关专业，3年及以上开发或测试经验；2、精通SQL/HQL，熟悉Shell/Python/Perl/JAVA至少一门编程语言；3、熟悉大数据相关技术，如：Hadoop/Hbase/Spark/Hive/GREENPLUM/MYSQL等；4、了解数据仓库、数据建模、数据分析相关技术；5、拥有较强的逻辑思维能力、数据分析能力及问题解决能力，具有良好的团队协作精神及服务意识，富有进取心、勇于创新。二、岗位负责1、负责数据仓库ODS、CEDW、四大集市以及应用层的质量把控；2、负责营销、合规监管等的数据需求的质量把控；3、负责实时BI、决策引擎、数据管控、积分权益决策引擎等20+套面向业务系统的功能/底层/数据的质量把控；4、负责5+大数据内管类系统的质量把控；5、负责章鱼大脑等人工智能项目的质量把控工作；6、负责代运营项目的质量把控工作；7、负责大数据质量相关所有文档的建设和更新工作。,金融,500-2000人,人工智能,广东
大数据算法工程师：,https://www.lagou.com/jobs/7182875.html,福田区,25k-35k,佳兆业投资咨询（深圳）有限公司,3-5年,硕士,发展空间 平台,"工作职责： 1、负责智能选股系统架构服务开发及架构升级； 2、优化推荐系统性能.稳定性.架构可扩展性，保障算法策略模块快速迭代； 3、分析海量用户行为数据.内容资讯数据，增加有效的用户特征和内容资讯特征，改进模型和召回.排序策略，提升推荐效果；或者提出人工智能解决方案和模型 岗位要求： 1、硕士及以上学历，数学或计算机相关专业，3年以上服务器开发经验。做过推荐系统或搜索引擎，有自然语言处理、机器学习、数据挖掘等相关经验优先； 2、精通Go、 Python、 C、 Java等其中两门语言，熟悉基础数据结构和算法，熟悉常用软件设计模式，代码整洁； 3、熟悉推荐系统，并对常见的推荐算法有自己的理解； 4、熟悉常用数据结构，及分析算法，并有自已独到的理解及应用。 5、精通高并发，低延迟服务设计，熟练掌握常用开源框架，至少熟悉两种NOSQL数据库 6、熟悉并行计算或者分布式计算，熟悉Spark,Storm等计算平台，有相关性能优化经验，并熟悉其上下游环境，包括Flume.Kafka.Hive.HBase等； 7、对数据敏感，分析数据，抽象问题，对于把大数据和人工智能分析的结果能够应用到实际业务场景产生商业价值具有强烈的热情。  8、有互联网金融或智能投顾选股策略方面经验的优先考虑",金融,50-150人,人工智能,广东
