job_name,job_url,job_location,job_salary,job_company,job_experience,job_class,job_given,job_detail,company_type,company_person,search_key,city
iOS高级开发工程师,https://www.lagou.com/jobs/6759266.html,海淀区,20k-40k,百度在线网络技术（北京）有限公司,3-5年,本科,平台大 发展好,工作职责-沟通理解产品需求，研发百度小说产品，含小说搜索、百度app小说频道、百度阅读app等 -学习和研究新技术提升研发效率，技术驱动小说产品体验改善 -深度优化文字阅读排版体验，为公司提供优秀阅读器能力 -积极体验用户产品，对产品提出改进建议任职资格-至少3年以上iOS开发经验 -本科或以上学历，计算机软件、通讯相关专业优先 -有扎实的Objective-C/C/C++语言基础 -熟悉iOS操作系统，并对iOS开发相关的性能、内存处理有深入理解 -熟悉XCode/Instruments等工具的使用 -熟悉Object-C常用的开源框架 -熟悉iOS开发相关的持久化存储、多线程编程、网络通讯等知识 -有较强学习、分析和解决问题的能力  -具有较强逻辑思维能力和表达能力 -工作积极主动，有较强责任感和严谨工作作风，能吃苦耐劳，具备一定抗压能力  -对主流的Hybrid技术，大前端融合相关技术有深入理解的优先 -小说阅读爱好者优先,工具,2000人以上,ios,北京
ios工程师,https://www.lagou.com/jobs/4270889.html,昌平区,13k-26k,北京寻宝天行网络技术有限公司,3-5年,本科,"福利待遇好,六险一金,发展好,背景强大",职位描述： 1、参与移动产品的设计 2、负责iOS移动产品的开发 3、优化iOS产品的用户体验和性能 4、编写软件设计和开发文档 岗位技能要求： 1.本科以上学历，三年以上 iOS开发经验，完整经历过一个移动产品的开发 2.熟悉Objective C、CC，熟悉XCode 3.熟悉iOS平台设计理念，熟悉HTTP TCPIP协议 4.熟练掌握开发过程中相关的软件调试工具和技术5.有tweak越狱开发经验者优先,电商,50-150人,ios,北京
IOS开发工程师,https://www.lagou.com/jobs/7086534.html,海淀区,15k-25k,北京慧赢国际教育科技发展有限公司,5-10年,大专,五险一金、带薪年假、法定假日、房补、车补,职位描述：岗位职责 1、主导IOS软件产品的系统分析与设计工作，承担核心功能代码编写，开发与维护系统公用核心模块；  2、承担IOS软件性能优化，主导技术难题攻关，解决各类潜在系统技术风险，保证系统的安全、稳定、快速运行；  3、负责指导、培训普通开发工程师，审核开发工程师的设计与研发质量，负责IOS平台手机客户端的开发和维护工作，对开发的软件质量负责； 任职资格 1、5年以上开发经验，计算机相关专业，本科以上学历，熟悉MVC、Reactor、Delegate等设计模式，熟悉SQL语言，熟悉SQLite在移动开发中的应用； 2、有扎实的Object C语言基础，熟悉Objective-C编程和Cocoa touch框架，有C、C++开发经验者优先，熟悉常用的数据结构和算法，熟悉Rest Application的开发，掌握cocoa touch、core data、IOS runtime等开发技术，精通OS X/IOS下的并行开发、网络、内存管理、GUI开发等技术；  3、拥有很好的设计模式和思维，熟悉面向对象编程，图形界面开发，熟练使用iPhone SDK、XCode、Instruments等工具开发和优化程序； 4、学习能力强，有强烈的责任心，具有较强的沟通能力及团队合作精神；  5、具有跨平台/多终端开发经验，具有encrypt/decrypt、http client/server、graphics等开发经验者优先；  6、对IOS的UI控件有优化经验者优先，有前端开发经验者优先；  7、拥有高度配合、善于协作，以及不屈不挠的精神。,教育,50-150人,ios,北京
IOS开发工程师,https://www.lagou.com/jobs/5426481.html,朝阳区,10k-20k,天驰传媒股份有限公司,3-5年,本科,千万级一流音视频平台，期待闷骚程序猿的你,岗位职责：1、负责根据产品需求在规定时间内完成客户端功能逻辑的设计、编码工作； 2、与团队共同完成项目的开发和维护，并保证项目高可扩展和可维护性；3、依照开发规范和基础架构，配合质量控制团队保证产品质量；4、持续优化产品的性能；任职资格：1、全日制统招本科及以上学历，计算机相关专业；2、三年及以上ios相关工作；3、具备完整的项目经验；4、熟练使用Objective-C或Swift语言；5、熟练掌握iOS下的开发测试工具，常用框架（CoreFoundation，CoreText等）SDK，UI，网络库；6、熟练掌握面向对象程序设计方法，常用设计模和算法，多线程变成，TCP/IP协议，HTTP协议，JSON解析等相关技术；7、具备以下条件者优先考虑：具有OTT软件、多媒体APP或视频APP开发经验、具有swift语言开发经验，参加过开源项目，有自己的博客，github活跃用户优先考虑；8、熟悉HLS / RTSP / RTMP等直播协议者优先；9、具有积极进取的工作态度能承担较大工作压力，具备良好的沟通能力和团队合作精神； 职位诱惑：工作时间：周一至周五、弹性工作时间；年假福利：带薪年假5天、满一年；高端福利：顶配MacBook Pro + 超顶配IMAC 27寸；暖心福利：免费午餐、晚餐、零食等；惊喜福利：全额缴纳五险一金；晒圈福利：生日礼品、不定期团建、旅游、节日福利等；,移动互联网,150-500人,ios,北京
ios开发工程师,https://www.lagou.com/jobs/6957658.html,朝阳区,10k-15k,北京节点共识区块链科技有限公司,1-3年,不限,餐补、区块链、五险一金、节假日及生日福利,职位描述：1、负责iOS项目的概要设计及开发；2、参与项目重点、难点的技术攻坚；3、负责模块和组件的研发与维护；4、持续优化IOS客户端产品，提升质量和性能及用户体验；4、学习并研究iOS系统相关新技术并应用到工作中。职位要求：1、1-3年iOS开发经验，熟练使用OC和Swift开发语言，有区块链项目iOS开发经验优先；2、精通各种UI控件，能处理复杂的界面交互；3、良好的编程风格，扎实的编程和数据结构算法基础，深入理解常用的设计模式；4.对网络编程，数据库，多线程有深入的理解，具有较强的分析和解决问题的能力；5.有强烈的责任心和团队精神，善于沟通和合作；,"移动互联网,数据服务",少于15人,ios,北京
ios开发工程师,https://www.lagou.com/jobs/7070650.html,海淀区,15k-25k,北京下厨房科技有限公司,1-3年,本科,免费午餐 弹性上班,简历请附带 GitHub、个人技术博客地址岗位职责： 1、负责下厨房 iOS 平台相关应用的开发和维护 - 参与下厨房移动平台底层架构设计、2、实现和维护 - 负责 App 的性能优化 3、负责项目代码的健壮性、可读性、可维护性任职要求：1、对技术有热情，热爱新的挑战，能够独立解决技术问题 - 熟练掌握 Objective-C，熟悉 Swift 的优先； 2、 有团队协作精神，有 1 个以上完整的 iOS 项目经验 - 责任感强，有良好的团队协作意识 3、 注重用户体验，关注代码质量 - 了解或熟悉 Flutter 等移动端新技术,移动互联网,150-500人,ios,北京
IOS开发工程师,https://www.lagou.com/jobs/7213063.html,朝阳区,10k-20k,乐荐信息科技（北京）有限公司,1-3年,本科,五险一金 弹性工作时间 有调薪晋升机会,"岗位职责1. 按照产品设计的要求，进行技术实现。完成移动终端产品iOS版的开发、测试。2. 与产品和运营人员沟通保证产品的质量和开发进度。3. 持续的优化相关的产品的质量、性能、用户体验。4、严格遵守职业操守，具备良好的沟通和团队合作任职要求1. 统招本科或以上学历，具有3年以上开发经验。2. 熟练掌握Objective-C，SWIFT, 熟悉iOS常用framework, iOS的UI/网络/数据库框架。3. 熟悉tcp/ip协议、HTTP协议、Sokect，数据库，JSON/XML解析等技术.4. 精通MVVM,MVP架构设计、组件化实际项目开发。5. 有良好沟通能力，较强的英文文档阅读能力。","移动互联网,企业服务",150-500人,ios,北京
高级IOS开发工程师,https://www.lagou.com/jobs/6806549.html,朝阳区,26k-50k,云账户（天津）共享经济信息咨询有限公司,3-5年,本科,"16薪,免费午晚餐,五险一金,住房补贴",14薪+4次季度奖金（每次0.5-3个月薪资）+年终奖金（2-6个月薪资）、补充商业保险、免费自助午/晚餐、公司6公里内租房/购房补贴、清华大学授课、华为高管培训、期权激励岗位职责：1.负责iOS平台原生应用产品的研发工作；2.负责Flutter跨平台应用产品的研发工作；3.跟进技术的发展，持续进行系统优化；4.参与需求讨论，以合理的技术方案创新性的解决用户需求；5.产出高质量的文档，进行团队知识的沉淀。任职要求：1.3年以上iOS开发经验，能独立完成模块开发和单元测试；2.有扎实的Swift、Objective-C基础，丰富的UI开发经验；3.对网络通信、内存管理、多线程等有深刻了解；4.有扎实的开发基础，熟悉设计模式、数据结构、算法;5.有较强的逻辑思维能力、学习能力、沟通能力。对技术有热情，热爱开发，遇到问题需要随时解决，有责任心，有较强的团队合作意识。,"移动互联网,数据服务",150-500人,ios,北京
iOS开发工程师,https://www.lagou.com/jobs/5078065.html,朝阳区,15k-30k,珠海随变科技有限公司,3-5年,本科,"**C2M,盈利平台,技术分享,千万用户",职位：iOS开发工程师岗位职责：1、 负责iOS平台手机客户端业务开发、性能优化；2、 按照规范编写技术文档；3、 iOS前沿技术预研；4、 与其他团队的沟通协调，保证产品按时上线；5、 完成上级领导交办的工作。岗位要求：1、 3年手机客户端开发经验及以上；2、 具备扎实的objective-c编程基础，深入了解过其原理，具备良好的编程习惯；3、 至少阅读过2种AFNetworking、SDWebImage等常用的三方库源码并深入了解过其原理；4、 具有良好的沟通能力，能根据产品设计独立进行应用程序开发；5、 熟悉或精通设计模式；6、 熟悉iOS编译、打包、反编译技术；7、 强烈的责任心，执行力，主动性。,电商,150-500人,ios,北京
ios开发工程师,https://www.lagou.com/jobs/6861630.html,西城区,15k-22k,中科科界（北京）科技有限公司,5-10年,本科,六险一金 国企 周末双休 地铁周边,"岗位职责：
  负责iOS移动客户端产品研发；
  负责产品架构的改进及性能优化 ；
 负责新技术的学习、研究和应用 ；
  参与产品的改进；
任职资格：
 本科及以上学历，五年以上iOS开发经验，计算机相关专业优先 ;有扎实的计算机基础、Objective-C语言基础，熟悉面向对象化编程思想和设计模式 ;
 熟悉iOS系统及iOS软件的开发、测试、分发流程，对iOS SDK和CocoaPos框架有深入理解，熟悉开发工具和测试工具的使用；
 具有强烈的进取心和求知欲望，善于学习和运用新知识，乐于解决具有挑战性的问题 ;
 具有良好的团队合作精神和积极主动的沟通意识；
 具有较强的逻辑思维和责任感。",社交、软件开发,50-150人,ios,北京
iOS开发工程师,https://www.lagou.com/jobs/6861101.html,朝阳区,18k-35k,北京同桌游戏科技有限公司,不限,本科,高成长高回报,- 工作职责    - iOS客户端的新功能开发、代码维护和性能优化    - 快速理解产品需求，和市场、运营紧密协作，支持和促进同桌游戏的发展- 职位要求    - 本科及以上学历，计算机软件相关专业    - 熟悉Swift或Objective-C    - 熟悉iOS开发常用的工具、框架    - 熟悉iOS开发常用的设计模式、架构    - 思维严谨、优秀的学习能力、解决问题能力及团队合作精神- 加分项    -  Github上有star较多开源项目或有优秀iOS博客    - 熟悉iOS动画及各种酷炫UI效果者    - 熟悉CoreText、TextKit、AVFoundation、Photos、Contacts、AddressBook等Framework（越多越好）    - 熟悉iOS推送的原理及实现    - 精读过Alamofire、SwiftyJSON、SnapKit、YYKit等知名开源项目（越多越好）    - 熟悉IM的原理及实现，熟悉环信SDK各接口的使用    - 熟悉常用的统计方法、工具    - 熟悉微信、QQ、微博、Google、Facebook等常见第三方SDK，及其身份验证、分享、支付等API的二次封装    - 熟悉Cocos2d-JS或Cocos2d-Lua    - 熟悉持续集成、打包、发版、与审核人员沟通等流程    - 熟悉iOS逆向分析   - 985/211，计算机科学与技术、软件工程、电子科学与技术、信息与通信工程专业的本科及以上学历优先   - 持续在一家知名互联网或科技类公司2年及以上的工作经验,移动互联网,50-150人,ios,北京
ios开发工程师,https://www.lagou.com/jobs/6883122.html,朝阳区,13k-20k,北京高域海汇科技有限公司,1-3年,本科,"核心业务,行业大牛,上升空间",岗位职责：1、负责iOS客户端功能架构的设计开发和迭代维护；2、参与iOS客户端需求评审、实现方案设计技术优化以及调研实现；3、突破系统开发技术难点，推动产品持续升级；4、关注互联网热点技术的发展方向，敢于提出、评估并应用新技术，开拓新服务。任职资格：1、本科或以上学历；2、精通OC或Swift；3、精通UIKit，能实现较复杂的UI交互，能解决一般性能问题；4、计算机基础扎实，熟悉常见数据结构和设计模式，熟悉 HTTP 、Websocket等网络协议；5、良好的沟通协作能力，自我学习能力强，执行力好，注重效率，能够深刻影响其他人；,移动互联网,150-500人,ios,北京
iOS高级开发工程师,https://www.lagou.com/jobs/7129541.html,朝阳区,20k-30k,北京奇艺世纪科技有限公司,5-10年,本科,大平台 学习机会多,岗位职责1、负责移动产品的功能研发和性能优化，完成高质量编码和测试工作；2、和产品经理配合，深度参与手机产品需求讨论，功能定义等 ；3、设计良好的代码结构，不断迭代重构 ；4、承担重点、难点的技术攻坚。 任职要求1、本科及以上学历，计算机相关专业，五年以上开发工作经验，三年以上iOS开发经验；2、具有扎实的编程功底，良好的设计能力和编程习惯，熟练掌握Objective-C、iOS SDK ，熟悉React Native或JavaScript；3、能独立开发iOS App；4、积极乐观，责任心强，工作认真细致，具有良好的团队沟通与协作能力。温馨提醒：如果 7 天内您没有收到爱奇艺的面试邀请，那么目前我们不会安排您参加后续的面试环节，感谢您的理解和对爱奇艺的关注与认可。,文娱丨内容,2000人以上,ios,北京
iOS高级开发工程师,https://www.lagou.com/jobs/7109389.html,海淀区,20k-30k,北京车之家信息技术有限公司,5-10年,本科,上市公司 公司规模大 福利待遇,【岗位职责】1、按时保质完成IOS客户端的版本开发任务；2、提升软件性能，质量，效率等多维度的技术指标；3、核心功能的框架设计及搭建，新技术调研，难点攻关。【岗位要求】1、5年以上iOS开发经验，主导、研发、发布过线上优秀产品；2、扎实的Object-c语言功功底，优良的编码风格和设计思维；3、熟悉iOS系统结构，对于内存，IO，网络，性能优化具备优良的技术能力素质；4、熟悉常用设计模式，具备优秀的编程素养和代码风格；5、具备优秀的多线程编程素养；6、熟悉React Native或Flutter等跨平台技术，了解框架原理；7、较强的分析和解决疑难问题的能力；8、工作细心，有责任感，有良好的沟通能力，富有团队精神；9、具备专业的职业素养和一定的抗压能力。,汽车丨出行,2000人以上,ios,北京
资深iOS开发工程师,https://www.lagou.com/jobs/6814247.html,海淀区,25k-50k,北京世纪好未来教育科技有限公司,5-10年,本科,牛人团队 转正机会 提供晚餐 周末双休,工作职责:-负责客户端（包括但不限于iOS  、macOS）的设计和研发，以及线上产品的维护和优化-负责  iOS  客户端的适配及性能优化，解决疑难问题-设计良好的代码结构，不断迭代重构优化项目架构-带领初级工程师共同完成研发任务职责要求:-计算机相关专业，五年及以上iOS开发经验，有主导或者独立开发的上线作品，掌握产品从开发到上线的完整过程-有扎实的Objective-C/C/C++语言基础，有C/C++开发经验者优先；-深入理解内存管理、多线程、网络、运行时及GUI开发，能够思路清晰的分析和解决疑难问题;-熟练掌握常用的数据结构和算法，熟练掌握常用设计模式和设计原则，有客户端架构设计经验，能够熟练的完成技术架构的重构;-理解OBJ-C的Runtime的运行机制和iOS平台的内存管理机制-熟练掌握iOS开发工具和相关开发测试工具的使用，包括但不限于instruments/charles等-能够主导完成某一功能模块的设计和实现，针对产品需求完成技术拆解，带领初级工程师达成项目目标-学习能力强，能够快速适应新的技术领域、学习新的技术-责任心强，保质保量完成各项工作-积极主动，能够主动承担责任，不局限于分配的工作,教育,2000人以上,ios,北京
小猿搜题-IOS研发工程师,https://www.lagou.com/jobs/6051213.html,朝阳区,25k-45k,北京猿力未来科技有限公司,不限,本科,行业领先 氛围好 下午茶 出国游,"工作职责: 1. 负责相关产品iOS客户端的开发工作; 2. 调整和优化代码质量、应用体验 任职资格: 1.  2年以上iOS开发经验,有较强的学习和解决问题能力; 2. 有扎实的Objective-C/Swift语言基础,有良好的数据结构和算法基础;3. 熟练掌握iOS开发技术,熟悉常用的第三方开发库; 4. 熟悉iOS不同版本的特性,了解Cocoa、UIKit等框架 5. 学习能力强,善于沟通、合作","移动互联网,教育",2000人以上,ios,北京
iOS开发工程师-【X6】,https://www.lagou.com/jobs/6600488.html,海淀区,20k-40k,北京达佳互联信息技术有限公司,不限,本科,"晋升空间,大牛团队,福利诱人",职位描述1、负责iOS客户端设计与开发；2、负责基础模块和组件的研发和维护；3、关注性能，提升客户端用户体验。任职要求1、良好的编程风格，扎实的编程和数据结构算法基础；深入理解面向对象编程思想，具有较强的设计能力；2、深入理解iOS SDK，具有丰富的 Objective-C 及 C/C++ 开发经验；精通各种UI控件，能够实现复杂的界面交互；3、熟练掌握iOS平台下的高性能编程及性能调优；4、具有较强的分析和解决问题的能力；热爱互联网新技术，了解并探索业界技术动向；5、有强烈的责任心和团队精神，善于沟通和合作；6、具有音视频、直播、OpenGL相关开发经验者优先。,文娱丨内容,2000人以上,ios,北京
iOS开发工程师 -【反作弊】,https://www.lagou.com/jobs/6929409.html,海淀区,30k-55k,北京达佳互联信息技术有限公司,3-5年,本科,岗位发展好，期权,岗位职责：1、独立设计风控SDK模块，负责核心模块开发；2、对SDK进行性能优化；3、对IOS APP、SDK进行逆向分析，了解其工作原理。岗位要求：1、具备3年及以上iOS平台开发经验，对iOS SDK开发有研究经验者优先；2、熟悉OC、SWIFT等语言，熟悉IOS开发平台特性，熟练掌握IOS相关控件；3、熟悉iOS攻防对抗知识，熟悉IOS黑产工具者优先；4、具有iOS逆向经验者优先；5)、具有iOS设备反作弊经验者优先。,文娱丨内容,2000人以上,ios,北京
IOS高级开发工程师,https://www.lagou.com/jobs/5121305.html,海淀区,20k-40k,北京字节跳动科技有限公司,3-5年,本科,六险一金，弹性工作，免费三餐，租房补贴,,文娱丨内容,2000人以上,ios,北京
SG闪购-高级iOS开发工程师,https://www.lagou.com/jobs/7134008.html,朝阳区,30k-50k,北京三快在线科技有限公司,3-5年,本科,新业务，发展空间大,,消费生活,2000人以上,ios,北京
ios专家,https://www.lagou.com/jobs/7032778.html,海淀区,20k-35k,北京世纪好未来教育科技有限公司,3-5年,本科,食堂 绩效奖金 年终奖,岗位职责： 1. 负责沟通和协同类效率工具iOS客户端相关产品的架构、设计、优化;2. 负责基础库、框架、关键模块的技术选型、开发和改进;3. 指导团队其他成员的设计和Coding，保证工程质量;4. 优化IOS团队的开发模式、流程和规范，提高团队效率。岗位要求：1. 5年以上IOS开发经验，可以独立承担架构设计，并主导项目;2. 精通Objective-C，有扎实的算法基础，深入掌握OC的底层机制，对内存管理，多线程编程，runtime等进阶技术有深入了解;3. 有全面的计算机基础知识，有较强的代码阅读能力，代码风格良好，能设计出高效、合理、易读、易于扩展的程序结构;4. 熟练使用 Git、CocoaPods、Instruments 等 IOS 开发常用工具;5. 有Android客户端研发经验的优先;6. 良好的团队协作能力和沟通能力，有责任感，对移动端产品有浓厚的兴趣，有求知欲，热爱学习新知识。,教育,2000人以上,ios,北京
美团平台-高级iOS工程师,https://www.lagou.com/jobs/6790362.html,朝阳区,38k-58k,北京三快在线科技有限公司,5-10年,本科,核心部门 上市公司 大牛云集,,消费生活,2000人以上,ios,北京
iOS开发工程师,https://www.lagou.com/jobs/4597596.html,海淀区,18k-36k,北京字节跳动科技有限公司,1-3年,本科,弹性工作，免费三餐，租房补贴，休闲下午茶，晋升空间,,文娱丨内容,2000人以上,ios,北京
IOS开发工程师,https://www.lagou.com/jobs/7053900.html,海淀区,15k-25k,北京聚和天成科技有限公司,3-5年,本科,区块链 团队氛围好,岗位职责1、基于移动互联网的金融、电商平台，负责iOS端的需求分析、架构设计、开发和维护；2、规范编写设计和维护文档；3、独立完成移动终端产品应用功能模块开发。任职资格1、统招本科及以上学历，计算机相关专业；2、精通Objective-C、Cocoa Touch框架，熟悉iOS SDK开发环境；3、5年以上iOS平台实际开发经验，具有大型互联网公司、主流互联网金融公司、电商平台工作经验；4、具有丰富的iOS平台UI开发经验，熟悉iOS平台设计模式以及设计理念；5、熟悉iOS平台网络、多线程、动画相关模块编程、熟悉TCP/UDP、HTTP等网络通信协议，熟悉iOS下网络通信机制；6、对代码、产品质量有执着的追求和强烈的责任感；7、能够独立完成项目，在App Store有应用发布者优先。加分项：有股票K线相关项目经验优先考虑~,"移动互联网,金融",50-150人,ios,北京
iOS高级开发工程师,https://www.lagou.com/jobs/6839303.html,海淀区,25k-50k,北京音娱时光科技有限公司,3-5年,本科,五险一金，补充医疗，带薪年假，股票期权,"工作职责：1. 负责公司K歌产品的研发，编写高质量的代码；2. 项目重构，代码review，性能优化，代码质量把控；3. 新技术方向调研，技术难点攻克；4. 配合产品/运营等部门, 提供相关技术支持。岗位要求：1. 统招本科及以上学历，三年以上 iOS 开发经验；2. 精通 OC/Swift 语言；3. 具有扎实的编程工底，良好的设计能力和编程习惯；4. 有强烈的求知欲和进取心，对技术和用户体验充分重视，对性能追求**；5. 学习能力强，具有良好的沟通能力和良好的团队合作精神，有良好的抗压能力；乐观积极，责任心强；6. 有音视频，图像处理经验者优先；7. 有 C/C++ 经验者有限。",移动互联网,50-150人,ios,北京
IOS终端开发工程师,https://www.lagou.com/jobs/6338451.html,海淀区,20k-40k,腾讯科技（深圳）有限公司,3-5年,本科,薪酬福利优厚，极富挑战性,岗位职责：参与Devops相关工具链和平台的建设工作； 参与IOS产品的质量保证工作，推动提升代码质量； 参与IOS产品研发流程的改进，提升研发效能。岗位要求：本科以上学历，计算机相关专业，3年以上相关工作经验； 熟悉IOS平台应用开发并有成熟产品开发经验，独立在应用商店发布作品者优先； 熟悉IOS单元测试、自动化测试，具备Devops实践经验； 对业界开源软件有持续关注，并对一些核心组件有过深入的了解； 能独立承担任务，具备优秀的分析和解决问题的能力； 有团队精神，具有良好的沟通能力。,社交,2000人以上,ios,北京
