job_name,job_url,job_location,job_salary,job_company,job_experience,job_class,job_given,job_detail,company_type,company_person,search_key,city
产品经理,https://www.lagou.com/jobs/7162701.html,南山区,13k-25k,未来大学（深圳）教育咨询有限公司,3-5年,大专,只奖励奉献者和贡献者，欢迎有识者加入！,科技改变世界、创新引领未来、认知创造价值 从工业革命到互联网出现，西方科技一次次的技术创新和商业变革，让他们成功引领世界几百年！当文明的钟摆回归东方，我们在深圳，这座改革开放的前驱城市。成立未来大学，这是一所以“新科技+源知识+智能教育”为内驱动的互联网创新型大学。在未来大学，你可以跟随北大、清华、哈佛、斯坦福大学等世界名校教授们深度学习5G、人工智能、区块链、物连网等新科技如何给产业赋能及商业化应用与落地;和世界知名企业的高管们探讨新科技的实践及商业应用的机遇和创新的管理之道！培养颠覆性、前瞻性、创新型、打破常规、挑战极限的未来科技和商业**！同时打造一个去形式、重实际、重贡献的分布式共生组织  期待您加入学习与协作，欢迎大家。同时这不是创始团队公司，也不是资本的组织，这是在打造一个公众化的智慧星球，它不属于任何个体，它属于大众，它只奖励奉献者和贡献者，欢迎有志者加入！产品经理，15K—30K 底层的思维，升华的智慧，用至善的灵魂去唤醒用户，用良知的心去和用户的心交互，来找到真正为用户创造价值的产品，建设好这个智慧星球。岗位职责1、负责在线教育App产品的规划、熟悉互联网产品从0-1全流程，能独立负责产品需求分析、产品设计、项目管理全流程2、负责分析行业、用户需求，分析竞争对手动态和市场动态。3、倾听用户声音，对数据敏感，善于数据统计分析，并根据数据给出产品功能改进意见，提高产品的用户体验；时刻关注产品相关信息，拓展产品功能并提出新的产品创意。4、负责与设计、开发、运营、测试合作，完成产品功能实现、迭代和项目管理等，实现产品目标。任职要求1、4年以上相关用户产品0-1设计完成工作经验，有过在线教育App工作经验者优先考虑。2、有很强的市场洞察力，富于创新精神，对新产品有敏锐的嗅觉，有很强的产品设计能力。3、有较强的自驱力、创新思维、逻辑思维能力、学习能力，能承受一定强度的工作压力。4、有商学、K12相关产品经理经验优先。,教育,15-50人,人工智能,深圳
产品经理,https://www.lagou.com/jobs/6793134.html,南山区,15k-30k,未来大学（深圳）教育咨询有限公司,5-10年,本科,只奖励奉献者和贡献者，欢迎有识者加入！,科技改变世界、创新引领未来、认知创造价值 从工业革命到互联网出现，西方科技一次次的技术创新和商业变革，让他们成功引领世界几百年！当文明的钟摆回归东方，我们在深圳，这座改革开放的前驱城市。成立未来大学，这是一所以“新科技+源知识+智能教育”为内驱动的互联网创新型大学。在未来大学，你可以跟随北大、清华、哈佛、斯坦福大学等世界名校教授们深度学习5G、人工智能、区块链、物连网等新科技如何给产业赋能及商业化应用与落地;和世界知名企业的高管们探讨新科技的实践及商业应用的机遇和创新的管理之道！培养颠覆性、前瞻性、创新型、打破常规、挑战极限的未来科技和商业**！同时打造一个去形式、重实际、重贡献的分布式共生组织  期待您加入学习与协作，欢迎大家。同时这不是创始团队公司，也不是资本的组织，这是在打造一个公众化的智慧星球，它不属于任何个体，它属于大众，它只奖励奉献者和贡献者，欢迎有志者加入！产品经理，15K—100K 底层的思维，升华的智慧，用至善的灵魂去唤醒用户，用良知的心去和用户的心交互，来找到真正为用户创造价值的产品，建设好这个智慧星球。岗位职责1、负责在线教育App产品的规划、熟悉互联网产品从0-1全流程，能独立负责产品需求分析、产品设计、项目管理全流程2、负责分析行业、用户需求，分析竞争对手动态和市场动态。3、倾听用户声音，对数据敏感，善于数据统计分析，并根据数据给出产品功能改进意见，提高产品的用户体验；时刻关注产品相关信息，拓展产品功能并提出新的产品创意。4、负责与设计、开发、运营、测试合作，完成产品功能实现、迭代和项目管理等，实现产品目标。任职要求1、4年以上相关用户产品0-1设计完成工作经验，有过在线教育App工作经验者优先考虑。2、有很强的市场洞察力，富于创新精神，对新产品有敏锐的嗅觉，有很强的产品设计能力。3、有较强的自驱力、创新思维、逻辑思维能力、学习能力，能承受一定强度的工作压力。4、有商学、K12相关产品经理经验优先。,教育,15-50人,人工智能,深圳
品牌策划,https://www.lagou.com/jobs/7088337.html,龙华新区,11k-15k,深圳市捷佳航空科技有限公司,3-5年,本科,平台大、环境优美、领导好相处、学习机会多,工作职责：1、 搜集最新的市场动态和行业讯息，捕捉最新市场动向以及竞争对手产品和推广信息，协调其他部门，以及公司对外的品牌形象实时监测；2、 配合部门负责人，进项公司品牌营销策划方案的撰写，对公司产品的市场定位、品牌定位、价格定位、渠道定位、媒体投放、形象包装、活动推广等进行系统化的策划和执行跟进；3、 产品营销活动策划方案的撰写、以及活动执行落地跟进工作；4、 公司广告宣传物料文案的攥写；5、 领导安排的其他相关工作。岗位要求：1.      全日制统招本科（硬性条件），广告学、公共关系学、传播学、市场营销等专业毕业；2.      曾在全国知名广告公司或者4A级广告公司工作3年以上工作经验；3.      具有科技产品、人工智能等具有相关产品或项目的营销推广经验，熟悉to B和to C市场的品牌推广。4.      具备一定文案撰写能力，熟悉各类科技产品的相关稿件，包括但不限于：广告文案、软文、新闻通稿、行业评论、发言稿等。5.      熟悉各类线上媒体的媒体特性和各种创意玩法，具有丰富的idea，能够随时捕捉行业热点，制造营销噱头进行线上线下的有效推广；6.      具备丰富的活动策划能力和执行能力，熟悉各类展会活动、会议营销、新闻发布会等流程，具有活动把控能力；7.      能够熟练掌握ppt，具备良好的ppt编辑能力和美化能力，以及word、excel的办公软件；8.      具有良好的团队合作意识，易沟通，善于洞察、具有丰富创造力，学习能力强。,物联网,50-150人,人工智能,深圳
支付后台开发工程师-数字银行,https://www.lagou.com/jobs/7201359.html,南山区,20k-40k,深圳虾皮信息科技有限公司,1-3年,不限,新项目，年假15天，大咖团队,"业务介绍
 依靠数据和技术驱动金融业务运营，打造新型东南亚数字银行，应用云计算，大数据，人工智能等互联网技术，着力在服务模式，客户群体，风控制度等领域进行创新。为东南亚广大用户提供更加贴近生活，简单易用的存款，贷款，转账，理财等金融基础服务。
岗位职责
 负责银行支付、清算系统等银行及金融业务系统的开发工作
 负责编码、单元测试和操作手册、维护手册编写等工作；通过与相关团队积极有效沟通，确保开发进度与质量
 对生产事件提供应用支持，思考和实现必要的功能或工具来保证系统稳定运行
 岗位要求
 2年及以上java开发经验；
 本科（全日制）及以上学历，理工科类专业
 具备扎实的Java编程基础，熟悉SSM、SpringCloud等开源流行框架，有较强的代码质量控制意识和良好技术、业务文档能力
 熟悉服务化、分布式系统、数据库（MySQL）、搜索引擎，典型中间件（LVS、Nginx、Redis、RabbitMQ等）
 具有良好的团队合作和沟通能力，有很强的自驱力，能主动为结果负责
 具有银行核心系统研发相关经验，熟悉银行开发流程者优先
 参与过大型分布式系统的设计和开发，有服务化、高并发系统的架构设计和开发经验者优先",电商,500-2000人,人工智能,深圳
前端开发Leader-数字银行,https://www.lagou.com/jobs/7201315.html,南山区,40k-60k,深圳虾皮信息科技有限公司,5-10年,不限,新项目，年假15天，大咖团队,"业务介绍
 依靠数据和技术驱动金融业务运营，打造新型东南亚数字银行，应用云计算，大数据，人工智能等互联网技术，着力在服务模式，客户群体，风控制度等领域进行创新。为东南亚广大用户提供更加贴近生活，简单易用的存款，贷款，转账，理财等金融基础服务。
岗位职责
 负责银行及金融业务前端产品需求开发，编写高质量可维护性的代码及相关技术文档
 主导前端整体架构设计及业务选型，负责团队基础技术、应用框架体系和工程化体系建设；
 结合实际业务场景不断优化现有产品，研究和探索前沿的前端技术，提高系统速度、稳定性和可扩展性，提升用户体验；
 建设人才梯队，优化开发流程，提高开发人员效率
 岗位要求
 本科以上学历，计算机相关专业，5年及以上全职开发工作经验。； 
 熟练掌握相关技术解决方案，可以组织相关技术解决方案进行持续优化，可以对新技术进行评估和引入；
 熟练使用原生JS编程，至少熟悉React/Vue.js/Angular一种前端开发框架，并有复杂应用场景的开发经验；  
 熟悉各种浏览器平台的特性，能够解决浏览器兼容性问题； 
 有前端架构设计、技术选型、性能优化、开发规范制定等方面的实际经验；
 需要有一定的英文阅读和书写能力，有金融开发经验更佳。",电商,500-2000人,人工智能,深圳
软件开发岗（java后台）,https://www.lagou.com/jobs/6978840.html,福田区,15k-25k,中移信息技术有限公司,3-5年,本科,央企、福利待遇好、平台大,岗位职责：1）负责已有应用系统日常代码维护工作，包括bug修复、功能优化完善、代码重构等； 2）负责新业务需求应用开发工作，包括技术方案设计、技术选型、项目管理、代码编写、单元测试等工作； 3）负责支撑运维工作，当相关应用系统出现问题，需要快速响应支撑，负责代码级排错和定位，bug修复等工作，保障应用系统稳定运行； 4）负责研究和引入新技术，对新开发工具平台及新技术运用进行研究和推广； 5）负责撰写部分开发文档和管理文档，如系统架构设计方案文档、概要设计文档、代码说明文档，部署文档，技术研发文档等。 6）负责软件开发项目管理和实施工作任职资格：1）计算机本科及以上学历，有3年以上Java开发相关工作经验； 2）熟练掌握主流java后台开发技术和框架，包括：SSI/SSH，Spring Boot/Cloud，缓存，多线程技术，熟悉人工智能相关技术3）熟悉大规模系统的非功能性设计及评估，分布式系统架构及原理，具备设计分布式系统设计能力。 4）熟练使用主流数据库(MysqlOracle)，熟练掌握SQL语法及调优； 5）至少参与过两个中型核心业务系统的项目设计或开发、有中大型系统部署、运维上线经验优先，有成功实施微服务架构经验优先 6）掌握高并发、分布式通信、内存数据库等技术； 7）沟通能力强，思维敏捷，具有良好服务意识，具备高度责任心，有较强的学习能力。,"数据服务,软件开发",2000人以上,人工智能,深圳
后端开发工程师（go）,https://www.lagou.com/jobs/5804920.html,南山区,15k-30k,广州国音智能科技有限公司,不限,本科,"大牛多,人工智能,IDG领投,技术创新",职位描述：1、负责后端程序的架构设计和优化；2、负责后端新需求的系统设计和实现。任职资格：1、本科及以上学历，有1-7年的互联网后端开发经验；2、精通Golang、Python中至少一门语言，能够熟练使用业务语言快速实现需求；3、良好的文档编写能力和故障排查能力，工作细心，较强的责任感和抗压能力；4、有过复杂系统开发经验优先，如ERP/CRM/电商订单管理类业务等；5、熟悉人工智能领域者优先。,移动互联网,150-500人,人工智能,深圳
量化策略研究实习生（若干）,https://www.lagou.com/jobs/6830893.html,福田区,1k-2k,深圳市前海九派资本管理合伙企业（有限合伙）,应届毕业生,本科,节日福利、不定期旅游等福利制度,岗位职责：1.研究国内股票、期货和期权等交易品种；2.设计交易策略并参与实盘交易。 岗位要求：1.国内外知名大学硕士以上学历，具备良好的数理功底，对量化投资有浓厚兴趣；2.具有扎实的机器学习理论基础，精通机器学习、人工智能、数据挖掘中的一项或多项；3.熟练使用python，熟悉C++；4.奥赛比赛获奖者和相关专业领域**会议和期刊优秀论文者优先；5.有国内外券商或私募基金的量化研究实习经验者优先；6.实习每周不少于3个工作日。,"金融,物联网",15-50人,人工智能,深圳
（深圳）大数据测试工程师,https://www.lagou.com/jobs/7041635.html,南山区,8k-13k,北京联龙博通电子商务技术有限公司,1-3年,本科,餐补、五险一金、加班费、过节费,要求：1、计算机及相关专业，本科及以上学历，两年以上测试经验:2、熟悉功能测试流程，掌握常用的测试设计方法:3、熟练掌握python或Java语言，有-定自动化测试经验;4、有大数据或人工智能测试经验优先;5、良好的沟通表达能力、理解分析能力、文档编写能力;6、较强的责任心和团队精神，能够承受较强的工作压力;岗位职责：负责大数据测试工作；负责人工智能产品测试工作；公司福利：周末双休+五险一金+年终奖+公司餐补+团建活动+加班费+加班餐补+加班超时双倍餐补＋加班车补等招行工作环境优越，管理到位，且现场有我司助理以及PM驻场。*我们公司目前是给招商银行的项目组招聘工程师（公司只做长期项目），属于人力外包；*我们跟银行合作多年，项目稳定，工作地点固定。※ 以上如能接受外聘，欢迎投递简历。,"移动互联网,电商",2000人以上,人工智能,深圳
销售工程师/经理,https://www.lagou.com/jobs/6797116.html,南山区,6k-12k,乐聚（深圳）机器人技术有限公司,1-3年,大专,"前景好,发展空间大,大牛多",岗位职责：1、负责公司B、C端教育产品的销售和推广，完成销售指标；2、参与教育产品或项目的技术咨询、方案设计，能针对政府，教育类客户进行方案宣讲引导，技术交流；3、负责开拓新的客户资源及渠道，能够结合客户的需求，提供专业灵活的服务，并从中发掘销售机会，最终达成销售目标及扩大产品的市场占有率；4、建立客户档案，维护客户关系，解决客户问题，促进业务的长期合作；职位要求：1.大专及以上学历，理工科背景，有3年以上销售工作经验，有责任心，能承受较大的工作压力；2.具有儿童教育电子产品、教育机器人经验，从事过学校市场经验和零售经验优先； 3.对人工智能技术方向有热情，对科创教育有一定了解，有通过人工智能新技术改变教育模式的愿景；4.具有较强的沟通协调能力及谈判技巧，有良好的客户服务意识及团队协作能力；,硬件,50-150人,人工智能,深圳
BDM,https://www.lagou.com/jobs/7054574.html,福田区,7k-14k,深圳市丰宜科技有限公司,3-5年,大专,朝九晚六，周末双休。,什么是丰e足食？      丰e足食是顺丰旗下的新零售品牌，于 2017年12月成立了无人货架项目，我们以线下碎片化场景、企业员工需求为核心，依托顺丰领先物流、供应链、营运优势，搭建多层次、高效率的新零售服务网络，提供多场景解决方案，助力完成企业员工福利体系，为企业提供定制化、一站式员工福利解决方案，目前已覆盖全国37个地区，服务企业客户50000+，专业服务团队600+人。       而我们做的不仅仅是无人货架，在逐步精细化运营过程中，丰e足食一方面借助人工智能和大数据，聘请国际**供应链专家，建立智能供应链实验室，以数据驱动运营，逐步实现选品、定价、补货的智能化。另一方面成立智能零售实验室，探索新的零售设备和新的零售场景。现在，丰e足食已经形成无人货架 、智能货柜、自动售货机的组合布局。未来，丰e足食将坚持聚焦CBD企业，实现无人零售与企业服务并举，力争打造依靠供应链优势和技术驱动的办公室综合服务巨头。招聘岗位：顺丰商业项目丰E足食城市推广主管。薪资：7k—14K，底薪及绩效考核制。工作内容：1.负责深圳市场丰e足食自动贩卖机的市场推广工作2.组建并管理一支8-12人的团队，带领团队进行市场的开发。我们没有统一的管理标准，只以业绩为导向，在这里你可以施展个人最好的才华。3.作为一名管理者，严于律己是必要条件，希望你能遵守公司的各项规章制度并严格执行。4.能接受偶尔的加班和出差。任职要求：1.大专以上学历，形象气质良好。2.2年以上销售经验，2年以上销售团队管理经验。3.有良好的逻辑和语言表达能力，能够深入一线了解员工需求别解读问题提供解决方案。具备招聘能力和员工培训能力，能够向上思考一切从团队利益出发。4.最好具有一定的自贩机市场推广经验。工作时间：工作时间周一至周五，9:00—18:30，周末双休，节假日不加班。晋升空间：作为一支创业型新零售团队，​我们只以业绩为导向，升职加薪都是完全公开透明，只要你有能力，丰e给你施展个人才华最好的天地。,"移动互联网,消费生活",2000人以上,人工智能,深圳
云计算销售经理,https://www.lagou.com/jobs/7184123.html,南山区,6k-12k,深圳极视角科技有限公司,3-5年,大专,人工智能、云计算、技术大牛多,工作职责：1.负责腾讯云计算产品及解决方案在市场的开拓与销售，通过陌拜、线下活动、电话等方式触达客户，沟通客户意向，完成销售任务和市场目标；2.负责客户的关系维护，持续销售；3.负责协调客户、公司等内、外部资源，满足客户需求和提升客户满意。任职要求：1.大专及以上学历，计算机通信等相关专业优先，3年以上销售经验； 2.有IT互联网、云计算、人工智能销售经验者优先，拥有珠海本地客户关系优先；3.拥有腾讯云、阿里云、华为云等相关云厂商经验的候选者优先，能够独立输出云计算相关解决方案者优先；4.有独立开发客户的能力，有较强的人际沟通能力、解决问题能力、执行能力强；5.为人坦诚自信，乐观进取，高度的工作热情，有良好的团队合作精神。,"移动互联网,数据服务",50-150人,人工智能,深圳
软件销售,https://www.lagou.com/jobs/7172088.html,南山区,7k-12k,北京中科汇联科技股份有限公司,1-3年,本科,五险一金 餐补 话费补贴 交通费补贴等,岗位职责：1、根据销售目标，指定销售计划，组织客户公关工作，建立良好的客户关系与合作伙伴关系，确保经营任务的达成；2、开发和维持公司客户关系和合作伙伴关系，规划并整合优势资源，提高公司客户的销售业绩；3、组织所属客户的项目招投标工作，以保证招投标工作的政策进行；4、跟踪协调项目的全过程，组织所属客户的销售工作，确保各项销售额等经营指标的完成；5、防止呆账坏账出现，并制定对策，确保公司账款按计划回款。任职资格：1、本科以上学历，2年以上销售工作经验；2、具备一定的客户关系资源及合作伙伴资源；3、良好的沟通表达能力，能熟练操作相关办公软件；4、学习能力强，有激情，能承受较大工作压力并适应出差；5、有互联网及人工智能行业经验者优先考虑。,企业服务,150-500人,人工智能,深圳
资深图形算法工程师,https://www.lagou.com/jobs/7046105.html,南山区,25k-50k,咪咕文化科技有限公司,3-5年,硕士,国有企业,职责描述：1. 3D/VR/AR的相关前沿技术研发；2. 协同AI算法工程师，设计、实现和优化AR／VR领域的通用核心算法／框架／模块；3. 协同5G研究员，进行5G场景下的AR/VR技术的研究，以及相关通用核心算法／框架／模块的设计、实现和优化；4. 对接人工智能创新联合实验室和合作高校、企业等，研究AI+VR／AR算法的落地优化方法；5. 构建视频、AI+ AR、VR等相关应用专利和标准。岗位要求：1.精通计算几何、3D图形学等知识，有较深厚的数学功底；2.精通OpenGL、OpenGL ES、D3d、OpenCV，精通多种游戏引擎（unity、osg、ogre等），熟悉3D建模软件，精通各种常用的3D模型格式；3.能够自主研发搭建图形游戏引擎框架；4.洞悉业内技术主流发展方向，结合最新技术应用到图形算法领域（如3D建模）；5.能够引领团队实现复杂的图形算法任务并能够在该领域保持一定的优势。细分技术方向：1. 3D建模和图形渲染；2. 基于力学的物理仿真；3. 物料仿真。对应业务场景：V2R：1. 3D建模和3D图形渲染：应用于3D虚拟头像和3D虚拟人体的创建，图形处理能力的提升可以使得创建的3D形象更加逼真；应用于虚拟形象捏脸、虚拟形象换装、虚拟场景构建等业务场景；2. 基于力学的物理仿真：应用于VR、场景特效、头发飘动、衣服形变飘动等物理效果的自然逼真呈现；3. 物料仿真：高保真呈现皮革、布料等不同物料的材质、纹理、光泽等效果。职位竞争优势：1、国有企业、平台大、所属前瞻技术研发核心部门，稳定持续发展；2、五险一金比例：按员工实际薪资缴纳，公积金比例12%，另有企业年金、补充医疗保险等；3、周末双休、享受国家法定节假日及全薪年假、另有各种节假日慰问；4、其他福利待遇：车补、饭补、通讯补贴等；5、舒适的工作环境，积极/简单的研发氛围，超多与各行各业巨头研讨/联合开发实验的机会。,"移动互联网,文娱丨内容",2000人以上,人工智能,深圳
资深AI算法工程师（机器视觉方向）,https://www.lagou.com/jobs/6801381.html,南山区,30k-60k,咪咕文化科技有限公司,5-10年,硕士,国有企业,"岗位职责：1. 人工智能算法工程技术的前沿研究与开发2. 协同算法研究员，设计、实现和优化计算机视觉与多媒体领域通用算法／框架／模块3. 协同特定领域研究员，进行特定领域的算法落地研究，设计、实现和优化视频、AR、VR、5G等特定领域的通用算法／框架／模块4. 对接人工智能创新联合实验室和合作高校、企业等，研究AI算法的落地优化方法任职要求：1. 国内外知名高校计算机科学、电子信息工程、数学或相关专业硕士及以上2. 熟练Python, C/C++中的至少一种语言3. 熟悉TensorFlow/Caffe2/PyTorch等至少一种深度学习框架4. 3年以上机器视觉AI算法研究和开发经验5. 熟悉GPU编程，有良好的视觉基础算法实现和优化能力6. 符合以下条件者加分：   - 在国内外知名AI研究院、实验室实习经验   - 在权威计算机视觉竞赛上作为核心成员获得过前三名以上的成绩              - 在视觉相关领域有丰富经验职位优势：1、国有企业、平台大、所属前瞻技术研发核心部门，稳定持续发展；2、五险一金比例：按员工实际薪资缴纳，公积金比例12%，另有企业年金、补充医疗保险等；3、周末双休、享受国家法定节假日及全薪年假、另有各种节假日慰问；4、其他福利待遇：车补、饭补、通讯补贴等；5、舒适的工作环境，积极/简单的研发氛围，超多与各行各业巨头研讨/联合开发实验的机会。","移动互联网,文娱丨内容",2000人以上,人工智能,深圳
