job_name,job_url,job_location,job_salary,job_company,job_experience,job_class,job_given,job_detail,company_type,company_person,search_key,city
java开发工程师,https://www.lagou.com/jobs/7126571.html,虹口区,8k-15k,广州光点信息科技有限公司,1-3年,本科,周末双休 五险一金 下午茶 年度旅游,岗位职责：1.金融行业应用产品的研发及维护；2.能够独立完成开发任务，保证项目进度和质量。任职条件：1.两年左右java项目开发经验2.精通java开发语言，有扎实的java编码基础；3.熟悉常用框架，如spring、springmvc、Mybatis；4.熟悉：maven、git，精通：redis、oracle、mysql开发；5.熟悉dubbo ，Http等协议6.熟练掌握WebService、Http等接口开发技术，7.了解使用linux基本命令，熟悉sql的性能优化；8.熟练使用Kaffka，elasticjob多线程；9.有很强的学习能力，工作主动性强能主动推动解决问题，耐心细致，责任心强；能承受一定压力，有良好的沟通协调能力与团队合作精神。,"移动互联网,数据服务",50-150人,java,上海
高级java开发工程师,https://www.lagou.com/jobs/7190601.html,长宁区,25k-35k,上海瑛太莱信息科技有限公司,5-10年,本科,年底双薪，带薪年假，定期团建，免费体检等,"岗位职责】1.负责业务需求把控、功能开发、测试。2.主导重大项目的架构设计和核心模块设计。3.审核开发工程师系统设计和代码质量，制定技术规范和开发规范。4.主导技术难题攻关，重构系统，保证高性能处理和系统的稳定性。5.负责培训和辅导初级开发工程师。【任职资格】拥有4年以上互联网后端开发经验；熟悉应用开发框架SpringMVC, Spring Boot等；熟悉主流应用服务器（Tomcat、Jetty等）；熟悉常用工程工具：Maven、Git、Eclipse/IntelliJ等；熟悉数据库设计，MySQL及数据库编程（SQL、JDBC）；java基础扎实，理解io、mq、多线程、集合等基础框架，理解SOA，微服务，DevOps，了解JVM原理，了解软件性能分析、调优等相关方法；基础类服务深入的理解；熟练使用常用的分布式中间件，能整体规划系统架构，对现有系统不足能有改进方案；掌握高并发解决方案。【加分项】1.熟悉分布式、缓存、消息、负载均衡等机制和实现者优先；",电商,500-2000人,java,上海
java开发工程师,https://www.lagou.com/jobs/7066569.html,青浦区,11k-20k,上海圣之尧智能科技有限公司,3-5年,不限,人才公寓，在职研究生，福利齐全,岗位职责：1、 分析业务需求分析并详细设计，负责编码实现；2、 参与系统测试工作，解决测试问题；3、 负责公司业务系统的代码开发和维护。岗位要求：1、地理信息系统（GIS）、计算机、软件相关专业本科及以上学历；2、熟悉面向对象的设计和编程，具有扎实的Java基础知识，熟悉至少一种javascript、node.js开发语言；3、熟悉Spring、Hibernate、Netty、OpenCV、Mybatis等主流开源框架；4、具备良好的沟通能力、团队合作能力和独立分析解决问题的能力；5、熟练掌握JBOSS/Tomcat等一种以上应用服务器优先。6、熟练使用Linux操作系统及常用开发工具，如Eclipse、idea Maven、SVN/Git,"人工智能,软件开发",15-50人,java,上海
java开发工程师,https://www.lagou.com/jobs/7149258.html,浦东新区,18k-30k,上海擎创信息技术有限公司,5-10年,本科,智能运维领域的领跑者,"岗位职责：1. 协助项目经理完成需求评审/设计/估时，负责设计文档及其他文档编写;2. 能独立或协助团队完成编码工作（Java），按时按质完成开发任务;3. 维护和升级现有软件产品和系统，快速定位并修复现有软件缺陷;4. 协助完成项目的测试、系统交付工作，对项目实施提供支持;5. 具有较强沟通能力及执行力，熟悉项目周期及标准管理流程，有项目管理相关资格证书者优先.任职要求：1. 计算机以及相关专业本科及以上学历，有完整的项目开发经历；2. 熟悉java开发，有4年以上Java/Scala开发经验相关；3. 熟悉Mysql, Orale等至少一种常见数据库的开发；4. 熟悉Spring，SpringMVC, Mybatis等常见开发框架及原理，熟悉RESTful；5. 熟练使用常用的开发工具 Idea/Eclipse,Maven,Git/Svn等，熟练使用Linux系统;6. 熟悉大数据生态相关技术，具备Kafka、Flink、Elasticseach, ES-hadoop开发经验的优先；7. 有过高并发或分布式开发经验或大数据以及流式数据处理的经验优先;8. 具备较好的编码习惯，熟悉并能使用常见的设计模式；9. 思维敏捷，较强的需求理解和分析能力，根据需求设计实现可扩展、易维护的解决方案；10. 性格开朗，有团队意识，对工作富有激情。","企业服务,数据服务",50-150人,java,上海
Java工程师,https://www.lagou.com/jobs/2397939.html,长宁区,15k-25k,携程计算机技术（上海）有限公司,1-3年,本科,福利待遇好，有钱途,岗位职责：1、 根据需求完成软件系统模块设计以及开发文档的编写； 2、 根据设计文档和需求说明完成代码编写、调试、单元测试和维护； 3、 有效分析并解决软件开发过程中的问题，负责解决开发过程中的疑难杂症； 4、 协助制定测试计划、定位发现的问题； 5、 严格执行和推行开发规范； 6、 针对项目需要，完成时间内的定制需求开发岗位要求：1、2年以上Java开发经验，基础扎实，理解IO、多线程、集合等基础框架，对JVM原理有一定的了解，同时熟悉.NET语言者优先； 2、精通servlet，JMS，Jdbc开发，熟悉Spring、iBatis、Netty等开源框架，能了解它的原理和机制，熟悉各种常用设计模式； 3、能熟练使用html、javascript、jquery等技术进行Web开发； 4、 对数据库的基本原理和内部实现机制有深入的理解，能够熟练应用MySQL; 5、良好的逻辑思维能力，熟悉业务抽象和数据模型设计，具有很强的分析问题和解决问题的能力，对解决具有挑战性问题充满激情； 6、积级乐观的心态，能够拥抱变化 ，敢于建议，勇于创新。,旅游,2000人以上,java,上海
JAVA,https://www.lagou.com/jobs/3335568.html,长宁区,15k-25k,携程计算机技术（上海）有限公司,1-3年,本科,个人提升 福利待遇 发展空间 年终奖金,岗位职责：1、参与火车票订单体系的业务系统开发，负责代码及相关文档编写；2、和团队成员顺利沟通、协作，并互相帮助提升；3、负责项目的需求分析，参与核心系统的设计和开发，独立完成小型项目的系统分析、设计和开发工作；4、负责指导模块开发工程师完成功能实现，并对编码质量进行监控；5、总结软件开发和维护过程中遇到的技术问题，提出完善具体措施，不断优化软件产品。岗位要求：1、2年以上Java开发经验，基础扎实，理解IO、多线程、集合等基础框架，对JVM原理有一定的了解，同时熟悉PHP语言者优先；2、精通servlet，JMS，Jdbc开发，熟悉Spring、iBatis、Netty等开源框架，能了解它的原理和机制，熟悉各种常用设计模式；3、能熟练使用html、javascript、jquery等技术进行Web开发；4、对数据库的基本原理和内部实现机制有深入的理解，能够熟练应用MySQL;5、良好的逻辑思维能力，熟悉业务抽象和数据模型设计，具有很强的分析问题和解决问题的能力，对解决具有挑战性问题充满激情；6、积级乐观的心态，能够拥抱变化 ，敢于建议，勇于创新。,旅游,2000人以上,java,上海
java开发工程师,https://www.lagou.com/jobs/6823482.html,闵行区,12k-20k,上海龙品信息技术有限公司,3-5年,本科,五险一金、节日福利、弹性工作,"岗位职责：1、参与项目需求分析，并根据需求进行开发工作；2、依照项目计划，按时提交高质量代码，完成开发任务；以及规范文档的编写和维护；3、持续改进和升级，优化产品功能，修复平台现有的BUG；4、整理和提交技术文档，负责产品功能模块的代码编写和单元测试。任职资格：1.工作经验 3年及以上Java实际开发经验2.熟悉java语言、具备分布式应用开发经验、熟练掌握Springmvc/springboot、mybatis等开源框架；3.SQL必须非常熟悉；4.熟悉TCP/IP网络协议,熟悉Linux 常用命令；5.具备良好的代码编写习惯，熟练使用代码版本管理工具Svn/Git与项目构建工具maven；6.至少有2年的互联网开发经验；7.熟悉Redis、Kafka、Zookeeper、dubbo、springcloud 2种以上的优先考虑8.熟悉ajax/javascript/css/html/vue优先考虑9.要求计算机专业和软件程序专业",电商,50-150人,java,上海
Java工程师,https://www.lagou.com/jobs/7016613.html,黄浦区,20k-35k,贝壳找房（北京）科技有限公司,5-10年,本科,发展空间大，团队氛围好，企业平台广,,房产家居,2000人以上,java,上海
java开发工程师,https://www.lagou.com/jobs/6749553.html,浦东新区,20k-30k,耀方信息技术（上海）有限公司,3-5年,本科,上市公司 大平台 发展空间,岗位职责:：1、按照开发经理分配的任务负责所属模块的分析、设计、开发实现；2、指导工程师分析并解决软件开发过程中的问题3、按照公司规范编制高质量代码，编写相关技术文档4、参与项目需求分析，根据需求文档和设计文档完成代码编写、调试、测试和维护工作任职要求：1，计算机本科以上学历，计算机，数学等相关专业，3年及以上java开发经验，参与过大型soa项目建设，熟悉dubbo，Spring Cloud，SpringBoot，熟悉微服务架构风格；2，熟悉B2B或者B2C电商商品、价格、库存、用户体系；3，熟练使用struts2、Spring、Ibatis等开源框架，并能解决开发中常见的问题4，熟练使用Redis、Memcached等缓存，并具备调优经验5，熟练使用mysql，oracle数据，具备sql调优经验6，熟悉使用eclipse，tomcat，git，mysql集成开发环境7，具有良好的沟通、协调能力，有较强的责任心和主人翁意识,"移动互联网,电商",500-2000人,java,上海
高级Java开发工程师,https://www.lagou.com/jobs/6856467.html,浦东新区,10k-15k,普元信息技术股份有限公司,3-5年,本科,五险一金、上市公司、团队稳定,工作职责：1、参与项目前期可行性分析、建设方案的制定，参与功能需求的整理与设计；2、参与具体项目的实施工作，包括不限于模块设计、系统框架或关键代码开发、系统上线等；3、独立或指导其他初级开发人员一起完成相关的任务；4、能够承担项目中的技术攻关，对低级别员工进行技术指导；职位要求：1、国家承认全日制本科及以上学历，3年以上工作经验，JAVA语言基础扎实；2、熟悉J2EE相关技术，深入理解常用的开源框架和技术，如SpringMVC、Mybatis/Hibernate等并熟悉其内部原理；3、精通SQL及优化，熟悉Oracle、Mysql关系型数据库，熟悉常用的NoSQL技术如Redis/MongoDB并具有实战经验；4、熟悉多线程开发、http、tcp协议的相关知识及相关经验5、有微服务开发（SpringBoot），Docker背景者优先6、能接受长期出差者优先7、学习能力强，认真并有耐心，能承受工作压力8、有高度的责任感、很强的学习和沟通能力，具有良好的团队合作精神,"企业服务,数据服务",500-2000人,java,上海
java开发工程师,https://www.lagou.com/jobs/6360776.html,浦东新区,9k-17k,普元信息技术股份有限公司,3-5年,本科,五险一金、弹性工作、,工作职责：1、参与项目前期可行性分析、建设方案的制定，参与功能需求的整理与设计；2、参与具体项目的实施工作，包括不限于模块设计、系统框架或关键代码开发、系统上线等；3、独立或指导其他初级开发人员一起完成相关的任务；4、能够承担项目中的技术攻关，对低级别员工进行技术指导；职位要求：1、国家承认全日制本科及以上学历，计算机专业毕业， 2 年以上工作经验；2、能够熟练使用Java语言开发Web企业级应用，掌握Spring Boot、Spring Cloud、Hibernate、MyBatis等开源框架；3、熟练数据库开发技术，掌握常见一种或多种数据库知识；熟练应用SQL；4、对多线程、事务有较深刻的认识和使用经验；5、沟通能力强，注重团队协作、有良好的学习能力、工作踏实；,"企业服务,数据服务",500-2000人,java,上海
java,https://www.lagou.com/jobs/4055336.html,黄浦区,15k-20k,上海舟恩信息技术有限公司,3-5年,本科,"大型项目,金融",岗位职责：独立完成系统功能模块分析、设计，并主导完成详细设计和编码，确保开发进度和质量；对程序BUG进行修正，对系统问题进行修改完善；对系统部署提供技术支持；对系统维护提供后续支持；岗位要求：本科以上学历，软件，信息技术类相关专业；3年以上Java开发经验；熟悉maven、git的使用；熟悉J2ee技术，熟悉web开发技术，熟悉常用的hibernate，springMVC等框架；熟练使用oracle、sql server、mysql中的一种或多种；有Play框架使用经验优先；有mongodb使用经验优先；思维清晰，逻辑能力强，良好的团队意识。,移动互联网,150-500人,java,上海
java开发工程师,https://www.lagou.com/jobs/7165783.html,徐汇区,13k-17k,上海微创软件股份有限公司,3-5年,本科,大平台、人工智能,"商汤科技专注于计算机视觉和深度学习的原创技术，是中国领先的人工智能头部公司。以“坚持原创，让AI引领人类进步”为使命，为安防、金融、智能手机、移动互联网、汽车、智慧零售、机器人等诸多行业提供基于人脸识别、图像识别、视频分析、无人驾驶、医疗影像识别等技术的完整解决方案。商汤科技现已在香港、北京、深圳、上海、成都、杭州、日本京都和东京成立分部，成为世界一流的原创人工智能技术公司。本职位派驻至商汤科技工作。职位描述1、 负责业务系统核心服务的需求分析、技术调研、设计、开发工作；2、 负责相关技术文档编写工作；3、 解决系统中的关键问题和技术难题。岗位要求1、计算机相关专业本科或以上学历，三年以上Java项目开发经验；2.、精通java语言，熟悉jvm，web开发、缓存、分布式架构、消息中间件等核心技术；3、精通Java EE相关的主流开源框架，能了解到它的原理和机制，如SpringBoot、SpringCloud、MyBatis等；4、精通Java编程技术，熟悉spring, mq, cache, rpc, search；5、具有一定的基于数据库、消息中间件、缓存、分布式存储开发高性能、高可用分布式应用系统的实践经验；6、熟悉MySQL/Redis/MongoDB；7、熟悉ElasticSearch，kafka原理和开发。","企业服务,移动互联网",2000人以上,java,上海
java开发工程师,https://www.lagou.com/jobs/6682244.html,浦东新区,15k-20k,上海银科创展投资集团有限公司,3-5年,本科,上市公司,"【岗位职责】1、负责内部产品的功能规划、需求分析设计、技术实现和用户体验；2、负责所属模块的代码开发、调试与维护工作；3、积极响应客户需求并进行开发/定制化开发和交付；4、参与公司产品的架构优化，性能优化并辅助其他模块进行技术实现；5、完成其他各类技术开发任务。【岗位要求】1、全日制本科及以上学历，计算机相关专业优先；2、3年以上Java开发经验，Java基础扎实，熟练掌握数据结构、java动态代理、反射、多线程等相关技术，掌握常用的设计模式，编码认真严谨规范；2、熟悉使用Spring、SpringBoot、Mybatis、Hiberate、dubbo、zookeeper等开源框架；3、熟悉分布式、缓存、消息等机制；熟悉memcache, redis, mongodb等主流NOSQL存储开源项目；4、熟悉至少一种常用数据库的应用开发，如Oracle、Sql Server、MySQL；5、有一定的linux基础，能够熟练使用linux常用工具；6、熟悉常用的RabbitMQ、ActiveMQ、kafka、redis等消息中间件技术；7、做过用友NC系统开发者优先。","移动互联网,金融",2000人以上,java,上海
Java开发工程师,https://www.lagou.com/jobs/6877102.html,徐汇区,10k-20k,东方财富信息股份有限公司,1-3年,本科,节日福利 年底双薪 五险一金,,金融,2000人以上,java,上海
java开发工程师,https://www.lagou.com/jobs/7191469.html,浦东新区,8k-15k,遍享信息技术（上海）有限公司,1-3年,大专,福利待遇好，13薪等,"1、核心功能的架构与代码编写，开发并维护系统公用核心模块以及相关文档编写；2、参与技术难点攻关；3、负责产品的开发、维护；职位要求：1、熟练掌握前端基础,熟悉主流JS框架，如JQuery、Angular等；2、熟练掌握常用开源框架，对SpringBoot、Maven、Spring、Springmvc、Mybaits有比较深入的理解；3、熟练掌握SQLServer、MySQL等主流数据库，具备SQL、触发器、函数、存储过程的编写能力；4、熟练掌握Java技术架构，熟悉WebService、分布式、多线程等高性能架构相关开发技术，掌握Java系统的故障排查和性能调优；5、熟练使用Tomcat，Jetty等应用服务器;6、学习能力强，有较强的独立工作能力和团队协作精神，极强的责任心，工作踏实、抗压能力强；7、良好的编码习惯，思路清晰，命名规范，逻辑性强；","移动互联网,消费生活",50-150人,java,上海
java开发工程师,https://www.lagou.com/jobs/7190754.html,静安区,18k-20k,苏州工业园区凌志软件股份有限公司,5-10年,本科,无加班，朝九晚五，节假日福利优厚，晋升大,岗位职责1、配合项目经理分析业务需求，提出技术实现方案；2、负责详细设计和开发实施；3、负责系统已有功能的问题诊断与优化；4、带领小组成员完成项目任职要求1、全日制计算机相关专业本科学历，学信网可查，有金融证券开发背景优先，有带团队经验优先2、5年以上java开发工作经验，有开发文档撰写经验者更佳；3、熟悉B/S结构开发，熟悉Spring、SpringMVC、Mybities、Hiberate等框架；4、熟悉HTML、CSS、Javascript、Ajax、JQeruy等前端开发技术；5、熟悉PL/SQL和oracle数据库基本操作，有相关项目开发经验；6、工作认真细心，善于沟通，具备强烈的责任心和敬业精神,金融,2000人以上,java,上海
java开发工程师,https://www.lagou.com/jobs/6220242.html,浦东新区,15k-20k,奥解思信息科技（上海）有限公司,1-3年,本科,外企工作环境，弹性工作制，薪资open。,"岗位职责：所需的技术技能 Must 熟悉 Core Java (prefer Java 8 +) Must 熟悉 Java EE 技术 Must 熟悉 的 一 个 现代 IoC, OR-Mapping 框架 Must 熟悉 DB 概念 和 SQL 命令 Must 熟悉 NoSQL DB(prefer Redis/Gemfire/Neo4j) Must 熟悉 现代 MVC 框架 之一可选的技术技能 Experience 在 RPC, Restful API, Hessian Experience 在 大规模 数据 维护 Experience Linux 命令 行需要非技术技能 Should 至少 有 3 年 工作 经验 Must 有 良好 的 书面 和 口头 沟通 技巧 Must 舒适 参与 技术 讨论 和 给予 技术 演示 Be 高度 motivated, 自 起动 个人 愿意 工作 在 动态 工作 环境 Work pressure, 管理 下 的 冲突 和 挑战 Must 演示 分析 思考 和 解决 问题 的 能力",金融,500-2000人,java,上海
急聘java开发,https://www.lagou.com/jobs/7146840.html,浦东新区,10k-13k,深圳市博悦科创科技有限公司,1-3年,大专,五险一金年终奖金 定期体检年度旅游,岗位要求：1.专科以上学历， 2年以上工作经验；2.精通面向对象设计思想，具有扎实的Java编程功底和良好的编码规范； 3.精通SpringCloud、SpringBoot、SpringMVC等常用框架，并了解机制和原理； 4.熟悉Tomcat、Jboss、nginx等多种应用和WEB服务器的配置； 5.至少熟悉一种数据库系统； 6.对系统架构设计有一定的理解，熟悉HTML语言、VUE.js等，了解当前流行的javascript开源框架； 7.具有出色的设计能力，思路清晰，善于思考，能独立分析和解决问题，责任心强，具备良好的团队合作精神和承受压力的能力,移动互联网,500-2000人,java,上海
Java高级开发工程师,https://www.lagou.com/jobs/7082550.html,静安区,20k-27k,上海米居网络科技有限公司,3-5年,本科,每年两次旅游，半个月带薪春节假，员工宿舍,岗位职责：1、负责公司网站开发、维护、升级、更新。完成业务后台系统的模块设计、编码、单元测试、维护等各阶段的开发任务；2、参与系统的架构设计、详细设计与核心模块编码等工作；3、协调开发后期的功能测试、集成测试、性能测试、部署上线等措施部署流程。岗位要求：1：全日制本科以上学历毕业，英文4级以上；2：4年以上J2EE相关工作经验。3：有扎实的JAVA基础功底，优雅的代码风格；4：精通Spring Boot等常用框架，了解其工作原理；5：熟练掌握MySQL数据库开发，配置、维护、性能优化；6：了解redis、mq任意一种，了解mongodb或者influxdb;7：了解docker部署，了解微服务后台框架。工作地址：上海静安区汶水路40号宏慧视界3号楼3楼休息制度：一周单休一周双休，介意请慎重投递,"移动互联网,电商",500-2000人,java,上海
java开发工程师,https://www.lagou.com/jobs/6961194.html,浦东新区,12k-17k,深圳市长亮科技股份有限公司,3-5年,本科,六险一金，双休,"1、至少参与两个Spring boot开发项目；2、熟练掌握Spring boot开发框架；3、熟练使用maven,dubbo,zookeeper等组件；4、熟悉前端技术，使用过VUE,REACT,JS,JQUERY等其中的前端技术；5、了解nodejs,elasticsearch,大数据技术",企业服务,2000人以上,java,上海
Java开发工程师,https://www.lagou.com/jobs/7172353.html,浦东新区,12k-18k,励元科技（上海）有限公司,3-5年,本科,专业培训、定期体检、B端企业,岗位职责：1.负责现有产品或系统的二次开发或维护工作，完成相关的升级和优化工作；2.负责软件产品或项目的需求分析、概要设计、编码等工作，根据进度完成相应阶段的工作；3.负责软件产品或项目的测试和缺陷修复工作；4.负责软件产品或项目的部署和维护工作；5.与前端人员配合，负责完成接口功能的开发工作；岗位要求：1.统招全日制本科毕业，计算机、软件开发、或自动化设备相关专业；2.熟练掌握Java Web相关的基础知识，了解web前端，熟悉jsp的使用；3.熟悉ssh、ssm和springboot+mybatis架构；4.熟悉mysql、sqlserver、Oracle等主流数据库；5.熟练使用GIT、SVN等代码管理工具；6.具备良好的逻辑思维和抽象思维，具有较强的项目计划能力、沟通协调能力、问题解决能力、独立分析能力、执行力和抗压力，较强的团队协作精神和责任心，工作严谨、细致；7.有wms项目相关经验者优先考虑；,移动互联网,150-500人,java,上海
高级JAVA开发工程师,https://www.lagou.com/jobs/6854973.html,长宁区,15k-25k,上海尚诚消费金融股份有限公司,5-10年,本科,薪酬福利健全 发展平台广阔,,"金融,移动互联网",150-500人,java,上海
java,https://www.lagou.com/jobs/6771269.html,闵行区,14k-16k,上海汉得信息技术股份有限公司,3-5年,大专,无,1.掌握数据库建模型，熟练使用Oracle、Mysql数据库；2.掌握Spring、SpringMVC、Mybatis框架集成和高效开发；3.掌握Js、Bootstrap、AngularJS开发，特别是AngularJS+Bootstrap框架的使用；4.掌握Maven、git的使用；5.了解Nginx、Redis；6.了解SeaJS，ReactJS，WebX框架优先,"企业服务,数据服务",2000人以上,java,上海
java开发工程师,https://www.lagou.com/jobs/6450612.html,杨浦区,15k-20k,上海花千树信息科技有限公司北京分公司,3-5年,本科,"成熟团队,上升空间",岗位职责：1.负责Java应用程序代码的编写；2.参与页面js协议的定制；3.确保产品质量的稳定性和高效性；4.服务器端架构优化。任职要求：1.大学本科及以上学历，有3年以上网站开发经验，能独立完成功能模块设计和开发；2.了解Java底层JVM原理，有深入调优和调错能力；3.熟悉HTML5/CSS3、Ajax、Canvas等前端开发技术；4.精通Java，Jsp，JavaBean，Servlet；5.熟悉MySQL、Oracle数据库的使用，以及SQL语句；6.具备多线程编程经验，良好的代码风格及注释习惯；7.具有团队协作精神，工作严谨主动，人际交往能力良好；8.了解大型并发服务器开发架构者优先。,移动互联网,2000人以上,java,上海
