job_name,job_url,job_location,job_salary,job_company,job_experience,job_class,job_given,job_detail,company_type,company_person,search_key,city
销售主管,https://www.lagou.com/jobs/6518396.html,天河区,12k-24k,广州华见智能科技有限公司,1-3年,大专,行业加平台 前景 升职快,要跟随这个时代， 请花三分钟思考，加入什么样的团队才能赢在人生！我们拥有强大的技术背景和核心竞争力，高性能的产品，人工智能和中医两大无限宽广的行业前景，在这里和我们一起挥洒青春热血，追逐梦想的巅峰； 我们拥有广阔的晋升渠道，只要你肯努力肯付出就能一步一步高升； 加入我们这个大家庭，让你在梦想拼搏的风雨路上有一个温暖的港湾，尽情释放自己的生命潜能，只为实现自己的一直追逐的梦想！我们为你提供好的平台，前景，行业和你的事业。请看岗位职责：1．负责公司的销售运作，包括计划、组织、进度控制。2．根据销售工作目标，建立销售模式、制定销售计划和销售策略，完成公司指定销售任务。3．开展市场调査、分析和预测，做好市场信息的收集、整理和反馈。4．客户开发及维护工作，对客户进行管理、指导和回访。5．制定、完善销售管理制度，扩大销售人员和队伍；6．配合公司产品的营销计划和市场活动。7．完成领导临时交办的其他工作。任职要求：1 大专及本科以上学历；2 热爱销售工作，有良好的团队合作意识；3 具备良好的沟通表达和商务谈判能力；4 优秀的自我管理能力和销售管理能力；5.有较好的学习能力，3年工作经验者优先，主要能独立工作；6.有医疗健康行业工作背景，了解社区诊所，医院运作流程。加分项：- 有一个梦想；- 愿意在团队中沉淀成长；- 有一颗热爱生活、热爱分享的心。薪资福利：1.上班时间：不定2.薪资待遇：面议，按能力贡献大小，有付出就有回报；3.按国家法定节假日实行带薪休假；4.定期组织聚餐等团建活动。*找平台，行业，前景，事业，这里是你的选择根据销售的职业特点，不是每天坐班，主要以外勤找客户为主。,"人工智能,医疗丨健康",15-50人,人工智能,广东
推广支撑工程师,https://www.lagou.com/jobs/6397558.html,海珠区,10k-15k,广东亿迅科技有限公司,3-5年,大专,五险一金 双休 国企,,通讯电子,2000人以上,人工智能,广东
售前解决方案（大数据方向）,https://www.lagou.com/jobs/6993923.html,海珠区,8k-14k,广东亿迅科技有限公司,1-3年,本科,国企 五险一金 周末双休,,通讯电子,2000人以上,人工智能,广东
首席技术官(CTO),https://www.lagou.com/jobs/5840461.html,越秀区,40k-70k,广东省出版集团数字出版有限公司,10年以上,硕士,"五险一金,周末双休,职工体检,餐补车补","岗位职责：1、全面管理公司研发和技术支持工作,负责技术层面的整体管理,包括软件研发、项目实施、销售支持及技术管理；2、根据公司的业务发展战略，负责制定公司技术战略，整合不同资源来转化执行，为业务发展提供全面的支持和保障；3、结合公司发展战略与教育行业产品发展趋势，支撑产品团队做发展规划并落实技术选型、架构设计等工作，实现产品开发目标；4、负责公司产品关键技术架构的制定和相关新技术的研究工作（大数据/人工智能等方向），对公司的技术演进能够做出中长期规划；5、负责公司运维的整体工作管理，监督落实ITIL体系的建立，保障业务的稳定性；6、负责技术梯队建设、激励、培养，制定相应的考核/激励，持续提升团队工作热情、工作质量和工作效率；7、负责组织制定研发、运维管理制度，技术标准，技术规范并实施；8、主导系统的架构设计，重构、优化现有的技术架构。任职要求：1、硕士以上学历；2、10年以上软件/移动端等领域开发经验，5年以上团队管理经验(50人以上团队管理经验)；3、有互联网、教育、电信其中一种行业线上业务系统的多年高层技术管理经验，对行业的新技术如大数据/人工智能有一定的研究及经验，有良好的业界口碑；4、具有以技术驱动业务的能力，提供成功实施案例可作为加分项；5、精通devops等开发运维一体化技术；精通互联网技术系统的架构设计、系统分析、编码实现、性能优化及系统安全；精通常用设计模式和主流设计工具，能进行系统建模、总体设计；6、熟练掌握常见开源框架和技术，熟悉微服务架构设计，熟悉大规模系统的负载均衡、缓存、网络存储、网络安全、数据库高可用设计及性能评估机制，具备海量数据、大批量、高并发、高性能分析及处理的成熟经验；7、熟悉容器集群管理技术，精通其容器编排、日志追踪、故障告警、弹性伸缩、高可用、滚动升级等常见业务技能。8、熟悉云资源的架构设计和部署规划，能对已有云资源应用做优化，有云资源可视化管理经验尤佳；9、精通主流数据库（mySQL/SQL Server/Oracle）的应用，并具备数据库应用系统设计能力；精通Memcache、Redis、mongodb等nosql的应用，精通其配置策略，并能结合业务场景做最优设计；精通常用的消息中间件RabbitMQ、Kafaka或RocketMQ中一种或多种；10、有优秀的沟通协调能力、计划执行能力；为人诚信，具有高度的责任心，工作主动积极，有大局观，善于管理和培养开发队伍，能承担工作压力。◆薪酬福利：综合年薪100万左右，由基本工资、年度绩效奖金、任期绩效奖金等组成；国企福利补贴，一应俱全，集团专项激励支持。◆工作地点：广州市越秀区环市东路472号粤海大厦10楼（地铁5号线动物园站B出口过人行天桥，公交动物园南门站）◆工作时间：周一至周五上午9:00-12:00，下午14:00-18:00，周末双休。","移动互联网,教育",50-150人,人工智能,广东
自然语言处理（NLP）算法工程师【深度学习方向】,https://www.lagou.com/jobs/5183527.html,南山区,30k-50k,深圳视界信息技术有限公司,3-5年,博士,大数据独角兽 技术领先 团队专业,岗位职责：研究深度学习算法和自然语言处理（中文），利用NLP相关技术、深度学习理论和方法解决实际问题，改进云听CEM产品；人才标准：全球知名高校、国内985高校博士及以上学历，NLP/人工智能、计算机、数学等相关专业/研究方向。有知名企业的NLP/机器学习/人工智能等项目经历，或直接参与过相关项目/课题研究的人才优先考虑；符合以下标准优先考虑：有知名企业的NLP/机器学习/人工智能项目经历，或直接参与过相关研究项目；有机器学习知识背景，熟悉深度神经网络模型（如DNN、RNN、LSTM）；熟悉基于统计和句法的自然语言处理方法；熟悉大规模数据挖掘、机器学习、分布式计算等相关技术；NLP项目相关方向：分词、词性标注、关键词抽取、文本分类、实体识别、信息抽取、情感分析。职位待遇及发展：月薪30-50K+丰厚年终奖+百万以上期权； 优秀人才可任命为公司科学家，纳入核心人才发展计划：优先提供团队晋升、对外商演及团队展示、打造个人品牌等机会。职位亮点：1、品牌优势：国内知名大数据、人工智能准独角兽企业，已完成中信资本在内的4轮融资，并已实现盈利；八爪鱼数据采集器全球知名度领先，连续4年大数据企业排行榜数据收集**名；2、团队优势：硅谷文化、核心团队来自Morningstar、百度、IBM、极光等全球知名企业，战略明确，战斗力强、创始团队零流失；团队百余人中，本科以上学历占95%+，985、211、海外名校优秀人才云集；3、产品优势：自主开发的大数据产品八爪鱼，已持续服务于全球数百万用户、中英日三种语言市场排名**；2018年研发上线的大数据人工智能平台云听CEM，是国内领先的基于大数据和自然语言处理（NLP）技术，满足品牌企业客户体验管理（CEM）管理需求，已覆盖消费、电子、日化等多个行业，获得科沃斯机器人、联合利华、OPPO、VIVO、创维等几十家行业头部客户认可，上线**年已支撑数千万营收；,数据服务,50-150人,人工智能,广东
算法实习生,https://www.lagou.com/jobs/7041669.html,南山区,5k-10k,前海企保科技（深圳）有限公司,应届毕业生,硕士,福利待遇好 公司重点培养对象 大咖指导,工作任务：1、研究对话机器人的相关NLP算法问题2、根据训练数据，设计和完成深度网络编程，提升性能能力要求：1、具有NLP的相关学习和研究经历2、NLP和机器学习研究生优先、其他人工智能方向学生次之3、熟悉Bert、深度网络编程的优先4、实习时间不少于3个月，全职优先，兼职视情况而定,"金融,企业服务",15-50人,人工智能,广东
大客户经理（深圳）,https://www.lagou.com/jobs/6650229.html,南山区,10k-20k,上海七牛信息技术有限公司,3-5年,本科,免费健身 水果零食 六险一金 年度体检,岗位职责：理解公司云计算相关产品的功能，积极在各行业尤其是移动互联网行业挖掘潜在销售机会；拜访客户，清楚理解潜在客户业务，并能结合数据存储、cdn加速、AI、大数据等产品功能解决客户业务需求；组织协调公司技术资源以满足客户对解决方案及产品交付的需求；负责商务沟通谈判、大客户的合同签署，收款跟进和关系维护，形成持续的合作。岗位要求：3年以上移动互联网、云计算基础设施等行业的销售或市场经验，熟悉国内外主流云平台服务商 例如AWS、阿里云、百度云等产品；热爱各种社交产品微博、微信等各种移动互联创新产品和工具；较强的逻辑思维和分析能力，善于分析各种竞合关系；热爱销售工作，乐观积极，脚踏实地，具有较强的攻关毅力，坚持不懈；有在云主机，人工智能，大数据，云存储行业售前或销售经验、计算机或信息技术相关专业的优先。,"移动互联网,数据服务",150-500人,人工智能,广东
算法开发工程师,https://www.lagou.com/jobs/4841729.html,南山区,25k-40k,深圳马可孛罗科技有限公司,3-5年,硕士,"发展空间大,弹性上班,大牛多多",工作职责1、负责关键业务场景的算法建模、海量数据下的工程实现和优化；2、构建适合公司业务发展的人工智能、机器学习工程平台；3、参与人工智能、机器学习前沿的研究和机票、酒店领域应用实践；4、组建符合公司业务发展需要的机器学习、人工智能人才梯队。职位要求1、计算机、数学与应用数学、统计学等相关专业，全日制硕士及以上毕业，工作经验2年及以上；2、熟练掌握机器学习、人工智能常见算法，如LR、SVM、RNN、KNN，熟悉Theano、Tensorflow、sklearn等框架的优先；3、至少熟练掌握以下一门编程语言或工具：R、Python、Matlab、Java；4、有至少一个海量数据下的机器学习、人工智能项目经验。5、在重要学术期刊、会议、论坛上发表过机器学习、人工智能的论文者优先考虑。,旅游,150-500人,人工智能,广东
算法工程师,https://www.lagou.com/jobs/6777593.html,南山区,30k-45k,深圳马可孛罗科技有限公司,3-5年,硕士,业务壁垒高、技术挑战大,工作职责1、负责关键业务场景的算法建模、海量数据下的工程实现和优化；2、构建适合公司业务发展的人工智能、机器学习工程平台；3、参与人工智能、机器学习前沿的研究和机票、酒店领域应用实践；4、组建符合公司业务发展需要的机器学习、人工智能人才梯队。职位要求1、计算机、数学与应用数学、统计学等相关专业，全日制硕士及以上毕业，工作经验2年及以上；2、熟练掌握机器学习、人工智能常见算法，如LR、SVM、RNN、KNN，熟悉Theano、Tensorflow、sklearn等框架的优先；3、至少熟练掌握以下一门编程语言或工具：R、Python、Matlab、Java；4、有至少一个海量数据下的机器学习、人工智能项目经验。5、在重要学术期刊、会议、论坛上发表过机器学习、人工智能的论文者优先考虑。,旅游,150-500人,人工智能,广东
NLP实习研究员,https://www.lagou.com/jobs/6792151.html,南沙区,5k-7k,暗物智能科技（广州）有限公司,应届毕业生,硕士,"弹性工作,高并发系统,每日餐补,团队氛围",1、协助自然语言处理方向的算法研究、产品开发和性能提升，涉及的问题包括但不限于自然语言理解、自然语言生成、实体识别、关系提取、机器翻译、自由问答、对话系统、自动摘要等。2、协助自然语言处理基础工具研发，包括命名实体识别、词性标注、语义分析、情感分析、文本摘要、主题发现、文本相似度等；3、协助领域相关的语料库的收集以及知识图谱的构建。4、紧跟业界最新自然语言处理技术动态，深入研发自然语言处理相关的算法，参与相关产品系统的研发，如自由问答和智能聊天系统。1、硕士及以上学历，重点院校为佳，实习期6个月及以上，优秀者可提前发放转正OFFER。计算机、数学、通信等相关专业，有自然语言处理项目经验。2、熟练掌握自然语言处理，信息检索和机器学习的基本方法。3、较强的算法实现能力，熟练掌握 C/C++/Python/Matlab/Shell编程。4、熟悉至少一种深度学习框架：PyTorch、Tensorflow、Keras、Caffe/2、MxNet。5、熟悉自然语言处理领域的最新研究成果，公开数据集，和相关的开源系统。6、较强的沟通表达能力，有很好的口头表达能力和出色的文档写作能力，善于深入浅出地表达和解释复杂的事物。7、较强的自学能力和独立思考能力，善于思考和表达自己的想法；同时又具备良好的团队合作精神；8、有以下经验者优先考虑：①在业内**会议和期刊以**作者（或者除导师外**作者）发表论文（如：ACL/NAACL/EMNLP/NIPS/AAAI等）②有较强的学术比赛经验或者在重要数据集的Leaderboard上排名靠前，比如SQuAD等学术数据集，Kaggle等国内外商业比赛。③有较丰富的相关经验，如有一年以上在BAT或人工智能知名创业公司进行自然语言处理算法或工程相关的工作经验。,"人工智能,教育",150-500人,人工智能,广东
前端开发工程师,https://www.lagou.com/jobs/7190152.html,天河区,8k-13k,广东成高成智慧科技有限公司,1-3年,大专,发展空间、五险一金、各种活动、聚餐,急招1人，********！【岗位职责】1、根据产品需求开发高性能的WEB前端页面和交互功能，提升产品的用户体验和促进业务发展；2、以模块化的思想设计开发通用前端组件，理解端到端的设计思维，能跨终端满足业务实现。3、学习研究互联网前端相关的前沿技术，和团队成员互相学习、分享，通过新技术服务业务和团队。[岗位要求]1、计算机相关专业，本科及以上学历，1年以上WEB前端开发经验，其中有移动端、小程序开发经验优先；2、精通javascript语言，ES6语法，熟悉vue或react等框架使用和原理。3、熟悉一门后端语言（java，node.js等）知识并有相关开发经验。4、熟练掌握html5+css3技能，能开发高性能、体验良好、可扩展、可配置化的web页面。福利吸引：华为微软等逾十年开发大牛带队、甲方自研发平台产品、上升空间大、政企龙头企业资源丰富、老板超级nice。集团简介：成高成数据集团是全球领先的大数据智慧产业共性技术支撑云服务平台运营商，国际先进的CGC全球智慧产业联盟共享经济平台运营商，大数据人工智能智慧商业操作系统集成服务商，物联网人工智能智慧产业操作系统集成服务商，为传统企业转型升级为平台企业提供系统性解决方案。成高成秉承“创造价值·增信赋能”的宗旨，建设运营国际先进的GIISS大数据智慧产业共性技术支撑云服务平台，重塑数据产业链，重构产业价值链，重建市场信任体系，使跨地区、跨领域、跨部门、跨行业、产业链上下游、供应链上下游数据资源互联互通互享互用，破解市场壁垒，破解大数据规模化流通、大数据产业化智慧即应用和大数据价值开发瓶颈，破解传统产业规模化转型升级瓶颈。目前，集团已与江苏、广东、浙江、四川、湖南、湖北、云南、贵州、江西等多个城市达成全面战略合作，共建大数据智慧城市公共信息云服务平台。公司办公地址：广州天河区（技术团队）：天河客运站地铁B出口20米立德商务大厦405-408室,"数据服务,软件开发",150-500人,人工智能,广东
计算机视觉算法总监,https://www.lagou.com/jobs/7196162.html,南山区,80k-100k,深圳市新国都股份有限公司,5-10年,硕士,职业发展，带薪年假,"岗位职责：1. 负责机器视觉模型的研发和实现2. 应用深度学习和图像识别等技术，深刻理解和分析需求，评估和选择合适等模型与算法3. 自主学习，跟随业内AI技术发展动态，匹配业务诉求，识别关键技术点与实现准备4. 领导安排的其他临时性工作岗位要求：1. 5年以上工作经验，计算机或者图像处理、模式识别、机器学习相关专业，重点实验室的博士生优先2. 对计算机视觉和模式识别方向有扎实等理论和实践基础3. 熟悉物体（人体，人脸，通用目标）检测，跟踪和识别的基本算法4. 熟练掌握C/C++, java或python等常用编程语言之一，具有linux下的开发经验5. 具有良好的数据结构与算法基础，具备扎实的编程功底，并熟练使用TensorFlow, PyTorch或其他深度学习工具 加分项：1、在国际会议或期刊上发表过论文；2、有较强的代码能力者优先，获得过 ACM 或其他商业代码竞赛的荣誉，如 ACM 区预赛金牌、NOI 银牌以上等，或代码开源在GitHub 上并有较大影响；3、有较强的比赛经验者或者在重要数据集的排行榜上排名靠前的优先，这些比赛包括但不限于 ImageNet 等相关竞赛、Kaggle 等一些国内外商业比赛；4、有较丰富的相关经验者优先，比如有一年以上在人工智能领域公司进行计算机视觉&机器学习方面实习的经验，或来自国内外计算机视觉/机器学习/计算机图形学/数据挖掘等领域内知名实验室。","金融,硬件",2000人以上,人工智能,广东
SRM实施顾问,https://www.lagou.com/jobs/6797582.html,顺德区,12k-24k,广东美云智数科技有限公司,3-5年,本科,供应链平台设计与交付，项目经理,"岗位职责1.负责SRM项目的实施交付。包括业务模块规划，业务解决方案设计，功能原型设计。2.评审技术方案，编写测试用例，完成测试验证。3.组织用户、产品架构、开发等人员协作交付合格产品功能，提升用户体验。4.产品功能优化需求分析、改善类需求规划及落地。 任职资格1、3年以上工作经验，本科及以上学历，工商管理专业、计算机专业、供应链专业、人工智能专业。2、熟悉软件规划、设计、开发的思路与方法。3、对互联网云产品的商业应用研究、产业数字化方向有见解。4、具有大型企业采购、制造业务经验或IT项目建设经验者优先。5、了解等Java，HTML5，CSS3，javascript，Wex5，ajax,spring mvc等开发工具者优先。",企业服务,500-2000人,人工智能,广东
产品培训师,https://www.lagou.com/jobs/7128756.html,天河区,6k-8k,深圳市威科姆数码网络有限公司,应届毕业生,本科,绩效提成+年终双薪+各类福利补贴,(一)岗位职责：1.负责公司产品、项目方案的培训、讲解及产品推介、演示；2.主动搜集、分析、跟踪用户体验，并基于提升用户实用性、易用性反馈产品优化建议；3.开展用户使用培训及运营工作（活动落实、用户活跃度提升、数据分析等）；4.关注用户需求，搜集竞品信息，发掘新的合作机会。（二）任职资格：1.教育、师范、计算机相关专业本科以上学历，可接受应届毕业生；2.掌握计算机和网络基础知识，熟练使用各种办公及视频软件；3.普通话标准，条理清晰，具备适度的气场、现场亲和力、良好的组织协调、沟通能力、语言表达书写能力；4.能适应经常省内出差。本次主要是威科姆科技深圳公司针对VCOM智慧教育业务进行招聘，真诚欢迎您加入威科姆事业中！（同时放在招聘岗位后）VCOM“优教·智慧教育云”（以下简称“优教云”）业务介绍优教云是运用云计算、大数据、人工智能等先进技术，以智慧课堂和互动教学为核心，依托智慧云平台的教育资源体系和教与学过程（大数据）评估的分析系统，为学校、教师、学生打造的高效课堂、精准教学，为学生提供自适应学习系统，实现了教育技术与教学应用的深度融合。优教云是目前“互联网+教育”K12教育领域内少有的全方位（教育局、学校、教师、学生、家长）、全链条（支持智慧校园解决方案、教育云平台、终端设备、信息服务产品及运营服务）的智慧教育综合解决方案。VCOM智慧教育云平台与国家“十三五”发展规划高度契合，得到中央电教馆专业认证，并被邀请参与制定“人人通”行业标准。优教云平台已与国家平台对接，“优教信使”APP、“优教智慧教育终端”已通过教育部备案。优教云在防控**期间，凭借同步优质教学资源提供专业的网络教学模式，为中小学教师、学生免费提供学习云平台及同步、优质、专业的教学资源。帮助教师按照各学科教学大纲，科学、有效的借助平台每天可在线发布学习任务，学生在家通过PC、手机、平板完成任务并及时反馈结果给教师，实现“停课不停教，停课不停学”，让孩子学习受影响的程度降到最低。目前优教云平台已广泛应用于6.8万所学校，45万个班级，总带宽达320G，可容纳数千万用户同时开展在线教学服务。平台的学科资源按“研、教、学、练、考”五位一体进行规划建设，涵盖中小学12个年级、35个全学科，300余个版本，每周更新10000条以上。我们的优势：1. 该业务为“互联网+教育”属于朝阳行业，我公司经过几年的探索，积累了丰富的教学应用经验。目前产品成熟，技术稳定，商业模式清晰，具备大规模市场推广的条件。2. 公司提供良好的薪酬体系和晋升激励机制（公司80%以上的管理岗位任职者都通过内部提升而来）。3. 公司提供完善的岗前培训和职业生涯规划辅导。我们的福利：1. 公司购买”五险一金”；2. 薪酬组成：工资+提成（或绩效）+年终双薪+餐费补贴+通讯费补贴等；3. 国家规定的相关假期；4. 传统节日员工福利慰问。,教育,15-50人,人工智能,广东
量化研究员,https://www.lagou.com/jobs/7175321.html,南山区,10k-15k,深圳数字动能信息技术有限公司,不限,不限,周末双休,技能要求：量化分析，模型搭建岗位职责：1、量化交易技术和理论的研究；2、实盘策略的储备，包括股票、期货、期权等；3、量化投资、FOF、人工智能等相关课程的设计和编写；4、支持客户咨询和配合市场宣传活动，包括但不限于量化投资教学和行业分享讲座。岗位要求：1、能够熟练使用MATLAB、Python；2、熟悉量化交易，熟悉市场主流量化交易平台使用的优先；3、有二级市场实盘交易经验；4、能独立完成量化投资某一领域的演讲，有较好的表达能力；5、学习能力强、逻辑思维能力强、能承受持续高强度工作；6、有基金从业资格、证券从业资格、投资咨询资格者优先考虑；7、本科及以上学历，金融工程、数学、物理、计算机等相关专业优先；有工作经验者优先考虑。,"移动互联网,金融",15-50人,人工智能,广东
