job_name,job_url,job_location,job_salary,job_company,job_experience,job_class,job_given,job_detail,company_type,company_person,search_key,city
测试工程师,https://www.lagou.com/jobs/6858823.html,崂山区,6k-8k,北京泛钛客科技有限公司,1-3年,本科,五险一金/工作氛围好/待遇好,岗位职责：1、参与项目的需求分析，制定测试方案，设计测试用例；2、搭建测试环境，保证测试环境的可靠性；3、与产品、研发团队协作完成各阶段的测试需求；4、负责测试bug提交和跟踪，提出改进建议；5、根据项目情况，合理开展自动化测试和性能测试。任职资格：1、良好的沟通能力、分析能力和解决问题能力；2、计算机相关专业背景，统招本科及以上学历，2年以上测试经验；3、能够负责高复杂度/大规模业务的测试工作；4、引入主流测试工具、测试方法，提升测试效率和质量；5、理解产品特点，关注用户反馈，帮助产品体验的提升；6、熟悉测试跟踪工具的使用，熟悉主流测试框架LoadRunner、Jmeter等；7、熟悉Python，能熟练编写自动化测试脚本；8、985/211高校毕业生优先；9、有一线互联网或正规金融机构科技工作经验优先。,"金融,数据服务",150-500人,python,青岛
软件工程师,https://www.lagou.com/jobs/6634983.html,城阳区,7k-10k,青岛大牧人机械股份有限公司,3-5年,本科,不加班,"技能要求：C，C++，SQL岗位职责：1、参与物联网及云计算系统应用软件的开发和测试工作。2、掌握或学习UML，进行物联网系统建模。3、掌握或学习cmmi，按规定处理项目文档任职要求：1、数学、软件、自动化、电子 等相关专业，对软件开发有浓厚兴趣的，能够提供相关作品的不限专业。2、熟悉c、java编程, 熟悉Jsp，Servlet等Web开发技术，了解Python。3、学习并使用HTML、CSS、Javascript、Ajax等技术。4、学习并掌握mysql、oracle等任一数据库的操作。5、学习并掌握apache、tomcat、jetty等。6、熟悉SVN等使用",物联网,500-2000人,python,青岛
机器人讲师,https://www.lagou.com/jobs/7172536.html,市南区,5k-7k,青岛市市南区码谷编程培训学校有限公司,不限,本科,双休、不加班,"岗位职责：1、 主要负责教授青少年编程课程；2、 负责课程研发，制作课件,完成课程、题库定期更新工作;3、 按照公司制定的教学计划，高质量完成教学任务；4、 协助班级日常管理和维护工作；5、 负责学生辅导和教学答疑等工作；6、 配合其他部门完成相关工作。任职要求：1、 本科及以上学历，理工科相关专业（计算机，电子，自动化，机械等）；2、 熟悉c/c++，python，scratch其中一门编程语言；3、 会micro:bi，arduino，51/stm32单片机其中一款硬件产品者优先；4、 热爱青少年教育,愿意学习领会先进的青少年编程教育方法;5、 承担课程的辅导、答疑、批改作业、组织课程讨论等教学环节工作；6、 有教育培训行业经验者或者相关教师资格证书者优先；",教育,15-50人,python,青岛
ETL数据工程师,https://www.lagou.com/jobs/7029415.html,市南区,6k-10k,青岛语宽网络科技有限责任公司,不限,大专,五险一金，月薪过万，稀缺人才岗位,1.协助公司大数据分析系统的数据采集，处理，设计，开发与测试；2.协助研究大数据行业新技术、优化系统结构、提升系统效果。任职资格：1.了解数据结构与算法功底；2.了解Hadoop、HBase、Kafka、Spark、ElasticSearch等主流的大数据技术；3.了解Java、shell、python等大数据开发语言；4.了解oracle、mysqi等关系型数据库5.可接受应届实习生,"数据服务,软件开发",15-50人,python,青岛
ETL数据开发工程师（可实习）,https://www.lagou.com/jobs/7029372.html,市南区,6k-8k,青岛语宽网络科技有限责任公司,应届毕业生,大专,五险一金，月薪过万，稀缺人才岗位,"技能要求：1、熟练掌握一种或多个开发语言(Python/perl/Bash等), 获取数据,应用算法,实现分析输出。2、熟悉linux开发环境, 掌握常用算法和数据结构。3、熟悉MySQL和NoSQL数据库,有很好的数据多维空间思维能力。4、熟悉计算机原理,操作系统,计算机网络等基础理论。5、熟悉C/C++。6、有很强责任心,优秀的团队合作精神,能够承受较大的工作压力逻辑思维清晰缜密,积极主动,具有较强的沟通协调能力。","数据服务,软件开发",15-50人,python,青岛
PHP开发工程师,https://www.lagou.com/jobs/3250054.html,市北区,7k-14k,青岛巴别塔网络科技有限公司,1-3年,本科,"弹性工作,双休","工作职责：1.负责后台系统的设计与实现、运维。2.确定产品的技术解决方案和开发时间评估。3.负责开发功能模块的设计4.协同组内开发工作以及任务安排5.组织团队内交流和培训以及代码评审。任职要求：1.大学本科以上学历, 2-3年中型或大型互联网产品软件的研发工作经验；2.熟悉PHP开发语言，了解各种主流框架（如PHP的主流框架）的使用及其原理；3.熟悉PHP面向对象的设计方法,具备良好的代码编写习惯及较强的文档编写能力；4.熟悉 Javascript 和 HTML/CSS，熟悉 HTTP 协议及W3C相关互联网规范；5.具备优秀的数据库设计和优化能力,至少精通一种数据库应用；6.熟悉 Unix/Linux 操作系统，熟悉Python、 Golang者优先；7.有互联网产品的Web开发经验者优先；8.具有很强的分析问题和解决问题的能力,勇于面对挑战性问题；9.具有良好的学习能力、时间和流程意识、沟通能力、团队合作、坦诚直接，有较好的沟通交流能力,能够迅速融入团队。10.熟悉区块链技术，熟悉Python，golang语言。","电商,金融",15-50人,python,青岛
Django架构师,https://www.lagou.com/jobs/6590600.html,城阳区,15k-25k,青岛魔力蛙科技产业有限公司,3-5年,不限,打造化工领域的类钉钉平台,职位描述：1、负责梳理特定业务域前后端系统的架构，负责整个软件架构设计、关键构件选型、接口的定义，指导各开发小组人员进行研发，帮助公司建设中台，规划中长期架构蓝图；2、负责核心模块的技术攻坚，参与并主导重大技术决策，进行技术风险评估；任职要求：1、 全日制本科及以上学历， 3年以上开Python发工作经验，3年以上架构师经验，能带领团队快速交付高质量的产品；2、对MySQL、Reddis、PostgreSQL等数据库内部实现机制有深刻的理解，有大数据量的数据库设计、分库分表、数据库调优经验；3、熟悉Django框架的后端API开发；4、对python/Flask技术及整个解决方案有深刻的理解及熟练的应用，并熟悉当前流行架构和设计模式，并在此基础上设计产品框架；5、能够使用文字、图示清晰的表达架构意图，具备良好的团队意识及协作精神，有较强的内外沟通能力。任职要求加分项：1、独立或主导设计过百万级用户以上规模的应用架构，熟悉容量评估，有成熟项目及产品经验；2、具备分布式系统设计开发经验、服务器运维及水平扩展方面实战经验，能对分布式常用技术进行合理应用，解决问题；3、熟悉云计算及大数据的整体技术体系（包含计算、存储、网络、数据库、中间件、安全等）；4、熟悉缓存、消息队列、集群技术处理、负载均衡、系统性能调优、系统韧性等软件编程高级技术；5、能够帮助所在研发团队制定研发标准与规范，提升团队研发质量，研究并推广新技术；6、能够负责针对重大项目或需求牵头干系研发团队制定方案，推进落地实施；,广告营销 企业服务,少于15人,python,青岛
数据库开发工程师,https://www.lagou.com/jobs/6633124.html,李沧区,7k-13k,上海超数信息科技有限公司,3-5年,大专,五险一金 餐补 节日福利等等,工作职责： 1、协助数据分析师完成数据处理、数据整合、ETL设计和开发工作; 2、在项目经理的带领下，参与数据分析与可视化项目实施过程； 3、专注于数据处理工作，包括理解客户需求，需求分析，方案设计，开发功能设计、开发测试、系统上线、客户培训等工作； 4、编写项目实施过程中的测试等文档。 职位要求： 1、具有相关数据库开发的工作经历优先  2、熟悉数据清洗、数据抽取、加工流程  3、熟练掌握ORACLE、DB2、SQLServer、MySql等数据库开发、熟悉SQL、存储过程以及数据库性能优化 4、熟悉LINUX、UNIX操作系统及其常用命令 5、掌握主流ETL工具，例如Kattle、Informatica、Shell、Python、存储过程等 6、有海尔、海信相关项目经验优先,"电商,数据服务",50-150人,python,青岛
测试经理,https://www.lagou.com/jobs/7087587.html,崂山区,15k-30k,海尔集团,3-5年,本科,五险一金 带薪年假 发展空间大,岗位职责1. 参与项目的需求分析，关注项目需求的合理性，可测性2.参与重要产品需求和架构设计评审，保证产品设计与架构的合理性3.参与重要产品自动化用例的评审，产品性能及安全测试评审，解决测试过程中的复杂技术问题4.根据产品线研发的实际情况，改进软件质量保证体系，并推动实施5.通过测试相关流程、策略、方法和工具等创新，提升测试团队整体质量及效率岗位要求1.专业要求：计算机及其相关专业2.学历要求：统招本科以上3.技能要求：至少精通一门开发语言Python，Java等语言，编写过接口自动化或Web自动化4.相关经历：6年以上软件测试经验，具备团队梯队建设和团队发展的经验5.能力要求：具有快速熟悉业务流程并建立完善质量体系的能力,"物联网,电商",2000人以上,python,青岛
测试工程师,https://www.lagou.com/jobs/7143401.html,崂山区,10k-20k,海尔集团,5-10年,不限,物联网平台前景好、薪资福利好、项目激励高,"岗位职责:
 参与需求评审，制定测试计划、测试用例； 2.软件测试，记录并协助定位缺陷，跟踪缺陷并完成回归测试； 3.总结测试过程，编写测试报告，及时反馈测试结果；4.参与自动化测试用例编写及维护，不断优化自动化测试框架； 5.尝试新方法、新工具提高测试效率。 任职资格： 1.能够熟练进行测试需求分析，编写测试计划、测试用例、测试方案、测试报告及各类测试技术文档； 2.熟悉Linux系统及常用命令； 3.具有较强的逻辑分析能力、协调能力和抗压能力； 4.熟悉Java或者Python语言，具有相关开发或测试经验优先； 5.本科以上学历，计算机、软件工程相关专业","物联网,电商",2000人以上,python,青岛
数据分析师,https://www.lagou.com/jobs/6841855.html,崂山区,10k-20k,海尔集团,3-5年,本科,大平台、稳定性高，薪酬福利完善,"岗位描述：1. 从0到1搭建数据分析体系：搭建数据监控分析体系，贴和业务需要定期分析查看业务发展情况，业务发展结果可量化，可衡量，使业务侧得到准实时的效果反馈，根据业务效果指导业务决策，做到心中有数；根据对数据、业务理解及与业务部门沟通，提出可能的潜在影响因素的业务假设；对于明显影响效果的因素，提出优化建议。2. 提出数据分析工具化，产品化建议：以“让数据易用”为准则，提出现有BI或数据产品相关的优化建议，提升数据使用效率，发挥更大价值。3.支撑战略，运营等决策部门提供专题分析及业务方向探索，实现战略落地： 根据决策层需要定期产出专项分析报告，不限于PPT或如tableau敏捷数据可视化开发工具。4.数据规范制定及数据质量提出建设性优化建议：梳理分析指标及数据源头，保证数据准确性及有效性，能针对数据缺口提出合理性需求。岗位要求：1.熟悉MySQL、Oracle等关系型数据库，有数据库基本应用能力；基本了解常用的应用服务器tomcat，Jboss等;2.精通编写sql语句，对复杂查询、分组等有深入了解，有一定的复杂报表经验，能独立梳理复杂业务逻辑；3.熟练运用类似Tableau，powerBI，QlikSense其中至少一种敏截数据可视化产品进行数据逻辑处理和业务逻辑转化，测试数据的准确性，快速形成相关的报表；4.熟练使用各种办公软件，如PPT、EXCEL等，能独立撰写数据分析报告；5. 了解SAAS服务基础原理及应用场景，需要时能投入相关数据分析工作；7.精通至少一种数据分析/挖掘/统计软件/语言，如Python，SAS，SPSS等；8. 对数据与业务方面有足够敏感性，有较强的逻辑分析能力，有较强的独立思考能力；9.良好的数据搜集、预测能力以及文档编写能力；10.5年以上数据分析经验，至少1年以上制造业相关工作经验，对工业互联网行业有一定的了解为加分项,有产品经理经验为加分项；11.具有良好团队合作精神，工作积极主动，有较好的学习能力，能够承受工作压力；","物联网,电商",2000人以上,python,青岛
DBA工程师,https://www.lagou.com/jobs/6843921.html,,15k-16k,海尔集团,5-10年,本科,10002,,"物联网,电商",2000人以上,python,青岛
前端开发工程师,https://www.lagou.com/jobs/6838907.html,,10k-15k,海尔集团,3-5年,本科,10002,,"物联网,电商",2000人以上,python,青岛
售前解决方案经理,https://www.lagou.com/jobs/7110077.html,市南区,25k-40k,北京市商汤科技开发有限公司,3-5年,本科,超级独角兽；发展空间大,岗位职责： 1、配合销售进行市场营销工作，与客户进行汇报交流、需求引导并进行方案撰写、方案宣讲等；2、负责人工智能教育或研学旅行基地等相关项目招投标策划，根据项目需求编写项目方案、可行性研究报告、招投标文件等；3、承担公司教育行业相关解决方案的需求收集，解决方案规划、解决方案营销和相关重点项目拓展等工作；4、组织协调产品技术资源，为合作伙伴和重点客户进行汇报交流、赋能培训等。任职要求：1、本科以上学历，人工智能、计算机、软件工程或电子工程等相关专业；2、熟悉教育行业用户及业务需求，3年以上教育信息化类、创客类或实践基地类项目产品方案、售前技术支持、方案规划等工作经验，熟悉政府项目运作流程，有千万级项目支持经验优先；3、具备较高水平的解决方案编制、撰写能力和良好的客户沟通技巧、对外呈现能力，熟悉项目管理与招投标流程；4、具有人工智能教育、编程教育项目或研学基地项目经验，熟悉Python、Scratch等编程语言优先；5、具有较强的责任心和上进心，工作积极主动，适应频繁出差工作。,人工智能,2000人以上,python,青岛
技术支持工程师（青岛）,https://www.lagou.com/jobs/7110547.html,市南区,20k-35k,北京市商汤科技开发有限公司,3-5年,本科,超级独角兽；发展空间大,岗位职责： 1、负责产品的售中、售后技术支持工作；                  2、负责产品测试、产品演示、用户培训工作；3、支持项目交付验收，跟踪处理售后客户问题；任职要求：1、本科以上学历，计算机相关专业，基础扎实，三年以上相关经验；2、熟悉TCP/IP、HTTP、Https等常用的网络协议；3、熟悉Linux/Windows操作系统，掌握一门脚本语言，如：Shell、Python、Sql等；4、有Mysql、Nginx、redis等常见开源软件运维经验；5、有Kubernetes、Ansible、Ceph使用经验优先；6、有软件项目交付实施经验优先；7、表达能力好，善于沟通，耐心解决问题；8、富有责任心，能够接受国内出差安排，敢于积极挑战不同场景下的运维和客户支持工作；,人工智能,2000人以上,python,青岛
用户画像算法工程师,https://www.lagou.com/jobs/6848341.html,黄岛区,12k-17k,青岛国信城市信息科技有限公司,不限,本科,市直企业、政府授权、智慧城市建设及运营,一、需求量：1二、工作职责1、基于跨领域的多场景的用户行为数据，建立、评估、持续优化数据模型，构建和优化用户画像，产出用户标签；2、用户画像需求分析，构建基于用户行为特征的平台化画像服务能力；3、参与搭建完整的用户画像挖掘系统，包括数据处理、挖掘用户画像、准确性评估等；4、建立用户画像产品的监控和评估机制。三、任职资格学历：本科及以上专业：计算机或其他相关专业年龄：40岁以下工作技能1.具备扎实的数学和计算机编程功底，以及坚实的文本数据挖掘和机器学习理论基础；2、精通至少一种编程语言，如R、C/C++、Java、Python等；3、掌握基于Hadoop或Hbase等大数据平台工具的开发与设计，熟悉Hive，Spark开发 ；4、熟练掌握熟悉常用的机器学习算法（贝叶斯，聚类，逻辑回归，SVM，GBDT，RF等）5、具有用户画像、个性化推荐、千人千面、DMP系统等相关的项目经验优先。,"人工智能,区块链",2000人以上,python,青岛
软件测试工程师,https://www.lagou.com/jobs/6848050.html,黄岛区,12k-15k,青岛国信城市信息科技有限公司,1-3年,本科,市直企业、政府授权、智慧城市建设运营,一、需求量：2二、工作职责1. 参与构建适合公司技术发展需要的质量保障体系，制定和推进相关质量方案落地实施；2. 参与产品需求和架构设计评审，评估合理性以及测试最优方案；3. 通过优化和制定测试相关流程、策略、方法和工具，提升研发过程的测试质量和效率；4. 解决测试过程中的复杂技术问题，根据产品和项目特点，提出合理的解决方案，并负责设计和实现自动化、性能测试框架及工具等以提高测试效率；5. 测试领域前瞻性探索，引领团队技术进步。三、任职资格学历：本科及以上专业：理工科、计算机或其他相关专业年龄：40岁以下工作技能1.至少一年以上软件开发、自动化测试、性能测试、或白盒测试工作经验；2.熟悉 Java/python/等至少一种编程语言；3. 具备很强的自我驱动学习能力、分析能力和解决问题的能力；4.在钱包和支付方面有专业知识者优先。,"人工智能,区块链",2000人以上,python,青岛
