job_name,job_url,job_location,job_salary,job_company,job_experience,job_class,job_given,job_detail,company_type,company_person,search_key,city
java大数据开发工程师,https://www.lagou.com/jobs/7013363.html,高新区,10k-15k,新疆维吾尔自治区广播电视研究所,3-5年,本科,五险一金 周末双休 地铁周边 扁平化管理,岗位职责：1、熟练使用常用开源框架进行现有Java Web及Hadoop、Spark大数据项目开发；2、负责系统前后端功能设计、编码、测试，管控项目开发进度；3、负责线上系统的维护和管理，对复杂问题进行快速定位和优化，保障系统稳定运行；4、参与需求分析、产品对接、项目组管理和技术选型工作；5、按规范书写相关设计、开发文档；6、与其他同事共享开发经验，优化产品的功能和性能。任职需求：1、全日制本科以上学历，计算机相关专业，3年以上系统开发经验和项目管理经验，有BI相关系统开发工作经验者优先；2、Java基础扎实，同时具备Scala、python语言开发优先；3、熟悉SpringMVC，Mybatis，SpringBoot等框架等主流框架；4、熟悉分布式、缓存、消息等机制，熟悉并发编程原理，有系统架构设计经验者优先;5、具备数据库开发经验，熟悉Oracle、Mysql等主流数据库，能独立完成数据库设计；6、了解hadoop、storm、spark、druid等大数据框架组件者优先；7、需要较强的逻辑分析、数据分析能力、问题排查能力、文档编写能力；8、具有良好的学习能力和强烈的工作责任心，能带领团队协作完成项目。,其他,150-500人,hadoop,成都
课程开发（AI大数据方向）,https://www.lagou.com/jobs/6665135.html,双流县,10k-20k,微慕客（成都）科技有限公司,3-5年,不限,五险一金 弹性工作 扁平管理 微软项目,工作职责：1.学习微软官方发布（更新）的数据分析/数据科学等课程，总结知识点，撰写相应的知识点文案2.根据总结的知识点内容进行数据分析/数据科学等课程的设计与开发工作，编写课程大纲、课件以及学生手册并录制相应中文解析视频3.负责课程实验（课程作业）的脚本编写工作，并且录制详细的代码/项目解析视频4.指导研究员助理完成日常的字幕、文案资料翻译整理工作以及学习平台后台配置工作5.配合公司活动宣传的需要进行对内以及对外的公开课、路演工作6.协助产品部门完成课程的迭代与打磨，逐步完善课程开发工作7.协助市场部门进行课程咨询工作，帮助客户更好的了解课程内容，了解客户的需求以不断改善课程内容设计职位要求：1.扎实的英文和机器学习背景；计算机，统计学，数学，金融，数据挖掘、理工科等相关专业本科及硕士以上学历2.两年以上数据分析/挖掘相关工作经验；熟悉数据分析流程，数据敏感度及逻辑能力强，有清晰的思路和数据建模方法论3.熟悉分类、回归、聚类等数据统计模型，具有一定的建模经验，善于从数据中挖掘出问题，做过定量、定性分析者优先4.熟练使用Python、T-SQL等编程语言，能够灵活运用PowerBI/Excel等数据分析工具者优先5.具备较强的规划和统筹能力，有较好的学习驱动力及有效的学习方法6.具备良好的文字表达能力和沟通能力，擅长与内部及外部合作团队交流沟通，具有优秀的报告讲解能力7.有责任心，可以承受较大的工作压力；富有团队合作精神、执行力强8.有PAAS、SAAS经验，熟悉Azure、培训工作经验，课程设计、开发和讲授经验者优先“获得微软MPP认证者面试可获得加分(MPP - Microsoft Professional Program) ”,数据服务,50-150人,hadoop,成都
高级爬虫开发/数据开发工程师(J11589),https://www.lagou.com/jobs/7183143.html,高新区,10k-15k,秒针信息技术有限公司,3-5年,本科,更多福利可与HR详谈,,"数据服务,广告营销",2000人以上,hadoop,成都
高级数据开发工程师,https://www.lagou.com/jobs/7137939.html,高新区,15k-25k,万商云集（成都）科技股份有限公司,5-10年,本科,"国内国外游,免费健身,节日福利,双休",岗位职责： 1. 负责公司数据中台项目的数据处理，设计数据采集、存储及清洗方案，实现数据的规模应用； 2. 负责大数据平台技术框架的选型、技术难点攻关和技术方案规划及设计。3. 负责跟进hadoop生态体系中前沿的技术解决方案，形成公司级的技术储备。 岗位要求： 1. 计算机软件相关专业本科以上学历； 2. 3年以上大数据处理，大规模的数据分析和算法实践； 3. 精通hadoop Spark编程，熟悉Hadoop生态圈，能运用其解决问题，熟悉Mysql、Redis 等常用SQL和NoSQL数据库；4. 至少熟练掌握Java、Scala、Python、Golang等两种以上语言；5. 有丰富的大数据集群部署和维护管理经验；6. 具备优秀的团队意识和沟通能力，学习能力和主动性强，具有钻研精神，充满激情，乐于接受挑战。,"移动互联网,电商",500-2000人,hadoop,成都
数据仓库开发工程师,https://www.lagou.com/jobs/7147721.html,高新区,10k-15k,成都极米科技股份有限公司,不限,本科,独角兽 数据仓库,,"电商,硬件",500-2000人,hadoop,成都
大数据开发工程师（研发中心）,https://www.lagou.com/jobs/7049359.html,锦江区,10k-15k,四川久远银海软件股份有限公司,3-5年,本科,五险一金，年终奖，生日福利,1、本科及以上学历，数学、计算机等相关专业，3年以上大数据开发经验；2、熟练应用java/python/scala编程，熟悉R编程者优先；3、熟练应用hadoop、spark、hive等分布式框架，可以搭建分布式运行环境；4、熟悉Java/scala与R/python等算法分析语言的编程接口；5、熟悉Java/scala与Oracle/nosql/gbase等数据库的编程接口；6、熟悉了解数据挖掘等相关知识。,"移动互联网,硬件",2000人以上,hadoop,成都
数据开发工程师,https://www.lagou.com/jobs/7030560.html,高新区,7k-14k,成都小蟾科技有限公司,1-3年,本科,五险一金 周末双休 带薪年假等,"【岗位职责】1、负责日常数据采集工作，包括数据清洗、分析、计算等。2、及时响应需求，提供业务所需数据和结果。3、探索、开发并维护数据基础设施，提供各种高效数据访问和处理工具；  4、建立并维护数据处理系统，对 ""数据正确性和系统可靠性"" 负责 ；【任职资格】1、本科及以上学历，2年及以上数据业务相关工作经验；2、精通Python，熟悉scrapy，requests等爬虫框架及HTTP工具3、熟悉app端数据抓取（有逆向、脱壳等经验），掌握Apktool、dex2jar、JD-GUI等工具，抓取过主流电商平台和主流app软件；4、具有1年以上实际网络爬虫或分布式采集开发工作经验5、了解常见反爬机制，有验证码识别技术者优先6、熟悉Mysql/MongoDB/Redis，有过数据库调优和海量数据存储经验优先7、性格开朗、善于沟通，有良好的自我驱动学习能力，注重效率和团队意识，有团队管理经验优先；","电商,移动互联网",150-500人,hadoop,成都
分布式数据库引擎开发工程师,https://www.lagou.com/jobs/6903135.html,高新区,15k-25k,北京万里开源软件有限公司,3-5年,本科,牛人多 工资多 假期多 弹性工作多,岗位职责：1、 负责开发MySQL独立引擎；2、 负责开发全局事务管理模块；3、负责维护全局元数据模块。岗位要求：1、熟练掌握C/C++语言，良好的编程习惯、数据结构、算法等基础知识；2、熟悉MySQL的代码框架，对MySQL进行过二次开发者优先；3、对MySQL存储引擎接口开发有经验者优先，对分布式事务有深入研究优先；4、有数据库底层系统研发经验优先。,数据服务,150-500人,hadoop,成都
分布式数据库存储开发工程师,https://www.lagou.com/jobs/6903129.html,高新区,15k-25k,北京万里开源软件有限公司,3-5年,本科,牛人多 工资多 假期多 弹性工作多,岗位职责：1、负责改造RocksDB的事务模型；2、 负责优化RocksDB的性能；3、负责实现基于RocksDB的一致性复制。岗位要求：1、熟练掌握C/C++语言，良好的编程习惯、数据结构、算法等基础知识；2、对RocksDB代码有深入研究者优先；3、对分布式系统有研究者优先。,数据服务,150-500人,hadoop,成都
大数据初级开发工程师,https://www.lagou.com/jobs/6736601.html,青羊区,7k-14k,上海诺悦智能科技有限公司,1-3年,本科,五险一金 奖金 餐补 通讯补助等,任职要求：精通Scala、java语言，有Scala实际编程经验深入了解分布式系统、大数据平台、消息队列等高可用高弹性架构;对HDFS/Yarn/HBase/Hive/Spark相关组件的性能优化和补丁跟踪等有实际经验在Hadoop、Spark、Storm、Flink等开源社区有过贡献最佳熟悉银行业务，有过银行数据处理、分析经验者优先良好的英语读写能力本科及以上学历，2年以上相关工作经验；,数据服务,50-150人,hadoop,成都
大数据开发实习生,https://www.lagou.com/jobs/6861313.html,高新区,2k-3k,成都华栖云科技有限公司,1年以下,本科,大平台、全额六险一金、发展空间大,技能要求：爬虫，HTTP协议，正则表达式，XPATCH，CSS选择器，验证码识别技术岗位职责：1、掌握爬虫相关开发技术，能够高效的开发互联网爬虫采集新闻数据；任职能力：1、本科及以上学历，计算机或相关专业，具有爬虫开发经验者优先；2、熟悉HTTP协议，熟悉正则表达式、XPath、CSS选择器等，了解常用验证码识别技术；岗位补贴：100元-120元/天,"移动互联网,企业服务",150-500人,hadoop,成都
数据开发工程师,https://www.lagou.com/jobs/6513091.html,高新区,11k-17k,成都南天佳信信息工程有限公司,3-5年,本科,年终奖金，年度体检等等,"1. 计算机或相关专业本科及以上学历，熟练使用常用算法和数据结构；2.有丰富的SQL使用经验，熟悉分布式数据库开发(Hadoop, hive等)，熟悉分布式平台工作原理；3.熟悉Linux操作系统及命令，熟悉常用的shell命令工具；4.3年以上金融领域项目开发经验，有CRM项目和营销类项目经验优先。","金融,其他",50-150人,hadoop,成都
大数据应用开发工程师,https://www.lagou.com/jobs/7217918.html,锦江区,7k-12k,四川久远银海软件股份有限公司,1-3年,本科,13薪起步，有带薪休假,负责大数据应用产品研发和实施，掌握Java、springboot、springmvc、html5、css、es6、vue、hive、spark、echarts等技术有一定的大数据分析能力优先,"移动互联网,硬件",2000人以上,hadoop,成都
大数据开发工程师,https://www.lagou.com/jobs/7087232.html,武侯区,15k-22k,成都妍丹信息科技有限公司,5-10年,本科,薪资优厚 发展空间大,"***此岗位要求英语能流利沟通***岗位职责：
 与Product Owner和项目经理进行需求和项目讨论，提供技术和业务的解决方案
 根据实际业务需求，负责公司大数据平台及应用系统的架构设计与开发，技术改进与性能优化
 指导和培训开发人员，解决系统开发、运行中出现的各种问题，同时保证交付质量
 建立大数据智能分析工作的流程、规范和方法
 参与和帮助团队的敏捷实施和持续改善
 积极学习和掌握保险相关的业务和系统知识
  完成主管安排的其他工作。
任职要求：        ***此岗位要求英语能流利沟通***
 计算机相关专业本科及以上学历，4年以上工作经验，其中包含2年或以上的大数据开发实施经验 
 精通Java语言，熟悉常见应用框架（如Spring、MyBatis等）和设计模式 
 熟悉Linux环境，能够熟练使用至少一种脚本语言（如Shell、Python等）
 熟悉Hadoop/Yarn/Hbase/Hive//Flume/Spark/Kafka等常用大数据组件 
 熟悉MS SQL Server/Oracle/MySQL/Redis/MongoDB等常见存储和缓存系统 
 熟悉Git 等代码版本控制技术 
 较强的分析和解决问题能力，对攻关疑难问题具有浓厚兴趣 
 良好的团队合作精神、沟通能力和学习能力 
 有大数据平台建设经验者优先录用 
 有金融行业背景经验更佳
 有Web开发经验更佳","人工智能,软件开发",50-150人,hadoop,成都
大数据开发工程师,https://www.lagou.com/jobs/3169950.html,高新区,18k-25k,深圳市先创数字技术有限公司成都分公司,5-10年,本科,良好的薪资福利和发展前景！,"岗位职责：1）大数据平台应用项目相关项目架构设计；2）大数据平台应用开发维护。任职资格： 1）25-32岁，统招本科学历、计算机或相关专业；2） 3年及以上相关工作经验,有扎实的计算机理论基础；3） 熟练Java服务端编程，有良好的编码习惯；4）深入理解MapReduce，熟练使用Storm、Hadoop、Spark，并阅读部分源码；5）熟练使用HDFS、Hbase、ElasticSearch、Solr；6） 深入理解Lucene，ElasticSearch，Solr等，有优化经验者优先；7） 具备良好的学习能力、分析解决问题能力；8）具有高度的责任心和团队合作精神；9）有大数据平台产品建设经验者优先。",数据服务,150-500人,hadoop,成都
大数据开发工程师 (MJ000130),https://www.lagou.com/jobs/7019913.html,武侯区,12k-20k,深圳市慧择时代科技有限公司,3-5年,本科,六险一金，周末双休,岗位职责：1.负责公司基础数据标签的设计及建设；2.负责AI算法对外服务的搭建和具体开发工作；3.参与用户画像标签体系的技术规划，开发挖掘用户各级标签，提升用户画像标签体系的覆盖度和准确性；4.参与公司数据系统的设计和具体开发工作；任职要求：1.本科及以上学历，计算机或者数学等相关专业，具备3年以上工作经验；2.熟悉MySQL、SQLServer，熟悉SQL语言，熟练掌握Java语言；3.熟悉Kettle、Datastage等ETL开发工具，熟悉数据仓库、ETL、BI开发的过程，对数据分析和处理计算有强烈兴趣；4.熟练掌握大数据开发工具的使用(hdfs、hive、hbase、spark、flink、impala、kafka等)，具有完整项目实战经验；5.参与过用户画像建模、用户画像系统的开发工作优先；6.具有较强的业务理解能力，思路敏捷清晰，有责任心及抗压能力，有强烈的自驱力，并有良好的团队协作精神。,"移动互联网,电商",500-2000人,hadoop,成都
大数据开发工程师,https://www.lagou.com/jobs/7131547.html,锦江区,12k-20k,和美（深圳）信息技术股份有限公司,5-10年,不限,年终奖 双休 餐补,1.负责实时数据的处理和分析，整理项目文档；2.进行人工智能行业数据的生产、整理及入库工作;3.负责数据处理新方法探索、新工具的推广使用等；4.编写项目数据处理及检查方案；5.及时反馈工作中出现的问题，并能够提出解决方法；6.按时、按质、按量的完成部门工作进度。任职要求：1.统招全日制本科6年以上，研究生4年以上。2.有5年以上kafka，spark streaming，以及flink的开发经验，完成过TPS1000以上的大型项目的实时数据分析工作。3.熟悉上游的flume，filebeat，logstash等采集组件以及下游的存储相关的hadoop组件。,"金融,人工智能",500-2000人,hadoop,成都
大数据开发工程师,https://www.lagou.com/jobs/6872500.html,高新区,10k-15k,四川金熊猫新媒体有限公司,1-3年,不限,高低温、餐、交、话补等，各类福利及年终奖,职位描述：1.负责Hadoop/spark/storm/kafka/zookeeper/flink等的大数据平台搭建及维护；2.负责开发ETL过程，优化存储⽅案，设计并实现分布式计算任务，搭建数据处理流程；3.负责模型和分层等数据产品监控、优化；岗位要求：1. 本科以上学历，计算机、数学相关专业，熟悉数据仓库建模相关理论，具有2年以上相关经验；2. 能够熟练应用spark、storm、flink、hive、hbase、ES、kylin等大数据组 件底层原理和框架，并结合实际业务场景进⾏⼤数据应⽤⾯向不同场景的封装、调优；3. 能够独立搭建基于CDH版本或Apache原生版本的大数据集群环境 ，并能够编写shell或python脚本，完成10台以内大数据集群的日常维护和常见故障的定位及优化,文娱丨内容,150-500人,hadoop,成都
大数据开发工程师,https://www.lagou.com/jobs/6662810.html,高新区,15k-25k,成都新潮传媒集团有限公司,5-10年,本科,打造中国**社区媒体流量平台,岗位职责1、与相关业务负责人对接，深入了解并抽象业务需求，分析数据应用可行性，形成需求调研和应用可行性设计；2.、通过对业务和数据调研，进行数据模型（数据仓库）设计，协同产品开发，数据分析团队进行开发工作；3、负责配合集团其他条线或者部门，提供数据支持。 任职要求1、全日制本科及以上学历，计算机、软件相关专业，5年以上Java研发从业经验；2、JAVA基础扎实，熟悉IO、多线程、分布式、负载均衡、缓存、消息等技术；3、熟悉JavaEE相关技术，对基于springcloud相关的微服务开发框架及技术有实际的实践项目；4、使用过大数据基础平台建设中的至少2种及其以上技术（如Hadoop、Hive、HBase、Spark、Storm、Kafka、Kylin、Kudu、ES等）；5、熟悉数据仓库模型设计与ETL(sqoop等)开发，对复杂业务逻辑的数据处理有一定经验；6、熟悉Linux常用操作、Shell脚本；7、具有良好的沟通能力、学习能力、团队合作精神，工作积极主动、服从安排、有责任心，严谨的编码风格，有优秀的逻辑思维能力，能独立分析问题和解决问题；,广告营销,2000人以上,hadoop,成都
数据库开发工程师,https://www.lagou.com/jobs/7027017.html,武侯区,8k-16k,四川锦程消费金融有限责任公司,3-5年,本科,"互联网金融,发展空间,稳定平台,薪酬福利","工作职责:1. 负责数据仓库的日常维护；2. 数据接入平台，负责对接内外部数据源，对数据进行清洗和加工；3. 负责公司内数据集市的建设与维护；4. 负责与业务部门对接沟通数据问题，并及时提出解决方案；任职资格:1. 计算机/统计学/信息与计算科学等相关专业本科及以上学历；2. 3年以上数据仓库项目、大数据工作经验；3. 理解数据模型和数据仓库，有数据仓库建模，有ETL等经验着优先；4. 精通SQL，有较好的SQL调优经验，熟悉主流数据库存储过程的开发；5. 具备出色的需求分析能力及快速学习能力，能深入理解复杂的业务逻辑；6. 工作认真、负责，有良好的团队合作精神，良好的分析能力与沟通技巧,能承受较大的工作压力；7. 数据敏感，较强的逻辑思维及数据分析能力，有消费金融相关业务经验者优先；",金融,150-500人,hadoop,成都
大数据Java开发,https://www.lagou.com/jobs/6660278.html,高新区,9k-14k,北京永洪商智科技有限公司,3-5年,本科,技术大牛，工作氛围好，行业领先,工作职责：1.完成产品相关模块的设计、开发、测试、修改bug等工作，包括业务需求的沟通，功能模块详细设计，业务功能实现与单元测试。2.参与产品构思和架构设计；3.撰写相关的技术文档；工作要求：1、工作使用 java 3年及其以上。2、深度掌握java内存模型，面向对象编程及设计模式。3、对 JVM 机制有深入理解，熟练应用多线程编程。对高并发及java性能调优有深刻理解与经验。4、扎实握数据库基础，熟练掌握 sql。5、有大数据生态系统工作经验者优先。,企业服务,150-500人,hadoop,成都
大数据开发工程师,https://www.lagou.com/jobs/6651192.html,武侯区,8k-16k,成都峰西猿科技有限公司,1-3年,不限,双休 工作弹性制,岗位描述：1、负责公司交通数据大数据产品的架构及量化指标判断；2、负责交通大数据平台hadoop、kafka、strom等的维护、开发和管理工作；3、与内部技术团队一起完成具体场景下的业务逻辑及大数据开发；4、参与数据分析平台设计与开发；5、基于Spark的各类数据应用分析；岗位要求：1、对系统设计、程序开发工作有热情，能够深入到数据中去；2、有良好的编程基础，熟悉常见的数据结构和算法；3、熟悉Haddop生态圈，熟悉Hive、Spark、Kafka等主流大数据处理工具；4、有大型数据平台、数据仓库设计、开发、运维经验者佳；5、熟练使用Java编程语言；（根据研究院要求，对交通大数据进行研究及架构开发）,"企业服务,数据服务",少于15人,hadoop,成都
大数据开发,https://www.lagou.com/jobs/7146839.html,武侯区,10k-20k,成都高伟达信息技术有限公司,3-5年,大专,高公积金、大银行平台,1.熟悉linux、unix、AIX开发环境2.熟悉oralce、mysql、和GP分布式数据库，精通sql、理解oralce引擎的原理及分布式数据库的工作原理3.了解SPARK、HIVE、HADOOP等分析工具的使用，具有海量数据采集、加工、存储等数据仓库构建的经历，包括而不限于ETL、特征提取等项目经验,金融,150-500人,hadoop,成都
大数据分析开发工程师,https://www.lagou.com/jobs/7141110.html,高新区,15k-20k,咪咕文化科技有限公司,3-5年,本科,五险一金，周末双休，高端岗位,1.     负责对接和收集大数据区域市场数据应用需求，制定针对性的大数据解决方案，并协调后端开发人员进行开发落地。2.     对产品及业务的运营数据进行收集、甄选、整理、汇总及分析，制作相关分析报告；3.     对运营数据进行实时监控，及时发现运营数据中存在的问题，进行归因分析并提出改进方案；4.     对接各业务线的需求，在业务监督上分析需求，过滤需求、调研并落地需求；5.     负责数据挖掘领域的分析应用，定期对用户特征、需求、行为、活跃度、活动效果等特定业务的数据模型的进行需求分析。职位要求：1.本科及以上学历，3年以上数据相关产品运营或分析经验。具备良好的逻辑思维和总结概括能力，能够快速定位问题、分析问题、提供方案；具备丰富的人群行为模型分析和设计经验；2、理解大数据领域相关业务知识，熟悉数据采集、数据ETL、数据仓库建模、任务调度等环节工作内容，掌握一定的数据分析技能，对数据开发、数据可视化等相关工具有一定产品或运营经验；3、良好的沟通能力和团队协作能力，能熟练建立数据、用户体验和信息反馈收集机制，有强烈的意愿通过数据运营能力来实现产品和业务体验提升；4、优先考虑：在数据挖掘、算法应用、机器学习等领域有实战经验者；5、应聘者请提供数据运营实际工作的案例。,"移动互联网,文娱丨内容",2000人以上,hadoop,成都
数据开发工程师,https://www.lagou.com/jobs/6734071.html,武侯区,10k-15k,成都乐鸟智慧科技有限公司,3-5年,本科,数据中台,岗位职责： 1、 负责数据产品需求分析、数据建模，主导完成相关设计及编码； 2、 完善现有数据产品，优化现有产品数据体系； 3、 深入理解业务需求，能从数据角度推动业务发展，开发相应数据产品及工具。岗位要求：1、精通HiveSQL！！！熟悉Oracle、MySQL等关系型数据库；熟悉MapReduce/Spark等数据开发技术；2、有一定的Java/python开发能力，熟悉linux/Shell；3、计算机、数据等相关专业本科以上学历，工作5年以上；4、熟悉数据仓库和数据集市的框架结构，具备数据仓库与数据集市的架构设计能力；5、在数据统计、机器学习上有一定基础的优先；6、沟通与交流能力强，业务理解能力强，具有一定的业务建模能力；7、需出差，出差地：成都！,"企业服务,数据服务",少于15人,hadoop,成都
