job_name,job_url,job_location,job_salary,job_company,job_experience,job_class,job_given,job_detail,company_type,company_person,search_key,city
技术总监,https://www.lagou.com/jobs/7045856.html,武昌区,20k-40k,北京功夫仁医网络科技有限责任公司,5-10年,本科,五险一金 各类补助 期权,"职位描述：1.全面负责公司技术平台的技术架构和实施；2.确认和评估系统需求，给出开发规范，搭建系统实现的核心构架，并澄清技术细节、扫清主要难点，进行实施指导；参与核心代码的书写，组织解决项目开发过程中的重大技术问题；3.负责技术框架选型、核心架构搭建、核心模块开发、性能优化等工作；能够支持百万级以上的日活。4.确定和文档化项目系统的需求、设计、实施和部署等“视图”；5.负责研发团队日常技术指导、培训交流，提升团队整体技术水平，解决研发人员遇到的技术问题；任职要求：1.统招本科及以上学历，计算机科学、软件工程相关专业毕业.2.精通Java、c/c++、PHP、golang、android/IOS(至少三种）编程语言；；3.5年以上互联网项目研发经验，管理过至少10人技术团队，经历过大型项目的完整开发过程；4.具备扎实的IT相关知识，精通数据结构、算法、系统构架、Windows/Linux系统、多线程、网络、数据库等技术，具有撰写规范技术文档和手册能力；5.具有全线能力，前段后端，算法各方面技术能力，杰出的学习能力和问题分解能力；6.具有2年以上大数据开发、数据分析或人工智能相关工作经验，具备hadoop或spark或redis集群下的分布式开发经验。7.具备互联网产品思维，熟悉敏捷项目管理方法。收趣收趣准备导入总共导入个书签
  
 注意：
  
 1.导入时请不要关闭页面，如果您的要导入的书签较多，请耐心等待
  
 2.一旦看到导入完成，您的书签就已保存在收趣，但仍需要一段时间解析后才能在App中看到。
  
开始完成取消继续导入取消导入导入到收趣职位描述：1.全面负责公司技术平台的技术架构和实施；2.确认和评估系统需求，给出开发规范，搭建系统实现的核心构架，并澄清技术细节、扫清主要难点，进行实施指导；参与核心代码的书写，组织解决项目开发过程中的重大技术问题；3.负责技术框架选型、核心架构搭建、核心模块开发、性能优化等工作；能够支持百万级以上的日活。4.确定和文档化项目系统的需求、设计、实施和部署等“视图”；5.负责研发团队日常技术指导、培训交流，提升团队整体技术水平，解决研发人员遇到的技术问题；任职要求：1.统招本科及以上学历，计算机科学、软件工程相关专业毕业.2.精通Java、c/c++、PHP、golang、android/IOS(至少三种）编程语言；；3.5年以上互联网项目研发经验，管理过至少10人技术团队，经历过大型项目的完整开发过程；4.具备扎实的IT相关知识，精通数据结构、算法、系统构架、Windows/Linux系统、多线程、网络、数据库等技术，具有撰写规范技术文档和手册能力；5.具有全线能力，前段后端，算法各方面技术能力，杰出的学习能力和问题分解能力；6.具有2年以上大数据开发、数据分析或人工智能相关工作经验，具备hadoop或spark或redis集群下的分布式开发经验。7.具备互联网产品思维，熟悉敏捷项目管理方法。","移动互联网,医疗丨健康",150-500人,ios,武汉
UI设计师,https://www.lagou.com/jobs/7101522.html,江夏区,6k-11k,武汉烽火技术服务有限公司,3-5年,本科,扁平化管理，年轻化团队,岗位职责:1、能高效理解产品和交互设计思路，敏锐判断视觉设计的可行性;2、主要负责公司B端产品(web、移动、app、小程序、H5等)的交互与界面视觉设计，根据项目实际需求，有独立把控和完成产品界面设计方案的输出能力；3、参与产品讨论，从视觉设计和用户体验的角度提出建议与解决方案;4、参与产品整体视觉风格及规范的制定，输出高质量设计方案;5、擅长使用Axure等原型工具，精通PS、Al等视觉设计软件; 6、对前沿设计探索感兴趣，自我驱动力强，能用设计效果准确表达想法;7、关注设计流行趋势，保持设计敏锐度;职位要求:1、本科以上学历，设计相关专业毕业，两年以上的互联网或移动互联网设计经验，熟悉Web、iOS、 Android设计规则;2、能高效理解产品和交互设计思路，敏锐判断视觉设计的可行性; 3、重视细节，追求像素级精神，热爱交互小动画;4、具有较强的工作责任心，有合作意识和团队精神，善于沟通和学习；5、面试需要携带作品或作品相关资料。,"移动互联网,信息安全",500-2000人,ios,武汉
Cocos2D游戏开发工程师,https://www.lagou.com/jobs/6334056.html,东湖新技术开发区,12k-20k,武汉微派网络科技有限公司,1-3年,本科,高额年终奖 6亿用户,【岗位职责】 1、基于Cocos2D引擎的功能实现； 2、iOS和Android平台的跨平台开发。   【任职资格】 1、热爱游戏，热衷开发，乐于接受有挑战性的任务；2、本科（含）以上学历，了解计算机图形学相关算法，数据架构和算法基础扎实；3、熟悉游戏客户端结构，良好的面向对象编码习惯； 4、有较的主动性和执行力，良好的团队意识、学习能力较强,社交,150-500人,ios,武汉
Flutter移动开发工程师,https://www.lagou.com/jobs/6725936.html,东湖新技术开发区,8k-12k,武汉赛思云科技有限公司,3-5年,大专,福利优厚骨干员工有期权,任职要求：1.专科以上学历，计算机软件或相关专业，三年以上编码经验；2.具有扎实的编程功底，良好的设计能力和编程习惯；3.熟悉Flutter 、Dart 语言，熟练使用各种UI组件并进行UI 开发，并对Java 语言或者OC有一定的了解；4.了解Flutter和原生的交互。如：通过流或者异步方式。5.熟悉Flutter布局、动画，有作品的优先；6.会使用Android Studio＆Visual Studio工具面编写代码。7. 具有Android或iOS研发相关经验、熟悉APP平台应用的设计理念；8. 对技术钻研有强烈的兴趣,"移动互联网,企业服务",15-50人,ios,武汉
技术总监,https://www.lagou.com/jobs/6994262.html,武昌区,20k-40k,武汉熊心智能科技有限责任公司,5-10年,本科,五险一金 各类补助,1.全面负责公司技术平台的技术架构和实施；2.确认和评估系统需求，给出开发规范，搭建系统实现的核心构架，并澄清技术细节、扫清主要难点，进行实施指导；参与核心代码的书写，组织解决项目开发过程中的重大技术问题；3.负责技术框架选型、核心架构搭建、核心模块开发、性能优化等工作；能够支持百万级以上的日活。4.确定和文档化项目系统的需求、设计、实施和部署等“视图”；5.负责研发团队日常技术指导、培训交流，提升团队整体技术水平，解决研发人员遇到的技术问题。任职要求：1.统招本科及以上学历，计算机科学、软件工程相关专业毕业.2.精通Java、c/c++、PHP、golang、android/IOS(至少三种）编程语言；3.5年以上互联网项目研发经验，管理过至少10人技术团队，经历过大型项目的完整开发过程；4.具备扎实的IT相关知识，精通数据结构、算法、系统构架、Windows/Linux系统、多线程、网络、数据库等技术，具有撰写规范技术文档和手册能力；5.具有全线能力，前段后端，算法各方面技术能力，杰出的学习能力和问题分解能力；6.具有2年以上大数据开发、数据分析或人工智能相关工作经验，具备hadoop或spark或redis集群下的分布式开发经验。7.具备互联网产品思维，熟悉敏捷项目管理方法。,"医疗丨健康,人工智能",15-50人,ios,武汉
u3d开发工程师,https://www.lagou.com/jobs/7184931.html,洪山区,8k-15k,北京光点图灵网络科技有限公司,1-3年,大专,周末双休 五险一金 团队旅游,职位描述：1.使用Unity3D引擎进行iOS/Android平台手机游戏开发；2.与策划，美术保持良好的沟通，确保程序功能与设计需求一致；3.独立实现游戏各个场景，包括但不限于核心玩法、商店等；4.对游戏性能优化有一定经验，包括但不限于UI，物理引擎、内存管理等。职位要求：1.掌握常用的数据结构和算法，两年以上工作经验；2.熟悉C#编程语言，掌握至少一种脚本编程语言；3.良好的逻辑思维和编程习惯，具备独立解决技术问题的能力；4.熟练使用Unity3D引擎，两年或以上Unity3D开发经验；6.善于沟通，要有团队合作精神；7.热爱游戏，有丰富游戏经验者优先；8.能承受一定强度的工作压力。,移动互联网,15-50人,ios,武汉
flutter工程师,https://www.lagou.com/jobs/7139408.html,硚口区,9k-14k,千里马（武汉）电商科技有限公司,3-5年,本科,五险一金 提供食宿 免费班车,职位职责：1、负责公司移动端跨平台框架的设计和研发工作2、负责Flutter引擎与框架的性能体验优化3、负责Flutter的基础库、工程体验、研发工具链等开发工作4、承担难点的技术攻坚专项，支持业务研发职位要求：1、本科及以上学历，计算机、通信、数学等相关专业2、良好的数据结构和算法基础，扎实的编程功底3、有丰富的Android或者iOS开发经验，至少熟悉Java/Kotlin/Object-C/Swift/C++等一种或者多种语言4、对新技术保持热情，具备良好的分析、解决问题的能力5、熟悉前后端相关或者跨平台框架(Flutter/React Native/Weex/浏览器内核/小程序等)优先，有渲染相关经验优先,"移动互联网,电商",15-50人,ios,武汉
BI可视化工程师,https://www.lagou.com/jobs/6669589.html,江夏区,15k-20k,神州数码（中国）有限公司,3-5年,本科,六险一金、员工体检、餐补、通讯补贴等,岗位职责：1、负责公司大数据可视化产品的规划、设计开发、维护；2、负责数据服务相关接口（DAAS)的开发；3、提出具有建设性的可视化产品和交互相关建议和方案4、根据项目需求、产品需求，分析并给出最优的页面前端结构解决方案；5、负责项目各种可视化需求开发（PC/APP/大屏）。岗位要求：1、3年及以上JAVA经验，较扎实基础功底，熟练OOA/OOD/OOP，熟悉使用ibatis/Mybatis、springboot、spring/springMVC等J2EE应用框架进行功能开发；2、熟悉HTML5、CSS3、jquery/vue、easyui、element-ui、echarts、highcharts等前端技术和框架；熟练使用tableau/datav/powerbi/quickbi 等可视化产品中至少一种。3、熟练Oracle、MySQL中至少一种关系型数据库4、有数据仓库基础理论知识并有相关实施经验;有BI门户及其他数据产品设计开发经验。5、有可视化大屏、统计报表开发或报表产品设计开发经验6、熟悉Android或IOS或Native+H5混合开发更佳7、积极的心态和良好的沟通表达能力、学习能力和团队合作精神,"硬件,数据服务",2000人以上,ios,武汉
unity3d游戏开发工程师,https://www.lagou.com/jobs/7160398.html,洪山区,11k-15k,武汉网幂科技有限公司,3-5年,本科,五险一金，带薪年假，周末双休，等等,"岗位职责：1、使用Unity3D引擎进行iOS/Android平台手机游戏开发；2、 游戏核心模块架构的搭建，相应模块的开发工作；3、针对各个发布平台进行游戏性能优化；4、与策划、美术、运营良好沟通，能按时高质量交付。5、能独立开发游戏，游戏打包、上传等；任职要求:1、计算机及相关专业本科以上学历，熟悉C#语言编程；2、良好的3D图形学基础，有两年以上unity3d的手游开发经验，熟悉Unity3D引擎架构设计；3、熟练掌握 NGUI或UGUI的使用方法；4、热爱游戏事业,富有创新意识；5、具备独立思考,分析,解决问题的能力,有较强的自学能力和责任心；6、对Shader有一定的认识，能使用工具编写简单的Shader；7、良好的英语基础，英语4级。",移动互联网,50-150人,ios,武汉
产品设计师,https://www.lagou.com/jobs/6952483.html,洪山区,10k-16k,武汉湃领科技有限公司,1-3年,大专,五险一金，双休，打车福利，季度年度奖金,职位职责：1、负责产品的UX设计工作(包括Web、iOS、Android端)，从设计策略到设计执行的全流程工作；2、和产品负责人，产品经理一起构思创意，提供具备优质产品体验的整体解决方案；3、对产品数据的变化与用户满意度有极高的敏感度，能灵活度量产品的整体体验水平，提出改进建议；4、时刻关注并分析流行产品设计趋势，研究目标用户需求，体验诉求与审美倾向，并迅速优化现有产品。职位要求：1、专科及以上学历，设计类相关专业；互联网或移动互联网设计经验；英文正常工作能力达标;2、具备成功商业化产品的项目经验与整体设计方案落地经验；3、深度理解Web、iOS、Android端的官方设计原则和规范；4、极度重视细节，追求像素级完美，可接受短期国外派驻出差；5、具备较成熟的产品思维和极强的用户同理心，能深度参与用户研究、交互设计、设计原型开发的工作工作地址武汉，部分东南亚国家首都,软件开发,50-150人,ios,武汉
php,https://www.lagou.com/jobs/6748411.html,洪山区,7k-13k,武汉乡土味士信息科技有限公司,3-5年,本科,五险一金 期权 双休 年假,"岗位职责:1.掌握it行业趋势，具备学习新技术与资讯的能力；2.负责公司平台技术架构及搭建，组织并参与技术攻关；3.建立项目需求分析书与项目执行方案，并制定项目任务和项目进度表；4.参与整个项目核心框架的设计，并完成完成核心代码的设计；任职要求:1.三年以上开发经验；2.精通B2B/B2C模式，熟悉TCP/IP,HTTP 等协议；3.精通基于PHP开源框架(ThinkPHP、CI)的开发；4.精通基于J2EE开源技术（spring，struts2，ibatis等）的开发；5.精通Oracle、mysql等数据库；6.精通js框架（jquery）的开发；7.精通第三方支付接口；8.精通分布式高并发服务器开发；9.熟悉Android/IOS移动端开发经验；","电商,工具",15-50人,ios,武汉
技术总监,https://www.lagou.com/jobs/5767748.html,洪山区,20k-35k,武汉飞猫环球商贸有限公司,5-10年,本科,技术总监 开发经理 项目经理,岗位职责：1、主导项目的技术路线制订和技术架构设计，并进行实施指导。2、确认和评估系统需求，给出开发规范，搭建系统实现的核心构架，并澄清技术细节、扫清主要难点；同时负责设计系统整体架构，把握整个项目大局。3、负责技术框架选型、核心架构搭建、核心模块开发、性能优化等工作；能够支持百万级以上的日活。4、统筹负责整个项目团队工作，产品设计、后台开发、测试、优化等工作任职要求：1、本科以上学历，计算机及相关专业；2、精通Java、c/c++、PHP、golang、android/IOS(至少三种）编程语言；；3、5-8年一线互联网公司研发管理经验，具有丰富的构架设计能力，丰富的研发梯队培养与团队管理能力，经历过大型项目的完整开发过程；；4、具备扎实的IT相关知识，精通数据结构、算法、系统构架、Windows/Linux系统、多线程、网络、数据库等技术，具有撰写规范技术文档和手册能力；5、具有全线能力，前段后端，算法各方面技术能力，杰出的学习能力和问题分解能力；6、具备较好的英语听、说、读、写能力；福利待遇：1、实行八小时工作制。工作时间周一到周六，每周天固定休息。2、员工享有带薪年假，年终奖；3、享受良好晋升空间；4、享受良好优质的办公环境和公司氛围；5、定期培训、良好的晋升机制；6、不定期举行团建活动。温馨而又富有激情的团队与公司氛围。,"电商,其他",150-500人,ios,武汉
测试工程师,https://www.lagou.com/jobs/4639157.html,武昌区,3k-6k,广州贝护佳医疗科技有限公司,不限,大专,"年终奖,五险一金,双休","岗位职责:1、负责Android、iOS客户端产品质量保证，制定测试计划、测试方案，编写测试用例、BUG提交和追踪，测试报告；2、根据Android、iOS客户端开发流程和工具进行优化，协助开发定位问题，提供高效的持续集成工具，提升交付效率和质量；3、根据项目过程中的体验对产品提出改进建议以建立**的用户感受，对项目过程提出改进建议以提高项目整体效率；4、学习和研究新技术以提高自动测试的效率和质量，满足质量保证的需求。任职资格:1、大专或以上学历，计算机相关专业优先；2、1年以上相关测试经验 ，有以下相关经验优先；3、对移动端崩溃问题有深刻了解，提升发现/解决/验收此类稳定性问题的工作效率；4、有服务器接口测试、性能测试、安全性测试、自动化测试经验者优先考虑；5、学习能力强，有较强分析、定位和解决问题的能力，具有较强逻辑思维能力和表达能力；6、工作积极主动，有强烈责任心和严谨工作作风，积极思考，不断创新,良好的协作沟通能力和团队合作精神。",医疗丨健康,15-50人,ios,武汉
高级 UI 设计师,https://www.lagou.com/jobs/6751881.html,东湖新技术开发区,10k-20k,深圳世通无限科技有限公司,不限,本科,有竞争力的薪资及奖金，免费下午茶,"岗位职责
 负责产品的视觉设计，及交互动画原型设计；
 理解产品需求，独立完成设计原型及最终设计实现；
 关注产品在开发中的设计还原，持续优化产品的用户体验；
 产品相关宣传资料、产品手册、广告素材的设计与制作。
任职要求
 理解并能合理运用 iOS 及 Android 平台的设计规范；
 两年以上设计工作经验（极优秀者可适当放宽）；
 有扎实的美术功底，良好的产品思维和理解能力；
 有很强的分析问题和解决问题的能力，对视觉设计、色彩有敏锐的观察力及分析能力，有交互设计能力；
 能准确把握需求，通过分析和讨论，协助产品经理完成相应的视觉及交互设计工作；
 至少熟练使用 Sketch、Figma、Photoshop、AE 等软件及平台中的三种，熟练使用 C4D 者加分；
 设计相关专业本科及以上学历（优秀者可适当放宽），有良好的沟通能力和协调能力，有团队合作精神；
 请附上相关作品（请勿提供临摹作品），无作品简历会默认不通过，谢谢合作。",软件开发,50-150人,ios,武汉
U3D前端开发工程师,https://www.lagou.com/jobs/7175760.html,洪山区,8k-15k,武汉花生游科技有限公司,1-3年,不限,国漫IP；全新项目；老板好；氛围好,岗位职能：1. 参加移动端产品的需求分析、架构设计、编码测试、性能优化等工作；2. 负责移动端代码的实现，编写需求文档、开发文档等；3. 及时准确地判断、定位开发过程或生产运行中的问题并协调解决。岗位要求：1. 熟练掌握Android开发平台及框架，一年以上实际开发经验；2. 熟悉C/C++或者Java开发语言和环境，熟悉js优先。3. 熟练掌握Android GUI程序开发；SDK及相关开发工具的使用；4. 熟悉移动终端特性和开发特点； 熟悉移动终端网络编程；5. 接入过多个平台SDK，对Android机型以及适配方面有丰富经验；6. 有android游戏多渠道打包经验的优先；熟悉IOS开发的优先；,"移动互联网,广告营销",15-50人,ios,武汉
图像识别高级算法工程师,https://www.lagou.com/jobs/6859238.html,武汉经济技术开发区,13k-20k,武汉动手力信息技术有限公司,不限,本科,双休，五险一金，团队氛围好,工作职责1. 负责图像压缩、降噪、增强、超分辨率等算法研究及技术落地；2. 负责图像识别、图像转换、人像处理等算法的迭代和性能优化；3. 结合产品业务，在健康医疗创新方向不断进行探索；4. 推动算法在工程上的性能优化与落地，制定数据和接口规范。 岗位要求1. 计算机相关专业，研究生及以上学历，对算法研发有浓厚兴趣；2. 良好的专业基础;深入理解深度学习原理；3. 熟悉计算机视觉和图像处理基本算法，有实际项目经验或者较好的研究成果；4. 熟悉深度学习框架如pytorch、tensorflow、caffe等其中一个或多个框架；5. 具备良好的编程能力，熟悉C++/Python/Java等至少一种编程语言；6. 具有良好的沟通和团队协作能力，有实际业务落地的经验，注重理论与实际相结合。 加分项：1. 在健康医疗领域有相关涉猎优先；2. 有安卓/IOS等移动端有产品落地项目经验者优先。,"移动互联网,消费生活",15-50人,ios,武汉
cocos2d-x游戏,https://www.lagou.com/jobs/4643627.html,汉阳区,4k-8k,武汉榕迹网络科技有限公司,应届毕业生,不限,福利待遇：6—18k，周末双休，五险一金,"岗位职责：1、使用Cocos2d-js游戏引擎开发基于iOS/安卓,H5手机游戏；2、根据产品需求完成模块设计、编码、测试工作；3、负责cocos2d游戏性能调优；5、根据微信接口将游戏接入到微信；6、能独立进行各种类型游戏的开发；任职要求：1、具有1-2年以上cocos-js 游戏开发经验；2、熟悉至Cocos2d-js的HTML5游戏开发引擎；3、熟悉各主流浏览器间的差异性，能快速定位、解决开发中遇到的浏览器兼容性问题；4、能利用Cocos2d-js HTML5前端技术及相关技术实现手机棋牌游戏研发。可接受应届毕业生",游戏,15-50人,ios,武汉
cocos2d-js前端开发,https://www.lagou.com/jobs/4706586.html,汉阳区,6k-12k,武汉榕迹网络科技有限公司,1-3年,不限,"五险一金,双休,年度旅游","岗位职责：1、使用Cocos2d-js游戏引擎开发基于iOS/安卓,H5手机游戏；2、根据产品需求完成模块设计、编码、测试工作；3、负责cocos2d游戏性能调优；5、根据微信接口将游戏接入到微信；6、能独立进行各种类型游戏的开发；任职要求：1、具有1-2年以上cocos-js 游戏开发经验；2、熟悉至Cocos2d-js的HTML5游戏开发引擎；3、熟悉各主流浏览器间的差异性，能快速定位、解决开发中遇到的浏览器兼容性问题；4、能利用Cocos2d-js HTML5前端技术及相关技术实现手机棋牌游戏研发。",游戏,15-50人,ios,武汉
系统架构师（前端）,https://www.lagou.com/jobs/7033959.html,江岸区,10k-20k,中信工程设计建设有限公司,5-10年,本科,智慧园区 物联网平台 供应链金融 BIM,工作职责：1、负责分析、规划、设计系统的架构，包括移动应用、windows、WEB前端； 2、完成从研发文档到系统发布等项目开发各环节的工作；3、分析和解决现有系统中的设计缺陷，并创造性提升、改进工作方法和技术；4、指导专业技术子模块的研发设计，为项目团队提供指导；5、将系统开发任务合理分配到各级开发人员，确保按时完成任务。任职资格：1、本科及以上学历，5-10年以上研发经验，3年以上架构师经验，熟练掌握系统架构、平台架构搭建；2、精通系统架构和设计模式，具备从应用到底层的完整的技术视野，有带小团队经验为佳；3、至少精通以下技术方向之一：windows客户端开发、移动端（安卓和iOS）、前端（WEB H5、小程序等）；4、至少负责过两个以上的大型软件项目的总体设计、技术实施及项目管理，熟悉软件产品研发过程；5、具备良好的沟通能力，较强的分析、解决问题、领悟、归纳和逻辑推理能力和撰写开发文档能力；6、具有良好的计划性，团队精神，能承受工作压力并充满热情；7、具备PMP项目管理认证、产品经理与开发、测试综合背景、建筑业数字化转型、产业互联网平台背景为加分项。注：1.工作地点为武汉市江岸区或东湖高新技术开发区。2.本职位为中信数智（武汉）科技有限公司（筹）招聘职位。,"房产家居,软件开发",2000人以上,ios,武汉
