job_name,job_url,job_location,job_salary,job_company,job_experience,job_class,job_given,job_detail,company_type,company_person,search_key,city
java开发工程师,https://www.lagou.com/jobs/6613226.html,黄浦区,15k-18k,上海海万信息科技股份有限公司,5-10年,本科,"五险一金,体检旅游,年终奖金,节日礼金",职责要求：1、参与与产品经理、需求分析关于需求实现的讨论与工作量评估；2、依工作计划完成互联网软件系统的设计、开发、单元测试；3、协助架构师完善系统平台架构；4、制定合理的工作计划，并在执行过程中管理风险。岗位技能要求：1.本科及以上学历，计算机相关专业，3年以上工作经验；2.熟练掌握Springboot微服务开发经验，熟悉MVC编程模式；3. 对设计模式，多线程，JVM，分布式常用技术有深入理解，有实际性能优化经验；4. 熟练掌握主流开源框架、中间件、分布式技术栈的设计思想和原理，理解其优缺点和适用场景；5.具有较强的学习能力，能适应较大的工作压力，具备良好的团队精神和敬业精神。,"移动互联网,金融",500-2000人,java,上海
Java开发工程师,https://www.lagou.com/jobs/3298523.html,浦东新区,10k-18k,上海海万信息科技股份有限公司,3-5年,本科,"五险一金,年终奖,体检旅游,过节费",1、熟练掌握Java Web Application开发技术和MVC框架，具有相关B/S开发经验；2、理解三层架构设计理念，熟悉依赖注入和面向接口的设计；3、熟练掌握Struts/Spring/Hibernate/Ibatis/Kotlin，spring cloud体系；4、熟练使用Apache Tomcat或Jetty应用服务器；5、熟悉sql编程；6、熟悉HTML，XML，CSS，JavaScript，JQuery，AngularJS等；7、注重单元测试质量，熟练使用spring test组件；8、具有良好的编程风格及习惯能够严格执行公司编码规范；优良的文档撰写能力；9、具有银行、保理、租赁行业业务系统研发经验优先。,"移动互联网,金融",500-2000人,java,上海
java开发工程师,https://www.lagou.com/jobs/6210201.html,浦东新区,18k-21k,上海华钦信息科技股份有限公司,3-5年,本科,年终奖 六险一金 14天年假 定期体检,工作职责：-后端服务开发的实际编码，包括新特性和维护；-交付高质量的工作，并始终满足要求和标准。任职要求：熟悉Core Java；熟悉SpringCloud；加分项：熟悉Shell；英语口语良好。,"数据服务,金融",500-2000人,java,上海
java开发工程师,https://www.lagou.com/jobs/7206123.html,浦东新区,14k-25k,上海华钦信息科技股份有限公司,3-5年,本科,六险一金 13薪,统招本科学历，学信网必须可查，最好是计算机相关专业3年以上Java开发经验Java基本扎实，熟悉java开发的主流技术，熟悉SSM框架、 Springboot 、springcloud、dubbo等外企的环境，英语读写流利，口语可以简单沟通,"数据服务,金融",500-2000人,java,上海
java开发工程师,https://www.lagou.com/jobs/7216864.html,浦东新区,18k-35k,宁波墨香投资管理有限公司,3-5年,不限,核心项目,工作职责: 1. 负责核心系统软件设计和编码实现 2. 深入理解业务、参与需求分析并将之转换成技术实现方案3. 参与系统的日常维护，发现和解决系统中存在的缺陷任职资格: 1. 计算机相关专业，本科及以上学历2. 3年以上Java后台开发经验，精通Java编程，有良好的编码习惯和基础3. 精通缓存框架（如Redis、Memcached等），熟悉消息队列框架（如Kafka、RocketMQ等）4. 精通Spring框架，熟练掌握Spring、SpringMVC、MyBatis等5. 了解微服务框架，掌握Spring Boot、Spring Cloud6. 熟练掌握常见的关系型数据库（如：PostgreSql、Oracle）和Nosql（MongoDB）数据库7. 理解敏捷开发流程并有实践经验8. 为人乐观积极，热爱钻研技术，有良好的沟通和团队协作能力,"企业服务,金融",150-500人,java,上海
java开发工程师,https://www.lagou.com/jobs/7151240.html,嘉定区,8k-15k,环球车享汽车租赁有限公司,3-5年,本科,国企，新能源，共享汽车,岗位职责:1.参与项目技术架构分析和设计工作。2.参与项目数据库设计工作。3.参与项目前后端模块开发和自测工作。4.参与高并发、大数据量，微服务架构项目的二次优化工作。5.参与新技术的研发和探索。职位要求:1.3年以上java 开发经验。2.熟悉Java编程，有良好的面向对象编程思想，并且熟悉常用的Java设计模式。3.熟悉微服务和分布式架构相关概念；了解常用的RPC框架，如dubbo；了解注册中心，如zookeeper。4.能够熟练使用mysql关系型数据库。能够熟练使用redis等NO-SQL数据库。5.熟练使用SpringBoot搭建项目，可以快速整合其他常用组件。6.熟悉git、github、subversion等版本控制器，7.熟悉使用maven搭建环境和发布项目，知晓maven继承和聚合思想，会搭建maven私服。8.熟悉JavaScript编程、jQuery框架、AJAX前台技术和vue框架。9.具有较强的学习和沟通能力，良好的团队协作精神，极强的责任心，工作踏实、勤恳，有钻研精神。,"移动互联网,消费生活",150-500人,java,上海
JAVA,https://www.lagou.com/jobs/7059721.html,徐汇区,10k-15k,上海魔卡信息科技有限公司,3-5年,大专,13薪，五险一金，生日会，团建,熟练搭建和使用Spring MVC、springboot等框架进行服务端项目开发;2) 对团队软件工程项目开发规范有一定了解并能有效执行;3) 了解并使用过主流的开发技术与开发框架;4) 理解复杂的业务逻辑，对业务模型进行设计，编写出规范的设计文档 。任职资格1)参与到Java项目产品的研发，遵循项目开发规范 ;2) 在团队中充当重要模块开发角色，能独立完成模块的开发以及与其它模块的整合;3) 维护和升级现有软件产品，快速定位并修复现有软件缺陷4) 履行其他开发人员的代码review工作，而且自己也能以身作则遵循相关代码规范;5) 4年以上JAVA相关工作经验 。备注：我们是外包性质的，介意勿扰哦,金融,50-150人,java,上海
1121T1-Java架构师,https://www.lagou.com/jobs/6523024.html,浦东新区,20k-40k,平安科技（深圳）有限公司,5-10年,本科,"五险一金,带薪年假,节日福利,绩效奖金",,金融,2000人以上,java,上海
1121V7-安全研究员（Java方向）,https://www.lagou.com/jobs/6622262.html,浦东新区,15k-25k,平安科技（深圳）有限公司,5-10年,本科,"五险一金,绩效奖金,带薪年假,定期体检",,金融,2000人以上,java,上海
Java开发工程师,https://www.lagou.com/jobs/7160337.html,浦东新区,12k-18k,上海狂龙数字科技有限公司,3-5年,大专,五险一金 法定假日 五天工作,"岗位职责——后端Java开发1、负责产品开发；2、负责处理、协调和解决项目中出现的技术问题；3、根据公司产品的版本管理规范，完成所负责项目的服务器代码的版本归档、版本变更、版本发布工作。4、负责处理线上版本紧急技术问题，线上版本bug处理；5、负责服务器系统优化，提高性能。岗位要求：1、  大专及以上学历，3~5年相关工作经验；2、  精通Java，熟悉Java web应用开发，基本功扎实，拥有良好的编程习惯；3、  熟练使用Spring，SpringMVC、Mybatis、SpringBoot、Jpa等常用技术框架；4、  具有良好的面向对象设计思想，熟悉设计模式5、  具有主流数据库sqlserver、MySQL的开发和设计经验,有NOSQL项目经验，熟悉memcache,redis,mangodb等主流NOSQL存储开源项目；6、  熟悉H5、CSS、javascript，熟悉jquery、easyui、bootstrap；7、  具备良好的团队意识及创新思维、自我激励能力，善于与人合作；8、  有net开发经验的优先。","硬件,其他",50-150人,java,上海
java开发工程师,https://www.lagou.com/jobs/7030132.html,浦东新区,10k-20k,杭州财人汇网络股份有限公司,3-5年,本科,"五险一金，福利齐全,餐补，高温补贴，年假",岗位职责：1、负责互联网金融相关产品重要模块的设计与开发工作2、维护和升级项目软件产品，快速定位并修复现有软件缺陷3、理解系统的业务需求，制定模块实现方案并带领小组完成实现岗位要求：1、统招本科及以上学历，计算机相关专业，2年以上实际项目开发经验2、精通java/j2ee开发技术，对jvm、多线程、分布式并发有一定了解3、熟练使用Spring、SpringBoot、SpringCloud，Mybatis等框架 4、掌握MySQL/Oracle，精通sql语句、存储过程等sql知识；了解数据库性能优化原理5、掌握主流NoSQL数据库技术，如redis、mongodb等6、熟悉常用的消息队列框架及特性、例如：RabbitMq、ActiveMQ、Kafka7、有良好的自学能力和沟通能力，积极主动、责任心强，能适应一定的工作压力8、具有良好的编程习惯和沟通理解能力9、有高并发开发经验或证券行业背景者优先本岗位目前需要根据项目安排驻场。目前驻场点是国金证券、海通证券、兴业证券。,"移动互联网,金融",150-500人,java,上海
java开发工程师,https://www.lagou.com/jobs/6905419.html,浦东新区,13k-18k,大连佳途科技有限公司,3-5年,本科,薪资优厚,岗位职责：1、根据开发规范与流程独立完成模块的编码、测试以及相关文档。2、按照项目计划，按时提交高质量代码，完成开发任务；3、有独立解决开发中遇到的难点问题4、严格执行规范，按期按质交付开发经理安排的任务 任职要求：1、本科及以上学历，计算机或相关专业，3~5年相关开发经验；2、熟练掌握Java开发语言，以及面向对象编程思路；3、熟悉mysql数据库，熟练使用SQL语言，能编写复杂sql和高性能sql4、熟练使用spring、springmvc、spring boot、spring cloud、mybatis、dubbo、mq、job框架集成开发5、熟练使用缓存如：Memcache、Redis，消息中间如：ActivityMQ、kafka等6、熟练掌握html页面和js编写，熟悉jquery、easyui 、bootstrap 、angular 、vue等前端框架7、良好的沟通表达能力，较强的逻辑分析能力，较好的团队意识和规范意思8、进取心强，目标明确，结果导向，能承受高强度的工作压力，具有优秀的团队协作精神9、有大型项目Java开发经验，对高并发、微服务架构经验者优先；有互联网、电商、新零售 项目经验者优先,"企业服务,软件开发",50-150人,java,上海
java开发工程师,https://www.lagou.com/jobs/7178469.html,普陀区,10k-15k,上海耶购电子商务有限公司,3-5年,本科,周末双休，五险一金，弹性工作，包吃,"工作职责：1、熟悉项目开发流程；2、努力学习公司制度和企业文化，提高自身职业素养和业务水平，保质保量的完成各项工作任务；3、积极参与需求分析、系统设计、软件研发、集成测试、安装部署以及运行维护工作；4、负责与需求部门指定人员接口，熟悉项目的需求规划说明；5、熟悉项目的开发计划，及项目的概要设计说明数据库设计；6、严格遵守相关开发工具的编码规范；7、按计划完成功能模块的功能设计、代码实现, 代码编写和单元测试；8、对各部门提出的产品的升级和错误修订需求，迅速反应，提供良好的技术支持服务，同时对响应的软件产品进行必要的升级工作；9、提交相关年、月、日计划和总结；10、关注互联网软件行业的技术发展动向，不断学习和提高自己的技术水平。为公司新的软件产品的研发提出有效的意见、为公司现有软件产品提出有效的改良意见 ；11、完成研发部主管交办的其他工作。任职要求：1、 全日制本科以上学历，计算机相关专业，3年以上的Java 开发经验,能够独立完成工作；2、 熟悉Java在服务器端开发环境，熟悉Tomcat应用服务器；3、 熟悉Struts， Spring MVC框架；熟练Web Service 设计和开发；4、 熟练使用SQL语言, 熟悉表结构设计, 熟练使用MySQL 等关系型数据库；5、 熟悉了解Linux系统，有互联网经验，了解高性能互联网程序所涉及的相关技术优先考虑；6、 熟悉功能模块的整体设计流程，至少参与2个以上大中型开发项目。备注：集团下面有2个开发项目，熟悉OA或者电商业务流程，开发经验者优先。","电商,移动互联网",15-50人,java,上海
java开发工程师,https://www.lagou.com/jobs/7191348.html,徐汇区,10k-20k,上海趣医网络科技有限公司,1-3年,本科,前景好 办公环境优 五险一金 零食供应,"工作职责：1. 软件的程序设计与代码编写；2. 有关技术方案、产品文档的编写，软件单元的测试；3. 根据产品具体要求，承担开发任务，按计划完成任务目标；4. 参与系统需求调研、需求分析；5. 协助测试人员完成软件系统及模块的测试；6. 改进完善软件功能、性能，对软件界面美化；7. 协助相关应用软件的安装调试工作。职位要求：1. 本科以上学历，计算机相关专业，一年以上工作经验；2. JAVA基础扎实：熟悉多线程编程，熟悉分布式，缓存，消息队列等机制；熟悉JVM，包括内存模型、类加载机制以及性能优化； 3. 熟练掌握JAVA WEB编程，熟练掌握Spring boot、MyBatis、Spring MVC等开源框架，并能自己搭建项目；4. 熟悉Mysql数据库，熟悉JDBC原理，懂得分析sql慢查询及sql调优；5. 对各种Web前端技术有所了解，能使用html5,css,javaScript等前端开发技术完成业务需求；6. 热爱技术，工作认真、严谨，对现有技术能主动思考，进行更新学习；7. 有很强的责任心、主动性和上进心，能承担压力，团队合作能力、执行力强；8.有重构经验、对spring cloud有开发经验者优先。","移动互联网,医疗丨健康",500-2000人,java,上海
Java开发工程师,https://www.lagou.com/jobs/6798506.html,浦东新区,15k-30k,上海悉息信息科技有限公司,3-5年,本科,全面发展，深入技术,平台和机会：1. 自由开放的工作环境，简单的人际关系，给你良好的工作环境，2. 产品/技术驱动型的公司文化，帮助你聚焦用户的核心价值，3. 深度的领域驱动设计（DDD），K8s，容器化，微服务的工程实践，帮助你紧跟技术主流发展趋势职位职责： 1、负责掌控365后台服务的研发，理解业务需求，理解架构设计，独立完成后台系统的核心编码工作和单元测试；2、各类线上问题的分析，修复职位要求： 1、本科或以上学历，1年以上的Java开发经验，有良好的编码习惯，理解面向对象编程范式；2、具备良好的系统分析能力、抽象思维能力，能独立分析和解决问题；4、参与或主导过大型WEB应用的设计和开发5、有devOps，k8s 的经验优先6、对技术有热情并希望用技术改善生活；有自信心愿意挑战自己的极限，并在不断试错中前进。,"移动互联网,企业服务",15-50人,java,上海
Java开发工程师,https://www.lagou.com/jobs/7101065.html,浦东新区,20k-40k,支付宝（杭州）信息技术有限公司,3-5年,本科,蚂蚁金服 期权 互联网金融 阿里巴巴,"支付宝财富技术部招聘技术人才，参与余额宝、定期理财相关开发，欢迎投递简历。岗位要求:1、本科以上，从事java开发3年以上,最好有移动互联网服务端开发经验；2、对Java面向对象软件结构有深入理解以及很强的应用能力；3、熟悉java web开发，熟练掌握Spring、iBatis、struts等开源框架，熟悉各种常用设计模式，熟练使用MySQL；4、对技术有强烈的兴趣，喜欢钻研，具有良好的学习能力，沟通技能，团队合作能力；","金融,移动互联网",2000人以上,java,上海
java开发工程师,https://www.lagou.com/jobs/6970966.html,浦东新区,15k-25k,上海华钦信息科技股份有限公司,3-5年,本科,十三薪，六险一金，加班补助,1.3年Java开发工作经验，本科及以上学历2.精通Java后端，对Java前端技术也要熟悉，熟悉SpringMVC，有一定的写代码的能力。3.精通SSH 框架，J2EE4.有较强的分析能力和定位问题的能力，有责任心，做事严谨，有良好的沟通，团队协作意识及多任务协调能力；5.英语听说读写良好,"企业服务,金融",2000人以上,java,上海
java开发工程师,https://www.lagou.com/jobs/6971729.html,浦东新区,8k-11k,上海仁维软件有限公司,1-3年,本科,年底双薪、定期体检,1、计算机相关专业本科及以上学历2、2年及以上JAVA工作经验（有上海本地工作经验者优先）3、具有良好的编码习惯，具备扎实的程序代码基本功和学习能力4、精通Java语言、熟练掌握主流开源应用框架，如：Spring、SpringMVC、Hibernate、JSP/Servlet、JDBC、XML等技术架构5、熟练使用Weblogic等中间件 6、熟练掌握Linux的基本命令 7、熟练使用Oracle等主流数据库8、具有良好的沟通能力，能协助项目经理工作9、有团队协作精神及独立解决问题能力10、有ODM规则引擎经验者优先 11、有保险行业经验者优先,金融,150-500人,java,上海
java高级开发工程师,https://www.lagou.com/jobs/5213193.html,虹口区,11k-17k,上海铠射信息科技有限公司,3-5年,本科,"软件工程师,周末双休,带薪年假,五险一金","岗位职责：1. 负责系统概要设计工作；2. 根据需求独立完成所分配模块和组件的定义，设计和编码实现工作；3. 书写包括设计文档，用户手册在内的相关技术文档，满足公司的技术管理流程要求；4. 参与开发经理安排的评审和项目管理类活动；5. 技术攻关及系统主要功能编码实现；6. 负责初级技术人员的开发技术指导工作；7. 确保交付的代码能够遵循公司的标准和流程规范。任职要求：1. 计算机相关专业本科或以上学历；2. 3年以上基于B/S的大型WEB应用系统开发经验，能独立和协同进行系统设计，能够解决开发中常见问题并进行技术攻关；3. 精通Java编程，熟练掌握常用的J2EE框架、DB2/Oracle等主流数据库的分析设计和调优，能够熟练运用各种设计模式及重构方法；4. 掌握系统性能与稳定性优化技术，熟练掌握基于关系数据库和非关系数据库的设计和优化应用，熟悉主流的WEB服务器配置及优化；有高性能多并发访问后台程序项目经验优先；5. 熟悉UML，有较好的文档撰写能力及良好的编码习惯和风格；6. 具有良好的沟通能力、较强的团队协作精神和高度的责任心,做事积极主动，敢于挑战勇于创新，有较强的业务感知力和理解能力。公司福利：1、员工活动：公司不定期组织丰富多彩的休闲活动，让同事间彼此增进联系，互帮互助。2、年度旅游：定期组织年度旅游活动，让工作有意外惊喜，让生活更有乐趣。3、各项福利：公司提供免费节假日福利（礼品/礼金）、日常免费下午茶，年度优秀员工奖金，部门活动经费，深入员工工作生活的方方面面。4、公司正处于快速发展阶段，只要您有能力，公司定会给与您升职的机会。5、公司办公环境轻松舒适，位于快速公交沿线，交通便捷。","移动互联网,信息安全",15-50人,java,上海
java开发工程师,https://www.lagou.com/jobs/7203885.html,静安区,12k-20k,上海乐蜀网络科技股份有限公司,3-5年,大专,带薪年假 团队氛围好 发展空间 项目奖金,"岗位职责：1、根据产品需要进行Java服务器端开发工作2、能独立完成项目的系统分析和设计，确保项目的进度和质量；3、能够通过CodeReview提供相关性能以及安全的建议；4、维护和升级现有系统，快速定位并修复缺陷；岗位要求：1、3年以上的J2EE应用开发经验,对主流开发框架,如Spring、SpringMVC、Mybatis、SpringBoot等有全面的了解和掌握2、精通MySQL、Oracle等常用关系数据库开发，能针对项目特性设计性能较优的数据库结构3、具有RESTful、Netty、Mina、RPC等的使用及开发经验4、能独立完成功能模块的研发和编码,具有良好的代码风格、安全意识、代码洁癖5、熟悉常用的分布式缓存及消息队列技术，如Memcached、Redis等，并运用于实际环境的优先考虑6、熟悉相关负载代理软件，如Nginx、HAproxy、F5等，了解集群高可用HA等技术优先考虑7、熟悉postgreSQL或pipelineDB或GreenPlum优先、学习过shardingJDBC源码优先8、熟练使用maven\git\svn\jenkins，熟悉大数据相关的开发优先考虑",游戏,150-500人,java,上海
基础技术部 -后端java开发工程师,https://www.lagou.com/jobs/7082709.html,长宁区,25k-45k,北京三快在线科技有限公司,3-5年,本科,团队专业，发展快,,消费生活,2000人以上,java,上海
java工程师,https://www.lagou.com/jobs/6267081.html,黄浦区,9k-18k,上海海万信息科技股份有限公司,3-5年,本科,"旅游,体检,过节费,年终奖",职责要求：1、参与与产品经理、需求分析关于需求实现的讨论与工作量评估；2、依工作计划完成互联网软件系统的设计、开发、单元测试；3、协助架构师完善系统平台架构；4、制定合理的工作计划，并在执行过程中管理风险。岗位技能要求：1.本科及以上学历，计算机相关专业，3年以上工作经验；2.熟练掌握Springboot微服务开发经验，熟悉MVC编程模式；3. 对设计模式，多线程，JVM，分布式常用技术有深入理解，有实际性能优化经验；4. 熟练掌握主流开源框架、中间件、分布式技术栈的设计思想和原理，理解其优缺点和适用场景；5.具有较强的学习能力，能适应较大的工作压力，具备良好的团队精神和敬业精神。,"移动互联网,金融",500-2000人,java,上海
Java开发工程师,https://www.lagou.com/jobs/7041667.html,浦东新区,12k-18k,上海华钦信息科技股份有限公司,3-5年,本科,13薪 六险一金,"2年以上Java开发经验，大专，本科真是可查学历熟悉springboot，springcloud，Dubbo等有汽车金融项目，银行，贷款项目优先考虑1、有2年以上的Java框架应用经验，比如SpringBoot, MyBatis等，熟悉Spring原理;2、项目会运用到Redis、Mongodb、MQ等，并具有实际使用经验，具有分布式应用架构（SOA、异步化）经验者优先。3、项目会运用到微服务架构和实现技术，有SpringCloud、Dubbo等业务经验的加分考虑；4、具有2年以上编程基础（ 比如熟悉HTTP、多线程、Socket、JVM、基本的数据结构和算法等）；5、熟知MySQL或Oracle等至少一种关系型数据库，并知道相关的数据库调优技巧；6、具有较强的面向对象设计能力和业务分析抽象能力，常见设计模式7、具有两年以上后端开发的经验8、良好的编码习惯和技术文档编写能力。9、至少2年以上使用GIT做版本管理的经验","数据服务,金融",500-2000人,java,上海
高级Java开发工程师,https://www.lagou.com/jobs/5148518.html,浦东新区,10k-20k,上海海万信息科技股份有限公司,3-5年,本科,"五险一金,过节福利,生日礼金,旅游、体检",岗位职责：1、负责金融产品的模块设计、参与系统的架构设计；2、负责程序编码、自测、联调；负责产品的缺陷修复；3、负责编写设计文档、流程图等技术文档；4、负责系统的架构优化、性能优化、代码质量优化等。岗位要求：1、本科以上学历，3年以上Java编程经验；2、精通JAVA编程，能够熟练应用Spring、MyBatis等主流开发框架和技术；3、熟悉微服务架构，熟悉spring cloud相关技术者优先；4、熟悉MySQL、sql server、oracle数据库应用，掌握数据库优化者优先；5、较强的自我学习能力和分析解决问题的能力，具备良好的文档编制习惯和代码书写规范；6、强烈的责任心与团队合作能力。,"移动互联网,金融",500-2000人,java,上海
java开发工程师,https://www.lagou.com/jobs/5561895.html,浦东新区,15k-25k,上海华钦信息科技股份有限公司,3-5年,本科,环境好 工作轻松,"Must be familiar with Core JavaMust be familiar with Java EE technologiesMust be familiar with one of the modern IoC, OR-Mapping frameworks (prefer Spring/Guice, Hiberate 3)Must be familiar with DB concepts and SQL commandsMust be familiar with no SQL DB(prefer to Elasticsearch DB)Must be familiar with one of the modern MVC framework","数据服务,金融",500-2000人,java,上海
基础技术部-Java工程师-分布式通信,https://www.lagou.com/jobs/6907807.html,长宁区,28k-55k,北京三快在线科技有限公司,3-5年,本科,发展前景,,消费生活,2000人以上,java,上海
