job_name,job_url,job_location,job_salary,job_company,job_experience,job_class,job_given,job_detail,company_type,company_person,search_key,city
大数据开发工程师,https://www.lagou.com/jobs/4777416.html,武侯区,8k-16k,四川华南信息产业股份有限公司,3-5年,本科,"五险一金,带薪年假,晋升空间","岗位职责： 1.基于公司自主研发的大数据平台产品、典型以及开源的数仓系统，为企业级客户提供数据工程服务，包括数据建模、数据接入、数据集成和数据治理等工作。  2.基于大数据平台和数据仓库系统的数据建模，ETL设计、开发与维护，进行数据抽取、清洗、转换、集成，最后加载到大数据平台/数据仓库中等工作。   3.积极了解公司业务，为上层应用团队提供数据可视化支持。任职要求：   1.有数据库和数据仓库设计基础，有关系数据库建模和数据仓库系统的工作经验； 2.熟练使用SQL和数据库，如Oracle, MySQL,PostgreSQL中的一种或多种；3.熟悉Linux操作系统，熟练脚本语言和SQL，熟悉常用的ETL工具；  4.了解Hadoop生态，了解Hive/hbase/HDFS/MapReduce/Greenplum/spark/scala等系统；熟悉ElasticSearch，能根据业务进行定制；5.有数据仓库或数据分析项目参与经验；有使用过报表工具，如Cognos,FineBI、Echart或其它；6.了解如何建立报表需要的宽表和汇总表;熟悉常用的固定报表、交叉报表、各种图表的制作等7.踏实，工作认真负责，积极主动，良好的沟通和分析解决问题的能力，可以根据项目需要出差。优先条件:    1.有数据仓库系统的实施经验，包括但不限于在TB以上多种数据集上ETL、系统间数据对接、维度建模、报告和分析展示等经验；2.熟悉Hadoop生态的开源项目，有使用主流Hadoop生态产品处理过TB以上数据的经验；    3.有整合和处理不同来源数据，编写复杂的查询且保证展示系统流畅运行的经验；4.有公安、交通、社保行业Flink/Greenplum/ClickHouse实际开发经验者优先","数据服务,移动互联网",150-500人,hadoop,成都
大数据开发经理,https://www.lagou.com/jobs/7204528.html,武侯区,13k-18k,中通服创立信息科技有限责任公司,3-5年,本科,Java、Hadoop、,岗位职责：1、负责公司大数据平台系统架构设计、核心开发工作（Hadoop生态圈），基于业务场景设计最优的系统解决方案。2、构架支持超大数量级的数据的大数据平台系统，及相关监控，拓展系统设计及实现。3、利用Hadoop、Spark、Flink等大数据技术对海量数据进行处理，支持建模（算法）的工程化实现，实现可视化BI分析。4、对现有系统的进行架构深入分析及系统优化，进一步提升系统的性能及数据处理能力。5、了解机器学习等技术进行数据分析及建模的方案的系统化设计，跟进数据挖掘项目的架构设计工作。任职要求：1、统招本科或以上学历，计算机相关专业， 2年以上大数据项目经验、3年以上管理经验。2、Java基础与算法功底扎实，精通面向对象分析、具备丰富的系统架构设计(J2EE)经验。3、具备较丰富的大数据平台相关构建，维护及调优经验，有超大数据量级下的大数据集市相关经验。4、具备较丰富的基于Hadoop生态圈的大数据处理项目经验，熟悉数仓分层搭建，熟悉HDFS、Hive、Spark、Flink、Kafka、Hbase、ES等大数据组件的使用和调优，具备一定的数据挖掘经验。5、具有良好的业务理解、沟通和协作能力，具有较强的学习和总结能力。,"移动互联网,硬件",500-2000人,hadoop,成都
大数据平台-高级 Java 开发工程师,https://www.lagou.com/jobs/6820034.html,高新区,12k-18k,成都聚思力信息技术有限公司,3-5年,本科,六险一金 带薪年假 餐补 车补,岗位职责：1.负责数据采集平台的web应用开发2.负责数据服务平台的web应用开发3.负责大数据平台中其它应用层程序的开发任职资格：1.计算机相关专业本科或以上学历；3 年以上Java 开发经验；2.JAVA基础扎实，精通io、多线程、集合等基础框架，精通 JVM ，垃圾回收算法， 有线上调优经验；3.精通 Spring，springboot等框架；4.有前端开发经验，熟悉 react，vue 等主流前端框架；5.精通数据库设计，熟悉至少一种主流 RDBMS 数据库，熟悉 Redis 或其他分布式 k-v 数据库6.熟悉junit、TestNG，ant、maven，svn、git等相关工具的使用；7.具有容器化经验或消息中间件开发经验者优先。8.了解大数据组件如 zk，kafka，spark，hive，elasticsearch 者优先9.有 Python 开发经验者优先,"移动互联网,电商",500-2000人,hadoop,成都
数据库开发工程师（oracle）,https://www.lagou.com/jobs/6434553.html,锦江区,8k-15k,四川商通实业有限公司,1-3年,大专,互联网支付行业 地铁口 五险一金,工作内容：1、开发和维护基于Oracle关系型数据库的应用系统以支持公司的业务发展；2、根据业务需求，独立完成项目计划和项目开发设计书，并完成具体、详细的程序设计方案；3、对复杂的业务模型进行准确、高效的程序设计开发工作；4、建立测试环境，进行相关开发的程序测试工作；5、完成相关的开发及测试文档。职位要求： 1、具有1年及以上ORACLE数据库开发相关工作经验；2、深刻理解Oracle数据库原理，能够熟练进行PL/SQL开发及性能调优；3 、具有较强学习和理解能力、一定的系统分析能力、独立解决问题的能力；4、高度的责任感，较强的适应能力，团队合作精神；5、具有良好的沟通技能，喜欢钻研；6、有支付行业工作经验优先。上班时间：9:00~12:00  13:30 ~17:30  周末双休福利：1、舒适的办公环境；2、五险一金；3、各类节日福利+生日福利+年终奖；4、国家法定节假日+5天带薪年假；5、员工的宝宝可享受生日礼金+学前教育成长基金+初中教育成长基金；6、享受与公司合作商户推出的各种线上线下优惠活动。,电商,150-500人,hadoop,成都
Oracle数据开发工程师,https://www.lagou.com/jobs/7142863.html,锦江区,8k-15k,四川商通实业有限公司,1-3年,大专,互联网支付行业 地铁口 五险一金,工作内容：1、开发和维护基于Oracle关系型数据库的应用系统以支持公司的业务发展；2、根据业务需求，独立完成项目计划和项目开发设计书，并完成具体、详细的程序设计方案；3、对复杂的业务模型进行准确、高效的程序设计开发工作；4、建立测试环境，进行相关开发的程序测试工作；5、完成相关的开发及测试文档。职位要求： 1、具有1年及以上ORACLE数据库开发相关工作经验；2、深刻理解Oracle数据库原理，能够熟练进行PL/SQL开发及性能调优；3 、具有较强学习和理解能力、一定的系统分析能力、独立解决问题的能力；4、高度的责任感，较强的适应能力，团队合作精神；5、具有良好的沟通技能，喜欢钻研；6、有支付行业工作经验优先。上班时间：9:00~12:00  13:30 ~17:30  周末双休福利：1、舒适的办公环境；2、五险一金；3、各类节日福利+生日福利+年终奖；4、国家法定节假日+5天带薪年假；5、员工的宝宝可享受生日礼金+学前教育成长基金+初中教育成长基金；6、享受与公司合作商户推出的各种线上线下优惠活动。,电商,150-500人,hadoop,成都
大数据开发工程师,https://www.lagou.com/jobs/5963238.html,高新区,15k-30k,成都娄外科技有限公司,5-10年,不限,牛人众多，产品靠谱，扁平结构，成长快速,你来做什么1、负责基于Hadoop/Spark平台架构的开发、设计和布局 ；2、完成系统框架的设计和核心代码的编写； 3、针对海量的用户行为数据进行统计、分析与挖掘，不断提高系统运行效率； 4、负责对数据进行分析，为项目组提供大数据技术指导及分析手段支撑； 5、负责大数据平台的性能监控和持续优化；针对需求提供大数据分析技术解决方案 ；6、大数据平台的运维工作，持续完善大数据平台，保证稳定性、安全性。 我们需要你1、精通Hadoop大数据平台架构，具有扎实的Java/Python等开发语言；并可以开发高效可靠的代码；2、具有较强的数据分析、数据挖掘的能力；3、熟悉spark、Hive、storm等计算框架者优先，对分布式存储和计算原理有较深的理解； 4、严密的数学思维、突出的分析和归纳能力、优秀的沟通表达能； 5、个性开朗，对技术钻研好学、逻辑思维能力强，沟通能力优秀，有团队合作精神。,教育,150-500人,hadoop,成都
大数据开发工程师,https://www.lagou.com/jobs/7031268.html,高新区,15k-30k,成都娄外科技有限公司,不限,不限,快速成长，风口行业，大牛围绕,你来做什么1、负责标签库、标签服务体系等相关系统的设计与实现；2、参与数据管理体系的搭建、为数据质量的保障提供支撑；3、与业务需求方沟通并可协调上下游资源推进开发任务落地。我们需要你1、计算机及相关专业，3年以上java/大数据开发经验；2、熟悉Java或scala语言，具有扎实的实际编程经验。掌握Python或shell脚本编写；3、熟悉常用的开源组件：Hadoop/Hive/Spark/Flink/HBase/kafka，阅读过部分源码，能对其进行故障分析、性能调优；4、至少熟悉Impala、Kudu、ElasticSearch、Clickhouse其中之一，并了解其特性和使用场景，有标签开发经验者优先；5、具备良好的服务意识，善于主动思考，自我驱动力强。有良好的沟通、协调能力，富有团队精神，有较强的文档编写能力；6、具备一定的故障排查能力，有良好的技术敏感度和风险识别能力。,教育,150-500人,hadoop,成都
大数据开发工程师,https://www.lagou.com/jobs/6078553.html,锦江区,18k-30k,和美（深圳）信息技术股份有限公司,5-10年,不限,年终奖 补贴,1. 参与大数据项目建设，负责大规模集群架构、开发及运维2. 处理高并发数据请求问题3. 根据业务场景设计合适的技术栈完成业务需求任职要求：1. 计算机相关专业，本科及以上学历; 2. 有6年以上工作经验，其中大数据工作经验不低于4年，有2 年以上大数据平台架构和系统设计经验3. 编码能力强，问题解决能力4. 有Hive，SparkSQL，Sqoop，ElasticSearch，kafka，Hive，SparkStreaming或Flink，Java或Scala等开发经验和能力5. 精通SQL 语言，掌握Oracle、DB2、MySQL 等一种或多种数据库系统的使用,"金融,人工智能",500-2000人,hadoop,成都
大数据开发,https://www.lagou.com/jobs/6140542.html,高新区,13k-25k,成都方未科技有限公司,3-5年,本科,和公司一起分享成长的“蛋糕”,我们的要求：硬实力1. 3年以上大数据工作经验，需要掌握的基本技术和语言相信不用多说，你一定是精通的。2.能处理亿级数据灵活检索与聚合、亿级明细数据存储等问题，有图计算经验优先。3. 本科以上学历，计算机、数学相关专业软实力1. 不要玻璃心（能妥善处理工作中产生的一些负面情绪）2. 喜欢沟通，善于协作（能求助，及时暴露问题）3. 对自己有要求（随时都在思考有没有更好的解决方案）4. 勤于记录和复盘你要做的：1. 基于运营商数据，负责清洗、存储、处理、分析等场景的开发，完成高质量的代码编写。2. 构建各种算法模型2. 带新人3. 喜欢短暂体验各大城市的工作氛围（不介意出差）你能得到的：1. 还不错的薪资福利待遇（我们会把大多数利润作为绩效回馈给员工）2. 持续不断的挑战（每天都会有进步，真正的大数据环境）3. 有不少的优秀合作伙伴和你一起公司背景:我们是一家通信和互联网相结合的高科技公司，以移动大数据融合分析引擎为技术核心，构建全域覆盖的数据服务网络，实现在线、实时、真实的数据服务网络闭环分析处理。,数据服务,15-50人,hadoop,成都
大数据开发工程师,https://www.lagou.com/jobs/6300305.html,双流区,12k-24k,贵州海康交通大数据有限公司,3-5年,不限,"五险一金,团聚,欢乐,学习","岗位职责：1、负责大数据系统的设计、搭建、做开发计划排期及管理，负责产品核心功能的方案设计、编码实现及单元测试；2、对海量数据进行数据处理、分析、统计工作，编写相应的技术文档；3、负责技术难点攻关，快速定位及解决线上技术问题，持续对线上系统进行性能优化及稳定性提升，保障系统可用性、稳定性、和可扩展性；4、积极了解公司业务，为上层应用团队提供数据可视化支持；任职要求：1、本科以上学历，计算机、软件工程或相关专业，工作至少3年以上；2、熟悉Java/Scala开发，有脚本语言（shell,python)开发经验者优先；3、至少熟悉一种大数据处理栈技术，如Hadoop、Spark; 熟悉流计算应用开发，如spark streaming, flink;熟练掌握大数据生态各个工具的原理及使用，如hive, sqoop等4、掌握HBase、Redis、Elastic Search等开源大数据存储技术，并能结合不同的业务场景深入使用；5、熟悉storm，spark streaming，flink，beam至少一种6、熟悉kafka，flume，es等相关组件7、对解决具有挑战性的数据问题充满激情，具有良好的分析问题和解决问题的能力，能够胜任部分数据分析，挖掘，建模工作。8、此岗位可能会涉及出差。公司地址：兴隆湖","移动互联网,数据服务",50-150人,hadoop,成都
中级数据开发工程师,https://www.lagou.com/jobs/6562195.html,高新区,8k-15k,广州谷沃信息科技有限公司,3-5年,本科,入职购买五险一金，年终奖，节日金,工作职责1.负责业务系统数据源的调研分析，出具数据质量分析报告；2.负责数据类项目的数据模型管理工作（建模、Mapping设计、开发实施）；3.负责数据类项目的ETL设计及开发工作；4.协助对用户提出的BI类需求进行需求调研和分析，梳理报表、指标和维度信息；5.对业务需求从技术实现、业务模型、开发测试等方面进行综合分析，并进行系统原型设计，协助完成需求评估和计划；任职要求1.计算机/电子/数学类相关专业本科以上学历，3年以上工作经验；2.有保险行业BI项目开发实施经验，寿险优先、有监管类项目经验者优先；3. 2年以上ETL开发经验，有Data Mapping经验者优先；4.熟悉数据仓库各类建模理论，以及数据仓库数据层级关系，有维度建模的经验;5.熟悉至少一种大型数据库系统例如：Oracle、DB2等；熟悉SQL编程，有较好的SQL性能调优经验;6.具备良好的逻辑分析能力和系统思维能力，良好的团队沟通能力。,"金融,数据服务",15-50人,hadoop,成都
java开发工程师（医保大数据产品部）,https://www.lagou.com/jobs/6825552.html,锦江区,6k-10k,四川久远银海软件股份有限公司,1-3年,本科,五险一金、每年调薪、定期体检、每年旅行,岗位技能要求1.计算机相关专业，全日制本科及以上学历；2.java基础知识扎实，包括多线程、集合、缓存、消息队列、全文搜索等；3.熟悉主流开源框架技术，包括Struts2、Spring 、SpringBoot、Hibernate、iBatis、MyBatis、Dubbo等，并对其架构设计及实现有一定了解；4.了解前端技术，包括JS、JQuery、HTML、CSS，熟悉JQuery、HTML5、Vuejs优先；5.了解Tomcat、Weblogic等应用服务器和中间件的使用，熟悉Linux系统使用者优先；6.了解MySQL、Oracle等关系型数据库的设计开发；7.有强烈的团队合作意识；8.有良好的代码开发习惯；9.学习能力强，具备良好的问题分析和解决能力，愿意并致力于新技术研究；10.沟通交流能力强，乐于分享，良好的团队合作精神。11.有医保行业相关开发经验优先岗位工作职责1、掌握公司开发平台，按照设计编写功能模块并进行单元测试2、参与医疗保险行业内相关产品研发3、支撑产品的落地实施工作,"移动互联网,硬件",2000人以上,hadoop,成都
java开发工程师（数据产品方向）,https://www.lagou.com/jobs/6820666.html,武侯区,15k-30k,多点生活（成都）科技有限公司,3-5年,本科,高速增长公司，氛围宽松,岗位职责：1、负责并参与大型数据系统建设、数据集市建设、以及开发核心报表等数据业务系统研发；2、负责并参与新零售领域数据相关系统架构设计、技术选型、开发、优化、重构，根据业务规划制定技术实现方案；3、主要研发方向：舆情系统、智能化舆情处理、其他数据应用类系统。岗位要求：1、人靠谱，责任心强，有自信；2、充满好奇心，热爱技术，享受coding，学习能力强，有代码洁癖；3、3 年以上 java工作经验，java基础扎实，熟悉io、多线程，熟悉分布式、缓存、消息机制、jvm调优等；4、熟悉Dubbo、MQ、spring boot、Mybatis、Redis、ElasticSearch、zookeeper等常用技术，在某一技术领域有较深入研究；5、项目经验丰富，对业务有良好理解；6、对数据有足够的敏感度，具备必要的产品意识，对互联网产品有良好的感觉。加分项有大型分布式、电商系统/超市系统研发经验。了解一定的大数据技术（如Hadoop、Hive、Impala、HBase、Spark、Storm、Kafka、Kylin、Kudu、ES等之一）,"电商,消费生活",500-2000人,hadoop,成都
数据开发工程师,https://www.lagou.com/jobs/6460236.html,高新区,12k-22k,多点生活（成都）科技有限公司,3-5年,本科,新零售行业，发展非常有潜力的品牌业务,"职位描述：1、基于公司大数据平台，设计大数据相关项目的技术方案；2、负责数据调研、数据接入、数据建模、数据清洗、数据映射、数据可视化等工作；3、负责对数据进行分析，为项目组提供大数据技术指导及分析手段支撑，BI报表输出；4、负责大数据平台的性能监控和持续优化；5、针对需求提供大数据分析技术解决方案；任职要求：1、本科及以上学历，3年以上工作经验，活跃、严谨的思维，理解能力强，交流沟通无障碍；2、熟练使用数仓、大数据工具，熟练使用SQL，熟悉Python或Java；3、熟悉mysql，mongodb，hive, spark, impala, kylin, ETL等技术，能独立承担报表设计和开发工作；4、良好的数据敏感度，能从海量数据提炼核心结果；有丰富的数据分析、挖掘、清洗和建模的经验；5、丰富的BI指标体系建设经验；","电商,消费生活",500-2000人,hadoop,成都
中级大数据技术开发,https://www.lagou.com/jobs/7061504.html,武侯区,10k-15k,广州市邦富软件有限公司,3-5年,本科,薪资待遇高，广阔的发展前景,"岗位职责：1、负责部门相关产品和项目大数据技术支撑以及相关大数据产品配置研发工作；2、负责开源大数据平台（Hadoop/HDP/CDH）及其组件的部署、配置、调试、优化；3、负责基于开源大数据平台的整合和二次开发工作；4、负责大数据相关项目的设计和开发工作，例如存储系统数据结构或存储结构设计，分布式计算框架相关计算任务代码开发等任职要求：1、全日制本科及以上学历，985、211优先，计算机应用技术、大数据算法等相关专业优先，特别优秀者可放宽； 2、2年以上大数据开发经验，3年以上后端开发经验；3、要求熟练掌握Hadoop大数据平台及生态圈相关组件使用及原理（例如HBase、Hive、Zookeeper、Spark、Kafka、Sqoop、Oozie、Ambari、Ranger、falcon等），熟悉基于Hadoop的HDP或CDH大数据平台者优先；4、熟练使用MapReduce, Spark, Spark Streaming等分布式计算框架进行实时或离线计算任务开发，调优；5、熟悉HDFS、HBase、Hive、Apache Livy等组件client接口及客户端开发者、有大数据平台或相关组件二次开发经验、或大数据相关开源软件经验者优先；6、熟悉Neo4j、JanusGraph、SparkX、Pregel等图谱相关技术可作为加分项",数据服务,150-500人,hadoop,成都
大数据开发工程师,https://www.lagou.com/jobs/6863989.html,高新区,25k-45k,华为技术有限公司,1-3年,本科,领先业界的薪酬待遇、广阔的发展前景,1、 计算机或者数学相关专业本科以上学历，3年以上工作经验；2、熟悉数据架构设计和治理分析；熟悉计算机的基础理论，扎实的编程能力；3、熟悉hadoop、spark、ElasticSearch、redis、kafka、MariaDB、mongodb等大数据相关技术；4、扎实的java编程基础，对各种开源的框架如Spring、mybatis、spring boot、spring cloud、dubbo等有深入的了解，对框架本身有过开发或重构者可优先考虑；5、具有大规模高并发web应用设计和开发经验优先；6、熟悉docker、kubernetes、mesos、rancher等容器技术并有实际使用经验者优先考虑；7、工作地：成都。,通讯电子,2000人以上,hadoop,成都
数据开发工程师,https://www.lagou.com/jobs/6976168.html,高新区,8k-15k,成都微银合创科技有限公司,3-5年,不限,金融大数据 企业级项目 充分发展空间,"技能要求：IMPALA，Spark，Python，DB2，Oracle，MySQL职位描述：1、基于公司大数据平台，设计大数据相关项目的技术方案；2、负责数据调研、数据接入、数据建模、数据清洗、数据映射、数据可视化等工作；3、负责对数据进行分析，为项目组提供大数据技术指导及分析手段支撑，BI报表输出；4、负责大数据平台的性能监控和持续优化；5、针对需求提供大数据分析技术解决方案；任职要求：1、本科及以上学历，3年以上工作经验，活跃、严谨的思维，理解能力强，交流沟通无障碍；2、熟练使用数仓、大数据工具，熟练使用SQL，熟悉Python或Java；3、熟悉oracle，db2，hive, spark, impala, kylin, ETL等技术，能独立承担报表设计和开发工作；4、良好的数据敏感度，能从海量数据提炼核心结果；有丰富的数据分析、挖掘、清洗和建模的经验；5、熟悉银行业务, 丰富的BI指标体系建设经验","企业服务,金融",15-50人,hadoop,成都
数据库开发工程师,https://www.lagou.com/jobs/7149589.html,郫县,10k-13k,上海开奈电子通讯有限公司,1-3年,不限,技术大牛 工作氛围人性化,任职资格：1、计算机相关专业，2年以上数据库开发经验；2、熟练掌握oracle、sqlserver数据库；3、实习linux常用命令、shell开发；4、学习能力强，具有独立工作的能力，良好团队协作及沟通表达能力。核心技能要求：数据库： 常用数据库(MySQL/Oracle/GP) 熟练软件部署： Linux-操作命令，Shell脚本 熟练,"移动互联网,消费生活",150-500人,hadoop,成都
大数据开发工程师,https://www.lagou.com/jobs/6717975.html,武侯区,8k-15k,四川恩阶魔数据技术有限公司,3-5年,本科,hadoop,岗位职责：1、负责公司业务场景基于大数据平台的技术选型，主导过大型数据平台建设者优先；2、负责公司业务场景数据模型设计；3、负责基于大数据平台Hive、Impala、Hbase和Spark设计和优化；4、负责ES、图数据库等建设。5、将开源社区新技术用于项目实践，具有修改源码的能力。6、负责公司项目、产品的研发。 岗位要求：1、了解微服务开发理念、实现技术，熟悉常见设计模式，熟练掌握SSH开发框架，熟练进行Java、Python代码编写，熟悉多线程编程；2、熟练掌握Hadoop及Map-Reduce应用开发，熟练掌握HBase、Hive、Storm、spark等大数据开发工具中一种或几种；3、熟悉Linux/unix系统，具备shell、python、scala等脚本开发能力；4、学习能力强，喜欢研究开源社区新技术，有团队观念，具备独立解决问题的能力；5、熟悉数据仓库理论，具备复杂业务需求梳理能力；6、良好的团队精神，较强的学习能力和欲望，强烈的责任心，独立解决问题能力。7、具有较强的业务需求分析能力、问题定位和沟通表达能力;8、具备较强的学习能力和主动性，有良好的时间和流程意识。福利待遇：年终奖、生日礼物、体检、团队建设、五险一金、重大节日慰问、****,数据服务,15-50人,hadoop,成都
