job_name,job_url,job_location,job_salary,job_company,job_experience,job_class,job_given,job_detail,company_type,company_person,search_key,city
Staff 软件工程师大数据,https://www.lagou.com/jobs/7100809.html,江宁区,40k-44k,思杰系统信息技术（北京）有限公司南京分公司,10年以上,本科,双休，五险一金公司缴纳,"What we are looking for?You are a seasoned software engineer who designs, develops, troubleshoots and debugs complex software applications, demonstrating for others how to resolve issues in innovative and practical ways.You are passionate on developing a big data platform and tools for big data ingestion, processing, and analytics.Position OverviewCitrix Analytics Platform team builds and maintains the data platform for Citrix Analytics Service, which aggregates data across users, devices, networks, applications, and files and generates actionable insights for Citrix customers.In this role, you will work on a team of talented engineers responsible for designing, developing, optimizing and extending the Citrix Analytics big data platform.Responsibilities ·      Design, develop, and maintain the Citrix Analytics platform·      Extend the Citrix Analytics platform by researching and applying new big data technologies and stacks to solve business problems·      Maintain the Citrix analytics platform by diagnosing, predicting and correcting scaling problems·      Contribute to our team’s growing set of development platforms, tools, and processes·      Build automation and tools that will increase the productivity of teams located in different locations·      Provide input and feedback to teams regarding decisions surrounding topics such as infrastructure, data architectures, and DevOps/SRE strategy·      Support and provide guidance to the company’s software engineering processes and standards·      Pursue and encourage others to acquire information and training regarding trends and advancements within area of specialization, incorporating these improvements where applicableBasic Requirements·      Bachelor’s degree or equivalent in computer science, electrical engineering, or related field is preferred, with a minimum of 8 years of directly related work experience·      Strong CS fundamentals, data structures, algorithms with good understanding of big data·      Familiar with SQL and MS SQLServer, fluent in database specific programming language (T-SQL)·      Hands-on experience in relational databases and NO-SQL databases·      Hands-on experience in designing and implementing data ingestion and transformation for big data platforms (Hadoop, Spark, kafka, storm etc.)·      Ability to design data models, monitor and debug issue and tuning performance Preferred qualifications·      Understand database design principal is a plus·      Experience of working on development and delivery of products based on Cloud Services (Azure, AWS) is a strong plus·      Machine Learning experience is a strong plus·      Highly parallelized data ingestion and transformation jobs in Spark including Spark Streaming is a strong plus·      Capability of using multiple programming languages (python, Java, JavaScript, Node, Scala, etc.) is a plus·      Security knowledge and experience is a plus·      Experience with using automation tools (Ansible, Puppet, Chef) and DevOps tools (Jenkins, Travis-CI, Gitlab CI) is a plus·      Strong communication (verbal and written, Chinese and English) and interpersonal skill·       Drive to stay abreast of new technologies",数据服务,500-2000人,大数据,南京
资深数据开发工程师 (MJ001161),https://www.lagou.com/jobs/6132551.html,雨花台区,25k-50k,广州希音供应链管理有限公司,5-10年,本科,薪资待遇好，平台广阔，独角兽企业,岗位职责：1.负责数据仓库架构设计；2.负责数仓模型业务模型规划，基于业务规划落地数仓域数据模型；3.负责数仓模型设计和管理，管控数仓模型设计方法。任职要求：1.5年以上数据仓库开发实施经验，具备大中型数据仓库架构设计、模型设计、ETL设计的相关经验；2.有一个以上企业级数据仓库项目设计经验，精通数据仓库架构，熟悉数据仓库项目的实施流程，具备零售行业数据仓库项目实施经验者优先；3.掌握多维分析相关技术和OLAP前端展现工具，熟悉大数据hadoop、hive、spark、storm、hbase、kylin、druid等相关技术特性；4.熟悉数据质量、元数据管理、数据安全管理；5.良好的沟通能力和协调能力，出色的团队合作精神；6.工作积极、有较强的责任心，抗压能力强。,"电商,移动互联网",2000人以上,大数据,南京
大数据销售经理,https://www.lagou.com/jobs/5744247.html,建邺区,10k-20k,江苏新华烽火数据技术有限公司,1-3年,大专,职位发展通道由大咖缔造！,"岗位职责：1、负责数据产品和服务销售，完成销售指标;2、与客户进行沟通，宣传和推广数据产品解决方案；3、参与市场销售活动策划及执行，开拓传媒行业市场，与有意向的客户达成合作；4、负责现有客户的关系维护，寻找新的销售机会；任职要求：1、专科以上学历，传媒或市场营销专业优先；2、熟悉媒体行业，在媒体行业工作2年以上或为其服务1年以上者优先；3、执行力强，有较强的销售能力，具有SaaS产品销售经验优先；4、优秀的语言表达沟通能力，有进行产品服务的宣讲能力；5、熟练操作EXCEL等办公软件；6、 有团队合作精神,能承受压力,有开拓创新精神。","移动互联网,数据服务",15-50人,大数据,南京
数据开发工程师 (MJ001211),https://www.lagou.com/jobs/6191985.html,雨花台区,12k-16k,广州希音供应链管理有限公司,应届毕业生,本科,五险一金、扁平管理、技术大牛,岗位职责：1)、负责数据应用开发支持；2)、负责公共层数据开发支持，及数据平台建设；岗位要求：1)、2020年毕业的国家统招本科以上学历，计算机相关专业； 2)、掌握数据结构与算法，有java或scala研发经验；理解基本的设计模式，能将业务需求快速理解成技术需求；3)、至少熟悉使用一种脚本语言shell或python；4)、熟悉Hadoop架构和工作原理，MapReduce编程；熟悉Hive，有HQL优化经验优先；5)、熟练掌握spark及spark streaming开发，有实际项目研发经验更佳；6)、有其他数据研发相关工具经验优先，例如HBase、Kylin、ES、Kudu、Redis。,"电商,移动互联网",2000人以上,大数据,南京
软件开发工程师（数据库）,https://www.lagou.com/jobs/6318502.html,江宁区,15k-30k,南京新联电子股份有限公司,3-5年,本科,五险一金 年终奖金 定期体检,"技能要求：数据库，MySQL，嵌入式工作技能/工作经验1.计算机、自动化、电子相关专业本科以上学历,3年以上数据库设计、开发经验。2.熟悉数据库的基础理论，精通Oracle/Mysql/SQLITE3/等数据库管理系统，具备SQLITE3数据库的设计开发能力，精通SQL语句和性能优化；3.具有嵌入式数据库开发经验优先；4.熟悉Unix/Linux操作系统,能熟练使用常用的命令；5.有数据库高负载高并发系统设计开发经验者优先；6.善于思考，主动积极，沟通能力强，有良好的团队精神，能够承担压力。","移动互联网,其他",500-2000人,大数据,南京
数据应用开发工程师（中国制造网）,https://www.lagou.com/jobs/7076474.html,浦口区,12k-16k,焦点科技股份有限公司,3-5年,本科,六险一金、上市公司、包吃包住、免费班车,岗位职责：1、负责数据清洗、加工、分类、展示等开发工作，保证数据质量；2、在大数据平台基础上，负责业务的数据应用开发和运维工作；3、配合横向大数据团队完成纵向业务的数仓升级。岗位要求：1、计算机、数学等相关专业本科及以上学历，具备互联网业务背景或相关工作经验优先；2、熟悉Java或Scala编程，有2年以上的工作经验，有实际大数据处理经验；  3、熟练掌握Hadoop、Hive、Spark、Hbase等一种以上大数据处理技术； 4、熟悉Oracle数据库，熟练使用Linux及Shell编程； 5、有Web开发、报表展示开发经验的优先； 6、具备良好的学习能力，团队合作和沟通能力。,电商,2000人以上,大数据,南京
数据库开发工程师,https://www.lagou.com/jobs/6249970.html,建邺区,15k-25k,南京轨道交通系统工程有限公司,3-5年,本科,轨道交通综合监控平台，自研发项目,"主要工作职责：
 轨道交通综合监控的实时库或历史库开发工作；
 参与综合监控系统的需求分析和模块设计；
 负责完成相关模块的编码和单元测试；
 完成客户端、服务端等模块的测试；
 负责有关技术方案、文档的编写；
 根据项目具体要求，承担开发任务，按计划完成任务目标；
专业经验和要求：
 有轨道交通自动化系统开发经验或者类似的工业监控平台开发经验优先；
 计算机、自动化、通信等相关专业本科及以上学历；
 精通C\C++编程，三年以上C++开发经验；
 熟悉Redis、FastDB、SQLite等开源实时库或者Oracle、Mysql等商用关系数据库；
 熟悉WINDOWS、LINUX、UNIX操作系统，具备跨平台开发经验；
 熟悉设计模式、多线程技术优先；
 有团队开发经验，具有团队协作精神和良好的与人交流能力；","物流丨运输,软件开发",150-500人,大数据,南京
java开发、C++开发、python、数据库,https://www.lagou.com/jobs/4139441.html,秦淮区,10k-20k,南京电子工程研究所（中国电子科技集团公司第二十八研究所）,1-3年,硕士,"平台好,项目好,福利待遇好",至少熟悉一种主流操作系统，至少熟练掌握C++、JAVA等任一种开发语言；有实际工作经验者优先。,"移动互联网,信息安全",2000人以上,大数据,南京
数据开发工程师（BI方向/Java后端）,https://www.lagou.com/jobs/7169832.html,江宁区,13k-16k,江苏景枫投资控股集团有限公司,5-10年,本科,五险一金,岗位职责：1. 负责业务数据的采集、同步、清洗、建模、钻取、展示等相关工作；2. 负责数据采集分析系统的需求、分析、设计、开发、测试和上线，满足公司业务运营和管理的数据分析需求;3. 参与公司数据采集分析平台和大数据平台的规划设计；4. 按规范要求编写代码，保证自己负责的产品持续敏捷开发，并保证线上稳定运行；5. 编写研发过程中产生的规范化文档/接口文档等。 任职要求：1. 本科及以上学历，计算机或相关专业，五年以上JAVA后端开发、数据分析及报表展示应用程序的开发经验，优秀的编程能力；2. 熟悉数据产品的全周期，覆盖数据产生、清洗、传输、建模、统计、聚合、查询、归因、可视化的全流程；3. 熟练掌握 Java 及面向对象设计开发，精通主流的数据库（包含MySQL、Oracle），精通使用SQL语句对大量数据记录进行分析、整理和查询；4. 精通数据分析及建模，熟练使用MySQL存储过程及SQL组合查询进行数据的钻取，掌握数据库优化技术；熟悉Echarts等开源图表库进行图表展示开发更佳；5. 良好的学习能力，能够快速学习一门新技术并实践；6. 沟通能力好、责任心强，能承受较大的工作压力，具有良好的团队合作精神和敬业精神。,"房产家居,软件开发",500-2000人,大数据,南京
数据分析与报表开发实习,https://www.lagou.com/jobs/5087526.html,鼓楼区,2k-3k,南京运享通信息科技有限公司,1年以下,本科,"数据分析,有挑战,有深度,弹性时间",岗位职责：1、对特定的体育数据领域进行内容的收集，分类，映射，清洗和统筹规划，为用户提供全面、准确、及时的信息；2、熟悉MYSQL数据库操作，有相关数据加工、数据分析、报表开发经验优先；3、具备「数据即产品」的意识，与研发、测试、分析师团队协作沟通，共同建设数据中心的产品线、工具集合。任职要求：1、本科及以上学历的应届毕业生，有自由的时间到公司实习，毕业后择优签订劳动合同；2、熟悉Excel的基本操作，会使用SQL语言的优先；3、为人踏实、勤勉、耐心，能够面对大量表格数据处理，保质保量完成工作；4、有较强的责任心和事业心，职业生涯中至少有一人对你说过「我可以放心地把事情交给你」。,"移动互联网,企业服务",50-150人,大数据,南京
数据分析与报表开发,https://www.lagou.com/jobs/4800560.html,江宁区,6k-12k,南京运享通信息科技有限公司,不限,本科,发现数据价值，提供更好使用数据的方式,"专注于数据统计、报表可视化、大数据分析：要求：（1）熟练掌握一种关系型数据库（MYSQL/Oracle),熟练掌握SQL编程。（2）熟练使用一种报表可视化工具(有帆软报表开发经验优  先)；（3）具备java/python开发经验优先； ( 4 ) 具备海量数据存储和高性能应用程序开发相关经验优先；（5）能主动学习、有良好的沟通能力，能接受加班安排，抗压能力强。职责：（1）完成核心产品中日常统计报表的开发；（2）完成用户定制报表的开发；（3）对业务数据进行深入、系统的分析，为企业提供业务指导性的分析报告；（4）可视化数据大屏（看板）开发（5）掌握业务流程和系统处理逻辑，定位处理统计报表中的异常数据问题。","移动互联网,企业服务",50-150人,大数据,南京
数据开发工程师,https://www.lagou.com/jobs/7131449.html,江宁区,15k-20k,江苏景枫投资控股集团有限公司,5-10年,本科,弹性工作 技能培训,岗位职责：1. 负责业务数据的采集、同步、清洗、建模、钻取、展示等相关工作；2. 负责数据采集分析系统的需求、分析、设计、开发、测试和上线，满足公司业务运营和管理的数据分析需求;3. 参与公司数据采集分析平台和大数据平台的规划设计；4. 按规范要求编写代码，保证自己负责的产品持续敏捷开发，并保证线上稳定运行；5. 编写研发过程中产生的规范化文档/接口文档等； 任职要求：1. 本科及以上学历，计算机或相关专业，五年以上JAVA后端开发、数据分析及数据图表化展示应用程序的开发经验，优秀的编程能力；2. 熟悉数据产品的全周期，覆盖数据产生、清洗、传输、建模、统计、聚合、查询、归因、可视化的全流程；3. 熟练掌握 Java 及面向对象设计开发，精通主流的数据库（包含MySQL、Oracle），精通使用SQL语句对大量数据记录进行分析、整理和查询；4. 精通数据分析及建模，熟练使用MySQL存储过程及SQL组合查询进行数据的钻取，熟练使用Echarts等开源图表库进行图表展示开发，掌握数据库优化技术；5. 良好的学习能力，能够快速学习一门新技术并实践；6. 沟通能力好、责任心强，能承受较大的工作压力，具有良好的团队合作精神和敬业精神。,"房产家居,软件开发",500-2000人,大数据,南京
数据开发工程师,https://www.lagou.com/jobs/3478186.html,秦淮区,13K-18K,江苏易启策网络科技有限公司,3-5年,本科,五险一金 团队建设 零食,211、985本科毕业计算机专业python基础扎实数据库可视化mysql,"数据服务,消费生活",15-50人,大数据,南京
BD/南京,https://www.lagou.com/jobs/7051665.html,秦淮区,10k-20k,杭州火烧云科技有限公司,不限,大专,六险一金 年度体检 年度旅游,职位描述：婚礼纪成立于2013年，是一个专注婚庆市场，连接线上线下需求的平台。  我们正在做的：大数据挖掘用户需求，致力于做到婚庆的一站式服务；开拓社交新领域，玩转低频需求市场；连结商家网搜新用户，达成更快更精准的市场部署。 我们是一个浪漫且务实的年轻团队，我们想要在市场规模超8000亿的领域做最好的平台。公司氛围融洽，遵循扁平化管理， 任何有创意的idea都能成为现实！任职资格:1、大专以上学历，有互联网、团购、电子商务、广告或婚礼行业工作经验优先；2、热爱销售、乐于挑战、积极乐观、富有激情和创新理念;3、具备较强的学习能力和适应能力，为人正直，诚实可靠；4、良好的学习能力、沟通能力、商务谈判能力，快速适应互联网行业的发展；5、基本的excle，word，ppt操作。工作职责：1、收集与整理客户信息，合理制定销售计划，达成每月销售任务；2、通过电话、拜访和网络相结合的方式进行推广客户的开发；3、分析客户需求，拟定营销方案，与客户谈判并促成合作；4、在开拓新市场，发展新客户的同时，做好老客户关系的维护，促成二次销售；5、与公司各部门配合，及时处理用户的反馈、投诉和建议，提高用户满意度。福利待遇：1、入职后签订劳动合同，给您职业安全感保障；2、完善的社会统筹保险，入职即缴纳六险一金；3、优厚的薪酬待遇，完善的晋升机制及奖励机制，高额提成；4、丰富多彩的各项团建活动，各种节日福利、生日福利；5、带薪年假、带薪病假每年5天6、年度体检，健健康康上班；7、在职员工结婚更有结婚大礼包。,消费生活,500-2000人,大数据,南京
软件开发工程师,https://www.lagou.com/jobs/6830501.html,雨花台区,13k-25k,华为技术有限公司,不限,本科,待遇和发展前景好,【软件开发工程师】一、专业知识要求：1、理解面向对象思想，1年以上软件开发经验，掌握Java/C++/python中至少一种；熟悉常用数据库(Oracle/MySQL 等)的原理和使用；2、掌握常见的数据结构、算法，了解软件工程、敏捷开发等知识。3、对目前前沿的大数据分析和处理、机器学习等开源软件熟悉者优先；4、良好的沟通、协调、学习、创新能力，对解决具有挑战性问题充满激情；5、熟悉网络安全相关知识，有网络安全设计编码经验优先。二、业务技能：（一）软件开发方向：1、具有云计算/大数据产品（计算/网络/数据库）的功能开发经验；能独立承担软件模块设计和开发工作；2、熟练掌握Java、C++、python等主流开发语言的一种；熟练掌握常用的软件架构模式，具有疑难问题定位、核心代码开发相关工作经验；（二）工程构建&运维方向：1、熟练使用linux，有运维工作经验优先；2、熟悉主流数据库，对数据库安全、优化、数据安全、灾难恢复等有一定经验；3、熟练使用构建工具和自动化部署工具（ansible、puppet或者saltstack任一款）;4、精通Shell/python脚本，能够快速编写各类服务器维护脚本；5、有vmware vcloud（vsan、nsx等）、KVM等相关维护经验优先；6、良好的沟通能力、细心、负责任、上进心、分享、协作。【高级软件设计/开发工程师】一、专业知识要求：1、通信、电子工程、数学、计算机等相关专业，具备良好的计算机、软件工程领域知识基础 ；2、熟练掌握一种主流开发语言（Java、Python、GoLang、python等）；3、了解分布式一致性、分布式事务、高可用等相关概念，对CAP理论、BASE理论有一定的理解；4、熟悉常见的机器学习算法如KNN、KMeans、SVM等优先考虑；二、业务技能：1、3年及以上Java、Python或GoLang开发经验；2、有Hadoop、Spark、Kafka等相关开发经验值优先考虑；其他要求：1、强烈的责任心，做事认真细致，具备良好的团队合作精神，沟通能力佳；2、对新技术敏感，求知欲强，能快速学习并具备较强的技术领悟能力；【软件测试工程师】一、专业知识要求：1、安全测试方向：有软件安全攻防、渗透测试（如DDOS攻防、提权等）、安全漏洞、防范方法和审计方法等工作经验者优先；2、测试开发方向：熟练掌握web开发的常用框架（如NodeJS、AngularJS等），具备一定的自动化测试经验，掌握业界通用的自动化测试技术；二、业务技能：1、能够熟练应用测试设计方法独立完成方案及用例设计；能够应用JAVA或者TCL等语言书写测试脚本。2、具备1年及以上软件开发或测试经验，有web开发/测试经验、自动化开发/测试经验者优先。3、熟练掌握系统测试、专项测试等方法，有相关测试语言/脚本的编写和实践经验优先。4、要求有较强的学习能力、责任心，自我驱动，有较好的沟通交流及协调能力，开放进取，有探索精神。,通讯电子,2000人以上,大数据,南京
数据分析师(006382),https://www.lagou.com/jobs/6741920.html,雨花台区,25k-45k,维沃移动通信有限公司,3-5年,本科,"股票期权,精英团队,弹性工作",1、负责互联网业务（官网APP、商城运营、账号、积分、会员、v粉卡、海外浏览器等）业务的运营数据分析工作；2、配合产品运营和上线需求，完成数据分析需求工作的支撑；3、帮助产品完成例行数据分析工作，跟踪业务发展状况，及时反映业务问题；4、结合业务发展目标，梳理运营数据体系，推动大数据BI建设；5、主动规划数据分析工作，通过数据分析实现业务增长目标。1、本科及以上学历，统计学、计算机、经济学、数学等相关专业；2、至少3年以上运营数据分析、数据挖掘等大数据相关岗位的经验； 3、具备优秀的数据分析能力，掌握常用算法，能通过数据分析、模型构建、数据预测等方式解决业务问题4、具备优秀的业务理解能力、逻辑思考能力和问题解决能力，能够对产品的运营问题进行系统化的思考和分析，能独立承担复杂的数据分析任务；5、熟练使用excel，具备优秀的PPT撰写和汇报能力；6、掌握SQL语言、R语言、Hive、Python、shell脚本等数据分析相关语言工具；7、沟通能力良好，富有团队精神，敢于承担，乐于分享，具有优秀的目标管理能力和自我驱动力；8、有跨部门、公司级项目主导经验者优先；有互联网业务相关从业经验者优先。,硬件,2000人以上,大数据,南京
客户经理,https://www.lagou.com/jobs/3493676.html,栖霞区,15k-20k,南京浦和数据有限公司,3-5年,本科,"薪酬优渥,发展迅速,前景广阔,专注技术",岗位职责：1、负责公司行业客户（电力、交通、公安等）大数据产品及解决方案的销售工作；2、按客户需求定制解决方案；3、负责区域内的存量客户的维护工作、新客户的拓展工作，完成相关任务指标；4、协助主管制定销售策略、计划，以及量化销售目标；5、负责项目机会点的跟踪、引导、落地以及项目团队的协调安排、监督、跟进；6、做好销售合同的签订、履行、管理与回款等相关工作，协调处理各类市场问题；任职要求：1、本科及以上学历，电力、交通、IT 等相关专业优先；2、一年以上销售相关工作经验，优秀应届生亦可；3、积极正向，有良好心态，抗压能力强，敢于承担责任；4、具有良好的沟通能力，分析解决问题能力以及客户服务能力；5、能够适应出差。,数据服务,50-150人,大数据,南京
高级Java开发工程师,https://www.lagou.com/jobs/4144270.html,栖霞区,20k-40k,南京浦和数据有限公司,5-10年,本科,"薪酬优渥,带薪年假,法定节假,专注技术",工作内容：1、负责业务系统需求分析、数据库设计、后端开发；2、 负责核心业务的技术方案设计与评审;3、负责生产环境维护，现有平台疑难问题定位，优化；4. 根据业务需求进行功能模块设计及编码实现。必备技能：1、至少精通Oracle/SQLServer/MySQL数据库的一种，熟练使用sql语言，熟悉数据库应用开发；2、精通JAVA语言，熟悉 JVM 运行机制；3、熟悉spring cloud 微服务架构，对开源的分布式框架有深入的了解；4、了解基础的数据结构、算法知识；5、熟悉Docker容器，对容器技术有所了解；6、具有良好的沟通能力、团队协作能力，遇事积极主动的解决。加分技能：1、熟悉DevOps开发流程；2、熟悉软件技术文档的编写，具备良好的文档编辑习惯和代码书写规范；3、了解大数据方面的相关知识。,数据服务,50-150人,大数据,南京
