job_name,job_url,job_location,job_salary,job_company,job_experience,job_class,job_given,job_detail,company_type,company_person,search_key,city
UIUX设计师 (WEB端）,https://www.lagou.com/jobs/5616842.html,滨江区,8k-16k,浙江天垂科技有限公司,1-3年,本科,"硅谷模式,MAC电脑,五险一金,氛围轻松","我们欢迎您参加 Teletraan Take Home Project。即使您没有通过简历筛选，若您take home 完成的较好，即将获得进一步面试的机会。
 获取题目：您可以通过http://nextcloud.teletraan.io/index.php/s/HADbTyfWEyiSNTX  获取题目。
 提交成果：本项Project没有时间限制，但请争取不要超过1周时间。完成后请根据PDF说明告知、发送成果给我们。
请本着“彼此尊重、自己负责“的态度独立完成所有题目。当然，我们**允许您科学上网、自行调研。谢谢您的配合。职位介绍：
 负责web端和移动端页面UIUX（交互）设计
 关注全球设计行业动态与发展方向，准确把握web端和移动端的设计风格和质量
 配合前端软件工程师完成人机交互界面设计工作
要求：
 本科及以上学历（不限于艺术类科班出身），平面功底深厚
 熟练使用Sketch、PS、AI等设计软件
 能对立思考和完成产品的设计
 积极理解产品的需求，同时快速的生成新的设计方案
 注重细节，善于沟通
 加分选项：
 具有web端和手机端页面及app的UIUX设计经验
 英文阅读无障碍或具有海外留学经历
 多项目，多线程工作能力
 有一定前端开发经验
麻烦您将简历和作品集一并发送至公司招聘邮箱（job.cn），并通过拉勾网告知我们，不胜感激！请注意： 
 作品集请多展示web端产品/设计； 
 邮件标题请写明“应聘岗位+姓名”； 
 请发送PDF格式，大小请控制在25M之内；不要发超大附件或百度云盘链接。 
我们的面试流程为：
 简历筛选 - Take home project - 现场面试1-2轮","数据服务,企业服务",15-50人,web,杭州
web前端开发工程师,https://www.lagou.com/jobs/7163886.html,余杭区,10k-15k,杭州互次方科技有限公司,1-3年,本科,潜力大，弹性工作，有期权，资深阿里创业人,"岗位描述:1、负责公司核心产品的前端开发工作，包括APP端混合式开发, 微信小程序, Web管理后台开发等；2、负责前端架构设计和性能调优，持续优化已有产品的用户体验；3、Web前沿技术研究和新技术调研；任职要求：1.一年以上前端开发经验，精通HTML/CSS/Javascript等前端相关技术熟悉ES6, Vue, Element-UI有大型应用的前端架构部署和实践经验；3.熟悉css3动画, canvas, WebGL, three.js，有 小程序、 Web管理后台开发经验, 熟悉mui, uni-app者优先考虑；4.把握前端技术发展潮流，积极主动研究前端新技术，能合理利用新技术推动业务发展；5.抗压能力强，有出色的团队合作精神",企业服务,15-50人,web,杭州
web前端,https://www.lagou.com/jobs/7106809.html,余杭区,15k-20k,浙江云程信息科技有限公司,不限,本科,五险，带薪休假,"岗位职责：1、依据项目需求高质量地完成复杂SPA应用以及移动端网页应用，微信小程序的开发、维护；2、具有前端工程化的思维，使用或独立开发工具，以提高开发效率或提升项目质量；3、在理解项目业务的基础上，结合前端技术，给出合理的实现方式，具有可扩展性，高可维护性，并充分考虑安全性、性能方面的风险；4、业务组件和框架的设计与开发。岗位要求：1、本科及以上学历；2、掌握各种前端技术，可以熟练运用包括HTML/CSS/JavaScript 等技术；3、熟练运用vue.js前端开发框架；4、熟练使用vuex，vue-router以及vue相关的工具链的使用；5、熟悉css预编译、后编译等工具， 如less/sass/postcss等；6、熟悉webpack等打包工具的运作原理，能根据项目要求进行配置；7、能独立负责一个正常SPA项目的开发，可以跟后端沟通实现项目需求；8、具备良好的团队协作精神，能利用自身技术能力提升团队整体研发效率，提高团队影响力；9、有良好的编码习惯, 能够编写清晰, 易于维护的代码；10、能和设计师沟通交互设计，和后端开发研讨技术实现方案，制定服务接口，崇尚团队合作；11、较强的自我管理能力，抱有积极的学习心态，乐于分享知识，喜欢沟通，乐观开朗，并且具有较强的逻辑思维。工作地址杭州 - 余杭区 - 德信数字产业大厦1402",软件开发、数据服务,少于15人,web,杭州
web前端开发工程师,https://www.lagou.com/jobs/6649440.html,余杭区,8k-12k,令克软件（杭州）有限公司,3-5年,本科,年终奖 公司氛围佳,职位描述：1.参与产品需求、研发设计的相关讨论，从前端设计角度提升产品使用性和美观度的要求2.根据公司的要求负责项目前端开发工作，实现产品所需的前后端交互3.与后台技术开发保持良好的沟通，完成具体的开发工作任职要求：1.计算机相关专业，本科及以上2.具有3年及以上前端开发实际工作经验，自我要求高，执行力强3.精通JavaScript、Html、CSS等WEB前端技术，并具备良好的编程风格，代码可维护性好4.熟练使用Web开发框架（jQuery、bootstrap、iview、vue、vux、vant等常用框架） 5.熟悉软件设计模式，具备软件开发架构思想，熟悉浏览器兼容性、缓存、安全等机制6.有中后台管理系统开发经验7.良好的沟通能力和团队合作精神，工作认真负责，有一定的逻辑思考能力,软件开发,50-150人,web,杭州
web前端开发工程师,https://www.lagou.com/jobs/6028573.html,滨江区,12k-20k,浙江聚智软件技术有限公司,3-5年,大专,五险一金，全勤奖，带薪年假，员工旅游,1、计算机相关专业本科及以上学历；五年以上相关岗位工作经验，有项目统筹管理经验者优先。2、熟练使用前端开发所需的技术，包括HTML5、CSS3、JavaScript，并积极跟进前端技术发展；3、熟练掌握Ajax调用及json格式数据，能够使用常见的前端构建工具（如gulp/grunt/webpack）者优先；4、能够处理浏览器常见兼容性问题，对性能优化有一定的了解，精通 PC 和 移动端H5前端开发；5、有一定的WEB开发经验，了解各种网络协议，能使用各种开放API，有数据可视化经验优先；6、熟练使用常用的工具，包括视觉设计软件、文本编辑软件、协作工具（git、svn）和常用开发环境配置（nodejs、path），会使用浏览器开发调试工具。7、熟练avalonjs框架的优先考虑。,移动互联网,15-50人,web,杭州
web前端开发工程师（vue方向）,https://www.lagou.com/jobs/7105741.html,余杭区,12k-17k,杭州互次方科技有限公司,3-5年,本科,潜力大，弹性工作，有期权，资深阿里创业人,"岗位描述:1、负责公司核心产品的前端开发工作，包括APP端混合式开发, 微信小程序, Web管理后台开发等；2、负责前端架构设计和性能调优，持续优化已有产品的用户体验；3、Web前沿技术研究和新技术调研；任职要求：1.三年以上前端开发经验，精通HTML/CSS/Javascript等前端相关技术熟悉ES6, Vue, Element-UI有大型应用的前端架构部署和实践经验；3.熟悉css3动画, canvas, WebGL, three.js，有 小程序、 Web管理后台开发经验, 熟悉mui, uni-app者优先考虑；4.把握前端技术发展潮流，积极主动研究前端新技术，能合理利用新技术推动业务发展；5.抗压能力强，有出色的团队合作精神",企业服务,15-50人,web,杭州
web全栈,https://www.lagou.com/jobs/6968797.html,滨江区,18k-30k,杭州希格斯投资管理有限公司,不限,本科,研究氛围 自由开放 成长迅速 回报丰厚,工作职责1、负责公司内部交易风控、客户关系管理、工作效率提升工具等等相关产品网页前端和后端的研究设计、开发和优化；2、负责相关产品的日常运维，参与产品规划，持续优化产品体验及性能；3、参与制定标准规范，流程改进及工具建设，为技术选型及技术改进提供解决方案。技能要求1、扎实的计算机基础知识（如操作系统、计算机网络、数据结构、算法），熟悉HTML、Javascript和Web开发框架，具备全栈开发能力；2、对MVC/MVVM等模式有一定的理解，熟悉常见前端技术框架（如React、vue、angularJS）；3、对前端工程化有一定理解，熟练掌握Webpack/Grunt/Gulp等构建工具的使用和配置；4、熟悉一门后端编程语言及常见Web框架，如Java Spring，Python Tornado等；5、熟悉常见数据库技术；6、熟悉常用的项目管理工具git，熟悉Linux系统及常见命令，具备较好的项目管理经验；7、具有良好的学习能力，对用户体验和产品研发有经验者优先。,"金融,数据服务",15-50人,web,杭州
web前端开发工程师,https://www.lagou.com/jobs/6904266.html,下城区,12k-16k,杭州浮云网络科技有限公司,1-3年,本科,五险一金、员工旅游、年底双薪、年度体检,岗位职责：1、负责大数据实时数据应用平台、数据标准管理平台、风控平台、用户体验分析平台等的前端架构设计和实现；2、负责用户行为路径可视化、路径图谱可视化、精细化运营数据可视化等数据可视化工作，并基于开源可视化框架进行二次开发；3、参与可视化埋点和全埋点方案的开发4、配合其他开发人员实现产品界面和功能，同时注重程序的安全、质量和性能；5、参与公司项目需求、开发方案设计等的相关讨论，从前端角度提出建议。岗位要求：1、计算机及相关专业，专科及以上学历，2年以上前端开发经验；2、熟练使用HTML5、CSS3、 ES6，熟悉AngularJS/React/vue等前端框架中的一种或多种，并有相应开发经验；3、了解前端工程化，模块化，具有webpack打包的经验，有前端优化经验；4、有数据可视化开发经验，使用过superset、highcharts、grafana等工具；5、有较强的逻辑分析、问题排查能力；6、有责任心，良好的沟通表达能力和团队协作能力，勤奋好学，能够承受一定的压力；7、向开源社区贡献过源码者优先。,"游戏,移动互联网",150-500人,web,杭州
Web渗透测试工程师（网关事业群）,https://www.lagou.com/jobs/7082747.html,滨江区,18k-35k,杭州安恒信息技术股份有限公司,3-5年,本科,五险一金 带薪年假 国内外旅游,"岗位职责：1、防火墙产品的测试用例设计和开发；2、防火墙产品中规则防御模块的优化和维护；3、分析现网漏洞的成因和验证利用方式, 并实现防御方案；4、和安全研究人员合作, 设计和实现新型攻击的防御方案；5、实现自动化渗透测试工具；任职要求：1、3年以上相关领域工作经验；2、精通OWASP Top 10中Web攻击和渗透的各种技术；3、 熟悉Java, JavaScript, PHP, ASP等语言及特性；4、能够熟练使用正则表达式实现文本提取和检测；5、能够熟练使用Burp Suite/WRK/TCP Dump 等工具进行攻击报文重放；6、能够熟练使用Python/Bash进行编程；7、 能够独立搭建各种Web应用环境的靶机/TestBed；8、优秀的学习能力和英文读写能力；9、良好的⼯作态度和责任⼼。","信息安全,数据服务",500-2000人,web,杭州
Web安全研究,https://www.lagou.com/jobs/7082877.html,滨江区,20k-35k,杭州安恒信息技术股份有限公司,3-5年,本科,五险一金 带薪年假 国内外旅游,职责职责：1、负责 Web 安全漏洞研究，跟踪国内外安全领域的安全动态并落地;  2、参与攻击队项目，主要负责 Web 方向打点;3、定期团队技术分享，提升团队整体作战能力。任职要求：1、至少掌握 JAVA/.NET/PHP/C 等两种语言，可完成相关Exp编写；2、精通 Web 漏洞形成原理，具备代码审计能力；3、良好的逻辑思维能力和团队合作精神，善于交流和表达。加分项：1、具备良好的英语文档阅读能力；2、曾参加过技术沙龙担任嘉宾进行技术分享；3、具有CISSP、CISA、CSSLP、ISO27001、ITIL、PMP、COBIT、Security+、CISP、OSCP等安全相关资质者；4、具有大型SRC漏洞提交经验、获得年度表彰、大型CTF夺得名次者；5、开发过安全相关的开源项目；6、具备良好的人际沟通、协调能力、分析和解决问题的能力者优先；7、个人技术博客；8、在优质社区投稿过文章。,"信息安全,数据服务",500-2000人,web,杭州
WEB前端开发工程师（外派）,https://www.lagou.com/jobs/6271342.html,滨江区,10k-15k,合肥优尔电子科技有限公司,3-5年,本科,"双休、旅游,五险一金,健康体检,年终奖",1、本科及以上学历，计算机、信息管理、软件工程等相关专业，需要3年以上工作经验。2、熟悉W3C规范及常见WEB前端技术，能写高质量Javascript/HTML/CSS代码；3、对WEB前端技术HTML/HTML5/JavaScript/CSS/跨浏览器兼容等有较深刻理解；4、精通Javascript或jQuery，能熟练使用html5建设响应式系统，适应PC/安卓移动设备；5、熟练主流前端框架，如Vue、React，具备前后端搭配选型，具有互联网公司前端架构开发经验，有Vue使用者优先考虑。6、有一定的交互体验设计基础（美观度）,"企业服务,信息安全",50-150人,web,杭州
高级Web前端工程师,https://www.lagou.com/jobs/6148944.html,西湖区,15k-30k,杭州溜达网络科技有限公司,5-10年,大专,"快速发展,14薪,带薪年假,周末双休",关于我们：我们是一家做流量增长的企业服务公司，服务过网易、阿里云、携程、中国电信等多家知名企业，核心团队来自于阿里的在线营销部门，有16年的丰富行业经验。 期待有梦想、有韧性，乐于创造价值的你加入！岗位职责:1.公司SAAS平台各模块的前端开发（VUE技术栈）2.小部分官网以及小程序的开发3.调研新技术、优化SAAS平台前端性能和兼容性我们希望你：1.充满好奇心，享受coding，学习能力强2.技术全面，对技术有热情，关注技术发展方向3.极强的责任心，追求完美的习惯，刨根问底的精神技术上：1. 熟练掌握HTML5、CSS3、JavaScript原生开发、W3C标准与ES规范2. 熟悉前端自动化和工程化，熟悉webpack，有TypeScript开发经验3. 精通使用VUE，掌握其原理，能独立开发常用组件4. 熟练使用Element，以及各种调试、抓包工具，能独立分析、解决和归纳问题5. 具有丰富的性能优化经验与浏览器兼容性开发经验。加分项：熟悉NodeJS，有NodeJS开发经验或者有至少一门服务器端编程的实战经验你会获得有行业竞争力的薪资和很多个性化的福利：1. 行业大牛CEO的**内部培训分享会，助攻UP~!2. 核心员工股权激励方案，全额公积金、年终奖、绩效奖金、带薪年假3. 弹性工作时间，上下班无需打卡4. 超高能装备：升降支架，机械键盘，3D显示屏幕等等5. 不定期组织outing ：漂流，轰趴，露营BBQ，旅游等等超酷团建项目6. 免费购书无上限优秀同学薪资open!,移动互联网,50-150人,web,杭州
高级安全渗透专家-web方向,https://www.lagou.com/jobs/6770847.html,余杭区,40k-70k,北京字节跳动科技有限公司,不限,本科,六险一金,,文娱丨内容,2000人以上,web,杭州
web前端,https://www.lagou.com/jobs/6789689.html,余杭区,10k-15k,数神科技信息（杭州）有限公司,3-5年,本科,五险一金 能力培养,"工作内容:1.负责前端页面的设计、开发、维护工作，配合后台开发人员完成项目，提升产品UI效果、用户体验 2.前端模块化、工程化的实现及优化，持续改进产品性能、稳定性和可扩展性3.负责公司产品前端报表页面，图表页面；4.自己负责模块功能的bug修复、系统正常上线运行保障、技术培训交流；5.参与及推动团队人员培养及梯队建设；6.参与团队前端技术体系建设，持续推动完善基础设施；岗位要求：本科及以上学历 工作经验2.5年以上熟悉w3c标准，熟练处理浏览器兼容性问题及调试工具精通JavaScript,HTML5, CSS等Web前端开发技术js基础扎实, 精通DOM字符串, 数组的使用; 熟练使用ajax, axios异步交互技术及JSON, xml等数据交互格式熟练掌握iview, antd等第三方前端UI框架熟练掌握Vue前端框架","移动互联网,数据服务",150-500人,web,杭州
web前端,https://www.lagou.com/jobs/3848473.html,余杭区,15k-30k,北京深睿博联科技有限责任公司,3-5年,本科,"大牛,人性化管理,靠谱团队,技术氛围好",岗位职责： 1、与产品经理和交互、视觉设计师协作，根据需求文档、线框图、设计稿完成页面制作；2、与后台工程师协作，完成数据交互、动态信息展现和用户的互动;任职资格： 1、3年以上web开发经验；2、精通HTML、CSS、JavaScript等前端技术； 3、对标准化、可用性、页面性能有深入了解，多浏览器兼容经验；4、熟练使用PS或FW等图像处理工具，熟悉JAVA或至少一种后端开发语言；5、热爱前端技术，个性乐观，善于沟通，有较强的学习能力和团队协作精神； 6、有MobileWeb、HTML5、CSS3、Node.js等开发经验者优先;,"移动互联网,医疗丨健康",150-500人,web,杭州
web前端开发工程师,https://www.lagou.com/jobs/7119512.html,余杭区,16k-30k,杭州同花顺数据开发有限公司,1-3年,本科,核新项目；发展空间；食堂健身房；带薪年假,职位诱惑：PB量级数据，五险一金，奖金激励职位描述：职位描述:：1、与产品设计师紧密工作在一起，实现功能方面的开发需求，确保产品具有优质的用户使用体验；2、实现千万用户产品一流的Web界面，优化代码并保持良好兼容性。要求：1、本科及以上学历。熟练掌握基础的前端技术，包括html、css、javascript等；2、理解并掌握DOM、BOM、Ajax、JSON等，对Javascript框架应用（如jQuery/vue等）有一定的经验；3、能够利用一些工具，对页面性能进行分析和优化；4、对框架、前端组件化、工程化有一定的了解，并有相关实践经验；5、具备良好的团队协作精神。,"金融,电商",2000人以上,web,杭州
web开发工程师,https://www.lagou.com/jobs/7146367.html,余杭区,15k-25k,杭州认识科技有限公司,3-5年,不限,周末双休五险一金弹性工作绩效奖金专业培训,职位描述：1、负责前端技术规划与提升，前端前沿技术研究与推广；2、负责公司前端开发跟进；3、参与需求评审，协助产品经理针对页面体验进行设计；4、负责组织前端代码走查工作；5、负责公司产品前端框架的搭建，前端页面代码的重构；任职要求：1、本科及以上学历计算机相关专业，3年以上web前端开发经验2、有一定的团队管理经验者优先，工作态度端正，能承受较强的工作压力。3、精通web前端技术架构，熟悉web标准，对web前端技术有较强的敏锐力。4、熟悉W3C标准，对表现与数据分离、Web语义化等有深刻理解；5、熟悉前端安全策略，熟悉常见的web前端攻击解决措施，熟悉前端性能优化手段，逻辑分析能力强；6、具有对CSS/JavaScript性能优化、解决多浏览器兼容性的经验；7、需有应用Vue的实战项目经验且熟练掌握，深入理解W3C标准与ES规范，熟悉Web语义化，掌握盒模型、常用布局以及浏览器兼容性；8、理解并掌握JavaScript语言核心技术DOM、BOM、Ajax、JSON等；9、良好软件工程思想，良好的编程能力和编程习惯；,医疗丨健康,50-150人,web,杭州
web前端开发主管,https://www.lagou.com/jobs/6751684.html,江干区,18k-28k,嘉兴构美信息技术有限公司,3-5年,大专,五险一金 下午茶 年休假等,1. 参与产品需求、研发设计的相关讨论，从前端设计角度提升产品用户体验2. 负责网站的前端开发工作，实现产品所需的交互和视觉效果；3. 与后台技术开发保持良好的沟通，完成具体的开发工作；4.负责前端团队的工作安排、管理任职要求：1. 计算机相关专业，本科及以上2. 具有4年及以上前端开发工作经验，自我要求高，执行力强；3. 熟练掌握使用JavaScript、html / html5 、css / css3、Ajax等前端开发技术，熟悉W3C标准；4. 熟练使用Web开发框架（Vue、React、jQuery、bootstrap、echart.js等常用框架）；5. 了解各种浏览器兼容性，缓存、安全等机制；6. 具有良好的前端设计感；7. 熟练react.js、angular.js 、require.js、node.js8. 良好的沟通协调能力和团队合作能力，工作主动，认真细致，有较强的学习能力和责任心,电商,150-500人,web,杭州
python web开发主管,https://www.lagou.com/jobs/6310363.html,江干区,20k-35k,嘉兴构美信息技术有限公司,5-10年,本科,"单双休,五险一金,下午茶,年轻团队",职位描述：1. 负责项目后端框架搭建，功能模块开发任务分配；2.  负责项目Web后端的模块设计和功能开发，以及项目维护工作；3.  负责数据平台的设计、开发和维护工作；4. 与前端保持良好的合作，并为前端提供所需的API接口并实现接口逻辑。5. 负责后端组人员的开发进度，保证研发质量与效率。岗位要求：1.计算机相关专业本科及以上学历，开发经验5年以上，其中Python开发经验2年及以上，带过团队的优先；2. 熟悉Python编程语言及flask、django等Python web开发框架；2. 熟悉掌握SQL语句及熟练使用MySQL，熟悉常用的数据库优化技术；3. 熟练使用Linux操作系统，具有一定的Shell编程能力；4. 有较强的编程能力及规范的编程风格，重视代码质量；5. 熟悉面向对象变成思想及常用的设计模式；6. 乐于学习和分享，又良好的团队合作和沟通能力，拥抱新技术。,电商,150-500人,web,杭州
web前端,https://www.lagou.com/jobs/1420811.html,江干区,5k-9k,杭州纳舍科技有限公司,1-3年,本科,弹性工作不用打卡，定期团建吃喝玩乐,"作为前端开发将为硬件产品打造流畅的UI界面React和Vue都ok。如果你比较怀旧jQuery我们也欢迎。我们为我们的产品选择最合适的技术实现， 我们喜欢开源，也喜欢新技术。岗位职责
 HTML5开发
 CSS3开发
 良好的Javascript编程能力
 自动化开发和测试的能力
 良好的设计能力和设计眼界，能迅速找到合适的交互方案并且实施
 开发文档的编写和维护
岗位任职要求
 有HTML5开发经验
 有JavaScript开发经验
 有CSS开发经验
 有设计作品者优先
 有Twitter Bootstrap经验者优先
 有jQuery经验者优先
福利
 每年一次报销参加费用，可以选择参加ComicUP或者China Joy, 或者其他年度技术论坛等
 每年书券报销
 每月月度奖金
 五险一金全额交付
 定期团建，可能去看西湖全景的自助，也可能去日料全自助，当然比较多的还是去吃了长肉的蟹肉煲
 合理的其他福利都可以提
如果有github账号及开源项目，则优先考虑优先考虑.....先考虑..................虑....","企业服务,数据服务",15-50人,web,杭州
web前端开发工程师,https://www.lagou.com/jobs/6944992.html,西湖区,8k-13k,浙江达摩网络科技有限公司,1-3年,大专,发展空间大，福利多，周末双休、新零售,岗位职责：1、负责公司sass系统web前端业务实现；2、负责前端功能开发和重构，保持良好的代码可维护性、可扩展性，高效的性能和良好的兼容性；3、负责前端新技术调研、组件库和效率工具建设，提升团队的开发效率和质量；岗位要求：1、计算机及相关专业3年以上web前端开发经验；2、熟练掌握前端相关技术(HTML/CSS/JavaScript/HTML5/CSS3...)，了解http协议以及相关开发调试工具；3、熟练掌握一个前端框架（Vue/React/Angular）4、熟练掌握CSS布局,"企业服务,消费生活",150-500人,web,杭州
Java Web工程师,https://www.lagou.com/jobs/7216692.html,余杭区,10k-20k,杭州排列科技有限公司,1-3年,本科,明星团队 年底双薪 绩效奖金,1.能独立完成核心/重要模块的设计、编码、单元测试；2.参与代码设计、审核和检查；3.能独立解决开发中遇到的难点问题；4.具备良好的抗压性、良好的学习能力和团队协作能力；5.负责公司项目及产品的实施和研发。任职要求：1、本科以上学历，精通J2EE体系架构，熟悉设计模式；2、两年以上Web项目实际开发经验；熟练掌握HTML、CSS、JS、AJAX、Jquery等Web前端开发技术以及BootStrop和Vue等前端框架，精通SSM、SSH、SpringBoot、Spring Cloud等主流的开源框架；3、至少熟练使用一种数据库（Oracle、DB2、MySQL），拥有较好的数据库设计开发能力；4、熟悉tomcat、weblogic、was等常用中间件，掌握常用LINUX指令，了解版本发布流程；5、能适应一定情况出差，具备金融行业（如：银行，保险，证券）IT系统开发经验。,"移动互联网,金融",50-150人,web,杭州
