job_name,job_url,job_location,job_salary,job_company,job_experience,job_class,job_given,job_detail,company_type,company_person,search_key,city
课程研发实习生,https://www.lagou.com/jobs/7107546.html,渝北区,3k-6k,重庆仙桃教育科技有限公司,应届毕业生,硕士,薪资高 ，名师领衔，发展空间大，可转正,岗位说明：学院首任理事长张东晓（原北大研究生院、工学院院长），现任执行院长陈学义（北大海洋研究院秘书长），首席数学家夏志宏（数学家、天文学家）今年暑期，学院由夏志宏老师领衔指导开展3+1教培体系（知识体系、课程体系、师资体系与评价体系）研发，打造大数据、人工智能、物联网、区块链、智能制造、数字化管理等方向的创新人才培养体系。招募全球硕博研究生，对有能力带团队开展研发的硕/博研究生月补贴8k/15k（特招），对有能力参加研究的硕/博研究生月补贴2.5K/5K + 绩效（普招）。实习时间3个月+，实习形式线下+线上。你将获得：1、研学资源：科学家作为导师的相关领域前沿研修课程。业界精英作为导师的工业与政务数字化智能化发展应用课程。2、就业创业：与学院专家老师共同组团工作是难得的高质量实习体验机会。三月期满，终身有约！既可以加入仙桃大数据学院就业创业，还可以留在仙桃国际大数据谷，有望进入数十家各行业企业就业。也可以人在四方，通过网络与学院长期开展课程、项目与创新创业等方面合作。任职要求：对新一代信息技术应用于传统产业和社会发展有兴趣；有协同创新与相互成就的价值观；愿意从事带学生、搞研发、合作顶目三位一体的工作。就读于双一流、原211院校及全球前100的海外院校，未与其他机构签订就业协议（即可能来学院就业或继续深造者）。拟招专业：数学、统计学、运筹学、密码学类。计算机与软件开发类。自动化与机器人类。工业工程与工业设计类。对新一代信息技术兴趣高基础好者不受专业限制。,"移动互联网,人工智能",50-150人,人工智能,重庆
Android客户端-开发工程师,https://www.lagou.com/jobs/6754336.html,渝北区,5k-10k,密根科技（重庆）有限公司,3-5年,不限,五险一金 双休 交通补助 弹性工作,项目开发程序员有：一、Android开发技术+前端技术程序员二、Java后端开发程序员要求：计算机、软件相关专业背景，有完整APP开发的经验；其中职位描述：Android开发工程师负责用户手机端APP的Android平台的开发；技术范围：熟练前端、iOS、Android技术能力；根据产品设计，进行高质量的软件开发和持续性能优化Java开发工程师职责：懂云服务器，及具备开发与搭建服务器和数据的能力；负责项目安卓应用程序的后端系统模块的设计和开发；负责测试程序设计，版本测试及修改工作；熟练算法数据设计；如推荐、搜索、语音、视频、生物技术等；熟练人工智能识别技术；技术范围，如下优先考虑：会后端+前端开发的全栈技术员；会后端+算法技术开发+运维测试。期待你参与项目的开发，我们重视你的价值和发掘，与我们一起共同拼搏和发展；灵活的薪资收入结构，可协商。,其他,少于15人,人工智能,重庆
web前端开发工程师,https://www.lagou.com/jobs/6944154.html,巴南区,6k-8k,重庆市中迪医疗信息科技股份有限公司,1-3年,本科,上市公司，医疗大数据项目，前景可期,【职位描述】1、负责公司大数据项目组信息集成平台相关项目的前端代码开发；3、负责实现Web页面功能设计，配合后端实现数据交互、易用性改进；4、负责前端技术选型，完成前端框架搭建、组件封装、页面特效；5、负责产品性能优化、兼容性、安全性，带动前端技术升级。【任职要求】1、计算机相关专业本科及以上学历，2年及以上前端工作经验；2、熟练掌握html、css、JS（es6）等前端开发语言；3、熟练使用Vue+VueX+ElementUI前端框架，有独立开发组件的经验；4、能高度还原UI设计图，擅长Echarts图表（包括地图）；5、熟悉git版本库管理工具，代码精简规范，有良好的编程习惯；6、能够独立思考、提出合理的设计建议，具备良好的沟通表达能力，有责任心和团队协作能力；7、有医疗行业或人工智能、大数据数据可视化、消息中间件开发等相关工作经验优先。【关键词】前端开发、2年以上经验、Vue、JS、Echarts,医疗丨健康,150-500人,人工智能,重庆
高级后台开发工程师,https://www.lagou.com/jobs/7055816.html,南岸区,15k-20k,重庆路丁科技有限公司,5-10年,本科,发展前景,职位描述：进行公司线上软件后台开发，架构维护和升级，组建产品整体后台软件体系；迭代开发新的产品需求，以及研发新增模块，进行技术难题攻关，能持续提升核心系统在高并发、海量请求数下的高处理性能，保证系统的安全、稳定、快速运行；进行技术预研、角色分工和周期评估，自行和带领团队完成设计和实现；完成开发文档编写，管理软件仓库，对接其他系统部门完成整体产品的联调和交付；完成自测试工作；岗位要求：计算机相关专业本科及以上学历，5年以上Java Web应用软件开发经验，2年以上架构经验；扎实的编程基础，深刻理解各种设计模式和设计原则，掌握JVM、IO、多线程、集合等基础框架；熟悉缓存、消息中间件、分布式系统架构等；熟悉主流的开源框架或组件，如Spring、Springcloud、MyBatis等，了解其原理；熟悉微服务系统的设计和应用，如SpringCloud、Dubbo；熟悉分布式系统的设计和应用，熟悉分布式、缓存、消息等机制；能对分布式常用技术进行合理应用，解决问题；掌握Linux操作系统和大型数据库（Oracle、MySql）；对sql优化有丰富的经验；对图像识别、人工智能框架、大数据ETL应用有较强的认识；对推荐算法、深度学习、流量黑客等领域有所研究；对金融产品设计有一定概念；过往经验有过高并发C端应用、小程序产品设计、ERP系统设计、物联网云后台经验者，优先考虑；欢迎全栈式人才；熟悉配置管理，遵循软件开发流程，有敏捷开发经验；工作踏实可靠，认真负责，学习能力强，适应能力好，耐心、细心；认可公司发展；,人工智能,15-50人,人工智能,重庆
初级机器学习工程师,https://www.lagou.com/jobs/6828023.html,北碚区,10k-20k,合肥沃时科技有限公司,应届毕业生,本科,灵活工作制，季度奖金，五险一金，年终等,"工作内容：1. 将机器学习、深度学习、人工智能等技术手段运用到药物研发、药物工艺开发2. 对相关的数据进行整合和分析，协助团队工作3. 密切关注计算化学、云计算和人工智能等前沿技术在药物开发研究中的应用前景                                                                         任职要求：1. 本科以上，计算机、计算化学，计算生物背景优先，能够熟练阅读英文文献。2. 具有良好的编程能力，至少掌握一门编程语言 (Python, C, C++, Fortran, Java等)3.一年及以上工作经验3. 熟悉基于机器学习的state-of-the-art相关算法，有相关从业经历或带领团队经历及工作年限较长者优先限考虑及放宽","人工智能,软件开发",15-50人,人工智能,重庆
计算机视觉算法工程师（重庆）-校招,https://www.lagou.com/jobs/6173159.html,九龙坡区,20k-25k,深圳市锐明技术股份有限公司,应届毕业生,硕士,团队氛围好 节日福利 五险一金,岗位职责：1、基于深度学习的计算机视觉技术系统与产品研发；2、前沿计算机视觉算法调研及实现；3、ADAS（Advanced Driver Assistance System）和DSM（Driver Status Monitor）等相关算法研发，包括车辆检测、行人检测、车道线检测、人脸检测、人脸关键点检测、人脸识别等；4、神经网络优化，包括压缩剪枝、量化等；5、前沿目标跟踪算法研究与优化，包括KCF、ECO、GOTURN等。 任职要求：1、硕士/博士学历，有计算机视觉或机器学习研究背景；2、精通C/C++/Python；3、精通caffe、pytorch、tensorflow、keras等其中一种开源深度学习框架；4、熟悉MATLAB/Python优先；5、有深度学习相关科研经历优先；6、有计算机视觉算法的实际产品化经验优先；7、在视觉计算、机器学习、人工智能、数值优化等领域有优秀论文发表记录优先。,"数据服务,硬件",500-2000人,人工智能,重庆
Java中高级开发工程师,https://www.lagou.com/jobs/4354881.html,渝北区,8k-16k,重庆普天永惠大数据科技有限公司,1-3年,大专,"弹性工作,技术环境,领导不错","岗位职责1、负责智慧城市的产品设计、开发；2、内部框架设计与核心代码的实现,包括人工智能图像识别，语音语义，大数据方向的核心实现；3、新技术调研和接入实现；职位要求1、2年以上Java相关工作经验,基础扎实.对io、多线程、集合等基础框架有一定了解。2、熟悉至少3种以上web前端技术，Jsp，Jquery,Html,CSS,Bootstrap,VUE,VUE2.0,node.js,AngularJS3、熟悉SpringMVC,SSH,Maven,Mybatis等常用框架技术；4、掌握Linux 操作系统和大型数据库（Oracle、MySql）；对sql优化有丰富的经验； 5. 学习能力强，适应能力好，有强烈的责任心，具备耐心/细心的品质； 加分项： 1.有基于机器学习算法,网络爬虫,视频流编解码经验者优先; 2.掌握多线程及高性能的设计与编码及性能调优；有高并发应用开发经验；3.会第二语言C#/c++优先","移动互联网,其他",50-150人,人工智能,重庆
合伙人,https://www.lagou.com/jobs/5978722.html,江北区,24k-25k,重庆绿之家再生资源回收有限公司,3-5年,不限,顺势而为,1 有格局，思想跳跃，懂得坚持（千金易得.合伙人难觅）2 项目核心 ：互联网➕再生资源回收 平台回收产业一体化 改变生态环境，改变未来人类处理废品方式及处理废品习惯3项目介绍 ：(1)公司名称：重庆绿之家再生资源回收有限公司(2)将综合利用大数据➕区块链➕人工智能➕物联网等技术。寻有意在环保领域创业的技术大咖，投资人，做绿色共享项目的创业合伙人。具备在物联网时代深挖掘的理念，思维活跃开放且专注，自带特殊技能光环属性。我们将改变人类的习惯，我们将推动社会前进的步伐！我们将传递绿色环保理念的价值……,企业服务,少于15人,人工智能,重庆
销售经理(J10297),https://www.lagou.com/jobs/6797840.html,九龙坡区,18k-30k,创新奇智（重庆）科技有限公司,10年以上,本科,期权、优厚佣金,,人工智能,150-500人,人工智能,重庆
项目管理,https://www.lagou.com/jobs/6617753.html,渝北区,2k-4k,中冶赛迪重庆信息技术有限公司,应届毕业生,本科,500强央企实习证明；内部推荐机会；,岗位职责： 1、参与并协助产品市场调研与业主需求分析工作，开展与项目相关的资料收集、数据分析、行业研究等工作，并撰写业主的用户体验与优化建议等报告；2、辅助项目/工作流程包括人员管理、项目资源管理、团队管理等标准化制定，推动执行并持续更新；3、为项目搜集技术供应商信息，制定商务合作标准流程，组织商务会议、开展商务洽谈并管理供应商信息；4、定期组织大数据相关技术分享会，整理汇总相关资料。任职要求： (只要在校大学生)1、每周至少到岗2~3天，至少实习6个月，实习半年以上者优先；2、善于交流、引导目标用户交流；3、有相关实习经历或创业经历者优先；4、工作积极主动，执行力强；5、有较好的文字把控力；6、对大数据、人工智能、机器视觉有一定了解，计算机相关专业者优先。,移动互联网,500-2000人,人工智能,重庆
项目管理（数据分析） 实习生,https://www.lagou.com/jobs/6892251.html,渝北区,2k-3k,中冶赛迪重庆信息技术有限公司,应届毕业生,本科,星级餐厅 导师带徒计划,【岗位职责】1、组织业务场景需求调研，撰写需求文档；2、与技术人员、合作技术厂家沟通项目需求，协助出具技术方案；3、项目实施过程进行项目管理，包括项目启动、规划、执行、监控、验收等环节及其相应的文档撰写；4、其他日常管理工作。【任职要求】1、了解数据挖掘、机器学习相关技术的应用2、对工业生产和人工智能感兴趣3、在校期间担任学生会干部或班干部者优先4、良好的学习、沟通和文档编写能力,移动互联网,500-2000人,人工智能,重庆
产品助理实习生,https://www.lagou.com/jobs/6892138.html,渝北区,1k-2k,中冶赛迪重庆信息技术有限公司,应届毕业生,本科,星级餐厅 导师带徒计划,【岗位要求】1、专业不限，对大数据、人工智能或钢铁冶金相关技术有了解者优先2、有较强的学习能力、逻辑分析能力、沟通能力、文档编写、PPT制作能力3、成绩排名前15%4、每周至少到岗3天，至少实习4个月以上，能全职实习者优先【任职要求】1、进行大数据、人工智能相关产品的研究并输出研究报告2、参与产品全生命周期过程的相关管理（包括产品立项、产品开发、产品运营、产品工程应用等过程）3、其它日常管理工作,移动互联网,500-2000人,人工智能,重庆
