job_name,job_url,job_location,job_salary,job_company,job_experience,job_class,job_given,job_detail,company_type,company_person,search_key,city
java工程师,https://www.lagou.com/jobs/5653693.html,海曙区,10k-15k,浙江高迪恩信息技术有限公司,3-5年,大专,缴纳五险一金、待遇从优,"岗位职责：1、负责开发产品API接口、编写接口文档；2、参与产品设计与规划；3、编写软件研发过程文档；4、负责公司内部工具开发；5、负责WEB应用开发。 岗位要求：1、计算机等相关专业，专科以上学历；2、3年以上项目开发经验；3、精通JavaEE,精通SpringBoot框架；4、熟练使用Dubbo/SpringCloud等微服务框架；5、熟练掌握Git,Jekins,Maven等开发辅助工具；6、熟练使用Oracle,MySQL等流行数据库，了解NoSQL数据库；7、熟练使用Linux操作系统，精通Linux操作系统命令行工具，熟悉Shell脚本编写；8、有从事医疗、急救业务系统开发者优先。9、有物联网系统开发经验者优先。","信息安全,数据服务",少于15人,web,宁波
后端开发工程师,https://www.lagou.com/jobs/7198962.html,鄞州区,5k-7k,东蓝数码有限公司,1-3年,本科,每年旅游 体检,1. 负责公司核心业务系统的后台开发（NodeJS）；2. 协助产品制定完善的开发计划，完成日常的开发工作；3. 配合项目主管，组织并参与业务系统的开发实施工作，及时解决项目中遇到的技术问题；4. 独立完成应用系统模块的代码编写和单元测试；岗位要求1. 3年以上服务器开发经验，1年以上nodejs开发经验；2. 有良好的算法及数据结构基础，有其他后端语言编程经验优先；3. 精通NodeJS后端开发及异步I/O编程，可以独立开发NodeJS module，有Websocket开发经验；4. 熟悉NodeJS运行机制，能够熟练的设计和开发基于NodeJS的web应用，熟练使用koa2、thinkjs等框架；5. 熟悉高性能数据库架构，熟练使用Mongodb、redis；6. 有完整的独立项目经验者优先,"移动互联网,硬件",50-150人,web,宁波
测试工程师,https://www.lagou.com/jobs/7100955.html,镇海区,5k-6k,浙江华民软件有限公司,1-3年,本科,双休，13薪，加班福利,1、负责APP和Web系统的测试用例编写；2、在测试过程中，迅速、准确、全面找出APP和Web中的问题，并对问题产生原因做基本判断；并对测试中发现的问题进行及时的记录、跟踪、反馈、分析；3、负责就APP、Web测试中出现的问题与开发、产品人员保持沟通，提出合理化建议。岗位要求：1、计算机专业优先，2年以上工作经验，本科学历；2、能快速掌握各种测试方法，顺利完成所需的测试任务；3、拥有较好的沟通技巧，有责任心；4、热爱互联网、移动互联网，对各类APP持有热情；,医疗丨健康,15-50人,web,宁波
ui设计师,https://www.lagou.com/jobs/6998114.html,江北区,5k-10k,宁波全能蝌蚪科技有限公司,1-3年,大专,五险，不加班，双休,职位描述1.参与公司产品的前期构思；2.参与公司产品的设计调研；3.负责公司移动端app产品的ui设计；4.负责界面ui的实现（切图、尺寸标注、切图调整等工作）；5.负责跟进产品的设计及实现；6.负责产品相关的其他设计。岗位要求：1.专科及以上学历；2.2年以上移动端web端的ui设计岗位工作经验；3.熟悉android、ios等移动操作系统的ui设计模式；4.熟悉android及ios等平台的ui设计规范及流程，能够独立完成软件界面的布局、设计、方案展示、切图、尺寸标注、切图调整等工作；5.具有扎实的美术基础，对色彩有透彻的理解，优秀的创新意识与娴熟的设计技巧，有能力把设计理念转化为现实；6.对设计流行趋势有敏锐的洞察力，擅长把握各种设计风格、主导产品的设计；7.精通photoshop或者其他设计相关软件。其他要求：1.有互联网公司相关岗位从业经验者、有移动app设计经验者。,"数据服务,软件开发",少于15人,web,宁波
前端开发工程师,https://www.lagou.com/jobs/7177845.html,江北区,10k-14k,纬创软件（武汉）有限公司,1-3年,本科,五险一金 双休 13薪 年终奖,岗位职责：前端设计开发，性能调优，组件化。岗位职责： 1.熟悉常用算法和数据结构； 2.熟悉W3C标准，精通HTML5、CSSCSS3、JavaScript等前端相关技术； 3.熟练使用React框架; 4.良好的代码风格，有一定的前端设计能力，能解决多浏览器多分辨率兼容性问题；5.熟悉一种非Web前端脚本语言（如PHPJavaCPython）或Node.js优先；6.有大型网站前端性能调优、可用性、运维及相关经验的优先；7.有较强的责任心，具有良好的沟通能力和团队合作精神，工作积极主动，较强的自我学习能力；,"移动互联网,企业服务",2000人以上,web,宁波
软件开发工程师Java,https://www.lagou.com/jobs/5649048.html,鄞州区,14k-18k,宁波薄言信息技术有限公司,1-3年,本科,人工智能独角兽，创新氛围，弹性工作,岗位职责：1）负责软件功能模块的设计、编码、开发与实施，主导架构设计及核心代码开发；2）负责搭建系统开发环境，完成系统框架和核心代码编写；3）配合产品设计提出的需求，共同探讨出一个合理有高度的实现方案，要求保持易对接、易提取复制的开发思维；4） 指导软件工程师的日常开发工作、解决开发中的技术问题；任职要求：1）计算机相关专业，本科及以上学历，2年以上java开发工作经验；2）精通JAVA，熟悉基于J2EE的WEB架构设计，能独立开发，代码编写规范，熟悉Web开发流程；3）熟悉主流web开发技术；4）熟练掌握主流数据库；5）熟悉并掌握常用设计模式；6）熟悉Linux/Windows环境；7）拥有比较优秀的需求分析、数据库设计及系统设计能力，有大型网站或大型应用系统设计开发经验优先考虑；8）拥有较强的归纳总结能力和抽象提取能力，有平台化思维能力；9）拥有较强的设计能力，在产品按要求完成后并能有效全面合理地验证是否达标；10）具有前沿主流技术的探索精神，合理地应用在产品中。11）乐于从零开始学习一门辅助语言，责任心强、能够适应高强度的工作，具备团队合作精神。,"移动互联网,数据服务",15-50人,web,宁波
前端开发（宁波区）,https://www.lagou.com/jobs/5358383.html,鄞州区,8k-16k,宁波万由电子科技有限公司,1-3年,本科,"五险一金,行业前景好，团队氛围好",主要职责：1、负责U-NAS   OS的前端系统设计、开发与实现；       2、负责移动互联网产品的前端系统设计、开发与实现；       3、Web与移动互联网前沿技术研究与新技术创新。岗位要求：1、2年以上前端页面与脚本开发经验。2、有独立完成复杂前端模块的设计与实现的经验 ，工程化，组件化经验；    3、精通JavaScript、Ajax、DOM等前端技术，掌握面向对象编程思想    4、精通HTML5/CSS3等相关技术；熟悉W3C标准     5、对用户体验、交互操作流程、及用户需求有深入理解     6、熟练使用Linux系统     7、有强烈的上进心和求知欲，善于学习和运用新知识。,"数据服务,硬件",50-150人,web,宁波
前端开发工程师,https://www.lagou.com/jobs/6336538.html,鄞州区,8k-10k,浙江立芯信息科技股份有限公司,3-5年,本科,五险一金，每年体检，餐补，交通补贴,职位描述：1、运用HTML、CSS、JavaScript、DOM等技术，负责前端web界面设计的实现； 2、承担交互功能实现、编码实现以及相关文档编制； 3、运用HTML、HTML5、CSS3、JS、Jquery等相关技术实现网站、移动端的前端页面； 4、熟悉主流的前端框架（VUE等），有一定的构建能力和学习能力。5、负责改进和优化前端代码，提升产品用户体验。 任职要求： 1、3年以上开发经验，大专及以上学历。 2、有完整的前端项目经验； 3、熟练掌握Css，htmlxhtml网页架构，及div、css布局网页； 4、熟悉Web标准，对表现与数据分离有深刻理解，熟悉页面架构和布局，熟练掌握HTML、CSS，精通Ajax、JavaScript、DOM，以及jQuery、Vue等开源前端框架； 5、熟练掌握浏览器扩展应用开发者，有微信公众号，移动APP应用系统的开发经验者优先。,"移动互联网,其他",150-500人,web,宁波
Java中级程序员,https://www.lagou.com/jobs/554203.html,江东区,6k-12k,宁波亦云软件有限公司,1-3年,不限,发展前景广,一、JAVA开发工程师  一名岗位职责：1、 负责业务系统的需求分析、设计、开发工作；2、 负责相关技术文档编写工作；3、 解决系统中的关键问题和技术难题。任职要求： 1. 踏实诚恳、责任心强，能接受较大的工作强度，具备良好的沟通能力和学习能力；2. 计算机相关专业，3年以上Java开发经验；3. 精通Java并有较全的知识面，熟悉Spring、Struts、MyBatis等主流框架，具有相关开发经验；4. 精通应用Web前端技术，例如HTML、JS、Jquery、CSS等；5. 熟悉Linux平台下常用命令操作、环境部署；6. 熟悉数据库技术(MySQL/Oracle)，数据库优化及SQL优化；7. 思维灵活，热爱技术，对Web设计、编程开发有丰富的经验。8.有消息中间件、数据库中间件、服务框架开发、等开发经验者优先,数据服务,少于15人,web,宁波
Java开发工程师,https://www.lagou.com/jobs/6074870.html,海曙区,5k-10k,宁波网邦科技有限公司,1年以下,本科,****,"1、有扎实的Java语言基础,熟练掌握Java语言及相关开发工具Eclipse、MyEclipse、IDEA; 2、熟悉Java的Web编程，有过进行相关JSP、Struts，SpringBoot相关开发项目经验;  3、熟悉底层IBatis/MyBatis框架并能熟悉使用。熟悉并会使用各种常用设计模式;  4、熟悉MySQL,MSSQL数据库的设计和开发，了解Tomcat配置;  5、熟悉HTML5、CSS、JAVASCRIPT, 会使用JQUERY、VUE、EXTJS框架; 6、对技术有强烈的兴趣，喜欢钻研，具有良好的自我学习能力，沟通技能，团队合作能力;  7、具有良好的编码风格;  8、要求工作经验一年以上，具有本科学历和有经验者优先; 9、工作时间：9:00-17:30（双休）; 10、工资待遇和福利面议;",软件开发,15-50人,web,宁波
JAVA软件开发,https://www.lagou.com/jobs/5527645.html,海曙区,8k-14k,宁波互邦软件有限公司,不限,不限,产品开发,"1、有扎实的Java语言基础,熟练掌握Java语言及相关开发工具Eclipse或者MyEclipse;2、熟悉Java的Web编程，有过进行相关JSP、Struts开发、JDBC开发的项目; 3、熟悉Struts2、IBatis框架并能熟悉使用。熟悉并会使用各种常用设计模式; 4、熟悉MsSQL,MySQL数据库的设计和开发，了解Tomcat配置; 5、熟悉HTML、CSS、JAVASCRIPT, 会使用JQUERY、EXTJS框架;6、对技术有强烈的兴趣，喜欢钻研，具有良好的自我学习能力，沟通技能，团队合作能力; 7、具有良好的编码风格; 8、要求工作经验一年以上，具有本科学历和有经验者优先;9、工作时间：9:00-17:30（双休）;10、工资待遇和福利面议;","企业服务,数据服务",少于15人,web,宁波
前端开发实习生,https://www.lagou.com/jobs/5786803.html,鄞州区,2k-4k,中航安贞（浙江）信息科技有限公司,应届毕业生,不限,公司有宿舍、食堂,,"数据服务,房产家居",50-150人,web,宁波
前端开发,https://www.lagou.com/jobs/5705034.html,鄞州区,7k-10k,中航安贞（浙江）信息科技有限公司,1-3年,本科,公司有食堂、宿舍,,"数据服务,房产家居",50-150人,web,宁波
JAVA软件开发-资管组-宁波-01033,https://www.lagou.com/jobs/7041833.html,江北区,10k-15k,中信网络科技股份有限公司,3-5年,本科,五险一金 双休 年终奖 年假,职位描述主要从事金融行业IC卡、TSM相关项目开发工作。岗位职责1.根据架构设计或概要设计进行详细设计；2.完成软件系统的编码工作 ；3.配合测试部门进行BUG修复并保障软件质量 。任职要求1． 3年 以上Java 开发经验；精通 java 编程语言。 2． 熟悉web service、SOA、ESB、JBI等相关技术与规范理念。3． 熟悉XML 及其相关技术：SCHEMA、XPATH、XSLT等。4． 熟悉Unix/Linux系统常用操作命令和 SHELL 脚本编程。 5． 熟悉oracle、DB2、Informix等大型数据库开发，熟悉 SQL。 6． 熟悉Jboss、Weblogic、WAS等常用中间件。,金融,500-2000人,web,宁波
