job_name,job_url,job_location,job_salary,job_company,job_experience,job_class,job_given,job_detail,company_type,company_person,search_key,city
php开发工程师,https://www.lagou.com/jobs/6988416.html,郑东新区,5k-10k,河南夺冠互动网络科技有限公司,3-5年,大专,重点培养，前途无限,"岗位职责：1、根据公司的业务需要，负责核心模块的设计和开发工作；2、协助需求分析、系统构架、数据库设计文档编写工作；3、根据项目计划，按时完成制作任务。任职要求：1、2年以上PHP开发经验，有小程序项目开发经验者优先；2、精通PHP语言，能以OOP方式编写PHP，了解常用设计模式；3、熟悉javascript，SQL语句；4、有PHP框架开发项目经验，熟悉ThinkPHP、Laravel框架；5、使用过缓存,如redis和memcached。",移动互联网,150-500人,php,郑州
php开发工程师,https://www.lagou.com/jobs/7169822.html,金水区,4k-6k,河南元启网络科技有限公司,1-3年,本科,五险一金，弹性工作，节日福利,"职位描述：PHP开发工程师任职要求：* 计算机基础知识扎实，对技术充满热情，极强的学习能力，具备 PHP 开发经验；* 了解主流 PHP 框架：Laravel, Symfony；* 熟悉 MySQL 数据库开发，能够对数据库进行设计、优化、维护；* 了解 Nginx 等服务器的配置及优化，了解 Linux 服务器系统管理、环境部署；* 了解缓存、消息队列、分布式等机制；* 熟悉 JavaScript、CSS、HTML 等前端技术，了解主流 JavaScript 框架（Vue，React，Angular）；* 能够设计用于移动 App、Web 应用的优雅的 API；* Git 版本控制* 良好的代码习惯，理解 OOP，设计模式；",移动互联网 电子商务,少于15人,php,郑州
PHP服务端开发工程师,https://www.lagou.com/jobs/6357017.html,中原区,8k-10k,乐至（上海）科技有限公司,3-5年,本科,薪酬丰盛，福利待遇好，环境好，人际简单,岗位职责：1、负责公司产品服务器端开发及维护；2、负责实现产品功能系统设计和开发；3、负责服务器配置、部署和维护；4、负责服务器相关工具的开发；5、与团队成员密切协作完成功能开发；6、具备一定的团队管理经验。录用条件：1、服务端开发2年以上经验；2、本科及以上学历，精通php、go等一种以上语言，有PHP方面的优化经验；3、熟悉Mysql，并有一定的性能优化经验优先；4、有高并发处理经验， nosql使用经验，熟悉lnmp架构配置及linux常用操作；5、熟悉常用开源框架，和前端html/css/js等常用框架和技术；6、有支付系统经验者优先；7、会go语言开发者优先；8、有socks5相关的并发优先。,移动互联网,50-150人,php,郑州
高级php开发,https://www.lagou.com/jobs/6988440.html,郑东新区,8k-12k,河南夺冠互动网络科技有限公司,5-10年,大专,重点培养，前途无限,"岗位职责：1、根据公司的业务需要，负责核心模块的设计和开发工作；2、协助需求分析、系统构架、数据库设计文档编写工作；3、根据项目计划，按时完成制作任务。任职要求：1、3年以上PHP开发经验，有公众号或小程序项目开发经验者优先；2、精通PHP语言，能以OOP方式编写PHP，了解常用设计模式；3、熟悉javascript，SQL语句；4、有PHP框架开发项目经验，熟悉ThinkPHP、Laravel框架；5、使用过缓存,如redis和memcached。",移动互联网,150-500人,php,郑州
php开发工程师,https://www.lagou.com/jobs/6881905.html,高新区,6k-9k,锅圈供应链（上海）有限公司,3-5年,大专,福利好，晋升快，发展空间大,"二、职位描述：1、负责公司项目功能开发，维护及优化公司项目代码；2、编写核心代码，承担主要开发工作，对代码质量及进度负责；3、负责与其他系统数据接口程序的编写；数据库表结构设计；4、全日制大专及以上学历，计算机专业，3年以上开发经验，有B2B2C电商项目经验；三、岗位要求1、精通PHP语言基础,具有良好的OOP编程思想；2、熟练掌握MVC编程思想,熟悉TP、Yii等框架的使用；3、具有大型项目开发经验以及高并发、高安全性互联网服务经验；4、具备相关的技术文档编写能力；了解支付产品开发经验；5、熟练掌握 Mysql数据库操作,了解MyQL的主从复制、读写分离索引等设汁与优化；6、熟练 linux基本操作及环境搭建,了解 Nginx负载均衡等配置；7、熟练掌握 Memcache、 Redis等 Nosql数据库的使用；8、熟悉API接口开发,熟悉微信公众号、小程序及微擎开发；9、熟练使用GIT版本控制工具；熟悉常用的数据库、消息队列；10、熟悉web前端技术Html+ Css, Javascript和Ajax、Jquery等；11、熟悉Web开发,熟悉HTTP协议,对TCP有了解；12、有良好的团队合作精神，有强烈的责任感，上进心，强大的抗压能力；有大型网站开发经验者优先。",不限,500-2000人,php,郑州
php高级开发工程师,https://www.lagou.com/jobs/7211013.html,高新区,10k-20k,河南礼姑娘网络科技有限公司,3-5年,大专,年终2000-30000的年终红包,"MySQL，JS岗位职责：1、根据公司战略及业务部署工作，带领团队进行协作开发；年薪30W2、带领团队解决开发中的技术问题，推动产品功能实现，高效快速地响应各部门的需求；3、负责公司技术团队的建设与管理、培训，核心技术提升；4、负责全站的开发与维护，参与完成系统分析、设计，并主导完成详细的设计；5、负责现有PHP架构，找出系统瓶颈，改进系统算法，提高系统性能。任职要求： 1、 5年以上PHP实际运营项目开发经验、带团队经验；2、 精通PHP开发语言，有电商平台项目相关经验；3、手机APP软件开发4、 熟练应用MySQL数据库结构设计，熟悉数据库原理和常用性能优化技术；5、 熟练应用Javascript, Xml,ajax, Div+css等网站开发技术；6、 熟悉Linux系统常用命令；7、较强的感召力能力，独立解决项目中出现的突发问题；8、有管理能力，团队合作精神",电商,50-150人,php,郑州
php开发工程师,https://www.lagou.com/jobs/6548700.html,郑东新区,6k-12k,河南绿悦网络科技有限公司,3-5年,大专,试用期短、单双休、成长空间大,"岗位职责：1、负责公司现有PHP网站优化和新产品开发；2、按照项目计划，与项目组其他成员协同工作实现开发目的；3、协助工程师测试和发布系统，准备相关的技术文档，协助解决各种技术问题；4、负责文档撰写，在前期期间设计交付URL接口文档、模板数据描述文档，在编码期间能撰写清晰明了的注释。任职资格：1、具备3-5年左右PHP开发/技术支持经验，熟悉PHP面向对象的设计方法，熟练使用PHP常用MVC框架2、具有良好的代码编写能力和良好的代码编程习惯，具备快速解决问题的能力4、精通PHP+MYSQL编程，熟练使用CSS编写；5、熟悉主流开发框架及设计模式6、熟悉各种WEB缓存技术，熟悉大型网站架构及性能优化7、熟悉Mysql数据库应用开发，了解Mysql的数据库配置管理、性能优化，熟悉lumen，laravel,php7的优先8、至少一种PHPFramework(laravel、Yii、CI等)有一定的了解；具备良好的代码编程习惯及文档编写能力；9、至少具备一种SQL数据库(MySQ)使用经验，了解事务、行锁、表锁等。入职转正：试用期1-3个月，能力强者可提前转正工作时间：09:30-12:00 13:30-18:30（7.5小时）、单双休、国家法定假日薪酬福利：基本薪酬、绩效奖金、项目奖金、各类补助、节日福利、社会保险、年终盈利分红等",其他,15-50人,php,郑州
php开发工程师,https://www.lagou.com/jobs/6765198.html,二七区,7k-12k,北京云海航创网络科技有限公司郑州分公司,3-5年,大专,节日福利,技能要求：PHP，Linux，MySQL，Laravel，HISNPHP工作职责：1、负责公司现有项目的功能优化；2、进行新项目功能模块的设计开发工作，完善相应的开发文档；3、负责解决项目中存在的架构等技术问题；4、协作完成项目后台模块的设计，开发，联调，上线等工作；岗位要求：1、有3年以上的工作经验2、熟练使用MySql数据库 ，会 Thinkphp框架，会使用存储过程触发器3、可以独立完成项目，可以快速上手。如项目需要须了解市面常见的各种API接口，如微信，支付宝，物流等接口，要为程序的扩展性做好基础和优化。4、可独立编写程序使用的脚本语言函数代码。了解或熟悉面向对象模式。5、毕业于计算机等相关专业优先考虑，有音视频、直播类项目经验优先考虑。福利待遇：1、薪资结构=基本工资+绩效工资+项目奖金+管理津贴；2、免费宿舍，免费下午茶；,软件开发,15-50人,php,郑州
php架构师,https://www.lagou.com/jobs/7202931.html,高新区,7k-10k,锅圈供应链（上海）有限公司,5-10年,本科,福利好，发展空间大,二、职位描述：1.规划后台系统技术架构，参与需求分析，架构设计，技术决策以及详细设计；2.优化现有系统的性能，解决系统中的关键问题和技术难题；3.把握负责系统设计保证系统的架构质量，核心部分代码编写，指导和培养工程师；4.不断进行系统优化，满足高可用，高性能，高扩展行等需求。带领工程师攻克高并发，高可用等带来的各种挑战和技术难关； 三、岗位要求1.统招本科以上，计算机相关专业；2.精通liunx开发环境，计算机基础扎实，熟悉常用数据结构和算法，较强的逻辑思维能力；3.有大型分布式，高并发，高负载，高可用，高扩展系统设计，开发和调优经验；4. 精通PHP开发语言，熟悉主流互联网架构的各种组件，如消息队列，分布式缓存（Redis、Memcached）等；5．有一定的前端开发经验，了解主流 JavaScript 框架或库、熟悉搜索引擎优化；6.5年以上开发经验，2年以上大型项目架构经验，参与大型复杂分布式互联网Web，API系统的设计开发优先；,不限,500-2000人,php,郑州
php全栈,https://www.lagou.com/jobs/7214471.html,中原区,8k-16k,郑州小桔大数据有限公司,5-10年,本科,共同成就你我,1、电商平台独立开发2、熟悉多商户平台运营模式,"企业服务,不限",150-500人,php,郑州
PHP技术经理,https://www.lagou.com/jobs/7211231.html,高新区,10k-20k,河南礼姑娘网络科技有限公司,5-10年,大专,年终2000-30000的年终红包,"岗位职责：1、根据公司战略及业务部署工作，带领团队进行协作开发；年薪30W2、带领团队解决开发中的技术问题，推动产品功能实现，高效快速地响应各部门的需求；3、负责公司技术团队的建设与管理、培训，核心技术提升；4、负责全站的开发与维护，参与完成系统分析、设计，并主导完成详细的设计；5、负责现有PHP架构，找出系统瓶颈，改进系统算法，提高系统性能。任职要求： 1、 5年以上PHP实际运营项目开发经验、带团队经验；2、 精通PHP开发语言，有电商平台项目相关经验；3、手机APP软件开发4、 熟练应用MySQL数据库结构设计，熟悉数据库原理和常用性能优化技术；5、 熟练应用Javascript, Xml,ajax, Div+css等网站开发技术；6、 熟悉Linux系统常用命令；7、较强的感召力能力，独立解决项目中出现的突发问题；8、有管理能力，团队合作精神；",电商,50-150人,php,郑州
php开发工程师,https://www.lagou.com/jobs/6958339.html,管城区,6k-10k,河南沐芃信息技术有限公司,1-3年,大专,单双轮休，朝九晚六，节日福利，带薪休假,"岗位职责：1、根据产品需求，开发相关的软件系统；2、 保证开发的进度和代码质量；3、 负责系统后端的维护和优化；4、根据网站运营的需要进行临时开发任务。1. 会写优雅的代码，不仅于会复制粘贴，我们需要的是创造。掌握XML、HTML/XHTML、HTML5、CSS、Javascript、AJAX、JSON等Web页面技术。2. 不要告诉我你只会使用TP框架，我们要求至少熟悉两种PHP框架 , THINKPHP，会Laravel 框架的会优先考虑。3. Mysql不仅要会怎么用，想想怎么调优。4. 掌握一定的前端技能，原生js，Jquery，Vue等等。5. 熟悉使用git，不会的都不会考虑。6. 必须熟悉LAMP 或 LNMP 架构。7. 具有一定的沟通能力、协调能力和优秀的团队精神。8. 热爱开源社区且对自身技术提升具有强烈的学习欲望，有参与开源项目开发经验的优先考虑。9. 计算机专业毕业，有外包项目经验的优先考虑",移动互联网,50-150人,php,郑州
PHP开发工程师,https://www.lagou.com/jobs/3758877.html,郑东新区,9k-12k,河南华胜文化科技有限公司,3-5年,大专,"薪水高,CBD办公,工作餐,美女多","职位描述： 岗位职责： 1、负责协助技术总监进行技术评测，bug处理，代码开发; 2、负责网站数据库、栏目、程序模块的设计与开发; 3、负责根据公司要求进行电商，管理，教育培训，营销等项目开发; 4、定期与相关部门沟通，获取反馈信息并进行相应的处理; 5、定期维护网站程序，处理反馈回来的系统bug。 6、有电子商务系统开发经验者优先. 任职要求： 1、本科及以上学历，两年以上PHP开发经验 2、熟悉至少一种PHP应用框架，如ThinkPHP，Yii , Laravel5 ，lumen等3、熟悉MYSQL数据库设计和架构能力，具备一定的数据库设计能力和具备一定的性能优化的经验 4、熟练掌握html、css、js等一些常用的WEB基础知识。 5、熟悉xml、xhtml的应用,熟悉socket的客户端和服务端应用的开发 。6、有良好的团队合作能力，善于沟通，热爱学习,良好的代码习惯,能严格执行公司规定和公司的规章制度. 7、有了良好的团队配合意识和精神, 熟练使用GIT提交代码,及良好的团队配合度.","电商,广告营销",15-50人,php,郑州
php开发工程师,https://www.lagou.com/jobs/7055467.html,高新区,6k-8k,河南微潮汐信息技术有限公司,1-3年,大专,团队氛围活跃、不定期团建、转正交社保,1.计算机、通信、电子等相关专业本科以上学历，熟悉常用的数据结构、算法；2.具有2年以上PHP的项目开发经验，掌握LNMP开发及其工作原理，至少熟练使用PHP Laravel 框架，具有PHP扩展开发经验者优化；3.熟悉MySQL，具备MySQL优化经验，具有MySQL分区、分表等集群设计经验者优先；4. 熟悉Apache、nginx等服务器环境使用及优化；5.了解redis、memcache、mongodb等常用nosql的使用场景及各自的优缺点；6.熟悉TCP/IP原理，熟悉网络服务程序开发，对负载均衡、容错等有深入理解；7.熟悉Linux下编程，能熟练的编写Shell脚本；8.有web安全、性能优化、部署维护有经验更佳；9.具备良好的编码规范，及确保代码质量及可维护性的编码习惯；10.具备良好的分析解决问题能力，有独立承担任务的经验和系统把控任务进度的能力和责任心。,"移动互联网,教育",少于15人,php,郑州
php开发工程师,https://www.lagou.com/jobs/7163701.html,管城区,6k-10k,北京声动视讯科技有限公司,1-3年,大专,"五险一金,年底双薪,带薪年假,公司出游","职位描述：1.根据项目具体要求，承担系统或模块开发任务，按计划完成项目任务目标；2.负责公司商业化网站及相关功能、网站后端各种服务的研发；3.负责公司商业化网站的日常维护，bug修复、功能优化等；4.配合前端进行详细设计、代码开发，配合测试，高质量完成项目；5.负责相应业务数据库的设计；6.负责与App产品PHP接口及后台的制定开发；7.有IOS/Android手机应用开发，手机微信平台开发经验者优先；8.组织关键技术攻关，解决软件开发过程中遇到的技术难题；9.配合测试人员参与产品的集成测试；10.负责相应技术文档的编写；任职要求：1. 计算机及相关专业本科以上学历,至少2年以上开发经验;有大型项目经验的优先考虑；2. 精通PHP+MYSQL编程, 良好的PHP面向对象设计方法和编程思想,具有优良的编码习惯, 代码结构清晰、逻辑性强、冗余率低；3. 精通Web前端技术，包括Ajax、JavaScript、AJAX/JQuery，熟练使用Html、JQuery；熟悉DIV+CSS网页布局；熟悉html和css（html5+css3）；4. 熟悉Discuz /PHP CMS者优先，有互动社区类网站开发经验者优先；具有ThinkPHP或Kohana开发经验者优先；开发过服务端API者优先。5. 对用户体验、交互操作流程、及用户需求有深入理解；6. 对Mssql数据库优化有深入的理解；掌握MySQL并有相关的性能调优经验；7. 熟悉服务器环境的配置管理和优化；熟悉HTTP原理，socket编程，缓存技术、静态化等高级应用；熟悉Linux 系统环境常用命令。8. 了解网站的设计、规划和制作流程；能根据需求分析书进行类库及模块设计，有网站开发经验者优先；有金融行业开发经验及手机客户端开发经验优先","电商,金融",15-50人,php,郑州
php开发工程师,https://www.lagou.com/jobs/7156588.html,高新区,10k-15k,河南省小飞鱼电子科技有限公司,3-5年,不限,节日福利 定期团建 福利待遇优,"岗位职责：1、与产品、UI等进行良好沟通，能够快速理解需求，并进行相应的模块设计与开发；2、协同完成Web产品，APP后台的技术架构设计、数据库设计、接口设计以及相关文档的编写；3、独立完成Web产品，APP后台相关功能模块的编码及单元测试；4、熟悉电商系统，社交系统，叠销系统者优先。任职要求：1、5年以上PHP网站开发经验，拥有良好的代码习惯，代码结构清晰，命名规范，逻辑性强，冗余率低；2、掌握MVC开发模式，能够使用主流PHP框架（ThinkPHP5、CI、Yii、Laravel等）进行开发；3、能够使用MySQL数据库，能够编写高效SQL语句；4、熟悉面向对象的设计方法，对面向对象的设计模式有较深理解并能够熟练应用；5、掌握JQuery、XML、HTML、CSS、Javascript、AJAX、JSON等Web技术；6、掌握APP接口开发，并有实际项目经验，对接口安全，高性能有一定的理解；7、掌握WEB缓存，NoSql数据库技术，数据库原理和常用性能优化技术,；8、具有强烈的团队意识、具有良好的沟通理解能力，善于学习，乐于探索技术。9、熟悉网络编程，有过swoole扩展相关框架使用经验者优先。",电商,15-50人,php,郑州
php开发工程师,https://www.lagou.com/jobs/7161752.html,金水区,8k-10k,河南莲菜网络科技有限公司,3-5年,本科,发展前景,岗位职责：1、独立完成中等规模、大型规模系统的需求分析和设计工作，并按要求编写系统设计文档，负责关键系统的编码；2、根据设计文档完成复杂度较高模块及核心模块的架构和编码工作，并能高效率、高质量完成；3、能够独立开发功能型平台，如：系统开发、平台研发等；4、负责解决开发过程中的技术问题；5、对mysql数据库熟练操作，完成平台数据的正常备份等日常工作；6、根据公司需求，听从公司安排调度，踏实上进勤劳刻苦。任职要求：1、计算机或相关专业，本科及以上学历，有3年以上大中型互联网项目研发经验；2、熟练掌握ThinkPHP框架，能够独立承担项目模块开发任务以及能够独立进行整个系统的架构设计、模块分解、接口设计、系统集成，具有独立主导中等规模PHP Web应用系统的研发经验；3、熟悉相关Web开发技术、熟悉HTML、XML、JavaScript、 DHTML、CSS、Ajax、josn等技术。4、有订单管理系统，仓储管理系统，物流管理系统开发经验优先考虑。5、对数据库管理及优化有深入理解，具备良好的数据组构能力。,电商,150-500人,php,郑州
中级PHP开发,https://www.lagou.com/jobs/4932983.html,金水区,6k-8k,郑州易单信息科技有限公司,3-5年,大专,"工作自由,双休,交通补贴,节日福利",岗位职责：1、与产品、UI等进行良好沟通，能够快速理解需求，并进行相应的模块设计与开发；2、协同完成Web产品的技术架构设计、数据库设计、接口设计以及相关文档的编写；3、独立完成Web产品相关功能模块的编码及单元测试岗位要求：1、3年以上PHP网站开发经验，拥有良好的代码习惯，代码结构清晰，命名规范，逻辑性强，冗余率低；2、有熟练掌握thinkphp5框架，有微擎二次开发经验者优先；3、熟练使用MySQL数据库，能够编写高效SQL语句；4、熟悉面向对象的设计方法，对面向对象的设计模式有较深理解并能够熟练应用；5、掌握JQuery、XML、HTML、CSS、Javascript、AJAX、JSON等Web技术；6、有外贸电商系统二次开发经验者优先；7、具有强烈的团队意识、创新意识和高度的责任心，能承受压力按时完成任务；8、具有良好的沟通理解能力，善于学习，乐于探索，热衷于开发具有优秀用户体验的Web产品。,移动互联网,15-50人,php,郑州
php,https://www.lagou.com/jobs/7147697.html,金水区,6k-8k,河南玛顺信息科技有限公司,1-3年,不限,弹性工作制，可兼职,任职要求：1.具有1年或2年以上网站开发经验，具有大型网站/程序开发经验者优先；2.精通MVC框架，熟悉面向对象编程，具有PHP缓存技术使用、静态化设计方面的经验者优先；3.精通一种关系型数据库，具有数据库索引优化、查询优化和存储优化经验者优先；4.熟练掌握XHTML、CSS、DIV、Javascript等前端技术，有SEO经验者优先；5.熟悉一种以上php框架，有SaaS模式产品开发经验优先；6.熟悉LINUX，熟悉Apache或Nginx等服务器运维、优化者优先；7.学习能力强，思维活跃，工作认真负责，有较强的沟通能力和团队合作精神。8、熟悉Swoole／Ci／YII2／Laravel／CodeIgniter／ThinkPHP／ZendFramework2+一种或多种，优先考虑。工作职责：1.负责PHP程序的设计及编码；2.负责撰写所属模块的开发文档；3.负责PHP代码优化；职位诱惑：内训：公司提供各类与工作相关的培训沙龙外训：为符合公司发展需要的职业资质认证提供全额学费补贴公司实行“师傅带徒弟”的职业技能与企业文化传承模式,移动互联网,15-50人,php,郑州
PHP,https://www.lagou.com/jobs/7051199.html,郑东新区,10k-15k,郑州沙僧科技有限公司,5-10年,本科,周末双休、五险一金、六险一金,"岗位职责：1、制定接口规范并完成核心功能PHP代码实现；2、微服务架构的设计和落地；3、参与技术方案选型，包括框架选型，缓存模型设计以及线上运维；4、支持前端的api server开发，持续改进业务功能模块，维护线上代码的稳定运行；5、负责服务端人员的技术培养和能力提升。任职要求：1、本科及以上学历，计算机相关专业，5年以上PHP开发经验，熟悉常见的MVC框架；2、熟悉MySQL,Redis,Memcached,Mongodb，具有丰富的踩坑经验；3、具有丰富的LNMP环境系统维护经验；4、有良好的团队合作能力和沟通能力，善于思考，有独立分析和解决复杂问题的经验；5、有大型互联网企业服务端工作经验、有创业公司工作经历、参与过中大型项目的架构开发或核心功能开发优化考虑。加入我们你将得到：1.全面保障 ---- 签定劳动合同养老保险+医疗保险+工伤保险+生育保险+失业保险+大病医疗险2.上班时间---- 规律的工作生活 9:00-11:50   13:00-18:00；3.带薪休假 ----周末双休，提供国家规定的各类假期；4.人性化的员工关怀----节日福利、孝道基金、结婚/生子福利、团建活动；5.舒适的办公环境 ---- 绿地之窗5A级写字楼，环境良好，视野开阔；6.公司组织不定期国内外旅游、户外拓展培训等。","移动互联网,数据服务",15-50人,php,郑州
