job_name,job_url,job_location,job_salary,job_company,job_experience,job_class,job_given,job_detail,company_type,company_person,search_key,city
软件测试工程师,https://www.lagou.com/jobs/5751400.html,南山区,12k-16k,深圳易马达科技有限公司,1-3年,本科,弹性工作制 年中奖金 年终奖,"岗位职责：1、负责Android、iOS客户端APP,微信/支付宝等小程序测试；2、负责执行APP端的自动化测试，参与自动化测试框架搭建；3、负责跟进项目进度，并对产品质量的提升给出合理建议；4、负责优化测试工作、完善测试流程、把握项目进度和质量。任职要求：1、本科以上学历，两年以上Android、iOS客户端APP，微信/支付宝小程序测试经验；2、了解APP的基本运行原理，熟悉互联网项目快速迭代的开发和测试流程；3、具备python、java中的一门语言基础以及数据库语言；4、熟悉测试用例及测试文档、测试报告的编写，执行过UI自动化测试、接口测试、性能测试等；5、具有较强的洞察力、学习能力，较好的协调沟通能力及团队合作精神，较强的抗压能力。","硬件,移动互联网",150-500人,python,广东
测试开发工程师,https://www.lagou.com/jobs/7079456.html,南山区,15k-30k,TCL实业控股股份有限公司,3-5年,本科,带薪年假 弹性工作 五险一金 发展空间大,职责描述：1、参与测试开发方案的讨论、设计和实现；2、参与完善测试方法，提升测试效率和测试覆盖；3、自动化测试需求挖掘、方案设计及实现；4、负责完成自动化工具设计开发，钻研重难点技术，解决测试开发的技术难题。任职资格：1、本科及以上学历，具备良好的逻辑思维和学习能力；2、具备良好的测试设计/数据结构/算法等理论知识；3、对测试开发工作有浓厚兴趣，有丰富的测试开发经验；4、精通Python/Java等语言的使用，有AI技术、图像声音识别等开发经验者优先；5、积极上进，有责任心，有良好的团队合作和沟通能力。,"移动互联网,其他",2000人以上,python,广东
业务运维工程师,https://www.lagou.com/jobs/7129960.html,南山区,15k-30k,TCL实业控股股份有限公司,3-5年,本科,平台大，机会多,"岗位职责：1.保障业务平台稳定、安全的运行，做到及时快速响应。2.深入理解业务架构、分析瓶颈、提出并落地优化方案并推进实施。3.负责线上系统层面稳定性保障，系统监控、应用监控、日志监控、版本升级等。4.优化CI/CD流程，推动自动化系统建设。5.编写运维操作文档，输出自动化脚本或工具。任职资格：1、3年以上Linux/Unix系统运维经验；2、熟悉spring cloud微服务框架，具备故障分析和处理能力，能熟练使用相关命令和工具3、熟悉CI/CD流程，有自动化服务实际经验4、熟练掌握使用shell/python语言，有ansible二次开发经验优先.5、有网络分析经验， 理解TCP/IP、HTTP等协议,熟分析工具或命令，如tcpdump6、熟悉使用监控与日志类分析工具， 如ELK/FileBeat/Promethus/grafana等","移动互联网,其他",2000人以上,python,广东
测试工程师,https://www.lagou.com/jobs/6322733.html,南山区,10k-15k,深圳市玄关健康医疗互联网有限公司,3-5年,本科,五险一金，年度体检，团队旅游,岗位职责1、 根据测试需求进行分析，设计测试方案、测试计划和测试用例2、 搭建测试环境、结合测试用例进行手工测试与自动化测试，并进行BUG跟踪，推动问题及时解决，对自己所测试产品的质量负责；3、 独立进行功能测试、集成测试、回归测试、性能测试，并编写测试报告；4、 行测试经验总结，持续改进测试过程和测试方法，提升测试质量和效率；任职要求1、 计算机或相关专业本科及以上学历；2、 三年或以上移动、Web应用测试经验良好的测试分析能力，至少熟悉一门脚本语言(Python、perl、vbscript、Java)，能够独立编写代码的能力；3、 熟练使用selenium自动化工具4、 具备定义测试流程和测试规范能力，熟练编写测试脚本和测试用例；5、 熟练使用接口、性能等测试工具，Postman，Jmeter等6、 有良好的学习归纳总结能力，沟通能力，逻辑思维能力，具有较强的学习能力和团队合作精神。,"移动互联网,医疗丨健康",150-500人,python,广东
高级测试工程师,https://www.lagou.com/jobs/6951014.html,南山区,15k-20k,深圳市玄关健康医疗互联网有限公司,3-5年,本科,六险一金，年度体检，团队旅游,职责描述：1.负责公司产品客户端、服务端的测试开发工作；2.负责测试团队管理，提高团队技术水平，降低团队工作压力，提升工作效；3.负责把控项目进度指导测试工程师执行测试，解答测试疑问，与相关人员沟通，确保测试有效开展；4.负责测试团队的日常管理及绩效考核评估。任职要求：1.统招本科以上学历，计算机相关专业；2.3年以上H5、App、Web应用测试经验良好的测试分析能力，至少熟悉一门脚本语言（ Python、Java）；3.3-5年测试管理经验，拥有敏捷开发测试的经验；4.扎实的计算机基础和编程能力，熟悉SQL语句；5.至少熟悉python+selenium做web自动化，python+appium做app自动化，白盒测试等等其中一种；6.有良好的沟通协调能力、解决问题能力和逻辑分析能力；7.有很强的质量意识，事业心、责任心、领导力，具备团队协作精神。,"移动互联网,医疗丨健康",150-500人,python,广东
数据分析主管,https://www.lagou.com/jobs/5461924.html,南山区,15k-30k,深圳爱问科技股份有限公司,5-10年,本科,五险一金 带薪年假 年终奖金 年度调薪,岗位职责：1.  建立并完善数据体系，制定整体业务数据获取规范、流程、标准，并监督执行、优化；2. 根据业务部门运营需求，梳理标准化数据指标，并建立、维护自动化报表体系，监控并反馈业务运营状况；3、深入理解业务及产品，跨部门协调和沟通，响应临时性数据分析需求；4、分析数据成因及业务运营关联性，发现问题并为企业决策提供支持。岗位要求：1、本科以上学历，统计、数学、计算机信息工程等专业优先；2、三年以上互联网行业工作经验，五年以上数据分析经验；3、具有扎实的统计学、数据分析、数据挖掘基础，熟悉数据分析、数据挖掘的手段；4、对数据敏感，归纳、分析能力强，做事严谨细致；5、有数据平台搭建等相关经验；6、精通office系列软件，熟练access、mysql等数据库软件，熟悉SPSS 、Python、MATLAB等软件；,"移动互联网,社交",150-500人,python,广东
高级数据分析师（ AW),https://www.lagou.com/jobs/3371931.html,南山区,18k-28k,深圳爱问科技股份有限公司,5-10年,本科,五险一金 年底双薪 带薪年假 节日福利,岗位职责：1、监控运营进度，策略性经营分析；2、能针对具体指标或业务做专项分析报告，并提供可行性建议；3、能提供通过数据挖掘做出预测性分析报告，并协助领导层决策；4、完善数据体系，对新业务线的数据体系搭建，优化业务部门数据报表5、数据存储与管理，定期整理数据及备份，跟踪异常记录6、人员管理并协助各部门运营工作，并及时提供有效数据岗位要求：1、本科以上学历，统计、数学、计算机信息工程等专业优先；2、三年以上互联网行业工作经验，五年以上数据分析经验；3、具有扎实的统计学、数据分析、数据挖掘基础，熟悉数据分析、数据挖掘的手段；4、对数据敏感，归纳、分析能力强，做事严谨细致；5、精通office系列软件，熟练access、mysql等数据库软件，熟悉SPSS 、Python、MATLAB等软件；有数据挖掘或建模应用经验；,"移动互联网,社交",150-500人,python,广东
c++开发工程师,https://www.lagou.com/jobs/6679257.html,南山区,13k-18k,深圳市金证科技股份有限公司,1-3年,本科,五险一金、带薪年假、股权激励,岗位职责：后台基础架构开发&维护，并对公司业务部门提供技术支持；岗位要求：• 熟悉操作系统，能够无障碍在windows/linux平台开发和调优，• 了解进程调度，线程同步，Socket通讯，协程相关原理等• 主要使用c/c++语言，有Python或PASCAL使用经验加分；**期间，无法安排至公司现场面试，一律采取远程面试安排。,金融,2000人以上,python,广东
数据分析师,https://www.lagou.com/jobs/7139824.html,天河区,6k-10k,广州海货信息科技有限公司,3-5年,本科,双休 六险一金 弹性上下班,工作职责：1.理解公司业务方向与战略，为公司运营决策、产品方向、销售策略提供数据分析；2.通过行业、产品、客户等维度进行商业数据建模，为决策层提出合理的优化建议，促进运营决策的优化，定期输出可读性强的分析报告及数据营销模型并应用于实践；3.构建用户/商品等标签体系，能根据市场变化维护及优化数据标签指标；4.构建会员及产品生命周期，挖掘各个周期特征及转化规律，并结合标签特征挖掘精准营销客户，给运营及会员营销提供有效建议，并形成效果跟踪和优化迭代；5.与技术部门沟通，实现数据报表智能化；具备职能：1.本科以上学历，3年以上数据统计和运营分析经验，有电商平台公司工作背景优先；2.良好的数据敏感度，能从海量数据提炼核心结果，具备独立编写数据分析报告的能力；3.熟练使用EXCEL和SQL，拥有一定的统计基础，对R、Python等统计建模软件有一定了解；4.熟悉数据行业前沿的技术，熟悉gio等数据分析工具；5.善于沟通，具备较强的逻辑能力和跨团队协作能力，有责任感，抗压能力强。,电商,500-2000人,python,广东
RPA(机器流程自动化) 高级咨询顾问,https://www.lagou.com/jobs/5698794.html,天河区,15k-25k,德勤企业咨询（上海）有限公司,3-5年,本科,五险一金 绩效奖金 管理规范 外资平台,"1. 德勤机器人研发和实施2. 流程优化咨询及流程机器人方案设计3. 流程机器人项目管理任职要求：1、1年以上流程机器人开发和实施经验，熟悉UiPath，Blueprism等优先 2、计算机、信息系统管理、软件、统计、数学等工科专业 3、具有VBA，.net, Python等开发经验者优先 4、认真仔细，具备快速学习能力、良好的沟通能力与抗压能力； 5、职业发展规划与本职业高度匹配，愿意在此行业长期发展工作地址",金融,2000人以上,python,广东
经理 / 副总监 - 云安全咨询 - 科技风险咨询,https://www.lagou.com/jobs/6740552.html,罗湖区,40k-70k,德勤企业咨询（上海）有限公司,10年以上,本科,五险一金 绩效奖金 管理规范 外资平台,"Responsibilities:• Supporting clients' cloud transformation including advising their operations on AWS, Azure, Google Cloud Platform (GCP), and AliCloud, etc. and addressing their needs in terms of security needs and working tightly with the privacy team to support compliance in the cloud;• Analyzing the specific risks and conducting technology reviews on latest developments in the related security products and technologies that may drive changes in the cybersecurity strategies, policies and processes;• Supporting clients in defining security requirements for Cloud adoption such as: SaaS software or platform (i.e. Office 365, etc.), design and development of cloud based applications, use of DevOps in the cloud, cloud managed services like (DB, SOC/SIEMs, Automation Frameworks, Data Lakes, etc);• Designing and producing the relevant security processes and components to operate in the Cloud (including provider/third party components), work on Blueprints and documentation, and advise on cost/benefits of chosen services;• Implementing major infrastructure management platforms (e.g. BMC, HP, CA, VMWare, etc.), service catalog, virtualization, automation, orchestration (e.g. Chef, Puppet) and public cloud vendors (e.g. AWS, Rackspace, GCP, Azure and Office 365 etc.);• Integrate security touch points to various security systems SOC, CASB and cloud native security offerings such as Azure security analytics and AWS cloud watch;• Ability to guide teams through the design and implementation of cloud security solutions that reduce vulnerability, strengthen controls and optimize organizational efficiency;• Ability to build an in-depth knowledge of the client’s business and stay up-to-date on industry activities, marketplace trends, innovation efforts, and leading practices;• Ability to develop relationships, establish credibility with, and instill confidence in clients.Requirements:• Bachelor degree or above Computer Science, Information Technology, Information Systems, or other related disciplines• At least 7 years of working experience in Cloud solution and architecture security;• At least one Security certification of CISSP, CCSP, SANS CCSK and Product certification (such as AWS SA Pro) in the related technologies is preferable;• Required cloud-ready architectures utilizing infrastructure and platform cloud services for AWS, Azure, Google Cloud Platform (GCP), or AliCloud; Containers & container management including Docker, Kubernetes;• Preferred network and SDN related knowledge, such as enterprise networks (Routing & Switching, Wireless, VPN etc.), design and implementation of software defined networking in a cloud environment.• Required knowledge of application architecture and security testing;• Experienced in Software Development and are skilled in one or more general purpose programming languages, particularly Python, Java, and JavaScript are preferred but not required;• Experienced in IoT/ICS/AI security/Big Data Security is a plus;• Strong analytical skill with high commitment to quality client service;• Strong consultation and communication skills, self-initiation, good team player and willingness to work under pressure;• Strong business development and clients relationship maintenance ability, in possess of market insight in cloud security area;• Mature, proactive and committed;• Excellent project management, people management and interpersonal skills;• Excellent written and oral communication skills in both English and Mandarin Chinese, including both technical and business writing, good documentation and presentation skills;• Willing to travel.",金融,2000人以上,python,广东
深度学习算法工程师,https://www.lagou.com/jobs/6540899.html,南山区,20k-40k,深圳迪巨智能科技有限公司,1-3年,硕士,公司重点项目,职位描述：1.负责人工智能/机器学习/深度学习的算法研究；2.负责算法在运动智能、大数据分析等现实问题中的模型实现和项目落地；3.负责应用模型的开发、监控、改善、优化、迭代工作；4.基于海量数据和真实需求，对业务问题进行定义、分析、方案制定及实施；5.负责对国内外最前沿技术和应用进行跟踪和学习，并结合公司业务情况进行技术预研和项目规划。任职要求：1.统计、运筹、数学、应用数学、物理、信息技术、计算机等相关专业硕士及以上；2.拥有扎实的数学功底，对深度学习方法、数据处理等领域有深入研究和独到见解；3.两年及以上数据挖掘、深度学习等相关经验，具备较强的工程实现能力，至少使用深度学习技术解决过一个实际问题；4.具有较强的编程能力，熟悉C/C++、Python/Matblab；5.熟练使用Pytorch、Caffe、Tensorflow等框架至少其中之一；6.在相关领域内的学术会议上发表过相关paper优先；7.具备强烈的责任心和团队合作精神，能承受较强的工作压力，有强烈的学习意愿、有良好的自我驱动能力。,"硬件,人工智能",15-50人,python,广东
软件架构工程师,https://www.lagou.com/jobs/6234861.html,南山区,15k-30k,深圳迪巨智能科技有限公司,5-10年,本科,公司重点项目,"岗位职责：1. 负责公司大数据存储平台和后端开发、测试、优化和维护工作；2. 负责功能开发与代码维护，编写开发接口及文档；3. 负责应用功能设计和方案讨论，编写设计文档；4. 参与基于分布式存储的大数据分析平台的建设；5. 完成上级领导交办的其它工作任务。任职要求：1. 本科及以上学历, 计算机相关专业；2. 精通python编程，熟练运用MVC框架，理解OOP思想,具有2年以上相关开发经验；3. 熟悉RabbitMQ、ActiveMQ等MQ中的一种或几种的使用，掌握MQ的使用方法；4. 熟练使用linux系统，掌握Linux常用命令；5. 能够独立的进行项目部署、发布等工作；6. 具备强烈的责任心和团队合作精神,能承受较强的工作压力,有强烈的学习意愿、有良好的自我驱动能力。","硬件,人工智能",15-50人,python,广东
高级软件测试工程师,https://www.lagou.com/jobs/6897550.html,南山区,15k-25k,万兴科技集团股份有限公司,3-5年,本科,发展空间大,岗位职责：1、负责移动端音视频编辑工具的测试2、参与产品需求分析，制定测试策略、方案及计划，结合用户场景多角度进行测试用例的设计3、执行测试，分析和定位测试发现的问题，推动问题及时解决，保证项目的测试进度和质量4、引进测试工具和测试方法，提升团队的测试质量和效率任职要求：1、本科以上学历，三年以上移动端测试经验，能够独立负责产品测试工作 2、了解Android/iOS系统特性，熟悉移动端的测试流程和测试技术，测试工具等3、熟悉python语言，移动端自动化测试框架，具有编写自动化脚本的实战经验4、具有很强的质量和责任意识，快速适应能力，具有一定的抗压能力；良好的团队合作精神和积极主动沟通的意识5、具有音视频编辑工具测试经验优先,移动互联网,500-2000人,python,广东
c++开发工程师,https://www.lagou.com/jobs/6933275.html,南山区,14k-20k,万兴科技集团股份有限公司,3-5年,本科,上市公司；带薪年假；五险一金；团队氛围好,岗位职责：1、负责工具类产品部分模块的研发；2、负责基于x86和ARM架构的Linux系统下产品的研发、编译和打包；3、负责产品的性能优化。岗位要求：1. 计算机等相关专业本科以上学历；2. 精通C++，熟悉C++11、boost，熟悉面向对象；3. 熟悉STL中常用的数据结构和算法的实现和复杂度；4. 熟悉Linux平台开发，熟悉Python或Shell；5. 熟悉Linux下rpm和deb两种打包方式。6. 有良好的沟通能力和团队合作能力，善于沟通，自主驱动，具备良好的问题定位分析能力。,移动互联网,500-2000人,python,广东
资深客户端开发工程师,https://www.lagou.com/jobs/6681716.html,天河区,15k-25k,厦门吉比特网络技术股份有限公司,1-3年,本科,"上市公司,福利好,平台大,发展空间大","岗位职责：1.负责实现游戏系统功能模块实现；2.能独立完成策划需求功能；3.能与团队其他成员协作沟通，解决技术难题。任职要求：1. 2年以上手游客户端开发经验，至少1款完整的项目经历；2.有Unity客户端3D游戏开发经验, 熟悉Unity引擎，掌握大部分Unity引擎组件的使用和开发；3.掌握C#，并熟悉一种脚本语言（Lua、Python）；4.具备良好的编程能力、编程习惯和代码风格，熟悉面向对象设计模式。5.全日制大学本科、计算机相关专业科班毕业；6.有Shader开发经验、熟悉卡通渲染开发经验者优先；7.喜爱二次元游戏，思维灵活；8.对女性向产品有一定兴趣和认可度。",游戏,500-2000人,python,广东
资深u3d客户端开发工程师,https://www.lagou.com/jobs/7081939.html,天河区,15k-30k,厦门吉比特网络技术股份有限公司,3-5年,本科,六险一金、带薪年假、免息购房借款,"岗位职责：1.负责实现游戏系统功能模块实现；2.能独立完成策划需求功能；3.能与团队其他成员协作沟通，解决技术难题。任职要求：1. 2年以上手游客户端开发经验，至少1款完整的项目经历；2.有Unity客户端3D游戏开发经验, 熟悉Unity引擎，掌握大部分Unity引擎组件的使用和开发；3.掌握C#，并熟悉一种脚本语言（Lua、Python）；4.具备良好的编程能力、编程习惯和代码风格，熟悉面向对象设计模式。5.有Shader开发经验、熟悉卡通渲染开发经验者优先；6.喜爱二次元游戏，思维灵活；7.对女性向产品有一定兴趣和认可度。",游戏,500-2000人,python,广东
技术美术,https://www.lagou.com/jobs/4882054.html,南山区,25k-35k,深圳易帆互动科技有限公司,3-5年,本科,年度旅游、六险一金、带薪年假、健身房私教,"工作内容：1.连接美术和开发团队，支持游戏美术效果实现，把控游戏制作的风格和美感；2.根据美术需求，编写材质球shader；3.与开发团队合作，对游戏3D效果、动画节奏、特效效果等进行调优；4.研究游戏美术内容制作的各项工具使用、游戏引擎各项功能、帮助美术人员使用引擎和工具；5.维护游戏美术内容开发流程、规范、以及引擎工具的使用，确保美术资源符合引擎规格；6.编写和维护游戏引擎功能使用、游戏美术资源开发的技术文档。工作要求：1.本科以上学历；3年以上游戏开发经验，至少2年以上技术美术工作经验，有完整游戏上线经验者优先；2.熟悉至少一类开发引擎, Unity3D优先；熟悉渲染管道和shader编程；熟练使用Max Script 或 Mel、 Python，3.精通使用 3DMax 或 Maya；4.有较好的美术专业能力及较高的审美能力，精通于游戏美术各类资源开发的流程和规范，对计算机图形图像技术和游戏机硬件有深入的了解；5.能有效与策划、程序进行项目协同开发，协助解决美术和程序之间的技术问题；6.良好的沟通能力，积极主动，乐于助人。","移动互联网,游戏",150-500人,python,广东
测试开发工程师（移动端）,https://www.lagou.com/jobs/5961040.html,南山区,25k-45k,广发证券股份有限公司,3-5年,本科,"季度奖,年终奖,牛人多,环境好",岗位职责： 1、根据用户需求规格说明书，确定测试目标与成果，评估风险和测试优先级，并据此制定测试计划。制定测试策略和设计测试过程、保证测试的效率和质量。完成自动化测试部分工作。2、负责发现并推动及时解决对质量有严重影响的缺陷，来推进项目或产品的质量水平。3、负责测试结果的统计分析，评估测试生产率、有效性和完备性。4、负责编写所承担软件部分的测试设计文档，并指导他人进行测试设计。5、按照测试设计文档，负责执行所承担软件部分的测试过程，收集和管理测试数据，提交缺陷报告，并反馈和跟踪缺陷的修改。   岗位要求： 1、3年以上金融行业测试经验优先，了解恒生柜台系统测试经验优先。2、熟悉Android或iPhone App自动化测试，精通一种以上app自动化测试框架， 3、熟悉app的测试，对功能测试、单元测试、集成测试、系统测试有独到的见解和方法。4、熟悉一门脚本语言，如Python，PHP等。5、工作细心，耐心，有责任心，有较强的沟通能力和团队协作精神。6、抗压能力强，富有激情，能胜任重复性的工作和能快速融入节奏的工作环境。,金融,2000人以上,python,广东
