job_name,job_url,job_location,job_salary,job_company,job_experience,job_class,job_given,job_detail,company_type,company_person,search_key,city
ETL开发工程师,https://www.lagou.com/jobs/7137969.html,高新区,10k-15k,万商云集（成都）科技股份有限公司,3-5年,本科,"国内国外游,免费健身,节日福利,双休",岗位职责：1、负责数据仓库系统的数据库模型处理； 2、负责数据仓库系统在数据库层的落地实施（建表设计SQL设计脚本等）； 3、负责数据仓库系统在数据库层的调优； 4、负责数据仓库的脚本运维；5、配合业务库对应数据仓库上的变更工作； 6、完成产品经理项目经理交代的其它任务。职位要求：1、3年及以上大数据行业经验；2、熟悉ORACLE/MYSQL数据库；3、熟悉LINUX操作系统 具备java scala 编程能力；4、具备HQL，SPARK等开发及调优能力；5、有大数据平台开发的经验优先；6、熟悉大数据常用操作命令，及线上问题排查能力者优先；,"移动互联网,电商",500-2000人,spark,成都
高级数据开发工程师,https://www.lagou.com/jobs/7137939.html,高新区,15k-25k,万商云集（成都）科技股份有限公司,5-10年,本科,"国内国外游,免费健身,节日福利,双休",岗位职责： 1. 负责公司数据中台项目的数据处理，设计数据采集、存储及清洗方案，实现数据的规模应用； 2. 负责大数据平台技术框架的选型、技术难点攻关和技术方案规划及设计。3. 负责跟进hadoop生态体系中前沿的技术解决方案，形成公司级的技术储备。 岗位要求： 1. 计算机软件相关专业本科以上学历； 2. 3年以上大数据处理，大规模的数据分析和算法实践； 3. 精通hadoop Spark编程，熟悉Hadoop生态圈，能运用其解决问题，熟悉Mysql、Redis 等常用SQL和NoSQL数据库；4. 至少熟练掌握Java、Scala、Python、Golang等两种以上语言；5. 有丰富的大数据集群部署和维护管理经验；6. 具备优秀的团队意识和沟通能力，学习能力和主动性强，具有钻研精神，充满激情，乐于接受挑战。,"移动互联网,电商",500-2000人,spark,成都
数据仓库开发工程师,https://www.lagou.com/jobs/7147721.html,高新区,10k-15k,成都极米科技股份有限公司,不限,本科,独角兽 数据仓库,,"电商,硬件",500-2000人,spark,成都
推荐算法工程师,https://www.lagou.com/jobs/6374855.html,高新区,15k-25k,成都极米科技股份有限公司,1年以下,硕士,年终奖励，定期体检，弹性工作,,"电商,硬件",500-2000人,spark,成都
中级运维工程师,https://www.lagou.com/jobs/7173276.html,双流区,10k-15k,贵州海康交通大数据有限公司,3-5年,本科,14薪；五险一金；节假日福利,"任职要求1、有3年以上运维工程师经验，精通Linux系统的管理和维护，熟悉多种 Linux 发行版（Debian/Centos）；2、精通常见服务的安装配置、熟练掌握Apache,Nginx、Redis等常用软件的安装、配置、管理和优化，有nginx开发经验者优先；3、精通和灵活运用1种以上的脚本语言，包括：Shell(必备)、PERL、PHP、Python等；4、熟悉至少一款常用监控管理系统Nagios/Zabbix/Prometheus，能熟练排查运维过程中的服务故障、系统故障、网络故障；5、熟悉各类网络协议，熟悉各类网络产品（交换机、路由器、防火墙等）的配置和管理，能够对网络产品进行简单配置；6、熟悉常用的持续集成系统，对devops有一定的理解，熟悉自动化部署，能够使用常用的工具；7、熟悉MySQL数据库的主从同步、读写分离、集群搭建、能够熟练的运用SQL语言；8、熟悉分布式架构的相关技术，如：LVS、redis、rabbitmq等；9、了解hadoop生态体系相关技术，如：cdh、flume、zookeeper、kafka、sqoop、kettle、storm、spark等，有部署维护经验更加；10、高度的责任感，较强的故障分析及排除能力，善于在工作中学习，能够承受一定的工作压力。11、能够适应短期出差。岗位职责1、负责linux/windows服务器、网络安全设施的配置，维护，监控，调优，故障排除等2、对系统在日常运维过程中出现的系统异常情况进行分析排查，保证系统正常运行；3、对数据库进行数据备份、数据监控、应急响应、故障排除、编写数据分析报告等4、大用户量下高性能服务器系统部署方案的制定及实施5、汇总应用系统运维过程中的技术问题，提出持续优化需求并跟踪问题解决进度；6、负责在线服务的24*7监控响应，解决运营中遇到的各种问题，总结解决方案整理存档；7、负责项目现场环境部署和调试。","移动互联网,数据服务",50-150人,spark,成都
大数据开发工程师（研发中心）,https://www.lagou.com/jobs/7049359.html,锦江区,10k-15k,四川久远银海软件股份有限公司,3-5年,本科,五险一金，年终奖，生日福利,1、本科及以上学历，数学、计算机等相关专业，3年以上大数据开发经验；2、熟练应用java/python/scala编程，熟悉R编程者优先；3、熟练应用hadoop、spark、hive等分布式框架，可以搭建分布式运行环境；4、熟悉Java/scala与R/python等算法分析语言的编程接口；5、熟悉Java/scala与Oracle/nosql/gbase等数据库的编程接口；6、熟悉了解数据挖掘等相关知识。,"移动互联网,硬件",2000人以上,spark,成都
数据分析师（数据挖掘工程师 ）(研发中心),https://www.lagou.com/jobs/6827601.html,锦江区,10k-15k,四川久远银海软件股份有限公司,3-5年,本科,五险一金，年终奖，生日福利,1、本科及以上学历，数学、计算机等相关专业，3年以上数据分析或者算法应用经验2、熟练应用R/python、sql编程，熟悉c/java等编程3、熟悉常用的数据挖掘算法，对数据结构和算法设计有较深刻的理解4、有具体落地项目经验，能很好的解读业务需求5、熟悉Spark、TensorFlow等主流框架者优先,"移动互联网,硬件",2000人以上,spark,成都
高级大数据开发工程师,https://www.lagou.com/jobs/5896605.html,高新区,20k-30k,四川生学教育科技有限公司,3-5年,大专,五险一金+绩效奖金+优厚福利+发展空间,岗位职责：1. 负责区域项目上的数据处理，设计数据采集、存储及清洗方案，实现数据的规模应用；2. 负责跟进hadoop生态体系中前沿的技术解决方案，形成公司级的技术储备。任职要求:1. 本科或以上学历，计算机软件相关专业优先；2. 3年以上大数据处理，大规模的数据分析和算法实践；3. 精通hadoop / Spark编程，或者具有其他并行计算的实践经验；4. 熟悉Mysql/Redis 等常用SQL和NoSQL数据库；5. 至少熟练掌握Java、Python等两种以上语言；6. 熟悉Hadoop、Spark生态圈，能运用其解决问题；7. 有丰富的大数据集群部署和维护管理经验；8. 良好的沟通，团队合作意识，非常强的学习能力；9. 对教育行业充满热情，责任心强，良好的跨团队合作和组织协调能力，能够应对复杂产品线的挑战。福利待遇：1.超出行业平均水平的薪资，多少全凭能力决定；2.享受五险一金，并提供餐补、交通补贴等；3.公司发展离不开员工的努力，员工重大事件公司将慰问及关怀；4.弹性工作制，全天7H工作时间，完美避开上下班高峰时段；5.享受国家法定假日及周末双休，享有带薪年假、病假、调休假等；6.每月举行一次Birthday Party，日常工作日茶餐厅提供饮料、零食、水果等；7.传统佳节会有高标准的节日礼金或礼品；8.每年将进行豪华套餐的健康体检；9.在超过2000平舒适的工作区域工作，保证最佳工作状态。,"移动互联网,教育",150-500人,spark,成都
Java开发工程师,https://www.lagou.com/jobs/1624508.html,高新区,5k-10k,成都任我行软件股份有限公司,1-3年,本科,五险一金双休项目奖金年终奖餐补班车旅游,"岗位职责：1、依据需求文档，承担核心设计、开发工作，按要求、高质量地完成软件模块的分析、设计、开发、测试，确保进度和质量；2、配合项目负责人，完成项目前期工作的开展，包括技术调研，文档编写等。任职要求：1、本科学历，计算机相关专业，两年以上java项目开发经验； 2、熟悉J2EE相关技术，Jsp、Servlet、JDBC、JMS等； 3、精通Java及面向对象设计开发，熟悉主流框架SpringMVC，Spring boot，Spring Cloud，dubbo等；4、熟悉大数据开发Hadoop、HBase、Hive、Spark等，有大数据开发经验，微服务经验；5、熟悉HTML5, CSS, JQuery, Ajax等前台技术；6、熟练掌握MYSQL,SQL语言，具有MySQL数据库开发经验。","移动互联网,企业服务",500-2000人,spark,成都
数据工程师,https://www.lagou.com/jobs/7066376.html,郫县,18k-30k,北京万里开源软件有限公司,5-10年,大专,缴纳全额比例公积金,"职责：1、负责海量数据的处理、分析、挖掘，大数据平台通用数据处理开发;2、数据分析体系的数据建模、统计及分析；3、负责数据ETL处理。4、配合标准化产品的本地部署和实施。要求：1、本科及以上学历，三年以上工作经验，有TB、PB级数据分析和处理经验优先；2、精通SQL开发(ORACLE,DB2,sybase IQ,Mysql,Postgresql等一种或多种);3、熟悉Linux系统，具备shell、perl等脚本开发能力；4、熟悉大数据技术(hadoop、spark等)，并具备一定的数据处理开发经验;5、了解Nginx,Tomcat，ActiveMQ等中间件，Memcached内存对象缓存系统,并会简单安装及错误分析;6、熟悉国网业务，了解JAVA开发者优先;7、熟悉阿里DataWorks或华为DaYu者优先。",数据服务,150-500人,spark,成都
java开发工程师,https://www.lagou.com/jobs/6958983.html,郫县,8k-12k,易宝软件科技（南京）有限公司,1-3年,本科,周末双休 带薪年假 每年两次调休机会,负责服务平台的开发岗位要求：1. 统招211及以上学历，计算机或软件等相关专业； 2. 2年以上Java开发经验，具有扎实的Java基础，熟悉Java多线程、并发相关知识；3. 熟悉并掌握Spring，SpringMVC，MyBatis或Hibernate等主流开源Web应用框架以及Web微服务框架；了解docker、spark尤佳；4. 熟悉常用Linux命令，熟悉服务器应用部署；5. 熟练掌握Oracle、MySQL等常用数据库；6. 熟悉分布式架构如dubbo + zookeeper或者springcloud + eureka等更佳；7、有良好的沟通能力和团队协作精神，严谨的工作态度与良好的质量意识。,移动互联网,150-500人,spark,成都
大数据运维工程师,https://www.lagou.com/jobs/6537101.html,武侯区,8k-12k,厦门科拓通讯技术股份有限公司,1-3年,本科,独立团队 双休弹性上下班 不定时腐败,"岗位职责：1. 负责公司大数据基础平台的运维,保障平台的稳定可用；2. 负责数据应用产品部署、上线及维护；3. 负责大数据平台资源管理、性能优化和故障处理；4. 深入研究大数据业务相关运维技术，持续优化集群服务架构;5. 参与设计大数据自动化运维、监控、故障处理工具。岗位要求：1. 本科及以上学历，计算机相关专业，2年以上大数据平台的运维经验；2. 掌握Hadoop、Hive、Spark、Hbase、Kafka等的原理，部署，维护，调优；3. 熟悉HDP或CDH，有实际部署、维护及优化经验；4. 掌握Linux系统环境的配置和优化，熟练部署各种应用服务，独立处理系统故障；5. 至少掌握Shell/Python/Java语言的一种；6. 强烈责任感，对生产环境服务高可用有敬畏之心,良好的团队合作意识和服务意识。","硬件,企业服务",500-2000人,spark,成都
大数据开发工程师,https://www.lagou.com/jobs/6428156.html,武侯区,15k-25k,厦门科拓通讯技术股份有限公司,5-10年,本科,独立团队 双休弹性上下班 团建活动丰富,"岗位职责：1、负责离线，实时数据集市等数据集市规划、研发；2、负责数据管理平台、开放服务、交换服务、质量服务等数据中台服务设计、研发；3、其他大数据产品设计、研发等相关工作。任职要求：1、本科及以上学历，5年以上工作经验，至少3年大数据开发经验；2、有实际的数据仓库开发和数据建模经验，熟悉BI工具软件优先；3、精通Java、python等主流编程语言；熟悉Hadoop、Hive、HBase、Spark、Flink、Kylin、ES，ClickHouse, MongoDB, Ignite等技术；4、掌握多线程及高性能程序设计编码及性能调优，有高并发应用开发经验；5、熟悉消息，缓存技术、服务器优化、集群性能优化、系统性能调优等技术；6、工作态度积极主动、细致、有全局观；具有较好抗压能力；善于与他人合作，具有良好的团队合作意识；","硬件,企业服务",500-2000人,spark,成都
大数据项目经理,https://www.lagou.com/jobs/6388109.html,武侯区,15k-25k,北京芯盾时代科技有限公司,3-5年,本科,"五险一金,工作居住证,节日福利,出国旅游",岗位职责：1、参与及负责大数据项目的实施落地。2、负责大数据产品相关文档编写及培训等工作。3、深入理解公司大数据平台架构，发现并解决性能瓶颈，支撑业务和数据量的快速增长。4、协助客户参与各种环境业务系统的投产及技术支持。5、协调项目资源，对于项目实施进度的规划、控制、监督和管理。6、负责与公司内相关部门沟通协调，制定整体方案，推进项目执行。7、负责定期汇报项目状态，跟进项目问题风险。 任职要求：1、熟悉Linux操作系统常用命令。2、熟悉Tomcat、Weblogic基本操作及调优。3、熟悉MySQL、Oracle安装及相关配置，熟悉SQL基本操作。4、熟悉Hadoop、Redis、ElasticSearch、HBase、Spark、Storm、Kafka等大数据组件，对离线计算、内存计算和流式计算均有较为深刻理解。5、有一定的Java开发能力者优先。6、熟练掌握Power point、Excel、Project、Visio等工具。7、熟悉软件项目管理过程，具有较强的项目管理能力和沟通协调能力。8、具有较强的大局观，能够统筹跨团队项目，具有丰富的项目组织及人员管理经验，能够有效管理项目团队。9、具备较强的语言表达能力，能与客户顺畅沟通或产品介绍。10、具备较强的学习与动手能力，能够适应出差。,"移动互联网,信息安全",150-500人,spark,成都
大数据项目实施,https://www.lagou.com/jobs/7092022.html,高新区,15k-25k,北京芯盾时代科技有限公司,3-5年,本科,晋升空间、年终奖,1、参与及负责大数据项目的实施落地。2、负责大数据产品相关文档编写及培训等工作。3、深入理解公司大数据平台架构，发现并解决性能瓶颈，支撑业务和数据量的快速增长。4、协助客户参与各种环境业务系统的投产及技术支持。5、协调项目资源，对于项目实施进度的规划、控制、监督和管理。6、负责与公司内相关部门沟通协调，制定整体方案，推进项目执行。7、负责定期汇报项目状态，跟进项目问题风险。 任职要求：1、熟悉Linux操作系统常用命令。2、熟悉Tomcat、Weblogic基本操作及调优。3、熟悉MySQL、Oracle安装及相关配置，熟悉SQL基本操作。4、熟悉Hadoop、Redis、ElasticSearch、HBase、Spark、Storm、Kafka等大数据组件，对离线计算、内存计算和流式计算均有较为深刻理解。5、有一定的Java开发能力者优先。6、熟练掌握Power point、Excel、Project、Visio等工具。7、熟悉软件项目管理过程，具有较强的项目管理能力和沟通协调能力。8、具有较强的大局观，能够统筹跨团队项目，具有丰富的项目组织及人员管理经验，能够有效管理项目团队。9、具备较强的语言表达能力，能与客户顺畅沟通或产品介绍。10、具备较强的学习与动手能力，能够适应出差。,"移动互联网,信息安全",150-500人,spark,成都
云应用平台工程师,https://www.lagou.com/jobs/7082115.html,锦江区,12k-20k,北京青云科技股份有限公司,3-5年,本科,六险一金；超长年假,职位描述：负责青云应用管理平台的设计和研发职位要求：较强的自主学习能力和英文技术文档阅读能力良好的编程 / 设计基础，至少精通一种常用编程语言，如 Python/Go/Java/Scala 等熟悉至少一种开源分布式系统：如 Hadoop/Spark/HBase/Kafka/Kylin 等，并有一定的运维经验熟悉至少一种分布式协调服务：如 ZooKeeper/etcd/Consul 等熟练使用 Git 代码管理工具优先条件：拥有 Linux 环境下的系统部署、监控和运维经验，对 DevOps 有一定的理解和实践熟悉微服务和 Kubernetes 技术，有实践经验或者项目开发经验者优先,数据服务,150-500人,spark,成都
软件测试工程师；（大数据）,https://www.lagou.com/jobs/7196281.html,高新区,11k-18k,上海华钦信息科技股份有限公司,5-10年,本科,13薪 六险一金,"大数据项目测试职位5年以上测试经验，本科以上学历熟悉linux，sql，有大数据平台测试经验，主要功能测试为主熟悉一种脚本语言工作内容：1、负责数据产品/数据平台的测试，包括确定测试范围、制定测试方案、编写测试计划及用例，执行测试。2、负责数据产品/数据平台产品和项目进度的跟踪，协助研发做好产品版本的迭代和发布，保证项目顺利推进，有质量发版。3、负责对测试中发现的问题进行分析定位和跟踪报告，推动测试中发现的问题得到及时合理的解决。 任职要求：1、5年以上测试经验，其中3年以上数据平台相关测试经验。有很强的分析能力和定位问题的能力，快速学习能力强；具有良好的沟通能力、细心负责、有团队精神；2、熟悉Linux操作系统，了解基本的Shell命令，能够部署和维护测试环境；3、熟悉MySQL、Redis等常用数据库及缓存者优先；3、熟悉Python,java等至少一种编程语言；5、熟悉Hadoop、Spark、HBase等分布式开源项目及工作原理者优先；","数据服务,金融",500-2000人,spark,成都
大数据初级开发工程师,https://www.lagou.com/jobs/6736601.html,青羊区,7k-14k,上海诺悦智能科技有限公司,1-3年,本科,五险一金 奖金 餐补 通讯补助等,任职要求：精通Scala、java语言，有Scala实际编程经验深入了解分布式系统、大数据平台、消息队列等高可用高弹性架构;对HDFS/Yarn/HBase/Hive/Spark相关组件的性能优化和补丁跟踪等有实际经验在Hadoop、Spark、Storm、Flink等开源社区有过贡献最佳熟悉银行业务，有过银行数据处理、分析经验者优先良好的英语读写能力本科及以上学历，2年以上相关工作经验；,数据服务,50-150人,spark,成都
个性化推荐算法,https://www.lagou.com/jobs/5902241.html,武侯区,20k-40k,北京奇艺世纪科技有限公司,3-5年,本科,"海量数据,优秀团队,大平台",岗位职责：1、基于大数据运用机器学习，数据挖掘算法挖掘用户兴趣点，发觉数据的商业化价值，完成千人千面的个性化推荐；2、运用深度学习提取文本，图片标签，为产品个性化能力提供支持。任职要求：1、计算机、数学、统计或相关专业本科以上学历，4年及以上机器学习相关工作经验；2、熟悉推荐引擎流程，3年及以上个性化推荐相关工作经验；3、熟悉机器学习和深度学习等相关算法，熟练运用相关工具；4、精通Java/python/scala中至少一种编程语言，对算法和数据结构有深入研究；5、熟悉hadoop/spark/flink等大数据处理工具，熟悉tensorflow等深度学习框架，并有实际应用的经验；6、具有团队合作精神，有较强的沟通表达能力，能够自我驱动。温馨提醒：如果 7 天内您没有收到爱奇艺的面试邀请，那么目前我们不会安排您参加后续的面试环节，感谢您的理解和对爱奇艺的关注与认可。,文娱丨内容,2000人以上,spark,成都
大数据平台架构师,https://www.lagou.com/jobs/7003438.html,锦江区,18k-30k,四川易贷网金融信息服务有限公司,3-5年,本科,五险一金,岗位要求：1、统招本科或以上学历，计算机相关专业， 2年以上大数据项目经验、3年以上架构经验。2、熟练使用CDH、HDP、FI等Hadoop生态系统发行版套件，进行平台服务的安装、部署和维护。3、具备较丰富的基于Hadoop生态圈的大数据处理项目经验，熟悉数仓建设、数据中台建设4、熟悉Hadoop、Hive、Hbase、kafka、Spark、Flink、ES、Flume、Sqoop、Ozzie、Tez、Hue、Azkanban、DataX等大数据组件的使用和调优，了解数据分析和数据挖掘。5、深刻理解大数据平台安全机制Kerberos、Ranger以及血缘分析套件Atlas。6、熟悉大数据应用开发平台的架构和设计，对数据采集、数据清洗、数据治理、数据质量管理、数据血缘分析、数据存储、作业调度、数据安全、数据分析有丰富的经验。7、优秀的团队合作精神、诚实、勤奋、严谨，敢于接受挑战。8、机器学习技术、数据挖掘经验丰富者优先考虑。岗位职责：1、负责公司大数据平台系统架构设计、核心开发工作（Hadoop生态圈），基于业务场景设计最优的系统解决方案。2、构架大数据开发平台，包括数据采集、数据存储、数据计算、数据管理的平台系统及相关监控，推进平台的架构设计和实现。3、基于对业务流程和应用的深入理解，制定需求，收集数据，构建数据指标体系、数据分析体系、建设数据服务功能，推动业务的精细化运营和自动化分析。4、基于已有的海量数据，负责数据挖掘调研、预研、需求分析，构建机器学习模型，通过大数据分析，探索问题进行深入分析，为实施、产品优化提供分析支持、优化建议和回归分析。5、自主检测业务的日常数据，关注数据趋势，能够分析和解读数据异常；并针对异常数据进行预警、解读和挖掘，并提出建议解决方案。6、善于沟通和交流，有丰富的跨团队、部门的项目资源整合能力，能够独立开展研究项目，能够进行技术分享和培训。,"移动互联网,金融",500-2000人,spark,成都
BI工程师,https://www.lagou.com/jobs/6681428.html,温江区,4k-7k,成都延华西部健康医疗信息产业研究院有限公司,不限,本科,工作环境好 团队氛围融洽,"岗位职责： 1、搭建、维护、开发 ETL 流程；2、对异源异构医疗数据进行汇总、清洗、聚合和可视化，保证数据及时、准确；3、负责数据仓库系统在数据库层的落地实施（建表设计SQL、设计脚本等）；4、负责日常ETL变更升级和维护,主要是数据库日常管理、SQL语句优化；负责数据仓库系统中ETL流程的优化以及运维过程中ETL相关技术问题的解决；5、保证所负责项目的交互质量，达到质量考核要求。岗位要求：1、 计算机相关专业本科及以上学历；2、 理解BI开发相关技术，如数据仓库、OLAP等；3、 有过完整的ETL流程开发经历，熟悉Kettle/SSIS/spark/flum/kafka等一种或多种，有大数据开发经验、大数据运维经验更佳； 4、熟练使用SQL语句，熟悉sql server、oracle数据库的基本操作；5、能够具备很强的数据敏感度和逻辑分析能力；6、很强的自我驱动力、结果导向并极具责任感，工作细心严谨，有良好沟通能力和团队协作精神，良好的学习习惯，对数据库技术有深入学习的渴望；7、有参与过区域/医院HIS、LIS、EMR、PACS等系统建设或数据治理者优先。","移动互联网,医疗丨健康",150-500人,spark,成都
大数据架构师,https://www.lagou.com/jobs/7183756.html,成华区,20k-35k,北京嗨学网教育科技股份有限公司,10年以上,本科,牛人扎堆，学习交流，完善晋升通道，大平台,"1.精通Java编程，参与过大数据平台相关系统的建设维护2.精通Hadoop(HDFS,Yarn,Hive等)集群架构以及源码，有大数据平台搭建维护经验优先3.熟悉Spark、Flink等流式编程架构及源码，有搭建维护经验优先4.熟悉Shell、Python脚本开发5.有ETL经验，懂数仓建模架构流程",教育,2000人以上,spark,成都
