job_name,job_url,job_location,job_salary,job_company,job_experience,job_class,job_given,job_detail,company_type,company_person,search_key,city
大数据开发工程师,https://www.lagou.com/jobs/6679720.html,高新区,10k-20k,杭州初灵信息技术股份有限公司,1-3年,本科,"周末双休,年终奖金,五险一金,弹性工作",岗位职责：1、负责大数据相关技术研究，解决海量数据不断增长面临的挑战；2、负责海量数据的处理、分析、挖掘和存储；3、大数据挖掘计算平台集群管理、部署、优化、排错；4、大数据分析项目的软件开发、维护、架构设计，文档编写等工作；任职要求：1、计算机相关专业本科及以上学历；2、有扎实的Java语言基础，熟悉JVM运行机制和内存管理，熟悉Scala语言者为佳；3、熟悉HHadoop 2.0以上版本体系结构、各个模块的功能，对Hadoop生态圈有较全面了解，同时具有源码级开发经验；4、对Hive、HBase、Map/Reduce、Spark有深入了解，能熟练编写Map/Reduce程序和Spark程序；5、熟悉Hadoop运行监控及调优技术；6、具备机器学习算法理论基础，如分类、聚类、推荐、关联规则，具备相关项目经验为佳；7、有互联网公司或海量数据处理工作经验，数据分析和挖掘经验者优先;,"移动互联网,数据服务",500-2000人,hadoop,成都
大数据开发工程师,https://www.lagou.com/jobs/6832523.html,高新区,15k-30k,成都路行通信息技术有限公司,3-5年,本科,车辆网 新零售 高速发展平台,岗位职责：1.负责车辆碰撞检测分布式实时集群的搭建和研发；2.负责车辆碰撞智慧大脑的搭建和研发；3.负责相关深度学习算法的分布式开发和嵌入、性能优化、工程环境部署； 岗位要求：1.计算机相关专业，本科及以上学历；2.熟悉flink（必不可少）及spark及其原理，有至少2年相关大规模数据采集及处理（超百亿条）的实战经验，或flink实时流处理开发经验；3.了解Hadoop、HBase、Hive的架构和工作原理；4.了解TensorFlow等主流深度学习框架，数据挖掘、机器学习等；5.乐于接受挑战，主动学习意识和能力，抗压能力强，目标导向。温馨提醒：非数仓,"移动互联网,消费生活",500-2000人,hadoop,成都
大数据开发工程师,https://www.lagou.com/jobs/7088446.html,高新区,11k-20k,北京世联互动网络有限公司成都分公司,3-5年,本科,没有加班文化，公积金12%，研发中心,"【岗位职责】：• 负责Naver DDOS防御系统分析端的架构设计，开发，维护及性能优化工作；• 海量数据存储、搜索与分析，系统服务的监控等操作。 【任职资格】：• 统招本科及以上学历，计算机或相关专业，3年以上相关工作经验；• Java基础扎实，spring等常用框架熟练，具有良好的编程习惯和代码编写能力；• 熟悉大数据生态系统：Hadoop, Storm, Zookeeper, Kafka等；• 熟悉 MySQL 数据库及mongoDB等nosql数据库;• 熟悉Linux环境，shell脚本编写，并可以独立完成项目部署，故障排查，组件维护等• 独立负责多个组件的开发工作，具备高效解决问题的能力；• 熟练阅读英文技术文档，可以使用英语完成简单的日常对话加分项：- 了解并有使用HDP/CDH等大数据生态系统者优先","移动互联网,社交",2000人以上,hadoop,成都
大数据开发工程师,https://www.lagou.com/jobs/6843260.html,高新区,7k-14k,中电万维信息技术有限责任公司,1-3年,本科,公司稳定 福利好 13薪 定期体检,"大数据工程师：岗位职责： 1、负责Hadoop/spark/storm/kafka/zookeeper/flink等的大数据平台搭建及维护； 2、负责业务需求调研,数据仓库业务建模业务需求分析及技术实现； 3、负责开发ETL过程，优化存储方案，设计并实现分布式计算任务，搭建数据处理流程； 4、负责模型和分层等数据产品监控、优化； 5、负责大数据中间件产品后端研发及文档编写；岗位要求：    1、能够参与大数据项目整体解决方案的规划、设计、技术选型，并提出可行性较高解决方案； 2、能够应用分布式编程、NIO、AIO、RPC等底层技术，完成相关大数据扩展 功能研发。    3、能够熟练应用spark、storm、flink、hive、hbase、ES、kylin等大数据组 件底层原理和框架，并结合实际业务场景进行大数据应用面向不同场景的封装、调优；    4、能够结合业务场景和数据资源，进行变量选和算法的选择、设定参数、加载算法、重构变量等操作，最终实现满足业务需求的建模，并能够结合分析结果撰写分析报告或解释性结论；     5、能够结合业务需求分析并规划高可用大数据集群软硬件需求（如查询服务器 、命名服务器、数据服务器等），以及部署架构和进程角色分布。 6、能够独立搭建基于CDH版本或Apache原生版本的大数据集群环境 ，并能够编写shell或python脚本，完成10台以内大数据集群的日常维护和常见故障的定位及优化； 7、有丰富建模项目经验及数据仓库建设经验者优先； 8、有数据中台建设经验者优先。",软件开发,500-2000人,hadoop,成都
大数据开发工程师,https://www.lagou.com/jobs/6860285.html,高新区,15k-25k,成都卓杭网络科技股份有限公司,3-5年,本科,六险一金 年度旅游 超nice氛围,"岗位职责：1、参与数据平台的构建工作, 演进现有数据平台基础设施；2、参与数据相关的软件开发工作, 迭代现有数据运营工具；3、参与设计并构建主题化数据模型，构建公司数据仓库；4、参与数据治理规范的建立, 构建覆盖全公司的数据治理工具。任职要求：1、全日制统招本科及以上，计算机、通信工程、数学等相关专业背景优先；2、至少3年以上Java/Scala开发经验，其中有1年以上的大数据开发经验；3、熟练使用SQL，理解数据库原理；4、熟练使用shell/python等脚本语言开发相关运维管理工具；5、熟悉HDP或CDH相关生态，对Hive/Hdfs/Yarn/Tez/Kafka等有较深的认识, 熟悉大数据架构（Spark，Hbase，Flume，ElasticSearch，Druid等）及解决方案，并有实际工作经验；6、具备丰富的高性能大并发场景下开发及架构经验及性能调优经验优先。","移动互联网,游戏",150-500人,hadoop,成都
数据开发,https://www.lagou.com/jobs/7024514.html,高新区,20k-40k,四川万特达科技有限责任公司,3-5年,大专,1,职责：1、参与快递行业数据仓库设计和研发2、负责从各业务系统抽取数据，做ETL处理后入库到数据仓库3、负责公司内部数据产品的数据开发4、参与各业务系统调研工作，熟悉快递行业业务知识要求 ：1、熟悉数据仓库建设方法论，了解快递行业更佳2、至少熟悉一种大数据处理技术，如Hadoop、Spark3、大专及以上学历，计算机、软件工程等相关专业，3年以上工作经验4、对解决具有挑战性的问题充满激情，具备良好的解决问题的能力，对待工作有较强的自我驱动力,"硬件,数据服务",50-150人,hadoop,成都
高级大数据开发工程师,https://www.lagou.com/jobs/5896605.html,高新区,20k-30k,四川生学教育科技有限公司,3-5年,大专,五险一金+绩效奖金+优厚福利+发展空间,岗位职责：1. 负责区域项目上的数据处理，设计数据采集、存储及清洗方案，实现数据的规模应用；2. 负责跟进hadoop生态体系中前沿的技术解决方案，形成公司级的技术储备。任职要求:1. 本科或以上学历，计算机软件相关专业优先；2. 3年以上大数据处理，大规模的数据分析和算法实践；3. 精通hadoop / Spark编程，或者具有其他并行计算的实践经验；4. 熟悉Mysql/Redis 等常用SQL和NoSQL数据库；5. 至少熟练掌握Java、Python等两种以上语言；6. 熟悉Hadoop、Spark生态圈，能运用其解决问题；7. 有丰富的大数据集群部署和维护管理经验；8. 良好的沟通，团队合作意识，非常强的学习能力；9. 对教育行业充满热情，责任心强，良好的跨团队合作和组织协调能力，能够应对复杂产品线的挑战。福利待遇：1.超出行业平均水平的薪资，多少全凭能力决定；2.享受五险一金，并提供餐补、交通补贴等；3.公司发展离不开员工的努力，员工重大事件公司将慰问及关怀；4.弹性工作制，全天7H工作时间，完美避开上下班高峰时段；5.享受国家法定假日及周末双休，享有带薪年假、病假、调休假等；6.每月举行一次Birthday Party，日常工作日茶餐厅提供饮料、零食、水果等；7.传统佳节会有高标准的节日礼金或礼品；8.每年将进行豪华套餐的健康体检；9.在超过2000平舒适的工作区域工作，保证最佳工作状态。,"移动互联网,教育",150-500人,hadoop,成都
大数据开发工程师,https://www.lagou.com/jobs/7097334.html,武侯区,15k-30k,成都朴华科技有限公司,3-5年,本科,管理扁平，领导好，福利好，业务高速发展,【岗位职责】：1.负责公司大数据项目的规划、设计和开发；2.负责数据建模、处理及数据分析。【任职要求】：1. 本科或以上学历，计算机软件相关专业优先，对数据处理、数据建模、数据分析等有深刻认识和实战经验；； 2. 3年以上大数据处理，大规模的数据分析和算法实践； 3.熟悉大数据应用编程，或者具有其他并行计算的实践经验，主导过大型数据平台建设者优先； 4. 熟悉常用的关系型数据库（SQL Server、Oracle、MySQL等）、非关系性数据库和数据仓库，具有SQL性能优化经验；5. 熟悉cockroachDB、Tidb等newSQL数据库原理、架构、配置及部署，有实际应用案例者优先；6. 熟悉c#、C、python等编程；7. 有丰富的大数据集群部署和维护管理经验；8、思维敏捷，对新技术敏感，有较强的钻研学习能力；9、具备良好工作习惯和团队协作精神,人工智能,50-150人,hadoop,成都
大数据开发工程师,https://www.lagou.com/jobs/6428156.html,武侯区,15k-25k,厦门科拓通讯技术股份有限公司,5-10年,本科,独立团队 双休弹性上下班 团建活动丰富,"岗位职责：1、负责离线，实时数据集市等数据集市规划、研发；2、负责数据管理平台、开放服务、交换服务、质量服务等数据中台服务设计、研发；3、其他大数据产品设计、研发等相关工作。任职要求：1、本科及以上学历，5年以上工作经验，至少3年大数据开发经验；2、有实际的数据仓库开发和数据建模经验，熟悉BI工具软件优先；3、精通Java、python等主流编程语言；熟悉Hadoop、Hive、HBase、Spark、Flink、Kylin、ES，ClickHouse, MongoDB, Ignite等技术；4、掌握多线程及高性能程序设计编码及性能调优，有高并发应用开发经验；5、熟悉消息，缓存技术、服务器优化、集群性能优化、系统性能调优等技术；6、工作态度积极主动、细致、有全局观；具有较好抗压能力；善于与他人合作，具有良好的团队合作意识；","硬件,企业服务",500-2000人,hadoop,成都
大数据开发工程师,https://www.lagou.com/jobs/6387900.html,高新区,15k-25k,北京芯盾时代科技有限公司,5-10年,本科,"五险一金,工作居住证,节日福利,出国旅游",工作职责：1、参与系统的需求分析和技术方案预研。2、负责大数据产品的研发、设计工作，及大数据平台的完善；3、负责各种生产、测试环境业务系统问题的快速定位和解决；4、负责代码编写、单元测试，确保代码执行性能、质量和安全；5、协助客户参与各种环境业务系统的投产及技术支持。 任职要求：1、思路清晰，善于思考，能独立分析和解决问题，较强的表达和沟通能力，责任心强，具备良好的团队合作精神和承受压力的能力，能接收项目驻场；2、熟练使用Kafka、Redis、Storm、ElasticSearch等大数据组件，并有相关项目开发经验；3、对MySQL、Oracle数据库有一定的了解和使用经验；4、对Tomcat、Weblogic服务器有一定的了解和使用经验；5、有Java开发经验者优先；6、有shell、Python开发经验者优先；7、工作积极主动，具有良好的团队协作精神；8、逻辑清晰，快速的学习能力及良好的沟通能力。,"移动互联网,信息安全",150-500人,hadoop,成都
【WMPS】数据开发工程师,https://www.lagou.com/jobs/6806062.html,高新区,18k-35k,北京三快在线科技有限公司,3-5年,本科,五险一金、免费班车,,消费生活,2000人以上,hadoop,成都
大数据开发工程师,https://www.lagou.com/jobs/7041911.html,武侯区,18k-25k,成都佳华物链云科技有限公司,3-5年,本科,共享行业,岗位职责* 负责基于开源大数据平台的二次开发，增强平台易用性，包括不限于(使用，配置管理，性能调优，排错等）* 负责应用大数据平台对数据中台进行支撑任职资格* 至少熟悉 Flink、Spark、Storm中2种，并阅读过其中部分核心的源码* 精通Java、scala、Golang、C/C++，熟悉相关语言的单元测试，并拥有对代码分析以及调优的经验* 对参与业务有自己的深入理解* 对基础数据结构以及相关算法有深刻的理解* 对分布式相关算法有自己深刻的理解* 熟悉数据库Mysql、Postgres、Hbase，并了解数据库底层数据结构* 熟悉linux常用命令* 对软件如何紧密结合硬件，有自己的理解者优先* 积极参与开源项目，有阅读论文习惯者优先,"移动互联网,数据服务",15-50人,hadoop,成都
大数据开发工程师,https://www.lagou.com/jobs/7037661.html,高新区,20k-40k,成都超有爱科技有限公司,3-5年,本科,五险一金，包三餐，弹性工作,工作职责1. 负责公司数据仓库建设以及指标体系建设的工作；2. 负责公司基础数据清洗、主题模型开发、报表开发、问题排查工作。工作要求1. 全日制统招本科及以上学历，计算机、统计学等专业优先；2. 2年以上大数据研发经验；3. 熟练使用Hive，Spark，ClickHouse等分析软件或框架；4. 拥有数仓建模、ETL数据抽取、报表开发、任务调度等经验者优先；5. 具备较强的学习能力及业务理解能力，有优秀的沟通协调能力及团队合作精神，善于思考、总结并具备分享精神。,教育,150-500人,hadoop,成都
大数据开发工程师,https://www.lagou.com/jobs/6931091.html,锦江区,12k-20k,音泰思计算机技术（成都）有限公司,5-10年,不限,年终奖金 六险一金 交通便利,岗位名称：开发工程师（大数据方向）概括：负责大数据处理的技术选型、架构设计和开发、性能调优、数据挖掘等工作。参与需求分析、大数据产品方案规划设计。岗位职责：1、根据客户需求或公司要求，进行大数据平台及应用平台的搭建，技术选型、技术实现；2、理解业务，对多种数据源进行组合分析、挖掘和建模；3、进行数据的存储、分析、索引建立、实时查询功能设计和开发；4、研究大数据前沿技术并应用到系统中；5、完成公司安排的其他相关工作和任务。,"移动互联网,企业服务",150-500人,hadoop,成都
大数据开发工程师,https://www.lagou.com/jobs/6999608.html,高新区,15k-20k,咪咕文化科技有限公司,1-3年,本科,有挑战性、福利好,1、参与大数据相关项目的设计与研发； 2、负责公司数据仓库的建设； 3、负责数据仓库模型设计、开发与维护； 4、参与数据模型体系构建及数据主题设计和开发； 5、负责ETL维护及任务性能调度方式优化； 6、负责大数据相关技术难题的钻研和攻克。职位要求：1、计算机、统计等相关专业全日制本科及以上学历，2年及以上相关工作经验，有互联网行业经验者优先；2、熟悉oracle/mysql/db2等至少一种关系数据库，具有较强的sql语言功底；3、熟悉shell、python等脚本语言之一，熟悉java者优先；4、熟悉Hadoop大数据平台架构，熟练掌握Map/Reduce 或有spark开发调优经验者优先； 5、具有ETL、数据分析或挖掘经验者优先； 6、有团队合作精神、良好沟通能力、工作主动负责、能承担压力；7、有大型企业数据仓库系统或其它后台分析系统开发经验者优先录用。,"移动互联网,文娱丨内容",2000人以上,hadoop,成都
大数据开发工程师,https://www.lagou.com/jobs/4117385.html,高新区,13k-26k,四川新网银行股份有限公司,5-10年,硕士,"互联网银行,互联网金融,大平台","岗位职责：1、负责全行大数据相关项目及整体平台解决方案的产品化输出；2、负责全行人工智能系统、大数据分析系统、实时流计算系统、BI系统、数据仓库、数据集市的设计和开发；3、负责数据调研、数据接入、数据建模、数据清洗、数据映射、数据可视化等工作； 4、负责对数据进行分析，为项目组提供大数据技术指导及分析手段支撑；5、负责大数据平台的性能监控和持续优化；针对需求提供大数据分析技术解决方案；6、负责大数据平台的运维工作，持续完善大数据平台，保证稳定性、安全性；  任职资格：1、 数学、统计学、计算机等相关专业本科及以上学历2、java或etl基础扎实，熟悉 linux 系统， 熟练使用 java,scala,python,shell 等至少一种语言3、 熟悉Hadoop、HBase、Hive、Streamming、Spark、NoSQL、ES中至少一种技术，阅读过源代码者优先； 4、 充分理解大数据背景下的计算模型，熟悉MapReduce、Spark开发流程模型中任一，并具有分布式开发经验； 5、具备较强的逻辑思维能力、学习创新能力、数据分析能力，以及良好的沟通技巧和团队合作能力；6、具有2年以上相关工作经验，上述职责至少满足一项或担任过一个或多个相关项目的开发工作，传统BI领域人员也可投递简历。",金融,150-500人,hadoop,成都
大数据开发工程师,https://www.lagou.com/jobs/7134360.html,锦江区,20k-25k,山东新希望六和集团有限公司,5-10年,本科,平台大，创新项目，发展空间广，待遇好,"岗位职责：1.参与业务需求梳理，针对业务需求进行数据模型设计； 2.负责数据的采集、入仓、清洗、计算、上线等开发工作；3.负责数据采集程序，爬虫等程序按照预定规则清洗入库；4.参与大数据门户、元数据管理平台、数据质量监控平台、可视化系统等系统的搭建和开发工作；5.负责数据平台和数据产品的功能实现和开发上线；6.数据平台和数据产品的维护和优化；7.负责数据产品的测试和质量保证；任职要求： 1.数学、统计学、计算机等相关专业本科及以上学历；2.熟悉linux系统及常用命令，熟练使用shell、python等；3.精通一种以上主流数据库Postgres、Oracle、MySQL等，熟练使用SQL，对sql性能调优有一定的理论及实践经验；4.熟练使用java,scala等语言，有基于Spark、Hadoop计算框架的大数据发开经验；5.熟悉大数据相关技术栈包括Hadoop/Hive/HBase/Spark/flink/Kafka/Zookeeper/Sqoop等；6.对ETL、数据管理、数据治理有一定的理解和认识，有ETL数据处理方案的设计与实施经验、有数据治理经验；7.5年以上数据开发和处理经验，数据仓库的设计及实施经验优先；8.具备较强的逻辑思维能力、学习创新能力、数据分析能力，以及良好的沟通技巧和团队合作能力。",其他,2000人以上,hadoop,成都
数据开发工程师,https://www.lagou.com/jobs/7005665.html,青羊区,10k-18k,德特赛维技术有限公司,1-3年,本科,五险一金、绩效奖金、周末双休、项目奖金,"工作职责：1.负责日常数据提取和问题排查；2.负责ETL任务调度开发和算法设计；3.负责数据模型设计和优化；4.负责电信数据分析和挖掘；岗位要求：1.全日制统招本科及以上学历，软件工程/计算机/通信/数学等相关专业；2.熟悉Hive SQL语言，熟悉scala，java中至少一种开发语言，熟悉shell，python中至少一种脚本语言；3.熟悉至少一种实时计算引擎 Storm, Spark Streaming, Flink, 对hadoop生态其他组件有一定了解，比如 HBase， hadoop, Hive, Druid等；4.执行力强，具有优秀的团队合作精神、敬业精神；5.有数据仓库建设、电信数据分析经验者优先；6.良好的分析报告书写能力","数据服务,通讯电子",50-150人,hadoop,成都
Java开发工程师 实时数据库,https://www.lagou.com/jobs/6779330.html,高新区,13k-23k,北京世联互动网络有限公司成都分公司,3-5年,本科,"上市公司,外企文化,研发中心，技术氛围浓","【岗位职责】：• 负责Naver DDOS防御系统分析端的架构设计，开发，维护及性能优化工作；• 海量数据存储、搜索与分析，系统服务的监控等操作。 【任职资格】：• 统招本科及以上学历，计算机或相关专业，3年以上相关工作经验；• Java编程基础扎实, 具有良好的编程习惯和代码编写能力；• 熟悉 Spring、Netty、Linux 等技术；• 熟悉大数据生态系统：Hadoop,Storm,Zookeeper,Kafka等;• 熟悉 MySQL 数据库，精通 SQL 语法；及mongoDB等nosql数据库;• 独立负责多个组件的开发工作，具备高效解决问题的能力；• 熟练阅读英文技术文档，可以使用英语完成简单的日常对话加分项：- 有数据可视化开发经验- 了解并有使用HDP/CDH等大数据生态系统者优先 - 熟悉Linux开发环境，shell脚本编写，并可以独立完成项目部署，故障排查。","移动互联网,社交",2000人以上,hadoop,成都
数据仓库开发工程师,https://www.lagou.com/jobs/6501638.html,高新区,30k-60k,北京字节跳动科技有限公司,不限,本科,六险一金，免费三餐，带薪休假，职业大牛,,文娱丨内容,2000人以上,hadoop,成都
行业数据应用开发经理/技术负责人,https://www.lagou.com/jobs/4394368.html,双流区,15k-30k,昆仑智汇数据科技（北京）有限公司,5-10年,本科,"行业风口,高价值,高效,团队优秀",岗位职责：1. 负责根据业务需求，完成整体技术方案设计，架构设计和开发规范制定；2. 带领团队完成产品或项目的技术研发工作，把握项目的整体进度，解决技术难题；3. 负责协调项目开发或实施的各个环节，以及各项目、部门和技术领域的合作。 任职要求：1.5年以上Java研发和软件设计经验及3年以上项目开发及技术部门管理经验；2.有主导大型企业信息系统从0到1的设计开发实施经验（行业不限）;3.具有复杂项目的技术研发、管理及交付经验；4.具备良好的系统分析能力，良好的抽象思维和逻辑思维能力，独立分析问题解决问题的能力；5.有责任感，具备较强的沟通协调能力及团队合作精神。,数据服务,150-500人,hadoop,成都
大数据后端开发(J10533),https://www.lagou.com/jobs/7025867.html,高新区,10k-20k,成都知道创宇信息技术有限公司,3-5年,本科,弹性上班时间，周末双休，氛围轻松,,信息安全,500-2000人,hadoop,成都
BI工程师/海外游戏数据开发工程师,https://www.lagou.com/jobs/6942864.html,青羊区,7k-14k,诺亚生活科技（北京）有限公司,1-3年,本科,一年14薪，试用期全薪，全额五险一金,职位优势：一年14薪、试用期全薪、全额五险一金、免费零食饮料、饭补包餐、年度旅游、年度免费体检、年度加薪、完善培训制度、生日礼物、下午茶.....职位描述：1、负责游戏数据体系的搭建；2、负责游戏产品的数据分析、数据解读、数据跟踪等工作；3、基于游戏用户行为数据，建立、评估、优化数据模型，构建用户画像，产出用户标签，用于提升推荐效果；4、建立业务指标体系、算法模型，提供游戏及市场分析或预测结果；5、探索开发数据相关工具，为数据分析或用户研究提供高效支持；6、根据新项目需求，分析，设计，并实现系统的架构方案，对系统的架构质量负责。任职要求：1、本科及以上学历，计算机专业，1年以上游戏数据分析、BI、或算法经验；2、熟悉SQL，熟悉shell、matlab、R、python等至少一种语言，有较强的技术开发背景优先；3、熟练使用kudu、presto、tableau等工具；4、对数据具充分敏感性，深入了解游戏用户，能从海量数据中提炼核心结论并形成专业报告，获知数据中隐含的变化和问题所在；5、责任心、自我驱动能力、追求质量以及良好的沟通和团队合作；6、有游戏行业数据开发经验的优先。,"移动互联网,广告营销",50-150人,hadoop,成都
