job_name,job_url,job_location,job_salary,job_company,job_experience,job_class,job_given,job_detail,company_type,company_person,search_key,city
PHP 实习生,https://www.lagou.com/jobs/6654155.html,东湖新技术开发区,3k-4k,广州奔步电脑有限公司,应届毕业生,本科,弹性上下班、外资公司、可转正,"岗位职责我们希望您：We wish you have :1. 对计算机科学抱有极大热情 Great passion for Computer Science.2. 具备独立规划、管理自我和追求未知的开拓精神 The ability to run projects independently with strong self-dicipline and curiosities to exlplore fields unknown.3. 至少在以下一个领域里拥有一定的专业认知和深入学习的渴望：微服务、物联网，DevOps、Springcloud和Azure Expertise and enthusiasm for at least one of the following fields: Micro-service, Internet-of-Things, DevOps, Springcloud and Azure.4. 至少熟练掌握以下一种语言：.Net, Java, PHPA good command of the listed programming languages: .Net, Java, PHP.5. 最好有一定的项目开发实践经验Practical experience in Development projects will be a plus.任职条件加入我们，您将有机会得到：Join us and you will have the chance to :1. 奔步实习生项目专项培养计划Participate in an customized internship training program.2. 导师One On One教练式指导To get 1-on-1 coaching from mentors.3. 与国际化的团队合作，参与500强公司项目Work with international teams and be a part in projects for Fortune 500 Companies.4. 了解世界技术发展趋势，获得前沿多维视角Get multidimensional and broaden perspectives from knowing the frontiers and trends in Computer Science and Technology.5. 知行结合，在实践中展开项目并产生富有价值的解决方案或产品Practice your knowledge in projects and turn amazing ideas into high value-added solutions and products.6. 激情，活力，平等，创新的学习氛围Be part of a passionate, dynamic, equal and innovative atmosphere.","移动互联网,电商",150-500人,php,武汉
高级php开发工程师,https://www.lagou.com/jobs/6214305.html,东湖新技术开发区,10k-18k,湖北云雷信息技术有限公司,3-5年,本科,员工福利 午休 双休,1、负责项目相关功能模块的设计、编码开发与维护，按时保质地完成所分配的工作任务。2、碰见问题主动与需求方或负责人沟通，最好能提出相应解决方案。3、参与系统需求分析、方案设计、评审、编码等工作。职位要求1. 3年以上Web开发经验，精通PHP语言特点及运行机制，熟悉PHP主流框架，有较强的架构能力和良好代码规范，有出色的组织能力及协调能力，对研发流程有基本的实践；2. 精通MySQL，有一定的数据库规划能力，熟悉常用的MySQL调优方案，熟悉各种WEB缓存技术，熟悉memcache、redis等常用nosql解决方案，了解各自的优缺点以及使用场景；3. 对各种算法思想和理论基础能力强，对Elasticsearch等搜索引擎有过项目经验者优先；4. 熟悉HTTP原理，了解TCP、IP协议，了解Socket编程，缓存技术、静态化等，有Swoole编程经验者优先；5. 熟悉及了解微信公众号，微信支付相关者优先；6.具备团队开发经验，熟练掌握Git等常见工具的使用；7. 有解决问题、钻研技术的兴趣和能力，逻辑清晰，思维敏捷，责任心强，学习能力强，能承受一定程度的工作压力；福利待遇1.工作时间周一到周五9:30-18:00，中午休息两小时，周末双休2.五险一金，工作环境舒适3.季度生日会，节日红包,"移动互联网,消费生活",50-150人,php,武汉
PHP开发工程师,https://www.lagou.com/jobs/4358020.html,武昌区,9k-15k,湖北腾牛数字科技有限公司,1-3年,大专,周末双休，五险一金，团队靠谱，年终奖,岗位要求：1、3年以上php开发经验，熟练使用一种或多种框架（Yii优先），有完整上线项目经验。2、熟悉Linux操作系统，熟练掌握lnmp开发，了解shell，熟悉nginx配置3、熟悉Mysql数据库，有sql调优经验4、熟悉HTML/CSS/JS等技术，具有互联网Web业务开发经验5、有互联网高并发项目经验优先6、有小程序开发经验优先岗位职责：1、负责公司业务功能实现；2、参与系统需求分析与设计；3、参与相关的技术文档编写；4、负责业务上线及后续维护。,"移动互联网,企业服务",15-50人,php,武汉
php后端,https://www.lagou.com/jobs/6881359.html,东西湖区,7k-14k,武汉车小白汽车服务有限公司,1-3年,本科,发展空间较大,"岗位职责：1、面向互联网后台服务端接口与应用的开发；2、执行所负责接口的程序单元、功能的测试，查出缺陷并保证其质量；3、进行应用逻辑的源代码开发；4、持续重构与维护组件保持可用性和稳定性；5、参与公司互联网大数据项目，并按计划完成各项设计、开发和测试工作；6、负责相应技术文档的编写和维护。任职要求：1、计算机或相关专业大专以上学历，三年以上开发工作经验，有大型web系统设计经验优先；2、精通PHP+MySQL开发，有ThinkPHP和Laravel开发经验；3、熟悉Linux系统（CentOS）熟悉在Linux环境下进行nginx、apache服务器的配置、性能优化；4、熟练使用数据库语言，具有数据库优化、查询优化、高性能高可用技术的经验；5、熟悉各种WEB缓存技术,熟悉大型网站构架和性能优化技术，具备 Sphinx/Redis经验者优先；6、掌握Jpython语言加分项；7、具有较强的架构能力，具有分布式计算、实时计算、数据仓库、数据挖掘系统的架构经历优先；8、敬业、主动、宽容、易相处，良好的团队合作意识和沟通技巧，具有大型互联网公司研发经历优先。    福利待遇：1、根据能力面议，空间较大。2、办公环境良好，设施设备齐全3、具竞争优势的薪酬制度、科学的考核体系、健全的晋升机制、广阔的发展空间、4、完善的员工培训：专业知识、产品知识、沟通技巧、管理技巧、企业文化、个人能力提升等。5、丰富的员工福利，轻松的办公氛围，如：各种团队建设活动、户外拓展培训、国内外旅游奖励。","金融,其他",15-50人,php,武汉
PHP,https://www.lagou.com/jobs/1585190.html,武昌区,25k-30k,武汉动说科技有限公司,5-10年,本科,新浪技术团队 + 互联网金融+前沿区块链,"1. 本科以上学历,4-6年PHP开发工作经验.2. 熟练MySQL、Redis/Memcached、MVC/REST架构原理与应用；3.熟练Nginx/Apache配置和优化，熟悉Linux系统；4. 熟练web前端技术如 HTML、DIV+CSS、Javascript、AJAX、JSON和 jQuery等;5. 拥有良好的代码习惯，结构清晰，命名规范，低冗余代码;6. 逻辑思维清晰，有足够的积极性,自学能力强 ,善于学习与创新分享 ，工作认真细致.7. 具备强烈的进取心及团队协作精神，有较强的沟通协调能力.8. 有丰富项目工作经验及家在省内者优先考虑.","金融,电商",15-50人,php,武汉
PHP开发工程师,https://www.lagou.com/jobs/4888159.html,洪山区,5k-8k,武汉凯艺维通网络科技有限公司,1-3年,大专,"五险一金,节日福利,带薪年假,双休",1、有过项目开发经验，能独立完成小型代码程序项目； 2、熟练掌握php＋mysql开发，熟练掌握JavaScript、jQuery。3、具有良好的代码编写风格。4、有较强的学习能力。5、具备团队合作精神，有较强的沟通及协调能力。6、具良好的沟通影响力、团队合作力和自我激励能力。 7、工作积极、主动、有高度的责任心和职业操守；,"移动互联网,社交",150-500人,php,武汉
兼职PHP网站后端后台,https://www.lagou.com/jobs/5712487.html,洪山区,3k-5k,深圳市酷汇信息科技有限公司,不限,不限,日结,要求：1，对PHP熟练，对thinkphp框架及js熟悉，对Mysql数据库熟悉。2，有良好的代码规范。3，空余时间比较多，最好是不用加班，周末有时间的，或辞职找工作有时间的。兼职内容：1，对已有网站模板进行修改，整理。2，修理网站的bug。3，增加网站的新内容等。待遇：30元一个小时。,电商,少于15人,php,武汉
php开发工程师,https://www.lagou.com/jobs/6784787.html,东湖新技术开发区,7k-12k,武汉江峦科技有限公司,3-5年,本科,初创公司，晋升空间充足,工作内容：1、 负责APP后台和其他后台基础系统架构、模块、库和组件的研发2、 分布式海量数据存储和分析系统的研发3、 统计分析、报表、SaaS业务等系统研发4、 CRM、审核流程、工作流等内部管理系统的研发能力要求：1、 1年以上年PHP开发经验，计算机软件相关专业 2、 精通PHP，具备OOP思想，熟悉PHP性能优化和安全开发方法； 3、 熟悉并精通Thinkphp框架，对框架源码实现有深层次认识；4、 精通Javascript，CSS，（bootstrap或layui等前端框架优先），并能熟练调试解决bug；熟练掌握web相关开发技术，AJAX，html，JSON等；5、 熟悉MySQL（或其它关系型数据库），熟悉SQL优化；6、 熟练使用一种或多种第三方的API、并能完成第三方API接口的接入，有实际开发经验优先。7、 掌握linux基本命令、能基于linux做开发、能够搭建LAMP坏境、能够搭建PHP坏境的各种扩展，对服务器优化有一定的知识； 8、 熟悉当前互联网的流行应用，在交互开发、用户体验等方面有自己的见解，能主动根据业务需要，提出合理的方案； 9、 具有很强的学习能力和对新技术的追求精神，具有良好的团队合作能力，具有较强的责任心。福利待遇：1、底薪+提成； 2、周末双休，周一至周五上午9～12，下午13：30～18； 3、每月员工生日福利，公司不定期周边旅游，聚餐等； 4、缴纳社保，按国家法定节假日带薪休假。,"数据服务,软件开发",15-50人,php,武汉
php,https://www.lagou.com/jobs/6748411.html,洪山区,7k-13k,武汉乡土味士信息科技有限公司,3-5年,本科,五险一金 期权 双休 年假,"岗位职责:1.掌握it行业趋势，具备学习新技术与资讯的能力；2.负责公司平台技术架构及搭建，组织并参与技术攻关；3.建立项目需求分析书与项目执行方案，并制定项目任务和项目进度表；4.参与整个项目核心框架的设计，并完成完成核心代码的设计；任职要求:1.三年以上开发经验；2.精通B2B/B2C模式，熟悉TCP/IP,HTTP 等协议；3.精通基于PHP开源框架(ThinkPHP、CI)的开发；4.精通基于J2EE开源技术（spring，struts2，ibatis等）的开发；5.精通Oracle、mysql等数据库；6.精通js框架（jquery）的开发；7.精通第三方支付接口；8.精通分布式高并发服务器开发；9.熟悉Android/IOS移动端开发经验；","电商,工具",15-50人,php,武汉
PHP,https://www.lagou.com/jobs/6180625.html,洪山区,6k-10k,武汉飞猫环球商贸有限公司,1-3年,大专,待遇好，办公环境好,此岗位目前已经招满了，本职位用于储备简历，请谨慎投递哦！！！岗位职责：1.负责产品的设计研发工作；2.参与整体系统架构设计，找出系统瓶颈，改进系统算法，提高系统性能；3.参与项目的技术方案设计及技术评审。任职要求：1、有Web系统设计开发经验，熟悉常用设计模式；2、熟悉PHP，熟练运用Laravel、TP、Swoft等PHP常用开发框架；3、优秀的数据库设计优化能力，至少熟悉一种数据库应用，熟悉mysql者优先；4、熟悉Linux，熟悉一门或几门以下语言；C/C++/go等；5、扎实的计算机基础，熟悉数据结构，有较强的算法设计能力；6、学习能力强，有较好的沟通能力，能迅速融入团队。以下经验将有加分：1、熟悉swoole，深入其原理，有swoole实际项目研发经验；2、具有大型，高并发Web经验，有C语言和PHP扩展开发经验。,"电商,其他",150-500人,php,武汉
PHP开发工程师,https://www.lagou.com/jobs/5986230.html,洪山区,6k-10k,武汉飞猫环球商贸有限公司,1-3年,本科,待遇好，工作轻松,"岗位职责：1、能按照项目计划，按时提交高质量的代码，完成开发任务；2、系统升级开发维护；3、Linux系统维护工作；4、熟悉svn并进行团队项目协同开发；5、对所开发的功能进行测试。任职要求：1. 掌握和熟练使用Laravel、swoole等php开发框架；2、精通PHP编程，3年以上实际项目经验，本科学历以上；3、熟悉Linux系统,各种环境配置,生产环境部署；4、精通MySQL，Redis熟悉索引优化、查询优化、存储优化技术；5、了解Nosql大数据技术，熟悉MongoDB、Redis、HBase、KAFKA其中至少一种；6、熟悉面向对象的程序设计和MVC模型；7、拥有良好的代码习惯，要求结构清晰、命名规范、逻辑性强、代码冗余率低，代码注释清晰；8、熟悉使用svn、git等项目管理工具，有良好的团队协作开发经验。","电商,其他",150-500人,php,武汉
php后端,https://www.lagou.com/jobs/7082624.html,江汉区,5k-6k,武汉市劲捷电子信息有限公司,1-3年,大专,"专业团队,培训指导,下午茶分享",职位描述：1、负责公司运营项目的开发、改版及维护；2、用PHP开发网站、软件后台及API接口数据调用；3、用JavaScript、HTML开发网页、WebApp；4、与程序开发相关的网络服务器管理、性能优化工作。任职资格：1、熟练掌握PHP语言，至少熟悉一种PHP主流框架，一年以上PHP开发实际经验，有成型的作品案例可以参考，有Drupal等开源系统运用二次开发经验者优先；2、熟练掌握JavaScript程序开发，有Angular、微信小程序等前端开发经验值优先；3、熟悉html5+css3和移动端开发的优先；4、熟练掌握Linux/Apache/MySQL/PHP架构及各环节操作的优先；5、熟练掌握关系型数据库理论，对MySQL深入了解，具备大数据量数据库开发、管理、优化等技能；6、有良好的语言表达及沟通能力、团队合作精神，以及对工作强烈的责任心。 福利待遇：1、上班时间：8.30~12点，下午13:00~17:30 双休、社保五险；2、带薪年假、婚假、产假等；3、中餐补助、车费补助、；4、每六个月可获得一次调薪机会、年终13薪；5、年度免费旅游或拓展、年度免费员工体检；6、春节、妇女节、端午节、中秋节节日礼品；7、员工生日活动、公司温暖基金活动等。公司拥有年轻具有活力的团队，活泼不失严谨的管理氛围，无天花板的职业平台，欢迎渴望实现自我价值、愿意和公司共同发展的优秀人才加入！,移动互联网,15-50人,php,武汉
PHP开发工程师,https://www.lagou.com/jobs/4855639.html,武昌区,5k-10k,武汉全乐科技有限公司,1-3年,本科,"PHP,MySQL,HTML5,JQuer","岗位职责：1、根据产品设计编写产品详细设计；2、根据规划制定程序结构，数据库设计，编写程序；3、根据项目具体进展与前端、设计协调；4、负责网站功能的维护、优化和重构；任职要求：1、精通PHP+MySQL+Apache，1年以上php项目开发和管理经验；2、熟悉ThinkPHP框架，能独立开发功能性程序；熟练使用MySQL数据库, 有良好的数据库操作和维护经验；3、精于大中型数据库查询及结构优化，熟悉SEO优化技术；4、精通前端开发技术（CSS，HTML5，Javascript，JQuery, AJAX, JSON，XML）；5、较强的分析和解决问题的能力，有良好的编程习惯，结构清晰，命名规范，逻辑性强，代码冗余率低；6、能独立完成开发任务，同时具备良好的团队合作能力；","移动互联网,其他",15-50人,php,武汉
php开发工程师,https://www.lagou.com/jobs/7133244.html,东湖新技术开发区,12k-18k,北京无忧创想技术咨询有限公司武汉分公司,5-10年,本科,周末双休，五险一金，年终奖，带薪年假等,工作权重占比技术方案制定20%，平台研发 50%，接口研发 30%通用能力：沟通能力，学习能力专业能力：PHP技术，MySQL数据库，NoSQL使用职业素养：责任心，用户意识加分项：Java开发能力，有大流量、高并发经验岗位职责：1、根据产品新需求以及系统规划，完成需求开发和开发文档的撰写；2、优化已有的代码及实现技术，对于不合理的架构给出解决方案；3、负责技术对接主系统和其他系统之间的接口，数据同步；任职要求：1，本科及以上学历，具备扎实的计算机理论基础，4年及以上PHP开发经验，有管理经验者优先；2. 熟悉PHP开发语言，了解主流框架的使用及其原理，了解常用的设计模式，有composer及phpunit使用经验者优先；3. 熟悉标准 SQL 和数据库设计，具备 MySQL 数据库设计及性能优化经验;4. 编写代码规范，符合psr标准，具有写注释的习惯（标准注释）；5. 熟悉常用的版本控制工具（SVN、Git），熟练使用Linux，能在Linux进行开发；6. 良好的沟通能力和工作激情、具有良好的团队协作精神，可以承受较强的工作压力，善于协调沟通；7. 有大型互联网研发经验优先,移动互联网,50-150人,php,武汉
php后端,https://www.lagou.com/jobs/7075833.html,洪山区,5k-8k,武汉海居房地产咨询有限公司,1-3年,本科,"五险一金,发展空间,年终奖,福利待遇",岗位职责：1.负责项目网站/小程序的接口开发、后台系统的开发；2.参与需求提出合理的项目实施方案；3.参与系统/小程序的需求分析、设计、编码等开发工作；4.参与系统/小程序的运营和维护工作，保证系统/小程序稳定可靠运行；5.负责接口的开发维护和调试；6.具有独立架设网站经验者优先。职位要求：1.计算机及相关专业，本科学历以上；思想活跃，自学能力强，主观能动性强；2.有三年以上实际项目开发经验、对P语言有十分深入的了解；3.良好的数据库设计和优化经验，熟练MySQL数据库增删改查常用操作，熟悉memcached、Redis、MongoDB的使用；4.了解网站构架和性能优化，熟悉web缓存技术，并有实际的项目经验；5.可以阅读第三方文档，独立使用第三方SDK进行开发；6.熟悉Linux环境常用命令；有API设计、开发、测试及文档编写的能力；7.了解缓存、消息队列、定时任务、搜索引擎等相关技术；8.熟悉目前主流技术。薪资待遇：薪资范围内，面议,其他,150-500人,php,武汉
php开发工程师,https://www.lagou.com/jobs/5715569.html,江汉区,8k-15k,湖北易旅行国际旅行社有限公司,3-5年,本科,周末双休 弹性工作 带薪年假,岗位职责：1、负责网站、系统开发和维护，能独立承担一个项目的开发任务；2、参与相关业务逻辑后端架构设计、核心代码的编写及后端服务程序的研发和编写；3、独立完成完整功能测试和发布，准备相关的技术文档，协助解决各种技术问题；4、参与后台系统性能、安全、扩展等优化的设计和实现5、参与工作相关技术的研究，提升团队技术水平。任职要求：1、计算机及相关专业本科以上学历，3年以上工作经验；2、精通PHP语言，有一定的数据结构和算法基础，熟练掌握面向对象编程;熟练使用Laravel/ CodeIgniter/Yii2等一种主流PHP框架，至少阅读过一种框架的源码；3、熟悉Mysql，掌握Mysql分表、分区、集群等相关设计方案，扎实的SQL知识，熟悉Mysql的各种查询优化，具备大型数据开发经验者优先；4、掌握分布式文件存储、非关系型数据库（Redis、Memcach、MongoDB等）、消息队列、云计算等相关技术；5、掌握Linux常用的命令，对linux下的软件安装、配置、服务器运维熟悉，熟悉LAMP/LNMP的部署和性能调优; 有过高并发web网站架构经验，能够独立设计高并发系统架构者优先;6、熟练掌握Git的使用；熟悉Go或者Python语言者优先；7、良好的编码和文档习惯，注重代码风格，熟悉各种设计模式和原则，能持续的关注和优化自己做的项目；8、 有良好的沟通能力和理解能力，有良好的学习能力和强烈的进取心；9、有开发团队管理、项目管理经验者优先。,"消费生活,文娱丨内容",50-150人,php,武汉
php开发工程师,https://www.lagou.com/jobs/7089502.html,武汉经济技术开发区,10k-16k,湖北雨露雨点科技有限公司,3-5年,不限,工作优异者满一年后公司会有分红奖励,"岗位职责：1、精通PHP编程语言、有3年以上实际WEB应用开发的工作经验;2、能够独立开发系统优先3、具有MySQL索引优化、查询优化和存储优化经验；一种nosql技术方面的经验。4、熟悉Javascript/AJAX/Jquery、CSS、HTML/XML等相关WEB技术，熟悉vue优先;5、熟练使用yii2、thinkphp、laravel等一些国内外主流开发框架中的一种框架即可,具备二次开发能力,能够独立开发系统各功能模块;6、有良好的编程习惯,有较强的代码阅读能力、学习能力;7、有过大型网站WEB页面和脚本以及WEB服务器性能优化工作者优先;8、有强烈的责任心,具备抗压能力,积极主动、认真踏实、具有良好的沟通能力和团队合作精神;能够很好完成项目总监交予的开发工作。任职资格：1、年龄，户籍，学历，性别不限；2、有责任心和主动工作意识；我们提供开放透明的工作环境，您能体会到您的参与能直接影响到我们的发展过程和方向。",移动互联网 企业服务,15-50人,php,武汉
php开发工程师,https://www.lagou.com/jobs/6133786.html,东湖新技术开发区,6k-9k,北京小满夏至科技有限公司,1-3年,不限,福利待遇不错。前景乐观！,岗位职责：1. 主要是维护工作；2. 负责商城后台、小程序接口的模块设计与开发；任职要求:1. 计算机相关专业大专以上学历，1年以上 PHP 开发经验；2. 能够独立完成小规模的PHP应用程序及接口开发；3. 熟悉MySQL数据库或SQLSERVER数据库；4. 熟悉JavaScript、AJAX、HTML5、CSS3相关的前台技术应用；5. 积极上进，有钻研技术的热情，有一定的自学能力；,"广告营销,移动互联网",15-50人,php,武汉
php 软件工程师,https://www.lagou.com/jobs/7098495.html,江汉区,8k-15k,武汉瓜豆科技有限公司,1-3年,大专,五险一金 带薪年假 定期团建 加班补助,"技能要求：Laravel，PHP，MySQL1. 独立完成网站程序功能开发、维护和升级，包括新系统开发和现有系统的二次开发； 2. 具备团队合作精神和协同开发能力，善于与项目组其他成员协同工作实现开发目的； 3. 根据系统设计文档进行模块的详细设计和编码，完成开发任务； 4. 负责文档撰写，在前期设计交付URL接口文档、模板数据描述文档，在编码期间能撰写清晰明了的注释； 5. 完成上司指派的其他工作； 任职要求： 1. 具备5-10年以上PHP开发/技术支持经验，熟悉PHP面向对象的设计方法，熟练使用PHP常用MVC框架； 2. 具有良好的代码编写能力和良好的代码编程习惯，具备快速解决问题的能力； 3. 精通PHP+MYSQL编程，熟练使用Javascrīpt/Ajax以及CSS编写； 4. 熟悉主流开发框架及设计模式； 5. 熟悉各种WEB缓存技术，熟悉大型网站架构及性能优化； 6. 熟悉Mysql数据库应用开发，了解Mysql的数据库配置管理、性能优化，熟悉mangodb，postgresql的优先； 7. 熟悉laravel or thinkphp框架. 8. 至少具备一种SQL数据库(MySQL，Oracleetc、、)使用经验，了解事务，触发器，存储过程等。熟悉各种缓存及nosql技术。 9. 有云端发布经验 （microsoft azure or amazon web service etc.)10. 熟悉Angular, React Native, NPM, Promises, ES6 and Webpack 优先考虑。","消费生活,移动互联网",少于15人,php,武汉
