job_name,job_url,job_location,job_salary,job_company,job_experience,job_class,job_given,job_detail,company_type,company_person,search_key,city
高级爬虫工程师,https://www.lagou.com/jobs/6760669.html,河北区,10k-15k,炘宇（北京）科技有限公司,3-5年,本科,五险一金、带薪年假、节日福利、大牛指导,"岗位职责：1、负责研究网站特质，数据要素分析、提取、整合，网页信息抓取、解析、数据清洗等研发和优化工作；2、参与爬虫相关数据存储机制设计，参与设计数据有效利用策略，从数据合理性、完整性角度提供建议 ；3. 参与爬虫核心算法的策略优化研究，提升抓取的效率和质量；4、维护现有网络爬虫系统，完成数据采集与爬取、解析处理、入库等数据日常工作，根进技术热点，及时更新新的爬虫功能；5、负责性能优化、处理能力和效率提高；负责与大数据工程师、数据挖掘、分析人员、运营及产品等协同工作，完成数据统计、查询和分析；6、负责设计公司网络爬虫的功能开发及优化；7、负责爬虫核心技术研究、开发工作，对反爬虫屏蔽具有相应的应对策略。任职要求：1、全日制统招本科及以上学历，计算机、数学、物理及其他理工科专业；2、具有3年以上爬虫开发经验者，精通python；2、有APP反编译、逆向分析、脱壳、加密参数破解经验；3、对数据结构和算法设计有较为深刻的理解，具有良好的沟通能力和团队合作意识;4、熟悉正则表达式，Jsoup、XPATH，CSS选择器，能够从结构化和非机构化的数据中获取信息,了解各种Web前端技术，包括HTML／XML／JavaScript／AJAX／JSON等;5、熟悉linux平台、shell编程,熟悉常用的爬虫框架如scrapy；6、熟练使用Mysql、Mongodb等SQL、NoSQL数据库，精通数据结构和算法设计；7、对主流爬虫架构有深入研究，具有成熟爬虫工具的设计及运维经验；8、能够熟练使用APP抓包工具。加分项：1、有破解JS加密经验；2、有多线程经验优先；3、有分布式编程经验者优先。",移动互联网,50-150人,大数据,天津
java开发工程师,https://www.lagou.com/jobs/6585167.html,津南区,15k-25k,北京鸿运顺达搬家有限公司,3-5年,本科,六险二金学历政府补贴 免费食宿,"职责描述：1.作为研发骨干可以独立承担城市大脑、公安大脑的重点模块研发工作；2.承担研发层面设计、文档编写、配合测试测试工作；3.支持软件产品项目上线应用；4.领导交办的其他工作。任职要求：1.本科或以上学历，985或211重点院校计算机或相关专业优先，3年以上互联网公司Java开发经验；2.熟练掌握SpringMVC、SpringBoot、MyBatis、JQuery等框架，熟悉自动单元测试框架；  3.熟练使用SQL、Oracle、MySQL等主流数据库,熟练掌握java多线程编程；4.具有大数据、可视化框架、时空平台相关开发、产品研发经验优先。",物流丨运输,15-50人,大数据,天津
高级产品经理,https://www.lagou.com/jobs/7114295.html,南开区,10k-20k,天津中新智冠信息技术有限公司,5-10年,本科,工业智能化；七险一金；试用期百分百薪资,1.充分理解公司的发展战略以及公司对产品的发展规划；2.负责信息系统的产品定义和设计，包括竞品分析、需求梳理、原型设计等；3.负责项目进度跟进，与开发团队密切协作，把控需求，协调进度；4.负责撰写PRD文档，PPT汇报材料等。任职要求：1.本科及以上学历；2.五年及以上互联网或软件产品设计经验；3.有相关的大数据的项目或知识背景，对物联网有一定了解；4.对产品和交互有一定理解，输出产品原型和PRD，并能与设计、开发和测试人员密切协作，确保产品落地；5.清晰地逻辑分析和表达能力，乐观积极，具有责任心和执行力。说明：有toB经验优先，该岗位需短期出差。,"移动互联网,消费生活",50-150人,大数据,天津
天津链家销售管培生,https://www.lagou.com/jobs/6981741.html,南开区,8k-9k,天津链家宝业房地产经纪有限公司富力城一店,3-5年,本科,晋升快，五险一金，互助金出国游，定期团建,岗位职责：1、负责为金融、房地产提供项目咨询及大数据解决方案的销售工作。2、通过公司、渠道、自拓资源挖掘客户需求，与之沟通、商务谈判最终促成合作。3、签约后期服务跟踪工作。任职要求：1、大专及以上学历，3年以上互联网行业销售经验优先；2、有一定金融领域、房地产开发商资源、人脉者优先。3、至少3年以上大数据行业或相关行业经验。4、有一定抗压能力，乐于挑战高薪。,房产家居、消费生活,2000人以上,大数据,天津
短视频拍摄剪辑师,https://www.lagou.com/jobs/6733387.html,河北区,1k-2k,天津秋之文化传媒有限公司,应届毕业生,不限,抖音短视频好玩,觉得短视频拍摄创意有趣！并认为短视频内容塑造是风口，并且对艺术创意有高要求者投递！感谢！只招两个！【岗位职责】1.公司日常抖音批量养号及作品发布；2.收集同行短视频内容；3.注册QQ、微信、微博、今日头条、抖音号、快手号等；4.短视频作品评论回复；5.利用抖音内部算法迅速吸粉（会培训）；6.日常研究分析抖音大数据；7.外出拍摄；8.视频剪辑；【任职要求】1. 热爱短视频行业，富有想象力创造力，思维敏捷，头脑灵活。2. 有特殊技能优先考虑（舞蹈、化妆，篮球，唱歌，颜值高，散打、书法、旅游（导游）、养宠物等）；3. 擅长剪辑软件、平面设计优先考虑；4. 有摄影摄像基础优先考虑；,"电商,广告营销",15-50人,大数据,天津
课程咨询顾问,https://www.lagou.com/jobs/7064742.html,和平区,6k-9k,萌小芽科技（天津）有限公司,1年以下,大专,七险、房补等,"一个人的一生离不开各种证件，当你呱呱坠地之后，医院给你以“出生证”；经过多年的学习、考试，不同等级的学校颁发给你不同的毕业证；当你走上工作岗位后，又有了“工作证”各种证件见证了你的成长，是你能力的象征！ 我们帮考网专注于职业资格考证题库领域，通过大数据实现智能推荐，为每个考生量身定制个性化学习方案，帮助考生花最少的时间通过考试。历经10余年，五十余万考生的共同见证，帮考网目前已经成为职业资格考证刷题领先品牌，帮你将各种证件收入囊中。 我们招“课程咨询师”你需要做的就是了解学员需求，为学员推荐合适的课程并指导他们进行了解，外呼及接听学员来电、回答学员在线提出的问题,促成学员购买。同时有效管理自己的学员，进行定期回访，促成订单。 小编告诉你，咱们的客户全部由公司提供，均为线上注册学员，提供签约那就是小 case！",移动互联网,150-500人,大数据,天津
项目经理,https://www.lagou.com/jobs/7061177.html,西青区,8k-15k,天津博和利统计大数据有限公司,3-5年,大专,政府局长市长客户，百万级项目，行业**,IT大项目经理（博和利，中国政府统计及经济大数据软件**服务商）岗位职责：1. 负责信息化项目实施和管理工作，制定项目整体实施计划，把控各个环节；2. 负责项目需求调研工作，确定和控制需求范围，完成需求分析和设计工作；3. 负责项目进度和质量的把控，确保项目准时完成上线和验收交付工作4. 负责与客户单位的沟通协调工作，完成对客户的培训和汇报工作；5. 负责项目过程中相关方案的撰写工作。任职资格：1. 3年以上软件项目经历，本科及以上学历；2. 有责任心，学习能力强，能承担较大的工作压力，全国性项目，能出差3. 具备较强的沟通协调和管理能力，有软件项目实施经验者优先；4. 熟练掌握Oracle、MySql、SQL等数据库一种或几种；5. 有PMP证书优先。工作地：南开华苑待遇：1万+，五险一金双休,移动互联网,50-150人,大数据,天津
需求工程师,https://www.lagou.com/jobs/6990010.html,和平区,12k-18k,北京天码科技有限责任公司,5-10年,本科,工作氛围好，可以最大限度发挥你的特长。,工作职责：1、负责公司信息化集成项目的需求分析、方案设计、需求落地、售前方案交流的相关工作。2、根据客户需求、独立进行方案规划，售前PPT编写，投标技术方案编写。3、能够独立完成需求文档编制，与开发人员沟通进行需求落地。4、负责与销售、技术开发部门沟通协调，确保需求沟通充分。5、能及时分析竞争对手动态和市场动态，规划信息化集成方案，持续优化改进。  6、具备一定的沟通能力和文档功底。任职要求:1、计算机及相关专业，本科及以上学历，熟悉最新技术方向；2、对大数据、企业信息化、云平台技术有比较全面的认识，能够独立完成相关方面的方案规划设计；3、熟悉售前流程、招投标流程、需求调研流程；4、熟练需求分析、功能设计、售前PPT编撰、投标技术方案编撰。5、较强的逻辑思维能力和学习能力，能独立展开产品调研分析设计等工作。6、学习能力强、责任心强，跨团队合作能力强，具备良好的沟通协调和自我驱动力，能承受压力。7、熟悉企业信息化、智慧城市领域业务者优先。,数据服务,150-500人,大数据,天津
电话销售,https://www.lagou.com/jobs/7104239.html,河西区,4k-5k,天津市津门信息咨询有限公司,1-3年,不限,双休，法定节假日，氛围愉悦,工作内容：1.维护老客户关系2.无需进行销售，公司提供大数据，从中为业务经理筛查意向客户3.有较强感染力，学习意识强，有语言表达能力4.无需风吹日晒找客户，写字楼坐班，前期意向客户筛查5.定期团建，优秀团队旅行，公司氛围好，交通便利6.入职培训，无需迷茫，没有硬性电话访问量7.快乐，愉悦的工作氛围，这不是一个死板的公司！！！！ 职位要求：20岁到30岁，男女不限 工作时间：周1~周5，8.30~18.00，午休1小时，法定节假日休息,金融 电子商务,少于15人,大数据,天津
储备营业处经理,https://www.lagou.com/jobs/6937481.html,和平区,10k-20k,中美联泰大都会,不限,本科,收入不封顶，时间自主管理，完善的培训机制,招募管理:运用大数据筛选符合 MetLife要求的人才销售管理:运用大都会NBS理念指导小伙伴展业组织发展:培训、指导团队成员快速晋升团队建设:探求符合团队发展的管理理念和文化工作时间。双休、法定节假日，每个月额外带薪假期4天员工福利:不同晋升阶段国内外培训学习；员工及家属商业保险；长期服务奖；海外旅游；全球荣誉等。招募基本要求:年龄：28-45周岁大专以上学历年收入10w+无寿险从业经验对自己有目标，有强烈的进取心。大都会人寿（METLIFE）是美国大都会集团的简称，1868年成立于美国纽约，原名为 National Union Life and Limb Insurance Company。大都会人寿距今以有152年历史，期间参加过一战，二战，泰坦尼克号，911等大事件的赔付，全美寿险公司排名**，规模最大。平均每4个美国人就有一人是大都会的客户。除美国之外，集团还在亚太地区、拉美以及欧洲设有直属的分支保险机构。2004年进入中国。,金融,2000人以上,大数据,天津
大数据开发工程师,https://www.lagou.com/jobs/7055006.html,和平区,14k-27k,捷信消费金融有限公司,3-5年,本科,五险一金 带薪休假 补充商业保险,"Duties and responsibilities： l  Deploy business use cases that runs one JD/Taobao like Decision Engine and Search Engine；l  Technical savvy as much as business savvy；l  Being able to guide business who are not familiar with the technical design of DE/SE and design proper business use cases that will easy to implement, and logical to end EShop users；Being able to create KPIs that will be used to monitor system performance.Requirements:l  Deep knowledge of Scala on Spark，Maven/SBT;l  Deep knowledge of Python on scikit-learn, Pandas;l  Deep knowledge of data warehouse data modeling，Spark-SQL/Hive-SQL/PL-SQL;l  Deep knowledge of Vim, Linux;l  Deep knowledge of Decision Tree, LR, GBDT, DBSCAN, Fast-Unfolding, K-means, Data cube, etc and their respective optimization;l  Deep knowledge of XGBoost, LightGBM, Tensorflow framework;Being able to develop with Spark ML. Staff Welfare:1. After on boarding, providing supplementary commercial insurance besides the state-stipulated insurance and housing fund;2. Fast and transparent promotion channel and broad development opportunities;3. 5-15 days paid annual leave and 5 days paid sick leave. Free annual physical check-up;4. Attractive employee activities.",金融,2000人以上,大数据,天津
IT大数据平台基础架构工程师,https://www.lagou.com/jobs/6817715.html,和平区,15k-30k,捷信消费金融有限公司,5-10年,本科,五险一金 带薪休假 补充商业保险,"Duties and responsibilities:The Sr. Data Platform Infrastructure Engineer will ensure the stability of Homecredit data service platform which is based on big data technology (HDFS, HBase, Kudu, Impala, Hive, Spark, etc.), by optimizing platform performance efficiency and setting up monitoring system that will detect abnormal activities damaging platform performance. The candidate will leverage both their technology and leadership skillsets as they partner across the Infrastructure Delivery Organization to architect, design, implement and automate an infrastructure-as-a-service model for our data service platform.Requirements:Deep experiences managing the Big Data DBMS within a large enterprise environment;Hands-on architectural experience designing, implementing;And operationalizing Big Data DBMS based on Cloudera, Hortonwork, and Apache technologies;Good knowledge in cluster computing, strong experiences performing and optimizing common Big Data platform administration tasks (at both software and hardware level) in support of service delivery;Strong track record of successful use of the following Big Data DBMS functionalities: HDFS, HBase, Kudu, Impala, Hive, Spark, etc.;Hands-On experiences understand and analyze common Big Data technical logs;Hands-on experiences with DevOps database automation practices;Understand how Hive script, Impala script, Spark script impact cluster performance;Understand the mechanism of HDFS, HBase, Kudu, etc. and resource management among different components.Staff Welfare:After on boarding, providing supplementary commercial insurance besides the state-stipulated insurance and housing fund;Fast and transparent promotion channel and broad development opportunities;5-15 days paid annual leave and 5 days paid sick leave. Free annual physical check-up;Attractive employee activities.",金融,2000人以上,大数据,天津
品牌公寓租赁管家,https://www.lagou.com/jobs/5307675.html,河北区,8k-12k,紫梧桐（北京）资产管理有限公司,应届毕业生,大专,大牛共事 扁平管理 领导nice 颜值高,蛋壳是什么？蛋壳是一家资产管理公司，是一家大数据驱动的互联网公司，是一个房屋租赁生活服务平台。蛋壳公寓是中国领先的互联网长租运营商。公司成立于2015年初，是一家以数据驱动为核心，提供高品质租住生活的资产管理和居住服务平台，致力于用互联网方式改造传统的住房租赁行业，产品形态涵盖合租公寓、整租公寓等，满足都市年轻白领多元化的居住生活需求。截至目前，公司管理房间规模近13万间，已进入北京、深圳、上海、杭州、天津、成都、武汉。南京和广州9地市场。【我们爱这样的你】去过一些有趣的地方，看过一些有趣的人，经历过困苦或膨胀，最重要的是你热爱生活。1、统招专科及以上学历，专业不限；2、沟通能力强，普通话标准；有亲和力，工作积极主动，乐观开朗；3、目标导向，抗压能力强【一直在等你】1、住房补贴，住蛋壳享优惠，应届生优惠更大。2、我们提倡工作，更提倡愉快的工作，在蛋壳，智慧与颜值并存！2、底薪+绩效奖金+业绩提成，月入过万So easy；3、社保：入职即上五险一金，转正提供补充商业保险；3、办公环境：扁平的架构，轻松的办公氛围；【相遇坐标】南开区 河北区 河西区 河东区 和平区 红桥区 等均有工作站，根据需求以及你的居住地就近安排工作地点。【不止相遇那么简单】在蛋壳，公开透明内部竞聘，谢绝关系户，无论资排辈，说不定下一个leader就是你！！,消费生活,2000人以上,大数据,天津
运营主管（云平台）,https://www.lagou.com/jobs/6881668.html,滨海新区,15k-30k,华慧长天（北京）信息技术有限公司,3-5年,本科,发展前景,1、领导华慧云团队，负责整体战略规划、产品运营和客户服务；2、负责运营团队的搭建、考核、管理、培养，推动团队工作流程和业务标准的执行，把控工作质量与进度，协调内外部资源，保证运营计划有效执行；3、根据产品功能及特点，制定产品运营方案，推进产品策略落地，负责内容建设、活动策划、渠道建设、产品优化等方面的策略制定和执行；4、负责分析强化用户体验、挖掘用户需求，有效提升用户口碑、访问及活跃，研究用户运营数据和用户反馈，调整运营策略，制定产品优化方案，以保证运营绩效的持续提升，并定期出具运营分析报告及改进意见。 任职要求：1、计算机或通信相关专业本科及以上学历，5年以上互联网运营工作经验，教育行业云从业经历者、程序员出身者优先；2、熟悉云计算行业，具备扎实的云计算技术功底，熟悉人工智能技术、了解人工智能开放平台，熟悉互联网教育的发展现状及趋势，较强的市场敏锐度和战略思维优先，有大数据产品从业经历优先；3、有丰富的产品运营经验，熟悉运营管理结构和流程，对数据敏感，能够通过数据有效分析用户行为驱动问题解决，推动产品优化；4、具有用户增长思维，逻辑和分析能力强，具有较强的创新及策划能力和极高的执行落地能力；5、积极向上，有冲劲，有韧性，有成就一番事业的决心和毅力，擅长团队合作，具有较强的跨部门沟通能力及协调能力；6、有十人及以上团队管理经验者优先。,其他,500-2000人,大数据,天津
客户经理,https://www.lagou.com/jobs/6864450.html,南开区,14k-15k,天津南源科技有限公司,不限,不限,想做销售，想挣钱那就加入我们一起并肩前行,岗位职责：1.负责开发和跟进行业客户，挖掘客户需求，对客户定期跟踪拜访；2.掌握解决方案销售能力，能够按要求完成销售目标；3.协助和安排为客户提供解决方案并进行交流和演示；4.协助项目交付和售后服务，负责项目收款；5.负责客户关系管理和维护，保障客户满意度；6.协助销售团队建设，完成团队销售目标。任职要求：1.具有诚信的品质，以用户至上为导向；2.具有资深的金融行业大数据从业经验；3.对市场趋势敏锐，具有发现商机的天赋直觉；4.充满激情，渴望经济收入无上限；5.内心强大，不轻易放弃，不惧怕打击；6.善于沟通，中英文表达能力良好，熟练使用办公软件；7.985/211大学计算机相关专业本科以上学历优先。公司福利：1、周末双休妥妥的，还有病假、年假、女神假、青年假都带薪哒。2、各种津贴等你来！午餐、交通、通信、购书等补贴等你来拿。3、还有旅游津贴、健身津贴、定期体检！你的健康我们来买单。4、节日礼物、生日礼物、婚育礼物等你来拿。5、体贴细致的生活关怀，水果零食不定期轰炸，吃喝玩乐偶尔为之。6、轻松欢乐的工作氛围，你好我好大家好。,金融、数据服务,15-50人,大数据,天津
销售经理,https://www.lagou.com/jobs/6733120.html,河东区,4k-8k,天津市我爱我家房地产经纪有限公司榕洋金城分公司,3-5年,大专,福利待遇好,岗位职责：1、负责为金融、房地产提供项目咨询及大数据解决方案的销售工作。2、通过公司、渠道、自拓资源挖掘客户需求，与之沟通、商务谈判最终促成合作。3、签约后期服务跟踪工作。任职要求：1、大专及以上学历，3年以上互联网行业销售经验优先；2、有一定金融领域、房地产开发商资源、人脉者优先。3、至少3年以上大数据行业或相关行业经验。4、有一定抗压能力，乐于挑战高薪。,其他,2000人以上,大数据,天津
Java 高级研发工程师,https://www.lagou.com/jobs/6658174.html,西青区,15k-30k,天津市小蜜蜂计算机技术有限公司,5-10年,本科,绩效评价体系，广阔成长空间.,【任职要求】1. 精通Java语言，5年以上的Java开发经验，深入的了解底层机制与各种设计模式；2. 对常用的JAVA框架有较深入的理解，如Spring、SpringMVC、SpringBoot、MyBatis等框架的设计思想和实现方式；3. 精通 J2EE、WebService、大数据、分布式、多线程等高性能架构相关开发技术；4. 了解Web应用的性能瓶颈和调优方式，如搜索引擎优化、缓存系统设计、网站负载均衡；5. 熟练掌握Oracle/MySQL/SQLServer数据库，熟悉数据库优化与数据挖掘技术；6. 精通主要应用服务器（Weblogic/WebSphere/Tomcat等）的配置和使用；7. 掌握面向对象的软件分析、设计和开发技术，对产品与项目的需求有良好的分析与系统设计能力；8. 具有良好的文档编写能力，并能对初中级研发工程师进行指导；9. 具备极强的独立思考和解决问题的能力；10．具备仓储物流软件开发经验者优先考虑。,企业服务,500-2000人,大数据,天津
web前端开发工程师,https://www.lagou.com/jobs/6395210.html,东丽区,12k-20k,中汽研汽车工业工程（天津）有限公司,3-5年,本科,五险一金 绩效奖金 交通补助 健身房,职责描述：1、负责产品Web界面设计开发、易用性改进、界面优化以及性能优化，持续提升用户体验；2、负责产品的前端构建，各类交互设计与实现；3、负责与后端工程师配合，为产品提供最优化的技术解决方案，前后端能共同配合完成项目。任职要求：1、全日制本科及以上学历，三年以上相关行业WEB前端开发工作经验；2、熟练掌握HTML、CSS、JavaScript、JSP、AJAX等前端开发技术，对BS架构软件有深入了解，掌握Web开发技术；3、熟悉Bootsrap、mint-ui、ElementUI等布局技术；4、精通vue框架、angular框架、react框架中一种，熟悉webpack，gulp，grunt等构件工具的一种；5、熟悉常用WEB开发调试工具；6、有良好的技术文档习惯，具有规范化，标准化的代码编写习惯；7、能紧跟前端技术的发展，将业界可用的经验运用到实际项目中。中汽研汽车工业工程（天津）有限公司（原机械工业部汽车工业天津规划设计研究院）隶属于中国汽车技术研究中心有限公司（国务院国资委管理的中央企业），公司成立于1985年，是中国汽车行业内具有丰富工程经验的工程公司。公司内部专业配置齐全，具备智能工厂、数字化研发中心设计及总承包实施能力，涵盖建筑、结构、工艺、智能化、公用设备、节能环保、规划咨询等20多个专业，涉及工程设计、工程咨询、总承包、装备制造、信息工程五大业务板块。自2004年公司建立企业信息化工程业务以来，目前已在业界拥有众多成熟案例，具备以MES、LES为核心，上下扩展至ERP、PLM、IIOT、智能网联的一体化解决方案。在中汽研“十三五”发展规划中，制定了以智能制造为主攻方向，推动“互联网+智能制造”转型和工业互联网创新发展，围绕信息技术集成应用、网络化升级改造、互联网制造新模式、工业大数据应用等制造业与互联网融合应用，帮助企业开展有效竞争，推动工业生产迈向智能时代，打造中国制造业明天的辉煌。我司典型信息化签约客户：广汽菲亚特克莱斯勒、奇瑞捷豹路虎、拜腾、福建奔驰、长城汽车、长安汽车、广汽传祺、吉利汽车、合众新能源等国内外知名整车企业。,"企业服务,其他",150-500人,大数据,天津
