job_name,job_url,job_location,job_salary,job_company,job_experience,job_class,job_given,job_detail,company_type,company_person,search_key,city
go语言开发工程师,https://www.lagou.com/jobs/5116307.html,西湖区,15k-30k,杭州溜达网络科技有限公司,3-5年,大专,"快速发展,14薪,带薪年假,周末双休",关于我们：我们是一家做流量增长的企业服务公司，服务过网易、阿里云、携程、中国电信等多家知名企业，核心团队来自阿里的在线营销部门，有16年的丰富行业经验。我们期望把这些能力复制给更多的商家，帮助他们掌握自己的流量，不受制于平台。 期待有梦想、有韧性，乐于创造价值的你加入！你将承担的工作：1.用go语言开发公司的部分网站。2.用go语言开发linux服务器相关软件。 你已掌握的技能：1. 熟练使用Linux操作系统； 熟悉web开发相关技术。2. 精通C/C++/PHP等其中一种开发语言。3. 熟悉数据结构与算法，熟悉Redis、MongoDB等NoSQL技术。4. 拥用良好的编码规范，能够熟练阅读英文文档。5. 5年以上编程开发经验，拥用GO语言开发一年以上经验。6. 了解TCP/IP协议栈，HTTP协议。7. 了解Linux编程；了解POSIX API；sockets编程；用C写过多进程/多线程的网络服务程序优先。 你会获得有行业竞争力的薪资和很多个性化的福利：1. 行业大牛CEO的**内部培训分享会，助攻UP~!2. 核心员工股权激励方案、年终分红、全额公积金、年终奖、绩效奖金、带薪年假；3. 弹性工作时间，上下班无需打卡；4. 超高能装备：升降支架，机械键盘，3D显示屏幕等等；5. 不定期组织outing ：漂流，轰趴，露营BBQ，旅游等等超酷团建项目；6. 免费购书无上限。 优秀同学薪资open!,移动互联网,50-150人,go,杭州
后端高级开发工程师(Go),https://www.lagou.com/jobs/7173515.html,下沙,25k-35k,杭州鲸算科技有限公司,5-10年,不限,双休,岗位职责：1. 带领开发团队完成技术平台的开发任务2. 负责运维基于容器的自动化平台及各个组件的设计和开发3. 负责监控系统、日志平台的优化和二次开发4. 负责公共云管理系统设计和开发5. 负责安全中心的设计和开发任职资格：1. 5年以上开发经验，有很好的项目和人员管理经验2. 具有良好的编码规范，理解并遵循标准的开发流程，有很强的自动化运维的意识3. 熟悉Go语言开发，以及go生态相关框架和库4. 有Python开发经验优先5. 熟悉Docker以及Kubernetes编排系统并有相应开发经验的优先6. 好奇心强，做事靠谱，善于思考，沟通能力强，执行力强,"人工智能,软件开发",500-2000人,go,杭州
go开发工程师,https://www.lagou.com/jobs/7206410.html,西湖区,15k-20k,武汉佰钧成技术有限责任公司,1-3年,大专,六险一金 周末双休 带薪年假 绩效奖金,任职要求1.负责视频监控协议开发2.提升产品稳定性的开发工作3.根据需求做定制化开发或脚本开发4.出差偶尔客户现场支持岗位要求：1.2年以上Linux系统下开发经验；2.熟悉Golang；3.至少熟悉Shell/Perl/Python一种脚本语言；4.GBT28181和ONVIF经验者优先；5.沟通理解能力较好，具备独立分析和解决问题的能力。后面的同学需要沟通一下预期，有一定的客户支持工作，不全是代码开发岗位职责（主要工作内容、核心要点）1.视频监控产品业务诊断工具开发2.提升视频监控产品业务稳定性相关的开发3.客户网络诊断工具开发4.协议客户端模拟工具开发5.客户对接与问题排查,移动互联网,2000人以上,go,杭州
服务端研发工程师（Go）,https://www.lagou.com/jobs/6966697.html,西湖区,20k-40k,杭州微拍堂文化创意有限公司,3-5年,大专,独角兽企业,"岗位职责：1、负责微拍堂基础服务系统的研发，迭代及升级维护；2、优化调整基础服务架构高可用性、高可扩展性；3、对现有系统的不足进行分析，找到目前系统的瓶颈，改进系统算法，提出并实施落地可行性优化方案。任职要求：1、熟悉Golang，3年及以上实际项目经验；2、熟悉微服务的设计原则，对分布式缓存、消息队列、全链路追踪等技术有实际项目经验；3、熟悉MySQL、Redis、MongoDB等主流数据库结构的设计,有独立部署调优经验；4、熟悉TCP/IP协议的基本运作原理；5、熟悉分布式系统，Elasticsearch，Kingshard,Codis,Nsq者优先；6、热爱钻研，有责任心、不浮不躁、具备良好的沟通能力及团队合作精神。","移动互联网,电商",500-2000人,go,杭州
go后端／golang,https://www.lagou.com/jobs/6537172.html,西湖区,15k-30k,杭州微拍堂文化创意有限公司,3-5年,本科,六险一金 餐补 全勤奖 年终奖 出国旅游,"岗位职责：1、负责微拍堂基础服务系统的研发，迭代及升级维护；2、优化调整基础服务架构高可用性、高可扩展性；3、对现有系统的不足进行分析，找到目前系统的瓶颈，改进系统算法，提出并实施落地可行性优化方案。任职要求：1、熟悉Golang，2年及以上实际项目经验，了解TIDB源码者优先；2、熟悉微服务的设计原则，对分布式缓存、消息队列、全链路追踪等技术有实际项目经验；3、熟悉MySQL、Redis、MongoDB等主流数据库结构的设计,有独立部署调优经验；4、熟悉TCP/IP协议的基本运作原理；5、熟悉分布式系统，Elasticsearch，Kingshard,Codis,Nsq者优先；6、热爱钻研，有责任心、不浮不躁、具备良好的沟通能力及团队合作精神。","移动互联网,电商",500-2000人,go,杭州
监控平台开发工程师（Python、Go、C++）,https://www.lagou.com/jobs/7113916.html,余杭区,15k-25k,杭州同花顺数据开发有限公司,1-3年,本科,上市公司 免费中晚餐 核心项目,"岗位职责：1. 负责公司监控平台的设计和开发工作；2. 发现和解决系统性能瓶颈等技术难题；3. 整合现有监控，针对业务系统提出合理优化建议,提高监控的有效性，实时性，先于用户发现问题。岗位要求：1. 本科以上学历，有1年以上互联网运维平台或中间件研发经验,掌握两种及以上开发语言；2. 对监控理念有较深的理解，了解国内外先进的监控解决方案；3. 有监控系统研发或运维经验，熟悉业界常用开源监控系统架构及工作原理（如zabbix;nagios;prometheus;open-falcon等），能够根据不同监控问题制定相应监控解决方案；4. 开源监控系统二次开发经验更佳。","金融,电商",2000人以上,go,杭州
GO开发工程师,https://www.lagou.com/jobs/6965178.html,余杭区,15k-30k,杭州同花顺数据开发有限公司,1-3年,本科,金融大数据产品 技术氛围浓 上市公司,职责描述：1、负责后端业务中心、服务平台的API基础层建设、维护； 重构原有项目从其他语言到GO；2、支撑用户中心、产品中心、充值中心、CRM等系统业务，能够高效的进行迭代；3、不断学习并创新，改进后端系统的服务能力。任职资格及要求：1、统招本科及以上学历，计算机、数学相关专业；2、两年以上开发经验，一年以上的Golang开发经验，有主流框架的项目经验；3、基本功扎实，熟悉常见设计模式、常见数据结构算法、MySQL等关系型数据库、熟悉缓存技术、HTTP协议；4、较强的设计能力，具有良好的代码风格、接口设计与程序架构，可独立高标准的完成系统的设计及开发；5、具有良好的团队协作沟通能力、责任心强、快速学习能力；6、有网络编程、高并发开发经验优先。,"金融,电商",2000人以上,go,杭州
go/golang/C++/Java,https://www.lagou.com/jobs/7162532.html,西湖区,30k-60k,上海佑柏装饰设计工程有限公司,5-10年,本科,云计算 ，世界500强,办公地点：上海/杭州/北京岗位职责：构建新一代serverless计算平台，包括：1. 设计和实现完整可扩展的前端系统，包括身份验证/权限管理，元数据管理，流量控制，计量计费，日志监控等等2. 设计和实现弹性可靠的后端系统，包括资源调度，负载均衡，容错处理等等3. 丰富易用的SDK/Tools/CLI/控制台4. 用户需求驱动，追踪业界趋势，利用技术推动业务的成长任职资格：1. 算法/数据结构/操作系统等基础知识扎实，优秀的逻辑思维能力。2. 至少掌握一门编程语言。例如Java/Go/C/C#/C++。3. 有大规模、高可用分布式系统开发经验者优先。4. 有Web/Mobile Backends/Microservice开发经验者优先。5. 良好的沟通能力和团队合作精神，有一定的组织协调能力。6. 本科及以上学历7. 3年以上工作经验,其他,15-50人,go,杭州
Go后端开发,https://www.lagou.com/jobs/6898846.html,江干区,6k-9k,杭州集信科技有限公司,应届毕业生,不限,福利佳，工作生活平衡，性价比高,职位描述：1. 负责各产品线的后端微服务的开发2. 负责和前端的联调对接3. 负责Bug的修复和软件完善工作任职资格：1. 本科及以上学历，计算机相关专业2. 熟练掌握Go或Node.js语言，有C++开发经验者优先3. 熟悉MySQL、Sqlite，Redis等常用数据库，有良好的数据库设计和优化能力4. 具备良好的编码习惯，结构清晰，命名规范5. 熟悉linux下开发，有跨平台开发经验者优先6. 有高并发、海量数据处理经验者优先,"通讯电子,其他",15-50人,go,杭州
GO|Golang开发工程师,https://www.lagou.com/jobs/7146226.html,西湖区,15k-25k,拉勾猎头,3-5年,本科,"阿里系,云生态,数据智能,周末双休",﻿1、大数据运维开发工程师（面向docker、kubernetes做自动化部署、监控、运维平台开发）; 2、负责公司大数据产品运维管理平台的迭代研发； 3、负责公司产品交付效率工具研发；﻿1、本科及以上学历，3年左右的golang开发经验，熟练使用web开发框架； 2、熟悉docker，熟悉kubernetes架构，有实际的容器云开发和运维经验； 3、熟悉grafana\promethues等开关项目，有实际的监控系统开发经验； 4、有面向To   B项目交付经验者优先； 5、有大数据产品运维经验者优先； 6、对新技术有快速学习和上手能力，对代码有一定的洁癖； 7、能接受短期出差者优先。  加分项： 1、在GitHub或其他平台上有热门开源项目,"移动互联网,企业服务",500-2000人,go,杭州
高级后端开发工程师（C++/Go,https://www.lagou.com/jobs/6990058.html,余杭区,25k-35k,北京旷视科技有限公司,3-5年,本科,福利待遇好、晋升空间大、有补助,工作职责:1. 设计和研发分布式特征检索数据库，开发高可用，健壮性强，低成本的特征存储数据库。设计调度策略，一致性策略，并发策略等策略优化存储和检索效率；2. 设计和研发分布式小文件存储数据库，开发高可用，低成本，易用的小文件存储服务；3. 负责公司人脸，行人，车辆等特征的高性能检索组件的开发，开发适配cpu，gpu，arm等芯片的高性能检索组件，优化十亿级别特征的检索效率；4. 研究和开发大规模特征比对服务。 任职资格:1. 设计和研发分布式特征检索数据库，开发高可用，健壮性强，低成本的特征存储数据库。设计调度策略，一致性策略，并发策略等策略优化存储和检索效率；2. 设计和研发分布式小文件存储数据库，开发高可用，低成本，易用的小文件存储服务；3. 负责公司人脸，行人，车辆等特征的高性能检索组件的开发，开发适配cpu，gpu，arm等芯片的高性能检索组件，优化十亿级别特征的检索效率；4. 研究和开发大规模特征比对服务。,人工智能,500-2000人,go,杭州
蚂蚁集团-Go技术专家,https://www.lagou.com/jobs/6792316.html,西湖区,30k-60k,支付宝（杭州）信息技术有限公司,3-5年,本科,长期激励 大平台 团队氛围 快速成长,"岗位描述：1. 负责SQL引擎核心模块的开发和测试2. 参与SQL引擎关键新技术和新功能的预研和原型工作3. 负责各个模块和功能的问题修复和版本维护岗位要求：1、良好的设计和编码品味，热爱写代码，有代码洁癖更佳；2、动手能力强，喜欢折腾，有解决复杂问题的能力与兴趣；3、了解MySQL、PostgreSQL等主流关系数据库，最好postgreSQL源码阅读经验或相关SQL引擎开发经验；4、了解数据库常用的数据结构和算法，例如B+ tree，hash等5、有Golang开发经验优先，或者C/C++开发经验。""","金融,移动互联网",2000人以上,go,杭州
C++/Go技术专家-北京/杭州,https://www.lagou.com/jobs/6889973.html,西湖区,30k-60k,支付宝（杭州）信息技术有限公司,3-5年,本科,C++/Go技术专家-北京/杭州,负责蚂蚁金服核心搜索引擎，广告引擎，推荐召回引擎，认知计算引擎等核心1、有c++，golang其中之一开发经验，追求**代码；2、具备搜索引擎/广告引擎/高性能存储引擎/高可靠在线服务 其中之一相关经验优先3、熟悉tenserrflow或者pytorch内部原理及使用优先4、熟悉搜索算法优先5、最重要的是个人潜力与责任感，有激情，有担当，有想法，不断突破自我，能够在新领域快速学习适应职位要求,"金融,移动互联网",2000人以上,go,杭州
Go后端开发,https://www.lagou.com/jobs/6243663.html,西湖区,10k-20k,极智安网（杭州）科技有限公司,1-3年,本科,"前沿创新,福利好,旅游,高速发展","【岗位职责】
 独立承担功能模块的设计和代码编写，对功能和稳定性负责
 负责公司安全产品后端业务开发
  参与解决方案的设计和研发
 具有良好的抗压能力，能够接受加班
 【任职要求】• 计算机及相关专业，本科以上学历。一年以上GoLang开发经验；• 除Go语言之外 ，熟悉python开发，有相关开发作品的，优先考虑；（不考虑只会python）• 熟悉MySQL、mongodb、sqlite等常用数据库一种以上，有良好的数据库设计和优化能力，了解常用调优方案• 具备良好的编码习惯，结构清晰，命名规范• 了解分布式高并发，了解Kafka、RabbitMQ一种以上消息中间件• 了解TCP/IP协议，有一定的网络相关基础• 有良好团队合作精神，乐观的工作态度，较强的责任心和主观能动性【加分项】
 了解XSS、CSRF、sql注入等基本的网络攻击和防御方式的原理，优先考虑
 有安全行业从业经验的，优先考虑
[我们期待优秀的你加入，在这里你可以]
 全员开放探寻讨论技术设计、技术框架和技术选型，是一个纯技术、重技术、崇尚技术的团队
 接触和学习安全行业前沿技术
 核心优秀员工股权激励方案、一年最高五薪绩效考核奖金",信息安全,15-50人,go,杭州
go后端开发,https://www.lagou.com/jobs/4665056.html,滨江区,15k-25k,杭州老爸评测科技有限公司,1-3年,本科,"六险一金,定期体检,团队活动,地铁站边","【岗位职责 】负责各产品线后端的模块开发与维护。【任职要求】1、计算机等相关专业大专及以上学历；2、1年以上开发经验，其中半年以上Go开发经验；除Go语言之外，至少熟悉一门主流编程语言（如PHP、Java、Python等）；3、熟悉使用MySQL、Memcached、Redis等，并具备模式规划、设计能力；4、拥有良好的代码书写和编程习惯，了解代码管理与版本控制；5、可承受压力，有责任感；学习能力强，自我驱动力强。【加分项】1、擅长算法,大学期间有ACM/TC经历者优先；2、有微服务开发经验优先。----------------------说明：部门全员配备mac电脑+大屏显示器+机械键盘。明确的人才培养目标，大牛带你飞。目前也有百万级pv的产品，你所开发的项目能有大流量的检验。","电商,移动互联网",150-500人,go,杭州
服务端Go研发,https://www.lagou.com/jobs/4614469.html,下城区,10k-15k,杭州朋越网络科技有限公司,3-5年,不限,快速成长，技术挑战,职位描述：职位描述：1、参与莲子基础数据平台服务的服务端架构设计与系统开发；2、参与实施服务端的性能诊断与优化。资格要求：1、 扎实的计算机专业基础，熟悉常用的数据结构与算法；2、 熟悉Go语言，会使用React等JS主流框架，熟悉shell或者python脚本并能在Linux环境进行开发；加分项：1、 有开源数据库如Postgresql、数据管理如zookeeper、etcd等key-value系统开发经验的优先；2、 了解Docker/K8S容器技术及其内部实现原理（linux namespace、cgroup、lxc）者优先；3、 有分布式系统相关开发设计经验者优先。,"移动互联网,数据服务",50-150人,go,杭州
Go语言,https://www.lagou.com/jobs/6878347.html,滨江区,20k-40k,杭州网存科技有限公司,3-5年,本科,年轻团队,岗位要求：1.区块链有深入了解，至少3年以上Golang开发经验，熟练使用Golang进行Web，微服务应用开发2.有丰富的Linux环境下的编程经验，熟悉多线程进程及网络开发；深入理解计算机网络和现代操作系统3.对服务端相关技术和架构(通讯、计算、存储)有较深刻的理解4.有良好的编程习惯，包括好的设计文档，单元测试，代码审查；5.有大规模分布式项目，高性能大并发项目经验优先；6.有ADX和DSP系统相关开发经验的优先；7. 工作主动，求知欲强，能刻苦钻研，从解决软件技术难题中获得成就感8.沟通性好，反应灵敏，思路清晰，学习能力强，具有较好的团队合作精神。,其他,15-50人,go,杭州
GO开发工程师,https://www.lagou.com/jobs/6730908.html,拱墅区,10k-20k,广州罗坚网络科技有限公司,3-5年,本科,老板，员工很nice. 工作氛围轻松，,"职位描述：1. 参与产品基础服务平台的设计、研发工作，提升产品稳定性。2. 与产品经理尝试沟通产品需求。3. 进行相关产品的技术文档编写，方案设计。任职要求：1. 计算机或者数学相关专业，本科及以上学历。2. 基于微服务架构，负责管理后台,前端Api所有功能开发及维护，不断提升代码质量、可扩展性和可维护性。3. 具有至少两年golang项目经验和三年以上4.其它语言（PHP/C++）的项目经验。5. 精通 MySQL应用开发，熟悉数据库原理和常用性能优化技术，以及 NoSQL原理、使用场景以及限制,精通redis。6. 熟悉至少一种消息队列 Kafka/Rabbitmq/Redis等7. 负责所编程序的自测试工作，并参加系统集成和联调。8. 具有分布式系统设计和开发经验者优先。9. 精通TCP/IP，HTTP协议，包括但不限于RPC、调用策略等；精通Protobuf/JSON序列化协议者优先",金融、其他,15-50人,go,杭州
运维主管,https://www.lagou.com/jobs/6407252.html,滨江区,15k-20k,浙江顺联网络科技有限公司,5-10年,大专,"带薪年假,绩效考核，节假日福利，加班补助","岗位职责：1. 负责运维团队的建设和管理，带领运维团队建立运维体系、规范，负责运维层面的稳定性保障；2. 深度配合架构、研发，提升架构的可运维性、服务稳定性；3. 负责持续改进完善运维业务体系，并且支持各项运维工作；5. 负责网络以及服务器的网络设置、维护和优化、网络的安全监控 、系统性能管理和优化、网络性能管理和优化;4. 保障运维安全，处理运维事故,优化各项维护工作标准操作规范，处理各类应急事件，建立合适的应急预案并组织演练;5. 负责内部分派下发，对实施结果负责；任职要求：1. 本岗位非纯管理岗，需要有较强的动手和实践能力;2. 5年以上运维工作经验，负责过3人及以上的运维团队管理工作;3. 精通Shell/Python/Perl/PHP/Go/Lua等1至2种编程语言；4. 熟悉互联网产品的运维流程，有海量的运营产品架构规划、调优项目经验;5. 自我驱动能力强，有较强的学习能力和良好的技术视野;6. 有费用成本管理意识，并具备成本优化能力，有效控制整体运维成本；7. 熟悉分布式架构、解耦部署，并熟悉相关产品。熟悉网络，存储，系统， 数据备份，两地三中心等技术；8. 工作细致踏实，有较强的沟通、执行能力；","移动互联网,电商",150-500人,go,杭州
运维工程师(DBA方向),https://www.lagou.com/jobs/6407362.html,滨江区,20k-30k,浙江顺联网络科技有限公司,5-10年,大专,"带薪年假,绩效考核，节假日福利，加班补助",岗位职责：1. 负责公司MySQL/NoSQL等各类数据库的管理，保障DB服务的安全稳定与高可用；2. 负责公司线上数据库的日常监控、权限控制、数据订正、数据备份和迁移、SQL审核和优化；3. 制定和实施数据库安全策略，运维审计策略等；4. 负责生产环境MySQL数据库的运维管理、性能监控、容量规划等；5. 负责数据库的SQL优化，完善数据库开发规范，深入理解业务，为开发提供合适的优化建议；任职要求：1. 5年以上DBA工作经验，有大型互联网产品运维经验，对生产系统有敬畏之心；2. 精通MySQL数据库，深入理解InnoDB引擎，对性能优化、可靠性部署、分库分表、读写分离、一致性方面，有大量生产实践经验，能与开发团队紧密配合，规划、设计和优化数据库技术方案；3. 熟悉业内常见的数据库高可用技术及常用的架构解决方案，熟悉各种MySQL中间件产品，熟悉两地三中心方案;4. 扎实的专业基础技能，熟悉任意一种语言 (Shell/Python/Perl/PHP/Go等)；5. 至少了解一种NOSQL技术【mogonDB/Redis/memcache等】，了解其优缺点和主要的应用场景；,"移动互联网,电商",150-500人,go,杭州
高级运维工程师,https://www.lagou.com/jobs/5488397.html,滨江区,15k-30k,浙江天垂科技有限公司,1-3年,本科,"硅谷团队,五险一金,弹性工作,正版软件","负责运维平台的规划设计和开发
 运维新技术的研究，运维规范的指定
技能要求：
 3年以上的工作经验，至少2年以上的运维平台架构经验
 精通自动化运维平台的搭建，包括持续集成、自动化部署、灰度发布（canary deployment）、日志中心、监控中心等
 熟练使用linux操作系统
 熟练使用python、shell，熟悉django、django-restframework或者flask优先
 熟练使用docker，了解docker swarm、kubernetes，有过kubernetes实际项目经验优先
 熟练使用jenkins，熟悉jenkins pipeline优先
 熟悉aws运维平台优先
加分选项：
 985，211院校毕业生
 熟悉go开发 或者Java
除此之外HR想说：
 截至目前，我们的程序员小伙伴都毕业于211/985学校，还有硅谷的技术大牛带队指导，探寻讨论技术设计、技术框架和技术选型，是一个纯技术、重技术、崇尚技术的小团队；
 热烈欢迎各种小姐姐加入；
 想要转型学习使用其他语言的小伙伴，也请快快砸来简历，我们更看重潜力而非目前的技术水平，HR小姐姐期待你们的加入~~","数据服务,企业服务",15-50人,go,杭州
高级c++工程师,https://www.lagou.com/jobs/6603829.html,滨江区,25k-50k,北京达佳互联信息技术有限公司,3-5年,本科,期权激励、大牛云集,岗位职责：（可选以下任一方向）1. 负责百亿级广告投放引擎及相关上下游研发。2. 通过基础框架迭代、热点优化、监控工具研发等方式，持续优化数万服务器规模的性能，并对延迟做出保障。3. 通过基础框架迭代、开发流程管控、服务自愈系统研发等方式，持续提升数万服务器规模的可用性，并作出SLA保障。任职要求：1. 有良好的编程基础，对操作系统运行机制有一定理解。2. 对c/c++语言的基础机制有理解，不要求掌握模版元等高级特性。3. 不要求广告领域从业经验，乐于见到跨行业、跨领域、跨语言的求职者。加分项：1. 有大规模服务维护经验，对可用性提升、故障处理有大量生产实践经验。2. 技术Geeker，对新的技术、**性能有狂热的追求。3. 在c++/java/go等服务端场景，有较多技术积累和深耕,文娱丨内容,2000人以上,go,杭州
