job_name,job_url,job_location,job_salary,job_company,job_experience,job_class,job_given,job_detail,company_type,company_person,search_key,city
android开发工程师,https://www.lagou.com/jobs/7129480.html,江宁区,7k-12k,广西飞熊科技有限公司,1-3年,不限,股票期权领导nice带薪年假,岗位职责1.负责手机、Pad平台下APP的开发2.独立完成Android软件开发、测试中发现的问题3.对Android平台开发技术进行研究，根据开发过程中的体验对产品提出改进建议负责APP的上线，后期更新维护工作。任职资格1. 大专及以上学历，具有2年以上Android互联网应用开发经验，参与过完整的互联网应用项目开发；2. 熟悉Java编程，熟悉Android应用开发；3. 熟悉网络编程、Http协议，熟练使用多线程编程；4. 对Android应用开发有深入了解，有互联网应用相关开发经验者优先；5. 熟悉Android控件的绘制流程和事件分发流程，精通自定义控件、事件分发原理者优先；6. 熟悉Android动效开发，精通动效原理、有复杂动效开发经验者优先；7. 有较好的性能意识，了解常用的性能优化方法和性能调试工具；,移动互联网 信息安全,150-500人,android,南京
android开发工程师,https://www.lagou.com/jobs/7107753.html,雨花台区,12k-20k,上海易宝软件有限公司南京分公司,1-3年,大专,双休，13薪资，带薪年假，生日礼物等,1职位要求:1一年以上android平台开发经验，熟练使用eclipse、androidsdk等开发工具进行开发，了解android框架api；主导过一个以上开发项目者优先。有成熟作品者优先；2.构建软件产品的系统架构，包括软件设计、编码和验证；3.根据产品需求和概要设计写出产品详细设计文档，对指定模块和功能编码实现，参与相关技术难点攻关；4.熟悉Android平台UI设计规范，对Android控件的理解较深，能够按要求实现自定义UI和功能；5.热爱开发工作，乐于学习，积极主动完成工作任务。福利待遇：1.同行业中具有竞争力的薪资水平，每年一次年度调薪机会；2.加纳五险一金，实行双休工作制；3.享受带薪年休假和法定婚假、产假、哺乳假等；4.端午、中秋等节假日发放过节礼品；5.生日礼物。,移动互联网,150-500人,android,南京
Android开发工程师,https://www.lagou.com/jobs/7151602.html,雨花台区,15k-20k,南京元贝信息技术有限公司,1-3年,本科,福利多多、产品自主研发、,【岗位职责】1. 负责公司现有App产品Android客户端开发和维护；2. 负责分析和解决产品开发中遇到的问题，提升用户使用体验；3. 参与项目技术方案的制定，并进行相关的设计或开发工作；4. 设计良好的代码结构，不断迭代重构；5. 承担重点、难点的技术攻坚。【任职】1. 3年以上Android客户端开发经验；2. 了解常用的性能优化方法和性能调试工具，有过实际的性能优化经验；3. 参与开发过至少1款成熟的客户端产品，有成功经验者优先；4. 有强烈的责任心和团队精神，善于沟通合作；5. 满足下列条件者优先考虑：熟练使用Kotlin开发，有过SDK开发经验，参与开源项目开发或者研究过开源项目；欢迎向我们展示你的：- Github 开源项目- 参与开发过的产品，附上下载地址,"移动互联网,消费生活",15-50人,android,南京
Android开发高级工程师,https://www.lagou.com/jobs/6997681.html,建邺区,15k-25k,深圳威尔视觉传媒有限公司,5-10年,本科,不打卡 13薪 六险一金 年假10天,职责描述：1、负责Android客户端软件设计与开发；2、负责Android客户端性能持续优化。任职要求：1、5年以上工作经验，本科以上学历；2、精通Java语言，有良好的编码风格；3、精通Android开发与性能优化，包括UI、网络开发；4、有快速的学习能力；5、有较强的自我管理能力和抗压能力。6、有音视频开发经验者优先；7、有游戏SDK开发经验者更佳；8、有安卓产品或SDK运营开发经验更佳。9、熟悉Flutter、React Native或者WEEX等跨平台开发语言加分。,"移动互联网,文娱丨内容",50-150人,android,南京
android开发工程师,https://www.lagou.com/jobs/6131103.html,雨花台区,10k-20k,南京大别山珍农业科技发展有限公司,1-3年,大专,五险一金，年终奖，双休，餐补,1、参与Android软件的需求调研和需求分析，撰写部分技术文档；2、负责软件的架构设计，完成Android开发环境和框架的搭建；3、负责Android手机软件的开发、测试和维护；4、负责解决开发过程中的Android技术问题。任职要求：1、计算机或相关专业专科及以上学历，一年以上Android平台实际开发经验；2、具备扎实的Java语言基础，能熟练使用Android SDK；3、熟悉Android应用开发框架，能熟练进行Android app/Framework开发；,其他,50-150人,android,南京
高级安卓开发工程师,https://www.lagou.com/jobs/6908756.html,雨花台区,12k-24k,易宝软件科技（南京）有限公司,3-5年,大专,五险一金，绩效奖金，周末双休，节日福利,统招学信网可查学历，2年以上安卓应用开发经验android基础（各个组件，UI控件，定制控件，设计模式，Java集合等）有比较清晰的了解。有良好的编码规范。沟通理解能力较好，有责任心。,移动互联网,150-500人,android,南京
高级安卓开发工程师,https://www.lagou.com/jobs/6878228.html,雨花台区,12k-24k,易宝软件科技（南京）有限公司,3-5年,大专,五险一金，周末双休，项目奖金，节日奖励,统招学信网可查学历，2年以上安卓应用开发经验android基础（各个组件，UI控件，定制控件，设计模式，Java集合等）有比较清晰的了解。有良好的编码规范。沟通理解能力较好，有责任心。,移动互联网,150-500人,android,南京
安卓/ios,https://www.lagou.com/jobs/7188846.html,江宁区,20k-30k,武汉鸿英格倍科技有限公司,3-5年,本科,全额缴纳社保公积金，人手配备mac,Android/iOS工程师职位要求1、大学本科及本科以上，计算机软件开发相关专业2、具有三年以上iOS／android系统应用开发维护经验，对iOS／android的UI控件，系统机制，framework与常见第三方库有使用经验与理解3、有足够的独立分析解决问题能力，技术视野开阔，在常见交流平台（如github／stackoverflow）有贡献者优先4、有即时通讯或国际化软件开发经验者、音视频开发经验者优先，有知名   企业工作经验优先,移动互联网 电子商务,150-500人,android,南京
Android高级软件工程师,https://www.lagou.com/jobs/7016329.html,雨花台区,15k-18k,深圳市酷开网络科技有限公司,3-5年,本科,行业独角兽 领导很nice,"岗位职责：1、参与产品需求分析评审，并能独立制定稳定可靠的技术实施方案；2、负责TV，平板，手机等Android平台应用开发但不局限于纯应用层开发；3、编写软件相关的设计与技术文档；4、根据项目具体要求, 能主导承担开发任务, 按计划完成任务目标。任职要求：1、计算机或相关专业大学本科及以上学历；2、热爱计算机软件开发行业，善于学习和总结分析；3、熟练使用常见设计模式；4、能独立开发高性能的Android应用；5、具备需求分析和功能设计的能力，有Android系统分析经验，有能力追溯framework层代码逻辑者优先；6、熟练掌握 Android平台体系结构、 Android的界面和交互开发、网络通讯、后台运行、数据存储、缓存技术等；7、具备多线程、图形界面编程，Socket通信、TCP/IP、Http开发经验者优先；8、熟练掌握Java, 熟悉Android SDK, 有Android应用开发经验者优先；9、良好的逻辑思维能力、学习能力、沟通能力，有较强的技术专研欲望；10、对产品有强烈的责任心，正直诚信、热爱挑战、具有良好的沟通能力和团队协作精神者优先。",移动互联网,150-500人,android,南京
android工程师,https://www.lagou.com/jobs/7215318.html,雨花台区,15k-30k,仙桃市美丽嘉装饰设计工程有限公司,3-5年,本科,五险一金 双休 技术大牛 14薪起,职位要求1、大学本科及以上，计算机软件开发相关专业2、具有三年以上android系统应用开发维护经验，对android的UI控件，系统机制，framework与常见第三方库有使用经验与理解3、有足够的独立分析解决问题能力，技术视野开阔，在常见交流平台（如github／stackoverflow）有贡献者优先,企业服务,500-2000人,android,南京
Android Telephony工程师,https://www.lagou.com/jobs/7204662.html,建邺区,12k-24k,武汉佰钧成技术有限责任公司,不限,不限,六险一金，弹性工作制，周末双休，季度奖金,岗位职责：1.负责Android平台Telephony Framework/TeleService/Telecom/InCallUI模块的看护2.负责解决电话，数据上网，SIM卡，搜网，VoLTE，短信等业务的问题，并实现相关产品和运营商需求3.与Modem配合完成新技术的预研以及手机整体通讯体验的提升 任职要求：1. 大学本科以上学历，计算机、通信等相关专业2. 熟悉Java语言，了解Linux系统，熟悉Android系统架构和基本组件使用3. 了解通信WCDMA，CDMA，LTE等相关协议者优先4. 精通Android平台通话，VoLTE，数据，SIM卡，搜网其中一个或多个模块者优先5. 工作认真踏实，有良好的学习、交流、沟通和协调能力，以及良好的团队意识和合作精神,移动互联网,2000人以上,android,南京
Android软件工程师（互联网业务）,https://www.lagou.com/jobs/4617946.html,雨花台区,25k-50k,维沃移动通信有限公司,5-10年,本科,"年终奖金,股票期权,弹性工作,年度旅游",工作职责1. 负责Android平台上互联网应用（AppStore、云服务、支付）的开发、维护和优化工作。2. 负责应用软件设计、编码与测试，开发文档编写。3. 解决产品在使用过程中遇到的各种问题。4. 跟进研究行业内技术动向，做好相关产品的技术规划和预研，保证公司产品的技术领先性。任职资格1、本科及以上学历，3年以上Android软件开发工作经验。2、精通Java编程，精通Android应用开发，熟悉Framework，熟悉Linux系统，熟悉网络编程、Http协议，熟练使用多线程编程。3、熟悉Android控件的绘制流程和事件分发流程，精通自定义控件、事件分发原理者优先。4、熟悉Android动效开发，精通动效原理、有复杂动效开发经验者优先。5、有较好的性能意识，了解常用的性能优化方法和性能调试工具。6、踏实、稳重，责任心较强，有上进心，学习能力较强。,硬件,2000人以上,android,南京
Android软件工程师（浏览器）(003619),https://www.lagou.com/jobs/5892767.html,雨花台区,25k-50k,维沃移动通信有限公司,3-5年,本科,"弹性工作,股票期权,千万日活,高并发系统",1、负责浏览器、视频等互联网业务开发和维护；2、负责浏览器、视频等性能、内存、网络优化；3、参与需求、策划评审，技术方案设计，新技术探索。1、本科及以上学历，3年以上独立开发App经验；2、熟悉framework和主流开源框架源码和设计原理；3、沟通表达能力强，能主动思考和解决问题。,硬件,2000人以上,android,南京
android开发工程师,https://www.lagou.com/jobs/7202873.html,雨花台区,10k-18k,南京亚信软件有限公司,1-3年,不限,固定13薪，年终奖，福利待遇完善,岗位职责：1、按照产品需求，负责公司Android客户端产品研发及优化，负责新技术探索，APP架构设计，体验与性能优化2、负责客户端维护开发及重难点技术公关3、优化和完善现有客户端产品功能，对现有客户端产品提报的问题进行定位分析和解决4、参与新产品的技术预研，研究手机Android客户端领域的新技术并加以应用5、参与产品需求分析、技术分析及架构设计，解决开发中出现的疑难问题6、解决各类型、品牌手机的系统兼容问题任职要求：1、计算机相关专业本科及以上学历，两年以上Android应用开发经验，至少完整参与或独立开发过2个Android APP项目2、熟练掌握Android平台下的代码调试和调优技术，良好的学习能力，能主动学习钻研与工作相关的知识和技术，了解JNI3、熟悉Android各版本SDK异同，对Android各版本以及机型的兼容性处理有较多经验4、熟悉MVC、MVP应用架构，具有基础库封装和技术规范能力，具有组件化开发经验，具有性能优化，机型适配能力；5、具备积极进取踏实负责的工作态度，强烈的团队合作意识及跨领域的学习能力6、此职位需要一年平均2-3月的出差，会VUE的优先,移动互联网,2000人以上,android,南京
android开发工程师,https://www.lagou.com/jobs/6484778.html,雨花台区,15k-30k,青岛易联万家科技有限公司南京分公司,3-5年,大专,五险一金，三节福利，不定期团建，双休等,1.熟练使用Androidstudio等Android软件开发工具，熟练掌握Android的界面和交互开发。2.学历统招专科及以上，经验相关3年及以上,"移动互联网,其他",50-150人,android,南京
android开发工程师,https://www.lagou.com/jobs/6638031.html,建邺区,10k-13k,青岛易联万家科技有限公司南京分公司,1-3年,大专,五险一金，三节福利，不定期团建，双休等,会第三方应用。能尽快到岗，可做现场面试。,"移动互联网,其他",50-150人,android,南京
安卓开发工程师,https://www.lagou.com/jobs/7202151.html,雨花台区,5k-10k,南京九则软件科技有限公司,1-3年,不限,五险一金，弹性工作，,1.专科及以上学历，计算机相关专业优先，乐于从事于软件开发行业。2. 熟练掌握 Android 开发工具、 Android UI 开发技术。3. 熟悉 Android 下网络通信机制，有 Socket 和 HTTP 相关编程经验。4. 熟悉 Android 系统架构，有使用 NDK 开发经验者优先 。5. 思路清晰，具备独立解决技术问题的能力。6. 有良好的学习能力、团队协作能力、主动沟通能力，愿意在团队中共享自己的经验与知识。7.开发APP案例多的优先考虑。8.在外包公司经验的优先考虑。,"移动互联网,企业服务",少于15人,android,南京
Android（南京）,https://www.lagou.com/jobs/6952643.html,雨花台区,20k-35k,杭州腾展科技股份有限公司,3-5年,本科,海外市场、技术大牛多，token奖励,"岗位职责：1、负责产品手机客户端软件相关的系统分析、设计和开发；3、学习和研究新技术以满足产品的需求；4、根据开发过程中的体验对产品提出改进建议；5、配合等其他部门提供产品相关技术支持。 任职要求：1、3年以上移动端开发经验，精通Android手机端开发，计算机科学或相关技术学科本科以上；2、热爱设计编写程序，对IT行业充满激情，有独立的用代码解决问题的能力3、熟悉Android应用开发框架，能独立开发高性能的Android应用；4、熟悉Android平台架构，有Android源码二次开发经验者优先；5、具备良好的设计模式和面向对象编程思维，良好的编程习惯，对代码品质和产品品质优较高的要求；6、有比较良好的计算机相关基础，熟悉数据结构与算法，操作系统相关知识, 高性能编程以及性能调优，并行开发，网络管理，内存管理，消息通讯机制，安全机制，多线程开发，Http/https/socket 工作原理；7、在成功的产品和项目经验优先；8、有底层C/C++基础的经验优先。","移动互联网,社交",150-500人,android,南京
Android开发工程师,https://www.lagou.com/jobs/6795778.html,建邺区,12k-18k,江苏中石电子科技有限公司,3-5年,不限,中高层管理岗储备人才,职位描述1. 负责Android客户端设计与开发，包括需求沟通、功能设计与开发等； 2. 负责Android客户端架构设计、性能调优、功耗优化等； 3. 和产品/测试/运营进行密切沟通，能够根据需求提出合理技术方案； 4. 负责软件开发过程中的问题分析和总结，提供建议和帮助改善研发流程。 任职要求 1.计算机相关专业专科及以上学历，具备扎实的计算机理论基础，有至少2年的Android应用开发经验； 2.具备扎实的java编程基础； 3.熟悉Android SDK、对Android应用结构有深刻的认识，具备出色的调试知识、经验和技能； 4.熟悉面向对象设计和分析，能够运用常用的设计模式；熟练掌握网络及多线程开发； 5.有强烈的上进心，自我驱动，学习适应能力强，乐观自信，能挑战自我不断追求卓越； 6.有强烈的责任心和团队精神，善于沟通和合作。,"移动互联网,消费生活",50-150人,android,南京
Android开发工程师,https://www.lagou.com/jobs/7114084.html,江宁区,12k-24k,上海中软华腾软件系统有限公司,不限,大专,此项目为华为云服务产品重点发展项目,Android开发工程师工作职责：1、 根据需求文档和开发计划进行架构设计和详细设计，并撰写相应的设计文档；2、 参与项目的需求分析，撰写需求文档并制订开发计划；3、 能够独立开发，能按照要求实现功能，并完成测试，有良好的编程规范与习惯；技能要求：1、 本科以上学历，电子、通讯、计算机等相关专业毕业2、 1年以上 Android 平台开发经验，或者3年以上JAVA开发经验；3、 熟悉Android四大组件，常用框架，常用设计模式，有性能优化和内存泄漏分析经验4、 拥有良好的沟通协调能力和团队协作能力,"企业服务,金融",2000人以上,android,南京
安卓开发工程师,https://www.lagou.com/jobs/7166332.html,玄武区,10k-15k,江苏四合院大数据有限公司,1-3年,大专,周末双休、五险一金期齐全、提供中餐,岗位职责：1、负责公司软件项目和产品的开发、实施和维护；2、撰写公司软件项目和产品的设计等文档；任职要求：1.两年以上Android项目开发经验；2.精通Android SDK，对 Android 系统应用管理、进程管理、内存管理机制有深入理解；3.精通JAVA编程和核心类库，对代码质量和编程规范有较高追求；4.熟悉Anddroid平台网络数据传输，本地数据存储，以及UI框架部分；5.精通网络的基本知识及TCP/IP、HTTP协议，精通XML、JSON；6.熟悉Android studio、IntelliJ IDEA等开发工具；熟悉svn、git等代码管理工具；7.熟悉ReatNative开发者优先;8.对软件产品有强烈的责任心，具备良好的沟通能力与整体设计能力。,软件开发,50-150人,android,南京
安卓开发工程师,https://www.lagou.com/jobs/7118657.html,秦淮区,15k-30k,联童有限公司,5-10年,本科,五险一金、年终奖、餐补、免费体检、年假,"工作职责：1、移动端程序开发：安卓、iOS端APP程序开发；安卓、iOS端SDK程序开发；2、应用集成解决方案应对：应用集成解决方案需求分析、开发；3、解决用户问题：能分析客户出现的与软件相关的问题，译出问题原因，并找到合理的解决方法；能独立处理客户的问题（包括在客户现场），并能解决客户问题；若需要其他部门配合解决，能提出解决问题的方案；4、软件方面技术资料编写：收集整理、编写新产品、新技术软件方面技术资料；整理更新现有软件方面技术资料；整理编写应用集成解决方案技术资料；任职条件：1、本科以上学历，计算机软件相关专业；2、精通Android开发平台及框架，一年以上实际开发经验；3、熟练掌握C/C++或者Java开发语言和环境；4、从事过安卓/iOS系统下开发，熟练掌握后端开发，熟悉了解前端开发，两年以上相关开发工作经验；5、熟悉HTML/WML/HTTP,具有良好的编程思想。","消费生活,数据服务",500-2000人,android,南京
安卓,https://www.lagou.com/jobs/4665799.html,栖霞区,5k-10k,南京通通付网络科技有限公司,1-3年,本科,互联网自研产品，有融资,"android开发工程师——直聘 岗位职责 1对目前公司app产品迭代升级 2学习新技术运到产品中去 3 有基础的实习岗位岗位要求 1由于做互联网产品，需要更强的责任心，需要用用户思维,工作经验1-3年， 2对原生开发，混合开发熟悉并具备开发能力 3对商城，o2o类，直播，语音聊天室等app有过开发经验优先 4对第三方在线支付，im，直播，极光，友盟等熟悉 待遇：10-15K，五险一金，周末双休，过年15天假期，互联网项目有期权设置 工作地点：南京黄埔大厦（2号线西安门地铁），9月份计划搬到紫东国际创业园（2号线仙鹤门地铁） 特殊说明：公司管理层是南京较早一批互联网创业团队者，占多家互联网公司产品技术总监席位，每年会联合投入1,2个互联网产品，进入资本市场融资，并已有多个成功案例。公司整体气氛和谐，注重态度，忌浮躁，弹性工作，人性化管理，KPI数字化考核","移动互联网,电商",15-50人,android,南京
安卓开发工程师,https://www.lagou.com/jobs/7202608.html,鼓楼区,10k-15k,南京易诺商信息技术有限公司,3-5年,大专,五险一金，双休，13薪，定期团建,职责描述：1.负责Android App的开发和维护；2.负责Android整体架构的优化；3.持续的从技术角度提升App易用性，保证App稳定性；4.根据产品设计，进行高质量的软件开发和持续性能优化。岗位要求：1.良好的Java/C++语言基础，熟悉常用数据结构和算法，熟悉设计模式；2.熟悉Android基础架构、组件、UI、性能优化、内存优化等，对于Android的新版本新特性有一定程度的了解；3.熟练使用常用调试工具Android Studio、Eclipse、GDB，具备良好的分析解决问题的能力，能独立承担任务，有良好的进度把控能力；4.具备良好的团队精神和沟通意识，责任心强，工作认真细致，有良好的抗压能力；福利待遇：   1、955工作制，双休，年底13薪，五险一金；  2、享受法定休假、带薪年假、婚假、病假、等福利；               3、完善高效的工作环境和氛围；生日福利，定期组织员工聚会等业余活动，丰富员工的工作生活；   4、转正员工可提供住宿。,移动互联网,15-50人,android,南京
中高级Android开发工程师,https://www.lagou.com/jobs/6019073.html,建邺区,12k-24k,华米(北京)信息科技有限公司,3-5年,本科,纽交所上市公司，Top5智能手表,工作职责： 1. 负责公司智能穿戴产品Android客户端的开发和维护；2. 根据需求设计软件架构并对现有框架进行持续优化；3. 负责新技术的探索和项目难题攻关。任职要求：1. 对程序开发有浓厚的热情；2. 本科及以上学历，数学专业／物理专业／电子工程专业／软件开发专业相关；3. 三年以上开发经验；4. 精通 Java 8 或 Kotlin；5. 熟练掌握 MVVM 或 Architecture Components，有半年以上实际项目应用经验；6. 掌握单元测试的编写；7. 熟练掌握 Git 命令；8. 严谨的编码习惯，注重测试和文档；9. 有很强的学习／自我驱动／自我管理能力；10. 善于 Google。以下为加分项：1. 了解Android Framework以及JVM的机制；2. 了解函数式编程，有RxJava实际项目应用经验；3. 了解 Flutter 框架，有实际使用经验；4. 熟练使用 Jetpack 组件；5. 理解编译原理；6. 精通UI动画；7. 有参与 Github 开源项目经验；8. 熟悉C/C++、 Python、JavaScript中的一种,硬件,500-2000人,android,南京
Android APP/Framework工程师,https://www.lagou.com/jobs/5901716.html,雨花台区,10k-20k,南京汉隆科技有限公司,3-5年,本科,弹性工作 带薪年假 领导nice,负责Android 系统的定制、现有模块和框架的移植和开发。  任职要求：1.对Android平台架构有深入的理解，能根据需要进行相应改造；2.熟悉Android系统四大组件的工作原理，了解Android的常用机制，例如Binder等；3.了解Android中常用系统服务和机制，例如AMS，WMS，多媒体等；4.有HAL开发经验(如WIFI，蓝牙，多媒体等)者优先；5.本科及以上学历(全日制统招)，3-5年以上工作经验。  公司为员工提供的福利：五险一金、带薪年假、绩效奖金、全勤奖、节日福利、生育探望金、活动经费、午餐补贴、员工旅游、定期体检、丰富的企业文化活动。南京汉隆科技有限公司属于蓬勃发展型企业，处于快速发展阶段，可提供有竞争力的薪酬体系和培训、个人发展机会。轻松的工作氛围，年轻激昂的团队，等你来加入我们！公司地址：南京市雨花区花神庙10号花神科技园乘车路线：地铁一号线到安德门或是天隆寺下车； 或是公交车111路、113路、148路、171路、338路、75路、88路、94路、安丹线、安广线等等,移动互联网,50-150人,android,南京
