job_name,job_url,job_location,job_salary,job_company,job_experience,job_class,job_given,job_detail,company_type,company_person,search_key,city
机器学习专家,https://www.lagou.com/jobs/6578537.html,市北区,8k-16k,青岛永嘎科技有限公司,3-5年,本科,"一同创业，共同成长。
成为联合创始人。",1.用好python.熟悉机器学习，深度学习，迁移学习，强化学习。熟悉基本的算法，机器学习常用算法，有自己擅长的领域。tensorflow.pytorch，caffe.solodity.至少要会使用一种。2主要实践方向，对二手房数据的机器学习推荐系统，广告系统，二手房区块链公链的实现，其他研究方向，人工智能下:脑机接口，癌症的诊断和基因治疗，量化交易。.3. 利用数据挖掘、建模分析的理论和方法解决具体业务需求问题，提升业务运转能力； 4、对互联网大数据挖掘、数据分析有一定的研究，并且拥有非常强的自我学习能力、自我激励能力。,"移动互联网,消费生活",少于15人,大数据,青岛
java开发工程师,https://www.lagou.com/jobs/7198443.html,崂山区,12k-20k,河南竹意文化传媒有限公司,3-5年,本科,年终奖 完善的晋升制度,岗位职责：1、负责后端框架搭建和核心功能开发工作；2.、熟悉后端框架当前发展趋势和特性，能够根据项目情况，独立进行后端框架选型和架构设计等工作；3、根据业务需要进行系统设计、开发、系统自测等工作；4、处理系统开发的各种问题，保证开发质量及开发进度；5、负责前后端交互的架构设计和开发，负责后端系统架构、性能和数据库设计的技术性优化；6、参与讨论用户体验和细化需求。岗位要求：1、计算机、软件工程、数学等相关专业。3年以上后端项目开发经验，对技术有热情；2、精通Java，了解HTML/CSS/JQuery/Ajax等前端技术，熟悉J2EE架构，深入了解spring、Spring MVC、MyBatis、Hibernate原理和实现机制，具有RESTful API和SpringBoot等相关框架开发经验，具有相应的系统架构能力和设计能力；3、精通数据库系统，熟悉主流数据库SqlServer和Oracle的使用，具有相关数据库设计能力，具有非关系型数据库应用经验者优先；4、精通Java多线程开发和线程池使用，具备中间件，云计算，大数据等技术最佳实践的能力5、良好的编码习惯，熟悉软件工程管理。6、良好的问题解决能力和自我管理能力，对问题能多角度思考提出解决方案7、工作主动、负责，具有良好的沟通和表达能力。团队协助能力和执行力突出。,"移动互联网,企业服务",150-500人,大数据,青岛
数据服务工程师（青岛）,https://www.lagou.com/jobs/7129150.html,市南区,9k-12k,北京中宇华兴科技有限公司,1-3年,不限,薪资高，加班少，技术新，氛围好,岗位职责：1、参与数仓模型设计及数据治理的开发工作；2、参与共享交换服务工作；3、数据项目的对外技术支持，与用户沟通交流需求。4、培训与指导客户使用大数据产品。岗位要求：1、具备两年以上的数据开发经验（技术特别优秀者不受此条件约束）；2、熟悉数据仓库体系知识，熟悉维度建模方法，有实战经验；3、精通SQL语言，至少熟悉一种脚本者优先，如shell、python；4、熟悉ETL工具(kettle/DataStage/informatica)优先；5、有Hadoop/Spark/Storm 数据应用开发经验优先；6、有良好的沟通交流能力和接口设计文档编写能力,移动互联网,50-150人,大数据,青岛
Java开发工程师,https://www.lagou.com/jobs/7183530.html,崂山区,13k-20k,大连慧桥云联科技有限公司,3-5年,本科,五险一金，年终奖,1、负责对接集团各系统（用户/优家云平台/支付/售后等）技术接口服务开发。 2、洗涤产业智能洗衣机业务服务及大数据服务开发。 3、洗涤产业智能洗衣机微信业务服务开发。 4、负责智慧洗衣机服务端规划及用户数据运营系统开发。补充：统招公办本科院校毕业，2年以上后台开发经验，具有独立开发能力。熟练掌握各种后台技术 Java 、Python等开发语言，有成功项目案例。薪资12-24万（综合薪资）,移动互联网,150-500人,大数据,青岛
java开发工程师,https://www.lagou.com/jobs/7199715.html,崂山区,8k-15k,天孚（北京）科技有限公司青岛分公司,1-3年,本科,五险一金，弹性工作,1.熟练使用JAVA，JSP，熟悉Eclipse，Idea开发环境，使用过Git等版本控制 工具了解J2EE体系，熟悉Tomcat，能够独立完成系统架构开发和应用部署 2.掌握在MongoDB和Mysql数据库上基本调试和设计技术 3.熟练掌握Flink、kafka、Hbase、zookeeper、ES等大数据组件 4.精通linux操作系统，掌握shell及命令5.熟悉docker、K8S、Nginx、redis，熟悉服务部署、监控、容量等管理，至少熟悉 一种数据库 6.熟悉iaaS、PaaS等产品，熟练使用云服务器7.较强的逻辑分析能力和沟通表达能力，擅于进行跨部门协作,软件开发,少于15人,大数据,青岛
销售经理,https://www.lagou.com/jobs/7110260.html,市南区,6k-12k,青岛链家兴业房地产经纪有限公司,1-3年,本科,底薪5500+提成,安家～帮客户找到满意的房子。通过电话，大数据帮客户找房，带客户看房的过程。,消费生活,2000人以上,大数据,青岛
cto首席技术官,https://www.lagou.com/jobs/7132408.html,崂山区,60k-90k,青岛硕智博睿管理顾问有限公司,5-10年,本科,大平台 薪酬高 发展前景好,岗位职责：1.根据组织发展战略，全面负责公司系统的技术方向研究、难点攻破和总体规划，参与重大技术决策和方案的制定；2.负责技术团队的建设，监督及指导，制定技术团队的培训计划及绩效评估标准，有效提升技术团队水平；3.主导技术项目的评估、规划、决策，审核总体技术方案，管理项目进度、预算及项目风险，对技术团队产出的质量和效率负责；4.全面支持平台日常安全运营、系统维护、升级，确保系统在高并发场景下的性能优势，解决系统潜在的技术风险；5.负责制定技术开发规范、运维规范，安全规范，故障处理等技术团队工作规范和工作流程，并监督、跟踪开发过程中规范落地情况；6.负责协调技术团队与公司其他部门的工作，为业务发展提供全面的技术支持，助力公司战略目标的实现。 任职要求：1.本科及以上学历，计算机科学与技术类相关专业；2.8年以上技术总监任职经验，100人以上团队管理经验，具有大型政府、智慧城市类项目或者大型企业项目设计实施经验者优先；3.5年以上分布式、高并发、高可用大型系统架构设计与开发经历，在软件开发、平台建设、项目管理等方面有丰富经验；4.精通java、设计模式、面向对象思想、微服务架构，精通Spring Boot、Spring Cloud，深刻理解其原理和实现机制；5.精通主流数据库（包括但不限于Oracle/MySQL/PostgreSQL/Greenplum/MongoDB），有丰富的SQL开发调优经验，有大数据处理经验；6.精通大数据领域解决方案，具备该领域全面的技术积累，包括但不限于Hadoop、Spark、Flink等，精通数据仓库建模和设计、海量数据处理与分析，有数据中台项目经验者优先；7.精通数据挖掘技术，精通TensorFlow深度学习开源框架，有大型政府或者企业数据挖掘、数据分析相关项目经验者优先；8.具备主导、培训整体技术研发团队的能力和经验，能够独立完成目标分解和难点攻关，可带领团队高效达成项目目标，并助力团队成长；9.具备极强的内驱力与责任心，对技术市场具有一定的敏锐度，能及时掌握市场最新技术发展动态，对公司技术发展能提供决策性的建议；10.具备极佳的分析、解决问题能力与沟通协调能力，擅长资源管理与资源调度，高效完成项目目标,企业服务,少于15人,大数据,青岛
电商运营,https://www.lagou.com/jobs/6234133.html,胶州市,10k-20k,青岛果木文化发展有限公司,1-3年,本科,高薪直聘,岗位职责：1、负责了解线上乐器及教学产品流行趋势，及时做好网店的整体布局与规划，以增加店铺的竞争力；根据年度、季度、月度的销售计划制定相对应的营销策划方案及推广方案；细化工作以量化绩效指标执行；2、负责网店改版，商家，下架，销售，售后的管理方案；3、负责网店日常维护优化店铺与商品排名；4、负责站内流量分析制定主推款与滞销款处理方案；5、负责制定并完善客户关系管理及相关服务工作要求，建立老客户群，帮派，掌柜说等与客户互动的NS；整理分类不同级别的老顾客，并对顾客做出相应的维护；分析在客户关系处理中的问题，提出有效改善意见；实时监督老顾客同比增长数据。6、有效协调平面设计、美工、推广、客服等人员以顺利有效完成指定工作；7、通过有效的数据分析（销售额，点击率，访问，转化率等），掌握网站和分类的运营状况，并做针对性的调整；8、其他竞争对手分析（行业、平台、对手大数据对标分析）等任职要求：1、熟悉淘宝天猫等平台的规则及营销规则；2、熟悉天猫、淘宝等各平台的推广渠道，制定、执行可行性营销推广方案，定期进行效果评估；3、熟悉天猫、淘宝的运营环境、交易规则，定期进行数据分析统计，研究热销产品走势等；4、有一定文案写作能力和活动策划经验，较强的组织策划能力、沟通协调能力和学习创新能力；5、有强大的时间管理及同时处理多项任务的能力，能适应快速的工作节奏与压力，工作态度认真负责，良好的团队意识，较强的抗压能力6、对数据敏感，有较强的数据分析能力；7、具有敏锐的市场眼光，良好的业务分析判断能力，并乐于自主创新8、具备出色的项目管理能力，团队管理能力和跨部门沟通能力只要你有能力，薪资待遇从优5K-20K公司简介：  青岛果木文化发展有限公司是国内音乐教育领域知名品牌，目前与百度、优酷、爱奇艺、360集团、人民邮电出版社等建立深度合作。公司旗下拥有自主经营乐器厂，主要生产吉他等乐器。主要致力于在线教育领域，书籍出版发行、音乐专辑制作、乐器销售与批发等业务。工作地址山东省青岛市胶州市兰州西路45号,"电商,教育",50-150人,大数据,青岛
大数据实习,https://www.lagou.com/jobs/7120486.html,市北区,4k-6k,青岛莱信实业有限公司,1-3年,大专,周末双休，项目奖金，高于同行业薪资,1负责承接项目方数据的处理和整合2对数据进行相关的分析并形成报告3专科及以上学历，学信网可查，现在急需人才，综合能力强可适当放宽条件,"移动互联网,数据服务",50-150人,大数据,青岛
大数据实习,https://www.lagou.com/jobs/6973017.html,市北区,6k-12k,青岛莱信实业有限公司,不限,大专,快速成长，平台广阔，后期带队，开拓市场,MySQL，Oracle，Linux，数据处理，数据挖掘，数据分析1、年龄20-30周岁。2、对大数据了解感兴趣（专业不限）3、参与数据整理和分析。4、负责数据仓库的日常维护工作。,"移动互联网,数据服务",50-150人,大数据,青岛
ETL数据开发实习生,https://www.lagou.com/jobs/7019079.html,市南区,4k-6k,青岛语宽网络科技有限责任公司,应届毕业生,大专,五险一金，周末双休，法定节假日，朝九晚五,"技能要求：数据库，数据库管理员，数据库开发技能要求：ETL岗位职责：1、辅助参与项目数据分析和设计；2、辅助完成软件系统代码的实现，编写代码注释和开发文档；3、辅助进行系统的功能定义,程序设计；4、根据设计文档或需求说明完成代码编写，调试，测试和维护；5、辅助分析并解决软件开发过程中的问题；6、协助测试工程师制定测试计划，定位发现的问题；7、配合项目经理完成相关任务目标；8、具有很强的学习和独立分析能力、工作责任心、良好的沟通能力和团体合作精神。任职资格：1、专科及以上毕业生；2、相关专业优先考虑；3、有责任感，良好的团队协助精神；4、有无经验均可，一经录用，待遇优厚；5、可接收应届毕业生。","数据服务,软件开发",15-50人,大数据,青岛
ETL数据开发工程师（可实习）,https://www.lagou.com/jobs/7029372.html,市南区,6k-8k,青岛语宽网络科技有限责任公司,应届毕业生,大专,五险一金，月薪过万，稀缺人才岗位,"技能要求：1、熟练掌握一种或多个开发语言(Python/perl/Bash等), 获取数据,应用算法,实现分析输出。2、熟悉linux开发环境, 掌握常用算法和数据结构。3、熟悉MySQL和NoSQL数据库,有很好的数据多维空间思维能力。4、熟悉计算机原理,操作系统,计算机网络等基础理论。5、熟悉C/C++。6、有很强责任心,优秀的团队合作精神,能够承受较大的工作压力逻辑思维清晰缜密,积极主动,具有较强的沟通协调能力。","数据服务,软件开发",15-50人,大数据,青岛
java高级开发工程师,https://www.lagou.com/jobs/7143462.html,崂山区,18k-28k,海尔集团,5-10年,本科,物联网平台前景好、薪资福利好、项目激励高,"岗位职责：
 参与制定项目研发计划，确保技术部门顺利按公司发展规划完成研发任务；2.承担项目组核心开发或设计工作，并能够按要求、高质量地完成开发或设计任务； 3.按照规范的要求，编写技术开发及设计文档；4.保证系统代码的高质量、稳定性与高性能；5.负责公司已有系统的开发和维护、新技术研究与实践； 任职资格：1.专业要求：计算机相关专业2.学历要求：本科及以上学历3.经历要求：4年及以上J2EE开发经验，具有WEB架构设计能力、项目规划和决策能力，具有一定项目管理经验；4.技能要求：深入了解strtus,spring,hibernate,ibatis,cache,mq,rpc等领域的框架或产品的机制与代码；深入了解MySQL、Oracle数据库，具有SQL数据库索引优化、查询优化和存储优化经验；具有丰富Memcache、Redis、Mongdb等缓存数据库技术经验，有分布式集群的实施经验；熟悉SOA服务化治理，具有RPC服务实施开发经验,如用dubbo等开源框架；熟悉消息中间件技术并具有相关项目开发使用经验，如用RabbitMQ、ActiveMQ等；熟悉Hadoop、Hive、HBase、Storm等相关开源项目；5.能力要求：有良好的领导能力，负责过一个完整系统或产品的整体架构设计和推动落地的；有SOA服务化、分布式系统实施经验者，有大数据、高并发和物联网行业系统构建经验者优先。","物联网,电商",2000人以上,大数据,青岛
产品经理,https://www.lagou.com/jobs/6847767.html,,12k-15k,海尔集团,3-5年,本科,10002,,"物联网,电商",2000人以上,大数据,青岛
销售专员销售代表,https://www.lagou.com/jobs/7169900.html,市北区,4k-6k,青岛地比图软件科技有限公司,1-3年,本科,大数据公司，公司培训，提供住宿。,"岗位职责：
 负责公司项目的推广；
 开拓新市场，发展新客户；
 管理维护客户关系。
任职资格：  1.大专及以上学历，市场营销等相关专业优先；  2.反应敏捷、表达能力强，具有较强的沟通能力及实际技巧，具有亲和力；  3.性格开朗，工作积极主动，有责任心，能承受较大的工作压力；  4.有团队协作精神，善于挑战。平时坐办公室，极少出差，公司提供资源。夏天朝九晚六，基本不加！周末双休！五险一金！转正后公司可提供住宿。青岛地比图软件科技有限公司的统一社会信用代码/注册号是********MA3DC1JA5M，企业法人吕晓东，目前企业处于开业状态。是一家大数据的公司，目前正值成长期，潜力巨大。","移动互联网,其他",15-50人,大数据,青岛
技术负责人,https://www.lagou.com/jobs/7128599.html,青岛高新技术产业开发区,16k-30k,青岛蓝湾信息科技有限公司,10年以上,硕士,年终奖金1-2.5薪,熟悉5G方向或物联网方向或大数据方向熟悉5G方向或物联网方向或大数据方向,"通讯电子,软件开发",50-150人,大数据,青岛
新媒体运营/文案策划,https://www.lagou.com/jobs/5717758.html,黄岛区,4k-8k,青岛不言创新科技有限公司,不限,大专,出国旅游 节日礼品 定期体检 内购会,一句话概括工作内容：1. 负责京东，淘宝，苏宁等电商平台的内容营销和文案编辑；2. 分析每个平台的受众群体特点，用图文或视频为其提供有价值的内容导购和心得分享；3. 通过对渠道规则的研究，获取更多的曝光转化渠道；4. 能够根据产品的特点，以数据为依托，通过对产品的把握，市场和人群的分析，撰写准确且有针对性的软文，配置到对应的渠道；5. s发挥创意，熟知不同渠道的广告特点，进行不同类型的文案创作；6. 对所运营账号的粉丝及转化数据负责。怎么才能胜任这个工作？1、半年优秀的文案工作经验，热爱文字，热爱学习，用文案让策略落地。（必须要有案例）2、有一定的电商内容渠道运营或写作经验；3、综合素质强悍，落地、自信、不作。4、爱思考能执行，耐压耐摔。5、有种有趣有料。薪资待遇：3000+提成+保险+其他日常福利。月均4000-6000。运营助理→运营（月均收入不低于5000）→运营合伙人（月均收入不低于8000+年底纯利分红），只要肯努力就可以拿分红，上不封顶（这是真话，不是忽悠你来面试的）。我们公司的运营，工作年限1-5年不等，有收入30万+的，也有月薪刚过5000的。而且只要业绩多多，年底还有不少的分红。发展空间怎么样？运营是公司的核心，不需要为晋升，是老板，持有项目或店铺分红。目前公司已经有80位以上的妖怪合伙人，成为妖怪合伙人以后，财务报表公开，实现自主经营。“给一个人最好的待遇，就是让他和最优秀的人在一起。”不言公司简介：不言研究院（青岛不言创新科技有限公司）是妖怪团队旗下产品和运营研究中心，注重项目研发，已成功孵化若干项目。公司拥有商标50余，3项国家发明专利，数十项实用新型和外观专利，拥有自主知识产权的办公OA系统。拥有完善的福利体系以及晋升机制。目前研究项目有电子商务多元运营项目，智能3D打印项目，商业智能BI项目、电商大数据运营项目、人体工程学智能家居项目等多个项目。我们立志做所有求职者口中“别人家”的公司。我们不求能直接招聘到世界上最**的工作伙伴，但我们赞成“赋能”。我们将致力于打造这样一种工作环境：一种不仅自己进步，整个团队都在努力进步的环境，这样的团队氛围会推动你进步，让你进行蜕变，让你发自内心的劳动，让你的物质与精神都得到最大的满足。这是最值得的劳动，而不是某个制度，某个考核来推动你进步，让你上班的不应该是考勤而是你对工作的向往。试一试和那些一样具有野心的人为伍，让你置身于可以成长的环境，在那种不仅仅自己可以进步，其他人也会推动你进步的环境，在这样的环境里拼搏，给自己一个机会，尝尝努力的滋味。现在有一位副总就是从总助干起来的，有一位总监就是从文员干起来的，有一位副总就是从售前晋升的。内部晋升机会多，只要肯努力就可以拿分红。在济南、青岛、北京都是我们战斗的地方。1、 薪水有高有低，但是一定够花！全凭自己能力，还有各种分红，爽的根本停不下来！2、 2008年成立，上百人的专业团队，都可以跟老板称兄道弟，勾肩搭背！3、 公司遍地是机会，100%内部提升，有利润分红，有股份，在这里可实现车房的奢侈梦想。4、 谦虚很重要，我们每天的定位都是创业初期，人人都是主人公的精英团队，请静下心来，你可以得到更大成长和帮助！5、 小活动不断，大活动不少。经常计划安排金沙滩、大明湖、故宫等“国内外**景点出游”！6、 美女同事帅哥邻居，男女搭配干活不累，在这里没有单身！7、 每天上网、上京东、上淘宝，不必担心被抓，我们大家一起为中国电子商务贡献流量！8、 三八节女同胞有礼物，儿童节人人都有份，春节年假更是长达半月之久！9、 每月有升职加薪的考核，只有有能力，机会待遇不是问题。10、拖延症晚期喊患者不要来，我们需要今日事今日毕。11、最后告诉你，我们注重品质，**不做乱七八糟的工作，不找乱七八糟的伙伴，想要做卧底侦探的请绕道，虽然我们很简单很善良，但是有必要时我们也很黄很暴力！12、2016年公司成立关怀基金，针对员工以及直属亲属进行社保外的报销。有保险，节假日福利，各项活动礼物，父母亲人福利，定期体检、国内国外游等多种福利13、生日还有抽奖！公司缴纳保险，还有节日福利和年底奖,"移动互联网,电商",150-500人,大数据,青岛
文案策划,https://www.lagou.com/jobs/6950213.html,市北区,4k-6k,青岛易联匠心科技有限公司,3-5年,本科,环境好,岗位职责官微、软文推广、新闻稿等内容撰写和运营；结合行业热点和公司技术产品优势、客户案例，产出优质内容；应用新媒体资源帮助公司实现在品牌形象、人才招聘、营销宣传等方面的目标；岗位要求本科及以上学历，新闻系或中文系专业优先；思路清晰，良好的创意能力；对人工智能、大数据、企业服务等相关行业有一定见解；文笔优秀，有记者/编辑/文案或IT科技类媒体相关工作经验优先，经常发表文章优先；具备一定的抗压能力，工作效率高，有上进心，沟通能力和团队合作精神佳。,移动互联网,50-150人,大数据,青岛
Django架构师,https://www.lagou.com/jobs/6590600.html,城阳区,15k-25k,青岛魔力蛙科技产业有限公司,3-5年,不限,打造化工领域的类钉钉平台,职位描述：1、负责梳理特定业务域前后端系统的架构，负责整个软件架构设计、关键构件选型、接口的定义，指导各开发小组人员进行研发，帮助公司建设中台，规划中长期架构蓝图；2、负责核心模块的技术攻坚，参与并主导重大技术决策，进行技术风险评估；任职要求：1、 全日制本科及以上学历， 3年以上开Python发工作经验，3年以上架构师经验，能带领团队快速交付高质量的产品；2、对MySQL、Reddis、PostgreSQL等数据库内部实现机制有深刻的理解，有大数据量的数据库设计、分库分表、数据库调优经验；3、熟悉Django框架的后端API开发；4、对python/Flask技术及整个解决方案有深刻的理解及熟练的应用，并熟悉当前流行架构和设计模式，并在此基础上设计产品框架；5、能够使用文字、图示清晰的表达架构意图，具备良好的团队意识及协作精神，有较强的内外沟通能力。任职要求加分项：1、独立或主导设计过百万级用户以上规模的应用架构，熟悉容量评估，有成熟项目及产品经验；2、具备分布式系统设计开发经验、服务器运维及水平扩展方面实战经验，能对分布式常用技术进行合理应用，解决问题；3、熟悉云计算及大数据的整体技术体系（包含计算、存储、网络、数据库、中间件、安全等）；4、熟悉缓存、消息队列、集群技术处理、负载均衡、系统性能调优、系统韧性等软件编程高级技术；5、能够帮助所在研发团队制定研发标准与规范，提升团队研发质量，研究并推广新技术；6、能够负责针对重大项目或需求牵头干系研发团队制定方案，推进落地实施；,广告营销 企业服务,少于15人,大数据,青岛
