job_name,job_url,job_location,job_salary,job_company,job_experience,job_class,job_given,job_detail,company_type,company_person,search_key,city
产品实施技术经理,https://www.lagou.com/jobs/7205584.html,岳麓区,25k-35k,秒针信息技术有限公司,5-10年,本科,六险一金，扁平化管理，年终奖丰厚,岗位职责：1、负责项目产品侧范围、进度、质量的把控；负责产品二次开发2、负责项目现场小组管理工作，以及与现场各团队的协调及衔接工作； 3、负责与产品团队的沟通与交流，能够准确传递项目侧信息和需求；4、负责与客户沟通和交流，与客户保持良好的沟通关系； 5、负责项目侧的技术架构需求讨论和架构设计工作；6、负责项目现场相关技术解决方案的编写工作；7、负责指导项目现场实施人员的产品使用工作；8、负责产品在项目使用过程中问题的梳理、沟通及解决；9、参与概要设计、详细设计及相关技术侧文档的编写工作；10、负责公司相关产品在项目侧的部署实施工作；任职要求：1、计算机或相关专业统招本科以上学历；2、五年及以上软件实施或数仓项目的管理和设计经验；3、熟悉 oracle、sql server、mysql等关系型数据库技术；4、熟悉 hadoop、spark、elasticsearch、hbase等大数据存储和计算的相关技术；5、熟悉 java、scala、sql等编程语言，熟悉linux、windows等常用操作系统；6、能快速掌握项目相关的业务场景和相关技术，有数字城市和政务行业经验者优先考虑；7、具备良好的沟通能力，优秀的协调能力，能有效协调各种资源；8、具备团队合作意识，能接受出差。,"数据服务,广告营销",2000人以上,hadoop,长沙
测试工程师,https://www.lagou.com/jobs/7066615.html,岳麓区,8k-12k,北京易观智库网络科技有限公司,1-3年,本科,技能培训、弹性工作、扁平管理、氛围融洽,岗位职责：1、根据软件需求分析需求，编写测试用例，设计测试数据。2、执行测试工作，确认结果，与开发人员一起定位并跟踪缺陷及时修复。3、在测试各环节与产品经理，开发团队沟通，推动各环节问题及时合理解决。4、对数据处理各环节进行正确性，有效性和完备性测试。5、编写软件测试内容各项总结文档。6、使用性能测试工具(Jmeter)进行性能测试。7、使用python基于Selenium编写自动化测试用例。任职要求：1、开放乐观，善于沟通，勇于承担。2、学习能力和执行能力强，善于分析与定位问题。3、熟悉软件测试流程，熟练掌握基本的测试方法。4、熟悉Linux，熟悉shell/python/Java 至少一种编程语言。5、熟练掌握SQL，了解presto基本操作。6、熟练掌握Jmeter工具。7、了解大数据平台和hadoop相关组件优先。8、有Selenium自动化测试开发经历优先。9、有接口自动化测试经历优先。,"移动互联网,数据服务",150-500人,hadoop,长沙
大数据技术工程师（高级）(J11551),https://www.lagou.com/jobs/7150590.html,岳麓区,15k-25k,秒针信息技术有限公司,5-10年,本科,"大牛多,学习型组织",（岗位涉及长期出差）负责数据中台的汇聚和采集ETL详细设计和开发工作；参与专题库/主题库的模型设计，并负责模型开发；参与数据标准化和数据治理模型的设计，并负责落地开发；负责数据分析需求的模型开发和实现；负责数据中台技术的优化和质量改进；任职资格:1.精通SQL语言，具备存储过程开发能力，能熟练进行SQL查询优化；熟悉Hive数据仓库设计，了解数据仓库模型及思想、维度建模思想，了解数据仓库相关应用；2.熟悉Hadoop、Spark、Sqoop、Hive、Flume、Kafka、 HBase等技术，使用过ETL相关技术进行数据交换工作；3.了解数据调度平台的设计思想，良好的数据批处理 、调度、异常处理等经验，熟悉shell、python、java等语言；4.具备较强的语言表达能力，能与客户顺畅沟通或产品介绍；具有良好的逻辑分析能力、需求理解能力和解决问题的能力；具有一定的文档编写能力；5.具有良好服务意识，工作态度端正，耐心、细致、热情，抗压力强，对工作专注、投入，有很好的职业素养 。6.具有5年及以上数据仓库相关项目工作经验，有电子政务行业项目经验优先；7. 具备一定的组织领导能力，能妥善组织安排并指导组员工作；,"数据服务,广告营销",2000人以上,hadoop,长沙
大数据平台管理工程师,https://www.lagou.com/jobs/6893648.html,芙蓉区,8k-16k,中通服创发科技有限责任公司,3-5年,本科,双休，项目绩效奖金，一年两次调薪机会。,1、计算机或相关专业本科以上学历，具备2年及以上hadoop等大数据产品运维或相关工作经验2、掌握Linux操作系统的配置，管理及优化，能够独立排查及解决操作系统层的各类问题3、熟练使用Python/Shell等脚本语言4、有数据治理、大数据集群的自动化运维和管理经验,"移动互联网,电商",150-500人,hadoop,长沙
高级技术支持工程师,https://www.lagou.com/jobs/7181076.html,岳麓区,15k-30k,北京宝兰德软件股份有限公司,5-10年,本科,发展空间大 上市公司 五险一金,"1、基于行业与公司现有产品线提供针对性解决方案；2、在客户端进行产品（应用性能管理APM、机器学习，智能运维AIOPS、大数据）的POC测试 ，实施运维等工作。资格要求：1、5年以上开发经验；2、统招学历，计算机相关专业；3、良好的沟通能力和责任心；技能要求：1.熟悉JavaEE常见框架和架构，Unix基本管理和操作，java常见问题分析和优化；2.具备linux、数据etl、apm、容器等运维能力；3.具备良好的沟通技巧；4.熟悉云计算、大数据和应用性能管理等常见技术，对云计算环境下的智能运维有较深的理解；有下述技能优先：1.有大型系统的运维管理经验；2.对云计算的产品和技术有一定的理解，例如k8S，docker,APM等；3.对大数据产品和技术有一定了解，如数据交换、数据集成、大数据hadoop、cdh、spark等、BI、数据可视化；4.熟悉某种中间件产品或技术，例如Apache, Tomcat, JBOSS, Weblogic, Websphere, VisiBroker, Tuxedo, CICS 等；",企业服务,150-500人,hadoop,长沙
nlp算法研究员,https://www.lagou.com/jobs/6423714.html,岳麓区,15k-25k,湖南星汉数智科技有限公司,不限,硕士,"扁平化管理,周末双休,五险一金,股票期权",岗位职责：1、 研究分词、实体识别、句法分析、信息抽取、分类等自然语言处理相关关键技术，进行技术创新；2、 负责R&D转化工作，将相关关键技术进行工程化代码实现，参与关键技术的系统集成；3、 参与技术需求研讨；4、 撰写相关专利，发表论文，参加各类公开评测；5、 组织各类数据集的收集、标注和整理；岗位要求：1、985院校计算机或相关专业硕士以上学历； 2、熟练掌握Java编程语言，算法基础扎实，具备较强的分析和解决问题能力，；3、在CCF C类以上国际会议、SCI期刊或EI期刊发表过NLP相关学术论文；4、了解spring cloud、hadoop、spark、storm、hive 、ElatisticSearch等大数据开源框架，有一定的大数据开发经验；5、具有较强的科研创新能力，能够解决NLP、知识抽取、分类、推理等领域的关键技术问题；6、具有较好的工程实践能力，能够将NLP相关前沿技术进行工程实现；7、熟悉python、TensorFlow和面向文本的深度学习模型，深度掌握机器学习及深度学习的内部机理；8、具有自我驱动品质，学习能力强，适应能力好，有强烈的责任心，具备耐心/细心的品质；9、抗压能力强，吃苦耐劳，愿意出差，能够加班待遇：1、作为公司骨干储备力量，优先配股；2、年薪20万-30万；,"移动互联网,数据服务",50-150人,hadoop,长沙
Java爬虫工程师,https://www.lagou.com/jobs/5275394.html,岳麓区,8k-15k,湖南星汉数智科技有限公司,不限,本科,"扁平化管理,周末双休,五险一金,交通补助",岗位职责：负责公司有关网络爬虫方面的工作岗位要求：1.能够熟练使用Java进行开发，熟悉网络爬虫设计思想和常用爬虫框架及相关工具；2.熟练掌握HttpClient、Css选择器、Xpath、正则，Http，TCP/IP等相关技术；3.了解Hadoop或Storm架构或有大数据背景者优先；4.有网络爬虫，信息抽取，文本分类相关经验者优先。,"移动互联网,数据服务",50-150人,hadoop,长沙
数据分析师,https://www.lagou.com/jobs/7073214.html,雨花区,10k-20k,昆仑智汇数据科技（北京）有限公司,不限,本科,福利多多,"1.针对制造行业的智能制造与工业互联网的需求，深入了解业务需求（如产品研发、生产工艺、质量控制、设备诊断、供应链管理等），运用数据分析/数据挖掘技术解决客户的实际问题。2.基于数据平台产品，建立数据标准、进行数据清洗、建立数据分析、预测或优化模型、并负责与团队一起负责数据分析应用的开发和落地实施。3.对具有共性的数据分析模型和行业应用进行抽象与研究，支撑数据分析产品的开发和在数据平台的应用。任职要求：1.独立定义和解决工业行业相关的数据分析/数据挖掘问题的能力，具有清晰的系统思维逻辑和共性抽象能力2.精通数据清洗、统计分析和常用数据挖掘/机器学习算法，有丰富的工业数据分析相关的实际项目经验3.至少精通一种数据分析语言（如Python, R, MATLAB等），及其相应的算法包。4.有良好的客户沟通、业务咨询、团队合作与项目管理能力5.有一定程序开发经验（如Python, Web, Java等），熟悉面向对象的设计6.熟悉常用数据库、大数据、并行化计算等相关技术和工具，如Spark, Hadoop等7.熟悉信号处理、优化算法、时序数据分析、深度学习等算法8.统招本科及以上，3年以上工作经验优先条件：1.工业专业教育背景或者工作经历（如自动化、机械、电气、能动、电子等）2.熟悉工业流程、工业通信协议，SCADA/MES/PLM等工业软件3.了解精益生产、六西格玛等概念及相应数据分析工具。4.熟系烟草行业的研、产、供、销相关环节的业务",数据服务,150-500人,hadoop,长沙
java架构师,https://www.lagou.com/jobs/7004410.html,长沙县,12k-20k,湖南长城信息金融设备有限责任公司,5-10年,本科,"朝阳行业,央企,五百强",职责描述一、负责云平台架构设计和实施方案工作1、根据云计算技术发展趋势，对前沿的产品和技术进行调研，做技术储备和可行性验证；2、依据需求规格说明书完成系统设计工作，提交软件概要设计说明书。3、与现场团队沟通，指导完成云平台的交付技术方案和实施工作二、负责云平台关键模块设计和编码工作。1.在场景设计、概要设计的基础上，进行关键系统的详细设计，完成准确详细可读性强的系统详细设计说明书。组织相关人员（如设计工程书、测试工程师）进行设计澄清。2.在评审后的详细设计说明书的基础上，进行系统关键模块编码实现。三、支撑实施和服务部保障工作1. 对产品进行必要的实施和售后支持保障2. 对解决的问题做好记录，为以后类似问题的解决积累经验3. 对其他部门进行本项目产品的培训。四、配置管理工作1. 负责SVN软件配置管理，技术文档管理。任职要求：1、有扎实的理论基础，丰富的业务专业知识和技术工作经验；对与工作相关的本业务专业外的其它技术领域有一定了解2、对业务领域内的新技术或新的技术趋势及时掌握；工作中有较强的创新意识3、熟悉云计算、熟悉微服务开发模式、云原生应用开发模式及概念。4、熟悉网络、服务器、SAN、备份、容灾等系统的架构和基本原理和系统虚拟化知识，了解IDC产业、行业云平台知识，熟悉国内外主流云计算厂商的产品和解决方案5、掌握虚拟化技术、分布式平台、主流开源云计算平台、容器技术、Linux内核等，如OpenStack、Kubernetes、Hadoop、Zookeeper、Docker等；6、精通Linux环境下的应用部署、应用开发和主要开源组件7、熟悉掌握J2EE和分布式微服务开发，掌握SpringCloud或Dubbo、Mybatis、MQ、ESB、noSQL等开源框架和技术；8、1年以上微服务、云计算、数据中心设计开发等相关领域工作经验9、有金融领域项目经验优先、有国产化项目经验优先,移动互联网,500-2000人,hadoop,长沙
算法分析师（实习）,https://www.lagou.com/jobs/6886334.html,岳麓区,5k-10k,湖南刺猬安全技术咨询有限公司,应届毕业生,本科,职位晋升；年终奖；条件优秀者待遇可面谈。,岗位职责：1.运用统计方法和机器学习方法，构建国际公共安全形势分析、突发事件影响分析、等业务所需的计量模型；2.配合研发部门将模型产品化，并推进相关算法的迭代完善；3.通过数据分析方法持续验证和优化模型及算法的可靠性；4.研究最新的建模理念和算法技术，为公司产品决策提供合理化建议。5.对业务数据进行整合、分析挖掘，挖掘用户行为特征，为产品、运营决策提供业务分析及数据支持任职资格：1.大学本科及以上学历，计算机/数学/信息类专业优先，985院校优先。2.熟悉常见分析方法及模型，如案例研究法、定量分析法、形式模型法和诠释法等，有过国际关系研究的相关建模经验者优先；3.精通至少一种数据分析/挖掘语言，如R/Python/SAS/Mahout等，熟悉至少一种数据库操作，如Hive/Mysql/Hadoop/Oracle等；4.对机器学习算法有了解的优先；5.具备业务快速学习和理解能力，有强大的自驱力；,"移动互联网,信息安全",15-50人,hadoop,长沙
Java中高级开发工程师,https://www.lagou.com/jobs/5591941.html,天心区,8k-12k,长沙市云研网络科技有限公司,3-5年,本科,双休、五险、半年调薪一次的机会,岗位职责：1、设计、研发大规模、大数据量、高并发的SAAS云平台（本地云端相结合）。2、解决分布式系统运行过程中的各种性能和功能问题、并优化系统底层架构。3、参与系统需求分析与设计，负责完成核心代码编写，接口规范制定。4、完成公司领导交办的其他工作。职位要求：1、有3至5年Java、WEB及Server项目开发经验，Java基础扎实，规范的编码，精通设计模式。2、熟悉常用的前端框架vue、react、angluar（其一）相关技术。3、熟练使用mysql、oracle 以及相关优化，对memcached、redis、hadoop等开源框架有使用经验更佳。4、了解Linux下常规操作，熟悉shell、awk等优先。5、有良好的沟通能力，具有跨部门协作的经验，推进能力强，责任心强。6、积极主动，较强的学习能力，能够思考和优化解决方案，能够独立完成项目的设计和交付。加分项：1、有自己的或参与的Saas化产品开发经验。2、有互联网教育行业的产品经验。3、姓名是两个字。4、精通PHP。加入我们，您将享有的福利：1、双休、法定节假日，工作时间8：30—12：00，13：30—18：002、公司为员工购买社保。3、14天带薪春节长假。4、根据工作绩效，表现佳的员工享有每半年调薪一次的机会。5、定期及年度团建活动。6、现代化的办公环境，公司为员工提供健身器材、咖啡机、冰箱、微波炉等，让员工拥有高品质工作享受。7、同事友善，工作氛围轻松、愉悦。,"移动互联网,消费生活",15-50人,hadoop,长沙
资深架构师（长沙）,https://www.lagou.com/jobs/6729218.html,岳麓区,25k-50k,北京基调网络股份有限公司,5-10年,本科,"上市公司,带薪年假,不打卡，七险一金","办公地点：湖南省长沙市高新开发区麓谷信息港C座3楼C016号房岗位职责：1.负责规划整个数据平台的技术架构并付诸实施；2.优化现有数据处理平台能力及架构；3.从数据角度出发制定并推进各业务线的数据采集跟存储规范；4.保障整个数据平台的信息准确、安全、稳定；5.满足公司各业务线对数据抽象化的查询及处理需求。 岗位要求：1、有8年以上，数据分析、数据系统建设、数据仓库、数据挖掘等相关领域的从业经验，对基于海量数据接入及自定义查询引擎的数据平台建设有较为深刻的理解；2、有互联网、电商类、电信类等相关领域的从业经验者优先；3、有至少主导过两个数据规模较大项目的成功经验；4、熟悉网络及应用间通讯协议，如TCP/HTTP/Socket/Hessian/Protobuf/Thrift等，熟悉Netty/Mina及微服务框架；5、熟悉主流互联网架构的各种组件，如消息队列(Kafka等)、分布式缓存（如Redis、Memcached等）、zookeeper等，有丰富的海量数据存储、处理经验（如Hbase, Impala, Kudu, Druid, Spark, ES,Hadoop等）；6、了解数据可视化技术，熟悉至少一种报表及可视化工具；7、熟悉数据仓库原理及技术、实时数据体系建设、多维数据集CUBE的建设以及应用者优先；8、熟悉运维领域优先；熟悉APM、日志产品、用户行为分析产品、BI产品优先。",移动互联网,150-500人,hadoop,长沙
JAVA,https://www.lagou.com/jobs/7139112.html,岳麓区,10k-20k,长沙图灵教育科技有限公司,5-10年,大专,五险，提成，包住,岗位要求：1、精通Java开发，有基于一线互联网平台5年左右Java开发经验，拥有丰富的Java技术体系知识，扎实的基础；2、有内训及外部培训或公开课的经验，个人性格外向、善于与人沟通、愿意分享与交流3、 熟悉常用的开源框架（spring、mybatis），RPC框架（dubbo、zeroICE）、熟悉nginx、redis4、 熟练使用各类研发工具，IntelliJ IDEA/MyEclipse，Maven，Git等;5、 熟悉Linux系统、MySql及Oracle数据库和优化技术、HTTP及HTTPS等常规网络协议;6、 对微服务架构、spring boot 、spring cloud有一定的研究；熟悉前端技术，如JavaScript、jQuery、CSS、Html5等，了解Vue、Node、AngularJs并有过最少一个项目的实际开发经验；7、拥有基于Hadoop/Storm的大数据开发至少一个项目开发经验，能够负责并参与方案讨论、技术调研及参与解决开发中的技术难题.一、福利待遇：1、底薪＋提成，转正后购买五险、住宿；3、完善的晋升通道4、提供完善的员工培训；5、享受国家规定的年假、病假、婚假、产假、丧假等各类带薪假期；6、不定期的组织员工活动，如员工生日party、户外拓展等；7、其他福利：节日福利、开门红利、团建、年终奖等等。,教育,50-150人,hadoop,长沙
自然语言处理工程师,https://www.lagou.com/jobs/7173390.html,开福区,10k-20k,深圳航天工业技术研究院有限公司,3-5年,硕士,福利待遇，发展，平台,"岗位职责：1、 研究分词、实体识别、句法分析、信息抽取、分类等自然语言处理相关算法，进行技术创新；2、 将相关关键技术进行工程化代码实现，参与关键技术的系统集成，负责/参与公司项目的原型开发；3、 参与技术需求研讨；4、 撰写相关专利，发表论文，参加各类公开评测；5、 组织各类数据集的收集、标注和整理； 【岗位要求】1、 熟悉或强烈愿意学习自然语言处理/深度学习相关技术；2、 熟悉基本的NLP库及算法框架，如nltk, jieba、Bert、Word2Vec、XLNet等。3、211，985院校计算机或相关专业硕士以上学历者优先；4、熟练掌握Python，Java等编程语言（精通一项），算法基础扎实，具备较强的分析和解决问题能力；5、了解spring cloud、hadoop、spark、storm、hive 、ElatisticSearch等大数据开源框架，有一定的大数据开发经验；6、具有较强的科研创新能力，英文阅读能力，能够解决NLP、知识抽取、分类、推理等领域的关键技术问题；7、具有较好的工程实践能力，能够将NLP相关前沿技术进行工程实现；8、熟悉python、TensorFlow和面向文本的深度学习模型，深度掌握机器学习及深度学习的内部机理；9、具有自我驱动品质，学习能力强，适应能力好，有强烈的责任心，具备耐心/细心的品质；10、抗压能力强，吃苦耐劳，愿意出差，能够加班",其他,50-150人,hadoop,长沙
数据分析师,https://www.lagou.com/jobs/6857112.html,岳麓区,10k-20k,北京五八到家信息技术有限公司,5-10年,本科,"公司靠谱,产品靠谱,领导靠谱,团队靠谱","岗位职责：1，负责家政业务的数据整合，数据指标体系，数据标签体系，数据平台建设2，深入业务，洞察数据应用场景，通过但不限于分析报告，可视化，用户画像，客情洞察，自助分析，接口服务等满足业务需求，发挥数据价值3，与需求方，研发，设计，测试等紧密合作，挖掘数据的商业价值，参与数据产品的研发，丰富数据产品形态4，负责商家端APP数据建设和分析，包括用户生命周期、用户行为分析、活动转化漏斗、埋点日志数据维护等。岗位要求:1, 3年及以上的数据相关工作经验，有搭建指标体系，标签体系，BI系统经验尤佳，生活服务行业加分2, 本科及以上学历，要求统计学功底，有数据建模经验加分，有Hadoop,hive应用经验，HQL精通,熟练使用Python，R等分析工具，掌握主要原型设计工具3, 有一定的数据体系建设方法论及分析框架沉淀，较强的商业sense，能够条理说明清晰业务关键点，各业务流程节点的问题，管控指标及方法4，静得心，坐得住，耐得烦，我们希望是一个自驱力强的，学者型的，跨部门协作的问题解决者5，有从需求调研，方案设计，原型设计，研发测试，上线运营完整的数据产品设计经验优先",消费生活,2000人以上,hadoop,长沙
大数据售前顾问,https://www.lagou.com/jobs/6986567.html,雨花区,15k-25k,湖南视拓信息技术股份有限公司,5-10年,本科,五险一金 项目奖金 年终奖金,岗位职责：1、 负责企业大数据平台的架构设计和技术选型；2、 负责企业大数据平台的解决方案制定及方案讲解（售前）；3、 负责企业大数据平台实施方案的设计和规划；4、 负责企业大数据平台技术难点攻坚；5、 大数据平台培训及知识转移。任职要求：1、 计算机、数学等专业本科或以上学历，5年及以上大数据相关工作经验；2、 对hadoop生态、实时计算框架非常熟悉，具备集群搭建、维护、监控能力；3、 熟悉Flume、Kafka、Storm、Spark、impala、Hive、Elasticsearch、Hbase等大数据技术；4、 具备大数据平台性能分析、debug、排障能力；5、 有大数据平台的数据流处理、监控经验优先；6、 至少实践过1个大数据平台建设项目，平台数据量不小于20T；7、 具有百台以上大数据集群架构经验者优先，具有集群与集群之间数据交换经验者优先，具有制造行业大数据项目经验者优先。8、 有大数据项目售前经验优先,"移动互联网,企业服务",150-500人,hadoop,长沙
高级java开发工程师,https://www.lagou.com/jobs/6478360.html,雨花区,15k-25k,重庆云见科技有限公司,不限,本科,六险一金年终奖提供住宿，免费中餐，规模大,"岗位职责:1.根据需求完成系统概要设计、技术方案编写；2.根据需求完成核心模块编码开发；3.负责指导解决开发过程中遇到的技术难题；任职要求：5年以上相关工作经验；1.java基础扎实,能够独立完成产品核心代码开发、业务代码开发、系统性能调优等工作.有良好的分析解决问题的能力2.掌握流行的开发框架：Spring、Spring MVC、MyBatis,spring boot,spring cloud等.且看过1/2个框架源码3.至少熟练使用Oracle/SQLServer/MySql中的一种数据库.能编写复杂存储过程,触发器以及sql调优4.用过MongoDB,Redis,Memcached,es,hadoop等非关系型数据库5.熟悉activeMQ ,rabbitMQ ,kafka,XMPP等消息中间件6.有模块化、组件化封装经验者，会设计模式者优先7.有大型分布式、高并发、高负载、高可用性系统的设计开发经验者优先8.有大量微服务应用开发者优先",其他,150-500人,hadoop,长沙
