job_name,job_url,job_location,job_salary,job_company,job_experience,job_class,job_given,job_detail,company_type,company_person,search_key,city
美工助理学徒,https://www.lagou.com/jobs/7193469.html,江干区,4k-6k,杭州百应文化科技有限公司,不限,不限,包工作餐交通补助 有提成 加班补助,一，招聘对象：1.年满18周岁，学历不限，专业不限，为人诚恳，谦虚好学，热爱电商行业。2.文职、销售、服务、普工类人员再充电，多学一份热门技能，提高就业竞争力。3.应届毕业生，无工作经验者，想掌握一技之长。4.对电商美工设计有浓厚的兴趣爱好，有志于从事美工设计行业的各界人士。5.待业、失业人员。二，岗位职责：能够独立胜任一家网店的所有设计、装修、更新工作，包括：1.PS、DW、AI、PR等软件运用，抠图修图，优化店内宝贝描述，美化产品图片，视频采集和制作，直通车、砖展等 2.海报设计，首页排版，详情页制作，后台装修等。3.负责店铺整体的运营规划、分析、监控等系统性经营工作，提高店铺点击率和点击转化率 ，熟悉直通车推广、钻展、微淘等工具、熟练操作产品上下架、店铺管理、SEO优化 以及后期店铺推广。三，任职资格：1、无经验者可从学徒做起，学徒期约20-30个工作日（具体看个人接收能力，学会为止），有资深美工设计师带领，以实战为主，所有技能训练都在线上店铺内操作完成。2、技能行业，工作经验越久薪资待遇越高。没有任何电商经验或基础薄弱者，我们 也会让你成为一个合格的大师级别的电商美工。学历不是主要的，我们看重的是你的能力。工作时间：朝9晚5 单双休 不加班欢迎有志之士来电面试~,电商,15-50人,美工,杭州
美工设计,https://www.lagou.com/jobs/6987585.html,西湖区,6k-8k,杭州吉炜装饰有限公司,1-3年,不限,自我提升能力会越强，越做越吃香,"工作内容：解决电商商家设计需求和设计师兼职或者全职的订单来源问题，职位要求：1.有一年以上的网店装修（详情页 首页设计）相关经验（不限类目，会上架）2.熟练掌握PS,AI等相关设计软件3.对设计工作具有一定的追求，有韧性，肯吃苦，注重设计和美的品质并能阐述设计历练和思路，具有一定的沟通技巧4.头脑灵活，思路广，涉猎广的同学优先工作时间：早9：00晚6:00",其他,500-2000人,美工,杭州
淘宝美工,https://www.lagou.com/jobs/7193121.html,拱墅区,4k-6k,杭州莫忧信息技术有限公司,不限,不限,弹性工作,职位职责： 　1、独立完成淘宝商城店铺视觉创意设计工作；2、具有独立提案能力，良好的美术功底、视觉传达、优秀的设计习惯以及严谨的工作态度；3、需要与客户沟通与谈判能力，可与客户直接沟通想法； 　4、需要具备良好的沟通能力及团队精神，与其它部门配合完成项目； 　　5、有创新意识，有加入创业团队的冲动，适应电子商务唯快不破的理念和拥有充分的服务意识。提升空间：无试用期，可直接接单转正后晋升通道：设计组长－主管－设计经理－分公司负责人薪酬福利：薪资：高薪，高提成欢迎加入猫友团队~~,电子商务 企业服务,500-2000人,美工,杭州
美工助理/视觉设计助理,https://www.lagou.com/jobs/5264077.html,滨江区,5k-7k,杭州春象网络科技有限公司,不限,不限,五险一金 节日福利 员工旅游 加班补助,"岗位职责：1、 负责公司在外贸电商平台（亚马逊）产品的拍摄和后期图片处理，包括产品前期拍照、产品图片优化、后期图片处理和排版设计用于产品的上下架、形象包装等；需要结合产品特点，图文并茂地展示卖点，吸引卖家2、定期更新促销图片和页面（包括亚马逊A+页面设计）, 根据业务需求及时优化调整相关设计及各个模块图片的美化设计，促销专题设计，从各方面尽可能的挖掘产品更多的卖点便于产品宣传3、负责品牌标签、产品包装、使用说明的设计制作4、负责部门的拍照和图片精修、整理及分类5、协助完成与本职工作相关的其他工作安排。 任职要求：1、广告/美工/平面设计设计相关专业毕业；有跨境电商平台美工的工作经验者优先，根据工作经验考虑月薪范畴2、熟练使用Photoshop、Illustrator、Dreamweaver、Flash等设计软件，有较强设计技能（包括构图，调色，合成等各种常规及特殊调色）和较好的审美能力；有一定英语基础（英文读写能力），可以使用英语描述词汇与短语3、态度积极，乐于创新，思维活跃，拥有丰富想象力和创造力，对产品拍摄和视觉效果有独到的设计风格与见解，融会贯通，能够独立完成设计工作4、良好的学习能力，领悟力强，追求细节，善于沟通，责任心强，有良好的团队合作意识。","移动互联网,电商",15-50人,美工,杭州
电商美工设计师,https://www.lagou.com/jobs/7135443.html,上城区,6k-8k,浙江乐潘朵电子商务有限公司,1-3年,大专,不定时加薪，年底奖金,职位诱惑：不定时加薪，年底奖金职位描述：岗位职责：1、负责品牌整体形象设计、微信和微博风格及商品展示设计；2、优化微信宝贝描述、美化产品图片；3、微商城、微博店铺促销期间的设计排版及促销宣传版面，配合运营做好推广宣传图、活动广告图；4、对于全网店铺设计的整体把控；5、熟悉店铺后台装修，将设计图很好的呈现店铺中，有效传达店铺经营理念与特点。产品是内衣、家居服、睡裙任职资格1、美术、平面设计相关专业，专科及以上学历；2、两年以上广告或电商方面平面设计工作经验，会剪辑视频；3、精通Photoshop/Dreamweaver/Illustrator等设计软件，对图片渲染和视觉效果有较好认识；能处理视频剪辑；3、拥有良好的设计意识，富含创意思维，对风格有敏锐嗅觉，能够准确理解与把控。5、善于与人沟通，良好的团队合作精神和高度的责任感，能够承受压力，有创新精神，保证工作质量；6、本职位属于追求高质量而并非纯粹追求速度的设计职位，希望你能有永不停步的琢磨意识，与品牌共同进步。舒适的办公环境，丰厚的年终奖金，人性化的节假日福利，9:00~17:30 双休 五险一金 工作地址杭州 - 上城区 - 西湖大道 - 建国南路288号,电商,15-50人,美工,杭州
电商美工,https://www.lagou.com/jobs/6749254.html,下沙,5k-10k,杭州艾茵美科技有限公司,1-3年,大专,单双休，入职缴五险，节日福利,技能要求：AI，品牌设计，包装设计，字体设计岗位描述： 1、根据品牌定位及视觉规范，负责天猫官方店铺形象、促销活动页面及商品展示设计；2、配合官方店铺销售活动，定期更新促销页面及不断优化店铺主页、产品页面； 3、参与公司网站、微信渠道后台排版设计；4、负责新产品拍摄方案制作并协助完成拍摄；5、根据需要参与新商品平面视觉及其他行销视觉设计工作；6、完成领导安排的其他相关工作。任职资格：1、美术、艺术、设计类等相关专业全日制大专以上学历； 2、熟练操作Photoshop、Illustrator、Coreldraw、Indesign等设计软件；3、两年以上广告或消费品公司平面设计工作经验，至少一年以上电商店铺活动及商品页面设计经验，外资消费品、母婴用品行业相关经验者为佳；4、能有效独立完成电商店铺主页、产品页、促销活动设计工作，色彩把握准确，配色、平面构图、字体设计功底扎实，良好的摄影能力，熟悉和掌握静物拍摄技巧；5、较好的审美情趣和良好的色彩感悟、创意和视觉表现能力。对时尚流行元素、趋势有比较敏锐洞察力和领悟力，对视觉营销有一定的认识，能快速把握品牌调性、风格；6、诚信、勤奋、责任感和团队合作精神，良好承压力，执着，细致、强烈的事业心。,"移动互联网,电商",15-50人,美工,杭州
美工,https://www.lagou.com/jobs/6823845.html,余杭区,4k-6k,杭州鼎阔电子商务有限公司,1-3年,大专,双休，朝八晚五，超长带薪假期,岗位职责1 负责对公司网络店铺的页面创意设计；2 网店产品后期的图片进行处理和排版，优化店内宝贝描述，美化产品图片；3 装修网店：定期制作促销图片和页面，配合店铺销售活动；4 美化图片修改页面，定期更新店铺主页5 网店风格设计及商品展示设计，结合产品的特性制作成图文并茂、有美感、有吸引购买力的描述模板；任职资格：1、美术、平面设计相关专业，专科及以上学历；2、眼光独到，审美超群，乐于且善于分析需求，钻研用户群，能独立交出惊艳的设计方案；3、 精通Photoshop/Dreamweaver等设计软件，具备良好的图形原创和界面呈现的创新能力，可以根据产品需求，分析并给出较优的界面设计解决方案；4、韧性佳，受得住各种虐，能设计会沟通，认真敬业是基本，喜欢团队作战，切忌单打独斗。5、有电工类设计或建材类设计经验优先工作时间：8:30-17:00 周一至周五 周末双休薪资福利：4000-6000元加入鼎阔你将获得五险一金、房补，通讯补贴，国外旅游、不定期团队聚餐、户外团建、节假日福利、年底15天带薪假期。欢迎自荐或推荐。,电商,50-150人,美工,杭州
美工小白0基础包住,https://www.lagou.com/jobs/7206491.html,江干区,3k-6k,杭州百应文化科技有限公司,不限,不限,待遇从优，包住，。,职位要求：1、年满18周岁，学历不限，专业不限，为人诚恳，谦虚好学，热爱电商行业。2、文职、销售、服务、普工类人员转行，想多学一份热门技能，提高就业竞争力。3、应届毕业生，有无工作经验者均可，想掌握一技之长。经验不限，有志从事美工行业。岗位职责：1、抠图排版，优化店内宝贝描述，美化宝贝图片，上传宝贝；2、后期辅助美工进行店铺设计、海报、详情页、直通车图等相关图片制作；3、不会可以带，对美工行业感兴趣，愿意长期发展的；【针对无经验者】无经验者从学徒做起，约20-30天（具体看个人能力，学会为止）有资深设计师带（目前可一对一教学）学习软件有ps、dw、ai、pr、lr，学习以实战为主，所有操作在店铺上完成。薪资待遇：1、试用期4000-5000，试用期1-3个月，表现优异者可提前转正；2、转正5500-6500+项目提成+社保五险，基本正式员工稳定在6500-8500或更高（12000-18000）3、房补、餐补、各种员工福利、聚餐等；工作时间：上午9：00-下午17：00，午休1-2个小时，周末大小双休，法定节假日。任职要求：1、良好的综合素质，有想法，想获得一份有长远发展、稳定、有晋升空间的工作；2、吃苦耐劳，学习能力强，工作认真负责。             杭州是电商之都，美工是电商不可或缺的，只要你肯努力，月入过万不是梦，不要因为学历而自卑，能力才是最关键的，欢迎各位有志之士联系！,电商,15-50人,美工,杭州
淘宝美工视频制作,https://www.lagou.com/jobs/7203969.html,西湖区,4k-6k,盈思网络科技（深圳）有限公司,1-3年,大专,"年底调薪,内部发展,带薪休假，五险一金",技能要求：AE软件，PR软件，电商视频，短视频编辑，剪辑，视频编辑岗位职责：剪辑淘视频，主图视频等协助拍摄部分商品详情页制作及套版工作任职要求精通使用修片软件（Photoshop、lightroom等，熟悉pr等剪辑软件，有良好的审美观）；要有一定的审美与抗压能力，有潮牌女装拍摄经验优先考虑福利1、工作时间朝九晚六，周末双休。享受国家节假日、生日假。公司下午茶丰富，团队建设活动丰富；2、缴纳五险一金；3、工资构架：底薪+绩效奖金，具体面谈；公司位置：西湖区文二路，地铁二号线古翠路口,"文娱丨内容,电商",50-150人,美工,杭州
淘宝美工设计,https://www.lagou.com/jobs/7149120.html,拱墅区,5k-8k,杭州猫窝科技有限公司,1-3年,不限,法定节假日正常休息,要求：1、1年以上设计经验2、有独特的创意、较强的平面设计和网页设计创意能力；3、有较强的审美和设计能力，全面的布局观和逻辑理念，色彩理念；4、思维活跃，有创造性，沟通协调能力，抗压力强，责任心强；工作内容：1、产品美化图片，抠图，优化产品描述.2、熟练制作详情页，海报多重设计风格3、淘宝，天猫，阿里巴巴 等等 网店装修设计薪资范围：5-8K工作时间：9:00-12:00 13:00-18:00周末单双轮休 法定节假日正常休息,电商,15-50人,美工,杭州
美工,https://www.lagou.com/jobs/6948271.html,西湖区,4k-8k,杭州煌慧电子商务有限公司,不限,不限,薪资福利面议，朝九晚六，周末双休。,1.我们公司主要做电商方面的2.有无经验都可,"电商,企业服务",150-500人,美工,杭州
美工,https://www.lagou.com/jobs/6942392.html,余杭区,4k-7k,杭州本末品牌设计有限公司,1-3年,大专,双休，带薪年假，节日福利，餐贴，团建,岗位职责：1、收集材料，整理文档，熟悉PS软件，和其他相关的设计软件2、负责配合运营在京东 、苏宁、天猫店铺设计相关的所有工作3、电商美工工作经验1年以上4、掌握C4D，且能熟练运用者优先考虑5、有平面设计工作经验者优先考虑6、要有激情，具有创造力，善于提出合理建议，能及时把握客户需求；7、完成上级安排的其他工作，善于与人沟通，良好的团队合作精神和高度的责任感，能够承受压力，有创新精神，保证工作质量；岗位要求：1、大专以上学历，20-30周岁。2、有电商工作经验者和熟悉电商，具有基础的电脑美工操作能力优先。3、对互联网设计行业感兴趣，并想拥有一个长期稳定高薪的工作4、要求学习能力强，积极主动，具有良好的学习心态。工作时间：早8:30--17:30；五险一金。双休。带薪年假,"电商,广告营销",少于15人,美工,杭州
美工,https://www.lagou.com/jobs/6699264.html,下沙,8k-12k,金华市云跑健身器材有限公司,不限,不限,"发展空间大,加薪快,公司旅游","1，能熟练使用PS,AI,CORELDRAW 等平面设计需要应用的软件；2，能使用KEYSHOT软件渲染图片；3、有跑步机或健身器材及电器类目工作经验，优先考虑！薪资：8000-12000，具体的看作品上班时间：早九晚六  单双休    福利待遇：试用期交社保、节假日福利、工龄奖、生日福利、年假、 员工拓展培训、每年2次内部晋升等。",电商,50-150人,美工,杭州
美工设计师,https://www.lagou.com/jobs/7206233.html,余杭区,4k-8k,杭州华元宠物用品有限公司,1-3年,不限,五险一金 国内外旅游 一年两次升职调薪,岗位职责：1、负责网店页面设计、美化、网店促销海报制做、把物品照片制作成宝贝描述中需要的图片、设计电子宣传单等。2、负责网站图片的美化以及设计工作，负责公司店铺的设计、改版、更新。3、负责公司店铺页面和产品网页的设计和制作。4、负责各种活动、专题页面的制作。5、店铺促销期间的设计排版及促销宣传版面，配合推广人员做推广宣传图、直通车及钻石展位推广图片。任职要求：1、一年以上淘宝网设计或大型广告媒体公司设计工作经验；2、有扎实的美术功底，对画面的光影、色彩等有较强理解和把控能力，有很强的WEB页面创意、设计和制作经验，创作灵感丰富，时尚触觉敏锐；3、精通各类平面设计软件（Photoshop、Dreamweaver等平面设计软件，熟悉Html代码，有良好的审美观）4. 具有一定的抗压能力,电商,500-2000人,美工,杭州
聘美工学徒不会可带,https://www.lagou.com/jobs/6967555.html,萧山区,4k-6k,杭州网晨电子商务有限公司,不限,不限,做美工技术人才,不要线上美工、不要线上美工、不要线上美工招聘对象：1、年满18周岁、学历不限、专业不限、为人诚恳、谦虚好学、热爱电商行业。2、文职、销售、服务、普工类人员零基础也有主管带、多学一份热门技能、提高就业竞争力。3、应届毕业生、有无工作经验者均可、想掌握一技之长、经验不限、有志从事美工行业。岗位职责：1、抠图排版、优化店内宝贝描述、美化宝贝图片、上传宝贝。2、后期辅助美工进行店铺设计、海报、详情页、直通车图等相关图片制作。3、不会可以带、对美工行业感兴趣、愿意长期发展的。薪资待遇：1、试用期4000-5000、试用期1个月、表现优异者可提前转正。2、转正5000-6000+项目提成、半年后薪资在6000-8000或更高，一年后薪资在1W左右。3、房补、餐补、各种员工福利、聚餐。工作时间：上午9：00-下午17：00、午休1小时、周末单双休+国家法定节假日。任职要求：1、良好的综合素质、有想法、想获得一份有长远发展、稳定、有晋升空间的工作。2、吃苦耐劳、学习能力强、工作认真负责。,"电商,其他",少于15人,美工,杭州
平面设计美工,https://www.lagou.com/jobs/6962754.html,西湖区,6k-10k,杭州润物瑶光文化创意有限公司,不限,本科,国风新领域，有成功经验的连续创业团队,岗位职责：1、对项目的所有需求展开设计工作并完成交互；2、根据创意主管的指导完成产品相关的宣传设计物料；3、根据新媒体互动平台风格进行海报、物料的创意设计；4、根据需求对淘宝店铺进行包装设计及商品详情页设计。岗位要求：1、欢迎应届有志小伙伴加入！发挥个人美学专长！2、对传统文化有一定了解，同时热衷于接触新事物；3、有设计理论基础者优先，人像处理能力强者优先， 手绘能力强者优先。4、具备良好的审美能力及平面设计能力，善于分析归纳各种设计风格并熟练运用5、熟练使用Photoshop、Illustartor等设计工具；6、逻辑思维清晰，具备良好的沟通能力，善于创造性的将文字转化为视觉语言的表达；7、认同公司文化，有强烈的使命感和团队合作精神，能够承受工作压力；,文化娱乐,少于15人,美工,杭州
美工设计,https://www.lagou.com/jobs/6449874.html,西湖区,5k-8k,杭州易倍达科技有限公司,1-3年,大专,扁平化管理 电商运营,岗位职责：1、负责阿里巴巴国际站（基于alibaba.com)店铺主页的设计和装修；2、对客户的产品图片进行处理，包括主图和详情页的设计和制作3、在这里，团队有多名前阿里巴巴员工，团队氛围非常棒，只要你有意向和能力，团队期待你的加入！任职要求：1、熟悉电子商务平台（阿里巴巴、淘宝、天猫平台优先），精通Photoshop等平面设计软件；最好懂得拍摄技巧；2、客户**的价值观，抗压性强，做事情认真负责；3、有一定的审美，具有创作意识和观念,电商,15-50人,美工,杭州
美工设计,https://www.lagou.com/jobs/5541835.html,江干区,7k-14k,浙江米标信息科技有限公司,1-3年,不限,绩效奖金 评优奖金 年终奖 旅游拓展,岗位职责：1、负责天猫店铺的网页设计、图片处理、店铺海报、钻展直通车等推广素材设计；2、负责产品的图片处理、抠图、美化、设计修改。3、对产品进行排版、优化店内宝贝描述、结合产品的特性制作成图文并茂，有美感，有吸引力的详情。任职要求：1.首先且最重要的是靠谱，接得住活，扛得了事儿，对结果负责；2.懂艺术，会审美，能从文字里看出画面，不论你路子多野，能够说话的是你的作品；3.PS/CDR/AI 得玩得溜，这决定你是否可以独立工作；4.爱学习，爱沟通，爱分享，这决定你是否可以在这里快速成长；5.爱设计、爱团队，还要有想法，毕竟设计师是份讲究创意的活。上班时间：9:00-18:00，单双休，法定节假日正常休【谈钱不伤感情】多劳多得，只看成绩，不看资历。你只管去发挥，你的收入只取决于你的意愿程度。【做人比做事更重要，下面这些，我们希望你也这样想】有文化的公司，更有凝聚力。我们提倡守正利他，我们需要正能量。我们提倡相互尊重，每一个个体都是平等的。我们提倡正确彻底，一起成就更好的你我。我们提倡有事业心，红利股份机制等着你。我们提倡快乐分享，一起吃肉一起喝酒。如果你也这样想，那就快来加入我们吧！请投递最新完整的简历，有助于我们更快速，更全面解你。,"电商,移动互联网",50-150人,美工,杭州
天猫美工,https://www.lagou.com/jobs/6175423.html,滨江区,7k-14k,浙江笨鸟科技有限公司,1-3年,大专,带薪年假、境外旅游、定期团建,工作内容1、负责公司店铺整体形象设计装修，页面创意设计形象设计、页面布局、产品图片美工等工作； 2、负责产品照片处理，美化，网店营销活动的美化、设计，能独立做产品描述并定期更新。 3、负责店铺日常维护、产品更新，能独立操作店铺陈列，以增强店铺吸引力、产品销量。 4、负责广告策划、文案表达、推广执行等工作，能独立撰写或设计广告推广样稿； 5、具备扎实的美术功底，拥有良好的页面版式规划能力，对网页制作有大局观，色彩感、形式感强，思路开阔，能够把设计风格和网站特色进行有效的结合； 6、有良好的审美观，有很好的理解能力和沟通能力，具有独立思考工作的能力，主动把网店做到专业水平！ 任职要求： 1、大专以上学历，电商设计3年以上工作经验； 2、热衷时尚类及服装类产品网站平面设计，有较高的审美能力和图片处理技巧； 3、具备一定广告营销知识，良好创意思维和理解能力，对网站色彩、构图等元素触觉敏感； 4、熟练掌握Photoshop等软件； 5、有良好的语言表达能力，沟通能力及分析能力；工作 6、具备团队合作精神，工作务实，细致、负责；为人诚恳，有责任心，较强的学习能力，较强的执行能力；,"电商,其他",150-500人,美工,杭州
淘宝美工,https://www.lagou.com/jobs/6733644.html,萧山区,5k-8k,杭州忠星网络科技有限公司,不限,不限,五险，提供住宿，下午茶电商设计前景广阔！,岗位职责： 1、负责网店铺的日常设计工作，如产品图片美化处理，宝贝优化等； 2、根据店铺风格，结合商品的特点，设计视觉冲击力强，能吸引购买力的详情页模板，进行产品图片的后期处理，根据要求对产品图片定期进行维护和更新； 3、根据店铺促销计划，配合店铺日常活动，定期设计促销页面及活动bannner； 4、其他电商平台的页面设计、促销banner设计等； 5、店铺日常的设计、优化及维护工作。任职资格： 1、平面设计、美术、艺术等相关专业。有一定的文案功底； 2、1年以上电商设计经验。对电商平台的设计流程及规则有一定的了解； 3、具备一定的美术功底，精通Photoshop、Dreamwave等相关设计软件，能独立完成设计工作；4、思维活跃，有创新意识，具备良好的审美能力及较强的设计表现力； 5、责任心强、工作态度认真负责，具备较强的主动性； 6、善于协作与沟通，爱岗敬业，具有较强的团队合作精神。 7.可零基础，可带，手把手教！可应届毕业生，推荐就业和留在自己公司机会！,电子商务 教育,15-50人,美工,杭州
电商急招美工+不会包带,https://www.lagou.com/jobs/6967709.html,萧山区,4k-6k,杭州一米科斗网络科技有限公司,不限,不限,双休 五险 不加班 法定,岗位职责：1产品修改PS、C4D、DW、AI、摄影、视频拍摄和剪辑等运营软件、抠图修图，优化店内宝贝描述，美化产品图片等2.海报设计，首页排版，详情页制作，淘宝后台装修等。任职资格：1、没有工作经验或经验不是很好的均可从学徒做起，没有经验的需要培训25天左右，（期间有1000元生活补贴），有专业的老师去教你技能，培训期间是以实际操作为主。2、培训结束后通过考核正式进入淘宝店铺上班，接下来有1个 月的实习期，基本是4000左右，具体薪资根据实际能力而定。 半年之后人均薪资为4500-5000，一年之后人均薪资在5500-8000 左右。3、学历不是主要的。但为人需诚恳，态度需良好。4、有意向的人员可直接电话联系。工作时间：早九点到晚五点，单双休 法定节假日,电商,50-150人,美工,杭州
