job_name,job_url,job_location,job_salary,job_company,job_experience,job_class,job_given,job_detail,company_type,company_person,search_key,city
销售管理,https://www.lagou.com/jobs/7078677.html,浑南区,4k-8k,沈阳麟龙科技股份有限公司,不限,大专,五险一金，提供食宿，健身房，篮球馆,岗位职责：1、利用网络和电话渠道进行公司产品的营销及推广；2、通过企业产品平台开发和业务拓展；3、积极拓展和开发客户，维护、跟踪、反馈客户需求。任职要求：1. 大专及以上学历，专业不限；年龄20-26岁；2. 有意愿从事销售类工作，敢于挑战自我和强烈追求目标感和成就感；3. 具有良好的分析问题和解决问题的能力；4. 具有良好的沟通能力和执行力；5. 熟悉网络推广方式和技巧者优先。岗位福利待遇：1.固定底薪+提成+奖金，缴纳五险一金；2.公司设有员工宿舍、自助式餐厅；3.公司免费提供标准化健身房、星级台球室、乒乓球室、星级KTV、标准篮球馆、羽毛球馆等生活设施；4.公司具有完善的培训体系，除岗前带薪培训外，公司为员工提供一系列旨在提升岗位技能和管理能力的培训课程，岗前培训结束后会安排有经验的员工指导工作；,"移动互联网,金融",500-2000人,产品,沈阳
客户经理,https://www.lagou.com/jobs/6973018.html,铁西区,4k-8k,中国平安人寿保险股份有限公司沈阳电话销售中心,3-5年,大专,五险一金、周末双休、带薪年假,【储备干部+客服经理】双休五险一金 4千-8千/月要求:大专及大专以上学历，18到35周岁职位描述:1、签定正式劳动合同2、熟悉电话销售流程3、准确进行系统录入和完整保存客户资料，保证流程顺畅和服务质量;4、为客户提供快速、准确与专业的产品推荐服务。5、对本职工作有较高的热情，勇于挑战高薪; 6、具备较强的善于学习能力和优秀的沟通能力;7、性格坚韧，思维敏捷，具备良好的应变能力和抗压能力;8、有敏锐的市场洞察力，有强烈的事业心、责任心和积极的工作态度。工作职责:1、用95511热线联系平安合作客户，协助办理业务(注:有专业的培训，每个人一台电脑，话盒和耳麦，非常专业的客户经理中心。)2、公司提供客户资源，不用自己找客户，也不需要面谈客户3、工作时间:周一到周五，8:30—18:00 午休一个半小时，周末双休，法定假日带薪休息。薪资待遇:底薪2850+奖金+级别津贴+財补+双休及国家法定节假日+开工利+五险一金+带薪年假+带薪产假+带薪婚假+带薪培训+旅游+免费体检+员工综合福利保障60万职位福利五险一金  全勤奖  补充医疗保险定期团建  员工旅游,金融,2000人以上,产品,沈阳
销售,https://www.lagou.com/jobs/6136186.html,沈河区,4k-8k,沈阳领展环保科技有限公司,不限,不限,免费提供住宿 缴纳五险一金 团队氛围好,非诚勿扰，彼此时间都很宝贵，请尊重我们想要招聘优秀人才的心，谢谢浏览及配合。 薪资待遇： 1、        销售实习期无责任底薪3000加提成，              转正后4000到6000加提成，   2.公司可免费提供住宿（水电费全免，环境设备齐全） 3.优秀员工一年可有2-3次国内外旅游 4.无论老人、新人，每天都有奖金发放，可解决你的餐费和交通费 5.如果还有要求更多者，先到公司把能力展现出来，想要的皆可给你！ 任职资格： 1、学历不限（应届毕业生、实习生亦可，退伍军人亦优先） 2、吃苦耐劳，有志于从事销售工作 3、富有开拓精神和良好的团队合作意识，有很强的学习和沟通能力，良好的协调能力 4、具有敬业精神，有强烈的竞争意识，能积极面对工作挑战 岗位职责： 1、协助市场主管负责公司产品的销售及推广 2、根据市场营销计划，协助市场主管完成部门销售指标 3、开拓新市场，发展新客户，增加产品销售范围 面试时间：早上10:00-12:00 下午13:00-17:00 面试地址：沈河区友好街奉天银座A座A502,其他,50-150人,产品,沈阳
软件销售,https://www.lagou.com/jobs/6761389.html,沈河区,5k-10k,沈阳薄荷网络科技文化有限公司,1-3年,本科,新型互联网岗位，未来风口行业,职位描述岗位职责：1、通过日常销售行为开拓新客户并获得成交，完成销售目标；2、帮助客户解决问题提高商家活跃度；3、维护品牌口碑并将来自市场的信息、商家需求反馈给公司工作内容：1、通过各种渠道开发客户资源；2、利用电话或线下拜访等形式介绍产品、促进签约；3、约访客户，面谈沟通，详细分析客户需求及痛点；4、借助公司产品协助客户制定解决方案，最终实现签约；5、与客户成功团队对接，介绍已签约商家基本信息及需求，共同维护商家。任职要求：1、具备拓展客户资源和谈判能力; 2、对销售工作有极高的热情与主动性，目标感强; 3、有良好的沟通表达、学习能⼒、抗压能力; 4、优秀应届生也可考虑，有互联⽹销售经验者优先考虑; 5、了解微信生态、公众号商城营销工具者优先考虑。成长建议：1、入职培训及时丰富，含产品行业知识、销售技巧和客户分类等，快速学习产品知识和销售技巧；2、老带新、师徒制，一对一的伙伴带你融入团队、陪访谈单等；3、积极拓客、尽可能得多接触客户了解需求；4、销售管理人员的管理和辅导；5、定期组织分享学习，从工作中沉淀，互帮互助。,移动互联网 电子商务,15-50人,产品,沈阳
出差专员,https://www.lagou.com/jobs/6961709.html,和平区,8k-12k,沈阳同建企业管理有限公司,不限,不限,包住，前期有老人带，公司氛围活泼向上,1.负责公司产品的销售及推广，提升市场占有率。2.制定自己的销售计划，服从上级的安排，并按时完成销售指标。3.挖掘、寻找意向新店并洽谈合作事宜。4.具有良好的团队合作精神。,"消费生活,企业服务",15-50人,产品,沈阳
客服,https://www.lagou.com/jobs/5874826.html,铁西区,3k-5k,沈阳青沐环保科技有限公司,1年以下,不限,"五险,女生提供住",售前岗位职责： 1、主要和买家沟通，给买家介绍产品，做好售前工作； 2、熟练运用公司产品，解答客户提问并落实问题；  3、与相关部门紧密配合，协调沟通；售后岗位职责：1、处理客户反馈的快递问题。2、处理顾客反馈的收到产品后发现的问题。3、处理顾客反馈的所有与产品相关的问题。4、处理顾客的退换货问题。5、做好顾客的挽回工作，妥善处理售后，尽量挽回顾客。,电商,150-500人,产品,沈阳
运营助理,https://www.lagou.com/jobs/5223704.html,铁西区,3k-5k,沈阳青沐环保科技有限公司,应届毕业生,大专,"五险,女生提供住",岗位职责：1、负责公司网络营销的策划、开发、运营、市场推广和销售工作。           2、依据公司营销策略和目标，策划组织品牌及产品的网络推广活动。           3、负责网络营销团队的建设和管理。          4、协助部门领导完成工作。任职要求：1.熟悉淘宝、京东、阿里、拼多多等平台环境。           2.有网店运营经验，1年以上。           3.熟悉多种推广方式。           4.沟通协调能力强。          5.市场营销经验多，营销策划能力强者优先录取。高薪诚聘、期待你的加入！,电商,150-500人,产品,沈阳
前端工程师,https://www.lagou.com/jobs/7117745.html,铁西区,9k-14k,神州数码融信软件有限公司,3-5年,本科,五险一金 年底双薪,"岗位职责：1、根据产品和UI设计要求，完成前端页面的切图和静态页面的开发工作。2、根据活动和产品的要求，完成页面动态效果的代码编写。3、解决产品和各类活动的平台适配和兼容性问题。岗位要求：1、3年以上前端开发经验2、能够手写基本的HTML/CSS/JS代码3、了解主流的JS框架，并精通其中的一项。4、对原生JS有一定研究的优先考虑。5.精通HTML5.jQuery，js,CSS等。6.掌握前端常用库，angular,react熟悉者优先，移动端页面开发经验者优先7.掌握网站的性能优化、SEO、UE、服务器端、兼容性、存在的bug等8.有良好的编码习惯。",金融,2000人以上,产品,沈阳
电话销售,https://www.lagou.com/jobs/7136200.html,大东区,4k-8k,沈阳法尔服饰有限公司,3-5年,不限,适合长久发展的行业！,岗位：电话销售专员。综合薪资4000-8000年龄18-35周岁有无经验均可，底薪3000+双提成＋奖金+13薪；岗位职责：1.向客户推广公司的产品与服务；2.负责接听客户热线，为客户讲解、推广产品；3.开发客户，根据客户条件匹配相符产品。薪资待遇：1）工作时间：早8:00晚17:00单休2）法定节假日带薪休假+带薪年假+节假日福利+定期组织团建；3）公平公正的竞聘制度，完善透明的晋升机制；4）职业前景：每个岗位都有明确的专业发展规划、公平的晋升机会和广阔的职业发展平台；（晋升职位----客户专员-团队经理-销售部经理-销售部总监）工作地址:大悦城B区东塔9楼联系人:经理,消费生活,15-50人,产品,沈阳
市场推广专员,https://www.lagou.com/jobs/6982174.html,沈河区,15k-25k,辽宁省叁禄舞蔬菜食品贸易有限公司,不限,不限,带薪培训，旅游，就近分配，节日福利，五险,负责维系客户，开发客户，销售公司旗下产品,其他,150-500人,产品,沈阳
诚聘销售代表+包住,https://www.lagou.com/jobs/7131783.html,沈河区,4k-6k,沈阳领展环保科技有限公司,不限,不限,免费提供住宿，缴纳五险一金，团队氛围好,环保已经是这个时代的主流，还在等什么，跟着国家的方向准是没错的，想要有发展空间的，那环保行业一定是不会错的。岗位职责：1、认真贯彻执行公司的管理规章制度，努力提升自己的销售水平。2、与客户保持良好沟通，实时了解客户需求。3、熟悉行业知识，企业知识和产品知识及掌握销售知识与技能。4、有责任心，没有任务量也可以做到不懈怠。5、负责产品的市场渠道开拓与销售工作，制定并完成自己的销售目标。（公司无任务量要求，需自己制定每天的任务标准）6、维护和开拓新的销售渠道和新客户，自主开发和拓展线上用户。7、学习并掌握市场的变化，了解客源市场布置的流量，注意市场结构的变化。公司福利：1、完全性免费的公寓型住所，距离近，提供基本生活用品（独立厨卫，冬有暖气，夏有空调，全自动洗衣机等）。2、提供应季水果，夏季提供冰镇饮料/水等。3、晋升空间大，晋升机制透明化，凭借个人管理以及业绩晋升。4、节假日均有团建活动（户外拓展、轰趴、KTV，应季游玩项目等）。5、专业一对一培训，免费国内外进修机会，还有机会直接进入总部学习。6、每年两次年会，国内外各一次，含国外带薪旅游7、丰厚的节日福利，专属的生日福利。8、此岗位对在校实习生、应届毕业生提供更加优厚的福利待遇及发展平台（国内外旅游带薪培训，转正后可签三方协议等）。任职资格：1、有经验、应届生和退伍军人优先。2、年龄要求在35周岁以下.3、具有良好的表达能力和沟通协调能力。4、具有良好的人际关系处理能力。5、具备良好的团队合作意识。6、有责任心，工作认真，善于表达。7、热爱销售工作，具备吃苦耐劳的精神。薪资/待遇：1、试用期底薪3000+高提成+奖金，转正后4000到8000底薪+高提成+绩效奖金+补助+福利+年终奖，新人综合薪资6000-12000元，后期综合薪资上不封顶。2、关怀性企业文化：带薪培训+五险一金+免费住宿+各项补助+周奖、月奖、季度奖、年终奖+节假日礼品+家人旅游等。3、无业绩任务量，压力小，多劳者多得。工作时间：上班时间上午8:00到下午6:00， 单休 法定假期休息。工作地址：沈河区友好街奉天银座A座A502,其他,50-150人,产品,沈阳
双休客服不加班（4k-7k）,https://www.lagou.com/jobs/7193114.html,铁西区,4k-7k,沈阳卡密数据服务有限公司,不限,不限,赚钱,工资内容：公司电话系统接听电话，给老客户介绍产品，如果需要，登记一下客户的联系方式就可以了薪资待遇：无责底薪3000+提成+工龄奖，平均工资5千左右工作时间：早9晚6准时下班，中午休息一个半小时（每天工作时间3，4小时左右）周末双休，法定休息！不要求通时通次，不加班，想赚钱的来！,通讯电子,50-150人,产品,沈阳
销售专员,https://www.lagou.com/jobs/7184235.html,沈河区,6k-12k,辽宁省老铁快动文化传媒有限公司,不限,不限,发展空间大 五险 节假日,工作内容：1.负责快手商家号招商，建立与企业客户的良好合作关系；2.开发和维护企业客户，完成公司下达的广告销售任务；3.熟悉产品特点和营销模式。任职要求：1.热爱销售工作，有销售工作经历优先；2.具备良好的沟通能力和谈判技巧，有较强的沟通能力和客户开发服务能力；3.能适应工作压力和敢于面对挑战。工资待遇:6k+奖金+五险上班时间:8.30－12.00 1.30－6.00周日单休 法定节假日休息,文化娱乐,50-150人,产品,沈阳
销售代表,https://www.lagou.com/jobs/7192117.html,铁西区,7k-14k,沈阳金羽商海支付科技有限公司,不限,不限,双休，不加班，五险，不需要坐班,职位描述：（类似卡员工作模式，拜访商户）1、主要负责维护与开发沈阳及沈阳周边市场。2、负责客户的开发、跟进及管理，并维护与其良好的商业关系；3、熟悉公司产品知识及推广流程，为客户提供最优质的产品及服务；4、贯彻执行部门的推广策略；5、服从经理安排。岗位要求：1、年龄20岁以上，为人正直踏实，责任心强。2、热爱推广行业，能吃苦耐劳，有团队精神。3、性格活泼开朗，沟通协调能力强，执行力佳，有较强的适应能力和学习能力。4、此岗位对优秀应往届毕业生开放。薪资待遇：底薪6000+提成+开机奖励 综合月薪8千-1万以上。福利待遇：1.一经录用，公司提供专业一对一的带薪培训。2.公司提供员工食堂。（工作环境舒适，临近商圈，交通便利。）3.公司定期举行内部活动，（销售PK，聚餐，KTV，户外烧烤，野外生存训练）4.正式员工享受带薪年假，法定节假日发放礼品。5.公平，公正，公开，透明化的晋升制度。,通讯电子,50-150人,产品,沈阳
新媒体运营,https://www.lagou.com/jobs/6989032.html,大东区,3k-6k,沈阳汇世信息技术有限公司,应届毕业生,不限,新颖 有前瞻性 面向企业级用户,致亲爱的你，首先我们沟通时请别问我最低能开多少钱，我不想招一个像公司最低工资看齐的人，虽然公司有保底底薪，但是销售都是靠业绩吃饭养家买口红买车买房子的，我希望你可以咨询销售**开多少钱，提成多少，有没有定期培训，虽然说销售需要一个过程，但是他是**一个可以凭实力说话来了就可以有业绩的工作。只要你脚踏实地阳光开朗，一定给你回报，适合长期发展。如果我们约定好见面时间请你务必守时赴约，哪怕不来也请提前告知，我也很忙请你体谅。沈阳汇世信息技术有限公司成立于2015年，是大连汇世信息技术有限公司在沈阳的第二家分公司，主要从事移动互联网项目，负责微信商业化的整体发展及布局，有微信商业化1、积极开拓市场，与客户建立良好的关系，维护客户关系，并达成销售； 2、主动联系客户，与其进行有效的沟通、了解客户反馈的意见和建议； 3、和客户面对面沟通，详细介绍公司产品； 4、按时完成销售任务。 任职要求： 1、大专及大专以上学历； 2、可接收应届毕业生; 3、普通话标准，有较强的沟通能力，语言表达能力强； 4、有责任感，具有团队协作精神， 有青春的朝气，有极强的进取心，有挑战高薪的勇气； 4、有面销经验，有互联网、金融、保险销售经验优先。                                                        薪资待遇： 1、薪酬：底薪（2200-3000）+高额提成+奖金（5000+上不封顶）  五险2、完善的培训=专业的带薪入职培训+实用的在职培训+系统的阶段培训； 我们采取以老带新，一对一全新领带转正模式，师徒之情伴随你整个职业生涯。3、人性的工时=国家法定假日休假+带薪年假+带薪婚/丧/病/产假/陪产假等；4、清晰的规划=以业绩为导向+简单融洽的职场氛围+公开透明畅通的晋升通道； 我们为每位员工提供清晰的职业规划，无论是成为销售的精英还是优秀的企业管理者。你能得到什么：1. 公平：同等的平台、同等的环境、同等的机会，不一样的是你自己的努力2. 公正：我们会用心去爱每一名同事，因为我们都是年轻人，有的都是共同的语言；3. 公开：晋升表彰公开透明，业绩，人品，二者缺一不可4. 你可以迅速与同龄人拉开差距，无论是能力的提升还是金钱的收入，我们可以让你的梦想从这里起飞。沈阳汇世信息技术有限公司成立于2015年，是大连汇世信息技术有限公司在沈阳的第二家分公司，主要从事移动互联网项目，负责微信商业化的整体发展及布局，有微信商业化微商户项目，微信商业化小程序项目，支付宝商业化项目，5G商业化项目。基于移动互联网，新媒体为当地的传统实体企业提供系统性线上、线下相结合的落地解决方案，帮助传统实体企业实现O2O的转型，并更好的结合现代互联网及腾讯大数据的应用。已服务过的企业有辽宁禾丰牧业有限公司，北方化妆品有限公司，爱美丽卡有限公司等辽宁诸多企业。总公司大连汇世信息技术有限公司成立于2010年，沈阳汇世腾达传媒有限公司成立于2013年，沈阳分公司自成立起就经中国企业家联合成长计划管委会严格审核并授权的“辽宁工作站”，负责推荐辽宁省的优秀企业代表参与入围“中国企业家联合成长计划”相关活动，涉及的业务包括：CCTV证券资讯频道《影响力对话》栏目，CCTV发现之旅频道《华商论见》栏目，CCTV证券资讯频道《大国商道》栏目高端访谈节目。现负责CCTV发现之旅频道《追溯》、CCTV老故事频道《匠心》纪录片栏目为“国家品牌计划”在东北地区进行选题工作。为当地企业提供***媒体平台展播、视频联盟媒体播放、授权荣誉、品牌入围、品牌推荐等较系统性的一站式的品牌提升解决方案，并全权负责与当地企业的接洽、跟进与后续的服务及支持工作。入围的公司有：四平宏宝莱饮品有限公司，本溪木兰花乳业，大连九州建设集团，本溪桓仁五女山旅游限公司，桓仁思帕蒂娜冰酒庄园，营口盛宇耐火材料有限公司等多家东北知名企业。,移动互联网,15-50人,产品,沈阳
销售专员,https://www.lagou.com/jobs/6981530.html,浑南区,10k-15k,沈阳麟龙科技股份有限公司,应届毕业生,大专,五险一金有食堂有宿舍奖励出国游,岗位职责：1.负责本公司服务产品在区域内或行业中的业务拓展；2.客户关系规划、拓展、管理；提高客户满意度，实现与客户双赢；3.协调公司内外资源，完成合同签订、合同执行监控；4.市场信息收集，包括行业、区域市场动态等。岗位要求：1.全日制统招本科及以上学历；2.2年以上互联网产品渠道销售经验，拥有安全领域销售经验者优先；3.有企业级用户的客户资源或服务于企业用户的代理商资源优先考虑；4.有渠道和项目销售经验者优先；5.具备较强的市场分析、营销、推广能力；6.良好的人际沟通、协调能力，分析和解决问题的能力；7.具备较强的责任心，具备较好的职业素质，较强的执行力；8.能够适应高效率的工作环境，承担较大的工作压力。,"移动互联网,金融",500-2000人,产品,沈阳
电话客服销售,https://www.lagou.com/jobs/7205717.html,沈河区,3k-6k,沈阳创联驿付电子商务有限公司,不限,本科,双休 无责底薪3000 五险 带薪年假,福利待遇：薪资无上限，只要你敢来，平台就敢让你完成梦想！！1.上班时间早九晚六，午休一个小时，周六周日双休，公司没有加班情况，假日按照国家法定休息。2.无责底薪3000，试用期3个月，试用期薪资按80%发放。3.薪资结构：无责底薪+电话补贴+奖金 每月平均薪资6000+4.公司为你缴纳五险、带薪年假、国家规定的各种节假日制度、婚嫁、产假等。5.每月业绩达标伙伴享受公司及团队丰厚奖励6.公司气氛比较活跃，气氛超级好，广阔的晋升空间。7.定期团建、节假日福利、晋升空间大、5A级办公地点8.不跑外，没有任务量的要求，没有通时的要求。工作内容：1.电话询问客户产品的使用情况，定期给客户更换我们的新产品，对客户的使用情况进行跟踪服务。2.负责公司老客户的维护等辅助性工作，解决客户提出的各种问题，提高客户满意度。3.统计每日工作数据，进行数据分析，不断提升工作效率。岗位要求：1.口齿清晰，普通话流利，语言富有感染力。2.学习转化能力强，能快速学习，学以致用，持续提升个人能力。3.工作态度端正，自信自律，严谨认真，有良好的团队合作能力。4.性格坚韧，思维敏捷，具有良好的应变能力和抗压能力。5.有敏锐的市场洞察力，有强烈的事业心、责任心和积极的工作态度。,金融,500-2000人,产品,沈阳
婚恋顾问,https://www.lagou.com/jobs/6354431.html,浑南区,3k-5k,沈阳金柏诚文化传媒有限公司,1年以下,不限,无需打卡，社交类工作，发展空间大,工作内容：1、沟通单身用户的需求并匹配相应（销售vip会员，匹配约见，线下活动等）服务产品，然后邀约客户到店，到店后进行婚恋产品的销售2、通过公司现有渠道和用户资源完成增长和转化；开发新渠道拓展新用户，并促进用户消费3、根据单身用户的不同需求，提供对应的服务并不断提升付费职位要求：1.了解微信生态，能够熟练操作微信，并且具备销售相关经验优先；2.有较强的沟通表达能力，普通话标准，理解能力强；3.有毅力，能坚持，抗压能力强，注重细节；4.要热爱婚恋行业，工作细心有耐心，选对团队很重要，期待你的加入；工作时间：965，节假日正常休息，不加班我们目前在做的是一个以微信生态为核心的城市单身交友的服务产品，致力于打造高效真实的婚恋交友模式和体系，想要投身到情感交友工作的小伙伴请投递简历,"移动互联网,文娱丨内容",少于15人,产品,沈阳
销售助理,https://www.lagou.com/jobs/6745706.html,浑南区,3k-5k,沈阳金柏诚文化传媒有限公司,不限,不限,不打卡，工作有趣，发展空间大，人性化管理,技能要求：电销，地推销售，店员销售，会销，面销，网销工作内容：1、谈客户加入vip会员，宣传服务进行到店邀约，到店后在进行婚恋产品的销售。了解用户的需求，邀约到店在谈单过程中要随时注意语言规范，要给到对方对于我们产品和服务的信心2、通过公司现有渠道和用户资源完成增长和转化；开发新渠道拓展新用户，并促进用户消费3、根据单身用户的不同需求，提供对应的服务并不断提升付费任职要求：1.了解微信生态，能够熟练操作微信所有相关功能；具备销售工作经验优先；2.能够处理好人际关系，知道如何提供个性化的服务，知道如何将自己的优势更快捷地展现给客户到最后签约。3.有毅力，能坚持，抗压能力强，注重细节；4.要热爱婚恋行业，工作细心有耐心，选对团队很重要，期待你的加入；工作时间：早10晚6，周休一天。国家法定节假日正常休息，不加班；,"移动互联网,文娱丨内容",少于15人,产品,沈阳
