job_name,job_url,job_location,job_salary,job_company,job_experience,job_class,job_given,job_detail,company_type,company_person,search_key,city
PHP开发工程师,https://www.lagou.com/jobs/5836289.html,浦东新区,6k-8k,上海米开罗那机电技术有限公司,1年以下,本科,"包食宿,节假日福利,员工旅游,成长空间高",工作职责： 1. 参与公司物联网项目，按要求参与智能项目研究，进行web后台开发及数据处理；2. 参与智能项目的部分实施工作，负责产品的现场搭建、调试及验收工作；3. 负责企业信息化项目中的部分开发工作，参与公司web、app等互联网产品的测试与维护。4. 参与产品上线前的测试、bug修复及升级，撰写开发文档及项目报告；5. 参与产品开发前的技术调研，独立完成产品的基础功能模块开发；6. 协助部门主管处理项目日常业务。岗位要求： 1. 本科以上学历，工作经验1年以上。也欢迎优秀的应届生；2. 计算机、互联网软件、电子通信、自动化控制等相关专业；3. 熟悉PHP开发，能熟练使用常见的PHP框架，对web应用有较好的认识，了解Python及数据处理的基础知识；4. 掌握WEB前端的基础知识，能独立完成简单的前端开发；5. 熟悉数据库（SQL）的基础知识，至少掌握一种数据库工具的使用；6. 熟悉网络HTTP协议、Websocket、XML、JSON等，有JS、JavaScript基础、HTML5基础者优先；7. 对智能控制开发有兴趣者优先，熟悉网络基础架构及网络常识者优先，有软件项目开发经验者优先；8. 熟悉并热爱软件设计和编码工作，有独立解决问题能力者优先；要求有很强的学习能力，能吃苦耐劳，抗压能力强，有优秀的沟通及文字表达能力，集体观念强，合作精神好。该职位属公司提供的物联网创业项目，给予充分的才能发挥空间，只要你足够有热情、足够有自信，那么，欢迎你加入我们！,"其他,消费生活",150-500人,php,上海
PHP开发经理,https://www.lagou.com/jobs/7083411.html,黄浦区,15k-25k,数说新奇信息技术（上海）有限公司,3-5年,本科,五险一金 补充医疗 员工旅游 年终奖金,"岗位职责:1、负责公司电商产品核心系统的开发和维护工作；2、制定项目的技术方案，参与核心代码编写，并能够指导开发人员高效完成项目任务；3、制定开发计划，协调需求部门和开发人员，合理分配资源并高效完成项目任务；4、参与产品相关的客户需求和问题方案的讨论、设计与代码审查；5、制定开发流程和编码规范；6、有效激励团队成员向阶段性目标冲刺。任职资格:1、统招本科计算机相关专业，5年以上开发经验，1年以上团队管理经验；2、精通PHP+MYSQL编程，熟练使用Yii,thinkphp、laravel等框架之一；3、熟练应用HTML5，Ajax，JavaScript，css3，xml,jquery等前端技术；4、熟练使用Linux/Unix操作系统；5、熟练常见的缓存技术，如memcache/mongodb/redis；6、熟悉高并发、高可用的系统设计，对分布式系统架构设计有独到见解并能提出优化方案；7、具有良好的编程风格和习惯，处处考虑代码效率，良好的异常处理能力，能够遵循规范并和伙伴分享；8、具有团队精神和敬业精神，具有良好的自学能力和独立解决问题的能力。","移动互联网,广告营销",15-50人,php,上海
服务端开发工程师（PHP/Java）,https://www.lagou.com/jobs/7152988.html,闵行区,15k-20k,上海葡萄纬度科技有限公司,5-10年,本科,快速发展期,岗位职责： 1、参与制定设计及开发规范，完成设计、开发、测试及发布上线工作； 2、系统性能优化，保证系统的安全、稳定、快速运行 ；3、维护和升级现有软件产品 ；4、参与公司底层技术的开发与维护。岗位要求： 1.精通 DLang / C# / Java / PHP 任意语言编程；  2.掌握 lldb / gdb 调试的基本技巧；  3.掌握以下至少一种 Web 通用框架如 Symfony / Laravel / Spring framework；  4.熟练使用Linux / FreeBSD 操作系统下的开发环境；  5.掌握JavaScript的常规使用；  6.思路敏捷，具有良好的分析能力和沟通能力，责任心强；  7.良好的技术方案撰写能力。,移动互联网,500-2000人,php,上海
PHP后端工程师,https://www.lagou.com/jobs/5447986.html,普陀区,10k-15k,上海极光网络科技有限公司,3-5年,本科,五险一金、项目奖金、带薪年假、节日福利,岗位职责：1、负责游戏运营平台、广告分析等后台系统的开发。2、负责用户中心、充值中心、礼包中心等系统的设计与实现。3、负责游戏官网、论坛的维护开发。4、参与后端基础服务的架构、实现。任职要求：1、本科及以上学历，计算机相关专业者优先；2、有以PHP为主的开发及维护项目工作经验；3、熟悉一到两种常用PHP框架（laravel、CI、Zend Framework、ThinkPHP、Yaf等）；4、熟悉MySQL数据库，对数据库的基本理论及其内部实现机制有一定的理解5、熟悉Linux/Unix，有相关开发经验；6、熟悉memcache、redis缓存系统，对服务器端程序的部署、架构、调优有一定的了解；7、有强烈的上进心和求知欲，善于学习新事物；8、有很强的发现问题、分析问题和解决问题的能力；9、善于沟通和逻辑表达，良好的团队合作精神和积极主动的沟通。,游戏,150-500人,php,上海
php开发工程师,https://www.lagou.com/jobs/6605261.html,徐汇区,10k-20k,上海邮康企业管理有限公司,1-3年,本科,双休、不加班、带薪年休假、五险一金,"岗位职责：* 开发和维护快来掌柜APP的服务端API和管理员后台。 任职要求：1. 大学统招本科或以上学历2. 掌握基本的计算机科学知识3. 熟悉PHP的MVC框架，如Laravel, Symfony 等4. 熟悉Mysql, Redis, Apache5. 熟悉Linux环境下的开发和部署6. 对网络安全和加密算法有一定的了解7. 熟悉git或svn8. 熟悉Html, JavaScript和css","电商,消费生活",50-150人,php,上海
php开发工程师,https://www.lagou.com/jobs/7200964.html,浦东新区,20k-35k,上海睿若食品有限公司,5-10年,本科,发展前景好,工作职责:1、负责移动APP相关的服务端程序设计和开发2、负责线上系统的bug修复及维护3、参与项目的需求评审，编写项目文档等，并根据开发规范保障开发质量任职资格:1、本科及以上学历，5年左右PHP开发经验，具备前端开发经验者优先；2、精通LAMP开发，掌握linux的基本操作，负责过大型网站的核心开发者优先；3、精通Mysql、Redis、MongoDB等数据库，熟悉分布式缓存技术，并有相关的风险控制经验及优化经验； 4、熟练掌握开发及版本控制工具，具备出色的程序优化、调试能力，良好的编程风格和文档习惯； 5、喜欢钻研技术，具有较强的分析和解决问题的能力，具有精益求精的钻研精神,"移动互联网,企业服务",50-150人,php,上海
PHP高级工程师,https://www.lagou.com/jobs/6807125.html,青浦区,15k-25k,上海答派体育文化发展有限公司,3-5年,大专,晋升空间大、优秀团队、节日福利、做五休二,"1.负责产品接口模块的开发、功能模块的升级和维护2.根据产品设计进行软件项目的设计与开发，独立完成一些核心模块的设计与编码工作；3.负责系统后台数据库的设计与调优以及数据安全工作；4.负责技术方案决策、解决技术难题、防范和化解技术风险；5.保障系统安全和稳定运行。任职要求：1.精通掌握PHP框架Yii22.至少2个Yii2项目参与经验3.4年以上相关工作经验，有互联网行业/电子商务行业从业经验者优先；4.精通PHP语言，熟悉java, python, go的应聘者优先；5.熟悉系统设计架构，精通分布式系统以及缓存技术， 有大流量网站设计开发经验者优先；6.具有良好的编程风格，有多层结构软件的开发经验；7.沟通能力强，有良好的团队合作精神；8.有基本英语读写能力者优先。","移动互联网,游戏",50-150人,php,上海
PHP开发工程师（电商）(J10533),https://www.lagou.com/jobs/7082047.html,浦东新区,20k-35k,上海壹佰米网络科技有限公司,3-5年,本科,互联网电商/五险一金/补充医疗/下午茶,,消费生活,2000人以上,php,上海
PHP高级工程师,https://www.lagou.com/jobs/7139180.html,闵行区,15k-30k,上海极贝网络科技有限公司,5-10年,本科,做五休二 薪资待遇,1.  3年以上PHP开发经验，熟悉LNMP环境。2.  熟悉Laravel框架。3.  能独立设计高并发架构，能独立分析解决服务器性能问题。4.  熟悉hadoop优先，有数据分析工作经验优先。5.  能接受挑战并承受工作压力，接受适当的加班6.  有游戏后台开发经验优先。7.  熟悉Python脚本优先,游戏,15-50人,php,上海
PHP高级开发工程师,https://www.lagou.com/jobs/6948948.html,青浦区,18k-28k,上海答派体育文化发展有限公司,3-5年,大专,晋升空间大、优秀团队、节日福利、做五休二,"1.负责产品接口模块的开发、功能模块的升级和维护2.根据产品设计进行软件项目的设计与开发，独立完成一些核心模块的设计与编码工作；3.负责系统后台数据库的设计与调优以及数据安全工作；4.负责技术方案决策、解决技术难题、防范和化解技术风险；5.保障系统安全和稳定运行。任职要求：1.熟练掌握两种PHP开发框架，熟悉yii2和swoole以及基于swoole框架的优先 （hyperf、swoft）2.必须有Yii2和swoole项目参与经验3.4年以上相关工作经验，有互联网行业/电子商务行业从业经验者优先；4.精通PHP语言，熟悉java，.net, python, go的应聘者优先；5.熟悉系统设计架构，精通分布式系统以及缓存技术， 有大流量网站设计开发经验者优先；6.具有良好的编程风格，有多层结构软件的开发经验；7.沟通能力强，有良好的团队合作精神；8.有基本英语读写能力者优先。","移动互联网,游戏",50-150人,php,上海
应届生PHP开发工程师,https://www.lagou.com/jobs/5303084.html,嘉定区,4k-6k,上海意玛软件有限公司,应届毕业生,不限,"员工活动,公司聚餐,核心技术,GIS","按照公司软件工程规范和编程规范，参与或独立完成公司电子海图等GIS产品及其他互联网产品, 参与从需求分析，概要设计，详细设计和编码等各个开发流程的设计工作。主要负责PHP/Java等后端开发。不要求相关技能经验，要求学习能力强，公司会提供相应培训。要求：1、对软件开发有浓厚的兴趣，逻辑思维强，数学功底好；2、工作耐心细致，责任心强，学习能力强；3、良好的沟通能力和团队合作精神；4、本科及以上学历，软件相关专业毕业优先；5、本岗位针对2019年毕业生。待遇：    起视工作经验面议，另有每半年加薪机会、年终奖、分红等奖励。    优秀员工更有期权配股机会，随着公司的壮大乃至最终上市，你有机会与我们一起分享巨大财富回报, 期待你的加入!","移动互联网,电商",15-50人,php,上海
实习生PHP开发工程师,https://www.lagou.com/jobs/4844873.html,嘉定区,3k-4k,上海意玛软件有限公司,应届毕业生,本科,"员工活动,职业培训,公司聚餐","按照公司软件工程规范和编程规范，参与或独立完成公司电子海图等GIS产品及其他互联网产品, 参与从需求分析，概要设计，详细设计和编码等各个开发流程的设计工作。主要负责开发PHP/Java等后端开发。不要求相关技能经验，要求学习能力强，公司会提供相应培训。要求：1、对软件开发有浓厚的兴趣，逻辑思维强，数学功底好；2、工作耐心细致，责任心强，学习能力强；3、良好的沟通能力和团队合作精神；4、本科及以上学历，软件相关专业毕业优先；5、本岗位针对2019年毕业生。","移动互联网,电商",15-50人,php,上海
PHP开发工程师 (Magento开发）,https://www.lagou.com/jobs/5495782.html,浦东新区,15k-30k,上海孚达礼品有限公司,3-5年,本科,拒绝996 技术负责人,"上海孚达礼品是美国个性化礼品定制电商Crystal Central LLC的上海分部。我们以C2B（Cosumer to Business）的创新模式，以贴合用户需求的产品设计和一流的服务，赢得了北美广大客户（包括公司、军队、教堂、老师等）的喜爱。公司成立10余年来，一直坚持稳步发展的模式，因此拥有良好的现金流，不需要融资（没有其他创业公司的疯狂加班和随时倒闭的风险，不需要受投资人摆布）。公司目前运营2个品牌，在美国第三方评价平台上的客户满意度都超过99%，在该分类下排名**和第二。为了契合公司业务的进一步发展、打造下一代定制化电商系统，现招聘资深PHP开发工程师若干，要求如下：岗位职责：
 公司现有系统平台的维护与开发；
 新电商系统的升级与开发；
 老系统与新系统的数据迁移；
 内部系统（订单、生产、物流等）的开发与维护
任职要求：
 本科及以上学历，精通PHP，3年以上PHP项目开发经验；
 熟悉Magento 2模块与主题开发；
 英语良好，能够阅读国外相关技术文档；
 掌握基本的前端知识html/css/js",电商,15-50人,php,上海
高级PHP开发工程师（识货）,https://www.lagou.com/jobs/4759370.html,杨浦区,25k-35k,虎扑（上海）文化传播股份有限公司,3-5年,本科,"快速发展,团队靠谱,大平台","岗位职责：1、负责公司PHP相关产品或项目的技术架构设计、重构、优化，根据业务规划及技术规划制定应用架构方案。2、负责项目或产品的系统的架构设计和系统设计、详细设计，研究引入新的技术、方法和编程思想。3、主导技术难题攻关，持续提升核心系统在高并发、海量请求数下的高处理性能。4、核心功能的架构与代码模板编写，开发与维护系统公用核心模块，建立和维护代码质量标准以及bug管理，保证代码的执行效率。5、审核和评估相关方案与设计，以确保其符合架构规划，满足业务需求。6、分析系统瓶颈，解决各种疑难杂症，对系统进行性能调优。任职要求：1、本科及以上学历，5年以PHP开发经验或java开发经验，知名互联网公司背景。2、精通PHP, MySQL, Linux, Apache/Nginx的开发熟悉PHP模板技术或框架技术。3、掌握Linux操作系统php环境配置的各种优化方案，掌握网站访问速度的各种优化方案。4、熟练掌握Mysql索引优化、查询优化和存储优化、缓存、静态化等技术。5、有运用memcache，redis,Mysql,elasticsearch 开发以及大流量网站构架与编码经验者优先。","移动互联网,文娱丨内容",500-2000人,php,上海
PHP开发工程师 (MJ000128),https://www.lagou.com/jobs/6809442.html,虹口区,15k-21k,虎扑（上海）文化传播股份有限公司,3-5年,大专,发展前景、福利待遇好,岗位职责：1）负责内部平台的搭建开发工作；2）参与虎扑App数据、赛事、社区功能开发及维护；3）撰写设计文档、接口文档岗位要求：1）本科及以上学历，计算机相关专业，具有3-5年以上Web/PHP服务端开发经验2）使用过swoole、laravel、yii等开发框架3）了解消息中间件（RocketMQ、RabbitMQ、Kafaka等一种或多种）的应用；4）具有较强的学习能力、抗压能力，具备一定的分析问题、解决问题的能力,"移动互联网,文娱丨内容",500-2000人,php,上海
百度地图PHP研发工程师,https://www.lagou.com/jobs/7198562.html,浦东新区,15k-25k,北京长地万方科技有限公司,3-5年,本科,年终奖、晋升空间,工作内容：负责地图数据自动化生产平台系统设计开发；负责业务流程引擎设计开发；负责大数据的存储系统设计开发；负责数据生产的自动监控和预警系统设计开发；负责大数据的统计报表及图表的开发；任职资格：-本科及以上学历-2年以上以PHP为主的中型或大型互联网产品软件的开发及维护工作经验-精通PHP开发工作，熟练LAMP开发，熟悉Linux-精通mysql、redis、postgres 任意一种数据库使用-熟悉至少一种php开发框架，熟悉主流开发框架，有YII开发经验者优先-熟悉Shell、JavaScript、Python者，有相关经验者优先-熟悉常用Web服务器（Apache/Lighttpd/Nginx）的配置、运维者，有相关经验者优先-熟悉工作流技术理论和方法及有工作流设计开发经验者优先-有GIS相关知识背景的优先,"数据服务,移动互联网",2000人以上,php,上海
PHP实习生,https://www.lagou.com/jobs/5807810.html,浦东新区,3k-6k,湖南快拍科技有限公司,应届毕业生,本科,灵活用工 按量付薪,公司决定将业务系统中部分双非模块（非核心非紧急）通过远程兼职实习的方式实现。一旦通过面试可长期合作。职位申请条件：1、熟悉 LAMP 架构2、熟练使用 Git 进行协同开发3、熟悉微信服务号以及小程序的开发4、熟练使用 Swoole 开发 TCP 通信服务器职位申请流程：1、具备上述技能的小伙伴需要完成在线 “技术认证”，微信搜索公众号 “码农印记”，关注后请参考菜单栏中的相关内容完成相关技术认证。2、完成技术认证后，方可获得面试机会。,"移动互联网,社交",少于15人,php,上海
php开发工程师,https://www.lagou.com/jobs/6722126.html,杨浦区,20k-30k,上海时代天使医疗器械有限公司,3-5年,本科,工作弹性，待遇优厚，发展空间大,"职位概要负责公司各系统的维护和二次开发任务工作职责1、基于SugarCRM平台的CRM系统功能开发和维护 2、基于微信企业号、公众号的相关系统开发和维护 3、根据项目需要参与需求分析和功能设计 4、进行系统的设计、编码、测试、维护和系统性能优化任职资格1、3-5年PHP开发经验，有很强的代码能力和工程能力，熟悉网络编程,有过相对复杂的产品开发经验2、熟悉web service(soap及REST)开发3、扎实的PHP功底，精通基于PHP的Web应用开发4、熟悉至少一种主流WEB服务器及应用服务器（Apache 、Nginx 、Tomcat等）的使用5、熟悉ThinkPHP框架6、了解Html5、JavaScript, Ajax7、思路清晰，了解常用的算法8、有团队合作经验优先9、熟悉SugarCRM开发者优先","电商,医疗丨健康",500-2000人,php,上海
资深/高级PHP游戏服务端开发,https://www.lagou.com/jobs/6774982.html,浦东新区,20k-35k,网易（杭州）网络有限公司,5-10年,本科,五险一金 商业保险 年底双薪 交通补贴,工作职责：1.      参与游戏项目的服务器端开发工作；2.      配合客户端的业务开发、测试和发布；3.      保障服务器性能和稳定性。任职要求：1.      计算机或相关专业的本科及以上学历，5年及以上开发经验；2.      拥有至少一款完整的上线手游产品的服务器开发经验，并在其中担任服务器主要岗位；3.      精通PHP，熟悉C#和JAVA等语言；4.      熟悉对服务器环境的配置，搭建；熟悉多线程、数据库、网络等专业技术；5.      具有强烈的责任心和充分的主动性，能够积极主动的推进项目的进展；6.      具有良好的沟通能力和团队合作能力。,电商,2000人以上,php,上海
PHP/GO开发工程师,https://www.lagou.com/jobs/6726694.html,长宁区,18k-25k,旅购（上海）信息科技有限公司,3-5年,大专,垂直行业独角兽,"岗位职责：1、在产品经理的指导下及时的完成项目开发工作；2、开发微信公众号/小程序、App接口及其后台,编写与维护以及文档的整理；3、负责项目的日常维护,功能的完善和二次开发；4、负责数据库的应用开发与管理维护，协调数据库设计，保证符合数据库设计规范和性能需求；我们希望你：1.1年及以上PHP开发经验，电商、App、公众号相关开发经验者优先;2.熟悉常见的PHP设计模式,熟练使用Laravel框架;3.良好的数据库设计和优化能力，熟悉 MySQL;4.对vue/react/小程序开发有一些了解5.良好的团队沟通和协作能力，熟练的运用Git;6.对Go有一定基础, 愿意后期逐步转型工作时间10：00 - 18：30(工作日)","旅游,移动互联网",15-50人,php,上海
php开发工程师,https://www.lagou.com/jobs/7198834.html,浦东新区,12k-16k,上海妃鱼网络科技有限公司,3-5年,本科,弹性工作 餐饮补贴 员工旅游,职责/任务：1、负责公司产品后台应用服务架构设计及开发；2、负责对系统的性能和可靠性调优，提供合适的技术解决方案，持续跟进产品需求问题确保问题解决；3、参与相关产品需求讨论与产品系统架构的设计和优化工作；4、负责系统文档编写，并对通用技术进行整理，提高技术复用。岗位要求：1、计算机或相关专业，本科以上学历；2、三年及以上PHP开发经验；3、精通至少一种主流的PHP 框架，熟悉TP者优先；4、工作自主驱动，具备良好的问题定位分析能力；5、工作认真责任心强，良好的沟通理解能力，具有团队协作能力和创新精神。我们将提供：1、独角兽的成长机会；2、高于行业的薪水和奖金；3、自由平等的互联网工作气氛和文化，无边界探索未知尝试创新；4、每天免费的下午茶、晚餐；5、每年12次团建 2次集体旅游；6、交通便利的工作地点：浦东张江盛大天地源创谷。我们希望你：保持好奇心和探索精神；充满激情拒绝平庸；有以结果为导向的做事风格。,"移动互联网,电商",150-500人,php,上海
PHP,https://www.lagou.com/jobs/233753.html,浦东新区,15k-30k,上海掌韵网络科技有限公司,3-5年,本科,"硅谷氛围,加入实现经济时间心灵三大自由！","岗位职责：1、负责公司产品核心后台模块的开发与维护，以及新模块的设计开发；2、负责公司网站的开发与维护；3、负责相关开发文档的整理与编写4、有全栈经验优先职位要求：1、本科及以上学历；2、精通后台编程语言，如php, python, ruby等3、熟悉MySQL数据库，具有MySQL优化能力4、良好的英文读写能力，能熟练用英文与人进行文字交流；5、良好的沟通能力，能快速理解设计、开发需求；6、对新技术有强烈的探索欲望，责任心强；7、熟悉主流CMS、国际主流论坛(vBulletin、phpBB、SMF、IPBoard、XenForo等）系统者优先；8、熟悉使用Javascript、Ajax，Html，Div+CSS等技术者优先；9、对LNMP/LAMP架构的部署、搭建、优化、排错等方面有经验者优先工作时间：周一~周五10：00-18：30工作地点：浦东张江","移动互联网,社交",15-50人,php,上海
php开发主管,https://www.lagou.com/jobs/7207360.html,长宁区,25k-40k,上海格罗夫信息科技有限公司,3-5年,不限,出海前景 多次调薪 丰厚奖金 包吃,1.负责业务线整体技术方案把控2.负责业务技术方案落地和codereview3.解决业务线效率和质量问题4.业务线技术梯队建立和人员培养管理带3-5人开发团队,电商,500-2000人,php,上海
php开发工程师,https://www.lagou.com/jobs/6886273.html,徐汇区,15k-20k,东方明珠新媒体股份有限公司,3-5年,本科,国有上市公司 互联网传媒头部公司,"此岗位为东方明珠新媒体旗下上海东方龙新媒体有限公司招聘岗位岗位职责1.      负责公司基于PHP的系统开发及架构；2.      能独立完成系统模块或系统的设计和代码的实现；3.      负责解决开发过程中的技术问题。任职资格1.      全日制本科及以上学历，计算机相关专业，3年以上相关开发经验2.      精通PHP+MYSQL编程，熟练使用Thinkphp, laravel, CI, Yii等常用框架3.      熟练应用HTML5，Ajax，JavaScript，css3，xml, jquery等前端技术4.      熟练使用Linux/Unix/Nginx/Apache5.      熟悉高并发、高可用的系统设计，对分布式系统架构设计有独到见解并能提出优化方案6.      了解或使用过诸如Java, Python, Ruby, Go等其他开发语言者优先",文娱丨内容,500-2000人,php,上海
PHP程序员,https://www.lagou.com/jobs/4982524.html,长宁区,8k-10k,齐著云科技（上海）有限公司,1-3年,大专,"带薪年假,五险一金,餐饮补贴",工作职责：1、负责公司产品的设计和开发。岗位要求：1、计算机相关专业，1-2年PHP开发工作，有平台开发经验优先；2、熟悉PHP主流开发框架和LAMP/LNMP框架；3、熟练掌握mysql等数据库应用、能够运用高效的sql语句，优化表、优化sql语句的能力；4、熟练掌握php开发语言，以及开发技巧；5、熟练掌握html、css、js等一些常用脚本，熟悉xml的应用。,"移动互联网,消费生活",15-50人,php,上海
高级PHP开发工程师（营销方向）(J10384),https://www.lagou.com/jobs/6769365.html,浦东新区,15k-30k,银联商务股份有限公司,1-3年,本科,绩效奖金，国企福利,,"电商,金融",2000人以上,php,上海
