job_name,job_url,job_location,job_salary,job_company,job_experience,job_class,job_given,job_detail,company_type,company_person,search_key,city
有品电商-高级数据仓库产品经理,https://www.lagou.com/jobs/7183499.html,海淀区,10k-20k,北京小米科技有限责任公司,1-3年,本科,七险一金、餐补、子女福利、大厂平台等,工作职责：1. 负责小米有品数据产品的探索，完成业务线数据产品的设计和项目推进；2. 制定产品线的规划和阶段性目标，产出PRD和原型设计。3. 负责有品业务埋点体系的建设；4. 组织跨团队协作，协调开发、设计、数据等各方资源，保证项目如期上线； 5. 制定产品运营策略，负责产品上线推广，持续改善产品功能和用户体验。职位要求：1. 计算机、数学、统计学相关专业，本科及以上学历；2. 熟练掌握SQL，熟悉Hive、MySql数据库或者其他主流数据库；3. 熟练使用office 、Axure等工具；4. 有良好的逻辑思维能力、较强的数据敏感度；5. 工作负责，具备较强的沟通交流与团队合作能力 ；6. 有新零售行业数据产品及埋点相关经验者优先。,硬件,2000人以上,数据仓库,北京
DBA运维工程师（Mysql与非关系数据库）,https://www.lagou.com/jobs/6917139.html,朝阳区,16k-30k,狮桥融资租赁（中国）有限公司,3-5年,本科,五险一金，免费水果，团队建设,【职位描述】1、数据库巡检、监控、数据故障排查并解决2、数据库灾备（灾备策略、备份及恢复、优化数据库性能）3、数据库权限管理、数据库资源分配4、数据结构管理、数据库方案设计及部署【任职要求】1、三年以上互联网或金融行业DB 运维经验。2、熟练MongoDB或hbase数据库的运行机制和体系架构3、熟悉数据库设计，优秀的SQL编写及数据库问题定位和调优能力4、熟悉MySQL或sqlserver、tidb数据库的运行机制和体系架构5、熟悉Linux操作系统，具备良好的Shell/Pell编程能力6、高可用数据库架构设计,"金融,物流丨运输",2000人以上,数据仓库,北京
DBA数据库管理,https://www.lagou.com/jobs/7113280.html,朝阳区,20k-40k,安讯达盛（北京）科技有限公司,1-3年,本科,五险一金、免费用餐、股权激励、年终分红,岗位职责：1、负责数据库的日常操作、安装、配置、监控、负载均衡、实时备份、灾难恢复和管理；2、负责制定数据库建设设计及优化方案；3、为应用开发、系统优化等提供技术支持。任职要求：1、计算机相关专业全日制本科以上学历；2、2年以上数据库专职维护经验；3、熟练完成与数据库相关的基本操作；4、精通常见数据库的运行机制，熟练进行数据库的日常管理；5、有较强的性能优化、备份与恢复及故障解除的处理能力；6、熟悉数据库安全管理规范；7、熟悉HIS等系统者优先。,移动互联网 医疗健康,15-50人,数据仓库,北京
高级数据仓库工程师,https://www.lagou.com/jobs/6165289.html,东城区,20k-40k,北京影谱科技股份有限公司,5-10年,本科,七险一金，国内外团建,职位描述：1、负责数据仓库产品及应用服务架构设计及研发；；2、负责数据仓库建模、调度系统的设计和开发指导；3、负责数据仓库ETL流程的优化及解决ETL相关技术问题；4、参与数据产品设计和评审，保障数据平台架构稳定；5、为日常运营活动提供数据支持，并且在一定程度上给予评估和建议；任职要求：1、从事数据仓库领域工作至少3年以上，熟悉数据仓库模型设计方法论，有分布式数据存储与计算平台应用开发经验 2、熟悉Hadoop生态相关技术并有相关开发经验，精通SQL开发及SQL性能调优3、熟悉Shell、JAVA、Python等至少一门语言，具有Spark/Flink/Storm开发经验者尤佳4、对公共数仓、数据权限、业务间访问有着丰富经验5、有行为数据建模、标签系统数据开发工作经验者优先。6、掌握机器学习算法是加分项。,"文娱丨内容,广告营销",50-150人,数据仓库,北京
数据库顾问/DBA,https://www.lagou.com/jobs/6098428.html,朝阳区,13k-25k,北京新数科技有限公司,3-5年,本科,创新，发展空间，期权,"工作职责：1. 负责数据库和数据库管理平台建设等项目交付工作，配合相关售前工作；2. 支持数据库云服务支持项目，包括故障解决、架构设计、调优等；3. 配合研发部门进行新产品需求调研和功能验证工作；4. 深入理解数据库软件市场，参与相关销售、市场推广和竞争调研工作。 工作地点：北京,深圳,上海 职位要求：1. 计算机相关专业，本科以上学历，2-3年以上数据库管理（DBA）或开发经验；2. 熟悉Oracle/Db2/MySQL/HANA等任一数据库软件产品，或有相关云计算、大数据、自动化运维、系统管理等领域工作经验；3. 熟悉Unix或Linux的基本命令和操作，熟悉SQL语言；4. 能接受出差，适应客户现场工作，有技术咨询、售前或项目管理经验者优先；5. 拥有良好的沟通表达能力和服务意识，有较强的团队合作意识；6. 有技术钻研精神，对数据库新技术和新领域有探索精神",企业服务,50-150人,数据仓库,北京
数据库工程师,https://www.lagou.com/jobs/7092235.html,海淀区,10k-20k,北京国都互联科技有限公司,3-5年,本科,福利待遇好，有发展前景,岗位职责：1. 负责数据库的安装、管理维护、监控和性能优化；2. 保证数据库的正常稳定运行； 3. 对数据库账号申请进行审核、权限分配以及对数据库账号操作行为进行监督； 4. 及时定位和排除数据库故障； 岗位要求： 1. 2年以上主流数据库管理经验； 2. 熟悉并能独立进行主流数据库的集群搭建及管理； 3. 熟悉shellperl编程，能使用脚本编写工具提升工作效率； 4. 能够对Linux平台服务器进行管理和维护工作； 5. 熟悉数据库权限梳理、划分，能够对数据库账号进行库表权限分配； 6. 良好的团队协作能力，积极主动，乐于接受挑战，能应对突发应急情况。,移动互联网,50-150人,数据仓库,北京
DBA数据库管理员,https://www.lagou.com/jobs/7076155.html,海淀区,10k-20k,北京简单科技有限公司,1-3年,本科,周末双休 地铁周边 节日福利,"岗位职责：负责生产环境Mysql数据库系统高可用、高性能架构方案、数据库扩展方案;负责MongoDB,Redis等NoSql数据库系统的设计、管理和维护;协助研发人员完成MySQL数据库的表结构、索引和SQL语句的优化;配合研发制定数据库技术方案，分库分表策略，数据迁移方案，以及相关业务的设计评审、SQL代码审核等；对数据库中间件产品的定期巡检、性能优化、隐患消除、故障分析解决等;为公司内部研发人员提供必要的咨询和相关培训; 任职要求：计算机及相关专业，2年以上 MySQL 实际工作经验；熟悉MySQL数据库设计、管理与优化、运行机制和体系结构；具有数据库应用安全经验，能独立规划、实施备份和恢复策略；精通MySQL复制，实时备份、负载均衡等处理技术，精通数据库核心参数设置和调整；熟练分析MySQL语句性能，精通MySQL索引、分表等优化措施的设计和实施；熟悉Linux操作系统，有python/shell/go 一种或多种脚本语言编程能力者优先；","移动互联网,教育",500-2000人,数据仓库,北京
数据库架构师,https://www.lagou.com/jobs/3370434.html,朝阳区,25k-50k,北京人大金仓信息技术股份有限公司,5-10年,本科,"六险一金,发展好,团队好,稳定性好",职位描述：1. 针对市场需求和客户痛点，负责数据库相关产品和解决方案的规划、架构设计以及从市场需求到技术需求的转化和分解，提供有竞争力的解决方案功能和技术特性；2. 负责数据库相关解决方案与周边产品和解决方案的集成，支撑业务方向的落地，并负责完成架构的落地；3. 负责跟踪数据库相关领域的技术趋势，竞争对手的产品、技术动态；4. 参与数据库相关产品、解决方案的战略规划、产品和技术规划、解决方案架构设计；5. 负责产品研发过程中关键设计的把关；职位要求：1. 全日制本科及以上学历，211/985院校或以上优先；2. 6年以上数据库/数据仓库/大数据相关产品的软件设计开发相关工作经验；3. 深入理解数据库、数据仓库、大数据、分布式体系架构和关键技术；4. 精通MySQL/PostgreSQL/Greenplum/MongoDB等其中至少一种主流数据库的实现原理，有开源贡献者优先；5. 精通C/C++/Java/php/python等其中至少一门语言；6. 深刻理解软件设计原则和设计模式，独立承担过大中型系统设计开发工作；7. 良好的英语阅读能力；,数据服务,150-500人,数据仓库,北京
C/C++开发工程师（数据库内核）,https://www.lagou.com/jobs/3369758.html,朝阳区,20k-36k,北京人大金仓信息技术股份有限公司,5-10年,本科,"国有企业,六险一金,发展好,团队好",1、作为数据库内核研发团队成员，参与或主导数据库内核相关领域的新技术探索，含算法、分布式架构等；2、参与或主导某类数据库领域的客户场景分析、需求定义、架构设计和特性交付；3、进行相关部分或全部算法设计、数据库系统方案设计以及软件架构设计；4、独立或协同负责内核或数据库工具特性的研发。任职要求：1、本科及以上学历，5年以上工作经验；2、熟练掌握Linux环境下C/C++编程，熟悉进程间通信、内存管理、网络通信等相关知识；3、熟悉数据库理论基础和主要算法，并且具有数据库内核相关开发经验者优先；4、熟悉Oracle、DB2、SQL Server、Sybase、Greenplum、MySQL、PostgreSQL等主流数据库架构中一种或多种者优先；5、熟悉数据库查询引擎（如查询代价估算算法，分布式查询计划产生算法等）、缓存管理、并行处理、I/O 访问相关知识，并有实践经验者优先；6、 有广阔的技术视野，优秀的团队合作能力和沟通能力。7、 喜钻研，有很强的学习能力和分享精神。,数据服务,150-500人,数据仓库,北京
高级数据库内核研发工程师,https://www.lagou.com/jobs/6585425.html,海淀区,25k-50k,北京聚云位智信息科技有限公司,5-10年,本科,不打卡、团队大牛多、带薪年假、扁平化管理,岗位职责：1. 负责分布式数据库内核架构设计和开发;2. 负责分布式数据库SQL层的设计，开发和性能优化;3. 负责分布式数据库引擎的稳定性以及性能优化;4. 负责分布式数据库内核核心技术调研;任职要求：1. 五年以上开发经验，三年以上数据库领域开发经验，扎实的编程能力，精通Java语言；2. 对分布式数据库执行引擎有比较深入的了解；3. 熟悉Spark/Flink/Hive等分布式计算框架的SQL处理机制中的一种或多种；4. 熟悉任意一种数据库系统的执行引擎/存储引擎/优化引擎的架构和实现原理；5. 优秀的发现和解决问题能力，良好的沟通能力，具备团队管理能力；加分项：1.对前沿技术有浓厚的热情和探索欲望，有开源项目经历；2.熟悉 Spark/Flink 内核，并阅读过其中的源码；3.熟悉 MySQL/PostgreSQL/Greenplum 的内核，并阅读过其中的源码。,数据服务,50-150人,数据仓库,北京
数据库内核高级开发工程师(存储引擎),https://www.lagou.com/jobs/6493073.html,海淀区,25k-50k,北京聚云位智信息科技有限公司,3-5年,本科,不打卡、周末双休、领导nice、带薪年假,岗位职责：负责分布式数据库存储引擎的设计，开发和性能优化。 任职要求：1. 精通C/C++，具备问题分析， 概念抽象和设计，以及工程编码的能力；2. 熟悉数据库查询引擎与存储引擎工作原理，熟悉至少一种列式存储引擎的设计和实现；3. 优秀的发现和解决问题能力，良好的沟通能力；4. 有数据库系统底层开发经验，熟悉LevelDB/RocksDB的优先。,数据服务,50-150人,数据仓库,北京
数据仓库专家,https://www.lagou.com/jobs/6715249.html,海淀区,25k-39k,北京小米科技有限责任公司,5-10年,本科,大平台,1.负责业务条线数据仓库基础平台的建设和维护，数据ETL的设计、开发与性能优化2. 建立实时和离线大数据处理流程，负责数据产品平台化和系统化。       3.负责数据治理工作，提升数据易用性及数据质量。4.理解并合理抽象业务需求，发挥数据价值，与业务团队紧密合作。任职要求：1.精通数据仓库实施方法论、深入了解数据仓库体系，并支撑过实际业务场景。2.具备较强的编码能力，对代码风格自我要求严格，熟练掌握Java、Shell、Python等至少其中一门语言。3.熟悉大数据的存储/计算相关技术：Hadoop/Hive/Spark/ElasticSearch/HBase/Kafka/Flume/Flink等大数据生态圈常用组件。4.参与过金融数据仓库建设者优先。有实时数仓设计、开发经验者优先。5.熟悉业内主流BI产品，有使用经验者优先。6.对数据敏感，具备良好的逻辑思维能力、认真细致，善于从数据中发现疑点。7.善于沟通，具备优秀的技术与业务结合能力，善于用系统化思维解决问题。,硬件,2000人以上,数据仓库,北京
数据库工程师,https://www.lagou.com/jobs/7199464.html,西城区,10k-15k,南通东华软件有限公司,3-5年,本科,五险一金 双休,职位职责负责数据仓库的存储过程开发及维护要求：1、 计算机类相关专业背景，本科或以上学历；2、熟练掌握Oracle数据库存储过程编程，有SQL优化经验3、掌握ETL工具开发，熟悉Informatica优先4、有金融行业软件开发项目经验者优先5、熟悉金融行业业务知识者优先6、有过风控系统指标开发者优先7、3年大型项目开发经验,"信息安全,数据服务",150-500人,数据仓库,北京
MySQL数据库工程师,https://www.lagou.com/jobs/7109396.html,海淀区,15k-30k,新浪网技术（中国）有限公司,1-3年,本科,免费停车场、早餐、健身房,工作职责：1.维护新浪网数据库集群稳定运行，持续发现和解决潜在问题；2.负责数据库集群的性能优化，探索新技术和新架构，以满足新浪移动高速业务发展需求；3.负责数据库的虚拟化平台以及自动化系统建设，实现自动化监控、高可用、可扩展架构；4.对数据库进行容量规划、架构设计，提高业务高可用性和容灾能力；5.负责数据库相关工作的整体规划，提供高价值决策建议。职位要求1.计算机相关专业本科及以上，熟练掌握MySQL原理以及相关运维工具的使用；2.熟练掌握数据库优化方法，并对系统内核和硬件优化有一定的涉猎；3.对于Linux操作系统以及网络等有一定了解，并且能结合业务体系，快速定位问题；4.至少熟悉Python，Golang，Java，C等编程语言中的一种，有自动化运维系统建设经验的优先；5.有过互联网大规模MySQL集群运维经验的优先；6.熟悉Redis、MongoDB等NoSQL技术的优先；7.熟悉K8S、Docker等技术的优先。,文娱丨内容,2000人以上,数据仓库,北京
DBA/数据库管理员,https://www.lagou.com/jobs/4214792.html,朝阳区,15k-25k,北京乐呵互动信息技术有限公司,1-3年,本科,"技术大牛,成长迅速,氛围轻松",【工作职责】1.负责数据库架构设计和管理，包括定制备份策略、性能优化、指标监控、日志分析、数据迁移、解决突发问题等，保证数据库集群系统的稳定、高效运行；2.提供数据库开发支持，负责 SQL 代码的上线审核，进行性能分析并提出相应的优化建议；3.负责公司重大业务活动数据库业务的保障；【职位要求】1.善于使用开源中间件，有在生产环境使用 MyCAT 分布式中间件，读写分离、分库分表的运维工作；2.对 MySQL 架构规划，高可用、扩容、迁移、备份恢复、性能监控以及容灾有一定的设计经验；3.了解多种 Cluster 技术，有在生产环境使用 Redis Cluster，性能优化、故障处理及监控等实际维护经验；4.熟悉 MongoDB 性能优化及故障处理，有在生产环境使用 MongoDB 分片集群（Sharded Cluster）实际维护经验；5.熟悉 Linux 基本管理，熟练使用 Shell 辅助运维工作，能够满足日常的 Linux 系统操作；6.对 Hadoop 有一定的认识，具备相关产品（Hive、HDFS、HBase、Sqoop、Hue、Flume NG）生产环境的应用经验；7.工作两年以上，数据库理论扎实，实践经验丰富；具备一定的开发能力，能够通过开发工具提升工作效率；,电商,50-150人,数据仓库,北京
数据库工程师,https://www.lagou.com/jobs/7183675.html,朝阳区,25k-35k,上海爱可生信息技术股份有限公司,3-5年,本科,"新三板,技术大牛,团建",岗位职责：1.负责客户 POC ，TiDB 项目落地、客户关系、项目管理；2.负责与用户进行需求沟通、技术培训，介绍 TiDB 的原理、使用方式、最佳实践等；3.负责客户技术支持，包括配置管理、升级、扩容、备份、数据迁移等工作；4.负责用户 TiDB 集群监控、故障响应、问题跟踪及性能分析处理；5.负责 POC 相关文档编写、流程建设、优化；6.研究 TiDB，对某细分方向，如 TiDB 自动化管理、SQL 优化、故障诊断等有持续产出、贡献。任职要求：1.3 年以上 DBA 或者 大数据工程师 相关工作经验（MySQL、Oracle、Hadoop等），2 年以上的企业服务工作经验；2.精通一种关系型数据库的（如 MySQL ）配置、备份、优化、监控、管理；3.熟悉 Linux 操作系统，如常用命令、文件系统、系统配置等，具有较强的故障定位和问题解决能力，有丰富处理重大故障的经历；4.丰富的项目管理、项目实施经验，能够独立完成数据库架构设计，标准化建设及 POC 文档编写；5.良好的沟通、技术演讲、资源协调能力，高度的责任心和团队合作精神；6.对某一行业比较熟悉，有丰富的企业服务、管理经验。,数据服务,150-500人,数据仓库,北京
高级数据仓库工程师,https://www.lagou.com/jobs/4860449.html,朝阳区,15k-30k,马上消费金融股份有限公司,3-5年,大专,"年底双薪,扁平化管理,技术大牛",职责描述：1. 构建面向全公司的数据产品及数据解决方案；2. 深入理解业务逻辑，基于海量数据完成数据仓库、集市的模型设计及开发工作；3. 通过技术手段为业务方提供快速、准确、灵活的数据服务化； 任职要求：1.学历要求：本科及以上学历，计算机相关专业；2.经验要求：5年以上数据仓库/大数据开发经验； 3.技能要求：（1）精通sql并能在hadoop环境下进行性能调优；（2）有丰富的Hadoop生态群系统开发经验，如hive/spark/kylin/kafka/hbase；(3)熟练使用一种以上编程语言，如python、java、scala；（4）深入理解数据仓库建模理论，有大型数据仓库实施经验；4.通用能力：（1）思路清晰，具备良好的沟通能力和快速解决问题的能力；（2）具备良好的学习能力与抗压能力；,"金融,移动互联网",2000人以上,数据仓库,北京
高级数据仓库经理,https://www.lagou.com/jobs/5855340.html,朝阳区,30k-40k,马上消费金融股份有限公司,5-10年,本科,五险一金 丰厚年终奖 持牌金融公司,"工作职责：1、 负责大数据仓库的建设与优化； 2、 负责大数据分析平台的建设与优化； 3、 负责BI、报表的建设与优化； 4、 管理和指导团队成员。 任职资格：1、学历要求:统招本科及以上学历，计算机以及相关专业，2、经验要求:具有5年及以上数据仓库经验,3、技能要求:（1）对数仓以及围绕数仓的相关系统（比如：调度，元数据管理等）有比较深刻的认知； （2）熟练掌握hadoop，hive，impala技术以及kylin等多维分析技术；（3）有中大型金融行业、互联网行业数仓建设经验者优先；4、通用要求：（1）有较强的学习能力和技术钻研能力、有自我驱动意识（2）具备独立分析和解决问题的能力；积极主动、认真踏实的工作态度（3）有良好的沟通能力，善于跨团队合作（4）具备良好的编码习惯，工作态度认真，责任心强","金融,移动互联网",2000人以上,数据仓库,北京
数据仓库架构师-共享(J10611),https://www.lagou.com/jobs/7152275.html,海淀区,30k-50k,北京易车互联信息技术有限公司,3-5年,本科,平台大，福利待遇好；发展前景好,,"移动互联网,电商",2000人以上,数据仓库,北京
中高级数据库DBA,https://www.lagou.com/jobs/6831397.html,朝阳区,20k-35k,北京万里开源软件有限公司,5-10年,本科,牛人多 工资多 假期多 弹性工作多,岗位要求：1、3年以上的Mysql的运维相关工作经验，本科及以上学历；2、精通MySQL的使用操作，精通percona　的mysql运维工具，至少精通一门脚本语言；3、精通MySQL相关监控以及工具，熟悉MySQL各个分支版本以及它们的异同；4、熟悉数据库测试标准与工具，熟悉常用的MySQL客户端工具，熟悉基于MySQL的集群解决方案；5、熟悉Oracle或相关工作经验有加分，有oracle迁移mysql相关经验的有加分。岗位职责：1、负责公司客户mysql集群的相关运维操作；2、掌握并负责公司mysql集群的运维、测试；3、为公司客户提供远程／现场的mysql技术支持；4、测试公司的mysql集群产品，参与公司mysql集群监控产品的研发；5、参与到文档和培训相关的工作。,数据服务,150-500人,数据仓库,北京
数据库售前专家,https://www.lagou.com/jobs/6831413.html,朝阳区,20k-35k,北京万里开源软件有限公司,5-10年,本科,牛人多 工资多 假期多 弹性工作多,岗位职责：1、了解客户需求，负责数据库集群产品的售前方案的编写，文档准备等；2、收集市场竞品信息，进行对比研究，设计出有效可行的项目方案；3、收集客户反馈及需求，负责公司数据库集群产品的poc测试方案；4、与产品、研发对接，确保项目的交付工作实施落地。岗位要求：1、5年及以上的数据库行业售前/研发经验经验，本科及以上学历；2、熟练掌握mysql的使用，掌握Linux系统常用命令；3、熟悉至少一项脚本语言和一门编程语言c/c++/java/python；4、良好的沟通表达能力和售前/技术类文档编写能力；5、 有国产数据库从业经验的优先，掌握pg/oracle/db2/sqlserver数据库使用的优先。,数据服务,150-500人,数据仓库,北京
初级需求分析师（医学数据库产品）,https://www.lagou.com/jobs/7106069.html,海淀区,8k-13k,艾迪泰科科技（北京）有限公司,不限,本科,六险一金 节日福利 餐补 带薪年假,技能要求：英语，需求分析，产品设计岗位职责：1. 根据公司业务发展及产品策略，规划设计所负责的产品模块，优化产品功能，推动产品优化升级2. 收集整理并分析用户需求，完成产品功能需求调研，撰写符合用户需求、可交付研发和测试的PRD文档及原型，熟练掌握需求分析工具及产品设计工具（包括但不限于Xmind，Visio，Axure，Sketch）3. 协调研发、测试、运维工作，跟进产品开发，把控产品开发的进度和质量，确保产品按时上线4. 对产品提出改进意见，推进产品不断迭代，并参与产品整体功能设计优化和流程设计优化5. 具备开发思维，能够与研发、测试、运维及海外云团队协同工作，同时具备用户思维，能够与产品终端用户建立沟通及产品功能反馈机制6. 关注用户反馈，对上线产品的运行状态进行监控，分析产品数据，输出用户使用产品分析报告，对公司业务发展及产品决策提供建议。 岗位要求：1. 2019年、2020年应届毕业生，本科及以上学历。2. 计算机、生物统计、医学、药学相关专业3. 必备优秀英语读写能力，能独立撰写英文文档；英语听说能力优秀者优先4. 具备逻辑思维能力、宏观规划能力及数据信息分析能力5. 能够快速学习新知识、掌握新领域业务体系，主动、超前学习相关工具技能，具备较强的责任心和抗压能力,其他,50-150人,数据仓库,北京
