job_name,job_url,job_location,job_salary,job_company,job_experience,job_class,job_given,job_detail,company_type,company_person,search_key,city
美工,https://www.lagou.com/jobs/6205250.html,西湖区,7k-14k,杭州布奇托网络科技有限公司,1-3年,本科,领导nice 氛围好 发展空间大,岗位职责：1、负责公司品牌活动、广告创意、线上线下活动等相关的视觉策划与设计；2、配合产品推广需求，完成动画、广告片、宣传片和视频特效等相关作品的制作和后期处理3、根据产品需求参与视频拍摄的脚本讨论与策划，提供创意性内容；任职要求：1、美术、栏目包装设计、影视制作，多媒体动画设计专业本科以上学历； 2、熟练使用相关软件 ：3dmax、MAYA、C4D、 After Effects、Photoshop、EDIUS及PR剪辑软件等；3、具备扎实的美术、动画基础，有较强的独立制作能力和创新意识；4、对产品的设计能有有自己独特的认识和见解，能很好的完成日常广告图片、视频的后期制作。,"移动互联网,电商",50-150人,美工,杭州
美工,https://www.lagou.com/jobs/7171434.html,滨江区,5k-8k,乐麦信息技术（杭州）有限公司,不限,大专,晋升空间大,岗位职责：1.负责店铺整体风格装修；2.负责天猫店铺主图，推广图，小型banner的制作设计；3.定期更新促销图片和页面、配合店铺销售活动、美化修改产品页面及定期更新店铺主页。任职资格：1.大专及以上学历，有电商相关工作经验；2.精通Photoshop、Illustrator、dreamweave等网页设计图形设计软件；3.具有较强视觉色彩把握能力，构思新颖创意独特，审美能力强；4.良好的沟通表达能力和团队协作能力，学习能力强，抗压性强。,电商,500-2000人,美工,杭州
品牌设计美工,https://www.lagou.com/jobs/6938353.html,江干区,3k-4k,杭州所罗门信息科技有限公司,应届毕业生,不限,视觉设计 品牌设计 图文设计,企业简介先知：杭州所罗门信息科技有限公司是一家创新型互联网金融科技企业，企业属于初创发展期。公司主营业务为通过大数据建立数据库，分析银行业相关金融产品，建立具有实用性的理财产品信息推荐平台，立志服务大于5000万以上的中产人群。公司秉承诚信、踏实、专业、追求卓越的企业文化理念，为社会进步创造价值。公司要么不做，要做就做领域内最优秀的产品。此次招收的人员能认可公司的文化，有创业激情者更佳。我们积极组建一支团结的团队，吸纳有品格、有才干的同志加入，因为优秀的团队是优秀产品的基石。如果你愿意脚踏实地与公司同行，成就未来，非常欢迎你来加入。职位要求：1、如果你有想做一款出色的互联网品质产品，来崭露头角、打响名声，那我们非常欢迎你。2、团队吸纳诚信、有扎实基础功底、有自己的设计理念、追求卓尔不群的优秀品质成员。3、技能方面我们希望你有一定的移动端设计经验，精通Photoshop、Sketch 、Illustrator、AI等设计软件；希望你是把设计当做生活，生活当做事业，善于思考，勇于创新，这里是一个你可以放手展示，成就未来的地方。职位描述：1、设计完成成套品牌设计方案，用品牌印象触及人们心底。2、参与产品web端、移动端风格界面UI研究、设计；设定整体视觉体验风格和UI设计；做好用户视觉体验控制3、熟悉客户特征，负责制定、完善和优化产品的界面设计；设计公司宣传图文、文案图文、广告图文等内容。4、辅助公司做好客户拓展与宣传工作。,数据服务、金融,少于15人,美工,杭州
美工,https://www.lagou.com/jobs/6925831.html,下城区,6k-8k,杭州智盾信息技术有限公司,1-3年,大专,接地气,1，较强的美术功底和出色平面设计审美功力；2，对于网页的美工布局及色彩的搭配有着独到的见解和体会，并具有较好的审美观及美感意识；3，精通Photoshop、Illustrator等相关设计软件应用；4，图片处理、美化、设计、修改、更新等 。,"企业服务,数据服务",15-50人,美工,杭州
美工设计师,https://www.lagou.com/jobs/7029803.html,滨江区,6k-8k,满贯（深圳）电子商务有限责任公司,1-3年,大专,五险一金，下午茶，年假等,投递简历时，请附带作品链接或将作品发送至该QQ邮箱：**********，谢谢！岗位职责：1、 面向平台：包含但不限于淘宝、天猫、京东2、日常设计：输出店铺日常需要图片，包含但不限于钻展入口图、钻展承接页、店铺首页装修、宝贝主图、宝贝详情页、直通车推广图片3、活动设计：输出店铺活动需要图片，包含但不限于聚划算、6·18、双11、双12活动4、设计规范：输出设计图片规范，图片设计模板，提升工作效率5、工作协助：协助主管完成照片拍摄，包含但不限于拍摄脚本制作、道具购买、场地租赁、照片修图任职资格：1、一年以上平面设计经验2、 优秀的沟通能力和理解能力3、 良好的审美及判断能力4、 加分项：电商设计师从业经验或者母婴/美妆/保健品行业从业经验优先考虑,电商,50-150人,美工,杭州
美工,https://www.lagou.com/jobs/6923640.html,余杭区,4k-5k,杭州长业科技有限公司,应届毕业生,不限,五险一金、单双休、旅游、、、、、,岗位职责：1、负责公司旗下网店的装修设计，修图排版，美华产品图片；2、负责店铺首页、二级页、宝贝详情页、活动图等整体形象设计、装修、制作；3、配合营销活动及时更新，首页定期维护；4、负责商品图片的前期设计、后期优化；5、完成店铺或领导布置的其他任务；任职要求：1、21-30岁，两年以上淘宝、天猫等平台美工工作经验，2、熟悉淘宝、天猫后台操作，掌握淘宝、天猫直通车站展页面制作要求3、有较强的责任心、沟通能力4、适应压力环境下工作，能很好的配合团队工作5、主动意识强，能根据店铺状况主动发现和解决问题薪资福利：1、底薪4000-5000+餐补+交通补贴+五险一金+话补+员工生日礼品+节假日礼品+额外奖励+年底双薪+带薪休假+法定节假日+公司旅游+团建 工作时间：8：30-17：30（单双休）,电商,50-150人,美工,杭州
美工平面设计,https://www.lagou.com/jobs/7206560.html,滨江区,7k-10k,壹玖壹玖酒类平台科技股份有限公司,1-3年,大专,发展空间大 办公环境优美 同事关系融洽,2018年阿里巴巴战略投资20亿元，1919接入阿里巴巴商业操作系统，承接酒类运营业务。酒类新零售独角兽，行业领军上市公司，线上入驻各大电商平台，线下1000多家门店，业务快速扩张期，发展前景广阔。连续两年天猫酒水双十一**店铺，双十一销售额过亿店铺！岗位职责：1、 负责天猫、淘宝、京东、饿了么等电商渠道无线、PC端设计。2、 负责各级页面设计，包括店铺、活动、产品、专题、详情等。3、 提高页面质量、用户停留时间、访问深度、点击率，提升转化率。4、 配合渠道业务人员，通过设计提高销售，增加品牌曝光，提升用户体验。5、 设计数据分析、总结和优化。任职要求：1、天猫、淘宝、京东等电商平台设计2年以上经验。2、熟悉电商平台各级页面设计，店铺装修，具备高品质的视觉审美。3、有优秀设计案例，独立撰写商品说明及一些宣传推广软文。4、熟练使用photoshop、dreamweaver等工具。5、思维活跃，抗压力强，主动积极，有责任心。薪资福利1、薪资：底薪+绩效+提成；2、优秀员工年终分配股权；3、上班时间：09:00-18:00，周末双休，五险一金，福利优越；4、国家法定节假日正常休假，生日当天可休假；5、公司制定个人晋升和长期发展规划。,消费生活,2000人以上,美工,杭州
高级美工,https://www.lagou.com/jobs/6961186.html,余杭区,8k-10k,杭州特泽瓦科技有限公司,3-5年,本科,五险一金 节日福利 每年多次加薪机会,工作内容：1、负责店铺的装修设计工作；2、对网店活动图片制作、发布、修改、调整；3、配合店铺销售活动美化店铺及产品展示；4、根据店铺营销活动计划，对店铺首页及附加页面进行美化设计；5、不断编排优化店铺页面结构、商品描述美化、店铺产品图片处理；6、日常产品图片，制作宣传海报和网络广告图片。职位要求：3年以上淘宝，京东 等一类电商平台美工相关工作经验，能独立完成设计任务。工作时间：9:00-12:00 13:30-18:00 单双休,电商,50-150人,美工,杭州
美工,https://www.lagou.com/jobs/7181152.html,滨江区,4k-8k,杭州云店科技有限公司,1-3年,大专,"五险
团建活动
节假日福利生日福利",岗位职责：1、负责店铺爆款产品打造、维护，制定运营策略、目标及执行方案；2、善于数据分析，能剖析数据找出店铺（爆款产品）问题，提高店铺产品访客、点击率、转化率；3、深度分析用户需求，并依此制定商品主图详情、卖点提炼、宝贝详情的方案并实施；4、每日监控营销数据、交易数据、商品管理、顾客管理、及时提出营销改进措施，给出确实可行的改进方案；5、对竞品的分析与追踪，并及时提出问题和应对方案6、对推广（直钻）有一定经验和基础，配合推广工具提升宝贝的搜索权重岗位要求：1. 大专及以上学历，有2年电商工作经验者优先考虑；2. 热爱互联网社区与电子商务，对网店运营有浓厚的兴趣；3. 善于总结分析，具有较强的数据分析能力和逻辑思维能力；4. 思维敏捷，有较强的执行力和进取心；5. 有较强的团队合作精神，较好的抗压能力和吃苦耐劳精神福利待遇：1、活动：如聚餐、旅游等各种文体活动2、关怀：如周到的假期和员工关怀，各种团建，丰富业余生活；3、福利：国家法定节假日以及节日福利、高温补贴等；超有爱团队，超快乐工作氛围；4、薪资：具有行业竞争力的优厚薪资待遇，超丰厚奖金；5、超有爱团队，超快乐工作氛围，欢迎你的到来6、上班时间9:00-18:00 午休12:00-13:30,电子商务 数据服务,少于15人,美工,杭州
美工,https://www.lagou.com/jobs/7076263.html,江干区,6k-9k,杭州如涵控股股份有限公司,1-3年,本科,学习机会多 下午茶,岗位职责：1、负责红人相关活动专题海报制作、推广图片制作； 2、负责红人店铺的banner，直播战报；任职要求：1、有一定的审美意识，想象力丰富、色彩感觉好；2、对时尚有敏锐的洞察力，能掌控流行时尚服饰搭配元素；3、具备良好的合作态度以及团队精神并富有工作激情、创造力跟责任感；,电商,500-2000人,美工,杭州
电商设计美工,https://www.lagou.com/jobs/7139149.html,余杭区,6k-8k,河南中横国际贸易有限公司,1-3年,本科,五险一金 带薪年假 节日福利 年度体检,岗位职责 ：1、店铺整体形象设计，包括视觉展示和路径设计，产品描述模板设计和改善；2、各大活动的整体规划及设计，按各品牌计划制定同期广告推广设计；3、能根据销售数据有效调节设计的方向和内容。任职资格 ：1、艺术类专业毕业，具备电商品牌视觉设计工作经验，可接受优秀应届毕业生；2、具有扎实的美术功底及审美创意设计能力，熟练使用lustrator、photoshop，Dreamweaver等软件；3、具有团队合作精神及良好的沟通能力，有较强的责任心和抗压能力。 这是一家崇尚“兼容性与个性化”的公司！高颜值是基础配置，大智慧是常规装备！旗下品牌iSDG亚洲健康行业的领军品牌专注于健康食品研发，以“创造真正的健康”为主要事业。企业实力雄厚，业务范围有宽度、有深度、有远见。线上渠道： 在天猫、京东、小红书、唯品会、云集、苏宁易购、美国亚马逊等近百家电商平台的相应类目中均为主力品牌，更是天猫国际亿元俱乐部的成员之一。线下渠道： 遍及日本20000家药妆店与国内屈臣氏、盒马鲜生、万宁、华润OLE、绿地G-Super等一线商超。90后主力团队，人性化管理，高效率，高创造力！优秀的成长空间，严谨的晋升机制，公平公正，能者居之！环境舒适，高格调，福利满满，压不住的幸福感加入我们，有爱的团队助你雏鹰快速变“金鹰”，磐石细琢成美玉。加入我们，让自由的思想，每每能碰撞出灵感的火花！,电商,150-500人,美工,杭州
美工,https://www.lagou.com/jobs/7209168.html,滨江区,6k-12k,杭州易妆品牌管理有限公司,3-5年,不限,福利待遇好，发展前景，老板nice,职位详情美工职位要求 1.精通Photoshop等图文设计软件，会做详情，首页和海报； 2.有耐心，能连续较长时间从事图片处理工作；思维敏捷，接收能力强，工作积极主动，有团队协作精神； 3.较强的创新能力，独立快速完成高品质设计，对色彩的把握独到，能把设计风格和栏目特色进行有效的结合； 岗位职责 1.产品美化，编辑，宣传海报促销广告设计； 2.网页模版设计，图片处理，产品介绍设计排版； 3.网店店铺介绍的页面设计，网站专题页面的设计和制作； 4.网页设计，网页美工，宣传品设计； 5.服从上级工作要求，保质保量完成任务。 工作时间：9:00-18:00.单休 工作地点杭州市 滨江区 银丰大厦 滨江区滨盛路1505号,电子商务,50-150人,美工,杭州
美工（KKL）,https://www.lagou.com/jobs/6991187.html,拱墅区,6k-12k,杭州铭师堂教育科技发展有限公司,不限,本科,"管理扁平,潜力项目,教育直播,团队氛围好","岗位职责：1、负责教材排版、配图、课表等教学相关物料设计。 2、负责对接老师，设计课件ppt模版。  3、负责设计流程的执行和维护，持续优化设计效率。4、协助部门其他人员，完成相关设计需求及制作。任职要求：1、  熟练使用设计软件（PS、AI、ID）2、  熟练使用office办公软件（ppt、word），有ppt排版作品。3、  良好的沟通能力和抗压能力，能顺畅的与多协作部门、供应商对接相关工作。4、  本科以上学历,美术、设计类相关专业毕业，具有一定的手绘能力；5、  具有教育公司工作经历，有教材、教案等相关美编工作经验优先考虑6、  简历请附带作品（作品网站链接/pdf作品集）工作地址",教育,500-2000人,美工,杭州
淘宝美工,https://www.lagou.com/jobs/7184398.html,滨江区,5k-6k,杭州宇盟信息技术有限公司,1-3年,大专,节假日，人性化管理，五险一金，节日福利,说明；须到公司上班，在家上班者勿扰，谢谢。【岗位职责】1、负责店铺的设计和装修，对店铺整体进行优化提升；2、完成宣传海报图片的制作及图片修改、美化处理；3、宝贝详情页面设计，宝贝详情页面的广告，宝贝图片的处理，后期制作，排版，促销活动设计；【任职要求】1、大专及以上学历，美术、设计相关专业优先，有1-2年电商美工经验。2、熟练使用Photoshop等软件，排版要有整体美观感。3、具有良好的网页及平面设计能力、丰富的网站制作经验。对于网站的美工开发及色彩的搭配有着独到的见解和体会，善于色彩搭配，思维活跃，有创意，有较强视觉效果表现能力；4、有团队协作精神，积极主动，有责任心，有耐心。【福利待遇】1、工作时间：9：00-12：00，13：30-18：00；2、福利多多：全勤奖，五险一金，国家法定假期，节假日福利，年终红包和各种高大上奖品，微波炉、冰箱、饮水机等设施一应俱全等；3、发展空间：人性化的管理；对表现优秀的员工，公司将予以晋升；4、交通便利：联庄地铁口附近，滨康路西公交车站；5、高档写字楼，办公环境优雅舒适，上班氛围轻松，员工相处融洽，欢迎有志向的，有能力的你加入哦~~,移动互联网,15-50人,美工,杭州
美工,https://www.lagou.com/jobs/7191211.html,拱墅区,4k-6k,杭州亨翠电子有限公司,1-3年,大专,双休,岗位职责:1、通过沟通和理解产品， 承担产品的拍照，扣图修图工作，包括和业务员一起去工厂拍摄并保管摄影器材；2、按时按业务员要求完成各网站需要的拼图，详情图制作，视频拍摄制作；3、各网站平台的旺铺装修，配合完成公司官网的设计，提供设计资料、方案；4、各业务员要求的彩盒，贴纸等设计、修改；5、公司各类产品的电子版目录， 印刷版目录的排版设计印刷；6、各产品报价单， 推广文案的设计；7、网站后期美化，配合节假日对各网站页面进行设计改版；8、照片，视频拍摄及制作；任职要求:1 、本科学历，广告视觉、平面设计等相关专业；2、能熟练使用Photoshop/illustrator/Coreldrew/等设计软件，擅长拍照、视频拍摄剪辑优先；3、能独立提供和设计产品包装设计图，各网站详情图，宣传画，样本册优先；4、会单反拍照优先公司福利：周末双休，法定节假日五险一金，绩效奖金餐费补贴，话费补贴高温补贴，节日福利旅游补贴，带薪年假带薪病假，健康体检专业培训，岗位晋升，happy团建！,其他,15-50人,美工,杭州
美工,https://www.lagou.com/jobs/7127443.html,余杭区,4k-5k,杭州半冷农业科技有限公司,1-3年,大专,"五险,带薪年假,生日福利,体检","1、负责网店的店铺设计、装修,图片设计及策划。2、负责网店活动页面设计、产品图片优化、网页整体视觉效果的创意及美化排版等。3、负责产品图、广告图等静态图制作、编辑,视觉效果提升及动态图片制作。4、负责对主题活动的方案设计,打造个性化视觉风格。5、负责宝贝详情描述设计。任职要求：1、热爱电子商务，工作积极主动，乐观开朗，具有良好的团队精神。2、有较为扎实的美工基础，对界面有良好的审美感觉和创新意识。3、有创新思维,能够熟练操作photoshop,CorelDraw,等相关平面设计软件，优秀的文字描述表达能力。4、能够独立完成店铺装修、日常活动页面制作、版面修改等工作。5、有淘宝、天猫设计类经验者优先。","企业服务,其他",15-50人,美工,杭州
淘宝美工助理,https://www.lagou.com/jobs/6733647.html,萧山区,5k-10k,杭州忠星网络科技有限公司,1年以下,不限,待遇高，福利好，有发展前景,"1、协助资深设计师进行产品美化图片、精修图片、优化产品2、后期熟练运用PS DW AE C4D AI等软件，熟练操作各类设计软件，完成视觉创意，色彩管理，创意设计。3、具备优异的设计能力和上佳的品味，能把根据客户要求延展创意并制作设计稿。有敏锐的美感，但对文字也要有一定的素养。有良好的创意构思，在平面设计、美术实际制作方面非常熟悉，具备跃动的思维,完美的色感,敏锐的洞察力和行动能力设计师学徒岗位要求：1、想学设计，无经验者也可根据情况录用，需具有上进心、有长久从事设计行业的打算。2、边做边学，做学徒工（推荐有经验并符合公司要求）通过要求由老师傅手把手带。设计师手把手教（推荐无经验，ps基础薄弱）会有设计师进行岗前学习20~30天左右正式上岗，虚心勤快的话，试用期1个月，保底5000左右，转正之后薪资更高6000-12000",电子商务 教育,15-50人,美工,杭州
美工策划,https://www.lagou.com/jobs/7216713.html,西湖区,5k-6k,浙江润泉酒店管理有限公司,应届毕业生,大专,包吃、包住,岗位职责：1、按照美工制作单的要求，完成各部门要求的美工制作。2、负责酒店所有的广告，海报、纪念册等的设计和推广工作； 3、负责所有重大节日宣传用品的工作和公众号文案撰写、运营及推广。4、负责入住酒店的VIP客人及重大会议接待工作的摄影、拍照等工作。5、妥善保管和节约使用各种美工工具、材料、保持工作场地整齐、清洁。6、掌握国内外有关信息，做好资料收集、整理、分析、储存工作。保证设计制品的合理性和创新性。7、必须了解和熟悉各部门的业务情况，钻研酒店宣传、美术广告业务、不断提高自己的绘画水平、摄影水平、设计水平和艺术素质，以便适应不断发展的美术广告工作的要求。8、熟悉酒店经营情况，掌握基本销售知识，在销售部办公室无人时，做好电话接听工作。9、跟办销售部经理交待的一切事宜。 招聘要求：1.年龄30岁以下，大专以上学历，市场营销或设计专业毕业；2.能熟练使用photoshop、CAD等各类画图设计软件，对会声会影等视频软件有所熟悉；3.具有公众号运营、网络编辑、软文推广等方面工作经验；4.具备较强的客户视角和市场判断力，具备较强的活动执行组织、协调能力。,旅游,50-150人,美工,杭州
电商美工客服,https://www.lagou.com/jobs/7191969.html,拱墅区,4k-8k,杭州栢辰文化创意有限公司,1-3年,大专,人性化管理、创始团队期权奖励,岗位职责：1、协助设计师收集材料，整理文档，熟悉PS软件的基本功能，工作流程后会协助设计师做一些海报、宣传册、页面优化等设计2、负责配合运营经理在京东 、苏宁、天猫产品日常运营、产品规划、新品上下架。3、负责配合运营经理维护电商上产品，主图，页面编辑。4、电商工作经验1年左右5、要有激情，具有创造力，善于提出合理建议，能及时把握客户需求；6、善于与人沟通，良好的团队合作精神和高度的责任感，能够承受压力，有创新精神，保证工作质量；岗位要求：1、大专以上学历，19-30周岁。2、有电商工作经验者和熟悉电商，具有基础的电脑美工操作能力优先。3、对互联网设计行业感兴趣，并想拥有一个长期稳定高薪的工作4、要求学习能力强，积极主动，具有良好的学习心态。工作时间：早8:30--17:30；五险一金。周末双休。带薪年假工作地址杭州 - 拱墅区 - 祥园路47号,电商,15-50人,美工,杭州
电商设计美工学徒零基础可教,https://www.lagou.com/jobs/7007210.html,萧山区,4k-6k,杭州优图坊网络科技有限公司,不限,不限,五险一金 周末双休 弹性工作 不会可教,我们的工作时间：早9晚5我们的休息时间:单双休+国家法定节假 日我们的薪资=3500底薪+提成任职要求：1、年满18周岁，学历不限，专业不限，只要踏实，肯学，有上进心；2、零基础无相关经验也可考虑，只要热爱设计，想学一门技能并往电商美工方向发展；  岗位职责：1.产品修改、抠图排版，美化产品图片等。2. PS、C4D、DW、AI、PR/摄影、视频拍摄、视频剪辑、等软件的熟练运用，淘宝后台的熟练操作，店铺视觉创意，色彩管理，店招到海报，直通车，钻展图片、聚划算图片等设计打造，手机端电脑端的一条龙装修。  任职资格：1、没有经验或零基础需要学习20到25天左右，具体学习时间根据学习能力而定，有专业的设计师去教你技能，手把手进行学习和指导操作。直到能独立掌握一个淘宝店铺的装修技能为止。2、学习期结束基本能独立操作一家淘宝店铺之后有1个月实习期，由企业资深的美工带领进行实际工作。实习期薪资3500左右（不含提成），按照技能而定，优秀者可适当提高底薪，1个月可以转正，薪资4000-5000加提成，半年后薪资在6000左右，一年后薪资在8000左右。3、为人诚恳，态度良好，诚心想学习一门技能的。 4、熟悉基本电脑操作，学历可适当放宽到初中 。,"电商,教育",50-150人,美工,杭州
