job_name,job_url,job_location,job_salary,job_company,job_experience,job_class,job_given,job_detail,company_type,company_person,search_key,city
大数据专家架构师,https://www.lagou.com/jobs/7034745.html,高新区,20k-40k,成都超有爱科技有限公司,不限,本科,五险一金，包三餐，弹性工作,工作职责1. 负责公司大数据平台的基础架构设计和技术选型，主导对应的落地实施；2. 负责搭建大数据应用平台，实现安全高效的数据管理和高性能的数据处理；3. 结合业界大数据最佳实践持续优化大数据架构。工作要求1. 全日制统招本科以上学历，计算机、数学、统计学等相关专业，3年以上相关工作经验；2. 精通开源大数据技术栈，精通Hadoop/Spark/ClickHouse等框架，有大数据开源社区开发经验者优先；3. 具备大数据应用平台架构设计和开发经验，能够提前规避潜在风险；4. 熟练Python或JAVA或C++等服务端编程，有良好的编码习惯；5. 具备良好的学习能力、分析解决问题能力，具有高度的责任心和团队合作精神。,教育,150-500人,python,成都
资深服务器开发工程师,https://www.lagou.com/jobs/6763035.html,高新区,20k-40k,成都超有爱科技有限公司,3-5年,本科,包三餐、五险一金、弹性工作时间,岗位职责：1、设计基于特定需求功能的服务器构架，进行关键技术攻关与优化，完成相关开发工作；2、设计和实施服务器压力测试，针对特定需求对服务器性能进行调整优化；3、与团队紧密配合，保证项目产品开发、上线、维护高质量进行4、对服务器端相关功能及运行情况负责，根据项目需求持续优化服务器状况，扩展服务器部署并且修复异常情况。岗位要求：1、计算机相关专业，3-5年互联网大厂工作经验，计算机基础扎实，精通算法、数据结构；2、精通C/C++、java、python或php中的某种或多种语言，熟悉分布式架构，熟悉Linux操作系统、网络编程；3、沟通能力强，乐于进行团队合作，执行力强，有责任心；4、有团队管理经验者加分，有iOS平台或Android平台开发经验者优先；5，心态开放积极，乐于解决问题。,教育,150-500人,python,成都
高级运维,https://www.lagou.com/jobs/7104293.html,武侯区,15k-25k,四川指尖天下网络科技有限公司,5-10年,不限,弹性时间、餐补、交通补贴、十三薪,"技能要求：Linux岗位职责：1、负责业务的基础环境的建设、维护和管理；2、负责线上服务的稳定性,通过技术手段(监控报警,容量管理,故障梳理,架构梳理等)不断提升稳定性；3、负责对接开发,处理和运维相关问题,优化流程,提升效率；4、负责业务线成本核算评估把控；5、负责运维小工具开发,解决重复性工作,提升效率.岗位要求：1、精通Linux系统原理，部署、维护、调优与故障诊断技术；2、熟悉Docker/k8s容器平台及相关的底层技术；3、熟练掌握各种中间件的部署和使用（比如Nginx/Haproxy/MySQL/DNS/Redis/Kafka/rabbitmq/Prometheus/Grafana/zookeeper等)；4、熟悉常用的批量操作工具Ansible、Saltstack，Puppet中至少一种；5、熟悉Jenkins、Gitlab、，对CI/CD流程制定与集成有实践经验；6、熟悉常见云平台的使用，如腾讯云、阿里云等；7、熟悉并擅长 Python、go、shell等脚本语言中的任意一种，熟练使用脚本来完成日常系统运维工作；8、有责任感、工作积极进取，乐于持续学习，抗压性强，良好的服务意识和团队合作精神注:公司为单休，介意者慎投",其他,15-50人,python,成都
数据模型岗,https://www.lagou.com/jobs/5780206.html,武侯区,10k-20k,四川锦程消费金融有限责任公司,不限,本科,五险一金年终奖金带薪年假节日福利,工作职责：1.模型及应用策略算法研究，建立模型算法包：机器学习（Xgboost，神经网络），逻辑回归，建立策略评估算法包。建立模型开发流程。建立策略分析算法包：如决策树，遗传算法。2.对模型、策略运行效果评估机制，进行持续的监控和调优。产出监控指标定义，报表等。3.联合建模，积极联合第三方公司，使用内外部数据进行模型研究，建立稳定有效的数据模型；4.推进规则引擎的开发接入，完成模型策略配置落地的配置包，协助具体产品模型的上线。5.建立模型开发流程，策略调优流程文档规范。6.完成上级交办的其他工作。任职要求：1.经济学、金融学、统计学、应用数学、信息管理与技术等相关专业本科及以上学历；2.熟练掌握数据库查询并具有统计分析专业背景，具有一定的银行相关数据分析工作经验；3.有银行、担保公司及其他金融行业相关数据分析工作经历，或数据相关的项目实施或项目管理经验者优先。4.具有一定的数据库相关专业知识；5.熟知统计分析及查询相关软件及工具：SPSS、SAS、SQL等；6.熟练掌握Excel数据处理、分析统计功能；7.熟悉R或Python语言。,金融,150-500人,python,成都
运维工程师,https://www.lagou.com/jobs/4027843.html,高新区,10k-20k,四川锦程消费金融有限责任公司,5-10年,本科,"公司总部,稳定平台,福利优,年度调薪","岗位职责:1.负责核心平台7*24小时稳定运行；2.负责及时响应生产环境的监控预警、故障及突发情况定位分析和解决；3.推动产品架构与部署优化；4.推动运维流程的自动化；5.日常运维方案文档的撰写。任职资格:1、可以根据业务需求，依托开源框架体系，进行运维自动化平台整体或者子模块的开发、设计、实现； 2、可以开发分布式系统，为自动化运维（配置管理、监控、部署、调度等）提供工具或系统支持；3、负责开发运维脚本或工具，来提高运维部署的效率。 熟练使用python；4、熟悉Linux系统，了解网络基础技术4、负责开发和维护运维脚本，熟练使用代码管理工具等；5、对自动装配工具具有深入理解和使用经验7、对开源的自动化运维框架，如日志系统，监控系统等有所了解，或者有使用经验，或者有定制开发的经验；8、有web和数据库开发经验；10、对容器技术有了解和使用经验；11、3-5年运维开发经验；12、具备良好的学习能力，独立分析问题，解决问题的能力；13、具有良好的代码书写和维护习惯；14、可承受较大压力，能够接受工作任务的动态调整，有责任感，较强的沟通协调能力，具有团队合作精神 划重点：具有运维开发经验且运维过AI，大数据，K8S集群的 可优先录用；15、了解基于Devops理念的软件交付过程,熟悉大型互联网公司架构，分布式服务调用框架等基础组件，有java开发背景和调优经验的优先，了解微服务架构优先；",金融,150-500人,python,成都
高级测试工程师,https://www.lagou.com/jobs/6590724.html,高新区,10k-16k,北京永洪商智科技有限公司,5-10年,本科,技术大牛，工作氛围好，行业领先,岗位职责：1、参与需求评审，制定测试计划、测试用例；2、实施软件测试，记录并协助定位缺陷，跟踪缺陷并完成回归测试；3、总结测试过程，编写测试报告，及时反馈测试结果；4、参与自动化测试用例编写及维护，不断优化自动化测试框架；5、尝试新方法，新工具提高的测试效率。任职要求:1、 一本院校数学相关专业本科。研究生加分；2、 熟悉sql语言，linux常用操作命令；3、 具备一定的代码基础；4、熟悉JAVA或者Python语言，具有相关开发或测试经验优先；5、能在合理Deadline下完成、做事速度快，执行力和决策力强；6、有良好的合作性和沟通能力，高度的奉献精神及敬业精神。,企业服务,150-500人,python,成都
测试工程师,https://www.lagou.com/jobs/7049185.html,高新区,10k-13k,北京永洪商智科技有限公司,3-5年,本科,技术大牛，工作氛围好，行业领先,岗位职责：1、参与需求评审，制定测试计划、测试用例；2、实施软件测试，记录并协助定位缺陷，跟踪缺陷并完成回归测试；3、总结测试过程，编写测试报告，及时反馈测试结果；4、参与自动化测试用例编写及维护，不断优化自动化测试框架；5、尝试新方法，新工具提高的测试效率。任职要求:1、 一本院校数学相关专业本科。研究生加分；2、 熟悉sql语言，linux常用操作命令；3、 具备一定的代码基础；4、熟悉JAVA或者Python语言，具有相关开发或测试经验优先；5、能在合理Deadline下完成、做事速度快，执行力和决策力强；6、有良好的合作性和沟通能力，高度的奉献精神及敬业精神。,企业服务,150-500人,python,成都
安全开发工程师,https://www.lagou.com/jobs/7212790.html,高新区,12k-18k,成都人者科技有限公司,不限,本科,五险一金 月薪*12+年终奖0-12月,职位要求：1、熟练掌握一门编程语言，如Python、C/C++、golang、Java；2、熟悉数据库，有mysql、es等至少一种数据库编程经验；3、熟悉网络知识，网络安全攻击/防御技术；4、熟悉国内外主流安全产品（如防火墙、IDS、IPS、ADS、安全审计、漏洞扫描、身份认证、加密系统等）；5、有经验应对WEB漏洞攻击如sql注入、xss、文件上传、文件包含、命令执行以及其他安全问题；6、熟悉大数据平台及分析技术优先；7、具备渗透测试，web应用漏洞挖掘、业务逻辑漏洞挖掘的实战经验者优先；8、工作积极主动，具有强烈的责任心、事业心，具有良好的沟通能力、团队配合精神。,信息安全、软件开发,15-50人,python,成都
安全运维工程师,https://www.lagou.com/jobs/7212777.html,高新区,8k-12k,成都人者科技有限公司,不限,本科,五险一金 月薪*12+年终奖0-12月,岗位职责：1.  负责网络安全设备维护、策略优化配置等；2.  负责网络安全技术研究工作；3.  负责应用系统的安全配置工作；任职要求：    计算机等相关专业，本科及以上学历；1、熟悉TCPIP等网络层协议，HTTPHTTPS等应用层协议，熟悉业界主流网络安全防护产品解决方案以及攻击检测与防护基础原理；2、熟悉网络设备及运维技术，对网络配置、拓扑结构，能够对网络结构安全进行评估和调整。3、熟悉安全设备及配置运维技术，可对防火墙、waf、IPS等进行合理策略配置，具备独立承担网络安全配置任务；4. 熟悉操作系统、数据库、中间件等运维技术；4、熟练掌握python脚本编写，可对常见应用进行脚本探测及漏洞探测5、熟练掌握nmap、msscan等网络扫描工具，对网络进行探测6、熟练操作linux操作系统，熟悉apache、nginx、tomcat、redis、memcache、mysql等应用中间件，以及配置文件信息、部署方法、优化方式等；加分项： 1. CISP证书、各类CTF比赛获奖。,信息安全、软件开发,15-50人,python,成都
前端开发工程师（H5方向）,https://www.lagou.com/jobs/6935340.html,高新区,12k-20k,咪咕文化科技有限公司,3-5年,本科,有挑战性、福利好,"1、负责 咪咕音乐移动 Web 前端功能设计、开发与维护；2、负责持续优化前端应用的性能和交互体验；3、负责前端工程化工具开发与整合，通用类库与框架的编写；4、追踪前端技术的发展，结合实际需求进行技术的改进与创新。任职要求：1、全日制本科及以上学历；2、三年以上工作经验，参与过至少一个完整的软件和系统的从需求分析、设计、开发、测试和发布的全过程，并在系统中负责至少一个核心模块；3、熟练掌握 HTML5/CSS3/Javascript/Vue/React 等前端技术；4、熟悉各浏览器间 Web 标准实现差异，了解响应式与自适应布局；5、熟悉前端模块化、组件化、工程化开发，熟练使用 Node 开发前端工具；6、熟悉常见 Javascript 设计模式，了解 MVC/MVP/MVVM 等架构模式；7、了解任何一种后台开发语言,如(Java,PHP,Python,Go)； 9、较强的责任心和团队协作精神，具备独立解决问题能力和不断探索的态度。","移动互联网,文娱丨内容",2000人以上,python,成都
大数据算法工程师,https://www.lagou.com/jobs/6999589.html,高新区,15k-20k,咪咕文化科技有限公司,3-5年,硕士,有挑战性、福利好,1、负责收集、整合和挖掘运营数据，根据用户特征、消费行为进行用户细分；2、负责音乐推荐系统、推荐算法设计、推荐模型优化、推荐算法开发与推荐场景设计等；3、负责用户画像标签指标设计、模型设计、模型训练、模型开发以及应用推广；4、应用先进的统计建模、数据挖掘、机器学习方法建立数据模型解决实际问题，并研发创新方法以解决常规算法不能解决的问题；职位要求：1、全日制硕士研究生及以上学历，计算机科学与技术、计算机软件、数据挖掘、应用数学、自然语言处理等相关专业；2、3年以上大数据挖掘经验或推荐系统设计经验，有2个以上大数据挖掘成功应用案例（面试时需提供相关案例）；3、有良好的编程能力、扎实的Java语言基础、能熟练使用JAVA等编程语言进行开发，熟悉Hadoop、MapReduce、Spark、Hbase、Hive、Storm、zookeeper等开源分布式系统，对其中1个或多个分布式系统有应用经验；4、熟悉至少一种Oracle、mysql、MongoDB等关系型或非关系型数据库技术，熟悉使用数据挖掘相关算法（决策树、聚类、逻辑回归、贝叶斯等）以及自然语言处理技术；5、熟悉推荐系统架构、常用推荐算法以及推荐系统评价标准，熟练使用Spss moder、R和Python等。,"移动互联网,文娱丨内容",2000人以上,python,成都
安全研究员（逆向/移动安全）,https://www.lagou.com/jobs/6258135.html,高新区,10k-20k,瑞数信息技术（上海）有限公司,1-3年,本科,"尖端技术,行业前景,股票期权,年终奖",职位描述• 针对公司产品进行逆向分析，加强软件自身的安全性• 负责逆向关键技术研究，对项目中技术难点进行攻关• 分析漏洞样本，提供分析处理报告• 支撑相关安全产品预研工作 职位要求• 熟练掌握软件逆向静态分析、动态调试、代码跟踪等，能够熟练使用OllyDbg、IDA、JEB等调试工具• 熟悉加密解密算法• 熟悉恶意代码类型和分析流程• 熟悉C/C++、Python脚本开发等语言• 具备较强的技术钻研和学习能力，具备良好的沟通能力 加分项• 熟悉浏览器漏洞挖掘优先• 熟悉JavaScript及其特性优先• 熟悉Web安全优先• 熟悉Android、iOS逆向优先• 具有独立攻击事件，恶意代码分析溯源能力优先• 具备英文资料的阅读能力优先,信息安全,150-500人,python,成都
开源云计算工程师,https://www.lagou.com/jobs/6607661.html,武侯区,15k-30k,北京易捷思达科技发展有限公司,3-5年,本科,远程工作，大牛多，扁平化，氛围好,"工作职责：1、分布式存储系统Ceph的维护及性能优化等工作；2、分布式存储系统Ceph的bug解决或定制开发工作；3、设计开发和优化大规模分布式存储系统类产品，包括块存储、对象存储等；4、分布式存储系统Ceph的运维支持，及时发现系统隐患、瓶颈，并解决问题。任职要求：1、计算机或相关专业本科以上学历，3年以上开发经验；2、熟练掌握C/C++ 熟悉Python、Bash Script；3、熟悉Ceph的源代码和内在工作原理，能对其进行性能优化、问题修复；4、熟悉Ceph，有丰富的线上部署、日常运维、扩缩容、性能分析、故障定位处理能力；5、有钻研精神，态度积极，自我驱动。加分条件：1、熟悉VFS、Block Layer内核机制；2、熟悉OpenStack开源云平台，有相关开发经验。职位名称：开源云计算工程师工作地点：成都工作职责：1、参与云计算OpenStack产品研发；2、参与Openstack社区工作，跟进社区动态。任职要求：1、计算机或相关专业本科以上学历，3年以上开发经验；2、熟练掌握C/Go/Python, 多线程编程、网络编程、脚本编程；3、优秀的分析问题和解决问题的能力，对解决挑战性问题充满激情；4、熟悉开源软件开发模式以及常用工具。至少以下条件之一:1、3年以上Kernel开发经验, 熟悉x86或arm, 熟悉KVM,QEMU；2、3年以上Ceph开发经验, 熟悉Linux文件系统, Block layer；3、2年以上OpenStack开发经验, 熟悉Nova, Cinder, 和Neutron等核心组件；4、2年以上基于Kubernetes开发经验。",数据服务,150-500人,python,成都
Ceph分布式存储研发工程师,https://www.lagou.com/jobs/6607681.html,武侯区,15k-30k,北京易捷思达科技发展有限公司,3-5年,本科,可远程，大牛多，扁平化，氛围好,工作职责：1、分布式存储系统Ceph的维护及性能优化等工作；2、分布式存储系统Ceph的bug解决或定制开发工作；3、设计开发和优化大规模分布式存储系统类产品，包括块存储、对象存储等；4、分布式存储系统Ceph的运维支持，及时发现系统隐患、瓶颈，并解决问题。任职要求：1、计算机或相关专业本科以上学历，3年以上开发经验；2、熟练掌握C/C++ 熟悉Python、Bash Script；3、熟悉Ceph的源代码和内在工作原理，能对其进行性能优化、问题修复；4、熟悉Ceph，有丰富的线上部署、日常运维、扩缩容、性能分析、故障定位处理能力；5、有钻研精神，态度积极，自我驱动。加分条件：1、熟悉VFS、Block Layer内核机制；2、熟悉OpenStack开源云平台，有相关开发经验。,数据服务,150-500人,python,成都
高级运维工程师【成都】,https://www.lagou.com/jobs/6770513.html,武侯区,10k-20k,杭州数澜科技有限公司,3-5年,本科,技术大牛多，公司氛围好，晋升机会多,岗位描述：1、负责公司产品的交付，包括规划、实施、运维、培训、文档输出等；2、和客户及项目经理进行良好的沟通，理解需求、确定实施方案；3、进行客户现场的升级、部署等日常维护工作，确保客户满意；职位要求：1、计算机专业本科以上学历，两年以上系统运维经验；2、熟悉Linux相关管理配置，熟练掌握shell或python一种，有自动化运维经验为佳；3、熟悉git、jenkins、yum工具，熟悉java、node.js相关应用的部署；4、对虚拟化技术、容器技术有一定了解优先；5、有大数据生态（hadoop、spark、hbase等）运维经验；6、有一定网络规划和维护能力；7、良好的抗压能力，高效的执行力以及强烈的责任感，良好的团队合作能力。8、要有一定的沟通能力及客户服务意识。,"企业服务,数据服务",150-500人,python,成都
数据开发工程师,https://www.lagou.com/jobs/6734071.html,武侯区,10k-15k,成都乐鸟智慧科技有限公司,3-5年,本科,数据中台,岗位职责： 1、 负责数据产品需求分析、数据建模，主导完成相关设计及编码； 2、 完善现有数据产品，优化现有产品数据体系； 3、 深入理解业务需求，能从数据角度推动业务发展，开发相应数据产品及工具。岗位要求：1、精通HiveSQL！！！熟悉Oracle、MySQL等关系型数据库；熟悉MapReduce/Spark等数据开发技术；2、有一定的Java/python开发能力，熟悉linux/Shell；3、计算机、数据等相关专业本科以上学历，工作5年以上；4、熟悉数据仓库和数据集市的框架结构，具备数据仓库与数据集市的架构设计能力；5、在数据统计、机器学习上有一定基础的优先；6、沟通与交流能力强，业务理解能力强，具有一定的业务建模能力；7、需出差，出差地：成都！,"企业服务,数据服务",少于15人,python,成都
风险监测分析岗,https://www.lagou.com/jobs/6544922.html,高新区,10k-20k,四川新网银行股份有限公司,3-5年,硕士,扁平化管理 午餐补助 交通补贴,职责描述：（1）协助完善全行操作风险管理政策、制度和流程；（2）负责建立并组织实施操作风险识别、监测、分析和报告程序；（3）负责非现场风险监测的模型、规则开发及维护工作；（4）对操作风险关键风险点进行日常监测并评估反馈；（5）协助开展操作风险管理信息系统建设。任职要求：（1）全日制院校硕士研究生及以上学历，经济、财务、金融、计算机等相关专业；（2）3年以上数据分析、风险建模的工作经验，熟悉银行业务及信息系统；（3）具备较强的数据敏感度、逻辑分析能力和良好的写作能力；（4）熟练使用Python、SQL、Spark者优先；（5）具有风险管理及审计相关资质证书(如FRM、CFA、CPA、CRISC、CISA)者优先。,金融,150-500人,python,成都
反欺诈策略分析师,https://www.lagou.com/jobs/6206852.html,高新区,10k-20k,四川新网银行股份有限公司,1-3年,硕士,"互联网银行,扁平化管理,星空餐厅","岗位职责：1. 负责制定和优化反欺诈策略来识别欺诈风险，并不断丰富侦测方式和调查手段，确保及时侦测及处置可疑告警；2. 负责建立反欺诈规则并在规则引擎上部署反欺诈规则，研究欺诈事件和发展趋势；3. 监控风险数据的波动，及时发现可疑数据、可疑监控对象等异常情况，并对发现的异常情况进行数据分析和处理；4. 负责各类型信贷欺诈、支付欺诈等风险事件的调查工作，并跟进后续的相关风险评估、流程优化及案件管理；5. 数据分析及处理：通过对业务数据进行各项分析和挖掘，尝试发现实际生产出现的各种风险问题和提出相应的解决方案。任职资格：1：数学/统计学/运筹学/计算机科学/金融/经济学科类等相关专业本科及以上学历（经验丰富者可适当放开此项限制）；2：信用卡、借记卡、第三方支付等公司的交易反欺诈策略制定及管理工作经验；3、熟练使用数据分析工具，如SQL，SAS，Python,R等优先。",金融,150-500人,python,成都
算法工程师（自然语言）,https://www.lagou.com/jobs/6861689.html,高新区,10k-20k,中国兵器装备集团自动化研究所,1-3年,本科,国企背景，待遇丰厚,岗位职责：1、推动业务文本分类、实体抽取等算法研究，提高判断准确率；2、完成业务算法模块代码开发、调试工作；3、与高校算法团队进行对接。任职要求：1、211研究生及上学历，数学、计算机等相关专业；2、2年及以上工作经验，如有至少一年在互联网独角兽及以上企业工作、实习者优先；3、精通Python/JAVA，有扎实的代码功底和实战能力；4、具有深度学习研发经验，熟悉Tensorflow、Kears、Pytorch等深度学习框架者优先；,"企业服务,物联网",500-2000人,python,成都
算法工程师（数据挖掘）,https://www.lagou.com/jobs/6861677.html,高新区,10k-20k,中国兵器装备集团自动化研究所,1-3年,本科,国企背景，待遇丰厚,岗位职责：1、推动设备智能运维相关数据挖掘研究，提高故障诊断、维保推荐准确率；2、完成业务算法模块代码开发、调试工作；3、与高校算法团队进行对接。任职要求：1、211机械、自动化、统计学等相关专业硕士及以上学历；2、2年以上工业设备健康维护领域数据分析、数据挖掘建模等相关工作经验，如有至少一年在PHM、智能制造等业务领域的头部企业工作、实习者优先；3、熟悉常用数据挖掘算法；4、熟悉Java、Scala、R、Python至少一种； 了解大数据框架Hadoop、Spark等；,"企业服务,物联网",500-2000人,python,成都
