job_name,job_url,job_location,job_salary,job_company,job_experience,job_class,job_given,job_detail,company_type,company_person,search_key,city
中高级H5软件开发（短期出差）,https://www.lagou.com/jobs/6978943.html,武昌区,12k-16k,中信网络科技股份有限公司,5-10年,大专,全额公积金、年底双薪、旅游、带薪假,"岗位职责1.负责手机和web项目前端核心代码实现； 2.配合后段开发人员进行界面和接口集成; 3.持续优化前端界面和脚本，保证兼容性和高性能；4.富有挑战的前端新技术研究; 5.与团队保持良好的沟通，提供合理的技术方案建议。任职条件1.4年以上H5前端开发经验，大专以上学历；2.能独立完成div+css设计排版、制作成符合web规范的静态html代码；3.精通Javascript,HTML5,css3,AJAX等前端技术；4.熟悉Web前端主流技术框架，如vue/jquery/jquerymobile/bootstrap/angularjs等；5.熟悉WEB标准，熟悉一种服务器端脚本语言优先(PHP、Java)；6.了解PC不同浏览器的差异重点IE10 IE8 Google Mozilla Firefox Safari 等；7.有良好的沟通协调能力，有责任心，思维逻辑性强；部门概述中信网络科技股份有限公司是中信集团子公司，于2001年在北京正式成立，是北京市认定的软件企业和高新技术企业，并通过系统集成贰级认证和ISO9001国际质量体系认证。公司业务主要涵盖应用软件开发、系统集成、IT服务和IT咨询服务，已为许多大、中型客户提供了市场领先的IT解决方案。 公司业务主要涵盖应用软件开发、系统集成、IT服务和IT咨询服务。       目前，中信网络科技已经为许多大、中型客户提供了相关的IT解决方案，并在一些主要行业取得了领先的市场地位，主要产品线有卡业务类、互联网金融类、风控业务类、移动互联网类和基础业务类。 服务领域以金融行业为主，涉及各大银行及政府大中型企业。 核心产品有金融IC卡业务平台、审计信息系统、人力资源管理信息系统、协同信息办公系统等。          中信网络科技以“诚信、创新、责任、协同、卓越”为核心价值观，诚信是我们的立足之本，创新是我们的发展之源，责任是我们的坚定之心，协同是我们的凝聚之钥、卓越是我们的追求之路。       中信网络科技始终致力于为中国金融机构、政府、大中型企业信息化建设提供领先的应用软件产品和专业化服务, 打造金融IT行业一流品牌，成为客户可信赖的合作伙伴、提供员工发展的舞台、为股东创造价值。",金融,500-2000人,php,武汉
web前端开发工程师,https://www.lagou.com/jobs/5930503.html,江夏区,7k-13k,武汉大势智慧科技有限公司,1-3年,本科,五险一金 餐饮补贴 年终奖 员工旅游,"岗位职责：
 根据项目进度安排配合后台开发人员完成Web开发，实现产品界面和功能；
 Web前端表现层及与前后端交互的架构设计和开发；
 利用Web技术实现产品原型；
 优化网站界面UI、代码优化。 
 任职要求：
 本科及以上学历，1年以上工作经验，能展示相关作品；
 扎实的HTML、CSS、JavaScript前端开发基本功；
 熟悉ES6语法，对Vue、React等框架精通其一；
 熟悉一种后端语言（如：Java、PHP、NodeJS等）优先考虑；
 具有WebGL (three.js) 开发经验者优先；
 良好的编码习惯、沟通协作能力和学习能力。","移动互联网,数据服务",50-150人,php,武汉
openstack运维,https://www.lagou.com/jobs/6918967.html,东湖新技术开发区,15k-22k,湖北盛天网络技术股份有限公司,5-10年,本科,福利好 发展快,"机、加速服务、监控服务等。岗位要求:1.计算机或者相关专业优先,具备三年以上互联网项目运维经验2.熟练掌握Linux系统,熟悉网络技术及其原理,熟悉TCP/IP协议工作原理3.熟练掌握zabbix/nagios/cacti等监控系统使用.4.精通Linux体系下PHP/Java/Python/go等生产环境的部署及调优.5.熟练掌握python/go/shell等开发语言,有过运维侧的相关系统开发经验者优先6.有Devops持续集成经验,Docker、Openstack、Kubernetes等运维经验者优先；6.有较强的工作责任心，良好的团队沟通能力与协作精神。","游戏,文娱丨内容",500-2000人,php,武汉
运维工程师,https://www.lagou.com/jobs/1207787.html,江夏区,6k-8k,北京尖峰计算机系统有限公司武汉分公司,1-3年,本科,专业技能培训，发展空间大，福利待遇好。,岗位要求:1. 熟悉Linux系统以及主要服务的安装、配置和维护。 2. 熟悉shell/Perl/php/python一种以上的脚本语言编程。 3. 熟悉mysql或Oracle数据库。4. 计算机相关专业本科以上学历，有一年以上工作经验。 5. 善于解决问题，善于沟通， 热爱学习。岗位职责:1. 开发及测试服务器的日常维护和监控 2. 服务器系统及应用软件的安装、配置、故障定位及排除3. 各种脚本的开发及维护,"数据服务,其他",50-150人,php,武汉
资深HTML5前端工程师,https://www.lagou.com/jobs/5005079.html,东湖新技术开发区,18k-25k,北京数字政通科技股份有限公司武汉分公司,5-10年,本科,"五险一金,餐饮补助,周末双休,年终奖金","岗位职责1、参与产品前期的规划构思，完善产品概念，参与原型策划与设计； 2、与UI合作实现移动web前端特效； 3、负责网站页面制作及维护，按照设计图完成页面html5开发； 4、按照业务功能需求，编写js和css3代码，协助后端工程师完成代码镶嵌和调试； 5、执行并优化前端技术标准、规范；    任职要求1、硕士5年以上工作经验，本科6年以上工作经验，计算机或相关专业；2、精通盒模型、常用布局以及浏览器和移动设备兼容性；3、精通W3C标准与ES规范, CSS3, 熟悉Web语义化, 能够高精度还原设计稿；4、精通使用至少一种JS框架，掌握其原理，能独立开发常用组件，如jquery，zepto，react，vue等等；5、精通使用各种调试、抓包工具，能独立分析、解决和归纳问题；6、良好的编码习惯，较强的沟通、理解能力和良好的责任心、进取心和团队合作能力；7、对前后端合作有深入了解并拥有相对丰富的项目经验, 微信公众号开发经验；8、具有性能优化经验, 拥有服务端语言如Node.js, java, php开发经验加分；9、有高级信息系统管理师、数据库工程师、系统集成项目管理工程师、高级系统分析师、系统架构设计师等证书之一的，优先录用。",移动互联网,500-2000人,php,武汉
高级HTML5前端工程师,https://www.lagou.com/jobs/5005052.html,东湖新技术开发区,15k-18k,北京数字政通科技股份有限公司武汉分公司,3-5年,本科,"五险一金,餐饮补助,周末双休,年终奖金","岗位职责1、 参与产品前期的规划构思，完善产品概念，参与原型策划与设计； 2、与UI合作实现移动web前端特效； 3、负责网站页面制作及维护，按照设计图完成页面html5开发； 4、按照业务功能需求，编写js和css3代码，协助后端工程师完成代码镶嵌和调试； 5、执行并优化前端技术标准、规范；    任职要求1、硕士3年以上工作经验，本科4年以上工作经验，计算机或相关专业；2、熟练掌握盒模型、常用布局以及浏览器和移动设备兼容性；3、熟悉W3C标准与ES规范, CSS3, 熟悉Web语义化, 能够高精度还原设计稿；4、熟练使用至少一种JS框架，掌握其原理，能独立开发常用组件，如jquery，zepto，react，vue等等；5、熟练使用各种调试、抓包工具，能独立分析、解决和归纳问题；6、良好的编码习惯，较强的沟通、理解能力和良好的责任心、进取心和团队合作能力；7、对前后端合作有深入了解并拥有相对丰富的项目经验, 微信公众号开发经验；8、具有性能优化经验, 拥有服务端语言如Node.js, java, php开发经验加分；9、有高级信息系统管理师、数据库工程师、系统集成项目管理工程师、高级系统分析师、系统架构设计师等证书之一的，优先录用。",移动互联网,500-2000人,php,武汉
前端工程师-武汉,https://www.lagou.com/jobs/6955401.html,洪山区,17k-34k,北京字节跳动科技有限公司,3-5年,本科,"六险一金,弹性工作,租房补贴,带薪休假",,文娱丨内容,2000人以上,php,武汉
测试工程师,https://www.lagou.com/jobs/7193332.html,洪山区,12k-20k,北京一一万物科技有限公司,3-5年,本科,福利待遇，弹性上班时间，发展空间,岗位职责：         1、负责Android、ios应用软件的功能、性能、兼容性等测试；         2、理解产品需求，设计测试用例、编写测试报告，并按照测试计划和流程完成测试任务；         3、对问题进行报告、跟踪、汇总，并协助开发人员定位问题；         4、搜集用户反馈问题并进行跟踪验证；         5、有服务器接口测试、性能测试、安全性测试、自动化测试经验者优先考虑         岗位要求：         1、本科及以上学历、计算机软件或相关专业；         2、2年及以上软件测试工作经验，至少1年Android、IOS测试经验；         3、熟悉至少一门主流编程语言，如Java，Python，Php，Golang，Node等;         4、对软件测试理论知识、app测试方法、测试流程等了解；         5、工作认真、负责、有耐心、有独立判断力、有主动学习意识；         6、沟通协调能力、语言及文字表达能力强，团队合作意识强。,"移动互联网,社交",150-500人,php,武汉
售前工程师,https://www.lagou.com/jobs/7036228.html,江汉区,8k-10k,力迩斯区块链安防科技（武汉）有限公司,3-5年,本科,工资高 加班少 氛围轻松,"岗位职责(需详填)：1.网络安全产品的行业需求分析2.售前调研、售中的项目交付管理3.定期对系统、云安全进行风险评估和监测，合规性实施、测试和报告。4、设计和测试新的 IT 安全解决方案。5、对网络安全事件进行应急响应，撰写安全分析报告 任职要求(需详填)：1.具有产品需求分析能力2.网络管理技能, 以测试内部系统, 如防火墙和 ipsids 设备, 以确保网络的安全。3.熟悉常见的编程语言包括, C, C++, c#, Java, Sql 或 PHP。4. 大学本科以上学历5.有以下证书者优先：CISSP,CISP, SSCP 、CISM、CRISC、QIAL、IIA 、diploma/ISO27001、CPP、OSCP、PSP、 CSA +、Security+6.有3-5年的网络安全售前工程师或项目经理经验",移动互联网,50-150人,php,武汉
高级前端开发工程师,https://www.lagou.com/jobs/7177369.html,汉阳区,14k-19k,北京好药师大药房连锁有限公司,5-10年,本科,包吃住，不打卡，领导nice，大平台,"工作职责 : 1.根据产品需求，配合产品经理，设计最优的页面前端组件解决方案； 2.负责项目前端核心模块的设计、交互实现，并持续改善性能和用户体验； 3.研究和探索前沿的前端技术，应用到团队与产品中。 任职资格 : 1. 统招本科学历，至少4年以上软件开发经验，1年以上HTML5 开发经验，熟悉DOM； 2. 深入理解 W3C,ECMAScript3/5/6,HTTP/HTTPS/Socket 协议,CSS3 标准; 3. 熟悉 WebRTC／RecordRTC，对 WebGL 有一定的了解； 4. 熟悉 hybrid 产品开发,熟悉 HTML5Native 化开发； 5. 有大型网站前端性能调优、可用性、运维及相关经验；6. 熟悉至少一种非 web 前端脚本语言（例如 PHP/Java/C#）或 Node.js, 并有实际操作经验；7. 精通各种浏览器中 HTML5 代码的优化方法，确保兼容性； 8. 使用过一种或多种框架，例如：ReactJs,Mobile Zepto, jQuery/jQuery Mobile, Angular js, Bootstrap 等等； 9. 有个人技术 GitHub开源项目经验者优先(允许是公司项目)； 10. 良好的编码与注释习惯，具备敏捷开发经验和思路； 11.有头部互联网2年以上工作经验优先。",医疗丨健康,150-500人,php,武汉
前端开发工程师,https://www.lagou.com/jobs/7206176.html,东湖新技术开发区,10k-15k,武汉格物优信科技有限公司,1-3年,本科,五险一金 带薪年假 年度旅游,【岗位职责】1、 负责公司产品的功能开发；2、 参与公司新项目前端框架的设计与实现；3、 通过技术手段，提升用户体验并满足高性能要求，提升开发效率和质量；4、 Web前沿技术研究、应用和推广。【岗位要求】1、 本科及以上学历2、 熟悉B/S开发技术，熟练掌握JavaScript、Ajax、CSS、HTML等web开发领域相关技术；对html5技术有一定了解； 3、 熟悉node.js；4、 熟悉基本的计算机网络概念，熟悉HTTP协议，了解TCP/IP的基本工作原理，熟悉各种Web标准规范； 5、 具备Linux、PHP相关经验者优先； 6、 具备较强的沟通交流和团队合作能力； 7、 具备较强的工作主动性和学习进取精神，对业界的最新技术发展动态有比较密切的关注，有成功的互联网站点开发经历者优先；8、 具有基于Electron开发桌面应用经验者优先。【薪酬福利】公司处于成长期，招募各类专业人才加入团队，个人职业成长空间广阔，薪资待遇从优，有期权激励、社保、年终奖、带薪年假、年度体检、年度旅游、节日福利等。【企业介绍】武汉格物优信科技有限公司专注红外热成像测温技术的研发和产业化应用，是一家集研发、生产、销售为一体的高新技术企业，拥有多项自主知识产权，通过ISO9000质量体系认证。公司依托科技创新求发展，不断为客户提供高品质、稳定可信赖的产品以及专业的服务。,"硬件,其他",少于15人,php,武汉
前端工程师,https://www.lagou.com/jobs/7132216.html,武昌区,10k-15k,北京火眼神算数据科技有限公司,3-5年,本科,公司发展前景好，13薪，提供午餐,"1负责Web 前端的开发；2 负责微信小程序开发；3 独立完成现有组件的扩展、维护、全新组件开发；4 配合后端工程师完成数据接口的开发和调试；5 负责已有产品线前端迭代开发重构，以及性能优化；岗位要求：1、计算机相关专业，本科及以上学历，至少2年以上的Web前端开发经验；2、熟悉 HTML5/CSS3/JavaScript 等前端相关技术；3、熟练使用jquery、vue、element-ui前端框架，熟悉webpack、npm等工具，能使用vue搭建相关应用，能独立开发常用组件；4、快速学习能力强、主动性强。有良好的编码习惯、责任心、进取心和团队合作能力；5、具有性能优化经验, 拥有服务端语言如Node.js, java, php开发经验加分；6、熟悉SVN、Git等版本管理工具。",数据服务,15-50人,php,武汉
Java开发实习生,https://www.lagou.com/jobs/6941142.html,洪山区,3k-6k,北京升鑫网络科技有限公司,应届毕业生,本科,下午茶、餐补、房补、竞争力的薪资,【岗位职责】1.在开发工程师的指导下，开发青藤云安全产品，进行各种创新性尝试；2.涉及的技术场景包括但不限于：Linux开发，Windows开发，服务器后端开发（Java）。【任职要求】1.计算机或相关学科专业背景，本科以上在校学生；2.具备快速学习能力，乐于探索未知领域，对技术有热情；3.熟练掌握至少一种编程语言（C/C++/Java/Python/PHP）；4.参与过实际项目或开源项目者优先；有个人项目作品或博客者优先。5.每周实习时间5个工作日，最少6个月的实习时间,数据服务,150-500人,php,武汉
测试开发实习生,https://www.lagou.com/jobs/6941155.html,洪山区,3k-6k,北京升鑫网络科技有限公司,应届毕业生,本科,下午茶、餐补、房补、竞争力的薪资,【岗位职责】1.参与青藤主要产品线的测试工作；2. 通过流程和技术手段，把控线上质量，完成线上监控和bug管理。【任职要求】1.计算机或者相关专业本科及以上学历；2.熟悉测试流程和测试方法，能把控整体项目进度和开发质量；3.能通过流程和技术手段对线上质量负责，包括线上的监控、和bug管理等；4.掌握Python/JAVA/C++/PHP等至少一门编程或脚本语言；5.熟练使用Linux。6.每周实习时间5个工作日，最少6个月的实习时间,数据服务,150-500人,php,武汉
web前端开发工程师,https://www.lagou.com/jobs/7088501.html,东西湖区,10k-15k,北京天融信网络安全技术有限公司,3-5年,本科,六险一金,"工作职责： 1、负责公司产品模块页面的维护，优化用户体验。2、与后台开发工程师合作，完成产品新需求页面的开发、优化及维护。3、积极自主学习，能快速参与新项目的开发。 任职资格： 1、本科及以上学历，计算机软件、通信、软件工程、电子信息工程等相关专业2、精通HTML, CSS进行UI设计，并且对模板化、模块化有一定理解；3、精通JavaScript面向对象程序设计，以及jQuery, EasyUI，BootStrap等主流JS类库，具有较强的前端代码开发能力，满足产品的UI交互设计需求；4、对Web前端脚本、应用程序的性能优化有较深的理解，并有相关实践经验；5、熟练掌握各主流浏览器间的差异，能很好的解决跨浏览器问题；6、熟悉微信小程序开发、react;7、具备团队合作精神，有责任心，有激情，爱学习，愿意钻研技术，具有挑战精神和创新意识； 8、熟悉php/python优先考虑。",信息安全,2000人以上,php,武汉
u3d/VR讲师,https://www.lagou.com/jobs/7205733.html,洪山区,6k-12k,武汉盛世蓝鲸科技有限公司,3-5年,本科,社保，国家节假日正常休息，超长带薪年假,任职要求：1、至少两年以上Unity3D开发经历，有完整的Unity3D移动平台项目经历或者线上产品者优先。                                                                              2、至少精通Java，Object-C，C++，C#，Javascript中的一种或多种语言。                                                                                                                   3、了解3D引擎工作的原理，熟悉游戏相关的基本算法，掌握3D性能瓶颈的分析方法。                                                                                              4、有团队精神，普通话标准，口齿清晰，语言逻辑性强；                               5、有培训或教学工作经验者优先或线上直播课程经验者优先；6、参与过PHP项目者优先；岗位职责：1、根据教学大纲带班教学                                                                                                                                2、配合市场需要，完成技术讲座的授课任务；                                                                                                                          3、能根据不同的培训要求，制定相应的教学计划；                                                                                       4、配合教学部其他讲师完成培训课程体系建设与实施；                                                                          5、负责相关的教学资料（实训大纲、教学PPT、教学用书、教学案例等）的研发工作；                              6、积极参与部门内训，保持技术先进性；,教育,50-150人,php,武汉
前端工程师（北京/武汉）,https://www.lagou.com/jobs/2873774.html,洪山区,10k-20k,北京青云科技股份有限公司,3-5年,本科,"技术大牛,不打卡,发展空间,时间弹性",职位描述：     青云 QingCloud 公有云、企业云 web 产品、客户端产品的开发、维护；青云QingCloud 产品线官网及公司官网的开发、维护。 工作职责:     理解云服务的功能、特点，对用户使用云服务的方式进行深入思考。    与系统工程师、设计师密切合作，参与产品需求、产品设计，负责开发实现以及测试、维护等迭代周期。     参与整个青云 QingCloud 前端产品线的工程化建设和开发规范的制定。     参与设计和开发适用于企业级产品的高效可复用的 UI 组件。 职位要求:     熟练掌握 HTML、CSS、JavaScript 等前端基础技术。     熟练掌握至少一种 HTML 模板语言如Jinja、Smarty、Velocity、Jade、Mustache 等。     熟练掌握  LESS、SASS、Stylus 等 CSS 预处理器技术，或 PostCSS 等 CSS处理框架。     熟练掌握至少一种 Web 应用的前端开发框架，如 BackboneJS、ReactJS、VueJS等。     熟练使用 Git、SVN 等项目代码管理工具。     中、大型的 Web 应用系统设计与开发经验。     有良好的编码习惯，对开发高品质的 web 产品充满热情。 优先条件：     有基于 SVG/Canvas/WebVR 等技术的数据可视化、产品图形化开发经验。     有前端工程化、持续集成的项目经验。     熟悉云计算各类服务和产品，或熟悉企业级产品的要求和架构方式。     掌握至少一种后端开发语言如 Python / PHP / NodeJS 等。     熟练使用 Shell。     良好的英语读写能力。,数据服务,150-500人,php,武汉
WEB 前端开发工程师,https://www.lagou.com/jobs/6126987.html,东湖新技术开发区,12k-24k,北京青云科技股份有限公司,3-5年,本科,"工作氛围,发展空间,晋升机会，六险一金",工作职责理解企业云盘和IM的定位、设计原则、交互特点，对使用人群和使用场景进行深入思考，与系统工程师、设计师密切合作，参与产品需求、产品设计，负责开发实现以及测试、维护等迭代周期;完成web 端面向用户、管理端的功能开发和功能维护 职位要求熟练掌握HTML、CSS、JavaScript 等前端基础技术，具备原生开发能力熟练掌握LESS、SASS、Stylus 等CSS 预处理器技术，或PostCSS 等CSS 处理框架熟练掌握至少一种现代Web SPA 应用的前端开发框架，如React、Vue 等熟练掌握webpack / babel / eslint / gulp 等前端开发和工程化工具链熟练使用Git、SVN 等项目代码管理工具中、大型的Web 应用系统设计与开发经验有良好的编码习惯，对开发高品质的Web 产品充满热情 优先条件有文件处理、办公协同类web 应用开发经验有hybrid webapp 项目开发经验掌握至少一种后端开发语言如Python、PHP、NodeJS 等,数据服务,150-500人,php,武汉
软件测试工程师,https://www.lagou.com/jobs/6107984.html,武昌区,7k-12k,北京广通信达软件股份有限公司杭州分公司,3-5年,本科,"领导好,带薪年假,员工体检，五险一金","岗位职责：1.负责产品项目的测试全过程，包括参与需求分析、设计评审、制定测试计划，设计和执行功能、性能、安全、兼容性等各种测试用例；2.实施、规划软件测试工作，并对问题进行跟踪分析和报告，推动测试中发现的问题及时合理地解决；3.指导测试工程师提升测试能力：包括构建测试环境、集成测试、回归测试、性能测试等；4.通过质量度量分析、测试方法、测试工具改进和项目流程优化等方法，持续提升产品线的总体质量及效率岗位要求：1、具有3年以上软件测试及自动化测试经验，熟悉软件工程、软件测试理论和方法，熟知相关的测试流程，精通测试用例设计方法, 有负责带领进行大型项目测试经验优先，有移动端测试经验者优先；2.具备很强的逻辑思维能力，有较好的分析解决问题能力、学习能力、抗压能力、沟通能力和团队协作；3.熟悉PHP/Java等至少一种编程语言，熟练使用Linux或Unix操作系统常用命令，熟悉oracle等主流数据库，有Shell/Python等使用经验者优先；","移动互联网,数据服务",500-2000人,php,武汉
