job_name,job_url,job_location,job_salary,job_company,job_experience,job_class,job_given,job_detail,company_type,company_person,search_key,city
美工美文,https://www.lagou.com/jobs/7151363.html,江干区,5k-8k,信颐健康科技（浙江）有限公司,3-5年,本科,五险，绩效奖金,【技能要求】电商美工，创意视觉，网页设计制作，新媒体软文编辑【公司宗旨】为40岁以上人群打造一个集“吃喝玩乐购养”为一体的综合电商平台。【岗位职责】1. 负责平台各类目页面及广告页面的美工美文、创意设计，熟练图文编辑。2. 负责商家及产品的美工美文，包括整体形象设计、详情页设计、页面更新及维护等。3. 负责线上各类营销策划活动的广告设计、视觉表现和软文编辑。【任职要求】1. 本科及以上学历，艺术设计类相关专业。2. 3年以上电商美工经验优先，美工和美文能力兼备的优先。3. 精通Photoshop，illustrator，InDesign等相关平面设计软件。4. 熟悉电商后台操作流程，可独立进行图片排版及描述，对色彩把握敏锐。5. 抗压能力强，具备团队合作精神。6. 投递简历或面试时请附上个人作品集。,移动互联网,15-50人,美工,杭州
美工设计,https://www.lagou.com/jobs/6876636.html,西湖区,4k-6k,杭州正经科技文化有限公司,1年以下,大专,周末双休，五险一金，免费零食,岗位职责： 负责商品详情页的制作及优化，涉及图片美化、产品卖点描述及排版等，主要进行平面设计。任职要求：1、大专以上学历，有1年左右天猫淘宝店铺美工工作经验，有优秀的平面设计能力。 2、具有较强的网页美工设计，平面设计经验，熟练掌握Photoshop、Illustrator、Coreldraw等平面设计软件。3、熟悉电商运营流程，电商美工经验优先。4、面试请携带作品。,"电商,文娱丨内容",少于15人,美工,杭州
招电商美工学徒,https://www.lagou.com/jobs/7023261.html,江干区,4k-6k,杭州网晨电子商务有限公司,不限,不限,稳定，高薪，有技术,职位描述：有些岗位永远不缺人，因为不需要技术，而有些人永远不缺岗位，因为有一技之长。文凭已经不是就业评判标准，而一项技能，才是就业的硬道理。现在很多大学生都找不到合适的工作，要么觉得薪资待遇低，要么觉得没有发展前景，在社会上碰壁了几年还没有给自己一个清楚的定位和职业的发展方向。如果仅仅凭一个文凭去找工作，已经没什么优势了，但是你多掌握一门技能，就多了一个别人没有的机会 ，多一个优势。一，招聘对象：1.年满18周岁，学历不限，专业不限，为人诚恳，谦虚好学，热爱电商行业。2.文职、销售、服务、普工类人员再充电，多学一份热门技能，提高就业竞争力。3.应届毕业生，无工作经验者，想掌握一技之长。4.对电商美工设计有浓厚的兴趣爱好，有志于从事美工设计行业的各界人士。5.待业、失业人员。二，岗位职责：能够独立胜任一家网店的所有设计、装修、更新工作，包括：1.PS、DW等软件运用，抠图修图，优化店内宝贝描述，美化产品图片，视频采集和制作，直通车、砖展等2.海报设计，首页排版，详情页制作，后台装修等。3.负责店铺整体的运营规划、分析、监控等系统性经营工作，提高店铺点击率和点击转化率 ，熟悉直通车推广、钻展、活动报名、排名搜索、、微淘等工具、熟练操作产品上下架、店铺管理、SEO优化 以及后期店铺推广。三，任职资格：1、无经验者可从学徒做起，学徒期约15-20个工作日（具体看个人接收能力，学会为止），有资深美工设计师带领，以实战为主，所有技能训练都在线上店铺内操作完成。2、学徒期结束正式上岗，因为之前没有相关经验，试用期薪资3500左右，转正后4000起，每年你的薪资会增加500-1000元/月，技能行业，工作经验越久薪资待遇越高。没有任何电商经验或基础薄弱者，我们 也会让你成为一个合格的大师级别的电商美工。学历不是主要的，我们看重的是你的能力。四，薪资待遇：技术类行业主要看实际能力，薪资=底薪+福利+奖金+提成：薪资在4000-8000/月。美工设计，只要你用心，做到2年以上资深美工，月薪近万，而且电商行业发展前景良好，相关部门也一直在鼓励发展电商，鼓励电商创业，电商已经遍布全国。杭州是电商之都，中国的硅谷，目前美 工对杭州、深圳、北京、上海等电商发达城市已经供不应求了，这个时期选择美工设计行业发展可以说是明智之举。选择大于努力，只有选择对了，才能捷足先登，事半功倍！欢迎有识之士直接电话联系咨询。五，工作时间：9:00-17:00；单双休，法定节假日。,"电商,其他",少于15人,美工,杭州
设计师美工,https://www.lagou.com/jobs/7124545.html,余杭区,8k-15k,杭州雷德夫贸易有限公司,3-5年,本科,一家有发展潜力的公司。,我们是一家品牌公司，电商详情是主要方向。要求，对品牌调性的把控在一定高度且有美感，效率高 科班出身，美院毕业优先。如果您是一位有追求的大设计师，这里有舞台也有惊喜。有意向的同学可以发作品到邮箱，看简历更重要的是看作品哦。www.leidfor.com,电子商务,50-150人,美工,杭州
淘宝美工学徒,https://www.lagou.com/jobs/7134696.html,萧山区,4k-6k,杭州优图坊网络科技有限公司,不限,不限,不会可教，弹性工作，学PS软件 视频剪辑,我们的工作时间：早9晚5我们的休息时间:单双休+国家法定节假日任职要求：1、年满18周岁，学历不限，专业不限，只要踏实，肯学，有上进心；2、零基础无相关经验也可考虑，只要热爱设计，想学一门技能并往电商美工方向发展；岗位职责：1.产品修改、抠图排版，美化产品图片等。2. PS、C4D、DW、AI、PR/摄影、视频拍摄、视频剪辑、等软件的熟练运用，淘宝后台的熟练操作，店铺视觉创意，色彩管理，店招到海报，直通车，钻展图片、聚划算图片等设计打造，手机端电脑端的一条龙装修。任职资格：1、没有经验或零基础需要学习20到25天左右，具体学习时间根据学习能力而定，有专业的设计师去教你技能，手把手进行学习和指导操作。直到能独立掌握一个淘宝店铺的装修技能为止。2、学习期结束基本能独立操作一家淘宝店铺之后有1个月实习期，由企业资深的美工带领进行实际工作。实习期薪资3500左右（不含提成），按照技能而定，优秀者可适当提高底薪，1个月可以转正，薪资4000-5000加提成，半年后薪资在6000左右，一年后薪资在8000左右。3、为人诚恳，态度良好，诚心想学习一门技能的。4、熟悉基本电脑操作，学历可适当放宽到初中。,"电商,教育",50-150人,美工,杭州
视觉设计师/淘宝美工,https://www.lagou.com/jobs/3106439.html,西湖区,8k-13k,杭州八仙广告有限公司,1-3年,大专,"绩效奖金,职位晋升,团队建设,年终奖金",岗位职责：负责淘宝、天猫等阿里平台的推广/活动/专题页面的视觉设计工作。任职要求：1.2年以上视觉设计工作经验，美术院校或者网页设计相关专业毕业优先；2.精通Photoshop、Illustrator、CorelDRAW、Dreamweaver等设计软件；3.擅长创意、策划，具备较强的美术功底和审美能力；4.工作主动勤奋，能承受一定的工作压力；5.富有责任感和团队精神。双休 9:30-18:00,"移动互联网,企业服务",50-150人,美工,杭州
淘宝美工,https://www.lagou.com/jobs/7128388.html,桐庐县,6k-10k,杭州佑米进出口有限公司,1-3年,本科,"五险一金
包住
每周单休
有年终奖",动画，手绘，美术设计，场景，平面设计 岗位职责： 1、对淘宝店铺的产品优化，包括产品描述，页面设计，分类设计。 2、不定期对淘宝和其他第三方电子商务平台店铺装修设计、海报制作、推广图片制作，能用简介文案表达产品的卖点等； 3、对店铺的产品做出相对应的销售Banner以及广告页面； 4、店铺日常维护、产品更新，能独立操作店铺陈列，以增强店铺吸引力、产品销量； 5、产品拍摄及照片处理，能独立做产品描述并定期更新。 6、根据公司产品的上架情况和促销信息自主制作促销广告位，对拍摄后的产品图进行校色、美化处理； 7、负责对店铺的宣传页，产品专题页，店面促销页面等进行独立设计。 要求： 1、具备对淘宝、电子商务的理解和分析能力，并站在用户角度去思考，提高淘宝商城的用户体验。2、对平面设计及摄影工作热爱并想长期从事此工作。 3、对商业产品有敏锐的洞察力和分析能力。 4、精通Photoshop/Dreamweaver/Illustrator/CDR/C4D等设计软件； 5、良好的沟通能力和团队协作精神。 6、平面，广告，产品，互联网等设计相关专业毕业（特别优秀者可对专业及学历、工作年限无要求） 职能类别：网店美工 关键字：美工平面设计设计师C4D3D淘宝美工天猫美工,电商,少于15人,美工,杭州
美工平面设计,https://www.lagou.com/jobs/6921800.html,西湖区,3k-6k,杭州御宅文化传播有限公司,3-5年,不限,内容简单，动漫游戏相关。,1. 制作网店需要的海报，社交媒体需要的图2. 将中文详情页改成英文详情页3. 完成公司交代的其他事项,文化娱乐,少于15人,美工,杭州
淘宝美工,https://www.lagou.com/jobs/6205799.html,滨江区,6k-12k,杭州所象电子商务有限公司,1-3年,大专,福利待遇完善、公司前景良好，知名度高,"不是坐班全职的请不要投递，勿扰，谢谢！任职资格：1、大专及以上学历，有至少2年以上电商平台美工设计经验；2、有较为扎实的美工基础，有团队意识，对界面有良好的审美感觉和创新意识。3、有创新思维,对photoshop,CorelDraw,等相关平面设计软件有浓厚兴趣，能够熟练使用，；4、对工作负责认真，有浓厚的团队意识；5、能够按照领导的意见进行修改优化，听从领导管理；有作品可以携带面试；6、会产品拍摄，有摄影经验。岗位职责：1、负责店铺的美术设计创意、策划，擅长图标设计，整体配色设计；能用简介文案表达产品的卖点；2、制作各种活动页面和推广图；.产品图片优化，产品详情页模版制作与优化；有良好的审美观；3、能独立完成店铺的主页美化，制作促销、描述模板，根据公司产品的上架情况和促销信息自主制作促销广告位，对拍摄后的产品图进行校色、美化处理；4、站在用户角度去思考，提高网站的可用性，优化设计；能够挖掘消费者的浏览习惯和点击需求；5、需要全职坐班，线上兼职的勿扰！！！！！工作时间：9:00--18:00   单休  法定节假日休息 薪资待遇：6-12K,可根据工作能力调整。只要你工作能力强，高薪资没问题。五险、季度加薪、带薪年假、免费零食下午茶、通讯补贴、高温补贴、生日福利、团建活动、出国旅游、高额年终奖~年轻化的团队、人性化的管理，高成长的平台、梦想实现的地方；而且您还有大量的机会接触到电商运营的其他工作，为您今后的发展提供更多的可能！公司全部为90后小伙伴，氛围超级NICE! 工作环境良好，轻松无压力~注：线上模式的勿扰！！！谢谢",电商,50-150人,美工,杭州
电商美工客服,https://www.lagou.com/jobs/6654346.html,拱墅区,4k-8k,浙江青木影视有限公司,不限,不限,人性化管理、创始团队期权奖励,岗位职责：1、协助设计师收集材料，整理文档，熟悉PS软件的基本功能，工作流程后会协助设计师做一些海报、宣传册、页面优化等设计2、负责配合运营经理在京东 、苏宁、天猫产品日常运营、产品规划、新品上下架。3、负责配合运营经理维护电商上产品，主图，页面编辑。4、电商工作经验1年左右5、要有激情，具有创造力，善于提出合理建议，能及时把握客户需求；6、善于与人沟通，良好的团队合作精神和高度的责任感，能够承受压力，有创新精神，保证工作质量；岗位要求：1、大专以上学历，19-30周岁。2、有电商工作经验者和熟悉电商，具有基础的电脑美工操作能力优先。3、对互联网设计行业感兴趣，并想拥有一个长期稳定高薪的工作4、要求学习能力强，积极主动，具有良好的学习心态。工作时间：早8:30--17:30；五险一金。周末双休。带薪年假,"广告营销,企业服务",少于15人,美工,杭州
美工设计,https://www.lagou.com/jobs/7119359.html,下沙,3k-5k,杭州盖特瑞驰电子商务有限公司,不限,不限,工作满6个月五险公司团建公司聚餐,公司介绍：杭州盖特瑞驰电子商务有限公司创业型电商公司，有广阔的发展空间，公司氛围好，扁平化管理。 上班时间：早8.30-晚6.00，不打卡，周末双休。 每月定期团建聚餐。岗位职责：1、负责宝贝详情页、活动图、广告素材图等设计、精修、制作；2、完成店铺或领导布置的其他任务；岗位要求：1、美术、平面设计、计算机等相关专业;2、精通PS、PR 等图片视频设计剪辑软件，能够熟练进行商品落地页素材设计对接;3、欢迎20届或在校生加入。4、21-30岁，两年以上淘宝、天猫等平台美工工作经验，5、有较强的责任心、沟通能力6、主动意识强，能根据产品情况主动发现和解决问题,"电商,物流丨运输",少于15人,美工,杭州
电商美工设计师,https://www.lagou.com/jobs/7115696.html,余杭区,5k-9k,杭州量子金融信息服务有限公司,1-3年,大专,五险一金 带薪年假 餐补 生日福利等,岗位职责：1、根据品牌定位及视觉规范，负责公司电商店铺页面设计，包括店铺整体的风格定位及设计制作店铺视觉创意、色彩管理，通过专业的设计提升公司的品牌形象；2、负责公司店铺平台页面的设计、改善及维护等工作，包括首页、详情页、主图、活动海报等，以增强店铺吸引力、产品销量；3、配合官方店铺销售活动，定期更新促销页面及不断优化店铺主页、产品页面；4、参与公司网站、微信渠道后台排版设计；5、负责新产品拍摄方案制作并主导完成拍摄；6、完成领导安排的其他相关工作。 任职要求：1. 美术、艺术、设计类等相关专业全日制大专以上学历；2. 熟练操作Photoshop、Illustrator、Coreldraw、Indesign等设计软件；3. 两年以上广告或消费品公司平面设计工作经验，至少一年以上电商店铺活动及商品页面设计经验，食品行业相关经验者为佳；4. 有效独立完成电商店铺主页、产品页、促销活动设计工作，色彩把握准确，配色、平面构图、字体设计功底扎实，良好的摄影能力，熟悉和掌握静物拍摄技巧；5. 较好的审美情趣和良好的色彩感悟、创意和视觉表现能力。对视觉营销有一定的认识，能快速把握品牌调性、风格；6. 诚信、勤奋、责任感和团队合作精神，良好承压力，执着，细致、强烈的事业心。7. 投递简历请附上作品集.作品投递至邮箱,"移动互联网,金融",15-50人,美工,杭州
电商美工,https://www.lagou.com/jobs/7061511.html,江干区,5k-8k,杭州金致生物科技有限公司,1-3年,不限,福利待遇优，老板超nice,岗位职责：1、负责淘宝、天猫、拼多多、京东各大公司网站的全套视觉设计。2、店面整体形象设计更新、商品描述美化、店铺产品图片处理、能熟练应用Photoshop、CDR、AI、Dreamweaver等软件，附：有经验、有自信、有能力者优先考虑！3、店铺内容的设计，美化。任职要求: 1、要求大专以上，艺术相关专业优先；2-5年工作经验，熟悉电商行业，有美妆洗护类目经验者优先考虑；2、具有较强的做图功底、创造性思维；很好把握视觉色彩与网店布局；3、有较强的色彩搭配能力、审美观和理解力，有一定的文字编辑能力尤佳；4、善于与人沟通，良好的团队合作精神和高度的责任感，能够承受压力，保证工作质量。工作地址：杭州市 江干区 新加坡杭州科技园(科技园路)5幢817,电子商务 社交网络,50-150人,美工,杭州
招淘宝美工,https://www.lagou.com/jobs/6723321.html,拱墅区,4k-6k,杭州京淘网络科技有限公司,1-3年,大专,双休 社保 法定节假日 绩效 提成,职位描述: 1.负责店铺的页面创意设计； 2.装修网店：根据公司每月制定的促销计划，对公司淘宝首页及附加页面进行网页美化设计； 3.定期制作促销图片和页面，配合店铺销售活动；美化修改产品页面，定期更新店铺主页； 4.网店风格及商品展示设计，结合商品的特性制作成图文并茂、有美感、有吸引购买力的描述模板。 任职要求 1.熟悉淘宝网店等专业网店装修设计，有皇冠级或淘宝商城店担任过产品、页面设计经验优先； 2.通美工软件，懂得淘宝代码的运用，排版要有整体美观感；3.具有良好的网页及平面设计能力、丰富的网站制作经验。对于网站的美工开发及色彩的搭配有着独到的见解和体会， 善于色彩搭配，思维活跃，有创意，有较强视觉效果表现能力； 4.美术设计相关专业毕业，有相关工作经验，能够持续接受工作压力和挑战；工作态度端正，耐心，细致有做过淘宝美工经验者优先。 岗位福利：1.底薪+续约、提点提成、月度PK奖金+年终高绩效奖金，周末双休，月收入7K及以上；2.按国家规定缴纳社保、带薪休假；3.享受节假日慰问、免费旅游、定期组织丰富的团队活动；4.多次的学习培训机会；5.提供良好的个人发展空间。,电商,50-150人,美工,杭州
美工设计,https://www.lagou.com/jobs/6178231.html,西湖区,5k-7k,杭州君尚酒店运营管理有限公司,1-3年,大专,五险一金，各种补贴、全勤奖，双休。,1、了解品牌和产品特点，把握需求，进行创意设计。   2、参与公司品牌形象、logo等VI讨论，提炼亮点并完成设计。 3、负责公司形象展示宣传、产品图册设计、宣传册设计等平面类设计工作，并给予制作意见。4、根据市场部工作计划制定设计计划并实施。  5、协助营销/运营等公司其他部门完成相关设计需求。,"旅游,广告营销",150-500人,美工,杭州
淘宝天猫美工,https://www.lagou.com/jobs/7088276.html,余杭区,6k-10k,浙江奇迹科技有限公司,1-3年,不限,入职满2年享受境外游1次,"岗位要求：1、两年以上行业经验，有独立完成店铺装修的能力，具备一定审美与创意能力；2、负责公司产品在电商平台上（例如：天猫、京东 等）营销活动的视觉呈现工作，熟悉电商后台操作；3、负责天猫店铺全套美工设计，视觉营销规划、店铺整体形象设计更新，商品详情描述美化，店铺产品图片处理，促销活动平面支持等完成，在线销售的整体设计,改善用户视觉体验;4、懂摄影，爱学习。技术要求：1、精通PS、AI或CDR、DW、GIF， 对Flash、HTML、JavaScript 的原理熟悉；2、良好的创意思维和理解力，有良好的整体布局能力和色彩感3、良好的团队合作精神和高度的责任感，有创新精神，保证工作质量。 应聘时请务必提供个人作品公司福利：1.公司交纳五险2.享有传统节日福利3.入职满一年享有每年一次旅游或体检4.单双休。",电商,15-50人,美工,杭州
淘宝美工（线上勿扰勿扰啊）,https://www.lagou.com/jobs/6078150.html,余杭区,5k-6k,上海亿朵纺织品有限责任公司,1-3年,本科,"五险一金,带薪年假,年度体检,不加班","岗位职责：1、结合品牌整体风格，对淘宝、天猫等平台店铺版面设计及详情页设计，并定期美化和更新产品页面；2、根据运营部门的需求制作具有创意的推广素材，包括直通车、钻展投放素材等；3、店铺活动，根据活动需求，策划并制作具有创意性、高点击率、高转化率的素材；4、产品的包装印刷物设计,如海报，宣传画册的设计制作。 任职要求：1、本科以上学历，美术及设计类等相关专业；2、2年以上电商行业设计经验，有服装类尤其是童装类设计应验者优先；3、熟练使用Photoshop、coreldraw、AI等软件,有Dreamweaver编辑经验者优先4、具有一定的美术功底，和较强的审美和创意设计能力，整体布局能力和色彩感好，能清楚地表达设计理念；5、善于学习，责任心强，具有团队合作精神及良好的沟通能力，工作细致，富有责任心。 PS:1、有意向者可联系HR扣扣：二零六六七五四六零八发作品；2、在线全职或兼职不考虑哦，非诚勿扰，谢谢！",电商,15-50人,美工,杭州
美工设计,https://www.lagou.com/jobs/6920579.html,滨江区,4k-6k,杭州鑫多网络科技有限公司,应届毕业生,不限,晋升空间,岗位职责 ：1、天猫店的视觉效果调整； 2、产品界面的设计、编辑、美化等工作； 3、活动海报设计； 4、活动广告和专题的设计； 5、可以主动参与公司线上所有活动的策划及宣传；  6、能简单产品照片拍摄、小视频简单拍摄制作任职资格 1、能熟练掌握Photoshop等照片处理软件，有产品拍摄技能最好，不局限思维，结合电商实情，敢于想象和创新！ 2、善于与人沟通，良好的团队合作精神和高度的责任感，能够承受压力，有创新精神，保证工作质量； 3、 条件允许下，应聘时可提供您的个人作品，便于公司参考。 我们追求创意，追求个性化，追求不断的自我的思考发挥，我们不讲学历，不讲经验，只看态度，只看创意。而且您还有大量的机会接触到电商运营的其他工作，为您今后的发展提供更多的可能！竭诚期待您的加入！上班时间：单休；法定假假日休息；9点-18点,电商,15-50人,美工,杭州
网页美工设计,https://www.lagou.com/jobs/5062483.html,江干区,6k-12k,天台喜购多网络技术有限公司,1-3年,大专,高薪,负责公司网站美工设计，app和手机网站页面设计，有一定审美和设计经验,"电商,移动互联网",少于15人,美工,杭州
美工平面设计,https://www.lagou.com/jobs/6932583.html,滨江区,6k-12k,浙江乐享齐方环保科技有限公司,3-5年,大专,五险双休年终奖团建,岗位职责：1、负责公司项目的界面和UI设计；2、负责项目的视觉原型设计，提高客户体验；2、配合技术部进行前端整体布局；3、配合运营部进行相应的宣传海报等方面的设计4、产品单页设计、手册设计排版，企业画册设计5、公司微信公众号以及支付宝服务号日常维护，发布产品海报或者与宣传相关的文章。岗位要求：1、良好的沟通能力和团队合作精神；2、对网页的配色及排版有一定的经验、精通Photoshop、AI、Coreldraw等平面设计软件，熟练操作各类办公软件；3、渴望发展，极具进取心，能够承受工作压力；4、大专学历以上；5、有网页、电商、小程序美工UI经验的优先考虑,"移动互联网,人工智能",15-50人,美工,杭州
網頁美工設計,https://www.lagou.com/jobs/5113785.html,萧山区,5k-10k,宁波庄庐信息科技有限公司,不限,不限,"時間自由,地點自由,待遇高,獎金高","1.要有UI怖局邏輯.2.具美感.3.能自已做圖, 會特效.4.網頁美工設計外包5.設計簡單，時尚。6.兼職。7.要確定自已有時間兼職.",企业服务,15-50人,美工,杭州
淘宝美工,https://www.lagou.com/jobs/6675600.html,拱墅区,4k-8k,杭州代码侠信息科技有限公司,不限,不限,"五险一金,周末双休,带薪年假,朝九晚六",岗位职责:1、产品美化图片，抠图，优化产品描述；2、参与负责店铺页面的制作与发布、页面的维护、相关产品的更新；3、负责店铺整体店网页设计，活动海报设计等工作；4、参与店铺首页、产品详情页面设计；任职资格：1、大专以上学历；2、有淘宝网店1年以上设计装修经验者优先；3、熟练使用ps、AI等设计软件；4、有扎实的美术功底、良好的理解能力，对页面的布局和色彩搭配有独到的见解者优先；5、热爱电子商务，并且立志长期在此行业发展；,"移动互联网,电商",50-150人,美工,杭州
