job_name,job_url,job_location,job_salary,job_company,job_experience,job_class,job_given,job_detail,company_type,company_person,search_key,city
网点管理-门店运营管理,https://www.lagou.com/jobs/6877557.html,东莞市市辖区,6k-9k,OPPO广东移动通信有限公司,1-3年,大专,员工宿舍+饭堂 免费班车 带薪年假,岗位职责：1. 负责海外客服中心销服一体店落地以及本地运营管理融合方案的输出和落地执行；2. 负责大区整体客服业务统筹对接及落地；标准化推广、各模块专项优化等运营工作； 3. 负责策划与推广新服务产品，提炼服务亮点，整合资源高效转播，有效提升服务口碑；4. 深入大区一线，感受用户痛点，及时发现问题，协同总部及当地输出可行的服务体验改善方向及行动方案。任职要求:1、23岁以上，本科学历，熟练的听、说、读、写英语能力； 2、具备较强的逻辑思维、项目执行与策划能力，能够有效配合团队作业分工及资源统筹； 3、有较高的工作热情，能够承受较强的工作压力，性格乐观开朗； 4、有主动服务意识，能够适应海外各区域出差需求。,硬件,2000人以上,运营,东莞
战区服务运营经理(006632),https://www.lagou.com/jobs/6829154.html,东莞市市辖区,15k-20k,维沃移动通信有限公司,5-10年,本科,"股票期权,千万级用户,工作氛围好",1、负责所辖片区新开国家市场调研制定售2、负责所辖区域的服务运营工作，通过工作培训、引导监督、奖惩考核等落实总部海外客服工作方针计划方案；后服务策略，推进新市场客服体系导入工作顺畅开展；3、负责所辖区域的客服网络建设，规划网点数量、分布及类型，提升网点的易寻性及形象；4、负责推动所辖片区产品市场口碑信息及差异化需求收集工作的开展；5、负责按照总部指导及要求推进提升所辖片区客服团队线下、线上服务能力。1、思维活跃、逻辑清晰、具备良好的统筹能力及突发问题解决能力；2、优秀的客户服务意识和团队合作精神；3、有2年以上知名手机厂商海外售后服务运营管理经验者优先；4、具备较强的抗压能力。5、英语6级及以上或具备日常及商务沟通的能力。,硬件,2000人以上,运营,东莞
电商运营助理,https://www.lagou.com/jobs/6343284.html,东莞市市辖区,3k-4k,东莞市一方茶叶商贸有限公司,不限,不限,有特色的茶叶品牌电商推广,岗位描述：1：协助运营做淘宝店的运营和推广，包括日常运营、付费推广、直通车推广、淘宝客及活动营销推广等；2：协助运营做公众号商城的运营和推广，包括商城日常维护、活动营销、粉丝维护营销、分销合作推广等；3：简单协助项目在其他平台的运营；岗位要求：要求电商项目操作经验；对茶叶有基本的了解，喜欢茶文化的优先；应届毕业生和实习生均可；公司待遇：包食宿，公司团建，每月聚餐。公司信息：公司旗下茶叶品牌勐小普，主要做适合年轻职场白领的普洱茶，推广年轻群体茶文化。,电商,少于15人,运营,东莞
短视频运营,https://www.lagou.com/jobs/6954210.html,东莞市市辖区,4k-6k,东莞市一方茶叶商贸有限公司,应届毕业生,不限,短视频+电商,根据品牌文化在抖音/快手类平台，做短视频的制作和运营,电商,少于15人,运营,东莞
主播运营专员,https://www.lagou.com/jobs/7153199.html,东莞市市辖区,5k-8k,广东万臻互娱文化传播有限公司,3-5年,不限,平台好，领导很nice！,岗位职责：1、通过网络招募、拓展、挖掘、培养、管理主播，整理主播资料，建立主播团队；2、培养潜力主播，维护已有主播，配合运营部门，协助完成主播入驻直播平台引导工作；3、负责跟进主播的咨询、投诉、建议、反馈，有效处理并提出合理的解决方案；4、协助负责人优化主播招募及管理流程，建构友好和谐的主播管理制度，5、完成上级领导布置的临时工作，提高主播的整体数量，质量，并对主播的推广效果，运营数据，目标业绩负责。任职要求：1、对主播行业感兴趣；基本电脑操作，有无经验皆可2、熟悉文化娱乐产业，有丰富的行业渠道资源，有运营类似互联网平台的管理经验优先考虑3、善于沟通，性格开朗，有责任感，工作积极主动，有良好的团队意识,文化娱乐 社交网络,2000人以上,运营,东莞
淘宝天猫运营,https://www.lagou.com/jobs/7084955.html,东莞市市辖区,5k-10k,深圳市单车教授科技有限公司,1-3年,大专,"社保，弹性时间,开阔空间",工作内容：1 、推广，直通车推广能力强，经验丰富。 2 、负责收集店铺同行活动信息，分析和提炼。 3 、负责平台免费资源活动报名。 4 、负资活动执行和跟进，以及效果评估和改进。 5 、负资产品标题相关性优化。 6 、熟悉淘宝、天猫数据分析，会根据生意参谋分析产品销售状况。7 、店铺基本信息的收集与异常情况反馏；8 、业内竟争对手的经，状况与推广促梢活动收集要求：1、统招本科及以上学历，2、至少2年及以上电商运营经验，至少持续运营一家店铺1年以上。3、直通车推广能力强，实操经验丰富，有较强的数据分析能力4、熟悉淘宝天猫的平台规则。5、熟悉淘宝天猫活动规律，活动报名流程等相关规则，且有丰富的活动经验。6、热爱骑行、熟悉自行车行业，熟悉户外用品行业者优先考虑7、良好的沟通表达能力， 积极向上的心态待遇：5k底薪+提成绩效，上不封顶。可供高级单身公寓，24小时热水，空调优秀的办公环境及积极向上的宽松工作氛围大小周单双休。节假日有假期。,"电商,其他",15-50人,运营,东莞
策略运营,https://www.lagou.com/jobs/6680745.html,东莞市市辖区,8k-16k,深圳市共识科技有限公司,应届毕业生,不限,包吃包住，只要你努力最低到手8000+,1、负责操作公司的资金账户；2、对公司资金高度负责，严格执行安全控制；3、以稳定盈利为高目标；4、在公司技术操作总监的指导下，并结合自身的观点，完成每月盈利任务。5、本岗位是属于技术岗位，无需外出拉客户，男女不限；,区块链、物联网,150-500人,运营,东莞
电商运营总监,https://www.lagou.com/jobs/6970803.html,东莞市市辖区,10k-15k,东莞市爱一百食品有限公司,3-5年,大专,90后团队，包吃包住，底薪+提成，福利好,1、负责管理考核整个运营团队，有管理经验。2、负责制定整个电商部门的培训体系搭建，开展系统性培养工作。3、制定年度销售目标，并细分到每一个人、平台、月度。落地执行监督。4、有淘系、京东、拼购、社区电商等两个以上同样职位3年以上经历。5、专职，不接受任何兼职。6、曾服务过的平台年售额不低于2000万。7、有梦想，有抱负，能与公司一同成长，有希望成为合伙人更佳。8、无优秀的品德和专业素养的人勿扰。兼职或者代运营勿扰。,电子商务 移动互联网,15-50人,运营,东莞
跨境电商运营,https://www.lagou.com/jobs/7126833.html,东莞市市辖区,6k-12k,东莞市雷蒙家居科技有限公司,3-5年,大专,人性化，高提成，上班时间和工作地点灵活,wayfair跨境电商平台操作和运营管理,"电商,消费生活",15-50人,运营,东莞
新媒体运营,https://www.lagou.com/jobs/7171556.html,东莞市市辖区,3k-6k,东莞市纽凌电子商务有限公司,1-3年,不限,五险一金 绩效奖金 住房补贴 年底双薪,工作职责：1.组织参与品牌推广，协助上级进行创意提案执行并监督所负责项目的创意构思和文案撰写；2.公司简介、产品品牌、物品描述等企业文化对外文案撰写；3.产品推广文案、广告文案、推广软文、公关文案等营销文案撰写；4.收集、整理用于网络推广的相关材料，并制作成相应的推广文案；5.负责各个店铺微淘微信每日文章的推送发布，跟踪数据，完成上级任务。任职资格：1.全日制本科及以上学历，中文、广告传播、新闻、公共关系、营销策划等相关专业；2.关注并对网络热点话题具有敏锐的触觉，善于挖掘热点新闻与推广产品间的结合，富有创新意识，思路开阔；3.有较深的文化底蕴，较强的文字组织能力和语言表达能力；4.性格开朗，思维活跃，较强的动手和学习能力及创新意识；5.思路清晰，文笔流畅，能够准确表达创意构想。Benefits 福利待遇：1.五险一金，享有国家规定的法定假期，正式员工每年5-10天带薪年假。2.富竞争力的薪酬水平及调薪方案（幅度10%－50%），月度绩效奖金、年底双薪及丰厚的奖金分红。3.合理公平的晋升机制，绩效跟踪员工发展轨迹，视能力培养及提拔成为管理级别员工。4.以结果为导向考核，实行导师实训机制，员工激励计划，奖励出国培训及旅游。5.温馨舒适的办公空间，自由灵活的办公形式，为员工提供高档居家式住宿环境，办公园区配备校园式餐饮膳食机构。6.年度体检，定期组织不同形式的娱乐活动，新颖的零食文化。7.享受***15000-30000元的松山湖专属新引进人才及东莞市专项人才补贴。8.工作制：灵活考勤，办公室一周5天40小时（业务部门根据需要实行大小周轮休），仓储中心一周6天48小时。在人才战略上，纽凌致力于吸纳与培养初进入电商行业的你成为我们销售团队的核心成员甚至管理层，导师培训及绩效跟踪将帮助员工以稳定踏实的工作态度来迎接高强度的发展节奏，以打好坚实的基础来应对发展挑战。如果你具备强烈的事业心，高度的执行力以及抗压力，不甘于朝九晚五的枯燥生活，这里将为你提供不平凡的发展平台。纽凌愿伴你一起成长，助你蜕变，在公司业绩目标达成的同时，与全体员工共享利润成果。,电商,15-50人,运营,东莞
新媒体运营,https://www.lagou.com/jobs/7133296.html,东莞市市辖区,3k-4k,深圳市麦田信息科技有限公司东莞分公司,1-3年,大专,"员工旅游,下午茶","岗位职责：1、负责微信公众平台运营及品牌与业务推广；2、独立运营微信公众号，负责微信公众账号的日常运营和维护工作；3、负责微信公众账号的文案撰写、内容更新、人群聚焦、话题发起等工作；提高影响力和关注度；5、负责策划并制定微信线上活动方案以及微信原创内容的策划与编辑工作6、跟踪微信推广效果，分析数据并反馈，总结经验，建立有效运营手段提升用户活跃度，增加粉丝数量，提升企业及产品口碑。任职资格：1、有微信运营工作经验一年以上；2、具有较强的语言组织能力和营销文案撰写、策划能力；突破性思维及良好的沟通和团队协作能力；3、具有敏锐的洞察力，创新能力强，对热点事件、新闻动态等信息敏感、把握能力强，能够及时反应；4、具有良好的理解能力和团队精神，热爱本职工作，工作细心、责任心强，富有想象力和激情；5、对PS软件有一定的基础6、有相关工作经验者优先录用；欢迎加入我们的团队，融入到平等、热情、开放的设计交流环境，与和您同样优秀的设计师一起在行动中迎接新的挑战，探索更有价值的设计，创作更高品质的作品。我们不仅关注团队建设，更关心您的个人事业规划和发展。我们真诚期待您的加入，共同成长地址：东莞市虎门镇虎门大道喜来登商贸中心508室（虎门乐购斜对面）公交站台：虎门乐购镇际公交：313，313B，315，202，301,302，309，公交快线10，公交快线12，公交快线15镇内公交：虎门2路，虎门3B,虎门6路，虎门15路，虎门16路","移动互联网,消费生活",15-50人,运营,东莞
跨境电商运营,https://www.lagou.com/jobs/7123017.html,东莞市市辖区,6k-12k,东莞市曼珠沙华乐器制造有限公司,1-3年,不限,"包吃住
社保。
7个半工作制
到休",招亚马逊跨境专员。需要有亚马逊运营经验。,电商、文娱丨内容,15-50人,运营,东莞
策划运营,https://www.lagou.com/jobs/7156014.html,东莞市市辖区,4k-6k,狐狸巴巴（广东）能源投资管理有限公司,应届毕业生,本科,能源企业，创始初期，前景大好,狐狸巴巴（广东）能源投资管理有限公司，由狐狸巴巴联手洪门世纪控股集团、阿中能源投资集团、赛坤能源科技以及深圳九然生物科技于2020年3月13日所成立于新能源企业，企业落地与东莞南城寰宇汇金中心万科大厦，注册资金为3000万元。是一家业务范围覆盖油品开发投资、新能源加油站、加气站、充电桩、保税国际店建设以及相关业务管理运营等领域的综合型新能源企业。岗位职责:协助并熟悉能源板块的团队建设以及综合运营管理协助上级建立完善运营管理体系挖掘用户需求，探索公司项目用户需求的运营机制执行项目渠道的培训、售前支持、维护改善运营方案，提高运营效率任职要求:本科学历以上，优秀可放宽，19、20届，经济管理类、理工科类专业优先熟练掌握办公软件以及了解ps等设计应用思维活跃，有创业者的自觉与野性，能适应创业型能源类公司的发展与工作节奏具备敏锐的市场洞察力，高效的工作执行力，良好的沟通协作能力试用期1~3个月，单休，9:00～12:00，14:00～18:00，不加班，包中晚两餐，转正后视优秀程度给予特殊提拔，并享受公司原始期权以及分红,区块链、消费生活,15-50人,运营,东莞
运营管理,https://www.lagou.com/jobs/7150044.html,东莞市市辖区,4k-6k,狐狸巴巴（广东）能源投资管理有限公司,应届毕业生,本科,能源企业，创始初期，前景大好,狐狸巴巴（广东）能源投资管理有限公司，由狐狸巴巴联手洪门世纪控股集团、阿中能源投资集团、赛坤能源科技以及深圳九然生物科技于2020年3月13日所成立于新能源企业，企业落地与东莞南城寰宇汇金中心万科大厦，注册资金为3000万元。是一家业务范围覆盖油品开发投资、新能源加油站、加气站、充电桩、保税国际店建设以及相关业务管理运营等领域的综合型新能源企业。岗位职责:协助并熟悉能源板块的团队建设以及综合运营管理协助上级建立完善运营管理体系挖掘用户需求，探索公司项目用户需求的运营机制执行项目渠道的培训、售前支持、维护改善运营方案，提高运营效率任职要求:本科学历以上，经济管理类、理工科类专业优先熟练掌握办公软件以及了解ps等设计应用思维活跃，有创业者的自觉与野性，能适应创业型能源类公司的发展与工作节奏具备敏锐的市场洞察力，高效的工作执行力，良好的沟通协作能力试用期1~3个月，单休，9:00～12:00，14:00～18:00，不加班，包中晚两餐，转正后视优秀程度给予特殊提拔，并享受公司原始期权以及分红,区块链、消费生活,15-50人,运营,东莞
主播运营,https://www.lagou.com/jobs/7090488.html,东莞市市辖区,3k-4k,东莞斯诺机电科技有限公司,1年以下,不限,***试,1.负责在淘宝、抖音、快手平台日常直播间工作。2.主要介绍汽车音响卖点展示，录制讲解按公司要求策划主持直播促销活动，拍照，粉丝互动，增加粉丝的粘度以及引导销售的转化。3.形象气质佳，声音甜美，性格开朗，善于活跃气氛沟通理解能力强，有缓解冷场的能力。有直播销售经验优先考虑薪资：面议,"汽车丨出行,电商",15-50人,运营,东莞
课程销售加运营,https://www.lagou.com/jobs/7091853.html,东莞市市辖区,7k-12k,北京桔乐部科技有限公司,1-3年,大专,高薪,"我们正在招一名课程销售/运营人员，负责B2B和B2C销售业务。 B2B: 与线下培训机构建立关系，销售我们的课程。B2C: 利用KOL等其他线上线下推广资源，帮助培训机构招生。运营: 管理课程以及助教，并累计客户对课程的反馈 岗位薪酬：底薪（7000）+ 提成（B2B：￥1000/客户，B2C: ￥300/报名学生），上不封顶，五险没有一金。早9晚6，周一至周六，每月一周双休，国家法定节假日。 具体职责：利用人脉关系、百度、知乎、企查查等拓展B2B客户资源；跟B2B客户沟通，介绍课程，销售课程；与B2C家长客户沟通，提供咨询服务，介绍课程，销售课程；管理课程以及助教完成其他临时性工作。任职资格：
 具有两年以上B2B/B2C产品销售经验；
 有培训机构人脉关系优先；
 有用户运营、社群运营相关经验优先；
 自我驱动型，学习能力强，目标导向，具备抗压能力；
 高中以上学位（大学学位优先），普通话。
请在申请中指出您是否有相关的工作经验以及B2B（教育机构）人脉关系，多谢！",教育,少于15人,运营,东莞
天猫运营经理,https://www.lagou.com/jobs/7153060.html,东莞市市辖区,8k-12k,广东罗曼智能科技股份有限公司,3-5年,大专,包吃住、活动丰富、发展平台好，空间大,工作职责：1、负责天猫网店的整体规划、营销、推广、客户关系管理等系统经营性工作；2、负责店面日常改版策划、上架、推广、销售、售后服务等日常运作与管理工作；3、熟悉天猫操作流程和交易规则及关注相关公告发布并作出及时反应对策；4、 协调店铺与公司内部的各项资源配置，有效提高各工作绩效与能力，定期组织客服人员技能培训及KPI考核；5、制定各部门工作规范、并进行有效的客服培训管理；6、和工厂沟通落实商品的生产款式、交货日期、质检、成品数量，保证店铺的产品更新，价格议定；7、制定月度销售任务和服务水平提升目标，制定月度店铺推广预算；8、负责策划店铺促销活动方案，执行与配合天猫官方相关营销活动，带领管理团队完成预期销售目标；9、负责收集市场和行业信息，产品分析，为公司定制网销产品提供依据；10、天猫营销工具研究，优化店铺及商品排名，提出应用方案，提高入店流量，增大点击率和浏览量、转化率；11、优化产品关键词、库存和产品线，并根据实际情况微调店铺的经营方向；12、按日/周/月/季监控分析数据（营销数据、交易数据、客户关系、库存数据），定期针对推广效果进行跟踪、评估，并提交推广效果的统计分析报表，及时提出营销改进措施，并给出切实可行的改进方案；任职资格：1. 熟悉天猫网店运营规则和管理；2.有5年以上天猫店铺运营经验，精通网络推广、营销的工具及方法；3.有天猫旗舰店成功的运营经验与案例，懂天猫运营规则；4.良好的沟通及应变能力；5.强烈的责任心和事业心。,其他,150-500人,运营,东莞
团购运营专员,https://www.lagou.com/jobs/7019367.html,东莞市市辖区,8k-10k,深圳市银海电器有限公司,1-3年,本科,发展前景 、培训成长,1、负责驿站团购线下招商，对接供应商等；2、负责站长的培训、管理和日常答疑。培训内容包括销售技巧客情维系等，制定相关的课件并输出培训效果，必要时协助站长进行用户群的运营打样；3、管理站长包括根据站长的生命周期制定运营和管理策略并实施，实现团购站点的留存及销售提升；4、对接商品和供应链团队，参与选品、定价，制定销售策略及推广方案，负责爆款的打造及营销活动的策划及推广。任职资格: 1、本科及以上学历，2-5年工作经验，有快消、零售、连锁门店行业经验；2、有线下招商、营销，市场活动经验优先考虑；3、有社交电商线上营销、用户运营、活动运营、微商社群运营经验等线上运营经验更佳；4、具有较强的数据分析能力、沟通能力及表达能力；5、工作主动积极，目标导向，能够吃苦耐劳。,"移动互联网,电商",150-500人,运营,东莞
孵化器运营专员,https://www.lagou.com/jobs/6987910.html,东莞市市辖区,4k-6k,东莞绿圃科技服务有限公司,1-3年,本科,五险一金+各项法定假日+带薪年假,岗位职责：1、为客户提供项目申报、工商登记、投资融资对接等孵化服务工作；2、负责孵化器相关业务的政策研究，了解政府各类政策优惠项目、荣誉资质项目等；3、走访外界相关企业，与业界保持良好的商务互动，开拓商务资源；4、负责园区招商工作，保证出租率；5、领导交待的其它工作。岗位职责：1、熟悉政府扶持项目相关资质的申报流程，熟悉孵化器相关的政策，拥有一定的政府关系资源，有成功申报项目经验；2、文字表达能力优秀，能独立完成相关策划方案、科技项目申报书等；3、具有较强业务拓展能力，主动挖掘潜力客户，维护新老客户关系；4、一年以上科技园区或孵化器（众创空间）运营管理、商务服务、品牌管理、企业培育等相关工作经验；5、本科以上学历，具有一定的英语听说能力，能够进行一般的日常对话和交流；6、中国共产党员优先。,"企业服务,其他",少于15人,运营,东莞
电商运营,https://www.lagou.com/jobs/6781233.html,东莞市市辖区,7k-10k,广东历鼎龙动力科技有限公司,3-5年,本科,发展机遇广泛,负责 独立站的运营。负责设计公司公司的外贸独立站的设计，运营；有一定的美术基础带领导团队的经验 有一定的电商运营基础,其他,50-150人,运营,东莞
社群/自媒体运营,https://www.lagou.com/jobs/6753388.html,东莞市市辖区,5k-10k,玩家青年商业经营管理（深圳）有限公司,1-3年,大专,团队氛围好，激情创业机会,"综合岗位：主要负责独立负责事业部品牌品宣、自媒体运营、社群运营、和活动运营版块1、品牌品宣：品牌体系的建设和渠道开拓，负责公司的品牌运营价值传播,提升品牌知名度;策划和实施公司品牌活动,对品宣、活动执行效果和市场成本负责; 2、项目规划与管理：负责用户社群架构和载体的搭建与运营以及执行,整体负责社群内容,社群氛围的营造,打造高粘性的社群;3、活动策划：负责各个项目的线上线下活动策划以及推进落实，基本营销活动，抽奖活动，社群裂变等玩法，达到活跃拉新转化的效果，4、新账号搭建运营：进行竞品分析以及制作运营方案，根据项目特性制定选题以及工作规划，安排落实跟进各项工作事宜，从基础引流到拉新转化5、微商城运营：负责项目内微商城的规划与运营，根据项目特性规划商城整体首页设计风格细节需求，运用商城功能配合公众号以及微信号进行系列营销活动宣传，做商城转化收入。6、系统化运营：联合线下门店，微信号，头条号，微博号进行全面推广，针对用户群体发掘对应产品沟通对接，规划更新商城内部分类产品，规划跟进推广进度分配，推进项目前段展示更新，分销系统完善更新等7.核心用户的挖掘和互动,维系社群活跃度,与用户互动和保持联系,制造感兴趣的话题;深挖社群用户需求,定期组织有效培训;",消费生活,50-150人,运营,东莞
电商运营,https://www.lagou.com/jobs/7082797.html,东莞市市辖区,4k-7k,东莞市嘉昇科技有限公司,1-3年,大专,"五险一金 
全体90后
工作氛围轻松",主要工作内容:1.负责和商家进行商务谈判，合作.上线;2.根据系统后台数据，协助商家分析店铺经营现状;3.根据精细化运营的思路精准对商家进行运营;4.通过策略思考，持续优化营销方式，让商家经营结果更好;5.推动解决与商家合作中存在的问题。任职要求:1.执行能力强。2.有较强的沟通能力和协调能力;3.关注细节，追求**;4.学习能力强，能适应行业高速发展和个人持续进步的节奏;你将得到薪资福利:1、丰富的移动互联网行业培训、成长和发展机会;2、丰厚的薪水和绩效，公平的晋升渠道;3、完善的福利待遇(五险一金、充足年假、补助、团建、精美节日礼品)4、每月精彩不断的团队组织活动;5、节假日正常休息，单休,企业服务,50-150人,运营,东莞
