job_name,job_url,job_location,job_salary,job_company,job_experience,job_class,job_given,job_detail,company_type,company_person,search_key,city
android开发工程师,https://www.lagou.com/jobs/6921575.html,江宁区,12k-24k,南京新知艺测科技有限公司,3-5年,本科,加班补贴 弹性工作 双休,工作职责：1. 负责公司教育类APP应用设计和研发2. 负责架构的改进和性能优化3. 负责软件开发过程中的问题分析和总结，提供建议帮助改善研发流程职位要求：1.良好的Java语言基础，熟悉常用数据结构和算法，熟悉设计模式；2.熟悉Android基础架构、组件、UI、性能优化、内存优化等，对于Android的新版本新特性有一定程度的了解；3.熟悉Android系统框架、熟悉下列一个或多个模块机制原理AMS、WMS、SurfaceFlinger、View体系架构等，或其他Framework模块有开发经验者优先，或者具有丰富Android应用开发经验，且对framework学习和开发有强烈兴趣；4.熟练使用常用调试工具Android Studio、Eclipse、GDB，具备良好的分析解决问题的能力，能独立承担任务，有良好的进度把控能力；5.具备良好的团队精神和沟通意识，责任心强，工作认真细致，有良好的抗压能力；,教育 移动互联网,15-50人,android,南京
安卓开发工程师,https://www.lagou.com/jobs/5433580.html,雨花台区,15k-25k,众能联合数字技术有限公司,3-5年,本科,独角兽企业、竞争力薪酬,"职责描述：1、根据产品需求开发相关的移动产品,并验证和修正测试中发现的问题。2、分析了解客户需求，制定移动端技术方案，参与移动端产品设计。3、学习和研究新技术以满足产品的需求，根据开发过程中的体验对产品提出改进建议。4、配合市场等其他部门，提供产品相关技术支持任职条件：1、本科及以上，25-35岁2、4年以上互联网或软件企业移动APP开发经验3、熟悉Android SDK，并且开发过2款以上成熟产品，熟悉 Android 应用打包、签名、验证和安装机制。对Android系统应用管理、进程管理、内存管理机制有深入理解；4、熟悉Android平台网络数据传输，本地数据存储，以及UI框架部分；熟悉与常见网络地图、位置服务等的结合开发。5、具有微信应用开发能力和经验。具有微信电商开发经验者，优先。6、熟悉JAVA开发者优先。","移动互联网,企业服务",500-2000人,android,南京
android开发工程师,https://www.lagou.com/jobs/6470019.html,雨花台区,15k-30k,掌阅科技股份有限公司,3-5年,本科,"工作氛围好,发展空间大",1、负责掌阅客户端的功能模块以及框架开发； 2、负责对安卓前沿技术进行预研与引入从而提升产品体验；3、负责对核心与重点技术进行攻关，保障项目顺利完成；4、根据开发过程中的体验对产品提出改进建议，保证开发出体验好，稳定性好的软件；任职要求1、计算机或相关专业本科及以上学历； 2、熟悉Android开发，3年以上Android应用开发经验，深入了解Android系统以及framework； 3、精通Android平台的UI组件、图像动画、数据库、文件系统、多线程等模块的使用与开发； 4、熟悉Xml、Json，熟悉网络编程等； 5、熟练使用Android Studio等开发工具，熟悉svn Git等版本控制工具； 6、有较强的学习能力和问题分析能力，可独立调试解决问题,文娱丨内容,500-2000人,android,南京
Android高级开发工程师,https://www.lagou.com/jobs/6179327.html,玄武区,11k-22k,南京贝湾信息科技有限公司,不限,不限,"团队棒,个人成长快",关于扇贝团队：扇贝是国内知名的在线学习平台，已经拥有过亿用户，同时持续盈利。我们在分布式架构，自然语言处理等技术方面也有长期积累，结合精良的内容制作，能够为用户提供独特和优秀的产品服务。- 我们会有各种分享会，产品、设计、技术、运营、英语大家一起交流；- 我们有一个专门的活动室，工作之余可以与小伙伴一起健身、运动；- 我们每天提供下午茶；- 我们提供人体工程学座椅， 办公电脑是Mac。岗位要求：- 热爱编程，技术扎实，对高质量代码有着持续不断的追求。- 熟悉常用Android开发技术，包括但不限于Java、网络、并发、UI、性能、图片加载等。- 基础良好，对计算机系统、数据结构和算法有一定的认知，能够胜任技术预研与选型工作。- 熟悉软件迭代开发流程，理解软件工程思想，具备良好的工程能力与团队协作能力。- 对oop、代码质量、代码复用有一定的理解。- 对业务具有敏感度，有一定的领域分析能力。岗位职责：-负责管理app技术团队，参与制定并负责app的迭代，并对开发质量负责；-负责app相关产品的设计、开发和维护；-参与产品需求的沟通、讨论和协调；-编写相关技术文档等工作；-参与分析和解决产品开发中遇到的问题。,"移动互联网,教育",150-500人,android,南京
Android开发工程师,https://www.lagou.com/jobs/6179293.html,玄武区,9k-16k,南京贝湾信息科技有限公司,不限,不限,"团队棒,个人成长快",关于扇贝团队：扇贝是国内知名的在线学习平台，已经拥有过亿用户，同时持续盈利。我们在分布式架构，自然语言处理等技术方面也有长期积累，结合精良的内容制作，能够为用户提供独特和优秀的产品服务。- 我们会有各种分享会，产品、设计、技术、运营、英语大家一起交流；- 我们有一个专门的活动室，工作之余可以与小伙伴一起健身、运动；- 我们每天提供下午茶；- 我们提供人体工程学座椅， 办公电脑是Mac。岗位要求：- 熟悉常用Android开发技术，包括但不限于Java、网络、并发、UI、性能、图片加载等；- 熟悉android开发的常用框架，功能和api；- 了解oop、代码质量、代码复用，软件工程思想；- 了解常用设计模式，数据结构和算法。岗位职责：-负责app相关产品的设计、开发和维护；-参与产品需求的沟通、讨论和协调；-编写相关技术文档等工作；-参与分析和解决产品开发中遇到的问题。,"移动互联网,教育",150-500人,android,南京
安卓开发工程师,https://www.lagou.com/jobs/6932662.html,江宁区,12k-22k,孩子王儿童用品股份有限公司,3-5年,本科,平台好 福利待遇好,"一、工作职责：1、移动端程序开发：安卓、iOS端APP程序开发；安卓、iOS端SDK程序开发；2、应用集成解决方案应对：应用集成解决方案需求分析、开发；3、解决用户问题：能分析客户出现的与软件相关的问题，译出问题原因，并找到合理的解决方法；能独立处理客户的问题（包括在客户现场），并能解决客户问题；若需要其他部门配合解决，能提出解决问题的方案；4、软件方面技术资料编写：收集整理、编写新产品、新技术软件方面技术资料；整理更新现有软件方面技术资料；整理编写应用集成解决方案技术资料；二、任职条件：1、本科以上学历，计算机软件相关专业；2、精通Android开发平台及框架，一年以上实际开发经验；3、熟练掌握C/C++或者Java开发语言和环境；4、从事过安卓/iOS系统下开发，熟练掌握后端开发，熟悉了解前端开发，两年以上相关开发工作经验；5、熟悉HTML/WML/HTTP,具有良好的编程思想。",消费生活,2000人以上,android,南京
Android开发工程师,https://www.lagou.com/jobs/7024885.html,雨花台区,12k-20k,易宝软件科技（南京）有限公司,3-5年,大专,五险一金加班补助定期体检免费班车项目奖金,技能要求：AndroidUI，SocketAndroid岗位级别：中高级1、计算机及相关专业，大专及以上学历，3年及以上全职开发工作经验，参与过2个以上完整的移动互联网项目；2、了解Android多线程编程原理，熟悉线程池的使用；3、熟悉开源网络框架和图片缓存框架的使用，了解过开源框架源码；4、对Android的UI、组件、性能优化、内存优化等有深入实践；5、熟悉Android下网络HTTP协议、socket协议编程；6、了解混合框架开发，了解Android与H5交互的机制；7、熟练掌握Android平台上APP性能优化的工具和方法；8、具备较强的责任感和主动性，良好的沟通能力、团队协作精神；9、熟悉google、facebook等国外第三方框架者优先。,移动互联网,150-500人,android,南京
android开发工程师,https://www.lagou.com/jobs/6901184.html,雨花台区,13k-25k,易宝软件科技（南京）有限公司,3-5年,大专,舒适办公环境 、活泼可爱90后的小伙伴,1、扎实的Android基础，熟悉常见的Android开发模式，熟悉Android各大组件和版本之间的差异。2、熟悉多线程开发，异步开发的注意事项和开发模式。3、思路清晰、有良好的独立分析问题及解决问题的能力。4、3年及以上相关工作经验，理工科专业。5、有热情、主动性和责任心强。,移动互联网,150-500人,android,南京
android开发工程师,https://www.lagou.com/jobs/7122087.html,雨花台区,11k-14k,江苏飞搏软件股份有限公司,3-5年,本科,清晰的职业通道,"岗位职责： 1. 根据项目具体要求, 承担模块设计、开发任务, 按计划完成任务目标; 2. 负责公司移动Android应用产品的研发, 编写高质量的代码; 3. 负责公司部分Android平台SDK和模块的研发优化工作，以及某些模块的移植工作； 4. 能够胜任某个产品移动端负责人的职责。 任职资格： 1、计算机或相关专业本科及以上学历. 2、熟悉android开发，3年以上android应用开发经验，深入了解android系统，java、AndroidStudio、AndroidSDK 3、精通android平台的ui组件，数据库，文件系统，多线程等模块的使用与开发 4、熟悉xml，json，熟悉网络编程等优先， 熟悉Android的常用API, 灵活掌握各种组件和控件 5、了解Android的基本运行时机制，有较强的组件、控件定制能力 6、扎实的抽象编程/设计能力, 掌握常用的设计模式, 拥有较高的编程质量 7、掌握H5开发、有跨平台开发经验者优先 8、有较强的学习能力和问题分析能力，可独立调试解决问题","信息安全,其他",150-500人,android,南京
Android开发工程师,https://www.lagou.com/jobs/4545234.html,鼓楼区,8k-16k,南京联创信息科技有限公司,1-3年,本科,开发框架,岗位职责 1. 负责手持终端的开发环境搭建，需求分析和架构设计讨论； 2. 完成手持终端系统功能模块开发； 3. 撰写相关开发文档； 4. 参与产品单元测试，后期产品升级维护。 5. 按照项目计划在保证质量的前提下、按时完成开发任务； 6. 负责与服务器端调试，确保应用质量。任职资格：1．熟练掌握java技术，熟悉面向对象编程设计，具备扎实的编程基础； 2．1年以上Android平台开发经验； 3．熟悉Android应用开发框架及Activity生命周期、熟练进行Android UI/Framework开发技能、熟练使用Android SDK、熟练使用SQLite数据库； 4．熟悉Android各种widget组件，能根据项目要求开发自定义控件； 5．熟悉Android下网络通信机制，对Socket通信、TCPIP、http和Xmpp有一定理解和经验； 6．拥有良好的代码习惯，结构清晰，命名规范，逻辑性强。,"移动互联网,教育",150-500人,android,南京
android开发工程师,https://www.lagou.com/jobs/7079683.html,江宁区,14k-25k,上海中软华腾软件系统有限公司,3-5年,大专,五险一金 双休 良好的晋升空间,1、负责Andriod平台手机应用软件的研发工作。2、负责完成指定的软件模块的设计、编码和测试。3、负责开发文档整理和编写用户操作手册。4、 维护和优化相关的产品的质量、性能、用户体验。,"企业服务,金融",2000人以上,android,南京
android开发工程师,https://www.lagou.com/jobs/7184208.html,雨花台区,9k-15k,北京南海中天科技有限公司,1-3年,本科,试用期享转正薪资,1. 1-3年Android应用开发经验，至少有开发2款成熟的App经验；2. 熟悉Android应用程序开发框架及各种特性，熟悉常用设计模式，能独立开发成熟的Android应用；3. 掌握Android代码优化技巧，了解常用的性能优化和内存优化方法及工具；4. 熟悉Android自定义控件、事件传递机制，熟悉MVC，MVP，MVVM架构；5. 能够独立思考，有责任心，有良好的团队协作能力，能协助承担相对高难度的工作；6. 计算机科学或相关专业。 加分项，具备以下条件者优先考虑1. 熟悉React Native，Flutter，Weex等与原生混合开发技术经验；2. 熟练掌握Kotlin并运用到项目开发中。,"电商,软件开发",50-150人,android,南京
android开发工程师,https://www.lagou.com/jobs/6940276.html,江宁区,15k-25k,上海华测导航技术股份有限公司,5-10年,本科,上市公司、丰厚的年终奖、上升空间,"【工作职责】:1.负责公司Android应用软件的开发,维护和优化工作2.负责应用软件架构设计，编码与测试，开发文档编写等工作3.解决产品在使用过程中遇到的各种问题4.跟进研究行业内技术动向，做好相关产品的关键技术攻关【任职资格】:1、本科及以上学历，计算机、遥感、地理信息系统或测绘相关专业优先；2、3年以上实际工作经验，具有良好的Java、Android开发功底，能够熟练使用Android的各个组件，熟练使用服务、多线程、文件操作、数据库操作等；3、有GIS数据引擎、地图绘制、格式转换、数据管理、投影转换等相关开发经验优先；4、具备Android平台GIS程序开发经验优先；5、能够快速了解使用第三方开源库，并可以进行项目需求，进行修改适用；6、具有良好的编程习惯和自学能力，较强的沟通能力，能吃苦耐劳，工作认真负责，具有团队精神。",硬件,500-2000人,android,南京
android开发工程师,https://www.lagou.com/jobs/6357109.html,栖霞区,8k-16k,南京迈疆智能科技有限公司,3-5年,本科,五险一金 双休 大疆无人机,岗位职责：1.在Android手机上设计和开发应用程序；2.调试解决Android应用相关问题；3.编写设计开发及实现文档；4.根据产品功能需求设计并完成软件实现；5.参与产品需求分析并制定技术实施方案；6.部门领导交代的其他工作。任职资格：1、1年以上Android平台应用开发经验，能熟练阅读英文文档；2、熟悉OOP编程思想；3、熟悉Android GUI控件开发，具有自定义GUI控件的技术，熟练掌握Android UI常用布局；4、熟悉Android图形图像处理者优先；5、熟悉WEB技术(javascript、css、html5)等优先6、具备良好的编程习惯、文档写作及管理能力，良好的用户需求分析、程序设计的能力；7.要求全日制本科学历，学信网可查。,"硬件,移动互联网",50-150人,android,南京
android开发工程师,https://www.lagou.com/jobs/7206439.html,栖霞区,10k-12k,杭州无有维信息科技有限公司,3-5年,不限,团队规模大，前沿技术，交通便利，环境优越,工作职责：1、负责根据产品需求，完成产品Android端软件设计、开发及维护；2、负责相关技术文档的编制与维护；3、参与产品的需求分析并参与技术实施方案设计。任职要求：1、3年及以上Android系统APP开发经验，具有良好的代码风格及独立开发项目的能力；2、岗位要求熟悉常用数据库基本操作，如SQLite、SQLServer；3、具有扎实的Java语言基础；4、具有硬件的交付界面系统的开发经验；5、有医疗行业经验值优先。,"电商,软件开发",50-150人,android,南京
android开发工程师,https://www.lagou.com/jobs/6731154.html,雨花台区,12k-20k,南京果酱文化发展有限公司,3-5年,本科,福利待遇优厚 发展前景好,岗位职责：1、负责Android平台应用日常开发与维护。2、参与需求评审和软件的详细设计。3、跟进新技术的探索研究，应用到实际产品开发中，不断迭代优化。任职要求：1、统招本科及以上学历，1年以上Android开发经验，熟练掌握Java，熟悉Android SDK，能独立开发Android App。2、具有扎实的编程功底，良好的设计能力和编程习惯。3、有基础组件封装，架构设计，性能优化等经验，基础扎实，代码规范，了解基本算法。4、有较好的产品意识。5、积极乐观，责任心强，工作认真细致，具有良好的团队沟通与协作能力。6、热爱移动产品研发，有较强的学习能力，有强烈的求知欲、好奇心和进取心 ，能及时关注和学习业界最新的移动开发技术。,"移动互联网,文娱丨内容",15-50人,android,南京
安卓开发工程师,https://www.lagou.com/jobs/6534894.html,江宁区,13k-17k,鼎捷软件股份有限公司,1-3年,大专,14薪，带薪年假，6险1金,"工作内容：1. 根据需求文档完成相应的设计与开发；2. 能独立地进行Android客户端的开发，测试和维护；3. 能和服务端开发进行良好的配合，进行API对接调试；4. 能针对客户端具体场景的性能问题进行针对性的调优；5. 能快速开发产品原型进行功能验证；6. 能根据需求进行合理的客户端架构设计，保证良好的扩展性。岗位要求：1. 大专及以上学历，2年Android实际开发经验，具有上线应用经验；2. 熟悉安卓体系架构，能够独立开发维护APP，有电子商务类APP 开发经验者优先；3. 熟悉H5，Angular等前端编程技术；4. 精通Android各类UI组件/图形图像/网络/文件系统等模块的使用；5. 熟悉Android系统工作原理，具备较强的调试和调优技能；6. 熟悉JSON数据解析,有MVP/MVC项目架构使用经验。",其他,2000人以上,android,南京
android开发工程师,https://www.lagou.com/jobs/7055420.html,雨花台区,14k-20k,苏州精正信息科技有限公司,3-5年,本科,双休不经常加班，五险一金,1. 有4年以上工作经验，具备launcher开发相关经历，有桌面主题开发经验；2. 能快速接手和掌握新技术，有较强的独立、主动的学习能力；专业知识要求：1. 精通Android开发平台及框架原理，Android平台UI设计和常用布局，熟练使用Android SDK及相关开发工具，能独立完成基于Android的应用的开发工作；2. 熟悉Android下跨进程通信，网络通信机制，TCP/HTTP/SOCKET等协议，具有云端交互应用开发的经验；3. 熟练掌握Android性能优化方法和相关调试工具；,"企业服务,金融",少于15人,android,南京
android开发工程师,https://www.lagou.com/jobs/6830752.html,雨花台区,7k-14k,广州市易杰数码科技有限公司,1-3年,本科,福利待遇优厚 工作氛围极好,"技能要求：
 Activity的使用（生命周期等）
  数据存储的使用（SP、数据库、文件存储）
 Service的使用（简单使用，两种启动方式的区别，）
 View的使用：ListView/Recyclerview 的使用，能够清楚的知道LinearLayout/RelativeLayout中较为重要的特性
 Android内存回收机制（对象回收原理），大概了解内存泄露的原因。
 知道最基本的adb命令 （adb pull adb push 等）
 了解Handler机制，以及与线程的关系
 具有Android TV app 开发经验优先
 熟悉Android内存管理机制，性能优化方案优先
其他要求：1.思路清晰，善于思考，具备良好的需求理解能力、分析和独立解决问题的能力；2.责任心强，良好的对外沟通和团队协作能力；3.二本以上计算机，数学，通信等相关专业优先。4.两年以上安卓开发经验。","移动互联网,社交",150-500人,android,南京
android开发工程师,https://www.lagou.com/jobs/6666680.html,雨花台区,12k-18k,通服智慧物联科技（南京）有限公司,3-5年,本科,五险一金 绩效奖金 节日福利 定期团建,"1、全面参与Android App的开发，迭代和维护；2、独立实现功能需求并按照要求编写单元测试用例；3、根据文档规范要求撰写部分概要设计、详细设计等开发文档；4、负责项目技术攻关，分析解决项目中遇到的技术问题；5、遵循Android前端设计基本规范并根据开发过程中的体验对产品提出改进建议。专业要求：1. 计算机及相关专业本科以上学历，3年以上Android开发经验；2. 熟练掌握Android开发技术，语言和框架，熟练使用MVC，MVP等模式；3. 具备良好的编程习惯，能快速定位并解决开发中的难题，熟练掌握Android调试技术；4. 熟悉计算机网络知识，熟悉TCP,HTTP等网络协议；5. 在Google Play或国内Android应用市场正式发布过产品者优先；6. 具备跨平台App开发经验者优先；","软件开发,物联网",50-150人,android,南京
Android开发工程师,https://www.lagou.com/jobs/6902395.html,雨花台区,12k-24k,易宝软件科技（南京）有限公司,3-5年,大专,技术先进 扁平管理 领导nice,3年以上安卓应用开发经验，java和android基础扎实，有比较清晰的了解，沟通理解能力较好，有责任心。具体面谈。,移动互联网,150-500人,android,南京
android开发工程师,https://www.lagou.com/jobs/7144446.html,雨花台区,13k-26k,易宝软件科技（南京）有限公司,3-5年,大专,双休、项目奖金,1、扎实的Android基础，熟悉常见的Android开发模式，熟悉Android各大组件和版本之间的差异。2、熟悉多线程开发，异步开发的注意事项和开发模式。3、思路清晰、有良好的独立分析问题及解决问题的能力。4、3年及以上相关工作经验，理工科专业。5、有热情、主动性和责任心强。,移动互联网,150-500人,android,南京
Android安卓开发工程师,https://www.lagou.com/jobs/7164379.html,鼓楼区,5k-10k,南京坦道信息科技有限公司,1-3年,本科,双休、五险一金、年终奖、体检,职责描述： 1、安卓应用开发与维护相关平台搭建和开发流程优化；2、进行andriod下的app开发，负责android平台下的技术预研； 3、熟悉Android各种widget组件，能根据项目要求开发自定义控件； 4、参与公司移动APP的设计、开发、编码等工作；熟悉wedapp开发； 5、熟练掌握android界面绘制、后台运行、数据存储、网络通信等原理； 任职要求：1、熟悉移动客户端常见架构，独立完成相关功能模块；2、熟悉Android应用开发框架，能独立开发高性能的Android应用； 3、熟练应用网络API，熟悉SocketHTTP、Android线程、进程通信机制，至少参与开发过2个完整的安卓项目。 4、熟悉Android系统控件及自定义控件，能够根据应用场景合理的设计解决方案； 5、熟悉现有Android设备，有适配经验，熟悉移动设备的开发特点，性能调优； 6、有很强的事业心和进取精神，能承受一定的工作压力。 7、有强烈的责任心，优秀的沟通能力及团队合作精神；8、有着良好的编码习惯和基础，独立解决问题的能力9、有Android地图组件开发，如高德、百度、腾讯等地图组件，优先考虑。 10、有混合开发经验优先考虑,"移动互联网,数据服务",50-150人,android,南京
安卓开发工程师,https://www.lagou.com/jobs/6514007.html,江宁区,11k-17k,鼎捷软件股份有限公司,1-3年,大专,大公司，平台发展，晋升机制,"工作内容：1. 根据需求文档完成相应的设计与开发；2. 能独立地进行Android客户端的开发，测试和维护；3. 能和服务端开发进行良好的配合，进行API对接调试；4. 能针对客户端具体场景的性能问题进行针对性的调优；5. 能快速开发产品原型进行功能验证；6. 能根据需求进行合理的客户端架构设计，保证良好的扩展性。岗位要求：1. 大专及以上学历，2年Android实际开发经验，具有上线应用经验；2. 熟悉安卓体系架构，能够独立开发维护APP，有电子商务类APP 开发经验者优先；3. 熟悉H5，Angular等前端编程技术；4. 精通Android各类UI组件/图形图像/网络/文件系统等模块的使用；5. 熟悉Android系统工作原理，具备较强的调试和调优技能；6. 熟悉JSON数据解析,有MVP/MVC项目架构使用经验。",其他,2000人以上,android,南京
