job_name,job_url,job_location,job_salary,job_company,job_experience,job_class,job_given,job_detail,company_type,company_person,search_key,city
数据库管理员dba,https://www.lagou.com/jobs/7179683.html,武侯区,12k-18k,成都天府通金融服务股份有限公司,3-5年,本科,"周末双休,带薪年假","岗位职责:1、进行业务系统数据库的规划、设计、实施，设计和优化数据库物理建设方案;2、负责数据库日常管理维护，包括故障恢复、日常备份、定期监控及性能优化等；3、在数据库设计、开发、性能调优方面对开发团队的支持和指导,对开发者的数据库访问代码进行评审和优化；4、配合其他部门进行数据处理、查询、统计和分析工作；5、制定和改进应急预案、策略和相关规范；任职资格:1、3年以上DBA工作经验，计算机、软件工程、电子信息、通讯等相关专业，全日制本科及以上学历；2、可以独立承担安装部署以及MYSQL/ORACLE数据库管理维护操作，完成各种故障的定位及解决工作；3、熟悉Oracle的高可用技术管理和故障处理（RAC/Dataguard/RMAN/Goldengate等)；4、熟悉Mysql的高可用技术管理和故障处理（Group Replication/InnoDB Cluster/keepalived等）；5、熟悉Linux操作系统，具有简单的Shell、Python脚本编写能力；6、精通Mysql/Oracle的性能监控与优化，监控数据库的日常运行，性能优化，分析运行瓶颈，并提供改进方案；7、熟悉Mongodb、Redis的维护与性能优化，高可用管理。8、善于沟通，具备良好团队合作精神，能够承担较大压力，具备较强的学习能力和独立解决问题的能力。9、持有Oracle Ocp证书优先；","移动互联网,金融",50-150人,python,成都
防火墙开发工程师（成都）,https://www.lagou.com/jobs/7168464.html,武侯区,15k-25k,杭州安恒信息技术股份有限公司,3-5年,本科,五险一金 带薪年假 国内外旅游,职责描述： 1、负责防火墙产品开发与维护； 2、负责防火墙产品功能模块的概要设计和文档编写； 3、负责防火墙产品功能模块的编码调试和自测； 任职要求： 1、计算机或者相关专业本科以上学历； 2、熟练掌握C语言开发，两年以上Linux C语言开发经验； 3、熟悉python或者go开发语言，具备项目开发经验； 4、熟悉TCP/IP协议，了解传统路由交换协议，有底层网络数据面研发经验； 5、熟悉Linux 内核网络协议栈； 具有以下条件者优先： 1、有过Linux内核网络协议栈开发经验者优先； 2、有过dpdk、vpp、netmap等高性能网络开发经验者优先； 3、有过硬件交换机，防火墙，路由器等网络设备研发经验者优先,"信息安全,数据服务",500-2000人,python,成都
java开发工程师,https://www.lagou.com/jobs/7038925.html,郫县,8k-14k,易宝软件科技（南京）有限公司,1-3年,本科,五险一金，周末双休，加班补助,"后端开发，java1、二本以上学历，计算机软件或相关专业，1年以上java开发经验；2、精通 (Java && SSH / SpringMVC&MyBatis),对框架源码级有研究者优先考虑；3、精通MySQL的使用，熟悉分布式数据库的设计与优化；4、有MongoDB、Redis、Memcached等缓存数据库开发经验；5、熟悉Linux操作系统，掌握该系统下常用命令和工具的使用，熟悉脚本语言（shell、perl、python）更佳；6、擅长Java性能调优，对大型分布式系统有较深入的研究，具备高并发高可用性系统开发经验者优先；",移动互联网,150-500人,python,成都
渗透工程师,https://www.lagou.com/jobs/7140007.html,高新区,10k-20k,成都无糖信息技术有限公司,不限,大专,福利完善 地铁周边 年轻团队 扁平管理,"岗位基本要求：1.熟悉渗透步骤，具备独立开展实战渗透的能力2.熟练掌握渗透基础工具和基础漏洞原理3.熟悉各类攻击技术,具备手工渗透能力，对常见的waf绕过有独到的见解4.熟练使用一门脚本语言(python/java/php/.net/perl)5.具备一定的代码审计能力(java/php/.net/asp)岗位特殊要求:1. 两年以上安全行业工作经验2. 对常见Web安全漏洞的原理、危害、利用方式及修复方法有较深入理解；3. java代码功底深厚4. 可以熟练利用各类java漏洞，对相关漏洞有过研究并5. 对相关java web容器有过漏洞研究注：对Java安全必须熟练！薪资8-20K","信息安全,数据服务",50-150人,python,成都
后端开发工程师,https://www.lagou.com/jobs/2597224.html,高新区,12k-18k,成都乐动信息技术有限公司,1-3年,本科,"团队佳,薪资给力,氛围活跃",工作职责：1、 负责大容量、高可用的后台系统开发、维护；2、 负责API设计、开发及维护；3、 负责线上问题的查找和修复；4、 负责参与产品架构设计。任职要求：1、 本科及以上学历，两年以上互联网或移动应用产品开发经验，尤其是大规模并发系统架构经验；2、 熟悉MySQL的使用；3、 有Redis 、Memcached等缓存数据库开发经验；4、 熟悉规范的软件开发流程，善于自学、探索、协作和执行；5、 至少精通一种后台开发语言，如C++、GO、Python等；6、 尽责，认真，有梦想！,移动互联网,150-500人,python,成都
算法工程师,https://www.lagou.com/jobs/7202593.html,武侯区,12k-20k,成都乐动信息技术有限公司,1-3年,本科,"团队氛围好,运动型团队,行业标杆",岗位职责:1.设计算法提升咕咚App的运动记录准确性。2.设计运动记录防作弊算法，增强线上赛事平台公平性。3.研究追踪人体姿态动作算法，识别各类健身动作。岗位要求:1.数学、计算机、自动化等相关专业，本科学历以上。2.具有一定的编程能力，熟练使用Python，SQL，R，Matlab一种或以上。3.数学基础扎实，熟练掌握概率统计、矩阵理论、**化的基本理论。4.熟悉机器学习原理与算法，熟练使用分类、聚类、神经网络模型解决有挑战性的问题。5.较强英语阅读能力，可以熟练检索和查阅英文文献。加入咕咚，你将获得：1、只有你想不到，没有咕咚做不到的福利活动；2、五险+商业险+工资10%住房公积金，一两个月的公积金缴存额就相当于别人交一年哟；3、结婚生子这种人生大事，咕咚也真心为你感到高兴，但心意却必不可少；4、提需求，改bug被掏空了吗？没关系，有美味的点心让你欲罢不能，饿货，来份下午茶吧；5、每月多样化的团建活动，看山看雪看那春暖花开，吃香喝辣尝遍天下美食；6、智能健身房+跑团活动等你临幸，麒麟臂、马甲线将是你的标配，让你成为人群中一道靓丽的风景线；7、这里盛产高颜值的技术控，小哥哥小姐姐们的颜值高到冲破天际；8、这里还有活力无限的boss们等你随时来撩。想要加入独角兽企业，加入新经济100强企业，咕咚将是你的不二之选，做一个让你周围小伙伴为之羡慕的咕咚人，想想都有点小激动呢~你，还需要犹豫吗？,移动互联网,150-500人,python,成都
Go 语言高级开发工程师,https://www.lagou.com/jobs/7134319.html,武侯区,18k-25k,杭州隆埠科技有限公司,5-10年,大专,五险一金，团队氛围好，试用期薪资不打折,"职位诱惑：
 五险一金，团队氛围好，试用期薪资不打折；
 办公地点在高端的天府四街 OCG，良好的办公环境；
 上班不打卡，每个人配备 MacBook Pro + 27 寸 4K 外接显示器； 
 后端岗位我们希望招聘到经验丰富的，不一定非得是 Go 语言，如你掌握 Ruby、Python、Java 等其他后端开发，也可通过；
 入职将会有专业指导 Go 语言、React、前端、Ruby、Rails 等工作需要的常用技能；
职位描述：
 理解业务需求，负责日常产品设计与开发；
 有需要的情况下参与中间件的设计与开发；
 与运维合作，部署维护自己的服务模块；
 参与技术合作方沟通和协同开发（需要英语）；
 我们期望有丰富的业务系统开发经验；
职位要求
 5 年以上互联网项目后端开发经验，并且需为业务系统开发经验；
 有机器学习、自然语言处理相关经验会有很大加分；
 这个岗位对前端方面没特别要求，但假如你是全栈工程师一定会有很大的加分；
 有数据库日常设计开发以及优化经验（MySQL、PostgreSQL）；
 熟悉 Docker、Kubernetes 会加分；
 可以用英语写文档以及书面沟通；
 熟练使用 macOS 以及 Linux 提供，掌握 Git 技能；
加分项
 有金融行业开发经验；
 有异地多活开发经验；
 英语流利；
 有机器学习、自然语言处理相关工作经验；
 全栈工程师能力；",数据服务,50-150人,python,成都
Ruby / Rails 高级开发工程师,https://www.lagou.com/jobs/7134253.html,武侯区,18k-25k,杭州隆埠科技有限公司,5-10年,本科,五险一金，大牛团队，环境好,"职位诱惑：此岗位为招聘 Ruby 社区经验丰富的同学，加入即可与 Ruby China 创始人 @huacnlee 一起工作。实际工作内容包括 Ruby 相关的业务系统开发和 Go 语言的系统开发，此岗位面试以 Ruby、Rails 和后端开发相关经验为主，入职我们将会培训 Go 语言、React、前端、Ruby、Rails 等工作需要的常用技能；
 五险一金，团队氛围好，试用期薪资不打折；
 办公地点在高端的天府四街 OCG，良好的办公环境；
 上班不打卡，每个人配备 MacBook Pro + 27 寸 4K 外接显示器； 
 后端岗位我们希望招聘到经验丰富的，不一定非得是 Go 语言，如你掌握 Ruby、Python、Java 等其他后端开发，也可通过；
 入职将会有专业指导 Go 语言、React、前端、Ruby、Rails 等工作需要的常用技能；
职位描述：
 理解业务需求，负责日常产品设计与开发；
 有需要的情况下参与中间件的设计与开发；
 与运维合作，部署维护自己的服务模块；
 参与技术合作方沟通和协同开发（需要英语）；
 我们期望有丰富的业务系统开发经验；
职位要求
 5 年以上 Ruby / Rails 相关工作经验，熟悉 Ruby、Rails；
 熟练的前端能力，全栈能力，掌握 HTMl / CSS / JavaScript；
 数据库日常设计开发以及优化经验（MySQL、PostgreSQL）；
 熟悉 Docker、Kubernetes 会加分；
 可以用英语写文档以及书面沟通；
 熟练使用 macOS 以及 Linux 提供，掌握 Git 技能；
加分项
 有金融行业开发经验；
 有异地多活开发经验；
 英语流利；",数据服务,50-150人,python,成都
运维工程师,https://www.lagou.com/jobs/7012858.html,武侯区,5k-10k,成都艾乐橙文化传播有限公司,3-5年,不限,年终福利 、带薪寒暑假期,"一、我们需要您：1、监控软件系统网站的运行状况，保证网站高可用率; 保障软件系统（包括网络，应用系统，电话系统）正常运行2、大规模集群的系统运维、服务监控分析、故障排查，以及紧急情况下的应急处理3、记录每天维护的日志和故障报告4、负责设计、搭建和维护各个项目业务系统的运行环境，包括服务器架设、网络及安全配置、系统软件安装配置及优化等二、我们期待这样的您：1、深入理解Linux系统，了解常用网络技术，熟悉DNS, CDN, TCP/IP、HTTP/HTTPS等协议，有良好的网络、计算机体系结构方面的知识2、熟悉HDFS/Mysql/Redis/ES/RabbitMq/Nginx/NODEJS/ELK/Zookeeper等部署，会Shell、Python脚本语言者优先3、具有Docker、 Kubernetes部署经验，熟悉Docker使用并具备一定的容器使用经验优先；了解devops相关工具。例如 git ,jenkins 等4、能承受故障突发、抗压能力强，具备较强的表达、沟通、协调能力，有强烈的责任心5、学习能力,分析问题能力强，具有良好的团队协作精神三、我们能给您的：1.乐享假期：带薪寒暑假（7-15天），惊不惊喜，意不意外，是的，我们有寒暑假2.公司平台：已获得三轮一线资本融资，素质教育准独角兽创业公司3.工作氛围：友爱活泼的年轻群体，多才多艺的萝莉御姐鲜肉，帅哥多多，美女多多4.日常福利：超多节假日小礼品5.日常活动：定期的团队建设、年度出游、读书会等6.内部福利：学舞蹈（街舞、中国舞等）更轻松，亲朋好友优惠多多","教育,文娱丨内容",500-2000人,python,成都
数据分析（建模）,https://www.lagou.com/jobs/6849885.html,高新区,10k-20k,成都市映潮科技股份有限公司,1-3年,硕士,"带薪年假,假期福利,年终奖,扁平化管理",岗位职责：1． 深入理解业务，对业务中面临的问题进行详细分析，通过收集、整理的数据，构建合理的算法模型，解决问题，提高工作效率与质量2． 对数据进行深入挖掘，利用回归、决策树、时间序列、神经网络等机器学习技术建立预测预警模型，发现数据潜在的价值及隐藏的信息，发现新的行业变化趋势和潜在的机会，为产业及公司的运营优化提供支持； 3． 参与各类业务报表的设计、开发、实施与跟踪，参与创新方法和应用的研发，充分挖掘数据的商业价值；4．领导安排的其他临时事项。任职要求：1． 统计、管理、数理、计算机全日制研究生以上学历，学历学位双证齐全；2． 2年以上相关工作经验，有基于大型数据库系统的数据挖掘、建模分析经验；3． 精通SQL语言，熟练掌握Python、SAS、R等其中一种建模语言；4． 具有较强的学习能力、分析能力、解决问题能力、沟通协调能力以及创新能力，强烈的工作责任感。,数据服务,50-150人,python,成都
数据分析师-挖掘方向,https://www.lagou.com/jobs/4289973.html,高新区,8k-15k,成都市映潮科技股份有限公司,1-3年,本科,"五险一金,年终奖,带薪年假,大数据",岗位职责1. 根据公司产品设计方案进行数据探索、选择和实现数据挖掘算法、构建数据挖掘模型，对算法和模型进行优化；2. 负责数据挖掘结果汇报，撰写汇报PPT，演示汇报成果，收集汇报意见并改善；3. 探索公司存量数据价值；4. 与研发等部门的工作沟通与对接。 岗位要求1. 统计、数学、信息技术相关专业本科以上学历，大数据行业1年以上工作经验；2. 扎实的机器学习理论基础，熟悉分类、回归、聚类等常用的机器学习/数据挖掘方法，有机器学习实践经验；3. 熟练掌握python/R进行数据处理与分析；4. 熟悉SQL数据库，有处理海量数据经验优先；5. 思维灵活，富有创造力和想象力，对数据敏感，积极探索公司存量数据价值；6. 良好的跨团队、跨部门沟通及推动能力以及团队合作精神。,数据服务,50-150人,python,成都
产品运营主管（数据运营）,https://www.lagou.com/jobs/7217457.html,武侯区,6k-8k,成都方源房地产咨询服务有限公司,3-5年,本科,五险一金，大平台，年底双薪，带薪年假,岗位职责:1、通过数据监控、数据报表搭建、专题数据分析等方法，帮助梳理产品运营的各类关键数据，驱动业务优化迭代，完成目标；2、能够理解产品、运营和业务场景，通过数据分析洞察业务关联；3、根据数据结果和业务需求，提出运营或产品解决方案，推动业务落地；4、跨部门、跨团队沟通协作、数据赋能，保证数据产出符合业务需求；任职要求:1、对数据敏感并有很强的洞察能力，快速从繁杂数据中发现问题；2、极强的业务学习能力，能够把数据和业务紧密联系，对房地产行业有一定了解为佳；3、具备良好的团队融合、协调沟通能力和抗压能力，能够推动数据和运营方案实施；4、1年以上数据运营或数据分析经验，熟练使用SQL 表连接/表聚合/字符串截取/时间函数/窗口函数等功能进行相关数据分析，具备一定独立分析能力，在熟练使用SQL的基础上，会Python、R、SPPS等其他语言分析工具的优先；5、有互联网从业经验者优先。,"移动互联网,房产家居",2000人以上,python,成都
高级金融分析师（企业反欺诈方向）,https://www.lagou.com/jobs/7173808.html,高新区,18k-28k,北京中经惠众科技有限公司,5-10年,本科,全额五险一金 通讯补贴 员工生日 双休,工作职责：1、负责小微企业金融产品的欺诈风险管理工作，制定反欺诈风控方案并推动部署落地。2、梳理业务流程中存在的风险点，设计针对性的反欺诈风控策略、风险识别模型与异常侦测机制。3、跟踪核心业务指标变化，建立实时风险监控体系，监测和分析风险策略执行情况和效果，以定量评估为基础，持续优化和完善风控方案。4、针对历史风险案件进行深度挖掘，刻画特征和作案链路，制定前瞻性的风控策略。5、推动新型反欺诈技术手段在业务中的落地应用。工作要求： 1、本科以上学历，有3年或以小微企业风险分析相关经验，行业包括银行、第三方支付机构、互联网金融等；2、曾负责欺诈策略或模型，且曾产出相关分析报告；3、熟练使用SQL，熟练使用Python进行数据分析与建模，有建立风险计量模型的实际经验；4、良好的沟通能力和表达能力，工作细致认真，能快速响应业务、政策、产品迭代需求。,"金融,企业服务",50-150人,python,成都
高级金融分析师（小微企业信用风险建模）,https://www.lagou.com/jobs/7173790.html,高新区,18k-28k,北京中经惠众科技有限公司,5-10年,本科,全额五险一金 通讯补贴 员工生日 双休,职责描述：1、 依据公司体系内外海量数据，构建小微企业画像指标体系，企业标签算法开发，对数据进行加工、清洗，运用各种统计方法对企业特征进行深度挖掘研究；2、 参与小微企业信用风险模型的设计、开发、测试、部署、更新迭代等全流程工作；3、 研究国内外先进的大数据及和算法，并结合公司项目需要，探索把这些技术运用到小微企业信用风险管理中  职位要求：1、 计算机、数学、统计等相关专业本科以上学历，有3年或以上数据分析或建模相关经验，行业包括银行、小贷公司、互联网金融等；2、 扎实的数学及概率统计基础，数据相关数据挖掘理论与算法，包括但不限于逻辑回归、决策树、支持向量机等；3、 熟悉使用SQL，至少掌握一种数据分析与挖掘语言，包括但不限于Python/R/SAS；4、 具有较强的业务理解能力，能够以业务的视角，从数据中发现有效的业务特征或潜在的风险，并给出有效的建议，有小微企业建模经验值优先；,"金融,企业服务",50-150人,python,成都
中间件工程师,https://www.lagou.com/jobs/6935351.html,武侯区,10k-20k,北京中科物安科技有限公司,3-5年,本科,发展空间大,中间件研发工程师-成都 1. 负责公司B/S架构软件产品线后台系统研发工作，并保证服务正确性、稳定性及安全性；2. 负责开发框架的搭建及改进，负责项目功能模块的开发；3. 配合前端技术人员按计划完成项目开发任务；4. 参与系统架构设计、需求评审、技术选型等过程环节，配合完成相关技术文档；5. 协助完成项目的测试、系统交付工作，对项目实施提供技术支持；6. 负责跟进服务器安全、稳定、维护和性能优化等工作;任职要求：1. 本科及以上学历，2年以上软件开发工作经验，擅长Web后端相关开发经验者优先；2. 精通Java语言开发，熟悉多线程编程，编程功底扎实，精通Java和面向对象编程，对JVM的原理有一定的了解；3. 熟练使用SSM、SpringBoot等各类Java开源框架，熟悉Tomcat，Nginx等开源软件的配置及运行原理4. 熟练掌握LINUX系统命令操作、具备Tomcat、Jboss部署及应用开发经验；5. 熟悉运用常用的J2EE开源框架，如 Struts2、SpringMVC、Spring、Hibernate、MyBatis等开源框架；6. 熟练使用Oracle/SQLServer/Mysql等主流数据库开发、熟悉SQL，并具有一定性能优化经验；熟悉ActiveMQ消息队列的使用；7. 熟悉TCP/IP、HTTP、MQTT等常见网络协议，熟悉基于Dubbo、SpringCloud、ServiceMesh等微服务的系统架构设计经验，熟悉Restful API接口设计；8. 熟悉C/C++、Python、Go等其它开发语言，并具备相应项目开发经验者优先；9. 有全栈开发经验或大型分布式系统开发经验者优先；10. 具有强烈的责任心和上进心，有良好的团队合作精神，工作积极主动；,信息安全,50-150人,python,成都
数据分析/数据科学研究员,https://www.lagou.com/jobs/6216429.html,双流县,10k-20k,微慕客（成都）科技有限公司,3-5年,本科,五险一金 弹性工作 扁平管理 微软项目,工作职责：1.学习微软官方发布（更新）的数据分析/数据科学等课程，总结知识点，撰写相应的知识点文案2.根据总结的知识点内容进行数据分析/数据科学等课程的设计与开发工作，编写课程大纲、课件以及学生手册并录制相应中文解析视频3.负责课程实验（课程作业）的脚本编写工作，并且录制详细的代码/项目解析视频4.指导研究员助理完成日常的字幕、文案资料翻译整理工作以及学习平台后台配置工作5.配合公司活动宣传的需要进行对内以及对外的公开课、路演工作6.协助产品部门完成课程的迭代与打磨，逐步完善课程开发工作7.协助市场部门进行课程咨询工作，帮助客户更好的了解课程内容，了解客户的需求以不断改善课程内容设计职位要求：1.扎实的英文和机器学习背景；计算机，统计学，数学，金融，数据挖掘、理工科等相关专业本科及硕士以上学历2.两年以上数据分析/挖掘相关工作经验；熟悉数据分析流程，数据敏感度及逻辑能力强，有清晰的思路和数据建模方法论3.熟悉分类、回归、聚类等数据统计模型，具有一定的建模经验，善于从数据中挖掘出问题，做过定量、定性分析者优先4.熟练使用Python、T-SQL等编程语言，能够灵活运用PowerBI/Excel等数据分析工具者优先5.具备较强的规划和统筹能力，有较好的学习驱动力及有效的学习方法6.具备良好的文字表达能力和沟通能力，擅长与内部及外部合作团队交流沟通，具有优秀的报告讲解能力7.有责任心，可以承受较大的工作压力；富有团队合作精神、执行力强8.有PAAS、SAAS经验，熟悉Azure、培训工作经验，课程设计、开发和讲授经验者优先“获得微软MPP认证者面试可获得加分(MPP - Microsoft Professional Program) ”,数据服务,50-150人,python,成都
高级c++工程师,https://www.lagou.com/jobs/7206761.html,高新区,14k-20k,成都云智天下科技股份有限公司,5-10年,本科,交通便利 办公环境好,岗位职责：1、根据产品需求文档完成项目系统架构，模块设计、编码及性能优化。2、持续改进软件系统架构、核心算法或者核心技术等，保证系统高性能、高可用性和高可扩展性；3、负责改进系统的性能、可扩展性、稳定性、安全性；4、负责项目开发过程中的底层技术攻关及运行中出现的技术问题；5、能独立支撑大、中型项目研发，包括设计、编码、上线等。岗位要求：1、本科及以上学历，有5年左右C/C++工作经验；2、网络基础扎实，精通TCP/IP协议。3、具备扎实的C/C++基础，有相关的开发经验和问题排查经验；有python和go的开发经验；4、熟悉Linux系统编程，比如文件、网络、多线程、多进程等；5、熟练使用svn、git、makefile等项目管理、版本控制工具；6、有嵌入式Linux编程经验和驱动开发经验，熟悉如何如何通过软件控制硬件；7、熟悉公钥密码体系，有SSL编程经验。福利待遇：1、享有六险一金；2、享受国家法定节假日；3、工作满一年可享受带薪年假；4、节假日福利、员工生日会；5、享受优秀员工奖、公司员工活动；6、享受公司培训，并为优秀员工提供外训机会。 工作时间：9:10-18:10（午休1.5小时），周末双休,移动互联网,50-150人,python,成都
