job_name,job_url,job_location,job_salary,job_company,job_experience,job_class,job_given,job_detail,company_type,company_person,search_key,city
安卓,https://www.lagou.com/jobs/6950768.html,雨花台区,13k-25k,江苏润和软件股份有限公司,不限,大专,双休、五险一金、年底双薪,招聘条件 1、工作年限3年以上 2、工作地点华为南京研究所 3、专科及以上学历，计算机科学或软件工程等相关专业 4、良好的的团队协作和沟通能力，表达及抗压能力 5、良好的责任心和事业心 招聘岗位和技能要求 工作职责： 1.参与云服务重点业务Android App和SDK开发； 2.负责重点特性的看护，包括UX体验，功能特性，基础组件集成等； 3.根据产品需求开发版本和特性，迭代演进； 任职要求： 业务技能要求： 1、计算机软件工程数学等相关专业，3年以上软件项目开发的工作经验，熟悉Android Studio工作工具，熟悉Git。 2、思维敏捷，对新技术敏感，有较强的钻研学习能力； 3、良好沟通和团队合作能力，具备很强的问题分析及解决能力有代码洁癖，愿意深究问题根源； 专业知识要求： 1. 熟悉Android常用框架(GlideGreenDAORetrofit等)及UI体验，有Android应用层项目经验者优先； 2. 熟悉Webview，有webview优化经验者优先； 3. 熟练掌握常用设计模式并具有Android代码架构设计经验； 4. 具备扎实的编程基础和良好的编程习惯，团队协作性好，沟通能力强； 5. 熟练使用Git、SVN，善于追踪Android最新技术，跟踪框架、组件的发展趋势，对技术有热情；,移动互联网,2000人以上,android,南京
android开发工程师,https://www.lagou.com/jobs/7082480.html,雨花台区,16k-25k,武汉佰钧成技术有限责任公司,不限,本科,六险一金，弹性工作制，周末双休，季度奖金,1. 本科及以上学历，计算机相关专业，至少5年以上Android开发经验2. 具备2年及以上Android APP开发经验，能独立承担Android APP开发与维护3. 具备3年及以上Android Framework开发经验，能够独立解决Framework疑难问题4. 熟练掌握Java语言，以及常用设计模式5. 具备良好的沟通能力，思维敏捷，思路清晰，工作积极主动，能够承受较大工作压力6. 有手机行业工作经验，精通英语读写，能正常口语交流者优先,移动互联网,2000人以上,android,南京
Android开发（高级）工程师,https://www.lagou.com/jobs/5228912.html,玄武区,20k-40k,北京字节跳动科技有限公司,3-5年,本科,六险一金，弹性工作，免费三餐，租房补贴,,文娱丨内容,2000人以上,android,南京
Android研发工程师-南京,https://www.lagou.com/jobs/6753074.html,雨花台区,15k-30k,掌阅科技股份有限公司,3-5年,本科,双休，交通补贴，14薪,工作职责               1、负责掌阅客户端的功能模块以及框架开发；2、负责对安卓前沿技术进行预研与引入从而提升产品体验；3、负责对核心与重点技术进行攻关，保障项目顺利完成；4、根据开发过程中的体验对产品提出改进建议，保证开发出体验好，稳定性好的软件；               任职要求               1、计算机或相关专业本科及以上学历；2、熟悉Android开发，3年以上Android应用开发经验，深入了解Android系统以及framework；3、精通Android平台的UI组件、图像动画、数据库、文件系统、多线程等模块的使用与开发；4、熟悉Xml、Json，熟悉网络编程等；5、熟练使用Android Studio等开发工具，熟悉svn Git等版本控制工具；6、有较强的学习能力和问题分析能力，可独立调试解决问题,文娱丨内容,500-2000人,android,南京
安卓开发工程师（驻场）,https://www.lagou.com/jobs/6808998.html,建邺区,10k-15k,彩讯科技股份有限公司,3-5年,大专,五险一金 司龄津贴 年度旅游,岗位职责：电信行业互联网新文娱领域相关应用分发、计费融合、流量经营、游戏运营、知识店铺、线上广告等业务的安卓开发工作。任职资格：1、熟悉Android开发，具备Android项目开发经验；2、熟悉Android常用组件，如HTTP、TCP通讯、音视频、 图片加载引擎、数据库、fragment、webview、push推送、自定义控件；   3、熟悉掌握Android SDK，自定义组件的实现，熟练使用Android Studio；4、熟悉Android内存管理，熟悉性能调优；5、有跨端开发经验优先；6、具有良好的沟通能力，责任心及团队合作精神；7、3年以上相关岗位工作经验。,"移动互联网,消费生活",500-2000人,android,南京
android开发工程师,https://www.lagou.com/jobs/6972922.html,雨花台区,13k-25k,拓维信息系统股份有限公司,3-5年,本科,项目奖金,"岗位职责：1、负责Android软件的设计和开发；2、参与软件需求分析，进行模块概要设计，模块详细设计，代码编写，单元测试等工作；3、参与移动平台软件框架的研究，设计和实现、关键技术验证和选型等工作；4、负责性能调优、架构改进、新技术引入，负责技术难点攻坚；5、与产品经理对接需求，编写必要的工作文档，对APP的编程质量、稳定性、用户体验负责；任职资格：1、统招本科，理工科专业，至少2年以上Android平台应用开发经验；2、熟练掌握Android应用开发框架，基本空间的使用，平台UI设计布局，能够独立完成开发，解决验证和修正测试中发现的问题；3、具备扎实的Java编程基础及良好的编程习惯；4、熟悉网络编程、基于多线程、SOCKET、HTTP等方面编程；5、有良好的面向对象分析、设计能力和良好文档习惯；6、学习能力强，思维敏捷,喜欢钻研、具有独立分析问题和解决问题的能力；7、责任心强，工作态度积极，对产品细节敏感。","移动互联网,教育",2000人以上,android,南京
android开发工程师,https://www.lagou.com/jobs/6838199.html,玄武区,10k-12k,南京矽汇信息技术有限公司,1-3年,本科,"五险一金,年终多薪,春游秋游,节假福利",职位描述1、负责Android平台下的APP的开发、迭代和维护工作；2、根据产品需求能够完成APP的开发，验证和修复Bug；3、按照项目计划，按时提交高质量代码，完成开发任务。职位要求1、2年以上Android项目开发经验；2、精通Java，具备扎实的编程基本功和良好的编程习惯；3、精通Android API，精通Android各种UI组件。熟悉Android下网络编程，熟悉Sqlite数据库及Android多线程开发，熟悉Json /XML，能独立分析和解决开发中的技术问题；4、具有良好的言语表达能力，善于与人沟通、合作，有良好的团队意识及高度责任心。,"医疗丨健康,消费生活",150-500人,android,南京
安卓framework,https://www.lagou.com/jobs/6991103.html,雨花台区,10k-20k,南京睿晖数据技术有限公司,1-3年,大专,五险一金,1.Android Framework 层软件设计、开发、移植和调试；2.负责Android中间层核心组件的定制和维护，并进行中间件模块的设计和开发；3.负责Rom的定制和维护。,"企业服务,数据服务",150-500人,android,南京
android安卓开发工程师,https://www.lagou.com/jobs/7192961.html,浦口区,10k-15k,南京魔苹网络科技有限公司,3-5年,大专,双休旅游年底双薪调薪餐补交补体检,1.计算机相关专业大专以上学历，熟悉 Android 系统架构及相关技术，至少4年以上的 Android 平台实际开发经验；2.熟悉无线网络应用开发，精通 socket 和 http 网络接口编程；3.熟悉 Android 底层图形库，熟悉 Android平板开发；4.熟悉 xml、json 组装解析；5.熟悉 Android 常用框架与第三方 SDK6.思路清晰，思维敏捷，快速的学习能力，良好的英文资料阅读能力；7.有 Android 完整产品开发经验者优先考虑。我们对员工的期望：你可以技术不过硬，但希望你勤恳好学。你可以文字功底不强，但希望你敢想敢写。你可以工作经验不丰富，但希望你勤于总结。你可以什么都不会，但一定要有一颗无与伦比的责任心！福利待遇：为所有正式录用的员工提供五险一金保障；双休，弹性工作制，作息规律，极少加班；全体正式员工享受过节费；每季度旅游；年底双薪；下午茶；无息贷款；完善的调薪制度（***达30%）；生日宴会；婚丧嫁娶现金福利；季度/年度优秀员工评选；餐补、交通补贴、话费补贴；常规性体检；工龄工资；推荐奖金。,"移动互联网,文娱丨内容",50-150人,android,南京
安卓android工程师,https://www.lagou.com/jobs/6505559.html,江宁区,10k-16k,南京智杰物联科技股份有限公司,3-5年,本科,期权 晋升空间 未来合伙人,"岗位职责：1、负责Android软件产品的系统分析与设计工作，承担核心功能代码编写，开发与维护系统公用核心模块；2、按照项目计划按时提交高质量的代码完成开发任务；3、能及时配合后台联调接口并及时解决技术瓶颈性问题；4、负责修复功能缺陷、优化性能，提高应用运行的性能和体验；5、对代码的规范、API接口的编写、接口约束条件、代码维护性具有良好规范性；6、解决项目开发中的问题、问题跟踪以及反馈解决；7、研究新技术，满足产品的需求。任职要求1.统招本科或以上学历，计算机及理科相关专业；熟练掌握java语言，深刻理解java各种常用方法原理，3年以上Android开发经验；2.精通AS开发工具，熟练使用相关辅助工具，熟练5.x、6.x、7.x、8、P  Android SDK各种特性；3.熟练使用Android自定义控件、事件传递机制、Activity、Fragment、Service 生命周期管理；4.精通Frame、Tween动画效果(旋转、缩放、渐变等)，精通Property属性动画的开发实现；5.熟练掌握UI设计常用布局、动画特效，熟悉控件触摸动作捕获（拖拽、移动、多点触摸等）；6.熟悉常见UI特效原理（下拉刷新等），UI绘制、View渲染策略，熟悉大量常用开源第三方库；7.熟练运用Android json/xml解析，HTTP HTTPS协议、Android多线程操作，加密和Socket网络通信；8.熟悉Android框架及各种特性，熟练运用面向对象编程，至少深入理解5种以上常用设计模式，并且运用到项目中；9.有智能家居（或熟悉NDK开发，熟悉JNI、binder等相关技术,有c/c++开发经验）开发经验者优先录用；10.工作积极主动有强烈责任感和严谨的工作作风，较强执行力和沟通能力对移动产品浓厚兴趣。非外包",其他,15-50人,android,南京
android开发工程师,https://www.lagou.com/jobs/7105984.html,雨花台区,12k-20k,易宝软件科技（南京）有限公司,3-5年,本科,五险一金 弹性工作时间 法定节假日,1职位要求:1三年以上android平台开发经验，熟练使用eclipse、androidsdk等开发工具进行开发，了解android框架api；主导过一个以上开发项目者优先。有成熟作品者优先；2.构建软件产品的系统架构，包括软件设计、编码和验证；3.根据产品需求和概要设计写出产品详细设计文档，对指定模块和功能编码实现，参与相关技术难点攻关；4.熟悉Android平台UI设计规范，对Android控件的理解较深，能够按要求实现自定义UI和功能；5.热爱开发工作，乐于学习，积极主动完成工作任务。福利待遇： 1.同行业中具有竞争力的薪资水平，每年一次年度调薪机会； 2.加纳五险一金，实行双休工作制； 3.享受带薪年休假和法定婚假、产假、哺乳假等； 4.端午、中秋等节假日发放过节礼品； 5.生日礼物。,移动互联网,150-500人,android,南京
android开发工程师,https://www.lagou.com/jobs/6932014.html,雨花台区,13k-25k,易宝软件科技（南京）有限公司,3-5年,大专,五险一金 免费班车 绩效奖金 弹性工作,"有3年以上Android平台应用软件开发经验。
 熟悉Android SDK、Android平台UI开发。 
 有良好的编程习惯和代码规范。 
 有良好的敬业精神和沟通能力。
 面试通过，薪资open，不在南京的候选人，可协调电话面试。",移动互联网,150-500人,android,南京
Android开发（南京）,https://www.lagou.com/jobs/7128574.html,雨花台区,10k-20k,南京蓝鲸人网络科技有限公司,3-5年,本科,六险一金，租房补贴，晚餐下午茶，无息贷款,【岗位职责】1. 根据产品的需求进行Android产品的开发，对相关模块做重构和优化；2. 对Android端疑难问题的提出合理的优化和解决方案；3. 快速学习上手新技能，有良好的沟通力和团队协作能力。【岗位要求】1. 本科及以上计算机相关专业毕业，至少两年以上Android开发经验；2. 熟练Java，Kotlin等开发语言，熟悉常用数据结构和算法；3. 熟悉Android平台及框架原理，熟悉Android sdk使用；4. 责任心强，良好的编码习惯和风格，代码严谨规范，学习能力强；5. 有大型互联网APP开发经验优先。【加分项】1. 有rn/flutter开发经验；2. 有项目重构/架构相关经验；3. 有多媒体相关经验。,"移动互联网,社交",50-150人,android,南京
安卓开发,https://www.lagou.com/jobs/7077413.html,建邺区,10k-15k,上海中软华腾软件系统有限公司,1-3年,大专,岗位8小时、双休、五险一金齐全入职即购买,1、从事Android平台应用软件开发；2、根据产品需求，开发对应功能；3、能够熟练完成技术等相关文档的编写；4、与相关人员沟通配合，完成App端软件的测试和升级；岗位要求：1、2年以上基于Android的开发经验，熟悉Android端开发流程；2、熟练掌握Android平台各种性能优化工具，具备良好的性能优化经验；3、熟悉UI设计，常用布局，动画特效；4、了解Android SDK及相关开发工具的使用，有通过Android源码阅读定位问题经验；5、熟悉Android主流第三方框架的使用，对设计模式有一定的认识；6、具有良好的语言表达能力，善于与人沟通、合作，有良好的团队意识，及高度责任心。,"企业服务,金融",2000人以上,android,南京
android开发工程师,https://www.lagou.com/jobs/7208808.html,秦淮区,10k-15k,南京伯索网络科技有限公司,1-3年,本科,六险一金、包吃、通信补贴、全勤奖,"岗位职责：1、 根据公司业务发展需求，负责公司Android应用（手机/Pad）开发；2、 负责基础模块和组件的研发和维护；3、 提升客户端用户体验, 功能扩展，现有开发方法的改进。任职要求：1、 统招本科以上学历，计算机或相关专业，2年以上Android平台开发经验；2、 熟练掌握JAVA, 熟悉Android SDK, 熟悉UI/网络/数据库框架；3、 熟悉Android常用的开源框架，对应用性能优化和内存优化有一定理解和实践；4、 有良好的代码风格和编程习惯；5、 熟悉Flutter开发优先。",移动互联网,150-500人,android,南京
高级android开发工程师,https://www.lagou.com/jobs/7208581.html,秦淮区,15k-25k,南京伯索网络科技有限公司,5-10年,本科,六险一金、包吃、通信补贴、全勤奖,"岗位职责：1、 根据公司业务发展需求，负责公司Android应用（手机/Pad）的框架设计和应用开发；2、 独立完成开发Android App，进行模块测试，保证代码的质量；3、 参与公司产品的架构设计、技术决选型、解方案制定和难点攻破、保障系统可用性、稳定性和可扩展性；4、 负责分析，定位，解决App线上问题；5、负责指导培训初级工程师和相关技术分享。任职要求：1、 统招本科以上学历，计算机或相关专业，3年以上Android平台开发经验；2、 扎实的计算机程序开发基本功，精通Java/kotlin开发语言,熟悉NDK开发；3、 熟悉Android 常用的开源框架，对应用性能优化和内存优化有一定理解和实践；4、 深入了解各个不同Android版本的特性与差异,以及不通屏幕尺寸并有丰富适配经验；5、 具备良好的分析解决问题能力，较强的自我学习能力和自我驱动能力；6、 有SDK开发经验者优先；7、 熟悉Flutter跨平台开发优先；8、有直播/在线教育类产品，音视频处理实际项目经验者优先。",移动互联网,150-500人,android,南京
android应用开发工程师,https://www.lagou.com/jobs/5767894.html,建邺区,15k-20k,咪咕文化科技有限公司,3-5年,本科,技术成长,工作职责：1、负责客户端相关需求的业务需求梳理、方案设计、功能开发、测试；2、负责客户端核心代码的编写、架构设计和功能开发；3、负责研发过程中的重点、难点的技术攻坚；持续重构优化既有系统，保证高性能处理和系统的稳定性；任职资格：1、全日制本科及以上学历，计算机相关专业；2、3年以上相关工作经历；具有3年以上Android开发经验，有成功发布App者优先；3、熟悉移动客户端开发流程；熟悉MVC、MVP模式；熟练掌握Framework，有较好的理解能力和实践经验；4、熟悉Android应用的性能优化，掌握一定的优化技巧和方法；熟练掌握Andorid应用的调试方法，熟悉ANR、Crash处理；熟练掌握Andorid UI 设计开发技巧，有复杂动效开发、优化经验；,"移动互联网,文娱丨内容",2000人以上,android,南京
android开发工程师,https://www.lagou.com/jobs/5852640.html,建邺区,13k-24k,安徽华米信息科技有限公司,3-5年,本科,六险一金、弹性作息、双休、餐补、班车,工作职责：  1. 负责公司智能穿戴产品Android客户端的开发和维护；2. 根据需求设计软件架构并对现有框架进行持续优化；3. 负责新技术的探索和项目难题攻关。任职要求：1. 对程序开发有浓厚的热情；2. 本科及以上学历，数学专业／物理专业／电子工程专业／软件开发专业相关；3. 三年以上开发经验；4. 精通 Java 8 或 Kotlin；5. 熟练掌握 MVVM 或 Architecture Components，有半年以上实际项目应用经验；6. 掌握单元测试的编写；7. 熟练掌握 Git 命令；8. 严谨的编码习惯，注重测试和文档；9. 有很强的学习／自我驱动／自我管理能力；10. 善于 Google。以下为加分项：1. 了解Android Framework以及JVM的机制；2. 了解函数式编程，有RxJava实际项目应用经验；3. 了解 Flutter 框架，有实际使用经验；4. 熟练使用 Jetpack 组件；5. 理解编译原理；6. 精通UI动画；7. 有参与 Github 开源项目经验；8. 熟悉C/C++、 Python、JavaScript中的一种。,移动互联网,500-2000人,android,南京
安卓android开发工程师,https://www.lagou.com/jobs/7034934.html,栖霞区,13k-16k,南京仁迈生物科技有限公司,3-5年,本科,14薪、免费住宿、餐补、交补、免费停车,岗位要求：1、负责根据产品需求，完成产品Android端软件设计、开发及维护；2、负责相关技术文档的编制与维护；3、参与产品的需求分析并参与技术实施方案设计；任职要求：1、2年及以上Android系统APP开发经验，具有良好的代码风格及独立开发项目的能力；2、岗位要求熟悉常用数据库基本操作，如SQLite、SQLServer；3、具有扎实的Java语言基础；4、有医疗行业经验值优先。,医疗丨健康,150-500人,android,南京
Android开发,https://www.lagou.com/jobs/5313130.html,秦淮区,8k-13k,南京好签软件技术有限公司,1-3年,本科,挑战,"职位要求（本岗位同时招聘实习生）： ★     熟练使用Android Studio，Eclipse等开发工具，熟练掌握java语言及java开发技术，具备扎实的编程基础和良好的编程习惯，注释清晰 ★     1年以上Android移动应用开发经验，有成型产品经验，有APP上架经验 ★     熟悉HTTP,TCP/IP等常见网络协议，熟练使用JSON/XML ★     熟悉无线网络应用开发，精通Socket和Http网络接口编程 ★     良好的优化、调试和解决问题能力，逻辑思维清晰严谨 ★    具有良好的沟通、协调和团队合作能力，责任心强 ★     有良好学习能力及做事态度，对学历无要求 工作职责 ★     好签APP的开发、Bug修复工作    ★     好签签字 SDK的开发、Bug修复工作 ★     撰写和维护相关开发文档，客户问题对应 加分项 ★     开发过文档管理，绘图方面应用经验 ★     有良好的英语阅读能力 ★     熟悉PDF技术 如果 ★你追求更高效、更环保的生活 ★你身体足够健康，能与我们共创百年基业 ★你有一颗理想主义的心，希望自己能参与到改变未来的宏伟蓝图中去 ★当一天的工作结束时，你希望能从中感受到自己的价值，和对世界微妙的影响 请将你的简历投给我们。","移动互联网,企业服务",15-50人,android,南京
Android开发工程师,https://www.lagou.com/jobs/7048636.html,建邺区,10k-20k,北京小米科技有限责任公司,3-5年,本科,500强,岗位职责：1、负责小米音乐国内版客户端开发；2、参与需求讨论与分析，拆分任务，按时、高质量的完成工作；3、配合系统版本升级，对所负责业务进行适配；4、维护现有工程，能够快速定位并修复软件缺陷；5、依据变化的需求与技术发展趋势，对客户端进行技术优化和改进。任职要求：1、本科或以上，计算机软件或相关专业，3年以上Andorid开发经验；2、扎实的编程基础，精通Java，深刻理解面向对象思想，熟悉常用的设计模式；3、具备良好的分析、解决问题的能力，接受能力强，能快速学习和掌握新技术；4、有Android平台下的网络优化，内存优化、性能调优经验；5、精通Framework者，有音频播放研发经验者，参与过开源项目开发者优先。,硬件,2000人以上,android,南京
Android 开发工程师,https://www.lagou.com/jobs/4190912.html,鼓楼区,5k-8k,益盟软件系统开发（南京）有限公司,1-3年,本科,"交通补贴,午餐补贴,节日福利费,员工体检",岗位职责：1、基于Android平台进行移动端应用程序开发设计、实现、测试及功能维护 2、与产品经理配合，参与需求讨论3、参与模块编码和单元测试，并编写相关文档4、负责修复功能缺陷、优化性能，提高应用运行的性能和体验岗位要求：1、2年以上工作经验，本科及以上学历，计算机、信息技术相关专业2、熟练掌握Android开发调试技巧 ，能够独立开发APP3、熟悉C/C++，java 语言，熟悉java并发、内存管理4、了解Android开发平台和框架原理、熟练使用Android SDK、熟练掌握Android UI组件（weight，Fragment等）、常用布局等 ，会自定义控件5、能提供开发作品案例6、有Android Market上线产品经验优先7、熟悉无线网络相关知识，熟悉TCP/UDP、HTTP等网络协议8、较强的发现、分析、解决问题能力9、具备良好的职业道德和团队精神，工作认真，能够承担工作压力,"医疗丨健康,移动互联网",150-500人,android,南京
安卓开发工程师,https://www.lagou.com/jobs/7166098.html,雨花台区,15k-20k,南京钧泰信息技术有限公司,3-5年,大专,"五险一金,下午茶,氛围好,节日福利",岗位说明： 1. 负责软件产品的android平台开发与维护 2. 持续改进产品的移动端功能，性能优化，改善访问体验3. 参与产品的需求分析和功能分析，协助优化产品设计任职要求：1. 4年以上Android开发经验，有完整项目开发和优化经验2. 掌握 Android平台体系结构，掌握 Android的界面和交互开发、网络通讯、后台运行、数据存储、缓存技术等 3. 熟悉多线程，图形界面编程，熟悉移动终端网络编程，Socket通信、有即时通信开发经验者优 4. 具备需求分析和功能设计的能力，有系统分析、系统架构的经验； 5. 掌握面向对象程序设计思想和方法，熟练使用常见设计模式 6. 有直播类app开发经验者优先考虑7. 熟悉NDK应用开发者优先考虑8. 熟悉WebRTC 视频语音聊天者优先考虑9. 有市面主流Android手机适配经验，具备快速定位、解决问题的能力10. 良好的逻辑思维能力、学习能力、沟通能力，有较强的技术专研欲望,"数据服务,软件开发",150-500人,android,南京
