job_name,job_url,job_location,job_salary,job_company,job_experience,job_class,job_given,job_detail,company_type,company_person,search_key,city
大数据平台专家,https://www.lagou.com/jobs/5508097.html,福田区,30k-60k,中国平安人寿保险股份有限公司,3-5年,本科,"金融科技,行业旗舰,年终丰厚",职位描述：岗位职责：1.负责大数据平台的整体设计与核心技术研究。2.负责数据应用系统的技术选型与架构设计。3.负责核心技术问题的研究攻关和重要应用的性能调优。4.负责研究业界前沿的平台技术。5.负责大数据应用开发的技术顾问与培训。岗位要求：1.本科以上学历，计算机相关专业。2.编程功底扎实，熟悉网络协议栈，数据结构与算法，数据库调优，操作系统原理等。3.丰富的一线研发经验，宽广的技术视野。4.设计并实现过大型平台系统，掌握其设计，实现与调优的要点。5.精通java或c++，熟练掌握python，至少掌握一种新语言，比如scala/go等。6.深入掌握HDFS/YARN/HBase/Spark，能高效地进行复杂应用的开发，对其设计方法学和底层原理有自己的体会。7.至少掌握一种其他引擎，比如Flink/ElasticSearch/Impala/Druid/GreenPlum等，对其底层原理有一定研究，理解其技术要害。8.有优秀的著作(技术博客，开源代码，顶会论文，公开演讲等)。9.对技术有着强烈的兴趣，追求**的性能优化，善于研究底层技术。10.具有自我驱动能力和良好的沟通协作能力。加分项1.管理过大型集群。2.对大数据做过开源贡献。,金融,2000人以上,go,广东
服务端开发工程师——广告系统基础服务方向,https://www.lagou.com/jobs/7218591.html,南山区,20k-40k,北京字节跳动科技有限公司,3-5年,本科,"六险一金,股票期权,弹性工作,免费三餐",,文娱丨内容,2000人以上,go,广东
大数据技术专家,https://www.lagou.com/jobs/7218528.html,福田区,30k-60k,深圳高速工程顾问有限公司,3-5年,硕士,薪资高，福利好，各种补贴与礼金，同事牛,岗位职责:1、与算法同事一起，负责基于整体逻辑，搭建基于容器化的【Docker】，面向微服务化的智能大数据平台；2、负责大数据架构设计及数据智能应用的核心开发；3、攻克实践当中的数据技术难点，给团队技术支撑任职资格:1、国内外知名院校【理工科类】至少硕士研究生以上学历；2、5年以上互联网平台型公司大数据研发经验，有完整的搭建过一个以上大数据平台架构；3、对hive、hbase、hadoop、spark、storm、elasticsearch、logstash、kibana、kafka等大数据技术栈有深入了解；5、有敏锐的技术洞察力和较强的问题分析能力，对技术有热情；6、具有推荐系统、计算广告CTR方面的经验者优先；7、扎实的编程基础，熟练使用至少二种常用的编程语言，包括但不限于：Python、Scala、Go、java;,其他,500-2000人,go,广东
高级算法专家,https://www.lagou.com/jobs/7218518.html,福田区,30k-60k,深圳高速工程顾问有限公司,3-5年,硕士,薪资高，福利好，各种补贴与礼金，同事牛,"工作内容： 1、负责带领智能算法团队开发和落地各种机器学习领域的工业化应用，持续完善公司业务中数据智能覆盖的领域，并提高现有领域的各方面性能； 2、和团队中其它伙伴一起打造产业互联网在工程基建领域的核心底层算法引擎；任职资格： 1.精通多种机器学习方法及常见深度学习算法如强化学习，元学习，模仿学习，集成学习等中若干种范式的具体实践经验； 2.精通机器学习理论的具体应用、包括但不限于优化方法、目标函数设计、训练技巧、模型压缩、模型优化，模型部署等的具体实现；3.具备丰富的清洗整理数据、理解数据、探索数据、制定模型方案、特征工程、可视化、大规模训练、结果评估一个完整建模周期的工作经验； 4.有非结构化和半结构化数据的特征抽取方法的经验，包括但不限于序列建模，autoencoder，因果模型，GNN等方法。5.了解模型上线和生产环境的工作流程掌握，基本的工具使用方法。6.熟练掌握一门或以上编程经验：python，Scala，go，Java加分项：1.在机器学习、互联网广告CTR、数据挖掘、运筹学、智能数据产品等领域有深厚的工业界经验或学术积累者优先2.有相关领域业界知名成功项目经验优先，在国际**会议和期刊以**作者发表过多篇高水平论文优先；3.国内外知名院校【理工科类】至少硕士研究生以上学历or博士,5年以上互联网平台型公司相关工作经验者优先",其他,500-2000人,go,广东
资深港美股开发工程师,https://www.lagou.com/jobs/7209526.html,南山区,18k-30k,一壶科技（深圳）有限公司,3-5年,本科,扁平化管理，福利待遇齐全，学习机会多,职位描述负责打造港美股交易模块。对接盈透证券，完成港美股交易相关接口开发。 广州、杭州、深圳职位硬性要求 必须要有盈透tws、网关开发经验，熟悉港美股交易规则。 工作职责1、负责产品服务端的开发工作2、深入理解业务需求，提供具体问题的解决方案3、负责相关模块的开发和改进，保证系统性能和稳定性4、为前端提供标准的接口就行，RESTFul，websocket 其它要求精通java、C++，go任何一种编程语言熟悉http、websocket协议，理解TCP/IP协议熟悉常用算法，具备一定的算法能力有大规模高并发在线系统或金融IT系统相关经验者优先目标导向，具有较强的学习能力、良好的团队协作和沟通能力 职位挑战-基于盈透证券Api结合私人银行业务，打造业界首创的交易中间件https://www.interactivebrokers.com.hk/en/index.php?f=5039&nhf=T,软件开发,15-50人,go,广东
机器学习工程师（推荐方向）,https://www.lagou.com/jobs/4331737.html,宝安区,20k-40k,深圳小步网络科技有限公司,3-5年,本科,"待遇优厚,成长空间大,弹性上班,下午茶",岗位职责：1、负责内容特征工程、用户特征工程、推荐算法模型等系统2、分析海量用户行为数据，内容资讯数据，增加有效的用户特征和内容资讯特征。改进模型和召回、排序策略，提升推荐效果。岗位要求：1.3年以上服务器开发经验，精通Go/Python/C++/Java 2.熟悉机器学习的基本方法 ( 降维、分类、回归、排序等等 )3.熟悉并行计算或者分布式计算，熟悉 Spark. Storm 等计算平台，有相关性能优化经验，并熟悉其上下游环境，包括 Flume. Kafka. Hive. HBase 等；4.对数据敏感，分析数据，抽象问题，对于把大数据分析的结果能够应用到实际业务场景产生商业价值具有强烈的热情5.具备良好的团队精神和沟通意识，责任心强，工作认真细致，有良好的抗压能力；加分项：1.做过推荐系统或搜索引擎，并对常见的推荐算法、搜索排序有自己的理解；2.自然语言处理、分类/聚类、数据挖掘等相关经验；╭(●｀∀´●)╯我们是谁？╰(●’◡’●)╮ 官网：http://www.xbonline.net/ 我们是一家产品导向的初创型互联网公司，致力于成为东南亚内容资讯平台公司。创始人为迅雷前技术副总裁，团队核心成员都是来自于知名互联网公司的大牛，目前公司全球拥有员工200多人，均来自各大知名IT、互联网公司高管、产品总监、技术总监，人员主要分布在中国深圳、越南胡志明。深圳为产品&研发中心，负责产品、系统的研发。在越南成立分公司，负责当地业务的运营和新业务拓展。 ╭(●｀∀´●)╯我们在做什么●’◡’●)╮ 公司做东南亚市场，目前产品有东南亚头条app、互金、小说漫画、区块链等业务 (≖ ‿ ≖)✧融资阶段： 小步网络成立于2016年5月，2017年12月获得B轮融资1600W美金，投资方SIG、启明，2019年1月更喜获OPPO领投及SIG、启明等知名机构投资的总价值一亿人民币的B+轮融资。。  (≖ ‿ ≖)✧我们可以提供： ■ 来到初创公司成长的空间巨大，我们有各类技术大咖可以亲身指导，更有热门海外互联网经验拓展、出国考察，交流学习的机会哦，务实的研发环境和技术探讨氛围能够让你快速成长（勾引） ■ 我们的薪酬待遇不逊于大公司—绩效奖金+带薪年假+丰厚年终奖+股票期权+五险一金+年度体检福利+带薪病假 ■ 舒适的工作环境--弹性不打卡+人性化管理+CEO、领导炒鸡nice，没有上下级 ■ 丰富的员工活动--生日会+节日Party+丰富下午茶+节日礼品福利+团建旅游+各种吃吃喝喝活动+每周运动健身福利（篮球、羽毛球、游泳、等等…）你心中所想我们都能提供 ■ 超大办公室，还有大大的休闲娱乐室（台球、桌球、乒乓球、桌上足球、飞镖、休息区、各种活动的场地）休息的时间好好放松，才能写出好代码鸭，哈哈 ■ 协助办理落户和申请相应人才补贴等,移动互联网,150-500人,go,广东
数据挖掘工程师（推荐方向）,https://www.lagou.com/jobs/4331772.html,宝安区,20k-40k,深圳小步网络科技有限公司,3-5年,本科,"待遇优厚,成长空间大,弹性上班,下午茶",岗位职责：1、负责内容特征工程、用户特征工程、推荐算法模型等系统2、分析海量用户行为数据，内容资讯数据，增加有效的用户特征和内容资讯特征。改进模型和召回、排序策略，提升推荐效果。岗位要求：1.3年以上服务器开发经验，精通Go/Python/C++/Java   2.熟悉机器学习的基本方法 ( 降维、分类、回归、排序等等 )3.熟悉并行计算或者分布式计算，熟悉 Spark. Storm 等计算平台，有相关性能优化经验，并熟悉其上下游环境，包括 Flume. Kafka.   Hive. HBase 等；4.对数据敏感，分析数据，抽象问题，对于把大数据分析的结果能够应用到实际业务场景产生商业价值具有强烈的热情5.具备良好的团队精神和沟通意识，责任心强，工作认真细致，有良好的抗压能力；     加分项：1.做过推荐系统或搜索引擎，并对常见的推荐算法、搜索排序有自己的理解；2.自然语言处理、分类/聚类、数据挖掘等相关经验；    ╭(●｀∀´●)╯我们是谁？╰(●’◡’●)╮ 官网：http://www.xbonline.net/ 我们是一家产品导向的初创型互联网公司，致力于成为东南亚内容资讯平台公司。创始人为迅雷前技术副总裁，团队核心成员都是来自于知名互联网公司的大牛，目前公司全球拥有员工200多人，均来自各大知名IT、互联网公司高管、产品总监、技术总监，人员主要分布在中国深圳、越南胡志明。深圳为产品&研发中心，负责产品、系统的研发。在越南成立分公司，负责当地业务的运营和新业务拓展。 ╭(●｀∀´●)╯我们在做什么●’◡’●)╮ 公司做东南亚市场，目前产品有东南亚头条app、互金、小说漫画、区块链等业务 (≖ ‿ ≖)✧融资阶段： 小步网络成立于2016年5月，2017年12月获得B轮融资1600W美金，投资方SIG、启明，2019年1月更喜获OPPO领投及SIG、启明等知名机构投资的总价值一亿人民币的B+轮融资。。  (≖ ‿ ≖)✧我们可以提供： ■ 来到初创公司成长的空间巨大，我们有各类技术大咖可以亲身指导，更有热门海外互联网经验拓展、出国考察，交流学习的机会哦，务实的研发环境和技术探讨氛围能够让你快速成长（勾引） ■ 我们的薪酬待遇不逊于大公司—绩效奖金+带薪年假+丰厚年终奖+股票期权+五险一金+年度体检福利+带薪病假 ■ 舒适的工作环境--弹性不打卡+人性化管理+CEO、领导炒鸡nice，没有上下级 ■ 丰富的员工活动--生日会+节日Party+丰富下午茶+节日礼品福利+团建旅游+各种吃吃喝喝活动+每周运动健身福利（篮球、羽毛球、游泳、等等…）你心中所想我们都能提供 ■ 超大办公室，还有大大的休闲娱乐室（台球、桌球、乒乓球、桌上足球、飞镖、休息区、各种活动的场地）休息的时间好好放松，才能写出好代码鸭，哈哈 ■ 协助办理落户和申请相应人才补贴等,移动互联网,150-500人,go,广东
前端工程师,https://www.lagou.com/jobs/3630128.html,南山区,10k-19k,深圳市紫川软件有限公司,3-5年,大专,周末双休 员工旅游 五险一金,1、熟悉 Web 设计和编码，精通 HTML、CSS、Javascript 等前端技术； 2、深刻理解 Web 标准，对可用性、稳定性、可访问性等相关知识有实际的了解和实践经验，具有模块化编程思想，良好的代码书写习惯； 3、熟练掌握至少一种现代前端框架（Angular，Vue，React 等），熟悉 ES6 规范开发； 4、至少了解一门服务端开发语言（如：PHP，Java，Python，Nodejs，Go 等），对业界前沿技术有较强的敏感性； 5、至少具备 3 年以上的网站开发，安全，性能优化等方面经验； 6、熟练使用 Git； 7、了解基本设计原理和原则，能够在无设计师参与的情况下选择合适的布局和组件； 8、能够无障碍阅读和书写英文文档； 9、具有较强前瞻能力和执行力，能够主导项目、管理项目进度和提升团队专业能力；,"电商,金融",500-2000人,go,广东
【国际业务部】后台开发工程师（海外云产品）（深圳）,https://www.lagou.com/jobs/5750619.html,南山区,22k-40k,腾讯科技（深圳）有限公司,3-5年,本科,海量数据、高并发、互联网金融,工作职责：负责腾讯云海外SAAS产品的平台设计和开发，通过技术手段满足不同客户的多样化要求   工作要求：1. 具有良好的产品需求沟通能力，主动性强。2. 使用编程语言包含但不限于：C/C++、python、go；熟悉基本数据结构和算法。3. 掌握网络编程技能：TCP/IP、socket编程、服务器模型，有高并发海量服务经验4.掌握使用数据库mysql、mongodb，对数据库的高并发和强一致性有深入了解。,社交,2000人以上,go,广东
29569-VB区块链高级开发工程师,https://www.lagou.com/jobs/6571140.html,南山区,25k-50k,腾讯科技（深圳）有限公司,5-10年,本科,腾讯,"工作职责：1. 负责VB数字资产业务领域的技术研发工作2. 负责参与设计VB 区块链系统开发工作3. 负责沟通产品需求确保相关研发工作的顺利实施岗位要求：1、 软件工程或计算机相关专业本科及以上，5年以上开发工作经验; 2、 精通 C++/Java/Go 中的两种以上开发语言，3、 精通比特币、以太坊实现原理;4、 精通 TCP、UDP网络编程，精通P2P网络原理与实现;5、 精通常用共识算法(POW, DPOS, PBFT)等;6、 精通智能合约实现原理;7、 具有分布式系统开发经验，熟练掌握分布式网络等相关技术;8、 良好的团队协作精神和执行力，较强的分析问题和解决问题能力",社交,2000人以上,go,广东
高级后端工程师,https://www.lagou.com/jobs/7177663.html,南山区,25k-40k,深圳市腾云扣钉科技有限公司,5-10年,本科,免费早餐、班车，全额五险，腾讯全资子公司,职位描述:1. 负责 CODING 代码托管产品的后端研发；2. 负责系统架构和性能的持续优化升级；3. DevOps 相关平台和工具开发及维护.职位要求:1. 扎实的计算机网络基础，熟练掌握 Linux 系统常用命令和脚本编写；2. 具备扎实的 Java 或 Go 语言基础，熟悉 Spring 相关框架；3. 熟悉主流数据库 MySQL、MariaDB 等，熟悉 Redis 等 NoSQL 数据库；4. 熟悉分布式架构思想，熟悉 RPC 调用方式和协议、RESTful 技术；5. 理解 Git 底层原理和存储结构、有代码托管系统设计和优化经验者优先；6. 熟悉 Docker、K8S、微服务架构并有实践经验者优先；7. 具备良好的团队合作精神，具备较强的问题定位和推动解决能力。,数据服务,50-150人,go,广东
KJC-后台开发工程师(中间件开发),https://www.lagou.com/jobs/7128704.html,南山区,15k-25k,深圳前海微众银行股份有限公司,3-5年,本科,五险一金 绩效奖金 带薪年假,岗位职责： 负责的中间件平台产品：消息中间件、Redis、Nginx、微服务、Kubernetes/Docker等设计和开发工作，支持银行业务系统稳定运行；优化平台产品系统性能；了解业界前沿各种主流中间件产品。任职要求：1、本科及以上学历，3年以上相关工作经验；2、熟悉Java/Go/C++（至少精通其中一种）常见开发框架，有扎实的编程经验；3、熟悉Linux操作系统，具备一定运维能力；有Openresty开发运维经验者优先；4、熟悉Kubernetes/Docker者优先；5、有分布式架构设计开发、海量并发交易系统经验者优先；6、善于独立思考，自我驱动，快速学习，不断突破技术瓶颈，乐于探索未知领域，能在较大压力下保持工作激情。,金融,2000人以上,go,广东
KXX-信息安全专员(安全开发),https://www.lagou.com/jobs/6285841.html,南山区,12k-20k,深圳前海微众银行股份有限公司,1-3年,本科,五险一金 绩效奖金 带薪年假,岗位职责：1、负责基础安全系统的设计和维护，方案落地； 2、有丰富的应急响应，事件调查经验，负责对安全事件的追溯和应急响应，及时解决出现的安全问题。任职要求：1、本科及以上学历，对安全攻防有深入理解； 2、2年以上Linux C/C++后台开发经验，具备大容量、高性能复杂系统的设计和架构能力； 3、热爱技术，精通底层技术，包括Linux系统编程、网络编程、网络协议等，极强的技术解决问题能力； 4、 熟悉业界安全攻防动态，追踪最新安全漏洞； 5、 熟悉至少一种编程语言，如shell，C，Java，GO等；6、有大型安全产品的研发经验优先； 7、大型互联网公司安全团队工作经验优先。,金融,2000人以上,go,广东
软件开发工程师,https://www.lagou.com/jobs/7198984.html,龙岗区,15k-30k,君师禾信息技术（上海）有限公司,不限,本科,福利待遇好,岗位要求：（1）计算机、软件、通信等相关专业本科及以上学历；（2）热爱编程，基础扎实，熟悉掌握但不限于JAVA/C++/Python/JS/HTML/GO等编程语言中的一种或数种，有良好的编程习惯；（3）具备独立工作能力和解决问题的能力、善于沟通，乐于合作，热衷新技术，善于总结分享，喜欢动手实践。（4）优选条件：     a、熟悉java主流框架、容器及数据库，能够解决疑难问题。如spring，tomcat，mysql，MongoDB等。     b、熟悉微服务框架（如Dubbo、、zukeeper、redies、SpringCloud等）以及应用，有SOA或分布式高并发系统的设计和开发经验。     c、了解消息队列，分布式缓存，NoSQL，分词搜索等技术，能够快速掌握相关开源产品使用。,信息安全,15-50人,go,广东
高级Golang开发工程师,https://www.lagou.com/jobs/6084036.html,南山区,20k-40k,深圳市即构科技有限公司,5-10年,本科,技术大牛 工匠精神 发展前景好,工作职责：1、负责企业效率工具相关业务后台服务的架构设计和开发；2、负责PaaS服务中高并发实时网络的架构设计和开发；3、提升系统性能和改进服务质量，保证系统安全、稳定、高效运行；4、承担重点、难点技术攻坚，指导相关同事职位要求：1、本科及以上学历，5年及以上后台开发经验，有带团队经验；2、良好的数据结构和算法能力；3、熟悉Unix/Linux开发环境，熟悉网络开发，理解并发编程和分布式网络；4、熟练掌握GO语言，有大型项目开发经验优先；5、熟悉mysql、redis等数据库开发，精通SQL调优和数据库结构设计优先乐观豁达，责任心强，愿意同团队一起发展。,"移动互联网,企业服务",150-500人,go,广东
golang工程师,https://www.lagou.com/jobs/4562221.html,南山区,16k-30k,万汇互联（深圳）科技有限公司,3-5年,大专,"绩效奖金,弹性工作,节日福利,团队气氛佳","职位描述:负责核心交易系统的开发和优化工作, 能够自主安排任务计划, 协助项目经理推进项目进度任职要求:1. 熟悉 Linux 开发环境, 掌握基本操作命令2. 熟悉 Go (C/C++), 有并发编程经验3. 熟悉 HTTP 协议, 有通用 RPC 服务开发经验4. 熟悉常用的数据库操作及其调优5.熟悉常用数据结构和算法6.熟悉多线程编程7.有较好的编码能力，思维严谨富有逻辑性加分项:1. 有金融交易系统开发经验2. 有微服务, gPRC 开发经验3. 处理过大并发低延迟系统的开发和优化4. 熟练 Docker 部署5. 开源项目贡献者, 可附 github / blog","社交,金融",50-150人,go,广东
后端开发工程师,https://www.lagou.com/jobs/7070663.html,南山区,10k-20k,深圳依瞳科技有限公司,应届毕业生,本科,更好的技术成长，更具性价比的薪酬福利,"岗位职责：1. 参与产品前期用户需求研究、分析产品应用行业的设计流行趋势；2. 服务器集群和云端集群管理；3. 完成后端模块相关制作，设计MySQL或云存储数据格式（schema）,高效完成数据操作；4. 设计高并发、高吞吐量、大规模服务，支持用户访问  。 任职要求：1. 985/211院校全日制统招本科及其以上教育背景,有实验室项目经历或者竞赛经历尤佳2. 了解linux环境，有linux集群管理/操作经验3. 了解并能够使用Java、go、python、C#等一种或多种后端开发语言环境 4. 了解MySQL, 阿里云（或其他国内外主流云）的存储服务5. 具备良好的沟通交流、团队协作能力，工作主动、富有激情和责任感，能承受工作压力6. 有写GitHub或者技术博客习惯。",人工智能,15-50人,go,广东
后端开发工程师（实习）,https://www.lagou.com/jobs/7171132.html,南山区,4k-6k,深圳依瞳科技有限公司,应届毕业生,本科,年底多薪，扁平化氛围好,"岗位职责：1. 参与产品前期用户需求研究、分析产品应用行业的设计流行趋势；2. 服务器集群和云端集群管理；3. 完成后端模块相关制作，设计MySQL或云存储数据格式（schema）,高效完成数据操作；4. 设计高并发、高吞吐量、大规模服务，支持用户访问  。 任职要求：1. 985/211本科及其以上教育背景,大三/大四在读，有实验室项目经历或者竞赛经历尤佳2. 了解linux环境，有linux集群管理/操作经验3. 了解并能够使用Java、go、python、C#等一种或多种后端开发语言环境 4. 了解MySQL, 阿里云（或其他国内外主流云）的存储服务5. 具备良好的沟通交流、团队协作能力，工作主动、富有激情和责任感6. 有写GitHub或者技术博客习惯7. 良好的计算机基础知识8. 可持续实习2个月及其以上，提供毕业后转正名额 薪酬福利最重要：IEEE院士，清华客座教授李劲博士&摩根大通技术leader苏立强博士亲自带队研发，技术成长能力指数级1、晚餐补贴2、加班交通补助3、免费零食下午茶",人工智能,15-50人,go,广东
DBA运维工程师,https://www.lagou.com/jobs/7105008.html,海珠区,15k-25k,广州梦映动漫网络科技有限公司,3-5年,本科,扁平架构 团队耐撕 年终奖,岗位职责：1. 负责公司多业务的数据库运维管理、监控，推进业务进行架构优化（MySQL、Redis、ES等）；2. 负责数据库日常管理、规范，问题跟进和处理，保证业务数据安全、可用；3. 负责数据库平台自动化运维工具开发；4. 审核、协助开发人员编写、优化SQL语句，并提供SQL 相关培训。任职要求：1. 本科或以上学历，3年及以上数据库相关管理和维护经验；2. 精通MySQL、Redis、ES日常运维和管理，能够进行备份、调优以及性能监控；3. 熟悉数据库优化和故障排查；4. 精通shell，熟悉Linux系统日常管理，熟悉python、go 至少一门脚本语言；3. 有建设或参与DB平台开发者优先。,"移动互联网,文娱丨内容",150-500人,go,广东
