job_name,job_url,job_location,job_salary,job_company,job_experience,job_class,job_given,job_detail,company_type,company_person,search_key,city
C++技术专家,https://www.lagou.com/jobs/7151157.html,余杭区,25k-50k,杭州欧若数网科技有限公司,10年以上,不限,开源图数据库，NoSQL,"岗位描述：1、负责开源的分布式图数据库 Nebula Graph的设计与实现（关系网络的存储和计算框架），调研和把握当前的业界最新动态，将其中的先进技术和理念引入到我们的引擎中，提升竞争力；2、对基础核心数据处理流程进行性能优化（包括算法优化，代码实现的软优化和硬优化）；岗位要求：1、精通C/C++编程，有很强的代码阅读、分析和设计能力；如果熟悉Go、Java编程更佳；2、熟悉分布式存储设计及实现；3、熟悉HBase, Mysql等数据库内核者优先；4、熟悉分布式一致性算法者优先；5、熟悉 Linux 系统下进程性能调优优先；6、具有良好的沟通能力，有较强的独立工作能力和解决问题的能力；7、有创意，有冲劲，有团队精神。","数据服务,软件开发",15-50人,go,杭州
linux研发工程师,https://www.lagou.com/jobs/6957308.html,余杭区,18k-30k,上海层峰网络科技有限公司,3-5年,不限,发展路径明确；年终奖；其他福利,⼯作职责： 1. 参与SDWAN产品功能设计、研发、组件优化； 2. 负责SDWAN技术调研，并落实技术产品化； 3. 负责SDWAN功能维护，及时⾼效解决故障。任职资格：1. 拥有计算机、通信或电⼦信息专业本科及以上学历，三年以上Linux平台开发经验； 2. ⾄少有C、C++、Go语⾔中的⼀种编程语⾔开发经验； 3. 熟悉TCP/IP⽹络协议，熟悉OSPF、BGP等路由协议； 4. 具备良好团队合作精神，学习能⼒，⼯作认真负责，善于沟通，能够承受⼀定 的⼯作压⼒； 5. 具备⽹络转发相关⼯作三年及以上经验。优先条件：       1. 具有DPDK开发经历优先； 2. 具有⼴域⽹传输优化经历优先；,"数据服务,移动互联网",150-500人,go,杭州
实施工程师,https://www.lagou.com/jobs/7087165.html,滨江区,9k-15k,安厨控股有限公司,1-3年,本科,"企业实力强,行业前景好,晋升空间大",实施工程师岗位职责：1、制定项目实施方案和计划，完成公司产品的实施、项目验收等工作。2、协调资源解决项目实施过程中出现的疑难问题，按时保质实现项目交付和验收。3、负责项目上新功能的测试、操作文档完善及培训工作，并及时向项目负责人汇报项目进度。4、参与计划制定、需求调研、解决方案制定、用户培训、实施上线等实施服务。5、协助客户处理在使用过程中遇到的各种技术问题，并为客户提供相应的售后支持。岗位要求：1、两年以上相关工作岗位经验，具有较强的应变能力，问题处理能力。2、必须具备执着精神，较强的事业心和高度的责任感，以及吃苦耐劳，团队合作的精神。3、熟悉一种开发语言能力（如Java、PHP、.Net、Python、Go），有一定代码能力优先考虑。4、熟悉Linux/Unix，或有Oracle\Mysql\SQLSERVER任意数据库相关实施经验优先考虑。5、掌握基本的TCP/IP知识，掌握基本的网络故障处理命令，能够解决实施过程中的基本网络问题。6、要求能够接受出差，大部分为省内出差，去客户现场帮助客户解决问题。,电商,150-500人,go,杭州
海外社区运营,https://www.lagou.com/jobs/6969029.html,西湖区,8k-12k,杭州威佩网络科技有限公司,1-3年,本科,行业领先 牛人多 福利丰厚,岗位职责：1.负责电竞内容类产品的采集、整理、审核及发布；2.管理电竞社区，运营社区内容，促进用户活跃，保持数据增长；任职要求：1. 本科及以上学历，专业不限，有1-3年内容运营相关工作经验；2. 对电竞类游戏，特别是DOTA2、CS:GO、LOL有很深的了解，了解steam生态，对游戏热点、爆点有足够敏感度；3. 具备较强的文案策划功底及活动策划能力；4. 具有良好的沟通能力、语言表达能力和较强的文字编辑能力；5. 投递时请附上你的电竞经历，以及电竞相关原创文字或视频作品，链接也可以。加分项：良好的英语读写能力。,"移动互联网,游戏",150-500人,go,杭州
php开发工程师,https://www.lagou.com/jobs/7152727.html,西湖区,15k-20k,杭州边锋网络技术有限公司,3-5年,本科,技术氛围浓厚、工作氛围好、福利多样化,岗位职责1、负责公司信息化管理平台WEB端和移动端的接口服务开发；2、参与制定公司信息化管理平台的架构设计方案；  3、根据公司发展需要，负责开发和完善基础平台的技术框架。任职要求1、全日制本科及以上学历，计算机相关专业优先；  2、精通PHP，3年以上PHP开发经验，2年以上后台架构独立设计经验，有需求分析和系统设计经验的优先；  3、熟悉Linux开发环境，熟悉JS，熟悉Node.js/Go/C#/Java中的一项或多项；4、有laravel等主流php开发框架/Vue、ElementUI等前端开发/信息化系统、OA系统等开发经验者优先；5、具备良好的沟通能力、独立解决问题的能力、文档编写能力，对工作认真负责；  6、学习能力强，有技术热情，能够快速掌握并应用新的技术。,"移动互联网,游戏",2000人以上,go,杭州
Python资深开发工程师,https://www.lagou.com/jobs/7025959.html,余杭区,13k-26k,杭州河象网络科技有限公司,3-5年,本科,年底双薪，高成长业务,岗位职责：1. 负责河小象产品矩阵的相关后端服务以及后台系统的设计和开发工作；2. 负责核心系统架构设计和核心代码开发，保证系统的稳定性和可扩展性；3. 负责指导初级工程师，对他们的业务结果和技术成长负责。岗位要求：1. 本科以上学历，五年以上后端研发经验；2. 精通Python，能熟练使用Flask/Django/Tornado等Web框架，有Java / Go开发经验者优先考虑；3. 熟练掌握常见数据结构及算法，熟悉多进程/多线程开发模式；4. 具有MySQL开发和调优经验，有NoSQL（Redis，MongoDB）的实践经验5. 熟悉分布式系统的设计和应用，有常见的分布式中间件（RPC框架，缓存，消息队列）的使用经验；6. 对技术有极大的热情，持续不断的通过技术的改进和优化提升业务目标；7.  极强的责任心，善于驱动团队达成目标，有创业经验者优先考虑；,"教育,移动互联网",500-2000人,go,杭州
运维开发测试工程师,https://www.lagou.com/jobs/7122929.html,余杭区,10k-20k,杭州映云科技有限公司,1-3年,本科,"期权,奖金,各类补贴,节日福利","职位描述：
 负责自动化工具的引入、平台的搭建维护；
 负责公司重点客户项目的测试、支持工作：理解客户的测试需求，解决客户环境中的测试问题（包括系统层面和应用层面）；
 开发自动化测试、编写性能测试脚本；
 分析、定位测试中遇到的问题，及时与研发部门配合进行问题跟踪，推动问题解决和功能改进。
岗位要求：
 大学本科，计算机等相关专业；1年以上开发、运维或性能/自动化测试相关经验；
 精通Linux，如Linux网络命令等；
 熟悉docker、Kubenetes相关技术，有docker、Kubenetes实践经验；
 掌握一种编程语言java/go等，熟练使用一种脚本；
 熟练使用MySQL、Mongodb、Redis等常用数据库；
 细心细致，责任心强，良好的沟通能力和表达能力；
 具备较强的学习能力和逻辑分析能力，对新技术感兴趣，有钻研和开拓精神；
 有jmeter、python经验者优先。","企业服务,物联网",15-50人,go,杭州
ES研发工程师,https://www.lagou.com/jobs/7203182.html,西湖区,25k-40k,杭州天谷信息科技有限公司,5-10年,本科,五险一金、扁平化管理、弹性上班制度,岗位描述1. ES、hbase等集群高可用设计与实施2.熟悉ES、hbase底层原理和设计思路；3. 线上集群的es index审核把关、优化、hbase表设计审核把关，问题诊断、性能优化 4. 集群监控告警、故障的及时恢复 5. 集群运维自动化平台的设计与开发 6. 为业务研发人员提供ES、hbase技术相关的咨询服务，包括数据模型优化、查询语句优化、容量规划 7、有中间件相关开发经验&服务意识；任职要求: 1. 全日制本科以上学历 2. 熟悉JAVA/Python/Go其中一门编程语言，具备实际项目开发经验 3. 熟悉Linux操作系统，懂得如何获取和解读应用性能的常见度量指标 4. 对信息检索技术有基础的了解，熟悉Lucene或ElasticSearch、hbase等 5. 良好的文档习惯，善于将工作中积累的知识点做记录和分享，有服务意识,企业服务,500-2000人,go,杭州
运维开发工程师,https://www.lagou.com/jobs/7112534.html,西湖区,18k-35k,杭州天谷信息科技有限公司,3-5年,本科,扁平化管理、五险一金,岗位描述负责CMDB、工单系统、监控告警系统、发布系统等设计开发落地维护工作；提高研发运维的工作效率；岗位要求1、本科以上学历，有3年以上互联网行业相关工作经验，对研发/运维/监控至少一个领域有深入的了解及丰富的经验；2、有2~3年互联网公司运维平台或中间件研发经验，掌握JAVA、GO语言；3、深入理解Linux体系结构，熟悉网络协议栈，有实战经验者优先；4、熟悉线上故障排查和应急处理；5、对问题有清晰的分析逻辑和全局思维，能提出具有创造性的解决思路和方案，并有良好的沟通能力及团队合作意识；,企业服务,500-2000人,go,杭州
软件测试工程师（外包）,https://www.lagou.com/jobs/6921454.html,余杭区,15k-30k,北京嘀嘀无限科技发展有限公司,3-5年,本科,大平台,岗位职责1. 负责接入层、弹性云、高可用平台等多个基础平台的测试开发工作；2. 参与产品需求和架构设计评审，评估整体技术架构合理性以及相关的可测性；3. 根据项目特点，开发测试工具、设计自动化解决方案，努力提升测试的质量和效率；4. 设计与执行测试用例，跟踪定位产品软件中的缺陷或问题，并撰写测试报告。任职要求1. 工科、计算机相关专业本科以上学历；2. 两年以上软件测试开发、自动化测试或白盒测试工作经验，有后端服务测试经验优先；3. 了解C/C++/Java/go/python/php等至少一种编程语言，有一定的脚本编写能力；4. 对软件测试有浓厚的兴趣和丰富的经验，有很强的分析能力和定位问题的能力；5. 有很强的改进意识，能针对质量问题进行调研、分析、设计、研发、评估； 其他说明：1. 测试的外包岗位，非正式岗2.人数需求： 北京：1人 杭州：1人3.工作地址 北京- 北京市海淀区西北旺东路10号院未名视通研发楼 杭州- 杭州市余杭区-九橙西溪创投中心,汽车丨出行,2000人以上,go,杭州
资深测试开发工程师(J200331013),https://www.lagou.com/jobs/6962999.html,余杭区,25k-40k,北京嘀嘀无限科技发展有限公司,3-5年,本科,广阔平台；急速成长；诱人福利,,汽车丨出行,2000人以上,go,杭州
区块链密码学工程师/专家,https://www.lagou.com/jobs/6172678.html,西湖区,50k-100k,杭州时戳信息科技有限公司,3-5年,硕士,"行业领先,福利丰厚,扁平管理,技术牛","岗位职责：1、负责数据安全与隐私保护相关技术研发， 根据需求能给出方案且能推动落地2、负责设计完整密钥管理体系安全架构，对现有管理模式能进行改进和优化3、研究应用密码学前沿技术、密码算法实现及性能优化，如同态加密、零知识证明等在区块链领域应用，并能产出理论或技术成果任职要求： 1、统招全日制硕士、博士学历，密码学、信息安全或应用数学相关专业；2、熟悉密码技术，了解并能使用常见密码算法，熟悉相关密码标准体系； 3、熟练掌握至少一种常用的编程语言，如：C/C++、JAVA或Go，熟练掌握密码算法相关开源库的使用；4、熟练掌握哈希函数原理及代码实现，精通对称加密、非对称加密的常用算法原理5、熟悉环签名、聚合签名、同态加密、零知识证明以及后量子密码理论等者优先；6、在密码学或信息安全**国际期刊和国际会议上发表论文者优先；7、熟悉区块链技术者优先；8、英语良好，具有海外学习、工作经验者优先。我们能提供1-薪酬open,奖金福利属于行业领先水平；2-发展空间大，公司设有优厚的员工期权激励；3-持续享受公司、行业发展红利；4-水果零食下午茶必备，健身房按摩椅随时可用。","移动互联网,区块链",50-150人,go,杭州
区块链技术专家,https://www.lagou.com/jobs/5917756.html,西湖区,50k-100k,杭州时戳信息科技有限公司,3-5年,本科,"行业领先,福利丰厚,扁平管理,技术牛","比原链是公司战略级产品，投入重金打造高级人才团队，持续寻找区块链热爱的开发者加入。我们能提供1-薪酬open,奖金福利属于行业领先水平；2-发展空间大，公司设有优厚的员工期权激励；3-持续享受公司、行业发展红利；4-水果零食下午茶必备，健身房按摩椅随时可用。任职要求1、计算机相关专业本科及以上学历；2、精通C/C++, GO， Python等语言 ；3、熟悉Linux系统， TCP/IP网络协议；4、熟悉Bitcoin， ethereum， fabric协议至少一种；5、熟悉前沿技术如闪电网络， 智能合约， 侧链等；6、良好的沟通与表达能力、思路清晰，较强的动手能力与逻辑分析能力；7、认可区块链价值，且之前有经验，有公有链开发经历、英语口语优秀等其一条件优先考虑。","移动互联网,区块链",50-150人,go,杭州
Golang工程师,https://www.lagou.com/jobs/6898224.html,西湖区,20k-30k,杭州远算科技有限公司,5-10年,本科,六险一金、创业氛围、年轻团队、互联网产品,岗位职责1、参与SaaS云平台的后端开发和优化。2、编写代码模块并进行单元测试。3、按项目优先级，保证项目交付。岗位要求1、有系统思维及解决复杂问题的能力2、精通Go、Java或C++一门以上编程语言，熟悉软件开发流程。3、熟悉Linux系统、shell脚本开发、Python，有Web开发经验。4、享受创业公司的自由与压力,企业服务,50-150人,go,杭州
高级大数据开发工程师,https://www.lagou.com/jobs/7205402.html,西湖区,18k-36k,北京云真信科技有限公司杭州分公司,3-5年,本科,16-25薪 海量数据 业务发展迅速,职位描述1.参与和主导大数据平台的开发和设计，数据产品的落地，包括但不限于数据采集、调度引擎、开发平台、数据治理、数据服务等；2.参与和主导平台的技术攻坚，解决平台的疑难杂症，包括但不限于：故障的定位与修复、资源及性能的优化；3.参与和主导平台技术的选型，新技术的预研，主流前沿技术的引入和落地，包括但不限于：存储、（流/批）计算引擎、多维分析及直接支持应用的各类数据产品；4.参与开发流程的优化改造，包括自动化测试等。 岗位要求：1.3年以上数据平台开发经验，至少完整负责过下列模块之一：数据集成/调度引擎/开发平台/任务运维/数据服务；2.3年以上的Java开发经验，可熟练开发MapReduce/Spark/Flink之一，熟悉java的IO/并发/容器/内存模型；3.数据hadoop生态环境，有HBase/Kafka/Hadoop/Hive/Spark/Flink/ES开发经验；4.熟练操作Shell，可独立使用命令行解决集群问题；5.具备快速学习、团队合作及高效沟通的能力；6.有过PB级数据平台经验者加分；7.熟悉Mongo/Redis/Mysql/Kylin/Druid/Flume/Zookeeper等开源产品者加分；8.熟悉SpringBoot/SpringCloud；9.熟悉Python/Go语言者加分；10.有用户标签/画像/推荐等数据产品开发经验者加分。,"数据服务,信息安全",50-150人,go,杭州
阿里云高可用架构-JAVA技术专家,https://www.lagou.com/jobs/7160094.html,余杭区,30k-55k,阿里云计算有限公司,5-10年,本科,承担阿里经济体和阿里云的高可用架构职责,"一、团队介绍：高可用架构团队是阿里巴巴负责阿里巴巴核心高可用产品的研发团队，提供的高可用架构基础设施直面双11洪峰流量，包括全链路压测、容量规划、准入控制、限流降级、流量调度等；通过攻防演练、环境隔离、业务对账等常态稳定性保障技术，提前暴露风险，低成本发现系统隐患；通过同城双活、异地多活、单元化体系建设，支撑阿里巴巴电商链路的分钟级故障切换，保证业务稳定运行。目前团队的技术，已经通过开源和商业化渠道进行外部输出。开源框架包括Sentinel、ChaosBlade，商业化产品包括PTS、AHAS，帮助云原生用户低成本提升高可用能力。• 如果对纯技术感兴趣，可以直接成为**开源项目的核心开发。• 如果对技术结合实际场景感兴趣, 可以深度参与多个高可用领域系统的建设, 一起探索世界****复杂高并发的双十一高可用、AIOPS等场景• 如果对产品、业务感兴趣，可以投身于将我们的高可用系统做成产品，推动实现全世界的“互联网+”趋势• 如果对云感兴趣，可以参与到性能压测、应用高可用和异地多活等云产品建设中来，感受与 AWS、Azure 等全球领先技术的追云逐浪二、岗位要求工作地点：杭州招聘岗位：• Java/Go技术专家• 前端技术专家职位描述：1、理解外部客户场景的稳定性诉求，有机融合业务和技术，从稳定性、功能、性能等方面，负责设计、实现、优化高可用云产品和解决方案；2、参与高可用技术的产品化升级，让技术具备更好的通用性和规模化复制能力；3、为客户提供应用与技术架构演进方案，基于应用高可用、全链路压测、异地多活稳定性产品沉淀具体的业务系统设计架构方案，形成最佳实践；4、通过技术影响力和团队协作能力落地稳定性架构升级；5、基于前沿技术，在助力业务创新、平台成本优化，微服务稳定性等方面进行技术预研和创新，探索复杂应用上云的新方式。职位要求：1.互联网/软件行业3年以上工作经验；2.精通linux平台上的Java语言编程，熟悉数据库开发技术，熟悉shell编程；3.对数据结构、算法设计、系统架构设计等有较为深刻的理解；4.熟悉系统高可用和稳定性方法策略，比如同城容灾、异地双活、异地多活等，有实战经验优先；5.精于架构设计、性能优化，有故障处理、监控、限流、降级、预案、容量规划、红蓝演练实战经验优先；6.有前端开发经验者优先；会C++,PHP，Go语言优先；7.具备良好的交流能力以及沉淀总结及方案输出能力，了解和分析客户需求，引导最优的架构设计方案，协调沟通产品和售后团队、进行行业沙龙宣讲等；8.善于独立思考，有快速学习能力，不断突破技术瓶颈，乐于探索未知领域，面对云计算的机遇与挑战，在较大压力下保持工作激情。三、了解更多【团队开源产品】限流降级 Sentinel（https://github.com/alibaba/Sentinel）故障演练 ChaosBlade（https://github.com/chaosblade-io/chaosblade）【团队商业化产品】性能测试服务 PTS（https://www.aliyun.com/product/pts）应用高可用服务 AHAS（https://www.aliyun.com/product/ahas）业务异地多活架构解决方案（https://www.aliyun.com/solution/middleware/msha）","电商,企业服务",2000人以上,go,杭州
运维架构师,https://www.lagou.com/jobs/6830000.html,余杭区,20k-40k,奇虎360科技有限公司,5-10年,本科,高潜行业，薪酬竞争力， 团队氛围好,岗位职责：1、负责服务器的配置、维护、监控、调优等；2、负责APP后端系统的日常运维，做好日常排查，故障预案、优化、评估等工作；3、进行服务器的配置，实现分布式，集群化运维，确保集群可用性，稳定性，制定并实施相关运维技术方案，确保服务高效，稳定的运行；4、负责设计实现与运维相关的自动化工具或系统，减少人工干预，实现运维系统管理业务系统；5、负责制定和实施运维规范，持续改进运维流程和质量。任职资格：1、本科及以上学历，计算机相关专业，5年以上系统运维经验；2、掌握至少1到2门编程语言，shell，pyrhon、或者Go语言；3、熟悉Java开发生态，有开发支持经验（配置开发环境、自动发布等）优先；4、熟悉Linux系统下各种服务的配置，例如MySQL、DNS、Nginx、Redis等；5、书序Linux操作系统的自动化部署、维护、鼓掌排查；6、熟悉阿里云的产品及运维管理；7、熟悉docker、kubernetes集群解决方案；8、具有等同CCNP的网络技能，熟练掌握TCP/IP，熟练抓包分析工具的使用；9、具备良好的分析解决问题能力与快速定位问题的能力。,信息安全,2000人以上,go,杭州
软件开发工程师,https://www.lagou.com/jobs/6913929.html,江干区,30k-60k,微软（中国）有限公司,3-5年,本科,弹性工作时间，国际化大平台,"职位类型：前端、后端、移动端、算法职位要求：熟练使用至少一种编程语言（Java/C#/Python/C++/Go等）算法coding能力强部分职位要求基本英语沟通能力部分岗位要求至少3+年工作经验（6+，8+，10+的都可以申请，岗位open for all level）包括但不限于以下职位，欢迎投递~上海职位：1.Dynamics Retail后端/全栈 1年以上工作经验，英语strong (open for all level)2. Dynamics SCM后端 3年以上工作经验，英语strong3. Dynamics Financial后端，1年以上工作经验4. Azure DevTest Labs/ Azure Configuration/ Azure SignalR Service后端开发，3年以上工作经验， 英语strong5. Azure Storage/Azure Stack后端开发，C++，3年以上工作经验，（open for all level）6. Azure Opensource Solutions后端开发，3年以上工作经验，容器背景苏州职位：1.Office 365 （云，分布式，多个小组在招聘，150+HC）后端开发/Data Scientist/Android/iOS 1年以上工作经验，英语strong (open for all level)transport/connectivity/high availability/performance/engineering system/big data/machine learning/verificationEngineering Manager，10年以上工作经验，有团队管理经验2.MMX - EdgeiOS， 1年以上工作经验，(open for all level)Android lead, 6年以上工作经验3. AI platformNLP算法，3年以上工作经验。特别优秀的纯后端工程师也可以接受。4. Azure Machine Learning 机器学习平台开发后端，8年以上工作经验，C++/机器学习/GPU/大数据前端，1年以上工作经验5. SharePoint后端开发，2年以上工作经验，英语strong6. Intune前端/后端/全栈，open for all level北京职位：1.Azure Big Data前端/后端/全栈，一年以上工作经验（open for all level）2.Azure Networkiing后端，三年以上工作经验3. Azure Machine Learning 机器学习平台开发后端，1年以上工作经验，C++/机器学习/GPU/大数据前端，1年以上工作经验4. Speech Scientist算法，1年以上工作经验，Speech/NLP背景5. MMX - Windows LauncherAndroid开发，1年以上工作经验后端开发，1年以上工作经验6. Bing Platform后端开发，6年以上工作经验，搜索/深度学习背景7. Vision Intelligence算法+工程，1年以上工作经验，数据建模/CV","移动互联网,数据服务",2000人以上,go,杭州
c++开发工程师,https://www.lagou.com/jobs/6979144.html,滨江区,10k-20k,杭州财人汇网络股份有限公司,1-3年,本科,"五险一金,福利齐全,餐补，高温补贴，年假",职位描述：1、证券行业，行情的各种业务实现；2、联合各业务线完成开发联调工作；3、和团队合作，对后台行情服务器进行性能优化。任职要求：1、熟练掌握 C++，熟悉常用库的使用，STL 或 Boost 等；2、熟悉 C++ 的多线程开发，了解一些常用数据结构和算法；3、有独立模块开发能力；4、良好的工作责任心；5、深刻理解 TCP 协议优先；6、有银行，证券等金融行业的工作经验优先。加分项：1、了解其它一种或多种语言 JAVA/C#/GO/PYTHON/SHELL 等；2、熟悉 Linux 操作系统下的 C++ 开发经验；3、有文件系统的 IO 优化经验；4、为人乐观，豁达。,"移动互联网,金融",150-500人,go,杭州
