job_name,job_url,job_location,job_salary,job_company,job_experience,job_class,job_given,job_detail,company_type,company_person,search_key,city
android开发工程师,https://www.lagou.com/jobs/6851001.html,雨花台区,10k-20k,亚信科技（中国）有限公司,不限,本科,人工智能,"职位描述：1. 负责Android系统服务层的开发以及维护工作，确保系统的稳定性、可靠性；2. 负责与测试、项目团队进行对接，解决项目疑难问题，以及项目相关问题；3. 独立进行错误分析、调试和修复, 并输出失效分析文档；4. 参与APP架构设计，承担模块设计，依据项目进度，实现软件功能并完成性能优化；5. 系统快启、内核优化、系统稳定性等相关的底层软件开发工作；6. 分析、定位并解决底层相关的软硬件问题；任职要求:1. 对Android系统原理有全面了解，熟悉Android的数据存储与访问方式，熟悉Activity及Service的生命周期，熟悉Android框架层核心服务，如AMS/WMS/PMS等，能为系统App提供技术指导与支持；2. 熟悉系统的调试方法，并能熟练使用各种系统调试工具，能快速定位问题、解决问题；3. 熟悉Linux下SDIO、USB、WIFI、Sensor、Display、Camera、Audio、Tuner等驱动模块开发者优先考虑；4. 工作态度积极、学习能力强、具备良好的沟通能力和团队合作精神；5. 有ARM平台Linux内核移植与驱动程序的开发经验优先考虑；6. 可以看懂原理图，具备一定硬件debug能力者优先考虑；","企业服务,移动互联网",2000人以上,android,南京
Android,https://www.lagou.com/jobs/1024606.html,浦口区,6k-12k,南京指南针信息科技有限公司,1-3年,不限,项目奖金，成长快,"1.1年以上工作经验，计算机相关专业大专或以上学历2.熟练掌握Android开发调试技巧 ，能够独立开发APP3.熟练掌握Android UI组件（weight, Fragment等）、常用布局等 ,会自定义控件4.熟悉无线网络相关知识, 熟悉TCP/UDP、HTTP等网络协议5.有Android Market上线产品经验优先6.较强的发现、分析、解决问题能力；7.具备良好的职业道德和团队精神，工作认真，能够承担工作压力。",移动互联网,15-50人,android,南京
高级安卓研发工程师,https://www.lagou.com/jobs/4794176.html,秦淮区,15k-20k,南京伯索网络科技有限公司,3-5年,本科,"发展平台大,技术牛人多,薪酬福利好","岗位职责：1．Android软件的设计、开发、系统调优；2．辅助系统定义、程序设计；3．协助制定测试计划、定位问题；任职要求：1、本科以上学历，计算机、软件相关专业；2、3年以上Android平台MMI软件开发经验，精通Android App 开发，熟练掌握常见的技术框架和原理，了解Android App的分发机制和热更新机制；3、了解前端技术，能够配合前端完成调试；4、熟悉MVC,MVVM等常用架构，熟悉常用设计模式；5、良好的编程习惯和风格，扎实的编程基础；6、有责任心，工作积极主动，勤恳踏实，能承担一定的工作压力，具备良好的沟通能力和团队合作精神。",移动互联网,150-500人,android,南京
android开发,https://www.lagou.com/jobs/6686274.html,雨花台区,16k-30k,拓维信息系统股份有限公司,5-10年,本科,"年底双薪,,绩效奖金",岗位要求：1.本科及以上学历，计算机相关专业优先，4年以上Android开发经验；2.安卓项目经验丰富，基础技术掌握扎实；3、针对已做项目清楚其核心功能的技术实现原理，清楚项目开发技术流程；4、强烈的责任心，做事认真细致，具备良好的团队合作精神，沟通能力佳，学习能力强。,"移动互联网,教育",2000人以上,android,南京
android开发工程师,https://www.lagou.com/jobs/6888751.html,雨花台区,8k-15k,南京瞰聆信息科技有限公司,1-3年,本科,自研公司，五险一金，周末双休，福利齐全,岗位职责:1.根据需求在Android移动端进行APP的设计和开发；2.参与项目的需求分析和模块设计，独立完成开发工作，进行模块测试，保证代码质量；3.维护项目，修正并验证测试中发现的问题；4.学习和研究新的移动互联网技术并尝试应用到产品中；岗位要求：1.性格乐观，思维开放，善于沟通学习，有责任心；2.计算机相关专业，本科及以上，二年以上工作经验；3.拥有扎实的理论知识，包括操作系统原理，数据结构，数据库原理，计算机编程，计算机网络等；4.深刻理解Android平台架构、主要组成和工作模式；5.熟悉Android手机软件的一般开发模式、开发步骤、模块划分及集成；6. 熟悉基本通讯协议、常用数据格式解析及应用优先考虑；7.掌握MVP/MVVM开发模式者优先；8.熟悉H5开发者优先。岗位亮点：五险一金，周末双休，无强制加班，每月生日会，年度旅游、团建等，各项节日福利齐全，团队精干，氛围和谐，项目前景好。,"移动互联网,企业服务",15-50人,android,南京
安卓开发工程师,https://www.lagou.com/jobs/6850747.html,雨花台区,13k-16k,南京安讯科技有限责任公司,3-5年,不限,安卓开发,任职要求：1.负责公司 Android客户端产品的开发； 2.完成产品设计、编码和单元测试工作，确保开发质量； 3.参与产品需求的沟通、讨论和协调。任职要求： 1.计算机科学或相关专业本科及以上学历，3-5年Android领域开发经验； 2.掌握JAVA或KOTLIN开发语言，熟悉Android平台及框架；3.有进程多线程编程经验，熟悉Socket网络编程，熟悉TCPIP，HTTP等网络协议； 4.提供实际的Android客户端产品； 5.语言表达能力强，责任心强，优秀的团队合作及沟通能力对技术有热情，逻辑性强，不畏挑战。符合以下条件优先录用：1.有两年以上音视频产品编程经验； 2.有地图类产品客户端软件开发经验；3.熟悉蓝牙及通信应用开发。,"移动互联网,金融",150-500人,android,南京
android开发工程师,https://www.lagou.com/jobs/7068092.html,江宁区,15k-25k,上海中软华腾软件系统有限公司,不限,本科,入职五险一金、项目奖金、绩效奖金、年终奖,"项目介绍：手机终端项目～技术要求较高，项目前景好，薪资优厚!技能优秀者学历可放宽统招大专！！！1，本科以上学历，计算机工程·通信工程等相关专业优先（全日制统招～学信网可查）2，安卓页面布局能力要强，包含各种基本组建的使用，有过一些开源组件使用，最好阅读过一些源码(recycleview,vlayout,glide等)。最好了解一些小语种的布局，例如阿拉伯语下布局是从右到左的方式3，熟悉安卓的事件分发机制，与view绘制机制，handle的原理，消息传递机制，线程与线程池等4，能够解决crash,anr与内存泄露，有一套自己的分析方法5，熟练掌握调试工具，以及安卓的一些辅助分析工具systrace , layout inspector等","企业服务,金融",2000人以上,android,南京
android开发工程师,https://www.lagou.com/jobs/6979060.html,雨花台区,15k-25k,上海易宝软件有限公司南京分公司,3-5年,本科,项目好，android都是市面主流技术,1.有2年以上Android平台应用软件开发经验。 2.熟悉Android SDK、Android平台UI开发。 3.有良好的编程习惯和代码规范。4.有良好的敬业精神和沟通能力。,移动互联网,150-500人,android,南京
Android开发（高级）工程师,https://www.lagou.com/jobs/6970385.html,鼓楼区,20k-40k,北京字节跳动科技有限公司,不限,本科,字节跳动，福利好，平台广，偏平管理,职位描述1、负责新产品业务的功能研发和性能优化，完成高质量编码和测试工作； 2、和产品经理配合，深度参与手机产品需求讨论，功能定义等 ； 3、设计良好的代码结构，不断迭代重构 ； 4、承担重点、难点的技术攻坚。职位要求1、本科及以上学历，计算机、通信等相关专业； 2、具有扎实的编程功底，良好的设计能力和编程习惯； 3、熟练掌握Java，熟悉Android SDK ； 4、一年以上Android开发经验，能独立开发Android App； 5、有较好的产品意识优先； 6、积极乐观，责任心强，工作认真细致，具有良好的团队沟通与协作能力； 7、热爱移动产品研发，有较强的学习能力，有强烈的求知欲、好奇心和进取心 ，能及时关注和学习业界最新的移动开发技术。,文娱丨内容,2000人以上,android,南京
Android开发工程师,https://www.lagou.com/jobs/6725478.html,雨花台区,8k-15k,江苏省朗通科技有限公司,不限,大专,工作强度小；发展空间大,岗位职责：1、根据产品需求开发Android应用客户端；2、对安卓手机软件系列产品进行维护、优化；3、参与android平台应用软件的设计策划及相关技术研究。任职要求：1、计算机相关专业，大专及以上学历；2、1年以上Android应用开发经验；特别优秀的应届生也可考虑；3、熟悉Android Studio等开发工具，能够独立搭建Android开发及测试环境；4、熟悉Android应用开发框架，熟悉Android相关SDK，能独立开发Android应用；5、深入理解Android 组件机制，组件通信原理，熟悉性能调优，内存泄露排查等相关知识；6、熟悉数据结构及算法基础，熟悉网络通信机制及常用数据传输协议；7、熟悉html5、css3及javascript优先。8、良好的沟通、学习能力，工作认真负责，具有团队工作精神。,软件开发,15-50人,android,南京
android开发工程师,https://www.lagou.com/jobs/6969264.html,建邺区,8k-13k,南京宝玮科技有限公司,1-3年,大专,五险一金；周末双休；加班调休,1、至少2年以上Android开发经验。2、具备扎实的Java语言基础;精通Android开发环境以及Android平台的开发规范;熟练掌握Android开发框架及API调用;熟练掌握Android的各种UI布局和控件开发，并具有开发自定义UI控件的能力。3、熟练应用网络API，熟悉SocketHTTP、Android线程、进程通信机制;有良好的代码习惯，要求结构清晰、命名规范、逻辑性强、代码冗余率低，代码注释清晰；对Android程序性能优化、内存优化有一定的经验。4、熟练掌握Android平台下的代码调试和调优技术； 具备较强的架构能力、设计能力、需求分析能力、具备独立完成APP开发能力。,"移动互联网,硬件",50-150人,android,南京
Android开发工程师,https://www.lagou.com/jobs/4202941.html,江宁区,10k-20k,南京本链信息科技有限公司,3-5年,本科,"弹性工作,五险一金,年终奖,免费零食",岗位职责：1. 移动设备上Android应用软件的开发和维护2. 独立完成移动终端产品应用的功能模块开发3. 协调产品、测试、设计等按时按质完成项目开发任职要求：1. 计算机相关专业，3年以上android开发经验。有独立完成app开发到上线的经历2. 具备良好的编码习惯，逻辑清晰，熟练运用设计模式3. 具备独立思考、分析和解决问题的能力4. 熟练掌握UI、多线程、同步异步、IO、网络以及数据库开发5.  良好的团队协作意识和积极的工作态度,其他,15-50人,android,南京
android开发工程师,https://www.lagou.com/jobs/6968309.html,雨花台区,10k-15k,江苏润和软件股份有限公司,3-5年,本科,五险一金 年薪双薪 餐补 加班少,1.    熟悉handler消息机制，并熟练运用及处理相关问题；2.    熟练使用fragment以及和viewpager组合实现功能；3.    对android时间分发机制有一定的了解；4.    有处理过ANR、TOMSTONE的经验；5.    熟悉动画；岗位要求：1、 本科及以上学历，计算机等相关专业；2、 2-5年Android APP开发经验；3、 有完整的Android项目经验；4、 沟通能力较强、有责任心。,移动互联网,2000人以上,android,南京
android开发工程师,https://www.lagou.com/jobs/5645112.html,玄武区,11k-15k,南京方和网络科技有限公司,1-3年,本科,弹性工作时间，免费午餐、水果、饮料。,职位描述：1. 喜欢编码工作、自学能力强，有良好的思维逻辑能力，有良好的责任感和抗压能力；2. 有扎实的JAVA基础，熟悉多种Android应用开发框架，能独立开发Android应用程序，根据产品需求完成架构和模块设计、编码、测试工作；3.有良好的编码习惯，沟通良好，有工作激情和团队合作精神；4.在项目中熟练使用常用设计模式（单例模式、工厂模式、适配模式、观察者模式等）和MVP架构进行编码5.熟练掌握事件分发机制、消息机制，掌握XML的解析及JSON解析、熟练使用http，SOCKET等协议,"移动互联网,企业服务",15-50人,android,南京
android开发工程师,https://www.lagou.com/jobs/7128812.html,栖霞区,10k-15k,杭州天铉科技有限公司,3-5年,大专,9:00-18:00,工作职责：1、负责根据产品需求，完成产品Android端软件设计、开发及维护；2、负责相关技术文档的编制与维护；3、参与产品的需求分析并参与技术实施方案设计。任职要求：1、3年及以上Android系统APP开发经验，具有良好的代码风格及独立开发项目的能力；2、岗位要求熟悉常用数据库基本操作，如SQLite、SQLServer；3、具有扎实的Java语言基础；4、具有硬件的交付界面系统的开发经验；5、有医疗行业经验值优先。,"数据服务,软件开发",150-500人,android,南京
安卓开发工程师,https://www.lagou.com/jobs/6884790.html,建邺区,9k-12k,南京多邦软件有限公司,1-3年,本科,五险一金，成长空间大,岗位描述：1.负责Android手机软件的开发及设计；2.根据产品的需求进行Android产品的开发；3.对Android平台开发技术进行研究，发现其缺陷并改正更新；4.根据用户需求研发新的Android产品，并测试其性能，进行改进；5.根据项目需求进行学习并快速掌握技巧； 任职资格：1、计算机相关专业，本科及以上学历；2、1年以上Android应用开发经验，熟悉Android SDK及相关开发、调试、优化工具；3、具有扎实的Java语言基础、熟悉面向对象的编程原理理；4、开发基础良好，对手机软件性能优化、内存优化有一定的了解；5、熟悉Android环境下的UI框架、Socket通信、HTTP通信、多线程编程,"移动互联网,教育",15-50人,android,南京
安卓开发工程师,https://www.lagou.com/jobs/7071941.html,鼓楼区,9k-11k,南京联坤软件技术有限公司,1-3年,本科,周末双休，五险一金，定期体检，带薪年假,岗位职责：1、负责Android手机客户端应用的需求分析、设计和开发；2、负责Android手机客户端应用的上线、维护以及后续版本的更新和技术支持；3、根据的技术发展，对Android手机客户端应用进行技术优化；任职要求：1、本科及以上学历，1-2年Android开发经验，能独立开发Android应用；2、熟练使用Java开发，有html，css，javascript或者flex开发经验；3、熟练使用AS、VSCode、Eclipse等开发工具及性能调优。4、熟悉Android 平台架构、熟悉各版本API的区别。5、根据代码规范进行代码编写。6、熟练的使用与集成第三方SDK。7、对工作充满热情，具有高度的责任感与团队合作精神，良好的沟通能力。,"移动互联网,企业服务",50-150人,android,南京
android开发工程师,https://www.lagou.com/jobs/6988630.html,鼓楼区,8k-10k,南京联坤软件技术有限公司,1-3年,大专,"五险一金,带薪年假,体检旅游",岗位职责：1、负责Android手机客户端应用的需求分析、设计和开发；2、负责Android手机客户端应用的上线、维护以及后续版本的更新和技术支持；3、根据的技术发展，对Android手机客户端应用进行技术优化；任职要求：1、本科及以上学历，1-2年Android开发经验，能独立开发Android应用；2、熟练使用Java开发，有html，css，javascript或者flex开发经验；3、熟练使用AS、VSCode、Eclipse等开发工具及性能调优。4、熟悉Android 平台架构、熟悉各版本API的区别。5、根据代码规范进行代码编写。6、熟练的使用与集成第三方SDK。7、对工作充满热情，具有高度的责任感与团队合作精神，良好的沟通能力。,"移动互联网,企业服务",50-150人,android,南京
android开发工程师,https://www.lagou.com/jobs/7035067.html,雨花台区,13k-23k,东华软件股份公司,3-5年,本科,五险一金、双休、年终奖等,工作地点：南京市雨花台区华为研究所一、岗位职责:1、负责公司项目产品的开发，包括java开发和安卓终端APP软件开发等；2、负责新需求分析及新特性设计，关键模块与核心代码的编写与检视；3、负责应用软件架构优化、解耦设计与关键问题的分析与解决等工作；4、有强烈的责任心，工作积极主动，具有较强的学习能力和技术研发能力。二、岗位要求:1、全日制本科及以上学历，计算机或相关专业；2、2年以上Android开发经验，java技术知识扎实，理解面向对象设计的原则；3、熟悉类的基本概念以及使用，熟练使用数组、链表和Map等；4、2年以上Android平台上开发经验，熟练掌握常用 Android API，熟练掌握HTTP及 HTTPSocket  LAndroid编程5、负责过大型Android应用的软件架构设计和核心模块的开发；熟悉 Android体系架构；6、具有 Android TV appAndroid开发、熟悉内存管理机制，性能优化方案类似工作经验者优先；7、在可扩展、高性能、高稳定性系统设计，开发和调优方面有实际经验者优先；三、福利待遇：五险一金，双休，发展空间大。,"企业服务,数据服务",2000人以上,android,南京
android开发工程师,https://www.lagou.com/jobs/6197550.html,江宁区,7k-14k,南京聚特惠电子商务有限公司,1-3年,不限,发展空间大 工作环境好 老板nice,1、至少一年以上工作经验；2、熟悉Android 开发平台及框架原理，有android移动产品开发经验者优先；3、熟悉Android系统结构或某一专门模块，如UI、多媒体、网络传输等；4、熟悉Android平台UI设计，熟悉常用布局；5、熟悉Android下网络通信机制，对Socket通信、TCP/IP和http/https有较深刻的理解和经验；6、对数据结构、基本算法熟练掌握，并具备基本的算法设计能力；7、SVN或Git管理代码；8、能够熟练使用MVVM（重点）9、良好的学习能力、沟通能力和自我管理能力，为人正直，有责任心；岗位职责：1、参与公司Android手机客户端应用产品的实现、测试及维护功能；2、与项目相关人员配合共同完成手机客户端应用软件的开发设计工作,"电商,消费生活",150-500人,android,南京
安卓开发工程师,https://www.lagou.com/jobs/6724449.html,雨花台区,10k-15k,南京肃帛软件科技有限公司,1-3年,大专,发展前景好,任职要求：1.全日制统招大专及以上学历，2年以上工作经验；2.具有JAVA语言编程基础，具备良好的编程习惯；3.熟悉Android四大组件、布局及特性，对Androidframework流程有一定的认识；4.熟悉Android下网络通信机制，熟悉Android数据库、线程通讯、多媒体操作等模块；5.善于沟通，能够快速融入团队进行相关开发工作；6.具有良好的执行能力，自学能力和独立解决问题的能力。,软件开发,50-150人,android,南京
android开发工程师,https://www.lagou.com/jobs/6493293.html,雨花台区,7k-9k,北京睿智荟聚科技发展有限公司,不限,大专,每月补贴 五险一金 双休,岗位职责：1、负责产品的Android客户端开发；2、理解产品需求，参与客户端产品的技术实现讨论和框架设计； 3、根据功能需求和设计方案进行开发，完成代码的编写和调试工作； 4、持续优化客户端性能。    岗位要求：1.熟悉Android开发平台及框架原理，熟练掌握Android UI开发技术以及数据库访问、广播及服务技术。 2.熟练掌握HTTP、TCP/IP等网络通信协议，至少能够熟练使用1种流行的HTTP网络访问技术框架，熟练掌握Json、Xml等格式数据的处理技术； 3.能够独立跟踪需求，并且完成定制化开发到发布一系列流程。 4.有独立完成已上架作品者优先,企业服务,50-150人,android,南京
Android开发工程师,https://www.lagou.com/jobs/6961506.html,浦口区,10k-15k,南京吉冉软件有限公司,1-3年,本科,五险一金双休,"Android开发工程师1、根据产品需求，设计并完成移动端的开发工作2、参与产品需求分析并参与技术实施方案设计3、负责编写和维护技术档案要求：1、具有2年以上移动端实际项目开发经验2、具有扎实的java编程基础，较强的逻辑思维能力3、熟悉软件开发流程，能独立完成设计、编码及测试工作认真、责任心强、良好的沟通能力。","移动互联网,企业服务",15-50人,android,南京
android开发工程师,https://www.lagou.com/jobs/6587697.html,雨花台区,12k-24k,视若飞信息科技（上海）有限公司,3-5年,本科,五险一金补充医疗保险 定期体检员工旅游,"职位描述：1、负责Android产品（基于浏览器）的需求分析、开发和测试。2、基于各TV、STB平台移植Android产品。3、开发和维护数字电视相关协议。Essential1.精通 C++开发。2.深入了解面向对象开发、C++对象模型。3.深入了解传统数据结构及算法。4.熟悉多线程、多进程编程。5.熟悉 Linux平台下的软件debug。6.熟悉 HTML4.01/HTML5、JavaScript/DOM、CSS。7.熟悉 Linux环境，交叉编译。8.熟悉 HTTP, Socket以及图形库。9.善于沟通协作。10.具备专业文档英语读写能力。Desirable1.英语口语流畅。2.熟悉PHP、Python、Bash Shell。3.了解多媒体开发及图形图像开发。4.具备开源浏览器研发经验。5.了解Android框架及平台 MediaPlayer。6.了解 XML、HTML。7.了解 SQL数据库。8.具备一定的团队领导能力。9.熟悉嵌入式开发环境。公司介绍","移动互联网,其他",50-150人,android,南京
android开发工程师,https://www.lagou.com/jobs/6915633.html,建邺区,12k-16k,南京云融金融信息服务有限公司,3-5年,本科,五险一金，节假日福利，生日福利,岗位职责：1.负责Android平台上互联网应用（多媒体流）的开发、维护和优化工作。2.负责应用软件设计、编码与测试，开发文档编写。3.解决产品在使用过程中遇到的各种问题。4.跟进研究行业内技术动向，做好相关产品的技术规划和预研，保证公司产品的技术领先性。任职要求：1、大专及以上学历，2-3年Android软件开发工作经验。2、精通Java编程，精通Android应用开发，熟悉Framework，熟悉Linux系统，熟悉网络编程、Http协议，熟练使用多线程编程。3、熟悉Android控件的绘制流程和事件分发流程，精通自定义控件、事件分发原理者优先。4、熟悉Android动效开发，精通动效原理、有复杂动效开发经验者优先。5、有较好的性能意识，了解常用的性能优化方法和性能调试工具。6、踏实、稳重，责任心较强，有上进心，学习能力较强。7、有在线教育或者IM相关开发经验优先。,"移动互联网,金融",150-500人,android,南京
Android开发工程师,https://www.lagou.com/jobs/5852913.html,建邺区,8k-15k,南京贝悦达信息技术有限公司,不限,不限,职位发展潜力巨大，锻炼机会多。,"任职要求】1年或以上Android开发经验;熟悉Android开发架构和API调用；熟悉HTTP、TCP/IP通讯协议,有网络编程经验;熟练掌握面向对象设计思想，熟悉常见设计模式，具备一定架构能力者优先；新技术接受能力强，具有程序设计模式思想，具有较强的学习能力、沟通能力和团队合作精神；对移动互联网产业有浓厚的兴趣；岗位职责】负责Android项目的开发规划、架构设计工作；完成手机应用软件Android平台模块的设计及编码；撰写技术实现文档，参与技术方案验证；配合设计和测试团队完成软件用户体验、运行及通信速度、功能等方面的改进及提升；调试和解决系统测试中发现的问题；",移动互联网,少于15人,android,南京
android开发工程师,https://www.lagou.com/jobs/6379216.html,鼓楼区,15k-25k,上海博泰悦臻电子设备制造有限公司,5-10年,不限,体检，团建，节日福利,"1. 5年以上Android客户端开发经验，基础扎实，熟练使用git/gerrit/jenkins/gradle等开发工具2. 精通Android应用开发框架, 具备丰富的Android UI开发经验 , 精通Android移动应用中数据存储、网络通讯、多媒体，蓝牙等的开发3. 对主流设计模式有实际运用经验，了解模块化，组件化4. 有应用性能问题与稳定性问题的分析与解决能力5. 有跨平台Flutter，RN等开发经验者优先6. 有强烈的责任心和团队精神，抗压能力强7. 对技术和产品有**追求，善于思考和总结，能主动解决问题",移动互联网,150-500人,android,南京
