job_name,job_url,job_location,job_salary,job_company,job_experience,job_class,job_given,job_detail,company_type,company_person,search_key,city
php开发工程师,https://www.lagou.com/jobs/6770762.html,南山区,15k-30k,深圳市速点网络科技有限公司,1-3年,本科,高薪公司稳定行业前景好,岗位要求：1、全日制大学本科及以上学历；2年以上PHP后台系统开发经验；2、精通PHP语言，同时熟悉或实践过Go/Java/Python等后端语言开发者优先；3、熟悉Linux操作系统，能熟练使用MySQL/MongoDB/Redis等数据库，熟悉常用的系统性能分析及优化方法；4、主导过完整的系统开发者优先（从系统的需求、设计、架构、实现和运营），重点掌握后端开发，并对常见的前端开发模式了解（如基于Vue的前端开发）；5、有激情有进取心，乐于持续学习，抗压性强，良好的沟通能力和合作精神；6、对新技术保持好奇心并具有专研精神和创新思维；7、熟悉容器与K8S者优先。岗位福利：1、和谐活跃的工作氛围，Boss性格Nice，Leader和蔼体贴，年轻团队活泼友善。2、人性化管理，弹性工作，加班适度。3、每周一次下午茶，每月一次生日会，每年一次旅游，不定期团建。4、五险一金（15号前入职的当月即购买，15号后入职的次月购买）。5、年终双薪。,"移动互联网,广告营销",50-150人,go,广东
仓储平台后端负责人,https://www.lagou.com/jobs/6801204.html,南山区,50k-70k,深圳虾皮信息科技有限公司,5-10年,不限,东南亚电商，年假多，上升空间大,"岗位职责业务责任描述
 打造覆盖东南亚的供应链系统，多国多地区的复合仓储系统
 构建全链路的监控体系和质量保障系统
 打造开放性仓储平台，直接面向更多的商家和买家
技术责任描述 
 负责Shopee 仓储平台整体项目的开发建设和规划，负责项目质量和进度
 负责根据项目计划制订开发计划，分配开发资源，负责与产品，测试，开发就项目需求、进度和问题进行沟通，推动问题解决
 负责对技术方案的把控，以及跟进研究业界动态，推进新技术的落地实施
 负责团队培训、相关人员的管理，优化和改进研发流程，提高开发人员的效率
任职要求
 计算机及相关专业，本科以上学历，八年及以上全职开发工作经验，三年以上中大型团队管理经验；
 扎实的编程基础，良好的代码风格，精通常用的软件工程方法，设计模式，数据结构和算法；
 JAVA，C/C++，Go，Python至少需要精通其中的一门；
 精通WEB开发，至少需要对一个WEB框架有深入了解；
 对MySQL，Redis等存储系统有深入理解，熟悉Rabbitmq，Kafka等消息系统，能够熟练使用消息系统进行系统解耦；
 对企业应用的架构和系统架构有独到的认识，了解不同架构方法的适应性和优缺点；对系统的高可用和高复用有一定的经验和理解；
 以结果为导向；善于思考，能独立分析和解决问题；责任心强，具备良好的团队合作精神和抗压能力；要有创业的激情和坚定的信念；
 有供应链、仓储、物流等相关业务背景优先;
 具有一定的商业敏感度，能够把握产品的需求价值，结合产品研发给出详细的技术方案
 适应变化、快速响应、踏实高效，有良好的团队管理意识和能力；
 需要有一定的英文阅读和书写能力。",电商,500-2000人,go,广东
测试负责人,https://www.lagou.com/jobs/7028439.html,南山区,50k-70k,深圳虾皮信息科技有限公司,5-10年,不限,福利待遇好，发展空间大,"岗位职责：1、参与产品需求分析，制定测试策略、方案及计划，统筹资源和任务分配，保证项目的测试进度和质量；2、执行软件产品的性能测试和分析，预测系统性能瓶颈、风险和安全隐患，负责线上缺陷跟踪及分析；为网站容量规划提供数据及建议；3、制定测试计划,根据需求设计测试用例,根据测试用例进行测试执行工作，并对缺陷进行跟踪，推动问题及时解决；4、根据项目特点(WEB、手机APP、后台API)，开发或使用合适的测试工具实现自动化测试；5、主导测试流程、技术改进及推进质量前移工作；6、建设人才团队，优化测试工具，提高测试效率。任职要求：1、本科及以上学历，计算机相关专业，负责过大型的项目测试工作，八年及以上全职开发工作经验，三年以上大中型团队管理经验；有电商类相关测试经验优先；2、有独立负责项目经验及出色的测试构架能力；熟悉测试流程和规范，熟练掌握软件测试方法，熟悉黑盒测试、安全测试、自动化测试、性能测试等；3、熟练使用任意一种常用的自动化测试工具（QTP、LoadRunner、Selenium、Jmeter等），缺陷管理跟踪软件（禅道、Jira、QC）；4、有搭建自动化测试平台的实战经验者优先；5、具备良好的开发基础，至少熟悉Python/Java/Go一种开发语言；6、熟练使用版本控制工具，熟悉任意一种数据库，熟练编写sql；7、适应变化、快速响应、踏实高效，有良好的团队管理意识和能力。8、需要有一定的英文阅读和书写能力。",电商,500-2000人,go,广东
sz-测试开发岗,https://www.lagou.com/jobs/6735579.html,福田区,15k-25k,深圳市中手游网络科技有限公司,3-5年,大专,"大平台,福利好,牛人多,晋升空间大",岗位职责：1、参与制定手游项目的自动化测试需求，并开发对应的机器人2、结合业务需求，建立和维护相关工具、平台的设计及开发工作3、及时发现项目进程中存在的问题，并提出持续性改进意见并推进迭代优化任职资格：1.2年以上的软件开发或者测试开发工作经验，熟悉C++/Java/Go/C#等至少一种主流编程语言，熟悉至少一门脚本开发语言（如shell、python），接受优秀毕业生；2.具备端游或手游的测试经验；3.良好的沟通能力，对质量体系、流程、测试风险把控有很好的理解和应用。,"移动互联网,游戏",500-2000人,go,广东
运维工程师,https://www.lagou.com/jobs/6968182.html,福田区,15k-20k,景瀚科技（深圳）有限公司,5-10年,本科,扁平管理 领导好 零食饮料 多假期,"职位描述：1.负责公司应用/游戏云服务器的运维和架构设计优化等工作；2.参与自动化运维平台规划设计，CI/CD流程的规划设计和实施；3.负责搭建运维监控体系，日志监控体系，针对问题迅速响应并且解决；4.通过技术手段、流程制度、容灾演练等措施，推动系统架构的健壮性，保障运营质量；5.快速定位和解决服务器故障；6.制定标准化的运维体系。 任职要求：1.具备基础的英语阅读能力；2.具备基础的阅读文档、撰写文档能力；3.5年及以上系统运维和实施经验；4.精通Windows、Linux等主流操作系统；5.精通Apache、Nginx，Redis，Kafka等主流中间件的安装和配置；6.熟练掌握Docker自动化部署,并且能够制定自动化部署解决方案；7.有Kubernetes线上部署实施经验；8.熟悉自动化监控工具的使用和配置；9.熟练使用 shell/bash，熟悉Python、Go、Java、C/C++等至少一种编程语言优先考虑；10.较强的学习与协作能力，良好的执行力与沟通能力；11.思维清晰敏捷，逻辑分析能力强，良好的口头和书面表达能力；12.良好的团队合作精神与沟通能力，思想活跃，注重细节，能够承受工作压力。  公司福利：1.周末双休；2.五险一金，一档医疗；3.带薪年假、每个法定假期多放假1~3天不等、圣诞节也放假！还有节日礼品；4.公司有各种零食饮料；5.每周球类运动、每月部门团建、每月庆生会、每年不定期公司活动；6.每年两次提升薪资的机会；7.扁平化管理，感受融洽和谐的团队氛围，期待您的加入！","移动互联网,游戏",15-50人,go,广东
PHP开发工程师,https://www.lagou.com/jobs/6402472.html,天河区,8k-16k,广州爱拍网络科技有限公司,1-3年,本科,团队气氛佳 发展前景好,我们希望您是：   靠谱的工程师：有扎实的基础，有丰富的开发经验以及钻研新技术的热情；     有创业者基因：你渴望一个能够共同成长的团队，有开发高品质产品、编写高质量代码的自我要求。我们会让你做： 1.负责平台的搭建与开发流程优化； 2.代码架构重构，业务框架设计 。您必须要自带的技能：1. 本科（1年以上PHP开发经验）2.精通PHP+MySQL开发，熟悉Javascript、XHTML、PHP模板技术；3. 熟悉面向对象编程，具有良好的代码编程习惯；4. 熟悉PHP主流的MVC框架，实际项目中有使用过CodeIgniter/Laravel/Yii/Symfony中的一种或多种；5. 熟练掌握基于MySQL的数据库开发，掌握MySQL的数据库配置管理、性能优化等技能，具备数据库应用系统的规划及设计的能力；6.有大数据或高并发处理经验优先考虑；7.熟悉go语言开发的，优先考虑；8. 学习能力强，责任心强，工作积极主动，能刻苦，具有专研精神。,文娱丨内容,150-500人,go,广东
高级后端开发工程师,https://www.lagou.com/jobs/7193956.html,南山区,15k-30k,广东美的制冷设备有限公司,3-5年,本科,六险一金 房补车补 10天旅游假,岗位职责：1. 负责电商系统后端业务系统开发，如商品，购买，活动，订单等系统开发。2. 负责后端系统架构体系规划，设计，建设和优化。3. 负责后端工具，公共库，平台组件等开发和维护。4. 对于电商平台开发主流技术，如数据存储，高并发高可用系统设计等深入持续研究。任职要求：1、计算机相关专业本科及以上学历，3年以上的c++开发经验，1年以上互联网开发经验； 2、具备Linux c/c++、go语言开发经验，熟悉数据结构与算法，熟悉常用设计模式;3、负责过电商某块具体业务，比如有抢购、优惠券、订单、支付、结算等相关工作经验优先，对mysql、redis、mq有一定了解者优先，熟悉脚本语言，如python、shell者优先考虑。;4、有强烈的责任心，具有owner精神，主动承担，并有良好的抗压能力，深入思考，并解决问题；5、具备良好的沟通技能及团队协作意识，有能力针对特定场景或要求给出合理的技术解决方案，并跨部门协调完成。,硬件,2000人以上,go,广东
云平台架构师,https://www.lagou.com/jobs/7194512.html,南山区,40k-80k,广东美的制冷设备有限公司,5-10年,本科,六险一金 房补车补 10天旅游假,岗位职责：1. 负责IoT云平台技术选型、系统架构设计、团队技术提升及管理，并承担核心业务研发工作；2. 保障服务的服务性与稳定性；3. 主导解决开发中遇到的复杂技术难题。岗位要求：1. 精通互联网产品架构，有丰富的大型分布式、高并发、高负载、高可用性系统设计开发经验。优秀的分析设计能力与文档能力；2. 精通Java语言及其应用框架、设计模式。熟悉一种或多种其他服务开发语言如Go Lang、Python、Node.js等；3. 精通微服务架构如 Spring Cloud，Dubbo/Dubbox等，在服务治理，服务监控方面有丰富实战经验；4. 熟悉主流数据库系统，及 Kafka、Redis、MongoDB、Hadoop、Spark、ElasticSearch等相关技术；5. 熟悉容器技术并有实际使用经验，熟悉DevOps研发流程以及持续集成工具链；6. 善于学习，有较强的主观能动性，对前沿技术具有敏锐度，英语基础好，能够阅读英文文献和英文技术材料；7. 良好的沟通能力与协调能力、执行能力，责任心强，有团队管理、技术指导及培训经验。,硬件,2000人以上,go,广东
PHP开发工程师（主程）,https://www.lagou.com/jobs/7108520.html,南山区,14k-22k,深圳市农博创新科技有限公司,3-5年,大专,"行业前景大,年终奖,扁平化管理,双休",岗位职责：1、负责核心代码的编写、技术方案的制定；2、负责带领组员进行任务分解及排期3、负责审核代码质量及技术培训； 任职要求：1、大专（含）以上学历，计算机相关专业，3年以上工作经验；2、熟练使用svn、git等版本管理工具；3、深入理解计算机原理、熟悉php的运行模式、常见的设计模式、PSR规范等；4、熟悉thinkphp，laravel等php框架；5、具有并发、mysql分库分表、事务处理等项目经验；6、熟悉linux开发环境，并对docker有一定了解；7、熟悉tcp、mqtt等常见的通信协议，有物联网项目经验的优先；8、熟悉swoole框架使用经验的优先9、具有go语言开发经验的优先。,"硬件,移动互联网",15-50人,go,广东
测试开发工程师,https://www.lagou.com/jobs/7178093.html,天河区,10k-12k,广州线条信息科技有限公司,3-5年,本科,包午饭，公司氛围好，牛人多,"岗位职责：1、负责渠道包测试验收工作系统化、自动化；2、负责自动化测试架构设计、框架/工具开发等的开发与搭建；3、根据软件产品特点，使用自动化测试提升测试效率、提高测试覆盖率、软件测试质量；4、主导开发或引入业界先进的自动化测试框架（技术）；5、通过问题导向，需求变化，完善和调整自动化测试领域的流程。   岗位要求：1、计算机或软件相关专业，本科及以上学历，具备扎实的计算机和软件技术基础；2、三年以上软件测试开发经验，掌握主流的测试与管理工具如loadrunner,jmeter,appscan等，熟悉掌握和运用C/C++/Python/go/javascript/java 等任何一门主流编程语言；3、具备软件测试经验和项目管理经验，具备搭建测试环境，开发测试框架的能力；；4、具有发现问题的灵敏嗅觉，具备针对复杂问题的分析和解决的能力；5、有语音行业完整项目经验的优先","移动互联网,广告营销",50-150人,go,广东
python开发,https://www.lagou.com/jobs/6864549.html,南山区,16k-32k,深信服科技股份有限公司,不限,不限,大平台/**安全团队/公司多达38项福利,岗位职责1.负责安全检测引擎的研发工作；2.优化检测引擎的性能，提高稳定性，优化产品体验；3.负责网络安全相关产品功能的设计和开发工作。岗位要求1.本科及以上学历，1年以上Python开发经验；2.熟悉Python语言，掌握函数式和面向对象编程，能够编写模块化、可重用、易维护的代码；3.熟悉Linux开发环境，掌握基本Shell命令，熟悉Go开发优先；4.有大数据分析和开发经验优先。,"信息安全,企业服务",2000人以上,go,广东
安全开发工程师,https://www.lagou.com/jobs/6817391.html,南山区,16k-32k,深信服科技股份有限公司,1-3年,本科,大平台/**安全团队/公司多达38项福利,工作职责：1、负责云端恶意文件检测、分析以及运营平台功能开发2、能分析高级恶意代码攻击和逃逸行为；岗位要求：1、熟练掌握C/C++和一门脚本语言如：python、ruby、go等；2、熟悉Windows或者Linux平台软件开发；2、熟悉常见的**木马的危害和技术手段，以及**和杀软的相互对抗；3、了解基本的漏洞的攻击原理，漏洞缓解机制；4、具备快速学习能力、有创造性并自我激励加分项：1、有过沙箱（sandbox）开发经验者优先考虑2、有过内核驱动开发和大型安全软件开发经验者优先考虑3、有分析过rootkit，bootkit，APT攻击样本的有优先。4、有云端多引擎杀毒开发经验优先,"信息安全,企业服务",2000人以上,go,广东
测试实习生（2021届）,https://www.lagou.com/jobs/6921715.html,番禺区,2k-4k,广州市百果园网络科技有限公司,应届毕业生,本科,免费三餐，下午茶夜宵，大牛指导，弹性工作,"岗位职责：1、参与Bigo各业务线的产品质量保障工作，针对产品业务逻辑和技术架构，制定并执行产品的测试计划和测试策略。2、参与产品的设计和技术实现评审，参与技术架构优化和改造升级建设，进行风险评估，挖掘新的测试方法，解决可测性问题及保障系统稳定性。3、参与开发符合产品特点的测试工具、平台，优化产品研发测试过程，提升测试效率。任职要求：1、计算机相关专业，本科及以上学历，21届或22届毕业生，每周至少可出勤三天。2、良好的代码基础，至少熟练掌握 C,C++/Java/Go/Python 等常用编程语言中的一种。3、思维活跃，有较强的逻辑思维能力，有较强的技术热情和学习欲望，责任心强，积极主动，有一定的沟通和团队合作能力。4、了解常用客户端、服务端开发或测试工具， 如自动化框架、压测工具、安卓或者IOS开源测试工具者优先。","移动互联网,社交",2000人以上,go,广东
网络安全工程师,https://www.lagou.com/jobs/7027166.html,番禺区,30k-60k,广州市百果园网络科技有限公司,3-5年,本科,弹性出勤、公司食堂、大牛指导,工作内容：1. 负责Bigo安全建设；2. 负责日常渗透测试(web/app/二进制)、红蓝对抗等安全工作；3. 跟进新的渗透技术研究。 任职资格：1.统招本科，计算机相关专业毕业，至少3年以上相关工作经验，熟悉常见的外网渗透测试的漏洞原理及利用方法(不局限于web)；2.熟悉常见的内网攻击思路和方法，掌握常用的内网工具（MSF等）；3.熟悉安全攻防技术，对流量监控、WAF、杀毒软件绕过有一定研究；4.熟悉python/go/php等至少一种脚本语言，能编写渗透辅助脚本或工具。加分项：1.参与过一些红蓝对抗攻防项目；2.熟悉CTF/pwn等攻防比赛，在此类比赛中拿过较好的成绩。,"移动互联网,社交",2000人以上,go,广东
Hyperledger区块链工程师,https://www.lagou.com/jobs/7205996.html,南山区,14k-25k,深圳市恋上互联网技术有限公司,3-5年,本科,发展前景广阔,"岗位职责：1、参与区块链系统的架构设计；2、参与区块链的协议、运行机制、底层源码研究和改进；3、负责区块链系统功能开发；任职要求：1、熟悉golang开发，掌握常用的go web框架，2年以上实际项目经验；2、熟悉Ethereum，HyperLedger、EOS等主流区块链技术相关机制原理；3、有 Ethereum（以太坊），Hyperledger（超级账本） 等区块链开发经验，尤其是掌握Fabric区块链框架；4、熟悉密码学基本知识，加密算法、共识算法、网络安全、分布式计算；5. 熟练常用数据库(Mysql,mongoDB,Redis)的使用，了解fabric的数据库CouchDB、LevelDB；6、熟悉Hyperledger Fabric相关开源项目，具有区块链溯源项目开发经验者优先；7、熟练掌握Linux操作系统，熟悉docker容器化技术及相关知识；8、具备大型复杂系统的设计与架构能力，有根据应用场景设计实现经验者优先；",区块链,50-150人,go,广东
高级赛事运营,https://www.lagou.com/jobs/7184367.html,番禺区,14k-28k,广州虎牙科技有限公司,3-5年,本科,上市公司、年底双薪、绩效奖金、年度旅游,岗位描述：1、负责DOTA2、CS:GO等电竞赛事策划、组织和运营，对各项赛事KPI负责；2、内部对接其他团队的工作配合，如保障直播平台的播出量化指标，参与公司级项目电竞侧内容的支持工作；3、外部对接赛事执行供应商，根据赛事进度及质量的要求，推进供应商完成各项赛事的具体落地，保障赛事线下落地质量，和线上数据效果触达；4、整理和总结赛事过程中遇到的问题，系统性优化赛事流程和规则，对竞品平台、赛事做出总结性分析。任职要求：1.本科以上学历，3年以上电竞/直播行业工作经验，有过大型活动/节目策划经验，有游戏厂商或赛事资源优先；2.深度直播用户，热爱DOTA2、CS:GO，骨灰级、高段位玩家优先；3.综合能力强，良好的沟通和跨部门协作、推动能力，主动性高，具备高抗压能力；4.有项目管理经验，有项目预算、项目计划的能力。,"社交,游戏",500-2000人,go,广东
PHP后端开发工程师,https://www.lagou.com/jobs/7015137.html,龙岗区,10k-20k,深圳市财盈通科技有限公司,1-3年,大专,"领导Nice,发展前景好，奖金多",PHP后端开发工程师职位描述：1.主要负责公司内部产品后端开发工作；2.PHP 后端开发工程师；3.团队有成熟规范和导师指导，充足的学习机会。职位要求：1.2年以上php实际开发经验，熟练掌握各种php开发工具；熟悉go语言优先.2.熟悉Linux环境下的nginx+php+mysql的配置及管理；3.熟练laravel，熟悉vue等框架;4.具备ERP网站的成功开发经验，有前端框架接口的开发经验；5.性格开朗，良好的表达沟通能力，思路清晰，较强的责任心、团队精神；公司福利：六险一金，底薪+项目奖金（月度奖金、季度奖金、年终奖金，不遗余力的奖金福利）,"移动互联网,电商",500-2000人,go,广东
Golang开发工程师,https://www.lagou.com/jobs/4622597.html,福田区,15k-30k,优倍快网络技术咨询(上海)有限公司,1-3年,不限,"上市公司,创业氛围,软硬件","岗位职责：
 参与 UniFi / FrontRow 相关产品的服务端架构设计与实现
岗位要求：1. 二年以上 Go / C / C++  服务端开发经验2. 有良好的编程风格和编写文档的习惯3. 有较强的责任心和学习能力，能承受一定工作压力4.熟练掌握Golang相关技术，熟悉Golang协程，熟悉channel和锁，对高并发、高可用架构系统有正确、深刻的理解，有分布式服务设计或开发经验者优先5. 熟悉MySQL，熟悉数据库原理和常用性能优化技术，同时熟悉其他数据库（如Redis、MongoDB等）者优先；6. 熟悉 HTTP、TCP/IP 等常见网络协议，有相关网络编程经验者优先；7. 有大型复杂系统设计开发经验者优先加分项 :1. 熟悉大数据开源生态2. 熟悉物联网相关软硬件产品","移动互联网,硬件",500-2000人,go,广东
服务端工程师,https://www.lagou.com/jobs/4498906.html,福田区,10k-20k,优倍快网络技术咨询(上海)有限公司,1-3年,本科,"创业氛围,上市公司,智能硬件","【岗位职责】快速高质量地完成功能的开发;协助定位并修复线上问题。【任职要求】至少一年服务端开发经验;精通和熟悉主流语言的至少一⻔: Go/Java/Node等;熟悉Linux工作环境,熟悉至少一种数据库编程;熟悉TCP、HTTP协议;有英文文档阅读能力;熟悉Go语言优先;参与过开源项目的优先;","移动互联网,硬件",500-2000人,go,广东
基础运维工程师,https://www.lagou.com/jobs/7180914.html,宝安区,10k-15k,深圳万顺叫车云信息技术有限公司,3-5年,大专,自研公司前景好五险一金下午茶福利,"1.负责各云的账号管理，权限管理，费用管理。2.负责云上资产管理，及时确定并释放，节省公司成本。3.负责运维服务账号的开通，授权管理。4.服务器日常巡检工作。5.网络运维管理。6.负责完善优化现有的监控系统、监控指标，告警策略的设计和优化。7.实时关注各个监控指标状态，发现告警及时响应和处理。8.负责基础服务的搭建、运维和故障处理。任职要求：1. 计算机及相关专业专科及以上学历，3年以上运维相关工作经验。2. 掌握linux的原理，熟练linux常用的命令。3. 具有 故障快速分析和处理能力，能然练使用strace.netstat、dig、tcpdump 等常用故障排查命令。4. 熟练使用shell, python, go一种或多种编程语言。5. 熟悉 主流的监控工具: zabbi x, gangl ia, prometheus监控工具。6. 熟练使用jenkins, ansible, saltstack自动化工具等。7. 熟悉nginx, redis， mysql， mongodb等的自动化部署和维护。8. 能够适应7*24小时值班。9. 具有良好的主动性， 运维流程意识、快速学习能力逻辑思维能力，沟通能力以及解决问题的能力。","消费生活,移动互联网",150-500人,go,广东
大数据开发工程师,https://www.lagou.com/jobs/7177936.html,天河区,15k-20k,佛山市博纳德信息科技有限公司,3-5年,本科,五险一金 发展空间大 餐补,岗位职责：1、负责数据的提取、BI设计和展示，以及数据运营分析平台的需求分析、设计和基础数据开发；2、负责个性化内容推荐系统构建及优化，效果改进，持续提升产品体验；3、负责海量数据的分析、开发、设计等工作；任职要求：1、精通Linux操作系统，熟练使用Java、Scala、python、Go中任意一种或者多种高级语言；2、2年以上大数据实时查询、离线分析、数据存储开发经验，包括HDFS、HBase、Spark等；3、2年以上大数据PB级海量数据分析、开发，包括 HDFS、HBase、Hive、Spark Sql等；4、2年以上的流式计算集群开发、优化、运维经验，包括Storm、Spark Streaming、Flink、Kafka等；5、具有一定分布式系统设计/开发经验者优先；6、参与过开源项目，为开源社区贡献过代码的优先;7、本科及以上学历，不少于3年的工作经验,移动互联网,150-500人,go,广东
