job_name,job_url,job_location,job_salary,job_company,job_experience,job_class,job_given,job_detail,company_type,company_person,search_key,city
中高级工程师（应用系统维护）,https://www.lagou.com/jobs/6627307.html,洪山区,9k-11k,北京先进数通信息技术股份公司成都分公司,3-5年,本科,五险一金 婚育福利 带薪年假 定期体检,"岗位责任：1. 协助客户完成在应用系统日常运维工作；2. 协助客户制定应用系统维护计划，及计划内停机维护、计划内演练；3. 完成日常应用系统运维监控、定期的健康检查；4. 完成日常应用系统所需的备份与数据清理；5. 协助客户完成应用系统所需的容量分析与优化；6. 完成应用系统运行报告、事件处理及问题分析报告；7. 配合客户及完成应用系统所需的变更与上线技术支持；8. 配合客户完成所需的合规性检查等相关工作。任职要求：工作经验方面：1. 掌握应用自动化规范，具备利用自动化工具完成应用启停、应用变更等常规操作的能力。2. 熟悉业务发展和系统运行特点，能够设计应用系统的容量计算模型，具备设计、选择可靠、合理、上下游匹配的运行相关技术参数和容量的能力。3. 具有熟练的开发技能，掌握VUE, React, spring cloud、K8s、Docker, MySQL, Redis、python, shell，php，java等相关开发技术中的2种或以上优先考虑；4. 掌握中间件概念设计、逻辑设计、物理设计原理及方法5. 掌握应用系统运行风险管理的基本知识，能进行应用运行风险识别和管控。6. 掌握性能容量分析及优化技能，指导性能容量分析及优化。7. 掌握应急流程、应急技能，能够在处置中提供处理意见。8. 掌握信息安全理论和各级安全管理制度，能够根据基本知识和制度要求分析系统运行中的信息安全风险。9. 熟悉信息系统高可用性规划及相关技术。10. 熟悉系统上线的准入标准。教育背景：理工类专业,本科及以上学历。培训经历：受过相关专业知识的培训者优先。技能：1. 具有银行或金融同业实施经验者优先；2. 具有公有云实施运维经验者优先；3. 能独立编写技术文档及方案，能快速、准确的定位故障并能及时的进行处理；4. 具备通用软件使用的技能、知识和工作经验。5. 具备创新和学习精神，适应在变化的环境中发展。6. 具备责任心、合作精神和人际交流能力。7. 能够胜任加班、出差等工作。","软件开发,其他",500-2000人,php,武汉
前端开发工程师,https://www.lagou.com/jobs/4839162.html,洪山区,7k-14k,武汉新烽光电股份有限公司,3-5年,大专,"上市公司,五险一金,节日福利,股权激励",岗位职责：1、根据项目进度安排配合后台开发人员完成Web项目开发，实现产品界面和功能；2、Web前端表现层及与前后端交互的架构设计和开发；3、利用Web技术实现产品原型；4、优化网站界面UI、代码优化；5、负责前端团队整体实力的提升和新技术的探索。任职资格：1、2年以上工作经历，计算机、软件及相关专业本科及以上的学历；2、熟悉Android/ios等移动平台，熟悉移动平台下的HTML5开发应用以及App发布；3、熟悉当前主流浏览器的兼容性开发，有过丰富的 Echarts 高德地图 canvas 微信小程序以及微信公众号开发经验；4、至少熟练使用一种当前流行框架  Vue\Angular\React (Vue优先)，熟练使用react框架，并使用他开发过实际项目；5、对前端工程化与模块化开发有一定了解，并有实践经验（如Webpack/RequireJS/SeaJS等）；熟悉一种或多种后端语言（JAVA/PHP/C++等）优先；6、具备良好的沟通能力，良好的代码编程习惯及较强的文档编写能力。,"移动互联网,硬件",50-150人,php,武汉
前端开发实习生,https://www.lagou.com/jobs/7003191.html,东湖新技术开发区,3k-6k,第四范式（北京）技术有限公司,不限,本科,大平台 大数据,前端实习生JD【职位描述】 工作职责:1.按产品需求，进行Web 前端的功能设计与研发工作；2.与后端工程师协作，高效完成产品的数据交互、动态信息展现；3.优化前端体验，提升 Web界面的友好和易用； 【任职资格】1.熟练HTML/CSS/JS等Web前端技术，对符合WEB标准的网站开发有相关经验；2.对Nodejs、Angularjs、React、Vuejs、D3.js、echarts、jQuary至少一个实际项目使用经验(Nodejs，Angularjs 最佳)；3.熟悉前端模版引擎，至少一种熟练使用；4.有较强的逻辑思维能力，善于分析、归纳、解决问题；5.了解后台相关知识者优先（Java、Python、PHP、Mysql等）。 6.一周实习4天以上，实习期不少于3个月,企业服务,500-2000人,php,武汉
技术总监,https://www.lagou.com/jobs/7045856.html,武昌区,20k-40k,北京功夫仁医网络科技有限责任公司,5-10年,本科,五险一金 各类补助 期权,"职位描述：1.全面负责公司技术平台的技术架构和实施；2.确认和评估系统需求，给出开发规范，搭建系统实现的核心构架，并澄清技术细节、扫清主要难点，进行实施指导；参与核心代码的书写，组织解决项目开发过程中的重大技术问题；3.负责技术框架选型、核心架构搭建、核心模块开发、性能优化等工作；能够支持百万级以上的日活。4.确定和文档化项目系统的需求、设计、实施和部署等“视图”；5.负责研发团队日常技术指导、培训交流，提升团队整体技术水平，解决研发人员遇到的技术问题；任职要求：1.统招本科及以上学历，计算机科学、软件工程相关专业毕业.2.精通Java、c/c++、PHP、golang、android/IOS(至少三种）编程语言；；3.5年以上互联网项目研发经验，管理过至少10人技术团队，经历过大型项目的完整开发过程；4.具备扎实的IT相关知识，精通数据结构、算法、系统构架、Windows/Linux系统、多线程、网络、数据库等技术，具有撰写规范技术文档和手册能力；5.具有全线能力，前段后端，算法各方面技术能力，杰出的学习能力和问题分解能力；6.具有2年以上大数据开发、数据分析或人工智能相关工作经验，具备hadoop或spark或redis集群下的分布式开发经验。7.具备互联网产品思维，熟悉敏捷项目管理方法。收趣收趣准备导入总共导入个书签
  
 注意：
  
 1.导入时请不要关闭页面，如果您的要导入的书签较多，请耐心等待
  
 2.一旦看到导入完成，您的书签就已保存在收趣，但仍需要一段时间解析后才能在App中看到。
  
开始完成取消继续导入取消导入导入到收趣职位描述：1.全面负责公司技术平台的技术架构和实施；2.确认和评估系统需求，给出开发规范，搭建系统实现的核心构架，并澄清技术细节、扫清主要难点，进行实施指导；参与核心代码的书写，组织解决项目开发过程中的重大技术问题；3.负责技术框架选型、核心架构搭建、核心模块开发、性能优化等工作；能够支持百万级以上的日活。4.确定和文档化项目系统的需求、设计、实施和部署等“视图”；5.负责研发团队日常技术指导、培训交流，提升团队整体技术水平，解决研发人员遇到的技术问题；任职要求：1.统招本科及以上学历，计算机科学、软件工程相关专业毕业.2.精通Java、c/c++、PHP、golang、android/IOS(至少三种）编程语言；；3.5年以上互联网项目研发经验，管理过至少10人技术团队，经历过大型项目的完整开发过程；4.具备扎实的IT相关知识，精通数据结构、算法、系统构架、Windows/Linux系统、多线程、网络、数据库等技术，具有撰写规范技术文档和手册能力；5.具有全线能力，前段后端，算法各方面技术能力，杰出的学习能力和问题分解能力；6.具有2年以上大数据开发、数据分析或人工智能相关工作经验，具备hadoop或spark或redis集群下的分布式开发经验。7.具备互联网产品思维，熟悉敏捷项目管理方法。","移动互联网,医疗丨健康",150-500人,php,武汉
前端开发工程师,https://www.lagou.com/jobs/6165391.html,东湖新技术开发区,12k-24k,多点生活（中国）网络科技有限公司,3-5年,本科,扁平化、期权、领导好、技术氛围强,岗位职责：1、负责公司内部移动办公平台的前端开发工作，基于企业微信、钉钉、飞书等办公平台的小程序开发2、负责公司内部办公系统的开发，包括但不限于：HR系统、OA系统等职位要求:1、大学本科及以上学历，2年以上前端实际开发经验；2、熟练掌握 HTML、CSS、JavaScript 等前端基础技术。3、熟练掌握至少一种 HTML 模板语言如Velocity、Jade、Freemaker等4、熟练掌握 CSS  技术及CSS处理框架5、熟练掌握至少一种 Web 应用的前端开发框架，如 ReactJS、VueJS等6、熟练使用 Git等项目代码管理工具7、熟悉微信小程序、钉钉小程序等小程序的开发语言8、有中、大型的 Web 应用系统设计与开发经验9、有良好的编码习惯，对开发高品质的 web 产品充满热情优先条件：1、有前端工程化、持续集成的项目经验2、掌握至少一种后端开发语言如 Python / PHP / NodeJS等3、良好的英语读写能力,"电商,消费生活",500-2000人,php,武汉
技术总监,https://www.lagou.com/jobs/6994262.html,武昌区,20k-40k,武汉熊心智能科技有限责任公司,5-10年,本科,五险一金 各类补助,1.全面负责公司技术平台的技术架构和实施；2.确认和评估系统需求，给出开发规范，搭建系统实现的核心构架，并澄清技术细节、扫清主要难点，进行实施指导；参与核心代码的书写，组织解决项目开发过程中的重大技术问题；3.负责技术框架选型、核心架构搭建、核心模块开发、性能优化等工作；能够支持百万级以上的日活。4.确定和文档化项目系统的需求、设计、实施和部署等“视图”；5.负责研发团队日常技术指导、培训交流，提升团队整体技术水平，解决研发人员遇到的技术问题。任职要求：1.统招本科及以上学历，计算机科学、软件工程相关专业毕业.2.精通Java、c/c++、PHP、golang、android/IOS(至少三种）编程语言；3.5年以上互联网项目研发经验，管理过至少10人技术团队，经历过大型项目的完整开发过程；4.具备扎实的IT相关知识，精通数据结构、算法、系统构架、Windows/Linux系统、多线程、网络、数据库等技术，具有撰写规范技术文档和手册能力；5.具有全线能力，前段后端，算法各方面技术能力，杰出的学习能力和问题分解能力；6.具有2年以上大数据开发、数据分析或人工智能相关工作经验，具备hadoop或spark或redis集群下的分布式开发经验。7.具备互联网产品思维，熟悉敏捷项目管理方法。,"医疗丨健康,人工智能",15-50人,php,武汉
前端开发工程师,https://www.lagou.com/jobs/5513939.html,东西湖区,8k-13k,湖北航天信息技术有限公司,5-10年,本科,发展前景好，涨薪几率大,职位描述：1、负责公司软件产品的页面功能的开发和优化，完成模块设计文档。2、利用各种Web技术模拟开发产品原型。3、参与需求分析、设计与开发。 4、配合后台开发人员实现产品界面和功能与后台的交互。5、制作标准优化的代码，并增加交互动态功能。任职要求：1、全日制统招本科或以上学历，计算机软件或相关专业，具有五年以上工作经验。2、精通HTML、JavaScript、Ajax、CSS等Web开发技术，对Nodejs技术有一定了解。3、对前端工程化与模块化开发有一定了解，并有实践经验（如Webpack/RequireJS/SeaJS等）。4、对Web前台的性能优化以及Web常见漏洞有一定的理解和相关实践，解决多浏览器兼容性问题有一定的经验。5、能熟练使用主流的JavaScript框架（ReactJS、AnguarjsJS、Vue等），并精通其中的一种以上优先。6、熟悉一种或多种后端语言（JAVA/PHP/C++等）优先，有前端自动化测试、单元测试方面经验者优先。7、良好的理解和沟通能力，较强的团队协作精神，逻辑思维强，善于交流和表达，并具备优秀的学习能力。8、具备高度的责任感和敬业精神，能承受工作压力者优先。,"金融,企业服务",500-2000人,php,武汉
前端开发工程师,https://www.lagou.com/jobs/6157906.html,江夏区,15k-25k,神州数码（中国）有限公司,3-5年,本科,六险一金、员工体检、餐补、通讯补贴等,岗位职责：1. 负责系统web前端的设计和开发，创建用户友好、符合标准、跨平台及跨浏览器的Web页面；2. 参与产品的需求分析，并制定技术方案和接口设计；3. 与后端配合完成新功能的开发、测试和上线；职位要求：1. 本科及以上学历，3年以上Web前端开发经验。2. 精通前端开发的基础技术（HTML、CSS、HTML5、CSS3等），熟悉页面架构和布局，熟练处理各种浏览器兼容问题。3. 精通原生JS、JQuery，对JavaScript的底层原理有深刻的理解，熟练Angular、React、Vue、Bootstrap中一种或多种。4. 熟悉常用前端构建工具：Webpack、Gulp等。5. 对用户体验、交互操作流程、用户需求有深入理解。6. 具有良好的沟通能力、学习能力、团队协作能力，base在武汉，长期出差北京。优先考虑：1、有UI交互设计经验的优先；2、掌握Web后端语言（如Java、Python、PHP等）并有项目经验者优先。,"硬件,数据服务",2000人以上,php,武汉
Android/iOS开发工程师,https://www.lagou.com/jobs/6026584.html,洪山区,15k-25k,思特沃克软件技术（成都）有限公司,3-5年,本科,五险一金，弹性工作，扁平管理,"该职位同时接受iOS和安卓的简历投递。Android：职责描述：1、负责android平台客户端程序的开发2、负责搭建系统开发环境，完成系统框架和核心代码；3、参与功能的架构设计与主导开发，功能模块化。4、根据开发过程中的体验对产品提出改进建议5、针对客户需要，提供移动解决方案任职要求：1、熟悉移动行业趋势和技术趋势，对企业移动需求有深入了解2、精通Android移动开发3、2年以上移动开发经验，有丰富的实施移动开发项目的经验4、有比较好的商业意识，能根据业务需求为客户制定相应的移动解决方案，并能提炼、总结可复用的解决方案iOS：职责描述：1、根据公司业务发展需求，负责公司IOS移动应用的框架设计和应用开发；2、IOS开发完成客户端界面及应用程序设计、开发、发布；3、负责IOS客户端开发流程的控制及优化，项目进度的管理及把控；4、参与公司产品架构设计、方案的制定；5、负责IOS平台框架层面的开发维护以及扩展；6、跟进IOS的新技术发展，编写设计开发及实现文挡；7、根据产品功能需求设计并完成软件实现。任职要求：1、基础扎实，熟悉常用数据结构与算法，精通C/C++、Objective C、Mac OS X、Xcode；2、3年以上的手机客户端开发经验；3、熟悉移动行业趋势和技术趋势，对企业移动需求有深入了解；4、有比较好的商业意识，能根据业务需求为客户制定相应的移动解决方案，并能提炼、总结可复用的解决方案。-----------------------分割线-------------------------------------------【ThoughtWorks是什么 】ThoughWorks是一家全球信息技术服务公司，在美国、英国、澳大利亚、加拿大、德国、印度、巴西、南非、中国、乌干达等十个国家，他成为超过 3000技术牛人的技术乐园，这其中，有300位在中国，他们通过全球资源共享和人才交流，服务全球各行业的**客户。目前，我们的客户遍及国内外金融、运输、出版、传媒、航运、能源、制造、互联网、教育等行业。中国本土客户包含渣打银行、BCG、JP摩根、美国Delta航空、澳大利亚Telstra电信、Suncorp金融集团、平安集团、中国电信、顺丰速运以及万华房产等多家国内外知名企业【我们是一群什么样的人】典型的ThoughtWorker 都有这样的特征：→ 聪明，学习能力非常强。→ 热爱技术，是真正的热爱，他们愿意为此付出个人的时间。→ 喜欢讨论，他们甚至经常为了一个语言的一点点小的特性而争执不下。→ 喜欢分享，在中国最活跃的技术社区都能看到他们的影子，公司内的技术学习会和分享会就更多了，这些都是自发的，他们认为这是他们生命中的一部分，而不是公司委派的。→ 也许还有点点愤青，但你关心我们生存的社会环境。【我们正在找什么样的人】态度：• 热爱技术• 不断学习• 团队大于个人，重视团队合作，而非个人“英雄主义”• 同样关注业务，重视对客户和团队的承诺能力：• 学习能力强• **的技术要求就是，我们希望你不是只做底层驱动软件开发的就可以。Java, C#, Ruby, Python，PHP，Flex都可以品格：• 坦诚、正直、谦虚、开放、热爱分享。【那么你需要付出什么】→ 你需要付出业余时间去学习，实践技术。这个没有捷径。我们会提供各种资源，它们就在你身边，但是我们不能替你学习。→ 你需要适应出差。我们的客户在海外和国内都有，必要的出差是咨询公司的特点，大概每年3个月，最多有可能6个月的出差。当然不是连续6个月，一般一次出去1个月-2个月是比较长的了，会分几次出去，当然也有更短的，比如2-3周，出差超过1个月，我们会有每两周飞回家探亲的机票补贴的。→ 你需要更主动。我们更倾向候选人会有很好的责任心，主动承担工作，而不是做个听话的“机器人”，被动分配任务。→ 你不会成为一个拥有权利的""指挥者""。我们是一个扁平的组织，没有人有权利指挥别人，或是“一个人做决定”，甚至掌握他人的面试或者performance review的结果。我们培养leadership, 但不是用权力去管理，而是通过你的专业，你的经验，你的能力，你的人品去建设你自己的影响力和领导力，给他人提供帮助，指导和解惑。",企业服务,2000人以上,php,武汉
高级前端开发工程师 (MJ000017),https://www.lagou.com/jobs/6977088.html,洪山区,9k-14k,武汉掌游科技有限公司,3-5年,本科,福利多多，五险一金，晋升空间大,岗位职责：1.参与设计和开发适用于企业级产品的高效可复用的 UI 组件。2.负责将创意变成现实，并确保具有顺畅的用户体验。职位要求：1、大学本科，计算机相关专业，2年以上前端开发工作经验。2、熟练掌握 HTML、CSS、JavaScript 等前端基础技术。3、熟练掌握 LESS、SASS、Stylus 等 CSS 预处理器技术，或 PostCSS 等 CSS处理框架。4、熟练掌握至少一种 Web 应用的前端开发框架，如 ReactJS、VueJS等。5、熟练使用 Git、SVN 等项目代码管理工具。6、中、大型的 Web 应用系统设计与开发经验。7、有良好的编码习惯，对开发高品质的 web 产品充满热情。优先条件：有基于 SVG/Canvas/WebVR 等技术的数据可视化、产品图形化开发经验。有前端工程化、持续集成的项目经验。熟悉云计算各类服务和产品，或熟悉企业级产品的要求和架构方式。掌握至少一种后端开发语言如 Python / PHP / NodeJS等。熟练使用 Shell。良好的英语读写能力。,"移动互联网,游戏",150-500人,php,武汉
技术总监,https://www.lagou.com/jobs/5767748.html,洪山区,20k-35k,武汉飞猫环球商贸有限公司,5-10年,本科,技术总监 开发经理 项目经理,岗位职责：1、主导项目的技术路线制订和技术架构设计，并进行实施指导。2、确认和评估系统需求，给出开发规范，搭建系统实现的核心构架，并澄清技术细节、扫清主要难点；同时负责设计系统整体架构，把握整个项目大局。3、负责技术框架选型、核心架构搭建、核心模块开发、性能优化等工作；能够支持百万级以上的日活。4、统筹负责整个项目团队工作，产品设计、后台开发、测试、优化等工作任职要求：1、本科以上学历，计算机及相关专业；2、精通Java、c/c++、PHP、golang、android/IOS(至少三种）编程语言；；3、5-8年一线互联网公司研发管理经验，具有丰富的构架设计能力，丰富的研发梯队培养与团队管理能力，经历过大型项目的完整开发过程；；4、具备扎实的IT相关知识，精通数据结构、算法、系统构架、Windows/Linux系统、多线程、网络、数据库等技术，具有撰写规范技术文档和手册能力；5、具有全线能力，前段后端，算法各方面技术能力，杰出的学习能力和问题分解能力；6、具备较好的英语听、说、读、写能力；福利待遇：1、实行八小时工作制。工作时间周一到周六，每周天固定休息。2、员工享有带薪年假，年终奖；3、享受良好晋升空间；4、享受良好优质的办公环境和公司氛围；5、定期培训、良好的晋升机制；6、不定期举行团建活动。温馨而又富有激情的团队与公司氛围。,"电商,其他",150-500人,php,武汉
