job_name,job_url,job_location,job_salary,job_company,job_experience,job_class,job_given,job_detail,company_type,company_person,search_key,city
数据分析,https://www.lagou.com/jobs/6923383.html,芙蓉区,5k-7k,南京汇龙科技有限公司,1-3年,本科,五险一金年终奖励周末双休员工食堂,数据岗位要求：（工作地点：长沙 ）工作要求1、电信移动用户维系相关数据统计及分析。2、完成移动用户的各类预警模型搭配。3、根据各维度的数据分析，提供用户维系营销建议。技能要求1、全日制大学本科及以上学历，有2年以上电信业务数据分析和业务分析工作经验优先。2、能熟练使用SQL分析数据，熟练使用数理统计、数据分析、数据挖掘工具软件（SAS、R、Python、tableau等的一种或多种）3、了解数据仓库理论，熟悉数据统计和数据挖掘专业知识4、参与过数据挖掘项目，使用过逻辑回归、神经网络、决策树、聚类等的一种或多种建模方法，对数据埋点、处理、建模和应用有一定了解者优先5、学习能力强，擅长沟通、责任心强，有团队合作精神。善于表述，抗压能力强。,移动互联网,150-500人,数据仓库,长沙
大数据开发,https://www.lagou.com/jobs/7016630.html,岳麓区,12k-22k,中兴通讯股份有限公司,3-5年,本科,福利好，领导nice,岗位职责要求1.负责技术难点的攻关及大数据平台新技术的调研及选型。2.负责公司大数据应用产品设计、开发、部署、运营(数据架构、模型设计、数据处理、部署运维）3.熟悉目前主流大数据处理框架下的海量数据集成、分析处理、统计挖掘工作4.精通数据仓库及数据建模理论，有大数据项目实践经验，至少精通一门语言5.熟悉hadoop生态圈组件，熟悉CDH，hdfs、MR、flume、kafka、spark、hbase、ES、Kylin、flink、BI工具6.全日制本科及以上学历，本科4年及以上，硕士2年及以上，数学、计算机、电子、通信等相关专业,"数据服务,信息安全",2000人以上,数据仓库,长沙
java架构师,https://www.lagou.com/jobs/6928933.html,岳麓区,12k-20k,中兴通讯股份有限公司,5-10年,本科,在长沙工作，一线省会城市，但房价低,岗位：java架构师岗位要求1.计算机或相关专业本科及以上学历，4年或以上JAVA实际开发经验。2.Java 基础知识扎实，熟悉常用算法，数据结构，设计模式等。3.熟练使用JAVA主流开发框架，SSM(Spring+SpringMVC+MyBatis)，Spring Boot，Spring Cloud等4.熟练使用消息中间件及缓存技术（Redis，Kafka，Rabbitmq，mysql等)。5.热爱技术，善于思考，积极主动，责任心强，沟通能力强，有良好的团队精神，能够承担压力。符合以下条件者，优先考虑：1.担任过Java 技术Leader、开发组长、架构等角色。2.微服务改造、开发经验，有大容量高并发系统的设计，大数据数仓建设，实时计算方面的经验。3.熟悉敏捷软件开发流程，Devops相关技术。4.开源代码，发表相关技术文章等。岗位：大数据运维开发岗位职责：参与大型企业数据中台建设：1、大数据集群运维、优化；2、大数据安全中心建设；3、离线实时数据采集分发平台建设；4、分析解决大数据用户问题岗位要求：1、熟悉Hadoop和Spark生态圈组件基本原理，有大数据集群搭建、运维、优化相关经验；2、掌握Java技术栈3、熟悉Linux系统，了解shell或python岗位：大数据开发工程师 岗位需求： 1、全日制本科及以上学历，计算机相关专业，扎实的Java语言基础和Linux编程基础； 2、3年大数据相关系统研发经验，有java后台开发经验和Flink开发经验者优先； 3、对大数据相关组件：Hadoop、Spark、Hbase、Hive、Kafka、Flume、Kylin、ElasticSearch等架构与底层实现有深入理解，； 4、具备构建稳定的大数据基础平台的能力，具备数据收集、数据清洗、数据仓库建设、实时流计算等系统研发经验； 5、工作有计划性，责任心和执行能力强，具备高度的责任心、诚信的工作作风、优秀沟通能力及团队精神。6、 对技术有热情，有不错的数据思维和敏感度，有一定的数据分析能力优先； 7、具备强烈的工作责任感，喜欢钻研，态度乐观，团队意识强。,"数据服务,信息安全",2000人以上,数据仓库,长沙
高级ETL开发工程师(J11552),https://www.lagou.com/jobs/7167717.html,岳麓区,13k-26k,秒针信息技术有限公司,5-10年,本科,"大牛多,学习型组织",（该职位涉及长期出差）参与数据中台的汇聚和采集ETL详细设计和开发工作；参与专题库/主题库的模型设计，并负责模型开发；参与数据标准化和数据治理模型的设计，并负责落地开发；负责数据分析需求的模型开发和实现；负责数据中台技术的优化和质量改进；任职资格:1.精通SQL语言，具备存储过程开发能力，能熟练进行SQL查询优化；熟悉Hive数据仓库设计，了解数据仓库模型及思想、维度建模思想，了解数据仓库相关应用；2.熟悉Hadoop、Spark、Sqoop、Hive、Flume、Kafka、HBase等技术，使用过ETL相关技术进行数据交换工作；3.了解数据调度平台的设计思想，良好的数据批处理 、调度、异常处理等经验，熟悉shell、python、java等语言；4.具有良好的逻辑分析能力、需求理解能力和解决问题的能力；具有一定的文档编写能力；5.具有良好服务意识，工作态度端正，耐心、细致、热情，抗压力强，对工作专注、投入，有很好的职业素养 。6.具有3年及以上数据仓库相关项目工作经验，有电子政务行业项目经验优先；7.可接受出差，有独立工作能力。,"数据服务,广告营销",2000人以上,数据仓库,长沙
高级数据资产管理(J11496),https://www.lagou.com/jobs/7081139.html,天心区,25k-30k,秒针信息技术有限公司,5-10年,本科,"大牛多,学习型组织",,"数据服务,广告营销",2000人以上,数据仓库,长沙
