job_name,job_url,job_location,job_salary,job_company,job_experience,job_class,job_given,job_detail,company_type,company_person,search_key,city
数据分析工程师,https://www.lagou.com/jobs/7019581.html,雨花区,10k-20k,长沙牛感科技集团有限公司,应届毕业生,硕士,"五险一金,双休+法定",岗位职责：1、负责企业大数据平台数据模型设计已经数据仓库的建立，根据数据仓库及BI项目的需求，制定ETL相关的设计方案和开发计划，并进行后续的设计、实施、维护；2、负责整个数据仓库数据模型的管理工作（建模，设计，实施）；3、负责沟通需求，将需求转化为模型及mapping；4、负责数据源调研、入库、开发的全流程工作，并保证数据质量；5、负责数据仓库的模型的标准制定，实施，监督工作；6、承担数据抽取、清洗、转化等数据处理程序开发。7、日常数据异常排查及分析。 任职要求：1、三年以上BI工作经验，至少一年以上数据建模工作， 能够熟练运用erwin、PowerDesigner等至少一种建模工具； 2、精通java、Python语言，两年以上开发经验；3、精通Hadoop，hive，spark，sqoop等；4、精通Oracle、SQL Server、MySQL等主流数据库的应用设计、性能调优及存储过程的开发具有2年以上ETL相关开发经验；5、对ETL有较深刻的认识，对于数据的定义有独到理解，熟悉至少一种ETL工具；6、有较强的沟通能力，能够将需求转化为模型，能够独立编写mapping设计；7、拥有良好的代码习惯，要求结构清晰，注释清晰，命名规范，逻辑性强，代码冗余率低，尤其是习惯写开发文档。,"物联网,区块链",15-50人,hadoop,长沙
数据分析师,https://www.lagou.com/jobs/7171839.html,岳麓区,10k-15k,湖南联信科技有限公司,3-5年,本科,五险一金 定期体检 周末双休 年底奖金,1、职位信息1. 负责信贷风控等方向模型需求分析和拓展，模型构建与验证；2. 独立或带领算法工程师负责模型项目化或产品化落地，实现业务与算法融合；职位需求：1. 数学/统计/计算机/金融工程等相关专业； 2. 熟悉贷前、贷后风控模型，对用户标签体系、用户行为分析有丰富经验，3年以上相关项目经验；3. 能根据业务场景合理设计模型算法，快速将模型落地、部署和监控；算法分析和实现能力强； 4. 熟练使用R/Python/Java编程语言；具有大数据系统Spark/hadoop/Hive等使用经验；5. 良好的团队合作精神，较强的沟通能力、抗压能力。,"移动互联网,金融",150-500人,hadoop,长沙
大数据AI架构分析师,https://www.lagou.com/jobs/6756977.html,雨花区,20k-30k,长沙电视台政法频道,5-10年,本科,六险一金、带薪年假、节假日工会福利,负责新闻资讯、用户行为数据等海量数据采集、处理、存储，应用方案的技术选型及架构实现，负责大据平台的架构规划，根据业务需求持续优化数据架构、保证数据的可靠性、稳定性、安全性，指导开发人员完成数据算法模型规划建设，分析算法模型构建及分析呈现。任职要求：1、计算机相关专业，本科学历以上，具备5年以上大型项目大数据建模、数据架构设计分析开发经验。2、熟悉Hadoop、Spark、Strom、深度学习、神经网络等。掌握Hadoop HA集群的搭建，熟悉MapReduce、Spark、Hive、HBase的原理和流程，能进行性能调优。3、熟悉kylin等OLAP引擎，熟悉大数据仓库维度建模。4、熟悉Python或Scala编程。5、具备媒体资讯行业大数据建模经验者优先。6、一线大厂互联网行业工作经验者优先。,其他,150-500人,hadoop,长沙
Java开发工程师,https://www.lagou.com/jobs/5700543.html,岳麓区,10k-20k,湖南乐马科技有限公司,3-5年,本科,早九晚六周末双休，节假日按国家法定日执行,,"金融,数据服务",50-150人,hadoop,长沙
软件测试工程师,https://www.lagou.com/jobs/6874504.html,天心区,8k-15k,湖南易智寄网络科技有限公司,1-3年,大专,13薪，五险一金，双休，各种福利,"岗位职责：1、参与需求评审，根据产品需求设计高效的测试用例并组织用例评审；2、根据产品规格和测试需求，编写测试方案、测试用例、测试脚本；3、组织、执行产品的测试工作，帮助研发人员进行软件定位，协助解决问题；4、对测试过程进行监控，完成集成测试、系统测试、回归测试等；5、建立、跟踪、维护测试工作的相关文档。6、在项目中保持和项目经理、开发、产品经理积极有效的沟通,驱动问题解决。任职要求：1、本科及以上学历，计算机相关专业；2、3年以上测试经验；3、熟练章握软件工程基本理论、功能测试各种方法、流程及规范；4、能够独立解决在测试工具和脚本方面遇到的问题，有测试团队管理经验优先；5、了解常用性能测试工具如LoadRunner/JMeter/soupui等6、熟悉MYSQL/Oracle/Hadoop/SQLSERVER等至少一种或多种存储库，能够定位分析存储库性能，有实际调优或者性能测试经验者优先；7、至少掌握一种常见编程语言，java/python/shell/c等8、具有较高的质量意识、团队合作意识，认真细心 、逻辑思维清晰严谨，工作积极主动、责任心强、有耐心细心。",移动互联网,15-50人,hadoop,长沙
Java开发工程师,https://www.lagou.com/jobs/5842358.html,雨花区,7k-12k,福韵数据服务有限公司,3-5年,本科,上班时间：9:00-18:00 周末双休,岗位职责：1.负责产品服务端的开发工作。2.深入理解业务需求，提供具体问题的解决方案。3.负责相关模块开发、改进以及设计文档编写，保证系统的性能和稳定性。任职要求：1.计算机专业本科以上学历。2.两年以上相关工作经验。3.有较强的学习能力，良好的团队协作和沟通能力。4.熟练掌握Java开发语言。5.掌握使用linux系统。6.熟练掌握elasticSearch，redis，mongodb者优先。7.有ETL开发使用经验者优先。8.有大规模高并发系统开发经验者优先。9.有hadoop，spark，storm，flink开发经验者优先。,"移动互联网,数据服务",150-500人,hadoop,长沙
首席技术官,https://www.lagou.com/jobs/6362332.html,天心区,20k-40k,湖南土流信息科技集团有限公司,10年以上,本科,C轮融资 双休 扁平化管理,岗位职责：1、根据公司业务发展战略，制定技术路线图并组织落实技术框架搭建及完善，为公司业务发展和核心产品研发提供技术指导和保障；2、进行项目可行性分析，带领产品研发团队做发展规划并落实技术选型，架构设计，指导、审核总体技术方案，指导并适当参与底层框架、核心代码编写，管理项目成员的工作质量，对开发结果进行质量评估，对研发结果质量负责；3、管理公司产品版本的迭代开发，负责协调项目的开发、实施的各个环节，把握项目的整体进度，保证最终版本质量；4、对行业产品及动向保持敏锐的感知度，负责公司产品关键技术架构的制定和相关新技术的研究工作（如大数据/人工智能等方向），对公司的技术演进能够做出中长期规划，建立内部技术优化和能力沉淀机制；5、负责公司研发团队建设和管理，打造高绩效高能力的技术团队，培养团队创新文化和用开放的心态构建学习成长型团队。任职要求：1、本科及以上学历，计算机、电子、通信工程、软件等相关专业；2、8年以上平台/软件/移动端等领域开发、架构设计经验，3年及以上大中型移动互联网公司技术总监或CTO岗位经验； 3、有较强的平台化思维，对行业的新技术（如大数据/人工智能）有一定的研究或项目经验；3、精通互联网技术系统的架构设计、系统分析、编码实现、性能优化及系统安全，精通常用设计模式和主流设计工具；4、精通java程序开发和ssm、springboot、springcloud主流开发框架，掌握多线程高性能程序开发，掌握jvm工作原理，具备jvm调优经验；掌握java高性能网络编程；5、精通mysql，postgreSQL，oracle等数据库系统，掌握数据库和sql优化，数据库集群及数据库切分扩展；6、熟练掌握互联网中间件开发与集成技术体系，熟练掌握常见开源框架和技术，熟悉大规模分布式系统的负载均衡、缓存、网络存储、网络安全、数据库高可用设计及性能评估机制，具备海量数据、大批量、高并发、高性能分析及处理的成熟经验；7、熟练掌握大数据批量和实时分析处理技术，包括但不限于flume，kafka，hadoop HDFS，mongodb，hbase，mapreduce/spark，storm，hive，kylin等。8、有丰富的项目管理经验、产品研发和团队管理经验，有很强的计划执行能力及优秀的协调资源达成结果能力，有50人以上团队管理经验者优先；9、为人诚信，具有高度的责任心，工作主动积极，有大局观，能理解并执行董事长战略方向指导并坚定地落地执行。,消费生活,150-500人,hadoop,长沙
java开发工程师,https://www.lagou.com/jobs/6892727.html,长沙县,8k-13k,湖南必和必拓科技发展有限公司,5-10年,本科,福利待遇好,高级软件开发工程师岗位职责1、参与公司信息化系统产品研发。2、撰写相关研发文档。3、负责服务器的应用部署和配置及软件性能分析及调优。4、指导普通工程师编写软件代码、完成单元测试、集成测试。5、数据库系统性能的优化设计。﻿任职要求：1、计算机相关专业本科及以上学历，具有2年以上软件开发经验；熟悉软件开发流程，有实际开发经验和独立软件设计能力。2、至少熟练掌握Java、PHP、Node.js或C#语言中的一种，以及.Net Framework4.0以上平台；有MVVMLight、Prism、Caliburn等MVVM实现方式经验优先。3、熟练编写业务逻辑；4、熟练使用Entity Framework框架，SpringBoot框架，微服务框架，Unity3D等三维建模框架；了解Web应用的性能瓶颈和调优方式；了解MongoDB、Hadoop等分布式文件存储数据库；熟悉SQL server 2008、MySQL、Oracle等数据库；具有多线程开发经验、熟练掌握线程之间的通信及相关调用处理机制；熟悉串口通信、USB通信及TCP/IP通信。5、精通Java开发语言，熟练掌握Eclipse或IntelliJ IDEA开发工具；熟悉HTML、精通Apache、JSP、servlet、SSM、SSH、Vue.js等web开发相关技术。6、编码习惯良好、工作勤奋，具有团队合作精神、责任心强、具有良好的沟通能力及学习能力。,"通讯电子,软件开发",15-50人,hadoop,长沙
高级算法工程师,https://www.lagou.com/jobs/6660823.html,岳麓区,15k-30k,自由飞越国际航空技术服务（北京）有限公司,3-5年,本科,"五险一金,双休,带薪年假","工作职责： 1.负责公司自主研发的搜索引擎产品的性能优化及应用优化； 2.利用数据挖掘技术对海量数据进行分析、建模、验证，提高性价比； 3.公司其他核心产品研发； 教育背景： 计算机、应用数学等相关专业本科及以上学历,硕士研究生优先,研究方向与搜索引擎相关最佳.职位要求： 1. 技术开发经验3年以上，系统架构搭建经验1年以上2. 熟悉互联网应用架构设计（分布式、延展性、可扩性），业务抽象和模型设计，以及相关方法论。对数据库、架构、分布式和缓存技术等技术有深刻理解和应用经验；3. 熟悉SOA、RESTful、微服务架构和设计模式，扎实的Java知识，精通Spring、SpringCloud、MyBatis等框架并了解工作原理，精通Mysql、Redis、MongoDB、ElasticSearch，Cassandra，kafka等数据库和缓存中间件的使用及优化，精通spark，Hadoop等大数据相关框架的搭建和使用;4. 对代码质量，性能，代码编写规范，文档编写等方面有一定的认知5. 熟练使用项目管理工具，并具备良好的团队合作精神、人际关系管理能力、沟通协调能力和培养团队成员意识，善于解决团队冲突，分析问题及解决问题能力强，良好的表达能力;6. 对已有架构和功能模块进行重构与优化，解决各类潜在系统技术风险加固系统，保证系统的安全、稳定、快速运行",电商,150-500人,hadoop,长沙
大数据开发,https://www.lagou.com/jobs/7016630.html,岳麓区,12k-22k,中兴通讯股份有限公司,3-5年,本科,福利好，领导nice,岗位职责要求1.负责技术难点的攻关及大数据平台新技术的调研及选型。2.负责公司大数据应用产品设计、开发、部署、运营(数据架构、模型设计、数据处理、部署运维）3.熟悉目前主流大数据处理框架下的海量数据集成、分析处理、统计挖掘工作4.精通数据仓库及数据建模理论，有大数据项目实践经验，至少精通一门语言5.熟悉hadoop生态圈组件，熟悉CDH，hdfs、MR、flume、kafka、spark、hbase、ES、Kylin、flink、BI工具6.全日制本科及以上学历，本科4年及以上，硕士2年及以上，数学、计算机、电子、通信等相关专业,"数据服务,信息安全",2000人以上,hadoop,长沙
Informatica高级专家(J11495),https://www.lagou.com/jobs/7081044.html,天心区,25k-30k,秒针信息技术有限公司,5-10年,本科,"大牛多,学习型组织",工作职责:1. 负责Informatica产品组件（包括BDM、PWC、EDC、DIH、AXON、MDM等）的日常运维；2. 负责为上述Informatica产品组件的应用提供操作指导、培训与技术支持等；3. 负责为上述Informatica产品组件提供相应技术咨询服务，排查与解决问题，提供解决方案并实施落地；4. 负责为上述Informatica产品组件进行知识沉淀及知识库建设；5. 负责为上述Informatica产品组件提供数据资产管理整体能力解决方案；6. 带领项目团队开展Informatica产品组件运维与实施工作。任职资格:1. 计算机相关专业，5年以上Informatica产品组件实施开发，熟悉BDM、PWC、EDC、DIH、AXON、MDM等优先；2. 熟悉至少两种常见关系型数据，如Oracle、PostgreSQL、MySQL、SQL Server等；3. 熟悉Hadoop生态系统，尤其是HDFS、Hive、Spark、Kafka，有开发经验者优先；4. 精通SQL，掌握SQL性能优化能力，熟悉Hive SQL；5. 熟悉Linux/Unix环境及脚本开发（shell或python等）；6. 有较强的问题排查/解决能力，具备较强的逻辑思维能力，能独立解决Informatica运维和实施问题；7. 良好的沟通表达能力和文档写作能力；8. 良好的团队协作能力，有团队管理经验者优先。,"数据服务,广告营销",2000人以上,hadoop,长沙
高级ETL开发工程师(J11552),https://www.lagou.com/jobs/7167717.html,岳麓区,13k-26k,秒针信息技术有限公司,5-10年,本科,"大牛多,学习型组织",（该职位涉及长期出差）参与数据中台的汇聚和采集ETL详细设计和开发工作；参与专题库/主题库的模型设计，并负责模型开发；参与数据标准化和数据治理模型的设计，并负责落地开发；负责数据分析需求的模型开发和实现；负责数据中台技术的优化和质量改进；任职资格:1.精通SQL语言，具备存储过程开发能力，能熟练进行SQL查询优化；熟悉Hive数据仓库设计，了解数据仓库模型及思想、维度建模思想，了解数据仓库相关应用；2.熟悉Hadoop、Spark、Sqoop、Hive、Flume、Kafka、HBase等技术，使用过ETL相关技术进行数据交换工作；3.了解数据调度平台的设计思想，良好的数据批处理 、调度、异常处理等经验，熟悉shell、python、java等语言；4.具有良好的逻辑分析能力、需求理解能力和解决问题的能力；具有一定的文档编写能力；5.具有良好服务意识，工作态度端正，耐心、细致、热情，抗压力强，对工作专注、投入，有很好的职业素养 。6.具有3年及以上数据仓库相关项目工作经验，有电子政务行业项目经验优先；7.可接受出差，有独立工作能力。,"数据服务,广告营销",2000人以上,hadoop,长沙
初级技术服务工程师,https://www.lagou.com/jobs/6853275.html,岳麓区,3k-4k,北京易观智库网络科技有限公司,1-3年,本科,"五险一金,双休,下午茶,会玩儿",岗位职责：1、支持和处理客户在易观方舟交付前、中、后期方面遇到的各类技术问题；帮助客户排查、定位问题、解决问题；负责易观方舟大数据产品私有部署环境的安装及运维支持工作（大数据平台运维支持方向）；2、负责支持客户完成易观方舟各类SDK的接入工作（SDK技术支持方向）；3、负责开发和完善数据ETL工具及文档；不断提升客户技术支持的满意度（ETL开发支持方向）；4、负责开发和完善技术服务软件系统，提升内部项目管理与服务效率（应用开发支持方向)。岗位要求：1、有强烈意愿从事大数据行业，愿意利用科技改变世界，热爱大数据和数据分析行业。2、具有优秀的数学基础、逻辑思维强，愿意接受挑战3、性格开朗，有责任心，团队意识强。4、本科及以上学历，信息与计算机相关专业；985、211高校毕业生优先。 岗位技能要求：1、熟悉网络与通信，了解操作系统原理，熟悉数据结构与常用算法。2、对linux系统有认知和简单操作经验。3、对hadoop生态中的组件，有一定认知和简单操作经验。4、有一定的 java/python/scala 语言基础。5、有一定SQL基础。,"移动互联网,数据服务",150-500人,hadoop,长沙
初级技术服务工程师,https://www.lagou.com/jobs/6942675.html,岳麓区,3k-4k,北京易观智库网络科技有限公司,应届毕业生,本科,"五险一金,双休,下午茶,会玩儿",岗位职责：支持和处理客户在易观方舟交付前、中、后期方面遇到的各类技术问题；帮助客户排查、定位问题、解决问题；负责易观方舟大数据产品私有部署环境的安装及运维支持工作（大数据平台运维支持方向）；负责支持客户完成易观方舟各类SDK的接入工作（SDK技术支持方向）；负责开发和完善数据ETL工具及文档；不断提升客户技术支持的满意度（ETL开发支持方向）；负责开发和完善技术服务软件系统，提升内部项目管理与服务效率（应用开发支持方向)。岗位要求：1、有强烈意愿从事大数据行业，愿意利用科技改变世界，热爱大数据和数据分析行业。2、具有优秀的数学基础、逻辑思维强，愿意接受挑战3、性格开朗，有责任心，团队意识强。4、本科及以上学历，信息与计算机相关专业；985、211高校毕业生优先。 岗位技能要求：1、熟悉网络与通信，了解操作系统原理，熟悉数据结构与常用算法。2、对linux系统有认知和简单操作经验。3、对hadoop生态中的组件，有一定认知和简单操作经验。4、有一定的 java/python/scala 语言基础。5、有一定SQL基础。,"移动互联网,数据服务",150-500人,hadoop,长沙
java架构师,https://www.lagou.com/jobs/6928933.html,岳麓区,12k-20k,中兴通讯股份有限公司,5-10年,本科,在长沙工作，一线省会城市，但房价低,岗位：java架构师岗位要求1.计算机或相关专业本科及以上学历，4年或以上JAVA实际开发经验。2.Java 基础知识扎实，熟悉常用算法，数据结构，设计模式等。3.熟练使用JAVA主流开发框架，SSM(Spring+SpringMVC+MyBatis)，Spring Boot，Spring Cloud等4.熟练使用消息中间件及缓存技术（Redis，Kafka，Rabbitmq，mysql等)。5.热爱技术，善于思考，积极主动，责任心强，沟通能力强，有良好的团队精神，能够承担压力。符合以下条件者，优先考虑：1.担任过Java 技术Leader、开发组长、架构等角色。2.微服务改造、开发经验，有大容量高并发系统的设计，大数据数仓建设，实时计算方面的经验。3.熟悉敏捷软件开发流程，Devops相关技术。4.开源代码，发表相关技术文章等。岗位：大数据运维开发岗位职责：参与大型企业数据中台建设：1、大数据集群运维、优化；2、大数据安全中心建设；3、离线实时数据采集分发平台建设；4、分析解决大数据用户问题岗位要求：1、熟悉Hadoop和Spark生态圈组件基本原理，有大数据集群搭建、运维、优化相关经验；2、掌握Java技术栈3、熟悉Linux系统，了解shell或python岗位：大数据开发工程师 岗位需求： 1、全日制本科及以上学历，计算机相关专业，扎实的Java语言基础和Linux编程基础； 2、3年大数据相关系统研发经验，有java后台开发经验和Flink开发经验者优先； 3、对大数据相关组件：Hadoop、Spark、Hbase、Hive、Kafka、Flume、Kylin、ElasticSearch等架构与底层实现有深入理解，； 4、具备构建稳定的大数据基础平台的能力，具备数据收集、数据清洗、数据仓库建设、实时流计算等系统研发经验； 5、工作有计划性，责任心和执行能力强，具备高度的责任心、诚信的工作作风、优秀沟通能力及团队精神。6、 对技术有热情，有不错的数据思维和敏感度，有一定的数据分析能力优先； 7、具备强烈的工作责任感，喜欢钻研，态度乐观，团队意识强。,"数据服务,信息安全",2000人以上,hadoop,长沙
Java全栈研发高级工程师,https://www.lagou.com/jobs/6423759.html,岳麓区,15k-25k,湖南星汉数智科技有限公司,不限,硕士,"扁平化管理,周末双休,五险一金,股票期权",岗位职责：1、 根据项目或子系统目标，设计软件系统结构，撰写设计文档；2、 负责具体模块的代码实现；3、 参与编码规范制订；4、 参与关键技术攻关；5、 参与性能调优和BUG排查；6、 参与需求分析。岗位要求：1、 211/985院校计算机或相关专业硕士以上学历，算法、数据结构、网络、操作系统、软件工程等专业基础扎实；2、 做过java相关项目开发，JAVA基础扎实，理解io、多线程、集合等基础框架，对JVM原理有一定的了解；3、 熟悉spring cloud、hadoop、spark、storm、hive 、ElatisticSearch等大数据开源框架；4、 了解分布式系统的设计和应用，了解分布式、缓存、消息等机制；能对分布式常用技术进行合理应用，解决问题；5、 具有一定创新能力；6、 了解机器学习的基本原理，具有机器学习的应用能力；7、 精通设计模式，具有较强的系统架构设计能力和分析能力；8、 具有自我驱动品质，学习能力强，适应能力好，有强烈的责任心，具备耐心/细心的品质；9、 抗压能力强，吃苦耐劳，愿意出差，能够加班10、 两年以上工作经验，大厂工作经验优先；待遇：1、作为公司骨干储备力量，优先配股；2、年薪20万-30万；,"移动互联网,数据服务",50-150人,hadoop,长沙
java工程师（大数据平台部）,https://www.lagou.com/jobs/4978216.html,岳麓区,7k-10k,湖南星汉数智科技有限公司,1-3年,本科,"五险一金,扁平化管理,前沿技术,周末双休",1.负责具体业务功能的开发，深入发掘业务需求，独当一面，包括需求分析、架构设计和代码实现；2.持续优化系统架构，提高系统在高并发、大流量下的容灾容错能力，保证系统的高可用性（性能、安全、容量）；3.通过梳理和抽象，沉淀通用性的平台或服务能力，发现和解决存在的技术问题，并在具体的业务场景中进行验证推广；岗位要求：1. 本科及以上学历，计算机软件或相关专业；2. 1年及以上使用JAVA开发的经验，JAVA基础扎实，理解io、多线程、集合等基础框架，对JVM原理有一定的了解，对hadoop spark storm hive 等开源框架熟悉；3. 熟悉分布式系统的设计和应用，熟悉分布式、缓存、消息等机制；能对分布式常用技术进行合理应用，解决问题；4. 掌握多线程及高性能的设计与编码及性能调优；有高并发应用开发经验优先；5. 学习能力强，适应能力好，有强烈的责任心，具备耐心/细心的品质；,"移动互联网,数据服务",50-150人,hadoop,长沙
