job_name,job_url,job_location,job_salary,job_company,job_experience,job_class,job_given,job_detail,company_type,company_person,search_key,city
新媒体运营,https://www.lagou.com/jobs/2273024.html,东莞市市辖区,5k-10k,东莞快创信息科技有限公司,不限,不限,高薪，优秀者分配期权，完善的培训体系,岗位职责：1、熟悉微信、微博等社交平台运作，重度移动互联网用户；2、能独立策划新媒体互动活动（侧重微信），执行策划，并进行效果追踪；3、能撰写适用于微信、微博的不同类型的自媒体方案，有独到的观点和创意；4、对热点、爆点要有足够敏感度，及时在微信、微博等平台做出响应；5、能综合各种运营手段增加粉丝数、提升用户活跃度。职位要求：1、扎实的文字功底，具备较强的文案策划功底以及活动策划能力，熟悉微博、微信运营、口碑营销、创意推广； 2、对微信的运营和推广有比较深刻的认识；3、具备良好的数据分析能力、语言及文字表达能力、团队协作能力； 4、有社会化媒体平台（微博、微信、论坛）营销经验者优先。本岗位同时招聘在校实习生，欢迎各位有志青年推荐或自荐。,"移动互联网,消费生活",50-150人,运营,东莞
新媒体运营,https://www.lagou.com/jobs/6399768.html,东莞市市辖区,2k-4k,东莞快创信息科技有限公司,应届毕业生,不限,"市中心,周末双休,薪酬高,平台大",岗位职责：1、熟悉微信、微博等社交平台运作，重度移动互联网用户；2、能独立策划新媒体互动活动（侧重微信），执行策划，并进行效果追踪；3、能撰写适用于微信、微博的不同类型的自媒体方案，有独到的观点和创意；4、对热点、爆点要有足够敏感度，及时在微信、微博等平台做出响应；5、能综合各种运营手段增加粉丝数、提升用户活跃度。职位要求：1、扎实的文字功底，具备较强的文案策划功底以及活动策划能力，熟悉微博、微信运营、口碑营销、创意推广； 2、对微信的运营和推广有比较深刻的认识；3、具备良好的数据分析能力、语言及文字表达能力、团队协作能力； 4、有社会化媒体平台（微博、微信、论坛）营销经验者优先。,"移动互联网,消费生活",50-150人,运营,东莞
产品运营,https://www.lagou.com/jobs/7149012.html,东莞市市辖区,8k-9k,东莞市天高网络科技有限公司,1-3年,不限,底薪+提成+五险一金+双休+带薪年假,1）岗位要求1.1）负责微信全端口流量和用户运营工作；1.2）负责用户体系的建立、维护和完善，对用户进行分层运营和生命周期管理，通过各种运营手段与工具，有效提升用户的新增、留存、活跃和订单转化；1.3）整理、分析平台数据以及编制运营报表，对平台目前存在的问题提出改进方案，针对不同用户群，不同活动，定期进行用户营销；1.4）根据年度发展指标，负责各类主题活动的策划和执行，负责跨部门协调和沟通，能挖掘和制造热门话题；2）任职资格2.1）本科学历，2年以上互联网行业运营经验，有电商、小程序、APP用户运营经验者优先；2.2）熟悉线上线下活动和用户运营，增长用户活动策划与用户数据分析；2.3）逻辑清晰、做事有条理、有冲劲、有想法，抗压能力强；2.4）良好的用户服务意识，有较强的项目管理能力，沟通协调能力和资源整合能力。,移动互联网,15-50人,运营,东莞
新媒体运营,https://www.lagou.com/jobs/6834596.html,东莞市市辖区,5k-10k,广东极速网络科技有限公司,1-3年,大专,"奖金,旅游,节假日福利,生日趴","职位描述：任职要求： 1、具备自媒体从业经验3年以上经验；对于自媒体有清晰深刻的理解；熟悉百家号、今日头条、微博、微信公众号、大鱼号、搜狐等平台操作规则； 2、需要负责统筹自媒体团队的整体工作，分析数据并反馈，总结经验及方法培训团队新人； 3、具备良好的互联网思维，善于跟踪网络热点，对于网络热词、热事能**时间反应； 4、具备互联网化的文字语言，不限于文字功底好，但胜在有自己的风格。福利待遇：1、上班时间8H,8:30-12:00 13:30-18:00，大小周休，节假日根据国家法定假安排放假。2、不定期举行团体活动、培训、旅游、聚餐，生日礼品发放3、奖金和补贴：全勤奖，绩效奖，季度奖，年终奖。欢迎你的加入，极速体育有你更精彩。备注：我司岗位的薪酬是根据求职者资历、能力、经验等因素确定，该职位薪酬范围在5k-10k","移动互联网,文娱丨内容",15-50人,运营,东莞
运营专员,https://www.lagou.com/jobs/7012481.html,东莞市市辖区,4k-8k,东莞市牛咖信息技术有限公司,1-3年,不限,晋升空间、薪资空间、五险一金 期权,岗位职责：1、基于运营策略策划线上线下活动。把控活动整体节奏和具体活动方案、主题创意、玩法策划、文案、交互、活动复盘等，为活动质量和效果负责；2、研究市场竞争对手的产品进行竞品分析，提供产品策略和运营建议；3、根据运营团队的需求配合开展其它产品运营工作。任职要求：1、专科及以上学历，2年以上运营工作经验；2、有社区运营经验及线下推广、广告、大型活动运营经验者；  3、能力全面且适合产品前期运营，在各个阶段需要承担不同重心的运营工作； 4、善于学习沟通，统筹协调能力强，抗压能力强。,移动互联网,15-50人,运营,东莞
新媒体运营专员,https://www.lagou.com/jobs/7111382.html,东莞市市辖区,3k-6k,广东友贝健康科技有限公司,不限,不限,零食任吃，每年一次涨薪机会，专业培训指导,岗位职责：1、负责公司微信公众号、官网等平台的内容输出和运营管理；2、负责公司营销活动方案相关文案的策划和撰写；3、负责公司品牌形象的维护和推广；4、协助完成运营活动数据跟踪和统计分析，针对活动运营的问题进行不断优化。任职要求：1、大专以上学历（如有新媒体相关运营经验可忽略），接受实习生；2、有一定新媒体运营工作经验，熟悉各大新媒体平台运营规范；3、文笔良好，会撰写产品软文，思路清晰、表达和抗压能力良好；4、具有较好的营销热点敏锐度，对大健康行业有兴趣,医疗健康,15-50人,运营,东莞
国内电商运营专员,https://www.lagou.com/jobs/6905691.html,东莞市市辖区,4k-8k,东莞柏睿斯运动器材有限公司,1-3年,不限,高提成，年底双薪，工作权限高,岗位职责：1、制定店铺发展计划，阶段目标；2、协调团队人员工作，监督客服与美工的工作，推进店铺营销活动，保持网店的正常运作；3、负责平台日常运营数据的整理、统计、分析和管理；4、负责店铺全店的整体运营，整体规划、运营策略、营销方案并组织执行，提高品牌影响力和产品销量；5、对市场活动、营销推广、市场调查进行数据追踪和评估；6、对市场行情、同行竞品、客户需求等及时分析总结，并做相应调整计划；7、负责SEO优化（标题、主题、详情页）、直通车、钻展推广，优化店铺及产品排名，打造产品爆款群，提高店铺点击率、浏览量和转化率；8、店铺日常安全维护，数据监控，问题检查每日监控数据，根据数据的分析及时调整店铺运营。福利待遇：1.五险，食宿补贴2.公司提供有竞争力薪资以及个人良好的发展上升空间3.享有国家法定假期4.员工国内外旅游、公司聚餐工作时间：早上8:45~下午6:15，中间休息2小时，共7.5小时。大小周。,"电商,医疗丨健康",50-150人,运营,东莞
跨境电商运营专员,https://www.lagou.com/jobs/6905083.html,东莞市市辖区,4k-8k,东莞柏睿斯运动器材有限公司,1-3年,大专,高提成，年底双薪，工作权限高,岗位要求：1.大专及以上学历，拥有1年以上跨境电商平台运营经验，条件优秀者可放宽要求。2.制定公司的经营目标及战略方针，负责公司整体业务的运营管理工作，制订跨境电商平台营销策略，优化运营流程，建立完善的线上运营体系。3.对市场整体趋势、竞争对手情况以及公司内部各项运营数据进行分析和总结，为公司业务规划提供决策支持。4.根据销售目标，制定跨境电商平台运营规划及各类营销方案，监督指导各项营销活动执行与优化。5.负责对跨境电商平台的产品定位及采购渠道的分析及开发，制定相应的战略机制，开发爆款及有竞争力的品类。6.出色的风险规避能力，熟知跨境电商的规则；较强的数据分析能力及判断能力，思维缜密；敢于担当，能承受较大压力。福利待遇：1.五险，食宿补贴2.公司提供有竞争力薪资以及个人良好的发展上升空间3.享有国家法定假期4.员工国内外旅游、公司聚餐工作时间：早上8:45~下午6:15，中间休息2小时，共7.5小时。大小周。,"电商,医疗丨健康",50-150人,运营,东莞
新媒体运营,https://www.lagou.com/jobs/6680883.html,东莞市市辖区,3k-6k,长沙侏罗纪教育科技有限公司,不限,不限,包吃住，弹性工作时间，氛围好,"技术要求： 新媒体运营  文案撰写  视频剪辑  PS    岗位职责：1、	负责新媒体平台（公众号、微博）日常内容编辑、发布及粉丝互动；2、	挖掘用户需求，根据平台特性制定用户内容运营策略并统筹执行；3、	社群的基础管理及运营；日常、活动数据的统计及分析；4、	具有整合营销传播的视角，对互动营销、网络营销具备一定的策划及项目管理能力。任职要求：1、	熟悉互联网和新媒体运营与推广；2、	文案创作能力强，具备一定美工基础（PS）和视频剪辑技能；3、	热心肠，沟通能力强，善于协作，热爱音乐者优先；4、	希望你具有有趣的灵魂！5、	接受实习生，实习期****。员工福利：1、	社保、带薪年假、弹性工作制、包吃包住；2、	年终奖+节日福利+生日礼物+不定期团建+游山玩水；3、	完善的培训体系（新人存活培训+晋升培训+音乐制作大师课福利）；4、	舒适的办公环境、吃不完的零食。",文娱丨内容、教育,15-50人,运营,东莞
新媒体运营主管（推广）,https://www.lagou.com/jobs/6012202.html,东莞市市辖区,6k-10k,广东微商信息咨询有限公司,1-3年,大专,五险 好平台 稳定,一、岗位职责：1、深入了解互联网，掌握熟悉微博、微信及新媒体领域的新功能，尤其是微信特点及资源的有效运用，结合产品特点，做出适用的推广方案；2、挖掘新兴的新媒体推广渠道，开拓有效的自媒体资源；3、负责抖音、微信公众号等平台的KOL和信息流广告推广及投放，制定投放计划；4、负责微社区、微信公众号、Q群等营销运营工作，增加粉丝数，提升粉丝活跃度；5、负责部门内部的各项管理工作，保证部门人员的输出持续高效。二、任职资格：1、大专学历及以上，有两年以上新媒体运营的相关经验，一年以上的主管经验，有微信、社群、百度、头条等平台推广管理的经验优先；2、熟悉各大新媒体平台的引流规律和方法；3、能够迅速掌握当下时事热点，即使做出引流方案。三、福利待遇：1、福利待遇：全勤奖+五险；2、定期举行员工出外旅游；3、员工的聚餐KTV、每周多次下午茶、员工生日礼物；4、公司提供游学机会，注重员工个人发展。,"移动互联网,企业服务",15-50人,运营,东莞
产品运营,https://www.lagou.com/jobs/6669077.html,东莞市市辖区,5k-8k,深圳市维谷电子商务有限公司,应届毕业生,不限,相关培训、带薪假期、晋升制度,"岗位职责：1、账号的运营管理与维护；2、制定产品线运营方案，分析产品前景、市场特点分析及竞争对手状况，制定产品开发以及产品线拓展计划；3、定期制定销售目标、制定相应销售策略，并且适时跟踪调整达到销售目标；4、listing产品上架，控制产品风险，有计划有针对性的标记产品关联标签； 持续优化产品图片和描述,保持店铺的好评率与良好的信用度；任职要求：1.大专以上学历，会法语优先考虑;2.工作主动，乐于挑战，具备跨境电商工作经验优先考虑且能获得更优的待遇；3.具备较好的沟通、协调及执行能力，工作认真、应对快捷敏锐，责任心强，具备优秀的团队合作精神。我司员工享有福利包括：1、全勤奖，带薪年假，婚假，国家规定的有薪假；2、免费下午茶，加班补贴，节假日福利；3、免费享受职业培训；4、绩效奖金，优秀员工奖金，年终奖金；",电商,少于15人,运营,东莞
电商运营,https://www.lagou.com/jobs/7142299.html,东莞市市辖区,7k-9k,东莞市良固紧固件有限公司,不限,大专,五险一金，绩效奖金，定期体检,我司经营紧固件产品，主要为b2b市场工作886，每日两餐食岗位职责】负责网店运营规划，制定目标、做运营方案，提升店铺的浏览量和转化率；负责线上商品管理，包括标题优化，详情优化、搭配优化、SKU优化等；负责店铺数据汇总统计和分析；负责协调仓管、客服、设计等岗位工作；完成团队交办的其他工作。任职要求】人品是基本要求，对工作积极主动、认真、细心、有责任心；有电商运营经验懂得如何制定有效目标和执行计划；对数据敏感，能从数据看出问题，并提出解决方案；有团队合作精神，沟通良好，能主动承担，多分担团队工作，因为目前团队人少，有时需帮忙多担待照顾；,其他,15-50人,运营,东莞
互联网运营,https://www.lagou.com/jobs/7152282.html,东莞市市辖区,3k-5k,东莞市虎门颐和堂中医诊所,1-3年,大专,年终奖 13薪 双休,岗位职责：1、负责医馆业务线上日常运营及推广工作2、负责医馆业务线上活动策划执行3、负责医馆公众号日常运营及推广4、协助完成与医馆相关的其他线上工作任职要求：1、大专或以上学历，互联网运营相关专业或中医药相关专业优先2、有1-2年互联网运营、微信公众号运营相关工作经验者优先，优秀者应届毕业生也可3、会简单PS、AI等相关基础设计软件，会简单视频剪辑软件工作福利：1、五险2、工作餐补3、租房补贴4、2年1次常规工资调整，转正后享受工龄工资（**年每月100元，每年递增100元）5、年终奖，13薪6、行政班，周末双休,"医疗丨健康,其他",15-50人,运营,东莞
社群运营,https://www.lagou.com/jobs/7148979.html,东莞市市辖区,6k-8k,东莞市天高网络科技有限公司,1-3年,不限,底薪+提成+五险一金+双休+带薪年假,1）岗位要求1.1）负责微信群的搭建、维护、引流，能够经常在群内与用户进行互动，善于挖掘用户需求，分析用户情感体验，维系社群活跃度，与用户互动保持联系，制造用户感兴趣的话题；1.2）能够执行微信群的相关营销推广活动，并具有发现问题，反馈问题的能力，并根据自己的理解能对微信群运营方案进行优化调整；1.3）能够具有在社群中及时挖掘出核心用户、KOL的能力，并与核心用户、KOL建立不错的关系；1.4）收集整理有效的用户建议，调研用户特征以及行为分析，优化调整社群运营途径和方法。2）任职要求2.1）熟悉社群运营模式，思维活跃，性格外向，至少1年半以上的社群运营经验；2.2）熟悉社群管理工具，可以通过工具管理多个社群的能力；2.3）文字功底扎实，对新鲜事物充满兴趣，喜欢刷微博上网聊天，群聊天，喜欢追星，对微信用户群体有一点了解者优先；2.4）执行力强，富有激情，积极求变，学习能力强，对互联网有一定的认知，善于团队合作，抗压能力强。,移动互联网,15-50人,运营,东莞
法律产品运营,https://www.lagou.com/jobs/7200097.html,东莞市市辖区,6k-12k,深圳海规网络科技有限公司,应届毕业生,本科,办公环境好,职位诱惑：年终体检、带薪年假7天、公积金全额职位描述：【职责描述】1、驻点法院，负责法院端产品的日常运营工作，保障当事人和法院人员在使用系统过程中案件的正常流转；2、了解并整合法院端需求，深度挖掘法院端产品，推动商务、产品、技术内部团队落地，与法院建立深度合作；3、在法院实际运营过程中，了解用户需求，推进公司产品迭代，提高用户黏性；4、沟通企业及律所等机构，打通案件运营全链路。【任职要求】1、本科以上学历，2年以上相关工作经验；2、对互联网司法产品有浓厚兴趣者优先；3、有很强的沟通、协调能力，很好的抗压能力；4、有过律师助理、调解员、书记员、公司法务、产品运营从业经验者优先；5、接受出差安排工作地址东莞 - 东莞市市辖区 - - 东莞市新城路35号,"金融,企业服务",50-150人,运营,东莞
网店运营,https://www.lagou.com/jobs/6733076.html,东莞市市辖区,6k-10k,东莞市君炜铭服饰有限公司,3-5年,本科,主做中高端女装服饰，发现新款测款,有上进心，责任心强，有较强的沟通能力，能够独立完成上司所交代的任务,电商,50-150人,运营,东莞
市场运营专员,https://www.lagou.com/jobs/6846033.html,东莞市市辖区,3k-6k,东莞市荟教网络科技有限公司,不限,大专,年终绩效奖金分红，带薪培训，带薪年假,【岗位职责】1. 负责各项线上线下活动的策划推广与执行，积极开拓客户资源；2. 负责公司网站、微信自媒体的运营和管理，开展线上营销，引流获客；3. 负责线上与客户的咨询沟通工作，达成招生目标。4. 完成领导安排的其它事务。  【岗位要求】1. 大专以上学历，应届生亦可；2. 熟悉市场推广、网络运营，有渠道拓展、市场活动策划经验者优先；3. 具备良好的服务意识，学习能力强，热爱教育行业，有责任心和团队合作精神； 【工资构成】：底薪+提成+绩效,教育,少于15人,运营,东莞
跨境电商运营,https://www.lagou.com/jobs/7126843.html,东莞市市辖区,6k-12k,东莞市雷蒙家居科技有限公司,1-3年,大专,人性化，高提成，上班时间灵活,wayfair跨境电商平台，操作和运营管理，工作地点灵活,"电商,消费生活",15-50人,运营,东莞
运营助理,https://www.lagou.com/jobs/6839453.html,东莞市市辖区,4k-7k,深圳市维谷电子商务有限公司,应届毕业生,大专,带薪假期、晋升制度,"岗位职责：1、账号的运营管理与维护；2、制定产品线运营方案，分析产品前景、市场特点分析及竞争对手状况，制定产品开发以及产品线拓展计划；3、定期制定销售目标、制定相应销售策略，并且适时跟踪调整达到销售目标；4、listing产品上架，控制产品风险，有计划有针对性的标记产品关联标签； 持续优化产品图片和描述,保持店铺的好评率与良好的信用度；任职要求：1.大专以上学历，会外语者优先考虑;2.工作主动，乐于挑战，具备跨境电商工作经验优先考虑且能获得更优的待遇；3.具备较好的沟通、协调及执行能力，工作认真、应对快捷敏锐，责任心强，具备优秀的团队合作精神。我司员工享有福利包括：1、全勤奖，带薪年假，婚假，国家规定的有薪假；2、免费下午茶，加班补贴，节假日福利；3、免费享受职业培训；4、绩效奖金，优秀员工奖金，年终奖金；",电商,少于15人,运营,东莞
法律产品运营,https://www.lagou.com/jobs/6824767.html,东莞市市辖区,6k-12k,深圳海规网络科技有限公司,1-3年,本科,年终体检、带薪年假7天、公积金全额,【职责描述】1、驻点法院，负责法院端产品的日常运营工作，保障当事人和法院人员在使用系统过程中案件的正常流转；2、了解并整合法院端需求，深度挖掘法院端产品，推动商务、产品、技术内部团队落地，与法院建立深度合作；3、在法院实际运营过程中，了解用户需求，推进公司产品迭代，提高用户黏性；4、沟通企业及律所等机构，打通案件运营全链路。【任职要求】1、本科以上学历，2年以上相关工作经验；2、对互联网司法产品有浓厚兴趣者优先；3、有很强的沟通、协调能力，很好的抗压能力；4、有过律师助理、调解员、书记员、公司法务、产品运营从业经验者优先；5、接受出差安排,"金融,企业服务",50-150人,运营,东莞
运营,https://www.lagou.com/jobs/6887685.html,东莞市市辖区,5k-10k,东莞市升元电子科技有限公司,3-5年,不限,双赢合作，共同发展，共创辉煌,1.负责对公司天猫店铺的整体运营，负责各个岗位的工作的工作安排，店铺活动的策划，爆款的打造，根据数据，进行相关调整。2.了解对手的爆品操作手法及选品的分析。3.直通车的优化及活动的报名。4.淘客资源的推广及内容营销。合伙投资或股权激励方式可面议,"电商,社交",15-50人,运营,东莞
运营专员,https://www.lagou.com/jobs/5846683.html,东莞市市辖区,5k-8k,东莞市橙星荟企业服务有限公司,3-5年,大专,"成长空间大
阿里的销售还有被称为铁军","1、负责协助操作阿里巴巴国际站运营，分析产品关键词排名，优化产品质量，产品P4P,橱窗，排名推广等；2、负责协助运营培训课程的策划安排和实施；3、负责各项活动、宣传推广方案的设计、讨论和实施，并定期分析运营效果，调整推广方案。","企业服务,电商",15-50人,运营,东莞
运营,https://www.lagou.com/jobs/5207545.html,东莞市市辖区,5k-8k,东莞源质信息科技有限公司,1-3年,本科,"前景好,福利多多",工作职责：1、负责互联网自媒体平台（微信、微博、头条号、百家号等热点网络平台）的内容编辑、策划运营及推广工作；2、独立运营微信公众号，策划与编辑输出优质、有高度传播性的内容；3、负责增加粉丝数，提高关注度和粉丝的活跃度，并及时与粉丝互动；4、定期分析后台数据，研究挖掘用户行为与需求，提高用户粘性；5、及时掌握网络热点，策划线上营销活动；6、参与品牌推广相关工作的创意构思、文案支撑等。任职要求：1、大专以上学历，1年以上新媒体运营工作经验，有成功经验者优先；2、有优秀的文案撰写、编辑能力，能独立完成内容策划；3、熟悉新媒体平台，了解网络热点及流行文化；具备一定的数据分析能力，有创新意识，执行力强,"广告营销,电商",15-50人,运营,东莞
运营,https://www.lagou.com/jobs/6742663.html,东莞市市辖区,9k-18k,广东乾晋信息技术有限公司,3-5年,不限,可全职兼职实习，收入不封顶！,岗位职责：1.负责58同镇东莞区域的数据运营用户增长裂变岗位要求：1.有相关行业营销策划运营经验【招聘，房产，二手车，乡亲交友】,企业服务、数据服务,50-150人,运营,东莞
服务运营-用户活动,https://www.lagou.com/jobs/6877512.html,东莞市市辖区,6k-9k,OPPO广东移动通信有限公司,1-3年,本科,员工宿舍+饭堂 免费班车 带薪年假,岗位职责：1.负责举办各类线上线下的核心用户活动，促进用户与公司研发团队进行沟通交流2.统筹项目全程：联动公司研发团队、策划活动方案、跟进活动执行和效果，输出活动报告和用户画像3.确保活动的影响力最大化：提升用户对OPPO品牌的忠诚度，确保研发团队获得全面的有效的用户反馈任职要求：1.思维活跃、思路清晰，具备良好的统筹能力和项目管理能力2.良好的沟通能力、有责任心3.具备1年及以上的用户调研/用户运营/活动策划的工作经验,硬件,2000人以上,运营,东莞
