job_name,job_url,job_location,job_salary,job_company,job_experience,job_class,job_given,job_detail,company_type,company_person,search_key,city
首席技术官,https://www.lagou.com/jobs/6362332.html,天心区,20k-40k,湖南土流信息科技集团有限公司,10年以上,本科,C轮融资 双休 扁平化管理,岗位职责：1、根据公司业务发展战略，制定技术路线图并组织落实技术框架搭建及完善，为公司业务发展和核心产品研发提供技术指导和保障；2、进行项目可行性分析，带领产品研发团队做发展规划并落实技术选型，架构设计，指导、审核总体技术方案，指导并适当参与底层框架、核心代码编写，管理项目成员的工作质量，对开发结果进行质量评估，对研发结果质量负责；3、管理公司产品版本的迭代开发，负责协调项目的开发、实施的各个环节，把握项目的整体进度，保证最终版本质量；4、对行业产品及动向保持敏锐的感知度，负责公司产品关键技术架构的制定和相关新技术的研究工作（如大数据/人工智能等方向），对公司的技术演进能够做出中长期规划，建立内部技术优化和能力沉淀机制；5、负责公司研发团队建设和管理，打造高绩效高能力的技术团队，培养团队创新文化和用开放的心态构建学习成长型团队。任职要求：1、本科及以上学历，计算机、电子、通信工程、软件等相关专业；2、8年以上平台/软件/移动端等领域开发、架构设计经验，3年及以上大中型移动互联网公司技术总监或CTO岗位经验； 3、有较强的平台化思维，对行业的新技术（如大数据/人工智能）有一定的研究或项目经验；3、精通互联网技术系统的架构设计、系统分析、编码实现、性能优化及系统安全，精通常用设计模式和主流设计工具；4、精通java程序开发和ssm、springboot、springcloud主流开发框架，掌握多线程高性能程序开发，掌握jvm工作原理，具备jvm调优经验；掌握java高性能网络编程；5、精通mysql，postgreSQL，oracle等数据库系统，掌握数据库和sql优化，数据库集群及数据库切分扩展；6、熟练掌握互联网中间件开发与集成技术体系，熟练掌握常见开源框架和技术，熟悉大规模分布式系统的负载均衡、缓存、网络存储、网络安全、数据库高可用设计及性能评估机制，具备海量数据、大批量、高并发、高性能分析及处理的成熟经验；7、熟练掌握大数据批量和实时分析处理技术，包括但不限于flume，kafka，hadoop HDFS，mongodb，hbase，mapreduce/spark，storm，hive，kylin等。8、有丰富的项目管理经验、产品研发和团队管理经验，有很强的计划执行能力及优秀的协调资源达成结果能力，有50人以上团队管理经验者优先；9、为人诚信，具有高度的责任心，工作主动积极，有大局观，能理解并执行董事长战略方向指导并坚定地落地执行。,消费生活,150-500人,人工智能,长沙
软件研发工程师（golang）,https://www.lagou.com/jobs/7027293.html,天心区,6k-10k,湖南心镜科技有限公司,1-3年,本科,周末双休六险一金，免费下午茶同事nice,福利待遇：①时间：9:30-12:00 14:00-18:30，周末双休。带薪年假+婚、丧、产、陪产假；②收入：上不封顶的；③培训：干货培训是免费的；④旅游：奖励多，方案多，免费周游世界；⑤晋升：空间大，是不靠关系的；⑥奖励：六险一金，福利多多；⑦心情：是自由的，还有每周免费下午茶，让你开心不下线。期待闪光的你，加入心镜科技！工作职责：1、软件研发工程师，负责产品服务端的设计、必须掌握Golang开发和单元测试工作；2、参与软件架构的设计和优化，并对软件性能进行优化;3、业务系统正常维护；4、完成其他相关工作。任职要求：1.涉猎面广，并且掌握Golang开发，主持，组织过项目的完成（或项目重要成员的）2.优秀的学习能力和问题解决能力，自我驱动，执行力强，主动承接任务3.对基本数据结构、网络协议、算法有深刻理解；对前后端分离有深刻理解，可设计restful接口；4.熟练掌握Golang开发，熟悉python/perl/shell等至少一门脚本语言，或熟悉Android或IOS开发基础知识5.熟悉linux服务器维护，可操作postgresql/mysql/mongo等数据库；6.有良好的工作及编码习惯；7.良好的沟通与表达能力、思路清晰，有较强的主动性和责任心，有较好的团队协作能力，技术视野广泛。8.能接受加班（非全日制本科以上与无诚意者勿扰）       公司拥有一支高水平的技术团队，技术骨干均为软件开发、系统管理、信息安全领域的大全栈极客；、如：AI人工智能(产品已上线)、大数据、云计算、创新的多种开源项目，还有多个合作项目。我们也是新大众创的创始合伙人，拥有2000平方的的创业孵化器。,"广告营销,移动互联网",15-50人,人工智能,长沙
图像算法工程师,https://www.lagou.com/jobs/6999671.html,雨花区,12k-18k,深圳昱拓智能有限公司,5-10年,本科,五险一金、双休、带薪休假、年底双薪,工作职责：1.参与整个算法实现过程，从需求分析、输入输出确定、方案设计、测试、算法库交付等；2. 图像目标检测、定位、检索、配准等算法设计、实现及优化；3. 基于可见光/热成像相机的全景拼接算法及可视化软件的开发；4. 机器人自主完成现场目标采集、识别的自动化工具的设计、开发与优化；5. 研究深度学习及传统机器学习中核心算法，针对目标问题收集样本，训练模型及优化。任职要求：1.本科及以上学历，计算机、应用数学、统计学、模式识别、人工智能、信号处理等相关专业；2. 有图像处理、模式识别、视觉分析、机器学习等算法经验3. 具有良好的C/C++语言功底，熟悉Python语言和opencv4.思路清晰，逻辑分析能力强，有解决复杂问题的能力。,人工智能,50-150人,人工智能,长沙
产品经理,https://www.lagou.com/jobs/4969315.html,岳麓区,6k-10k,湖南星汉数智科技有限公司,1-3年,本科,"五险一金,扁平化管理,年终奖,周末双休",岗位职责：1、参与产品推广，配合完成与客户的技术交流、技术方案宣讲、产品及应用系统演示等工作，收集客户业务信息、应用场景信息，整理出有效需求；2、将客户需求转化为整体解决方案交付给客户，协调其它部门资源，推进实施方案，跟踪控制项目的进度；与客户保持技术与方案上的沟通，及时解答疑问、响应新需求、处理突发问题，收集客户意见，处理协调客户工作；3、参与编写客户演示PPT、项目标书、产品宣传推广文案、产品说明书等材料；4、负责研究用户的行为习惯，把握各层次的需求，研究市场的同类竞品。对市场上所有的竞争对手产品进行分析，并改进产品的市场竞争力任职要求：1、思维敏捷，逻辑清晰，具备较强的自学能力以及独立分析问题和解决问题的能力；2、有强烈的责任心和团队合作精神，工作主动、独立性强、吃苦耐劳、能承受工作压力，适应偶尔出差的工作性质；3、具有工作演示经验者优先，掌握一定的表达技巧，具有较强的分享和表现欲望，善于影响感染他人；4、执行力强，积极主动，有团队意识，客户服务导向，能承受一定工作压力；5、有大数据分析、人工智能行业相关经验者优先,"移动互联网,数据服务",50-150人,人工智能,长沙
原创编辑,https://www.lagou.com/jobs/6555721.html,岳麓区,5k-10k,湖南博互卓越网络技术有限公司,1-3年,大专,"学习平台,新媒体行业,高回报",岗位职责：1、负责策划偏科技互联网选题，紧跟热点话题，撰写原创文章；2、负责发现、跟进热点现象，并通过分析解读独立成文；3、美股财报季，负责撰写美股上市企业财报解读文章；4、重点热点能产出观点缝隙；4、负责商稿编写。任职要求：1、爱思考、爱研究、爱阅读、爱写作，对商业、互联网、美股充满巨大的好奇心；2、有志于深耕深度报道，结识大量产业优质人脉，接触知名创业者和投资人；3、具备一定的沟通能力、执行能力、突破能力，敢于挑战自己，能够承受较强的工作压力，能接受排版；3、对产业互联网、游戏、内容、文娱、社交、电商、人工智能、5G、任意一个领域有独特见解的优先，对美股市场有一定了解者优先；4、有金融类、新闻类相关学习经验或投行、证券公司工作经验者优先。5、有写作经验者优先，无写作经验但平时能以清晰思路在雪球上发表增量信息和观点者优先。职位诱惑：1、我们叫美股研究社，是市场上**一家专注美股的机构媒体，与百度、腾讯、老虎证券、微博财经、富途牛牛、雪球、金融界、和讯网等权威渠道有深度合作，每天都有几十数百万用户阅读我们内容。2、能接触大量优质的投资者和主流互联网企业精英，对建立丰富的投资思维有巨大帮助，对个人建立优质人脉也有巨大帮助；3、商业、经济、互联网等专业领域的书籍和相关学习资源，管饱；4、平等、开放、专业的团队，让你每天都看得到自己的进步和变化；5、身在长沙，思想却与北上广、华尔街时刻接轨，一不小心就有几十万用户阅读了自己亲手写出的稿件。,"移动互联网,广告营销",15-50人,人工智能,长沙
