job_name,job_url,job_location,job_salary,job_company,job_experience,job_class,job_given,job_detail,company_type,company_person,search_key,city
云计算研发工程师（IaaS）-成都研发中心,https://www.lagou.com/jobs/7143823.html,高新区,10k-15k,联通云数据有限公司,1-3年,本科,央企、高薪酬、高福利,"一、职责描述：1.参与云计算OpenStack产品研发；2.运维支撑接口人，对接运维组，负责运维问题收集、跟踪，完成常见问题分析处理；3.完成公共组件如openssl,openssh等因安全漏洞需要升级的版本验证工作；4.完成日常新功能开发及BUG修复的测试工作；5.完成日常升级的支撑工作；二、任职要求：1.计算机或相关专业本科以上学历，3年以上云计算相关工作经验；2.熟悉OpenStack整体架构，具备OpenStack核心组件(nova、cinder、neutron等)常见问题定位分析能力；3.熟悉linux系统使用维护，熟悉MySQL，LVS/HAProxy，Apache,RabbitMQ等集群部署;4.具备一定开发能力，熟悉python/shell等开发语言；5.良好的沟通能力和文档编写能力，较强的工作主动性和积极性；",硬件,500-2000人,python,成都
资深容器研发工程师,https://www.lagou.com/jobs/7041478.html,锦江区,18k-28k,北京青云科技股份有限公司,5-10年,本科,六险一金；超长年假,职位描述负责青云公有云和私有云 PaaS 平台容器服务现有产品的开发、支持、实施等工作，支持用 Docker 和 Kubernetes 进行容器化应用的生命周期管理，整合青云虚拟化、存储、网络和安全等能力。持续跟进容器领域主流技术，并持续完善加强青云容器产品线。职位要求熟练掌握 Golang 语言，具备 Python、Java 或者其他一种或多种语言的开发经验；至少有一种面向容器的集群资源调度平台使用经验（Kubernetes、Mesos、Swarm），Kubernetes 优先，了解源码和实现者优先;优先考虑对 1 个或多个 Docker/Kubernetes 生态开源项目代码熟悉并有改进优化经验者，有贡献容器相关开源项目者优先；对 Linux 系统有深入的理解；熟悉容器底层网络（vlan、vxlan、overlay）、存储实现机制，有容器平台相关插件开发经验者优先；熟悉 DevOps 流程，关注开源 CI/CD 技术工具；较强的团队沟通和协作能力，较强的独立开发能力和自我驱动能力；,数据服务,150-500人,python,成都
云应用平台工程师,https://www.lagou.com/jobs/7082115.html,锦江区,12k-20k,北京青云科技股份有限公司,3-5年,本科,六险一金；超长年假,职位描述：负责青云应用管理平台的设计和研发职位要求：较强的自主学习能力和英文技术文档阅读能力良好的编程 / 设计基础，至少精通一种常用编程语言，如 Python/Go/Java/Scala 等熟悉至少一种开源分布式系统：如 Hadoop/Spark/HBase/Kafka/Kylin 等，并有一定的运维经验熟悉至少一种分布式协调服务：如 ZooKeeper/etcd/Consul 等熟练使用 Git 代码管理工具优先条件：拥有 Linux 环境下的系统部署、监控和运维经验，对 DevOps 有一定的理解和实践熟悉微服务和 Kubernetes 技术，有实践经验或者项目开发经验者优先,数据服务,150-500人,python,成都
软件测试工程师；（大数据）,https://www.lagou.com/jobs/7196281.html,高新区,11k-18k,上海华钦信息科技股份有限公司,5-10年,本科,13薪 六险一金,"大数据项目测试职位5年以上测试经验，本科以上学历熟悉linux，sql，有大数据平台测试经验，主要功能测试为主熟悉一种脚本语言工作内容：1、负责数据产品/数据平台的测试，包括确定测试范围、制定测试方案、编写测试计划及用例，执行测试。2、负责数据产品/数据平台产品和项目进度的跟踪，协助研发做好产品版本的迭代和发布，保证项目顺利推进，有质量发版。3、负责对测试中发现的问题进行分析定位和跟踪报告，推动测试中发现的问题得到及时合理的解决。 任职要求：1、5年以上测试经验，其中3年以上数据平台相关测试经验。有很强的分析能力和定位问题的能力，快速学习能力强；具有良好的沟通能力、细心负责、有团队精神；2、熟悉Linux操作系统，了解基本的Shell命令，能够部署和维护测试环境；3、熟悉MySQL、Redis等常用数据库及缓存者优先；3、熟悉Python,java等至少一种编程语言；5、熟悉Hadoop、Spark、HBase等分布式开源项目及工作原理者优先；","数据服务,金融",500-2000人,python,成都
测试工程师,https://www.lagou.com/jobs/6834433.html,高新区,12k-20k,北京瑞友科技股份有限公司,3-5年,本科,名企，环境优越,熟悉机器人框架、Selenium等UI自动化测试工具熟悉Python/Java、Linux英语能够口语交流。,电商,2000人以上,python,成都
web前端开发工程师,https://www.lagou.com/jobs/6821774.html,青羊区,9k-15k,上海诺悦智能科技有限公司,1-3年,大专,五险一金 奖金 餐补 通讯补助等,岗位职责：1. 负责项目的开发、上线及维护工作；2. 根据产品需求完成模块设计、编码和Bug修复等工作；3. 根据产品开发、使用过程体验对产品提出修改、提出计划并实施；4. 改善软件的易用性、提升用户体验。任职资格：1. 计算机专业，本科以上学历，3年以上前端开发工作经验；2. 熟悉W3C标准， 精通HTML5/JavaScript/ES6+/CSS3/nodejs等Web开发技术；3. 掌握HTTP(S)协议，了解前端常用的构建工具-webpack；熟悉git，有良好的代码习惯，对前后分离开发规范有一定了解.4. 对web性能优化，安全有一定的见解和相关实践；注重用户体验，有产品意识；5.熟练使用一门非前端脚本语言（如：NodeJS /Python/PHP/JAVA 等），并具备一定的开发能力优先和项目经验；6.对React Native ，微信公众号开发，微信小程序开发有实战经验者优先。,数据服务,50-150人,python,成都
DBA数据库,https://www.lagou.com/jobs/5526047.html,高新区,14k-24k,小明太极（湖北）国漫文化有限公司成都分公司,3-5年,本科,六险一金、餐补、绩效奖金、节日福利,公司福利：1.节假日只会比国家规定更多，每年春节一般放15天2.弹性作息时间，人性化管理3.六险一金，年终奖1-3个月薪资4.每年涨薪幅度10%以上5.重大传统节日红包、节日礼品6.餐补、生日祝福、红包及调休 职责描述：1、负责数据库设计、日常操作、监控及故障处理;2、参与流式计算、大数据方面实施、监控、部署以支撑业务;3、参与后续数据库选型，优化成本；4、负责对开发、运维数据库方面进行业务指导培训；任职要求：1、计算机等相关专业本科及以上学历，5年以上大型数据库运维经验，3年数据库架构设计经验；2、精通Mysql、SQL server其中一种，有SQL调优、分库分表、高可用、分布式事务、容灾备份等充分的项目实施经验；3、熟悉Linux操作系统，会使用C/Shell/Python/Go 编程其中一种，有较强的开发能力；4、熟悉流式计算、大数据；5、通读过mysql、redis等产品源码，了解阿里云产品优先；,"移动互联网,文娱丨内容",150-500人,python,成都
个性化推荐算法,https://www.lagou.com/jobs/5902241.html,武侯区,20k-40k,北京奇艺世纪科技有限公司,3-5年,本科,"海量数据,优秀团队,大平台",岗位职责：1、基于大数据运用机器学习，数据挖掘算法挖掘用户兴趣点，发觉数据的商业化价值，完成千人千面的个性化推荐；2、运用深度学习提取文本，图片标签，为产品个性化能力提供支持。任职要求：1、计算机、数学、统计或相关专业本科以上学历，4年及以上机器学习相关工作经验；2、熟悉推荐引擎流程，3年及以上个性化推荐相关工作经验；3、熟悉机器学习和深度学习等相关算法，熟练运用相关工具；4、精通Java/python/scala中至少一种编程语言，对算法和数据结构有深入研究；5、熟悉hadoop/spark/flink等大数据处理工具，熟悉tensorflow等深度学习框架，并有实际应用的经验；6、具有团队合作精神，有较强的沟通表达能力，能够自我驱动。温馨提醒：如果 7 天内您没有收到爱奇艺的面试邀请，那么目前我们不会安排您参加后续的面试环节，感谢您的理解和对爱奇艺的关注与认可。,文娱丨内容,2000人以上,python,成都
音频算法资深工程师,https://www.lagou.com/jobs/4324668.html,武侯区,20k-40k,北京奇艺世纪科技有限公司,3-5年,本科,"优秀团队,核心业务,海量数据",岗位职责：应用先进的统计建模，机器学习，深度学习方法建立数据模型解决实际语音问题， 如语音识别， TTS， 语音变声， 语音画像，声纹识别等任职要求：1. 计算机（机器学习、人工智能等方向）相关专业硕士以上学历2. 熟悉基本的计算机声学、语言学算法，有实际相关项目经验的优先3. 扎实的编程基础，至少熟悉Matlab/C/C++/Python其中一种编程语言4. 熟练阅读相关英文论文资料，具备快速实现最新算法的能力5. 有较强的数据分析和解决问题的能力6. 组织和沟通能力强，有管理经验的优先温馨提醒：如果 7 天内您没有收到爱奇艺的面试邀请，那么目前我们不会安排您参加后续的面试环节，感谢您的理解和对爱奇艺的关注与认可。,文娱丨内容,2000人以上,python,成都
服务器运维工程师,https://www.lagou.com/jobs/7211918.html,锦江区,12k-16k,四川易贷网金融信息服务有限公司,3-5年,大专,五险一金,岗位职责：1、负责现有服务器软硬件环境的维护与升级及网络优化、安全问题处理；2、保障线上业务的稳定，能对线上故障及时响应、处理；3、完善相关监控系统的策略，并定期分析相关服务的运行状况，并给出改善建议；4、负责突发事件管理，应急响应、故障排除、问题跟踪与管理，提供相关报告，运维文档；5、负责开发运维脚本或工具，为自动化运维（配置管理、监控、部署、调度等）提供工具或系统支持，来提高运维部署的效率；6、负责服务器安全及账号、权限的管理，规范运维流程，完善相关运维制度； 岗位要求：1、具有计算机及相关专业，3年以上系统运维经验；2、熟练掌握linux，至少掌握一门脚本语言，如：bash、sh、perl、python等，能进行服务器维护脚本的编写；3、熟练掌握基于linux环境的部署、配置、基本的参数调优、故障诊断；4、熟悉服务器各硬件模块、配置，能进行相关的硬件故障诊断、网络异常情况的处理；5、熟练掌握nginx、lvs、haproxy+keepalive＋heartbeat等常用的负载均衡技术；6、熟悉网络知识，了解TCP/IP协议；7、熟悉Kubernetes容器编排技术和Docker技术，有实际的使用与运维经验；8、能够熟练使用MySql数据库，熟练掌握SQL语法，了解索引等知识；9、CI/CD有实战经验，能够利用gitlab和Jenkins进行持续集成和部署；10、具有Spring Cloud微服务框架各个组件，如Eureka，Zuul，Api Getway等运维经验者优先。,"移动互联网,金融",500-2000人,python,成都
数据分析师,https://www.lagou.com/jobs/6724915.html,高新区,12k-22k,上海冰鉴信息科技有限公司,1-3年,本科,人工智能公司+C轮融3亿多+行业top,主要要求：会用python/R进行数据分析的建模工作，有金融风控行业的工作经验。工作地点：成都天府五街工作职责：1、了解MySQL等数据库，能熟练使用SQL；2、熟悉Hive等。3、熟悉Python编程，同时掌握Shell者优先考虑；4、做过数据清洗，特征工程等工作；5、积极沟通，工作细致，主动了解业务需求。职位要求：1) 统计，数学，金融，经济学等相关专业硕士及以上学历，至少一年以上工作经验；2) 具有互联网或金融行业的大数据风控管理策略分析及制定的工作经验；3）具有较强的逻辑推理分析能力，能把复杂的业务问题抽象成数学问题，并找到解决方案；4）数据分析能力强，熟练掌握 R，python， Matlab， SQL者最佳；5）具有优秀的的沟通表达和学习能力，结果导向型，责任心强，具有良好的团队协作精神。,"信息安全,数据服务",150-500人,python,成都
高级大数据工程师,https://www.lagou.com/jobs/5914317.html,温江区,10k-20k,成都延华西部健康医疗信息产业研究院有限公司,3-5年,本科,工作环境好 团队氛围融洽,岗位职责：1. 与相关业务负责人对接，深入了解并抽象业务需求，分析数据应用可行性，形成需求调研和应用可行性设计。2. 通过对业务和数据调研，进行数据模型（数据仓库）设计，协同产品开发，数据分析团队进行开发工作。3. 负责医疗卫生大数据平台系统、架构设计；4. 负责医疗卫生大数据平台的部署、开发和维护；5. 利用医疗卫生大数据平台实现对数据的抽取、清洗、转换，分析、处理、挖掘；6. 数据平台前后端可视化BI系统搭建和开发；7. 保证所负责项目的交互质量，达到质量考核要求。8. 负责建立数据管理工作流程、规范和方法岗位要求：1. 本科以上学历，计算机、电子信息等相关专业，3年以上大数据相关项目经验2. 理解BI开发相关技术，如数据仓库、ETL、OLAP等。3. 熟悉数据仓库模型设计，对数据仓库系统架构非常熟悉并有丰富实践经验。4. 熟悉 ETL 相关工作流程和方法5. 具备完整的大数据领域理论知识和丰富实战项目经验6. 熟悉Hadoop/Kettle/SSIS/Kafka/flume/sqoop/Elasticsearch/Hive/Hbase/ Presto等一种或多种，有大数据开发经验，有大数据运维经验更佳。7. 掌握使用Python/JS/Java进行复杂业务逻辑的数据处理，熟悉Python语言优先8. 至少掌握一种Oracal/SQL server等主流数据库，精通SQL。9. 熟练常用数据挖掘算法和工具优先考虑10. 能够具备很强的数据敏感度和逻辑分析能力11. 有良好的系统性能优化及故障排除能力12. 有带领大数据小组经验者优先13. 有参与过区域/医院HIS、LIS、EMR、PACS等系统建设或数据治理者优先14. 具备主动思维，抗压力强，有高效执行力和敏感度，有事业心和责任心，具备创新能力；15. 有很好的合作能力，善于合作协调沟通，思维敏捷，具有非常好的书面和口头表达能力；16. 具备良好的合作意识，有较强的沟通能力及跨团队协作能力、驱动能力。,"移动互联网,医疗丨健康",150-500人,python,成都
大数据部经理,https://www.lagou.com/jobs/7138032.html,温江区,20k-25k,成都延华西部健康医疗信息产业研究院有限公司,5-10年,本科,舒适办公环境，团队氛围融洽,岗位职责：1.  负责延华医疗大数据产品研发规划，需求分析、架构设计及方案编制，包括数据平台、数据质量，数据产品和数据建设；2. 负责数据仓库、大数据平台、报表可视化的搭建及研发；3. 负责大数据平台运维服务过程中，相关系统优化、问题处理等；4. 辅助产品经理完成产品开发，负责产品技术路线规划以及系统架构、应用架构、技术架构分析和设计；5. 负责建立数据管理工作流程、规范和方法；6. 负责管理大数据研发团队。 岗位要求：1.  本科以上学历，计算机、电子信息等相关专业，5年以上大数据相关项目经验，2年以上团队管理经验；2. 精通Hadoop/Kettle/SSIS/Kafka/flume/sqoop/Elasticsearch/Hive/Hbase/ Presto等主流大数据技术，有大数据开发经验，有大数据运维经验更佳。3. 掌握使用Python/JS/Java进行复杂业务逻辑的数据处理，熟悉Python语言优先4. 至少掌握一种Oracal/SQL server等主流数据库，精通SQL。5. 对于高并发、高可用性、高性能有过实际项目产品经验者优先；6. 有良好的跨部门沟通协调能力，有较强的同理心，能够合理调度资源及时满足和匹配业务需求,"移动互联网,医疗丨健康",150-500人,python,成都
Java开发工程师-基础组件方向,https://www.lagou.com/jobs/6736577.html,武侯区,15k-25k,成都书声科技有限公司,3-5年,本科,五险一金 带薪年假 **项目 周末双休,"【工作职责】 1、 根据公司业务的演进，负责数据源、缓存、消息队列、日志、链路等基础中间件的二次开发和改造，并在业务团队内推进； 2、保持与业务团队的沟通，提炼业务框架内的公共设施，开发适用于不同场景的基础框架脚手架等，让业务团队快速响应业务需求；3、负责代码架构的优化与演进，针对项目的性能持续进行优化【任职资格】  1. 全日制统招本科及以上学历，至少三年互联网行业开发经验； 2. 熟悉Java，以及至少一种脚本语言并且有具体实践经验，包括但不限于 Node.js、Python、Lua； 3. 熟悉Java领域内的常见技术框架, 并且有定制开发能力，包括但不限于 Spring、Dubbo、Netty 等；4. 具备较强的沟通力、协调及应变能力、逻辑性强；5. 工作积极主动，具有较强的抗压能力；6. 较好的抗压能力和团队合作意识。","移动互联网,文娱丨内容",500-2000人,python,成都
Web引擎开发工程师（成都）,https://www.lagou.com/jobs/5651100.html,武侯区,15k-30k,OPPO广东移动通信有限公司,不限,本科,待遇优渥、成长迅速、体系培养,岗位职责：1. 负责web引擎、Web应用运行环境、Web安全等相关领域的研发维护、定制优化；2. 负责HTML5标准跟进以及知识产权策略实施；任职要求：1. 熟悉C、C++语言，熟悉Web开发相关语言，如HTML、JavaScript、Python等；2. 具备较好的计算机基础知识，较好的逻辑分析能力、学习能力，较好的团队协作、沟通能力；3. 有Web引擎、应用研发经验者优先；,硬件,2000人以上,python,成都
运维经理,https://www.lagou.com/jobs/6831240.html,成华区,15k-30k,北京嗨学网教育科技股份有限公司,3-5年,本科,乐观上进的氛围，乐于分享的小伙伴,"岗位职责：1.负责公司基础运维团队技术体系化、团队建设与人员管理等工作；2.负责公司IT基础架构虚拟化、网络、存储、公共组件、网关、防火墙、Linux系统等运维和管理工作；3.负责公司IDC机房、公有云环境、私有云openstack的规划和管理工作；4.负责和业务团队沟通与协作，输出基础技术达成公司战略目标。任职要求：1.统招本科以上学历，5年基础IT架构设计经验，3年以上团队管理经验；2.熟练使用Linux操作系统及基础维护，掌握Shell或者python语言,有实际使用写脚本或代码经验；3、掌握TCP/IP协议，掌握计算机网络知识；4、熟悉运维脚手架工具： ansible、saltstack；5、熟悉互联网基础组件： MySQL、MongoDB、Redis、Zookpeer、Kafka；6、掌握前端开发知识优先；7、熟悉docker容器化等相关编排技术优先；8、熟悉ELK日志系统优先；9、熟悉常用CI/CD工具jenkins；10.具备团队合作精神，积极的工作态度和责任心，良好的沟通和自我驱动学习能力。",教育,2000人以上,python,成都
大数据架构师,https://www.lagou.com/jobs/7183756.html,成华区,20k-35k,北京嗨学网教育科技股份有限公司,10年以上,本科,牛人扎堆，学习交流，完善晋升通道，大平台,"1.精通Java编程，参与过大数据平台相关系统的建设维护2.精通Hadoop(HDFS,Yarn,Hive等)集群架构以及源码，有大数据平台搭建维护经验优先3.熟悉Spark、Flink等流式编程架构及源码，有搭建维护经验优先4.熟悉Shell、Python脚本开发5.有ETL经验，懂数仓建模架构流程",教育,2000人以上,python,成都
测试工程师自动化,https://www.lagou.com/jobs/7106148.html,武侯区,8k-10k,艾迪泰科科技（北京）有限公司,1-3年,本科,六险一金 节日福利 餐补 带薪年假,"技能要求：软件测试岗位职责：1、 负责编写功能测试计划、测试总结、分析报告2、 熟悉项目软件测试的流程，包括参与需求分析、制定测试计划、设计测试用例、执行测试、进行缺陷跟踪。3、 能够带领组员按时交付产品功能测试，并配合开发人员解决问题4、 负责协助TeamLead参与测试团队的建设和管理5、 不断创新，以适应项目交付的测试方法，提高测试效率岗位要求：1、 计算机或其他相关专业本科以上学历2、 英语听说能力良好， 需要和国外技术团队交流，需要完成英文文档3、1-3年以上测试工作经验 。4、熟悉软件测试基础1） 掌握基本和了解mysql, 能使用sql 进行 增，删，改，查2）了解基本的http 协议，3）能使用python语言，了解selenium和 一个测试框架（unitest 或pytest）4）能简单使用linux ,熟悉linux基本命令5、具有良好学习能力、分析能力和解决问题的能力；6、主动性强愿意自学提高自身技术水平 。7、工作认真细致，善于主动优化工作效率；主动学习，学习效率高；记忆力好、责任心强、沟通能力强、有较强的逻辑分析能力，能适应有压力的工作",其他,50-150人,python,成都
测试工程师（社交APP）,https://www.lagou.com/jobs/6015589.html,高新区,8k-12k,四川盛趣时代网络科技有限公司,5-10年,大专,"六险一金,周末双休,朝十晚六,节日福利","岗位职责：1、对游戏社交产品进行功能、接口、兼容性测试；2、根据软件设计需求，设计测试用例，能维护测试用例，并对产品提测合理的意见；3、负责测试方案设计、用例设计及数据准备；4、对缺陷进行跟踪分析，能有效推动开发解决问题；5、能独立搭建测试环境。任职要求：1、五年以上测试web和app相关工作经验, 全日制专科及以上，计算机相关专业，有游戏、语聊、二次元app测试经验者优先考虑；2、会使用fidder，jmeter，postman工具等；3、熟悉能独立编写测试用例，执行测试，跟踪测试缺陷；4、熟悉测试流程，熟悉能独立编写测试用例，较强的测试设计能力，执行测试，跟踪测试缺陷，且对web系统架构基础了解。5、具备较强的学习能力和良好的沟通能力，具有强烈的责任心和执行力。6、 有一定的编程基础，熟悉一种以上测试脚本语言（Python），有app自动化测试框架和使用经验者优先；","移动互联网,电商",150-500人,python,成都
AI研发工程师,https://www.lagou.com/jobs/5879679.html,高新区,25k-30k,成都华栖云科技有限公司,3-5年,本科,"大平台,弹性工作,补充商业险",岗位职责：1、从事AI应用集成和相关算法调研，算法实验和研究工作2、负责相关应用集成和相关领域算法和应用研发岗位要求：1、扎实的数学基础和逻辑思维能力2、熟悉PYTHON和C++开发3、熟悉常用深度学习算法和网络模型，有实战经验和一定创新能力4、有以下经验之一(1)、语音识别(2)、语音合成(3)、行为或动作识别(4)、场景识别(5)、对象跟踪,"移动互联网,企业服务",150-500人,python,成都
运维工程师,https://www.lagou.com/jobs/4897689.html,武侯区,6k-12k,四川万益能源科技有限公司,1-3年,本科,"六险一金,用餐补贴,年度体检，节日礼金","岗位职责：1、保障线上业务稳定, 快速处理线上故障2、负责运维后台架构、devops工具链、监控、日志系统等持续优化3、协调开发、测试、运维等各团队，提高产品的线上运行质量4、负责运维相关标准化工作5、牵头技术选型评估，技术方案，疑难技术问题攻克6、对行业新技术保持敏锐的感知，对公司未来技术方向提供建议7、负责公司办公和数据信息安全8、负责运维部门和团队日常管理任职资格：1、计算机本科及以上学历，2年以上系统运维经验, 优秀的架构设计和优化能力2、熟练使用Shell/Python/Go/Java中的至少两种语言进行运维自动化工具开发3、熟悉LVS/Nginx/Keepalived/Haproxy等负载均衡软件的安装配置调优4、熟悉Tomcat/Redis/Mysql/MongoDB/ElasticSearch/Kafka/RabbitMQ等软件安装配置调优5、理解devops, 熟悉jenkins Pipeline、Gitlab、Nexus、K8s等devops工具6、熟悉Zabbix、Prometheus等常用监控工具7、对网络知识和设备有一定的经验和了解8、对数据库：mysql, oracle有一定运维能力9、良好的主动性、团队合作能力、沟通能力10、 具有三级等保实施经验，熟悉三级等保相关要求和规范11.有学习的欲望，具备良好的学习能力和解决问题的能力加分项1.有DevOps运维工作经验优先考虑。2.有数据库运维工作经验或OCP、CMDBA证书优先考虑3.具备一定的代码能力优先考虑4.熟悉hadoop大数据生态技术栈","企业服务,数据服务",50-150人,python,成都
