job_name,job_url,job_location,job_salary,job_company,job_experience,job_class,job_given,job_detail,company_type,company_person,search_key,city
Android开发工程师,https://www.lagou.com/jobs/6650030.html,西青区,10k-20k,天津畅索软件科技有限公司,3-5年,本科,五险一金，带薪年假，员工体检，团建旅游,工作职责：1、根据需求负责android平台framework层Service、JNI、app等相关内容开发调试；2、负责Android系统的优化、精简和跨平台移植等工作；3、负责Android系统的维护和扩展，以及相关问题分析定位；4、负责Android系统的新技术跟进和相关模块的文档编写；任职资格：1、熟悉Android框架、JNI开发、熟练掌握Java、C和C++语言开发；2、具备1年以上Android framework层的独立开发经验；3、熟悉android系统Service、Binder、callback等机制；4、熟练使用android调试工具，能快速定位问题；5、工作勤奋、敬业、积极主动、具备强烈的责任心和团队合作精神；,软件开发,150-500人,android,天津
Android开发工程师,https://www.lagou.com/jobs/6012664.html,河西区,15k-20k,中交智运有限公司,3-5年,本科,央企福利,岗位职责：1、负责android应用的迭代、修改、优化和维护工作。2、参与项目需求分析、产品功能讨论以及技术方案设计。3、完成相关组件、关键机制、流程等文档的沉淀。4、负责高质量的设计和编码，参与项目架构设计与实现。5、与UI设计团队紧密配合，保证产品用户体验。任职要求：1、全日制本科及以上学历，中共党员优先考虑，计算机相关专业，3年以上android开发经验；2. 具有扎实的Java语言开发基础和良好的编码习惯，熟悉常用的数据结构以及算法；3. 熟练掌握Android的UI编写、控件、以及framework和API的使用，能封装复用常用组件、降低代码耦合；4. 熟悉常用的安卓开发框架，熟悉热修复技术，插件化开发；5、具备良好的团队合作精神和创新意识，较强的责任心；可承受一定工作压力。,"移动互联网,物流丨运输",2000人以上,android,天津
android开发工程师,https://www.lagou.com/jobs/7035075.html,北辰区,8k-13k,天津鹏达金融外包服务有限公司,3-5年,本科,法定节假日，前景好,工作职责：1.负责公司android端APP的开发以及维护；2.负责公司项目新的需求分析，功能设计及研发工作;3.编写相关的开发文档，测试文档等；任职要求：1.统招本科及以上学历，计算机或软件工程相关专业，3年以上 android开发经验；2.熟练掌握android架构，及各组件及类库的使用；3.熟悉TCP/IP网络通信，多线程IO模型等；4.熟悉地图应用（定位，轨迹，里程计算等）的开发与优化；5.有责任感，具有较强的分析和解决问题的能力，能够独立完成android端的开发及调试工作；,金融,150-500人,android,天津
Android工程师(J10282),https://www.lagou.com/jobs/7080124.html,滨海新区,8k-10k,中标软件有限公司,1-3年,本科,国有企业 薪资待遇高 发展前景好,,"信息安全,移动互联网",150-500人,android,天津
移动前端开-Android/ios(J23156),https://www.lagou.com/jobs/6650764.html,红桥区,15k-30k,捷信消费金融有限公司,不限,本科,五险一金、带薪年假、补充医疗保险,Duties and Responsibilities:Requirements:Staff Welfare:,金融,2000人以上,android,天津
Android高级研发工程师,https://www.lagou.com/jobs/6838583.html,西青区,15k-20k,天津市莱斯宝科技有限公司,3-5年,大专,海外市场，五险一金，合资公司，年终奖金,职位要求：工作职责：1、具有4年以上Android实际开发经验，计算机或相关专业专科以上学历；2、精通Java语言，熟练掌握数据结构、算法及软件设计等；3、熟悉Android平台UI设计，熟悉常用布局，包括各种控件、布局方式、动画和自定义控件的使用方法；4、熟悉Android下网络通信机制，对Socket通信、TCP/IP和http/https有一定理解和经验；5、熟悉常用Android应用开发框架，并了解其实现原理；6、熟练运用Android的API，掌握Android中UI设计、后台运行、数据存储、分辨率、版本适配等的原理；7、具备良好的面向对象设计思想，熟悉软件工程和敏捷开发模式；具备以下条件者优先：1.有多终端开发、服务端开发、跨平台开发经验者优先；2.具备多个核心模块的设计实现经验，且项目成功上线，运行良好；3.有优秀项目案例或者优秀Android框架设计经验优先。团队亮点：1、优秀+无限潜力的创业公司，我们是高速奔跑，逆风飞翔，持续增长的团队；2、我们价值观驱动，客户**，真诚客观，我们拥有一群主动承担责任，合作共赢的伙伴；3、大家勤恳板砖，努力生活，我们测试是软妹纸，程序员是文艺男，周末邀你一起打游戏；4、在饭团，你将感受到轻松的人际氛围，扁平化的管理，舒适的办公环境和技术大牛们一起成长的快乐。 职位亮点：1、纯粹的技术氛围，团队都是代码爱好者，我们在代码上相亲相爱；2、业务发展迅速，涉及很多复杂的业务系统搭建与设计，更多的挑战在等你；3、有深度的自营产品，多变的海外市场，让你拥有更好的产品思维和逻辑；4、随着公司的高速可持续发展，更多资本进入，获得巨大的成功和回报。 我们希望你:1、“以梦为马”：愿意接受挑战，是有梦想的程序猿；2、“细节控”：追求细节和完美的“处女座”；3、“不拖延症”：快速解决实际问题，没有拖延症；4、“ 超级Geek ”：以创新技术为使命的人；5、“好奇心强”：关注前沿领域，对新技术充满热情。 工作环境:1、养生绿植3、舒适键盘4、Mac办公设备5、零食屋6、娱乐室（新办公场所即将上线） 员工福利:1、五险一金2、年终奖3、带薪年假4、节日福利5、每周三下午茶6、度团建节日尾牙7、深夜滴滴补助  8、公司烛光晚餐补助   岗位职责：1、负责产品Android端应用的架构和开发；2、主导技术攻坚；,"移动互联网,消费生活",50-150人,android,天津
android开发工程师,https://www.lagou.com/jobs/6620327.html,武清区,10k-20k,玛雅六月新（天津）电子商务集团有限公司,5-10年,本科,五险一金，有双休，免费住宿,职责：1.参与海外营销APP产品讨论，制定产品计划，验证产品效果；2.协调团队成员，保证每周的产品快速迭代；3.解决产品技术难题，及时采纳新技术，保证团队的技术领先；4.把用户当粉丝，对用户反馈的问题，及时响应和解决。要求：1.四年以上Android开发经验；2.作为主力开发过至少一个Android应用，有多终端适配经验；3.深入理解面向对象的设计模式，对数据结构、基本算法熟练掌握；4.了解Android平台内存管理机制、进程管理机制、任务管理机制；深入了解Android UI事件传递、布局、绘制等原理，能够编写自定义UI控件；5.熟悉Android下网络通信机制，对Socket通信、TCP/IP和HTTP有一定理解和经验；,电子商务,2000人以上,android,天津
初级安卓开发工程师,https://www.lagou.com/jobs/7163714.html,北辰区,5k-8k,天津市拓甫网络科技开发有限公司,应届毕业生,本科,五险一金、周末双休、年底双薪，年度体检，,岗位职责：1、负责android客户端软件的产品开发与维护；2、根据项目任务计划按时完成软件编码工作。任职要求：1、应届毕业生，全日制本科（统招二本）及以上学历，计算机相关专业；2、 熟悉Java，具有Android应用程序开发经验；3、良好的编程风格，扎实的编程基础和数据结构算法基础；4、有强烈的责任心，工作积极主动，善于沟通和团队合作；      5、综合素质优秀者条件可适当放宽。,"移动互联网,信息安全",50-150人,android,天津
安卓android,https://www.lagou.com/jobs/6788498.html,滨海新区,15k-20k,狮桥融资租赁（中国）有限公司,3-5年,大专,互联网 人才公寓 六险一金,"一、任职要求：1、大专及以上学历，计算机或相关专业，3年以上android开发经验；2、熟悉 React Native开发经验者优先；3、精通常用软件架构模式，熟悉数据结构，多线程，运行时、动画、内存管理、本地存储、网络   编程（Socket、http/webservice）等；4、具备优秀的沟通和协调能力，良好的服务精神及团队合作能力，能够承受较大工作压力；5、发布过作品者,有物流产品开发经验者优先考虑。二、岗位职责：1、负责公司产品android端开发，上线及维护迭代；2、能按照项目计划，按时提交高质量的代码，完成开发任务；3、参与移动平台软件框架的研究、设计和实现、关键技术验证和选型等工作；4、规范编写设计和维护文档；负责相关技术文档编写，并协助相关产品经理进行相关系统产品文档的编写；三、福利待遇：1.工资：15-20K，单双轮休；2.六险一金（全国任选购买地），带薪休假（法定假日、年假、婚假、产假、陪产假等），提供免费人才公寓;3.在职提升：公司为员工提供各种培训机会，狮桥学院根据员工的岗位类别，组织各种业务、工作、能力提升等相关内部培训与户外拓展，助力员工晋升发展；4.公司在不同季度将举办各类文娱活动，增进部门间沟通，愉悦身心；【备注】此招聘为公司直招，狮桥物流及其下属分公司在招聘过程中不收取任何费用、押金等，敬请各位求职者知晓，以免受骗损失财物。狮桥物流期待您的加入！若有意向请直接投递简历，若通过筛选，我司将在5个工作日内安排您进行相关面试！","金融,物流丨运输",2000人以上,android,天津
android开发工程师,https://www.lagou.com/jobs/7183782.html,东丽区,5k-10k,天津市联桥智能科技有限公司,不限,不限,移动端开发,1、负责Android端软件的设计、开发和维护；2、精通Android多线程、各类UI组件、图像动画、网络、文件系统、定位等模块的使用和开发;3、精通Android的线程机制，能够熟练使用各种安悉Android系统的线程类，及service、广播等;4、负责Android产品的性能优化、兼容性优化和故障排查等；5、拥有摄像头控制，视频处理，文件流，地图定位，通讯，直播等开发经验发经验优先 ;,物流丨运输,15-50人,android,天津
Android开发工程师,https://www.lagou.com/jobs/6827793.html,西青区,7k-11k,图锐（北京）信息技术有限公司,1-3年,本科,五险一金、节假日福利、团队活动等,1、2年Android开发经验，熟悉Java语言，数据库；2、熟悉WEB前端技术，熟练安卓加载html网页机制，熟练安卓原生与js互相调用机制；3、开发基础良好，理解设计模式，熟悉Android项目构建过程；4、对Android的UI开发非常熟悉，熟悉xml，http，TCP/IP，SOCKET等协议；5、熟练使用第三方框架，例如Gson解析，网络请求，第三方支付，分享，图片处理，上传等；6、熟练使用Android调试工具，可以快速定位查找问题，有相关的网络优化、内存优化、性能调优经验；7、熟练掌握Android的API，理解Android的体系结构，掌握Android中界面绘制，后台运行，数据存储等的原理；8、良好的编程习惯，精通数据结构和面向对象程序设计，有兴趣和能力编写高效而整洁的代码；9、有GIS开发经验者优先。,电商,15-50人,android,天津
Android开发工程师,https://www.lagou.com/jobs/6764535.html,东丽区,15k-16k,杭州远传新业科技有限公司,3-5年,本科,1.,岗位职责：1、基于Android平台进行软件产品开发；2、参与软件的分析、设计、编码和测试过程；3、参与项目重点、难点的技术攻坚；4、跟进Android平台的新技术并应用到软件产品中；5、根据用户反馈和统计数据调整软件产品，提高用户体验；岗位要求：1、2年以上Android开发经验，有独立开发应用的能力；2、熟悉Android各组件生命周期、多线程运作机制，有性能和内存优化经验优先；3、熟悉Android平台下界面、服务、数据库、网络等开发技术；4、思路清晰，具有良好编码风格和团队合作精神；5、有在应用市场发布过作品的优先。,移动互联网,150-500人,android,天津
Android开发工程师,https://www.lagou.com/jobs/3664938.html,滨海新区,5k-7k,北京卡雷尔机器人技术有限公司,3-5年,本科,"晋升机会大,发展空间广,公司福利",技能要求：AndroidStudio，sdk，SQL，MVC框架，java，Android移动开发1.熟练掌握JAVA语法，有扎实的JAVA基础。2.能独立进行应用程序开发和移植。3.熟悉Android开发平台及框架，熟悉AndroidGUI程序开发，熟悉自定义组件，熟悉JSON/XML。4.熟悉activity、service的使用，了解其生命周期，熟练使用广播发送/接收消息，熟练掌握异步监听机制。5.具备快速学习能力、较强的逻辑思维能力、分析问题及解决问题的能力；心智成熟，性情稳定，乐于钻研技术。6.善于沟通，工作认真负责，具备高度的责任心和持续的进取精神，具备良好的团队合作精神。7.可接受加班优先,"硬件,其他",15-50人,android,天津
Android前端工程师,https://www.lagou.com/jobs/5613098.html,河西区,8k-12k,天津亨嘉口岸物流有限公司,不限,不限,"免费工作餐,年终奖,五险一金","岗位职责：1. 根据公司要求，基于Android平台进行应用程序的开发；2. 根据项目任务计划,按时完成软件高质量编码和测试工作；3. 根据产品功能模块设计，编码实现各模块功能并确保开发质量;4. 参与移动平台软件框架的研究，设计和实现、关键技术验证等工作；5. 规范文档的编写、维护，以及其他与项目相关工作。任职要求：1. 计算机或相关专业本科以上学历，1年以上Android平台开发经验；2. 熟悉Android开发平台框架及各种特性，能够熟练掌握Android各种控件的使用特性；3. 能够熟练使用glide, eventbus, okhttp, rxjava等常用第三方库;4. 深度参与过移动产品开发，具有独立开发相关模块的经验；5. 具有良好的面相对象编程思想，熟练运用常见的设计模式；6. 精通常用软件架构模式，熟悉各种算法与数据结构、多线程、网络编程等，能够不断优化产品的性能，提高用户体验；7. 熟悉SVN或Git等相关的代码管理工具。","电商,移动互联网",150-500人,android,天津
安卓开发工程师,https://www.lagou.com/jobs/5832578.html,河东区,8k-15k,天津市倍格德智能科技有限公司,1-3年,本科,五险一金、带薪年假,"职位描述：1、负责智能手机应用相关的技术研究2、从事与产品化相关的技术支持3、负责Android平台的浏览器开发4、在Android手机上设计并开发应用程序；5、Android平台框架层的维护以及扩展。 6、负责Android项目的开发工作；7、负责Android项目的架构设计、方案的制定；8、跟进Android的新技术发展。编写设计开发及实现文档；9、根据产品功能需求设计并完成软件实现；10、参与产品需求分析并制定技术实施方案；任职要求：1、计算机、通信、电子等相关专业本科以上学历，一年以上工作经验；2、熟悉Linux操作系统，熟悉c++/Java编程技术，掌握Android系统网络编程；3、具有J2ME或Java开发经验，熟悉ANDROID手机软件架构，熟悉Android平台MMI软件开发；4、了解基本软件开发流程，了解Clear Case/Clear Quest/UML等开发工具；5、要求熟悉ANDROID手机软件架构，精通ANDROID平台MMI软件开发，能独立进行应用程序开发和移植；6、熟悉C++/C#, MSSQL/MySQL数据库开发；熟悉多线程、Socket或ACE等网络通信编程技术；7、熟悉大疆Mobile SDK、Onboard SDK、Payload SDK优先考虑；8、具备良好合作态度及团队精神，并富有工作激情、创新力和责任感；9、喜欢挑战高难度项目；有较好的学习能力、沟通能力，能承受一定的工作压力；","企业服务,数据服务",50-150人,android,天津
安卓开发工程师,https://www.lagou.com/jobs/6857378.html,南开区,8k-10k,天津口袋广告有限公司,1-3年,大专,待遇优厚,1.负责Android客户端产品的架构设计、功能开发2.根据项目任务计划按时完成软件编码、测试及bug修复3.改善软件的易用性，提升用户使用体验。岗位要求：1.具有扎实的java基础，了解UI事件传递、布局、绘制、动画等原理2.熟悉Android各种widget组件，能根据项目要求开发自定义控件3.会熟练使用搜索引擎，不只是百度得会google4.有IM开发经验者优先,"移动互联网,游戏",15-50人,android,天津
中级安卓工程师,https://www.lagou.com/jobs/6597106.html,西青区,8k-10k,天津布尔科技有限公司,3-5年,大专,绩效奖金 节日福利 周末双休 五险一金,岗位职责：1.参与业务需求设计与讨论，基于Android平台进行应用程序开发；2.根据产品需求完成Android项目设计、编码、测试和优化；3.编写相关的开发文档，如技术文档、设计文档、软著等；4.研究新技术以满足产品需求，根据开发过程中的体验对产品提出改进建议。完成上级分配的其他任务。任职要求：1.至少3年以上Android开发经验，有蓝牙通讯开发经验者优先；2.熟练掌握Android SDK、内存优化、多线程、进程通信机制；3.熟悉Android常用框架，如Rxjava、Retrofit、Netty、Okhttp等4.熟练掌握http和socket通讯；5.熟悉蓝牙、USB、串口通讯；6.熟悉敏捷开发流程，能够独立完成一个项目；7.具备良好的编码习惯，工作态度认真，能够依据业务需要学习必要的职业技能；8.熟悉汽车行业相关知识者优先，能独自驾驶汽车者优先。,"移动互联网,数据服务",15-50人,android,天津
终端应用开发工程师（YD-TJ）G00114,https://www.lagou.com/jobs/6977469.html,南开区,18k-25k,成都卫士通信息产业股份有限公司,5-10年,本科,交补、餐补、高温假、旅游费、商业保险等,,"企业服务,信息安全",500-2000人,android,天津
软件测试工程师（YD-TJ）G00113,https://www.lagou.com/jobs/6977441.html,南开区,15k-20k,成都卫士通信息产业股份有限公司,3-5年,本科,交补、餐补、高温假、旅游费、商业保险等,,"企业服务,信息安全",500-2000人,android,天津
交互设计师,https://www.lagou.com/jobs/6304309.html,南开区,7k-12k,天津市神州商龙科技股份有限公司,3-5年,大专,福利待遇优厚,"1、负责网站、移动平台等功能的用户体验设计； 2、与产品研发团队紧密合作，确保产品交互设计、操作体验的良好顺畅； 3、参与产品需求、原型的设计，协同视觉、UI设计流程及体验管控； 4、跟踪产品用户反馈，收集和挖掘改进需求，持续提升产品用户体验； 5、完成上级交办的其他工作。任职要求： 1、大学专科及以上学历，两年及以上用户体验设计工作经验，艺术、绘画、工业设计、交互设计、心理学、视觉设计等相关专业，英语四级； 2、熟悉iOS、Android等跨平台的界面设计规范，能独立设计Web端、移动端产品整体交互流程、信息架构、流程设计和原型设计； 3、对移动端的用户体验有深入的理解，对用户体验和易用性有敏锐的把握能力； 4、具备扎实的美术功底、独到的艺术感受和优秀的视觉设计能力，精通使用Axure,Photoshop,Lllustrator等设计软件； 5、有责任感，良好的沟通能力，能在协作中准确传达你的设计意图，有客户端界面设计经验者优先；","移动互联网,消费生活",500-2000人,android,天津
嵌入式软件开发工程师,https://www.lagou.com/jobs/6993399.html,西青区,15k-25k,天津畅索软件科技有限公司,3-5年,本科,五险一金，带薪年假，员工体检，团建旅游,"岗位职责：1. 负责Android系统下的BSP开发和设计2. 移植和定制Linux Kernel/Bootloader和BootRom,3. BSP bring-up 及驱动开发（LCD、TP、BT/WIFI GPS等）4. 驱动性能优化，稳定性优化及日常驱动问题解决，驱动新技术的探索和调研岗位要求：1. 本科以上学历，计算机及相关专业2. 1年以上的驱动开发经验，精通C/C++,熟悉常见数据结构3. 有LCD,USB,BT,WIFI,GPS,Audio等驱动开发经验4. 熟悉ARM平台下的linux内核移植与驱动程序开发的流程5. 熟悉测试设备，如示波器/逻辑分析仪，JTAG调试器，能看懂原理图，有一定的硬件debug能力6. 熟悉Linux和安卓体系架构优先",软件开发,150-500人,android,天津
软件测试工程师,https://www.lagou.com/jobs/7131459.html,北辰区,8k-12k,天津市拓甫网络科技开发有限公司,3-5年,本科,五险一金、周末双休、年底双薪，年度体检，,技能要求：软件测试岗位职责：1.参与产品需求文档的评审工作，并能够提出合理的质疑；2.编写测试计划、测试策略等，根据测试的目的和内容设计测试流程；3.编写测试用例，设计测试数据及预期结果，确保测试目的的达成，能较好的保证测试用例的覆盖度及深度；4.评估软件特性与缺陷，确保测试目的的达成，并反馈测试意见，协助修正测试Bug；5. 整理测试文档，编写软件测试报告。任职要求：1.本科及以上学历，计算机或相关专业；2. 5年以上工作经验，3年以上测试工作经验，具有大中型系统项目经验者优先；3. 精通B/S结构及Web测试，熟悉Android、iOS等主流系统测试；4.可搭建配置 web/Android/IOS 产品的测试环境；5.熟悉数据库，能编写 SQL 脚本6.熟练使用主流bug管理系统；7.思路清晰，逻辑思维能力强，具有很强的问题细节捕捉、分析和解决能力。,"移动互联网,信息安全",50-150人,android,天津
IT 全栈开发技术专家(J23535),https://www.lagou.com/jobs/6882733.html,红桥区,20k-40k,捷信消费金融有限公司,10年以上,本科,Java开发 全栈开发 移动端开发,,金融,2000人以上,android,天津
IT Expert Developer-全栈,https://www.lagou.com/jobs/6795062.html,红桥区,20k-40k,捷信消费金融有限公司,5-10年,本科,全栈 前端 后端 移动端,"Responsibilities:• Performs coding, unit testing and documentation of software units defined by the design document.• Participates in software modification during integration testing.• Makes commitments that fall within the tasks given by authorized personnel. Participates in proposing changes that make the system more efficient and/or reduce operation or maintenance cost.• Develops efficient software within given time frame.• Responsible for resolve complex technical difficulty.• Wise or skillful for at least on one technical domain and can give some constructive advice to team lead and architect.• Responsible for help team lead and architect practice road map.• Responsible for training team and help team promote technical skill.Requirements: a. EducationBachelor degree or above in Information Technology or comparable.b. Experience/skills• Expert as Java technical, full stack technical developer with Android, iOS, web technology such as JavaScript, HTML5, familiar for some original code, such as Spring, JDK, ES6, Android SDK, etc.• In-depth understanding for the code design, and good with different view, such as OOP, POP, FP, etc.• Strong sense and knowledge for the program refactor design.• At least 10+ years development experience, 5+years at least for the core coding design and development.• 3+years head Internet company, such as BAT, etc. and acting as the core technical working, such as Alibaba technical P7+ level.• Experience for the Front End, SDK design, such as Android SDK, JS SDK.• Passion for the development working, join some open source project is more good, such as join some GitHub open project.• Good communication skill with technical and none-technical scenario.• Strong troubleshooting and problem-solving sill, like the challenge for the high press.• Have some computer industry contribution is better, such as core developer for the familiar system or application, such as Java community contribution.• Other development language, such as .net. python, is better.c. English Request• Literacy for English.• Basic communication with English.",金融,2000人以上,android,天津
