job_name,job_url,job_location,job_salary,job_company,job_experience,job_class,job_given,job_detail,company_type,company_person,search_key,city
大数据开发工程师,https://www.lagou.com/jobs/6992876.html,岳麓区,13k-18k,中和农信项目管理有限公司,3-5年,本科,年底多薪 七险一金 大牛带队,"岗位职责：1、参与大规模数据系统的架构设计和应用，主要面向信贷业务方向；2、负责数据的开发和治理，满足可扩展性等业务指标；3、负责BI报表实现和数据服务需求；岗位要求：1、大学本科学历及以上；2、熟悉SQL,丰富的ETL设计和开发经验；3、对大数据理论、数据仓库理论、行业应用有一定的认识与研究，熟悉大数据相关技术；4、了解Hadoop各组件的原理和实现，具备故障排查能力，有很好的技术敏感度和风险识别能力；5、有阿里云大数据平台开发经验或金融风控领域的优先。","移动互联网,金融",2000人以上,hadoop,长沙
大数据开发工程师,https://www.lagou.com/jobs/6893657.html,芙蓉区,8k-16k,中通服创发科技有限责任公司,3-5年,本科,双休，项目绩效奖金，一年两次调薪机会。,1.3年以上大数据平台开发相关经验2.熟悉大数据相关工具：如Hadoop、Hive、Hbase、MapReduce、pig、MPP等，并数量搭建相关集群环境3.有基于spark streaming/flink/storm实时数据流处理经验，对大数据平台处理流程与机制有深入全面的了解和把握4.熟悉Spark/Map-Reduce/Hadoop/Flink/storm分布式计算框架，进行海量数据模型设计、数据ETL开发5.熟悉大数据架构，有实际大数据项目落地经验6.熟悉java，python开发语言7.工作积极主动、有责任心,"移动互联网,电商",150-500人,hadoop,长沙
大数据开发,https://www.lagou.com/jobs/7179339.html,天心区,6k-8k,南京迈特望科技股份有限公司,1-3年,大专,大平台,大专及以上学历，1年以上工作经历；有数仓开发经验，会Oracle，DB2、mysql等关系型数据开发，会hive，hbase，Hadoop开发,"移动互联网,人工智能",500-2000人,hadoop,长沙
大数据开发,https://www.lagou.com/jobs/6896048.html,岳麓区,12k-20k,中兴通讯股份有限公司,3-5年,不限,大数据,1.端到端负责公司大数据应用产品设计、开发、部署、运营2.完成技术难点的攻关及大数据平台新技术的调研及选型任职要求：1、全日制本科及以上学历，计算机相关专业，扎实的Java语言基础和Linux编程基础； 2、3年大数据相关系统研发经验，有java后台开发经验和Flink开发经验者优先； 3、对大数据相关组件：Hadoop、Spark、Hbase、Hive、Kafka、Flume、Kylin、ElasticSearch等架构与底层实现有深入理解，； 4、具备构建稳定的大数据基础平台的能力，具备数据收集、数据清洗、数据仓库建设、实时流计算等系统研发经验； 5、工作有计划性，责任心和执行能力强，具备高度的责任心、诚信的工作作风、优秀沟通能力及团队精神。6、 对技术有热情，有不错的数据思维和敏感度，有一定的数据分析能力优先； 7、具备强烈的工作责任感，喜欢钻研，态度乐观，团队意识强。,"数据服务,信息安全",2000人以上,hadoop,长沙
数据开发工程师（长沙） (MJ000396),https://www.lagou.com/jobs/7136038.html,芙蓉区,8k-15k,杭州玳数科技有限公司,1-3年,本科,阿里系创业、云计算生态、餐补、双休,1、负责数据整合以及数据模型的建立、维护、优化； 2、负责大数据项目的开发、测试和运维工作； 3、负责数据报表的开发、维护工作；4、项目交付过程中的开发文档编写；5、其它安排的事项。职业要求：1、计算机、软件工程、电子信息相关专业背景，1至3年左右工作经验（优秀的应届生也可考虑）；2、熟悉Oracle/MySQL/SQL Server(至少其中一种)等数据库，掌握SQL语言；3、熟悉Hadoop/Hive/Spark/Flink（至少其中之一）等大数据平台/工具，有Flink开发经验可优先考虑；4、了解常见的数据模型，有较好的开发习惯和编程规范；5、有Java或Python开发经验，会使用常用的开发框架；6、有很强的主动学习能力，理解能力，有大数据项目经验优先；7、较好的沟通能力，做事踏实，服从工作安排，接受出差。,数据服务,150-500人,hadoop,长沙
大数据开发工程师,https://www.lagou.com/jobs/7214772.html,岳麓区,10k-15k,湖南德翌成信息技术有限公司,3-5年,不限,周末双休+入职即购买五险一金,工作职责： 1、参与数据调研、数据治理规划，梳理数据资产；2、负责数据采集、数据标准化处理，为团队提供优质数据；3、负责数据治理工作，包括但不限于模型设计开发、数据质量管理、元数据管理、数据安全管控、数据血缘分析以及数据服务治理；4、负责基于大数据hadoop生态及阿里云生态的ETL开发任务；5、管理并优化海量数据处理过程，包括但不限于离线数据处理、实时数据处理；6、配合PM完成数据模块的交付，及时满足客户现场的数据开发需求任职要求：1、2年以上大数据项目开发经验，对数据治理有一定的认知和项目经验；2、熟练掌握hadoop生态的开发技能，比如hive、spark、flink、kafka、hbase等，有二次开发经验优先；3、熟练掌握关系型数据库（如MySql或Oralce等），至少掌握一种nosql数据库；4、熟悉linux操作系统，会使用shell、python中的至少一种脚本语言，熟练掌握java、scala、python中的至少一种编程语言5、对数仓建设理论有充分的理解，具备利用Hive或MPP构建大数据仓库的设计能力，包括对数据分层标准、数据模型标准、主题划分标准、ETL开发标准等的设计和编制；6、对数据敏感，有数据分析、BI可视化、算法开发经验者优先；7、良好的沟通和理解能力，思路清晰，善于思考，能独立分析和解决问题，责任心强，具备良好的团队合作精神和承受压力能力。,软件开发,15-50人,hadoop,长沙
数据开发工程师,https://www.lagou.com/jobs/7176199.html,岳麓区,10k-13k,苏州工业园区凌志软件股份有限公司,3-5年,本科,无加班，朝九晚五，节假日福利优厚，晋升大,岗位职责：   1.修改并测试数据报送流程中的sql脚本   2.优化数据报送流程相关sql脚本   3.开发新的报送流程SQL脚本 任职要求：   1.精通oracle，mysql等关系型数据库脚本开发   2.熟练掌握shell，脚本开发   3.熟悉hive，presto，对大数据相关组件有所了解  4.python，java，web，hive，有一项技能很擅长就可以,金融,2000人以上,hadoop,长沙
大数据开发工程师,https://www.lagou.com/jobs/3521074.html,岳麓区,10k-15k,北京易观智库网络科技有限公司,3-5年,本科,五险一金、双休、项目奖金、水果下午茶等,工作职责：1、负责提升数仓的性能，关注数据质量，设计数据稽核工具；2、负责ETL关键任务的优化设计，协助解决开发过程中的技术难题；3.   负责通过数据分析和挖掘，支撑业务团队数据需求。任职要求：1、本科以上学历，至少3年以上大数据工作经验；2、精通java 和 SQL；熟悉Kafka、MR、Hive、Hbase 等；有丰富的spark项目经验；3、具有很强的学习、分析和解决问题能力、良好的团队意识和协作精神，有较强的内外沟通能力；4、具有丰富的企业级数仓设计和的建模经验；5、具有移动互联网数据分析类产品的开发经验优先。,"移动互联网,数据服务",150-500人,hadoop,长沙
大数据开发工程师,https://www.lagou.com/jobs/6679885.html,芙蓉区,15k-20k,长沙二三三网络科技有限公司,5-10年,大专,"年底双薪,五险一金,周末双休,员工旅游",岗位职责：1、负责大数据的日常开发包括架构和日常的业务；2、与业务方沟通日常的需求梳理需求文档产出技术方案；3、支撑用户行为分析用户画像智能推荐、数据可视化系统的开发和建设。 任职要求：1、深刻理解HDFS分布式文件系统存储结构和高可用原理；2、能运用scala进行spark RDD，spark streaming编程； 3、熟练掌握hadoop mapreduce计算框架编程，对yarn的资源调度，作业监控了解； 4、深刻了解Spark运行机制掌握spark streaming编程，对定时批量任务处理； 5、熟悉flume，kafka等日志收集以及kafkaconnect实时多系统导入导出工具等分发框架的使用，能够将他们和storm、spark进行整合进行数据的实时处理； 6、能够熟练运用hive数据仓库工具，对日志数据进行查询，统计等数据操作，并且有一定的数据优化经验； 7、能将hive和spark sql进行整合，进行数据查询等相关操作； 8、熟悉hbase数据库的使用及其编程；9、熟悉ELK技术栈，了解ElasticSearch，Logstash的整合使用； 10、掌握Sqoop数据迁移工具的使用，能熟练的将数据从不同的存储介质进行迁移。其他薪资福利：绩效奖金+季度奖金+项目奖金+年底双薪+年终奖金+五险一金+周末双休+节日福利+员工旅游,"移动互联网,教育",150-500人,hadoop,长沙
大数据开发工程师,https://www.lagou.com/jobs/7097847.html,长沙县,13k-26k,三一汽车制造有限公司,3-5年,本科,福利待遇，发展前景,职责：1. 参与车联网大数据框架的搭建；2.参与车联网数仓的建设。3.分析生态圈数据需求，整合生态圈数据，支持产品创新 。任职要求：1.计算机或相关专业本科以上学历，有3年以上工作经验；2.熟悉数仓及数据中台建设；3. 掌握 sql server、mysql等关系型数据库技术；4. 精通hadoop、flink，spark、Druid、hbase等大数据存储和计算的相关技术；6.精通java、scala、sql等编程语言；7.精通linux、windows等常用操作系统；8.有车联网项目开发经验的优先考虑、有互联网大数据项目开发经验优先考虑。,汽车丨出行,2000人以上,hadoop,长沙
大数据开发工程师,https://www.lagou.com/jobs/7111610.html,岳麓区,12k-20k,中兴通讯股份有限公司,3-5年,本科,5G先锋,1、具有5年Java开发经验，熟悉Spring生态，掌握Hibernate、Mybatis任意一种ORM框架，掌握Oracle、Mysql数据库。　　2、具有2年以上的大数据开发经验，熟悉大数据、数据仓库，分布式架构技术理论，具有大数据整体系统架构设计和实战经验，熟悉CDH、HDP、TDH至少一款大数据产品，有从无到有建设大数据平台经验者优先;　　3、熟悉大数据组件的开发、搭建、维护以及性能优化;　　4、较强的开发能力，必须熟练使用相关开发语言(Java/Python/Scala/Shell等)，熟悉大数据生态、关系数据库和NOSQL数据库、Linux等相关知识，能够独立完成并指导初级开发人员完成大数据相关的技术实现和调优;　　5、熟悉Hadoop、Hbase、Hdfs、MapReduce、Yarn、Zookeeper、Hive、Impala、Spark、Flink、Kafka、Flume、Kylin、Phoenix等组件或技术，能阅读源码跟踪问题。　　6、熟练掌握Spark、flink任意一种计算框架，掌握MapReduce计算框架原理，并有实际项目开发经验。　　7、熟练掌握HDFS、HBase、Kafka、Redis、Hive、Sqoop、Shell等技术和组件，熟练应用开发，必须熟悉复杂数据查询性能调优，包括实时查询和离线批处理查询，服务器和生态组件的参数优化。　　8、精通高级算法并有与业务结合落地优先;　　9、扎实的独立分析问题、解决问题的能力，具备良好的需求理解能力、沟通协调能力和团队合作精神;有很强的数据设计抽象能力，善于从复杂的数据问题中找到关键路径，并且擅于跟业务团队就业务问题进行良好的沟通，能推动业务的指标化、量化;　　10、有较好的学习能力、团队协作精神，认真细心，有强烈的责任心，爱岗敬业，有较高抗压能力，有较好的工作稳定性。,"数据服务,信息安全",2000人以上,hadoop,长沙
大数据开发工程师,https://www.lagou.com/jobs/6756997.html,雨花区,15k-20k,长沙电视台政法频道,3-5年,不限,六险一金、带薪年假、节假日工会福利,负责新闻资讯、用户行为数据等海量数据采集、处理、存储，算法模型建模分析，编码。任职要求：1、计算机相关专业，本科学历以上，具备3年以上大数据开发经验。2、熟悉Hadoop、Spark、Strom、Hbase、Hive、HDFS等。3、熟悉Python或Scala编程。4、具备媒体资讯行业大数据建模经验者优先。5、一线大厂互联网行业工作经验者优先。,其他,150-500人,hadoop,长沙
大数据开发工程师,https://www.lagou.com/jobs/6865640.html,天心区,7k-12k,湖南红网新闻网络传播有限责任公司,3-5年,本科,国企，工作稳定，福利齐全，周末双休,"岗位职责：1、负责负责用户画像、运营平台、推荐等相关红网大数据平台数据应用产品设计、研发；2、保障系统高性能、高质量、完全运行；3、参与设计并构建主题化数据模型，构建集团数据仓库；4、参与数据治理规范的建立, 构建覆盖全集团的数据治理工具；5、负责或参与项目开发过程中的技术攻关和性能调优。任职要求：1、全日制本科及以上学历；2、3-5年数据开发工作经验，3年及以上数据平台构建，Java, Scala 或 Python 开发工作经验；3、熟悉 Git/GitHub，通信协议 TCP/HTTP 及 RESTful 标准；4、深入了解大数据计算平台架构和产品组件原理和应用场景，如 Spark, Hadoop, Hive, HBase, AWS Redshift, AWS Kinesis, GCP BigQuery, GCP Cloud Dataflow 等。","移动互联网,电商",500-2000人,hadoop,长沙
数据开发工程师,https://www.lagou.com/jobs/7021682.html,岳麓区,9k-13k,湖南梦洁家纺股份有限公司,5-10年,本科,周末双休、五险一金、绩效奖金、晋升空间大,"基本要求：职位类型     数据开发工程师35岁以下         性别：不限本科及以上       专业：计算机相关专业职位描述：1、参与软件系统的设计、开发、测试等过程2、满足业务需求架构设计、数据梳理、数据同步及实现优化3、负责系统主要功能的代码实现4、使用ETL或者接口完成其他系统对接工作5、编写软件开发说明书、测试文档、软件版本管理文档等 6、数据中心、数据仓库搭建、维护、完善及优化7、基于数据中心数据的其他系统搭建8、上级安排的其他工作任职资格：1.5年以上开发与数据分析相关工作经验；2.熟悉ETL工具kettle,能熟练进行ETL开发及调度流程；3.熟悉帆软开发工具软件，能熟练进行数据分析开发工作；4.熟悉主流数据库（Oracle、MSSQL、MYSQL等），并熟练掌握编写数据库存储过程，有SQL调优经验；具有一定的算法设计能力、数据仓库建建模经验优先。","消费生活,其他",150-500人,hadoop,长沙
ETL开发/数据库开发工程师,https://www.lagou.com/jobs/6847128.html,开福区,10k-16k,北京宇信科技集团股份有限公司广州分公司,1-3年,本科,六险一金 带薪年假 司龄假 补贴,岗位职责：1、参与BI类项目实施;2、负责数据仓库、数据集市、报表平台等BI项目的ETL开发、数据模型设计及应用开发；2、负责BI项目的报表设计及开发;4、针对数据仓库应用系统的数据处理需求，对金融行业（银行、证券、保险)业务数据进行分析，完成数据仓库的数据抽取、转换和装载过程;5、参与数据仓库中ETL流程的优化以及数据仓库系统实施过程中ETL相关技术问题的解决;6、需求分析，集市模型设计。任职要求：1、计算机、数学或者电子信息技术本科以上学历；2、2年以上BI从业经验；3、熟悉数据仓库架构及原理，熟悉UNIX/LINUX系统；4、熟悉数据ETL原理，熟悉Oracle或者DB2数据库；5、熟练应用Datastage等ETL工具；6、熟悉面向对象编程技术，良好的学习能力和逻辑思维能力；7、良好的沟通表达（口头及书面）和文档交付能力。,金融,2000人以上,hadoop,长沙
资深java开发工程师,https://www.lagou.com/jobs/5118746.html,岳麓区,12k-20k,北京五八到家信息技术有限公司,3-5年,本科,"强大平台,优厚薪资,扁平管理,六险一金",岗位职责：1、参与系统需求分析与设计，负责完成核心代码编写，接口规范制定2、参与架构设计，服务性能效率优化等3、拆解产品需求，提出技术实现方案和步骤职位要求：1、有3至5年java WEB及Server项目开发经验，Java基础扎实，规范的编码，了解设计模式；2、熟悉常用的前端html、js、jquery、ajax、Json等相关技术；3、熟悉常用的数据结构，深入理解面向对象、MVC等相关概念；4、熟练使用sql以及相关优化，了解sql语句的一般规范，能够优化并清除慢查询语句，具备数据库应用系统的规划及设计能力；有NoSql相关实际经验，对memcached、redis、hadoop等开源框架有使用经验更佳；5、有互联网系统研发经验，懂web系统架构设计，能考虑到高并发和大数据量者优先；6、了解Linux下常规操作，熟悉shell、awk等优先；7、有良好的沟通能力，具有跨部门协作的经验，推进能力强，责任心强；8、 积极主动，较强的学习能力，能够思考和优化解决方案，能够独立完成项目的设计和交付；加分项：1、较好的教育背景，本科学历及以上；2、逻辑思维清晰，热爱互联网和移动端产品；3、能写出严谨的结构清晰的易于阅读的代码；4、热爱技术，自己是&愿意加入一群实干派工程师的团队；5、能独当一面，自我管理和驱动力强，有良好的时间管理意识,消费生活,2000人以上,hadoop,长沙
政务大数据交付架构师,https://www.lagou.com/jobs/6897499.html,岳麓区,30k-50k,腾讯科技（深圳）有限公司,5-10年,本科,大平台、高福利,岗位要求： 1. 计算机、数学等专业本科或以上学历，5年及以上大数据相关工作经验；2. 对hadoop生态、实时计算框架非常熟悉，具备集群搭建、维护、监控能力；3. 熟悉Flume、Kafka、Storm、Spark、impala、Hive、Elasticsearch、Hbase等大数据技术至少精通其中三项以上；4. 具备大数据平台性能分析、debug、排障能力；5. 有大数据平台的数据流处理、监控经验优先；6. 至少实践过1个大数据平台建设项目，平台数据量不小于20T；至少参与交付过3个以上政务云/数据中台/应用相关的项目7. 具有百台以上大数据集群架构经验者优先，具有集群与集群之间数据交换经验者优先，具有政务行业大数据项目经验者优先。 通过腾讯云技术认证或同等资格认证的优先录取。岗位职责： 1. 政务大数据处理平台的架构设计和技术选型；2. 大数据处理平台实施方案的设计和规划；3. 技术难点攻坚；4. 项目整体进度的把控和风险控制；5. 培训及知识转移。6.负责腾讯WeCity未来城市政务项目（数据中台、AI中台、应用中台等）架构交付，保证项目按合同约定成功交付；,社交,2000人以上,hadoop,长沙
大数据平台架构师,https://www.lagou.com/jobs/6988913.html,岳麓区,18k-30k,湖南福米信息科技有限责任公司,5-10年,本科,C轮，技术挑战，金融,职位描述：1、负责数据平台、数据仓库、计算平台、调度平台等搭建。2、负责用户画像、风险图谱、风控数据等的设计开发。要求：1、熟悉Hadoop、Hive、Hbase、Spark等，实时计算Flink等。2、具备扎实的java和Python基础3、具备较强的架构设计能力。4、良好的业务理解能力，良好的沟通能力。,"金融,移动互联网",50-150人,hadoop,长沙
高级测试开发工程师,https://www.lagou.com/jobs/6769572.html,天心区,10k-15k,湖南易智寄网络科技有限公司,5-10年,本科,双休、五险一金、年终奖、出国交流机会,"岗位职责：1、参与需求评审，根据产品需求设计高效的测试用例并组织用例评审；2、根据产品规格和测试需求，编写测试方案、测试用例、测试脚本；3、利用测试资源组织、执行产品的测试工作，找出产品存在的问题；4、对产品可能存在的风险进行评估和分析，并制定防范的方案；5、建立、跟踪、维护测试工作的相关文档。6、在项目中保持和项目经理、开发、产品经理积极有效的沟通,驱动问题解决。任职要求：1、本科及以上学历，计算机相关专业；2、5年以上测试经验；3、熟练章握软件工程基本理论、功能测试各种方法、流程及规范；4、能够独立解决在测试工具和脚本方面遇到的问题，有测试团队管理经验优先；5、了解常用性能测试工具如LoadRunner/JMeter/soupui等6、熟悉SQL，熟悉MYSQL/Oracle/Hadoop/SQLSERVER等至少一种或多种存储库，能够定位分析存储库性能，有性能测试经验；7、至少掌握一种常见编程语言，java/python/shell/c等8、具有较高的质量意识、团队合作意识，认真细心 、逻辑思维清晰严谨，工作积极主动、责任心强、有耐心细心。福利待遇：1、五险一金；2、薪资待遇：10000-15000元/月,13薪；3、舒适的工作环境，融洽的工作氛围，和谐的人际关系及人性化的管理模式；4、工作时间：9:00-18:00（双休，节假日全休）。",移动互联网,15-50人,hadoop,长沙
自然语言处理工程师,https://www.lagou.com/jobs/6814930.html,开福区,10k-20k,深圳航天工业技术研究院有限公司,不限,硕士,央企；团队技术水平高，氛围好；待遇优越,"岗位职责：1、 研究分词、实体识别、句法分析、信息抽取、分类等自然语言处理相关算法，进行技术创新；2、 将相关关键技术进行工程化代码实现，参与关键技术的系统集成，负责/参与公司项目的原型开发；3、 参与技术需求研讨；4、 撰写相关专利，发表论文，参加各类公开评测；5、 组织各类数据集的收集、标注和整理；岗位要求：1、 熟悉或强烈愿意学习自然语言处理/深度学习相关技术；2、 熟悉基本的NLP库及算法框架，如nltk, jieba、Bert、Word2Vec、XLnet等。3、211，985院校计算机或相关专业硕士以上学历；4、熟练掌握Python，Java等编程语言（精通一项），算法基础扎实，具备较强的分析和解决问题能力；5、了解spring cloud、hadoop、spark、storm、hive 、ElatisticSearch等大数据开源框架，有一定的大数据开发经验；6、具有较强的科研创新能力，英文阅读能力，能够解决NLP、知识抽取、分类、推理等领域的关键技术问题；7、具有较好的工程实践能力，能够将NLP相关前沿技术进行工程实现；8、熟悉python、TensorFlow和面向文本的深度学习模型，深度掌握机器学习及深度学习的内部机理；9、具有自我驱动品质，学习能力强，适应能力好，有强烈的责任心，具备耐心/细心的品质；10、抗压能力强，吃苦耐劳，愿意出差，能够加班",其他,50-150人,hadoop,长沙
大数据架构师（长沙） (MJ000391),https://www.lagou.com/jobs/7136000.html,芙蓉区,20k-30k,杭州玳数科技有限公司,5-10年,不限,阿里系创业、云计算生态、餐补、双休,职位诱惑：挑战，激情，技术大牛，扁平管理，弹性工作1、负责数据中台项目规划、技术架构等工作，包括数据采集、模型、网络、安全、质量等架构设计；2、和产品经理一起推进项目需求落地，将业务和产品需求转变成为技术实现方案；3、深入理解产品的需求、场景，参与核心模块代码开发；4、协同开发工作，确保项目开发的正常进行；5、作为关键技术攻坚人员，解决重大项目的技术疑难问题。并能有效地对新人进行辅导，带领团队快速提升；6、能从技术视角对项目边界、项目投入成本给出合理判断，控制项目风险。  岗位要求：1、本科及以上学历，5年及以上大数据开发经验，精通数据建模理论，丰富的数据仓库设计和大数据项目实施经验；2、熟悉常见的关系型、非关系型数据库的使用，熟悉分布式计算框架Hadoop/Spark/Fink中的至少一种，有Flink开发经验优先考虑，熟悉大数据其他技术栈；3、Java/Python等开发语言至少掌握一种；4、具有良好的沟通、组织能力，强烈的进取心和优秀团队合作精神，接受出差。,数据服务,150-500人,hadoop,长沙
