job_name,job_url,job_location,job_salary,job_company,job_experience,job_class,job_given,job_detail,company_type,company_person,search_key,city
高级运维工程师,https://www.lagou.com/jobs/6912405.html,南山区,15k-28k,深圳云路信息科技有限责任公司,3-5年,大专,发展前景大，福利待遇好,岗位职责：1、负责基于Kubernetes生态技术探索，持续提升系统运维能力和运维效率。2、跟进社区发展，不断完善升级平台组件;4、参与技术方案和系统设计方案评审，掌握相关的技术架构和原理，能够从运维架构角度主动识别方案风险，并给出专业的解决方案；5、不断研发与探索运维自动化，缩短运维响应时间，减低运维成本；6、生产系统弹性框架、两地三中心落地实践；岗位要求：1、精通Linux，网络基础扎实。2、熟悉 python/go 其中一种开发语言，具备运维自动化开发能力；3、有 2 年以上专职 kubernets + Docker 生产环境运维相关工作经验，熟悉其部署、监控及性能调优。有代码阅读能力者优先；4、对Federation、istio有深刻认识，具有落地实践者优先;5、有HLEM产出、CRD开发实践经验优先；6、务实、自我驱动、学习能力强、较好的问题分析与解决能力、抗压性强，良好的沟通协调能力和团队合作精神。,"物流丨运输,软件开发",150-500人,go,广东
安全运维工程师 (MJ000192),https://www.lagou.com/jobs/7194298.html,南山区,10k-20k,深圳市慧择时代科技有限公司,不限,本科,六险一金 周末双休 福利完善,1、负责内部安全系统的安全规则运营，例如基线规则，漏洞补丁等；2、负责内部信息安全事件/威胁情报的监控和响应工作；3、负责内部安全系统的状态监控，建立完善的监控体系、运行分析，保证运行质量，提高系统的高可用性；4、实时关注和应对外界发布的高危漏洞预警，并采取防范措施；5、熟悉常用安全设备的使用；6、配合内部/外部审计工作；任职资格：1、计算机或网络安全相关专业本科以上学历；2、了解厂家安全漏洞的利用和修复方法；3、能熟练使用Linux、Windows系统平台下各种应用系统；4、熟练掌握正则表达式的语法及使用；5、熟练掌握java、python、go、javascript至少一门开发语言；6、具有踏实的工作心态、良好的沟通呢能管理和团队协作能力；7、具有较强的独立动手能力和学习能力；加分项目：熟悉国家信息安全法律法规与ISO27001、PCI-DSS、网络安全等级保护系列相关标准规范；具备CISSP、CISP、CWASP等认证优先,"移动互联网,电商",500-2000人,go,广东
PHP开发工程师,https://www.lagou.com/jobs/7150136.html,南山区,15k-20k,深圳市天天爱科技有限公司,3-5年,本科,"行业前10,晋升空间大,月绩效奖金","岗位职责：1.负责项目和产品的研发、整体架构设计及部分核心功能的开发工作。 2.负责现有系统的维护，参与技术评估、技术积累、技术难题解决等工作。 3.跨团队沟通协作，确保系统架构内外设计合理，保障项目质量与进度。 4.跟进前沿技术，参与技术决策、技术选型、技术架构和技术风险评估。 5.发现和解决业务系统的技术问题，对系统的稳定性和可用性负责。 任职资格：1、本科及以上学历，计算机等相关专业毕业，3年及以上的服务端开发经验，热爱技术，喜欢钻研；2、具有良好的PHP基础，熟悉Yii，laravel等至少一种开源框架；3、熟悉Linux系统基本操作，了解HTML,CSS,Javascript等web技术；4、熟悉Python，可以用python做一部分数据处理工作；5、具有MySQL索引优化、查询优化、存储优化和大数据处理经验；6、具备良好的分析解决问题能力，有独立承担任务的经验和系统把控任务进度的能力和责任心；7、责任心强，能主动反馈和跟进问题；8、熟悉其他服务端语言(Go、JAVA)优先。",游戏,150-500人,go,广东
私有云存储运维工程师,https://www.lagou.com/jobs/6741328.html,南山区,15k-25k,深圳市铱硙医疗科技有限公司,3-5年,本科,"人工智能,高端前沿,前景广阔",岗位职责1、为公司的私有云/混合云，以及分布式存储系统提供日常运维和开发支持；2、负责私有大数据存储平台的需求分析，方案设计，开发实现及用户业务上云支撑工作；3、改善系统架构，使用自动化工具监视和收集系统相关日志，分析和提高存储系统以及容器云平台的性能和安全审计。任职要求1、计算机相关专业毕业，本科及以上学历，三年以上的运维开发经验和一年以上的大型Kubernetes/Docker运维经验；2、至少具备以下方面的知识和经验：基于主机的网络，Linux / UNIX管理，存储技术，系统编程，分布式系统，基于主机的网络，云存储等；3、熟悉以下一种或几种编程语言：C/C++、Go、Bash、 Ansible、Python；4、熟悉Docker和Kubernetes的技术和原理及相关的操作系统基础设施，Docker / K8S容器化运维，自动化运维；5、熟悉Ceph，GlusterFS，HDFS等分布式存储技术（Github代码库，生产环境的部署，存储系统升级和迁移）。,"医疗丨健康,数据服务",15-50人,go,广东
golang工程师,https://www.lagou.com/jobs/6766972.html,南山区,10k-20k,深圳市铱硙医疗科技有限公司,1-3年,本科,"人工智能,高端前沿,前景广阔",岗位职责：1、参与项目需求分析，完成软件需求的设计、编码，保证软件的确保安全、质量和性能；2、参与项目内部测试、部署、实施等工作；3、配合项目其他组员完成规定任务，保证任务正常提交。岗位要求：1、熟悉linux系统2、熟悉git docker3、熟悉go语言，了解beego等golang框架4、熟练使用sql，熟悉mysql/sqlserver/oracle5、熟悉redis 或对MQ有了解6、有C++ 开发经验优先,"医疗丨健康,数据服务",15-50人,go,广东
测试工程师 - 分布式存储,https://www.lagou.com/jobs/6954635.html,南山区,10k-20k,北京志凌海纳科技有限公司,不限,本科,"高速发展,带薪年假,工程师文化,月度餐补",岗位职责：- 与开发团队深度合作，理解掌握分布式存储产品特性，完成功能正确性验证；- 构建质量保障平台，开发测试工具与自动化测试框架；- 推动开发团队不断提高代码测试覆盖率和持续集成覆盖度。任职要求：- 具有 3 年或以上相关工作经验，包括软件开发经验或测试工程师经验；- 认真负责，具有良好的沟通能力和执行力，追求极致的软件质量；- 熟悉云计算等基础设施类软件产品。加分项：- 掌握一门编程语言 Python/C/C++/Go，有良好的代码风格；- 熟练使用 Shell；- 熟悉各类自动化测试方法，并有所实践。我们提供：- 标配的五险一金和极具竞争力的薪水，持续的期权机制；- 各种水果零食、咖啡牛奶无限量免费供应，任君挑选；- 每年十二天带薪年假，旅游工作两不误；- 补充医疗保险，为你健康保驾护航；- 弹性工作时间，为结果负责；- 年度旅游&定期团建活动。,数据服务,50-150人,go,广东
php开发工程师,https://www.lagou.com/jobs/6964299.html,天河区,5k-10k,上饶市一三齐齐信息技术有限公司广州分公司,1年以下,本科,"发展空间,学习机会,年轻团队，","岗位职责：1、负责公司平台系统开发工作，完成重要核心模块的开发，有较强的质量意识；2、系统架构持续优化，优化团队研发流程和方法，不断提高团队代码质量、研发水平和工作效率；3、协同其他岗位工作，管理项目的计划和执行，并对项目质量和项目成功交付负责；4、协调系统内部、跨系统的技术方案制定和评审，保证系统的可扩展、易维护性；5、完成基础工具、平台的研发、运维等方面的日常工作。任职要求：1、计算机相关专业，大专及以上学历，2年以上的开发经验；2、精通PHP+MySQL开发，熟悉主流开发框架，如ThinkPHP、Laravel等；3、熟悉Redis/MongoDB/memcached等数据及缓存技术,有高流量、高并发web经验者优先；4、熟悉Linux/Unix基本操作，熟悉NGINX/Apache/MySQL/PHP等服务器软件安装和优化；5、掌握相关WEB技术，熟悉JavaScript/CSS/HTML5/HTML及第三方JS、UI框架应用；6、熟悉互联网应用技术，熟悉TCP、UDP、SOCKET、HTTP协议、原理、安全及技术应用；7、具有良好的代码编写风格和习惯，结构清晰，逻辑性强，代码冗余低；8、熟悉版本管理GIT、SVN等协同开发工具；9、熟悉JAVA、Python、Go等任意一种其它语言的优先考虑。公司福利：1、五险一金：涵盖住房公积金、养老、工伤、生育、失业、医疗，为员工提供全面保障；2、免费三餐：公司有自己开发的点餐系统平台，自助餐形式，免费提供早餐、中餐、晚餐；午晚餐每餐10多个菜式，所有菜式任装不限量；3、免费下午茶：每周可免费点下午茶，还有不定时大型主题下午茶，节日下午茶等；4、团建活动：丰富的团建活动及周年庆活动--周年庆旅游、团建卡丁车、珠海长隆海洋王国、从化温泉度假、KTV聚会等等（一切为了放松）；5、免费零食：提供丰富免费的零食供应，工作环境明亮舒适且宽阔，保证大家的轻松工作；6、节日福利：丰富的节日礼品及节日氛围（端午星冰粽、中秋礼品卡、节日红包等等，你所知道的节日都有福利）；7、生日礼遇：生日员工都享有礼品卡（可上网挑选兑换各种礼品或兑换相应金额）；8、梯度全勤：每年实行梯度全勤奖制，1月-12月全勤奖从200-1200元递增；9、租房补贴：入职半年员工，每月享有租房补贴（租房有补贴，工作无压力）；10、带薪年假：入职一年员工即享有带薪年假，休年假依旧享有全勤奖；11、年底双薪：实行全职员工年底双薪制度；12、工龄奖：为做满一年以上的老员工提供工龄奖，逐年递增；13、年度体检：为入职满一年的员工提供定期免费体检（为员工健康护航）；14、晋升空间：内部优先晋升原则，人性化的晋升空间。",游戏,150-500人,go,广东
数据平台开发,https://www.lagou.com/jobs/6848752.html,南山区,20k-30k,深圳小爱灵动网络技术有限公司,5-10年,本科,周末双休、弹性工作、团队氛围好、空间大,"工作内容：1、通过API接口获取源数据，并根据方案对数据进行处理和储存；2、负责BI数据后台的前端和后端的搭建和日常维护；3、搭建数据中台，设计并实现各种自动化工具；职位要求：1、具有一定的web全栈能力，有大数据工作经验更佳；2、有海量数据查询优化经验，熟练使用mysql、sqlserver等数据库，精通数据库查询优化；3、精通Javascript，熟练使用流行的前端技术如：react、Vue、angular等进行前端技术开发，掌握相关的前端构建工具，能自觉的对前端交互就行优化；4、精通PHP、Java等任意一门后台语言，熟练使用各PHP\java各大流行框架，并对相关框架的原理有一定了解,掌握Python或go加分；5、有良好的理解和沟通能力，合理进行任务分解；6、有良好的编码和撰写相关开发文档的习惯，对自己的代码进行单元测试，保证代码质量；",游戏,15-50人,go,广东
web全栈,https://www.lagou.com/jobs/6850625.html,南山区,20k-30k,深圳小爱灵动网络技术有限公司,5-10年,本科,周末双休、弹性工作、团队氛围好、空间大,"工作内容：1、通过API接口获取源数据，并根据方案对数据进行处理和储存；2、负责BI数据后台的前端和后端的搭建和日常维护；3、搭建数据中台，设计并实现各种自动化工具；职位要求：1、具有一定的web全栈能力，有大数据工作经验更佳；2、有海量数据查询优化经验，熟练使用mysql、sqlserver等数据库，精通数据库查询优化；3、精通Javascript，熟练使用流行的前端技术如：react、Vue、angular等进行前端技术开发，掌握相关的前端构建工具，能自觉的对前端交互就行优化；4、精通PHP、Java等任意一门后台语言，熟练使用各PHP\java各大流行框架，并对相关框架的原理有一定了解,掌握Python或go加分；5、有良好的理解和沟通能力，合理进行任务分解；6、有良好的编码和撰写相关开发文档的习惯，对自己的代码进行单元测试，保证代码质量；",游戏,15-50人,go,广东
前端开发工程师,https://www.lagou.com/jobs/6704754.html,南山区,12k-20k,深圳市长亮科技股份有限公司,3-5年,不限,六险一金 年休假 公司总部研发部,"岗位职责：1、售后平台中后台前端代码开发，参与多种平台的应用开发，包括Web与H5等产品，负责前端交互的实现；2、负责JavaScript程序模块的开发，通用类库、框架的编写；3、设计及实现前后端的数据交互，对代码质量及进度负责任职要求：1.大学本科及以上学历，计算机、软件工程等相关专业优先；2.2年左右前端开发经验；熟悉除JavaScript外的一种高级语言（如Java, Python, PHP,GO）的优先；3.熟练HTML、CSS、Javascript等前端技术，能处理浏览器兼容问题；4.熟悉Vue/React/Angular中一个或多个 ，优先；",企业服务,2000人以上,go,广东
SPBU-后端架构师（大规模微服务）,https://www.lagou.com/jobs/6889913.html,天河区,30k-50k,广州酷狗计算机科技有限公司,3-5年,本科,五险一金、年终奖金、周末双休、包餐,工作职责：1. 负责微服务方向相关技术的调研和方案实施落地；2. 基于kubernetes，参与云应用编排落地；3.跟踪AIOPS技术，优化从故障预警、故障告警、告警聚合到根因分析以及故障自愈的全栈流程。任职资格：1.本科及以上学历，熟练掌握Java或Go，熟悉网络编程、并发、分布式、缓存、消息队列、数据库等技术；2.5年以上软件开发经验，有大型云计算平台技术负责人、架构师经验优先，有大型云计算产品公司3年以上工作经验者优先；3.熟悉 Docker / Kubernetes等周边生态项目，如监控、日志、网络等方案，精通或者有实施经验者优先 ；4.熟悉微服务、服务网格等概念，了解Istio、Spring Cloud架构和实现优先 ；5.对编程、技术有热情，积极主动，工作责任心强。,文娱丨内容,500-2000人,go,广东
YJBU-后端开发工程师,https://www.lagou.com/jobs/6806648.html,天河区,15k-25k,广州酷狗计算机科技有限公司,3-5年,本科,五险一金、餐饮补贴、员工旅游、年终奖金,工作职责:1、负责TME（腾讯音乐娱乐）开放平台（千万级IoT设备接入）建设开发；2、遵照开发规范、上线流程，按时保质的完成产品需求开发和上线；3、保障酷狗系统线上业务稳定运行；4、完成开发过程中相关文档的编写和维护；5、协助测试工程师定位、解决发现的问题；6、协助QA部门处理酷狗业务相关问题。任职资格:1、本科或以上学历，计算机软件或相关专业；2、具有三年以上大型服务端开发经验，精通一种服务端语言【Go/C/C++/Lua/PHP/PYTHON等】。 3、熟悉使用linux平台、shell编程，熟悉ngx_lua优先；4、对高可用、高并发，高负载的架构有一定了解，具有分布式架构的代码开发能力；5、熟悉TCP/IP、DNS等底层协议，精通HTTP协议，熟练掌握各种工具进行网络问题诊断；6、能够承受一定的工作压力，在紧凑的计划安排下按时完成任务；7、善于与人沟通，良好的团队合作精神和高度的责任感；8、有大型互联网业务开发经验优先考虑。,文娱丨内容,500-2000人,go,广东
网络传输高级开发工程师,https://www.lagou.com/jobs/7154707.html,南山区,15k-30k,雷神科技有限公司,3-5年,大专,薪资待遇高，前景福利好,职位描述1、基于P2P和PCDN技术，为用户提供低成本高质量的文件、网络通讯传输服务；2、参与P2P体系搭建，架构设计、算法、协议优化和技术研发；任职要求：1、计算机相关专业本科或以上学历；2、有c/c++开发经验，熟悉go、python等语言者优先；3、熟悉TCP/IP，HTTP协议，了解常用P2P协议，了解P2P相关网络架构，有性能优化相关经验优先；4、有过CDN/P2P开发经验，有手机端（android、ios）、路由器端、服务器后台开发经验者优先；  5、有良好的逻辑思维能力，有学习精神，沟通能力良好，积极负责。,软件开发,150-500人,go,广东
运维开发工程师（技术中心）,https://www.lagou.com/jobs/6614984.html,海珠区,15k-25k,广州花生家网络科技有限公司,5-10年,本科,"千万级用户,高并发系统,团队大牛多","岗位职责:1、负责运维系统各自动化平台的设计与开发，提升运维质量及效率。2、负责优化、完善运维各系统及辅助其他部门系统提供接口和功能3、通过技术手段控制和优化成本，提升SLA降低运维和运营成本以及资源闲置率。任职资格:1、精通Linux操作系统，对自动化运维工具有3年以上实际开发经验，懂运维所需。2、具备3年以上开发经验，至少精通1种开发语言：Python/Go/Java,精通Django、beego、springcloud、Mybaties框架优先。3、熟练Vue、Bootstrap、Highcharts等前端框架，能独立完成前端功能、报表和图像的展示。4、有CMDB、运维自动化、监控系统、发布系统、运营支撑系统、AIOPS系统等开发经验者优先。对容器、K8S有着1年以上实际生产使用经验优先。5、具有良好的学习能力、沟通能力、服务理念和合作精神，强烈的责任心与主动性，对所负责工作有owner意识，并能自我驱动成长。","电商,消费生活",150-500人,go,广东
DBA工程师/高级DBA,https://www.lagou.com/jobs/6615356.html,海珠区,15k-25k,广州花生家网络科技有限公司,3-5年,本科,"千万级用户,高并发系统,团队大牛多","1、负责MySQL、redis、MongoDB等数据库维护，保证系统7*24小时稳定运行。2、MySQL数据库性能监控和调优。3、负责维护数据库的日常变更、备份、恢复、扩容，数据迁移等。4、对开发部门提供数据库技术支持与帮助，审核研发应用程序中的慢查询和有危害的SQL。5、负责开发和完善DBA工具平台岗位要求：1、具备3年及以上数据库相关系统的维护经验，有互联网、电商经验者优先。2、熟悉MySQL及Innodb的体系结构和运行原理。掌握MySQL的数据备份和快速恢复, 高可用架构。3、精通redis、Kafuka、RabbitMQ、ES、HBase（AMPQ协议类）等主流互联网公司使用的系统。4、掌握Shell/Go/Python中的一种或几种语言。","电商,消费生活",150-500人,go,广东
运维工程师,https://www.lagou.com/jobs/7114086.html,南山区,15k-20k,深圳点猫科技有限公司,3-5年,本科,全额五险一金，餐补，年终奖，周末双休,,"移动互联网,教育",2000人以上,go,广东
后端开发工程师,https://www.lagou.com/jobs/7184584.html,南山区,15k-24k,深圳小鹅网络技术有限公司,3-5年,本科,发展前景好 年终奖丰厚 双休,工作内容：1、负责后端功能研发，参与产品需求讨论、技术方案设计。2、编码实现产品功能。3、学习和研究新技术以满足产品需求任职要求：1、本科或以上学历，计算机软件或相关专业，3年以上后端开发经验; 2、熟悉Linux开发环境，精通Go或PHP语言，熟悉Node/python/java其中一种或多种； 3、计算机基础扎实，熟悉主流Web框架设计和实现原理（gin、beego、laravel、yii等）； 4、熟悉Redis/Mysql等数据库，具有很强的学习能力、分析问题和解决问题能力、对技术有钻研精神和兴趣；5、有大型分布式、高并发、高负载、高可用系统设计、开发和调优经验者加分。其他要求：1、有良好的沟通协作能力，善于发现问题，并提出解决方案。2、有较强的责任感，学习能力强，有创造性思维能力和表达能力，充满创业激情。,"移动互联网,社交",500-2000人,go,广东
网络运维实习生,https://www.lagou.com/jobs/7128291.html,荔湾区,4k-6k,唯品会（中国）有限公司,应届毕业生,本科,"弹性工作,包三餐,大牛带队,转正机会",岗位职责：1. 协助网络工程师对唯品会IDC、仓库、园区网络进行规划、实施、交付，满足业务发展需求。2. 协助网络工程师做好网络日常运维、监控、容量规划、质量保障。3. 协助网络运维开发做好需求管理、产品规划、功能开发，提升运维工具水平。 岗位要求：1.熟悉主流交换路由网络技术，有CCIE或同等认证者优先2.具备一定的代码能力，通过python或go对运维工具进行功能开发，简化运维。3.具备良好的学习能力和沟通协调能力。,电商,2000人以上,go,广东
Java开发工程师（物流运配）,https://www.lagou.com/jobs/7168986.html,荔湾区,15k-30k,唯品会（中国）有限公司,3-5年,本科,"弹性工作,包三餐,大牛带队,六险一金",工作内容：1、与项目、产品、测试、业务等部门内外人员沟通，协作完成供应链、物流等相关项目开发工作。2、在线业务功能开发，从JS前端到网关接入层到后端业务APIs到缓存、存储层。3、在线功能涉及的后台任务、离线任务等的开发，后台管理、监控、报表等开发。4、APIs、协议设计、数据库设计。5、应用框架、基础库、组件、辅助工具的设计开发。6、团队代码日常review。7、Oncall值守，对涉及团队代码的线上故障，与运维一起进行紧急分析处理。8、收集分析数据，利用SQL查询、自己写脚本工具等数据分析手段，发现方向，改进程序。9、克服挑战，收获成就感和满足感。应聘要求：1、热爱编程和技术挑战，有意愿进行全栈式开发，我们需要你能即做前端JS代码编程，也做后端服务编程，对一个垂直功能，能够一人从前到后搞定，包括开发实现和问题调试排查。2、我们不要求你来应聘时前后端编程技能都已熟练掌握（是的话当然更棒！），但如果你擅长后端，起码对前端概念有清楚的理解，反之如果你擅长前端，也应对后端概念有清楚的理解。同时做好学习掌握前端或后端技能的准备。3、良好的逻辑思维和解决问题能力，扎实的计算机基础概念知识，各类常用数据结构的特性、操作等。对自己当前擅长的编程领域，各类问题（如事件循环、宿主环境、协议标准、同步异步、缓存、并发、网络、IO、数据库等等）应有原理性的理解。4、现场展示代码的能力，即刻写代码或伪代码解决面试官要求的问题，及进一步的讨论。建议你多参考网上资料，尽量对各类面试编程题、概念理解题有所准备。5、关于当前掌握的编程语言，我们没有特定的要求，你应聘职位的工作语言将以JS/Java为主，但你熟练掌握任一种脚本语言和编译语言（JS/TypeScript/Python/Php/Java/C#/C++/Go/Clojure/…）并展示出对其的深刻理解均可，(比如如果你未用过Java，面试我们不会考察你Java语法、Java范式、类库用法等)。如果你精通Windows体系的开发，也不必因为工作内容是Linux体系而顾虑。相比特定经验，我们更关注理解力、思维逻辑和快速学习。6、你要能阅读领域相关的英文资料、从英文网站查找问题解决方案，比如各类国外项目的英文官网、stackoverflow论坛等7、如果你有技术博客、属于自己个人的独立程序软件、开源项目等，非常欢迎应聘时介绍展示。,电商,2000人以上,go,广东
后台开发工程师,https://www.lagou.com/jobs/7216575.html,南山区,15k-23k,深圳瀚德金融科技控股有限公司,3-5年,本科,带薪年假 五险一金 商业保险 年度体检,岗位职责：1、负责金融科技、区块链联盟链系统相关的后台设计、开发；2、参与架构设计、核心技术难题攻关；3、系统架构、区块链底层等技术改进，大数据等新兴技术探索；4、对相关业务系统、区块链技术进行持续性优化和改进；5、完成上级安排的其他工作。任职要求：1、本科及以上学历，计算机等相关专业；2、5年以上研发经验，有金融企业从业经验者优先；3、精通Java，MySql，熟悉区块链，掌握以太坊、Fabric基本研发能力、对技术有浓厚兴趣；4、有NodeJS项目经验或熟悉NodeJS经验优先，熟悉Go语言优先。,金融,150-500人,go,广东
