job_name,job_url,job_location,job_salary,job_company,job_experience,job_class,job_given,job_detail,company_type,company_person,search_key,city
大数据工程师,https://www.lagou.com/jobs/7161536.html,,10k-20k,海尔集团,3-5年,本科,大平台、工业互联网、牛人团队,1、负责数据库架构设计以及数据库详细设计、优化数据库架构、解决数据库中心建设设计问题；2、负责大数据平台的选型、模型设计及系统部署，数据集市的规划、设计等；3、负责大数据系统研发工作，包括大规模非结构化数据业务模型构建、大数据存储；4、负责组织ETL过程开发，优化存储方案，设计并实现分布式计算任务，搭建数据处理流程；5、负责组织针对海量的用户行为数据进行统计、分析与挖掘，提取商业价值,"物联网,电商",2000人以上,大数据,青岛
大数据架构师,https://www.lagou.com/jobs/7209777.html,黄岛区,15k-30k,青岛国信城市信息科技有限公司,5-10年,本科,五险二金，免费三餐,"岗位职责：1.负责平台的整体数据架构设计，完成从业务模型到数据模型的设计工作 形成快速解决方案；2.负责根据业务功能、业务模型，进行数据库建模设计 ，解决高并发的调度系统中的关键问题；3.负责平台数据提取、数据挖掘及数据分析，具有良好的商业敏感度和优秀的数据分析技能，能够解决复杂的商业问题；4.负责数据开发质量的评审，指导相关构建测试并完成性能、代码优化；5.负责组织开发人员进行技术研究和技术攻关工作，负责研发人员技术培训和技能提升，提升工作效率，降低研发成本；6.完成上级交办的其他工作。任职资格：学历：本科学历及以上专业：计算机、软件工程、数据等相关专业；年龄：不限；工作技能：1.有5年以上的大型项目工作经验,至少3年架构师或技术经理等工作经验。2.丰富的数据架构规划、数据建模、数据库设计以及程序设计、开发经验；3.丰富的数据解决方案或数据架构（数据仓库、数据集成、数据管理）构建经验；4.深入掌握业务抽象、SQL查询路径以及优化路径在内的方法和技能；5.精通至少一种数据库技术,至少一种开源ETL工具、数据建模工具；6.不少于三年hadoop生态圈相关经验，基于Hadoop、MPI或Cassandra、MongoDB分布式平台, HBase及类似的NoSQL存储, MySQL，和BI系统等大型商业系统实践经验。","人工智能,区块链",2000人以上,大数据,青岛
大数据应用（ETL）（中级）,https://www.lagou.com/jobs/6848278.html,黄岛区,13k-17k,青岛国信城市信息科技有限公司,3-5年,本科,市直企业、政府授权、智慧城市建设及运营,"一、需求量：1二、工作职责1. 负责大数据以及BI相关应用项目的ETL设计、开发、维护工作；2. 负责ETL调度架构和统一数据资源库的开发优化工作；3. 参与大数据平台产品及服务调研、构建与支持；4. 与团队内部以及需求部门进行有效沟通，支持项目实施以及解决相关数据问题。三、任职资格学历：本科及以上专业：计算机或其他相关专业年龄：40岁以下工作技能1. 3年以上数据工作经验；2. 有数据库开发和设计经验，熟悉数据仓库体系优先考虑；3. 熟悉数据ETL相关工具及架构体系，有Kettle经验的优先；4. 熟悉Linux, 会编写shell脚本；5. 至少熟悉Java/PHP/Python/C开发语言之一,熟练使用正则表达式优先；6. 熟悉Hadoop/hbase/HIVE优先；7. 正直、坦诚、有激情；8. 较强沟通和学习能力。","人工智能,区块链",2000人以上,大数据,青岛
大数据ETL实习生,https://www.lagou.com/jobs/6784006.html,市北区,5k-8k,青岛隆顺数据服务有限公司,不限,大专,薪资高、弹性工作、晋升快、底薪4000起,薪资高，有发展，晋升机制健全，福利待遇优，机会多，工作体面。工作时间：周末双休，朝九晚五，转正投五险一金，提供住宿，节假日正常放假（元宵节，情人节，端午节，七夕节等）岗位职责：数据分析、数据挖掘、数据开发任职要求：大专及以上学历、21-30岁之间、思维逻辑大数据属于新兴行业，人才匮乏，薪资普遍很高。,"数据服务,人工智能",50-150人,大数据,青岛
大数据实习,https://www.lagou.com/jobs/7111861.html,市北区,6k-8k,青岛楷皓大数据有限公司,不限,大专,五险一金节假日朝九晚五晋升机制健全薪资高,岗位职责:数据分析、数据挖掘、数据开发任职要求:大专及以上学历、21-35岁之间、逻辑思维良好、专业(会计、统计、数学及应用数学、计算机)相关专业优先,数据服务、人工智能,50-150人,大数据,青岛
大数据实习生,https://www.lagou.com/jobs/7212538.html,市北区,4k-6k,青岛东宸联合科技有限公司,不限,大专,周末双休，朝九晚六。入职即可提供住宿。,1负责数据的处理和公司业务需求分析2熟练使用办公软件3细心耐心，计算机、会计、金融、统计专业优先任职要求: 大专及以上学历，年龄20-35岁！实习期间综合能力优秀者优先转为正式员工！13-15薪，周末双休！偶尔加班，加班有1.5倍加班费，节假日正常休息，节假日若加班3倍薪水,通讯电子,50-150人,大数据,青岛
大数据ETL实习生,https://www.lagou.com/jobs/6522468.html,市北区,4k-6k,青岛航凯大数据科技服务有限公司,不限,大专,大数据行业是目前发展行业里最新兴热门行业,1，大专学历以上2，年龄在20周岁以上3，逻辑思维能力测试通过4，有一颗肯学习的心5，喜欢大数据行业，对行业认可,移动互联网,15-50人,大数据,青岛
大数据管培生,https://www.lagou.com/jobs/7211397.html,市北区,6k-12k,青岛莱信实业有限公司,不限,大专,高收入  不加班  周末双休  五险一金,"1、参与项目需求分析和设计；2、完成软件系统代码的实现，编写代码注释和开发文档；3、辅助进行系统的功能定义,程序设计；4、根据设计文档或需求说明完成代码编写，调试，测试和维护；5、分析并解决软件开发过程中的问题；6、协助测试工程师制定测试计划，定位发现的问题；7、配合项目经理完成相关任务目标；8、具有很强的学习和独立分析能力、工作责任心、良好的沟通能力和团体合作精神。任职资格：1、专科及以上毕业生；2、相关专业优先考虑；3、有责任感，良好的团队协助精神；4、有无经验均可，一经录用，待遇优厚；5、可接收应届毕业生。","移动互联网,数据服务",50-150人,大数据,青岛
ETL大数据实习生,https://www.lagou.com/jobs/7126404.html,市北区,6k-12k,青岛莱信实业有限公司,不限,大专,五险一金，周末双休，带薪年假，工作轻松,1.计算机相关专业及有工作经验者优先考虑。2.无工作经验者可岗前培训，要求爱学习，肯吃苦，逻辑思维能力强。3.具有良好的团队合作能力。4.负责数据仓库ETL流程的优化及解决ETL相关技术问题5.大专学历及以上,"移动互联网,数据服务",50-150人,大数据,青岛
大数据助教,https://www.lagou.com/jobs/6788600.html,市北区,4k-6k,青岛莱牛教育有限公司,1-3年,大专,公司培养，稳定，不可被替代享受法定节假日,辅助大数据讲师授课管理学员批改作业帮助学生更好的高薪就业朝九晚六 双休年底13薪工作简单，认真，细心，耐心即可。工作具有高度责任感！跟公司一起长远发展,"移动互联网,教育",15-50人,大数据,青岛
大数据讲师,https://www.lagou.com/jobs/6791603.html,市北区,16k-30k,青岛莱牛教育有限公司,3-5年,大专,真正的高薪且双休，年终奖丰厚，稳定长远,做好大数据ETL技术教学，帮助学生高薪就业解答学生技术或项目问题,"移动互联网,教育",15-50人,大数据,青岛
数据库开发工程师,https://www.lagou.com/jobs/4508375.html,,5k-9k,北京智麟科技有限公司,1-3年,本科,五险一金，定期团建，弹性工作,"岗位职责：本科以上学历，计算机相关专业工作经验1~3年负责日常运维技术工作负责相关技术文档的编写掌握ADF或JAVA优先负责Oracle相关的技术设计及研发精通Oracle PLSQL开发语言对ORACLE EBS技术理解深刻，掌握相关问题查证方法熟悉Linux、AIX、HP-UNIX操作系统，熟悉Shell脚本；理解Oracle数据库体系结构，基础扎实，熟练各部分的管理；熟悉Oracle的备份与恢复技术，熟悉各种情况下的恢复；熟悉安装，包括RAC及补丁安装,数据库升级，熟悉基本的操作系统命令；熟悉Oracle数据库原理，精通SQL调优，深入理解数据库性能，拥有书写、优化复杂SQL的能力。具备从操作系统、存储、网络以及硬件的优化和诊断能力。具备从架构、建模层面设计、优化数据库系统的能力。有OCP或OCM证书优先。具有良好的逻辑思维能力具有良好的业务理解能力工作积极主动、注重细节、认真负责，善于团队合作","移动互联网,数据服务",50-150人,大数据,青岛
大数据实习,https://www.lagou.com/jobs/7182199.html,市南区,4k-7k,青岛航凯大数据科技服务有限公司,3-5年,大专,双休 住宿 五险一金,进行数据分析数据挖掘 抽取 转换 加载  接受无经验大专生,移动互联网,15-50人,大数据,青岛
大数据开发工程师,https://www.lagou.com/jobs/7049921.html,市北区,6k-10k,青岛好驻大数据科技有限公司,不限,大专,早九晚六 周末双休 五险一金,1、计算机及其相关专业，大专及以上学历。2、具备实时处理框架的设计和开发能力4、熟悉Linux等开发环境，能进行shell脚本的编写;5、具有较强的逻辑分析能力，高度的责任心及团队合作精神;6、具有实际大数据项目的成功经验者优先考虑,数据服务、软件开发,150-500人,大数据,青岛
大数据实习生,https://www.lagou.com/jobs/5605720.html,市北区,3k-5k,青岛地比图软件科技有限公司,不限,大专,早9晚5周末双休！节假日休息。提供住宿！,1负责数据的处理和数据分析。2会用办公室软件。,"移动互联网,其他",15-50人,大数据,青岛
大数据讲师,https://www.lagou.com/jobs/7080130.html,青岛高新技术产业开发区,8k-15k,青岛原子青软管理咨询有限公司,3-5年,大专,五险一金 双休 不加班,岗位职责： 1、根据部门计划安排，进行高校、基地授课2、指导学生完成毕业设计、项目；3、按规范完成与授课相关的教学活动，包括相关教学文档的提交、作业评定、出试卷、组织学生考试、批阅试卷及后期归档；4、参与教学改进、教学案例分享等教学研讨活动；5、配合业务部门，参与高校宣讲、技术小组等技术讲座和市场宣传活动。  任职要求：1、本科及以上学历，三年及以上大数据开发经验；2、熟悉Linux操作系统，掌握Shell/Perl至少一种脚本语言；3、熟练掌握Java或Python语言，具备分布式程序设计的基本能力；4、熟悉主流大数据框架原理，掌握Hadoop、Hive、HBase、Zookeeper集群搭建，调优，开发；5、熟悉常用实时处理框架Spark、Kafka、Flume原理及开发过程 6、精通SQL语言，熟悉MySQL、Oracle等关系型数据库者优先；7、精通数据仓库技术，熟练使用常见的ETL工具者优先。8、讲师经验不做硬性要求，有讲师经验的，学历可放宽；9、良好的沟通表达能力，有做讲师意愿；,软件开发,15-50人,大数据,青岛
大数据实习,https://www.lagou.com/jobs/6942883.html,市南区,4k-6k,青岛玄天数据科技有限公司,不限,本科,大数据热门，薪资高，待遇好，晋升空间大。,1、对互联网行业感兴趣，愿意从事数据服务的工作2、对ETL技术有基本的认识，知道ETL开发的一般性流程3、最好有一定的编写代码，开发文档的经验，或者做过类似的调试和维护,其他,50-150人,大数据,青岛
大数据与人工智能工程师,https://www.lagou.com/jobs/6855131.html,,12k-18k,海尔集团,不限,本科,10002,,"物联网,电商",2000人以上,大数据,青岛
海洋项目智能超算与大数据平台软件架构师,https://www.lagou.com/jobs/6939073.html,即墨市,20k-25k,青岛海洋科学与技术国家实验室有限公司,3-5年,本科,前景发展好，福利好,岗位职责：1.负责智能超算与大数据平台项目开发；2.参与公司定制大数据处理分析平台和产品的设计与研发；3.参与大数据运维系统开发，对大数据平台持续优化；资格条件：1. 本科及以上学历，有大型复杂项目或产品研发经验及行业应用项目经验者优先；2. 熟悉常用设计模式和开发框架，熟悉并发、分布式编程者优先；3. 熟悉shell、python、go等编程语言者优先；4. 熟悉操作系统、算法、数据库原理和并行处理技术，对大数据处理技术有深入的了解；5. 具有良好的团队协作能力，具有较强的分析和解决问题能力；6. 有数据模型或数据分析经验者优先；7. 有科研类、工程类以及产业应用类等项目申报经验者优先。,"企业服务,其他",15-50人,大数据,青岛
大数据开发实习生,https://www.lagou.com/jobs/7035265.html,市南区,2k-4k,青岛语宽网络科技有限责任公司,1年以下,大专,五险一金 周末双休 住宿补贴,"岗位职责：1、辅助参与项目数据分析和设计；2、辅助完成软件系统代码的实现，编写代码注释和开发文档；3、辅助进行系统的功能定义,程序设计；4、根据设计文档或需求说明完成代码编写，调试，测试和维护；5、辅助分析并解决软件开发过程中的问题；6、协助测试工程师制定测试计划，定位发现的问题；7、配合项目经理完成相关任务目标；8、具有很强的学习和独立分析能力、工作责任心、良好的沟通能力和团体合作精神。任职资格：1、专科及以上毕业生；2、相关专业优先考虑；3、有责任感，良好的团队协助精神；4、一经录用，待遇优厚；5、可接收应届毕业生。","数据服务,软件开发",15-50人,大数据,青岛
急聘大数据实习生,https://www.lagou.com/jobs/7019171.html,市南区,2k-4k,青岛语宽网络科技有限责任公司,1年以下,大专,五险一金，周末双休，法定节假日，朝九晚五,"技能要求：数据库，数据库开发，MySQL，Oracle技能要求：数据库开发，数据仓库，数据分析岗位职责：1、参与项目需求分析和设计；2、完成软件系统代码的实现，编写代码注释和开发文档；3、辅助进行系统的功能定义,程序设计；4、根据设计文档或需求说明完成代码编写，调试，测试和维护；5、分析并解决软件开发过程中的问题；6、协助测试工程师制定测试计划，定位发现的问题；7、配合项目经理完成相关任务目标；8、具有很强的学习和独立分析能力、工作责任心、良好的沟通能力和团体合作精神。任职资格：1、专科及以上毕业生；2、相关专业优先考虑；3、有责任感，良好的团队协助精神；4、有无经验均可，一经录用，待遇优厚；5、可接收应届毕业生。","数据服务,软件开发",15-50人,大数据,青岛
数据库开发工程师,https://www.lagou.com/jobs/6633124.html,李沧区,7k-13k,上海超数信息科技有限公司,3-5年,大专,五险一金 餐补 节日福利等等,工作职责： 1、协助数据分析师完成数据处理、数据整合、ETL设计和开发工作; 2、在项目经理的带领下，参与数据分析与可视化项目实施过程； 3、专注于数据处理工作，包括理解客户需求，需求分析，方案设计，开发功能设计、开发测试、系统上线、客户培训等工作； 4、编写项目实施过程中的测试等文档。 职位要求： 1、具有相关数据库开发的工作经历优先  2、熟悉数据清洗、数据抽取、加工流程  3、熟练掌握ORACLE、DB2、SQLServer、MySql等数据库开发、熟悉SQL、存储过程以及数据库性能优化 4、熟悉LINUX、UNIX操作系统及其常用命令 5、掌握主流ETL工具，例如Kattle、Informatica、Shell、Python、存储过程等 6、有海尔、海信相关项目经验优先,"电商,数据服务",50-150人,大数据,青岛
java,https://www.lagou.com/jobs/6807260.html,崂山区,10k-20k,江西牛客科技有限责任公司,3-5年,本科,大平台 福利好,1、负责后端框架搭建和核心功能开发工作；2.、熟悉后端框架当前发展趋势和特性，能够根据项目情况，独立进行后端框架选型和架构设计等工作；3、根据业务需要进行系统设计、开发、系统自测等工作；4、处理系统开发的各种问题，保证开发质量及开发进度；5、负责前后端交互的架构设计和开发，负责后端系统架构、性能和数据库设计的技术性优化；6、参与讨论用户体验和细化需求。1、计算机、软件工程、数学等相关专业。3年以上后端项目开发经验，对技术有热情；2、精通Java，了解HTML/CSS/JQuery/Ajax等前端技术，熟悉J2EE架构，深入了解spring、Spring MVC、MyBatis、Hibernate原理和实现机制，具有RESTful API和SpringBoot等相关框架开发经验，具有相应的系统架构能力和设计能力；3、精通数据库系统，熟悉主流数据库SqlServer和Oracle的使用，具有相关数据库设计能力，具有非关系型数据库应用经验者优先；4、精通Java多线程开发和线程池使用，具备中间件，云计算，大数据等技术最佳实践的能力5、良好的编码习惯，熟悉软件工程管理。6、良好的问题解决能力和自我管理能力，对问题能多角度思考提出解决方案7、工作主动、负责，具有良好的沟通和表达能力。团队协助能力和执行力突出。,"移动互联网,电商",少于15人,大数据,青岛
资深售前安全顾问（青岛）,https://www.lagou.com/jobs/7125584.html,市北区,8k-16k,杭州安恒信息技术股份有限公司,3-5年,不限,五险一金 带薪年假 国内外旅游,岗位职责：1、负责大客户方案、需求深入挖掘支持；2、负责全面、深入地了解客户需求，评估客户需求的可靠性与可行性；3、依据客户需求，设计解决方案研究思路、研究内容，选择合适的研究方法，撰写客户解决方案；4、担任售前大项目经理，对项目进行统筹、人员分工与协调、质量及风险把控、客户沟通工作；5、负责重要、城市级大项目的顶层设计规划，并进行项目方案的宣讲等工作；6、负责高级售前文档的编写，如行业标准规范、体系文件等；7、负责行业内针对信息安全需求深入调研、挖掘、梳理等工作；8、负责大型交流会议的宣讲等工作。任职要求（需具备2条及以上任职要求条件）：1、信息安全相关工作经验5年以上；2、擅长编写可研报告、技术方案、项目建议书、科技成果报告、技术专利、科研课题申报书等各类技术文档；3、具备较强的综合分析、组织协调、沟通交流的能力，擅长组织协调跨部门的协同工作，对突发事件有紧急应对能力；4、具有项目运作、交流策划、技术方案规划等能力；5、熟悉网络安全技术，尤其是WEB安全，熟练掌握WEB主流攻击、防护技术，有大数据、态势感知项目经验的工作者优先；6、具有公安、网信、数据资源管理局、运营商、金融等行业信息安全项目售前工作经验；7、有智慧城市、XX云项目规划设计经验者优先；8、 有PMP、CISP、CISSP资质者优先。,"信息安全,数据服务",500-2000人,大数据,青岛
渠道商务拓展/案场项目经理J10527,https://www.lagou.com/jobs/7151092.html,市北区,7k-12k,北京高因科技有限公司,不限,本科,双线晋升 优秀团队 高额佣金,居理新房(Julive)——一站式购房平台居理新房（北京高因科技有限公司），创立于2014年，注册资本4.5亿元人民币，致力于打造一站式购房平台，拥有专业的高学历咨询师团队，提供从大数据找房、全城看房到低价买房的全程定制化服务，赢得了良好的用户口碑。历经6年，已经成为国内新房电商领跑者。业务范围目前已涵盖京津冀、成渝、长三角等七大城市群，包括北上广深、苏杭、成都、重庆、武汉、西安、沈阳等31个城市，员工人数近3000人，与全国累计超过200个开发商合作，2019年度GMV超300亿。凭借取得的优异成绩和规模，居理新房不断赢得国内外资本市场的青睐，先后获得源码资本、祥峰资本、斯道资本等多家知名投资方的注资，58集团也给予战略投资。2019年8月，居理新房宣布签约迪丽热巴为全新品牌代言人，并完成数千万美元C轮融资。 我们提供的岗位是——驻场项目经理和商务拓展！月入过万就满足了？不不不，这只是开始！ 【我们能给您提供的】1.薪酬体系：基本工资6500+高额提成（基本工资包括无责任底薪5000+绩效1500，试用期按照基本工资80%发放）其中从18年4月开始实施的绩效与业绩无关，只要你有过硬的执行力，就可以全额拿到。2.多类补贴：每人每月可获得全勤奖+电脑补贴+话费报销+打车报销等。3.福利保障：试用期开始交五险一金+内部员工购房福利+年度体检+年度带薪出游+带薪年假+节假日福利+生日福利+ 每月团建经费。4.全职业生命周期的培训培养体系：从新人到管理者的每个阶段，均有完善的培训课程，且每个新人均配备资深导师进行入职引导及在职指导。①专业培训：入职初期，统一安排约两周的集中带薪培训，从地产行业的专业知识到营销咨询的业务技巧全方位覆盖。②入组培训机制：对于新员工安排入组孵化，即由主管全面培育和孵化，帮助新人达到转正标准实现顺利转正。③线上自主学习平台——猫头鹰学院，线上培训课程，让学习无处不在。5.两条个性化晋升通道：一条是专业方向，一条是管理方向①专业方向：职级从C1-C7，不断提升，对工作精益求精②管理方向：项目经理/商务拓展→项目/拓展主管→渠道主管→城市经理→大区经理从新人到管理者平均晋升周期为9-12个月，每月均会组织一次管理者公开竞聘。公司有刚转正就做到主管的超强实力新人，有95年的城市经理，你希望自己成为哪一类？6.丰富多彩的员工活动：公司专门设立员工满意部，为员工提供茶歇、零食、甜点等福利，同时还有员工自发组织的读书、撸猫、篮球、健身等各种兴趣小组，让你上班不枯燥，下班不单调！7.工作环境：办公室均入驻高档写字楼，办公环境宽敞明亮，舒适整洁；公司互联网扁平化管理，氛围轻松融洽。 【项目经理岗位职责】1.在公司合作的开发商楼盘驻场，充分了解自己楼盘项目的信息，对自己楼盘的成交量负责，与咨询师对接，一同服务客户2.对接开发商，完成与开发商的多层级关系维护工作，处理开发商和客户之间协调沟通工作3.在案场进行信息的全面搜集，眼观六路耳听八方，清楚案场情况的方方面面4.重点负责合作楼盘项目的回款工作，保证回款的时间点和进度顺利 【商务拓展岗位职责】1.负责居理新房领域的楼盘拓展，和开发商的项目负责人达成商务合作2.负责合作项目的对接工作，了解项目的最新动态，及时传递给咨询师，保证咨询师能更好地了解项目3.负责合作项目的后期回款，保证回款速度4.负责开发商的维护工作，保证后续能有更多合作 【我们需要这样的你】1.来自一本及以上院校，统招本科及以上学历【我们的小伙伴45%以上来自海外和国内优秀高校，我们非常期待这样你加入我们，一同成长】；2.认为自己有不错的亲和力、沟通能力、逻辑思维能力以及协调能力；3.有良好的抗打击能力，愿意和一群加班狂一起工作；4.为人处世灵活，临场处理能力强，有正直的价值观；5.渴望和一群优秀的同事一起工作，让自己也变得同样优秀（真正公平、公开和谐的工作氛围）；6.一颗不安分的心、一颗能披荆斩棘的心、一颗热爱沟通的心。 良禽择木而栖，我在居理新房等你！,移动互联网,2000人以上,大数据,青岛
